"#",Jurisdiction,Kind,Display Key,Lens ID,Publication Date,Publication Year,Application Number,Application Date,Priority Numbers,Earliest Priority Date,Title,Abstract,Applicants,Inventors,Owners,URL,Document Type,Has Full Text,Cites Patent Count,Cited by Patent Count,Simple Family Size,Extended Family Size,Sequence Count,CPC Classifications,IPCR Classifications,US Classifications,NPL Citation Count,NPL Resolved Citation Count,NPL Resolved Lens ID(s),NPL Resolved External ID(s),NPL Citations,Legal Status
1,JP,A,JP 2000302014 A,088-430-531-112-785,2000-10-31,2000,JP 2000091546 A,2000-03-29,US 28590999 A,1999-04-02,"METHOD AND DEVICE FOR SENSING, ANNOUNCING AND POSITIONING VEHICLE THEFT","PROBLEM TO BE SOLVED: To eliminate a delay time between the timing at which a vehicle encounters a theft and the timing of sending the information to an appropriate agency. SOLUTION: In cooperation with a global positioning system(GPS), a security system 12 for vehicle including a position measuring device 20 gives the positional information about the vehicle position. The system 12 is equipped with a passive type operator-specifying device 32 having a first security code and a theft control unit 22 including a memory 29 to store a second security code. The device 32 and control unit 22 are in cooperation ensure that the vehicle operator is acknowledged as qualified and allows him to operate the vehicle. An event sensor 38 makes communication with the theft control unit 22 and generates an event signal associated with vehicle such as movement. In case an event signal is received by the unit 22 and the first and second security codes are not identical, the unit 22 notifies a monitoring station with the vehicle position determined by the position sensor 20. The monitoring station will be a police station or security firm of the applicable district, the home of the vehicle owner, etc.",FORD MOTOR CO,GIOIA THOMAS A,,https://lens.org/088-430-531-112-785,Patent Application,no,0,1,3,3,0,B60R25/102;;B60R25/102;;B60R25/33;;B60R25/33;;B60W2556/50;;B60W2556/50,B60R25/04;;B60R25/10;;G08B25/10,,0,0,,,,PENDING
2,US,A,US 6067007 A,046-849-664-684-794,2000-05-23,2000,US 28590999 A,1999-04-02,US 28590999 A,1999-04-02,"Method and apparatus for detection, notification and location of vehicle theft","A security system for an automotive vehicle including a positioning device which, in cooperation with a Global Positioning System (""GPS"") satellite network provides location information regarding the vehicle's position. The security system further includes a passive operator identification device having a first security code and a theft control unit including memory storing a second security code. The passive operator identification device and the theft control unit work together to ensure the vehicle operator is authorized to operate the vehicle. An event detector communicates with the theft control unit to provide an event signal associated with the vehicle such as vehicle movement. If an event signal is received by the theft control unit, and the first and second security codes are not equal, the theft control unit communicates the vehicle position as determined by the position detector to a monitoring station. The monitoring station could be the local police department, a security service firm, or the vehicle owner's residence, for instance.",FORD MOTOR CO,GIOIA THOMAS A,VISTEON GLOBAL TECHNOLOGIES INC (2000-06-15);;FORD GLOBAL TECHNOLOGIES INC. A MICHIGAN CORPORATION (1999-03-19),https://lens.org/046-849-664-684-794,Granted Patent,yes,16,128,3,3,0,B60R25/102;;B60R25/102;;B60R25/33;;B60R25/33;;B60W2556/50;;B60W2556/50,B60R25/04;;B60R25/10;;G08B25/10,340/426;;340/825.3;;307/10.3;;180/287,0,0,,,,EXPIRED
3,EP,A2,EP 1040971 A2,195-739-634-633-780,2000-10-04,2000,EP 00302308 A,2000-03-22,US 28590999 A,1999-04-02,Method and apparatus for detection notification and location of vehicle theft,"A security system for an automotive vehicle (10) including a positioning device (20) which, in co-operation with a Global Positioning System (""GPS"") satellite network (18) provides location information regarding the vehicle's position. The security system further includes a passive operator identification device (24) having a first security code and a theft control unit (22) including memory (29) storing a second security code. The passive operator identification device (24) and the theft control unit (22) work together to ensure the vehicle operator is authorised to operate the vehicle (10). An event detector communicates with the theft control unit (22) to provide an event signal associated with the vehicle such as vehicle movement. If an event signal is received by the theft control unit (22), and the first and second security codes are not equal, the theft control unit (22) communicates the vehicle position as determined by the position detector (20) to a monitoring station (14). The monitoring station (14) could be the local police department, a security service firm, or the vehicle owner's residence, for instance.",FORD MOTOR CO,GIOIA THOMAS A,,https://lens.org/195-739-634-633-780,Patent Application,yes,0,2,3,3,0,B60R25/102;;B60R25/102;;B60R25/33;;B60R25/33;;B60W2556/50;;B60W2556/50,B60R25/04;;B60R25/10;;G08B25/10,,0,0,,,,DISCONTINUED
4,US,A,US 3383243 A,141-235-277-173-027,1968-05-14,1968,US 65453467 A,1967-07-19,US 65453467 A,1967-07-19,Method of preparing a partially collapsed latex foam backed carpet,,GEN LATEX & CHEMICAL CORP OF G,DI GIOIA FRANK A,,https://lens.org/141-235-277-173-027,Granted Patent,no,4,3,1,1,0,C08J9/30;;C08J2321/00;;D06N3/10;;D06N2209/106;;D06N7/0073;;D06N2205/04;;D06N2205/045;;D06N2205/20;;D06N2207/08;;D06N3/10;;C08J2321/00;;C08J9/30;;D06N2209/106;;D06N2205/20;;D06N2205/04;;D06N7/0073;;D06N2207/08;;D06N2205/045,A47G27/00;;C08J9/30;;D06N3/10;;D06N7/00,B5S S17Y          --          -;;B5S S191          --          -;;B5S S22Y          --          -;;B5S S221          --          -;;B5S S32Y          --          -;;B5S S322          --          -;;B5S S326          --          -;;B5S S33Y          --          -;;B5S S333          --          -;;B5S S371          --          -;;B5S S40Y          --          -;;B5S S414          --          -;;B5S S415          --          -;;B5S S419          --          -;;B5S S42Y          --          -;;B5S S420          --          -;;B5S S421          --          -;;B5S S543          --          -;;B5S S55Y          --          -;;B5S S555          --          -;;B5S S556          --          -;;B5S S558          --          -;;B5S S56X          --          -;;B5S S562          --          -;;B5S S565          --          -;;B5S S598          --          -;;B5S S599          --          -;;B5S S62Y          --          -;;B5S S63X          --          -;;B5S S654          --          -;;B5S S658          --          -;;B5S S682          --          -;;B5S S69X          --          -;;B5S S691          --          -;;B5S S728          --          -;;B5S S733          --          -;;B5S S736          --          -;;B5S S755          --          -;;B5S S758          --          -;;B5S S763          --          -;;B5S S787          --          -;;B5S S788          --          -;;B5S S789          --          -;;B5S S790          --          -,0,0,,,,EXPIRED
5,BE,A,BE 897221 A,196-565-118-722-92X,1984-01-05,1984,BE 211122 A,1983-07-05,IT 2224682 A,1982-07-06,PRODUITS A EFFET PROLONGE CONTENANT DU SULOCTIDIL,"Produits à libération prolongée convenant pour l'administration par voie buccale et contenant du suloctidil. Comprimés caractérisés en ce que la partie à libération rapide contient environ 12 à environ 25 % de suloctidil par rapport au poids total du comprimé et environ 10 à environ 30 % d'excipients pharmaceutiques inertes par rapport à ce poids total,tandis que la partie à libération lente contient 27 à environ 55 % de suloctidil par rapport au poids total du comprimé et environ 8 à environ 16 % d'excipients pharmaceutiques inertes par rapport à ce poids total.",LEPETIT SPA,GIOIA A;;GALBIATIE F,,https://lens.org/196-565-118-722-92X,Granted Patent,no,0,0,14,14,0,A61K9/209;;A61K31/135;;A61P9/00,A61K9/22;;A61K9/24;;A61K31/135;;A61P9/00,,0,0,,,,EXPIRED
6,CA,A,CA 741189 A,036-293-230-359-405,1966-08-23,1966,CA 741189D A,,CA 741189T A,,PACKAGING CONTAINER FOR BEVERAGES,,MORRIS BELKIN,RICHARDSON JAMES A;;GIOIA NICOLA J,,https://lens.org/036-293-230-359-405,Granted Patent,no,0,3,1,1,0,,,,0,0,,,,EXPIRED
7,CA,A,CA 740309 A,169-135-767-510-805,1966-08-09,1966,CA 740309D A,,CA 740309T A,,PACKAGING CONTAINER FOR BEVERAGES,,MORRIS BELKIN,RICHARDSON JAMES A;;GIOIA NICOLA J,,https://lens.org/169-135-767-510-805,Granted Patent,no,0,3,1,1,0,,,,0,0,,,,EXPIRED
8,CA,A,CA 884745 A,128-633-882-114-132,1971-11-02,1971,CA 884745D A,,CA 884745T A,,END LOADING BEVERAGE CARTON,,GREENTREE LTD,RICHARDSON JAMES A;;GIOIA NICOLA J,,https://lens.org/128-633-882-114-132,Granted Patent,no,0,0,1,1,0,,,,0,0,,,,EXPIRED
9,US,A,US 6063672 A,021-626-667-201-65X,2000-05-16,2000,US 24519399 A,1999-02-05,US 24519399 A,1999-02-05,NMOS electrostatic discharge protection device and method for CMOS integrated circuit,MOS functional devices and electrostatic discharge protection devices are formed on a substrate having a relatively low-resistance area beneath the functional devices to inhibit latch-up of the functional devices and a relatively high resistance area beneath each electrostatic protection device to reduce the snapback holding voltage of each electrostatic discharge protection device.,LSI LOGIC CORP,MILLER GAYLE;;GIOIA SAMUEL C;;RANDAZZO TODD A,BELL SEMICONDUCTOR LLC (2017-12-08);;AVAGO TECHNOLOGIES GENERAL IP (SINGAPORE) PTE. LTD (2014-08-14);;LSI CORPORATION (2007-04-06),https://lens.org/021-626-667-201-65X,Granted Patent,yes,27,31,1,1,0,H01L21/823425;;H01L27/0266;;H01L27/0921;;H01L27/0266;;H01L27/0921;;H01L21/823425,H01L21/8234;;H01L27/02;;H01L27/092,438/275;;438/281;;438/282,0,0,,,,EXPIRED
10,AU,A8,AU 2003/220141 A8,059-592-413-958-43X,2003-09-22,2003,AU 2003/220141 A,2003-03-07,US 9387702 A;;US 0307298 W,2002-03-08,Modular printed antenna,,GEN INSTRUMENT CORP,GIOIA DANIEL J;;USKALI ROBERT G;;KINDINGER PETER A,,https://lens.org/059-592-413-958-43X,Patent Application,no,0,0,11,11,0,H01Q1/088;;H01Q23/00;;H01Q1/24;;H01Q1/088,H01Q1/24;;H01Q1/08,,0,0,,,,DISCONTINUED
11,EP,A4,EP 1488475 A4,023-481-614-351-396,2005-09-21,2005,EP 03716435 A,2003-03-07,US 0307298 W;;US 9387702 A,2002-03-08,MODULAR PRINTED ANTENNA,,GEN INSTRUMENT CORP,GIOIA DANIEL J;;USKALI ROBERT G;;KINDINGER PETER A,,https://lens.org/023-481-614-351-396,Search Report,no,2,0,11,11,0,H01Q1/088;;H01Q23/00;;H01Q1/24;;H01Q1/088,H01Q1/24;;H01Q1/08,,0,0,,,,DISCONTINUED
12,EP,A2,EP 1488475 A2,019-363-630-597-474,2004-12-22,2004,EP 03716435 A,2003-03-07,US 0307298 W;;US 9387702 A,2002-03-08,MODULAR PRINTED ANTENNA,,GEN INSTRUMENT CORP,GIOIA DANIEL J;;USKALI ROBERT G;;KINDINGER PETER A,,https://lens.org/019-363-630-597-474,Patent Application,yes,0,0,11,11,0,H01Q1/088;;H01Q23/00;;H01Q1/24;;H01Q1/088,H01Q1/24;;H01Q1/08,,0,0,,,,DISCONTINUED
13,AU,A1,AU 2003/220141 A1,196-178-189-855-375,2003-09-22,2003,AU 2003/220141 A,2003-03-07,US 9387702 A;;US 0307298 W,2002-03-08,MODULAR PRINTED ANTENNA,,GEN INSTRUMENT CORP,GIOIA DANIEL J;;USKALI ROBERT G;;KINDINGER PETER A,,https://lens.org/196-178-189-855-375,Patent Application,no,0,0,11,11,0,H01Q1/088;;H01Q23/00;;H01Q1/24;;H01Q1/088,H01Q1/24;;H01Q1/08,,0,0,,,,DISCONTINUED
14,US,A1,US 2009/0240616 A1,047-907-444-749-970,2009-09-24,2009,US 43575209 A,2009-05-05,US 43575209 A;;US 37169606 A;;US 6218805 A,2005-02-17,"Establishing an Inventory Management and Trading Application for Alternative, Liquid Repurchase Agreement Markets","The invention relates to a system and method for repo trading. The invention facilitates the inventory collection, organization, and search of the long and short positions of financial instruments such as corporate bonds and equities through the provision of a database. The invention also provides users with the ability to match borrowers and lenders with opposing positions for financial instruments. In a second embodiment the invention provides a system for creating pseudo-securities, from a diverse population of corporate bonds or equities that meet parameters specified by a user.",ICAP SERVICES NORTH AMERICA LL,HAMMER KYLE E;;GIOIA PETER P;;COPIN GEORGE A,INTERCAPITAL SERVICES NORTH AMERICA LLC (2016-12-22),https://lens.org/047-907-444-749-970,Patent Application,yes,4,8,2,2,0,G06Q40/00;;G06Q40/00;;G06Q40/04;;G06Q40/04,G06Q40/00,705/37,0,0,,,,DISCONTINUED
15,WO,A2,WO 2003/077357 A2,119-017-316-320-219,2003-09-18,2003,US 0307298 W,2003-03-07,US 9387702 A,2002-03-08,MODULAR PRINTED ANTENNA,An interchangeable and modular antenna (10) in a wireless communications device (30) that is configured for RF wireless communications based on one of a plurality of different predetermined RF communication protocols. The wireless communications device (30) allows multiple antenna modules (10) to be provided for being selected for use in the communications device (30). The communications device (30) includes a radio module (34) and a main circuit board (32) having an electrical connector (40). One or more antenna modules (10) are releasably mounted on the main circuit board (32) of the radio module (34) using a mating RF connector (24) that engages the radio module&apos;s electrical connector (40) to enable a cable-free and interchangeable connection of the radio module (34) with the antenna module (10).,GEN INSTRUMENT CORP,GIOIA DANIEL J;;USKALI ROBERT G;;KINDINGER PETER A,,https://lens.org/119-017-316-320-219,Patent Application,yes,0,0,11,11,0,H01Q1/088;;H01Q23/00;;H01Q1/24;;H01Q1/088,H01Q1/08;;H01Q1/24,,0,0,,,,PENDING
16,US,A1,US 2003/0169205 A1,023-143-830-007-344,2003-09-11,2003,US 9387702 A,2002-03-08,US 9387702 A,2002-03-08,Modular printed antenna,"
    An interchangeable and modular antenna 10  in a wireless communications device 30  that is configured for RF wireless communications based on one of a plurality of different predetermined RF communication protocols. The wireless communications device 30  allows multiple antenna modules 10  to be provided for being selected for use in the communications device 3 . The communications device 30  includes a radio module 34  and a main circuit board 32  having an electrical connector 40 . One or more antenna modules 10  are releasably mounted on the main circuit board 32  of the radio module 34  using a mating RF connector 24  that engages the radio module's electrical connector 40  to enable a cable-free and interchangeable connection of the radio module 34  with the antenna module 10. 
",GIOIA DANIEL J.;;USKALI ROBERT G.;;KINDINGER PETER A.,GIOIA DANIEL J;;USKALI ROBERT G;;KINDINGER PETER A,GENERAL INSTRUMENT CORPORATION D/B/A/ THE BROADBAND COMMUNICATIONS SECTOR OF MOTOROLA INC (2002-01-11),https://lens.org/023-143-830-007-344,Patent Application,yes,1,25,11,11,0,H01Q1/088;;H01Q23/00;;H01Q1/24;;H01Q1/088,H01Q1/08;;H01Q1/24,343/702;;343/906,0,0,,,,DISCONTINUED
17,WO,A3,WO 2003/077357 A3,161-697-044-810-154,2003-12-04,2003,US 0307298 W,2003-03-07,US 9387702 A,2002-03-08,MODULAR PRINTED ANTENNA,An interchangeable and modular antenna (10) in a wireless communications device (30) that is configured for RF wireless communications based on one of a plurality of different predetermined RF communication protocols. The wireless communications device (30) allows multiple antenna modules (10) to be provided for being selected for use in the communications device (30). The communications device (30) includes a radio module (34) and a main circuit board (32) having an electrical connector (40). One or more antenna modules (10) are releasably mounted on the main circuit board (32) of the radio module (34) using a mating RF connector (24) that engages the radio module&apos;s electrical connector (40) to enable a cable-free and interchangeable connection of the radio module (34) with the antenna module (10).,GEN INSTRUMENT CORP,GIOIA DANIEL J;;USKALI ROBERT G;;KINDINGER PETER A,,https://lens.org/161-697-044-810-154,Search Report,yes,1,0,11,11,0,H01Q1/088;;H01Q23/00;;H01Q1/24;;H01Q1/088,H01Q1/08;;H01Q1/24,,0,0,,,,PENDING
18,CA,A1,CA 2477708 A1,168-480-332-617-938,2003-09-18,2003,CA 2477708 A,2003-03-07,US 9387702 A;;US 0307298 W,2002-03-08,MODULAR PRINTED ANTENNA,An interchangeable and modular antenna (10) in a wireless communications device (30) that is configured for RF wireless communications based on one of a plurality of different predetermined RF communication protocols. The wireless communications device (30) allows multiple antenna modules (10) to be provided for being selected for use in the communications device (30). The communications device (30) includes a radio module (34) and a main circuit board (32) having an electrical connector (40). One or more antenna modules (10) are releasably mounted on the main circuit board (32) of the radio module (34) using a mating RF connector (24) that engages the radio module's electrical connector (40) to enable a cable-free and interchangeable connection of the radio module (34) with the antenna module (10).,GEN INSTRUMENT CORP,USKALI ROBERT G;;GIOIA DANIEL J;;KINDINGER PETER A,,https://lens.org/168-480-332-617-938,Patent Application,no,0,0,11,11,0,H01Q1/088;;H01Q23/00;;H01Q1/24;;H01Q1/088,H01Q1/24;;H01Q1/08,,0,0,,,,DISCONTINUED
19,US,A1,US 2011/0270735 A1,176-721-386-813-920,2011-11-03,2011,US 201113180008 A,2011-07-11,US 201113180008 A;;US 37169606 A;;US 6218805 A,2005-02-17,"Establishing an Inventory Management and Trading Application for Alternative, Illiquid Repurchase Agreement Markets","The invention relates to a system and method for repo trading. The invention facilitates the inventory collection, organization, and search of the long and short positions of financial instruments such as corporate bonds and equities through the provision of a database. The invention also provides users with the ability to match borrowers and lenders with opposing positions for financial instruments. In a second embodiment the invention provides a system for creating pseudo-securities, from a diverse population of corporate bonds or equities that meet parameters specified by a user.",ICAP SERVICE NORTH AMERICA LLP,HAMMER KYLE E;;GIOIA PETER P;;COPIN GEORGE A,INTERCAPITAL SERVICES NORTH AMERICA LLC (2016-12-22),https://lens.org/176-721-386-813-920,Patent Application,yes,0,15,2,2,0,G06Q40/00;;G06Q40/00;;G06Q40/04;;G06Q40/04,G06Q40/00,705/37,0,0,,,,DISCONTINUED
20,DE,A1,DE 10321750 A1,133-163-802-284-885,2004-03-04,2004,DE 10321750 A,2003-04-24,US 37576102 P;;US 41155303 A,2002-04-25,Fahrzeugpersonalisierung durch biometrische Identifizierung,"Es wird ein System und Verfahren zur Erfassung der Identität eines Fahrzeuginsassen offenbart. Das System enthält ein im Fahrzeug montiertes Sensormodul. Das Sensormodul enthält einen Innensassensensor zur Gewinnung eines Abbilds von einem Körperteil des Fahrzeuginsassen zur Identifizierung des Fahrzeuginsassen. Das Verfahren umfasst das Aktivieren eines Fahrzeuginsassenidentifikationssystems, das Gewinnen eines Abbilds von einem Körperteil des Fahrzeuginsassen, das Vergleichen des von dem Körperteil gewonnenen Abbilds mit mindestens einem gespeicherten Abbild von einem Körperteil, das Feststellen, ob das von dem Körperteil gewonnene Abbild mit dem mindestens einem gespeicherten Abbild übereinstimmt, und das Beurteilen, ob der Fahrzeuginsasse identifiziert worden ist.",VISTEON GLOBAL TECH INC,SADLER JOHN G;;MADAU ADRIAN;;GIOIA THOMAS A;;HEUSSNER ERIC M,,https://lens.org/133-163-802-284-885,Patent Application,no,0,21,4,6,0,B60R25/04;;B60R25/2081;;B60R25/252;;G07C9/00563;;G06V40/10;;B60R25/252;;B60R25/04;;G07C9/00563;;B60R25/2081;;G06V40/10,B60R25/04;;G06K9/00;;G07C9/00,,0,0,,,,DISCONTINUED
21,HK,A1,HK 1169408 A1,002-006-981-204-617,2013-01-25,2013,HK 12110192 A,2012-10-16,EP 2010055463 W;;EP 09159030 A,2009-04-29,CDK INHIBITOR SALTS CDK,,NERVIANO MEDICAL SCIENCES SRL,ZAMPIERI MASSIMO M;;AIROLDI ANNALISA A;;FORNARETTO MARIA GIOIA MG;;BRASCA MARIA GABRIELLA MG,,https://lens.org/002-006-981-204-617,Patent Application,no,0,0,13,13,0,C07D487/04;;A61P11/00;;A61P13/08;;A61P13/12;;A61P17/06;;A61P19/02;;A61P31/12;;A61P35/00;;A61P35/02;;A61P37/00;;A61P37/06;;A61P43/00;;A61P9/00;;A61P9/10;;C07D487/04,C07D/;;A61K/;;A61P/,,0,0,,,,PENDING
22,ES,B3,ES 2022458 B3,146-910-198-323-494,1991-12-01,1991,ES 87830321 T,1987-09-07,IT 4843686 A,1986-09-10,PROCESO PARA CONECTAR ACERO AL MANGANESO AUSTENITICO A CARRILES DE AGUJAS DE CARBONO O BAJA ALEACION DE RAILES DE ACERO.,,BREDA FUCINE SPA,BARTOLI MAURO BREDA FUCINE MERIDIONALI S P A;;DI GIOIA MICHELE BREDA FUCINE MERIDIONALI S P A,,https://lens.org/146-910-198-323-494,Granted Patent,no,0,0,7,7,0,B23K35/004;;C21D9/04;;E01B7/12,B23K35/00;;C21D9/04;;E01B7/12,,0,0,,,,EXPIRED
23,US,A,US 5248920 A,170-569-085-343-281,1993-09-28,1993,US 95959492 A,1992-10-13,US 95959492 A,1992-10-13,Cathode ray tube dynamic electron-optic eyebrow effect distortion correction,"In a color CRT with an in-line gun and a pin cushion correcting yoke, there is disclosed an eyebrow effect electronoptical distortion correction device comprising two pair of coils, each pair having a coil on each outer electron beam side of the neck in the plane of the beams. The coil pairs are spaced apart along the Z-axis between the gun and the yoke and are driven by a sawtooth current having a bow-tie envelope synchronous with the raster scan to correct the dynamic, antisymmetrical eyebrow effect apparent as a purity defect on the raster.",ZENITH ELECTRONICS CORP,GIOIA NORMAN F;;GORSKI RICHARD M;;WATSON LIONEL A;;ADLER ROBERT;;CHIODI WAYNE R,ZENITH ELECTRONICS CORP (1992-10-08),https://lens.org/170-569-085-343-281,Granted Patent,yes,4,19,1,1,0,H04N3/233;;H04N3/233;;H01J29/705;;H01J29/705;;H01J29/707;;H01J29/707;;H01J2229/5637;;H01J2229/5637,H01J29/70;;H04N3/233,315/368.26;;315/368.28,0,0,,,,EXPIRED
24,DE,A8,DE 10321750 A8,128-914-468-485-828,2004-07-08,2004,DE 10321750 A,2003-04-24,US 37576102 P;;US 41155303 A,2002-04-25,Fahrzeugpersonalisierung durch biometrische Identifizierung,,VISTEON GLOBAL TECH INC,SADLER JOHN G;;MADAU ADRIAN;;GIOIA THOMAS A;;HEUSSNER ERIC M;;CHI DAVID D;;TEMPLETON RYAN L,,https://lens.org/128-914-468-485-828,Amended Application,no,0,0,4,6,0,B60R25/04;;B60R25/2081;;B60R25/252;;G07C9/00563;;G06V40/10;;B60R25/252;;B60R25/04;;G07C9/00563;;B60R25/2081;;G06V40/10,B60R25/04;;G06K9/00;;G07C9/00,,0,0,,,,DISCONTINUED
25,US,B2,US 6810309 B2,025-582-154-448-976,2004-10-26,2004,US 41155303 A,2003-04-10,US 41155303 A;;US 37576102 P,2002-04-25,Vehicle personalization via biometric identification,"
    A system and method for detecting an identity of an occupant of a vehicle is disclosed. The system includes a sensor module mounted in a vehicle. The sensor module having an occupant sensor for acquiring an image of a member of the vehicle occupant to identify the vehicle occupant. The method includes activating a vehicle occupant identification system, acquiring an image of a member of the vehicle occupant, comparing the acquired image of the member with at least one stored image of a member, determining whether the acquired image of the member matches the at least one stored image, and assessing whether the vehicle occupant has been identified. 
",VISTEON GLOBAL TECH INC,SADLER JOHN G;;MADAU ADRIAN;;GIOIA THOMAS A;;HEUSSNER ERIC M;;CHI DAVID D;;TEMPLETON RYAN L,VISTEON GLOBAL TECHNOLOGIES INC (2003-04-04),https://lens.org/025-582-154-448-976,Granted Patent,yes,9,166,4,6,0,B60R25/04;;B60R25/2081;;B60R25/252;;G07C9/00563;;G06V40/10;;B60R25/252;;B60R25/04;;G07C9/00563;;B60R25/2081;;G06V40/10,B60R25/04;;G06K9/00;;G07C9/00,701/1,0,0,,,,EXPIRED
26,US,A1,US 2003/0204290 A1,188-368-398-097-299,2003-10-30,2003,US 41155303 A,2003-04-10,US 41155303 A;;US 37576102 P,2002-04-25,Vehicle personalization via biometric identification,"
   A system and method for detecting an identity of an occupant of a vehicle is disclosed. The system includes a sensor module mounted in a vehicle. The sensor module having an occupant sensor for acquiring an image of a member of the vehicle occupant to identify the vehicle occupant. The method includes activating a vehicle occupant identification system, acquiring an image of a member of the vehicle occupant, comparing the acquired image of the member with at least one stored image of a member, determining whether the acquired image of the member matches the at least one stored image, and assessing whether the vehicle occupant has been identified. 
",VISTEON GLOBAL TECH INC,SADLER JOHN G;;MADAU ADRIAN;;GIOIA THOMAS A;;HEUSSNER ERIC M;;CHI DAVID D;;TEMPLETON RYAN L,VISTEON GLOBAL TECHNOLOGIES INC (2003-04-04),https://lens.org/188-368-398-097-299,Patent Application,yes,3,255,4,6,0,B60R25/04;;B60R25/2081;;B60R25/252;;G07C9/00563;;G06V40/10;;B60R25/252;;B60R25/04;;G07C9/00563;;B60R25/2081;;G06V40/10,B60R25/04;;G06K9/00;;G07C9/00,701/1;;340/426.1,0,0,,,,EXPIRED
