"#",Jurisdiction,Kind,Display Key,Lens ID,Publication Date,Publication Year,Application Number,Application Date,Priority Numbers,Earliest Priority Date,Title,Abstract,Applicants,Inventors,Owners,URL,Document Type,Has Full Text,Cites Patent Count,Cited by Patent Count,Simple Family Size,Extended Family Size,Sequence Count,CPC Classifications,IPCR Classifications,US Classifications,NPL Citation Count,NPL Resolved Citation Count,NPL Resolved Lens ID(s),NPL Resolved External ID(s),NPL Citations,Legal Status
1,US,A,US 3251731 A,065-551-671-330-828,1966-05-17,1966,US 25778663 A,1963-02-11,US 25778663 A,1963-02-11,Bleaching of wood pulp with a sequestering agent and hydrogen peroxide,,GARD ANDREW J,GARD ANDREW J,,https://lens.org/065-551-671-330-828,Granted Patent,no,3,39,1,1,0,D21C9/1042;;D21C9/1042,D21C9/10,,0,0,,,,EXPIRED
2,US,A,US 3232869 A,005-155-340-561-903,1966-02-01,1966,US 27051563 A,1963-04-04,US 27051563 A,1963-04-04,Method of purifying aqueous liquid,,GARD ANDREW J,GARD ANDREW J,,https://lens.org/005-155-340-561-903,Granted Patent,no,5,16,1,1,0,C02F1/766;;C02F1/766,C02F1/76,,0,0,,,,EXPIRED
3,CA,A,CA 686115 A,145-586-808-137-042,1964-05-12,1964,CA 686115D A,,CA 686115T A,,BLEACHING OF WOOD PULP,,GARD ANDREW J,GARD ANDREW J,,https://lens.org/145-586-808-137-042,Granted Patent,no,0,5,1,1,0,,,,0,0,,,,EXPIRED
4,CA,A,CA 532084 A,161-146-558-704-315,1956-10-23,1956,CA 532084D A,,CA 532084T A,,PROCESSING HIDES AND SKINS,,DOW CHEMICAL CO,BERSWORTH FREDERICK C;;GARD ANDREW J,,https://lens.org/161-146-558-704-315,Granted Patent,no,0,0,1,1,0,,,,0,0,,,,EXPIRED
5,WO,A1,WO 2006/084312 A1,138-247-852-301-698,2006-08-17,2006,AU 2006/000155 W,2006-02-09,AU 2005/900598 A,2005-02-09,METHOD OF PROMOTING HAIR GROWTH,This invention relates to method of promoting hair growth comprising topically applying to the area of skin in which loss is to be treated or prevented a composition comprising an androgen selected from the group consisting of testosterone and pharmaceutically acceptable esters thereof and a carrier comprising a volatile solvent. The invention also relates to a topical composition for promoting hair growth.,ACRUX DDS PTY LTD;;HUMBERSTONE ANDREW JONATHAN;;GARD NER KAREN LEE,HUMBERSTONE ANDREW JONATHAN;;GARD NER KAREN LEE,,https://lens.org/138-247-852-301-698,Patent Application,yes,4,12,1,1,0,A61K31/568;;A61P17/14,A61K31/568;;A61P17/14,,4,3,005-024-148-791-151;;029-177-634-603-687;;027-757-882-783-857,11217871;;10.2165/00003495-200161010-00006;;10498493;;10.1056/nejm199909233411307;;10.1001/jama.1968.03140190033009;;5694435;;10.1001/jama.204.6.451,"MEIDAN V.M. ET AL.: ""Treatments for Androgenic Alopecia and Alopecia Areata. Current Options and Future Prospects"", THERAPY IN PRACTICE. DRUGS, vol. 61, no. 1, 2001, pages 53 - 69;;WOOD A.J. ET AL.: ""Treatment of Hair Loss"", THE NEW ENGLAND J. OF MEDICINE, vol. 341, no. 13, September 1999 (1999-09-01), pages 964 - 973;;PAPA C.M. ET AL.: ""Stimulation of Hair Growt by Topical Application of Androgen"", THE JOURNAL OF THE AMERICAN MEDICAL ASSOCIATION, vol. 191, no. 7, February 1965 (1965-02-01), pages 521 - 525;;BERGER R.A. ET AL.: ""Failure of Topical Testosterone in Male-Pattern Alopecia"", THE JOURNAL OF THE AMERICAN MEDICAL ASSOCIATION, vol. 204, no. 6, May 1968 (1968-05-01), pages 131 - 132",PENDING
6,EP,A1,EP 0494922 A1,084-140-976-661-612,1992-07-22,1992,EP 90914747 A,1990-10-05,GB 8922563 A,1989-10-06,IMPROVEMENTS IN ROLLER BEARINGS.,"Un roulement à rouleaux (10) comprend des anneaux internes et externes (11, 12) entre lesquels sont disposés des rouleaux (13). Lesdits rouleaux (13) sont, de préférence, positionnés à un angle par rapport à l'axe du roulement (B), et présentent des surfaces externes concaves (15) de configuration asymétrique. Lesdites surfaces externes se mettent en contact avec les surfaces internes convexes (16, 17) des anneaux (11, 12) de manière à imposer une force de biais positive auxdits rouleaux, ce qui assure l'autoalignement du roulement lors de l'utilisation.",RHP BEARINGS LTD,WARDLE FRANK PETER;;HARRIS MARK ANDREW SPRING GARD,,https://lens.org/084-140-976-661-612,Patent Application,yes,0,0,9,10,0,F16C19/36;;F16C19/362;;F16C33/36;;F16C23/086;;F16C2240/30;;F16C19/362;;F16C33/36;;F16C19/36;;F16C23/086;;F16C2240/30,F16C19/34;;F16C19/36;;F16C33/36,,0,0,,,,DISCONTINUED
7,WO,A1,WO 2023/064889 A1,050-651-881-527-673,2023-04-20,2023,US 2022/0078100 W,2022-10-14,US 202163256032 P,2021-10-15,APPARATUS AND METHOD FOR WRIST AND CATHETER STABILIZATION DURING RADIAL ACCESS,"An apparatus for wrist and catheter stabilization during radial artery access includes a wrist support member and a catheter support member connected by an adjustable coupler. The wrist support member comprises a first platform with a curved surface configured to cradle a wrist in a supine or neutral position and an inclined portion to motivate extension or ulnar flexion of the wrist. The catheter support member comprises a second platform with a curved sidewall extending along at least one side of the second platform. The curved sidewall may be configured to direct a catheter toward a radial access point of the wrist when the catheter is extended across the platform portion of the catheter support member. The adjustable coupler is reconfigurable to control a height of the catheter support member from the wrist support member, as well as orientation and other height/distance parameters in some embodiments.",UNIV NEBRASKA,ALVAREZ CARLOS;;THORELL WILLIAM;;SURDELL DANIEL;;GARD ANDREW;;EHLERS LANDON,,https://lens.org/050-651-881-527-673,Patent Application,yes,5,0,1,1,0,A61M5/52;;A61M2025/0213,A61M5/52;;A61M25/02,,0,0,,,,PENDING
8,US,B1,US 6213537 B1,136-937-994-588-458,2001-04-10,2001,US 33666499 A,1999-06-18,US 33666499 A,1999-06-18,Mirror trim panel,"A mirror trim panel including a cover portion, a primary attachment portion, and a hinge between the cover portion and the primary attachment portion. The hinge allows the mirror trim panel to be secured to the door trim panel and to be lowered into a transit position to improve packaging density and to reduce shipping costs of the door trim panel assembly.",PRINCE TECHNOLOGY CORP,BUTZ ANDREW R;;GARD MICHAEL;;MCCARTHY DAVID J;;REICHARD BRENT A,PRINCE TECHNOLOGY CORPORATION (1999-06-15),https://lens.org/136-937-994-588-458,Granted Patent,yes,17,10,1,1,0,B60J5/0404;;B60J5/0404;;B60R13/0206;;B60R13/0206;;B60R13/0243;;B60R13/0243,B60J5/04;;B60R13/02,296/152;;296/146.7;;296/146.1;;248/479;;248/487,0,0,,,,EXPIRED
9,US,A1,US 2023/0173676 A1,102-699-796-725-066,2023-06-08,2023,US 202218056443 A,2022-11-17,US 202218056443 A;;US 202163281573 P,2021-11-19,MACHINE LEARNING LOGIC-BASED ADJUSTMENT TECHNIQUES FOR ROBOTS,"This disclosure provides systems, methods, and apparatuses, including computer programs encoded on computer storage media, that provide for training, implementing, or updated machine learning logic, such as an artificial neural network, to model a manufacturing process performed in a manufacturing robot environment. For example, the machine learning logic may be trained and implemented to learn from or make adjustments based on one or more operational characteristics associated with the manufacturing robot environment. As another example, the machine learning logic, such as a trained neural network, may be implemented in a semi-autonomous or autonomous manufacturing robot environment to model a manufacturing process and to generate a manufacturing result. As another example, the machine learning logic, such as the trained neural network, may be updated based on data that is captured and associated with a manufacturing result. Other aspects and features are also claimed and described.",PATH ROBOTICS INC,LONSBERRY ALEXANDER;;LONSBERRY ANDREW;;GARD NIMA AJAM;;VASU MADHAVUN CANDADAI;;SCHWENKER ERIC,,https://lens.org/102-699-796-725-066,Patent Application,yes,0,1,2,2,0,B25J9/1664;;B25J9/1684;;B25J9/163;;G05B2219/40532;;G05B2219/39131;;G05B2219/39132;;G05B2219/4704;;Y02P90/02;;B25J9/161;;B25J9/163;;B25J9/1664;;B25J11/005;;B25J19/021,B25J9/16;;B25J11/00;;B25J19/02,,0,0,,,,PENDING
10,WO,A1,WO 2023/089536 A1,080-258-265-009-028,2023-05-25,2023,IB 2022061107 W,2022-11-17,US 202163281573 P,2021-11-19,MACHINE LEARNING LOGIC-BASED ADJUSTMENT TECHNIQUES FOR ROBOTS,"This disclosure provides systems, methods, and apparatuses, including computer programs encoded on computer storage media, that provide for training, implementing, or updated machine learning logic, such as an artificial neural network, to model a manufacturing process performed in a manufacturing robot environment. For example, the machine learning logic may be trained and implemented to learn from or make adjustments based on one or more operational characteristics associated with the manufacturing robot environment. As another example, the machine learning logic, such as a trained neural network, may be implemented in a semi-autonomous or autonomous manufacturing robot environment to model a manufacturing process and to generate a manufacturing result. As another example, the machine learning logic, such as the trained neural network, may be updated based on data that is captured and associated with a manufacturing result. Other aspects and features are also claimed and described.",PATH ROBOTICS INC,LONSBERRY ALEXANDER;;LONSBERRY ANDREW;;GARD NIMA AJAM;;VASU MADHAVUN CANDADAI;;SCHWENKER ERIC,,https://lens.org/080-258-265-009-028,Patent Application,yes,1,0,2,2,0,B25J9/1664;;B25J9/1684;;B25J9/163;;G05B2219/40532;;G05B2219/39131;;G05B2219/39132;;G05B2219/4704;;Y02P90/02;;B25J9/161;;B25J9/163;;B25J9/1664;;B25J11/005;;B25J19/021,B25J9/16,,0,0,,,,PENDING
11,WO,A2,WO 2008/048658 A2,015-088-398-702-807,2008-04-24,2008,US 2007/0022208 W,2007-10-17,US 85217406 P,2006-10-17,"EQUILIBRIUM-POINT PROSTHETIC AND ORTHOTIC ANKLE-FOOT SYSTEMS, DEVICES, AND METHODS OF USE","The present invention relates to a system for use in rehabilitation and/or physical therapy for the treatment of injury or disease. The system can enable an amputee to proceed over any surface without overbalancing. In particular the system is self-adapting to adjust the torque moment depending upon the motion, the extent of inclination, and the surface topography.",UNIV NORTHWESTERN;;HANSEN ANDREW H;;GARD STEVEN A;;CHILDRESS DUDLEY S;;RUHE BRIAN;;WILLIAMS RYAN,HANSEN ANDREW H;;GARD STEVEN A;;CHILDRESS DUDLEY S;;RUHE BRIAN;;WILLIAMS RYAN,,https://lens.org/015-088-398-702-807,Patent Application,yes,0,29,4,4,0,A61F2/6607;;A61F2002/5003;;A61F2002/5009;;A61F2002/5036;;A61F2002/5072;;A61F2002/6818;;A61F2002/6845;;A61F2002/6854;;A61F2002/701;;A61F2002/704;;A61F2002/7625;;A61F2002/7635;;A61F2002/7645;;A61F2/70;;A61F2/6607;;A61F2002/6818;;A61F2002/6854;;A61F2002/6845;;A61F2002/5003;;A61F2002/7645;;A61F2002/7625;;A61F2002/5036;;A61F2002/5072;;A61F2002/5009;;A61F2002/704;;A61F2002/701;;A61F2002/7635;;A61F2/70,A61F2/66,,0,0,,,,PENDING
12,WO,A3,WO 2008/048658 A3,071-933-411-920-101,2008-07-03,2008,US 2007/0022208 W,2007-10-17,US 85217406 P,2006-10-17,EQUILIBRIUM-POINT PROSTHETIC AND ORTHOTIC ANKLE-FOOT SYSTEMS,"The present invention relates to a system for use in rehabilitation and/or physical therapy for the treatment of injury or disease. The system can enable an amputee to proceed over any surface without overbalancing. In particular the system is self-adapting to adjust the torque moment depending upon the motion, the extent of inclination, and the surface topography.",UNIV NORTHWESTERN;;HANSEN ANDREW H;;GARD STEVEN A;;CHILDRESS DUDLEY S;;RUHE BRIAN;;WILLIAMS RYAN,HANSEN ANDREW H;;GARD STEVEN A;;CHILDRESS DUDLEY S;;RUHE BRIAN;;WILLIAMS RYAN,,https://lens.org/071-933-411-920-101,Search Report,yes,3,0,4,4,0,A61F2/6607;;A61F2002/5003;;A61F2002/5009;;A61F2002/5036;;A61F2002/5072;;A61F2002/6818;;A61F2002/6845;;A61F2002/6854;;A61F2002/701;;A61F2002/704;;A61F2002/7625;;A61F2002/7635;;A61F2002/7645;;A61F2/70;;A61F2/6607;;A61F2002/6818;;A61F2002/6854;;A61F2002/6845;;A61F2002/5003;;A61F2002/7645;;A61F2002/7625;;A61F2002/5036;;A61F2002/5072;;A61F2002/5009;;A61F2002/704;;A61F2002/701;;A61F2002/7635;;A61F2/70,A61F2/68;;A61F2/66,,0,0,,,,PENDING
13,US,B2,US 8597369 B2,160-967-488-096-618,2013-12-03,2013,US 31181807 A,2007-10-17,US 31181807 A;;US 85217406 P;;US 2007/0022208 W,2006-10-17,Equilibrium-point prosthetic and orthotic ankle-foot systems and devices,"The present invention relates to a system for use in rehabilitation and/or physical therapy for the treatment of injury or disease. The system can enable an amputee to proceed over any surface without overbalancing. In particular the system is self-adapting to adjust the torque moment depending upon the motion, the extent of inclination, and the surface topography.",HANSEN ANDREW H;;GARD STEVEN A;;CHILDRESS DUDLEY S;;RUHE BRIAN;;WILLIAMS RYAN;;UNIV NORTHWESTERN;;DEPT OF VETERAN AFFAIRS;;CHICAGO REHABILITATION INST,HANSEN ANDREW H;;GARD STEVEN A;;CHILDRESS DUDLEY S;;RUHE BRIAN;;WILLIAMS RYAN,NORTHWESTERN UNIVERSITY (2009-01-22),https://lens.org/160-967-488-096-618,Granted Patent,yes,23,29,4,4,0,A61F2/6607;;A61F2002/5003;;A61F2002/5009;;A61F2002/5036;;A61F2002/5072;;A61F2002/6818;;A61F2002/6845;;A61F2002/6854;;A61F2002/701;;A61F2002/704;;A61F2002/7625;;A61F2002/7635;;A61F2002/7645;;A61F2/70;;A61F2/6607;;A61F2002/6818;;A61F2002/6854;;A61F2002/6845;;A61F2002/5003;;A61F2002/7645;;A61F2002/7625;;A61F2002/5036;;A61F2002/5072;;A61F2002/5009;;A61F2002/704;;A61F2002/701;;A61F2002/7635;;A61F2/70,A61F2/66,623/50;;623/53;;623/47,17,10,045-538-885-092-886;;027-812-728-797-299;;001-496-076-489-825;;021-779-431-616-944;;026-298-289-248-451;;101-810-718-699-057;;096-099-293-094-00X;;036-718-160-307-335;;058-794-744-554-842;;076-351-172-552-250,10.1080/00222895.1986.10735369;;15136283;;10.1016/0167-9457(93)90010-m;;10.1109/86.769402;;10391582;;10433420;;10.1016/s0021-9290(99)00078-0;;10.1016/s0966-6362(01)00181-3;;11809582;;10.1016/j.jbiomech.2004.01.017;;15336920;;10.1016/j.humov.2004.08.023;;15664674;;15531172;;10.1016/j.gaitpost.2003.09.006;;10.1016/j.jbiomech.2005.05.005;;15990102;;19154079;;10.1115/1.3005335,"Feldman, Once More on the Equilibrium-point Hypothesis (lambda model) for Motor Control, J. Motor Behav., 18, 1986, pp. 17-54.;;Perry, Gait Analysis: Normal and Pathological Function, 1992, Slack Inc., 1992.;;Latash et al., Joint Stiffness: Myth or Reality?; Hum. Mov. Sci, 12, 1993, pp. 653-692.;;Irby et al., Optimization and Application of a Wrap-Spring Clutch to a Dynamic Knee-Ankle-Foot Orthosis, IEEE Trans. Rehabll. Eng., 7, 2, 1999, pp. 130-134.;;Ferris et al., Runners Adjust Leg Stiffness for Their First Step on a New Running Surface; J. Biomech.; 32, 8, pp. 787-794, 1999.;;Hansen, Roll-over Characteristics of Human Walking With Applications for Artificial Limbs; Dissertation, 2002.;;Leroux et al., Postural Adaptations to Walking on Inclined Surfaces: I. Normal Strategies, Gait & Pos., 15, 1, 2002, pp. 67-74.;;Hansen et al., The Human Ankle During Walking: Implications for Design of Biomimetic Ankle Prostheses, J. Biomech; 37, 10, pp. 1467-1474.;;Hansen et al., Roll-over Characteristics of Human Walking on Inclined Surfaces; Hum, Mov. Sci.; 23, 6, pp. 807-821.;;Prentice et al., Locomotor Adaptations for Changes in Slope of the Walking Surface; Gait & Pos.; 20, 3, pp. 255-265.;;Lay, The Effects of Sloped Surfaces on Locomotion: A Kinematic and Kinetic Analysis, J. Biomech., 39, 9, 2006, pp. 1621-1628.;;Williams et al., Prosthetic Ankle-Foot Mechanism Capable of Automatic Adaptation to the Walking Surface; J. Biomech. Eng., 131, 3, 2009.;;PCT/US2007/022208 International Search Report.;;PCT/US2007/022208 Written Opinion of the International Search Authority.;;PCT/US2011/000675 International Search Report.;;PCT/US2011/000675 Written Opinion of the International Search Authority.;;PCT/US2012/000038 International Search Report.",ACTIVE
14,US,A1,US 2010/0185301 A1,067-530-372-963-609,2010-07-22,2010,US 31181807 A,2007-10-17,US 31181807 A;;US 85217406 P;;US 2007/0022208 W,2006-10-17,"EQUILIBRIUM-POINT PROSTHETIC AND ORTHOTIC ANKLE-FOOT SYSTEMS, DEVICES, AND METHODS OF USE","The present invention relates to a system for use in rehabilitation and/or physical therapy for the treatment of injury or disease. The system can enable an amputee to proceed over any surface without overbalancing. In particular the system is self-adapting to adjust the torque moment depending upon the motion, the extent of inclination, and the surface topography.",HANSEN ANDREW H;;GARD STEVEN A;;CHILDRESS DUDLEY S;;RUHE BRIAN;;WILLIAMS RYAN,HANSEN ANDREW H;;GARD STEVEN A;;CHILDRESS DUDLEY S;;RUHE BRIAN;;WILLIAMS RYAN,NORTHWESTERN UNIVERSITY (2012-09-04),https://lens.org/067-530-372-963-609,Patent Application,yes,24,75,4,4,0,A61F2/6607;;A61F2002/5003;;A61F2002/5009;;A61F2002/5036;;A61F2002/5072;;A61F2002/6818;;A61F2002/6845;;A61F2002/6854;;A61F2002/701;;A61F2002/704;;A61F2002/7625;;A61F2002/7635;;A61F2002/7645;;A61F2/70;;A61F2/6607;;A61F2002/6818;;A61F2002/6854;;A61F2002/6845;;A61F2002/5003;;A61F2002/7645;;A61F2002/7625;;A61F2002/5036;;A61F2002/5072;;A61F2002/5009;;A61F2002/704;;A61F2002/701;;A61F2002/7635;;A61F2/70,A61F2/66,623/47,0,0,,,,ACTIVE
15,EP,A1,EP 4059445 A1,018-663-106-415-740,2022-09-21,2022,EP 21315040 A,2021-03-18,EP 21315040 A,2021-03-18,MEDICAL IMPLANT AND CATHETER DEVICE FOR A MEDICAL IMPLANT,"The invention relates to a medical implant (1) comprising a patch (2). The implant is adapted to close a defect (3), preferably a an opening in a ventricular or atrial septum (4). The medical implant (1) comprises at least one mechanical anchor (5). The anchor may comprise a barb (6) and is adapted to pierce the patch (2) and/or biological tissue (4) such as to fix the medical implant (1) to said tissue (4). The medical implant can be deployed by a delivery device (7). The delivery device (7) may comprise a balloon (8', 8""), preferably at least two balloons (8', 8"").
",HOLISTICK MEDICAL,SPENCER ANDREW;;JOSEPHSON JOHN;;ROCHE ELLEN;;WARNACK BORIS;;POULETTY PHILIPPE;;PAU ANTOINE;;GARD MARCO,,https://lens.org/018-663-106-415-740,Patent Application,yes,9,0,3,3,0,A61B17/0057;;A61B2017/00575;;A61B2017/00623;;A61B2017/00004;;A61B2017/00243;;A61B2017/00898;;A61B2017/00597;;A61B2017/00579;;A61B2017/00893;;A61B2017/0061;;A61B2017/00876;;A61B2017/00477;;A61B2017/005;;A61B2017/00871,A61B17/00;;A61M37/00,,0,0,,,,DISCONTINUED
16,EP,A1,EP 4308009 A1,151-139-845-917-243,2024-01-24,2024,EP 22716223 A,2022-03-18,EP 21315040 A;;EP 2022057117 W,2021-03-18,MEDICAL IMPLANT AND CATHETER DEVICE FOR A MEDICAL IMPLANT,,HOLISTICK MEDICAL,SPENCER ANDREW;;JOSEPHSON JOHN;;ROCHE ELLEN;;WARNACK BORIS;;POULETTY PHILIPPE;;PAU ANTOINE;;GARD MARCO,,https://lens.org/151-139-845-917-243,Patent Application,yes,0,0,3,3,0,A61B17/0057;;A61B2017/00575;;A61B2017/00623;;A61B2017/00004;;A61B2017/00243;;A61B2017/00898;;A61B2017/00597;;A61B2017/00579;;A61B2017/00893;;A61B2017/0061;;A61B2017/00876;;A61B2017/00477;;A61B2017/005;;A61B2017/00871,A61B17/00,,0,0,,,,PENDING
17,WO,A1,WO 2022/195058 A1,001-528-103-301-124,2022-09-22,2022,EP 2022057117 W,2022-03-18,EP 21315040 A,2021-03-18,MEDICAL IMPLANT AND CATHETER DEVICE FOR A MEDICAL IMPLANT,"The invention relates to a medical implant (1) comprising a patch (2). The implant is adapted to close a defect (3), preferably a an opening in a ventricular or atrial septum (4). The medical implant (1) comprises at least one mechanical anchor (5). The anchor may comprise a barb (6) and is adapted to pierce the patch (2) and/or biological tissue (4) such as to fix the medical implant (1) to said tissue (4). The medical implant can be deployed by a delivery device (7). The delivery device (7) may comprise a balloon (8', 8''), preferably at least two balloons (8', 8'').",HOLISTICK MEDICAL,SPENCER ANDREW;;JOSEPHSON JOHN;;ROCHE ELLEN;;WARNACK BORIS;;POULETTY PHILIPPE;;PAU ANTOINE;;GARD MARCO,,https://lens.org/001-528-103-301-124,Patent Application,yes,11,0,3,3,0,A61B17/0057;;A61B2017/00575;;A61B2017/00623;;A61B2017/00004;;A61B2017/00243;;A61B2017/00898;;A61B2017/00597;;A61B2017/00579;;A61B2017/00893;;A61B2017/0061;;A61B2017/00876;;A61B2017/00477;;A61B2017/005;;A61B2017/00871,A61B17/00,,0,0,,,,PENDING
18,WO,A3,WO 2002/056489 A3,078-043-327-839-87X,2003-02-27,2003,US 0200888 W,2002-01-10,US 26171401 P;;US 79774501 A;;US 2060701 A,2001-01-12,LOCAL OSCILLATOR LEAKAGE CONTROL IN DIRECT CONVERSION PROCESSES,"A system and method for generating a local oscillator (LO) frequency in a zero intermediate frequency (IF) receiver or transmitter is presented. A signal is received from a voltage controlled oscillator (VCO). The signal has a VCO frequency. The VCO frequency is divided by a number N to produce a signal having a divided-down frequency. The signal having the VCO frequency is then mixed with the signal having the divided-down frequency to produce an output signal having an output frequency. Local oscillator leakage is reduced. Thus, the receiver or transmitter may operate in multiple wireless communication bands and modes and meet the associated specifications.",QUALCOMM INC,PETERZELL PAUL E;;MALDONADO DAVID;;GARD KEVIN;;SEE PUAY HOE ANDREW;;DUNWORTH JEREMY D;;SAHOTA KAMAL,,https://lens.org/078-043-327-839-87X,Search Report,yes,4,0,18,47,0,G01N33/14;;H03D3/008;;H03D3/009;;H03D3/008;;H03D3/009;;G01N33/14,H03L7/183;;G01N33/14;;H03D3/00;;H04B1/30;;H04B1/40,,0,0,,,,PATENTED
19,DE,D1,DE 60224162 D1,118-453-470-763-696,2008-01-31,2008,DE 60224162 T,2002-01-10,US 26171401 P;;US 79704501 A;;US 2060701 A;;US 0200888 W,2001-01-12,REDUKTION VOM LECKSIGNAL EINES LOKALOSZILLATORS IN EINEM DIREKTKONVERSIONSVERFAHREN,,QUALCOMM INC,PETERZELL PAUL E;;MALDONADO DAVID;;GARD KEVIN;;SEE PUAY HOE ANDREW;;DUNWORTH JEREMY D;;SAHOTA KAMAL,,https://lens.org/118-453-470-763-696,Granted Patent,no,0,0,7,47,0,G01N33/14;;H03D3/008;;H03D3/008;;H04B1/30;;H03D3/009,H03L7/183;;H04B1/30;;G01N33/14;;H03D3/00;;H04B1/40,,0,0,,,,EXPIRED
20,JP,A,JP 2008306759 A,176-318-543-223-079,2008-12-18,2008,JP 2008203318 A,2008-08-06,US 26171401 P;;US 79704501 A;;US 2060701 A,2001-01-12,LOCAL OSCILLATOR LEAKAGE CONTROL IN DIRECT CONVERSION PROCESSES,"<P>PROBLEM TO BE SOLVED: To provide local oscillator leakage control in direct conversion processes. <P>SOLUTION: A system and method for generating a local oscillator (LO) frequency in a zero intermediate frequency (IF) receiver or transmitter is presented. A signal is received from a voltage controlled oscillator (VCO). The signal has a VCO frequency. The VCO frequency is divided by a number N to produce a signal having a divided-down frequency. The signal having the VCO frequency is then mixed with the signal having the divided-down frequency to produce an output signal having an output frequency. Local oscillator leakage is reduced. Thus, the receiver or transmitter may operate in multiple wireless communication bands and modes and meet the associated specifications. <P>COPYRIGHT: (C)2009,JPO&INPIT",QUALCOMM INC,PETERZELL PAUL E;;MALDONADO DAVID;;GARD KEVIN;;SEE PUAY HOE ANDREW;;DUNWORTH JEREMY D;;SAHOTA KAMAL,,https://lens.org/176-318-543-223-079,Patent Application,no,0,1,7,47,0,G01N33/14;;H03D3/008;;H03D3/008;;H04B1/30;;H03D3/009,H03L7/183;;G01N33/14;;H03D3/00;;H04B1/26;;H04B1/30;;H04B1/40,,0,0,,,,INACTIVE
21,BR,A,BR 0206415 A,058-794-137-563-165,2004-10-19,2004,BR 0206415 A,2002-01-10,US 26171401 P;;US 79774501 A;;US 2060701 A;;US 0200888 W,2001-01-12,Controle de perdas de oscilador local no processo de conversão direta,"A system and method for generating a local oscillator (LO) frequency in a zero intermediate frequency (IF) receiver or transmitter is presented. A signal is received from a voltage controlled oscillator (VCO). The signal has a VCO frequency. The VCO frequency is divided by a number N to produce a signal having a divided-down frequency. The signal having the VCO frequency is then mixed with the signal having the divided-down frequency to produce an output signal having an output frequency. Local oscillator leakage is reduced. Thus, the receiver or transmitter may operate in multiple wireless communication bands and modes and meet the associated specifications.",QUALCOMM INC,PETERZELL PAUL E;;MALDONADO DAVID;;GARD KEVIN;;SEE ANDREW PUAY HOE;;DUNWORTH JEREMY D;;SAHOTA KAMAL,,https://lens.org/058-794-137-563-165,Patent Application,no,0,0,18,47,0,G01N33/14;;H03D3/008;;H03D3/009;;H03D3/008;;H03D3/009;;G01N33/14,H03L7/183;;G01N33/14;;H03D3/00;;H04B1/30;;H04B1/40,,0,0,,,,DISCONTINUED
22,CA,A1,CA 2434048 A1,101-916-957-831-188,2002-07-18,2002,CA 2434048 A,2002-01-10,US 26171401 P;;US 79774501 A;;US 2060701 A;;US 0200888 W,2001-01-12,LOCAL OSCILLATOR LEAKAGE CONTROL IN DIRECT CONVERSION PROCESSES,"A system and method for generating a local oscillator (LO) frequency in a ze ro intermediate frequency (IF) receiver or transmitter is presented. A signal i s received from a voltage controlled oscillator (VCO). The signal has a VCO frequency. The VCO frequency is divided by a number N to produce a signal having a divided-down frequency. The signal having the VCO frequency is then mixed with the signal having the divided-down frequency to produce an output signal having an output frequency. Local oscillator leakage is reduced. Thus , the receiver or transmitter may operate in multiple wireless communication bands and modes and meet the associated specifications.",QUALCOMM INC,SEE PUAY HOE ANDREW;;DUNWORTH JEREMY D;;SAHOTA KAMAL;;MALDONADO DAVID;;GARD KEVIN;;PETERZELL PAUL E,,https://lens.org/101-916-957-831-188,Patent Application,no,0,0,18,47,0,G01N33/14;;H03D3/008;;H03D3/009;;H03D3/008;;H03D3/009;;G01N33/14,H03L7/183;;G01N33/14;;H03D3/00;;H04B1/30;;H04B1/40,,0,0,,,,EXPIRED
