61,US,B2,US 10393740 B2,153-779-141-369-785,2019-08-27,2019,US 201515517409 A,2015-10-12,US 201515517409 A;;US 201462062717 P;;US 2015/0055149 W,2014-10-10,Methods for identifying modulators of calcium-sensing receptors,"Methods for identifying compounds that modulate the activity and/or expression of a calcium-sensing receptor, wherein said compounds can be incorporated into flavor compositions that can be used to modify the kokumi taste and/or palatability of pet food products.",MARS INC,MCGRANE SCOTT JOSEPH;;TAYLOR ANDREW JOHN;;FINE RICHARD MASTEN;;KLEBANSKY BORIS;;GIBBS MATTHEW RONALD,MARS INCORPORATED (2015-07-27),https://lens.org/153-779-141-369-785,Granted Patent,yes,8,0,10,10,7,G01N33/566;;G01N33/84;;G01N2500/04;;G01N33/84;;G01N2500/04;;G01N33/566;;G01N33/84;;G01N2500/04;;G01N33/566,G01N33/84;;G01N33/566,,35,32,056-201-471-905-934;;028-862-168-091-90X;;043-660-854-338-958;;051-504-535-716-216;;011-543-575-355-882;;104-322-730-003-071;;052-218-141-470-099;;075-223-296-811-59X;;015-740-822-611-627;;018-694-084-068-187;;005-059-809-125-448;;055-140-332-201-424;;069-146-206-691-894;;091-379-864-905-836;;019-779-601-634-917;;013-181-635-285-001;;047-522-696-481-432;;094-742-476-378-715;;024-169-748-954-977;;014-816-999-983-305;;026-164-216-541-151;;003-199-881-877-144;;085-764-009-624-439;;125-493-619-382-833;;104-776-189-083-902;;067-457-318-879-045;;074-988-743-588-202;;058-607-890-219-595;;072-250-039-322-319;;069-355-613-624-075;;068-222-865-494-38X;;019-410-001-720-969,2231712;;10.1006/jmbi.1990.9999;;10.1016/s0022-2836(05)80360-2;;10.1093/nar/25.17.3389;;9254694;;pmc146917;;pmc2565688;;10.1074/jbc.m611071200;;17310064;;10.1152/ajprenal.2001.280.5.f815;;11292623;;10373443;;10.1074/jbc.274.26.18382;;pmc6634626;;10.1523/jneurosci.0496-10.2010;;20573884;;3914646;;10.1016/0163-7258(85)90017-8;;10.1093/jn/137.6.1524s;;17513419;;8386298;;10.1016/0076-6879(93)17092-j;;10.1126/science.2471267;;2471267;;10.1038/nature13396;;25042998;;17616213;;10.1021/jf071276u;;19700256;;10.1016/j.domaniend.2009.07.004;;19305800;;10.2174/157015907781695982;;pmc2656812;;pmc46825;;8390686;;10.1073/pnas.90.12.5873;;10.1073/pnas.87.6.2264;;2315319;;pmc53667;;25981303;;10.1016/j.ejphar.2015.05.013;;pmc4584177;;8474352;;10.1016/0076-6879(93)17091-i;;22511946;;10.1371/journal.pone.0034489;;pmc3325276;;10.1016/j.physbeh.2004.12.010;;15708786;;3382986;;10.1093/bioinformatics/4.1.11;;19892707;;10.1074/jbc.m109.029165;;pmc2801228;;10.1073/pnas.85.8.2444;;pmc280013;;3162770;;14976203;;10.1074/jbc.m400724200;;10.1016/j.bbrc.2008.11.060;;19056349;;19170504;;10.1021/jf803376d;;10.1093/bioinformatics/10.1.3;;8193952;;10.1124/pr.109.002501;;21228259;;24603153;;10.1126/science.1249489;;pmc3991565;;10.1007/s00441-006-0266-5;;16847639;;10.1074/jbc.m313639200;;14736871;;10.1074/jbc.m307191200;;14660633,"Altschul, et al., “Basic Local Alignment Search Tool”, J. Mol. Biol., 1990, 215, 403-410.;;Altschul, et al., “Gapped BLAST and PSI-BLAST: A New Generation of Protein Database Search Programs”, Nucleic Acids Research, 1997, vol. 25, No. 17, pp. 3389-3402.;;Binet, et al., “Common Structural Requirements for Heptahelical Domain Function in Class A and Class C G Protein-Coupled Receptors”, J. Biol. Chem., 2007, 282(16):12154-12163.;;Blankenship, et al., “The Calcium-sensing Receptor Regulates Calcium Absorption in MDCK Cells by Inhibition of PMCA”, Am. J. Physiol. Renal. Physiol., 280, 2001, F815-F822.;;Brauner-Osborne, et al., “The Agonist-binding Domain of the Calcium-sensing Receptor is Located at the Amino-Terminal Domain”, Journal of Biological Chemistry, vol. 274, No. 26, Jun. 25, 1999, 18382-18386.;;Cartoni, et al., “Taste Preference for Fatty Acids is Mediated by GPR40 and GPR120”, Journal of Neuroscience, vol. 30, No. 25, pp. 8376-8382 (Jun. 23, 2010).;;Cline, “Perspectives for Gene Therapy: Inserting New Genetic Information into Mammalian Cells by Physical Techniques and Viral Vectors”, Pharmac. Ther., vol. 29, pp. 69-92, 1985.;;Conigrave, et al., “Aromatic L-Amino Acids Activate the Calcium-Sensing Receptor”, J. Nutr. Jun. 2007, vol. 137 No. 6, pp. 1524S-1527S.;;Cotten, “Receptor-Mediated Transport of DNA into Eurkaryotic Cells”, Methods in Enzymology, vol. 217 (1993), pp. 618-644.;;Cunningham, et al., “High-Resolution Epitope Mapping of hGH-Receptor Interactions by Alanine-Scanning Mutagenesis”, Science, 1989, 244(4908):1081-1085, Abstract only (2 pgs.).;;Dore, et al., “Structure of class C GPCR metabotropic glutamate receptor 5 transmembrane domain”, Nature Jul. 31, 2014; 511(7511):557-62, Epub Jul. 6, 2014, Abstract Only (2 pgs.).;;Dunkel, et al., “Molecular and Sensory Characterization of gamma-Glutamyl Peptides as Key Contributors to the Kokumi Taste of Edible Beans (Phasolus vulgaris L.)”, J. Agric. Food Chem., 2007, 55, 6712-6719.;;Eswar, et al., “Comparative Protein Structure Modeling Using Modeller”, Curr Protoc Bioinformatics, Supplement 15, 5.6.1-5.6.30, 47 pages (2006).;;Gal, et al., “Cloning and Sequencing of the Calcium-Sensing Receptor from the Feline Parathyroid Gland”, Domestic Animal Endocrinology, 38 (2010), pp. 57-61.;;Jensen, et al., “Allosteric Modulation of the Calcium-Sensing Receptor”, Current Neuropharmacology, vol. 5, No. 3, (2007) 180-186.;;Karlin, et al., “Applications and Statistics for Multiple High-Scoring Segments in Molecular Sequences”, Proc. Natl. Acad. Sci. USA vol. 90 pp. 5873-5877, Jun. 1993.;;Karlin, et al., “Methods for Assessing the Statistical Significance of Molecular Sequence Features by Using General Scoring Schemes”, Proc. Natl. Acad. Sci. USA, vol. 87, pp. 2264-2268, Mar. 1990.;;Lee, et al. “Structural Insights into Ligand Recognition and Selectivity for Class A, B and C GPCR's”, Eur. J. Pharmacol., 2015, 763:196-205.;;Loeffler, “Gene Transfer into Primary and Established Mammalian Cell Lines with Lipopolyamine-Coated DNA”, Methods in Enzymology, vol. 217 (1993), 599-618.;;Maruyama, et al., “Kokumi Substances, Enhancers of Basic Tastes, Induce Responses in Calcium-Sensing Receptor Expressing Taste Cells”, PLOSOne, Apr. 2012, vol. 7, No. 4, e34489, 8 pages.;;McCaughey, et al., “Calcium Deprivation Increases the Palatability of Calcium Solutions in Rats”, Physiology & Behavior, 84 (2005), pp. 335-342.;;Myers, et al., “Optical Alignments in Linear Space”, Comput. Appl. Biosci., 1988, 4(1):11-7, Abstract Only (1 pg.).;;Ohsu, “Involvement of the Calcium-Sensing Receptor in Human Taste Perception”, The Journal of Biological Chemistry, vol. 285, No. 2, pp. 1016-1022, Jan. 8, 2010.;;Pearson, et al., “Improved Tools for Biological Sequence Comparison”, Proc. Natl. Acad. Sci. USA, 85:2444-8, Apr. 1988.;;Petrel, et al., “Positive and Negative Allosteric Modulators of the CA2+-sensing Receptor Interact within Overlapping but Not Identical Binding Sites in the Transmembrane Domain”, Journal of Biological Chemistry, vol. 279, No. 18, Apr. 30, 2004, 18990-18997.;;San Gabriel, et al., “The Calcium-Sensing Receptor in Taste Tissue”, Biochem & Biophys Res. Comm., 378 (2009), pp. 414-418.;;Toelstede, et al., “A Series of Kokumi Peptides Impart the Long-Lasting Mouthfulness of Matured Gouda Cheese”, J. Agric. Food Chem., 2009, 57, 1440-1448.;;Torelli, et al., “Advance and Adam: two algorithms for the analysis of global similarity between homologous informational sequences”, Comput. Appl. Biosci., 10:3-5 (1994).;;Urwyler, “Allosteric Modulation of Family C G-Protein-Coupled Receptors: from Molecular Insights to Therapeutic Perspectives”, Pharmacol Rev, 63:59-126, 2011.;;Wu, et al., “Structure of a Class C GPCR Metabotropic Glutamate Receptor 1 Bound to an Allosteric Modulator”, Science Apr. 4, 2014; vol. 344, p. 58-64.;;International Search Report and Written Opinion dated Feb. 2, 2016 in International Application No. PCT/US2015/055149 (12 pages).;;Ferraguti, et al., “Metabotropic glutamate receptors”, Cell Tissue Res, Dec. 2006, 11, 326(2):483-504.;;Liu, et al., “Molecular Determinants Involved in the Allosteric Control of Agonist Affinity in the GABAb Receptor by the GABAb2 Subunit”, J. Biol. Chem. Jan. 21, 2004, vol. 279, No. 16, pp. 15824-15830.;;Malitschek, et al., “The N-Terminal Domain of γ-Aminobutyric AcidBReceptors Is Sufficient to Specify Agonist and Antagonist Binding”, Molecular Pharmacology Aug. 1999, 56 (2) 448-454.;;Miedlich, et al., “Homology Modeling of the Transmembrance Domain of the Human Calcium Sensing Receptor and Localization of an Allosteric Binding Site”, Journal of Biological Chemistry, vol. 279, No. 8, Feb. 20, 2004, pp. 7254-7263.",ACTIVE
62,WO,A2,WO 2016/094726 A2,153-216-259-620-921,2016-06-16,2016,US 2015/0065106 W,2015-12-10,US 201462090138 P,2014-12-10,COMPOUNDS THAT MODULATE FATTY ACID RECEPTOR ACTIVITY AND PET FOOD PRODUCTS CONTAINING THE SAME,"A flavor composition comprising at least one compound that modulates, increases and/or enhances the activity of a GPR120 fatty acid receptor that can be used to enhance the fatty acid taste and/or palatability of pet food products is described herein. Also disclosed herein are methods for identifying said compounds.",MARS INC,MCGRANE SCOTT JOSEPH;;TAYLOR ANDREW JOHN;;GIBBS MATTHEW RONALD;;FINE RICHARD MASTEN;;KLEBANSKY BORIS,,https://lens.org/153-216-259-620-921,Patent Application,yes,13,0,46,46,1,A23K20/132;;A23K20/142;;A23K20/153;;A23K50/42;;A23K50/48;;A23K20/111;;A23L27/88;;A23L27/204;;A23V2002/00;;A23K20/111;;A23K20/142;;A23K20/132;;A23K20/153;;A23K50/42;;A23K50/48;;A23L27/88;;A23L27/204;;A23L27/21;;A23L27/23;;A23K20/111;;A23K20/132;;A23K20/142;;A23K20/153;;A23K50/42;;A23K50/48;;A23L27/21;;A23L27/22;;A23L27/23;;A23L27/204;;A23L27/235;;A23L27/88;;A23K50/40;;A23K20/132;;A23K20/153;;A23K50/42;;A23K50/48;;A23L27/88;;A23L27/204;;A23K20/111;;A23K20/142;;A23L27/21;;A23L27/23;;A23L27/22;;A23L27/235;;A23V2002/00,A23L27/20,,15,15,104-322-730-003-071;;015-981-364-551-336;;104-322-730-003-071;;008-278-323-798-991;;083-302-361-577-505;;050-061-272-649-958;;094-742-476-378-715;;015-740-822-611-627;;052-218-141-470-099;;008-278-323-798-991;;083-302-361-577-505;;050-061-272-649-958;;014-077-783-276-576;;037-756-253-428-172;;079-975-993-799-001,pmc6634626;;10.1523/jneurosci.0496-10.2010;;20573884;;10.1371/journal.pone.0024014;;pmc3162022;;21901153;;pmc6634626;;10.1523/jneurosci.0496-10.2010;;20573884;;10.2210/pdb3sn6/pdb;;pmc3184188;;21772288;;10.1038/nature10361;;pmc3074590;;20929726;;10.1126/science.1194396;;22437504;;pmc3356457;;10.1038/nature10939;;8474352;;10.1016/0076-6879(93)17091-i;;8386298;;10.1016/0076-6879(93)17092-j;;3914646;;10.1016/0163-7258(85)90017-8;;10.2210/pdb3sn6/pdb;;pmc3184188;;21772288;;10.1038/nature10361;;pmc3074590;;20929726;;10.1126/science.1194396;;22437504;;pmc3356457;;10.1038/nature10939;;24860101;;10.1074/jbc.m114.561449;;pmc4106347;;16301204;;10.1093/bioinformatics/bti770;;pmc4526412;;10.1016/j.str.2015.06.007;;26190572,"CARTONI ET AL., J NEUROSCI., vol. 30, no. 25, 23 June 2010 (2010-06-23), pages 8376 - 82;;CELINE ET AL., PLOS ONE., vol. 6, no. 8, 2011, pages E24014;;CARTONI ET AL., J. OF NEUROSCIENCE, vol. 30, no. 25, 2010, pages 8376 - 8382;;RASMUSSEN, S.G. ET AL., NATURE, vol. 477, 2011, pages 549 - 555;;WU, B. ET AL., SCIENCE, vol. 330, 2010, pages 1066 - 1071;;WU, H. ET AL., NATURE, vol. 485, 2012, pages 327 - 332;;LOEFFLER; BEHR, METH. ENZYMOL., vol. 217, 1993, pages 599 - 618;;COHEN ET AL., METH. ENZYMOL., vol. 217, 1993, pages 618 - 644;;CLINE, PHARMAC. THER., vol. 29, 1985, pages 69 - 92;;RASMUSSEN, S.G. ET AL.: ""Crystal structure of the beta2 adrenergic receptor-Gs protein complex"", NATURE, vol. 477, 2011, pages 549 - 555;;WU, B. ET AL.: ""Structures of the CXCR4 chemokine GPCR with small-molecule and cyclic peptide antagonists"", SCIENCE, vol. 330, 2010, pages 1066 - 1071, XP055036210, DOI: doi:10.1126/science.1194396;;WU, H. ET AL.: ""Structure of the human kappa-opioid receptor in complex with JDTic"", NATURE, vol. 485, 2012, pages 327 - 332;;BRIAN D. HUDSON ET AL.: ""The Molecular Basis of Ligand Interaction at Free Fatty Acid Receptor 4 (FFA4/GPR120"", THE JOURNAL OF BIOLOGICAL CHEMISTRY, vol. 289, no. 29, 18 July 2014 (2014-07-18), pages 20345 - 58;;ARNOLD K; BORDOLI L; KOPP J; SCHWEDE T.: ""The SWISS-MODEL Workspace: A web-based environment for protein structure homology modelling"", BIOINJORMATICS., vol. 22, 2006, pages 195 - 201;;ZHANG, J YANG; R JANG; Y ZHANG.: ""GPCR-1-TASSER: A hybrid approach to G protein-coupled receptor structure modeling and the application to the human genome"", STRUCTURE, vol. 23, 2015, pages 1538 - 1549, XP029251264, DOI: doi:10.1016/j.str.2015.06.007",PENDING
63,WO,A1,WO 2016/057996 A1,170-928-565-859-991,2016-04-14,2016,US 2015/0055149 W,2015-10-12,US 201462062717 P,2014-10-10,METHODS FOR IDENTIFYING MODULATORS OF CALCIUM-SENSING RECEPTORS,"Methods for identifying compounds that modulate the activity and/or expression of a calcium-sensing receptor, wherein said compounds can be incorporated into flavor compositions that can be used to modify the kokumi taste and/or palatability of pet food products.",MARS INC,MCGRANE SCOTT JOSEPH;;TAYLOR ANDREW JOHN;;FINE RICHARD MASTEN;;KLEBANSKY BORIS;;GIBBS MATTHEW RONALD,,https://lens.org/170-928-565-859-991,Patent Application,yes,2,5,10,10,7,G01N33/566;;G01N33/84;;G01N2500/04;;G01N33/84;;G01N2500/04;;G01N33/566;;G01N33/84;;G01N2500/04;;G01N33/566,G01N33/566,,21,18,051-504-535-716-216;;091-379-864-905-836;;125-493-619-382-833;;011-543-575-355-882;;104-322-730-003-071;;013-181-635-285-001;;019-779-601-634-917;;056-201-471-905-934;;028-862-168-091-90X;;085-764-009-624-439;;018-694-084-068-187;;094-742-476-378-715;;015-740-822-611-627;;052-218-141-470-099;;043-660-854-338-958;;072-250-039-322-319;;005-059-809-125-448;;189-511-438-714-876,10.1152/ajprenal.2001.280.5.f815;;11292623;;19305800;;10.2174/157015907781695982;;pmc2656812;;14976203;;10.1074/jbc.m400724200;;10373443;;10.1074/jbc.274.26.18382;;pmc6634626;;10.1523/jneurosci.0496-10.2010;;20573884;;10.1073/pnas.87.6.2264;;2315319;;pmc53667;;pmc46825;;8390686;;10.1073/pnas.90.12.5873;;2231712;;10.1006/jmbi.1990.9999;;10.1016/s0022-2836(05)80360-2;;10.1093/nar/25.17.3389;;9254694;;pmc146917;;10.1073/pnas.85.8.2444;;pmc280013;;3162770;;10.1126/science.2471267;;2471267;;8474352;;10.1016/0076-6879(93)17091-i;;8386298;;10.1016/0076-6879(93)17092-j;;3914646;;10.1016/0163-7258(85)90017-8;;pmc2565688;;10.1074/jbc.m611071200;;17310064;;24603153;;10.1126/science.1249489;;pmc3991565;;10.1038/nature13396;;25042998;;10.1002/0471250953.bi0506s15,"KRISTY A. BLANKENSHIP ET AL: ""The calcium-sensing receptor regulates calcium absorption in MDCK cells by inhibition of PMCA"", AMERICAN JOURNAL OF PHYSIOLOGY: RENAL PHYSIOLOGY, vol. 280, no. 5, 1 May 2001 (2001-05-01), United States, pages 815 - 822, XP055243241, ISSN: 1931-857X;;JENSEN ANDERS A ET AL: ""Allosteric modulation of the calcium-sensing receptor"", CURRENT NEUROPHARMACOLOGY, BENTHAM SCIENCE PUBLISHERS, HILVERSUM, NL, vol. 5, no. 3, 1 September 2007 (2007-09-01), pages 180 - 186, XP002590070, ISSN: 1570-159X;;C. PETREL ET AL: ""Positive and Negative Allosteric Modulators of the Ca2+-sensing Receptor Interact within Overlapping but Not Identical Binding Sites in the Transmembrane Domain"", JOURNAL OF BIOLOGICAL CHEMISTRY, vol. 279, no. 18, 30 April 2004 (2004-04-30), pages 18990 - 18997, XP055151052, ISSN: 0021-9258, DOI: 10.1074/jbc.M400724200;;BRAUNER-OSBORNE HANS ET AL: ""The agonist-binding domain of the calcium-sensing receptor is located at the amino-terminal domain"", JOURNAL OF BIOLOGICAL CHEMISTRY, AMERICAN SOCIETY FOR BIOCHEMISTRY AND MOLECULAR BIOLOGY, US, vol. 274, no. 26, 25 June 1999 (1999-06-25), pages 18382 - 18386, XP002436357, ISSN: 0021-9258, DOI: 10.1074/JBC.274.26.18382;;CARTONI ET AL., J. OF NEUROSCIENCE, vol. 30, no. 25, 2010, pages 8376 - 8382;;KARLIN; ALTSCHUL, PROC. NATL. ACAD. SCI. USA, vol. 87, 1990, pages 2264 - 2268;;KARLIN; ALTSCHUL, PROC. NATL. ACAD. SCI. USA, vol. 90, 1993, pages 5873 - 5877;;ALTSCHUL ET AL., J. MOL. BIOL., vol. 215, 1990, pages 403 - 410;;ALTSCHUL ET AL., NUCLEIC ACIDS RES., vol. 25, 1997, pages 3389 - 3402;;MYERS; MILLER, CABIOS, 1989;;TORELLIS; ROBOTTI, COMPUT. APPL. BIOSCI., vol. 10, 1994, pages 3 - 5;;PEARSON; LIPMAN, PROC. NATL. ACAD. SCI., vol. 85, 1988, pages 2444 - 8;;CUNNINGHAM ET AL., SCIENCE, vol. 244, 1989, pages 1081 - 1085;;LEE ET AL., EUR J PHANNACOL., 14 May 2015 (2015-05-14);;LOEFFLER; BEHR, METH. ENZYMOL., vol. 217, 1993, pages 599 - 618;;COHEN ET AL., METH. ENZYMOL., vol. 217, 1993, pages 618 - 644;;CLINE, PHARMAC. THER., vol. 29, 1985, pages 69 - 92;;BINET ET AL., J. BIOL. CHEM, vol. 282, no. 16, 2007, pages 12154 - 63;;WU, SCIENCE, vol. 344, no. 6179, 2014, pages 58 - 64;;DORE ET AL., NATURE, vol. 511, 2014, pages 557 - 562;;ESWAR ET AL., CURRENT PROTOCOLS IN BIOINFONNATICS, 2006",PENDING
64,WO,A3,WO 2016/094726 A3,190-398-234-367-183,2016-09-01,2016,US 2015/0065106 W,2015-12-10,US 201462090138 P,2014-12-10,COMPOUNDS THAT MODULATE FATTY ACID RECEPTOR ACTIVITY AND PET FOOD PRODUCTS CONTAINING THE SAME,"A flavor composition comprising at least one compound that modulates, increases and/or enhances the activity of a GPR120 fatty acid receptor that can be used to enhance the fatty acid taste and/or palatability of pet food products is described herein. Also disclosed herein are methods for identifying said compounds.",MARS INC,MCGRANE SCOTT JOSEPH;;TAYLOR ANDREW JOHN;;GIBBS MATTHEW RONALD;;FINE RICHARD MASTEN;;KLEBANSKY BORIS,,https://lens.org/190-398-234-367-183,Search Report,yes,6,0,46,46,0,A23K20/132;;A23K20/142;;A23K20/153;;A23K50/42;;A23K50/48;;A23K20/111;;A23L27/88;;A23L27/204;;A23V2002/00;;A23K20/111;;A23K20/142;;A23K20/132;;A23K20/153;;A23K50/42;;A23K50/48;;A23L27/88;;A23L27/204;;A23L27/21;;A23L27/23;;A23K20/111;;A23K20/132;;A23K20/142;;A23K20/153;;A23K50/42;;A23K50/48;;A23L27/21;;A23L27/22;;A23L27/23;;A23L27/204;;A23L27/235;;A23L27/88;;A23K50/40;;A23K20/132;;A23K20/153;;A23K50/42;;A23K50/48;;A23L27/88;;A23L27/204;;A23K20/111;;A23K20/142;;A23L27/21;;A23L27/23;;A23L27/22;;A23L27/235;;A23V2002/00,A23L27/20;;A23K20/111;;A23K50/40,,4,4,064-816-888-267-051;;055-257-931-301-944;;104-322-730-003-071;;003-249-569-284-849,10.1021/jm300215x;;22519963;;10.1016/j.neuroscience.2013.06.043;;23831422;;pmc6634626;;10.1523/jneurosci.0496-10.2010;;20573884;;10.1074/jbc.m211495200;;12496284,"BHARAT SHIMPUKADE ET AL: ""Discovery of a Potent and Selective GPR120 Agonist"", JOURNAL OF MEDICINAL CHEMISTRY, vol. 55, no. 9, 23 April 2012 (2012-04-23), pages 4511 - 4515, XP055187297, ISSN: 0022-2623, DOI: 10.1021/jm300215x;;GODINOT N ET AL: ""Activation of tongue-expressed GPR40 and GPR120 by non caloric agonists is not sufficient to drive preference in mice"", NEUROSCIENCE, vol. 250, 2013, pages 20 - 30, XP028709284, ISSN: 0306-4522, DOI: 10.1016/J.NEUROSCIENCE.2013.06.043;;C. CARTONI ET AL: ""Taste Preference for Fatty Acids Is Mediated by GPR40 and GPR120"", JOURNAL OF NEUROSCIENCE, vol. 30, no. 25, 23 June 2010 (2010-06-23), pages 8376 - 8382, XP055137711, ISSN: 0270-6474, DOI: 10.1523/JNEUROSCI.0496-10.2010;;BRISCOE C P ET AL: ""The orphan G protein-coupled receptor GPR40 is activated by medium and long chain fatty acids"", JOURNAL OF BIOLOGICAL CHEMISTRY, AMERICAN SOCIETY FOR BIOCHEMISTRY AND MOLECULAR BIOLOGY, US, vol. 278, no. 13, 28 March 2003 (2003-03-28), pages 11303 - 11311, XP002279348, ISSN: 0021-9258, DOI: 10.1074/JBC.M211495200",PENDING
65,EP,A2,EP 2115554 A2,191-778-291-926-94X,2009-11-11,2009,EP 08705653 A,2008-01-03,US 2008/0050066 W;;US 62020107 A,2007-01-05,HOLDING AND USING AN ELECTRONIC PEN AND PAPER,,CANDLEDRAGON INC,PITTEL ARKADY;;ELEKTROV STANISLAV V;;GOLDMAN ANDREW M;;FINE LAWRENCE;;GOLDENBERG EUGENE;;PITTEL ILYA,,https://lens.org/191-778-291-926-94X,Patent Application,yes,0,0,4,4,0,B43K23/001;;B43K23/001;;B43K23/02;;B43K23/02;;B43K23/08;;B43K23/08;;B43K29/10;;B43K29/10;;G06F3/03545;;G06F3/03545,G06F3/033,,1,0,,,See references of WO 2008086067A3,DISCONTINUED
66,WO,A2,WO 2008/086067 A2,079-920-188-502-510,2008-07-17,2008,US 2008/0050066 W,2008-01-03,US 62020107 A,2007-01-05,HOLDING AND USING AN ELECTRONIC PEN AND PAPER,"A housing contains electronics used in determining locations of a writing instrument based on wireless signals, defines a chamber in which the writing instrument may be held when not in use, and includes a retention element to retain the writing instrument from falling out of the chamber. In general, in one aspect, a writing instrument includes an elongate pen body, an electrical contact on a surface of the pen body, and a light source disposed near an end of the pen body. The light source includes a light guide having an optically conductive portion and an optically reflective portion.",CANDLEDRAGON INC;;PITTEL ARKADY;;ELEKTROV STANISLAV V;;GOLDMAN ANDREW M;;FINE LAWRENCE;;GOLDENBERG EUGENE;;PITTEL ILYA,PITTEL ARKADY;;ELEKTROV STANISLAV V;;GOLDMAN ANDREW M;;FINE LAWRENCE;;GOLDENBERG EUGENE;;PITTEL ILYA,,https://lens.org/079-920-188-502-510,Patent Application,yes,0,0,4,4,0,B43K23/001;;B43K23/001;;B43K23/02;;B43K23/02;;B43K23/08;;B43K23/08;;B43K29/10;;B43K29/10;;G06F3/03545;;G06F3/03545,B43K29/00;;B43K23/02,,0,0,,,,PENDING
67,EP,B1,EP 3204772 B1,160-832-350-981-034,2020-12-23,2020,EP 15784884 A,2015-10-12,US 201462062717 P;;US 2015/0055149 W,2014-10-10,METHODS FOR IDENTIFYING MODULATORS OF CALCIUM-SENSING RECEPTORS,,MARS INC,MCGRANE SCOTT JOSEPH;;TAYLOR ANDREW JOHN;;FINE RICHARD MASTEN;;KLEBANSKY BORIS;;GIBBS MATTHEW RONALD,,https://lens.org/160-832-350-981-034,Granted Patent,yes,8,0,10,10,0,G01N33/566;;G01N33/84;;G01N2500/04;;G01N33/84;;G01N2500/04;;G01N33/566;;G01N33/84;;G01N2500/04;;G01N33/566,G01N33/566,,8,6,019-410-001-720-969;;110-550-015-719-347;;003-199-881-877-144;;024-169-748-954-977;;091-379-864-905-836;;069-146-206-691-894,10.1074/jbc.m307191200;;14660633;;20179105;;10.1242/jcs.061879;;19892707;;10.1074/jbc.m109.029165;;pmc2801228;;22511946;;10.1371/journal.pone.0034489;;pmc3325276;;19305800;;10.2174/157015907781695982;;pmc2656812;;19700256;;10.1016/j.domaniend.2009.07.004,"SUSANNE U. MIEDLICH ET AL: ""Homology Modeling of the Transmembrane Domain of the Human Calcium Sensing Receptor and Localization of an Allosteric Binding Site"", JOURNAL OF BIOLOGICAL CHEMISTRY, vol. 279, no. 8, 20 February 2004 (2004-02-20), US, pages 7254 - 7263, XP055575266, ISSN: 0021-9258, DOI: 10.1074/jbc.M307191200;;BYSTROVA MARINA F., ROMAN A. ROMANOV, OLGA A. ROGACHEVSKAJA, GLEB D. CHURBANOV , STANISLAV S. KOLESNIKOV: ""Functional expression of the extracellular-Ca2+-sensing receptor in mouse taste cells"", JOURNAL OF CELL SCIENCE, vol. 123, 2010, pages 972 - 982, XP055843434;;OHSU T; AMINO Y; NAGASAKI H; YAMANAKA T; TAKESHITA S; HATANAKA T; MARUYAMA Y; MIYAMURA N; ETO Y: ""Involvement of the calcium-sensing recepto in human taste perception"", JOURNAL OF BIOLOGICAL CHEMISTRY, vol. 285, no. 2, 2010, pages 1016 - 1022, XP055056508, DOI: 10.1074/jbc.M109.029165;;DATABASE NUCLEOTIDE 4 October 2003 (2003-10-04), ANONYMOUS: ""Homo sapiens calcium-sensing receptor (hypocalciuric hypercalcemia 1, severe neonatalhyperparathyroidism) (CASR)"", XP055843437, retrieved from NCBI Database accession no. NM:000388;;MARUYAMA YUTAKA, REIKO YASUDA, MOTONAKA KURODA, YUZURU ETO: ""Kokumi Substances, Enhancers of Basic Tastes, Induce Responses in Calcium-Sensing Receptor Expressing Taste Cells"", PLOS ONE, vol. 7, no. 4, 12 April 2012 (2012-04-12), pages e34489, XP055056509;;JENSEN ANDERS A; BRÄUNER-OSBORNE H: ""Allosteric modulation of the calcium-sensing receptor"", CURRENT NEUROPHARMACOLOGY, vol. 5, no. 3, 1 September 2007 (2007-09-01), pages 180 - 186, XP002590070;;MALIKOVA N., VYSOTSKI E.: ""Bioluminescent properties of hydromedusan Ca2+-regulated photoproteins and their semi-synthetic derivatives"", LUMINESCENCE- THE JOURNAL OF BIOLOGICAL AND CHEMICAL LUMINESCENCE, vol. 29, no. 1, 0036, August 2014 (2014-08-01), pages 1 - 106, XP055843442;;GAL A; RIDGE T K; GRAVES T K: ""Cloning and sequencing of the calcium-sensing receptor from the feline parathyroid gland"", DOMESTIC ANIMAL ENDOCRINOLOGY, vol. 38, no. 1, 2010, pages 57 - 61, XP026777176, DOI: 10.1016/j.domaniend.2009.07.004",ACTIVE
