39,AU,A8,AU 2011/318388 A8,036-262-146-917-046,2013-08-01,2013,AU 2011/318388 A,2011-10-13,US 45534710 P;;US 2011/0056227 W,2010-10-19,Systems and methods for avian mitigation for wind farms,"A wildlife detection system includes a tracking device, a receiver, and a wildlife deterrent system. The tracking device may be mounted to a wildlife. The receiver is configured to track movement of the tracking device relative to an object of danger to the wildlife. The wildlife deterrent system is configured to reduce risk of danger to the wildlife in response to movement of the wildlife within a predetermined distance from the object of danger as tracked by the receiver.",RENEWABLE ENERGY SYSTEMS AMERICAS INC,BABBITT VICTOR;;OLIVER ANDREW G;;FINE JEFFREY W;;IVES DANIEL;;BRAND ALEXANDER D,,https://lens.org/036-262-146-917-046,Patent Application,no,0,0,14,14,0,A01K11/008;;A01K35/00;;A01M29/00;;A01K11/006;;A01K11/006;;A01K11/008;;A01K11/008;;A01M29/00;;A01M29/00;;A01M31/002;;A01M31/002;;F03D80/00;;F04D15/0066;;F03D7/00;;F03D17/00;;F03D17/00;;F03D80/00;;F03D80/00;;G01S13/75;;G01S5/0009;;G01S13/75;;G01S13/75;;G01S13/88;;Y02E10/72;;Y02E10/72,A01K11/00;;A01M29/00;;F03D11/00;;G01S13/75,,0,0,,,,INACTIVE
40,EP,A1,EP 2629601 A1,166-717-669-565-416,2013-08-28,2013,EP 11779013 A,2011-10-13,US 45534710 P;;US 2011/0056227 W,2010-10-19,SYSTEMS AND METHODS FOR AVIAN MITIGATION FOR WIND FARMS,,RENEWABLE ENERGY SYSTEMS AMERICAS INC;;OLIVER ANDREW G,OLIVER ANDREW G;;BABBITT VICTOR;;FINE JEFFREY W;;IVES DANIEL;;BRAND ALEXANDER D,RENEWABLE ENERGY SYSTEMS AMERICAS INC. (2014-05-21),https://lens.org/166-717-669-565-416,Patent Application,yes,0,0,14,14,0,A01K11/008;;A01K35/00;;A01M29/00;;A01K11/006;;A01K11/006;;A01K11/008;;A01K11/008;;A01M29/00;;A01M29/00;;A01M31/002;;A01M31/002;;F03D80/00;;F04D15/0066;;F03D7/00;;F03D17/00;;F03D17/00;;F03D80/00;;F03D80/00;;G01S13/75;;G01S5/0009;;G01S13/75;;G01S13/75;;G01S13/88;;Y02E10/72;;Y02E10/72,A01K11/00;;A01M29/00;;A01M31/00;;F03D15/00;;F03D17/00;;F03D80/00;;F04D15/00;;G01S13/75,,1,0,,,See references of WO 2012054313A1,ACTIVE
41,US,B2,US 9581165 B2,190-680-601-334-586,2017-02-28,2017,US 201113878810 A,2011-10-13,US 201113878810 A;;US 45534710 P;;US 2011/0056227 W,2010-10-19,Systems and methods for avian mitigation for wind farms,"A wildlife detection system includes a tracking device, a receiver, and a wildlife deterrent system. The tracking device may be mounted to a wildlife. The receiver is configured to track movement of the tracking device relative to an object of danger to the wildlife. The wildlife deterrent system is configured to reduce risk of danger to the wildlife in response to movement of the wildlife within a predetermined distance from the object of danger as tracked by the receiver.",BABBITT VICTOR;;OLIVER ANDREW G;;FINE JEFFREY W;;IVES DANIEL;;BRAND ALEXANDER D;;RENEWABLE ENERGY SYSTEMS AMERICAS INC,BABBITT VICTOR;;OLIVER ANDREW G;;FINE JEFFREY W;;IVES DANIEL;;BRAND ALEXANDER D,RENEWABLE ENERGY SYSTEMS AMERICAS INC (2013-04-01),https://lens.org/190-680-601-334-586,Granted Patent,yes,35,6,14,14,0,A01K11/008;;A01K35/00;;A01M29/00;;A01K11/006;;A01K11/006;;A01K11/008;;A01K11/008;;A01M29/00;;A01M29/00;;A01M31/002;;A01M31/002;;F03D80/00;;F04D15/0066;;F03D7/00;;F03D17/00;;F03D17/00;;F03D80/00;;F03D80/00;;G01S13/75;;G01S5/0009;;G01S13/75;;G01S13/75;;G01S13/88;;Y02E10/72;;Y02E10/72,F03D7/00;;A01K11/00;;A01M29/00;;A01M31/00;;F04D15/00;;G01S5/00;;G01S13/75;;G01S13/88,,1,0,,,"PCT International Search Report for PCT International Application No. PCT/US2011/056227, mailed Mar. 8, 2012.",INACTIVE
42,EP,B1,EP 2629601 B1,048-615-323-714-730,2017-04-12,2017,EP 11779013 A,2011-10-13,US 45534710 P;;US 2011/0056227 W,2010-10-19,SYSTEMS AND METHODS FOR AVIAN MITIGATION FOR WIND FARMS,,RENEWABLE ENERGY SYSTEMS AMERICAS INC,OLIVER ANDREW G;;BABBITT VICTOR;;FINE JEFFREY W;;IVES DANIEL;;BRAND ALEXANDER D,RENEWABLE ENERGY SYSTEMS AMERICAS INC. (2014-05-21),https://lens.org/048-615-323-714-730,Granted Patent,yes,1,0,14,14,0,A01K11/008;;A01K35/00;;A01M29/00;;A01K11/006;;A01K11/006;;A01K11/008;;A01K11/008;;A01M29/00;;A01M29/00;;A01M31/002;;A01M31/002;;F03D80/00;;F04D15/0066;;F03D7/00;;F03D17/00;;F03D17/00;;F03D80/00;;F03D80/00;;G01S13/75;;G01S5/0009;;G01S13/75;;G01S13/75;;G01S13/88;;Y02E10/72;;Y02E10/72,A01K11/00;;A01M29/00;;A01M31/00;;F03D15/00;;F03D17/00;;F03D80/00;;F04D15/00;;G01S13/75,,1,1,046-399-111-943-113,10.1126/science.325_386;;19628835,"ANDREW CURRY: ""Deadly Flights"", SCIENCE, vol. 325, no. 5939, 24 July 2009 (2009-07-24), pages 386 - 387, XP055265681, DOI: 10.1126/science.325_386",ACTIVE
43,ZA,B,ZA 201302592 B,086-183-220-373-293,2013-11-27,2013,ZA 201302592 A,2013-04-11,US 45534710 P;;US 2011/0056227 W,2010-10-19,SYSTEMS AND METHODS FOR AVIAN MITIGATION FOR WIND FARMS,,RENEWABLE ENERGY SYSTEMS AMERICAS INC,VICTOR BABBITT;;JEFFREY W FINE;;ALEXANDER D BRAND;;ANDREW G OLIVER;;DANIEL IVES,,https://lens.org/086-183-220-373-293,Granted Patent,no,0,0,14,14,0,A01K11/008;;A01K35/00;;A01M29/00;;A01K11/006;;A01K11/006;;A01K11/008;;A01K11/008;;A01M29/00;;A01M29/00;;A01M31/002;;A01M31/002;;F03D80/00;;F04D15/0066;;F03D7/00;;F03D17/00;;F03D17/00;;F03D80/00;;F03D80/00;;G01S13/75;;G01S5/0009;;G01S13/75;;G01S13/75;;G01S13/88;;Y02E10/72;;Y02E10/72,A01K/;;A01M/;;F03D/;;G01S/,,0,0,,,,ACTIVE
44,WO,A1,WO 2012/054313 A1,139-563-118-231-083,2012-04-26,2012,US 2011/0056227 W,2011-10-13,US 45534710 P,2010-10-19,SYSTEMS AND METHODS FOR AVIAN MITIGATION FOR WIND FARMS,"A wildlife detection system includes a tracking device, a receiver, and a wildlife deterrent system. The tracking device may be mounted to a wildlife. The receiver is configured to track movement of the tracking device relative to an object of danger to the wildlife. The wildlife deterrent system is configured to reduce risk of danger to the wildlife in response to movement of the wildlife within a predetermined distance from the object of danger as tracked by the receiver.",RENEWABLE ENERGY SYSTEMS AMERICAS INC;;BABBITT VICTOR;;OLIVER ANDREW G;;FINE JEFFREY W;;IVES DANIEL;;BRAND ALEXANDER D,BABBITT VICTOR;;OLIVER ANDREW G;;FINE JEFFREY W;;IVES DANIEL;;BRAND ALEXANDER D,,https://lens.org/139-563-118-231-083,Patent Application,yes,6,5,14,14,0,A01K11/006;;A01K11/008;;A01M29/00;;A01M31/002;;G01S13/75;;F03D80/00;;F03D17/00;;Y02E10/72;;F03D80/00;;A01K11/008;;A01K35/00;;A01M29/00;;G01S13/75;;F03D7/00;;G01S5/0009;;G01S13/88;;Y02E10/72;;A01K11/006;;A01K11/008;;A01M29/00;;A01M31/002;;G01S13/75;;F03D80/00;;F03D17/00;;F04D15/0066,A01K11/00;;A01M29/00;;F03D11/00;;G01S13/75,,0,0,,,,PENDING
45,CA,A1,CA 2814347 A1,007-005-502-728-841,2012-04-26,2012,CA 2814347 A,2011-10-13,US 45534710 P;;US 2011/0056227 W,2010-10-19,SYSTEMS AND METHODS FOR AVIAN MITIGATION FOR WIND FARMS,"A wildlife detection system includes a tracking device, a receiver, and a wildlife deterrent system. The tracking device may be mounted to a wildlife. The receiver is configured to track movement of the tracking device relative to an object of danger to the wildlife. The wildlife deterrent system is configured to reduce risk of danger to the wildlife in response to movement of the wildlife within a predetermined distance from the object of danger as tracked by the receiver.",RENEWABLE ENERGY SYSTEMS AMERICAS INC;;OLIVER ANDREW G,OLIVER ANDREW G;;BABBITT VICTOR;;FINE JEFFREY W;;IVES DANIEL;;BRAND ALEXANDER D,,https://lens.org/007-005-502-728-841,Patent Application,no,0,0,14,14,0,A01K11/008;;A01K35/00;;A01M29/00;;A01K11/006;;A01K11/006;;A01K11/008;;A01K11/008;;A01M29/00;;A01M29/00;;A01M31/002;;A01M31/002;;F03D80/00;;F04D15/0066;;F03D7/00;;F03D17/00;;F03D17/00;;F03D80/00;;F03D80/00;;G01S13/75;;G01S5/0009;;G01S13/75;;G01S13/75;;G01S13/88;;Y02E10/72;;Y02E10/72,A01K11/00;;A01M29/00;;F03D11/00;;G01S13/75,,0,0,,,,DISCONTINUED
46,GB,B,GB 2498666 B,184-501-609-792-676,2015-08-12,2015,GB 201306929 A,2011-10-13,US 2011/0056227 W;;US 45534710 P,2010-10-19,Systems and methods for Avian mitigation for wind farms,,RENEWABLE ENERGY SYSTEMS AMERICANS INC,BABBITT VICTOR;;FINE JEFFREY W;;IVES DANIEL;;BRAND ALEXANDER D;;OLIVER ANDREW G,,https://lens.org/184-501-609-792-676,Granted Patent,no,7,0,14,14,0,A01K11/008;;A01K35/00;;A01M29/00;;A01K11/006;;A01K11/006;;A01K11/008;;A01K11/008;;A01M29/00;;A01M29/00;;A01M31/002;;A01M31/002;;F03D80/00;;F04D15/0066;;F03D7/00;;F03D17/00;;F03D17/00;;F03D80/00;;F03D80/00;;G01S13/75;;G01S5/0009;;G01S13/75;;G01S13/75;;G01S13/88;;Y02E10/72;;Y02E10/72,A01K35/00;;A01K11/00;;A01M29/00;;F03D11/00;;G01S13/75,,0,0,,,,INACTIVE
47,US,B2,US 10768184 B2,037-085-078-364-751,2020-09-08,2020,US 201916536088 A,2019-08-08,US 201916536088 A;;GB 201310664 A;;US 201916246091 A;;US 201514898321 A;;GB 2014000233 W,2013-06-14,Methods for increasing palatability of pet foodstuff,The present invention relates to a method of identifying a compound that binds to or modulates the activity of one or more polypeptides encoding one or more receptors that are involved in the detection and perception of fatty acids.,MARS INC,KLEBANSKY BORIS;;MCGRANE SCOTT JOSEPH;;TAYLOR ANDREW JOHN;;GIBBS MATTHEW RONALD;;FINE RICHARD MASTEN,MARS INCORPORATED (2017-05-25),https://lens.org/037-085-078-364-751,Granted Patent,yes,19,0,26,26,14,C07K14/705;;C07K14/70596;;G01N33/566;;G01N2333/70596;;G01N2333/726;;G16B35/00;;G16C20/60;;G16C20/64;;C07K14/705;;C07K14/70596;;G01N33/566;;G16C20/64;;G16B35/00;;G16C20/60;;C07K14/705;;C07K14/70596;;G01N33/566;;G01N2333/70596;;G01N2333/726;;G16C20/64;;C07C53/126;;C07C57/03;;C07K2319/00;;G01N33/74,G01N33/74;;C07C53/126;;C07C57/03;;C07K14/705;;G01N33/566;;G16B35/00;;G16C20/60;;G16C20/64,,30,18,088-157-299-850-470;;025-509-743-864-694;;056-201-471-905-934;;028-862-168-091-90X;;104-322-730-003-071;;015-737-885-035-500;;001-768-314-430-105;;065-623-309-621-577;;019-779-601-634-917;;013-181-635-285-001;;015-981-364-551-336;;026-164-216-541-151;;114-793-231-053-713;;085-764-009-624-439;;064-816-888-267-051;;043-536-031-861-192;;032-694-419-826-363;;074-988-743-588-202,16276419;;pmc1265871;;10.1172/jci25299;;10.1194/jlr.m021873;;22210925;;pmc3276480;;2231712;;10.1006/jmbi.1990.9999;;10.1016/s0022-2836(05)80360-2;;10.1093/nar/25.17.3389;;9254694;;pmc146917;;pmc6634626;;10.1523/jneurosci.0496-10.2010;;20573884;;18162488;;10.1096/fj.07-8415com;;10.1093/chemse/bjr069;;21868624;;10.1007/s00210-009-0425-9;;19471906;;pmc46825;;8390686;;10.1073/pnas.90.12.5873;;10.1073/pnas.87.6.2264;;2315319;;pmc53667;;10.1371/journal.pone.0024014;;pmc3162022;;21901153;;3382986;;10.1093/bioinformatics/4.1.11;;10.1016/s0092-8674(01)00451-2;;11509186;;10.1073/pnas.85.8.2444;;pmc280013;;3162770;;10.1021/jm300215x;;22519963;;10.1124/mol.110.066324;;20685848;;19007110;;10.1021/jm800970b;;10.1093/bioinformatics/10.1.3;;8193952,"Laugerette et al. CD36 involvement in orosensory detection of dietary lipids, spontaneous fat preference, and digestive secretions, Nov. 2005, The Journal of Clinical Investigation 115(11):3177-3184 (Year: 2005).;;Pepino et al., The fatty acid translocase gene CD36 and lingual lipase influence oral sensitivity to fat in obese subjects, 2012, Journal of Lipid Research 53:561-566 (Year: 2012).;;Uniprot: “Sequence UPI00004BCC30”, [online], Dec. 9, 2004, [*], <URL: http://www.uniprot.org/uniparc/UPI00004BCC30>, 2 pgs.;;Uniprot: “Sequence UPI00005A4EBB”, [online], Apr. 26, 2012 [*], <URL: http://www.uniprot.org/uniparc/UPI00005A4EBB, 1 pg.;;Uniprot: “Sequence UPI0002988ED2”, [online], Nov. 7, 2012, [*]<URL: http://www.uniprot.org/uniparc/UPI0002988ED2> 1 pg.;;Uniprot: “Sequence UPI0002989000”, [online], Nov. 7, 2012, [*] <URL: http://www.uniprot.org/uniparc/UPI0002989000>, 2 pgs.;;Uniprot: M3WCE6 “Sequence UPI0002989000”, [online], Nov. 7, 2012, [*]<URL: http://www.uniprot.org/uniparc/UPI0002989000>, 2 pgs.;;Uniprot: NP_001245268, “Sequence UPI00005A4EBB”, [online], Apr. 26, 2012, [*], <URL: http://www.uniprot.org/uniparc/UPI00005A4EBB, 2 pgs.;;“XP_003982755.1, CD36 Protein with SEQ ID No. 3 Feb. 15, 2013”, Retrieved from: https://www.ncbi.nlm.nih.gov/protein/410952168?sat=18&satkey=3322721, 1 page, Feb. 15, 2013.;;Altschul, et al., “Basic Local Alignment Search Tool”, J. Mol. Biol., Oct. 1990, 215, 403-410.;;Altschul, et al., “Gapped BLAST and PSI-BLAST: A New Generation of Protein Database Search Programs”, Nucleic Acids Research, Sep. 1997, vol. 25, No. 17, pp. 3389-3402.;;Cartoni, et al., “Taste Preference for Fatty Acids is Mediated by GPR40 and GPR120”, Journal of Neuroscience, vol. 30, No. 25, pp. 8376-8382 (Jun. 23, 2010).;;Di Palma, et al., “M3Z0H4_MUSPF”, May 1, 2013 (May 1, 2013), XP055472512, Retrieved from the Internet: URL: http://www.uniprot.org/uniprot/M3Z0H4.txt?version=2, 2 pgs.;;Fushiki, Nutritional physiological study regarding oil preference, Heisei 25 (2013), The Proceedings of the Japan Society for Bioscience, Biotechnology, and Agrochemistry Prize Winner Lecture, Japan, 8 pgs.(with translation).;;Gaillard, et al., “The Gustatory Pathway is Involved in CD36-Mediated Orosensory Perception of Long-Chain Fatty Acids in the Mouse”, The FASEB Journal, May 2008, 2(5):1458-1468.;;Galindo, et al., “G-Protein-Coupled Receptors in Human Fat Taste Perception”, Chem. Senses, 37:123-139, Feb. 2012.;;Hara, “Novel Selective Ligands for Free Fatty Acid Receptors GPR120 and GPR40”, Naunyn-Schmied Arch. Pharmacol. (Sep. 2009), 380:247-255.;;Hirasawa, et al., Free fatty acid receptors and drug discovery, Ligand search for fatty acid receptors, Clarification and drug discovery application of a physiological function, Jrnl of Clinical and Experimental Medicine, Japan,May 29, 2010, 233(9), p. 755-760 (Abstract only).;;Karlin, et al., “Applications and Statistics for Multiple High-Scoring Segments in Molecular Sequences”, Proc. Natl. Acad. Sci. USA vol. 90 pp. 5873-5877, Jun. 1993.;;Karlin, et al., “Methods for Assessing the Statistical Significance of Molecular Sequence Features by Using General Scoring Schemes”, Proc. Natl. Acad. Sci. USA, vol. 87, pp. 2264-2268, Mar. 1990.;;Kuda, “Lysine 164 of CD36 is Important for Fatty Acid Uptake and Signaling to Calcium”, J. Biol. Chem., Apr. 2013, 19 pages.;;Martin, et al., “The Lipid-Sensor Candidates CD36 and GPR120 are Differentially Regulated by Dietary Lipids in Mouse Taste Buds: Impact on Spontaneous Fat Preference”, PLoS One, Aug. 2011, 6(8):e24014, 1-10.;;Myers, et al., “Optical Alignments in Linear Space”, Comput. Appl. Biosci., Mar. 1988, 4(1):11-7, Abstract Only (1 pg.).;;Nelson, et al., “Mammalian Sweet Taste Receptors”, Cell, vol. 106, p. 381-390, Aug. 10, 2001.;;Pearson, et al., “Improved Tools for Biological Sequence Comparison”, Proc. Natl. Acad. Sci. USA, 85:2444-8, Apr. 1988.;;Pontius, et al., “UNITPROT:M2WCE6”, Genome Research, May 1, 2013, XP55472511, Retrieved from the Internet: URL: http://www.uniprot.org/uniprot/M3WCE6, 2 pgs., Jan. 5, 2013.;;Shimpukade, et al., “Discovery of a Potent and Selective GPR120 Agonist”, Journal of Medicinal Chemistry, vol. 55, No. 9, pp. 4511-4515 (Apr. 23, 2012).;;Sun, et al., “Structure-Activity Relationships of GPR120 Agonists Based on a Docking Simulation”, Molecular Pharmacology, vol. 78, No. 5, Nov. 1, 2010, pp. 804-810, ZP055122562.;;Suzuki, et al., “Identification of G Protein-Coupled Receptor 120 Selective Agonists Derived from PPAR-gamma Agonists”, J. Med. Chem., Nov. 2008, 51, 7640-7644.;;Torelli, et al., “Advance and Adam: two algorithms for the analysis of global similarity between homologous informational sequences”, Comput. Appl. Biosci., 10:3-5 (Feb. 1994).",ACTIVE
48,CA,A1,CA 2968004 A1,046-913-943-329-772,2016-06-16,2016,CA 2968004 A,2015-12-10,US 201462090138 P;;US 2015/0065067 W,2014-12-10,METHODS FOR MODULATING TASTE RECEPTORS,"Amino acids present in domains of an umami taste receptor are described herein, wherein the amino acids interact with at least one nucleotide derivative and/or at least one transmembrane compound that potentiates, modulates, increases, and/or enhances the activity of the umami receptor. Such compounds can be used in flavor compositions to enhance the umami taste and/or palatability of food products.",MARS INC,MCGRANE SCOTT JOSEPH;;TAYLOR ANDREW JOHN;;FINE RICHARD MASTEN;;KLEBANSKY BORIS;;GIBBS MATTHEW RONALD,,https://lens.org/046-913-943-329-772,Patent Application,no,0,0,46,46,4,A23K20/132;;A23K20/142;;A23K20/153;;A23K50/42;;A23K50/48;;A23K20/111;;A23L27/88;;A23L27/204;;A23V2002/00;;A23K20/111;;A23K20/142;;A23K20/132;;A23K20/153;;A23K50/42;;A23K50/48;;A23L27/88;;A23L27/204;;A23L27/21;;A23L27/23;;A23K20/111;;A23K20/132;;A23K20/142;;A23K20/153;;A23K50/42;;A23K50/48;;A23L27/21;;A23L27/22;;A23L27/23;;A23L27/204;;A23L27/235;;A23L27/88;;A23K50/40;;A23K20/132;;A23K20/153;;A23K50/42;;A23K50/48;;A23L27/88;;A23L27/204;;A23K20/111;;A23K20/142;;A23L27/21;;A23L27/23;;A23L27/22;;A23L27/235;;A23V2002/00,A23K50/40;;A23K20/00;;A23K20/153;;A23L27/20;;A23L27/23;;C07K14/705,,0,0,,,,PENDING
49,RU,C2,RU 2740310 C2,027-514-376-433-444,2021-01-13,2021,RU 2017123818 A,2015-12-10,US 201462090138 P;;US 2015/0065067 W,2014-12-10,METHODS FOR MODULATION OF TASTE RECEPTORS,"FIELD: biotechnology.SUBSTANCE: invention represents a method for enhancing feline umami receptor activity, comprising contacting a composition comprising an amino acid and a nucleotide or nucleotide derivative, with feline umami receptor, wherein the composition interacts in a site of interaction of the feline umami receptor with one or more amino acids selected from a group consisting of Ser172, Thr149, Thr148, Glu301, Tyr220, Glu170, Asp302, His71, Arg277, His308, Ser306, Ser384, Ala380, His47, Asn69, Asp302, Met383, Ser385, Ile309, Ser107, Asp49 and combinations thereof.EFFECT: methods for modulation of taste receptors are proposed.28 cl, 84 dwg, 27 tbl, 9 ex",MARS INC,MCGRANE SCOTT JOSEPH;;TAYLOR ANDREW JOHN;;FINE RICHARD MASTEN;;KLEBANSKY BORIS;;GIBBS MATTHEW RONALD,,https://lens.org/027-514-376-433-444,Granted Patent,no,2,0,46,46,0,A23K20/132;;A23K20/142;;A23K20/153;;A23K50/42;;A23K50/48;;A23K20/111;;A23L27/88;;A23L27/204;;A23V2002/00;;A23K20/111;;A23K20/142;;A23K20/132;;A23K20/153;;A23K50/42;;A23K50/48;;A23L27/88;;A23L27/204;;A23L27/21;;A23L27/23;;A23K20/111;;A23K20/132;;A23K20/142;;A23K20/153;;A23K50/42;;A23K50/48;;A23L27/21;;A23L27/22;;A23L27/23;;A23L27/204;;A23L27/235;;A23L27/88;;A23K50/40;;A23K20/132;;A23K20/153;;A23K50/42;;A23K50/48;;A23L27/88;;A23L27/204;;A23K20/111;;A23K20/142;;A23L27/21;;A23L27/23;;A23L27/22;;A23L27/235;;A23V2002/00,A23K50/40,,0,0,,,,ACTIVE
50,US,A1,US 2019/0361039 A1,026-454-184-610-794,2019-11-28,2019,US 201916536088 A,2019-08-08,US 201916536088 A;;GB 201310664 A;;US 201916246091 A;;US 201514898321 A;;GB 2014000233 W,2013-06-14,METHODS FOR INCREASING PALATABILITY OF PET FOODSTUFF,The present invention relates to a method of identifying a compound that binds to or modulates the activity of one or more polypeptides encoding one or more receptors that are involved in the detection and perception of fatty acids.,MARS INC,MCGRANE SCOTT JOSEPH;;TAYLOR ANDREW JOHN;;GIBBS MATTHEW RONALD;;FINE RICHARD MASTEN;;KLEBANSKY BORIS,MARS INCORPORATED (2017-05-25),https://lens.org/026-454-184-610-794,Patent Application,yes,0,0,26,26,14,C07K14/705;;C07K14/70596;;G01N33/566;;G01N2333/70596;;G01N2333/726;;G16B35/00;;G16C20/60;;G16C20/64;;C07K14/705;;C07K14/70596;;G01N33/566;;G16C20/64;;G16B35/00;;G16C20/60;;C07K14/705;;C07K14/70596;;G01N33/566;;G01N2333/70596;;G01N2333/726;;G16C20/64;;C07C53/126;;C07C57/03;;C07K2319/00;;G01N33/74,G01N33/74;;C07C53/126;;C07C57/03;;C07K14/705;;G01N33/566;;G16B35/00;;G16C20/60;;G16C20/64,,0,0,,,,ACTIVE
51,WO,A3,WO 2008/086067 A3,028-719-025-323-759,2008-11-20,2008,US 2008/0050066 W,2008-01-03,US 62020107 A,2007-01-05,HOLDING AND USING AN ELECTRONIC PEN AND PAPER,"A housing contains electronics used in determining locations of a writing instrument based on wireless signals, defines a chamber in which the writing instrument may be held when not in use, and includes a retention element to retain the writing instrument from falling out of the chamber. In general, in one aspect, a writing instrument includes an elongate pen body, an electrical contact on a surface of the pen body, and a light source disposed near an end of the pen body. The light source includes a light guide having an optically conductive portion and an optically reflective portion.",CANDLEDRAGON INC;;PITTEL ARKADY;;ELEKTROV STANISLAV V;;GOLDMAN ANDREW M;;FINE LAWRENCE;;GOLDENBERG EUGENE;;PITTEL ILYA,PITTEL ARKADY;;ELEKTROV STANISLAV V;;GOLDMAN ANDREW M;;FINE LAWRENCE;;GOLDENBERG EUGENE;;PITTEL ILYA,,https://lens.org/028-719-025-323-759,Search Report,yes,4,0,4,4,0,B43K23/001;;B43K23/001;;B43K23/02;;B43K23/02;;B43K23/08;;B43K23/08;;B43K29/10;;B43K29/10;;G06F3/03545;;G06F3/03545,G06F3/033,,0,0,,,,PENDING
