74,US,B2,US 11185100 B2,044-249-473-663-761,2021-11-30,2021,US 201515534434 A,2015-12-10,US 201515534434 A;;US 201462090138 P;;US 2015/0065067 W,2014-12-10,Methods for modulating taste receptors,"Amino acids present in domains of an umami taste receptor are described herein, wherein the amino acids interact with at least one nucleotide derivative and/or at least one transmembrane compound that potentiates, modulates, increases, and/or enhances the activity of the umami receptor. Such compounds can be used in flavor compositions to enhance the umami taste and/or palatability of food products.",MARS INC,MCGRANE SCOTT JOSEPH;;TAYLOR ANDREW JOHN;;FINE RICHARD MASTEN;;KLEBANSKY BORIS;;GIBBS MATTHEW RONALD,MARS INCORPORATED (2017-05-24),https://lens.org/044-249-473-663-761,Granted Patent,yes,93,0,46,46,4,A23K20/132;;A23K20/142;;A23K20/153;;A23K50/42;;A23K50/48;;A23K20/111;;A23L27/88;;A23L27/204;;A23V2002/00;;A23K20/111;;A23K20/142;;A23K20/132;;A23K20/153;;A23K50/42;;A23K50/48;;A23L27/88;;A23L27/204;;A23L27/21;;A23L27/23;;A23K20/111;;A23K20/132;;A23K20/142;;A23K20/153;;A23K50/42;;A23K50/48;;A23L27/21;;A23L27/22;;A23L27/23;;A23L27/204;;A23L27/235;;A23L27/88;;A23K50/40;;A23K20/132;;A23K20/153;;A23K50/42;;A23K50/48;;A23L27/88;;A23L27/204;;A23K20/111;;A23K20/142;;A23L27/21;;A23L27/23;;A23L27/22;;A23L27/235;;A23V2002/00,A23L27/23;;A23K20/111;;A23K20/132;;A23K20/142;;A23K20/153;;A23K50/42;;A23K50/48;;A23L27/00;;A23L27/20;;A23L27/21;;A23L27/22,,101,42,097-923-284-986-427;;098-722-813-286-166;;018-478-883-712-542;;003-249-569-284-849;;104-322-730-003-071;;005-059-809-125-448;;055-257-931-301-944;;034-460-436-650-41X;;016-821-974-075-529;;147-501-527-880-670;;019-575-005-148-934;;052-259-667-172-062;;064-816-888-267-051;;043-578-978-192-222;;072-250-039-322-319;;049-533-002-254-769;;129-923-609-845-358;;031-023-247-552-867;;097-923-284-986-427;;037-756-253-428-172;;052-218-141-470-099;;015-740-822-611-627;;014-077-783-276-576;;039-556-771-082-497;;022-504-179-666-950;;094-742-476-378-715;;015-981-364-551-336;;008-278-323-798-991;;050-061-272-649-958;;083-302-361-577-505;;079-975-993-799-001;;191-411-585-955-892;;160-742-738-587-018;;058-364-861-504-473;;062-090-930-361-891;;081-678-005-964-739;;057-881-642-933-808;;038-388-764-020-400;;072-449-883-895-911;;095-178-865-100-620;;146-214-003-575-01X;;013-974-775-574-366,pmc2606899;;19104071;;10.1073/pnas.0810174106;;10.1021/jf103849e;;21162577;;pmc102472;;10592235;;10.1093/nar/28.1.235;;10.1074/jbc.m211495200;;12496284;;pmc6634626;;10.1523/jneurosci.0496-10.2010;;20573884;;10.1038/nature13396;;25042998;;10.1016/j.neuroscience.2013.06.043;;23831422;;10.1002/jhet.5570240136;;10.1093/chemse/27.8.739;;12379598;;10.1038/35039564;;11069170;;20961679;;10.1016/j.bpc.2010.09.001;;pmc1698869;;10.1016/j.physbeh.2006.05.033;;16782140;;10.1021/jm300215x;;22519963;;pmc3873546;;10.1074/jbc.m113.494443;;24214976;;24603153;;10.1126/science.1249489;;pmc3991565;;pmc521102;;10.1073/pnas.0404384101;;15353592;;pmc4428668;;10.1038/nmeth.3213;;25549265;;10.1016/0006-8993(86)91577-5;;3008926;;pmc2606899;;19104071;;10.1073/pnas.0810174106;;16301204;;10.1093/bioinformatics/bti770;;3914646;;10.1016/0163-7258(85)90017-8;;8386298;;10.1016/0076-6879(93)17092-j;;24860101;;10.1074/jbc.m114.561449;;pmc4106347;;10.1111/j.1749-6632.1998.tb10597.x;;9929631;;10.1093/jn/136.7.1932s;;16772462;;pmc2063449;;8474352;;10.1016/0076-6879(93)17091-i;;10.1371/journal.pone.0024014;;pmc3162022;;21901153;;10.2210/pdb3sn6/pdb;;pmc3184188;;21772288;;10.1038/nature10361;;22437504;;pmc3356457;;10.1038/nature10939;;pmc3074590;;20929726;;10.1126/science.1194396;;pmc4526412;;10.1016/j.str.2015.06.007;;26190572;;10.1093/chemse/1.4.495;;10.3758/bf03326850;;10.1021/ja01651a049;;18181569;;10.1021/jf072803c;;21770456;;10.1021/jf202202h;;10.1530/jme-14-0003;;25008074;;10.1097/wnr.0b013e328308b36c;;18628659;;25375264;;10.1021/jf504686s;;10.1016/j.ejmech.2011.01.035;;21324566;;10.1021/ja00228a040;;25331670;;10.1007/s12013-014-0141-z,"Zhang et al., Molecular mechanism for the umami taste synergism. PNAS Dec. 30, 2008 105 (52) 20930-20934.;;Festring et al., Systematic Studies on the Chemical Structure and Umami Enhancing Activity of Maillard-Modified Guanosine 50-Monophosphates. J. Agric. Food Chem. 59: 665-676, 2011.;;Berman, et al., Nucleic Acids Research, vol. 28, p. 235-242 (Jan. 2000).;;Briscoe, et al., “The orphan G Protein-coupled Receptor GPR40 is Activated by Medium and Long Chain Fatty Acids”, Journal of Biological Chemistry, American Society for Biochemistry and Molecular Biology, vol. 278, No. 13, pp. 11303-11311 (Mar. 28, 2003).;;Cartoni, et al., “Taste Preference for Fatty Acids is Mediated by GPR40 and GPR120”, Journal of Neuroscience, vol. 30, No. 25, pp. 8376-8382 (Jun. 23, 2010).;;Dore, et al., “Structure of class C GPCR metabotropic glutamate receptor 5 transmembrane domain”, Nature Jul. 31, 2014; 511(7511):557-62, Epub Jul. 6, 2014, Abstract Only (2 pgs.).;;Eswar, et al., “Comparative Protein Structure Modeling Using Modeller”, Curr Protoc Bioinformatics, Supplement 15, 5.6.1-5.6.30, 47 pages (Oct. 2006).;;Godinot, et al., “Activation of tongue-expressed GPR40 and GPR120 by non-caloric agonists is not sufficient to drive preference in mice”, Neuroscience, vol. 250, pp. 20-30 (Jul. 2013).;;Jovanovic, et al., “Substituent and solvent effects on tautomeric equilibria of barbituric acid derivatives isoterically related compounds”, Journal of Heterocyclic Chemistry, vol. 24, No. 1, pp. 191-204 (Jan. 1, 1987).;;Kawai, et al., “Taste Enhancements Between Various Amino Acids and IMP”, Chemical Senses and Flavor, vol. 27, No. 8, pp. 739-745 (Oct. 1, 2002).;;Kunishima, et al., Nature, vol. 407, p. 971-977 (Oct. 2000).;;Lopez-Cascales, et al., “Binding of glutamate to the umami receptor”, Biophysical Chemistry, North-Holland, Amsterdam, NL, vol. 152, No. 1-3, pp. 139-144 (Nov. 1, 2010).;;Reed, et al., “Diverse tastes: Genetics of Sweet and Bitter Perception”, Physiology and Behavior, Elsevier Science, Ltd., Oxford, GB, vol. 88, No. 3, pp. 215-226 (Jun. 30, 2006).;;Shimpukade, et al., “Discovery of a Potent and Selective GPR120 Agonist”, Journal of Medicinal Chemistry, vol. 55, No. 9, pp. 4511-4515 (Apr. 23, 2012).;;Toda, et al., “Two Distinct Determinants of Ligan Specificity in T1R1/T1R3 (the Umami Taste Receptor)”, The Journal of Biological Chemistry, vol. 288, No. 52, pp. 36863-36877, Dec. 27, 2013.;;Wu, et al., “Structure of a Class C GPCR Metabotropic Glutamate Receptor 1 Bound to an Allosteric Modulator”, Science, Apr. 4, 2014; vol. 344, p. 58-64.;;Xu, et al., “Different Functional Roles of TiR Subunits in the Heteromeric Taste Receptors”, Proceedings of the National Academy of Sciences, National Academy of Sciences, vol. 101, No. 39, pp. 14258-14263 (Sep. 28, 2004).;;Yang, et al., Nat. Methods vol. 12:7-8 (Jan. 2015).;;Yoshii, et al., “Synergisitic Effects of 5′-Nucleotides on Rat Taste Responses to Various Amino Acids”, Brain Research, Faculty of Pharmaceutical Sciences, Hokkaido Univ., 367 (1986), 45-51, Accepted Jul. 2, 1985.;;Zhang, et al., “Molecular mechanism for the umami taste synergism”, Proceedings of the National Academy of Sciences, vol. 105, No. 52, pp. 20930-20934 (Dec. 30, 2008).;;U.S. Appl. No. 15/534,413 (US2018/0168208), filed Jun. 8, 2017 (Dec. 28, 2017).;;U.S. Appl. No. 15/534,421, filed Jun. 8, 2017.;;U.S. Appl. No. 15/534,440, filed Jun. 8, 2017.;;International Search Report dated Apr. 5, 2016 in International Application No. PCT/US2015/065046.;;International Search Report dated Aug. 2, 2016 in International Application No. PCT/US2015/065036.;;International Search Report dated Jul. 19, 2016 in International Application No. PCT/US2015/065106.;;International Search Report dated Jun. 30, 2016 in International Application No. PCT/US2015/065067.;;“Sarcosine—Wikipedia”, Oct. 23, 2014, https://en.wikipedia.org/w/index.php?titile=Sarcosine&oldid=630844266, 8 pgs.;;Arnold, et al., “The Swiss Model Workspace: A Web-Based Environment for Protein Structure Homology Modelling”, Bioinformatics, vol. 22, pp. 195-201 (Jan. 2005).;;Cline, “Perspectives for Gene Therapy: Inserting New Genetic Information into Mammalian Cells by Physical Techniques and Viral Vectors”, Pharmac. Ther., vol. 29, pp. 69-92, 1985.;;Cotten, et al., “Receptor-Mediated Transport of DNA into Eurkaryotic Cells”, Methods in Enzymology, vol. 217 (1993), pp. 618-644.;;Hudson, et al., “The Molecular Basis of Ligand Interaction at Free Fatly Acid Receptor 4 (FFA4/GPR120)”, The Journal of Biological Chemistry, vol. 289, pp. 20345-20358, Jul. 2014.;;Kurihara, et al., “Introductory Remarks on Umami Taste”, Annals of the New York Academy of Sciences, vol. 855, Nov. 1998, pp. 393-397.;;Li, et al., “Cats Lack a Sweet Taste Receptor”, The Journal of Nutrition, 136(7 Suppl):1932S-1934S, Jul. 2006.;;Loeffler, et al., “Gene Transfer into Primary and Established Mammalian Cell Lines with Lipopolyamine-Coated DNA”, Methods in Enzymology, vol. 217 (Mar. 1993), 599-618.;;Martin, et al., “The Lipid-Sensor Candidates CD36 and GPR120 are Differentially Regulated by Dietary Lipids in Mouse Taste Buds: Impact on Spontaneous Fat Preference”, PLoS One, Aug. 2011, 6(8):e24014, 1-10.;;Rasmussen, et al., “Crystal Structure of the Beta Adrenergic Receptor-Gs Protein Complex”, Nature, (Jul. 2011) 477: 549-555.;;Wu, et al., “Structure of the Human Kappa Opioid Receptor in Complex with JDTic”, Nature, (Mar. 2012) 485:327-332.;;Wu, et al., “Structures of the CXCR4 Chemokine Receptor in Compex with Small Molecule and cyclic Peptide Antagonists”, Science, (Nov. 2010), 330:1066-1071.;;Zhang, et al., “GPCR-I-TASSER: A Hybrid Approach to G Protein Coupled Receptor Structure Modeling and the Application to the Human Genome”, Structure, Aug. 2015, 23(8):1538-1549.;;EP Search Report dated Jun. 6, 2013 in EP Application No. 12190902.2, 12 pgs.;;EP Search Report dated Jun. 6, 2013 received in connection with EP Application No. 12190901.4, 11 pgs.;;EP Search Report dated May 31, 2013 received in connection with EP Application No. 12190888.3, 10 pgs.;;Final Office Action dated Sep. 7, 2018 for U.S. Appl. No. 14/438,819, 32 pages.;;Final Office Action dated Sep. 7, 2018 for U.S. Appl. No. 14/438,827, 32 pages.;;Final Office Action dated Sep. 7, 2018 for U.S. Appl. No. 14/438,834, 31 pages.;;International Preliminary Report on Patentability dated May 5, 2015 in connection with PCT/EP2013/072788, 8 pages.;;International Preliminary Report on Patentability dated May 5, 2015 in connection with PCT/EP2013/072789, 8 pages.;;International Preliminary Report on Patentability dated May 5, 2015 in connection with PCT/EP2013/072790, 8 pages.;;International Preliminary Report on Patentability dated May 5, 2015 in connection with PCT/EP2013/072794, 8 pages.;;International Search Report dated Feb. 7, 2014 in PCT/EP2013/072788, 5 pages.;;International Search Report dated Feb. 6, 2014 in connection with PCT/EP2013/072789. 5 pages.;;International Search Report dated Feb. 6, 2014 in connection with PCT/EP2013/072790, 5 pages.;;International Search Report dated Mar. 4, 2014 in connection with PCT/EP2013/072794, 5 pages.;;Invitation to Pay Additional Fees Annex dated Apr. 1, 2016 in International Application No. PCT/US2015/065106.;;USPTO Prosecution History (Office Actions dated Jun. 18, 2017) for U.S. Appl. No. 14/438,819, filed Apr. 27, 2015, 33 pgs.;;USPTO Prosecution History (Office Actions dated Jun. 18, 2017) for U.S. Appl. No. 14/438,811, filed Apr. 27, 2015, 27 pgs.;;USPTO Prosecution History (Office Actions dated Jun. 18, 2017) for U.S. Appl. No. 14/438,827, filed Apr. 27, 2015, 34 pages.;;USPTO Prosecution History (Office Actions dated Jun. 18, 2017) for U.S. Appl. No. 14/438,834, filed Apr. 27, 2015, 34 pages.;;USPTO Prosecution History, Final Office Action dated Sep. 7, 2018, U.S. Appl. No. 14/438,811, 37 pages.;;USPTO Prosecution History, Non-Final Office Action dated Feb. 7, 2018, U.S. Appl. No. 14/438,811, 32 pages.;;USPTO Prosecution History, Non-Final Office Action dated Feb. 7, 2018, U.S. Appl. No. 14/438,819, 53 pages.;;USPTO Prosecution History, Non-Final Office Action dated Feb. 7, 2018, U.S. Appl. No. 14/438,827, 53 pages.;;USPTO Prosecution History, Non-Final Office Action, dated Feb. 7, 2018, U.S. Appl. No. 14/438,834, 54 pages.;;USPTO Prosecution History, Response to Non-Final Office Action dated Aug. 7, 2018, U.S. Appl. No. 14/438,811, 67 pages.;;USPTO Prosecution History, Response to Non-Final Office action dated Aug. 7, 2018, U.S. Appl. No. 14/438,819, 26 pages.;;USPTO Prosecution History, Response to Non-Final Office Action dated Aug. 7, 2018, U.S. Appl. No. 14/438,827, 27 pages.;;USPTO Prosecution History, Response to Non-Final Office Action, dated Aug. 7, 2018, U.S. Appl. No. 14/438,834, 25 pages.;;USPTO Prosecution History, U.S. Appl. No. 14/438,811, Jan. 8, 2018 Amendment and Request for Continued Examination (RCE), 23 pages.;;USPTO Prosecution History, U.S. Appl. No. 14/438,811, Mar. 29, 2017 Restriction Requirement, 7 pages.;;USPTO Prosecution History, U.S. Appl. No. 14/438,811, May 19, 2017 Non-Final Office Action, 13 pages.;;USPTO Prosecution History, U.S. Appl. No. 14/438,811, May 4, 2017 Response to Restriction Requirement, 13 pages.;;USPTO Prosecution History, U.S. Appl. No. 14/438,811, Aug. 18, 2017 Response to Non-Final Office Action, 15 pages.;;USPTO Prosecution History, U.S. Appl. No. 14/438,811, Sep. 12, 2017 Final Office Action, 14 pages.;;USPTO Prosecution History, U.S. Appl. No. 14/438,819, Jan. 8, 2018 Amendment and Request for Continued Examination (RCE), 26 pages.;;USPTO Prosecution History, U.S. Appl. No. 14/438,819, Mar. 23, 2017 Restriction Requirement, 9 pages.;;USPTO Prosecution History, U.S. Appl. No. 14/438,819, May 19, 2017 Non-Final Office Action, 16 pages.;;USPTO Prosecution History, U.S. Appl. No. 14/438,819, May 5, 2017 Response to Restriction Requirement, 16 pages.;;USPTO Prosecution History, U.S. Appl. No. 14/438,819, Aug. 18, 2017 Response to Non-Final Office Action, 19 pages.;;USPTO Prosecution History, U.S. Appl. No. 14/438,819, Sep. 8, 2017 Final Office Action, 19 pages.;;USPTO Prosecution History, U.S. Appl. No. 14/438,834, Jan. 8, 2018 Amendment and Request for Continued Examination (RCE), 24 pgs.;;USPTO Prosecution History, U.S. Appl. No. 14/438,834, Mar. 23, 2017 Restriction Requirement, 9 pages.;;USPTO Prosecution History, U.S. Appl. No. 14/438,834, May 4, 2017 Response to Restriction Requirement, 15 pages.;;USPTO Prosecution History, U.S. Appl. No. 14/438,834, Aug. 18, 2017, Response to Non-Final Office Action, 18 pages.;;USPTO Prosecution History, U.S. Appl. No. 14/438,834, Sep. 11, 2017, Final Office Action, 18 pgs.;;“The Chemistry of Beef Flavor, Executive Summary”, Cattleman's Beef Board, May 2007, 16 pages.;;Boudreau, et al., “Chemical Stimulus Determinants of Cat Geniculate Ganglion Chemoresponsive Grou II Unit Discharge”, Chemical Senses and Flavor, Reidel, Dordrecht, NL, vol. 1, No. 4, Jan. 1, 1975, pp. 495-517.;;Taylor, “Food Flavour Technology”, John Wiley & Sons, Ltd., Publication, Jan. 2010, pp. 96-97.;;White, et al., “Taste Preferences of the Cat for Neuro Physiologically Active Compounds”, Physiological Psychology, vol. 3., No. 4, Jan. 1, 1975, pp. 405-410.;;Erlanger, et al., Improved Synthesis of Amino Acid Benzyl Esters, J. Am. Chem. Soc., Nov. 1954, pp. 5781-5782, vol. 76, Issue 22.;;Machine Translation of Chlorella Ind Co, JP4642932 B, Dec. 1971, 2 pages.;;Cairoli, Paola, et al., Studies on Umami Tast. Synthesis of New Guanosine 5′-Phasphate Derivatives and Their Synergistic Effect with Monosodium Glutamate, J. Agric. Food Chem., Jan. 9, 2008, pp. 1043-1050, vol. 56, No. 3.;;Festring, Daniel, et al., Sterioselective Synthesis of Amides Sharing the Guanosine 5′-Monophosphate Scaffold and Umami Enhancement Studies Using Human Sensory and hT1R1/rT1R3 Receptor Assays, J. Agric. Good Chem., Jul. 19, 2011, pp. 8875-8885, vol. 59, No. 16.;;Hong-Yih Ou et al., Activation of Free Fatty Acid Receptor 1 Improves Hepatic Steatosis Through a p38-Dependent Pathway, Journal of Molecular Endocrinology, 2014, 165-174, 53.;;Narukawa, et al., Characterization of umami receptor and coupling G protein in mouse taste cells, NeuroReport, May 9, 2008, pp. 1169-1173, vol. 19, No. 12.;;Suess, B, et al., Human taste and umami recptor responses to chemosensorica generated by Maillard-type N2-alkyl- and N2-arylthiomethylation of guanosine 5′-monophosphates, J. Agric. Food Chem, Nov. 26, 2014, pp. 11429-11440, vol. 62, No. 47.;;Database UniProt [online], Accession No. M3W68, May 1, 2013, Internet: URL: https://www.uniprot.org/uniprot/M3VV68.txt?version=1, (2 pgs).;;Rajabi et al., “Structure-activity relationship of 2,4,5-trioxoimidazolidines as inhibitors of thymidine phosphorylase,” European Journal of Medicinal Chemistry, 46:1165-1171 (2011).;;Sigel et al., “Comparison of the Metal Ion Coordinating Properties of Tubercidin 5′-Monophosphate (7-Deaza-AMP) with Those of Adenosine 5′-Monophosphate (AMP) and 1, N6-Ethenoadenosine 5′-Monophosphate (e-AMP). Definite Evidence for Metal Ion-Base Backbinding to N-7 and Extent of Macrochelate Formulation in M(AMP) and M(e-AMP),” J. Am. Chem. Soc 110:6857-6865 (1988).;;Wang Fang et al., “Condiment Production Process,” pp. 340-341, Yanbian People's Press (Mar. 31, 2003) (with English translation).;;Dang et al., “Interaction Between Umami Peptide and Tate Receptor T1R1/T1R3,” Cell Biochem Biophys 70:1841-1848 (2014).",ACTIVE
75,CN,A,CN 106796245 A,036-628-188-684-475,2017-05-31,2017,CN 201580055032 A,2015-10-12,US 201462062717 P;;US 2015/0055149 W,2014-10-10,Methods for identifying modulators of calcium-sensing receptors,"The invention provides methods for identifying compounds that modulate the activity and/or expression of a calcium-sensing receptor, wherein said compounds can be incorporated into flavor compositions that can be used to modify the kokumi taste and/or palatability of pet food products.",MARS INC,MCGRANE SCOTT JOSEPH;;TAYLOR ANDREW JOHN;;FINE RICHARD MASTEN;;KLEBANSKY BORIS;;GIBBS MATTHEW RONALD,,https://lens.org/036-628-188-684-475,Patent Application,no,5,2,10,10,0,G01N33/566;;G01N33/84;;G01N2500/04;;G01N33/84;;G01N2500/04;;G01N33/566;;G01N33/84;;G01N2500/04;;G01N33/566,G01N33/84;;G01N33/566,,1,0,,,"JENSEN等: ""allosteric modulation of the calcium-sensing receptor"", 《CURRENT NEUROPHARMACOLOGY》",ACTIVE
76,US,A1,US 2019/0187158 A1,154-887-988-791-230,2019-06-20,2019,US 201916246091 A,2019-01-11,US 201916246091 A;;GB 201310664 A;;US 201514898321 A;;GB 2014000233 W,2013-06-14,METHODS FOR INCREASING PALATABILITY OF PET FOODSTUFF,The present invention relates to a method of identifying a compound that binds to or modulates the activity of one or more polypeptides encoding one or more receptors that are involved in the detection and perception of fatty acids.,MARS INC,MCGRANE SCOTT JOSEPH;;TAYLOR ANDREW JOHN;;GIBBS MATTHEW RONALD;;FINE RICHARD MASTEN;;KLEBANSKY BORIS,,https://lens.org/154-887-988-791-230,Patent Application,yes,0,1,26,26,12,C07K14/705;;C07K14/70596;;G01N33/566;;G01N2333/70596;;G01N2333/726;;G16B35/00;;G16C20/60;;G16C20/64;;C07K14/705;;C07K14/70596;;G01N33/566;;G16C20/64;;G16B35/00;;G16C20/60;;C07K14/705;;C07K14/70596;;G01N33/566;;G01N2333/70596;;G01N2333/726;;G16C20/64;;C07C53/126;;C07C57/03;;C07K2319/00;;G01N33/74,G01N33/74;;C07C53/126;;C07C57/03;;C07K14/705;;G01N33/566;;G16B35/00;;G16C20/60;;G16C20/64,,0,0,,,,ACTIVE
77,CN,A,CN 107249349 A,128-352-018-603-768,2017-10-13,2017,CN 201580075910 A,2015-12-10,US 201462090138 P;;US 2015/0065067 W,2014-12-10,Methods for modulating taste receptors,"Amino acids present in domains of an umami taste receptor are described herein, wherein the amino acids interact with at least one nucleotide derivative and/or at least one transmembrane compound that potentiates, modulates, increases, and/or enhances the activity of the umami receptor. Such compounds can be used in flavor compositions to enhance the umami taste and/or palatability of food products.",MARS INC,MCGRANE SCOTT JOSEPH;;TAYLOR ANDREW JOHN;;FINE RICHARD MASTEN;;KLEBANSKY BORIS;;SKILES JERRY WALLACE,,https://lens.org/128-352-018-603-768,Patent Application,no,5,0,46,46,0,A23K20/132;;A23K20/142;;A23K20/153;;A23K50/42;;A23K50/48;;A23K20/111;;A23L27/88;;A23L27/204;;A23V2002/00;;A23K20/111;;A23K20/142;;A23K20/132;;A23K20/153;;A23K50/42;;A23K50/48;;A23L27/88;;A23L27/204;;A23L27/21;;A23L27/23;;A23K20/111;;A23K20/132;;A23K20/142;;A23K20/153;;A23K50/42;;A23K50/48;;A23L27/21;;A23L27/22;;A23L27/23;;A23L27/204;;A23L27/235;;A23L27/88;;A23K50/40;;A23K20/132;;A23K20/153;;A23K50/42;;A23K50/48;;A23L27/88;;A23L27/204;;A23K20/111;;A23K20/142;;A23L27/21;;A23L27/23;;A23L27/22;;A23L27/235;;A23V2002/00,A23K20/111;;A23K20/132;;A23K20/142;;A23K20/153;;A23K50/42;;A23K50/48;;A23L27/00;;A23L27/20,,1,0,,,"F. ZHANG 等: ""Molecular mechanism for the umami taste synergism"", 《PROCEEDINGS OF THE NATIONAL ACADEMY OF SCIENCE》",ACTIVE
78,CA,C,CA 2968004 C,000-683-085-863-281,2023-03-07,2023,CA 2968004 A,2015-12-10,US 201462090138 P;;US 2015/0065067 W,2014-12-10,METHODS FOR MODULATING TASTE RECEPTORS,"Amino acids present in domains of an umami taste receptor are described herein, wherein the amino acids interact with at least one nucleotide derivative and/or at least one transmembrane compound that potentiates, modulates, increases, and/or enhances the activity of the umami receptor. Such compounds can be used in flavor compositions to enhance the umami taste and/or palatability of food products.",MARS INC,MCGRANE SCOTT JOSEPH;;TAYLOR ANDREW JOHN;;FINE RICHARD MASTEN;;KLEBANSKY BORIS;;GIBBS MATTHEW RONALD,,https://lens.org/000-683-085-863-281,Granted Patent,no,0,0,46,46,4,A23K20/132;;A23K20/142;;A23K20/153;;A23K50/42;;A23K50/48;;A23K20/111;;A23L27/88;;A23L27/204;;A23V2002/00;;A23K20/111;;A23K20/142;;A23K20/132;;A23K20/153;;A23K50/42;;A23K50/48;;A23L27/88;;A23L27/204;;A23L27/21;;A23L27/23;;A23K20/111;;A23K20/132;;A23K20/142;;A23K20/153;;A23K50/42;;A23K50/48;;A23L27/21;;A23L27/22;;A23L27/23;;A23L27/204;;A23L27/235;;A23L27/88;;A23K50/40;;A23K20/132;;A23K20/153;;A23K50/42;;A23K50/48;;A23L27/88;;A23L27/204;;A23K20/111;;A23K20/142;;A23L27/21;;A23L27/23;;A23L27/22;;A23L27/235;;A23V2002/00,A23K50/40;;A23K20/00;;A23K20/153;;A23L27/20;;A23L27/23;;C07K14/705;;G01N33/566,,0,0,,,,PENDING
79,US,A1,US 2019/0324031 A1,183-047-255-148-854,2019-10-24,2019,US 201916450462 A,2019-06-24,US 201916450462 A;;US 201715517409 A;;US 2015/0055149 W;;US 201462062717 P,2014-10-10,METHODS FOR IDENTIFYING MODULATORS OF CALCIUM-SENSING RECEPTORS,"Methods for identifying compounds that modulate the activity and/or expression of a calcium-sensing receptor, wherein said compounds can be incorporated into flavor compositions that can be used to modify the kokumi taste and/or palatability of pet food products.",MARS INC,MCGRANE SCOTT JOSEPH;;TAYLOR ANDREW JOHN;;FINE RICHARD MASTEN;;KLEBANSKY BORIS;;GIBBS MATTHEW RONALD,MARS INCORPORATED (2015-07-27),https://lens.org/183-047-255-148-854,Patent Application,yes,0,0,10,10,7,G01N33/566;;G01N33/84;;G01N2500/04;;G01N33/84;;G01N2500/04;;G01N33/566;;G01N33/84;;G01N2500/04;;G01N33/566,G01N33/566;;G01N33/84,,0,0,,,,ACTIVE
80,US,A1,US 2022/0246245 A1,055-656-007-353-851,2022-08-04,2022,US 202017629292 A,2020-07-23,US 202017629292 A;;US 201962877724 P;;US 2020/0043257 W,2019-07-23,MANAGING AND ACCESSING EXPERIMENT DATA USING REFERENTIAL INDENTIFIERS,"The present disclosure is directed to managing and accessing experiment data. A data processing system may generate a system identifier for each instance that leads to a generation of experiment data. A first segment may refer to a source entity, and may be used to differentiate identifiers generated by different source entities. This implementation may aim to provide an explicit representation of the data generation process while providing a glimpse on select metadata attributes, such as an individual species, sample class, and experimental technique used to generate the dataset. These constraints may prevent duplicates and may enable system-side associations among subjects, samples, aliquots, and experiments.",MEMORIAL SLOAN KETTERING CANCER CENTER,MEDINA-MARTINEZ JUAN SANTIAGO;;PAPPAEMMANUIL ELLI;;KUNG ANDREW;;OSSA JUAN ESTEBAN ARANGO;;LEVINE MAX FINE,,https://lens.org/055-656-007-353-851,Patent Application,yes,1,0,4,4,0,G06F7/02;;G16B50/30;;G16H10/40;;G06F16/2264;;G16B50/30;;G06F16/955,G16B50/30;;G06F16/22,,0,0,,,,PENDING
81,WO,A1,WO 2021/016448 A1,165-361-307-815-405,2021-01-28,2021,US 2020/0043257 W,2020-07-23,US 201962877724 P,2019-07-23,MANAGING AND ACCESSING EXPERIMENT DATA USING REFERENTIAL IDENTIFIERS,"The present disclosure is directed to managing and accessing experiment data. A data processing system may generate a system identifier for each instance that leads to a generation of experiment data. A first segment may refer to a source entity, and may be used to differentiate identifiers generated by different source entities. This implementation may aim to provide an explicit representation of the data generation process while providing a glimpse on select metadata attributes, such as an individual species, sample class, and experimental technique used to generate the dataset. These constraints may prevent duplicates and may enable system-side associations among subjects, samples, aliquots, and experiments.",MEMORIAL SLOAN KETTERING CANCER CENTER,MARTINEZ JUAN SANTIAGO MEDINA;;PAPPAEMMANUIL ELLI;;KUNG ANDREW;;OSSA JUAN ESTEBAN ARANGO;;LEVINE MAX FINE,,https://lens.org/165-361-307-815-405,Patent Application,yes,4,0,4,4,0,G06F7/02;;G16B50/30;;G16H10/40;;G06F16/2264;;G16B50/30;;G06F16/955,G01N33/48;;G06F7/00;;G16H10/60,,0,0,,,,PENDING
