49,US,A1,US 2022/0313233 A1,157-388-110-393-392,2022-10-06,2022,US 202017642263 A,2020-09-11,IB 2019001058 W;;EP 2020075550 W,2019-09-13,"MEDICAL IMPLANT, DELIVERY DEVICE, METHOD OF PRODUCING A MEDICAL IMPLANT, AND METHOD OF DELIVERING A MEDICAL IMPLANT","The invention relates to a medical implant ( 1 ) that is adapted to repair or close defect (D), in particular an opening in a ventricular, atrial, or septal wall (W). The medical implant ( 1 ) may, in particular, be a patch. It comprises an adhesive composition ( 6 ). It further comprises two states, wherein in the first state, the medical implant ( 1 ) can be deployed to an implant site while the adhesive composition ( 6 ) is inactive. It can be brought into a second state by an activation mechanism. The adhesive composition ( 6 ), in the second state, is curable by a curing mechanism.",HOLISTICK MEDICAL,ROCHE ELLEN;;KEILLOR MATTHEW;;POULETTY PHILIPPE;;PAU ANTOINE;;GARD MARCO;;WARNACK BORIS;;BRUNEAU MAËLLE;;WEISS TONY;;BURDICK JASON ALAN;;SPENCER ANDREW,HOLISTICK MEDICAL (2022-02-10),https://lens.org/157-388-110-393-392,Patent Application,yes,0,0,12,12,0,A61F2/966;;A61B17/0057;;A61B2017/00606;;A61B2017/00867;;A61B2017/00659;;A61B2017/00623;;A61B2017/00557;;A61B2017/00898;;A61B2017/0065;;A61B2017/00951;;A61B2017/00619;;A61B2017/00575;;A61B2017/00004;;A61B2017/00243;;A61B2017/00592;;A61F2/966;;A61B17/0057;;A61B2017/00575;;A61B2017/00592;;A61B2017/00606;;A61B2017/00619;;A61B2017/00623;;A61B2017/0065;;A61B2017/00004;;A61B2017/00243;;A61B2017/00557;;A61B2017/00867;;A61B2017/00951;;A61B2017/00659;;A61B2017/00898;;A61F2/966;;A61B2017/00557;;A61B2017/00951;;A61B2017/00575;;A61B17/0057;;A61B2017/00004;;A61B2017/00243;;A61B2017/00867;;A61B2017/00606;;A61B2017/00592;;A61B2017/00619;;A61B2017/00659;;A61B2017/00898;;A61B2017/0065;;A61B2017/00623;;A61B17/0057;;A61B90/39;;A61F2/966;;A61B2017/00592;;A61B2017/00606;;A61B2017/00619;;A61B2017/00623;;A61B2017/0065;;A61B2017/00659;;A61B2017/00004;;A61B2017/00243;;A61B2017/00557;;A61B2017/00867;;A61B2017/00898;;A61B2017/00951;;A61B2090/3966;;A61B17/00491;;A61B2017/00004;;A61B2017/00243;;A61B2017/00606;;A61B2017/00623;;A61B2017/0065,A61B17/00,,0,0,,,,PENDING
50,MX,A,MX 2022003004 A,109-559-898-649-025,2022-04-07,2022,MX 2022003004 A,2020-09-11,IB 2019001058 W;;EP 2020075550 W,2019-09-13,"MEDICAL IMPLANT, DELIVERY DEVICE, METHOD OF PRODUCING A MEDICAL IMPLANT, AND METHOD OF DELIVERING A MEDICAL IMPLANT.","The invention relates to a medical implant (1) that is adapted to repair or close defect (D), in particular an opening in a ventricular, atrial, or septal wall (W). The medical implant (1) may, in particular, be a patch. It comprises an adhesive composition (6). It further comprises two states, wherein in the first state, the medical implant (1) can be deployed to an implant site while the adhesive composition (6) is inactive. It can be brought into a second state by an activation mechanism. The adhesive composition (6), in the second state, is curable by a curing mechanism.",HOLISTICK MEDICAL,SPENCER ANDREW;;GARD MARCO;;POULETTY PHILIPPE;;BRUNEAU MAËLLE;;ROCHE ELLEN;;PAU ANTOINE;;KEILLOR MATTHEW;;WARNACK BORIS;;WEISS TONY;;BURDICK JASON ALAN,,https://lens.org/109-559-898-649-025,Patent Application,no,0,0,12,12,0,A61F2/966;;A61B17/0057;;A61B2017/00606;;A61B2017/00867;;A61B2017/00659;;A61B2017/00623;;A61B2017/00557;;A61B2017/00898;;A61B2017/0065;;A61B2017/00951;;A61B2017/00619;;A61B2017/00575;;A61B2017/00004;;A61B2017/00243;;A61B2017/00592;;A61F2/966;;A61B17/0057;;A61B2017/00575;;A61B2017/00592;;A61B2017/00606;;A61B2017/00619;;A61B2017/00623;;A61B2017/0065;;A61B2017/00004;;A61B2017/00243;;A61B2017/00557;;A61B2017/00867;;A61B2017/00951;;A61B2017/00659;;A61B2017/00898;;A61F2/966;;A61B2017/00557;;A61B2017/00951;;A61B2017/00575;;A61B17/0057;;A61B2017/00004;;A61B2017/00243;;A61B2017/00867;;A61B2017/00606;;A61B2017/00592;;A61B2017/00619;;A61B2017/00659;;A61B2017/00898;;A61B2017/0065;;A61B2017/00623;;A61B17/0057;;A61B90/39;;A61F2/966;;A61B2017/00592;;A61B2017/00606;;A61B2017/00619;;A61B2017/00623;;A61B2017/0065;;A61B2017/00659;;A61B2017/00004;;A61B2017/00243;;A61B2017/00557;;A61B2017/00867;;A61B2017/00898;;A61B2017/00951;;A61B2090/3966;;A61B17/00491;;A61B2017/00004;;A61B2017/00243;;A61B2017/00606;;A61B2017/00623;;A61B2017/0065,A61B17/00;;A61F2/966,,0,0,,,,PENDING
51,BR,A2,BR 112022003051 A2,028-406-943-693-962,2022-08-16,2022,BR 112022003051 A,2020-09-11,EP 2020075550 W;;IB 2019001058 W,2019-09-13,"IMPLANTE MÉDICO, DISPOSITIVO DE ENTREGA, MÉTODO DE PRODUÇÃO DE IMPLANTE MÉDICO, E MÉTODO DE COLOCAÇÃO DE IMPLANTE MÉDICO","IMPLANTE MÉDICO, DISPOSITIVO DE ENTREGA, MÉTODO DE PRODUÇÃO DE IMPLANTE MÉDICO, E MÉTODO DE COLOCAÇÃO DE IMPLANTE MÉDICO. A presente invenção refere-se a um implante médico (1) que é adaptado para reparar ou fechar um defeito (D), em particular uma abertura em uma parede ventricular, atrial ou septal (W). O implante médico (1) pode, em particular, ser um remendo. O implante médico compreende uma composição adesiva (6). O mesmo compreende ainda dois estados, sendo que, no primeiro estado, o implante médico (1) pode ser implantado em um sítio de implante enquanto a composição adesiva (6) se encontra inativa. O implante médico poderá ser colocado em um segundo estado por meio de um mecanismo de ativação. A composição adesiva (6), no segundo estado, é curável por meio de um mecanismo de cura.",HOLISTICK MEDICAL,ELLEN ROCHE;;MATTHEW KEILLOR;;PHILIPPE POULETTY;;ANTOINE PAU;;MARCO GARD;;BORIS WARNACK;;ANDREW SPENCER;;MAËLLE BRUNEAU;;TONY WEISS;;JASON ALAN BURDICK,,https://lens.org/028-406-943-693-962,Patent Application,no,0,0,12,12,0,A61F2/966;;A61B17/0057;;A61B2017/00606;;A61B2017/00867;;A61B2017/00659;;A61B2017/00623;;A61B2017/00557;;A61B2017/00898;;A61B2017/0065;;A61B2017/00951;;A61B2017/00619;;A61B2017/00575;;A61B2017/00004;;A61B2017/00243;;A61B2017/00592;;A61F2/966;;A61B17/0057;;A61B2017/00575;;A61B2017/00592;;A61B2017/00606;;A61B2017/00619;;A61B2017/00623;;A61B2017/0065;;A61B2017/00004;;A61B2017/00243;;A61B2017/00557;;A61B2017/00867;;A61B2017/00951;;A61B2017/00659;;A61B2017/00898;;A61F2/966;;A61B2017/00557;;A61B2017/00951;;A61B2017/00575;;A61B17/0057;;A61B2017/00004;;A61B2017/00243;;A61B2017/00867;;A61B2017/00606;;A61B2017/00592;;A61B2017/00619;;A61B2017/00659;;A61B2017/00898;;A61B2017/0065;;A61B2017/00623;;A61B17/0057;;A61B90/39;;A61F2/966;;A61B2017/00592;;A61B2017/00606;;A61B2017/00619;;A61B2017/00623;;A61B2017/0065;;A61B2017/00659;;A61B2017/00004;;A61B2017/00243;;A61B2017/00557;;A61B2017/00867;;A61B2017/00898;;A61B2017/00951;;A61B2090/3966;;A61B17/00491;;A61B2017/00004;;A61B2017/00243;;A61B2017/00606;;A61B2017/00623;;A61B2017/0065,A61B17/00;;A61F2/966,,0,0,,,,DISCONTINUED
52,EP,A1,EP 4027898 A1,062-734-115-379-21X,2022-07-20,2022,EP 20768059 A,2020-09-11,IB 2019001058 W;;EP 2020075550 W,2019-09-13,"MEDICAL IMPLANT, DELIVERY DEVICE, METHOD OF PRODUCING A MEDICAL IMPLANT, AND METHOD OF DELIVERING A MEDICAL IMPLANT",,HOLISTICK MEDICAL,ROCHE ELLEN;;KEILLOR MATTHEW;;POULETTY PHILIPPE;;PAU ANTOINE;;GARD MARCO;;WARNACK BORIS;;SPENCER ANDREW;;BRUNEAU MAËLLE;;WEISS TONY;;BURDICK JASON ALAN,HOLISTICK MEDICAL (2023-05-31),https://lens.org/062-734-115-379-21X,Patent Application,yes,0,0,12,12,0,A61F2/966;;A61B17/0057;;A61B2017/00606;;A61B2017/00867;;A61B2017/00659;;A61B2017/00623;;A61B2017/00557;;A61B2017/00898;;A61B2017/0065;;A61B2017/00951;;A61B2017/00619;;A61B2017/00575;;A61B2017/00004;;A61B2017/00243;;A61B2017/00592;;A61F2/966;;A61B17/0057;;A61B2017/00575;;A61B2017/00592;;A61B2017/00606;;A61B2017/00619;;A61B2017/00623;;A61B2017/0065;;A61B2017/00004;;A61B2017/00243;;A61B2017/00557;;A61B2017/00867;;A61B2017/00951;;A61B2017/00659;;A61B2017/00898;;A61F2/966;;A61B2017/00557;;A61B2017/00951;;A61B2017/00575;;A61B17/0057;;A61B2017/00004;;A61B2017/00243;;A61B2017/00867;;A61B2017/00606;;A61B2017/00592;;A61B2017/00619;;A61B2017/00659;;A61B2017/00898;;A61B2017/0065;;A61B2017/00623;;A61B17/0057;;A61B90/39;;A61F2/966;;A61B2017/00592;;A61B2017/00606;;A61B2017/00619;;A61B2017/00623;;A61B2017/0065;;A61B2017/00659;;A61B2017/00004;;A61B2017/00243;;A61B2017/00557;;A61B2017/00867;;A61B2017/00898;;A61B2017/00951;;A61B2090/3966;;A61B17/00491;;A61B2017/00004;;A61B2017/00243;;A61B2017/00606;;A61B2017/00623;;A61B2017/0065,A61B17/00;;A61F2/966,,0,0,,,,PENDING
53,AU,A1,AU 2020/347500 A1,052-017-426-818-684,2022-03-31,2022,AU 2020/347500 A,2020-09-11,IB 2019001058 W;;EP 2020075550 W,2019-09-13,"Medical implant, delivery device, method of producing a medical implant, and method of delivering a medical implant","The invention relates to a medical implant (1) that is adapted to repair or close defect (D), in particular an opening in a ventricular, atrial, or septal wall (W). The medical implant (1) may, in particular, be a patch. It comprises an adhesive composition (6). It further comprises two states, wherein in the first state, the medical implant (1) can be deployed to an implant site while the adhesive composition (6) is inactive. It can be brought into a second state by an activation mechanism. The adhesive composition (6), in the second state, is curable by a curing mechanism.",HOLISTICK MEDICAL,ROCHE ELLEN;;KEILLOR MATTHEW;;POULETTY PHILIPPE;;PAU ANTOINE;;GARD MARCO;;WARNACK BORIS;;SPENCER ANDREW;;BRUNEAU MAËLLE;;WEISS TONY;;BURDICK JASON ALAN,,https://lens.org/052-017-426-818-684,Patent Application,no,0,0,12,12,0,A61F2/966;;A61B17/0057;;A61B2017/00606;;A61B2017/00867;;A61B2017/00659;;A61B2017/00623;;A61B2017/00557;;A61B2017/00898;;A61B2017/0065;;A61B2017/00951;;A61B2017/00619;;A61B2017/00575;;A61B2017/00004;;A61B2017/00243;;A61B2017/00592;;A61F2/966;;A61B17/0057;;A61B2017/00575;;A61B2017/00592;;A61B2017/00606;;A61B2017/00619;;A61B2017/00623;;A61B2017/0065;;A61B2017/00004;;A61B2017/00243;;A61B2017/00557;;A61B2017/00867;;A61B2017/00951;;A61B2017/00659;;A61B2017/00898;;A61F2/966;;A61B2017/00557;;A61B2017/00951;;A61B2017/00575;;A61B17/0057;;A61B2017/00004;;A61B2017/00243;;A61B2017/00867;;A61B2017/00606;;A61B2017/00592;;A61B2017/00619;;A61B2017/00659;;A61B2017/00898;;A61B2017/0065;;A61B2017/00623;;A61B17/0057;;A61B90/39;;A61F2/966;;A61B2017/00592;;A61B2017/00606;;A61B2017/00619;;A61B2017/00623;;A61B2017/0065;;A61B2017/00659;;A61B2017/00004;;A61B2017/00243;;A61B2017/00557;;A61B2017/00867;;A61B2017/00898;;A61B2017/00951;;A61B2090/3966;;A61B17/00491;;A61B2017/00004;;A61B2017/00243;;A61B2017/00606;;A61B2017/00623;;A61B2017/0065,A61B17/00;;A61F2/966,,0,0,,,,PENDING
54,AU,A1,AU 2017/201898 A1,123-456-909-130-698,2017-04-06,2017,AU 2017/201898 A,2017-03-21,AU 2017/201898 A;;AU 2014/244197 A;;US 201361784020 P;;US 2014/0025674 W,2013-03-14,"Molecules having certain pesticidal utilities, and intermediates, compositions, and processes related thereto",,DOW AGROSCIENCES LLC,FISCHER LINDSEY G;;BAUM ERICH W;;CROUSE GARD D;;DEAMICIS CARL;;LORSBACH BETH;;PETKUS JEFF;;SPARKS THOMAS C;;WHITEKER GREGORY T;;WARD ANDREW L;;ROSS RONALD;;HAO YAN;;GIAMPIETRO NATALIE C,CORTEVA AGRISCIENCE LLC (2021-12-16),https://lens.org/123-456-909-130-698,Patent Application,no,0,0,49,72,0,C07C211/45;;A01N47/36;;A01N25/00;;A01N25/32;;A01N43/653;;A01N47/12;;A01N47/34;;A01N53/00;;A01N55/08;;C07D417/12;;A01N47/42;;C07C335/16;;C07C335/26;;C07D249/08;;C07D277/54;;C07D403/10;;C07D285/01;;C07D405/10;;Y02A50/30;;C07D417/12;;C07F5/04;;C07C335/26;;C07D249/08;;C07D277/54;;C07D403/10;;A01N47/36;;A01N25/00;;A01N25/32;;A01N43/653;;A01N47/12;;A01N47/34;;A01N53/00;;A01N55/08;;C07C211/45;;C07C335/02;;C07C267/00;;A01N47/40;;C07D405/10;;C07D285/01;;A01N47/42;;C07C335/16;;A01N43/653;;C07C211/45;;C07C335/12;;C07C335/26;;C07D249/08;;C07D249/10;;C07D277/54;;C07D285/04;;C07D403/10;;C07D417/12;;C07F5/04;;A01N47/36;;A01N25/00;;A01N25/32;;A01N43/653;;A01N47/12;;A01N47/34;;A01N53/00;;A01N55/08;;C07D417/12;;C07C211/45;;A01N47/42;;C07C335/16;;C07C335/26;;C07D249/08;;C07D277/54;;C07D403/10;;A01N47/40;;C07C267/00;;C07C335/02;;C07D285/01;;C07D405/10;;C07F5/04,C07D401/00;;A01N43/647;;A01P7/00;;A01P9/00;;A01P19/00;;A61K31/4196,,0,0,,,,INACTIVE
55,AU,B2,AU 2017/201898 B2,132-323-224-560-57X,2018-02-01,2018,AU 2017/201898 A,2017-03-21,AU 2017/201898 A;;AU 2014/244197 A;;US 201361784020 P;;US 2014/0025674 W,2013-03-14,"Molecules having certain pesticidal utilities, and intermediates, compositions, and processes related thereto","This disclosure relates to the field of molecules having pesticidal utility against pests in phyla Nematoda, Arthropoda, and/or Mollusca, processes to produce such molecules and intermediates used in such processes, compositions containing such molecules, and processes of using such molecules against such pests. These molecules may be used, for example, as nematicides, acaricides, insecticides, miticides, and/or molluscicides. This document discloses molecules having the following formula (""Formula One""). 2 1-R2 Ar1 Ar2 N N-C NHet 7 """"L 7 x-R4",CORTEVA AGRISCIENCE LLC,FISCHER LINDSEY G;;BAUM ERICH W;;CROUSE GARD D;;DEAMICIS CARL;;LORSBACH BETH;;PETKUS JEFF;;SPARKS THOMAS C;;WHITEKER GREGORY T;;WARD ANDREW L;;ROSS RONALD;;HAO YAN;;GIAMPIETRO NATALIE C,CORTEVA AGRISCIENCE LLC (2021-12-16),https://lens.org/132-323-224-560-57X,Granted Patent,no,1,0,49,72,0,C07C211/45;;A01N47/36;;A01N25/00;;A01N25/32;;A01N43/653;;A01N47/12;;A01N47/34;;A01N53/00;;A01N55/08;;C07D417/12;;A01N47/42;;C07C335/16;;C07C335/26;;C07D249/08;;C07D277/54;;C07D403/10;;C07D285/01;;C07D405/10;;Y02A50/30;;C07D417/12;;C07F5/04;;C07C335/26;;C07D249/08;;C07D277/54;;C07D403/10;;A01N47/36;;A01N25/00;;A01N25/32;;A01N43/653;;A01N47/12;;A01N47/34;;A01N53/00;;A01N55/08;;C07C211/45;;C07C335/02;;C07C267/00;;A01N47/40;;C07D405/10;;C07D285/01;;A01N47/42;;C07C335/16;;A01N43/653;;C07C211/45;;C07C335/12;;C07C335/26;;C07D249/08;;C07D249/10;;C07D277/54;;C07D285/04;;C07D403/10;;C07D417/12;;C07F5/04;;A01N47/36;;A01N25/00;;A01N25/32;;A01N43/653;;A01N47/12;;A01N47/34;;A01N53/00;;A01N55/08;;C07D417/12;;C07C211/45;;A01N47/42;;C07C335/16;;C07C335/26;;C07D249/08;;C07D277/54;;C07D403/10;;A01N47/40;;C07C267/00;;C07C335/02;;C07D285/01;;C07D405/10;;C07F5/04,C07D401/00;;A01N43/647;;A01P7/00;;A01P9/00;;A01P19/00;;A61K31/4196,,0,0,,,,INACTIVE
