"#",Jurisdiction,Kind,Display Key,Lens ID,Publication Date,Publication Year,Application Number,Application Date,Priority Numbers,Earliest Priority Date,Title,Abstract,Applicants,Inventors,Owners,URL,Document Type,Has Full Text,Cites Patent Count,Cited by Patent Count,Simple Family Size,Extended Family Size,Sequence Count,CPC Classifications,IPCR Classifications,US Classifications,NPL Citation Count,NPL Resolved Citation Count,NPL Resolved Lens ID(s),NPL Resolved External ID(s),NPL Citations,Legal Status
1,WO,A1,WO 2023/215283 A1,184-252-331-581-203,2023-11-09,2023,US 2023/0020685 W,2023-05-02,US 202263337915 P,2022-05-03,SYSTEMS AND METHODS FOR CONFIGURING A ROBOT TO INTERFACE WITH EQUIPMENT,"Computer vision techniques for configuring a robot having a robotic arm to interface with equipment to perform a task. The techniques include: capturing at least one image of the equipment; determining a position of a first alignment feature in the at least one captured image; determining, using the position of the first alignment feature in the at least one captured image, an alignment difference between a current alignment of the robot and the equipment with respect to a prior alignment of the robot and the equipment; and configuring the robot to interface with the equipment based on the alignment difference.",AMGEN INC,FINE JORDAN;;TRESANSKY ANDREW,,https://lens.org/184-252-331-581-203,Patent Application,yes,5,0,1,1,0,B25J9/1697,B25J9/16,,0,0,,,,PENDING
2,EP,A2,EP 0533321 A2,104-171-961-521-137,1993-03-24,1993,EP 92306485 A,1992-07-15,US 73437591 A,1991-07-22,Expanding atherectomy device.,"According to the invention, there is provided an intravascular catheter (10) having a rotating working head (20) comprising an elongated flexible jacket having opposed proximal and distal ends and a central passageway (12) extending between the ends. The working head is located at the distal end of the jacket. A concentrically wound drive cable (13) extends through the passageway of the jacket, having a driving end operatively connected to the working head for rotating it and a driven end operatively connected to a source of high-speed motion. The working head is rotatably mounted in a bearing (25) and further attached to the drive cable. The working head further includes a rotating tip with a plurality of axially-extending wires (23) attached to the driving end of the cable. The wires are actuated to reversibly expand from an initial retracted position with the wires radially compressed within the distal end of the jacket, to an activated position distally of the jacket, with the wires being radially expanded to a larger diameter than that of the jacket.",DOW CORNING WRIGHT CORP,FINE MICHAEL JAY;;KORTENBACH JUERGEN ANDREW,,https://lens.org/104-171-961-521-137,Patent Application,yes,0,18,3,3,0,A61B17/320725,A61B17/00;;A61B17/22;;A61M25/00,,0,0,,,,DISCONTINUED
3,US,A1,US 2014/0266692 A1,048-575-922-029-90X,2014-09-18,2014,US 201313973539 A,2013-08-22,US 201313973539 A;;US 201313987290 A;;US 201261616399 P,2012-03-27,METHODS AND SYSTEMS FOR ENCOURAGING AND ENFORCING HAND HYGIENE,"A method of and system for monitoring an instance and a duration of hand-washing activity using a lightweight, wearable device including a radio frequency identification tag reader; an external communication device; an alarm device that is adapted to generate at least one of a visual, an audible, and a haptic signal; data storing device(s) having multi-dimensional movement, acceleration, and/or moment data representative of hand-washing activity; an accelerometer to measure multi-dimensional movement and acceleration of the device; a gyroscope to measure multi-dimensional movement and moment of the device; and a processing device that uses measured multi-dimensional movement, acceleration, and/or moment data to evaluate hand-washing activity by determining when hand-washing activity has begun and ended and by comparing the duration of hand-washing activity to a pre-determined minimum hand-washing requirement, to determine whether or not said hand-washing activity complies with the minimum hand-washing requirements.",INTELLIGENTM,FREEDMAN SETH;;FINE ANDREW;;MULLINIX DAVE,INTELLIGENTM (2013-08-27),https://lens.org/048-575-922-029-90X,Patent Application,yes,13,57,2,2,0,G08B21/245;;G08B21/245,G08B21/24,340/539.11,0,0,,,,INACTIVE
4,EP,A3,EP 0533321 A3,055-996-801-350-501,1993-05-12,1993,EP 92306485 A,1992-07-15,US 73437591 A,1991-07-22,EXPANDING ATHERECTOMY DEVICE,"According to the invention, there is provided an intravascular catheter (10) having a rotating working head (20) comprising an elongated flexible jacket having opposed proximal and distal ends and a central passageway (12) extending between the ends. The working head is located at the distal end of the jacket. A concentrically wound drive cable (13) extends through the passageway of the jacket, having a driving end operatively connected to the working head for rotating it and a driven end operatively connected to a source of high-speed motion. The working head is rotatably mounted in a bearing (25) and further attached to the drive cable. The working head further includes a rotating tip with a plurality of axially-extending wires (23) attached to the driving end of the cable. The wires are actuated to reversibly expand from an initial retracted position with the wires radially compressed within the distal end of the jacket, to an activated position distally of the jacket, with the wires being radially expanded to a larger diameter than that of the jacket.",DOW CORNING WRIGHT CORPORATION,"FINE, MICHAEL JAY;;KORTENBACH, JUERGEN ANDREW",,https://lens.org/055-996-801-350-501,Search Report,yes,4,0,3,3,0,A61B17/320725,A61B17/00;;A61B17/22;;A61M25/00,,0,0,,,,DISCONTINUED
5,US,B2,US 9135805 B2,112-789-480-566-814,2015-09-15,2015,US 201313973539 A,2013-08-22,US 201313973539 A;;US 201313987290 A;;US 201261616399 P,2012-03-27,Methods and systems for encouraging and enforcing hand hygiene,"A method of and system for monitoring an instance and a duration of hand-washing activity using a lightweight, wearable device including a radio frequency identification tag reader; an external communication device; an alarm device that is adapted to generate at least one of a visual, an audible, and a haptic signal; data storing device(s) having multi-dimensional movement, acceleration, and/or moment data representative of hand-washing activity; an accelerometer to measure multi-dimensional movement and acceleration of the device; a gyroscope to measure multi-dimensional movement and moment of the device; and a processing device that uses measured multi-dimensional movement, acceleration, and/or moment data to evaluate hand-washing activity by determining when hand-washing activity has begun and ended and by comparing the duration of hand-washing activity to a pre-determined minimum hand-washing requirement, to determine whether or not said hand-washing activity complies with the minimum hand-washing requirements.",INTELLIGENTM,FREEDMAN SETH;;FINE ANDREW;;MULLINIX DAVE,INTELLIGENTM (2013-08-27),https://lens.org/112-789-480-566-814,Granted Patent,yes,32,15,2,2,0,G08B21/245;;G08B21/245,G08B1/08;;G08B21/24,,3,1,111-233-809-090-701,10.1155/2008/273130,"Dan Sutch and Tash Lee, Fizzees, futurelab (May 2006).;;Ince, N.F. et al., ""Detection of Early Morning Daily Activities with Static Home and Wearable Wireless Sensors,"" EURASIP Journal on Advances in Signal Processing, vol. 2008 (Jul. 17, 2007).;;Healthsense eNeighbor Remote Monitoring web page: http://www.healthsense.com/index.php/products/eneighbor-remote-monitoring, publicly available prior to (Mar. 27, 2012).",INACTIVE
6,US,A,US 5479727 A,015-165-616-523-724,1996-01-02,1996,US 32902994 A,1994-10-25,US 32902994 A,1994-10-25,Moisture removal and passivation of surfaces,"The present invention is a process of removal of moisture from surfaces, such as metal conduit for transmission of high purity gases in electronic component fabrication facilities, and the passivation of such metal surfaces to retard the readsorption of moisture, wherein the moisture removal and passivation is enhanced using an agent of the formula: R.sub.a SiX.sub.b Y.sub.c Z.sub.d where a =1-3; b, c, and d are individually 0-3 and a+b+c+d=4; R is one or more organic groups; and at least one of X, Y or Z have a bond to silicon that is readily hydrolyzable. The moisture removal and passivation is conducted at less than 65.degree. C. and at least ambient pressure.",AIR PROD & CHEM,FINE STEPHEN M;;JOHNSON ANDREW D;;LANGAN JOHN G,AIR PRODUCTS AND CHEMICALS INC (1994-12-12),https://lens.org/015-165-616-523-724,Granted Patent,yes,6,53,9,9,0,F26B21/14;;F26B7/00;;F26B21/14,F26B19/00;;F26B21/14;;F26B7/00,34/516;;34/517,1,0,,,"Tatenuma, K., et al. Quick Acquisition of Clean Ultrahigh Vacuum by Chemical Process Technology. J. Vac. Sci. Technol. A 11(4) Jul./Aug. 1993:1719 1724.",EXPIRED
7,TW,B,TW 323960 B,106-825-198-655-037,1998-01-01,1998,TW 84107951 A,1995-07-31,US 32902994 A,1994-10-25,Process of surface dehumidification and moisture deactivation this invention relates to a process of surface dehumidification and moisture deactivation which comprises contacting the surface with a carrier gas at a pressure of 14.7 to 3000 psia.,"A process of dehumidification and deactivation for a surface adsorbed with moisture to retard the re-adsorption of moisture, in which the process comprises setting the pressure at 14.7 psia to 3000 psia, contacting the surface with a carrier gas containing a desiccant to remove the adsorbed moisture from the surface and deactivate the surface in order to retard the re-adsorption of moisture, in which the molecular formula of the desiccant is : RaSiXbYcZd, in which a = 1-3; b, c, d, separately, is 0-3 and a+b+c+d=4; R is one or more organic groups; and X, Y, or Z, separately, is hydrogen, halogen, alkoxy, amino or -N(H)Si(R)3, however, at least one of X, Y, or Z is bonded with silicon and is readily hydrolysable.",AIR PROD & CHEM,STEPHEN MARK FINE;;ANDREW DAVID JOHNSON;;JOHN GILES LANGAN,,https://lens.org/106-825-198-655-037,Granted Patent,no,0,0,9,9,0,F26B21/14;;F26B7/00;;F26B21/14,F26B19/00;;F26B7/00;;F26B21/14,,0,0,,,,EXPIRED
8,US,B1,US 7546458 B1,172-122-853-578-297,2009-06-09,2009,US 27349702 A,2002-10-18,US 27349702 A;;US 37790602 P,2002-05-04,Method for organizing virtual networks while optimizing security,"An access point in a wireless communication system can be configured to include multiple virtual LANS (VLANs) based on security levels, thereby allowing secure traffic to be isolated from insecure traffic. Configuring the access point can include assigning a security level to each VLAN and setting a security association for each station associated with the access point. Based on this security association, each station can be assigned to an appropriate VLAN.",ATHEROS COMM INC,SINGLA AMAN;;DAVIDSON ANDREW M;;FINE MICHAEL;;HAYES KEVIN,ATHEROS COMMUNICATIONS INC (2002-10-15);;QUALCOMM ATHEROS INC (2011-01-05);;QUALCOMM INCORPORATED (2012-10-22),https://lens.org/172-122-853-578-297,Granted Patent,yes,11,21,1,1,0,H04L12/4645;;H04L12/4645,H04L9/00;;G06F15/173;;H04K1/00,713/166;;380/255;;709/223,1,0,,,"IBM technical Disclosure Bulletin, Mar. 2002, ""Use of Virtual Local Area Networks in a Shared Infrastructure to Support Multiple Customers at Low Cost,"" Mar. 1, 2002, pp. 1-3.",INACTIVE
9,DE,T2,DE 69501493 T2,127-550-622-152-378,1998-04-30,1998,DE 69501493 T,1995-10-20,US 32902994 A,1994-10-25,Entfernung von Feuchtigkeit und Passivierung von Oberflächen,,AIR PROD & CHEM,FINE STEPHEN MARK;;JOHNSON ANDREW DAVID;;LANGAN JOHN GILES,,https://lens.org/127-550-622-152-378,Granted Patent,no,0,0,9,9,0,F26B21/14;;F26B7/00;;F26B21/14,F26B7/00;;F26B19/00;;F26B21/14,,0,0,,,,EXPIRED
10,EP,A1,EP 0709635 A1,030-643-418-035-321,1996-05-01,1996,EP 95116557 A,1995-10-20,US 32902994 A,1994-10-25,Moisture removal and passivation of surfaces,"The present invention is a process of removal of moisture from surfaces, such as metal conduit for transmission of high purity gases in electronic component fabrication facilities, and the passivation of such metal surfaces to retard the readsorption of moisture, wherein the moisture removal and passivation is enhanced using an agent of the formula: R a SiX b Y c Z d  where a = 1-3; b, c, and d are individually 0-3 and   ; R is one or more organic groups; and at least one of X, Y or Z have a bond to silicon that is readily hydrolyzable. The moisture removal and passivation is conducted at less than 65°C and at least ambient pressure.",AIR PROD & CHEM,FINE STEPHEN MARK;;JOHNSON ANDREW DAVID;;LANGAN JOHN GILES,,https://lens.org/030-643-418-035-321,Patent Application,yes,4,4,9,9,0,F26B21/14;;F26B7/00;;F26B21/14,F26B7/00;;F26B19/00;;F26B21/14,,2,0,,,"TATENUMA ET AL: ""Quick acquisition of clean ultrahigh vacuum by chemical process technology"", J.VAC.SCI.TECHNOL.A, vol. 11, no. 4, pages 1719 - 1724, XP000403685;;K.TATENUMA, T.MOMOSE & H.ISHIMARU, J. VAC. SCI. TECHNOL. A., no. 11, 1993, pages 1719",EXPIRED
11,EP,B1,EP 0709635 B1,188-423-282-537-204,1998-01-21,1998,EP 95116557 A,1995-10-20,US 32902994 A,1994-10-25,Moisture removal and passivation of surfaces,,AIR PROD & CHEM,FINE STEPHEN MARK;;JOHNSON ANDREW DAVID;;LANGAN JOHN GILES,,https://lens.org/188-423-282-537-204,Granted Patent,yes,2,0,9,9,0,F26B21/14;;F26B7/00;;F26B21/14,F26B7/00;;F26B19/00;;F26B21/14,,1,0,,,"J.VAC.SCI.TECHNOL.A, vol. 11, no. 4, July 1993 pages 1719-1724, XP 000403685 TATENUMA ET AL 'Quick acquisition of clean ultrahigh vacuum by chemical process technology'",EXPIRED
12,DE,D1,DE 69501493 D1,070-548-033-577-598,1998-02-26,1998,DE 69501493 T,1995-10-20,US 32902994 A,1994-10-25,Entfernung von Feuchtigkeit und Passivierung von Oberflächen,,AIR PROD & CHEM,FINE STEPHEN MARK;;JOHNSON ANDREW DAVID;;LANGAN JOHN GILES,,https://lens.org/070-548-033-577-598,Granted Patent,no,0,0,9,9,0,F26B21/14;;F26B7/00;;F26B21/14,F26B7/00;;F26B19/00;;F26B21/14,,0,0,,,,EXPIRED
13,AU,A,AU 1990/066524 A,001-234-711-672-486,1991-05-23,1991,AU 1990/066524 A,1990-11-09,US 43674289 A,1989-11-15,INTEGRATED COMMUNICATIONS LINK HAVING DYNAMICALLY ALLOCATABLE BANDWIDTH AND A PROTOCOL FOR TRANSMISSION OR ALLOCATION INFORMATION OVER THE LINK,,DIGITAL EQUIPMENT CORP,VARGHESE GEORGE;;SZMAUZ RICHARD L;;SMITH ANDREW JOHN;;FINE MICHAEL,,https://lens.org/001-234-711-672-486,Patent Application,no,0,0,7,7,0,H04J3/1682;;H04Q11/0435;;H04Q2213/13332;;H04J3/1682;;H04Q2213/13332;;H04Q11/0435,H04J3/16;;H04L5/22;;H04Q11/04,,0,0,,,,EXPIRED
14,US,A,US 5313467 A,091-250-570-655-360,1994-05-17,1994,US 98524992 A,1992-12-02,US 98524992 A;;US 43674289 A,1989-11-15,Integrated communication link having a dynamically allocatable bandwidth and protocol for transmission of allocation information over the link,"An integrated communications link in a communications network that is provided with apparatus which allows dynamic allocability of bandwidth among a plurality of channels. At least three different types of information can be carried on these channels, and the bandwidth of these channels are dynamic so that it can be changed according to a determinable scheme. The link also sends error control information with a message that informs the receiver how the bandwidth is to be allocated, this error control information providing an extremely high level of assurance that the receiver of the information will know how the received information is to be allocated.",DIGITAL EQUIPMENT CORP,VARGHESE GEORGE;;SZMAUZ RICHARD L;;SMITH ANDREW J;;FINE MICHAEL,CABLETRON SYSTEMS INC (1998-02-06);;ENTERASYS NETWORKS INC (2000-09-29),https://lens.org/091-250-570-655-360,Granted Patent,yes,24,135,7,7,0,H04J3/1682;;H04Q11/0435;;H04Q2213/13332;;H04J3/1682;;H04Q2213/13332;;H04Q11/0435,H04J3/16;;H04L5/22;;H04Q11/04,370/94.1;;370/60,0,0,,,,EXPIRED
15,AU,B2,AU 627953 B2,000-439-061-610-760,1992-09-03,1992,AU 1990/066524 A,1990-11-09,US 43674289 A,1989-11-15,INTEGRATED COMMUNICATIONS LINK HAVING DYNAMICALLY ALLOCATABLE BANDWIDTH AND A PROTOCOL FOR TRANSMISSION OR ALLOCATION INFORMATION OVER THE LINK,,DIGITAL EQUIPMENT CORP,VARGHESE GEORGE;;SZMAUZ RICHARD L;;SMITH ANDREW JOHN;;FINE MICHAEL,,https://lens.org/000-439-061-610-760,Granted Patent,no,3,0,7,7,0,H04J3/1682;;H04Q11/0435;;H04Q2213/13332;;H04J3/1682;;H04Q2213/13332;;H04Q11/0435,H04J3/16;;H04L5/22;;H04Q11/04,,0,0,,,,EXPIRED
16,EP,A3,EP 0428407 A3,059-228-011-030-427,1992-08-19,1992,EP 90312443 A,1990-11-15,US 43674289 A,1989-11-15,AN INTEGRATED COMMUNICATIONS LINK HAVING DYNAMICALLY ALLOCATABLE BANDWIDTH AND A PROTOCOL FOR TRANSMISSION OF ALLOCATION INFORMATION OVER THE LINK,"An integrated communications link (16) in a communications network is provided with apparatus which allows dynamic allocatability of bandwidth among a plurality of channels. At least three different types of information can be carried on these channels, and the bandwidth of each channel is dynamically adjustable so that it can be changed according to a determinable scheme. The link also sends error control information with a message that informs the receiver how the bandwidth is to be allocated, this error control information providing an extremely high level of assurance that the receiver of the information will know how the received information is to be allocated.  ",DIGITAL EQUIPMENT CORPORATION,"VARGHESE, GEORGE;;SMITH, ANDREW JOHN;;SZMAUZ, RICHARD L.;;FINE, MICHAEL",,https://lens.org/059-228-011-030-427,Search Report,yes,2,0,7,7,0,H04J3/1682;;H04Q11/0435;;H04Q2213/13332;;H04J3/1682;;H04Q2213/13332;;H04Q11/0435,H04J3/16;;H04L5/22;;H04Q11/04,,4,0,,,"PATENT ABSTRACTS OF JAPAN vol. 6, no. 264 (E-150)23 December 1982 & JP-A-57 159 152 ( NIPPON DENSHIN DENWA KOSHA ) 1 October 1982;;PATENT ABSTRACTS OF JAPAN vol. 11, no. 119 (E-517)18 June 1987 & JP-A-62 020 439 ( MATSUSHITA ELECTRIC IND CO ) 29 January 1987;;PATENT ABSTRACTS OF JAPAN vol. 10, no. 137 (E-405)21 May 1986 & JP-A-61 001 129 ( FUJITSU KK ) 7 January 1986;;PATENT ABSTRACTS OF JAPAN vol. 8, no. 004 (E-220)10 January 1984 & JP-A-58 171 156 ( FUJITSU KK ) 7 October 1983",DISCONTINUED
17,EP,A2,EP 0396432 A2,095-812-022-925-355,1990-11-07,1990,EP 90304912 A,1990-05-04,GB 8910419 A,1989-05-05,Monitoring apparatus.,"Monitoring apparatus for monitoring traffic flow in a tunnel is disclosed comprising a plurality of cameras 10, 12, 14 each connected to a camera controller 60, 62, 64. Each camera controller includes an image memory for periodically storing still images from the camera associated therewith. A plurality of incident detectors 40 - 45; 46 - 51 are associated with each camera 10, 12, and lie within the field of view of that camera. The incident detectors detect the passage of vehicles in a carriageway of the tunnel and determine whether or not a traffic incident eg congestion or an accident has occurred in accordance with an algorithm. When an incident has occurred an incident detection signal is generated which is communicated to the camera controllers via a central controller 66. The image memory of the relevant camera controller is responsive to the detection signal to identify and freeze a plurality of images prior to the incident which are then passed to the central controller, so that the circumstances leading up to the incident can be reviewed.  ",GOLDEN RIVER LTD,DALGLEISH MICHAEL;;FINE DAVID;;MORETON BOB;;WATKINS ANDREW;;JONES JOHN,,https://lens.org/095-812-022-925-355,Patent Application,yes,0,29,5,5,0,G08G1/164;;G08G1/04,G08G1/04;;G08G1/16,,0,0,,,,DISCONTINUED
18,CA,A1,CA 2029850 A1,044-914-434-587-812,1991-05-16,1991,CA 2029850 A,1990-11-13,US 43674289 A,1989-11-15,INTEGRATED COMMUNICATIONS LINK HAVING DYNAMICALLY ALLOCATABLE BANDWIDTH AND A PROTOCOL FOR TRANSMISSION OF ALLOCATION INFORMATION OVER THE LINK,"An integrated communications link in a communications network that is provided with apparatus which allows dynamic allocability of bandwidth among a plurality of channels. At least three different types of information can be carried on these channels, and the bandwidth of these channels are dynamic so that it can be changed according to a determinable scheme. The link also sends error control information with a message that informs the receiver how the bandwidth is to be allocated, this error control information providing an extremely high level of assurance that the receiver of the information will know how the received information is to be allocated.",DIGITAL EQUIPMENT CORP,VARGHESE GEORGE;;SZMAUZ RICHARD L;;SMITH ANDREW J;;FINE MICHAEL,,https://lens.org/044-914-434-587-812,Patent Application,no,0,0,7,7,0,H04J3/1682;;H04Q11/0435;;H04Q2213/13332;;H04J3/1682;;H04Q2213/13332;;H04Q11/0435,H04J3/16;;H04L5/22;;H04Q11/04,D43630010    M,0,0,,,,DISCONTINUED
19,CA,A1,CA 2016088 A1,131-103-772-446-021,1990-11-05,1990,CA 2016088 A,1990-05-04,GB 8910419 A,1989-05-05,MONITORING APPARATUS,"Monitoring apparatus for monitoring traffic flow in a tunnel, comprising a plurality of cameras each connected to a camera controller. Each camera controller includes an image memory for periodically storing still images from the camera associated therewith. A plurality of incident detectors are associated with each camera. The incident detectors detest the passage of vehicles and determine whether or not a traffic incident, eg congestion or an accident, has occurred in accordance with an algorithm. When an incident has occurred an incident detection signal is generated which is communicated to the camera controllers. The image memory of the relevant camera controller is responsive to the detection signal to identify and freeze a plurality of images prior to the incident which are then passed to the central controller, so that the circumstances leading up to the incident can be reviewed. Figure 2",DALGLEISH MICHAEL;;FINE DAVID;;MORETON BOB;;WATKINS ANDREW;;JONES JOHN,DALGLEISH MICHAEL;;FINE DAVID;;MORETON BOB;;WATKINS ANDREW;;JONES JOHN,,https://lens.org/131-103-772-446-021,Patent Application,no,0,0,5,5,0,G08G1/164;;G08G1/04,G08G1/04;;G08G1/16,D23500031    M;;3540015    S,0,0,,,,DISCONTINUED
20,EP,A2,EP 0428407 A2,051-815-481-099-539,1991-05-22,1991,EP 90312443 A,1990-11-15,US 43674289 A,1989-11-15,An integrated communications link having dynamically allocatable bandwidth and a protocol for transmission of allocation information over the link.,"An integrated communications link (16) in a communications network is provided with apparatus which allows dynamic allocatability of bandwidth among a plurality of channels. At least three different types of information can be carried on these channels, and the bandwidth of each channel is dynamically adjustable so that it can be changed according to a determinable scheme. The link also sends error control information with a message that informs the receiver how the bandwidth is to be allocated, this error control information providing an extremely high level of assurance that the receiver of the information will know how the received information is to be allocated.  ",DIGITAL EQUIPMENT CORP,VARGHESE GEORGE;;SMITH ANDREW JOHN;;SZMAUZ RICHARD L;;FINE MICHAEL,,https://lens.org/051-815-481-099-539,Patent Application,yes,0,44,7,7,0,H04J3/1682;;H04Q11/0435;;H04Q2213/13332;;H04J3/1682;;H04Q2213/13332;;H04Q11/0435,H04J3/16;;H04L5/22;;H04Q11/04,,0,0,,,,DISCONTINUED
21,EP,A3,EP 0396432 A3,069-468-662-080-837,1991-04-10,1991,EP 90304912 A,1990-05-04,GB 8910419 A,1989-05-05,MONITORING APPARATUS,"Monitoring apparatus for monitoring traffic flow in a tunnel is disclosed comprising a plurality of cameras 10, 12, 14 each connected to a camera controller 60, 62, 64. Each camera controller includes an image memory for periodically storing still images from the camera associated therewith. A plurality of incident detectors 40 - 45; 46 - 51 are associated with each camera 10, 12, and lie within the field of view of that camera. The incident detectors detect the passage of vehicles in a carriageway of the tunnel and determine whether or not a traffic incident eg congestion or an accident has occurred in accordance with an algorithm. When an incident has occurred an incident detection signal is generated which is communicated to the camera controllers via a central controller 66. The image memory of the relevant camera controller is responsive to the detection signal to identify and freeze a plurality of images prior to the incident which are then passed to the central controller, so that the circumstances leading up to the incident can be reviewed.  ",GOLDEN RIVER LIMITED,"DALGLEISH, MICHAEL;;FINE, DAVID;;MORETON, BOB;;WATKINS, ANDREW;;JONES, JOHN",,https://lens.org/069-468-662-080-837,Search Report,yes,4,0,5,5,0,G08G1/164;;G08G1/04,G08G1/04;;G08G1/16,,0,0,,,,DISCONTINUED
