83,US,B1,US 6291723 B1,047-966-667-641-166,2001-09-18,2001,US 38896699 A,1999-09-02,US 38896699 A,1999-09-02,Diolefin/hydroxyaryl condensates and catalyst therefor,"A catalyst composition comprising trifluoromethanesulfonic acid (also referred to as triflic acid) and a sufficient quantity of a substance (also referred to as a retarder) to decrease but not eliminate the catalytic activity of the acid is disclosed. Also disclosed, is a method and composition for condensing a hydroxyaryl with a diene by use of the catalyst composition. The method is capable of producing condensates having: a mole ratio of 1 mole of the diene to one mole of the hydroxyaryl; one mole of diene to two moles of the hydroxyaryl as well as higher molecular weight products such as resins by changes in temperature, time of reaction, type and quantity of retarder and other variables.",BORDEN CHEM INC,GERBER ARTHUR H,MOMENTIVE SPECIALTY CHEMICALS INC (1999-08-25);;BORDEN CHEMICAL INC. A NEW JERSEY CORPORATION (2002-04-05),https://lens.org/047-966-667-641-166,Granted Patent,yes,12,1,15,15,0,B01J31/0227;;B01J31/0237;;B01J31/0247;;B01J31/06;;B01J2231/323;;C07C37/14;;C07C41/06;;C07C37/88;;C07C2601/16;;C07C2603/68;;B01J31/0237;;B01J31/0247;;B01J31/06;;C07C37/14;;C07C37/88;;C07C41/06;;B01J2231/323;;B01J31/0227;;B01J31/06;;B01J2231/323;;C07C37/14;;B01J31/0237;;C07C41/06;;B01J31/0247;;C07C37/88;;C07C2603/68;;C07C2601/16,B01J31/02;;B01J31/06;;C07B61/00;;C07C37/14;;C07C39/12;;C07C39/23;;C07C41/05;;C07C41/06;;C07C43/243,568/793;;568/628;;568/630;;568/632;;568/732;;568/733;;568/806;;528/205;;528/171,9,1,022-105-581-164-651,10.1021/ja01205a003,"3M Fluorad, FC24, Product Information Bulletin, Jun. 1995.;;""Reaction of Phenol with Endo-Dicyclopentadiene"" V. Isagulyants et al. Neftekhimia (1974) 14(2), 280-3 -With English Translation.;;Beilstein, RN 52062-67-6 Registry, Phenol, 4-(3a4,5,6,7,7a-hexahydro-4,7-methano-1H-inden-6-yl)-(9CI) (1998).;;""Reaction of Phenol with Alkyl- and Alkenylcycloalkenes in the Presence of KU 23 Catalyst"" Sadykhov, Sh. et al. Neftekhimiya (1996), 36(2), 158-168.;;""Reaction of Phenol with Alkylcycloalkenes on a Zeolite-Containing Aluminosilicate Catalyst"" Soldatove, V. et al. Neftekhimiya (1988), 28(2), 189-99.;;""Catalytic Alkylation of Phenol by Isoprene Dimers"" Sadykhov. Sh. et al. Azerb. Neft. Khoz, (1984), (3), 46-9.;;""Study of the O-Cycloalkylation of Phenol with Alkylcycloalkenes"" Sadykhov, Sh. et al. Azerb, Khim Zh. (1978), (2), 35-7.;;""Use of Ion Exchange Resins in Catalysis, Reaction of Dicyclopentadiene with phenol on a KU 2 Cation Exchanger"" Isagulyants, V. et al., Zh. Prikl. Khim. (Lenningrad) (1974) 47 (3), 684.;;H. A. Bruson, et al.; J. Am. Chem. Soc. 68, 8 (1946) pp. 8-10.",EXPIRED
84,TW,B,TW I262933 B,061-849-968-262-770,2006-10-01,2006,TW 89106968 A,2000-04-14,US 29815399 A,1999-04-23,Phenol-novolacs with improved optical properties,"The specification discloses a method for the manufacture of a fluorescent polyphenolic product with high UV absorbance, its subsequent epoxidation, polyphenolic products, epoxidized derivatives and compositions thereof as well as laminates containing fluorescent polyphenolic products and derivatives thereof. The polyphenolic products are prepared by heating glyoxal at a temperature of about 80 DEG C to about 100 DEG C with a molar excess of a phenol in the presence of an acidic catalyst which is eliminated from the reaction mixture at a temperature below about 170 DEG C. The total mote ratio of glyoxal to phenol charged to the reaction mixture is about 0.15 to 0.22 moles of glyoxal for each mole of phenol. The glyoxal is added continuously or by stepwise additions to the phenol so as to keep the aldehyde units in the reaction mixture to less than about 70% of the aldehyde units in the total quantity of glyoxal to be charged for making the polyphenol. Water is distilled stepwise or continuously from the reaction mixture. The catalyst is removed from the reaction mixture by further distilling the reaction mixture, generally at higher temperatures. After removal of the catalyst, unreacted phenol is removed by distillation and the reaction mixture is heated at a temperature of about 175 DEG C to 200 DEG C for about 0.25 hours to about 3 hours to produce a polyphenolic reaction product having high fluorescence, high UV absorbance and high solubility in organic solvents. The polyphenolic reaction product can be epoxidized by conventional means and such epoxy products used in the manufacture of laminates, coatings and adhesives.",HEXION SPECIALTY CHEMICALS INC,GERBER ARTHUR H,,https://lens.org/061-849-968-262-770,Granted Patent,no,0,1,15,25,0,B32B5/32;;C08G8/04;;C08G8/28;;C08G14/04;;C08G14/12;;C08G59/08;;C08L61/06;;C08L61/14;;C08L63/00;;H05K1/0266;;H05K1/0269;;H05K1/0326;;H05K1/0373;;H05K3/285;;Y10T442/2861;;Y10T442/2049;;Y10T428/249962;;Y10T442/277;;C08G8/04;;Y10T442/2861;;Y10T442/2049;;Y10T428/249962;;Y10T442/277;;B32B3/26;;B32B2363/00;;B32B27/18;;B32B2305/72;;B32B27/38;;B32B2307/3065;;B32B2305/026;;B32B2307/422;;C08G8/04;;C08G8/28;;C08G59/08;;H05K3/285;;H05K1/0266;;C08G14/04;;H05K1/0326;;C08L61/14;;C08L63/00;;C08G14/12;;B32B5/32;;H05K1/0373;;H05K1/0269;;C08L61/06,B32B5/32;;B32B7/02;;C08G8/00;;B32B27/18;;C08G8/04;;C08F8/08;;C08G8/10;;C08G8/28;;C08G14/04;;C08G14/12;;C08G59/08;;C08G59/62;;C08J5/24;;C08L61/06;;C08L61/10;;C08L61/14;;C08L63/00;;H05K1/02;;H05K1/03;;H05K3/28,,0,0,,,,EXPIRED
85,EP,A3,EP 0370595 A3,096-225-676-270-028,1991-06-12,1991,EP 89305912 A,1989-06-12,US 27144788 A,1988-11-15,BINDER COMPOSITIONS COMPRISING LOW MOLECULAR WEIGHT POLY(ORTHOMETHYLOLATED)PHENOLIC COMPOUND AND NOVOLAC RESIN,"The invention relates to a binder composition comprising a low molecular weight poly (orthomethylolated) phenolic compound which is combined with a phenol formaldehyde novolac resin and cured in the presence of alkali and an organic ester. Low and high density aggregates can be added to the binder to produce foundry or refractory articles. The binder can also be applied, with or without aggregate, to paper, fabrics, or concrete.  ","BORDEN, INC.","GERBER, ARTHUR H.","BORDEN CHEMICAL, INC. A DELAWARE CORPORATION (1997-05-01);;BORDEN, INC. TRANSFER- BORDEN CHEMICAL, INC. (1997-02-14)",https://lens.org/096-225-676-270-028,Search Report,yes,1,0,12,12,0,C08G8/24;;C08K3/22;;C08L61/06;;C08K3/22;;C08L61/06;;C08G8/24,C08G8/24;;C08K3/22;;C08L61/04;;C08L61/06,,0,0,,,,EXPIRED
86,ES,T3,ES 2270587 T3,088-394-930-981-19X,2007-04-01,2007,ES 99911121 T,1999-03-05,US 15858498 A,1998-09-22,NOVOLACS FENOLICOS CON PROPIEDADES OPTICAS MEJORADAS.,"The specification discloses a method for the manufacture of a fluorescent polyphenolic product with high UV absorbance, its subsequent epoxidation as well as polyphenolic products and epoxidized derivatives and compositions thereof. The polyphenolic products are prepared by heating glyoxal at a temperature of about 80 DEG C. to about 100 DEG C. with a molar excess of a phenol in the presence of an acidic catalyst which is eliminated from the reaction mixture at a temperature below about 170 DEG C. The total mole ratio of glyoxal to phenol charged to the reaction mixture is about 0.15 to 0.22 moles of glyoxal for each mole of phenol. The glyoxal is added continuously or by stepwise additions to the phenol so as to keep the aldehyde units in the reaction mixture to less than about 70% of the aldehyde units in the total quantity of glyoxal to be charged for making the polyphenol. Water is distilled stepwise or continuously from the reaction mixture. The catalyst is removed from the reaction mixture by further distilling the reaction mixture, generally at higher temperatures. After removal of the catalyst, unreacted phenol is removed by distillation and the reaction mixture is heated at a temperature of about 175 DEG C. to 200 DEG C. for about 0.25 hours to about 3 hours to produce a polyphenolic reaction product having high fluorescence, high UV absorbance and high solubility in organic solvents. The polyphenolic reaction product can be epoxidized by conventional means and such epoxy products used in the manufacture of laminates, coatings and adhesives.",HEXION SPECIALTY CHEMICALS INC,GERBER ARTHUR H,,https://lens.org/088-394-930-981-19X,Granted Patent,no,0,0,28,28,0,C08G8/04;;C08G14/04;;C08G14/12;;C08G59/08;;C08L61/06;;C08L61/14;;C08L63/00;;H05K1/0266;;H05K1/0269;;H05K1/0326;;H05K1/0373;;H05K3/285;;C08G14/12;;C08G8/04;;C08G8/28;;C08G59/08;;C08L61/14;;C08L63/00;;H05K1/0269;;H05K1/0326;;H05K1/0373;;H05K3/285;;C08L61/06;;C08G14/12;;H05K1/0269;;C08G14/04;;C08G8/04;;C08G59/08;;H05K1/0266;;H05K1/0373;;C08L63/00;;H05K3/285;;H05K1/0326;;C08L61/14,C08F6/10;;C08G8/00;;C08F8/00;;C08G6/00;;C08G8/04;;C08G8/06;;C08G8/12;;C08G14/04;;C08G14/12;;C08G59/08;;C08G59/62;;C08L61/06;;C08L61/10;;C08L61/14;;C08L63/00;;H05K1/02;;H05K1/03;;H05K3/28,,0,0,,,,EXPIRED
87,CA,A1,CA 2346238 A1,101-904-034-187-197,2001-01-11,2001,CA 2346238 A,2000-04-03,US 29815399 A;;US 42164199 A;;US 0008963 W,1999-04-23,PHENOL-NOVOLACS WITH IMPROVED OPTICAL PROPERTIES,The specification discloses epoxidized products and compositions of a polyphenol of a phenol and glyoxal wherein the polyphenol prior to epoxidati on has an ultraviolet (UV) absorbance of at least 0.260 at 365 nanometers (nm) and/or at least 0.400 at 350 nm. The specification also discloses the manufacture and use of such epoxidized products.,BORDEN CHEM INC,GERBER ARTHUR H,,https://lens.org/101-904-034-187-197,Patent Application,no,0,0,7,25,0,B32B5/32;;C08G8/04;;C08G8/28;;C08G14/04;;C08G14/12;;C08G59/08;;C08L61/06;;C08L63/00;;H05K1/0266;;H05K1/0269;;H05K1/0326;;H05K1/0373;;H05K3/285;;C08G14/04;;C08G14/12;;H05K1/0373;;C08G8/28;;C08G59/08;;H05K1/0266;;C08L61/06;;H05K1/0269;;H05K3/285;;B32B5/32;;H05K1/0326;;C08G8/04;;C08L63/00,B32B5/32;;C08G8/04;;C08G8/28;;C08G14/04;;C08G14/12;;C08G59/08;;C08L61/06;;C08L63/00;;H05K1/02;;H05K1/03;;H05K3/28,,0,0,,,,DISCONTINUED
88,EP,B1,EP 0469811 B1,122-132-699-606-952,1994-11-30,1994,EP 91306900 A,1991-07-29,US 56220690 A;;US 61687990 A,1990-08-02,Accelerators for curing phenolic resole resins.,"There are disclosed methods and compositions for accelerating the hardening of phenolic resole resins having a pH of about 4.5 to 9.5 with lightburned magnesium oxide or magnesium hydroxide, with or without the addition of an ester functional hardening agent. Acceleration of hardening is achieved by incorporating into said compositions an effective quantity of a material which: increases the solubility of magnesium in the hardenable mixture; by certain amines; or by certain chelating agents. Accelerator compounds include those which provide chloride, sulfamate, nitrate, formate, and phosphite anions as well as selected tertiary amines.",BORDEN INC,GERBER ARTHUR HARRY,,https://lens.org/122-132-699-606-952,Granted Patent,yes,2,1,9,79,0,C04B26/122;;C04B35/634;;C04B35/63476;;C04B2111/00112;;C08G8/28;;C08K3/22;;C04B35/63476;;C04B35/634;;C04B26/122;;C04B2111/00112;;C08G8/28;;C08K3/22,C04B26/12;;C04B35/634;;C08G8/28;;C08K3/22;;C08L61/10,,0,0,,,,EXPIRED
89,US,A,US 5103443 A,133-401-140-143-776,1992-04-07,1992,US 57701390 A,1990-09-04,US 57701390 A,1990-09-04,Optical recording medium with high absorption and high reflectivity,"A thin film is formed on a plastic substrate that is preformed with recording tracks, either continuous or discontinuous, formed of a metal containing film on a thermoplastic substrate. Individually-identifiable recording elements arranged in rows are preferred. Initial reflection of the recording elements are reduced by etching or microscopically roughing the surface to produce discontinuities with dimensions less than one wavelength of the light being used to record on and read from the media. The rough surface may be created on the plastic before the application of the metallic film or the film itself may be roughened after application to the plastic. The resulting micromirrors can have about equal initial reflectivity and absorption of about fifty percent with little or no transmission. The location of the individual recording elements can be determined prior to recording and used as a gauge to permit compensation for changes in the scanning velocity of the reading or writing beam. One bit of digital information is recorded on each recording element either by leaving the reflectivity unchanged or by applying focused energy of sufficient intensity to melt or distort the plastic beneath the metal-containing film and thereby further decrease the reflectivity.",GERBER ARTHUR M,GERBER ARTHUR M,,https://lens.org/133-401-140-143-776,Granted Patent,yes,3,7,1,1,0,G11B7/013;;G11B7/013;;G11B7/00455;;G11B7/00455;;G11B7/26;;G11B7/26;;Y10S430/146;;Y10S430/146,G11B7/0045;;G11B7/013;;G11B7/26,369/100;;369/283;;369/284;;369/288;;X346 76L;;346/135.1;;430/270;;430/945,0,0,,,,EXPIRED
90,WO,A1,WO 1983/002938 A1,175-809-001-999-622,1983-09-01,1983,US 8300236 W,1983-02-23,US 35262682 A,1982-02-26,HYDRAULIC CEMENT MIXES AND PROCESS FOR IMPROVING HYDRAULIC CEMENT MIXES,"A hydraulic cement mix including hydraulic cement, aggregate, sufficient water to effect hydraulic setting of the cement, and an additive comprising a poly(hydroxyalkylated)polyethyleneamine or a poly(hydroxyethyl)polyethyleneimine or mixtures of each or both, the additive being present in an amount sufficient to increase the compressive strength of the hardened mix. Generally, the additive is present in a total amount of up to about 1.0% by weight based upon the weight of the cement, usually in an amount of between about 0.01% and about 0.25% by weight based upon the weight of the cement preferably in an amount in the range of about 0.02% to about 0.07% by weight.",MARTIN MARIETTA CORP,GERBER ARTHUR HARRY,,https://lens.org/175-809-001-999-622,Patent Application,yes,3,10,32,33,0,C04B24/12;;C04B24/32;;C04B24/12;;C04B24/32,C04B24/12;;C04B24/28;;C04B24/32,C1H HAG           HAG;;C1H H120          HAG;;C1H H620          HAG;;C1H H748          HAG;;C1H H757          HAG,0,0,,,,PATENTED
91,US,A,US 4811326 A,159-610-162-358-721,1989-03-07,1989,US 8764887 A,1987-08-20,US 8764887 A;;US 70073585 A,1985-02-11,Method of recording digital information on an array of equally spaced micromirrors,"A method of recording digital information on a thermoplastic substrate having an array of equally-spaced microscopic optically-alterable mirrors each supported by a mesa projecting from one surface of the substrate. The mirrors may be formed of a composite of gold and SiO.sub.2. Recording is by laser beam that reduces the reflectivity of selected mirrors. Each mirror is capable of recording one or more bits of digital information. After exposure, the mirrors retain enough reflectivity to be distinguishable from the intervening valleys. The mirrors serve as timing and tracking markers prior to and during recording, and during read-out. The area and location of each information bit is determined prior to recording: not as a result of the recording process. The mirrors may be scanned along parallel rows or diagonally across the rows.",GERBER ARTHUR M,GERBER ARTHUR M,MICROMIRROR CORPORATION A CO CORP (1988-09-26),https://lens.org/159-610-162-358-721,Granted Patent,yes,5,17,1,9,0,G11B7/00455;;G11B7/013;;G11B7/09;;G11B7/24;;G11B7/24085;;G11B7/26;;G11B7/26;;G11B7/24;;G11B7/013;;G11B7/09;;G11B7/24085;;G11B7/00455,G11B7/0045;;G11B7/007;;G11B7/013;;G11B7/09;;G11B7/24;;G11B7/26,369/109;;369/275;;369/100;;X346 76L;;346/135.1,3,1,033-738-873-986-840,10.1063/1.92805,"Craighead et al., Applied Physics Letters, vol. 39, No. 7, Oct./1981, pp. 532 534.;;Holmstrom et al., Deformation Recording Method , IBM Tech. Dis. Bulletin, vol. 10, No. 6, 11/1967, p. 760.;;Haller et al., IBM Tech. Dis. Bulletin, vol. 22, No. 3, 8/1979, p. 1234.",EXPIRED
92,EP,A4,EP 0101723 A4,168-982-426-549-008,1984-07-03,1984,EP 83901051 A,1983-02-23,US 35262682 A,1982-02-26,PROCESS FOR IMPROVING HYDRAULIC CEMENT MIXES.,,MARTIN MARIETTA CORP,GERBER ARTHUR HARRY,SANDOZ LIMITED (1986-02-19),https://lens.org/168-982-426-549-008,Search Report,no,1,0,32,33,0,C04B24/12;;C04B24/32;;C04B24/12;;C04B24/32,C04B24/12;;C04B24/28;;C04B24/32,,0,0,,,,EXPIRED
93,MX,A,MX 158901 A,181-771-909-213-331,1989-03-29,1989,MX 19633583 A,1983-02-21,US 35262682 A,1982-02-26,MEJORAS EN UNA COMPOSICION DE CEMENTO HIDRAULICO,,SANDOZ AG,GERBER ARTHUR HARRY,,https://lens.org/181-771-909-213-331,Granted Patent,no,0,0,32,33,0,C04B24/12;;C04B24/32;;C04B24/12;;C04B24/32,C04B24/12;;C04B24/28;;C04B24/32,,0,0,,,,EXPIRED
94,AT,T1,AT E232885 T1,185-488-203-217-05X,2003-03-15,2003,AT 96944433 T,1996-12-23,US 934395 P;;US 9620101 W,1995-12-27,REAKTIV-VERDÜNNER FÜR SÄUREHÄRTBARE PHENOLHARZE,,BORDEN CHEM INC,GERBER ARTHUR H,,https://lens.org/185-488-203-217-05X,Granted Patent,no,0,0,24,24,0,C08G8/08;;C08G8/28;;C08G8/10;;C08L61/06;;C08G8/08,C08L61/06;;C08G8/08;;C08G8/28,,0,0,,,,DISCONTINUED
95,CA,A1,CA 2118078 A1,185-331-405-398-930,1995-10-12,1995,CA 2118078 A,1994-10-13,US 22589094 A,1994-04-11,CURATIVES FOR PHENOLIC NOVOLACS,"A binder composition of a phenolic novolac resin and a (lower) alkoxylated triazine-formaldehyde resin curing agent is disclosed. The triazine resins have sufficient carbon atoms in the alkoxy groups so as to provide a curing agent having a water solubility of less than 15%. The binder cures at high temperatures so as to provide improved flow and prolonged workability to the composition. The compositions are useful in refractory applications having a need for high temperature curing agents such as for maintenance and repair within refractory vessels by gunning/spraying, manufacture of electrodes by the Soderberg method, and for use in blast furnace tap holes.",BORDEN INC,GERBER ARTHUR H,,https://lens.org/185-331-405-398-930,Patent Application,no,0,0,13,13,0,C04B35/634;;C04B35/63476;;C04B35/6348;;C04B35/66;;C08L61/06;;C08L61/28;;C04B35/63476;;C04B35/634;;C08L61/28;;C04B35/6348;;C04B35/66;;C08L61/06,C04B35/634;;C04B35/66;;C08L61/06;;C08L61/28,,0,0,,,,EXPIRED
96,IE,B1,IE 66350 B1,013-057-800-301-346,1995-12-27,1995,IE 274091 A,1991-08-01,US 56220690 A;;US 61687990 A,1990-08-02,Accelerators for curing phenolic resole resins,"There are disclosed methods and compositions for accelerating the hardening of phenolic resole resins having a pH of about 4.5 to 9.5 with lightburned magnesium oxide or magnesium hydroxide, with or without the addition of an ester functional hardening agent. Acceleration of hardening is achieved by incorporating into said compositions an effective quantity of a material which: increases the solubility of magnesium in the hardenable mixture; by certain amines; or by certain chelating agents. Accelerator compounds include those which provide chloride, sulfamate, nitrate, formate, and phosphite anions as well as selected tertiary amines.",BORDEN INC,GERBER ARTHUR HARRY,,https://lens.org/013-057-800-301-346,Granted Patent,no,0,0,9,79,0,C04B26/122;;C04B35/634;;C04B35/63476;;C04B2111/00112;;C08G8/28;;C08K3/22;;C04B35/63476;;C04B35/634;;C04B26/122;;C04B2111/00112;;C08G8/28;;C08K3/22,C04B26/12;;C04B35/634;;C08G8/28;;C08K3/22;;C08L61/10,,0,0,,,,EXPIRED
97,EP,A3,EP 0376432 A3,015-962-948-387-409,1991-07-03,1991,EP 89305715 A,1989-06-07,US 28809088 A,1988-12-22,LITHIUM-CONTAINING RESOLE COMPOSITION FOR MAKING A SHAPED REFRACTORY ARTICLE AND OTHER HARDENED ARTICLES,"The invention relates to the use of lithium ion-generating alkalizing agents in resole binder compositions useful for bonding aggregate materials to form refractory articles. Use of lithium-ion generating alkalizing agents produce resole resin binder compositions which, when cured by an ester functional curing agent, exhibit tensile and compression strengths superior to strengths obtained from compositions using sodium ion-generating or potassium ion-generating alkalizing agents.  ","BORDEN, INC.","GERBER, ARTHUR H.",,https://lens.org/015-962-948-387-409,Search Report,yes,0,0,11,11,0,B22C1/2253;;C04B26/122;;C04B35/634;;C04B35/63472;;C04B41/009;;C04B41/4823;;C04B41/63;;C04B2103/0008;;C04B2103/0093;;C08G8/10;;C08G8/24;;C08K5/10;;C04B35/63472;;C08K5/10;;C04B41/009;;C04B26/122;;C08G8/10;;C04B2103/0093;;C04B35/634;;C08G8/24;;C04B41/63;;C04B2103/0008;;B22C1/2253;;C04B41/4823,C04B35/632;;B22C1/22;;C04B26/12;;C04B35/634;;C04B41/48;;C04B41/63;;C08G8/10;;C08G8/24;;C08K5/10;;C08L61/10,,0,0,,,,EXPIRED
98,BR,A,BR 9103174 A,016-182-684-039-521,1992-05-05,1992,BR 9103174 A,1991-07-24,US 56220690 A,1990-08-02,RETARDADORES PARA CURA DE RESINAS RESOL FENOLICAS,,BORDEN INC,GERBER ARTHUR HARRY,,https://lens.org/016-182-684-039-521,Patent Application,no,0,0,8,79,0,C04B26/122;;C04B26/122;;C08K3/22;;C08K3/22,C08G8/10;;B24D3/28;;C04B26/12;;C08G8/00;;C08K3/22;;C08L61/04;;C08L61/10,,0,0,,,,DISCONTINUED
99,CA,C,CA 2052224 C,035-837-618-879-147,1998-01-20,1998,CA 2052224 A,1991-09-25,US 61687990 A,1990-11-21,ACCELERATORS FOR CURING PHENOLIC RESOLE RESINS,"There are disclosed methods and compositions for accelerating the hardening of phenolic resole resins having a pH of about 4.5 to 9.5 with lightburned magnesium oxide or magnesium hydroxide, with or without the addition of an ester functional hardening agent. Acceleration of hardening is achieved by incorporating into said compositions an effective quantity of a material which: increases the solubility of magnesium in the hardenable mixture; by certain amines; or by certain chelating agents. Accelerator compounds include those which provide chloride, sulfamate, nitrate, formate, and phosphite anions as well as selected tertiary amines.",BORDEN INC,GERBER ARTHUR HARRY,,https://lens.org/035-837-618-879-147,Granted Patent,no,0,0,6,79,0,,C08G8/28;;B22C1/22;;C08G8/00;;C08J3/24;;C08K3/00;;C08K3/22;;C08K3/26;;C08K5/04;;C08K5/10;;C08K5/13;;C08K5/16;;C08K5/3492;;C08L61/04;;C08L61/06,,0,0,,,,EXPIRED
100,IE,A1,IE 920919 A1,041-769-999-067-390,1993-02-24,1993,IE 920919 A,1992-03-23,US 74870791 A,1991-08-22,Refractory compositions,"Retarding the hardening of a composition containing a phenolic resin solution and a magnesia aggregate is effected by mixing into such composition a compound which provides an aspartate, fluoride, bifluoride, malate, tartrate, citrate, oxalate, phosphate or phosphonate anion to the composition or a tetraalkoxy silane, a partially hydrolysed tetraalkoxy silane, 2-, or 4-chlorophenol, or 2'-, or 4'-hydroxyacetophenone.",BORDEN CHEMICAL,GERBER ARTHUR HARRY,,https://lens.org/041-769-999-067-390,Patent Application,no,0,0,10,79,0,C04B26/122;;C04B35/043;;C04B35/634;;C04B35/63476;;C08K3/22;;C08K13/02;;C08L61/06;;C04B35/04;;C04B35/63476;;C08K13/02;;C04B26/122;;C08K3/22;;C04B35/634;;C04B35/043,C04B26/12;;C04B35/043;;C04B35/634;;C08K3/22;;C08K13/02;;C08L61/10,,0,0,,,,EXPIRED
101,US,A,US 5294649 A,064-126-582-769-165,1994-03-15,1994,US 4156193 A,1993-04-02,US 4156193 A;;US 56220690 A;;US 61687990 A;;US 94306592 A;;US 99596892 A,1990-08-02,Accelerators for curing phenolic resole resins,"There are disclosed methods and compositions for accelerating the hardening of phenolic resole resins having a pH of about 4.5 to 9.5 with lightburned magnesium oxide or magnesium hydroxide, with or without the addition of an ester functional hardening agent. Acceleration of hardening is achieved by incorporating into said compositions an effective quantity of a material which: increases the solubility of magnesium in the hardenable mixture; by certain amines; or by certain chelating agents. Accelerator compounds include those which provide chloride, sulfamate, nitrate, formate, and phosphite anions as well as selected tertiary amines.",BORDEN INC,GERBER ARTHUR H,BORDEN CHEMICAL INC (1996-06-11);;BORDEN CHEMICAL INC. A NEW JERSEY CORPORATION (2002-04-05),https://lens.org/064-126-582-769-165,Granted Patent,yes,24,20,1,79,0,C04B26/122;;C04B26/122;;C04B35/634;;C04B35/634;;C08G8/28;;C08G8/28;;C08K3/22;;C08K3/22,C04B26/12;;C04B35/634;;C08G8/28;;C08K3/22;;C08L61/10,523/145;;523/139;;525/504;;528/129,2,0,,,"Roczniak, Kryatyna Selected Crosslinking Catalytic Polycondensation Compounds Polimery, 29(3); 95 99 Mar. 1984.;;Rozniak, Kryatyna Selected Crosslinking Catalytic Polycondensation Compounds Zesz. Nauk Wyzsza Szk. Inz. Radomiu Materialozn. Chem., vol. 8, p. 283, 1985.",EXPIRED
102,AU,B2,AU 662256 B2,111-547-872-129-914,1995-08-24,1995,AU 1993/052010 A,1993-11-29,US 98824792 A,1992-12-09,Latent acid curable compositions,,BORDEN INC,GERBER ARTHUR HARRY,"BORDEN CHEMICAL, INC. (2003-06-19)",https://lens.org/111-547-872-129-914,Granted Patent,no,3,0,12,12,0,C08G8/28;;C08G8/28;;C04B26/122;;C04B26/122,C04B26/12;;C08G8/28;;C08L61/06,,0,0,,,,EXPIRED
