527,US,A1,US 2011/0147108 A1,040-410-710-061-08X,2011-06-23,2011,US 97107410 A,2010-12-17,US 97107410 A;;US 28724009 P,2009-12-17,"Four Wheel Drive, Zero Turn Radius Mower",A mower apparatus and method for making the same is provided. A mower apparatus may include a multi-wheel drive mower system having at least one mower blade and at least one front wheel positioned proximate the front of the mower system and at least one rear wheel positioned proximate the rear of the mower system. The mower apparatus may also include a zero turn assembly haying at least one caster wheel. The zero turn assembly may be rotatably attached to the multi-wheel drive mower system to provide the mower apparatus with the capability of operating in either a multi-wheel drive mode having at least the at least one front wheel and the at least one rear wheel engaging the ground or a zero turn radius mode having only the at least one caster wheel and the at least one rear wheel engaging the ground.,HECHT SR MICHAEL RUDOLF;;EVANS ARTHUR LEON,HECHT SR MICHAEL RUDOLF;;EVANS ARTHUR LEON,,https://lens.org/040-410-710-061-08X,Patent Application,yes,14,3,1,1,0,A01D75/28;;Y10T29/49826;;Y10T29/49826;;A01D75/28,B23P17/04;;B60K17/34;;B60K17/30,180/233;;280/99;;29/428,0,0,,,,DISCONTINUED
528,US,A,US 958484 A,100-961-280-646-808,1910-05-17,1910,US 1909/0474961 A,1909-01-29,US 1909/0474961 A,1909-01-29,ROTARY PRINTING-MACHINE.,,EVANS ARTHUR BURROUGHES;;WICHMANN GEORG CARL HEINRICH,EVANS ARTHUR BURROUGHES;;WICHMANN GEORG CARL HEINRICH,,https://lens.org/100-961-280-646-808,Granted Patent,no,0,8,1,1,0,B41F7/10;;B41F7/10,,,0,0,,,,EXPIRED
529,GB,A,GB 988878 A,018-987-831-749-998,1965-04-14,1965,GB 352762 A,1962-01-30,GB 352762 A,1962-01-30,Fluidised bed process for the production of titanium dioxide,"Titanium dioxide is recovered from above a hot fluidized bed in which, in the presence of a source of K, Rb or Cs, an oxygenating gas reacts with titanium tetrahalide other than TiF4. The K, Rb or Cs source may be added batchwise to the bed, giving a concentration by weight (estimated as oxide) with respect to the weight of the bed of 0.1-5%; or continuously, with concentration with respect to TiO2 produced of 2%; if 0.1-1% of a source of Na, Li or Group IIa or IIb elements be added to the bed, only 0.01-0.05% K, Rb or Cs is required. The sources of the elements may be salts, hydroxides or the elemental metals, e.g. as vapour. The source may be introduced, e.g. with a reactant, as a solid or liquid or a solution; the bed particles may be slurried with source solution and dried before use; or the source may itself form all or part of the bed particles, e.g. as potassium aluminium silicate. The titanium tetrahalide, e.g. TiCl4, may be introduced as a vapour; the oxygenating gas may be O2 with or without inert gas, e.g. as air; other gases, e.g. N2, may also be introduced. The bed temperature is 800 DEG -1200 DEG C. Additional heat may or may not be supplied, e.g. electrical heating, preheating one or more input gases, or burning a fuel, e.g. CO, in the bed with additional oxygenating gas. Bed particles, e.g. SiO2, ZrSiO4, Al2,O3 or TiO2, have size 50-2,000 m . Minor proportions of rutilizing agents, e.g. aluminium halide, zirconium tetrahalide, water vapour, or other TiO2 crystal-modifying agents, e.g. halides of Si, Sb and P, may be added. The TiO2 may be recovered from the effluent gas by use of a cyclone to remove larger particles and filtration to recover pigmentary TiO2. The gaseous halogen product may be separated by liquefaction and used to produce more titanium tetrahalide. In examples the pigmentary TiO2 recovered had rutile content of about 98%; after wet milling the bed material up to about 13% of the trahalide admitted was retained thereon as TiO2; in a contrasting run in which the source was omitted, 40% tetrahalide was retained. Specifications 761,770 and 986,660 are referred to.",BRITISH TITAN PRODUCTS,EVANS ARTHUR WALLACE;;ARKLESS KENNETH;;PEACOCK JOHN,,https://lens.org/018-987-831-749-998,Granted Patent,no,0,0,3,3,0,C01G23/07;;C01G23/07,C01G23/07,C1A APB4          APB4;;C1N N212          -;;C1N N213          -;;C1N N251          -;;C1N N261          -;;C1N N269          -;;C1N N275          -;;C1N N277          -;;C1N N279          -;;C1N N28X          -;;C1N N289          -;;C1N N29X          -;;C1N N30X          -;;C1N N300          -;;C1N N301          -;;C1N N302          -;;C1N N303          -;;C1N N347          -;;C1N N35Y          -;;C1N N354          -;;C1N N357          -;;C1N N358          -;;C1N N367          -;;C1N N382          -;;C1N N391          -;;C1N N402          -;;C1N N404          -;;C1N N410          -;;C1N N412          -;;C1N N414          -;;C1N N42X          -;;C1N N422          -;;C1N N432          -;;C1N N433          -;;C1N N436          -;;C1N N440          -;;C1N N464          -;;C1N N51Y          -;;C1N N540          -;;C1N N542          -;;C1N N543          -;;C1N N544          -;;C1N N545          -;;C1N N546          -;;C1N N547          -;;C1N N557          -;;C1N N558          -;;C1N N561          -;;C1N N589          -;;C1N N592          -;;C1N N593          -;;C1N N594          -;;C1N N609          -;;C1N N61X          -;;C1N N61Y          -;;C1N N613          -;;C1N N617          -;;C1N N626          -;;C1N N63X          -;;C1N N632          -;;C1N N639          -;;C1N N641          -;;C1N N656          -;;C1N N658          -;;C1N N66X          -;;C1N N660          -;;C1N N663          -;;C1N N666          -;;C1N N67Y          -;;C1N N684          -;;C1N N686          -;;C1N N690          -;;C1N N695          -;;C1N N696          -;;C1N N697          -;;C1N N699          -;;C1N N700          -;;C1N N701          -;;C1N N703          -;;C1N N708          -;;C1N N713          -;;C1N N714          -;;C1N N715          -;;C1N N716          -;;C1N N717          -;;C1N N72Y          -;;C1N N724          -;;C1N N732          -;;C1N N737          -;;C1N N738          -,0,0,,,,EXPIRED
530,CA,A,CA 756518 A,087-308-750-574-044,1967-04-11,1967,CA 756518D A,,CA 756518T A,,PROCESS FOR THE MANUFACTURE OF TITANIUM DIOXIDE,,BRITISH TITAN PRODUCTS,EVANS ARTHUR W;;PEACOCK JOHN;;ARKLESS KENNETH,,https://lens.org/087-308-750-574-044,Granted Patent,no,0,0,1,1,0,,,,0,0,,,,EXPIRED
531,DE,B,DE 1124472 B,088-403-954-659-156,1962-03-01,1962,DE B0052354 A,1959-03-04,GB 698758 A,1958-03-04,Verfahren und Vorrichtung zur Herstellung von Siliciumdioxyd,,BRITISH TITAN PRODUCTS,EVANS ARTHUR WALLACE;;HUGHES WILLIAM;;HARRIS BERNARD,,https://lens.org/088-403-954-659-156,Patent Application,no,1,0,2,2,0,B82Y30/00;;C01B33/183;;C01P2004/50;;C01P2004/52;;C01P2004/64;;C01P2006/10;;C01P2006/12;;C01P2006/60,C01B33/18,,0,0,,,,DISCONTINUED
532,GB,A,GB 2507125 A,113-248-016-322-183,2014-04-23,2014,GB 201218937 A,2012-10-22,GB 201218937 A,2012-10-22,Wheel securing apparatus for a bicycle with tyre lever.,"An apparatus 1 for holding a bicycle wheel in a bicycle frame, including: an elongate member 3; a first engaging member 5 positioned at one end of the elongate member 3; a second engaging member 7 positioned at an opposite end of the elongate member 3; and a pivotally moveable actuating member 9 for effecting movement of the second engaging member 7 towards the first engaging member 5; wherein the actuating member 7 includes holding means 11 for engaging with a spoke of the bicycle wheel. The first engaging member 5 may also be formed with a tyre lever (figure 5). In other embodiments (figures 6a-c) the actuating member may be extendable in length, and in another embodiment (figure 7) the actuating member is removable.",HALL WILLIAM ARTHUR JAMES;;EVANS THOMAS NORMAN,HALL WILLIAM ARTHUR JAMES;;EVANS THOMAS NORMAN,,https://lens.org/113-248-016-322-183,Patent Application,no,2,1,4,4,0,B25B27/0071;;B62K25/02;;B60C25/02;;B62K25/02;;B62K2206/00;;F16B2/185;;F16B5/07,B62K25/02;;B60C25/02,,0,0,,,,INACTIVE
533,US,A,US 1372267 A,008-988-776-250-677,1921-03-22,1921,US 28610519 A,1919-03-29,US 28610519 A,1919-03-29,Self-cleaning side-dump underfeed-furnace,,UNDERFEED STOKER COMPANY OF AM,BLACKBURN ARTHUR H;;DE VOE WILLIAM EVANS,,https://lens.org/008-988-776-250-677,Granted Patent,no,0,2,1,1,0,F23K3/10;;F23K3/10,F23K3/10,,0,0,,,,EXPIRED
534,US,A,US 3245818 A,129-865-052-052-971,1966-04-12,1966,US 22355562 A,1962-09-13,GB 3476061 A,1961-09-27,Vapor phase oxidation,,BRITISH TITAN PRODUCTS,WALLACE EVANS ARTHUR;;KENNETH ARKLESS;;JOHN PEACOCK,,https://lens.org/129-865-052-052-971,Granted Patent,no,3,8,2,2,0,C01G23/07;;C01G23/07,C01G23/07,,0,0,,,,EXPIRED
535,US,A,US 1902676 A,142-560-159-610-607,1933-03-21,1933,US 49655930 A,1930-11-18,GB 1902676X A,1929-12-19,Hardening alloy steels,,HUBERT SUTTON;;JOHN SIDERY ARTHUR;;BENJAMIN EVANS,HUBERT SUTTON;;JOHN SIDERY ARTHUR;;BENJAMIN EVANS,,https://lens.org/142-560-159-610-607,Granted Patent,no,0,5,1,1,0,C23C12/00;;C23C12/00,C23C12/00,,0,0,,,,EXPIRED
536,US,A,US 2398646 A,189-852-326-139-69X,1946-04-16,1946,US 47256043 A,1943-01-16,US 47256043 A,1943-01-16,Collating apparatus,,MCBEE CO,KARBACH JR ARTHUR P;;EVANS VERN D,,https://lens.org/189-852-326-139-69X,Granted Patent,no,0,10,1,1,0,B41L11/00;;B41L11/00,B41L11/00,,0,0,,,,EXPIRED
537,GB,A,GB 796735 A,086-113-135-805-895,1958-06-18,1958,GB 2150355 A,1955-07-25,GB 352315X A;;GB 190756X A,1955-07-25,Production of silicon dioxide,"Silicon dioxide is prepared by the oxidation of silicon tetrachloride vapour in a fluidized bed of inert solid particles. In the preferred process, the particles, which may be of silica, alumina, zircon, or nitrile, have sizes from 40m to 1000m , and the bed is maintained at a temperature of 500 DEG to 1200 DEG C. After passing through the bed, the products, silicon dioxide and chlorine, are cooled and separated, the chlorine being used to prepare further silicon tetrachloride. The silicon dioxide may either be washed with water, or treated with steam above 250 DEG C.",BRITISH TITAN PRODUCTS,EVANS ARTHUR WALLACE;;HUGHES WILLIAM;;HARRIS BERNARD,,https://lens.org/086-113-135-805-895,Granted Patent,no,0,2,4,4,0,B82Y30/00;;C01B33/183;;C01P2004/64;;C01P2006/12;;C01P2006/90;;B82Y30/00;;C01P2004/64;;C01P2006/12;;C01P2006/90;;C01B33/183,C01B33/18,C1A APB4          APB4,0,0,,,,EXPIRED
538,CA,A,CA 636015 A,093-793-282-473-902,1962-02-06,1962,CA 636015D A,,CA 636015T A,,PRODUCTION OF SILICON DIOXIDE,,BRITISH TITAN PRODUCTS,EVANS ARTHUR W;;HARRIS BERNARD;;HUGHES WILLIAM,,https://lens.org/093-793-282-473-902,Granted Patent,no,0,0,1,1,0,,,,0,0,,,,EXPIRED
539,CA,A,CA 435855 A,096-576-181-709-38X,1946-07-16,1946,CA 435855D A,,CA 435855T A,,COLLATING APPARATUS,,MCBEE CO,KARBACH ARTHUR P JR;;EVANS VERN D,,https://lens.org/096-576-181-709-38X,Granted Patent,no,0,0,1,1,0,,,,0,0,,,,EXPIRED
540,EP,A2,EP 0136810 A2,156-476-074-685-745,1985-04-10,1985,EP 84305806 A,1984-08-24,GB 8323995 A,1983-09-07,Temperature control during annealing.,"Temperature control at a weld (52) between a tube (51) and tube plate (53) having heat input from an inductive heating probe (50) to effect annealing of the weld is performed with the aid of a signal generating receptor coil (54) coupled with the probe (50). The signal from the coil (54) experiences a characteristic change when the temperature of the weld reaches the required annealing temperature and this signal is used to control the heat input to the weld. The receptor coil can be inside the tube (51), outside the tube (51), embracing a number of similar tubes (51) or may be inside an adjacent tube (51). At the anneal, the materials of the tube and weld reach their Curie point which brings about a permeability change. The invention also has application to annealing a braze between a ferritic repair tube and a ferritic tube in a tube plate as can arise during the repair of shell and tube heat exchangers used in nuclear systems.",ATOMIC ENERGY AUTHORITY UK,DUNCOMBE EDWARD;;THOMSON ALEXANDER;;EVANS ROBERT ARTHUR,,https://lens.org/156-476-074-685-745,Patent Application,yes,0,2,8,8,0,C21D11/00;;C21D9/50;;F28F9/18;;F28F21/083,C21D9/50;;C21D11/00,,0,0,,,,EXPIRED
541,DE,A1,DE 3024356 A1,006-297-530-523-078,1981-01-22,1981,DE 3024356 A,1980-06-27,GB 7923104 A,1979-07-03,VERFAHREN ZUR SENKUNG DER GELIERTEMPERATUR VON AUS MILCH ERHALTENEN MOLKEPROTEINEN,,EXPRESS DAIRY FOODS,PHILLIPS DAVID JOHN;;EVANS MERVYN THOMAS ARTHUR,,https://lens.org/006-297-530-523-078,Patent Application,no,0,0,17,17,0,A23J3/08,A23J1/20;;A23J3/00;;A23J3/08,,0,0,,,,DISCONTINUED
542,GB,A,GB 190324487 A,030-934-177-265-213,1904-09-15,1904,GB 190324487D A,1903-11-11,GB 190324487T A,1903-11-11,Improvements in Machines for Printing on Tin Plate or the like.,"24,487. Wichmann, G. C. H., and Evans, A. B. Nov. 11. Lithographic and like printing; feeding sheets.- A machine for printing on tin plates and the like has a roller c, Fig. 1, carrying an aluminium or similar printing-surface, suitably damped and inked in the usual manner, and transferring the design to a cylinder b having a rubber or like surface, from which the design is pressed on to the tin plate, carried round between the gripper and impression cylinder a and the printing cylinder b. The shaft b<1> of the cylinder b runs in eccentric bearings q, and the cylinder may be moved out of contact with the cylinders c, a, when desired, during the printing operation by pressing the pedal v. This action depresses the tumbler u, and allows the link s, reciprocated by the cam t<1>, roller t, and lever s<1> to pull over the lever r<1> during the printing operation, and thereby, through the lever r, an adjustable link, and the lever q<1>, partly turns the eccentric bushes q on each side of the machine and moves the cylinder b oat of action. When the pedal v rises through the action of a spring, the hook at the end of the link s no longer engages the pin r', and the cylinder b remains in working position. The sheets of tin are fed by hand, one by one, from a table f to a vertical steel face-plate g, Figs. 1 and 2, supported on a feed-board g<1> mounted on brackets g<2>. The lower edge passes between springs i adjustably mounted on a guidebar i<1> and smoothers k on the shaft k<1>, and finally rests on the tips of the arms h mounted on a shaft h<1>. The sheet is then gripped by the grippers e, and at the same time a cam m on the cylinder a, lowers the arms h through a roller n on a lever n<1> engaging a roller o on a lever o<1> on the shaft h<1>, and also moves backwards the smoothers k through the extra links and levers h<2>, k<2>. The sheet being vertical, its own weight helps to overcome its inertia, and it passes down between the guides l and the cylinder a, is printed on by the cylinder b, and pulled past the guides l<1>, Fig. 1, the hindmost edge springing outwards immediately it has passed the guides l<1>. At the same time the grippers e are turned backwards to release the front edge of the sheet, which falls printed side uppermost on the table l'. The grippers are opened by a pin p<1>, Fig. 2, mounted on an arm adjustable in position, engaging with a slot in a piece d<1> on the end of the gripper shaft, the grippers being turned backwards through nearly 180‹ in the slot a<1>, and are closed on the sheet by a similar pin p fixed to the framework, entering and leaving the other end of the slot in the piece d<1>, thereby turning the grippers forward.",WICHMANN GEORG CARL HEINRICH;;EVANS ARTHUR BURROUGHES,WICHMANN GEORG CARL HEINRICH;;EVANS ARTHUR BURROUGHES,,https://lens.org/030-934-177-265-213,Patent Application,no,0,0,1,1,0,,,,0,0,,,,DISCONTINUED
543,CA,A,CA 494277 A,044-849-313-186-619,1953-07-07,1953,CA 494277D A,,CA 494277T A,,CLOSURES FOR JAM JARS AND LIKE CONTAINERS,,METAL BOX CO LTD,EVANS ARTHUR J PERCIVAL;;STEPHENS WILLIAM A,,https://lens.org/044-849-313-186-619,Granted Patent,no,0,0,1,1,0,,,,0,0,,,,EXPIRED
544,WO,A1,WO 2014/028974 A1,089-710-396-872-863,2014-02-27,2014,AU 2013/000931 W,2013-08-22,AU 2012/903671 A,2012-08-24,DIAGNOSTIC MARKERS FOR SPONDYLOARTHROPATHIES AND USES THEREOF,This present invention discloses methods and agents for diagnosing the presence or risk of development of spondyloarthropathies in mammals. The methods and agents are based on the detection of a polymorphic nucleotide in a polymorphic site having reference sequence number rs116488202 on chromosome 6. The invention also discloses methods for the treatment or prevention of spondyloarthropathies based on the diagnostic methods of the invention.,UNIV QUEENSLAND;;UNIV BRISTOL,BROWN MATTHEW ARTHUR;;EVANS DAVID MEURIG FAENOR,,https://lens.org/089-710-396-872-863,Patent Application,yes,1,1,1,1,0,C12Q1/6883;;C12Q2600/156,C12Q1/68,,0,0,,,,PENDING
545,US,A,US 3043659 A,145-838-270-630-57X,1962-07-10,1962,US 72047058 A,1958-03-10,GB 352315X A;;GB 190756X A,1955-07-25,Process for the production of purified silicon dioxide,,BRITISH TITAN PRODUCTS,WILLIAM HUGHES;;WALLACE EVANS ARTHUR;;BERNARD HARRIS,,https://lens.org/145-838-270-630-57X,Granted Patent,no,12,10,4,4,0,B82Y30/00;;C01B33/183;;C01P2004/64;;C01P2006/12;;C01P2006/90;;B82Y30/00;;C01P2004/64;;C01P2006/12;;C01P2006/90;;C01B33/183,C01B33/18,,0,0,,,,EXPIRED
546,US,A,US 823835 A,184-212-923-313-329,1906-06-19,1906,US 1904/0222774 A,1904-08-30,US 1904/0222774 A,1904-08-30,MACHINE FOR PRINTING ON TIN PLATES OR THE LIKE.,,WICHMANN GEORG CARL HEINRICH;;EVANS ARTHUR BURROUGHES,WICHMANN GEORG CARL HEINRICH;;EVANS ARTHUR BURROUGHES,,https://lens.org/184-212-923-313-329,Granted Patent,no,0,0,1,1,0,B41F13/28;;B41F13/28,,,0,0,,,,EXPIRED
547,DE,A1,DE 1951247 A1,004-552-756-639-463,1970-05-27,1970,DE 1951247 A,1969-10-10,GB 4837968 A,1968-10-11,Modifiziertes Protein,,UNILEVER NV,ARTHUR EVANS MERVYN THOMAS;;IAN IRONS LAURENCE,,https://lens.org/004-552-756-639-463,Patent Application,no,0,0,8,8,0,A23J3/04;;A23J3/04;;A23L15/30;;A23L15/30;;Y10S530/853;;Y10S530/853,A23J3/00;;A23L15/00,,0,0,,,,DISCONTINUED
548,GB,A,GB 992414 A,009-358-758-908-260,1965-05-19,1965,GB 3476061 A,1961-09-27,GB 3476061 A,1961-09-27,Production of titanium dioxide by vapour phase oxidation,"TiO2 is produced by reacting a titanium tetrahalide (not fluoride), an aluminium halide (not fluoride), and an oxygenating gas in a fluidized bed of particles containing Si and O in chemical combination, the aluminium and titanium halides being introduced separately. Of the total bed particles having diameter 40-1000m , preferably at least 25% contain Si-O bonds, e.g. zircon sand ZrO2SiO2, sillimanite Al2O3SiO2, or pure SiO2. A bed temperature of 900-1200 DEG C. is maintained. Ti halide, preferably TiCl4, is introduced at 150-800 DEG C., and moisture may also be separately introduced. Al halide, preferably AlCl3 may be fed at 100-600 DEG C., in the oxygenating gas, e.g. O2, air, and is in a quantity such that 0.1-10% preferably 2-4% by weight of Al2O3 relative to TiO2 is produced. 60-80% of the TiO2 produced is contained in the effluent gas and can be recovered by known methods, while the remaining TiO2 is accreted on the bed particles which are continuously or intermittently removed and subjected to abrasion by wet or dry milling processes. A wet process, using fine sand ball mills, of particle size 250-1000m , and water is preferred, the sand being subsequently separated from the pigment by sieving or preferential settling.",BRITISH TITAN PRODUCTS,EVANS ARTHUR WALLACE;;ARKLESS KENNETH;;PEACOCK JOHN,,https://lens.org/009-358-758-908-260,Granted Patent,no,0,1,2,2,0,C01G23/07;;C01G23/07,C01G23/07,C1A APB4          APB4;;C1N N212          -;;C1N N213          -;;C1N N251          -;;C1N N261          -;;C1N N269          -;;C1N N277          -;;C1N N278          -;;C1N N279          -;;C1N N28X          -;;C1N N289          -;;C1N N30X          -;;C1N N300          -;;C1N N301          -;;C1N N302          -;;C1N N347          -;;C1N N35Y          -;;C1N N354          -;;C1N N357          -;;C1N N358          -;;C1N N367          -;;C1N N368          -;;C1N N391          -;;C1N N402          -;;C1N N404          -;;C1N N410          -;;C1N N412          -;;C1N N414          -;;C1N N42X          -;;C1N N422          -;;C1N N432          -;;C1N N433          -;;C1N N436          -;;C1N N440          -;;C1N N464          -;;C1N N51X          -;;C1N N51Y          -;;C1N N540          -;;C1N N541          -;;C1N N542          -;;C1N N543          -;;C1N N544          -;;C1N N546          -;;C1N N547          -;;C1N N548          -;;C1N N550          -;;C1N N551          -;;C1N N552          -;;C1N N557          -;;C1N N561          -;;C1N N588          -;;C1N N589          -;;C1N N59X          -;;C1N N59Y          -;;C1N N590          -;;C1N N591          -;;C1N N592          -;;C1N N593          -;;C1N N594          -;;C1N N604          -;;C1N N606          -;;C1N N608          -;;C1N N61X          -;;C1N N61Y          -;;C1N N613          -;;C1N N617          -;;C1N N626          -;;C1N N63X          -;;C1N N632          -;;C1N N633          -;;C1N N641          -;;C1N N656          -;;C1N N658          -;;C1N N66X          -;;C1N N660          -;;C1N N663          -;;C1N N666          -;;C1N N67Y          -;;C1N N675          -;;C1N N679          -;;C1N N684          -;;C1N N714          -;;C1N N715          -;;C1N N716          -;;C1N N729          -;;C1N N739          -;;C1N N74Y          -;;C1N N762          -;;C1N N763          -;;C1N N773          -,0,0,,,,EXPIRED
549,GB,B,GB 2146435 B,036-202-660-887-99X,1987-02-18,1987,GB 8323995 A,1983-09-07,GB 8323995 A,1983-09-07,TEMPERATURE CONTROL DURING ANNEALING,,ATOMIC ENERGY AUTHORITY UK,DUNCOMBE EDWARD;;THOMPSON ALEXANDER;;EVANS ROBERT ARTHUR,,https://lens.org/036-202-660-887-99X,Granted Patent,no,0,0,8,8,0,C21D11/00;;C21D9/50;;F28F9/18;;F28F21/083,C21D9/50;;C21D11/00,G1N19B2M1;;G1N19F3;;G1N19F7E1;;G1N19H14;;G1N19X1;;G3RA623;;G3RB4723;;G3RB475;;G3RBQ59;;U1S1612;;U1S1673;;U1S1905;;U1S1969;;U1S2184;;U1SG1N;;U1SG3R,0,0,,,,EXPIRED
550,US,S,US D0266693 S,063-881-802-077-201,1982-10-26,1982,US 19632580 F,1980-10-14,US 19632580 F,1980-10-14,Coal burning stove,,MOHAWK IND INC,LEAVENS RICHARD;;EVANS ARTHUR;;FUHRMANN WILLIAM F,MOHAWK INDUSTRIES INC. A CORP. OF MASS (1980-09-19),https://lens.org/063-881-802-077-201,Design Right,yes,2,0,1,1,0,,,D23/97;;D2303,0,0,,,,EXPIRED
551,FR,A,FR 400509 A,053-719-526-460-424,1909-07-29,1909,FR 400509D A,1909-03-08,GB 400509X A,1908-03-20,Perfectionnements dans les machines rotatives à imprimer,,ARTHUR BURROUGHS EVANS;;GEORG CARL HEINRICH WICHMANN,EVANS ARTHUR BURROUGHS;;WICHMANN GEORG CARL HEINRICH,,https://lens.org/053-719-526-460-424,Granted Patent,no,0,1,1,1,0,B41F11/00,B41F11/00,"XVII, 2",0,0,,,,EXPIRED
552,US,A,US 5355079 A,071-568-958-302-89X,1994-10-11,1994,US 175993 A,1993-01-07,US 175993 A,1993-01-07,Probe assembly for testing integrated circuit devices,"A probe assembly adapted to test an integrated circuit (IC) device whose contact pads are deployed in a predetermined pattern in a common plane. The assembly includes a film membrane having a planar dielectric contactor zone and an array of suspension wings radiating from this zone. The wings are clamped at their ends by a mounting ring surrounding a port in a printed circuit board which exposes the contactor zone suspended below the board to the IC device to be tested, the ring being secured to the board. Deployed in a matching pattern on the exposed face of the contactor zone and cantilevered therefrom to assume an angle with respect thereto are spring contact fingers that are extensions of traces running along the wings of the membrane to leads on the printed circuit board. These leads extend to respective test terminals on the board which are connectable to electronic instrumentation for conducting tests on the IC device. When the IC device is raised to bring its contact pads into engagement with the spring fingers, this action causes the fingers to flex inwardly, and in doing so to scrub the contact pads and thereby ensure effective electrical contact therewith.",WENTWORTH LAB INC,EVANS ARTHUR;;BAKER JOSEPH R;;LANDER JACK,WENTWORTH LABORATORIES INC (1992-11-20),https://lens.org/071-568-958-302-89X,Granted Patent,yes,12,98,1,1,0,G01R1/07342;;G01R1/0735;;G01R1/07342;;G01R1/0735,G01R1/073,H2E EAHC          EAHC;;H2E EAHC          EAHCX;;H2E EAHCX         EAHCX,0,0,,,,EXPIRED
553,GB,B,GB 2507125 B,084-142-726-245-869,2017-01-11,2017,GB 201218937 A,2012-10-22,GB 201218937 A,2012-10-22,Apparatus for holding a bicycle wheel in a bicycle frame,,WILLIAM ARTHUR JAMES HALL;;THOMAS NORMAN EVANS,WILLIAM ARTHUR JAMES HALL;;THOMAS NORMAN EVANS,,https://lens.org/084-142-726-245-869,Granted Patent,no,2,0,4,4,0,B25B27/0071;;B62K25/02;;B60C25/02;;B62K25/02;;B62K2206/00;;F16B2/185;;F16B5/07,B62K25/02;;B60C25/02,,0,0,,,,INACTIVE
554,FR,A1,FR 2460630 A1,135-064-974-580-129,1981-01-30,1981,FR 8014855 A,1980-07-03,GB 7923104 A,1979-07-03,PROCEDE POUR ABAISSER LA TEMPERATURE DE GELIFICATION DES PROTEINES DE PETIT-LAIT OBTENUES A PARTIR DU LAIT,"<P>L'INVENTION A POUR OBJET UN PROCEDE POUR ABAISSER LA TEMPERATURE DE GELIFICATION DE PROTEINES DE PETIT-LAIT DERIVANT DU LAIT.</P><P>SELON L'INVENTION, ON MAINTIENT UNE SOLUTION AQUEUSE DE CES PROTEINES DE PETIT-LAIT ENTIER, A UNE TEMPERATURE ELEVEE D'AU MOINS 70C POUR ACCROITRE LE NOMBRE DES RADICAUX MERCAPTO SUSCEPTIBLES DE REAGIR ET ON CHOISIT LA DUREE PENDANT LAQUELLE ON MAINTIENT LES PROTEINES A LA TEMPERATURE ELEVEE ET LE PH DE LA SOLUTION DE FACON A EVITER LA PRECIPITATION, LA GELIFICATION ET LA COAGULATION DES PROTEINES ALORS QU'ELLES SONT A TEMPERATURE ELEVEE ET ON REFROIDIT LA SOLUTION OBTENUE.</P>",EXPRESS DAIRY FOODS,PHILLIPS DAVID JOHN;;EVANS MERVYN THOMAS ARTHUR,,https://lens.org/135-064-974-580-129,Patent Application,no,1,0,17,17,0,A23J3/08,A23J1/20;;A23J3/00;;A23J3/08,,0,0,,,,EXPIRED
