200,US,A,US 4055534 A,171-684-427-051-546,1977-10-25,1977,US 63199675 A,1975-11-14,US 63199675 A,1975-11-14,Upgraded aromatic polyester material in powder form,"A process for upgrading polyesters derived from aromatic dicarboxylic acids which comprises reaction of the polyester material (both virgin and scrap) in an aprotic polar solvent with any of the following: A. diisocyanates represented by the general formula R(NCO).sub.2 with difunctional reagents in which the functionality is selected from --OH, --NH and/or --COOH; and, B. isocyanate terminated polymers alone or with the above difunctional reagents. The invention also includes stabilization of the products obtained from the above, with organic phosphites. The polyester products, whether or not stabilized, are found to be upgraded with respect to both molecular weight and processability as compared with the starting material and are readily recoverable in powder form which is most desirable for subsequent use.",HORIZONS INC,GERBER ARTHUR H,,https://lens.org/171-684-427-051-546,Granted Patent,yes,8,13,4,4,0,C08G18/4205;;C08G18/4205;;C08G18/0852;;C08G18/0852;;C08G18/10;;C08G18/10;;C08G18/4009;;C08G18/4009,C08G18/00;;C08G18/08;;C08G18/10;;C08G18/40;;C08G18/42;;C08G18/46;;C08G18/65,260 457 PH,0,0,,,,EXPIRED
201,MY,A,MY 122693 A,180-098-328-235-811,2006-04-29,2006,MY PI20004014 A,2000-08-30,US 38896699 A,1999-09-02,DIOLEFIN/HYDROXYARYL CONDENSATES AND CATALYST THEREFOR,"A CATALYST COMPOSITION COMPRISING TRIFLUOROMETHANESULFONIC ACID (ALSO REFERRED TO AS TRIFLIC ACID) AND A SUFFICIENT QUANTITY OF A SUBSTANCE (ALSO REFERRED TO AS A RETARDER) TO DECREASE BUT NOT ELIMINATE THE CATALYTIC ACTIVITY OF THE ACID IS DISCLOSED. ALSO DISCLOSED, IS A METHOD AND COMPOSITION FOR CONDENSING A HYDROXYARYL WITH A DIENE BY USE OF THE CATALYST COMPOSITION. THE METHOD IS CAPABLE OF PRODUCING CONDENSATES HAVING: A MOLE RATIO OF 1 MOLE OF THE DIENE TO ONE MOLE OF THE HYDROXYARYL; ONE MOLE OF DIENE TO TWO MOLES OF THE HYDROXYARYL AS WELL AS HIGHER MOLECULAR WEIGHT PRODUCTS SUCH AS RESINS BY CHANGES IN TEMPERATURE, TIME OF REACTION, TYPE AND QUANTITY OF RETARDER AND OTHER VARIABLES",HEXION SPECIALTY CHEMICALS INC,GERBER ARTHUR H,,https://lens.org/180-098-328-235-811,Granted Patent,no,0,0,15,15,0,B01J31/0227;;B01J31/0237;;B01J31/0247;;B01J31/06;;B01J2231/323;;C07C37/14;;C07C41/06;;C07C37/88;;C07C2601/16;;C07C2603/68;;B01J31/0237;;B01J31/0247;;B01J31/06;;C07C37/14;;C07C37/88;;C07C41/06;;B01J2231/323;;B01J31/0227;;B01J31/06;;B01J2231/323;;C07C37/14;;B01J31/0237;;C07C41/06;;B01J31/0247;;C07C37/88;;C07C2603/68;;C07C2601/16,C07C37/14;;B01J31/02;;B01J31/06;;C07B61/00;;C07C39/06;;C07C39/12;;C07C39/23;;C07C41/05;;C07C41/06;;C07C43/243,,0,0,,,,EXPIRED
202,EP,A1,EP 1439955 A1,188-861-642-751-846,2004-07-28,2004,EP 02728442 A,2002-03-12,US 0207333 W;;US 94096101 A,2001-08-28,HIGH NITROGEN CONTAINING TRIAZINE-PHENOL-ALDEHYDE CONDENSATE,,BORDEN CHEM INC,GERBER ARTHUR H,,https://lens.org/188-861-642-751-846,Patent Application,yes,0,0,7,7,0,B32B5/28;;B32B27/04;;B32B27/38;;B32B27/42;;C08G14/06;;C08G14/10;;C08L61/34;;H05K1/0346;;Y10T428/31511;;Y10T428/24994;;Y10T428/249994;;C07D251/72;;Y10T428/31511;;Y10T428/24994;;Y10T428/249994;;B32B5/28;;C08G14/06;;C08L61/34;;B32B27/42;;C08G14/10;;B32B27/04;;H05K1/0346;;B32B27/38,C08J5/24;;B32B5/28;;B32B27/04;;B32B27/38;;B32B27/42;;C08G14/06;;C08G14/09;;C08G14/10;;C08G59/62;;C08L61/34;;H05K1/03,,0,0,,,,DISCONTINUED
203,CA,C,CA 2118078 C,001-564-964-248-212,2002-02-26,2002,CA 2118078 A,1994-10-13,US 22589094 A,1994-04-11,CURATIVES FOR PHENOLIC NOVOLACS,"A binder composition of a phenolic novolac resin and a (lower) alkoxylated triazine-formaldehyde resin curing agent is disclosed. The triazine resins have sufficient carbon atoms in the alkoxy groups so as to provide a curing agent having a water solubility of less than 15%. The binder cures at high temperatures so as to provide improved flow and prolonged workability to the composition. The compositions are useful in refractory applications having a need for high temperature curing agents such as for maintenance and repair within refractory vessels by gunning/spraying, manufacture of electrodes by the Soderberg method, and for use in blast furnace tap holes.",,GERBER ARTHUR HARRY,,https://lens.org/001-564-964-248-212,Granted Patent,no,0,0,13,13,0,C04B35/634;;C04B35/63476;;C04B35/6348;;C04B35/66;;C08L61/06;;C08L61/28;;C04B35/63476;;C04B35/634;;C08L61/28;;C04B35/6348;;C04B35/66;;C08L61/06,C04B35/634;;C04B35/66;;C08L61/06;;C08L61/28,,0,0,,,,EXPIRED
204,WO,A1,WO 1997/024385 A1,014-424-095-870-559,1997-07-10,1997,US 9620101 W,1996-12-23,US 934395 P,1995-12-27,REACTIVE DILUENTS FOR ACID CURABLE PHENOLIC COMPOSITIONS,"Disclosed are acid hardenable phenolic resin compositions and novolac compositions modified with about 5 to about 15 % by weight of at least one reactive diluent selected from the group consisting of benzylic alcohol, benzylic ether, ethylene glycol, 1,3-butylene glycol, monoallyl or methylallyl ethers of poly(methylol)alkanes, monoallyl ether of glycerine, allyl or methallyl glycidyl ether, N-acylated arylamine, N-acylated naphthylamine, N-substituted arylsulfonamide, and N-substituted arylamine. The reactive diluent can be used to improve impact resistance and flexibility of the acid hardenable phenolic resin. Preferably, the methods for modifying mix life of acid hardenable phenolic resin by use of aryl phosphite and benzylic alcohol, and methods for modifiying novolac resins, as well as methods for making the present compositions and products, such as coiled filament pipe and laminate panels, employing the compostions are also disclosed.",BORDEN INC;;GERBER ARTHUR H,GERBER ARTHUR H,,https://lens.org/014-424-095-870-559,Patent Application,yes,3,0,24,24,0,C08G8/08;;C08G8/28;;C08G8/10;;C08L61/06;;C08G8/08,C08G8/08;;C08L61/06;;C08G8/28,,0,0,,,,PATENTED
205,TW,B,TW I284651 B,065-859-368-971-340,2007-08-01,2007,TW 90113559 A,2001-06-05,US 58760800 A;;US 59963300 A;;US 76581901 A,2000-06-05,Glyoxal-phenolic condensates with enhanced fluorescence,"Glyoxal-phenolic condensates, epoxidized products thereof, as well as their method of manufacture are disclosed. The condensates and epoxidized products have exceptionally high fluorescence as well as good ultraviolet absorbance. There is also disclosed compositions and laminates containing the condensates and epoxidized products thereof.",HEXION SPECIALTY CHEMICALS INC,GERBER ARTHUR H,,https://lens.org/065-859-368-971-340,Granted Patent,no,0,0,19,23,0,C08G8/04;;C08G8/24;;C08G8/28;;C08G14/04;;C08G14/12;;C08L61/06;;C08L61/14;;H05K1/0326;;C08G8/04,C08J5/24;;C07B61/00;;C07C37/20;;C07C39/15;;C08G8/00;;C08G8/24;;C08G8/28;;C08G14/04;;C08G14/12;;C08G59/08;;C08G59/62;;C08L61/06;;C08L61/14;;C09K11/06;;H05K1/03,,0,0,,,,EXPIRED
206,CN,A,CN 1209144 A,086-645-172-800-142,1999-02-24,1999,CN 96180130 A,1996-12-23,US 934395 P,1995-12-27,Reactive diluents for acid curable phenolic compositions,,BORDEN INC,GERBER ARTHUR H,"HANSEN SPECIALTY CHEMICALS CO., LTD. (2007-08-08)",https://lens.org/086-645-172-800-142,Patent Application,no,0,4,24,24,0,C08G8/08;;C08G8/28;;C08G8/10;;C08L61/06;;C08G8/08,C08L61/06;;C08G8/08;;C08G8/28,,0,0,,,,EXPIRED
207,EP,A1,EP 1290054 A1,077-449-388-259-274,2003-03-12,2003,EP 01939746 A,2001-05-31,US 0117551 W;;US 58760800 A;;US 59963300 A;;US 76581901 A,2000-06-05,GLYOXAL-PHENOLIC CONDENSATES WITH ENHANCED FLUORESCENCE,"Glyoxal-phenolic condensates, epoxidized products thereof, as well as their method of manufacture are disclosed. The condensates and epoxidized products have exceptionally high fluorescence as well as good ultraviolet absorbance. There is also disclosed compositions and laminates containing the condensates and epoxidized products thereof.",BORDEN CHEM INC,GERBER ARTHUR H,"MOMENTIVE SPECIALTY CHEMICALS INC. (2011-10-26);;HEXION SPECIALTY CHEMICALS, INC. (2007-01-17);;BORDEN CHEMICAL, INC. (2003-08-06)",https://lens.org/077-449-388-259-274,Patent Application,yes,0,0,19,23,0,C08G8/04;;C08G8/24;;C08G8/28;;C08G14/04;;C08G14/12;;C08L61/06;;C08L61/14;;H05K1/0326;;C08G8/04,C08J5/24;;C07B61/00;;C07C37/20;;C07C39/15;;C08G8/00;;C08G8/04;;C08G8/24;;C08G8/28;;C08G14/04;;C08G14/12;;C08G59/08;;C08G59/62;;C08L61/06;;C08L61/14;;C09K11/06;;H05K1/03,,0,0,,,,EXPIRED
208,WO,A1,WO 2000/017243 A1,076-431-779-481-102,2000-03-30,2000,US 9904799 W,1999-03-05,US 15858498 A,1998-09-22,PHENOL-NOVOLACS WITH IMPROVED OPTICAL PROPERTIES,"The specification discloses a method for the manufacture of a fluorescent polyphenolic product with high UV absorbance, its subsequent epoxidation as well as polyphenolic products and epoxidized derivatives and compositions thereof. The polyphenolic products are prepared by heating glyoxal at a temperature of about 80 °C to about 100 °C with a molar excess of a phenol in the presence of an acidic catalyst which is eliminated from the reaction mixture at a temperature about 170 °C. The total mole ratio of glyoxal to phenol charged to the reaction mixture is about 0.15 to 0.22 moles of glyoxal for each mole of phenol. The glyoxal is added continuously or by stepwise additions to the phenol so as to keep the aldehyde units in the reaction mixture to less than about 70% of the aldehyde units in the total quantity of glyoxal to be charged for making the polyphenol. Water is distilled stepwise or continuously from the reaction mixture. The catalyst is removed from the reaction mixture by further distilling the reaction mixture, generally at higher temperatures.",BORDEN CHEM INC,GERBER ARTHUR H,,https://lens.org/076-431-779-481-102,Patent Application,yes,3,3,28,28,0,C08G8/04;;C08G14/04;;C08G14/12;;C08G59/08;;C08L61/06;;C08L61/14;;C08L63/00;;H05K1/0266;;H05K1/0269;;H05K1/0326;;H05K1/0373;;H05K3/285;;C08G14/12;;C08G8/04;;C08G8/28;;C08G59/08;;C08L61/14;;C08L63/00;;H05K1/0269;;H05K1/0326;;H05K1/0373;;H05K3/285;;C08L61/06;;C08G14/12;;H05K1/0269;;C08G14/04;;C08G8/04;;C08G59/08;;H05K1/0266;;H05K1/0373;;C08L63/00;;H05K3/285;;H05K1/0326;;C08L61/14,C08G8/04;;C08G14/04;;C08G14/12;;C08G59/08;;C08G59/62;;C08L61/06;;C08L61/10;;C08G8/00;;C08L61/14;;C08L63/00;;H05K1/02;;H05K1/03;;H05K3/28,,1,0,,,"""Ecyclopedia of Polymer Science and Engineering"", JOHN WILLEY & SONS, XP002907184",PATENTED
209,CA,A,CA 1249306 A,095-215-983-730-682,1989-01-24,1989,CA 495205 A,1985-11-13,US 67077284 A,1984-11-13,ADDITIVE FOR HYDRAULIC CEMENT MIXES,"ADDITIVE FOR HYDRAULIC CEMENT MIXES A hydraulic cement mix contains a poly(N-methylol) glycoluril as a set accelerator, optionally together with one or more known set accelerators selected from water-soluble salts and alkanolamines.",SANDOZ LTD,GERBER ARTHUR H,,https://lens.org/095-215-983-730-682,Granted Patent,no,0,0,19,20,0,C04B24/128;;C04B28/02;;C09K3/00;;C04B24/12;;C04B28/02;;C04B24/128,C04B24/12;;C04B24/16;;C04B28/02;;C09K3/00,261-50,0,0,,,,EXPIRED
210,DE,T2,DE 69422385 T2,089-293-230-952-180,2000-07-06,2000,DE 69422385 T,1994-10-06,US 22589094 A,1994-04-11,Härtungsmittel für phenolische Novolacke,"A binder composition of a phenolic novolac resin and a (lower) alkoxylated triazine-formaldehyde resin curing agent is disclosed. The triazine resins have sufficient carbon atoms in the alkoxy groups so as to provide a curing agent having a water solubility of less than 15%. The binder cures at high temperatures so as to provide improved flow and prolonged workability to the composition. The compositions are useful in refractory applications having a need for high temperature curing agents such as for maintenance and repair within refractory vessels by gunning/spraying, manufacture of electrodes by the Soderberg method, and for use in blast furnace tap holes.",BORDEN CHEM INC,GERBER ARTHUR HARRY,,https://lens.org/089-293-230-952-180,Granted Patent,no,0,0,13,13,0,C04B35/634;;C04B35/63476;;C04B35/6348;;C04B35/66;;C08L61/06;;C08L61/28;;C04B35/63476;;C04B35/634;;C08L61/28;;C04B35/6348;;C04B35/66;;C08L61/06,C04B35/634;;C04B35/66;;C08L61/06;;C08L61/28,,0,0,,,,EXPIRED
211,NZ,A,NZ 250179 A,119-130-412-701-497,1995-04-27,1995,NZ 25017993 A,1993-11-10,US 98824792 A,1992-12-09,ACID-HARDENABLE PHENOLIC RESIN COMPOSITION COMPRISING AN ARYL PHOSPHITE AND OPTIONALLY FURFURYL ALCOHOL TO ACCELERATE HARDENING,,BORDEN INC,GERBER ARTHUR HARRY,,https://lens.org/119-130-412-701-497,Patent Application,no,0,0,12,12,0,C08G8/28;;C08G8/28;;C04B26/122;;C04B26/122,C04B26/12;;C08G8/28;;C08L61/06,,0,0,,,,PENDING
212,BR,A,BR 8307707 A,138-615-573-024-102,1985-03-19,1985,BR 8307707 A,1983-12-14,US 48406283 A;;US 8301956 W,1983-04-11,MISTURA HIDRAULICA DE CIMENTO E PROCESSO PARA ACELERAR SEU ENDURECIMENTO,,MARTIN MARIETTA CORP,GERBER ARTHUR H,,https://lens.org/138-615-573-024-102,Patent Application,no,0,0,3,18,0,,C04B22/08;;C04B22/12;;C04B22/14;;C04B24/12;;C04B28/04,,0,0,,,,DISCONTINUED
213,AU,A,AU 1999/029841 A,140-557-519-561-037,2000-04-10,2000,AU 1999/029841 A,1999-03-05,US 15858498 A;;US 9904799 W,1998-09-22,Phenol-novolacs with improved optical properties,"The specification discloses a method for the manufacture of a fluorescent polyphenolic product with high UV absorbance, its subsequent epoxidation as well as polyphenolic products and epoxidized derivatives and compositions thereof. The polyphenolic products are prepared by heating glyoxal at a temperature of about 80 DEG C. to about 100 DEG C. with a molar excess of a phenol in the presence of an acidic catalyst which is eliminated from the reaction mixture at a temperature below about 170 DEG C. The total mole ratio of glyoxal to phenol charged to the reaction mixture is about 0.15 to 0.22 moles of glyoxal for each mole of phenol. The glyoxal is added continuously or by stepwise additions to the phenol so as to keep the aldehyde units in the reaction mixture to less than about 70% of the aldehyde units in the total quantity of glyoxal to be charged for making the polyphenol. Water is distilled stepwise or continuously from the reaction mixture. The catalyst is removed from the reaction mixture by further distilling the reaction mixture, generally at higher temperatures. After removal of the catalyst, unreacted phenol is removed by distillation and the reaction mixture is heated at a temperature of about 175 DEG C. to 200 DEG C. for about 0.25 hours to about 3 hours to produce a polyphenolic reaction product having high fluorescence, high UV absorbance and high solubility in organic solvents. The polyphenolic reaction product can be epoxidized by conventional means and such epoxy products used in the manufacture of laminates, coatings and adhesives.",BORDEN CHEM INC,GERBER ARTHUR H,"BORDEN CHEMICAL, INC. (2003-06-19)",https://lens.org/140-557-519-561-037,Patent Application,no,0,0,28,28,0,C08G8/04;;C08G14/04;;C08G14/12;;C08G59/08;;C08L61/06;;C08L61/14;;C08L63/00;;H05K1/0266;;H05K1/0269;;H05K1/0326;;H05K1/0373;;H05K3/285;;C08G14/12;;C08G8/04;;C08G8/28;;C08G59/08;;C08L61/14;;C08L63/00;;H05K1/0269;;H05K1/0326;;H05K1/0373;;H05K3/285;;C08L61/06;;C08G14/12;;H05K1/0269;;C08G14/04;;C08G8/04;;C08G59/08;;H05K1/0266;;H05K1/0373;;C08L63/00;;H05K3/285;;H05K1/0326;;C08L61/14,C08G8/00;;C08G8/04;;C08G14/04;;C08G14/12;;C08G59/08;;C08G59/62;;C08L61/06;;C08L61/10;;C08L61/14;;C08L63/00;;H05K1/02;;H05K1/03;;H05K3/28,,0,0,,,,EXPIRED
214,NO,L,NO 20002395 L,185-989-168-707-058,2000-06-30,2000,NO 20002395 A,2000-05-08,US 15858498 A;;US 9904799 W,1998-09-22,Fenol-novolaker med forbedrede optiske egenskaper,"The specification discloses a method for the manufacture of a fluorescent polyphenolic product with high UV absorbance, its subsequent epoxidation as well as polyphenolic products and epoxidized derivatives and compositions thereof. The polyphenolic products are prepared by heating glyoxal at a temperature of about 80 DEG C. to about 100 DEG C. with a molar excess of a phenol in the presence of an acidic catalyst which is eliminated from the reaction mixture at a temperature below about 170 DEG C. The total mole ratio of glyoxal to phenol charged to the reaction mixture is about 0.15 to 0.22 moles of glyoxal for each mole of phenol. The glyoxal is added continuously or by stepwise additions to the phenol so as to keep the aldehyde units in the reaction mixture to less than about 70% of the aldehyde units in the total quantity of glyoxal to be charged for making the polyphenol. Water is distilled stepwise or continuously from the reaction mixture. The catalyst is removed from the reaction mixture by further distilling the reaction mixture, generally at higher temperatures. After removal of the catalyst, unreacted phenol is removed by distillation and the reaction mixture is heated at a temperature of about 175 DEG C. to 200 DEG C. for about 0.25 hours to about 3 hours to produce a polyphenolic reaction product having high fluorescence, high UV absorbance and high solubility in organic solvents. The polyphenolic reaction product can be epoxidized by conventional means and such epoxy products used in the manufacture of laminates, coatings and adhesives.",BORDEN CHEM INC,GERBER ARTHUR H,,https://lens.org/185-989-168-707-058,Abstract,no,0,0,28,28,0,C08G8/04;;C08G14/04;;C08G14/12;;C08G59/08;;C08L61/06;;C08L61/14;;C08L63/00;;H05K1/0266;;H05K1/0269;;H05K1/0326;;H05K1/0373;;H05K3/285;;C08G14/12;;C08G8/04;;C08G8/28;;C08G59/08;;C08L61/14;;C08L63/00;;H05K1/0269;;H05K1/0326;;H05K1/0373;;H05K3/285;;C08L61/06;;C08G14/12;;H05K1/0269;;C08G14/04;;C08G8/04;;C08G59/08;;H05K1/0266;;H05K1/0373;;C08L63/00;;H05K3/285;;H05K1/0326;;C08L61/14,C08G8/04;;C08G14/04;;C08G14/12;;C08G59/08;;C08G8/00;;C08G59/62;;C08L61/06;;C08L61/10;;C08L61/14;;C08L63/00;;H05K1/02;;H05K1/03;;H05K3/28,,0,0,,,,DISCONTINUED
215,NO,L,NO 20025682 L,184-519-159-438-201,2003-01-24,2003,NO 20025682 A,2002-11-26,US 58760800 A;;US 59963300 A;;US 76581901 A;;US 0117551 W,2000-06-05,Glyoksal-fenolkondensater med ökt fluorescens,"Glyoxal-phenolic condensates, epoxidized products thereof, as well as their method of manufacture are disclosed. The condensates and epoxidized products have exceptionally high fluorescence as well as good ultraviolet absorbance. There is also disclosed compositions and laminates containing the condensates and epoxidized products thereof.",BORDEN CHEM INC,GERBER ARTHUR HARRY,,https://lens.org/184-519-159-438-201,Abstract,no,0,0,19,23,0,C08G8/04;;C08G8/24;;C08G8/28;;C08G14/04;;C08G14/12;;C08L61/06;;C08L61/14;;H05K1/0326;;C08G8/04,C08J5/24;;C07B61/00;;C07C37/20;;C07C39/15;;C08G8/00;;C08G8/04;;C08G8/24;;C08G8/28;;C08G14/04;;C08G14/12;;C08G59/08;;C08G59/62;;C08L61/06;;C08L61/14;;C09K11/06;;H05K1/03,,0,0,,,,DISCONTINUED
216,US,A,US 5648404 A,001-935-532-236-285,1997-07-15,1997,US 22589094 A,1994-04-11,US 22589094 A,1994-04-11,Curatives for phenolic novolacs,"A binder composition of a phenolic novolac resin and a (lower) alkoxylated triazine-formaldehyde resin curing agent is disclosed. The triazine resins have sufficient carbon atoms in the alkoxy groups so as to provide a curing agent having a water solubility of less than 15%. The binder cures at high temperatures so as to provide improved flow and prolonged workability to the composition. The compositions are useful in refractory applications having a need for high temperature curing agents such as for maintenance and repair within refractory vessels by gunning/spraying, manufacture of electrodes by the Soderberg method, and for use in blast furnace tap holes.",BORDEN INC,GERBER ARTHUR HARRY,MOMENTIVE SPECIALTY CHEMICALS INC (1996-06-20);;BORDEN CHEMICAL INC. A NEW JERSEY CORPORATION (2002-04-05);;BORDEN INC (1994-04-04),https://lens.org/001-935-532-236-285,Granted Patent,yes,12,8,13,13,0,C04B35/634;;C04B35/63476;;C04B35/6348;;C04B35/66;;C08L61/06;;C08L61/28;;C04B35/63476;;C04B35/634;;C08L61/28;;C04B35/6348;;C04B35/66;;C08L61/06,C04B35/634;;C04B35/66;;C08L61/06;;C08L61/28,523/145;;523/147;;524/593;;524/594;;524/192,9,3,065-476-194-630-352;;077-513-503-171-408;;040-237-849-093-741,10.2494/photopolymer.3.419;;10.1117/12.46360;;10.2494/photopolymer.3.401,"American Cyanamid Company, High Solids Amino Crosslinking Agents CRT 557 A 11/91 5K.;;American Cyanamid Company, Compositional Guide to High Solids Melamine Formaldehyde Cross Linking Agents 4 2109 2/84 7/86 3K; CRT 555.;;Monsanto Chemical Co. RESIMINE Amino Crosslinker Resins MCRE 2016, 1991.;;M.R. Winkle and K.A. Graziano, Acid Hardening Positive Photoresist Using Photochemical Generation of Base , J. Photopolym. Sci. and Technol., vol. 3, No. 3 (1990) pp. 419 422.;;K.A. Graziano, S.D. Thompson, and M.R. Winkle, Novel Acid Hardening Positive Photoresist Technology , SPIE, vol. 1466, Advances in Resist Technology and Processing VIII (1991), pp. 75 88.;;K.A. Graziano, et al., Acid Catalyzed Crosslinking In Novolak Based Negative Resists , Polym. Mater. Sci. Eng., 60, 151 4 (Eng) 1989.;;J.W. Thackaray et al, DUV ANR Photoresists: Resist Design Considerations , J. Photopolym. Sci and Technol., vol. 3, No. 3, 1990, pp. 401 415.;;Foseco, Inc. TUNCAST Tundish Spray System , 1990, 3M/1190.;;S. Carniglia and G. Barona, Handbook of Industrial Refractories Technology , pp. 567 572, Noyes Publications (1992).",EXPIRED
217,US,A,US 5317050 A,006-051-672-893-373,1994-05-31,1994,US 16609693 A,1993-12-13,US 16609693 A;;US 98824792 A,1992-12-09,Latent acid curable compositions,"Compositions containing an aryl phosphite and water to hydrolyze the aryl phosphite provide controlled and extended work time when used as hardening agents for the ambient temperature hardening of phenolic resins and for rapid hardening of such resins at modestly elevated temperatures. Pre-solvolysis with small quantities of water, alkanols of 1 to 4 carbon atoms or alkylene glycols of 2 to 4 carbon atoms improve compatibility of trisubstituted phosphites with the resin. Pre-hydrolysis of the phosphites as well as addition of furfuryl alcohol or alkylene glycols of 2 to 4 carbon atoms accelerate the hardening (curing) of the resin. Various compounds such as: carboxylic acid amides, urea, dicyandiamide, N-methylolated amides, N-alkyl 2-pyrrolidinones having 1 to 4 carbon atoms in the alkyl group, those having an internal epoxide group, alkanols, and Schiff bases retard the ambient temperature hardening of the resin with the aryl phosphite hardening agents.",BORDEN INC,GERBER ARTHUR H,MOMENTIVE SPECIALTY CHEMICALS INC (1996-06-11);;BORDEN CHEMICAL INC. A NEW JERSEY CORPORATION (2002-04-05);;BORDEN INC (1993-12-06),https://lens.org/006-051-672-893-373,Granted Patent,yes,22,4,12,12,0,C08G8/28;;C08G8/28;;C04B26/122;;C04B26/122,C04B26/12;;C08G8/28;;C08L61/06,524/107;;524/111;;524/128;;524/153;;524/154;;525/398;;525/400;;525/420;;525/427;;525/429;;525/480;;525/486;;525/488;;525/489;;525/495;;525/509;;525/515;;525/516;;528/86;;528/107;;528/108;;528/111,2,0,,,"G. Brode et al, ACS Polymer Preprints 24 (2), 192, (1983).;;Organic Chemicals/Ethyloxazoline Dow s New Award Winning Intermediate Development, Dow Chem.",EXPIRED
218,US,A,US 5096983 A,013-962-040-508-386,1992-03-17,1992,US 56220690 A,1990-08-02,US 56220690 A,1990-08-02,Method for making a phenolic resole resin composition having extended work life,"There are disclosed methods and compositions for retarding the room temperature gelation and eventual hardening of phenolic resole resins when such resins are mixed with lightburned magnesium oxide or magnesium hydroxide hardening agents with or without an ester functional hardening agent. Retardation of gelation and hardening is achieved by incorporating into said mixture a compound which decreases the solubility of magnesium in said mixture. Additionally, hardening at higher temperatures, thermal curing, as well as refractories, coated abrasives, polymer concrete, and other methods and compositions of this invention are disclosed.",BORDEN INC,GERBER ARTHUR H,BORDEN CHEMICAL INC (1996-06-11);;BORDEN INC. A CORP. OF NJ (1990-07-31);;BORDEN CHEMICAL INC. A NEW JERSEY CORPORATION (2002-04-05),https://lens.org/013-962-040-508-386,Granted Patent,yes,27,41,8,79,0,C04B26/122;;C04B26/122;;C08K3/22;;C08K3/22,C08G8/10;;B24D3/28;;C04B26/12;;C08G8/00;;C08K3/22;;C08L61/04;;C08L61/10,525/506;;525/508,3,0,,,"U.S. patent application Ser. No. 288,090, filed Dec. 22, 1988 by A. H. Gerber, now U.S. Pat. No. 4,939,188.;;U.S. patent application Ser. No. 149,102, filed Jan. 27, 1988 by Detlefsen et al.;;U.S. patent application Ser No. 450,989, filed Dec. 15, 1989 by Lemon et al.",EXPIRED
