"#",Jurisdiction,Kind,Display Key,Lens ID,Publication Date,Publication Year,Application Number,Application Date,Priority Numbers,Earliest Priority Date,Title,Abstract,Applicants,Inventors,Owners,URL,Document Type,Has Full Text,Cites Patent Count,Cited by Patent Count,Simple Family Size,Extended Family Size,Sequence Count,CPC Classifications,IPCR Classifications,US Classifications,NPL Citation Count,NPL Resolved Citation Count,NPL Resolved Lens ID(s),NPL Resolved External ID(s),NPL Citations,Legal Status
1,DE,D1,DE 3565975 D1,095-728-890-452-12X,1988-12-08,1988,DE 3565975 T,1985-11-02,EP 8500584 W;;US 67077284 A,1984-11-13,ADDITIVE FOR HYDRAULIC CEMENT MIXES,,SANDOZ AG,GERBER ARTHUR,"MBT HOLDING AG, ZUERICH, CH (1997-10-02)",https://lens.org/095-728-890-452-12X,Granted Patent,no,0,0,19,20,0,C04B24/128;;C04B28/02;;C09K3/00;;C04B24/12;;C04B28/02;;C04B24/128,C04B24/12;;C04B24/16;;C04B28/02;;C09K3/00,,0,0,,,,EXPIRED
2,CA,C,CA 2381897 C,013-461-078-159-753,2009-12-15,2009,CA 2381897 A,2000-08-29,US 38896699 A;;US 0023717 W,1999-09-02,DIOLEFIN/HYDROXYARYL CONDENSATES AND CATALYST THEREFOR,"A catalyst composition comprising trifluoromethanesulfonic acid (also referr ed to as triflic acid) and a sufficient quantity of a substance (also referred to as a retarder) to decrease but not eliminate the catalytic activity of the acid is disclosed. Also disclosed, is a method and composition for condensing a hydroxyaryl with a diene by use of the catalyst composition. The method is capable of producing condensates having: a mole ratio of 1 mole of the diene to one mole of the hydroxyaryl; one mole of diene to two moles of the hydroxyaryl as well as higher molecular weight products suc h as resins by changes in temperature, time of reaction, type and quantity of retarder and other variables.",BORDEN CHEM INC,GERBER ARTHUR A,,https://lens.org/013-461-078-159-753,Granted Patent,no,0,0,15,15,0,B01J31/0227;;B01J31/0237;;B01J31/0247;;B01J31/06;;B01J2231/323;;C07C37/14;;C07C41/06;;C07C37/88;;C07C2601/16;;C07C2603/68;;B01J31/0237;;B01J31/0247;;B01J31/06;;C07C37/14;;C07C37/88;;C07C41/06;;B01J2231/323;;B01J31/0227;;B01J31/06;;B01J2231/323;;C07C37/14;;B01J31/0237;;C07C41/06;;B01J31/0247;;C07C37/88;;C07C2603/68;;C07C2601/16,C07C43/174;;B01J21/02;;B01J21/08;;B01J21/12;;B01J21/14;;B01J31/02;;B01J31/06;;C07B61/00;;C07C2/08;;C07C2/14;;C07C37/11;;C07C37/14;;C07C39/12;;C07C39/23;;C07C41/05;;C07C41/06;;C07C43/243;;C08L61/06;;C08L61/10,,0,0,,,,EXPIRED
3,WO,A1,WO 2000/064669 A1,006-248-542-926-455,2000-11-02,2000,US 0008994 W,2000-04-03,US 29815399 A,1999-04-23,PHENOL-NOVOLACS WITH IMPROVED OPTICAL PROPERTIES,"A method for the manufacture of a fluorescent polyphenolic product with high UV absorbance, its subsequent epoxidation, polyphenolic products, epoxidized derivatives and compositions thereof as well as laminates containing fluorescent polyphenolic products and derivatives thereof are disclosed.",BORDEN CHEM INC,GERBER ARTHUR H,,https://lens.org/006-248-542-926-455,Patent Application,yes,3,2,15,25,0,B32B5/32;;C08G8/04;;C08G8/28;;C08G14/04;;C08G14/12;;C08G59/08;;C08L61/06;;C08L61/14;;C08L63/00;;H05K1/0266;;H05K1/0269;;H05K1/0326;;H05K1/0373;;H05K3/285;;Y10T442/2861;;Y10T442/2049;;Y10T428/249962;;Y10T442/277;;C08G8/04;;Y10T442/2861;;Y10T442/2049;;Y10T428/249962;;Y10T442/277;;B32B3/26;;B32B2363/00;;B32B27/18;;B32B2305/72;;B32B27/38;;B32B2307/3065;;B32B2305/026;;B32B2307/422;;C08G8/04;;C08G8/28;;C08G59/08;;H05K3/285;;H05K1/0266;;C08G14/04;;H05K1/0326;;C08L61/14;;C08L63/00;;C08G14/12;;B32B5/32;;H05K1/0373;;H05K1/0269;;C08L61/06,B32B5/32;;B32B7/02;;B32B27/18;;C08G8/00;;C08G8/04;;C08G8/10;;C08G8/28;;C08G14/04;;C08G14/12;;C08G59/08;;C08G59/62;;C08J5/24;;C08L61/06;;C08L61/10;;C08L61/14;;C08L63/00;;H05K1/02;;H05K1/03;;H05K3/28,,0,0,,,,PENDING
4,ES,T3,ES 2192624 T3,014-190-915-807-258,2003-10-16,2003,ES 96944433 T,1996-12-23,US 934395 P,1995-12-27,DILUYENTES REACTIVOS PARA COMPOSICIONES FENOLICAS CURABLES CON ACIDO.,"SE DESCRIBEN UNAS COMPOSICIONES DE RESINA FENOLICA ENDURECIBLES CON ACIDO Y UNAS COMPOSICIONES DE NOVOLAC, MODIFICADAS PARCIALMENTE DEL 5 A APROXIMADAMENTE EL 15 % EN PESO, CON AL MENOS UN DILUYENTE REACTIVO SELECCIONADO ENTRE UN GRUPO COMPUESTO DE ALCOHOL BENCILICO, ETER BENCILICO, ETILENGLICOL, 1,3 BUTILENGLICOL, ETERES MONOALILO O METIALILO DE POLI(METILOL)ALCANOS, ETER MONOALILO DE GLICERINA, ETER ALILO O METALILO DE GLICIDILO, ARILAMINA N ACILADA, NAFTILAMINA N ACILADA, ARILSULFONAMIDA N ACILADA, Y ARILAMINA N SUSTITUIDA. EL DILUYENTE REACTIVO PUEDE EMPLEARSE PARA MEJORAR LA RESISTENCIA A LOS IMPACTOS Y LA FLEXIBILIDAD DE DICHA RESINA FENOLICA. PREFERENTEMENTE, TAMBIEN SE DESCRIBEN LOS METODOS PARA MODIFICAR LA VIDA DE LA MEZCLA DE DICHA RESINA FENOLICA USANDO FOSFITO DE ARILO Y ALCOHOL BENCILICO, Y LOS METODOS PARA MODIFICAR LAS RESINAS NOVOLAC, ASI COMO LOS METODOS PARA FABRICAR LAS PRESENTES COMPOSICIONES Y PRODUCTOS, POR EJEMPLO, TUBERIA DE FILAMENTO ENROLLADO Y PANELES LAMINADOS,EMPLEANDO ESTAS COMPOSICIONES.",BORDEN CHEM INC,GERBER ARTHUR H,,https://lens.org/014-190-915-807-258,Granted Patent,no,0,0,24,24,0,C08G8/08;;C08G8/28;;C08G8/10;;C08L61/06;;C08G8/08,C08G8/08;;C08G8/28;;C08L61/06,,0,0,,,,EXPIRED
5,ZA,B,ZA 858717 B,017-659-193-519-661,1987-06-24,1987,ZA 858717 A,1985-11-12,US 67077284 A,1984-11-13,ADDITIVE FOR HYDRAULIC CEMENT MIXES,,SANDOZ LTD,GERBER ARTHUR H,,https://lens.org/017-659-193-519-661,Granted Patent,no,0,0,19,20,0,C04B24/128;;C04B28/02;;C09K3/00;;C04B24/12;;C04B28/02;;C04B24/128,C04B24/12;;C04B24/16;;C04B28/02;;C09K3/00,,0,0,,,,EXPIRED
6,US,A1,US 2004/0048072 A1,022-950-131-885-839,2004-03-11,2004,US 23532602 A,2002-09-05,US 23532602 A,2002-09-05,N-substituted arylamino-phenol-formaldehyde condensates,"
   There is disclosed N-substituted arylamino-phenol-formaldehyde condensates which are substantially free of water, contain not more than 2% by weight of a phenol and possess unobvious properties, e.g., which have the residues of an N-substituted arylamine and 1.5 to 3 moles of formaldehyde for each mole of the said arylamine, contain from about 35% to 63% by weight of phenol residue, contain at least 3.5% by weight of nitrogen, have a melt viscosity of less than 2,000 cps at 175 C., a hydroxyl equivalent of about 195 to 220, a Methanol Tolerance of at least 40%, high solubility in organic solvents commonly used in epoxy formulations, and are self-catalyzing curatives for epoxy resins. 

   The condensates of this invention are prepared by: 

   (A) charging to a reaction vessel a phenol and 

   (a) one member selected from the group consisting of formaldehyde and N-substituted arylamine to form a reaction mixture, 

   (b) charging the remaining member of said group to the reaction mixture; 

   (B) heating the reaction mixture until all of the formaldehyde and said arylamine have reacted and the condensate contains from about 35% to about 63% by weight of phenol residue. Additionally disclosed are epoxy compositions containing the condensates of this invention as well as laminates prepared with the epoxy compositions. 
",BORDEN CHEM INC,GERBER ARTHUR H,HEXION INC (2015-01-15);;BAKELITE LLC (2021-10-22);;BAKELITE UK HOLDING LTD (2021-10-25),https://lens.org/022-950-131-885-839,Patent Application,yes,18,1,3,3,0,C08G8/28;;C08G8/28;;C08L61/14;;C08L61/14;;C08L63/00;;C08L63/00;;H05K1/0326;;H05K1/0326;;Y10T428/249941;;Y10T428/249941;;Y10T428/2933;;Y10T428/2933;;Y10T428/2971;;Y10T428/2971;;Y10T428/31511;;Y10T428/31511;;Y10T428/31515;;Y10T428/31515,C08G8/28;;C08L61/14;;C08L63/00;;H05K1/03,428/413,0,0,,,,EXPIRED
7,MY,A,MY 134141 A,042-254-944-773-144,2007-11-30,2007,MY PI20012610 A,2001-06-01,US 58760800 A;;US 59963300 A;;US 76581901 A,2000-06-05,"""GLYOXAL-PHENOLIC CONDENSATES WITH ENHANCED FLUOROESCENCE""","GLYOXAL -PHENOLIC CONDENSATES, EPOXIDIZED PRODUCTS THEREOF, AS WELL AS THEIR METHOD OF MANUFACTURE ARE DISCLOSED. THE CONDENSATES AND EPOXIDIZED PRODUCTS HAVE EXCEPPTIONALLY HIGH FLUORESCENCE AS WELL AS GOOD ULTRAVIOLET ABSORBANCE. THERE IS ALSO DISCLOSED COMPOSITIONS AND LAMINATES CONTAINING THE CONDENSATES AND EPOXDIZED PRODUCTS THEREEOF.",BORDEN CHEM INC,ARTHUR H GERBER,,https://lens.org/042-254-944-773-144,Granted Patent,no,0,0,4,23,0,C08L61/14;;C08L61/14;;C08G8/04;;C08G8/04;;C08G8/24;;C08G8/24;;C08G8/28;;C08G8/28;;C08G14/04;;C08G14/04;;C08G14/12;;C08G14/12;;C08L61/06;;C08L61/06;;H05K1/0326;;H05K1/0326;;Y10T428/24994;;Y10T428/24994;;Y10T428/249962;;Y10T428/249962;;Y10T428/31511;;Y10T428/31511,C08F6/00;;C08J5/24;;B32B27/12;;B32B27/38;;C07B61/00;;C07C37/20;;C07C39/15;;C08G8/00;;C08G8/04;;C08G8/24;;C08G8/28;;C08G14/04;;C08G14/12;;C08G59/08;;C08G59/62;;C08L61/06;;C08L61/14;;C09K11/06;;H05K1/03,,0,0,,,,EXPIRED
8,AU,B2,AU 634077 B2,052-822-822-445-21X,1993-02-11,1993,AU 1991/081294 A,1991-07-23,US 56220690 A;;US 69894591 A,1990-08-02,RETARDERS FOR HARDENING PHENOLIC RESINS,"There are disclosed methods and compositions for retarding the room temperature gelation and eventual hardening of phenolic resole resins when such resins are mixed with lightburned magnesium oxide or magnesium hydroxide hardening agents with or without an ester functional hardening agent. Retardation of gelation and hardening is achieved by incorporating into said mixture a retarder compound such as one which decreases the solubility of magnesium in said mixture. Additionally, hardening at higher temperatures, thermal curing, coated abrasives, polymer concrete, and other methods and compositions of this invention are disclosed.","BORDEN, INC.",ARTHUR HARRY GERBER,,https://lens.org/052-822-822-445-21X,Granted Patent,no,3,0,12,79,0,C04B26/122;;C04B2103/0004;;C04B2103/0086;;C04B2103/14;;C04B2103/20;;C08K3/22;;C04B26/122;;C04B2103/14;;C04B2103/20;;C04B2103/0004;;C04B2103/0086;;C08K3/22,C04B26/12;;C08K3/22;;C08L61/10,,0,0,,,,EXPIRED
9,AU,A,AU 1996/040781 A,081-782-659-327-43X,1996-10-17,1996,AU 1996/040781 A,1996-01-03,US 41619295 A,1995-04-04,Mixtures of phenolic novolaks fur use with refractory aggregate and methods for making same,"A binder solution of a phenolic novolak resin in solvent, preferably furfuryl alcohol containing at least one chemical agent such as amines containing one to five, preferably two to four, nitrogen atoms, glycerine or mixtures thereof. Preferably, the binder solution contains about 0.2 to about 1.5 weight percent water. The binder solution is for binding refractory objects, preferably those containing doloma (calcined dolomite) aggregate. Methods of mixing these ingredients and using the mixture are also disclosed. Bricks made from the doloma aggregate mixed with the binder solution show good ambient temperature green strength and enhanced modulus of rupture after curing and coking.",BORDEN INC,GERBER ARTHUR HARRY,,https://lens.org/081-782-659-327-43X,Patent Application,no,0,0,20,20,0,C04B35/03;;C04B35/06;;C04B35/632;;C04B35/634;;C04B35/63476;;C08G8/28;;C08G14/00;;C08K5/0008;;Y10T428/2998;;Y10T428/2993;;C04B35/63476;;C04B35/06;;C04B35/632;;C08G8/28;;C04B2103/14;;Y10T428/2998;;Y10T428/2993;;C04B35/63476;;C08G8/28;;C08G14/00;;C08K5/0008;;C04B35/03;;C04B35/634;;C04B35/632;;C04B35/06,C04B35/03;;C04B35/06;;C04B35/632;;C04B35/634;;C08G8/28;;C08G14/00;;C08K3/16;;C08K5/00;;C08K5/04;;C08K5/053;;C08K5/1535;;C08K5/16;;C08K5/17;;C08K5/20;;C08K5/31;;C08K5/3492;;C08L61/04;;C08L61/06;;C08L61/20;;C08L61/28,,0,0,,,,EXPIRED
10,US,A,US 5223554 A,086-233-408-084-779,1993-06-29,1993,US 99596892 A,1992-12-23,US 99596892 A;;US 56220690 A;;US 61687990 A;;US 94306592 A,1990-08-02,Accelerators for curing phenolic resole resins,"There are disclosed methods and compositions for accelerating the hardening of phenolic resole resins having a pH of about 4.5 to 9.5 with lightburned magnesium oxide or magnesium hydroxide, with or without the addition of an ester functional hardening agent. Acceleration of hardening is achieved by incorporating into said compositions an effective quantity of a material which: increases the solubility of magnesium in the hardenable mixture; by certain amines; or by certain chelating agents. Accelerator compounds include those which provide chloride, sulfamate, nitrate, formate, and phosphite anions as well as selected tertiary amines.",BORDEN INC,GERBER ARTHUR H,BORDEN CHEMICAL INC (1996-06-11);;BORDEN CHEMICAL INC. A NEW JERSEY CORPORATION (2002-04-05),https://lens.org/086-233-408-084-779,Granted Patent,yes,25,9,1,79,0,C04B26/122;;C04B35/634;;C08G8/28;;C08K3/22;;C08K3/22;;C04B35/634;;C08G8/28;;C04B26/122,C04B26/12;;C04B35/634;;C08G8/28;;C08K3/22;;C08L61/10,523/139;;523/145;;523/146;;528/129;;525/480;;525/503;;525/504;;525/505;;525/506;;525/508,0,0,,,,EXPIRED
11,AT,T1,AT E111119 T1,101-676-944-306-827,1994-09-15,1994,AT 89305912 T,1989-06-12,US 27144788 A,1988-11-15,BINDEMITTELZUSAMMENSETZUNGEN ENTHALTEND EINE POLY(ORTHOMETHYLOLIERTE) PHENOLVERBINDUNG UND EIN NOVOLAC-HARZ.,"The invention relates to a binder composition comprising a low molecular weight poly (orthomethylolated) phenolic compound which is combined with a phenol formaldehyde novolac resin and cured in the presence of alkali and an organic ester. Low and high density aggregates can be added to the binder to produce foundry or refractory articles. The binder can also be applied, with or without aggregate, to paper, fabrics, or concrete.",BORDEN INC,GERBER ARTHUR H,,https://lens.org/101-676-944-306-827,Granted Patent,no,0,0,12,12,0,C08G8/24;;C08K3/22;;C08L61/06;;C08K3/22;;C08L61/06;;C08G8/24,C08G8/24;;C08K3/22;;C08L61/04;;C08L61/06,,0,0,,,,DISCONTINUED
12,US,A,US 5334675 A,126-092-440-209-351,1994-08-02,1994,US 20136194 A,1994-02-24,US 20136194 A;;US 16609693 A;;US 98824792 A,1992-12-09,Latent acid curable compositions,"Compositions containing an aryl phosphite and water to hydrolyze the aryl phosphite provide controlled and extended work time when used as hardening agents for the ambient temperature hardening of phenolic resins and for rapid hardening of such resins at modestly elevated temperatures. Pre-solvolysis with small quantities of water, alkanols of 1 to 4 carbon atoms or alkylene glycols of 2 to 4 carbon atoms improve compatibility of trisubstituted phosphites with the resin. Pre-hydrolysis of the phosphites as well as addition of furfuryl alcohol or alkylene glycols of 2 to 4 carbon atoms accelerate the hardening (curing) of the resin. Various compounds such as: carboxylic acid amides, urea, dicyandiamide, N-methylolated amides, N-alkyl 2-pyrrolidinones having 1 to 4 carbon atoms in the alkyl group, those having an internal epoxide group, alkanols, and Schiff bases retard the ambient temperature hardening of the resin with the aryl phosphite hardening agents.",BORDEN INC,GERBER ARTHUR H,MOMENTIVE SPECIALTY CHEMICALS INC (1996-06-11);;BORDEN CHEMICAL INC. A NEW JERSEY CORPORATION (2002-04-05),https://lens.org/126-092-440-209-351,Granted Patent,yes,22,9,12,12,0,C08G8/28;;C08G8/28;;C04B26/122;;C04B26/122,C04B26/12;;C08G8/28;;C08L61/06,525/485;;524/128;;528/129;;528/137;;525/480;;525/481;;525/483;;525/484,2,0,,,"G. Brode et al., ACS Polymer Preprints 24(2), 192, (1983).;;Organic Chemicals/Ethyloxazoline , Dow s New Award Winning Intermediate Development, Dow, Chem.",EXPIRED
13,DE,T2,DE 68918057 T2,112-919-872-732-095,1995-02-02,1995,DE 68918057 T,1989-06-12,US 27144788 A,1988-11-15,Bindemittelzusammensetzungen enthaltend eine poly(orthomethylolierte) Phenolverbindung und ein Novolac-Harz.,"The invention relates to a binder composition comprising a low molecular weight poly (orthomethylolated) phenolic compound which is combined with a phenol formaldehyde novolac resin and cured in the presence of alkali and an organic ester. Low and high density aggregates can be added to the binder to produce foundry or refractory articles. The binder can also be applied, with or without aggregate, to paper, fabrics, or concrete.",BORDEN INC,GERBER ARTHUR H,"BORDEN CHEMICAL, INC. (N.D.GES.D. STAATES DELAWARE (1997-11-06)",https://lens.org/112-919-872-732-095,Granted Patent,no,0,3,12,12,0,C08G8/24;;C08K3/22;;C08L61/06;;C08K3/22;;C08L61/06;;C08G8/24,C08G8/24;;C08K3/22;;C08L61/04;;C08L61/06,,0,0,,,,EXPIRED
14,US,A,US 4401472 A,138-388-769-069-989,1983-08-30,1983,US 35262682 A,1982-02-26,US 35262682 A,1982-02-26,Hydraulic cement mixes and processes for improving hydraulic cement mixes,"A hydraulic cement mix including hydraulic cement, aggregate, sufficient water to effect hydraulic setting of the cement, and an additive comprising a poly(hydroxyalkylated)polyethyleneamine or a poly(hydroxyethyl)polyethyleneimine or mixtures of each or both, the additive being present in an amount sufficient to increase the compressive strength of the hardened mix. Generally, the additive is present in a total amount of up to about 1.0% by weight based upon the weight of the cement, usually in an amount of between about 0.01% and about 0.25% by weight based upon the weight of the cement, preferably in an amount in the range of about 0.02% to about 0.07% by weight.",MARTIN MARIETTA CORP,GERBER ARTHUR H,SANDOZ LTD. A SWISS CORP (1985-04-10);;MARTIN MARIETTA CORPORATION A CORP.OF MD (1982-02-25),https://lens.org/138-388-769-069-989,Granted Patent,yes,1,92,32,33,0,C04B24/12;;C04B24/32;;C04B24/12;;C04B24/32,C04B24/12;;C04B24/32;;C04B24/28,106/90;;106/97;;106/104;;106/314,0,0,,,,EXPIRED
15,JP,B2,JP 2554820 B2,160-583-723-317-642,1996-11-20,1996,JP 12073992 A,1992-05-13,US 69894591 A;;US 74870791 A,1991-05-13,JP 2554820 B2,,BORDEN INC,GERBER ARTHUR HARRY,,https://lens.org/160-583-723-317-642,Granted Patent,no,0,0,6,79,0,,C08K3/22;;C04B14/30;;C04B22/12;;C04B22/16;;C04B24/02;;C04B24/06;;C04B24/12;;C04B24/40;;C04B26/12;;C04B35/04;;C08J3/20;;C08K5/07;;C08K5/10;;C08K5/13;;C08K5/54;;C08K5/5415;;C08K13/02;;C08L61/04;;C08L61/06;;C08L61/10,,0,0,,,,EXPIRED
16,KR,B1,KR 930008205 B1,182-458-004-557-75X,1993-08-26,1993,KR 860700339 A,1986-06-07,US 67077284 A;;EP 8500584 W,1984-11-13,ADDITIVE FOR HYDRAULIC CEMENT MIXES,,SANDOZ AG,GERBER ARTHUR G,,https://lens.org/182-458-004-557-75X,Granted Patent,no,0,0,19,20,0,C04B24/128;;C04B28/02;;C09K3/00;;C04B24/12;;C04B28/02;;C04B24/128,C04B24/12;;C04B24/16;;C04B28/02;;C09K3/00,,0,0,,,,EXPIRED
17,EP,A1,EP 1208070 A1,172-662-400-181-227,2002-05-29,2002,EP 00961411 A,2000-08-29,US 0023717 W;;US 38896699 A,1999-09-02,DIOLEFIN/HYDROXYARYL CONDENSATES AND CATALYST THEREFOR,,BORDEN CHEM INC,GERBER ARTHUR A,"HEXION SPECIALTY CHEMICALS RESEARCH BELGIUM S.A. (2008-07-09);;HEXION SPECIALTY CHEMICALS, INC. (2008-05-07);;BORDEN CHEMICAL, INC. (2003-08-06);;MOMENTIVE SPECIALTY CHEMICALS RESEARCH BELGIUM (2011-03-09)",https://lens.org/172-662-400-181-227,Patent Application,yes,0,0,15,15,0,B01J31/0227;;B01J31/0237;;B01J31/0247;;B01J31/06;;B01J2231/323;;C07C37/14;;C07C41/06;;C07C37/88;;C07C2601/16;;C07C2603/68;;B01J31/0237;;B01J31/0247;;B01J31/06;;C07C37/14;;C07C37/88;;C07C41/06;;B01J2231/323;;B01J31/0227;;B01J31/06;;B01J2231/323;;C07C37/14;;B01J31/0237;;C07C41/06;;B01J31/0247;;C07C37/88;;C07C2603/68;;C07C2601/16,B01J31/02;;B01J31/06;;C07B61/00;;C07C37/14;;C07C39/12;;C07C39/23;;C07C41/05;;C07C41/06;;C07C43/243,,0,0,,,,DISCONTINUED
18,TW,B,TW 366352 B,015-921-919-835-945,1999-08-11,1999,TW 85100330 A,1996-01-12,US 41619295 A,1995-04-04,The compositions useful in the refractory aggregate and the applications thereof,"A binder solution of a phenolic novolak resin in solvent, preferably furfuryl alcohol containing at least one chemical agent such as amines containing one to five, preferably two to four, nitrogen atoms, glycerine or mixtures thereof. Preferably, the binder solution contains about 0.2 to about 1.5 weight percent water. The binder solution is for binding refractory objects, preferably those containing doloma (calcined dolomite) aggregate. Methods of mixing these ingredients and using the mixtures are also disclosed. Bricks made from the doloma aggregate mixed with the binder solution show good ambient temperature green strength and enhanced modulus of rupture after curing and cooking.",BORDEN CHEM INC,GERBER ARTHUR HARRY,,https://lens.org/015-921-919-835-945,Granted Patent,no,0,0,20,20,0,C04B35/03;;C04B35/06;;C04B35/632;;C04B35/634;;C04B35/63476;;C08G8/28;;C08G14/00;;C08K5/0008;;Y10T428/2998;;Y10T428/2993;;C04B35/63476;;C04B35/06;;C04B35/632;;C08G8/28;;C04B2103/14;;Y10T428/2998;;Y10T428/2993;;C04B35/63476;;C08G8/28;;C08G14/00;;C08K5/0008;;C04B35/03;;C04B35/634;;C04B35/632;;C04B35/06,C04B35/03;;C04B35/06;;C04B35/632;;C04B35/634;;C08G8/28;;C08G14/00;;C08K3/16;;C08K5/00;;C08K5/04;;C08K5/053;;C08K5/1535;;C08K5/16;;C08K5/17;;C08K5/20;;C08K5/31;;C08K5/3492;;C08L61/04;;C08L61/20;;C08L61/28,,0,0,,,,EXPIRED
19,CH,A5,CH 662809 A5,025-423-266-603-83X,1987-10-30,1987,CH 577983 A,1983-02-23,US 35262682 A,1982-02-26,HYDRAULISCHE ZEMENTMISCHUNGEN UND VERWENDUNG DER HYDRAULISCHEN ZEMENTMISCHUNGEN ZUM ERHOEHEN DER DRUCKFESTIGKEIT VON ERHAERTETEN HYDRAULISCHEN ZEMENTMISCHUNGEN.,,SANDOZ AG,GERBER ARTHUR HARRY,,https://lens.org/025-423-266-603-83X,Granted Patent,no,0,0,32,33,0,C04B24/12;;C04B24/32;;C04B24/12;;C04B24/32,C04B24/28;;C04B24/12;;C04B24/32,,0,0,,,,EXPIRED
20,CN,A,CN 1286701 A,038-562-583-469-402,2001-03-07,2001,CN 99801649 A,1999-03-05,US 15858498 A,1998-09-22,Phenol-novolacs with improved optical properties,"The specification discloses a method for the manufacture of a fluorescent polyphenolic product with high UV absorbance, its subsequent epoxidation as well as polyphenolic products and epoxidized derivatives and compositions thereof. The polyphenolic products are prepared by heating glyoxal at a temperature of about 80 DEG C. to about 100 DEG C. with a molar excess of a phenol in the presence of an acidic catalyst which is eliminated from the reaction mixture at a temperature below about 170 DEG C. The total mole ratio of glyoxal to phenol charged to the reaction mixture is about 0.15 to 0.22 moles of glyoxal for each mole of phenol. The glyoxal is added continuously or by stepwise additions to the phenol so as to keep the aldehyde units in the reaction mixture to less than about 70% of the aldehyde units in the total quantity of glyoxal to be charged for making the polyphenol. Water is distilled stepwise or continuously from the reaction mixture. The catalyst is removed from the reaction mixture by further distilling the reaction mixture, generally at higher temperatures. After removal of the catalyst, unreacted phenol is removed by distillation and the reaction mixture is heated at a temperature of about 175 DEG C. to 200 DEG C. for about 0.25 hours to about 3 hours to produce a polyphenolic reaction product having high fluorescence, high UV absorbance and high solubility in organic solvents. The polyphenolic reaction product can be epoxidized by conventional means and such epoxy products used in the manufacture of laminates, coatings and adhesives.",BORDEN CHEM INC,GERBER ARTHUR H,"HANSEN SPECIALTY CHEMICALS CO., LTD. (2007-04-18)",https://lens.org/038-562-583-469-402,Patent Application,no,0,4,28,28,0,C08G8/04;;C08G14/04;;C08G14/12;;C08G59/08;;C08L61/06;;C08L61/14;;C08L63/00;;H05K1/0266;;H05K1/0269;;H05K1/0326;;H05K1/0373;;H05K3/285;;C08G14/12;;C08G8/04;;C08G8/28;;C08G59/08;;C08L61/14;;C08L63/00;;H05K1/0269;;H05K1/0326;;H05K1/0373;;H05K3/285;;C08L61/06;;C08G14/12;;H05K1/0269;;C08G14/04;;C08G8/04;;C08G59/08;;H05K1/0266;;H05K1/0373;;C08L63/00;;H05K3/285;;H05K1/0326;;C08L61/14,C08G8/00;;C08G8/04;;C08G14/04;;C08G14/12;;C08G59/08;;C08G59/62;;C08L61/06;;C08L61/10;;C08L61/14;;C08L63/00;;H05K1/02;;H05K1/03;;H05K3/28,,0,0,,,,EXPIRED
21,EP,A2,EP 0469785 A2,040-553-984-706-517,1992-02-05,1992,EP 91306785 A,1991-07-25,US 56220690 A;;US 69894591 A,1990-08-02,Retarders for curing/hardening resole resins.,"There are disclosed methods and compositions for retarding the room temperature gelation and eventual hardening of phenolic resole resins when such resins are mixed with lightburned magnesium oxide or magnesium hydroxide hardening agents with or without an ester functional hardening agent. Retardation of gelation and hardening is achieved by incorporating into said mixture a retarder compound such as one which decreases the solubility of magnesium in said mixture. Additionally, hardening at higher temperatures, thermal curing, coated abrasives, polymer concrete, and other methods and compositions of this invention are disclosed.",BORDEN INC,GERBER ARTHUR HARRY,,https://lens.org/040-553-984-706-517,Patent Application,yes,0,8,12,79,0,C04B26/122;;C04B2103/0004;;C04B2103/0086;;C04B2103/14;;C04B2103/20;;C08K3/22;;C04B26/122;;C04B2103/14;;C04B2103/20;;C04B2103/0004;;C04B2103/0086;;C08K3/22,C04B26/12;;C08K3/22;;C08L61/10,,0,0,,,,EXPIRED
