"#",Jurisdiction,Kind,Display Key,Lens ID,Publication Date,Publication Year,Application Number,Application Date,Priority Numbers,Earliest Priority Date,Title,Abstract,Applicants,Inventors,Owners,URL,Document Type,Has Full Text,Cites Patent Count,Cited by Patent Count,Simple Family Size,Extended Family Size,Sequence Count,CPC Classifications,IPCR Classifications,US Classifications,NPL Citation Count,NPL Resolved Citation Count,NPL Resolved Lens ID(s),NPL Resolved External ID(s),NPL Citations,Legal Status
1,CA,A,CA 520920 A,119-685-646-639-330,1956-01-17,1956,CA 520920D A,,CA 520920T A,,SUSPENSORY POUCH FOR MEN'S UNDERGARMENTS,,TURNBULL LTD C,EVANS ARTHUR,,https://lens.org/119-685-646-639-330,Granted Patent,no,0,1,1,1,0,,,,0,0,,,,EXPIRED
2,US,A,US 3930809 A,187-999-236-602-365,1976-01-06,1976,US 48840374 A,1974-07-15,US 48840374 A;;US 39018473 A,1973-08-21,ASSEMBLY FIXTURE FOR FIXED POINT PROBE CARD,A fixture for assembling a probe card adapted to test integrated circuit patterns having contacts deployed thereon. The card includes an opening providing access to a pattern and a ring of spaced conductive pads surrounding the opening. Anchored on selected pads are blade-like needle-holders having needles extending therefrom to engage the contacts in the pattern being tested. The fixture is designed to facilitate attachment of each needle-holder blade to its pad on the card and to orient the blade before such attachment so that the needle point is precisely aligned with the related contact.,WENTWORTH LAB INC,EVANS ARTHUR,,https://lens.org/187-999-236-602-365,Granted Patent,yes,2,163,1,3,0,G01R1/07314;;G01R1/07342;;G01R31/2886;;Y10T29/53261;;Y10T29/53087;;Y10T29/53261;;Y10T29/53087;;G01R1/07342;;G01R1/07314;;G01R31/2886,G01R1/073;;G01R31/28,29203J,0,0,,,,EXPIRED
3,US,S,US D0272755 S,110-650-351-503-762,1984-02-21,1984,US 16036280 F,1980-06-17,US 16036280 F,1980-06-17,Stove grille,,MOHAWK IND INC,EVANS ARTHUR,,https://lens.org/110-650-351-503-762,Design Right,yes,0,0,1,1,0,,,D23/128;;D2303,2,0,,,"Sweet's Architectural Catalog File, 1973, vol. 10, Section 10.25/HA, H & K Plain Lattice Grille.;;Sweet's Architectural Catalog File, 1973, vol. 10, Section 10.25/In, Intertec Rectangular Grille.",EXPIRED
4,GB,A,GB 809951 A,114-606-690-146-269,1959-03-04,1959,GB 909357 A,1957-03-20,GB 909357 A,1957-03-20,Improvements in or relating to travelling wave tubes,"809,951. Backward-wave tubes. STANDARD TELEPHONES & CABLES Ltd. March 20, 1957, No. 9093/57. Class 39(1). A hairpin interdigital line for a backward wave oscillator tube has the sets of U-shaped metal ribbon conductors, or hairpins 14, 14<SP>1</SP> held between the middle members 12, 12<SP>1</SP> and pairs of outer members 9, 10 and 91, 101 respectively of the bounding walls. The outer members have slots to receive the limbs of the conductors. The wall members and the conductors are gold plated and bonded together by a gold diffusion process, or brazed with suitable solder. At one end the conductors are of resistive material, or coated with such material, to provide a wave absorbing termination. The conductors may be curved instead of, flattened at the base of the U. The complete structure includes side plates 16, 17.",STANDARD TELEPHONES CABLES LTD,EVANS ARTHUR,,https://lens.org/114-606-690-146-269,Granted Patent,no,0,0,5,6,0,H01J23/28;;H01J23/28,H01J23/28,H1D DK            KA1;;H1D DKGH          KGF;;H1D DKGH          KGH;;H1D D16AY         KGF;;H1D D16AY         UA;;H1D D16A1BY       KGF;;H1D D16A1BY       UA;;H1D D16A1B2       KGF;;H1D D16A1B2       UA;;H1D D16A1Y        KGF;;H1D D16A1Y        UA;;H1D D16A6         KGF;;H1D D16A6         UA;;H1D D16A8         KGF;;H1D D16A8         UA;;H1D D16M2         KGF;;H1D D16M2         UA;;H1D D16S4         KGF;;H1D D16S4         UA;;H1D D16S6         KGF;;H1D D16S6         UA;;H1D D16S8         KGF;;H1D D16S8         UA;;H1D D16T2         KGF;;H1D D16T2         UA;;H1D D18AY         KGF;;H1D D18AY         UA;;H1D D18A2B        KGF;;H1D D18A2B        UA;;H1D D18A2D        KGF;;H1D D18A2D        UA;;H1D D18A2E        KGF;;H1D D18A2E        UA;;H1D D18A2Y        KGF;;H1D D18A2Y        UA;;H1D D46A          KGF;;H1D D46A          UA;;H1D D46Y          KGF;;H1D D46Y          UA,0,0,,,,EXPIRED
5,DE,A1,DE 3321128 A1,155-469-517-509-539,1984-12-13,1984,DE 3321128 A,1983-06-10,DE 3321128 A,1983-06-10,Mechanism for extending and positioning a high-lift device relative to a wing,"The invention makes available an operating and positioning arrangement for slats on the leading edges of wings, wherein a slat panel is connected to one end of an extendable guide rail part which is held and guided at its other end by means of rollers which are mounted on a fixed structure in the leading-edge section of the wing. The operating and positioning arrangement comprises a drive and programming mechanism which is integral or is constructed to form a unit, is connected to the slat panel and operates in such a manner that it combines the opening or closing process of an aerodynamic slot with a slat extending drive mechanism. The drive and programming mechanism, which is integral or is combined to form a unit comprises a contoured cam guide track which has the approximate shape of an S-cam guide track and has a roller follower which is connected to an element and a drive arm; and this combination permits synchronisation of the slat operation with the programming control of the slat deflection angle and the opening and closing of an aerodynamic slot.",BOEING CO,EVANS ARTHUR,,https://lens.org/155-469-517-509-539,Patent Application,no,2,6,1,1,0,B64C9/24;;B64C3/50,B64C3/50;;B64C9/24,,0,0,,,,DISCONTINUED
6,IT,B,IT 1171196 B,093-260-514-235-785,1987-06-10,1987,IT 1256783 A,1983-07-06,IT 1256783 A,1983-07-06,Wing leading edge slat actuating and positioning mechanism,The wing leading edge slat actuation and positioning mechanism system is provided so that a slat panel can be connected to one end of an extensible track which is supported and guided at its other end by rollers mounted to fixed structure in the leading edge section of the wing. The actuation and positioning system comprises a unified drive and a programming mechanism which is connected to the slat panel and functions to combine an aerodynamic slot opening or closure operation with a slat extension drive mechanism. The unified drive and programming mechanism comprises a contoured cam track in the shape of an S and having a roller follower which is connected to a link and drive arm. This combination allows synchronisation of slat actuation with programming control of slat angle-of-deflection and aerodynamic slot opening or closure.,BOEING CO,EVANS ARTHUR,,https://lens.org/093-260-514-235-785,Granted Patent,no,0,0,3,3,0,,B64C/,,0,0,,,,EXPIRED
7,DE,D1,DE 3465147 D1,144-708-225-429-349,1987-09-03,1987,DE 3465147 T,1984-04-11,US 49123383 A,1983-05-03,TEST PROBE ASSEMBLY FOR IC CHIPS,,WENTWORTH LAB INC,EVANS ARTHUR,,https://lens.org/144-708-225-429-349,Granted Patent,no,0,0,4,6,0,G01R1/07342,H01L21/66;;G01R1/073,,0,0,,,,EXPIRED
8,US,A,US 4399970 A,083-801-576-775-134,1983-08-23,1983,US 20659080 A,1980-11-13,US 20659080 A,1980-11-13,Wing leading edge slat,"A wing leading edge slat actuation and positioning system, wherein a slat panel is connected to one end of an extensible track member which is supported and guided at its other end, by rollers mounted to fixed structure in the leading edge section of the wing. The actuation and positioning system comprises a unified drive and a programming mechanism which is connected to the slat panel and functions to combine an aerodynamic slot opening or closure operation with a slat extension drive mechanism. The unified drive and programming mechanism comprises a contoured camtrack somewhat in the shape of an S-camtrack and having a roller follower which is connected to a link and drive arm; and this combination allows synchronization of slat actuation with programming control of slat angle-of-deflection and aerodynamic slot opening or closure.",BOEING CO,EVANS ARTHUR,BOEING COMPANY THE A CORP. OF DE (1980-11-07),https://lens.org/083-801-576-775-134,Granted Patent,yes,8,103,1,1,0,B64C9/24;;Y02T50/30;;B64C9/24;;Y02T50/30,B64C9/24,244/214;;X244 75R;;244/216,0,0,,,,EXPIRED
9,FR,A,FR 1193360 A,152-264-563-716-258,1959-11-02,1959,FR 1193360D A,1958-03-17,GB 909357 A,1957-03-20,Tubes à ondes progressives,,INT STANDARD ELECTRIC CORP,EVANS ARTHUR,,https://lens.org/152-264-563-716-258,Granted Patent,no,0,0,5,6,0,H01J23/28;;H01J23/28,H01J23/28,,0,0,,,,EXPIRED
10,EP,B1,EP 0127295 B1,115-549-393-075-116,1987-07-29,1987,EP 84302479 A,1984-04-11,US 49123383 A,1983-05-03,TEST PROBE ASSEMBLY FOR IC CHIPS,,"WENTWORTH LABORATORIES, INC.","EVANS, ARTHUR",,https://lens.org/115-549-393-075-116,Granted Patent,yes,0,0,4,6,0,G01R1/07342,H01L21/66;;G01R1/073,,0,0,,,,EXPIRED
11,US,A,US 4382228 A,068-332-122-407-49X,1983-05-03,1983,US 59777175 A,1975-07-21,US 59777175 A;;US 48840374 A,1974-07-15,Probes for fixed point probe cards,"Probes for a probe card adapted to test integrated circuit patterns having contacts deployed thereon, the card including an opening providing access to a pattern and a ring of spaced conductive pads surrounding the opening. The probes are adapted to be anchored on selected pads of the card, each probe being constituted by a rigid, blade-like needle-holder having a deflectable needle extending therefrom to engage a respective contact in the pattern being tested.",WENTWORTH LAB INC,EVANS ARTHUR,,https://lens.org/068-332-122-407-49X,Granted Patent,yes,2,64,1,3,0,G01R1/07342;;G01R31/2886;;G01R1/07342;;G01R31/2886,G01R1/073;;G01R31/28,H1K KMA           MA;;H2E EAH           EAH;;H2E EAHC          EAHCX;;H2E EAHCX         EAHCX;;U1S S2088,0,0,,,,EXPIRED
12,IT,A0,IT 8312567 A0,168-510-341-551-998,1983-07-06,1983,IT 1256783 A,1983-07-06,IT 1256783 A,1983-07-06,MECCANISMO ESTENSORE RETRATTORE PER FEZIONATO PER IPERSOSTENTATORI SISTEMATI SUL BORDO D ATTACCO DELLE ALI DI UN AEROPLANO,,BOEING CO,EVANS ARTHUR,,https://lens.org/168-510-341-551-998,Patent Application,no,0,0,3,3,0,,B64C/,,0,0,,,,EXPIRED
13,US,A,US 4719417 A,197-689-119-490-092,1988-01-12,1988,US 85062986 A,1986-04-11,US 85062986 A;;US 49123383 A,1983-05-03,Multi-level test probe assembly for IC chips,"A multi-level test probe assembly for checking an integrated circuit chip before terminal leads are applied to the contact pads thereof which are deployed on the chip on a common plane, some pads being inwardly displaced relative to other pads. The assembly includes a planar insulation card provided with a port and having a printed circuit thereon whose traces are connected to a plurality of test terminals connectable to external testing equipment. Surrounding the port and bonded to the card is a mounting ring of dielectric material having a flat face on which is supported a first radial array of fine wires lying in a horizontal plane, the trailing end of each wire being connected to a respective trace. The wires cantilever across the port and converge toward the central region thereof below which is disposed the chip to be tested, the tapered leading end of each wire being double bent to define a needle having a shank section and a tip section terminating in a tip which engages a respective contact pad on the chip. Overlying the first layer and bonded thereto is a second layer of dielectric material having embedded therein a second radial array of fine wires whose tips engage those contact pads on the chip not engaged by the first array.",WENTWORTH LAB INC,EVANS ARTHUR,WENTWORTH LABORATORIES INC. A CORP OF CT (1986-10-09),https://lens.org/197-689-119-490-092,Granted Patent,yes,8,104,1,6,0,G01R1/073;;G01R1/073,G01R1/073,324158P;;X324158F;;324/72.5,2,0,,,"Cantilever Probe , by Altonen et al, IBM Tech. Disc. Bull., vol. 24, 6, 11/81, p. 2687.;;A Neutron Hardness Assurance Screen Based on High Frequency Probe Measruements , by Bailey et al, IEEE Trans. on Tech. Sci., vol. NS 23, 6, 12/76, pp. 2020, 2021, 2023.",EXPIRED
14,GB,A,GB 2138756 A,060-785-402-087-241,1984-10-31,1984,GB 8311294 A,1983-04-26,GB 8311294 A,1983-04-26,Wing leading edge slat,"A wing leading edge slat actuation and positioning system, wherein a slat panel 31 is connected to one end of an extensible track member 24 which is supported and guided at its other end, by rollers 43 mounted to fixed structure in the leading edge section of the wing. The actuation and positioning system comprises a unified drive and a programming mechanism which is connected to the slat panel and functions to combine an aerodynamic slot opening or closure operation with a slat extension drive mechanism. The unified drive and programming mechanism comprises a contoured camtrack 33 somewhat in the shape of an S-camtrack and having a roller follower 39A which is connected to a link 38 and drive arm 35; and this combination allows synchronization of slat actuation with programming control of slat angle-of-deflection and aerodynamic slot opening or closure. In a take-off setting (Fig. 3, not shown) the slat forms a smooth continuous surface with the wing upper surface, while the landing setting shown opens a slot 27. <IMAGE>",BOEING CO,EVANS ARTHUR,,https://lens.org/060-785-402-087-241,Patent Application,no,0,15,3,3,0,B64C3/50;;B64C9/22;;Y02T50/10;;Y02T50/30,B64C3/50;;B64C9/22,B7G GCM           CM;;B7G G27B2         G25-29;;B7G G27B3         G25-29;;B7G G28B          G25-29;;B7G G28D2         G25-29;;B7G G28FX         G25-29;;B7G G28G1B        G25-29;;B7G G29B          G25-29;;B7G G308          CM,0,0,,,,EXPIRED
15,US,A,US 1604222 A,193-236-094-320-283,1926-10-26,1926,US 56565522 A,1922-06-03,US 56565522 A,1922-06-03,Straightening and curving device,,FISK RUBBER CO,ARTHUR EVANS,,https://lens.org/193-236-094-320-283,Granted Patent,no,0,1,1,1,0,B21D5/01;;B21D5/01,B21D5/01,,0,0,,,,EXPIRED
16,GB,A,GB 190410365 A,044-171-862-714-131,1905-05-05,1905,GB 190410365D A,1904-05-05,GB 190410365T A,1904-05-05,A New or Improved Brake Apparatus for Rudder Heads of Vessels.,"10,365. Evans, A. May 5. Rudders.-Comprises brake-blocks A for the rudder-bead quadrant C operated by a shaft B having right and left handed screws.",EVANS ARTHUR,EVANS ARTHUR,,https://lens.org/044-171-862-714-131,Patent Application,no,0,0,1,1,0,,,,0,0,,,,DISCONTINUED
17,US,A,US 4981029 A,101-232-269-438-086,1991-01-01,1991,US 45723089 A,1989-12-26,US 45723089 A,1989-12-26,Electric heater coil assembly termination apparatus and method of use,A method and apparatus for forming an electric resistance heating coil of desired resistance that involves forming a straight end or pigtail at the ends of the coil whereby electrical connectors can be connected to the aligned pigtails and end insulators can separate the electrical connectors.,CARRIER CORP,EVANS ARTHUR,CARRIER CORPORATION A DE CORP (1989-12-21),https://lens.org/101-232-269-438-086,Granted Patent,yes,6,0,2,2,0,H01K3/02;;H05B3/32;;H01K3/02;;H05B3/32,H01K3/02;;H05B3/32,72/134;;72/137;;140/71.5,0,0,,,,EXPIRED
18,EP,A1,EP 0127295 A1,189-018-013-461-43X,1984-12-05,1984,EP 84302479 A,1984-04-11,US 49123383 A,1983-05-03,Test probe assembly for IC chips.,"A test probe assembly for checking an integrated circuit chip before terminal leads are applied to the contacts thereof which are deployed on the chip in a common plane. The assembly includes a planar insulation card (T 10 ) provided with a port (T 11 ) and having a printed circuit thereon whose traces are connected to a plurality of test terminals (T 16 ) connectable to external testing equipment. Surrounding the port (T 11 ) and bonded to the card is a mounting ring of dielectric material having a flat face on which is supported a radial array of fine wires (T 17 ). These are maintained in their assigned positions by a layer of dielectric material adherent to the face, the wires (T 12 ) being embedded in the layer. The wires (T 12 ) cantilever across the port (T 11 ) and converge toward the central region thereof below which is disposed the chip (T 20 ) to be tested, the leading ends of the wires (T 12 ) being double bent to define obtuse angle needles whose tips engage the respective contacts on the chip (T 20 ). The trailing ends of the wire (T 12 ) which diverge outwardly from the ring are soldered to the traces whereby each needle is connected to a respective test terminal (T 16 ).",WENTWORTH LAB INC,EVANS ARTHUR,,https://lens.org/189-018-013-461-43X,Patent Application,yes,5,2,4,6,0,G01R1/07342,H01L21/66;;G01R1/073,,0,0,,,,EXPIRED
19,US,A,US 4599559 A,054-648-464-944-271,1986-07-08,1986,US 75750285 A,1985-07-22,US 75750285 A;;US 49123383 A,1983-05-03,Test probe assembly for IC chips,"A test probe assembly for checking an integrated circuit chip before terminal leads are applied to the contacts thereof which are deployed on the chip in a common plane. The assembly includes a planar insulation card provided with a port and having a printed circuit thereon whose traces are connected to a plurality of test terminals connectable to external testing equipment. Surrounding the port and bonded to the card is a mounting ring of dielectric material having a flat face on which is supported a radial array of fine wires lying in a horizontal plane. These are maintained in their assigned positions by a layer of dielectric material adherent to the face, the wires being embedded in the layer. The wires cantilever across the port and converge toward the central region thereof below which is disposed the chip to be tested, the tapered leading end of each wire being double bent to define a needle having a shank section and a tip section terminating in a tip which engages a respective contact on the chip. The tip section has a downward slope whereby the tips of the needles are exposed to view through a microscope for purposes of alignment. The trailing end of each wire is soldered to a respective trace connecting each needle to a test terminal.",WENTWORTH LAB INC,EVANS ARTHUR,WENTWORTH LABORATORIES INC. A CORP OF CT (1985-07-16),https://lens.org/054-648-464-944-271,Granted Patent,yes,3,71,1,6,0,G01R1/073;;G01R1/073,G01R1/073,324158P;;324/72.5;;X324158F,1,0,,,Probe Rite Inc. 1974 product catalog.,EXPIRED
20,GB,B,GB 2138756 B,072-139-970-940-369,1986-07-16,1986,GB 8311294 A,1983-04-26,GB 8311294 A,1983-04-26,WING LEADING EDGE SLAT,,BOEING CO,EVANS ARTHUR,,https://lens.org/072-139-970-940-369,Granted Patent,no,0,1,3,3,0,B64C3/50;;B64C9/22;;Y02T50/10;;Y02T50/30,B64C3/50;;B64C9/22,B7G27B2;;B7G27B3;;B7G28B;;B7G28D2;;B7G28FX;;B7G28G1B;;B7G29B,0,0,,,,EXPIRED
21,FR,A1,FR 2547270 A1,140-960-480-980-17X,1984-12-14,1984,FR 8309681 A,1983-06-10,FR 8309681 A,1983-06-10,Extension and retraction mechanism for a leading edge slat of an aircraft wing,"A leading edge lift augmenting slat 11D is linked to the front end of an extensible carrying rail 24 which is supported and guided at the rear by rollers 43 mounted in the fixed part of the leading edge of the wing 10. The combined deflection control and positioning mechanism comprises an S-shaped guide rail forming a cam 33 in which a roller 39a moves, linked to an articulation 39 of a simple rod system 35, 38, 40. <IMAGE>",BOEING CO,EVANS ARTHUR,,https://lens.org/140-960-480-980-17X,Patent Application,no,1,4,2,2,0,B64C9/22;;B64C3/50;;B64C9/24;;Y02T50/10,B64C3/50;;B64C9/22;;B64C9/24,,0,0,,,,EXPIRED
22,GB,A,GB 190514319 A,019-162-950-471-327,1906-04-12,1906,GB 190514319D A,1905-07-11,GB 190514319T A,1905-07-11,Improvements in Printing Machinery.,"14,319. Evans, A. B. July 11. Cylinder machines with plane printing-surfaces.- In bed-reciprocating gear comprising an upper rack o, driven by a reciprocating wheel or pinion f constrained by a fixed lower rack m, the stroke is increased by reciprocating the rack.m oppositely to the pinion f. The rack m is arranged in guides n, and is connected by a rod l to a crank set at an angle, preferably 180 degrees, to the crank-pins d for the pinion f.",EVANS ARTHUR BURROUGHES,EVANS ARTHUR BURROUGHES,,https://lens.org/019-162-950-471-327,Patent Application,no,0,0,1,1,0,,,,0,0,,,,DISCONTINUED
23,FR,A,FR 647808 A,034-662-330-709-343,1928-12-01,1928,FR 647808D A,1927-11-15,FR 647808T A,1927-11-15,Perfectionnements apportés aux machines à imprimer,,,EVANS ARTHUR BURROUGHES,,https://lens.org/034-662-330-709-343,Granted Patent,no,0,1,1,1,0,B65H7/02,B65H7/02,,0,0,,,,EXPIRED
24,US,A1,US 2008/0092799 A1,027-264-161-556-19X,2008-04-24,2008,US 90171007 A,2007-09-17,US 90171007 A;;US 10636505 A;;US 56164404 P,2004-04-13,Flag pole mounted unfurling device and associated baton,"A flag pole mounted unfurling device is installed on a flagpole and rotates to minimize the unwanted furling of the flag. The device includes a lower swivel, an upper swivel, and a baton that extends between the lower swivel and the upper swivel to retain the two swivels in alignment and properly separated. The upper swivel and lower swivel are free to rotate around the axis of the pole while the baton serves to couple the upper and lower swivels together, both rotationally and longitudinally. The entire assembly is longitudinally retained on the pole by an upper collar and a lower collar and minimizes the unwanted furling of a flag through ‘dynamic instability.’",EVANS ARTHUR L,EVANS ARTHUR L,,https://lens.org/027-264-161-556-19X,Patent Application,yes,20,3,3,3,0,G09F17/00;;G09F17/00,G09F17/00,116/174,0,0,,,,DISCONTINUED
25,US,A,US 2125222 A,026-387-095-967-014,1938-07-26,1938,US 9628036 A,1936-08-15,US 9628036 A,1936-08-15,Windmill governor,,EVANS ARTHUR J,EVANS ARTHUR J,,https://lens.org/026-387-095-967-014,Granted Patent,no,0,2,1,1,0,F03D7/0224;;F03D7/0224;;F05B2260/74;;F05B2260/74;;F05B2260/75;;F05B2260/75;;F05B2260/77;;F05B2260/77;;Y02E10/72;;Y02E10/72,F03D7/02,,0,0,,,,EXPIRED
26,AU,A,AU 1985/050384 A,044-524-645-148-920,1986-06-05,1986,AU 1985/050384 A,1984-11-29,AU 1985/050384 A,1984-11-29,ILLUMINATED SIGN CONSTRUCTION,,EVANS PRINT PTY LTD;;POSTER MEDIA PTY LTD,EVANS RALPH ARTHUR,,https://lens.org/044-524-645-148-920,Patent Application,no,0,0,1,1,0,,G09F7/02;;G09F7/18,,0,0,,,,DISCONTINUED
27,GB,A,GB 724085 A,090-361-277-188-359,1955-02-16,1955,GB 1001151 A,1951-04-28,GB 1001151 A,1951-04-28,New or improved means for feeding work-pieces to presses and like machines,"724,085. Metal-working presses. PRESS GUARDS, Ltd. April 28, 1952 [April 28, 1951], No. 10011/51. Class 83 (4). Means for feeding individual work-pieces to a press &c. comprises an arm 68 which can be oscillated between limits about a vertical axis and moved angularly about a horizontal axis to raise and lower work-gripping means 69 on the arm, the movement of the arm being synchronized with the operation of the machine by an oscillating disc 31 coupled to a member 20 adapted to be mounted on a continuously rotating part of the machine. The press tools 16, 19 are operated by a fly-wheel 10 and crank 13, which also reciprocate an adjustable rod 23 through the disc 20. The rod 23 oscillates the disc 31 through 90 degrees which in turn, through a rod 40, oscillates a block 35 between the adjustable limit stops 50. The block 35 oscillates on a block 34 which is itself oscillated about the horizontal axis by a cam 60 on the disc 31 and a rod 55. The block 35 carries the work-gripping fingers 69, which are operated by a wedge 71 and an air cylinder 7 2 controlled by a valve actuated by a cam on the disc 31. In operation, the block 35 is oscillated to bring the fingers over a blank on a table 76, the block 34 is then moved angularly and the fingers closed to grip the blank. The arm returns and deposits the blank on to the bottom tool 16 as the ram reaches its upper position. For picking up sheets 81, Fig. 6, the fingers 69 may be replaced by a suction cup 80. The sheets are separated prior to lifting by an air-jet 84. Alternatively, an electromagnet or a permanent magnet and pneumatic releasing means may be used. The blanks may be supplied to a pick-up position by a magazine 90 and a pneumatically-actuated pusher, or by a stack automatically raised by a screwed spindle, or by a rotary table loaded by the operator and fed step-by-step by an airoperated ratchet device. Jets 98 actuated by cams 100 on the disc 20 remove swarf and discharge the work-pieces from the tools.",PRESS GUARDS LTD,EVANS FREDERICK ARTHUR,,https://lens.org/090-361-277-188-359,Granted Patent,no,0,1,1,1,0,B30B15/30;;B21D43/10,B21D43/10;;B30B15/30,,0,0,,,,EXPIRED
28,GB,A,GB 189318848 A,113-336-061-338-635,1894-09-29,1894,GB 189318848D A,1893-10-07,GB 189318848T A,1893-10-07,Improvements in Stay Travellers for Sails and the like.,,EVANS ARTHUR KELLY,EVANS ARTHUR KELLY,,https://lens.org/113-336-061-338-635,Patent Application,no,0,0,1,1,0,,,,0,0,,,,DISCONTINUED
