776,US,A,US 5514360 A,158-067-360-751-526,1996-05-07,1996,US 39769595 A,1995-03-01,US 39769595 A,1995-03-01,Negative thermal expansion materials,"A method for making tungstate compounds according to the formula XW.sub.2 O.sub.8, wherein X is selected from the group consisting of zirconium, hafnium, and combinations thereof, is described. Also described are compositions that include the tungstate compounds, and a method for reducing the positive thermal expansion of a material using such tungstate compounds. Substantially single phase compounds can be made by practicing the method, which method also reduces the synthesis time relative to known methods, and expands the reactants that can be used for the synthesis over the methods reported previously. The tungstate compounds generally can be made by forming a solution, particularly an aqueous solution, comprising a W.sup.6+ compound and a second metal compound wherein the metal is selected from the group consisting of Zr.sup.4+, Hf.sup.4+ and combinations thereof. The solvent is removed from the solution by any known method to leave the solutes as a solid product. The solid product is then heated to a temperature of greater than about 600.degree. C., preferably at least about 1165.degree. C., more preferably from about 1165.degree. C. to about 1250.degree. C., and even more preferably to about 1200.degree. C. The heated product is then cooled to ambient temperature, generally relatively rapidly, to produce substantially single phase tungstate compounds.",OREGON STATE,SLEIGHT ARTHUR W;;THUNDATHIL MARY A;;EVANS JOHN S O,OREGON UNIVERSITY OF BOARD OF HIGHER EDUCATION THE (1995-04-20),https://lens.org/158-067-360-751-526,Granted Patent,yes,3,85,1,1,0,C01G41/00;;C01G41/00,C01G41/00,423/593,5,1,010-848-664-045-086,10.1111/j.1151-2916.1968.tb11881.x,"Linear Thermal Expansion of Three Tungstates, J. Am. Ceram. Soc. Discussions and Notes, 51:227 228 (1968), Martinek, et al.;;A New Ternary Oxide, ZrW 2 O 8 , J. Am. Ceram. Soc. Discussions and Notes, 42:570 (1959), Graham, et al.;;Condensed Phase Relations in the Systems ZrO 2 WO 2 WO 3 and HfO 2 WO 2 WO 3 , J. Am. Ceram. Soc., 50:211 215 (1967), Chang, et al.;;Subsolidus Equilibria in the System ZrO 2 WO 3 P 2 O 5 , J. Am. Ceram. Soc., 53:159 161 (1970), Martinek, et al.;;X Ray Diffraction Investigation of the Compounds AB 2 O 8 , Russian Journal of Inorganic Chemistry, vol. 12, No. 11, (Nov. 1967), Trunov, et al.",EXPIRED
777,US,A,US 3956519 A,197-213-515-480-706,1976-05-11,1976,US 52946574 A,1974-12-04,GB 1498674 A;;GB 3828174 A;;GB 5003274 A;;GB 5784773 A,1973-12-13,Process for aggregating protein,"Debranched amylopectin and debranched low-DE maltodextrin have been found to cause protein to aggregate in solution. Such aggregation, which can lead to precipitation or flocculation of the protein, is useful for instance in aerated aqueous fat emulsions, e.g. ice cream and whipped cream, where the stability of the product can be altered as desired.",LIPTON INC THOMAS J,EVANS MERVYN THOMAS ARTHUR;;JONES MALCOLM GLYN DESMOND;;JONES NORMAN,LEVER BROTHERS COMPANY A ME CORP (1989-08-30);;CONOPCO INC. A CORP. OF ME (1989-08-30);;CONOPCO INC. D/B/A THOMAS J. LIPTON COMPANY (1991-09-17),https://lens.org/197-213-515-480-706,Granted Patent,yes,6,19,2,10,0,A23C13/12;;A23G9/20;;A23G9/32;;A23G9/34;;A23G9/46;;A23J3/00;;A23J3/08;;A23J3/10;;A23J3/16;;A23L29/35;;A23G2200/06;;A23G9/46;;A23G9/20;;A23J3/00;;A23G9/34;;A23G9/32;;A23J3/08;;A23C13/12;;A23J3/16;;A23J3/10;;A23L29/35,A23C13/12;;A23G9/20;;A23G9/32;;A23G9/34;;A23G9/46;;A23J3/00;;A23J3/08;;A23J3/10;;A23J3/16;;A23L1/09,426/564,0,0,,,,EXPIRED
778,DE,C3,DE 2110518 C3,085-880-023-315-286,1978-09-21,1978,DE 2110518 A,1971-03-05,GB 1068370 A,1970-03-05,DE 2110518 C3,,"MOORE BUSINESS FORMS LTD., LONDON","EVANS, RONALD ARTHUR;;HOLT, KENNETH ANTHONY;;BLACKLEY, MANCHESTER, LANCASHIRE (GROSSBRITANNIEN)",,https://lens.org/085-880-023-315-286,Granted Patent,no,0,0,12,12,0,B41M5/136;;B41M5/0253;;B41M5/1366,G03C11/22;;B41M5/025;;B41M5/136,,0,0,,,,EXPIRED
779,EP,A3,EP 2042691 A3,143-057-258-802-434,2012-01-25,2012,EP 08016420 A,2008-09-18,GB 0718892 A,2007-09-26,Lubricant pipe assembly for a turbine,"A pipe assembly including secondary leak containment and leak indication is described with particular reference to a lubricant-carrying pipe for supplying oil to an internal bearing chamber in a gas turbine engine. The oil pipe crosses a hot gas zone to a manifold on the engine inner casing so that an oil leak is a potential fire hazard. The connection into the bearing chamber manifold includes a secondary containment system that ensures that any leakage from the oil pipe seal is contained within an interstitial space between the pipe and a co-axial, secondary containment member. The interstitial space opens into a relatively safe zone outside the outer engine casing where the fire or safety hazard is eliminated or does not exist.
",ROLLS ROYCE PLC,CARBINES-EVANS ALEX JAMES;;QUARTLY PHILIP ARTHUR;;SLACK GRAHAM ANDREW,,https://lens.org/143-057-258-802-434,Search Report,yes,1,0,5,5,0,F01D9/065;;F01D25/18;;F16C33/1045;;F16C2360/23;;F01D25/18;;F16L5/14;;F16L39/005;;F01D25/18;;F01D9/065;;F16C33/1045;;F16C2360/23,F01D25/18;;F01D9/06;;F01M11/02,,0,0,,,,DISCONTINUED
780,AU,A,AU 1972/043833 A,194-118-543-675-901,1974-01-03,1974,AU 1972/043833 A,1972-06-23,GB 2990871 A,1971-06-25,CHEMICAL COMPOUNDS,,ICI LTD,EVANS RONALD ARTHUR;;HOLT KENNETH ANTHONY;;RENFREW ANDREW HUNTER MORRIS,,https://lens.org/194-118-543-675-901,Patent Application,no,0,0,26,26,0,B41M5/0253;;B41M5/136;;C09B11/02;;C07C309/46;;C07C2603/18,B41M5/025;;B41M5/136;;C07C309/46;;C09B11/02,,0,0,,,,DISCONTINUED
781,DE,A1,DE 2458145 A1,031-227-083-838-870,1975-06-26,1975,DE 2458145 A,1974-12-09,GB 1498674 A;;GB 5001574 A;;GB 5784773 A,1973-12-13,VERFAHREN ZUR AGGREGATION VON PROTEINEN,,UNILEVER NV,EVANS MERVYN THOMAS ARTHUR;;JONES MALCOLM GLYN DESMOND;;JONES NORMAN,,https://lens.org/031-227-083-838-870,Patent Application,no,0,0,6,10,0,A23G9/38;;A23C13/12;;A23G9/20;;A23G9/32;;A23G9/325;;A23G9/34;;A23G9/46;;A23G2200/06;;A23J3/00;;A23J3/10;;A23L29/35,C12N9/44;;A23C11/10;;A23C13/12;;A23G9/00;;A23G9/20;;A23G9/32;;A23G9/34;;A23G9/38;;A23G9/46;;A23J1/00;;A23J3/00;;A23J3/10;;A23L1/09,,0,0,,,,DISCONTINUED
782,CA,A,CA 714113 A,087-566-708-790-933,1965-07-20,1965,CA 714113D A,,CA 714113T A,,POLYMER COMPOSITIONS,,BRITISH TITAN PRODUCTS,EVANS ARTHUR W;;LEDERER GERHARD E F;;KYLE THOM I,,https://lens.org/087-566-708-790-933,Granted Patent,no,0,1,1,1,0,,,,0,0,,,,EXPIRED
783,DE,A1,DE 2229031 A1,111-438-580-768-535,1973-01-04,1973,DE 2229031 A,1972-06-14,GB 2776571 A,1971-06-14,FARBLOSE FARBSTOFFBILDNER,,ICI LTD,EVANS RONALD ARTHUR;;HOLT KENNETH ANTHONY;;RENFREW ANDREW HUNTER MORRIS,,https://lens.org/111-438-580-768-535,Patent Application,no,0,0,26,26,0,B41M5/136;;B41M5/0253;;C09B11/02,B41M5/025;;B41M5/136;;C09B11/02,,0,0,,,,DISCONTINUED
784,DE,A1,DE 1495135 A1,119-586-357-566-987,1968-12-12,1968,DE B0073002 A,1963-08-05,GB 3205762 A,1962-08-21,Verfahren zur Herstellung pigmentierten Polymermaterials,,BRITISH TITAN PRODUCTS,WALLACE EVANS ARTHUR;;FERDINAND LEDERER GERHARD EMIL;;IAN KYLE THOM,,https://lens.org/119-586-357-566-987,Patent Application,no,0,0,6,7,0,C08F2/44;;C08F2/44,C08F2/44,,0,0,,,,EXPIRED
785,US,A,US 3393165 A,118-308-242-033-340,1968-07-16,1968,US 29946963 A,1963-08-02,GB 3205762 A,1962-08-21,Polymer compositions,,BRITISH TITAN PRODUCTS,WALLACE EVANS ARTHUR;;FERDINAND LEDERER GERHARD EMIL;;IAN KYLE THOM,,https://lens.org/118-308-242-033-340,Granted Patent,no,11,14,6,7,0,C08F2/44;;C08F2/44,C08F2/44,260/22,0,0,,,,EXPIRED
786,GB,A,GB 2222705 A,024-041-608-808-481,1990-03-14,1990,GB 8811837 A,1988-05-19,GB 8811837 A,1988-05-19,Reduced pressure enclosure,"A reduced pressure enclosure (10) such as a fume cupboard comprising an outlet duct (11) and an access opening (12) closable by means such as a sliding sash (13), has a sensor (14) for sensing the velocity of air flow at the opening (12) and connected to circuitry (15) which controls flow control means (19) in the duct (11) which leads to an extractor fan (not shown). This allows the rate of extraction of air from the cabinet to be regulated in accordance with the size of the opening (12). The enclosure can be part of a system including a plurality of enclosures feeding a common exhaust system, each (reduced pressure enclosure (10) having a closed loop flow control system. For use with the above systems an anemometer is also described which includes a pair of matched electronic components such as diodes (30), (31) disposed side-by-side in an air stream (33), one of said components (30) having heating means (32) attached to it and the two components being connected to circuitry adapted to sense the difference in temperature of the components and thus the velocity of air therepast. Changes in air temperature are thereby compensated. <IMAGE>",WHEELER THOMAS ARTHUR WISBEY;;EADY JOHN GRAHAM;;EVANS WILLIAM EDWARD;;ROBERT LESLIE WEST,WHEELER THOMAS ARTHUR WISBEY;;EADY JOHN GRAHAM;;EVANS WILLIAM EDWARD,,https://lens.org/024-041-608-808-481,Patent Application,no,2,12,2,2,0,B08B15/023;;G01P5/10;;G01F1/684;;G01F1/6842;;G01F1/69;;G01F1/696,B08B15/02;;G01F1/684;;G01F1/69;;G01F1/696;;G01P5/10,G1N NAEQ          AEQ;;G1N N1D13         AEQ;;G1N N3S2          AEQ;;G1N N4A           AEQ;;G1N N7A1          AEQ;;G1N N7B1          AEQ;;G3R RA622         BG29;;G3R RBG29         BG29;;U1S S1438;;U1S S1738;;U1S S2150,0,0,,,,DISCONTINUED
787,GB,A,GB 2453155 A,028-522-658-233-308,2009-04-01,2009,GB 0718892 A,2007-09-26,GB 0718892 A,2007-09-26,Co-axial pipe assembly which supplies oil to a bearing in a gas turbine engine,"A co-axial pipe assembly includes secondary leak containment and leak indication of lubricating oil being supplied oil to an internal bearing chamber in a gas turbine engine. The pipe assembly comprises a concentric outer tube nut 38 which surrounds and shields an inner oil supply pipe 8 in a hostile zone 6. One end of the pipe 8 has a cone 34 which is forced by the tube nut 38 into a fluid tight joint with a corresponding cone 32 in a manifold 12. If the cone seal 32, 34 fails then oil will find its way through vent bleed holes 50 into an interstitial space 52 between the pipe 8 and an internal bore of the tube nut 38. The interstitial space 52 has an opening 54 which is a safe zone outside the hostile zone 6 thus the oil leak does not present a hazard since the safe zone is external to an engine casing 2 and the leak may be observed during maintenance actions. The pipe assembly may also be used to avoid contamination of foodstuff.",ROLLS ROYCE PLC,CARBINES-EVANS ALEX JAMES;;QUARTLY PHILIP ARTHUR;;SLACK GRAHAM ANDREW,,https://lens.org/028-522-658-233-308,Patent Application,no,3,0,5,5,0,F01D9/065;;F01D25/18;;F16C33/1045;;F16C2360/23;;F01D25/18;;F16L5/14;;F16L39/005;;F01D25/18;;F01D9/065;;F16C33/1045;;F16C2360/23,F16L39/00;;F01D25/18;;F16L5/14,,0,0,,,,PENDING
788,GB,A,GB 1005434 A,059-319-577-435-320,1965-09-22,1965,GB 2831061 A,1961-08-03,GB 2831061 A,1961-08-03,Polymer compositions,"A process for the production of pigmented polymers comprises dry milling together a pigment and a composition of which at least the greater part is a polymerizable monomer, the amount of pigment being at least 1% by volume of said composition, and thereafter polymerizing the monomer. Specified pigments are rutile and anatase, which may be coated with alumina, silica and/or titanium dioxide. Milling may be effected in the presence of dispersing agents, e.g. ethylene oxide condensates with fatty acids and alcohols, sodium hydrocarbon sulphonates, quaternary ammonium salts and alkyd resins, particularly oil modified alkyds. Specified monomers are vinyl acetate, acrylic and methacrylic esters, acrylonitrile, vinylidene chloride, styrene, butadiene and dialkyl maleates and fumarates. Polymerization may be effected in bulk, suspension or emulsion, e.g. in the presence of alkyl or hydroxyalkyl cellulose ethers, in the presence of peroxide and redox initiators and sequestertering agents. Plasticizers may be added before polymerization. In examples, vinyl acetate is milled with a rutile pigment coated with alumina and titanium dioxide in the presence of (1) a linseed oil modified pentaerythritol alkyd resin and the product polymerized in aqueous emulsion in the presence of hydroxyethyl cellulose, polyethylene oxide, trisodium salt of ethylenediamine tetraacetic acid, sodium bicarbonate, ammonium persulphate, sodium metabisulphite, and with the addition of benzoyl peroxide, vinyl acetate and dibutyl phthalate, and (2) a linseed oil modified pentaerythritol alkyd resin and dibutyl phthalate, and the product polymerized in aqueous emulsion in the presence of hydroxyethyl cellulose, a condensate of ethylene oxide with a long chain fatty alcohol, ammonium persulphate and sodium formaldehyde sulphoxylate, and with the addition of benzoyl peroxide, vinyl acetate and dibutyl phthalate. The products may be used in emulsion paints.",BRITISH TITAN PRODUCTS,EVANS ARTHUR WALLACE;;LEDERER GERHARD EMIL FERDINAND;;KYLE THOM IAN,,https://lens.org/059-319-577-435-320,Granted Patent,no,0,4,3,4,0,C08F2/44,C08F2/44,C3L LDF           LDF;;C3L LEA           LEA;;C3P P10D2A        -;;C3P P10P1B        -;;C3P P10P1C        -;;C3P P10P1D        -;;C3P P10P1E1       -;;C3P P10P1E2       -;;C3P P10P1E5       -;;C3P P10P1F        -;;C3P P10P2A1       -;;C3P P10P2A2       -;;C3P P10P2A4       -;;C3P P10P2C        -;;C3P P10P4C        -;;C3P P10P5         -;;C3P P10P6B        -;;C3P P10P6X        -;;C3P P14D4         -;;C3P P14D7A        -;;C3P P14K4         -;;C3P P14P1B        -;;C3P P14P1C        -;;C3P P14P1D        -;;C3P P14P1E1       -;;C3P P14P1E2       -;;C3P P14P1E5       -;;C3P P14P1F        -;;C3P P14P2A1       -;;C3P P14P2A2       -;;C3P P14P2A4       -;;C3P P14P2C        -;;C3P P14P4C        -;;C3P P14P5         -;;C3P P14P6B        -;;C3P P14P6X        -;;C3P P2D1A2        P2.P;;C3P P2K9          -;;C3P P2P1B         -;;C3P P2P1C         -;;C3P P2P1D         -;;C3P P2P1E1        -;;C3P P2P1E2        -;;C3P P2P1E5        -;;C3P P2P1F         -;;C3P P2P2A1        -;;C3P P2P2A2        -;;C3P P2P2A4        -;;C3P P2P2C         -;;C3P P2P4C         -;;C3P P2P5          -;;C3P P2P6B         -;;C3P P2P6X         -;;C3P P4D3B1        -;;C3P P4P1B         -;;C3P P4P1C         -;;C3P P4P1D         -;;C3P P4P1E1        -;;C3P P4P1E2        -;;C3P P4P1E5        -;;C3P P4P1F         -;;C3P P4P2A1        -;;C3P P4P2A2        -;;C3P P4P2A4        -;;C3P P4P2C         -;;C3P P4P4C         -;;C3P P4P5          -;;C3P P4P6B         -;;C3P P4P6X         -;;C3P P7D2A1        -;;C3P P7K9          -;;C3P P7P1B         -;;C3P P7P1C         -;;C3P P7P1D         -;;C3P P7P1E1        -;;C3P P7P1E2        -;;C3P P7P1E5        -;;C3P P7P1F         -;;C3P P7P2A1        -;;C3P P7P2A2        -;;C3P P7P2A4        -;;C3P P7P2C         -;;C3P P7P4C         -;;C3P P7P5          -;;C3P P7P6B         -;;C3P P7P6X         -;;C3P P8D2A         -;;C3P P8D2B2        -;;C3P P8D3A         -;;C3P P8P1B         -,0,0,,,,EXPIRED
789,GB,A,GB 847972 A,140-380-138-497-018,1960-09-14,1960,GB 221558 A,1958-01-22,GB 221558 A,1958-01-22,Improvements in or relating to indicator means,"847,972. Visible signalling apparatus. K.G.M ELECTRONICS Ltd. Jan. 12, 1959 [Jan. 22, 1958; March 31, 1958; July 28, 1958], Nos. 2215/58, 10259/58 and 24276/58. Class 118 (2). A stacked indicator for the selective showing of any one of a set of numbers or letters &c. comprises a stack of plates arranged with their adjacent faces substantially in contact, a totally internally-reflecting light transmitting passage arranged at the rear of each one of the plates and a distinctive source of light associated with each passage to provide for trans-illumination of the plates and of the symbols on them. Fig. 1 of the Provisional Specification 2215/58 shows an indicator comprising stacked plates 1, for example of "" Perspex "" (Registered Trade Mark), which are bent to provide portions 2 substantially at right-angles to the plane of the operative portions of the plate on which the symbols, for example letters or numbers, are engraved. A festoon lamp 3 is associated with each of the plates so that they may be selectively illuminated total internal reflection of the light being provided at the bend in the plate. In the modification shown in Fig. 2, of the Provisional Specification 2215/58, the perspex plates 1 are stacked and bent so that their end portions 2 are mounted in slots in a block 5 of opaque material each being associated with a pea lamp 6 housed in bores in the block. As shown in Fig. 3 of the Provisional Specification 2215/58, the slots 4 are such that the portions 2 of the plate do not reach the end of their slot and the lamp 6 penetrate into it a short distance. The edge of the plate remote from the lamp 6 may be cut at an angle, polished and coated with reflective material to provide for transverse internal reflection at this face to direct the light at other angles into the engraving which forms the symbol on the face of the plate. The symbol on the plate may be in the form of discrete dots or the like separated by a distance small compared with the diameter of the dots. As shown in the Figure of the Provisional Specification 24276/58, a solid block 20 of Perspex or similar transparent material illuminated by a lamp 17 has one edge in contact with one Perspex plate of a stacked indicator, the block and the edge of the plates 11 may be coated with an opaque or silver finish to ensure total internal reflection.",K G M ELECTRONICS LTD,EVANS MEURIG HILL;;ELSEY ROBIN ARTHUR WARREN;;FREEDMAN HAROLD PHILIP,,https://lens.org/140-380-138-497-018,Granted Patent,no,0,5,1,1,0,G09F9/46,G09F9/46,G5C CEK           CEK,0,0,,,,EXPIRED
790,AT,B,AT 317660 B,020-452-789-828-553,1974-09-10,1974,AT 1211569 A,1969-12-30,GB 6197668 A,1968-12-31,Verfahren zur Herstellung einer eßbaren Triglyceridölemulsion,,UNILEVER NV,MERVYN THOMAS ARTHUR EVANS;;LAURENCE IAN IRONS;;JOHN RICHARD MITCHELL,,https://lens.org/020-452-789-828-553,Granted Patent,no,0,0,14,14,0,A23D7/003;;A23D7/0053;;A23D7/0056;;Y10S530/832;;Y10S530/833;;Y10S516/06;;Y10S516/915;;A23L29/10;;A23D7/0056;;A23D7/0053;;A23D7/003;;Y10S516/06;;Y10S530/833;;Y10S516/915;;Y10S530/832;;A23L29/10,A23G9/04;;A23D7/00;;A23D7/005;;A23L29/10;;B01J13/00;;C09K23/30,"53A,5/01",0,0,,,,EXPIRED
791,DE,A1,DE 2337275 A1,066-985-640-062-693,1974-02-14,1974,DE 2337275 A,1973-07-23,GB 3416872 A;;GB 4412872 A,1972-07-21,DURCHFLUSSREGELVENTIL,,LUCAS AEROSPACE LTD,LLOYD ARTHUR LESLIE;;PARRY-EVANS ANTHONY MICHAEL;;CAPEWELL TERENCE JOHN,,https://lens.org/066-985-640-062-693,Patent Application,no,0,1,6,10,0,F16K11/12,F16K11/12,,0,0,,,,EXPIRED
792,DE,A1,DE 2363100 A1,095-055-565-152-760,1974-07-11,1974,DE 2363100 A,1973-12-19,US 31796172 A,1972-12-26,MIKROPROGRAMM-STEUERWERK UND VERFAHREN ZU SEINEM BETRIEB,,IBM,ENGER THOMAS ARTHUR;;EVANS JUN CHARLES WESLEY;;JOHNSON LANCE HERMAN,,https://lens.org/095-055-565-152-760,Patent Application,no,0,0,13,13,0,G06F9/267;;G06F9/267,G06F9/28;;G06F9/22;;G06F9/26,,0,0,,,,DISCONTINUED
793,GB,A,GB 1284409 A,134-014-963-334-975,1972-08-09,1972,GB 6197668 A,1968-12-31,GB 6197668 A,1968-12-31,OIL EMULSIONS CONTAINING ACYLATED PROTEIN EMULSIFIERS,1284409 Ice cream; emulsifier UNILEVER Ltd 30 Dec 1969 [31 Dec 1968] 61976/68 Heading A2B [Also in Division C3] Ice-cream is prepared using as emulsifying agent an N - acylated unhydrolysed protein (see Division C3).,UNILEVER LTD,EVANS MERVYN THOMAS ARTHUR;;IRONS LAURENCE IAN;;MITCHELL JOHN RICHARD,,https://lens.org/134-014-963-334-975,Granted Patent,no,0,0,14,14,0,A23D7/003;;A23D7/0053;;A23D7/0056;;Y10S530/832;;Y10S530/833;;Y10S516/06;;Y10S516/915;;A23L29/10;;A23D7/0056;;A23D7/0053;;A23D7/003;;Y10S516/06;;Y10S530/833;;Y10S516/915;;Y10S530/832;;A23L29/10,A23G9/04;;A23D7/00;;A23D7/005;;A23L29/10;;B01J13/00;;C09K23/30,A2B BKE           BKE;;A2B B1Z           B1;;A2B B16           B16;;A2B B391          BKE;;C3H HHX2          HHX2;;C3H H501          HHX2;;C3H H518          HHX2,0,0,,,,EXPIRED
794,AU,A,AU 1972/043293 A,093-938-285-305-415,1973-12-13,1973,AU 1972/043293 A,1972-06-09,AU 1972/043293 A,1972-06-09,SPIRIT-REPRODUCING CARBON PAPERS,,ICI LTD,EVANS RONALD ARTHUR;;HOLT KENNETH ANTHONY;;RENFREW ANDREW HUNTER MORRIS,,https://lens.org/093-938-285-305-415,Patent Application,no,0,0,1,1,0,,B41M5/04;;B41M5/08,,0,0,,,,DISCONTINUED
795,US,A1,US 2020/0146558 A1,076-933-008-113-379,2020-05-14,2020,US 201916522640 A,2019-07-25,US 201916522640 A;;US 201862703282 P,2018-07-25,"Apparatus, code, methods, and systems for providing unexpected rewards for a measured change of a user","Code configured receiving, over the communications network from information sources associated with the user baseline data storing the baseline data in the attached database. A first algorithm is selected from algorithms stored in an attached database. The first algorithm is for facilitating the measured change of a user based upon the baseline data received. A performance indicator for facilitating the measured change is determined. Next, the code is configured for receiving from one of the information sources a first set of performance indicator user data, Next, the code determines based upon the performance indicator user data received if the performance indicator for the measured change was satisfied. Next, the code provides to the remote computing an unexpected reward message or the loss aversion message based upon if the performance indicator for the measured change was satisfied. The steps are repeated until the measured change is satisfied.",JONES CHRISTOPHER;;JAMES TED;;EVANS JOHN N;;ZIA ASIM;;BRASSERT ARTHUR,JONES CHRISTOPHER;;JAMES TED;;EVANS JOHN N;;ZIA ASIM;;BRASSERT ARTHUR,TRUSX INC (2020-08-20),https://lens.org/076-933-008-113-379,Patent Application,yes,0,0,1,1,0,A61B5/0205;;A61B5/0022;;A61B5/0022;;A61B5/0205;;A61B5/6824;;A61B5/6824;;A61B5/7275;;A61B5/7275;;G06Q30/0211;;G06Q30/0211;;G16H10/20;;G16H20/10;;G16H20/30;;G16H20/60;;G16H40/67,A61B5/0205;;A61B5/00;;G06Q30/02,,0,0,,,,DISCONTINUED
796,EP,A1,EP 3159589 A1,127-824-081-092-071,2017-04-26,2017,EP 16190701 A,2013-01-07,US 201261586372 P;;US 201213668633 A;;EP 13150379 A,2012-01-13,FLOW RATE SCALE FIELD CALIBRATION FOR BALANCING VALVE,"A balance or flow limiting valve features a valve body/member (12) having a flow rate indicator/scale (44) containing setting having printed flow rates calibrated in units of measure in volume per time increment between a minimum flow rate position (MIN) and a maximum flow rate position (MAX); and a knob/handle (48) having a position indicator and being moveable to any continuous position on the flow rate indicator/ scale between MIN and MAX in response to a user applied force, where the relationship between the flow rate indicator/scale (44) and the position indicator is based on calibrated flow characteristics of the balance or flow limiting valve. The user can set an exact desired flow rate in one operation by moving the knob/handle to a desired position between MIN and MAX without consulting a printed flow curve or balance calculator to determine the desired exact flow rate.
",FLUID HANDLING LLC,EVANS STANLEY PAUL;;ROSCA FLORIN;;HUSE GLENN EDWARD;;KAHN DONALD ARTHUR,,https://lens.org/127-824-081-092-071,Patent Application,yes,11,0,12,12,0,G05D7/01;;Y10T137/8225;;F16K37/0016;;Y10T137/8225;;G05D7/01;;Y10T137/8309;;F16K37/0016,F16K37/00;;G05D7/01,,0,0,,,,ACTIVE
797,US,B1,US 7292965 B1,138-177-001-238-861,2007-11-06,2007,US 86935004 A,2004-06-16,US 86935004 A;;US 51702300 A,2000-03-02,Method and system for estimating manufacturing costs,"A method and system estimates manufacturing costs for conventional and advanced materials and processes based on process-oriented approach. A computer system input display for selecting one or more designs and one or more design parameters. Cost models are based upon process-oriented manufacturing cost estimates for a plurality of designs utilizing materials and manufacturing processes. Software is programmed to receive selected designs and selected design parameters from the input display and pass the selected designs and design parameters to the cost models. An output display shows the manufacturing costs estimated by the cost models for the selected designs and design parameters. A manufacturing process flow simulation model highlights and quantifies the magnitude of the manufacturing process cost drivers. An architecture including a relational database is also disclosed, and input and editing modules can be utilized to modify the cost model equations or to provide input from other software applications.",AMERICAN TECHNOLOGY & SERVICES,MEHTA PAUL P;;EVANS JERRY WILLIAM;;LUDWIG ARTHUR L;;CHHABRA RAHUL,AMERICAN TECHNOLOGY & SERVICES INC (2004-06-10),https://lens.org/138-177-001-238-861,Granted Patent,yes,28,93,2,2,0,G06Q30/06;;G06Q30/06,G06F17/10;;G06F7/60;;G06G7/48;;G06Q30/06,703/2;;703/6,5,2,116-390-714-648-961;;010-651-429-294-606,10.1080/095448299261443;;10.1080/07408179708966405,"Determining the Affordability of Advanced Propulsion Systems, Paul P. Mehta, Jerry W. Evans, Arthur L. Ludwig, Jun. 7-10, 1999.;;Leibl et al, ""Cost Calculation with a Feature-based CAD System using Modules for Calculation, Comparison and Forecast"", Journal of Engineering Design, vol. 10 No. 1, pp. 93-102 (Mar. 1999).;;Anderson et al, ""Designing Quality into Products: The Use of Accounting Data in New Product Development"", Accounting Horizons, vol. 12 No. 3, pp. 213-233 (Sep. 1998).;;Hertenstein et al, ""Why Product Development Teams Need Management Accountants"", Management Accounting, vol. 79 No. 10, pp. 50-55 (Apr. 1998).;;Veeramani et al, ""Methodologies for Rapid and Effective Response to Requests for Quotation (RFQs)"", IIE Transactions, vol. 29 No. 10, pp. 825-838 (Oct. 1997).",EXPIRED
