269,GB,A,GB 1022406 A,098-884-871-791-373,1966-03-16,1966,GB 4857263 A,1963-12-09,GB 4857263 A,1963-12-09,Pigment production,"Finely divided metal oxides are prepared by introducing into a fluidized bed of particulate material at a temperature of at least 700 DEG C. a first metal halide (not F) and an oxygenating gas and simultaneously introducing at a point higher in the bed a second metal halide. Metals specified are titanium aluminium zirconium. Halide specified:-chloride. Oxygenating gas specified:-air or O2. Particulate size specified:-50-2000 m . The second halide is introduced at a distance above the first so that the first is oxidized before contact with second. The first halide may be a mixture of those specified or may be the same as the second and preferably forms sub-pigmentary particles of oxide. When the first and second halides are the same the amount introduced as the first halide is in the range 5-90% of the whole halide introduced. When they are different the first is in the range 0.5-10% of the total weight of metal oxide produced. The oxygenating gas may be introduced at any point in the bed or mixed with the first metal halide. The second metal halide is added so that it mixes rapidly and uniformly with the products of the first reaction. To the reactants may be added an alkali metal halide (potassium specified), water or silicon halide in the range 0.001-5% of the total weight of metal oxide produced. In an example a bed of particulate TiO2 was heated to 1050 DEG C. and TiCl4, preheated to 200 DEG C. and containing SiCl4 in an amount to give 0.125% silica by weight of the TiO2 produced, was passed in as a first halide. Oxygen preheated to 150 DEG C. and containing AlCl3 to give 0.62% alumina by weight of the TiO2 produced was passed in at the same level. Above these inlets is introduced preheated TiCl4. Good yields of TiO2 in a finely divided state are produced.",BRITISH TITAN PRODUCTS,EVANS ARTHUR WALLACE;;ARKLESS KENNETH,,https://lens.org/098-884-871-791-373,Granted Patent,no,0,0,2,3,0,C01B13/26;;C01G23/07;;C01P2006/60,C01B13/26;;C01G23/07,C1A ANX1D         -;;C1A AN4AX         -;;C1A AN40          -;;C1A APB4          APB4;;C1N N209          -;;C1N N21Y          -;;C1N N212          -;;C1N N213          -;;C1N N214          -;;C1N N251          -;;C1N N260          -;;C1N N261          -;;C1N N269          -;;C1N N275          -;;C1N N277          -;;C1N N279          -;;C1N N28X          -;;C1N N289          -;;C1N N30X          -;;C1N N300          -;;C1N N301          -;;C1N N302          -;;C1N N347          -;;C1N N35Y          -;;C1N N354          -;;C1N N357          -;;C1N N358          -;;C1N N367          -;;C1N N368          -;;C1N N391          -;;C1N N402          -;;C1N N404          -;;C1N N412          -;;C1N N414          -;;C1N N422          -;;C1N N432          -;;C1N N433          -;;C1N N436          -;;C1N N440          -;;C1N N464          -;;C1N N51X          -;;C1N N51Y          -;;C1N N541          -;;C1N N542          -;;C1N N543          -;;C1N N544          -;;C1N N545          -;;C1N N557          -;;C1N N560          -;;C1N N561          -;;C1N N589          -;;C1N N59Y          -;;C1N N592          -;;C1N N593          -;;C1N N594          -;;C1N N595          -;;C1N N604          -;;C1N N609          -;;C1N N61X          -;;C1N N61Y          -;;C1N N613          -;;C1N N617          -;;C1N N62X          -;;C1N N62Y          -;;C1N N626          -;;C1N N627          -;;C1N N628          -;;C1N N63X          -;;C1N N639          -;;C1N N641          -;;C1N N656          -;;C1N N658          -;;C1N N66X          -;;C1N N660          -;;C1N N663          -;;C1N N666          -;;C1N N67Y          -;;C1N N676          -;;C1N N678          -;;C1N N679          -;;C1N N68X          -;;C1N N682          -;;C1N N684          -;;C1N N700          -;;C1N N701          -;;C1N N703          -;;C1N N708          -;;C1N N714          -;;C1N N715          -;;C1N N716          -,0,0,,,,EXPIRED
270,DE,A1,DE 1657200 A1,146-018-865-537-430,1971-01-07,1971,DE 1657200 A,1967-09-15,GB 4158466 A,1966-09-16,Vorrichtung zur Abgabe von Fluessigkeiten,,DISTILLERS CO CARBON DIOXIDE,CRIPPEN PETER;;JAMES EVANS ARTHUR,,https://lens.org/146-018-865-537-430,Patent Application,no,0,0,3,3,0,F04B43/073;;F04B43/073;;G01F11/086;;G01F11/086,F04B43/073;;G01F11/08,,0,0,,,,DISCONTINUED
271,US,A,US 2058696 A,046-768-907-593-295,1936-10-27,1936,US 71318034 A,1934-02-27,US 71318034 A,1934-02-27,Process of stabilizing oils,,ASSOCIATED OIL COMPANY,ARTHUR LAZAR;;MANDERSON EVANS JOHN,,https://lens.org/046-768-907-593-295,Granted Patent,no,0,1,1,1,0,C10M1/08;;C10M1/08;;C10M2203/10;;C10M2203/10;;C10M2203/102;;C10M2203/102;;C10M2203/104;;C10M2203/104;;C10M2203/106;;C10M2203/106;;C10M2203/108;;C10M2203/108,,C5F F455          -,0,0,,,,EXPIRED
272,US,A,US 806963 A,049-562-931-632-763,1905-12-12,1905,US 1905/0270342 A,1905-07-19,US 1905/0270342 A,1905-07-19,TREE-FELLING FOOTBOARD.,,EVANS ARTHUR E;;CARON FORTUNA,EVANS ARTHUR E;;CARON FORTUNA,,https://lens.org/049-562-931-632-763,Granted Patent,no,0,3,1,1,0,A01M31/02;;A01M31/02,,,0,0,,,,EXPIRED
273,US,A,US 3009777 A,068-244-947-569-362,1961-11-21,1961,US 72810758 A,1958-04-14,GB 1281257 A,1957-04-18,Process for preparing zirconium sulphate solutions,,BRITISH TITAN PRODUCTS,WALLACE EVANS ARTHUR;;CYRIL SHORE,,https://lens.org/068-244-947-569-362,Granted Patent,no,3,4,4,4,0,C01G25/06;;C01G25/06;;C22B34/14;;C22B34/14,C01G25/06;;C22B34/14,,0,0,,,,EXPIRED
274,FR,A,FR 1538853 A,118-019-848-346-789,1968-09-06,1968,FR 121113 A,1967-09-15,FR 121113 A,1967-09-15,Appareil pour la distribution de fluides,,DISTILLERS CO CARBON DIOXIDE,CRIPPEN PETER;;EVANS ARTHUR JAMES,,https://lens.org/118-019-848-346-789,Granted Patent,no,0,0,1,1,0,G01F11/086,G01F11/08,,0,0,,,,EXPIRED
275,EP,B1,EP 0650507 B1,131-074-103-731-378,1997-01-22,1997,EP 93916104 A,1993-07-16,GB 9301511 W;;GB 9215184 A,1992-07-17,INTUMESCENT COMPOSITIONS,"PCT No. PCT/GB93/01511 Sec. 371 Date Mar. 10, 1995 Sec. 102(e) Date Mar. 10, 1995 PCT Filed Jul. 16, 1993 PCT Pub. No. WO94/02545 PCT Pub. Date Feb. 3, 1994.An intumescent composition comprises saline soluble inorganic silicate fibrous material containing CaO, MgO and no more than 4% by weight of Al2O3, such as calcium magnesium silicate. The fibres may be vitreous, with an average length of 10 to 500 microns, and may form 5 to 30 weight percent of the composition. The composition may be incorporated in a coating composition, e.g. for wet coating (paint) or powder coating, or a mastic or putty, or a composition containing a polymer. Enhanced fire protection can be provided, and the coating compositions may be applied as a single thick coating rather than by building up thin layers.",ALCAN INT LTD,WAINWRIGHT ROBIN;;EVANS KENNETH ARTHUR,,https://lens.org/131-074-103-731-378,Granted Patent,yes,2,3,17,17,0,C08K7/10;;C09D5/185;;C09K21/02;;C09D5/185;;C08K7/10;;C09K21/02,B05D7/24;;C08K3/22;;C08K3/34;;C08K7/00;;C08K7/10;;C08L101/00;;C09D5/00;;C09D5/18;;C09K3/00;;C09K21/02,,0,0,,,,EXPIRED
276,DE,A1,DE 1940634 A1,128-068-674-997-971,1970-03-05,1970,DE 1940634 A,1969-08-09,GB 4094568 A,1968-08-27,Elektrodengitter fuer Bleiakkumulatoren,,ELECTRIC POWER STORAGE LTD,SHANKS NORMAN;;ARTHUR EVANS JAMES,,https://lens.org/128-068-674-997-971,Patent Application,no,0,1,5,5,0,H01M4/73;;H01M4/73;;Y02E60/10;;Y10T29/10;;Y10T29/10,H01M4/73,,0,0,,,,EXPIRED
277,US,A,US 5111678 A,158-206-924-706-390,1992-05-12,1992,US 70583591 A,1991-05-28,US 70583591 A;;US 45722989 A,1989-12-26,Electric heater coil transferring and forming apparatus and method of use,A method and apparatus for forming an electric resistance heating coil of desired resistance that involves forming a straight helical coil and centering the formed coil for transfer to a first folding station for holding the straight helical coil into a U-shaped helical coil.,CARRIER CORP,EVANS ARTHUR;;MCMANUS JOHN R,,https://lens.org/158-206-924-706-390,Granted Patent,yes,5,3,2,2,0,B21D11/00;;B21F35/00;;B21F35/00;;H05B3/32;;H05B3/32;;Y10T29/53261;;Y10T29/53261,B21F35/00;;H05B3/32,72/134;;72/422;;72/426;;29/759,0,0,,,,EXPIRED
278,GB,A,GB 919019 A,020-106-729-405-08X,1963-02-20,1963,GB 698858 A,1958-03-04,GB 698858 A,1958-03-04,Production of metal oxides,"Oxides of titanium, aluminium, zirconium or hafnium are prepared by reacting the corresponding halide with oxygen in the presence of a fluidized bed of inert solids which has a cross-sectional area at least that of a circle of 15 inches diameter and contains sufficient solid to conserve the heat from p the exothermic reaction to render it self-sustaining. The reaction is effected in the bed and the oxide product is for the most part discharged in entrainment with the outgoing gases. The oxide accretion on the bed particles is maintained at or below 20% by weight of the inert solids material. The reactants are introduced, preferably separately, through a plurality of inlet ducts distributed across the bed cross-section and the inlet ducts are provided with constrictions each of which produces a pressure drop which is at least one half of the pressure drop from the bottom to the top of the fluidized bed. The fluidized bed may be as described in Specification 761,770, i.e. the particle size should be from 40-1000 microns, and temperature of the bed is normally between 800 DEG and 1300 DEG C. A proportion of the ozide product forms as an accretion on the bed particles and accordingly a portion of the bed may be withdrawn and cleaned, for example by chlorination. The reactants, namely the halide and oxygen are normally employed in stoichiometric amounts, but oxygen to chloride ratios from 0,75:1 to 4:1 may be employed. Withdrawal of the bed solids may be employed as a cooling means since such solids may be withdrawn and cooled or fed at any temperature desired to obtain adequate cooling and adequate purging of oxide accretion from the bed particles. The apparatus employed is described and claimed in Specification 919,020 and the orifices in the perforated base of the fluidized bed may be provided with means to bar ingress of the bed material to the fluidizing gas supply, as described in Specifications 724,193, 794,666 and 813,489. According to examples (1) a vertical steel shaft furnace was provided with a perforated base fitted with manifolds feeding titanium tetrachloride and oxygen. A zircon sand bed of 150 microns average diameter was preheated to 1100 DEG C. and the reaction temperature was thereafter maintained at 980 DEG C., overheating being prevented by feeding and removing zircon sand. A minor quantity of water may be added to the oxygen reactant stream. (3) Aluminium trichloride and oxygen were separately fed to a fluidized bed of zircon sand which was maintained at 1000 DEG C. throughout the reaction by withdrawing zircon sand and feeding in cool sand. Aluminium oxide of 0,07 microns diameter was obtained. Specification 849,140 also is referred to.",BRITISH TITAN PRODUCTS,EVANS ARTHUR WALLACE;;HUGHES WILLIAM,,https://lens.org/020-106-729-405-08X,Granted Patent,no,0,5,4,6,0,B01J19/26;;B01J19/26;;B01J4/002;;B01J4/002;;B01J8/1818;;B01J8/1818;;B01J8/1827;;B01J8/1827;;B01J8/44;;B01J8/44;;B01J2208/00495;;B01J2208/00495;;B82Y30/00;;B82Y30/00;;C01B13/26;;C01B13/26;;C01B33/183;;C01B33/183;;C01P2004/52;;C01P2004/52;;C01P2004/64;;C01P2004/64;;C01P2006/12;;C01P2006/12;;C01P2006/60;;C01P2006/60;;C01P2006/90;;C01P2006/90,B01J8/44;;C01B13/26;;C01B33/18,C1A APB4          APB4;;C1N N209          -;;C1N N21Y          -;;C1N N212          -;;C1N N213          -;;C1N N214          -;;C1N N215          -;;C1N N251          -;;C1N N260          -;;C1N N261          -;;C1N N269          -;;C1N N275          -;;C1N N337          -;;C1N N346          -;;C1N N347          -;;C1N N35Y          -;;C1N N354          -;;C1N N357          -;;C1N N358          -;;C1N N367          -;;C1N N368          -;;C1N N391          -;;C1N N402          -;;C1N N403          -;;C1N N406          -;;C1N N407          -;;C1N N408          -;;C1N N412          -;;C1N N414          -;;C1N N42X          -;;C1N N422          -;;C1N N432          -;;C1N N433          -;;C1N N436          -;;C1N N440          -;;C1N N448          -;;C1N N449          -;;C1N N464          -;;C1N N504          -;;C1N N51Y          -;;C1N N511          -;;C1N N540          -;;C1N N541          -;;C1N N542          -;;C1N N543          -;;C1N N544          -;;C1N N545          -;;C1N N546          -;;C1N N557          -;;C1N N558          -;;C1N N560          -;;C1N N579          -;;C1N N59X          -;;C1N N592          -;;C1N N593          -;;C1N N594          -;;C1N N595          -;;C1N N604          -;;C1N N61X          -;;C1N N61Y          -;;C1N N613          -;;C1N N617          -;;C1N N626          -;;C1N N632          -;;C1N N633          -;;C1N N634          -;;C1N N641          -;;C1N N656          -;;C1N N657          -;;C1N N658          -;;C1N N66X          -;;C1N N66Y          -;;C1N N663          -;;C1N N664          -;;C1N N666          -;;C1N N679          -;;C1N N68X          -;;C1N N680          -;;C1N N682          -;;C1N N683          -;;C1N N684          -;;C1N N685          -;;C1N N689          -;;C1N N69X          -;;C1N N691          -;;C1N N695          -;;C1N N697          -;;C1N N714          -;;C1N N715          -;;C1N N716          -,0,0,,,,EXPIRED
279,DE,A1,DE 1657201 A1,039-592-472-580-46X,1971-01-21,1971,DE 1657201 A,1967-09-15,GB 4158566 A,1966-09-16,Vorrichtung zur Abgabe von Fluessigkeiten,,DISTILLERS CO CARBON DIOXIDE,CRIPPEN PETER;;JAMES EVANS ARTHUR,,https://lens.org/039-592-472-580-46X,Patent Application,no,0,0,9,9,0,B67D1/10;;B67D1/10,B67D1/10,,0,0,,,,DISCONTINUED
280,FR,A,FR 523940 A,135-393-718-358-112,1921-08-27,1921,FR 523940D A,1920-09-10,GB 523940X A,1919-10-13,Ensemble de vilebrequin et de différentiel combiné,,STEPHEN EVANS ALLEY;;ARTHUR THOMSON,ALLEY STEPHEN EVANS;;THOMSON ARTHUR,,https://lens.org/135-393-718-358-112,Granted Patent,no,0,0,1,1,0,F16H48/10;;F16H48/11;;F16H2048/106,F16H48/10,"X, 4",0,0,,,,EXPIRED
281,US,A,US 3130011 A,170-322-774-568-238,1964-04-21,1964,US 83694059 A,1959-08-31,GB 3130011X A,1958-09-17,Production of silicon halides,,BRITISH TITAN PRODUCTS,WALLACE EVANS ARTHUR;;KENNETH ARKLESS,,https://lens.org/170-322-774-568-238,Granted Patent,no,3,3,1,1,0,C01B33/08;;C01B33/08,C01B33/08,,0,0,,,,EXPIRED
282,US,A,US 3455487 A,007-041-649-727-446,1969-07-15,1969,US 3455487D A,1967-09-13,GB 4158466 A,1966-09-16,FLUID DISPENSING APPARATUS,,DISTILLERS CO CARBON DIOXIDE,CRIPPEN PETER;;EVANS ARTHUR JAMES,,https://lens.org/007-041-649-727-446,Granted Patent,no,3,13,3,3,0,F04B43/073;;F04B43/073;;G01F11/086;;G01F11/086,F04B43/073;;G01F11/08,222/76,0,0,,,,EXPIRED
283,CA,A,CA 637114 A,054-611-174-422-10X,1962-02-27,1962,CA 637114D A,,CA 637114T A,,FLUID BED OXIDATION OF TICL4,,BRITISH TITAN PRODUCTS,EVANS ARTHUR W;;HUGHES WILLIAM,,https://lens.org/054-611-174-422-10X,Granted Patent,no,0,0,1,1,0,,,,0,0,,,,EXPIRED
284,US,A,US 3188173 A,053-466-069-065-679,1965-06-08,1965,US 16274761 A,1961-12-28,GB 698858 A;;GB 2177853 A,1953-08-06,"Process for the production of oxides of al, si and ti",,BRITISH TITAN PRODUCTS,WILLIAM HUGHES;;WALLACE EVANS ARTHUR,,https://lens.org/053-466-069-065-679,Granted Patent,no,4,10,1,6,0,B01J8/44;;B01J2208/00495;;B82Y30/00;;C01B13/26;;C01B33/183;;C01P2004/52;;C01P2004/64;;C01P2006/12;;C01P2006/60;;C01P2006/90;;B82Y30/00;;C01P2006/60;;C01B13/26;;B01J8/44;;C01P2006/90;;C01B33/183;;B01J2208/00495;;C01P2006/12;;C01P2004/64;;C01P2004/52,B01J8/44;;C01B13/26;;C01B33/18,,0,0,,,,EXPIRED
285,DE,D1,DE 69307709 D1,066-202-262-601-480,1997-03-06,1997,DE 69307709 T,1993-07-16,GB 9215184 A;;GB 9301511 W,1992-07-17,SICH AUFBLÄHENDE ZUSAMMENSETZUNGEN,"PCT No. PCT/GB93/01511 Sec. 371 Date Mar. 10, 1995 Sec. 102(e) Date Mar. 10, 1995 PCT Filed Jul. 16, 1993 PCT Pub. No. WO94/02545 PCT Pub. Date Feb. 3, 1994.An intumescent composition comprises saline soluble inorganic silicate fibrous material containing CaO, MgO and no more than 4% by weight of Al2O3, such as calcium magnesium silicate. The fibres may be vitreous, with an average length of 10 to 500 microns, and may form 5 to 30 weight percent of the composition. The composition may be incorporated in a coating composition, e.g. for wet coating (paint) or powder coating, or a mastic or putty, or a composition containing a polymer. Enhanced fire protection can be provided, and the coating compositions may be applied as a single thick coating rather than by building up thin layers.",ALCAN INT LTD,WAINWRIGHT ROBIN;;EVANS KENNETH ARTHUR,,https://lens.org/066-202-262-601-480,Granted Patent,no,0,0,17,17,0,C08K7/10;;C09D5/185;;C09K21/02;;C09D5/185;;C08K7/10;;C09K21/02,B05D7/24;;C08K3/22;;C08K3/34;;C08K7/00;;C08K7/10;;C08L101/00;;C09D5/00;;C09D5/18;;C09K3/00;;C09K21/02,,0,0,,,,EXPIRED
286,GB,A,GB 889791 A,112-845-125-501-788,1962-02-21,1962,GB 1281257 A,1957-04-18,GB 1281257 A,1957-04-18,Treatment of zirconiferous materials,"In the recovery of zirconium values as soluble compounds from zirconiferous materials rich in silica, e.g. zircon sand, the finely divided zirconiferous materials are admixed with at least one finely divided alkali metal oxide, hydroxide, or carbonate, and at least one finely divided alkaline earth metal or magnesium oxide, hydroxide, or carbonate, and the mixture is then roasted, under conditions such as substantially to avoid fusion or sintering of the mixture. The amount of alkaline earth metal or magnesium compound employed is preferably in the range of 0,2 to 1,8 stoichiometric equivalents per equivalent of zirconia+silica, and the amount of alkali metal compound is preferably in the range of 0,1 to 1,9 stoichiometric equivalents per equivalent of zirconia+silica. The zirconium values may be recovered from the roasted product by digesting with a mineral acid, preferably in excess, and lixiviating with water, preferably at elevated temperature, to dissolve the zirconium. The digestion with the mineral acid, for example hydrochloric or nitric, preferably sulphuric, acid, is carried out such that the treated material is in the form of a slurry, paste or, preferably, a substantially dry pulverulent mass. Advantageously dilute acid may be added during the lixiviation with water. The mixing prior to roasting is preferably carried out in the dry state for example in a drum with vanes, or it may be mixed as a slurry or paste, and either dried or fed as it is to the roasting, which may be carried out in stationary or moving hearth furnaces either in crucibles or directly, or preferably either in batches or continuously in a rotary furnace in which it undergoes mixing during the roasting. The zirconium sulphate solution obtained when the roast is digested with sulphuric acid may be used for incorporation with titanium dioxide pigments either by neutralizing the solution either in situ or prior to mixing with the titanium dioxide. The thus coated or mixed pigment is then dewatered and dried.",BRITISH TITAN PRODUCTS,EVANS ARTHUR WALLACE;;SHORE CYRIL,,https://lens.org/112-845-125-501-788,Granted Patent,no,0,3,4,4,0,C01G25/06;;C01G25/06;;C22B34/14;;C22B34/14,C01G25/06;;C22B34/14,C1A AP15          AP15,0,0,,,,EXPIRED
287,CA,A,CA 617886 A,127-270-197-349-578,1961-04-04,1961,CA 617886D A,,CA 617886T A,,PREPARATION OF TITANIUM DIOXIDE,,BRITISH TITAN PRODUCTS,EVANS ARTHUR W;;ARKLESS KENNETH,,https://lens.org/127-270-197-349-578,Granted Patent,no,0,0,1,1,0,,,,0,0,,,,EXPIRED
288,NO,D0,NO 950162 D0,013-118-889-869-072,1995-01-16,1995,NO 950162 A,1995-01-16,GB 9215184 A;;GB 9301511 W,1992-07-17,Oppsvulmende sammensetninger,"PCT No. PCT/GB93/01511 Sec. 371 Date Mar. 10, 1995 Sec. 102(e) Date Mar. 10, 1995 PCT Filed Jul. 16, 1993 PCT Pub. No. WO94/02545 PCT Pub. Date Feb. 3, 1994.An intumescent composition comprises saline soluble inorganic silicate fibrous material containing CaO, MgO and no more than 4% by weight of Al2O3, such as calcium magnesium silicate. The fibres may be vitreous, with an average length of 10 to 500 microns, and may form 5 to 30 weight percent of the composition. The composition may be incorporated in a coating composition, e.g. for wet coating (paint) or powder coating, or a mastic or putty, or a composition containing a polymer. Enhanced fire protection can be provided, and the coating compositions may be applied as a single thick coating rather than by building up thin layers.",ALCAN INT LTD,WAINWRIGHT ROBIN;;EVANS KENNETH ARTHUR,,https://lens.org/013-118-889-869-072,Patent Application,no,0,0,17,17,0,C08K7/10;;C09D5/185;;C09K21/02;;C09D5/185;;C08K7/10;;C09K21/02,C08K3/22;;C08K3/34;;B05D7/24;;C08K7/00;;C08K7/10;;C08L101/00;;C09D5/00;;C09D5/18;;C09K3/00;;C09K21/02,,0,0,,,,EXPIRED
289,NO,L,NO 950162 L,016-264-011-665-762,1995-01-16,1995,NO 950162 A,1995-01-16,GB 9215184 A;;GB 9301511 W,1992-07-17,Oppsvulmende sammensetninger,"PCT No. PCT/GB93/01511 Sec. 371 Date Mar. 10, 1995 Sec. 102(e) Date Mar. 10, 1995 PCT Filed Jul. 16, 1993 PCT Pub. No. WO94/02545 PCT Pub. Date Feb. 3, 1994.An intumescent composition comprises saline soluble inorganic silicate fibrous material containing CaO, MgO and no more than 4% by weight of Al2O3, such as calcium magnesium silicate. The fibres may be vitreous, with an average length of 10 to 500 microns, and may form 5 to 30 weight percent of the composition. The composition may be incorporated in a coating composition, e.g. for wet coating (paint) or powder coating, or a mastic or putty, or a composition containing a polymer. Enhanced fire protection can be provided, and the coating compositions may be applied as a single thick coating rather than by building up thin layers.",ALCAN INT LTD,WAINWRIGHT ROBIN;;EVANS KENNETH ARTHUR,,https://lens.org/016-264-011-665-762,Abstract,no,0,0,17,17,0,C08K7/10;;C09D5/185;;C09K21/02;;C09D5/185;;C08K7/10;;C09K21/02,C08K3/22;;C08K3/34;;B05D7/24;;C08K7/00;;C08K7/10;;C08L101/00;;C09D5/00;;C09D5/18;;C09K3/00;;C09K21/02,,0,0,,,,EXPIRED
290,DE,B,DE 1214817 B,114-764-529-470-453,1966-04-21,1966,DE B0068098 A,1962-07-19,GB 2622661 A,1961-07-19,Verfahren zur Herstellung farbbestaendiger Titandioxydpigmente,,BRITISH TITAN PRODUCTS,EVANS ARTHUR WALLACE;;SHORE CYRIL,,https://lens.org/114-764-529-470-453,Patent Application,no,3,0,2,3,0,C09C1/3661;;C01P2004/84,C09C1/36,,0,0,,,,DISCONTINUED
291,GB,A,GB 1275414 A,110-564-367-592-80X,1972-05-24,1972,GB 4094568 A,1968-08-27,GB 4094568 A,1968-08-27,IMPROVEMENTS RELATING TO THE MANUFACTURE OF GRIDS FOR THE PLATES OF ELECTRIC STORAGE BATTERIES,"1275414 Rolling battery grids ELECTRIC POWER STORAGE Ltd 26 Aug 1969 [27 Aug 1968] 40945/68 Heading B3M [Also in Division H1 A lead or lead alloy grid 15, for a storage battery plate, comprising a lattice of bars (or a lattice of ribs on a sheet) in which three bars radiate from each junction, two bars making an acute angle with a given direction common to all the junctions and one bar making an obtuse angle may be rolled from sheet metal, the direction of rolling being chosen so that at each junction two bars radiate in the direction of rolling and one bar radiates against the direction of rolling. The rolls are patterned to form the desired grid design.",ELECTRIC POWER STORAGE LTD,EVANS JAMES ARTHUR;;SHANKS NORMAN,,https://lens.org/110-564-367-592-80X,Granted Patent,no,0,0,5,5,0,H01M4/73;;H01M4/73;;Y02E60/10;;Y10T29/10;;Y10T29/10,H01M4/73,B3M ME            ME;;B3M M19B          M3;;B3M M3X           M3;;H1B B420          473;;H1B B473          473,0,0,,,,EXPIRED
292,US,A,US 3621701 A,130-446-419-300-572,1971-11-23,1971,US 3621701D A,1969-08-19,GB 4094568 A,1968-08-27,MANUFACTURE OF GRIDS FOR THE PLATES OF ELECTRIC STORAGE BATTERIES,,ELECTRIC POWER STORAGE LTD,EVANS JAMES ARTHUR;;SHANKS NORMAN,,https://lens.org/130-446-419-300-572,Granted Patent,no,0,1,5,5,0,H01M4/73;;H01M4/73;;Y02E60/10;;Y10T29/10;;Y10T29/10,H01M4/73,72/364,0,0,,,,EXPIRED
