328,EP,A3,EP 0469786 A3,156-085-082-645-964,1992-04-01,1992,EP 91306786 A,1991-07-25,US 56220690 A;;US 68056891 A,1990-08-02,HIGH SURFACE AREA MAGNESIA AS HARDENER FOR PHENOLIC RESINS,"There are disclosed methods and compositions for room temperature hardening of phenolic resole resin refractory compositions containing a magnesium oxide hardening agent alone or together with an organic ester. The resin is a low viscosity, low molecular weight resin having a high free phenol content. The magnesium hardening agent has a surface area of at least 20 square meters per gram. The compositions provide adequate working times and room temperature hardening within 24 hours.","BORDEN, INC.","TAYLOR, JOHN GERARD;;GERBER, ARTHUR HARRY",,https://lens.org/156-085-082-645-964,Search Report,yes,1,0,8,79,0,C04B35/634;;C04B35/63476;;C04B35/66;;C08G8/28;;C08K3/22,C04B35/634;;C04B35/66;;C08G8/28;;C08K3/22;;C08L61/10,,2,0,,,"CHEMICAL ABSTRACTS, vol. 103, no. 24, Columbus, Ohio, US; abstract no. 199399K, 'THERMOSETTING RESIN BINDERS FOR COLD HARDENING OF SAND MOLDS';;& JP-A-60 090 251 (KYUSHU REFRACTORY CO., LTD.) 21 May 1985",EXPIRED
329,US,A,US 4153462 A,026-252-311-161-229,1979-05-08,1979,US 60488975 A,1975-08-14,US 31169072 A,1972-12-04,Method of making silver halide emulsions,The present invention is directed to a method for forming the crystals of a photographic silver halide emulsion which comprises crystallizing silver halide grains from a solution of a water-soluble complex of silver halide complexed with excess halide ions. The crystals may be sensitized before the binder is added.,POLAROID CORP,GERBER ARTHUR M;;WALWORTH VIVIAN K,,https://lens.org/026-252-311-161-229,Granted Patent,yes,5,9,16,16,0,G03C1/015;;G03C1/015,C01G5/02;;G03C1/005;;G03C1/015,96 94R,0,0,,,,EXPIRED
330,US,A,US 4623682 A,167-528-912-470-673,1986-11-18,1986,US 78268285 A,1985-10-01,US 78268285 A,1985-10-01,Cement mixes and admixtures thereof,"Cement mix, particularly concrete mixes, for high compressive strength including early compressive strength, have extended workability without substantial loss in rate of hardening when containing an admixture combination of a sulfonated naphthalene-formaldehyde condensated and fractionated sulfonated lignin, such as ultrafiltered lignosulfonate.",SANDOZ LTD,NICHOLSON RICHARD R;;GERBER ARTHUR H,SANDOZ LTD (1985-11-18),https://lens.org/167-528-912-470-673,Granted Patent,yes,6,16,2,2,0,C04B28/02;;C04B28/02;;C04B24/18;;C04B24/18,C04B24/18;;C04B28/02,524/3;;106/90;;524/6,0,0,,,,EXPIRED
331,WO,A1,WO 1985/002479 A1,196-297-750-581-501,1985-06-06,1985,US 8401272 W,1984-08-13,US 55427083 A,1983-11-22,SLANTED POLE HEAD FOR MAGNETIC RECORDING,"A magnetic pole head for recording and playback. Its features, as illustrated in (Fig. 1) are: a high permeability core (1), a magnetic field producing means (3), and an acute angle PHI between the bottom surface and side surface at the trailing portion of the head (i.e. the portion which influences the recording medium (5) last). It has been found that this improved pole head significantly increases the derivative of vertical magnetic field intensity with respect to lateral distance. This increase in the rate at which vertical field intensity changes will allow for higher density perpendicular recording than is feasible with conventional vertical heads.",MINNESOTA MINING & MFG,GERBER JOEL ARTHUR;;SIEVERS JERRY ALBERT,,https://lens.org/196-297-750-581-501,Patent Application,yes,3,8,4,4,0,G11B5/187;;G11B5/187;;G11B5/127;;G11B5/127;;G11B5/1278;;G11B5/1278,G11B5/127;;G11B5/187,G5R RB264         RMJ;;G5R RB657         RMJ;;G5R RB658         RMJ;;G5R RB659         RMJ;;G5R RMJ           RMJ,9,0,,,"PATENTS ABSTRACTS OF JAPAN, Vol. 7, No. 26 (P-172) (1171), 2 February 1983 & JP, A, 57-179922 (Canon K.K.) 5 November 1982, see the whole document;;PATENTS ABSTRACTS OF JAPAN, Vol. 4 No. 168 (P-37) (650), 20 November 1980 & JP, A, 55113122 (Matsushita Denki Sangyo K.K.) 1 September 1980, see the whole document;;PATENTS ABSTRACTS OF JAPAN, Vol. 3, No. 64 (E-114), 31 May 1979, page 48E114 & JP, A, 54 041 710 (Hitachi Seisakusho K.K.) 4 March 1979 see the whole document;;PATENTS ABSTRACTS OF JAPAN, Vol. 2, No. 45, 27 March 1978, page 528E78 & JP, A, 53 009 110 (Fujitsu K.K.) 27 January 1978, see the whole document;;PATENTS ABSTRACTS OF JAPAN, Vol. 7, No. 138 (P-204) (1283), 16 June 1983 & JP, A, 58 053 013 (Fujitsu K.K.) 29 March 1983 see the whole document;;PATENTS ABSTRACTS OF JAPAN, Vol. 3, No. 96 (E-130), page 134E130, 15 August 1979 & JP, A, 54 074 718 (Tokyo Denki Kagaku Kogyo K.K.) 15 June 1979 see the whole document;;PATENTS ABSTRACTS OF JAPAN, Vol. 6, No. 212 (P-151) (1090), 26 October 1982 & JP, A, 57117119 (Fujitsu K.K.) 21 July 1982, see the whole document;;IBM Technical Disclosure Bulletin, Vol. 9, No. 7, December 1966 (Armonk, N.Y., US) J.L. DAWSON et al.: ""Edge Effect Magnetic Recording"", pages 776-777, see the whole document;;PATENTS ABSTRACTS OF JAPAN, Vol. 8, No. 68 (P-264) (1505), 30 March 1984 & JP, A, 58215713 (Fujitsu K.K.) 15 December 1983, see the whole document",PENDING
332,AU,A,AU 1973/062812 A,005-107-029-857-692,1975-05-22,1975,AU 1973/062812 A,1973-11-22,US 31169072 A,1972-12-04,METHOD OF MAKING SILVER HALIDE EMULSIONS,,POLAROID CORP,WALWORTH VIVIAN KANN;;GERBER ARTHUR MITCHELL,,https://lens.org/005-107-029-857-692,Patent Application,no,0,0,16,16,0,G03C1/015;;G03C1/015,C01G5/02;;G03C1/005;;G03C1/015,,0,0,,,,EXPIRED
333,FR,A1,FR 2346741 A1,049-693-942-731-791,1977-10-28,1977,FR 7709802 A,1977-03-31,US 67264776 A;;US 77504477 A;;US 77504577 A;;US 77504677 A,1976-04-01,PROCEDE POUR FORMER DES GRAINS D'HALOGENURE D'ARGENT PAR ELECTROLYSE,,POLAROID CORP,WALWORTH VIVIAN KANN;;GERBER ARTHUR MITCHELL,,https://lens.org/049-693-942-731-791,Patent Application,no,5,0,8,16,0,G03C1/0051,G03C1/005,,0,0,,,,EXPIRED
334,CA,A,CA 1141325 A,002-120-614-071-196,1983-02-15,1983,CA 379184 A,1981-06-05,CA 379184 A;;CA 275253 A;;US 67264776 A;;US 77504477 A;;US 77504577 A;;US 77504677 A,1976-04-01,FORMING SILVER HALIDE GRAINS WITH CATHODE OF ELEMENTAL HALOGEN AND CARBON,"A method which comprises the electrolytic generation of silver ions and halide ions employing a silver anode, a halide ion generating cathode comprising elemental halogen and electrically conducting carbon and an electrolyte and precipitation in the electrolyte of the ion pairs remote from the electrodes to provide photosensitive silver halide grains. A cell suitable for this method is also disclosed. This method diviates the critical and tedious washing requirements of the known processes.",POLAROID CORP,WALWORTH VIVIAN K;;GERBER ARTHUR M,,https://lens.org/002-120-614-071-196,Granted Patent,no,0,0,1,16,0,,C25B1/24;;C25B11/12,204-7,0,0,,,,EXPIRED
335,AU,A,AU 1977/023894 A,183-043-023-040-643,1978-10-12,1978,AU 1977/023894 A,1977-04-01,US 67264776 A;;US 77404677 A;;US 77504477 A;;US 77504577 A,1976-04-01,FORMING SILVER HALIDE GRAINS BY ELECTROLYSIS,,POLAROID CORP,WALWORTH VIVIAN KANN;;GERBER ARTHUR MITCHELL,,https://lens.org/183-043-023-040-643,Patent Application,no,0,0,2,16,0,G03C1/0051,C25B1/00;;C25B1/24;;C25B1/26;;G03C1/005,,0,0,,,,EXPIRED
336,IE,A1,IE 912736 A1,005-704-064-973-520,1992-02-12,1992,IE 273691 A,1991-08-01,US 56220690 A;;US 68056891 A,1990-08-02,High surface area magnesia as hardener for phenolic resins,"There are disclosed methods and compositions for room temperature hardening of phenolic resole resin refractory compositions containing a magnesium oxide hardening agent alone or together with an organic ester. The resin is a low viscosity, low molecular weight resin having a high free phenol content. The magnesium hardening agent has a surface area of at least 20 square meters per gram. The compositions provide adequate working times and room temperature hardening within 24 hours.",BORDEN CHEMICAL,TAYLOR JOHN GERARD;;GERBER ARTHUR HARRY,,https://lens.org/005-704-064-973-520,Patent Application,no,0,0,8,79,0,C04B35/634;;C04B35/63476;;C04B35/66;;C08G8/28;;C08K3/22,C04B35/634;;C04B35/66;;C08G8/28;;C08K3/22;;C08L61/10,,0,0,,,,EXPIRED
337,US,A,US 4102759 A,082-534-422-275-831,1978-07-25,1978,US 77504577 A,1977-03-07,US 77504577 A,1977-03-07,Method of electrolytically forming silver halide grains utilizing a novel anode,An electrolytic cell for generating silver ions and halide ions for the formation of photosensitive silver halide grains wherein the anode comprises particulate silver.,POLAROID CORP,GERBER ARTHUR M;;WALWORTH VIVIAN K,,https://lens.org/082-534-422-275-831,Granted Patent,yes,7,2,1,16,0,G03C1/0051;;G03C1/0051,C25B11/08;;G03C1/005,204/94,0,0,,,,EXPIRED
338,CA,A,CA 1109822 A,120-619-507-409-164,1981-09-29,1981,CA 275253 A,1977-03-31,US 67264776 A;;US 77504477 A;;US 77504577 A;;US 77504677 A,1976-04-01,METHOD OF FORMING SILVER HALIDE GRAINS BY ELECTROLYSIS,Photosensitive silver halide emulsions are prepared by the precipitation of silver halide grains from silver and halide ions generated by electrolysis.,POLAROID CORP,WALWORTH VIVIAN K;;GERBER ARTHUR M,,https://lens.org/120-619-507-409-164,Granted Patent,no,0,0,8,16,0,G03C1/0051,G03C1/005,204-7,0,0,,,,EXPIRED
339,EP,A1,EP 0164356 A1,025-286-116-062-750,1985-12-18,1985,EP 84903148 A,1984-08-13,US 55427083 A,1983-11-22,SLANTED POLE HEAD FOR MAGNETIC RECORDING.,"Tête magnétique polaire pour l'enregistrment et la reproduction, se caractérisant par un noyau de perméabilité élevée (1), un organe produisant un champ magnétique (3), et un angle aigu PHI entre la surface de fond et la surface latérale dans la partie de fuite de la tête (c'est-à-dire la partie qui influence en dernier le support d'enregistrement (5)). On a remarqué que cette tête polaire améliorée accroît considérablement la dérivée de l'intensité du champ magnétique vertical par rapport à la distance latérale. Cet accroissement de la vitesse à laquelle l'intensité du champ vertical change permet de réaliser un enregistrement perpendiculaire d'une densité plus élevée que celle possible avec des têtes verticales conventionnelles.",MINNESOTA MINING & MFG,GERBER JOEL ARTHUR;;SIEVERS JERRY ALBERT,,https://lens.org/025-286-116-062-750,Patent Application,yes,0,0,4,4,0,G11B5/187;;G11B5/187;;G11B5/127;;G11B5/127;;G11B5/1278;;G11B5/1278,G11B5/127;;G11B5/187,,1,0,,,See references of WO 8502479A1,DISCONTINUED
340,US,A,US 4060419 A,035-870-188-823-745,1977-11-29,1977,US 67264776 A,1976-04-01,US 67264776 A,1976-04-01,Method of forming silver halide grains by electrolysis,Photosensitive silver halide emulsions are prepared by the precipitation of silver halide grains from silver and halide ions generated by electrolysis.,POLAROID CORP,GERBER ARTHUR M;;WALWORTH VIVIAN K,,https://lens.org/035-870-188-823-745,Granted Patent,yes,6,6,1,16,0,G03C1/0051;;G03C1/0051,G03C1/005,96 94R,0,0,,,,EXPIRED
341,CA,A1,CA 2052264 A1,061-904-661-618-516,1992-10-05,1992,CA 2052264 A,1991-09-25,US 68056891 A,1991-04-04,HIGH SURFACE AREA MAGNESIA AS HARDENER FOR PHENOLIC RESINS,"R.I.C.2191 There are disclosed methods and compositions for room temperature hardening of phenolic resole resin refractory compositions containing a magnesium oxide hardening agent alone or together with an organic ester. The resin is a low viscosity, low molecular weight resin having a high free phenol content. The magnesium hardening agent has a surface area of at least 20 square meters per gram. The compositions provide adequate working times and room temperature hardening within 24 hours.",BORDEN INC,TAYLOR JOHN G;;GERBER ARTHUR H,,https://lens.org/061-904-661-618-516,Patent Application,no,0,0,3,79,0,C08G8/28;;C08G8/28;;C04B35/634;;C04B35/634;;C08K3/22;;C08K3/22,C08K3/00;;C04B35/634;;C08G8/28;;C08K3/22;;C08L61/04;;C08L61/06;;C08L61/10,,0,0,,,,DISCONTINUED
342,US,A,US 4139598 A,092-836-871-319-461,1979-02-13,1979,US 75874077 A,1977-01-12,US 47405574 A,1974-05-28,Catalytic preparation of soluble poly(dichlorophosphazenes),High molecular weight poly(dihalophosphazenes) which exhibit solubility in benzene and in substituted benzenes are prepared in solution or in bulk from dihalophosphazenes such as (Cl.sub.2 PN).sub.3-7 at moderate temperatures by the use of novel polymerization catalysts.,HORIZONS RESEARCH INC,REYNARD KENNARD A;;GERBER ARTHUR H,,https://lens.org/092-836-871-319-461,Granted Patent,yes,3,8,10,10,0,C08G79/025;;C08G79/025;;C01B21/097;;C01B21/097;;C01B21/0986;;C01B21/0986;;C07F3/103;;C07F3/103;;C07F9/65812;;C07F9/65812,C01B21/097;;C01B21/098;;C07F3/10;;C07F9/6581;;C08G79/00;;C08G79/02,423/300,0,0,,,,EXPIRED
343,US,A,US 3694253 A,143-352-424-095-141,1972-09-26,1972,US 3694253D A,1971-05-19,US 14475471 A,1971-05-19,METHOD OF FORMING CAPSULES OF POLYMER COATED SILVER HALIDE GRAINS,,POLAROID CORP,GERBER ARTHUR M;;WALWORTH VIVIAN K,,https://lens.org/143-352-424-095-141,Granted Patent,no,0,25,1,1,0,C08F2/44;;C08F2/46;;G03C1/002;;G03C1/005;;G03F7/002;;G03F7/002;;C08F2/46;;G03C1/005;;C08F2/44;;G03C1/002,C08F2/44;;C08F2/46;;G03C1/00;;G03C1/005;;G03F7/00,117/93.31,0,0,,,,EXPIRED
344,CA,A,CA 1040836 A,163-707-670-190-596,1978-10-24,1978,CA 224447 A,1975-04-11,US 47405574 A,1974-05-28,CATALYTIC PREPARATION OF SOLUBLE POLY(DICHLOROPHOSPHAZENES),High molecular weight poly(dihalophosphazenes) which exhibit solubility in benzene and in substituted benzenes are prepared in solution or in bulk from dihalophosphazenes such as (Cl2PN)3-7 at moderate temperatures by the use of novel polymerization catalysts.,HORIZONS RESEARCH INC,REYNARD KENNARD A;;GERBER ARTHUR H,,https://lens.org/163-707-670-190-596,Granted Patent,no,0,0,10,10,0,C08G79/025;;C08G79/025;;C01B21/097;;C01B21/097;;C01B21/0986;;C01B21/0986;;C07F3/103;;C07F3/103;;C07F9/65812;;C07F9/65812,C01B21/097;;C01B21/098;;C07F3/10;;C07F9/6581;;C08G79/00;;C08G79/02,23-77,0,0,,,,EXPIRED
345,CA,A,CA 1260963 A,047-663-544-806-815,1989-09-26,1989,CA 519301 A,1986-09-29,US 78268285 A,1985-10-01,CEMENT MIXES AND ADMIXTURES THEREOF,"Cement mix, particularly concrete mixes, for high compressive strength including early compressive strength, have extended workability without substantial loss in rate of hardening when containing an admixture combination of a sulfonated naphthalene-formaldehyde condensated and fractionated sulfonated lignin, such as ultrafiltered lignosulfonate.",SANDOZ LTD,GERBER ARTHUR H;;NICHOLSON RICHARD R,,https://lens.org/047-663-544-806-815,Granted Patent,no,0,1,2,2,0,C04B28/02;;C04B28/02;;C04B24/18;;C04B24/18,C04B24/18;;C04B28/02,261-56.1,0,0,,,,EXPIRED
346,DE,A1,DE 2714489 A1,102-665-642-783-874,1977-10-06,1977,DE 2714489 A,1977-03-31,US 67264776 A;;US 77504477 A;;US 77504577 A;;US 77504677 A,1976-04-01,VERFAHREN UND VORRICHTUNG ZUR HERSTELLUNG VON PHOTOGRAPHISCHEN SILBERHALOGENID-EMULSIONEN,,POLAROID CORP,WALWORTH VIVIAN KANN;;GERBER ARTHUR MITCHELL,,https://lens.org/102-665-642-783-874,Patent Application,no,2,0,8,16,0,G03C1/0051,G03C1/005,,0,0,,,,EXPIRED
347,AT,T1,AT E117707 T1,196-724-405-651-058,1995-02-15,1995,AT 91306786 T,1991-07-25,US 56220690 A;;US 68056891 A,1990-08-02,MAGNESIA MIT GROSSER SPEZIFISCHER OBERFLÄCHE ALS HÄRTER FÜR PHENOLHARZE.,"There are disclosed methods and compositions for room temperature hardening of phenolic resole resin refractory compositions containing a magnesium oxide hardening agent alone or together with an organic ester. The resin is a low viscosity, low molecular weight resin having a high free phenol content. The magnesium hardening agent has a surface area of at least 20 square meters per gram. The compositions provide adequate working times and room temperature hardening within 24 hours.",BORDEN INC,TAYLOR JOHN GERARD;;GERBER ARTHUR HARRY,,https://lens.org/196-724-405-651-058,Granted Patent,no,0,0,8,79,0,C04B35/634;;C04B35/63476;;C04B35/66;;C08G8/28;;C08K3/22,C04B35/634;;C04B35/66;;C08G8/28;;C08K3/22;;C08L61/10,,0,0,,,,DISCONTINUED
348,US,A,US 5873161 A,009-307-894-448-14X,1999-02-23,1999,US 68512596 A,1996-07-23,US 68512596 A,1996-07-23,Method of making a Z axis interconnect circuit,"Method for making Z-axis interconnections between adjacent circuit layers with electrically conductive traces, in multi-layered circuits, include connecting a conducting member of a deformable material to a circuit board layer and depositing an adhesive layer over an adjacent circuit board layer. The adjacent circuit layers are aligned, with the conducting member substantially collinear with the conductive traces of the adjacent circuit layers, and the circuit layers are brought together by pressure, such that the conducting member penetrates the adhesive layer and deforms until it ""cracks"". The cracking exposes fresh (unoxidized) material that contacts a conductive trace, joining the circuit layers together and creating a low resistance electrical connection. The adhesive serves to bound expansion of the deformable conducting member, reducing any potential contacts with adjacent conducting members.",MINNESOTA MINING & MFG,CHEN YU;;GERBER JOEL ARTHUR;;SMITH JOSHUA WOODWARD,MINNESOTA MINING AND MANUFACTURING COMPANY (1996-07-23),https://lens.org/009-307-894-448-14X,Granted Patent,yes,18,42,8,8,0,H05K3/46;;H05K3/4635;;H05K3/4635;;H01L23/5385;;H01L23/5385;;H01L2224/16237;;H01L2224/16237;;H01L2224/73253;;H01L2224/73253;;H01L2924/01019;;H01L2924/01019;;H01L2924/01021;;H01L2924/01021;;H01L2924/01057;;H01L2924/01057;;H01L2924/01078;;H01L2924/01078;;H01L2924/01079;;H01L2924/01079;;H05K1/0393;;H05K1/0393;;H05K3/28;;H05K3/28;;H05K3/305;;H05K3/305;;H05K3/361;;H05K3/361;;H05K3/4038;;H05K3/4038;;H05K3/4617;;H05K3/4617;;H05K3/4647;;H05K3/4647;;H05K2201/0195;;H05K2201/0195;;H05K2201/0305;;H05K2201/0305;;H05K2201/0367;;H05K2201/0367;;H05K2201/0394;;H05K2201/0394;;H05K2201/10977;;H05K2201/10977;;H05K2203/1189;;H05K2203/1189;;Y10T29/49126;;Y10T29/49126;;Y10T29/49144;;Y10T29/49144;;Y10T29/49149;;Y10T29/49149,H01L23/538;;H05K1/00;;H05K3/28;;H05K3/30;;H05K3/36;;H05K3/40;;H05K3/46,29/830;;29/840;;29/843,0,0,,,,EXPIRED
349,US,A,US 1759152 A,191-505-800-890-268,1930-05-20,1930,US 22952527 A,1927-10-28,US 22952527 A,1927-10-28,Sodium borate tri-sodium phosphate compound and process for its manufacture,,FED PHOSPHORUS CO,BOOTH CHARLES F;;GERBER ARTHUR B;;PAUL LOGUE,,https://lens.org/191-505-800-890-268,Granted Patent,no,0,5,1,1,0,C01B35/14;;C01B35/14,C01B35/14,,0,0,,,,EXPIRED
350,DE,T2,DE 69704851 T2,023-257-127-576-241,2001-11-29,2001,DE 69704851 T,1997-02-21,US 61111696 A;;US 9702669 W,1996-03-05,VERFAHREN ZUR HERSTELLUNG VON SEITENEINSATZSTÜCKEN FÜR WEGWERFARTIKEL,,PROCTER & GAMBLE,KEIGHLEY ARTHUR;;GERBER LEE;;NEASE GARY;;MIDKIFF DAWSON,,https://lens.org/023-257-127-576-241,Granted Patent,no,0,0,23,23,0,A61F13/15699;;A61F13/15804;;A61F13/49009;;A61F13/49015;;Y10T156/1015;;Y10T156/1008;;Y10T156/1051;;Y10T156/1062;;Y10T156/1085;;A61F13/15699;;A61F13/49015;;A61F13/15804;;Y10T156/1015;;Y10T156/1008;;Y10T156/1051;;Y10T156/1062;;Y10T156/1085;;A61F13/49015;;A61F13/15699;;A61F13/49009;;A61F13/15804,A61F13/49;;A61F5/44;;A61F13/15;;A61F13/472;;A61F13/496;;B32B43/00,,0,0,,,,EXPIRED
351,DE,D1,DE 69704851 D1,102-387-197-996-793,2001-06-21,2001,DE 69704851 T,1997-02-21,US 61111696 A;;US 9702669 W,1996-03-05,VERFAHREN ZUR HERSTELLUNG VON SEITENEINSATZSTÜCKEN FÜR WEGWERFARTIKEL,,PROCTER & GAMBLE,KEIGHLEY ARTHUR;;GERBER LEE;;NEASE GARY;;MIDKIFF DAWSON,,https://lens.org/102-387-197-996-793,Granted Patent,no,0,0,23,23,0,A61F13/15699;;A61F13/15804;;A61F13/49009;;A61F13/49015;;Y10T156/1015;;Y10T156/1008;;Y10T156/1051;;Y10T156/1062;;Y10T156/1085;;A61F13/15699;;A61F13/49015;;A61F13/15804;;Y10T156/1015;;Y10T156/1008;;Y10T156/1051;;Y10T156/1062;;Y10T156/1085;;A61F13/49015;;A61F13/15699;;A61F13/49009;;A61F13/15804,A61F13/49;;A61F5/44;;A61F13/15;;A61F13/472;;A61F13/496;;B32B43/00,,0,0,,,,EXPIRED
352,US,A,US 1688112 A,197-743-733-058-157,1928-10-16,1928,US 28828728 A,1928-06-25,US 28828728 A,1928-06-25,Saline tri-sodium phosphate and process for its manufacture,,BOOTH CHARLES F;;GERBER ARTHUR B;;PAUL LOGUE,BOOTH CHARLES F;;GERBER ARTHUR B;;PAUL LOGUE,,https://lens.org/197-743-733-058-157,Granted Patent,no,0,7,1,1,0,C01B25/30;;C01B25/30,C01B25/30,,0,0,,,,EXPIRED
353,US,A,US 1023267 A,019-695-961-124-402,1912-04-16,1912,US 1911/0621172 A,1911-04-14,US 1911/0621172 A,1911-04-14,PISTON-ACTUATED MECHANISM.,,MOCK CHARLES M;;GERBER ARTHUR U;;CORDELL HENRY,MOCK CHARLES M;;GERBER ARTHUR U;;CORDELL HENRY,,https://lens.org/019-695-961-124-402,Granted Patent,no,0,8,1,1,0,F15B11/048;;F15B11/048,,,0,0,,,,EXPIRED
354,US,A,US 1783417 A,039-399-918-044-465,1930-12-02,1930,US 8287726 A,1926-01-21,US 8287726 A,1926-01-21,White anhydrous calcium sulphate and method for producing same,,SWANN RES INC,DURGIN CHARLES B;;GERBER ARTHUR B;;PAUL LOGUE,,https://lens.org/039-399-918-044-465,Granted Patent,no,0,0,1,1,0,C01F11/466;;C01F11/466,C01F11/46,,0,0,,,,EXPIRED
355,CA,A,CA 1061947 A,127-818-439-856-240,1979-09-04,1979,CA 252786 A,1976-05-18,US 58601475 A,1975-06-11,SOLVENT RECOVERY OF THERMOPLASTIC POLYESTERS,"Thermoplastic linear polyesters such as polyethyleneterephthalate and polytetramethyleneterphthalate (sometimes called polybutyleneterephthalate) are prepared in the form of a pure, controlled particle size powder form either bulk material of virgin nature or, more importantly, form scrap containing a variety of contaminants, the process involves dissolving the polyester values in a polar solvent at an elevated temperature, under conditions chosen so that there is no degradation of the molecular weight of the original polyester, filtering the hot solution, cooling the filtrate to a temperature at which the polyester values being to crystallization begins in order to control the particle size, filtering off and washing the powdered polyester after precipitation is complete with the solvent used for initial solution of the polyester, treating the filtrate obtained therefrom after removal of the polyester values by known techniques for purposes of recovery of pure solvent and recovery of other values which may be present as contaminants in the original polyester by flushing with water, a lower alcohol, and/or an alkyl ketone, or by distillation.",HORIZONS RESEARCH INC,GERBER ARTHUR H;;WAINER EUGENE U S A,,https://lens.org/127-818-439-856-240,Granted Patent,no,0,0,5,5,0,C08J3/14;;C08J11/08;;C08J2367/02;;G03C11/24;;Y02P20/582;;Y02W30/62;;C08J11/08;;G03C11/24;;C08J2367/02;;C08J3/14;;Y02P20/582;;Y02W30/62,C08L67/00;;B09B3/00;;B29B11/00;;B29B17/02;;B29B17/04;;C08J3/14;;C08J11/08;;G03C11/24,403-8,0,0,,,,EXPIRED
356,BR,A,BR 9301162 A,016-462-795-406-52X,1994-11-22,1994,BR 9301162 A,1993-03-12,US 97139692 A,1992-11-04,Composições aglutinantes que endurecem a temperatura ambiente,,BORDEN INC,IYER S RAJA;;ARMBRUSTER DAVID R;;GERBER ARTHUR HARRY,,https://lens.org/016-462-795-406-52X,Patent Application,no,0,0,11,11,0,C08K5/32;;C08L61/12;;C08G8/22;;C08K5/32;;C08K3/22;;C08K5/10;;C08K3/36;;C08K3/28;;C08K3/38;;C08K5/32,C08G8/28;;C08K5/16;;C08K5/32;;C08L61/04;;C08L61/10,,0,0,,,,DISCONTINUED
357,EP,A3,EP 0073684 A3,023-799-057-358-594,1983-06-29,1983,EP 82304604 A,1982-09-01,US 29863981 A,1981-09-02,METHOD FOR FORMING A PHOTOSENSITIVE SILVER HALIDE ELEMENT,"A photosensitive silver halide element comprising a support carrying photosensitive silver halide grains in a predetermined spaced array is prepared by a method which comprises at least partially coalescing fine-grain silver halide in a plurality of spaced depressions in a first, relatively hydrophobic, layer, superposing the layer with a second, relatively hydrophilic, layer during or subsequent to the coalescence, and then separating the second and first layers whereby the coalesced silver halide grains are retained on the second layer in a pattern corresponding substantially to the pattern of the spaced depressions.",POLAROID CORPORATION,"GERBER, ARTHUR M.;;SLAFER, WARREN D.;;WALWORTH, VIVIAN K.",,https://lens.org/023-799-057-358-594,Search Report,yes,3,0,9,9,0,G03C1/005;;G03C1/005;;Y10S430/146;;Y10S430/146;;Y10S430/149;;Y10S430/149,G03C1/00;;G03C1/005;;G03C1/76,,0,0,,,,EXPIRED
358,NZ,A,NZ 250068 A,082-589-155-511-358,1995-08-28,1995,NZ 25006893 A,1993-10-27,US 97139692 A,1992-11-04,RETARDING ALKALINE CURE OF PHENOLIC RESOLES CONTAINING A HARDENING AGENT BY ADDING A NITROALKANE; RAW BATCH COMPOSITIONS COMPRISING REFRACTORY MATERIAL AND HARDENABLE RESOLES; COMPOSITIONS CONTAINING NITROALKANE DISSOLVED IN HARDENER,,BORDEN INC,IYER S RAJA;;ARMBRUSTER DAVID RAY;;GERBER ARTHUR HARRY,,https://lens.org/082-589-155-511-358,Patent Application,no,0,0,11,11,0,C08K5/32;;C08L61/12;;C08G8/22;;C08K5/32;;C08K3/22;;C08K5/10;;C08K3/36;;C08K3/28;;C08K3/38;;C08K5/32,C08K5/16;;C08K5/32;;C08L61/04;;C08L61/10;;C08G8/28,,0,0,,,,PENDING
359,IN,B,IN 181158 B,082-193-046-915-088,1998-04-25,1998,IN 43MA1993 A,1993-01-25,IN 43MA1993 A,1993-01-25,A method for the manufacture of a hardened henolic resole resin,,BORDEN CHEM INC,IYER RAJA S;;ARMBRUSTER DAVID RAY;;GERBER ARTHUR HARRY,,https://lens.org/082-193-046-915-088,Granted Patent,no,0,0,1,1,0,,C08G8/00,,0,0,,,,EXPIRED
360,AU,A,AU 1982/087418 A,025-135-533-028-977,1983-03-10,1983,AU 1982/087418 A,1982-08-19,US 29863981 A,1981-09-02,METHOD FOR FORMING A PHOTOSENSITIVE ELEMENT,,POLAROID CORP,GERBER ARTHUR M;;SLAFER WARREN D;;WALWORTH VIVIAN K,,https://lens.org/025-135-533-028-977,Patent Application,no,0,0,9,9,0,G03C1/005;;G03C1/005;;Y10S430/146;;Y10S430/146;;Y10S430/149;;Y10S430/149,G03C1/00;;G03C1/005;;G03C1/76,,0,0,,,,EXPIRED
361,AU,A,AU 1993/040173 A,121-702-878-049-931,1994-05-19,1994,AU 1993/040173 A,1993-06-09,US 97139692 A,1992-11-04,Ambient temperature hardening binder compositions,,BORDEN INC,IYER S RAJA;;ARMBRUSTER DAVID R;;GERBER ARTHUR HARRY,,https://lens.org/121-702-878-049-931,Patent Application,no,0,1,11,11,0,C08K5/32;;C08L61/12;;C08G8/22;;C08K5/32;;C08K3/22;;C08K5/10;;C08K3/36;;C08K3/28;;C08K3/38;;C08K5/32,C08G8/28;;C08K5/16;;C08K5/32;;C08L61/04;;C08L61/10,,0,0,,,,EXPIRED
