"#",Jurisdiction,Kind,Display Key,Lens ID,Publication Date,Publication Year,Application Number,Application Date,Priority Numbers,Earliest Priority Date,Title,Abstract,Applicants,Inventors,Owners,URL,Document Type,Has Full Text,Cites Patent Count,Cited by Patent Count,Simple Family Size,Extended Family Size,Sequence Count,CPC Classifications,IPCR Classifications,US Classifications,NPL Citation Count,NPL Resolved Citation Count,NPL Resolved Lens ID(s),NPL Resolved External ID(s),NPL Citations,Legal Status
1,GB,B,GB 2383060 B,161-273-233-663-369,2004-06-23,2004,GB 0228961 A,2002-12-11,US 1740401 A,2001-12-14,Fracture and wear-resistant rock bits,,SMITH INTERNATIONAL,LIANG DAH-BEN;;PORTWOOD GARY RAY;;COX PAUL ESTES;;WILLIAMS JOHN LEWIS,,https://lens.org/161-273-233-663-369,Granted Patent,no,5,0,7,25,0,C22C29/08;;C22C29/08;;E21B17/1092;;E21B17/1092;;E21B10/08;;E21B10/08;;E21B10/52;;E21B10/52,C22C29/08;;E21B10/08;;E21B10/52;;E21B17/10,E1F FGB           FGB,0,0,,,,EXPIRED
2,GB,A,GB 2383060 A,064-741-719-825-135,2003-06-18,2003,GB 0228961 A,2002-12-11,US 1740401 A,2001-12-14,Hard and tough cutting elements / inserts,A material with optimised hardness and toughness for use in forming cutting elements or inserts for rock bits has a fracture toughness of at least 21.977 Mpa (m)<SP> </SP> (20ksi (in)<SP>0.5</SP>) and a wear number of at least 1.5. The material may have a hardness of 83-85 Rockwell A and may be formed from tungsten carbide incorporating at least 12 % by weight of cobalt. Embodiments are described where at least one cutting element on a gage row has a lower toughness or lower wear number than the cutting elements on an interior row.,SMITH INTERNATIONAL,LIANG DAH-BEN;;PORTWOOD GARY RAY;;COX PAUL ESTES;;WILLIAMS JOHN LEWIS,,https://lens.org/064-741-719-825-135,Patent Application,no,5,3,7,25,0,C22C29/08;;C22C29/08;;E21B17/1092;;E21B17/1092;;E21B10/08;;E21B10/08;;E21B10/52;;E21B10/52,C22C29/08;;E21B10/08;;E21B10/52;;E21B17/10,E1F FGB           FGB,0,0,,,,EXPIRED
3,US,B2,US 10223744 B2,151-827-459-629-322,2019-03-05,2019,US 201615095184 A,2016-04-11,US 201615095184 A;;US 201314145914 A;;US 201562145508 P,2013-12-31,Location and event capture circuitry to facilitate remote vehicle location predictive modeling when global positioning is unavailable,"Disclosed are a device and/or a method of location and event capture circuitry to facilitate remote vehicle location predictive modeling when global positioning is unavailable. In one embodiment, a predictive circuit of a vehicle includes event detection circuitry to initiate a timer circuit of the vehicle when a wheel of the vehicle is in a stationary state beyond threshold amount of time during an event; an event categorization circuitry to monitor a telemetry data of the vehicle to assign a category to the event; a data communication circuitry to communicate the event, the category, and/or a set of other events and categories to a predictive recommendation server on a periodic basis; and a repossession detection circuitry to determine that the vehicle is pending repossession based on the event, the category, the set of other events and categories, and/or a message communicated from the predictive recommendation server to the predictive circuit.",SPIREON INC,BRADY JAMES;;WHEELER BRIAN;;ESTES DAVID;;MARKS THOMAS;;WARNER ANDY;;TRAN BEN;;CALLINAN MICHAEL;;COLLINGWOOD CHRIS;;WITHERS DAVID;;ARDELEAN ILIE,SPIREON INC (2022-06-28),https://lens.org/151-827-459-629-322,Granted Patent,yes,595,14,3,3,0,B60R16/0231;;G06Q40/02;;G06Q40/02;;G01S5/0027;;G01S5/0027;;G07C5/008;;G07C5/0841,G06Q40/02;;B60R16/023;;G01S5/00;;G07C5/00;;G07C5/08,,21,7,006-367-403-795-856;;100-710-127-639-250;;158-149-659-981-077;;080-128-461-692-72X;;006-752-821-825-668;;000-723-526-917-42X;;051-683-419-510-671,pmc4732111;;26797615;;10.3390/s16010078;;10.3844/jcssp.2012.2008.2016;;10.1109/robot.2003.1241704;;10.1145/2070942.2070950;;10.1186/1687-1499-2012-222;;10.1109/iccrd.2011.5763840;;10.3390/s141222689;;25460817;;pmc4299034,"“Dynamic Vehicle Detection Via the Use of Magnetic Field Sensors”, MDPI, Jan. 19, 2016 by Vytautas Markevicius et al. (pp. 9) http://www.mdpi.com/1424-8220/16/1/78/pdf.;;“Accuracy and Resource Consumption in Tracking and Location Prediction”, 8th International Symposium, Jul. 2003 by Ouri Wolfson et al. (pp. 4) http://link.springer.com/chapter/10.1007/978-3-540-45072-6_19.;;“A Heuristic Moving Vehicle Location Prediction Technique Via Optimal Paths Selection With Aid of Genetic Algorithm and Feed Forward Back Propagation Neural Network”, Journal of Computer Science, Dec. 12, 2012 by Baby Anitha, E. et al. (pp. 9) http://citeseerx.ist.psu.edu/viewdoc/download?doi=10.1.1.687.3596&rep=rep1&type=pdf.;;“Location Estimation and Trajectory Prediction of Moving Lateral Vehicle Using Two Wheel Shapes Information in 2-D Lateral Vehicle Images by 3-D Computer Vision Techniques”, IEEE Xplore, Sep. 14-19, 2003 by Chih-Chiun Lai et al. (p. 1) http://ieeexplore.ieee.org/xpl/articleDetails.jsp?arnumber=1241704.;;“Adaptive Location Prediction Strategies Based on a Hierarchical Network Model in a Cellular Mobile Environment”, The Computer Journal, May 1999 by Sajal K. Das et al. (p. 1) https://goo.gl/C27yaT.;;“Automatic Transit Tracking, Mapping, and Arrival Time Prediction Using Smartphones”, ACM Digital Library, Nov. 1-4, 2011 by James Biagioni et al. (pp. 14) https://www.cs.uic.edu/˜jakob/papers/easytracker-sensys11.pdf.;;“Location Prediction and Queries for Tracking Moving Objects”, IEEE Xplore, 2000 by O. Wolfson et al. (p. 1) http://ieeexplore.ieee.org/xpl/articleDetails.jsp?arnumber=839495.;;“A Novel Vehicular Location Prediction Based on Mobility Patterns for Routing In Urban VANET”, EURASIP Journal on Wireless Communications and Networking, Dec. 2012 by Guangtao Xue et al. (pp. 28) http://link.springer.com/article/10.1186/1687-1499-2012-222.;;“Vision-Based Vehicle Detection System With Consideration of the Detecting Location”, IEEE Xplore, Apr. 3, 2012 by Minkyu Cheon et al. (p. 1) http://ieeexplore.ieee.org/xpl/articleDetails.jsp?arnumber=6175131.;;“A Vehicle Detection Approach Based on Multi-Features Fusion in the Fisheye Images”, IEEE Xplore, Mar. 11-13, 2011 by Guangtao Cheng et al. (p. 1) http://ieeexplore.ieee.org/xpl/articleDetails.jsp?arnumber=5763840.;;“Save Money on Fleet Fueling Purchases”, Sokolis Group Fuel Managment, Jan. 26, 2011 by Sokolis (p. 1) http://www.sokolisgroup.com/blog/save-money-on-fleet-fueling-purchases/.;;“Sensor-based Logistics: Monitoring Shipment Vital Signs in Real Time”, Inbound Logistics, Jun. 2013 by Chris Swearingen (pp. 2) http://www.inboundlogistics.com/cms/article/sensor-based-logistics-monitoring-shipment-vital-signs-in-real-time/.;;“Electronic Cargo Tracking System and Solution, Intermodal Real-time Container Tracking and Rail Car Transport Security Tracking System for End-to-End Supply Chain Security System and Tracking Solution”, Cargo Tracking Solution & intermodal Transport Monitoring, Avante International Technology, Inc. in 2001-2015 (pp. 11) http://www.avantetech.com/products/shipping/.;;“Sea Container Tracking Methods”, Moving-Australia, 2012 (pp. 3) http://www.moving-australia.co.uk/container/tracking-methods.php.;;“GlobalTag for Global Visibility and Tracking”, Global Tracking Technology, in 2015 (pp. 5) http://globaltrackingtechnology.com/globaltag-for-global-visibility.html.;;“The Course of the ‘Connected’ Car”, It Is Innovation, Emphasis on safety, Jan. 6, 2013 by Murray Slovick (pp. 4) http://www.ce.org/i3/Features/2013/January-February/The-Course-of-the-Connected-car.aspx.;;“Cooperating Embedded Systems and Wireless Sensor Networks”, John Wiley & Sons, Inc., ISBN: 978-1-84821-000-4, Mar. 10, 2008 by Michel Banâtre et al. (pp. 2) http://as.wiley.com/WileyCDA/WileyTitle/productCd-1848210000.html.;;“Mitsubishi Motors Develops New Driver Support System”, Mitsubishi Motors, Dec. 15, 1998 (pp. 5) http://www.mitsubishi-motors.com/en/corporate/pressrelease/corporate/detail429.html.;;“Vehicle Tracking for an Evasive Manoeuvres Assistant Using Low-Cost Ultrasonic Sensors”, EBSCO Host Connections, 2014, vol. 14 Issue 12, p. 22689, Dec. 2014 by Jiménez, Felipe et al. (p. 1) http://connection.ebscohost.com/c/articles/100145890/vehicle-tracking-evasive-manoeuvres-assistant-using-low-cost-ultrasonic-sensors.;;“The End of Demographics: How Marketers Are Going Deeper With Personal Data”, Mashable Journal, in Jul. 1, 2011 by Jamie Beckland (pp. 7) http://mashable.com/2011/06/30/psychographics-marketing/.;;“Power cycling 101: Optimizing energy use in advanced sensor products”, Analog Dialogue, vol. 44, Aug. 2010 by Mark Looney (pp. 7) http://www.analog.com/library/analogdialogue/archives/44-08/power_cycling.html.",ACTIVE
4,US,A1,US 2016/0225072 A1,176-337-369-748-358,2016-08-04,2016,US 201615095184 A,2016-04-11,US 201615095184 A;;US 201314145914 A;;US 201562145508 P,2013-12-31,LOCATION AND EVENT CAPTURE CIRCUITRY TO FACILITATE REMOTE VEHICLE LOCATION PREDICTIVE MODELING WHEN GLOBAL POSITIONING IS UNAVAILABLE,"Disclosed are a device and/or a method of location and event capture circuitry to facilitate remote vehicle location predictive modeling when global positioning is unavailable. In one embodiment, a predictive circuit of a vehicle includes event detection circuitry to initiate a timer circuit of the vehicle when a wheel of the vehicle is in a stationary state beyond threshold amount of time during an event; an event categorization circuitry to monitor a telemetry data of the vehicle to assign a category to the event; a data communication circuitry to communicate the event, the category, and/or a set of other events and categories to a predictive recommendation server on a periodic basis; and a repossession detection circuitry to determine that the vehicle is pending repossession based on the event, the category, the set of other events and categories, and/or a message communicated from the predictive recommendation server to the predictive circuit.",BRADY JAMES;;WHEELER BRIAN;;ESTES DAVID;;MARKS THOMAS;;WARNER ANDY;;TRAN BEN;;CALLINAN MICHAEL;;COLLINGWOOD CHRIS;;WITHERS DAVID;;ARDELEAN ILIE,BRADY JAMES;;WHEELER BRIAN;;ESTES DAVID;;MARKS THOMAS;;WARNER ANDY;;TRAN BEN;;CALLINAN MICHAEL;;COLLINGWOOD CHRIS;;WITHERS DAVID;;ARDELEAN ILIE,SPIREON INC (2022-06-28),https://lens.org/176-337-369-748-358,Patent Application,yes,2,16,3,3,0,B60R16/0231;;G06Q40/02;;G06Q40/02;;G01S5/0027;;G01S5/0027;;G07C5/008;;G07C5/0841,G06Q40/02;;B60R16/023;;G01S5/00;;G07C5/00;;G07C5/08,,0,0,,,,ACTIVE
5,US,A1,US 2023/0260046 A1,159-167-442-120-431,2023-08-17,2023,US 202318136966 A,2023-04-20,US 202318136966 A;;US 202117170741 A;;US 202063021360 P;;US 202062971519 P,2020-02-07,SYSTEMS AND METHODS FOR AUTOMATIC DETECTION OF GIG-ECONOMY ACTIVITYSYSTEMS AND METHODS FOR AUTOMATIC DETECTION OF GIG-ECONOMY ACTIVITY,"Systems and methods relating to improving the experience of gig-economy workers are disclosed, with particular reference to gig-economy work involving vehicle use. Such systems and methods include automatically monitoring and evaluating activities such as driving during performance of gigs, as well as providing recommendations based thereupon. Gig-related activities may be automatically detected based upon data provided by a mobile device associated with the gig-economy worker, thereby automatically generating a record of such activities for the worker. Telematics data indicative of movement of a vehicle may be collected and analyzed to detect gig-economy activities. During or after performance of gig-economy work, data automatically collected may be used to generate and present recommendations or education points to the gig-economy worker.",STATE FARM MUTUAL AUTOMOBILE INSURANCE CO,ESTES HANNAH;;SCHWARTZ AUDREY;;DIBENEDETTO MICHAEL;;RODRIGUEZ JAMES P;;ZARKOOB ANNA;;TUCKER BEN;;BEACHY DAR;;ABELLA ELIJAH;;SHERWOOD DIANA;;BRYANT EMILY;;SELLERS KRISTIN;;FIELDS BRIAN;;ZHANG HANPEI,STATE FARM MUTUAL AUTOMOBILE INSURANCE COMPANY (2021-02-02),https://lens.org/159-167-442-120-431,Patent Application,yes,0,0,5,5,0,G06Q40/08;;G06N20/00;;G06Q50/40;;G06Q40/08;;G06N20/00;;G06Q10/02;;G06Q10/0633;;G06Q10/0635;;G06Q10/06398;;G06Q50/40;;H04W4/40;;G06Q10/063114;;G06Q30/0217;;G06Q30/0269;;G06Q30/0631;;G06Q50/26;;G07C5/008;;G08G1/09,G06Q40/08;;G06N20/00;;G06Q50/30,,0,0,,,,PENDING
6,US,A1,US 2023/0401509 A1,174-191-498-857-233,2023-12-14,2023,US 202318239256 A,2023-08-29,US 202318239256 A;;US 202117170830 A;;US 202063021360 P;;US 202062971519 P,2020-02-07,SYSTEMS AND METHODS OF USING A TRANSFERRABLE TOKEN FOR GIG-ECONOMY ACTIVITY ASSESSMENT,"Systems and methods relating to improving the experience of gig-economy workers are disclosed, with particular reference to gig-economy work involving vehicle use. Such systems and methods include automatically monitoring and evaluating activities such as driving during performance of gigs, as well as providing recommendations based thereupon. Transferable tokens may be used to apply information across various types of gig activities. Such a transferable token may represent one or more risk levels associated with a gig-economy worker to provide reputational information between gig-economy platforms or between types of gig-economy activities. Thus, the transferable token may enable a gig-economy worker to transfer high customer ratings across gig-economy platforms.",STATE FARM MUTUAL AUTOMOBILE INSURANCE CO,ESTES HANNAH;;SCHWARTZ AUDREY;;DIBENEDETTO MICHAEL;;RODRIGUEZ JAMES P;;ZARKOOB ANNA;;TUCKER BEN;;BEACHY DAR;;ABELLA ELIJAH;;SHERWOOD DIANA;;BRYANT EMILY;;SELLERS KRISTIN;;FIELDS BRIAN;;ZHANG HANPEI,STATE FARM MUTUAL AUTOMOBILE INSURANCE COMPANY (2021-02-02),https://lens.org/174-191-498-857-233,Patent Application,yes,0,0,5,5,0,G06Q40/08;;G06N20/00;;G06Q50/40;;G06Q40/08;;G06N20/00;;G06Q10/02;;G06Q10/0633;;G06Q10/0635;;G06Q10/06398;;G06Q50/40;;H04W4/40;;G06Q10/063114;;G06Q30/0217;;G06Q30/0269;;G06Q30/0631;;G06Q50/26;;G07C5/008;;G08G1/09,G06Q10/0635;;G06N20/00;;G06Q10/02;;G06Q10/0633;;G06Q10/0639,,0,0,,,,PENDING
7,US,A1,US 2024/0005376 A1,123-561-283-191-935,2024-01-04,2024,US 202117170833 A,2021-02-08,US 202117170833 A;;US 202063021360 P;;US 202062971519 P,2020-02-07,SYSTEM AND METHODS FOR TARGETED RECOMMENDATIONS DURING GIG-ECONOMY ACTIVITY,"Systems and methods relating to improving the experience of gig-economy workers are disclosed, with particular reference to gig-economy work involving vehicle use. Such systems and methods include automatically monitoring and evaluating activities such as driving during performance of gigs, as well as providing recommendations based thereupon. During or after performance of gig-economy work, data automatically collected may be used to generate and present recommendations or education points to the gig-economy worker. Such recommendations may include recommendations to optimize gig metrics of interest to the gig-economy worker. Such recommendations may be related to nearby products or services and may be displayed to gig-economy workers or customers in various embodiments.",STATE FARM MUTUAL AUTOMOBILE INSURANCE CO,ESTES HANNAH;;SCHWARTZ AUDREY;;DIBENEDETTO MICHAEL;;RODRIGUEZ JAMES P;;ZARKOOB ANNA;;TUCKER BEN;;BEACHY DAR;;ABELLA ELIJAH;;SHERWOOD DIANA;;BRYANT EMILY;;SELLERS KRISTIN;;FIELDS BRIAN M;;ZHANG HANPEI,STATE FARM MUTUAL AUTOMOBILE INSURANCE COMPANY (2021-02-02),https://lens.org/123-561-283-191-935,Patent Application,yes,1,1,5,5,0,G06Q40/08;;G06N20/00;;G06Q50/40;;G06Q40/08;;G06N20/00;;G06Q10/02;;G06Q10/0633;;G06Q10/0635;;G06Q10/06398;;G06Q50/40;;H04W4/40;;G06Q10/063114;;G06Q30/0217;;G06Q30/0269;;G06Q30/0631;;G06Q50/26;;G07C5/008;;G08G1/09,G06Q30/06;;G06N20/00;;G06Q10/06;;G06Q50/26;;G07C5/00;;G08G1/09;;H04W4/40,,0,0,,,,PENDING
8,US,B1,US 11783257 B1,101-516-705-649-109,2023-10-10,2023,US 202117170830 A,2021-02-08,US 202117170830 A;;US 202063021360 P;;US 202062971519 P,2020-02-07,Systems and methods of using a transferrable token for gig-economy activity assessment,"Systems and methods relating to improving the experience of gig-economy workers are disclosed, with particular reference to gig-economy work involving vehicle use. Such systems and methods include automatically monitoring and evaluating activities such as driving during performance of gigs, as well as providing recommendations based thereupon. Transferable tokens may be used to apply information across various types of gig activities. Such a transferable token may represent one or more risk levels associated with a gig-economy worker to provide reputational information between gig-economy platforms or between types of gig-economy activities. Thus, the transferable token may enable a gig-economy worker to transfer high customer ratings across gig-economy platforms.",STATE FARM MUTUAL AUTOMOBILE INSURANCE CO,ESTES HANNAH;;SCHWARTZ AUDREY;;DIBENEDETTO MICHAEL;;RODRIGUEZ JAMES P;;ZARKOOB ANNA;;TUCKER BEN;;BEACHY DAR;;ABELLA ELIJAH;;SHERWOOD DIANA;;BRYANT EMILY;;SELLERS KRISTIN;;FIELDS BRIAN M;;ZHANG HANPEI,STATE FARM MUTUAL AUTOMOBILE INSURANCE COMPANY (2021-02-02),https://lens.org/101-516-705-649-109,Granted Patent,yes,11,0,5,5,0,G06Q40/08;;G06N20/00;;G06Q50/40;;G06Q40/08;;G06N20/00;;G06Q10/02;;G06Q10/0633;;G06Q10/0635;;G06Q10/06398;;G06Q50/40;;H04W4/40;;G06Q10/063114;;G06Q30/0217;;G06Q30/0269;;G06Q30/0631;;G06Q50/26;;G07C5/008;;G08G1/09,G06Q10/00;;G06N20/00;;G06Q10/02;;G06Q10/0633;;G06Q10/0635;;G06Q10/0639,,0,0,,,,ACTIVE
9,US,B1,US 11663675 B1,068-933-848-551-099,2023-05-30,2023,US 202117170741 A,2021-02-08,US 202117170741 A;;US 202063021360 P;;US 202062971519 P,2020-02-07,Systems and methods for automatic detection of gig-economy activity,"Systems and methods relating to improving the experience of gig-economy workers are disclosed, with particular reference to gig-economy work involving vehicle use. Such systems and methods include automatically monitoring and evaluating activities such as driving during performance of gigs, as well as providing recommendations based thereupon. Gig-related activities may be automatically detected based upon data provided by a mobile device associated with the gig-economy worker, thereby automatically generating a record of such activities for the worker. Telematics data indicative of movement of a vehicle may be collected and analyzed to detect gig-economy activities. During or after performance of gig-economy work, data automatically collected may be used to generate and present recommendations or education points to the gig-economy worker.",STATE FARM MUTUAL AUTOMOBILE INSURANCE CO,ESTES HANNAH;;SCHWARTZ AUDREY;;DIBENEDETTO MICHAEL;;RODRIGUEZ JAMES P;;ZARKOOB ANNA;;TUCKER BEN;;BEACHY DAR;;ABELLA ELIJAH;;SHERWOOD DIANA;;BRYANT EMILY;;SELLERS KRISTIN;;FIELDS BRIAN M;;ZHANG HANPEI,STATE FARM MUTUAL AUTOMOBILE INSURANCE COMPANY (2021-02-02),https://lens.org/068-933-848-551-099,Granted Patent,yes,6,3,5,5,0,G06Q40/08;;G06N20/00;;G06Q50/40;;G06Q40/08;;G06N20/00;;G06Q10/02;;G06Q10/0633;;G06Q10/0635;;G06Q10/06398;;G06Q50/40;;H04W4/40;;G06Q10/063114;;G06Q30/0217;;G06Q30/0269;;G06Q30/0631;;G06Q50/26;;G07C5/008;;G08G1/09,G06F11/07;;G06F11/263;;G06F11/32;;G06N20/00;;G06Q40/08;;G06Q50/30,,0,0,,,,ACTIVE
