"#",Jurisdiction,Kind,Display Key,Lens ID,Publication Date,Publication Year,Application Number,Application Date,Priority Numbers,Earliest Priority Date,Title,Abstract,Applicants,Inventors,Owners,URL,Document Type,Has Full Text,Cites Patent Count,Cited by Patent Count,Simple Family Size,Extended Family Size,Sequence Count,CPC Classifications,IPCR Classifications,US Classifications,NPL Citation Count,NPL Resolved Citation Count,NPL Resolved Lens ID(s),NPL Resolved External ID(s),NPL Citations,Legal Status
1,US,A,US 4744909 A,129-484-877-378-459,1988-05-17,1988,US 1006087 A,1987-02-02,US 1006087 A,1987-02-02,Method of effecting accelerated oxidation reaction,"The method of this invention is particularly, although not exclusively, adapted for effecting accelerated oxidation reactions in a downhole or deep well wet oxidation apparatus, including the processing of aqueous organic waste, such as municipal sludge. It includes injecting a multiple-phase composition which contains an oxygen or an oxygen-rich gas which is fully saturated with water vapor and which also contains water in the liquid phase into a wet oxidation reaction apparatus which contains an aqueous stream of combustible waste, preferably at the temperature and pressure of the waste stream at the point of injection. This reduces the likelihood of hazardous spontaneous combustion which may otherwise occur if dry spots are allowed to form in the reaction apparatus. The volume of water in the composition should be equal to at least twice the volume of water necessary to saturate the gas with water vapor to maintain at least 50 percent of the water in the liquid phase.",VERTECH TREATMENT SYSTEMS INC,FERRARO FRANCIS M;;HALL RONALD H,BOW VALLEY RESOURCE SERVICES INC. A CORP. OF DE (1989-02-23);;VERTECH TREATMENT SYSTEM INC. 12000 PECOS SUITE 3 DENVER COLORADO 80234 (1987-01-23),https://lens.org/129-484-877-378-459,Granted Patent,yes,6,16,9,9,0,B01J3/042;;C02F11/083;;C02F3/06;;C02F11/08;;C02F11/083;;B01J3/042,B01J3/04;;B09B3/00;;C02F1/74;;C02F11/08,210/747;;210/752;;210/761,0,0,,,,EXPIRED
2,AT,T1,AT E75218 T1,166-597-742-741-241,1992-05-15,1992,AT 88300668 T,1988-01-27,EP 88300668 A;;US 1006087 A,1987-02-02,VERFAHREN ZUR DURCHFUEHRUNG EINER BESCHLEUNIGTEN OXYDATIONSREAKTION.,,WASTE TREATMENT PATENTS & RES,FERRARO FRANCIS MICHAEL;;HALL RONALD H,,https://lens.org/166-597-742-741-241,Granted Patent,no,0,0,9,9,0,B01J3/042;;C02F11/083;;C02F3/06;;C02F11/08;;C02F11/083;;B01J3/042,B09B3/00;;B01J3/04;;C02F1/74;;C02F11/08,,0,0,,,,DISCONTINUED
3,EP,B1,EP 0277760 B1,006-695-318-708-327,1992-04-22,1992,EP 88300668 A,1988-01-27,US 1006087 A,1987-02-02,METHOD OF EFFECTING ACCELERATED OXIDATION REACTION,,WASTE TREATMENT PATENTS & RESEARCH N.V.,"FERRARO, FRANCIS MICHAEL;;HALL, RONALD H.",WASTE TREATMENT PATENTS & RESEARCH N.V. (1991-09-25),https://lens.org/006-695-318-708-327,Granted Patent,yes,3,0,9,9,0,B01J3/042;;C02F11/083;;C02F3/06;;C02F11/08;;C02F11/083;;B01J3/042,B09B3/00;;B01J3/04;;C02F1/74;;C02F11/08,,2,0,,,"H2O, vol. 20, no. 18, 27th August 1987, pages 442-448, Rijswijk, NL; J.J. VAN DEN BERG: ""Treatment of sewage-sludge"";;CHEMICAL ABSTRACTS, vol. 95, no. 2, July 1981, page 114, abstract no. 27175j, Columbus, Ohio, US; & JP-A-80 35 174 (MITSUBISHI HEAVY INDUSTRIES) 11-09-1980",EXPIRED
4,DE,D1,DE 3870271 D1,055-276-667-502-504,1992-05-27,1992,DE 3870271 T,1988-01-27,US 1006087 A,1987-02-02,VERFAHREN ZUR DURCHFUEHRUNG EINER BESCHLEUNIGTEN OXYDATIONSREAKTION.,,WASTE TREATMENT PATENTS & RES,FERRARO FRANCIS MICHAEL;;HALL RONALD H,,https://lens.org/055-276-667-502-504,Granted Patent,no,0,0,9,9,0,B01J3/042;;C02F11/083;;C02F3/06;;C02F11/08;;C02F11/083;;B01J3/042,B09B3/00;;B01J3/04;;C02F1/74;;C02F11/08,,0,0,,,,EXPIRED
5,KR,B1,KR 920002070 B1,191-156-338-972-286,1992-03-10,1992,KR 870009503 A,1987-08-29,US 1006087 A,1987-02-02,METHOD OF EFFECTING ACCELERATED OXIDATION REACTION,,VERTCH TREATMENT SYSTEMS INC,FERRARO FRANCIS M;;HALL RONALD H,,https://lens.org/191-156-338-972-286,Granted Patent,no,0,0,9,9,0,B01J3/042;;C02F11/083;;C02F3/06;;C02F11/08;;C02F11/083;;B01J3/042,B09B3/00;;B01J3/04;;C02F1/74;;C02F11/08,,0,0,,,,EXPIRED
6,EP,A1,EP 0277760 A1,083-626-629-642-824,1988-08-10,1988,EP 88300668 A,1988-01-27,US 1006087 A,1987-02-02,Method of effecting accelerated oxidation reaction.,"A method of introducing gaseous oxygen into a fluid waste stream in conjunction with the accelerated oxidation of organic matter inside a reaction apparatus, comprising the steps of: 
    preparing a multiple-phase composition which contains gaseous oxygen which is substantially fully saturated with water vapour the multiple-phase composition also containing liquid water; 
    injecting said multiple-phase composition into the fluid waste stream in the reaction apparatus at at least one injection site; and, 
    raising the temperature and pressure of the fluid waste stream containing the multiple-phase composition to produce the accelerated oxidation reaction of organic matter, 
    whereby unwanted dry spots which could otherwise form in the reaction apparatus are substantially eliminated. The method of introducing gaseous oxygen provides for an accelerated oxidation reaction of combustible material in the fluid stream.  ",VERTECH TREATMENT SYSTEMS INC,FERRARO FRANCIS MICHAEL;;HALL RONALD H,WASTE TREATMENT PATENTS & RESEARCH N.V. (1991-09-25),https://lens.org/083-626-629-642-824,Patent Application,yes,3,1,9,9,0,B01J3/042;;C02F11/083;;C02F3/06;;C02F11/08;;C02F11/083;;B01J3/042,B09B3/00;;B01J3/04;;C02F1/74;;C02F11/08,,2,0,,,"H2O, vol. 20, no. 18, 27th August 1987, pages 442-448, Rijswijk, NL; J.J. VAN DEN BERG: ""Treatment of sewage-sludge"";;CHEMICAL ABSTRACTS, vol. 95, no. 2, July 1981, page 114, abstract no. 27175j, Columbus, Ohio, US; & JP-A-55 035 174 (MITSUBISHI HEAVY INDUSTRIES) 11-09-1980",EXPIRED
7,US,B1,US 9756086 B1,176-522-930-684-316,2017-09-05,2017,US 201313784295 A,2013-03-04,US 201313784295 A,2013-03-04,Distributed connection management,"Persistent connections between multiple client devices and multiple back-end service components are managed using a consistent hashing-based approach to route distribution. A load balancer distributes the connections across multiple gateway servers. Each connection is associated with a device having an identifier, which can be hashed using a selected hashing algorithm. The gateway servers are assigned values over a hashing range. When a connection is established for a device, the hash value for that device can be mapped to a corresponding gateway server. The primary gateway server establishing the connection can store information (e.g., the port or interface) for the connection, and can send identifying information to the corresponding gateway server determined by the hash value. When a backend service wants to locate the connection, the service hashes the device identifier to determine the corresponding gateway server, which returns the identity of the primary gateway server hosting the connection.",AMAZON TECH INC,MCHUGH JASON GEORGE;;FERRARO PAUL FRANCIS DEAN,AMAZON TECHNOLOGIES INC (2013-03-14),https://lens.org/176-522-930-684-316,Granted Patent,yes,8,15,1,1,0,H04L67/1004;;H04L65/1069;;H04L67/1004,G06F15/16;;H04L29/06,,1,0,,,"Broadhurst, Martin. “Consistent Hash Ring.” Feb. 11, 2011, http://www.martinbroadhurst.com/Consistent-Hash-Ring.html.",INACTIVE
8,CN,A,CN 105377416 A,029-945-824-343-889,2016-03-02,2016,CN 201480027130 A,2014-05-14,US 2014/0000119 W;;US 201361823360 P;;US 2013/0044143 W;;US 201414276719 A,2013-05-14,Steam explosion methods before gasification,"An integrated plant that includes a steam explosion process unit and biomass gasifier to generate syngas from biomass is discussed. A steam explosion process unit applies a combination of heat, pressure, and moisture to the biomass to make the biomass into a moist fine particle form. The steam explosion process unit applies steam with a high pressure to heat and pressurize any gases and fluids present inside the biomass to internally blow apart the bulk structure of the biomass via a rapid depressurization of the biomass with the increased moisture content. Those produced moist fine particles of biomass are subsequently fed to a feed section of the biomass gasifier, which reacts the biomass particles in a rapid biomass gasification reaction to produce syngas components.",SUNDROP FUELS INC,FERRARO FRANCIS MICHAEL;;HOHMAN JERROD WAYNE;;AMPULSKI ROBERT S,,https://lens.org/029-945-824-343-889,Patent Application,no,0,2,3,19,0,C10K3/04;;C10J3/00;;C10J2300/0906;;C10J2300/0916;;C10J2300/092;;C10J2300/0969;;C10J2300/0976;;C10J2300/0993;;C10J2300/1246;;C10J2300/1269;;C10J2300/1621;;C10J2300/1665;;C10J2300/1807;;C10J2300/1853;;C10L9/083;;Y02E50/10;;Y02E50/30;;Y02P20/145,B01J19/00;;C08J3/12;;C10L5/44,,1,0,,,"PAK SUI LAM: ""《PhD thesis, University of British Columbia, Vancouver, Canada》"", 31 May 2011",DISCONTINUED
9,US,B2,US 9227895 B2,064-133-410-888-26X,2016-01-05,2016,US 16621208 A,2008-07-01,US 16621208 A;;US 94865707 P,2007-07-09,Methods and apparatus for producing alcohols from syngas,"Methods and apparatus for producing alcohols from syngas are disclosed herein. In some variations, syngas is catalytically converted to alcohols. The alcohols can be subjected to drying to produce an intermediate alcohol product, followed by distilling the intermediate product to produce a purified ethanol product for use in liquid fuels.",TIRMIZI SHAKEEL H;;KLEPPER ROBERT E;;FERRARO FRANCIS M;;ALBEMARLE CORP,TIRMIZI SHAKEEL H;;KLEPPER ROBERT E;;FERRARO FRANCIS M,ALBEMARLE CORPORATION (2012-05-04);;RANGE FUELS SOPERTON PLANT LLC (2012-03-20);;RANGE FUELS INC (2012-03-20);;KETJEN LIMITED LIABILITY COMPANY (2024-01-01),https://lens.org/064-133-410-888-26X,Granted Patent,yes,74,0,2,24,0,C07C29/1518;;C07C29/1518;;C07C29/76;;C07C29/76,C07C29/80;;C07C29/151;;C07C29/76,,12,6,169-831-980-962-156;;116-286-970-409-740;;022-053-965-572-599;;059-199-192-118-769;;110-415-798-276-009;;143-367-893-059-954,10.1246/cl.1985.881;;10.1016/j.cattod.2006.07.006;;10.1039/c39850000321;;10.1002/sia.1042;;10.2172/1216404;;10.1016/0021-9517(86)90340-4,"Hironori Arakawa et al., ""Selective Synthesis of Ethanol Over Rh-Ti-Fe-Ir/SiO2 Catalyst at High Pressure Syngas Conversion"", Chemistry Letters, pp. 881-884, Mar. 11, 1985.;;Division of Chemical Reaction Engineering, KTH-Kungl. Tekniska Högskolan, ""Torrefied Wood an Alternative to Charcoal for Reducing Deforestation"", http://hem.fyristorg.com/zanzi/torrefaction.html, Feb. 2001.;;John L. Falconer et al., ""Zeolite Membrane Research"", http://www.colorado.edu/che/FalcGrp/research/zeolite.html (1996).;;Jianli Hu et al., ""Conversion of Biomass-Derived Syngas to Alcohols and C2 Oxygenates Using Supported Rh Catalysts in a Microchannel Reactor"", Catalysis Today, vol. 120, pp. 90-95, Sep. 6, 2006.;;Masaru Ichikawa et al., ""Mechanism of Syngas Conversion Into C2-Oxygenates Such as Ethanol Catalysed on a SiO2-Supported Rh-Ti Catalyst"", J. Chem. Soc., Chem. Commun., pp. 321-323 (1985).;;Hongtao Ma et al., ""Temperature-Programmed Surface Reaction Study on C2-Oxygenate Synthesis Over SiO2 and Nanoporous Zeolitic Material Supported Rh-Mn Catalysts"", Surf. Interface Anal., vol. 32, pp. 224-227, Jan. 8, 2001.;;C.B. Murchison et al., ""Mixed Alcohols From Syngas Over Moly Catalysts"", Proc. 9th Intern. Cong. Catal., vol. 2, pp. 626-633 (1988).;;G.K. Pearce, ""Pervaporation vs. Distillation. A Comparative Costing for Alcohol Dehydration"", Proc. Int. Conf. Pervaporation Processes, ISBN:0939997088, pp. 278-296 (1989).;;S. Phillips et al., ""Thermochemical Ethanol via Indirect Gasification and Mixed Alcohol Synthesis of Lignocellulosic Biomass"", NREL Technical Report/TP-510-41168 (Apr. 2007).;;Jose G. Santiesteban et al., ""Mechanism of C1-C4 Alcohol Synthesis Over Alkali/MoS2 and Alkali/Co/MoS2 Catalysts"", Proc. 9th Intern. Cong. Catal., 2, 561-568 (1988).;;P.L. Spath et al., Technical Report, ""Preliminary Screening-Technical and Economic Assessment of Synthesis Gas to Fuels and Chemicals with Emphasis on the Potential for Biomass-Derived Syngas"", NREL Report No. NREL/TP-510-34929, Dec. 2003.;;G. Van Der Lee et al., ""On the Selectivity of Rh Catalysts in the Formation of Oxygenates"", Journal of Catalysis, vol. 98, pp. 522-529 (1986).",ACTIVE
10,US,B2,US 9447326 B2,054-092-038-213-993,2016-09-20,2016,US 201414276719 A,2014-05-13,US 201414276719 A;;US 201213531318 A;;US 2013/0044143 W;;US 201361823360 P,2012-06-22,Pretreatment of biomass using steam explosion methods before gasification,"An integrated plant that includes a steam explosion process unit and biomass gasifier to generate syngas from biomass is discussed. A steam explosion process unit applies a combination of heat, pressure, and moisture to the biomass to make the biomass into a moist fine particle form. The steam explosion process unit applies steam with a high pressure to heat and pressurize any gases and fluids present inside the biomass to internally blow apart the bulk structure of the biomass via a rapid depressurization of the biomass with the increased moisture content. Those produced moist fine particles of biomass are subsequently fed to a feed section of the biomass gasifier, which reacts the biomass particles in a rapid biomass gasification reaction to produce syngas components.",SUNDROP FUELS INC,FERRARO FRANCIS MICHAEL;;HOHMAN JERROD WAYNE;;AMPULSKI ROBERT S,SUNDROP FUELS INC (2014-05-12);;SUNDROP IP HOLDINGS LLC (2018-08-08),https://lens.org/054-092-038-213-993,Granted Patent,yes,44,7,2,19,0,C07C29/1518;;C10J3/485;;C10K3/02;;C10L9/083;;D21C1/02;;C10J2300/0906;;C10J2300/0909;;C10J2300/0916;;C10J2300/092;;C10J2300/0976;;C10J2300/1223;;C10J2300/1665;;C10J2300/1853;;B01J8/087;;B01J8/12;;B01J19/02;;B01J8/0025;;B01J2208/00123;;B01J2208/00132;;B01J2208/00504;;B01J2208/00513;;B01J2208/0084;;B01J2219/0263;;Y02P20/145;;C10G2/32;;C10G2300/1014;;Y02P30/20;;Y02E50/10;;C10B49/02;;Y02P20/145;;C10G2/32;;C10G2300/1014;;C07C29/1518;;C10J3/485;;C10K3/02;;C10L9/083;;D21C1/02;;C10J2300/0906;;C10J2300/0909;;C10J2300/0916;;C10J2300/092;;C10J2300/0976;;C10J2300/1223;;C10J2300/1665;;C10J2300/1853;;B01J8/087;;B01J8/12;;B01J19/02;;B01J8/0025;;B01J2208/00123;;B01J2208/00132;;B01J2208/00504;;B01J2208/00513;;B01J2208/0084;;B01J2219/0263;;Y02P30/20;;Y02E50/10,B01J7/00;;B01J8/00;;B01J8/08;;B01J8/12;;B01J19/02;;C07C29/151;;C10B49/02;;C10G2/00;;C10J3/48;;C10K3/02;;C10L9/08;;D21C1/02,,9,0,,,"U.S. Appl. No. 61/119,062, filed Dec. 2, 2008, Stites.;;Higuchi, Takayoshi ""Steam Explosion of Wood"", Sections 1-4, Biomass Handbook, © 1989 by OPA (Amsterdam), pp. 470-473 plus Cover, Biblio, Table of Contents excerpt. 7 pages total, Editors: Osamu Kitani & Carl W. Hall, ISBN 2-88124-269-3, Gordon and Breach Science Publishers S. A., Cooper Station, New York, New York.;;""StakeTech-First Pulping System Receives Full Acceptance"", May 14, 1996, 2 pages Publisher: Business Wire. downloaded from http://www.thefreelibrary.com/StakeTech.;;McCallum, Don, ""Medium Density Fiber Board"" pp. 8-11, Nov. 1, 1996 http://fennerschool-associated.anu.edu.au/fpt/mdf/manufacture.html.;;Lam, PS, ""Steam Explosion of Biomass to Produce Durable Wood Pellets"", The University of British Columbia, May 2011, Retrieved from the Internet on Oct. 21, 2013 from URL https://circle.ubc.ca/bitstream/id/123471/ubs-2011-fall-Iam-paksui.pdf. p. 33, Paragraph 1; p. 43, Paragraphs 1-3, Tables 2.4-2.5.;;International Search Report and Written Opinion for International Application No. PCT/US2013/044143 mailed Nov. 13, 2013, 18 pages. International Searching Authority/US, Alexandria, Virginia USA.;;Non Final Rejection Action for U.S. Appl. No. 13/531,318 mailed Oct. 25, 2013, 6 pages. International Searching Authority/US, Alexandria, Virginia USA.;;Restriction Requirement for U.S. Appl. No. 13/531,318 mailed May 20, 2013, 7 pages. International Searching Authority/US, Alexandria, Virginia USA.;;Final Office Action for U.S. Appl. No. 13/531,318 mailed May 29, 2014, 7 pgs. International Searching Authority/US, Alexandria, Virginia USA.",ACTIVE
11,US,A,US 4721575 A,151-338-434-634-46X,1988-01-26,1988,US 84796586 A,1986-04-03,US 84796586 A,1986-04-03,Method and apparatus for controlled chemical reactions,"A method and apparatus for effecting accelerated chemical reactions at elevated temperatures and pressures including wet oxidation of materials in waste streams. An influent waste stream or first reactant is directed through a long tubular coil within a containment vessel with a second reactant being added to the influent. The waste stream includes gas and liquid components. The flow rates for the reactants of the waste stream are set to cause plug or slug flow of the waste stream through the tubular coil. The curvature of the coil tends to induce a secondary flow in the liquid component such that the liquid component tends to travel in a spiral thereby providing more intimate mixing of the reactants. The containment vessel may be partitioned to form a series of successive compartments to permit different temperature gradients to be applied to successive sections of the tubing coil across its length. Alternatively, a tube in tube construction for the tubular coil permits counter current heat exchange between the waste stream within the inner tube and a returning stream. Multiple injection and extraction points are provided along the path of the tubular coil to permit gas, liquid or solid reactants to be added or extracted as desired. The tubular coil provides an excellent environmental container for the reaction stream and is extremely suitable for temperature control to permit continuous heat input, autogenic operation and continuous heat extraction.",VERTECH TREATMENT SYSTEMS INC,BINNING JACK E;;FERRARO FRANCIS M;;CARLSON FRANKLIN B,BOW VALLEY RESOURCE SERVICES INC. A CORP. OF DE (1989-02-23);;VERTECH TREATMENT SYSTEMS INC (1986-03-10),https://lens.org/151-338-434-634-46X,Granted Patent,yes,12,74,3,24,0,B01J19/243;;B01J2219/00083;;B01J2219/00099;;B01J2219/00121;;B01J2219/00159;;B01J2219/00162;;B01J2219/00182;;C02F11/08;;C02F11/08;;B01J2219/00121;;B01J2219/00162;;B01J2219/00159;;B01J2219/00182;;B01J2219/00083;;B01J2219/00099;;B01J19/243,B01J10/00;;B01J19/24;;C02F11/08,210/761;;210/177;;210/180;;210/205;;423/659;;422/202;;422/208;;422/235,0,0,,,,EXPIRED
12,US,A1,US 2014/0249237 A1,072-447-909-448-281,2014-09-04,2014,US 201414276719 A,2014-05-13,US 201414276719 A;;US 201213531318 A;;US 2013/0044143 W;;US 201361823360 P,2012-06-22,PRETREATMENT OF BIOMASS USING STEAM EXPLOSION METHODS BEFORE GASIFICATION,"An integrated plant that includes a steam explosion process unit and biomass gasifier to generate syngas from biomass is discussed. A steam explosion process unit applies a combination of heat, pressure, and moisture to the biomass to make the biomass into a moist fine particle form. The steam explosion process unit applies steam with a high pressure to heat and pressurize any gases and fluids present inside the biomass to internally blow apart the bulk structure of the biomass via a rapid depressurization of the biomass with the increased moisture content. Those produced moist fine particles of biomass are subsequently fed to a feed section of the biomass gasifier, which reacts the biomass particles in a rapid biomass gasification reaction to produce syngas components.",SUNDROP FUELS INC,FERRARO FRANCIS MICHAEL;;HOHMAN JERROD WAYNE;;AMPULSKI ROBERT S,SUNDROP FUELS INC (2014-05-12);;SUNDROP IP HOLDINGS LLC (2018-08-08),https://lens.org/072-447-909-448-281,Patent Application,yes,2,11,2,19,0,C07C29/1518;;C10J3/485;;C10K3/02;;C10L9/083;;D21C1/02;;C10J2300/0906;;C10J2300/0909;;C10J2300/0916;;C10J2300/092;;C10J2300/0976;;C10J2300/1223;;C10J2300/1665;;C10J2300/1853;;B01J8/087;;B01J8/12;;B01J19/02;;B01J8/0025;;B01J2208/00123;;B01J2208/00132;;B01J2208/00504;;B01J2208/00513;;B01J2208/0084;;B01J2219/0263;;Y02P20/145;;C10G2/32;;C10G2300/1014;;Y02P30/20;;Y02E50/10;;C10B49/02;;Y02P20/145;;C10G2/32;;C10G2300/1014;;C07C29/1518;;C10J3/485;;C10K3/02;;C10L9/083;;D21C1/02;;C10J2300/0906;;C10J2300/0909;;C10J2300/0916;;C10J2300/092;;C10J2300/0976;;C10J2300/1223;;C10J2300/1665;;C10J2300/1853;;B01J8/087;;B01J8/12;;B01J19/02;;B01J8/0025;;B01J2208/00123;;B01J2208/00132;;B01J2208/00504;;B01J2208/00513;;B01J2208/0084;;B01J2219/0263;;Y02P30/20;;Y02E50/10,C10B49/02;;C10B1/00,518/704;;422/162;;252/373,0,0,,,,ACTIVE
13,WO,A1,WO 2014/204519 A1,086-094-104-251-622,2014-12-24,2014,US 2014/0000119 W,2014-05-14,US 2013/0044143 W;;US 201361823360 P;;US 201414276719 A,2013-05-14,STEAM EXPLOSION METHODS BEFORE GASIFICATION,"An integrated plant that includes a steam explosion process unit and biomass gasifier to generate syngas from biomass is discussed. A steam explosion process unit applies a combination of heat, pressure, and moisture to the biomass to make the biomass into a moist fine particle form. The steam explosion process unit applies steam with a high pressure to heat and pressurize any gases and fluids present inside the biomass to internally blow apart the bulk structure of the biomass via a rapid depressurization of the biomass with the increased moisture content. Those produced moist fine particles of biomass are subsequently fed to a feed section of the biomass gasifier, which reacts the biomass particles in a rapid biomass gasification reaction to produce syngas components.",SUNDROP FUELS INC,FERRARO FRANCIS MICHAEL;;HOHMAN JERROD WAYNE;;AMPULSKI ROBERT S,,https://lens.org/086-094-104-251-622,Patent Application,yes,6,8,3,19,0,C10K3/04;;C10J3/00;;C10J2300/0906;;C10J2300/0916;;C10J2300/092;;C10J2300/0969;;C10J2300/0976;;C10J2300/0993;;C10J2300/1246;;C10J2300/1269;;C10J2300/1621;;C10J2300/1665;;C10J2300/1807;;C10J2300/1853;;C10L9/083;;Y02E50/10;;Y02E50/30;;Y02P20/145,B01J19/00;;C08J3/12;;C10L5/44,,1,0,,,"LAM, PS.: ""STEAM EXPLOSION OF BIOMASS TO PRODUCE DURABLE WOOD PELLETS"", May 2011 (2011-05-01), Retrieved from the Internet <URL:https://circle.ubc.ca/bitstream/id/123471/ubc_2011_fall_lam_paksui.pdf>",PENDING
14,US,A1,US 2009/0018372 A1,195-830-433-156-620,2009-01-15,2009,US 16621208 A,2008-07-01,US 16621208 A;;US 94865707 P,2007-07-09,METHODS AND APPARATUS FOR PRODUCING ALCOHOLS FROM SYNGAS,"Methods and apparatus for producing alcohols from syngas are disclosed herein. In some variations, syngas is catalytically converted to alcohols. The alcohols can be subjected to drying to produce an intermediate alcohol product, followed by distilling the intermediate product to produce a purified ethanol product for use in liquid fuels.",RANGE FUELS INC,TIRMIZI SHAKEEL H;;KLEPPER ROBERT E;;FERRARO FRANCIS M,ALBEMARLE CORPORATION (2012-05-04);;RANGE FUELS SOPERTON PLANT LLC (2012-03-20);;RANGE FUELS INC (2012-03-20);;KETJEN LIMITED LIABILITY COMPANY (2024-01-01),https://lens.org/195-830-433-156-620,Patent Application,yes,69,15,2,24,0,C07C29/1518;;C07C29/1518;;C07C29/76;;C07C29/76,C07C29/74;;B01J19/00,568/916;;422/187,0,0,,,,ACTIVE
15,US,A1,US 2009/0204250 A1,016-156-163-785-941,2009-08-13,2009,US 2838008 A,2008-02-08,US 2838008 A,2008-02-08,SYSTEM AND METHOD FOR INTEGRATING RFID SENSORS IN MANUFACTURING SYSTEM COMPRISING SINGLE USE COMPONENTS,"The present invention provides a system and method for measuring physical, chemical and biological properties of a manufacturing system comprising embedding a plurality of RFID sensors in a plurality of corresponding single use components wherein each of the plurality of RFID sensors is configured to provide multi-parameter measurements for at least one single use component from the plurality of single use components, and each of the plurality of RFID sensors is further configured to provide simultaneous digital identification for the single use component and for its respective RFID sensor and further comprises reading the multi-parameter measurements and the digital identification for the plurality of single use components using at least one RFID writer/reader, processing the measurements using a processor, and controlling subsequent process steps by comparing the measurements of at least one parameter to a predetermined value.",GEN ELECTRIC,POTYRAILO RADISLAV ALEXANDROVICH;;PIZZI VINCENT FRANCIS;;KLENSMEDEN STAFFAN;;FERRARO RICHARD JOHN,GENERAL ELECTRIC COMPANY (2005-02-08),https://lens.org/016-156-163-785-941,Patent Application,yes,30,62,9,9,0,G01D9/005;;G06K19/0717;;G06K19/0723;;G01D9/005;;G06K19/0717;;G06K19/0723;;C12M41/48;;G06K19/0723;;G06K19/0717;;G01D9/005;;C12M41/48,G06F17/00;;H04Q5/22,700/109;;340/10.41,0,0,,,,DISCONTINUED
