36,US,B2,US 8945226 B2,142-884-620-027-411,2015-02-03,2015,US 65060009 A,2009-12-31,US 65060009 A,2009-12-31,Vertebral spacer,"An anterior cervical column support having a hollow frame having a top load bearing surface and a bottom load bearing surface may be inserted between a first spinal vertebra and a second spinal vertebra. The top load bearing surface and the bottom load bearing surface may each include an opening allowing access to the interior of the frame. A front surface may extend between the top load bearing surface and the bottom load bearing surface, and a rear surface may extend between the top load bearing surface and the bottom load bearing surface. Two side surfaces are attached between the front surface and the rear surface, each side surface having a solid side panel that is at least x-ray translucent. An anterior (front) plate is attached to the front surface of the support device, where the front plate includes clearance holes for receiving fasteners for holding the front plate in position. The top load bearing surface and the bottom load bearing surface may include a serrated or other high friction surface for applying frictional forces between the load bearing surfaces and adjacent vertebrae.",JOHNSTON TERRY;;GEISLER FRED H;;BASS DANIEL;;RHAUSLER,JOHNSTON TERRY;;GEISLER FRED H;;BASS DANIEL,RHAUSLER INC (2009-12-07),https://lens.org/142-884-620-027-411,Granted Patent,yes,33,6,7,9,0,A61F2/447;;A61F2/447;;A61F2/442;;A61F2/442;;A61F2002/2817;;A61F2002/2817;;A61F2002/2835;;A61F2002/2835;;A61F2002/30056;;A61F2002/30056;;A61F2002/3008;;A61F2002/3008;;A61F2002/30261;;A61F2002/30261;;A61F2002/30448;;A61F2002/30448;;A61F2002/30576;;A61F2002/30576;;A61F2002/30578;;A61F2002/30578;;A61F2002/30593;;A61F2002/30593;;A61F2002/30604;;A61F2002/30604;;A61F2002/30774;;A61F2002/30774;;A61F2002/30777;;A61F2002/30777;;A61F2002/30787;;A61F2002/30787;;A61F2002/30789;;A61F2002/30789;;A61F2002/30904;;A61F2002/30904;;A61F2002/30906;;A61F2002/30906;;A61F2002/30925;;A61F2002/30925;;A61F2310/00023;;A61F2310/00023;;A61F2310/00047;;A61F2310/00047;;A61F2310/00053;;A61F2310/00053;;A61F2310/00071;;A61F2310/00071;;A61F2310/00203;;A61F2310/00203;;A61F2310/00221;;A61F2310/00221;;A61F2310/00239;;A61F2310/00239;;A61F2310/00293;;A61F2310/00293;;A61F2310/00796;;A61F2310/00796,A61F2/44;;A61F2/28;;A61F2/30,623/17.16,3,0,,,"International Preliminary Report on Patentability in corresponding application PCT/US2011/020053 dated Jul. 12, 2012.;;International Search Report for corresponding PCT/US2011/020053, dated Sep. 22, 2011.;;Supplementary European Search Report to EP 11728551; dated Jul. 9, 2013.",ACTIVE
37,WO,A3,WO 2011/082403 A3,044-298-537-524-623,2011-11-24,2011,US 2011/0020053 W,2011-01-03,US 65060009 A,2009-12-31,CERVICAL SPACER,"An anterior cervical column support having a hollow frame having a top load bearing surface and a bottom load bearing surface may be inserted between a first spinal vertebra and a second spinal vertebra. The top load bearing surface and the bottom load bearing surface may each include an opening allowing access to the interior of the frame. A front surface may extend between the top load bearing surface and the bottom load bearing surface, and a rear surface may extend between the top load bearing surface and the bottom load bearing surface. Two side surfaces are attached between the front surface and the rear surface, each side surface having a solid side panel that is at least x-ray translucent. An anterior (front) plate is attached to the front surface of the support device, where the front plate includes clearance holes for receiving fasteners for holding the front plate in position. The top load bearing surface and the bottom load bearing surface may include a serrated or other high friction surface for applying frictional forces between the load bearing surfaces and adjacent vertebrae.",RHAUSLER INC;;GEISLER FRED H;;BASS DANIEL;;JOHNSTON TERRY,GEISLER FRED H;;BASS DANIEL;;JOHNSTON TERRY,,https://lens.org/044-298-537-524-623,Search Report,yes,5,0,7,9,0,A61F2/447;;A61F2/447;;A61F2/442;;A61F2/442;;A61F2002/2817;;A61F2002/2817;;A61F2002/2835;;A61F2002/2835;;A61F2002/30056;;A61F2002/30056;;A61F2002/3008;;A61F2002/3008;;A61F2002/30261;;A61F2002/30261;;A61F2002/30448;;A61F2002/30448;;A61F2002/30576;;A61F2002/30576;;A61F2002/30578;;A61F2002/30578;;A61F2002/30593;;A61F2002/30593;;A61F2002/30604;;A61F2002/30604;;A61F2002/30774;;A61F2002/30774;;A61F2002/30777;;A61F2002/30777;;A61F2002/30787;;A61F2002/30787;;A61F2002/30789;;A61F2002/30789;;A61F2002/30904;;A61F2002/30904;;A61F2002/30906;;A61F2002/30906;;A61F2002/30925;;A61F2002/30925;;A61F2310/00023;;A61F2310/00023;;A61F2310/00047;;A61F2310/00047;;A61F2310/00053;;A61F2310/00053;;A61F2310/00071;;A61F2310/00071;;A61F2310/00203;;A61F2310/00203;;A61F2310/00221;;A61F2310/00221;;A61F2310/00239;;A61F2310/00239;;A61F2310/00293;;A61F2310/00293;;A61F2310/00796;;A61F2310/00796,A61F2/44;;A61B17/70;;A61B17/82;;A61B17/86;;A61L27/04;;A61L27/12;;A61L27/14;;A61L27/38,,1,0,,,See also references of EP 2519196A4,PENDING
38,WO,A2,WO 2011/082403 A2,040-017-802-245-678,2011-07-07,2011,US 2011/0020053 W,2011-01-03,US 65060009 A,2009-12-31,CERVICAL SPACER,"An anterior cervical column support having a hollow frame having a top load bearing surface and a bottom load bearing surface may be inserted between a first spinal vertebra and a second spinal vertebra. The top load bearing surface and the bottom load bearing surface may each include an opening allowing access to the interior of the frame. A front surface may extend between the top load bearing surface and the bottom load bearing surface, and a rear surface may extend between the top load bearing surface and the bottom load bearing surface. Two side surfaces are attached between the front surface and the rear surface, each side surface having a solid side panel that is at least x-ray translucent. An anterior (front) plate is attached to the front surface of the support device, where the front plate includes clearance holes for receiving fasteners for holding the front plate in position. The top load bearing surface and the bottom load bearing surface may include a serrated or other high friction surface for applying frictional forces between the load bearing surfaces and adjacent vertebrae.",RHAUSLER INC;;GEISLER FRED H;;BASS DANIEL;;JOHNSTON TERRY,GEISLER FRED H;;BASS DANIEL;;JOHNSTON TERRY,,https://lens.org/040-017-802-245-678,Patent Application,yes,0,1,7,9,0,A61F2/447;;A61F2/447;;A61F2/442;;A61F2/442;;A61F2002/2817;;A61F2002/2817;;A61F2002/2835;;A61F2002/2835;;A61F2002/30056;;A61F2002/30056;;A61F2002/3008;;A61F2002/3008;;A61F2002/30261;;A61F2002/30261;;A61F2002/30448;;A61F2002/30448;;A61F2002/30576;;A61F2002/30576;;A61F2002/30578;;A61F2002/30578;;A61F2002/30593;;A61F2002/30593;;A61F2002/30604;;A61F2002/30604;;A61F2002/30774;;A61F2002/30774;;A61F2002/30777;;A61F2002/30777;;A61F2002/30787;;A61F2002/30787;;A61F2002/30789;;A61F2002/30789;;A61F2002/30904;;A61F2002/30904;;A61F2002/30906;;A61F2002/30906;;A61F2002/30925;;A61F2002/30925;;A61F2310/00023;;A61F2310/00023;;A61F2310/00047;;A61F2310/00047;;A61F2310/00053;;A61F2310/00053;;A61F2310/00071;;A61F2310/00071;;A61F2310/00203;;A61F2310/00203;;A61F2310/00221;;A61F2310/00221;;A61F2310/00239;;A61F2310/00239;;A61F2310/00293;;A61F2310/00293;;A61F2310/00796;;A61F2310/00796,A61F2/44;;A61B17/70;;A61B17/82;;A61B17/86;;A61L27/04;;A61L27/12;;A61L27/14;;A61L27/38,,1,0,,,See references of EP 2519196A4,PENDING
39,US,A1,US 2011/0160860 A1,048-408-562-122-693,2011-06-30,2011,US 65060009 A,2009-12-31,US 65060009 A,2009-12-31,CERVICAL SPACER,"An anterior cervical column support having a hollow frame having a top load bearing surface and a bottom load bearing surface may be inserted between a first spinal vertebra and a second spinal vertebra. The top load bearing surface and the bottom load bearing surface may each include an opening allowing access to the interior of the frame. A front surface may extend between the top load bearing surface and the bottom load bearing surface, and a rear surface may extend between the top load bearing surface and the bottom load bearing surface. Two side surfaces are attached between the front surface and the rear surface, each side surface having a solid side panel that is at least x-ray translucent. An anterior (front) plate is attached to the front surface of the support device, where the front plate includes clearance holes for receiving fasteners for holding the front plate in position. The top load bearing surface and the bottom load bearing surface may include a serrated or other high friction surface for applying frictional forces between the load bearing surfaces and adjacent vertebrae.",RHAUSLER INC,JOHNSTON TERRY;;GEISLER FRED H;;BASS DANIEL,RHAUSLER INC (2009-12-07),https://lens.org/048-408-562-122-693,Patent Application,yes,30,37,7,9,0,A61F2/447;;A61F2/447;;A61F2/442;;A61F2/442;;A61F2002/2817;;A61F2002/2817;;A61F2002/2835;;A61F2002/2835;;A61F2002/30056;;A61F2002/30056;;A61F2002/3008;;A61F2002/3008;;A61F2002/30261;;A61F2002/30261;;A61F2002/30448;;A61F2002/30448;;A61F2002/30576;;A61F2002/30576;;A61F2002/30578;;A61F2002/30578;;A61F2002/30593;;A61F2002/30593;;A61F2002/30604;;A61F2002/30604;;A61F2002/30774;;A61F2002/30774;;A61F2002/30777;;A61F2002/30777;;A61F2002/30787;;A61F2002/30787;;A61F2002/30789;;A61F2002/30789;;A61F2002/30904;;A61F2002/30904;;A61F2002/30906;;A61F2002/30906;;A61F2002/30925;;A61F2002/30925;;A61F2310/00023;;A61F2310/00023;;A61F2310/00047;;A61F2310/00047;;A61F2310/00053;;A61F2310/00053;;A61F2310/00071;;A61F2310/00071;;A61F2310/00203;;A61F2310/00203;;A61F2310/00221;;A61F2310/00221;;A61F2310/00239;;A61F2310/00239;;A61F2310/00293;;A61F2310/00293;;A61F2310/00796;;A61F2310/00796,A61F2/44,623/17.16,0,0,,,,ACTIVE
40,EP,A4,EP 2519196 A4,109-513-484-691-561,2013-08-07,2013,EP 11728551 A,2011-01-03,US 65060009 A;;US 2011/0020053 W,2009-12-31,CERVICAL SPACER,,RHAUSLER INC,GEISLER FRED H;;BASS DANIEL;;JOHNSTON TERRY,,https://lens.org/109-513-484-691-561,Search Report,no,8,0,7,9,0,A61F2/447;;A61F2/447;;A61F2/442;;A61F2/442;;A61F2002/2817;;A61F2002/2817;;A61F2002/2835;;A61F2002/2835;;A61F2002/30056;;A61F2002/30056;;A61F2002/3008;;A61F2002/3008;;A61F2002/30261;;A61F2002/30261;;A61F2002/30448;;A61F2002/30448;;A61F2002/30576;;A61F2002/30576;;A61F2002/30578;;A61F2002/30578;;A61F2002/30593;;A61F2002/30593;;A61F2002/30604;;A61F2002/30604;;A61F2002/30774;;A61F2002/30774;;A61F2002/30777;;A61F2002/30777;;A61F2002/30787;;A61F2002/30787;;A61F2002/30789;;A61F2002/30789;;A61F2002/30904;;A61F2002/30904;;A61F2002/30906;;A61F2002/30906;;A61F2002/30925;;A61F2002/30925;;A61F2310/00023;;A61F2310/00023;;A61F2310/00047;;A61F2310/00047;;A61F2310/00053;;A61F2310/00053;;A61F2310/00071;;A61F2310/00071;;A61F2310/00203;;A61F2310/00203;;A61F2310/00221;;A61F2310/00221;;A61F2310/00239;;A61F2310/00239;;A61F2310/00293;;A61F2310/00293;;A61F2310/00796;;A61F2310/00796,A61F2/44;;A61B17/70;;A61B17/82;;A61B17/86;;A61L27/04;;A61L27/12;;A61L27/14;;A61L27/38,,0,0,,,,DISCONTINUED
41,DE,A1,DE 102012103199 A1,191-547-332-885-892,2013-10-17,2013,DE 102012103199 A,2012-04-13,DE 102012103199 A,2012-04-13,"Device useful for mechanical disruption of cells, comprises two driven rollers, working gap which is adjustable between rolling surfaces comprising apparatus for perforating cell walls and casing rings via which rollers are pressed together","Device comprises: two driven rollers (11, 12), and a defined working gap which is adjustable between the rolling surfaces, where the roller surfaces of the rollers comprise apparatus for perforating cell walls; and casing rings (13) at the ends of rollers arranged between the two side walls (3, 4), via which the rollers are pressed together by the action of spring force. The rollers between the casing rings comprise surface structured rolling surfaces with a diameter smaller than the casing rings, where the defined working gap is necessarily adjustable.",ETG ENTWICKLUNGS UND TECHNOLOGIE GMBH,RIEGEL WOLF-ULRICH DIPL ING;;GEISLER FRED,,https://lens.org/191-547-332-885-892,Patent Application,no,5,2,1,1,0,C12M47/06,C12M1/33;;C12M1/42,,0,0,,,,DISCONTINUED
42,EP,A2,EP 2519196 A2,187-852-913-422-446,2012-11-07,2012,EP 11728551 A,2011-01-03,US 65060009 A;;US 2011/0020053 W,2009-12-31,CERVICAL SPACER,,RHAUSLER INC,GEISLER FRED H;;BASS DANIEL;;JOHNSTON TERRY,,https://lens.org/187-852-913-422-446,Patent Application,yes,0,0,7,9,0,A61F2/447;;A61F2/447;;A61F2/442;;A61F2/442;;A61F2002/2817;;A61F2002/2817;;A61F2002/2835;;A61F2002/2835;;A61F2002/30056;;A61F2002/30056;;A61F2002/3008;;A61F2002/3008;;A61F2002/30261;;A61F2002/30261;;A61F2002/30448;;A61F2002/30448;;A61F2002/30576;;A61F2002/30576;;A61F2002/30578;;A61F2002/30578;;A61F2002/30593;;A61F2002/30593;;A61F2002/30604;;A61F2002/30604;;A61F2002/30774;;A61F2002/30774;;A61F2002/30777;;A61F2002/30777;;A61F2002/30787;;A61F2002/30787;;A61F2002/30789;;A61F2002/30789;;A61F2002/30904;;A61F2002/30904;;A61F2002/30906;;A61F2002/30906;;A61F2002/30925;;A61F2002/30925;;A61F2310/00023;;A61F2310/00023;;A61F2310/00047;;A61F2310/00047;;A61F2310/00053;;A61F2310/00053;;A61F2310/00071;;A61F2310/00071;;A61F2310/00203;;A61F2310/00203;;A61F2310/00221;;A61F2310/00221;;A61F2310/00239;;A61F2310/00239;;A61F2310/00293;;A61F2310/00293;;A61F2310/00796;;A61F2310/00796,A61F2/44;;A61B17/70;;A61B17/82;;A61B17/86;;A61L27/04;;A61L27/12;;A61L27/14;;A61L27/38,,0,0,,,,DISCONTINUED
43,US,B2,US 8348981 B2,004-551-816-699-018,2013-01-08,2013,US 48991609 A,2009-06-23,US 48991609 A,2009-06-23,Minimal access occipital plate,"A bone plate for securing a spinal fixation element to bone includes a base portion having a top face, a rod receiving portion and a bone anchor receiving portion. The bone anchor receiving portion includes a plurality of angled holes for receiving bone screws. At least one of the screw holes is oriented at an acute angle relative to the top face of the plate.",AESCULAP IMPLANY SYSTEMS LLC;;CHEEMA NAVEED;;APFELBAUM RON;;GEISLER FRED;;KHOO LARRY,CHEEMA NAVEED;;APFELBAUM RON;;GEISLER FRED;;KHOO LARRY,AESCULAP IMPLANT SYSTEMS LLC (2009-06-24),https://lens.org/004-551-816-699-018,Granted Patent,yes,35,10,2,2,0,A61B17/7055;;A61B17/7055,A61B17/80,606/286,4,0,,,"PCT International Search Report for International Application No. PCT/US2006/037385; Search Report Completed Feb. 5, 2007 and Mailed Feb. 19, 2007.;;U.S. Appl. No. 12/088,580, filed Aug. 13, 2008.;;Japanese Office Action for application for JP 2008-533500, dated Mar. 24, 2011 with English Translation.;;USPTO Final Office Action for U.S. Appl. No. 12/088,580 dated Jul. 30, 2012.",INACTIVE
44,US,A1,US 2020/0015861 A1,112-578-707-660-240,2020-01-16,2020,US 201916581609 A,2019-09-24,US 201916581609 A;;US 201615138076 A;;US 201562152719 P,2015-04-24,"VERTEBRAL FIXATION DEVICES, SYSTEMS, AND METHODS",Described herein is an orthopedic fixation device for use in spinal surgery. Said orthopedic device is a pivoting device that comprises one or more hinges. Fixation of multiple vertebrae is accomplished by fixation at the vertebral facet joints. Multiple device may be further fixed at multiple vertebral levels with the use of a multi-level rod.,ARTICULAR SPINE FIX INC,LOCH HARTMUT;;DIPERNA PAUL M;;GEISLER FRED H,,https://lens.org/112-578-707-660-240,Patent Application,yes,0,0,4,4,0,A61B17/7064;;A61B17/7064;;A61B17/7047;;A61B17/7049;;A61B17/7076;;A61B2017/7073,A61B17/70,,0,0,,,,ACTIVE
45,US,A1,US 2017/0020577 A1,147-280-380-709-388,2017-01-26,2017,US 201615138076 A,2016-04-25,US 201615138076 A;;US 201562152719 P,2015-04-24,"VERTEBRAL FIXATION DEVICES, SYSTEMS, AND METHODS",Described herein is an orthopedic fixation device for use in spinal surgery. Said orthopedic device is a pivoting device that comprises one or more hinges. Fixation of multiple vertebrae is accomplished by fixation at the vertebral facet joints. Multiple device may be further fixed at multiple vertebral levels with the use of a multi-level rod.,ARTICULAR SPINE FIX INC,LOCH HARTMUT;;DIPERNA PAUL M;;GEISLER FRED H,ARTICULAR SPINE FIX INC (2016-04-29),https://lens.org/147-280-380-709-388,Patent Application,yes,9,4,4,4,0,A61B17/7064;;A61B17/7064;;A61B17/7047;;A61B17/7049;;A61B17/7076;;A61B2017/7073,A61B17/70,,0,0,,,,DISCONTINUED
46,US,A1,US 2010/0324557 A1,190-772-038-503-560,2010-12-23,2010,US 48991609 A,2009-06-23,US 48991609 A,2009-06-23,MINIMAL ACCESS OCCIPITAL PLATE,"A bone plate for securing a spinal fixation element to bone includes a base portion having a top face, a rod receiving portion and a bone anchor receiving portion. The bone anchor receiving portion includes a plurality of angled holes for receiving bone screws. At least one of the screw holes is oriented at an acute angle relative to the top face of the plate.",AESCULAP IMPLANT SYSTEMS INC,CHEEMA NAVEED;;APFELBAUM RON;;GEISLER FRED;;KHOO LARRY,AESCULAP IMPLANT SYSTEMS LLC (2009-06-24),https://lens.org/190-772-038-503-560,Patent Application,yes,28,22,2,2,0,A61B17/7055;;A61B17/7055,A61B17/80,606/70;;606/286,0,0,,,,INACTIVE
47,WO,A1,WO 2016/172607 A1,103-326-432-023-295,2016-10-27,2016,US 2016/0029016 W,2016-04-22,US 201562152719 P,2015-04-24,"VERTEBRAL FIXATION DEVICES, SYSTEMS, AND METHODS",Described herein is an orthopedic fixation device for use in spinal surgery. Said orthopedic device is a pivoting device that comprises one or more hinges. Fixation of multiple vertebrae is accomplished by fixation at the vertebral facet joints. Multiple devices may be further fixed at multiple vertebral levels with the use of a multi-level rod.,ARTICULAR SPINE FIX INC,LOCH HARTMUT;;DIPERNA PAUL M;;GEISLER FRED H,,https://lens.org/103-326-432-023-295,Patent Application,yes,8,1,4,4,0,A61B17/7064;;A61B17/7064;;A61B17/7047;;A61B17/7049;;A61B17/7076;;A61B2017/7073,A61B17/70,,0,0,,,,PENDING
48,US,B2,US 11678911 B2,039-865-603-909-079,2023-06-20,2023,US 201916581609 A,2019-09-24,US 201916581609 A;;US 201615138076 A;;US 201562152719 P,2015-04-24,"Vertebral fixation devices, systems, and methods",Described herein is an orthopedic fixation device for use in spinal surgery. The orthopedic device is a pivoting device that comprises one or more hinges. Fixation of multiple vertebrae is accomplished by fixation at the vertebral facet joints. Multiple devices may be further fixed at multiple vertebral levels with the use of a multi-level rod.,ARTICULAR SPINE FIX INC,LOCH HARTMUT;;DIPERNA PAUL M;;GEISLER FRED H,,https://lens.org/039-865-603-909-079,Granted Patent,yes,20,0,4,4,0,A61B17/7064;;A61B17/7064;;A61B17/7047;;A61B17/7049;;A61B17/7076;;A61B2017/7073,A61B17/70,,4,0,,,"PCT/US2016/29016 International Search Report and Written Opinion dated Sep. 30, 2016.;;U.S. Appl. No. 15/138,076 Office Action dated Mar. 29, 2019.;;U.S. Appl. No. 15/138,076 Office Action dated Oct. 6, 2017.;;U.S. Appl. No. 15/138,076 Office Action dated Sep. 7, 2018.",ACTIVE
49,US,B2,US 8798233 B2,044-080-415-823-025,2014-08-05,2014,US 201213369368 A,2012-02-09,US 201213369368 A,2012-02-09,Low dose-rate radiation for medical and veterinary therapies,"Various embodiments relate to a method of performing microbeam radiation therapy on a subject, including: affixing a collimator to the subject at a first location; producing a first high energy radiation fan beam, wherein the width of the first fan beam in a first direction is greater than the width of the first fan beam in a second direction; and moving the subject in the second direction so that the first fan beam irradiates the subject through the collimator to produce first high dose regions alternating with first low dose regions.",GEISLER FRED HARDEN;;POLATNICK LOIS ANN;;SLATKIN DANIEL N;;MICROBEAM THERAPY LLC,GEISLER FRED HARDEN;;POLATNICK LOIS ANN;;SLATKIN DANIEL N,MICROBEAM THERAPY LLC (2012-02-07);;COPERNICUS DYNAMICS GROUP LP (2016-12-16),https://lens.org/044-080-415-823-025,Granted Patent,yes,4,6,3,7,0,A61N5/1042;;A61N5/1042;;A61N5/1049;;A61N5/1049;;A61N5/1068;;A61N5/1068;;A61N5/1078;;A61N5/1078;;A61N2005/1076;;A61N2005/1076;;A61N2005/1091;;A61N2005/1091;;A61N2005/1095;;A61N2005/1095;;A61N2005/1097;;A61N2005/1097,A61N5/10,378/65;;378/147;;378/205,22,17,054-211-568-412-059;;052-322-497-785-745;;062-028-802-239-202;;059-508-039-880-833;;033-759-381-492-919;;013-822-280-888-889;;010-822-639-255-481;;018-972-033-151-340;;009-055-474-362-616;;002-098-322-477-487;;090-327-392-310-234;;000-303-904-730-46X;;036-454-340-144-522;;017-774-811-455-022;;060-356-621-796-974;;066-699-080-041-511;;032-272-684-389-168,10.1016/j.ijrobp.2006.11.036;;17275205;;10.1016/j.clon.2010.06.014;;20667700;;10.1118/1.597149;;8413027;;10.1016/j.ijrobp.2010.03.011;;pmc2953612;;20615630;;10.1063/1.1915270;;20034592;;10.1016/j.mrrev.2009.12.003;;19655968;;10.1063/1.3170035;;10.1118/1.598794;;10619240;;16510333;;10.1016/s1470-2045(06)70615-5;;10.1093/rpd/ncr361;;21979431;;17635201;;10.1111/j.1469-8749.2007.00577.x;;20601776;;10.1088/0031-9155/55/14/006;;21775795;;10.1088/0031-9155/56/16/r01;;20140254;;10.1371/journal.pone.0009028;;pmc2815784;;15285266;;10.1088/0031-9155/49/13/n04;;16912367;;10.1088/0031-9155/51/17/n01;;10.4137/bci.s901,"International Search Report in corresponding PCT Application No. PCT/US2013/025267, issued on Apr. 3, 2013.;;Ahunbay et al, ""Direct Aperture Optimization-Based Intensity-Modulated Radiotherapy for Whole Breast Irradiation"", Int. J. Radiation Oncology Biol. Phys., vol. 67, No. 4, 2007, pp. 1248-1258.;;Slatkin et al, ""Prospects for Microbeam Radiation Therapy of Brain Tumours in Children"", Medical Department Brookhaven National Laboratory, 2008, p. 163.;;W.P.M. Mayles, ""Survey of the Availability and Use of Advanced Radiotherapy Technology in the UK"", Clinical Oncology 22 (2010) pp. 636-642.;;Beilajew, ""The Effect of Strong Longitudinal Magnetic Fields on Dose Deposition from Electron and Photon Beams"", Med. Phys. 20 (4), Jul./Aug. 1993, pp. 1171-1179.;;Keall et al, ""Electromagnetic-Guided Dynamic Multileaf Collimator Tracking Enables Motion Management for Intensity-Modulated ARC Therapy"", Int. J. Radiation Oncology Biol. Phys., vol. 79, No. 1, 2011, pp. 312-320.;;E. Brauer-Krisch et al, ""Characterization of a Tungsten/Gas Multislit Collimator for Microbeam Radiation Therapy at the Europeam Synchrotron Radiation Facility"", Review of Scientific Instruments 76, 2005, 7 pages.;;E. Brauer-Krisch et al, ""Effects of Pulsed, Spatially Fractionated, Microscopic Synchrotron X-Ray Beams on Normal and Tumoral Brain Tissue"", Mutation Research 704/Reviews in Mutation Research, (2010), pp. 160-166.;;E. Brauer-Krisch, ""New Technology Enables High Precision Multislit Collimators for Microbeam Radiation Therapy"", Review of Scientific Instruments 80, (2009),6 pages.;;Jian-Rong Dai et al, ""Intensity-Modulation Radiotherapy Using Independent Collimators: An Algorithm Study"", Med. Phys. 26 (12), 1999, pp. 2562-2570.;;Hargrave et al, ""Diffuse Brainstem Glioma in Children: Critical Review of Clinical Trials"", http://oncology.thelancet.com, vol. 7, 2006, pp. 241-248.;;Kalef-Ezra, ""Health Physics Aspects in Treatment Rooms After 18-MV X-Ray Irradiations"", Radiation Protection Dosimetry (2011), vol. 147, No. 1-2, pp. 1-6.;;J.A. Laissue et al, ""Prospects for Microbeam Radiation Therapy of Brain Tumours in Children to Reduce Neurological Sequelae"", Developmental Medicine & Child Neurology, 2007, 49: 577-581.;;Laissue et al, ""The Weanling Piglet Cerebellum: A Surrogate for Tolerance to MRT (Microbeam Radiation Therapy) in Pediatric Neuro-Oncology"", Proceedings of SPIE, vol. 4508 (2001), pp. 65-73.;;Fan et al, ""Intensity Modulation Under Geometrical Uncertainty: A Deconvolution Approach to Robust Fluence"", Physics in Medicine and Biology 55 (2010), pp. 4029-4045.;;Bert et al, ""Motion 41 Radiotherapy: Particle Therapy"", Physics in Medicine and Biology 56 (2011), pp. R113-R144.;;Serduc et al, High-Precision Radiosurgical Dose Delivery by Interlaced Microbeam Arrays of High-Flux Low-Energy Synchrotron X-Rays, Synchrotron X-Ray Radiosurgery, vol. 5, issue 2, 2010, pp. 1-12.;;Slatkin, ""Uniaxial and Biaxial Irradiation Protocols for Microbeam Radiation Therapy"", Institute of Physics Publishing, Phys. Med. Biol. 49 (2004), pp. N203-N204.;;Slatkin, ""Tetrahedral Irradiation Protocol for Microbeam Radiation Therapy"", Institute of Physics Publishing, Phys. Med. Biol. 51 (2006), pp. N295-N297.;;Cai et al, ""Targeted Cancer Therapy with Tumor Necrosis Factor-Alpha"", Biochemistry Insights, 2008, pp. 5-21.;;Gonsalves et al, ""Tunable Laser Plasma Accelerator Based on Longitudinal Density Tailoring"", Nature Physics, 2011, pp. 1-5.;;Esteban et al, ""Reducing the Number of Segments in Unidirectional Segmentations of Fluence Matrices for Multileaf Collimators in IMRT"", M.Sc. Biomedical Engineering, 2010, pp. i-xii and 1-30.",ACTIVE
50,WO,A1,WO 2013/119899 A1,008-238-486-471-348,2013-08-15,2013,US 2013/0025267 W,2013-02-08,US 201213369368 A,2012-02-09,LOW DOSE-RATE RADIATION FOR MEDICAL AND VETERINARY THERAPIES,"Various embodiments relate to a method of performing microbeam radiation therapy on a subject, including: affixing a collimator to the subject at a first location; producing a first high energy radiation fan beam, wherein the width of the first fan beam in a first direction is greater than the width of the first fan beam in a second direction; and moving the subject in the second direction so that the first fan beam irradiates the subject through the collimator to produce first high dose regions alternating with first low dose regions.",MICROBEAM THERAPY LLC;;GEISLER FRED HARDEN;;POLATNICK LOIS ANN;;SLATKIN DANIEL N,GEISLER FRED HARDEN;;POLATNICK LOIS ANN;;SLATKIN DANIEL N,,https://lens.org/008-238-486-471-348,Patent Application,yes,4,0,3,7,0,A61N5/1042;;A61N5/1042;;A61N5/1049;;A61N5/1049;;A61N5/1068;;A61N5/1068;;A61N5/1078;;A61N5/1078;;A61N2005/1076;;A61N2005/1076;;A61N2005/1091;;A61N2005/1091;;A61N2005/1095;;A61N2005/1095;;A61N2005/1097;;A61N2005/1097,A61N5/10,,0,0,,,,PENDING
