133,CA,A1,CA 2076091 A1,007-204-954-444-948,1993-03-10,1993,CA 2076091 A,1992-08-13,US 75694791 A,1991-09-09,"SUPERALLOY COMPONENT WITH DISPERSION-CONTAINING PROTECTIVE COATINGS, AND METHOD OF PREPARATION","13DV-8682 SUPERALLOY COMPONENT WITH DISPERSION-CONTAINING PROTECTIVE COATING, AND METHOD OF PREPARATION A coated superalloy component includes a substrate article formed of a superalloy and an adherent coating over the substrate. The coating is a nickel-base superalloy containing at least about 0.3 volume percent or more of a dispersed oxide of yttrium, hafnium and/or a rare earth, and, preferably, grain boundary strengthening elements such as carbon, zirconium, and boron. The oxide dispersoids improve the performance of the coating in service, reducing the incidence failures due to thermal fatigue, oxidation, and corrosion damage. The dispersoid-containing coating may be formed by directly depositing the oxide-containing coating, or by depositing a metallic coating and then forming the dispersoids by subsequent heat treatment.",GOLDMAN EDWARD H;;WORTMAN DAVID J;;DAROLIA RAMGOPAL,GOLDMAN EDWARD H;;WORTMAN DAVID J;;DAROLIA RAMGOPAL,,https://lens.org/007-204-954-444-948,Patent Application,no,0,0,3,4,0,C23C4/06;;C23C4/12;;C23C4/18;;C23C30/00,C23C4/04;;C23C4/06;;C23C4/12;;C23C4/18;;C23C30/00,,0,0,,,,DISCONTINUED
134,WO,A3,WO 2003/008007 A3,122-171-303-832-34X,2003-05-30,2003,US 0223156 W,2002-07-19,US 90902701 A,2001-07-19,DEVICE FOR REGENERATION OF ARTICULAR CARTILAGE AND OTHER TISSUE,"An implantable device for facilitating the healing of voids in bone, cartilage and soft tissue is disclosed. A preferred embodiment includes a cartilage region comprising a polyelectrolytic complex joined with a subchondral bone region. The cartilage region, of this embodiment, enhances the environment for chondrocytes to grow articular cartilage; while the subchondral bone region enhances the environment for cells which migrate into that region's macrostructure and which differentiate into osteoblasts. A hydrophobic barrier exists between the regions, of this embodiment. In one embodiment, the polyelectrolytic complex transforms to hydrogel, following the implant procedure.",KENSEY NASH CORP;;BREKKE JOHN H;;BRADICA GINO;;GOLDMAN SCOTT M,BREKKE JOHN H;;BRADICA GINO;;GOLDMAN SCOTT M,,https://lens.org/122-171-303-832-34X,Search Report,yes,5,0,7,7,0,A61F2/28;;A61F2/30756;;A61F2002/30062;;A61F2002/30677;;A61F2210/0004;;A61F2250/0067;;A61K35/16;;A61K35/28;;A61K38/15;;A61L27/20;;A61L27/38;;A61L27/3847;;A61L27/3852;;A61L27/56;;A61L27/58;;A61F2/28;;A61F2002/30062;;A61L27/38;;A61L27/58;;A61K35/28;;A61K38/15;;A61K35/16;;A61L27/3847;;A61F2/30756;;A61F2250/0067;;A61L27/3852;;A61F2210/0004;;A61L27/56;;A61L27/20;;A61F2002/30677,A61F2/00;;A61F2/02;;A61F2/28;;A61F2/30;;A61K35/16;;A61K35/28;;A61K38/15;;A61L27/20;;A61L27/38;;A61L27/56;;A61L27/58,,0,0,,,,PENDING
135,CN,A,CN 1321082 A,195-273-018-717-612,2001-11-07,2001,CN 99811336 A,1999-09-22,GB 9820746 A,1998-09-23,Micronised pharmaceutical compositions,,PHARMAX LTD,FLYNN R A;;GOLDMAN M H;;LOVELY J R,"FORESTS LABS ENGLAND CO., LTD. (2009-03-31)",https://lens.org/195-273-018-717-612,Patent Application,no,0,2,38,38,0,A61K9/0075;;A61K9/145;;A61K38/12;;A61P11/00;;A61P31/04,A61K9/12;;A61K9/00;;A61K9/14;;A61K9/50;;A61K9/72;;A61K31/137;;A61K31/7036;;A61K38/00;;A61K38/12;;A61K47/26;;A61P11/00;;A61P31/04,,0,0,,,,EXPIRED
136,US,B1,US 7664122 B1,171-562-042-331-728,2010-02-16,2010,US 74719303 A,2003-12-30,US 74719303 A;;US 48430503 P,2003-07-03,Call tracking using voice quality measurement probe,"A system for monitoring quality of calls in a network. A server receives information concerning calls which begin or end in a network and at the same time receives measurements of a quality parameter such as bandwidth. This measurement data is provided by a probe, so that the server is able to correlate calls which are placed through the network with the quality of service in the network at that time. When the quality falls below a desired level, the server notifies the customer or the network operator so that appropriate action may be taken.",AT & T CORP,CHEUNG ERIC;;FOLADARE MARK;;GOLDMAN SHELLEY;;PURDY KERMIT H;;SHUR DAVID H,AT&T CORP (2004-05-07),https://lens.org/171-562-042-331-728,Granted Patent,yes,19,7,3,3,0,H04L41/5003;;H04L41/5009;;H04L43/0829;;H04L43/0852;;H04L43/087;;H04L43/106;;H04L41/5003;;H04L43/087;;H04L43/0829;;H04L43/0852;;H04L43/106;;H04L41/5009,H04L12/56;;H04L12/28;;H04L12/66,370/401;;370/352;;379/1.04,1,0,,,"Tom Gallatin, Finding and Fixing VolP Problems, May 2003, Internet Telephony Feature Article, pp. 1-6, May 2003.",INACTIVE
137,US,A,US 3322461 A,043-786-563-203-686,1967-05-30,1967,US 41637864 A,1964-12-07,US 41637864 A,1964-12-07,Lock for automobile seats,,GOLDMAN,GOLDMAN MARK H;;KAPEL EDWARD V;;LUDA LAWRENCE E,,https://lens.org/043-786-563-203-686,Granted Patent,no,5,7,1,1,0,B60N2/20;;B60N2/20,B60N2/20,,0,0,,,,EXPIRED
138,US,A1,US 2010/0098228 A1,007-170-793-651-74X,2010-04-22,2010,US 64748809 A,2009-12-26,US 64748809 A;;US 74719303 A;;US 48430503 P,2003-07-03,CALL TRACKING USING VOICE QUALITY MEASUREMENT PROBE,"A system for monitoring quality of calls in a network. A server receives information concerning calls which begin or end in a network and at the same time receives measurements of a quality parameter such as bandwidth. This measurement data is provided by a probe, so that the server is able to correlate calls which are placed through the network with the quality of service in the network at that time. When the quality falls below a desired level, the server notifies the customer or the network operator so that appropriate action may be taken.",CHEUNG ERIC;;FOLADARE MARK;;GOLDMAN SHELLEY;;PURDY KERMIT H;;SHUR DAVID H,CHEUNG ERIC;;FOLADARE MARK;;GOLDMAN SHELLEY;;PURDY KERMIT H;;SHUR DAVID H,AT&T CORP (2004-05-07),https://lens.org/007-170-793-651-74X,Patent Application,yes,36,1,3,3,0,H04L41/5003;;H04L41/5009;;H04L43/0829;;H04L43/0852;;H04L43/087;;H04L43/106;;H04L41/5003;;H04L43/087;;H04L43/0829;;H04L43/0852;;H04L43/106;;H04L41/5009,H04M15/00,379/112.06,0,0,,,,EXPIRED
139,CN,C,CN 1148168 C,136-857-241-745-260,2004-05-05,2004,CN 99811336 A,1999-09-22,GB 9820746 A,1998-09-23,Micronised pharmaceutical compositions,本发明叙述了含有超微粉碎的多粘菌素E甲磺酸钠的药物组合物。超微粉碎的药物可以与载体如乳糖一起使用。药物组合物可以装入如明胶胶囊的容器中和经粉末吸入法给药。,PHARMAX LTD,FLYNN R A;;GOLDMAN M H;;LOVELY J R,"FORESTS LABS ENGLAND CO., LTD. (2009-03-31)",https://lens.org/136-857-241-745-260,Granted Patent,no,0,0,38,38,0,A61K9/0075;;A61K9/145;;A61K38/12;;A61P11/00;;A61P31/04,A61K9/12;;A61K9/00;;A61K9/14;;A61K9/50;;A61K9/72;;A61K31/137;;A61K31/7036;;A61K38/00;;A61K38/12;;A61K47/26;;A61P11/00;;A61P31/04,,0,0,,,,EXPIRED
140,MX,A,MX 150670 A,132-678-709-617-637,1984-06-25,1984,MX 18373880 A,1980-08-29,US 7067279 A,1979-08-29,"MEJORAS EN PLATAFORMA AUTO-ELEVABLE CON GATOS MOVIBLES FUERA DE LA COSTA,EMPLEADA EN PERFORACIONES PETROLERAS",,FRIEDE & GOLDMAN LTD,GOLDMAN JEROME L;;BREEDEN JOHN O'R;;MICHEL WALTER H,,https://lens.org/132-678-709-617-637,Granted Patent,no,0,0,10,11,0,E02B17/021;;E02B17/06;;E02B17/0818;;E02B2017/006;;E02B2017/0082;;E02B17/021;;E02B2017/0082;;E02B17/0818;;E02B17/06;;E02B2017/006,E02B17/08;;B66F3/02;;E02B17/06,85-25;;59-1,0,0,,,,EXPIRED
141,US,A,US 3898613 A,184-523-037-976-88X,1975-08-05,1975,US 45994074 A,1974-04-11,US 45994074 A,1974-04-11,Vehicle fuel economy meter,"A device for sensing and indicating the relative acceleration rate of a vehicle comprises a housing having an acceleration rate sensing switch carried by an adjusting member and an indicator operatively connected to the switch and a battery power source. The adjusting member is operative to position the switch for sensing vehicle acceleration rate above a given threshold level. When the vehicle acceleration rate exceeds the preset threshold level, the switch is actuated to its ON state and the indicator is energized for presenting an indication of excessive vehicle acceleration rate and increased fuel consumption.",FOSTER MILLER ASS,NAHIKIAN EDWIN H;;GOLDMAN EDWARD J;;BROWN ROBERT L,,https://lens.org/184-523-037-976-88X,Granted Patent,no,3,4,1,1,0,G01P15/135;;H01H29/002;;H01H35/14;;G01P15/135;;H01H29/002;;H01H35/14,G01P15/135;;H01H29/00;;H01H35/14,340 52R,0,0,,,,EXPIRED
142,US,A,US 3891926 A,066-004-708-657-220,1975-06-24,1975,US 31581872 A,1972-12-18,US 31581872 A,1972-12-18,Filter module,"A radio transceiver, capable of transmitting and receiving in any of a large number (7000.) of channels over a band of frequencies almost an octave wide in the u.h.f. spectrum, which includes a tunable frequency synthesizer operable over the band 225-400 MHz., in 25 KHz. channel spacings, a driver amplifier responsive to the synthesizer over the entire band, a filter of the multi-cavity resonator type continuously tunable over the band and a broad band power amplifier responsive to the output of the filter, amplitude modulation of carrier derived from the power amplifier being achieved at the driver amplifier in response to an error signal equal to the difference between a rectified version of the output of the power amplifier and an audio input signal. Since the cavity resonator presents a load to the driver amplifier which looks like a short circuit when the filter is not correctly tuned, the driver output stages, operating Class C, are bypassed during tuning, drive during tuning being achieved from Class A drivers of the Class C stages until the filter is completely tuned, and in the latter process rough tuning being achieved in terms of a comparison of power reflected from the input of the filter and issuing out of the filter, and fine tuning being achieved in response to phase comparison of the signals at the input and issuing out of the filter.",AMERICAN STANDARD INC,ISHMAN NEAL H;;LENERT RICHARD W;;GOLDMAN JEFFREY B,,https://lens.org/066-004-708-657-220,Granted Patent,no,5,30,1,1,0,H04B1/405;;H04B1/405,H04B1/40,325/159,0,0,,,,EXPIRED
143,US,B2,US 8804913 B2,169-535-439-405-945,2014-08-12,2014,US 64748809 A,2009-12-26,US 64748809 A;;US 74719303 A;;US 48430503 P,2003-07-03,Call tracking using voice quality measurement probe,"A system for monitoring quality of calls in a network. A server receives information concerning calls which begin or end in a network and at the same time receives measurements of a quality parameter such as bandwidth. This measurement data is provided by a probe, so that the server is able to correlate calls which are placed through the network with the quality of service in the network at that time. When the quality falls below a desired level, the server notifies the customer or the network operator so that appropriate action may be taken.",CHEUNG ERIC;;FOLADARE MARK;;GOLDMAN SHELLEY;;PURDY KERMIT H;;SHUR DAVID H;;AT & T IP II LP,CHEUNG ERIC;;FOLADARE MARK;;GOLDMAN SHELLEY;;PURDY KERMIT H;;SHUR DAVID H,AT&T CORP (2004-05-07),https://lens.org/169-535-439-405-945,Granted Patent,yes,37,0,3,3,0,H04L41/5003;;H04L41/5009;;H04L43/0829;;H04L43/0852;;H04L43/087;;H04L43/106;;H04L41/5003;;H04L43/087;;H04L43/0829;;H04L43/0852;;H04L43/106;;H04L41/5009,H04M1/24;;H04M3/08;;H04M3/22,379/22.03;;379/1.01,1,0,,,"Tom Gallatin, ""Finding and Fixing VoIP Problems,"" May 2003, Internet Telephony Feature Article, pp. 1-6, May 2003.",INACTIVE
144,US,B1,US 6353156 B1,056-684-410-000-559,2002-03-05,2002,US 50117800 A,2000-02-10,US 50117800 A,2000-02-10,High Pigment Beet,"
    Novel high pigment beet populations and varieties and methods to produce are disclosed. The invention relates to a beet seed, a beet plant, a beet population, a beet variety, a beet hybrid and to a method of producing beets having a high level of total betalain pigments in the root. 
",WISCONSIN ALUMNI RES FOUND,GABELMAN WARREN H;;GOLDMAN IRWIN L;;BREITBACH D NICHOLAS,WISCONSIN ALUMNI RESEARCH FOUNDATION (2000-06-02),https://lens.org/056-684-410-000-559,Granted Patent,yes,0,7,1,1,0,A01H5/06;;A01H6/024;;A01H5/06;;A01H6/024,A01H5/06,800/298;;800/260,14,7,123-974-592-796-810;;074-315-411-869-773;;108-923-033-867-711;;013-465-520-855-937;;075-992-334-346-059;;029-539-499-607-735;;104-186-103-180-286,10.21273/hortsci.29.5.478c;;10.21273/hortsci.30.4.841c;;10.1007/bf00441426;;10.21273/hortsci.31.5.880;;10.21273/jashs.121.1.23;;10.1093/oxfordjournals.jhered.a110785;;10.21273/jashs.115.1.165,"Eagen, K.A., et al., (Abstract of) ""RAPD Marker Frequency Changes in Two Red Beet Populations Undergoing Recurrent Selection"" (1994), HortScience 29(5):478.;;Eagen, K.A., et al., (Abstract of) ""Directional RAPD Marker Frequency Changes in Two Divergently Selected Beet Populations"" (1995), HortScience 30(4):841.;;Eagen, K.A., et al., ""RAPD Marker Frequency Changes Associated with Sugar and Pigment Content in Two Beet Populations Modified Via Recurrent Selection,"" Proceedings of the 28th Biennial Meeting of the Am. Soc. of Sugar Beet Technologists, New Orleans, LA, Mar. 8-11, 1995, pp. 99-105.;;Eagen, K.A., (Abstract of) ""RAPD Marker Frequency Changes in Two Beet Populations Resulting from a Divergent Recurrent Selection Scheme,"" Proceedings of 1995 International Conference on the Status of Plant Genome Research III, San Diego, CA, p. 40.;;Eagen, K.A., et al. (1996), ""Assessment of RAPD marker frequencies over cycles of recurrent selection for pigment concentration and percent solids in red beet (Beta vulgaris L.),"" Mol. Breeding 2:107-115.;;Goldman, I.L. (1996), ""A List of Germplasm Releases from the University of Wisconsin Table Beet Breeding Program, 1964-1992,"" HortScience 31(5):880-881.;;Goldman, I.L., et al. (1995), (Abstract of) ""Response to Eight Cycles of Half Sib Family Recurrent Selection for Pigment Concentration in Beta vulgaris,"" Agronomy Abstracts, p. 97.;;Goldman, I.L., et al. (1996), ""Simultaneous Selection is Effective in Increasing Betalain Pigment Concentration but not Total Dissolved Solids in Red Beet,"" J. Amer. Soc. Hort. Sci. 121(1):23-26.;;Goldman, I.L., et al., ""Genetic Modification of Betalain Pigment Concentration in Red Beet (Beta vulgaris L.)"" Proceedings of the 1996 International Conference on Natural Colorants, Acapulco, Mexico, Jan. 23-25, pp. 1-3.;;Watson, James F., et al. (1982), ""Seasonal Changes and Cultivar Differences in pigment Concentrations and Percent Dissolved Solids in Roots of Table Beets,"" J. Amer. Soc. Hort. Sci. 107(5):713-716.;;Watson, James F., et al. (1984), ""Genetic Analysis of Betacyanin, Betaxanthine, and Sucrose Concentrations in Roots of Table Beet,"" J. Amer. Soc. Hort. Sci. 109(3):386-391.;;Wolyn, D.J., et al. (1986), ""Effects of Planting and Harvest Date on Betalain Pigment Concentrations in Three Table Beet Genotypes,"" HortScience 21(6):1339-1340.;;Wolyn, D.J., et al.(1989), ""Inheritance of Root and Petiole Pigmentation in Red Table Beet,"" J. Heredity 80(1):33-38.;;Wolyn, D.J., et al. (1990), ""Selection for Betalain Pigment Concentrations and Total Dissolved Solids in Red Table Beets,"" J. Amer. Soc. Hort. Sci. 115(1):165-169.",EXPIRED
145,CA,A,CA 879236 A,164-963-306-935-896,1971-08-24,1971,CA 879236D A,,CA 879236T A,,PROCESS AND APPARATUS FOR THE DEHYDRATION OF A GAS,,SHELL INT RESEARCH,GOLDMAN EDWIN C;;REMAN GERRIT H;;ZUIDERWEG FREDERIK J,,https://lens.org/164-963-306-935-896,Granted Patent,no,0,0,1,1,0,,,,0,0,,,,EXPIRED
146,US,A,US 3495380 A,197-864-075-970-988,1970-02-17,1970,US 3495380D A,1967-06-22,GB 886267 A,1967-02-24,PREVENTION OF GAS HYDRATE FORMATION IN GAS TRANSPORT PIPELINES,,SHELL OIL CO,REMAN GERRIT H;;ZUIDERWEG FREDERIK J;;GOLDMAN EDWIN C,,https://lens.org/197-864-075-970-988,Granted Patent,no,3,15,7,7,0,B01D53/26;;F17D3/145;;B01D53/26;;F17D3/145,B01D53/26;;E21B43/36,55/32,0,0,,,,EXPIRED
147,US,B1,US 7589663 B1,167-649-164-754-494,2009-09-15,2009,US 33567806 A,2006-01-20,US 33567806 A,2006-01-20,System and method for the measurement of the unambiguous roll angle of a projectile,"A system for the measurement of an angle of roll of a projectile is disclosed. The projectile has a casing with a rear end, a front end, and a side wall extending therebetween. The system includes a radar configured to transmit a polarized electromagnetic signal toward the projectile and a groove disposed on the side wall of the casing. The groove has a width, a depth, and a length, the width extending along a longitudinal axis of the projectile, the depth extending inwardly from an outer surface of the casing toward the longitudinal axis, and the length extending along the outside of the casing. The radar is further configured to receive a return signal from the projectile, wherein the return signal from the groove is modulated as a function of the angle of roll of the projectile. Amplitude or phase modulation of the return signal from the groove can be used to uniquely determine the roll angle of the projectile.",US ARMY,GOLDMAN GEOFFREY H;;COBURN WILLIAM O;;PIZZILLO THOMAS J,UNITED STATES OF AMERICA AS REPRESENTED BY THE SECRETARY OF THE ARMY THE (2006-01-19),https://lens.org/167-649-164-754-494,Granted Patent,yes,20,12,1,1,0,F41G7/305;;F42B10/06;;F42B15/00;;F42B15/01;;G01S7/025;;G01S13/883;;G01S7/025;;F42B15/00;;F41G7/305;;F42B15/01;;G01S13/883;;F42B10/06,G01S13/66;;F42B30/00;;G01C1/00;;G01S13/00,342/62;;342/5;;342/61;;342/175;;342/188;;342/195;;244/3.1;;244/3.11;;244/3.14;;244/3.15;;244/3.23,0,0,,,,INACTIVE
148,CA,A1,CA 2592525 A1,191-911-471-036-469,1999-01-11,1999,CA 2592525 A,1998-04-30,US 89367297 A;;CA 2236429 A,1997-07-11,MAINTENANCE AND WARRANTY CONTROL SYSTEM FOR AIRCRAFT,,PRATT & WHITNEY CANADA,GRAHAM PETER H;;NGUYEN PHUC LUONG;;GOLDMAN AVRUM;;MCCORMICK IAN,,https://lens.org/191-911-471-036-469,Patent Application,no,0,0,2,6,0,,G06Q10/00;;B64F5/40;;G07C5/08,,0,0,,,,EXPIRED
149,US,E,US RE032589 E,122-503-254-135-721,1988-02-02,1988,US 49857483 A,1983-05-26,US 49857483 A;;US 7067279 A,1979-08-29,"Mobile offshore, self-elevating (jack-up) unit leg/hull rigidification system","A system for making a ""jack-up"" rig with its jacked-up legs and hull rigid and fixed together by the use of ""rack chock"" elements which are designed to absorb the maximum axial chord loading on the legs and transmit them directly into the hull. The ""rack chock"" elements are configured preferrably with a number of matching teeth for exact, in-line engagement with the legs' rack teeth, and are capable of being adjusted for vertical alignment and horizontal positioning to mate with the rack teeth position. By a series of screw jacks and/or secondary chocks, the ""rack chock"" elements provide rigid contact with both the legs and the hull structure and eliminate the requirement for the jack pinions to take the load (as is done in the prior art) in either jacked-up or ocean-tow dispositions.",,Goldman; Jerome L.;;Michel; Walter H.;;Breeden; John O. 'R.,,https://lens.org/122-503-254-135-721,Amended Patent,yes,5,23,1,11,0,E02B17/021;;E02B17/06;;E02B17/0818;;E02B2017/006;;E02B2017/0082;;E02B17/0818;;E02B17/021;;E02B2017/006;;E02B17/06;;E02B2017/0082,E02B17/06,405198;;254 89R;;254 95,0,0,,,,PENDING
150,US,A1,US 2009/0131858 A1,143-810-407-933-700,2009-05-21,2009,US 97250208 A,2008-01-10,US 97250208 A;;US 87974407 P,2007-01-10,"Ultrafiltration Membrane, Device, Bioartificial Organ, And Related Methods","The present invention relates to ultrafiltration. In particular, the present invention provides nanoporous membranes having pores for generating in vitro and in vivo ultrafiltrate, devices and bioartificial organs utilizing such nanoporous membranes, and related methods (e.g., diagnostic methods, research methods, drug screening). The present invention further provides nanoporous membranes configured to avoid protein fouling with, for example, a polyethylene glycol surface coating.",UNIV MICHIGAN,FISSELL WILLIAM H;;ROY SHUVO;;FLEISCHMAN AARON;;GOLDMAN KENNETH G,THE CLEVELAND CLINIC FOUNDATION (2010-02-16);;THE REGENTS OF THE UNIVERSITY OF MICHIGAN (2009-03-26);;THE CLEVELAND CLINIC (2008-11-18),https://lens.org/143-810-407-933-700,Patent Application,yes,42,93,10,10,0,B01D61/18;;B01D61/20;;B01D67/0034;;B01D67/0062;;B01D67/0088;;B01D2313/243;;B01D2321/22;;B01D2325/028;;B01D61/145;;B01D61/18;;B01D61/20;;B01D67/0034;;B01D67/0062;;B01D67/0088;;B01D2313/243;;B01D2321/22;;B01D2325/028;;B01D61/145;;A61M1/1623;;A61M1/267;;A61B5/14532;;B01D2257/70;;G01N1/4077;;G01N2001/4088,A61M1/00;;A61B5/103;;A61B5/1455;;B01D61/14;;B01D61/18,604/57;;210/321.6;;210/321.69;;210/321.62;;210/321.65;;210/243;;210/650;;210/636;;216/44;;600/561;;600/341;;977/887;;977/780,0,0,,,,ACTIVE
151,US,A1,US 2016/0332119 A1,179-180-812-176-363,2016-11-17,2016,US 201615223941 A,2016-07-29,US 201615223941 A;;US 97250208 A;;US 87974407 P,2007-01-10,"ULTRAFILTRATION MEMBRANE DEVICE, BIOARTIFICIAL ORGAN, AND RELATED METHODS","The present invention relates to ultrafiltration. In particular, the present invention provides nanoporous membranes having pores for generating in vitro and in vivo ultrafiltrate, devices and bioartificial organs utilizing such nanoporous membranes, and related methods (e.g., diagnostic methods, research methods, drug screening). The present invention further provides nanoporous membranes configured to avoid protein fouling with, for example, a polyethylene glycol surface coating.",UNIV MICHIGAN REGENTS;;CLEVELAND CLINIC FOUND,FISSELL WILLIAM H;;ROY SHUVO;;FLEISCHMAN AARON;;GOLDMAN KENNETH G,THE CLEVELAND CLINIC FOUNDATION (2010-02-16);;THE REGENTS OF THE UNIVERSITY OF MICHIGAN (2009-03-26);;THE CLEVELAND CLINIC (2008-11-18),https://lens.org/179-180-812-176-363,Patent Application,yes,0,9,10,10,0,B01D61/18;;B01D61/20;;B01D67/0034;;B01D67/0062;;B01D67/0088;;B01D2313/243;;B01D2321/22;;B01D2325/028;;B01D61/145;;B01D61/18;;B01D61/20;;B01D67/0034;;B01D67/0062;;B01D67/0088;;B01D2313/243;;B01D2321/22;;B01D2325/028;;B01D61/145;;A61M1/1623;;A61M1/267;;A61B5/14532;;B01D2257/70;;G01N1/4077;;G01N2001/4088,B01D61/14;;A61B5/145;;A61M1/16;;A61M1/26;;B01D61/18;;B01D61/20;;B01D67/00;;G01N1/40,,0,0,,,,ACTIVE
152,WO,A2,WO 2011/091074 A2,193-710-328-208-805,2011-07-28,2011,US 2011/0021763 W,2011-01-19,US 201161431262 P;;US 29616010 P,2010-01-19,"NANOPOROUS MEMBRANES, DEVICES, AND METHODS FOR RESPIRATORY GAS EXCHANGE","One aspect of the present invention relates to a silicon nanoporoυs membrane for oxygenating blood. The nanoporous membrane includes a first major surface, a second major surface, and a plurality of pores extending between the first and second major surfaces. The first major surface is for contacting a gas. The second major surface is for contacting blood and is oppositely disposed from said first major surface. The first and second major surfaces define a membrane thickness. Each of the pores is defined by a length, a width, and a height. Each of the pores is separated by a uniform interpore distance.",CLEVELAND CLINIC FOUNDATION;;UNIV CASE WESTERN RESERVE;;FISSELL IV WILLIAM H;;BASKARAN HARIHARA;;ROY SHUVO;;GOLDMAN KEN,FISSELL IV WILLIAM H;;BASKARAN HARIHARA;;ROY SHUVO;;GOLDMAN KEN,,https://lens.org/193-710-328-208-805,Patent Application,yes,0,11,3,3,0,B01D61/00;;B01D63/08;;B01D67/0062;;B01D67/0093;;B01D71/02;;B01D2323/38;;B01D2325/02;;B01D2325/021;;B01D2325/028;;A61M1/1698;;B01D2323/38;;B01D2325/028;;B01D63/08;;B01D67/0062;;B01D61/00;;B01D67/0093;;B01D71/0215;;B01D2325/0214;;B01D2325/02831;;A61M1/1698,A61M1/34;;A61M1/22;;A61M16/00;;B01D61/00;;B01D71/00,,0,0,,,,PENDING
153,EP,A1,EP 2125171 A1,151-435-132-159-493,2009-12-02,2009,EP 08713705 A,2008-01-10,US 2008/0050773 W;;US 87974407 P,2007-01-10,"ULTRAFILTRATION MEMBRANE, DEVICE, BIOARTIFICIAL ORGAN, AND RELATED METHODS",,UNIV MICHIGAN,FISSEL WILLIAM H;;ROY SHUVO;;FLEISCHMAN AARON;;GOLDMAN KENNETH G,,https://lens.org/151-435-132-159-493,Patent Application,yes,0,0,10,10,0,B01D61/18;;B01D61/20;;B01D67/0034;;B01D67/0062;;B01D67/0088;;B01D2313/243;;B01D2321/22;;B01D2325/028;;B01D61/145;;B01D61/18;;B01D61/20;;B01D67/0034;;B01D67/0062;;B01D67/0088;;B01D2313/243;;B01D2321/22;;B01D2325/028;;B01D61/145;;A61M1/1623;;A61M1/267;;A61B5/14532;;B01D2257/70;;G01N1/4077;;G01N2001/4088,B01D61/20;;A61M37/00;;B01D61/14;;B01D61/18;;B01D67/00,,0,0,,,,DISCONTINUED
