188,US,B2,US 7902417 B2,062-114-865-319-075,2011-03-08,2011,US 48232406 A,2006-07-07,US 48232406 A;;US 69766705 P,2005-07-08,Dual catalyst system for alkane metathesis,"A method of converting at least one first alkane to a mixture of at least one low molecular weight alkane (optionally also including additional lower and/or higher molecular weight alkanes) and at least one high molecular weight alkane, comprising: reacting a first alkane in the presence of dual catalyst system comprising a first catalyst (i.e., a hydrogen transfer catalyst and preferably an iridium pincer complex catalyst) and a second catalyst (i.e., a metathesis catalyst) to produce a mixture of low and high molecular weight alkanes.",UNIV NORTH CAROLINA;;UNIV RUTGERS,GOLDMAN ALAN S;;BROOKHART MAURICE;;ROY AMY H;;AHUJA RITU;;HUANG ZHENG,UNIVERSITY OF NORTH CAROLINA AT CHAPEL HILL (2006-09-05);;RUTGERS THE STATE UNIVERSITY OF NEW JERSEY (2006-11-20),https://lens.org/062-114-865-319-075,Granted Patent,yes,21,15,11,11,0,B01J23/28;;B01J23/36;;B01J31/2265;;B01J31/2409;;B01J2208/025;;B01J2231/54;;B01J2231/60;;B01J2531/0244;;B01J2531/64;;B01J2531/827;;C07C6/10;;C07C2521/04;;C07C2521/08;;C07C2521/12;;C07C2523/28;;C07C2523/30;;C07C2523/36;;C07C2531/22;;C07C2531/24;;C10G2/32;;B01J35/19;;C07C6/10;;B01J23/28;;C07C2521/12;;C07C2521/08;;C07C2523/28;;C07C2531/24;;C10G2/32;;B01J2531/0244;;C07C2523/30;;B01J2231/60;;B01J31/2265;;B01J31/2409;;B01J2531/64;;B01J23/36;;B01J2531/827;;C07C2523/36;;C07C2531/22;;B01J2208/025;;B01J2231/54;;C07C2521/04;;B01J35/19,C07C5/327;;C07C6/08,585/656;;585/708,4,3,096-107-913-404-193;;006-391-646-958-779;;088-966-469-158-445,16614220;;10.1126/science.1123787;;10.1016/0021-9517(73)90270-4;;15755083;;10.1021/cr020018n,"Goldman AS et al. Catalytic alkane metathesis by tandem alkane dehydrogenation-olefin metathesis. Science (Apr. 14, 2006), vol. 312, pp. 257-261.;;International Search Report and Written Opinion for PCT/US06/26808; date of mailing Feb. 22, 2007.;;Burnett, Robert L. and Hughes, Thomas R., Mechanism and poisoning of the molecular redistribution reaction of alkanes with a dual-functional catalyst system, Journal of Catalysis 31, 55-64 (1973).;;Wasilke J-C et al. Concurrent tandem catalysis. Chemical Reviews 2005; 105: 1001-1020.",INACTIVE
189,DE,D1,DE 602004016640 D1,139-810-213-640-569,2008-10-30,2008,DE 602004016640 T,2004-04-13,GB 0308586 A;;EP 2004003864 W,2003-04-14,MEHRDIMENSIONALE NMR-SPEKTROSKOPIE EINER HYPERPOLARISIERTEN PROBE,"The present invention relates to methods of performing Nuclear Magnetic Resonance (NMR) spectroscopy adapted for a hyperpolarized sample. The methods comprise the steps of hyperpolarizing a sample using DNP, wherein at least a portion of the NMR active nuclei receives hyperpolarization; performing NMR spectroscopy on the sample with the use of sequences of rf-pulses, wherein the pulse sequences comprises at least two rf-pulses, either on the same nuclei or on different nuclei, and wherein the pulse sequence is adapted for a hyperpolarized sample; and analyzing at least two of the NMR spectra to obtain a characterization of the sample, or to obtain an interim result to be used in the NMR spectroscopy step.",GE HEALTHCARE AS,SERVIN ROLF;;ARDENKJAER-LARSEN JAN H;;JOHANNESSON HAUKUR;;GOLDMAN MAURICE;;WOLBER JAN,,https://lens.org/139-810-213-640-569,Granted Patent,no,0,0,10,10,0,G01R33/4633;;G01R33/62;;G01R33/4633;;G01R33/62,G01R33/46;;G01R33/62,,0,0,,,,ACTIVE
190,DE,B,DE 1260446 B,120-599-364-663-441,1968-02-08,1968,DE E0024157 A,1963-01-11,US 17571062 A,1962-02-26,Adiabatisches Fraktionierverfahren zur Gewinnung von praktisch reinem Wasserstoff aus gasfoermigen Gemischen desselben mit Kohlenwasserstoffen,,EXXON RESEARCH ENGINEERING CO,KANT FRED H;;SKARSTROM CHARLES W;;READ CHESTER L;;GOLDMAN IRA B,,https://lens.org/120-599-364-663-441,Patent Application,no,4,0,5,6,0,B01D53/047;;B01D2253/102;;B01D2253/106;;B01D2253/304;;B01D2253/308;;B01D2256/16;;B01D2257/702;;B01D2259/40062;;B01D2259/402;;B01D2259/4145;;C01B3/56;;C01B2203/043;;C01B2203/048;;C07C7/12;;C10G53/08;;C01B32/306;;C01B3/56;;C01B2203/048;;B01D2259/40062;;B01D2253/106;;B01D2259/402;;C07C7/12;;B01D53/047;;C10G53/08;;B01D2253/304;;B01D2253/102;;C01B2203/043;;B01D2259/4145;;B01D2256/16;;B01D2253/308;;B01D2257/702;;C01B32/306,B01D53/047;;C01B3/56;;C01B31/08;;C07C7/12;;C10G53/08,,0,0,,,,DISCONTINUED
191,JP,A,JP 2001121499 A,182-588-126-709-251,2001-05-08,2001,JP 2000268606 A,2000-09-05,US 39571199 A,1999-09-14,MICROMACHINE STRUCTURE AND METHOD OF MANUFACTURING THE SAME,"PROBLEM TO BE SOLVED: To provide a capacitive acceleration sensor made into a micromachine capable of detecting a lateral direction. SOLUTION: The capacitive acceleration sensor which straightens resistance for stiction of detection fingers forming capacitive elements and is made into a micromachine capable of detecting in a lateral direction includes fixed detection fingers (316, 318, 516, 518, 536, 538) formed like beams. Each finger (316, 318, 516, 518, 536, 538) is supported by a plurality of supporting elements or fixing bodies (320, 322, 330, 332, 334, 336, 522, 530). Finger elements (312, 512) added to inertial mass (304, 502) can be fastened with each other at the tips in the same way as the roots. As a result, also hardness of lateral directions and vertical directions of the fingers (316, 318, 516, 518, 536, 538) moving simultaneously is increased.",MOTOROLA INC,KENNETH G GOLDMAN;;HAMMOND JONATHAN H;;GARRY J OBRIAN;;JOSE L TRES,,https://lens.org/182-588-126-709-251,Patent Application,no,0,3,3,3,0,B81B3/0008;;G01P15/00;;G01P15/125;;G01P2015/0814,G01P15/00;;B81B3/00;;G01P15/125;;H01L29/84,,0,0,,,,PENDING
192,US,A,US 3237379 A,166-280-377-868-686,1966-03-01,1966,US 17571062 A,1962-02-26,US 17571062 A,1962-02-26,Adsorption systems in heatless fractionation processes,,EXXON RESEARCH ENGINEERING CO,KANT FRED H;;GOLDMAN IRA B;;SKARSTROM CHARLES W;;READ CHESTER L,,https://lens.org/166-280-377-868-686,Granted Patent,no,17,35,5,6,0,B01D53/047;;B01D2253/102;;B01D2253/106;;B01D2253/304;;B01D2253/308;;B01D2256/16;;B01D2257/702;;B01D2259/40062;;B01D2259/402;;B01D2259/4145;;C01B3/56;;C01B2203/043;;C01B2203/048;;C07C7/12;;C10G53/08;;C01B32/306;;C01B3/56;;C01B2203/048;;B01D2259/40062;;B01D2253/106;;B01D2259/402;;C07C7/12;;B01D53/047;;C10G53/08;;B01D2253/304;;B01D2253/102;;C01B2203/043;;B01D2259/4145;;B01D2256/16;;B01D2253/308;;B01D2257/702;;C01B32/306,B01D53/047;;C01B3/56;;C01B31/08;;C07C7/12;;C10G53/08,,0,0,,,,EXPIRED
193,US,A1,US 2011/0191898 A1,010-542-669-991-504,2011-08-04,2011,US 99786009 A,2009-06-30,US 99786009 A;;US 7704308 P;;US 2009/0049233 W,2008-06-30,Compositions and Methods for Enhanced Amino Acid Levels in Plants,"Threonine is an essential amino acid for humans and in the animal feed industry where its levels in feed rations can significantly impact the cost of production of important meat sources, such as swine and poultry. Threonine as well as essential amino acids lysine and methionine are all synthesized via the aspartate family pathway. Aspartate kinase (AK) is the first enzyme in the pathway, and catalyzes the ATP-dependent phosphorylation of aspartate to form β-aspartyl phosphate. AK constitutes the main regulatory step controlling the metabolic flux through the pathway, and is subject to end product inhibition by Lys and/or Thr. The current invention provides a method to produce a transgenic high free threonine soybean via the overexpression of feed-back-resistant AK enzymes in developing soybean plants and seeds. These modifications provide a method to enhance both plant nitrogen metabolism and crop growth performance.",MONSANTO TECHNOLOGY LLC,CROWLEY JAMES H;;GOLDMAN BARRY S;;HUANG JINTAI;;QI QUNGANG;;RAPP WILLAM D,MONSANTO TECHNOLOGY LLC (2011-03-14),https://lens.org/010-542-669-991-504,Patent Application,yes,5,4,8,8,23,C12N9/1217;;C12N9/1217;;C12N15/8251;;C12N15/8251;;C12N15/8254;;C12N15/8254,C12N15/87;;A01H5/00;;C07H21/04;;C12N5/10;;C12N9/12,800/278;;536/23.2;;435/194;;435/419;;435/415;;435/412;;800/298;;435/468,6,5,104-307-102-263-002;;078-032-065-951-066;;087-675-382-846-61X;;043-124-279-834-066;;012-639-238-823-780,16232547;;10.1016/s1389-1723(99)80146-7;;10.1016/s0378-1097(99)00075-0;;10.1111/j.1574-6968.1999.tb13504.x;;10220897;;16905770;;10.1074/jbc.m605886200;;10.1007/bf02341030;;24197375;;10.1016/j.bbrc.2003.10.042;;14623312,"Kobashi et al. (Kinetic and Mutation Analysis of Aspartate Kinase from Thermus flavus, 87 Journal of Bioscience and Bioengineering No. 6, 739-745 (1999)).;;Kikuchi et al. (Mutational analysis of the feedback sites of lysine-sensitive aspartokinase of Escherichia coli, 173 FEMS Microbiology Letters, 211-215 at 213-214 (1999)).;;Kotaka et al. (Structures of R- and T-state Escherichia coli Aspartokinase III: mechanisms of the allosteric transition and inhibition by lysine, 281 JBC No. 42, 31544-31552 at 31548-49 (2006)).;;Dotson et al. (Lysine-insensitive aspartate kinase in two threonine-overproducing mutants of maize, 182 Planta, 546-552 (1990)).;;Bareich et al. (Functionally important amino acids in Saccharomyces cerevisiae aspartate kinase, 311 Bioch and Biophys Res Comm, 597-603 (2003)).;;BLAST of SEQ ID NO: 7 obtained 12/11/2014.",ACTIVE
194,US,S,US D0638130 S,097-660-574-738-892,2011-05-17,2011,US 36944110 F,2010-09-08,US 36944110 F,2010-09-08,Neurostimulation lead,,ADVANCED NEUROMODULATION SYS,ERICKSON JOHN H;;BUCKELS JAZZMYNE;;FELER CLAUDIO A;;CUSHING TOMMY;;GOLDMAN STEPHEN L,ADVANCED NEUROMODULATION SYSTEMS INC. D/B/A ST. JUDE MEDICAL NEUROMODULATION DIVISION (2010-08-03);;ADVANCED NEUROMODULATION SYSTEMS INC (2005-07-28),https://lens.org/097-660-574-738-892,Design Right,no,0,2,1,1,0,,,2401;;D24/187;;D24/155,0,0,,,,ACTIVE
195,US,B2,US 9090882 B2,109-986-756-081-813,2015-07-28,2015,US 99786009 A,2009-06-30,US 99786009 A;;US 7704308 P;;US 2009/0049233 W,2008-06-30,Compositions and methods for enhanced amino acid levels in plants conferred by lysine and/or threonine feedback insensitive aspartate kinase proteins,"Threonine is an essential amino acid for humans and in the animal feed industry where its levels in feed rations can significantly impact the cost of production of important meat sources, such as swine and poultry. Threonine as well as essential amino acids lysine and methionine are all synthesized via the aspartate family pathway. Aspartate kinase (AK) is the first enzyme in the pathway, and catalyzes the ATP-dependent phosphorylation of aspartate to form β-aspartyl phosphate. AK constitutes the main regulatory step controlling the metabolic flux through the pathway, and is subject to end product inhibition by Lys and/or Thr. The current invention provides a method to produce a transgenic high free threonine soybean via the overexpression of feedback-resistant AK enzymes in developing soybean plants and seeds. These modifications provide a method to enhance both plant nitrogen metabolism and crop growth performance.",CROWLEY JAMES H;;GOLDMAN BARRY S;;HUANG JINTAI;;QI QUNGANG;;RAPP WILLIAM D;;MONSANTO TECHNOLOGY LLC,CROWLEY JAMES H;;GOLDMAN BARRY S;;HUANG JINTAI;;QI QUNGANG;;RAPP WILLIAM D,MONSANTO TECHNOLOGY LLC (2011-03-14),https://lens.org/109-986-756-081-813,Granted Patent,yes,12,2,8,8,23,C12N9/1217;;C12N9/1217;;C12N15/8251;;C12N15/8251;;C12N15/8254;;C12N15/8254,C12N9/12;;C12N15/82,,9,7,104-307-102-263-002;;078-032-065-951-066;;087-675-382-846-61X;;043-124-279-834-066;;012-639-238-823-780;;013-171-628-910-842;;052-550-444-990-504,16232547;;10.1016/s1389-1723(99)80146-7;;10.1016/s0378-1097(99)00075-0;;10.1111/j.1574-6968.1999.tb13504.x;;10220897;;16905770;;10.1074/jbc.m605886200;;10.1007/bf02341030;;24197375;;10.1016/j.bbrc.2003.10.042;;14623312;;10.1111/j.1365-313x.1993.00721.x;;8816791;;pmc38375;;10.1073/pnas.93.19.10280,"Kobashi et al. (Kinetic and Mutation Analysis of Aspartate Kinase from Thermus flavus, 87 Journal of Bioscience and Bioengineering No. 6, 739-745 (1999)).;;Kikuchi et al. (Mutational analysis of the feedback sites of lysine-sensitive aspartokinase of Escherichia coli, 173 FEMS Microbiology Letters, 211-215 at 213-214 (1999)).;;Kotaka et al. (Structures of R- and T-state Escherichia coli Aspartokinase III: mechanisms of the allosteric transition and inhibition by lysine, 281 JBC No. 42, 31544-31552 at 31548-49 (2006)).;;Dotson et al. (Lysine-insensitive aspartate kinase in two threonine-overproducing mutants of maize, 182 Planta, 546-552 (1990)).;;Bareich et al. (Functionally important amino acids in Saccharomyces cerevisiae aspartate kinase, 311 Bioch and Biophys Res Comm, 597-603 (2003)).;;BLAST of SEQ ID No. 7 obtained Dec. 11, 2014.;;Karchi et al., ""Seed specific expression of a bacterial desensitized aspartate kinase increases the production of seed threonine and methionine in transgenic tobacco,"" Plant J., 3:721-727, 1993.;;Rigden et al., ""Plant virus DNA replication processes in agrobacterium: insight into the origins of geminiviruses,"" Proc. Natl. Acad. Sci. USA, 93:10280-10284, 1996.;;English translation of office action issued Apr. 23, 2012, in Chinese Application No. 200980125099.5.",ACTIVE
196,WO,A3,WO 2010/002876 A3,068-518-482-927-865,2010-03-11,2010,US 2009/0049233 W,2009-06-30,US 7704308 P,2008-06-30,COMPOSITIONS AND METHODS FOR ENHANCED AMINO ACID LEVELS IN PLANTS,"Threonine is an essential amino acid for humans and in the animal feed industry where its levels in feed rations can significantly impact the cost of production of important meat sources, such as swine and poultry. Threonine as well as essential amino acids lysine and methionine are all synthesized via the aspartate family pathway. Aspartate kinase (AK) is the first enzyme in the pathway, and catalyzes the ATP-dependent phosphorylation of aspartate to form β-aspartyl phosphate. AK constitutes the main regulatory step controlling the metabolic flux through the pathway, and is subject to end product inhibition by Lys and/or Thr. The current invention provides a method to produce a transgenic high free threonine soybean via the overexpression of feedback-resistant AK enzymes in developing soybean plants and seeds. These modifications provide a method to enhance both plant nitrogen metabolism and crop growth performance.",MONSANTO TECHNOLOGY LLC;;CROWLEY JAMES H;;GOLDMAN BARRY S;;HUANG JINTAI;;QI QUNGANG;;RAPP WILLIAM D,CROWLEY JAMES H;;GOLDMAN BARRY S;;HUANG JINTAI;;QI QUNGANG;;RAPP WILLIAM D,,https://lens.org/068-518-482-927-865,Search Report,yes,5,0,8,8,23,C12N9/1217;;C12N9/1217;;C12N15/8251;;C12N15/8251;;C12N15/8254;;C12N15/8254,C12N15/54;;C12N15/82,,1,1,013-171-628-910-842,10.1111/j.1365-313x.1993.00721.x,"KARCHI H ET AL: ""SEED-SPECIFIC EXPRESSION OF A BACTERIAL DESENSITIZED ASPARTATE KINASE INCRASES THE PRODUCTION OF SEED THREONINE AND METHIONINE IN TRANSGENIC TOBACCO"", PLANT JOURNAL, BLACKWELL SCIENTIFIC PUBLICATIONS, OXFORD, GB, vol. 3, no. 5, 1 January 1993 (1993-01-01), pages 721 - 727, XP002015695, ISSN: 0960-7412",PENDING
197,US,A,US 4800442 A,199-721-472-116-106,1989-01-24,1989,US 5115487 A,1987-05-18,US 5115487 A;;US 76593885 A,1985-08-15,Apparatus for generating an image from a digital video signal,"An apparatus for generating a high quality image from a digital video signal includes a system for gamma correcting the digital video signal with a digital look up table and for converting the resultant digital signal to an analog video signal. Another circuit generates a triangular wave reference pattern signal and a comparator compares the analog video signal with the triangular wave reference pattern signal to form a pulse-width-modulated signal. A raster scanning print engine producing, for example, a laser beam, scans over a recording medium in accordance with the pulse-width-modulated signal, thereby forming an image of high quality on the recording medium of a print engine. This apparatus can also be used with an analog video signal by first converting the analog video signal to a digital video signal with an analog to digital converter.",CANON KK,RISEMAN JOHN H;;SMITH JOHN J;;D ENTREMONT ALICE M;;GOLDMAN CRAIG E,,https://lens.org/199-721-472-116-106,Granted Patent,yes,19,76,2,53,0,H04N1/4056;;H04N1/4056,H04N1/405,358/280;;358/283;;358/298,4,1,024-836-713-593-389,10.1126/science.224.4644.44;;17783509,"Declaration Submitted Pursuant to 37 C.F.R. 1.56 and M.P.E.P. 609 by Applicants.;;Science, vol. 224, p. 44;;Press release of Demonics Ltd., Feb. 24, 1984.;;Four (4) pages prepared on Demonics ETP 1 Electronic Technical Publishing System.",EXPIRED
198,BR,A2,BR PI0914933 A2,108-504-808-195-943,2015-08-11,2015,BR PI0914933 A,2009-06-30,US 7704308 P;;US 2009/0049233 W,2008-06-30,Composições e métodos para níveis de aminoácido aumentados em plantas,,MONSANTO TECHNOLOGY LLC,CROWLEY JAMES H;;GOLDMAN BARRY S;;HUANG JINTAI;;QI QUNGANG;;RAPP WILLIAM D,,https://lens.org/108-504-808-195-943,Patent Application,no,0,0,8,8,0,C12N9/1217;;C12N9/1217;;C12N15/8251;;C12N15/8251;;C12N15/8254;;C12N15/8254,C12N15/54;;C12N15/82,,0,0,,,,ACTIVE
199,CN,B,CN 102076856 B,174-226-576-999-593,2014-12-31,2014,CN 200980125099 A,2009-06-30,US 2009/0049233 W;;US 7704308 P,2008-06-30,Compositions and methods for enhancing amino acid levels in plants,,MONSANTO TECHNOLOGY LLC,CROWLEY JAMES H;;GOLDMAN BARRY S;;HUANG JINTAI;;QI QUNGANG;;RAPP WILLIAM D,,https://lens.org/174-226-576-999-593,Granted Patent,no,0,0,8,8,0,C12N9/1217;;C12N9/1217;;C12N15/8251;;C12N15/8251;;C12N15/8254;;C12N15/8254,C12N15/54;;C12N15/82,,0,0,,,,ACTIVE
200,CN,A,CN 102076856 A,118-641-453-732-757,2011-05-25,2011,CN 200980125099 A,2009-06-30,US 2009/0049233 W;;US 7704308 P,2008-06-30,Compositions and methods for enhancing amino acid levels in plants,"Threonine is an essential amino acid for humans and in the animal feed industry where its levels in feed rations can significantly impact the cost of production of important meat sources, such as swine and poultry. Threonine as well as essential amino acids lysine and methionine are all synthesized via the aspartate family pathway. Aspartate kinase (AK) is the first enzyme in the pathway, and catalyzes the ATP-dependent phosphorylation of aspartate to form ss-aspartyl phosphate. AK constitutes the main regulatory step controlling the metabolic flux through the pathway, and is subject to end product inhibition by Lys and/or Thr. The current invention provides a method to produce a transgenic high free threonine soybean via the overexpression of feedback-resistant AK enzymes in developing soybean plants and seeds. These modifications provide a method to enhance both plant nitrogen metabolism and crop growth performance.",MONSANTO TECHNOLOGY LLC,CROWLEY JAMES H;;GOLDMAN BARRY S;;JINTAI HUANG;;QUNGANG QI;;RAPP WILLIAM D,,https://lens.org/118-641-453-732-757,Patent Application,no,0,5,8,8,0,C12N9/1217;;C12N9/1217;;C12N15/8251;;C12N15/8251;;C12N15/8254;;C12N15/8254,C12N15/54;;C12N15/82,,0,0,,,,ACTIVE
201,CA,C,CA 1313703 C,095-585-618-249-231,1993-02-16,1993,CA 515897 A,1986-08-13,US 76593885 A,1985-08-15,APPARATUS FOR GENERATING AN IMAGE FROM A DIGITAL VIDEO SIGNAL,"An apparatus for generating a high quality image from à dlgital viaeo signal incluàes a system for gamma cc,rrecting the digital video signal with a digital look up talble ana for converting the resultant digital signal to an analog viàeo signal. Another circuit generates a triangular wave reierence pattern signal and a comparator compares the analog video signal with the triangular wave reference pattern signal to form a pulse-width-modulated signal. A raster scanning print engine producing, for example, a laser beam, scans over a recording medium in accordance with the pulse-width-modulated signal, thereby forming an image of high quality on the recording medium of a print engine. This apparatus can also be used with an analog video signal by first converting the analog video signal to a digital video signal with an analog to digital converter. 0621%",CANON KK,RISEMAN JOHN H;;SMITH JOHN J;;D ENTREMONT ALICE M;;GOLDMAN CRAIG E,,https://lens.org/095-585-618-249-231,Granted Patent,no,0,0,47,53,0,H04N1/407;;H04N1/4056,G06T5/00;;H04N1/403;;H04N1/405;;H04N1/407;;H04N5/76,D23500009    M,0,0,,,,EXPIRED
202,CA,C,CA 1326286 C,018-350-647-463-879,1994-01-18,1994,CA 616427 A,1992-06-26,CA 616427 A;;CA 515897 A;;US 76593885 A,1985-08-15,IMAGE PROCESSING APPARATUS,"An apparatus for generating a high quality image from a digital video signal includes a system for gamma correcting the digital video signal with a digital look up table and for converting the resultant digital signal to an analog video signal. Another circuit generates a triangular wave reference pattern signal and a comparator compares the analog video signal with the triangular wave reference pattern signal to form a pulse-width-modulated signal. A raster scanning print engine producing, for example, a laser beam, scans over a recording medium in accordance with the pulse-width-modulated signal, thereby forming an image of high quality on the recording medium of a print engine. This apparatus can also be used with an analog video signal by first converting the analog video signal to a digital video signal with an analog to digital converter.",CANON KK,RISEMAN JOHN H;;SMITH JOHN J;;D ENTREMONT ALICE M;;GOLDMAN CRAIG E,,https://lens.org/018-350-647-463-879,Granted Patent,no,0,0,3,53,0,,H04N1/40,,0,0,,,,EXPIRED
203,CA,C,CA 1325267 C,064-348-201-009-693,1993-12-14,1993,CA 616429 A,1992-06-26,CA 616429 A;;CA 515897 A;;US 76593885 A,1985-08-15,IMAGE PROCESSING APPARATUS,"An apparatus for generating a high quality image from a digital video signal includes a system for gamma correcting the digital video signal with a digital look up table and for converting the resultant digital signal to an analog video signal. Another circuit generates a triangular wave reference pattern signal and a comparator compares the analog video signal with the triangular wave reference pattern signal to form a pulse-width-modulated signal. A raster scanning print engine producing, for example, a laser beam, scans over a recording medium in accordance with the pulse-width-modulated signal, thereby forming an image of high quality on the recording medium of a print engine. This apparatus can also be used with an analog video signal by first converting the analog video signal to a digital video signal with an analog to digital converter.",CANON KK,RISEMAN JOHN H;;SMITH JOHN J;;D ENTREMONT ALICE M;;GOLDMAN CRAIG E,,https://lens.org/064-348-201-009-693,Granted Patent,no,0,0,3,53,0,,H04N1/40,,0,0,,,,EXPIRED
204,CA,C,CA 1325844 C,096-342-327-801-495,1994-01-04,1994,CA 616428 A,1992-06-26,CA 616428 A;;CA 515897 A;;US 76593885 A,1985-08-15,IMAGE PROCESSING APPARATUS,"An apparatus for generating a high quality image from a digital video signal includes a system for gamma correcting the digital video signal with a digital look up table and for converting the resultant digital signal to an analog video signal. Another circuit generates a triangular wave reference pattern signal and a comparator compares the analog video signal with the triangular wave reference pattern signal to form a pulse-width-modulated signal. A raster scanning print engine producing, for example, a laser beam, scans over a recording medium in accordance with the pulse-width-modulated signal, thereby forming an image of high quality on the recording medium of a print engine. This apparatus can also be used with an analog video signal by first converting the analog video signal to a digital video signal with an analog to digital converter.",CANON KK,RISEMAN JOHN H;;SMITH JOHN J;;D ENTREMONT ALICE M;;GOLDMAN CRAIG E,,https://lens.org/096-342-327-801-495,Granted Patent,no,0,0,3,53,0,,H04N1/40,D235011      M,0,0,,,,EXPIRED
205,BR,B1,BR PI0914933 B1,109-140-349-113-110,2018-09-25,2018,BR PI0914933 A,2009-06-30,US 7704308 P;;US 2009/0049233 W,2008-06-30,"polipeptídeo exibindo atividade de aspartato quinase (ak) que não é sujeito a inibição por produto final, polinucleotídeo codificando o mesmo, construto de dna recombinante, microrganismo transformado, produto alimentício, farelo ou farinha, bem como métodos de transformação de uma célula de planta, de produção de uma planta transformada e de aumento do teor de aminoácido livre total de uma planta.",,MONSANTO TECHNOLOGY LLC,BARRY S GOLDMAN;;JAMES H CROWLEY;;JINTAI HUANG;;QUNGANG QI;;WILLIAM D RAPP,,https://lens.org/109-140-349-113-110,Granted Patent,no,0,0,8,8,0,C12N9/1217;;C12N9/1217;;C12N15/8251;;C12N15/8251;;C12N15/8254;;C12N15/8254,C12N15/54;;C12N15/82,,0,0,,,,ACTIVE
