"#",Jurisdiction,Kind,Display Key,Lens ID,Publication Date,Publication Year,Application Number,Application Date,Priority Numbers,Earliest Priority Date,Title,Abstract,Applicants,Inventors,Owners,URL,Document Type,Has Full Text,Cites Patent Count,Cited by Patent Count,Simple Family Size,Extended Family Size,Sequence Count,CPC Classifications,IPCR Classifications,US Classifications,NPL Citation Count,NPL Resolved Citation Count,NPL Resolved Lens ID(s),NPL Resolved External ID(s),NPL Citations,Legal Status
1,BR,A,BR 7902032 A,043-821-329-059-082,1979-11-27,1979,BR 7902032 A,1979-04-03,US 89389078 A,1978-04-06,VALVULA APERFEICOADA,,ALLIS CHALMERS,GOLDMAN H,,https://lens.org/043-821-329-059-082,Patent Application,no,0,0,1,1,0,,F16K25/00,,0,0,,,,DISCONTINUED
2,WO,A1,WO 1981/000270 A1,079-940-714-563-662,1981-02-05,1981,US 7900516 W,1979-07-13,US 7900516 W,1979-07-13,VARIABLE CONTROL FOR TOILET FLUSH TANKS,"For use in a toilet flush tank having a flush discharge opening at the bottom which is normally closed by a discharge valve (26) having an air chamber (26a) therein, an attachment including an air passage (35) for venting the air chamber and a water level responsive valve means (36, 37, 37"", 49, 49"") normally closing the air passage when the water within the tank is above a predetermined height and venting the air chamber when the water in the tank falls to a predetermined level, so that when the discharge valve is lifted and buoyed by the air within the chamber thereof during the discharge of water from the tank, the discharge valve will be permitted to reseat as soon as the water level responsive valve means vents the air chamber.",GOLDMAN H,GOLDMAN H,,https://lens.org/079-940-714-563-662,Patent Application,yes,19,3,2,2,0,E03D1/144;;F16K31/28,E03D1/14;;F16K31/28,E1C C21G2N        C21G2,0,0,,,,PENDING
3,US,A,US 981636 A,015-937-990-789-191,1911-01-17,1911,US 1910/0560265 A,1910-05-09,US 1910/0560265 A,1910-05-09,SANITARY FIXTURE FOR WATER-CLOSETS.,,GOLDMAN DAVID;;GOLDMAN HIRSCH H,GOLDMAN DAVID;;GOLDMAN HIRSCH H,,https://lens.org/015-937-990-789-191,Granted Patent,no,0,2,1,1,0,E03D9/032;;E03D9/032,,,0,0,,,,EXPIRED
4,US,A,US 984272 A,125-206-779-541-739,1911-02-14,1911,US 1910/0560264 A,1910-05-09,US 1910/0560264 A,1910-05-09,DISINFECTING GARBAGE-PAIL.,,GOLDMAN DAVID;;GOLDMAN HIRSCH H,GOLDMAN DAVID;;GOLDMAN HIRSCH H,,https://lens.org/125-206-779-541-739,Granted Patent,no,0,0,1,1,0,B65F7/00;;B65F7/00,,,0,0,,,,EXPIRED
5,US,A,US 923165 A,127-894-977-026-249,1909-06-01,1909,US 1909/0474971 A,1909-01-29,US 1909/0474971 A,1909-01-29,DISINFECTING MONEY-DRAWER.,,GOLDMAN DAVID;;GOLDMAN HIRSCH H,GOLDMAN DAVID;;GOLDMAN HIRSCH H,,https://lens.org/127-894-977-026-249,Granted Patent,no,0,9,1,1,0,B65D81/266;;B65D81/266,,,0,0,,,,EXPIRED
6,US,S,US D0257864 S,034-026-890-537-052,1981-01-13,1981,US 84014277 F,1977-10-07,US 84014277 F,1977-10-07,Combined spinning and whistling toy,,GOLDMAN ALAN H,GOLDMAN ALAN H,,https://lens.org/034-026-890-537-052,Design Right,yes,6,1,1,1,0,,,D21/98;;D2101,0,0,,,,EXPIRED
7,WO,A3,WO 2007/081619 A3,068-986-403-943-806,2008-01-17,2008,US 2006/0061582 W,2006-12-04,US 74219305 P,2005-12-02,READILY DEPLOYED AND STOWED STORAGE DEVICES FOR TEMPORARY HOLDING AND TRANSPORTING PERSONAL ITEMS,"Disclosed are small, compact devices that provide readily deployed storage for small personal items, and they can also readily be returned to their stowed configuration. This toggling between deployed and stowed can be accomplished without a required change to the connection of any such device to another object, such as a travel case. The devices provide specific benefit to people going through an airport or building security checkpoint at which it is a requirement that pocket items such as cell phones, keys, and coins must be removed from one's pockets for assessment by a scanning apparatus.",GOLDMAN IRA H,GOLDMAN IRA H,,https://lens.org/068-986-403-943-806,Search Report,yes,2,0,3,3,0,A45C7/0095;;A45C11/26;;A45C7/0095;;A45C11/26,B65D3/00;;A45C13/40;;B60R7/00;;B60R9/00;;B65D33/14,,0,0,,,,PENDING
8,CA,A,CA 266099 A,118-562-059-187-775,1926-11-23,1926,CA 266099D A,,CA 266099T A,,MANICURING INSTRUMENT,,HENRY L HUGHES CO,GOLDMAN RALPH H,,https://lens.org/118-562-059-187-775,Granted Patent,no,0,0,1,1,0,,,,0,0,,,,EXPIRED
9,WO,A2,WO 2005/018981 A2,148-235-023-264-249,2005-03-03,2005,US 2004/0027031 W,2004-08-18,US 49630303 P,2003-08-19,"METHODS AND DEVICES FOR ENHANCING HEALTH, SAFETY, AND COMFORT ON CONVEYANCES IN RELATION TO RECLINING SEATS","A method and device for enabling an aft passenger on a conveyance to establish protection from a forward seatback (103), irrespective of a conventional effort by a forward passenger to cause reclining of the forward seatback. A device is disclosed that includes a main body and additional elements appended to the main body. The device is adapted for access by the aft passenger to activate it in order to inhibit such reclining. In one preferred embodiment, the device (FIG. 13; 10) is adapted for use on an airplane to engage the forward seatback (103) and an arm (151) of a tray table assembly (150) designated for use by the aft passenger. In another preferred embodiment, the device comprises a recline inhibiter component connected to a depressible safety input control (FIG 20; 412) which is integrated with a rearward portion (104) of a seat (100x) for access by the aft passenger.",GOLDMAN IRA H;;RIGHT BRAIN LTD LLC,GOLDMAN IRA H,,https://lens.org/148-235-023-264-249,Patent Application,yes,0,0,4,4,0,B60N2/22;;B60N3/004;;B64D11/064;;B64D11/0638;;B64D11/0638;;B60N3/004;;B64D11/064;;B60N2/22,A47B83/02;;B60N2/90;;B60N/;;B60N2/22;;B60N3/00;;B64D11/06,,0,0,,,,PENDING
10,US,A,US 2174226 A,181-245-587-683-030,1939-09-26,1939,US 16388737 A,1937-09-15,US 16388737 A,1937-09-15,Sound recording apparatus,,GOLDMAN ISIDORE H,GOLDMAN ISIDORE H,,https://lens.org/181-245-587-683-030,Granted Patent,no,0,1,1,1,0,G11B3/36;;G11B3/36,G11B3/36,,0,0,,,,EXPIRED
11,US,A,US 1469081 A,007-200-138-679-898,1923-09-25,1923,US 56281722 A,1922-05-22,US 56281722 A,1922-05-22,Sample card,,GOLDMAN CHARLES H,GOLDMAN CHARLES H,,https://lens.org/007-200-138-679-898,Granted Patent,no,0,1,1,1,0,G09F5/042;;G09F5/042,G09F5/04,,0,0,,,,EXPIRED
12,US,A,US 2153751 A,118-713-233-734-873,1939-04-11,1939,US 18694538 A,1938-01-26,US 18694538 A,1938-01-26,Sound recording apparatus,,GOLDMAN ISIDORE H,GOLDMAN ISIDORE H,,https://lens.org/118-713-233-734-873,Granted Patent,no,0,0,1,1,0,G11B3/36;;G11B3/36,G11B3/36,,0,0,,,,EXPIRED
13,US,A,US 2841204 A,145-070-697-572-369,1958-07-01,1958,US 33537653 A,1953-02-05,US 33537653 A,1953-02-05,Method of manufacturing a non-woven fibrous sheet,,GOLDMAN JOSHUA H,GOLDMAN JOSHUA H,,https://lens.org/145-070-697-572-369,Granted Patent,no,20,1,1,1,0,D04H1/00;;D04H1/00,D04H1/00,,0,0,,,,EXPIRED
14,US,A,US 4078174 A,047-279-557-509-696,1978-03-07,1978,US 70946276 A,1976-07-28,US 54958275 A,1975-02-13,Neutron borehole logging correction technique,"In accordance with an illustrative embodiment of the present invention, a method and apparatus is disclosed for logging earth formations traversed by a borehole in which an earth formation is irradiated with neutrons and gamma radiation produced thereby in the formation and in the borehole is detected. A sleeve or shield for capturing neutrons from the borehole and producing gamma radiation characteristic of that capture is provided to give an indication of the contribution of borehole capture events to the total detected gamma radiation. It is then possible to correct from those borehole effects the total detected gamma radiation and any earth formation parameters determined therefrom.",SCHLUMBERGER TECHNOLOGY CORP,GOLDMAN LEONARD H,,https://lens.org/047-279-557-509-696,Granted Patent,yes,5,35,5,5,0,G01V5/102;;G01V5/102;;G01V5/101;;G01V5/101,G01V5/10,250/270,0,0,,,,EXPIRED
15,US,A,US 2429314 A,166-228-744-693-622,1947-10-21,1947,US 45064042 A,1942-07-11,US 45064042 A,1942-07-11,Apparatus for producing saturated fibrous bodies,,FIBRE PRODUCTS LAB INC,GOLDMAN JOSHUA H,,https://lens.org/166-228-744-693-622,Granted Patent,no,23,9,1,1,0,D06B3/10;;D06B2700/27;;D21J1/00;;D06B3/10;;D06B2700/27;;D21J1/00,D06B3/10;;D21J1/00,,0,0,,,,EXPIRED
16,US,A,US 3041676 A,185-261-646-240-009,1962-07-03,1962,US 73633958 A,1958-05-19,US 73633958 A,1958-05-19,Apparatus for producing a heterogeneous diffusion of fibers,,GOLDMAN JOSHUA H,GOLDMAN JOSHUA H,,https://lens.org/185-261-646-240-009,Granted Patent,no,10,2,1,1,0,D04H1/00;;D04H1/00,D04H1/00,,0,0,,,,EXPIRED
17,US,A,US 3010569 A,036-683-491-557-85X,1961-11-28,1961,US 73194058 A,1958-04-30,US 73194058 A,1958-04-30,Protective case for medical thermometer,,BOONTON MOLDING COMPANY,GOLDMAN STANLEY H,,https://lens.org/036-683-491-557-85X,Granted Patent,no,6,19,1,1,0,B65D25/105;;B65D85/30;;B65D25/105;;B65D85/30,B65D25/10;;B65D85/30,,0,0,,,,EXPIRED
18,US,A,US 1568064 A,093-724-048-513-495,1926-01-05,1926,US 74194724 A,1924-10-06,US 74194724 A,1924-10-06,Antislipping device for shoe soles and heels,,GOLDMAN DAVID H,GOLDMAN DAVID H,,https://lens.org/093-724-048-513-495,Granted Patent,no,0,22,1,1,0,A43B13/26;;A43C15/161;;A43B13/26;;A43C15/161,A43B13/26;;A43C15/16,,0,0,,,,EXPIRED
19,CA,A,CA 1051125 A,112-562-998-470-845,1979-03-20,1979,CA 245590 A,1976-02-12,US 54958275 A,1975-02-13,NEUTRON BOREHOLE LOGGING CORRECTION TECHNIQUE,"NEUTRON BOREHOLE LOGGING CORRECTION TECHNIQUE In accordance with an illustrative embodiment of the present invention, a method and apparatus is disclosed for logging earth formations traversed by a borehole in which an earth formation is irradiated with neutrons and gamma radiation produced thereby in the formation and in the borehole is detected. A sleeve or shield for capturing neutrons from the borehole and producing gamma radiation characteristic of that capture is provided to give an indication of the contribution of borehole capture events to the total detected gamma radiation. It is then possible to correct from those borehole effects the total detected gamma radiation and any earth formation parameters determined therefrom.",SCHLUMBERGER CA LTD,GOLDMAN LEONARD H,,https://lens.org/112-562-998-470-845,Granted Patent,no,0,0,5,5,0,G01V5/102;;G01V5/102;;G01V5/101;;G01V5/101,G01V5/10,358-4,0,0,,,,EXPIRED
20,US,A,US 2084582 A,190-199-744-578-421,1937-06-22,1937,US 74844434 A,1934-10-16,US 74844434 A,1934-10-16,Art of bonding or plying bodies,,GOLDMAN JOSHUA H,GOLDMAN JOSHUA H,,https://lens.org/190-199-744-578-421,Granted Patent,no,0,7,1,1,0,B01D39/14;;Y10T156/1056;;Y10T156/1056;;B01D39/14,B01D39/14,B5S S17Y          KA          1;;B5S S17Y          KA          2;;B5S S17Y          KA          3;;B5S S17Y          KA          4;;B5S S17Y          KA          5;;B5S S172          KA          5;;B5S S177          KA          2;;B5S S178          KA          2;;B5S S180          KA          3;;B5S S181          KA          3;;B5S S188          KA          1;;B5S S189          KA          1;;B5S S19X          KA          1;;B5S S19X          KA          2;;B5S S19X          KA          3;;B5S S19X          KA          4;;B5S S19X          KA          5;;B5S S191          KA          4;;B5S S22Y          KA          1;;B5S S22Y          KA          2;;B5S S22Y          KA          3;;B5S S22Y          KA          4;;B5S S22Y          KA          5;;B5S S222          KA          5;;B5S S227          KA          2;;B5S S228          KA          2;;B5S S230          KA          3;;B5S S231          KA          3;;B5S S238          KA          1;;B5S S239          KA          1;;B5S S241          KA          4;;B5S S344          KA          1;;B5S S344          KA          2;;B5S S344          KA          3;;B5S S344          KA          4;;B5S S344          KA          5;;B5S S353          KA          1;;B5S S353          KA          2;;B5S S353          KA          3;;B5S S353          KA          4;;B5S S353          KA          5;;B5S S354          KA          1;;B5S S354          KA          2;;B5S S354          KA          3;;B5S S354          KA          4;;B5S S354          KA          5;;B5S S36X          KA          1;;B5S S36X          KA          2;;B5S S36X          KA          3;;B5S S36X          KA          4;;B5S S36X          KA          5;;B5S S36Y          KA          1;;B5S S36Y          KA          2;;B5S S36Y          KA          3;;B5S S36Y          KA          4;;B5S S36Y          KA          5;;B5S S360          KA          1;;B5S S360          KA          2;;B5S S360          KA          3;;B5S S360          KA          4;;B5S S360          KA          5;;B5S S381          KA          1;;B5S S381          KA          2;;B5S S381          KA          3;;B5S S381          KA          4;;B5S S381          KA          5;;B5S S54X          KA          1;;B5S S54X          KA          2;;B5S S54X          KA          3;;B5S S54X          KA          4;;B5S S54X          KA          5;;B5S S55Y          KA          1;;B5S S55Y          KA          2;;B5S S55Y          KA          3;;B5S S55Y          KA          4;;B5S S55Y          KA          5;;B5S S554          KA          1;;B5S S554          KA          2;;B5S S554          KA          3;;B5S S554          KA          4;;B5S S554          KA          5;;B5S S579          KA          1;;B5S S579          KA          2;;B5S S579          KA          3;;B5S S579          KA          4;;B5S S579          KA          5;;B5S S587          KA          1;;B5S S587          KA          2;;B5S S587          KA          3;;B5S S587          KA          4,0,0,,,,EXPIRED
21,BE,A,BE 578214 A,016-690-613-571-626,1959-10-28,1959,BE 578214 A,1959-04-28,US 578214X A,1958-04-29,Filtre pour fluide et procédé de fabrication de ce filtre,,CUNO ENG CORP,GOLDMAN J H,,https://lens.org/016-690-613-571-626,Granted Patent,no,0,0,1,1,0,,,,0,0,,,,EXPIRED
22,US,A,US 2340658 A,024-609-926-338-795,1944-02-01,1944,US 26693239 A,1939-04-10,US 26693239 A,1939-04-10,Sound recording apparatus,,GOLDMAN ISIDORE H,GOLDMAN ISIDORE H,,https://lens.org/024-609-926-338-795,Granted Patent,no,0,6,1,1,0,G11B3/36;;G11B3/36,G11B3/36,,0,0,,,,EXPIRED
23,US,B2,US 7287817 B2,078-436-546-275-362,2007-10-30,2007,US 92007104 A,2004-08-17,US 92007104 A;;US 49630303 P,2003-08-19,"Methods and devices for enhancing health, safety, and comfort on conveyances in relation to reclining seats","A method and device for enabling an aft passenger on a conveyance to establish protection from a forward seatback, irrespective of a conventional effort by a forward passenger to cause reclining of the forward seatback. A device is disclosed that includes a main body and additional elements appended to the main body. The device is adapted for access by the aft passenger to activate it in order to inhibit such reclining. In one preferred embodiment, the device is adapted for use on an airplane to engage the forward seatback and an arm of a tray table designated for use by the aft passenger. In another preferred embodiment, the device comprises a recline inhibitor component connected to a depressible safety input control which is integrated with a rearward portion of a seat for access by the aft passenger.",GOLDMAN IRA H,GOLDMAN IRA H,,https://lens.org/078-436-546-275-362,Granted Patent,yes,11,11,4,4,0,B60N2/22;;B60N3/004;;B64D11/064;;B64D11/0638;;B64D11/0638;;B60N3/004;;B64D11/064;;B60N2/22,B60N/;;A47B83/02;;B60N2/22;;B60N2/90;;B60N3/00;;B64D11/06,297/463.2;;297/146;;297/310;;297/463.1,1,0,,,"""RMUTT""; ""Airline passenger anti-knee-crush device""; Halfbakery.com; date-stamped Apr. 6, 2001; copy printed Aug. 14, 2004; http://www.halfbakery.com/idea/Airline<SUB>-</SUB>20passenger<SUB>-</SUB>20anti-knee-crush<SUB>-</SUB>20device.",INACTIVE
24,US,A,US 4308902 A,110-315-689-560-192,1982-01-05,1982,US 12201380 A,1980-02-19,US 12201380 A,1980-02-19,Duplicating apparatus with variable scale factor,Apparatus for duplicating a master object includes a router which is positioned on a pivoting carriage which has a follower which engages a rotating three dimensional master object. The work piece is rotated at the same rate as the master object and a router carried on the carriage engages the work piece. The location of the axis about which the master object rotates may be varied to change the scale factor so that the work piece may be smaller than the master object.,GOLDMAN JEFFREY H,GOLDMAN JEFFREY H,,https://lens.org/110-315-689-560-192,Granted Patent,yes,6,0,1,1,0,B23Q35/109;;Y10T409/30028;;Y10T409/30224;;Y10T409/300168;;Y10T409/30028;;Y10T409/30224;;Y10T409/300168;;B23Q35/109,B23Q35/10,142/7,0,0,,,,EXPIRED
25,US,A1,US 2007/0138222 A1,098-284-991-067-68X,2007-06-21,2007,US 56668306 A,2006-12-04,US 56668306 A;;US 74219305 P,2005-12-02,Readily deployed and stowed storage devices for temporary holding and transporting personal items,"Disclosed are small, compact devices that provide readily deployed storage for small personal items, and they can also readily be returned to their stowed configuration. This toggling between deployed and stowed can be accomplished without a required change to the connection of any such device to another object, such as a travel case. The devices provide specific benefit to people going through an airport or building security checkpoint at which it is a requirement that pocket items such as cell phones, keys, and coins must be removed from one's pockets for assessment by a scanning apparatus.",GOLDMAN IRA H,GOLDMAN IRA H,,https://lens.org/098-284-991-067-68X,Patent Application,yes,29,25,3,3,0,A45C7/0095;;A45C11/26;;A45C7/0095;;A45C11/26,B65D30/00;;A45C1/02;;A45C3/00;;A45C3/06;;A45C13/40;;A45C15/00;;B60R7/00;;B60R9/00;;B65D33/14,224/401;;383/4;;383/24;;150/106;;190/111;;150/112,0,0,,,,DISCONTINUED
26,US,A1,US 2002/0036028 A1,178-384-683-220-919,2002-03-28,2002,US 91798001 A,2001-07-30,US 91798001 A;;US 22236100 P,2000-08-01,Means for aiding the dispensing of proper amounts of toothpaste and discouraging use of excessively dispensed amounts,"
   A device designed to promote the placement on a toothbrush of not more than a predetermined amount of toothpaste. A preferred embodiment physically encourages the relative positioning of a toothbrush and a tube of toothpaste such that when toothpaste is squeezed from its tube it is dispensed substantially on top of and across the toothbrush's bristle bunches rather than lengthwise along the top of the bunches. The device is designed to provide visual encouragement to an individual to stop dispensing toothpaste when an appropriate amount has been dispensed. Furthermore, the device generally prevents any excessively dispensed toothpaste from remaining on the toothbrush. 
",GOLDMAN IRA H.,GOLDMAN IRA H,,https://lens.org/178-384-683-220-919,Patent Application,yes,0,4,1,1,0,A47K5/18;;A47K5/18,A47K5/18,141/373;;141/114;;141/386,0,0,,,,DISCONTINUED
27,US,A,US 1589339 A,087-462-530-373-393,1926-06-15,1926,US 3708625 A,1925-06-15,US 3708625 A,1925-06-15,Manicuring instrument,,HENRY L HUGHES CO INC,GOLDMAN RALPH H,,https://lens.org/087-462-530-373-393,Granted Patent,no,0,14,5,5,0,A45D29/16;;A45D29/16;;A45D29/17;;A45D29/17,A45D29/16;;A45D29/17,,0,0,,,,EXPIRED
28,WO,A3,WO 2005/018981 A3,007-026-661-616-444,2007-08-02,2007,US 2004/0027031 W,2004-08-18,US 49630303 P,2003-08-19,"METHODS AND DEVICES FOR ENHANCING HEALTH, SAFETY, AND COMFORT ON CONVEYANCES IN RELATION TO RECLINING SEATS","A method and device for enabling an aft passenger on a conveyance to establish protection from a forward seatback (103), irrespective of a conventional effort by a forward passenger to cause reclining of the forward seatback. A device is disclosed that includes a main body and additional elements appended to the main body. The device is adapted for access by the aft passenger to activate it in order to inhibit such reclining. In one preferred embodiment, the device (FIG. 13; 10) is adapted for use on an airplane to engage the forward seatback (103) and an arm (151) of a tray table assembly (150) designated for use by the aft passenger. In another preferred embodiment, the device comprises a recline inhibiter component connected to a depressible safety input control (FIG 20; 412) which is integrated with a rearward portion (104) of a seat (100x) for access by the aft passenger.",RIGHT BRAIN LTD LLC;;GOLDMAN IRA H,GOLDMAN IRA H,,https://lens.org/007-026-661-616-444,Search Report,yes,5,0,4,4,0,B60N2/22;;B60N3/004;;B64D11/064;;B64D11/0638;;B64D11/0638;;B60N3/004;;B64D11/064;;B60N2/22,B60N2/90;;A47B83/02;;B60N/;;B60N2/22;;B60N3/00;;B64D11/06,,1,0,,,"""HALFBAKERY article, Airline passenger anti-knee-crush device"", XP003016248, Retrieved from the Internet <URL:http://www.kneedefendercom/html2/how_to.htm> [retrieved on 20070101]",PENDING
29,CA,A,CA 167655 A,122-877-830-293-979,1916-02-15,1916,CA 167655D A,1915-10-28,CA 167655T A,1915-10-28,VALVE,,GOLDMAN ISIDORE H,GOLDMAN ISIDORE H,,https://lens.org/122-877-830-293-979,Granted Patent,no,0,0,1,1,0,,,,0,0,,,,EXPIRED
30,US,A,US 1178068 A,172-958-692-542-700,1916-04-04,1916,US 3448915 A,1915-06-16,US 3448915 A,1915-06-16,PRESSURE-CONTROLLED VALVE.,,GOLDMAN ISIDORE H,GOLDMAN ISIDORE H,,https://lens.org/172-958-692-542-700,Granted Patent,no,0,0,1,1,0,F16K31/56;;F16K31/56,,,0,0,,,,EXPIRED
31,US,A,US 2819718 A,009-879-151-392-636,1958-01-14,1958,US 36837553 A,1953-07-16,US 36837553 A,1953-07-16,Drainage tube,,GOLDMAN ISIDORE H,GOLDMAN ISIDORE H,,https://lens.org/009-879-151-392-636,Granted Patent,no,3,113,1,1,0,A61M25/1002;;A61M25/1002,A61F2/958,,0,0,,,,EXPIRED
32,US,A,US 2115577 A,119-680-090-890-390,1938-04-26,1938,US 7509236 A,1936-04-18,US 7509236 A,1936-04-18,Strainer,,JOHNSON & JOHNSON,GOLDMAN JOSHUA H,,https://lens.org/119-680-090-890-390,Granted Patent,no,0,38,1,1,0,B01D27/005;;B01D29/216;;B01D2201/182;;B01D27/005;;B01D2201/182;;B01D29/216,B01D25/00;;B01D25/24;;B01D27/00;;B01D29/00,,0,0,,,,EXPIRED
33,US,S,US D0315619 S,174-561-382-963-865,1991-03-19,1991,US 23816188 F,1988-08-30,US 23816188 F,1988-08-30,Swimmer's mask,,VOIT CORP,GOLDMAN DAVID H,VOIT CORPORATION A NY CORP (1988-08-22),https://lens.org/174-561-382-963-865,Design Right,yes,6,1,1,1,0,,,D29/9,0,0,,,,EXPIRED
34,US,A,US 1937515 A,166-159-844-189-216,1933-12-05,1933,US 61361832 A,1932-05-26,US 61361832 A,1932-05-26,Collar button,,GOLDMAN MAX H,GOLDMAN MAX H,,https://lens.org/166-159-844-189-216,Granted Patent,no,0,0,1,1,0,A44B3/00;;Y10T24/3604;;Y10T24/3604;;A44B3/00,A44B3/00,,0,0,,,,EXPIRED
35,CA,A,CA 168782 A,195-870-073-131-273,1916-04-11,1916,CA 168782D A,1915-12-03,CA 168782T A,1915-12-03,MACHINE FOR FILLING TUBULAR PACKING RINGS,,GOLDMAN ISIDORE H,GOLDMAN ISIDORE H,,https://lens.org/195-870-073-131-273,Granted Patent,no,0,0,1,1,0,,,,0,0,,,,EXPIRED
36,US,A,US 3065856 A,197-998-793-964-631,1962-11-27,1962,US 73168258 A,1958-04-29,US 73168258 A,1958-04-29,Fluid filter and method of making same,,GOLDMAN JOSHUA H,GOLDMAN JOSHUA H,,https://lens.org/197-998-793-964-631,Granted Patent,no,12,24,6,6,0,B01D29/111;;B01D39/1615;;B01D39/2017;;B01D39/2041;;B01D46/00;;B01D2239/0613;;B01D2239/065;;B01D2239/0654;;B01D2239/0695;;B01D2239/086;;B01D29/216;;B01D46/00;;B01D39/1615;;B01D2239/065;;B01D2239/086;;B01D39/2017;;B01D29/111;;B01D2239/0695;;B01D2239/0654;;B01D2239/0613;;B01D39/2041,B01D29/11;;B01D39/16;;B01D46/00,B1D DDPA          DDPA;;B1D DDPA          DPA,0,0,,,,EXPIRED
37,CA,A,CA 606101 A,050-872-331-987-316,1960-10-04,1960,CA 606101D A,,CA 606101T A,,METHOD OF MANUFACTURING A NON-WOVEN FIBROUS SHEET,,GOLDMAN JOSHUA H,GOLDMAN JOSHUA H,,https://lens.org/050-872-331-987-316,Granted Patent,no,0,0,1,1,0,,,,0,0,,,,EXPIRED
38,US,A,US 3231092 A,066-776-105-981-320,1966-01-25,1966,US 24272662 A,1962-12-06,US 24272662 A,1962-12-06,Filter and method of making the same,,GOLDMAN JOSHUA H,GOLDMAN JOSHUA H,,https://lens.org/066-776-105-981-320,Granted Patent,no,8,5,1,1,0,B01D39/14;;B01D39/14,B01D39/14,,0,0,,,,EXPIRED
39,CA,A,CA 645902 A,115-853-707-445-578,1962-07-31,1962,CA 645902D A,,CA 645902T A,,FLUID FILTER AND METHOD OF MAKING SAME,,AMERICAN MACH & FOUNDRY,GOLDMAN JOSHUA H,,https://lens.org/115-853-707-445-578,Granted Patent,no,0,0,1,1,0,,,,0,0,,,,EXPIRED
40,US,A,US 2496286 A,032-397-854-973-439,1950-02-07,1950,US 59009545 A,1945-04-24,US 59009545 A,1945-04-24,Air control valve,,GOLDMAN JOSHUA H,GOLDMAN JOSHUA H,,https://lens.org/032-397-854-973-439,Granted Patent,no,5,3,1,1,0,B63C11/10;;B63C11/10,B63C11/10,,0,0,,,,EXPIRED
41,CA,A,CA 363067 A,068-730-602-359-910,1936-12-29,1936,CA 363067D A,,CA 363067T A,,REINFORCED CARDED FIBRE WEB,,GOLDMAN JOSHUA H,GOLDMAN JOSHUA H,,https://lens.org/068-730-602-359-910,Granted Patent,no,0,0,1,1,0,,,,0,0,,,,EXPIRED
42,US,A,US 2308693 A,125-059-823-446-791,1943-01-19,1943,US 38705841 A,1941-04-05,US 38705841 A,1941-04-05,Adhesive tape,,COLUMBIA MILLS INC,GOLDMAN JOSHUA H,,https://lens.org/125-059-823-446-791,Granted Patent,no,0,14,1,1,0,C09J2400/263;;Y10S206/82;;C09J7/21;;Y10T428/15;;C09J2301/18;;Y10T428/15;;C09J7/21;;C09J2400/263;;Y10S206/82;;C09J2301/18,C09J7/21,,0,0,,,,EXPIRED
43,US,A,US 2039312 A,120-363-445-423-019,1936-05-05,1936,US 1126235 A,1935-03-15,US 1126235 A,1935-03-15,Reenforced carded web,,GOLDMAN JOSHUA H,GOLDMAN JOSHUA H,,https://lens.org/120-363-445-423-019,Granted Patent,no,0,71,4,4,0,D04H1/66;;D04H1/66;;Y10T428/24124;;Y10T428/24124;;Y10T428/24612;;Y10T428/24612;;Y10T428/24802;;Y10T428/24802,D04H1/66,,0,0,,,,EXPIRED
