291,EP,A1,EP 0481802 A1,046-991-164-612-572,1992-04-22,1992,EP 91309618 A,1991-10-17,US 59996890 A;;US 71232691 A;;US 76958091 A,1990-10-18,Hydroxylated inhibitors of HIV reverse transcriptase.,"Novel biotransformed or synthetic hydroxy pyridinones inhibit HIV reverse transcriptase, and are useful in the prevention or treatment of infection by HIV and the treatment of AIDS, either as compounds, pharmaceutically acceptable salts (where appropriate), pharmaceutical composition ingredients, whether or not in combination with other antivirals, anti-infectives, immunomodulators, antibiotics or vaccines. Methods of treating AIDS and methods of preventing or treating infection by HIV are also described.",MERCK & CO INC,CHEN SHIEH-SHUNG TOM;;HSU ANNJIA;;DOSS GEORGE A;;GOLDMAN MARK E;;BALANI SURESH K;;THEOHARIDES ANTHONY D;;HOFFMAN JACOB M JR;;PITZENBERGER STEVEN M;;RAMJIT HARRI G;;KAUFFMAN LAURA R;;ARISON BYRON H;;SAARI WALFRED S;;ROONEY CLARENCE S;;WAI JOHN S,,https://lens.org/046-991-164-612-572,Patent Application,yes,4,69,11,14,0,C07D213/74;;C07D401/12;;C07D413/10;;C12P17/12;;C12P17/16;;A61P31/12;;A61P31/18;;A61P43/00;;C07D211/80,A61K31/4418;;A61K31/4425;;A61K31/443;;A61K31/4433;;A61K31/47;;A61P31/12;;A61K31/44;;A61P31/18;;A61P43/00;;C07D213/64;;C07D213/69;;C07D213/70;;C07D213/74;;C07D401/12;;C07D405/06;;C07D405/12;;C07D409/06;;C07D409/12;;C07D413/06;;C07D413/12;;C07D417/06;;C07D417/12;;C07D498/04;;C12N9/99;;C12P17/12;;C12P17/16,,5,3,000-360-034-394-490;;161-140-274-156-022;;098-185-617-968-310,1716683;;10.1021/jm00113a036;;10.1002/jhet.5570200141;;10.1021/jo00342a050,"CHEMICAL ABSTRACTS, vol. 115, no. 13, 30 September 1991, Columbus, Ohio, US; abstract no. 126401T, W. S. SAARI ET AL.: ""2-Pyridinone derivatives: a new class of nonnucleoside, HIV-1-specific reverse transcriptase inhibitors."" page 24; & J. Med. Chem. 1991, 34(9), 2922 - 2925;;CHEMICAL ABSTRACTS, vol. 94, no. 5, 2 February 1981, Columbus, Ohio, US; abstract no. 30805z, page 580; & JP-A-55083786 (DAINIPPON PHARMACEUTICAL CO., LTD.) 24-06-1980;;CHEMICAL ABSTRACTS, vol. 99, no. 17, 24 October 1983, Columbus, Ohio, US; abstract no. 139717B, M. A. HASSAN ET AL.: ""Synthesis and reactions of polysubstituted 2(1H)-pyridones and pyridines."" page 579; & Pol. J. Chem. 1982, 56(2), 419 - 423;;JOURNAL OF HETEROCYCLIC CHEMISTRY, vol. 20, 1983, pages 199 - 203; C. O. OKAFOR ET AL.: ""Synthesis of Analogues of the 2,3,6-Triazaphenothiazine Ring System (1)"";;JOURNAL OF ORGANIC CHEMISTRY, vol. 47, 1982, EASTON (US), pages 592 - 594; C. O. OKAFOR: ""Studies in the Heterocyclic Series. 22. New Chemistry of Azaphenothiazine and Its Precursors.""",DISCONTINUED
292,US,A1,US 2001/0039014 A1,113-882-183-225-944,2001-11-08,2001,US 76001001 A,2001-01-10,US 76001001 A;;US 17555100 P;;US 21394700 P,2000-01-11,Integrated systems and methods for diversity generation and screening,"
   Integrated systems and methods for diversity generation and screening are provided. The systems use common fluid and array handling components to provide nucleic acid diversification, transcription, translation, product screening and subsequent diversification reactions. 
",MAXYGEN INC,BASS STEVEN H;;DAVIS S CHRISTOPHER;;PATTEN PHILLIP A;;TOBIN MATTHEW;;MINSHULL JEREMY;;WELCH MARK;;GUSTAFSSON CLAES;;CARR BRIAN;;JENNE STEPHANE;;RAILLARD SUN AI;;CRAMERI ANDREAS;;STEMMER WILLEM P C;;EMIG ROBIN;;LONGCHAMP PASCAL;;GOLDMAN STANLEY;;GIVER LORRAINE J;;AFFHOLTER JOSEPH A,MAXYGEN INC (2001-04-03);;CODEXIS INC (2024-02-06);;CODEXIS MAYFLOWER HOLDINGS LLC (2010-10-28),https://lens.org/113-882-183-225-944,Patent Application,yes,42,212,15,15,0,B01J19/0046;;B01J2219/00378;;B01J2219/00585;;B01J2219/00659;;B01J2219/00675;;B01J2219/00689;;B01J2219/00695;;B01J2219/007;;B01J2219/00722;;B82Y30/00;;C12N15/1027;;C12N15/1031;;C40B60/04;;G16B20/00;;Y02A90/10;;G16B20/50;;G16B20/20;;C12N15/1031;;B01J2219/00722;;B01J2219/00378;;B01J2219/00689;;C40B60/04;;B01J2219/00675;;C12N15/1027;;B01J2219/00695;;B82Y30/00;;B01J2219/007;;B01J2219/00585;;B01J19/0046;;B01J2219/00659;;G16B20/00;;Y02A90/10;;G16B20/20;;G16B20/50,G01N33/53;;C12M1/00;;C12N15/09;;C12N15/10;;C12Q1/68;;G01N37/00;;G16B20/20;;G16B20/50,435/6;;X702 2;;435/287.2,0,0,,,,DISCONTINUED
293,US,B2,US 7462469 B2,063-314-035-357-729,2008-12-09,2008,US 15493602 A,2002-05-23,US 15493602 A;;US 76001001 A;;US 17555100 P;;US 21394700 P,2000-01-11,Integrated system for diversity generation and screening,"Integrated systems and methods for diversity generation and screening are provided. The systems use common fluid and array handling components to provide nucleic acid diversification, transcription, translation, product screening and subsequent diversification reactions.",MAXYGEN INC,BASS STEVEN H;;DAVIS S CHRISTOPHER;;PATTEN PHILLIP A;;TOBIN MATTHEW;;MINSHULL JEREMY;;WELCH MARK;;GUSTAFSSON CLAES;;CARR BRIAN;;JENNE STEPHANE;;RAILLARD SUN AI;;CRAMERI ANDREAS;;STEMMER WILLEM P C;;EMIG ROBIN;;LONGCHAMP PASCAL;;GOLDMAN STANLEY;;GIVER LORRAINE J;;AFFHOLTER JOSEPH A,CODEXIS INC (2024-02-06);;CODEXIS MAYFLOWER HOLDINGS LLC (2010-10-28),https://lens.org/063-314-035-357-729,Granted Patent,yes,109,43,15,15,0,B01J19/0046;;B01J2219/00378;;B01J2219/00585;;B01J2219/00659;;B01J2219/00675;;B01J2219/00689;;B01J2219/00695;;B01J2219/007;;B01J2219/00722;;B82Y30/00;;C12N15/1027;;C12N15/1031;;C40B60/04;;G16B20/00;;Y02A90/10;;G16B20/50;;G16B20/20;;C12N15/1031;;B01J2219/00722;;B01J2219/00378;;B01J2219/00689;;C40B60/04;;B01J2219/00675;;C12N15/1027;;B01J2219/00695;;B82Y30/00;;B01J2219/007;;B01J2219/00585;;B01J19/0046;;B01J2219/00659;;G16B20/00;;Y02A90/10;;G16B20/20;;G16B20/50,C12P19/34;;G01N33/53;;C12M1/00;;C12N15/09;;C12N15/10;;C12Q1/68;;G01N37/00;;G16B20/20;;G16B20/50,435/91.2;;435/6;;435/91.1,45,41,069-081-028-661-451;;052-515-049-615-321;;076-857-393-695-376;;030-682-602-291-829;;041-686-146-430-131;;098-702-433-451-053;;024-369-171-979-227;;144-691-161-287-610;;094-087-374-443-020;;072-689-231-585-62X;;005-534-971-910-727;;017-122-411-657-318;;014-793-548-895-526;;034-553-838-798-25X;;025-834-245-974-873;;084-748-487-156-928;;008-668-626-323-479;;057-988-909-871-766;;049-427-119-219-60X;;049-917-149-198-776;;009-898-247-038-15X;;059-349-671-883-389;;008-006-631-989-07X;;016-467-427-627-620;;072-668-742-851-341;;111-715-011-111-624;;063-099-001-050-447;;040-482-527-661-995;;036-055-058-985-848;;027-719-371-280-548;;029-506-594-475-338;;056-304-474-559-637;;077-476-584-062-720;;023-130-578-604-418;;051-679-383-863-659;;061-754-589-503-35X;;009-992-889-537-648;;070-322-219-790-918;;028-312-552-297-631;;056-304-474-559-637;;028-312-552-297-631,10429246;;10.1038/11737;;10.1038/7003;;10096293;;11283594;;10.1038/86744;;7692403;;pmc310094;;10.1093/nar/21.18.4410;;7727111;;9630892;;10.1038/nbt0396-315;;8564822;;10.1038/nm0196-100;;9131621;;10.1038/nbt0597-436;;10.1038/34663;;9440693;;10.1006/jmbi.1996.0031;;8568883;;10359711;;10.1016/s1367-5931(99)80044-1;;10.1038/12884;;10471932;;9425664;;10.1016/s0958-1669(97)80127-9;;11283580;;10.1038/86681;;10.1073/pnas.91.22.10747;;7938023;;pmc45099;;10.1038/370389a0;;8047147;;7491501;;10.1126/science.270.5241.1510;;10.1038/nbt0695-549;;pmc20752;;9114019;;10.1073/pnas.94.9.4504;;pmc15083;;10.1073/pnas.96.1.11;;9874762;;10.1038/15095;;10545919;;pmc24609;;9144168;;10.1073/pnas.94.10.4937;;pmc24338;;10.1073/pnas.95.24.14130;;9826665;;10350066;;10.1016/s0014-5793(99)00475-5;;10.1128/jb.145.1.306-320.1981;;6450747;;pmc217274;;10.1016/s0958-1669(98)80042-6;;9821285;;9582111;;10.1126/science.280.5366.1046;;10397261;;10383126;;10388473;;10.1093/clinchem/45.7.982;;8994661;;10.2144/97221rr01;;9325094;;10.1006/jmbi.1997.1252;;9606143;;10.1006/abio.1998.2606;;9344407;;10.1006/abio.1997.2326;;9630890;;10.1038/nbt0396-303;;10.2144/99275rr01;;10572649;;10.1038/nbt0897-789;;9255796;;pmc217167;;6109711;;10.1128/jb.145.2.687-695.1981;;9223302;;10.1073/pnas.94.15.7997;;pmc21544;;9325094;;10.1006/jmbi.1997.1252;;9223302;;10.1073/pnas.94.15.7997;;pmc21544,"Chang, C., et al. (1999) ""Evolution of a cytokine using DNA family shuffling."" Nature Biotechnology 17:793-797.;;Christians, F.C. et al., (1999) ""Directed evolution of thymidine kinase for AZT phosphorylation using DNA family shuffling."" Nature Biotechnology 17:259-264.;;Coco et al., (2001) ""DNA shuffling method for generating highly recombined genes and evolved enzymes"" Nature Biotechnology vol. 19 pp. 354-359.;;Crameri et al., (1993) ""10(20)-Fold aptamer library amplification without gel purification,"" Nuc. Acids Res. 21(18):4410.;;Crameri, A. & Stemmer W.P.C. (1995) ""Combinatorial multiple cassette mutagenesis creates all the permutations of mutant and wildtype cassettes."" Biotechniques 18:194-195.;;Crameri, A. et al. (1996) ""Improved green fluorescent protein by molecular evolution using DNA shuffling."" Nature Biotechnology 14:315-319.;;Crameri, A. et al. (1996) ""Construction and evolution of antibody-phage libraries by DNA shuffling."" Nature Medicine 2:100-103.;;Crameri, A. et al., (1997) ""Molecular evolution of an arsenate detoxification pathway by DNA shuffling."" Nature Biotechnology 15:436-438.;;Crameri, A. et al., (1998) ""DNA shuffling of a family of genes from diverse species accelerates directed evolution."" Nature 391:288-291.;;Gates, C.M. et al., (1996) ""Affinity selective isolation of ligands from peptide libraries through display on a lac repressor headpiece dimer"". Journal of Molecular Biology 255:373-386.;;Minshull, J., Stemmer, W.P.C. (1999) ""Protein evolution by molecular breeding."" Current Opinion in Chemical Biology 3:284-290.;;Ness, J. et al., (1999) ""DNA Shuffling of subgenomic sequences of subtilisin."" Nature Biotechnology 17:893-896.;;Patten, P.A. et al., (1997) ""Application of DNA Shuffling to Pharmaceuticals and Vaccines."" Current Opinion in Biotechnology 8:724-733.;;Pelletier, Joelle N., (2001) ""A Rachitt for our toolbox"" Nature Biotechnology vol. 19, p. 314-315.;;Stemmer, W.P.C. (1994) ""DNA Shuffling by random fragmentation and reassemby: In vitro recombination for molecular evolution."" PNAS 91:10751.;;Stemmer, W.P.C. (1994) ""Rapid evolution of a protein in vitro by DNA shuffling."" Nature 370:389-391.;;Stemmer, W.P.C. (1995) ""The Evolution of Molecular Computation."" Science 270:1510.;;Stemmer, W.P.C. (1995) ""Searching Sequence Space."" Bio/Technology 13:549-553.;;Stemmer, W.P.C. (1996) ""Sexual PCR and Assembly PCR."" In: The Encyclopedia of Molecular Biology. VCH Publishers, New York. pp. 447-457.;;Stemmer, W.P.C. & Soong, N.W. (1999) ""Molecular breeding of viruses for targeting and other clinical properties."" Tumor Targeting 4:59-62.;;Zhang, J. et al., (1997) ""Directed evolution of an effective fucosidase from a galactosidase by DNA shuffling and screening."" Proceedings of the National Academy of Sciences, USA 94:4504-4509.;;Chou, H.P. et al (1999) ""A Microfabricated Device for Sizing and Sorting DNA Molecules."" Proc. Natl'l Acad. Sci. 96:11-113.;;DeSilva et al. (1998) ""Rapid Genotyping and Quantification on the LightCycler with Hybridization Probes"" Biochimica 2:12-15.;;DeSilva et al. (1998) ""The LightCycler-The Smartest Innovation for More Efficient PCR"" Biochemica 2:4-7.;;Fu, A.Y. et al (1999) ""A Microfabricated Fluorescence-Activated Cell Sorter,"" Nat. Biotechnol. 17:1109-1111.;;Hanes and Pluckthun (1997) ""In vitro Selection and Evolution of Functional Proteins by Using Ribosome Display."" Biochemistry 94:4937-4942.;;Hanes et al. (1988) ""Ribosome Display Efficiently Selects and Evolves High-Affinity Antibodies in vitro from Immune Libraries"" PNAS 95:14130-14135.;;Hanes et al. (1999) ""Comparison of E. coli and rabbit reticulocyte ribosome display systems"" FEBS Lett. 450(1-2): 105-10.;;Hays et al. (1981) ""Recombination of uracil-containing Lambda bacteriophages."" J. Bacteriol. 145(1):306-320.;;Jermutus et al. (1998) ""Recent advances in producing and selecting functional proteins by using cell-free translation"" Curr. Opin. Biotechnol. 9(5):534-48.;;Kopp et al. (1998) ""Chemical Amplification: Continuous flow PCR on a Chip"" Science 280:1046-1047.;;Kreuzer et al. (1999) ""LightCycler technology for the quantitation of bcr/ab1 fusion transcripts"" Cancer Research 59(13):3171-4.;;Laurendeau et al. (1999) ""Quantitation of MYC gene expression in sporadic breast tumors with a real-time reverse transcriptionPCR assay"" Clin Chem 59(12):2759-65.;;Laurendeau et al. (1999) ""TaqMan PCR-based gene dosage asay for predictive testing in Individuals from a cancer family with INK4 locus haploinsufficiency"" Clin Chem 45(7):982-6.;;Lindner et al. (1997) ""Specific Detection of His-tagged Proteins with Recombinant anti-His tag scFv-Phosphatase or scFv-phage fusions"" Biotechniques 22(1):140-149.;;Moore et al. (1997) ""Strategies for the in vitro evolution of protein function: enzyme evolution by random recombination of improved sequences"" Journal of Mol. Bio. 3:336-347.;;Muller et al. (1998) ""Tandem Immobilized Metal Ion Affinity Chromatography/Immunoaffinity purification of His-tagged proteins-evaluation of two anti-His-tag monoclonal antibodies"" Anal Biochem. 259(1):54-61.;;Nieba et al. (1997) ""BIACORE analysis of histadine-tagged proteins using a chelating NTA sensor chip."" Anal. Biochem 22(2):217-218.;;Tyagl and Kramer (1996). ""Molecular beacons: probes that fluoresce upon hybridization."" Nat Biotechnol 14, 303-308.;;Unger, M. et al (1999) ""Single Molecule Fluorescence Observed with Mercury Lamp Illumination,"" Biotechniques 27:1008-1013.;;Wang et al. (1997) ""Biocatalytic plastics as active and stable materials for biotransformations"" Nat Biotechnol 2:15(8):789-93.;;Warner et al. (1981) ""Synthesis and Metabolism of uracil-containing deoxyribonucleic acid in Escherichia coli"" J. Bacteriol. 145(2):687-695.;;Zhao et al. (1997) ""Functional and nonfunctional mutations distinguished by random recombination of homologous genes"" Proc. Natl. Acad. Sci. vol. 94:7997-8000.;;Moore, J.C., et al., J. Mol. Biol. (1997) 272:336-347.;;Zhao, H., et al., PNAS(USA) (1997) 94:7997-8000.",EXPIRED
294,US,A1,US 2003/0054383 A1,105-398-056-447-38X,2003-03-20,2003,US 15493602 A,2002-05-23,US 15493602 A;;US 76001001 A;;US 17555100 P;;US 21394700 P,2000-01-11,Integrated systems and methods for diversity generation and screening,"
   Integrated systems and methods for diversity generation and screening are provided. The systems use common fluid and array handling components to provide nucleic acid diversification, transcription, translation, product screening and subsequent diversification reactions. 
",MAXYGEN INC,BASS STEVEN H;;DAVIS S CHRISTOPHER;;PATTEN PHILLIP A;;TOBIN MATTHEW;;MINSHULL JEREMY;;WELCH MARK;;GUSTAFSSON CLAES;;CARR BRIAN;;JENNE STEPHANE;;RAILLARD SUN AI;;CRAMERI ANDREAS;;STEMMER WILLEM P C;;EMIG ROBIN;;LONGSCHAMP PASCAL;;GOLDMAN STANLEY;;GIVER LORRAINE J;;AFFHOLTER JOSEPH A,CODEXIS INC (2024-02-06);;CODEXIS MAYFLOWER HOLDINGS LLC (2010-10-28),https://lens.org/105-398-056-447-38X,Patent Application,yes,81,15,15,15,0,B01J19/0046;;B01J2219/00378;;B01J2219/00585;;B01J2219/00659;;B01J2219/00675;;B01J2219/00689;;B01J2219/00695;;B01J2219/007;;B01J2219/00722;;B82Y30/00;;C12N15/1027;;C12N15/1031;;C40B60/04;;G16B20/00;;Y02A90/10;;G16B20/50;;G16B20/20;;C12N15/1031;;B01J2219/00722;;B01J2219/00378;;B01J2219/00689;;C40B60/04;;B01J2219/00675;;C12N15/1027;;B01J2219/00695;;B82Y30/00;;B01J2219/007;;B01J2219/00585;;B01J19/0046;;B01J2219/00659;;G16B20/00;;Y02A90/10;;G16B20/20;;G16B20/50,G01N33/53;;C12M1/00;;C12N15/09;;C12N15/10;;C12Q1/68;;G01N37/00;;G16B20/20;;G16B20/50,435/6;;435/287.2;;X702 2,0,0,,,,EXPIRED
295,WO,A3,WO 2001/051663 A3,120-304-895-269-637,2002-06-13,2002,US 0101056 W,2001-01-10,US 17555100 P;;US 21394700 P,2000-01-11,INTEGRATED SYSTEMS AND METHODS FOR DIVERSITY GENERATION AND SCREENING,"Integrated systems and methods for diversity generation and screening are provided. The systems use common fluid and array handling components to provide nucleic acid diversification, transcription, translation, product screening and subsequent diversification reactions.",MAXYGEN INC;;BASS STEVEN H;;DAVIS S CHRISTOPHER;;PATTEN PHILLIP A;;TOBIN MATTHEW;;MINSHULL JEREMY;;WELCH MARK;;GUSTAFSSON CLAES;;CARR BRIAN;;JENNE STEPHANE;;RAILLARD SUN AI;;CRAMERI ANDREAS;;STEMMER WILLEM P C;;EMIG ROBIN;;LONGCHAMP PASCAL;;GOLDMAN STANLEY;;GIVER LORRAINE J;;AFFHOLTER JOSEPH A,BASS STEVEN H;;DAVIS S CHRISTOPHER;;PATTEN PHILLIP A;;TOBIN MATTHEW;;MINSHULL JEREMY;;WELCH MARK;;GUSTAFSSON CLAES;;CARR BRIAN;;JENNE STEPHANE;;RAILLARD SUN AI;;CRAMERI ANDREAS;;STEMMER WILLEM P C;;EMIG ROBIN;;LONGCHAMP PASCAL;;GOLDMAN STANLEY;;GIVER LORRAINE J;;AFFHOLTER JOSEPH A,,https://lens.org/120-304-895-269-637,Search Report,yes,11,0,15,15,0,B01J19/0046;;B01J2219/00378;;B01J2219/00585;;B01J2219/00659;;B01J2219/00675;;B01J2219/00689;;B01J2219/00695;;B01J2219/007;;B01J2219/00722;;B82Y30/00;;C12N15/1027;;C12N15/1031;;C40B60/04;;G16B20/00;;Y02A90/10;;G16B20/50;;G16B20/20;;C12N15/1031;;B01J2219/00722;;B01J2219/00378;;B01J2219/00689;;C40B60/04;;B01J2219/00675;;C12N15/1027;;B01J2219/00695;;B82Y30/00;;B01J2219/007;;B01J2219/00585;;B01J19/0046;;B01J2219/00659;;G16B20/00;;Y02A90/10;;G16B20/20;;G16B20/50,G01N33/53;;C12M1/00;;C12N15/09;;C12N15/10;;C12Q1/68;;G01N37/00;;G16B20/20;;G16B20/50,,2,2,028-312-552-297-631;;056-304-474-559-637,9223302;;10.1073/pnas.94.15.7997;;pmc21544;;9325094;;10.1006/jmbi.1997.1252,"ZHAO H ET AL: ""FUNCTIONAL AND NONFUNCTIONAL MUTATIONS DISTINGUISHED BY RANDOM RECOMBINATION OF HOMOLOGOUS GENES"", PROCEEDINGS OF THE NATIONAL ACADEMY OF SCIENCES OF USA, NATIONAL ACADEMY OF SCIENCE. WASHINGTON, US, vol. 94, July 1997 (1997-07-01), pages 7997 - 8000, XP002916918, ISSN: 0027-8424;;MOORE J C ET AL: ""STRATEGIES FOR THE IN VITRO EVOLUTION OF PROTEIN FUNCTION: ENZYME EVOLUTION BY RANDOM RECOMBINATION OF IMPROVED SEQUENCES"", JOURNAL OF MOLECULAR BIOLOGY, LONDON, GB, vol. 272, no. 3, 26 September 1997 (1997-09-26), pages 336 - 347, XP000892797, ISSN: 0022-2836",PENDING
296,NO,L,NO 914091 L,064-343-054-947-176,1992-04-21,1992,NO 914091 A,1991-10-17,US 59996890 A;;US 71232691 A;;US 76958091 A,1990-10-18,FREMGANGSMAATE FOR FREMSTILLING AV HYDROKSYLERTE INHIBITORER FOR HIV-REVERSTRANSKRIPTASE,"Nye forbindelser med formelen. Rj eller Reller begge er substituert minst én gang med OH; X er NR, 0, S,eller oksimido eller én til fem halogenatomer, C^-alkyltio, -alkyl-sulfinyl, -alkylsulfonyl, -alkoksy, -alkoksykarbonyl, cyan eller aryl; eller Rs og R, kan sammen danne en cykloalkylring med 5-7 ringatomer; eller Rj og Rkan sammen danne en cykloalkylring med 5-7 ringatomer; og Rog R, er H, C..-alkyl, C..-alkenyl, C..-cykloalkyl;. er aryl eller en. heterocyklisk rest som kan være substituert, med det forbehold at den heterocykliske rest ikke er ftalimid, eller farmasøytisk akseptabelt salt eller ester derav.Forbindelsene inhiberer HIV-reverstranskriptase og kan anvendes ved forhindring eller behandling av infeksjon med HIV og ved behandling av AIDS, eventuelt i kombinasjon med andre antivirusmidler, antiinfeksJonsmidler, immunomodulatorer, antibiotika eller vaksiner.",MERCK & CO INC,CHEN SHIEH-SHUNG TOM;;HSU ANNJIA;;DOSS GEORGE A;;GOLDMAN MARK E;;BALANI SURESH K;;THEOHARIDES ANTHONY D;;HOFFMAN JR JACOB M;;PITZENBERGER STEVEN M;;RAMJIT HARRI G;;KAUFFMAN LAURA R;;ARISON BYRON H;;SAARI WALFRED S;;ROONEY CLARENCE S;;WAI JOHN S,,https://lens.org/064-343-054-947-176,Abstract,no,0,0,11,14,0,C07D213/74;;C07D401/12;;C07D413/10;;C12P17/12;;C12P17/16;;A61P31/12;;A61P31/18;;A61P43/00;;C07D211/80,A61K31/4418;;A61K31/4425;;A61K31/44;;A61K31/443;;A61K31/4433;;A61K31/47;;A61P31/12;;A61P31/18;;A61P43/00;;C07D213/64;;C07D213/69;;C07D213/70;;C07D213/74;;C07D401/12;;C07D405/06;;C07D405/12;;C07D409/06;;C07D409/12;;C07D413/06;;C07D413/12;;C07D417/06;;C07D417/12;;C07D498/04;;C12N9/99;;C12P17/12;;C12P17/16,,0,0,,,,PENDING
297,NO,D0,NO 914091 D0,128-016-307-166-258,1991-10-17,1991,NO 914091 A,1991-10-17,US 59996890 A;;US 71232691 A;;US 76958091 A,1990-10-18,FREMGANGSMAATE FOR FREMSTILLING AV HYDROKSYLERTE INHIBITORER FOR HIV-REVERSTRANSKRIPTASE,,MERCK & CO INC,CHEN SHIEH-SHUNG TOM;;HSU ANNJIA;;DOSS GEORGE A;;GOLDMAN MARK E;;BALANI SURESH K;;THEOHARIDES ANTHONY D;;HOFFMAN JR JACOB M;;PITZENBERGER STEVEN M;;RAMJIT HARRI G;;KAUFFMAN LAURA R;;ARISON BYRON H;;SAARI WALFRED S;;ROONEY CLARENCE S;;WAI JOHN S,,https://lens.org/128-016-307-166-258,Patent Application,no,0,0,11,14,0,C07D213/74;;C07D401/12;;C07D413/10;;C12P17/12;;C12P17/16;;A61P31/12;;A61P31/18;;A61P43/00;;C07D211/80,A61K31/4418;;A61K31/44;;A61K31/4425;;A61K31/443;;A61K31/4433;;A61K31/47;;A61P31/12;;A61P31/18;;A61P43/00;;C07D213/64;;C07D213/69;;C07D213/70;;C07D213/74;;C07D401/12;;C07D405/06;;C07D405/12;;C07D409/06;;C07D409/12;;C07D413/06;;C07D413/12;;C07D417/06;;C07D417/12;;C07D498/04;;C12N9/99;;C12P17/12;;C12P17/16,,0,0,,,,PENDING
298,WO,A2,WO 2001/051663 A2,105-194-746-760-272,2001-07-19,2001,US 0101056 W,2001-01-10,US 17555100 P;;US 21394700 P,2000-01-11,INTEGRATED SYSTEMS AND METHODS FOR DIVERSITY GENERATION AND SCREENING,"Integrated systems and methods for diversity generation and screening are provided. The systems use common fluid and array handling components to provide nucleic acid diversification, transcription, translation, product screening and subsequent diversification reactions.",MAXYGEN INC;;BASS STEVEN H;;DAVIS S CHRISTOPHER;;PATTEN PHILLIP A;;TOBIN MATTHEW;;MINSHULL JEREMY;;WELCH MARK;;GUSTAFSSON CLAES;;CARR BRIAN;;JENNE STEPHANE;;RAILLARD SUN AI;;CRAMERI ANDREAS;;STEMMER WILLEM P C;;EMIG ROBIN;;LONGCHAMP PASCAL;;GOLDMAN STANLEY;;GIVER LORRAINE J;;AFFHOLTER JOSEPH A,BASS STEVEN H;;DAVIS S CHRISTOPHER;;PATTEN PHILLIP A;;TOBIN MATTHEW;;MINSHULL JEREMY;;WELCH MARK;;GUSTAFSSON CLAES;;CARR BRIAN;;JENNE STEPHANE;;RAILLARD SUN AI;;CRAMERI ANDREAS;;STEMMER WILLEM P C;;EMIG ROBIN;;LONGCHAMP PASCAL;;GOLDMAN STANLEY;;GIVER LORRAINE J;;AFFHOLTER JOSEPH A,,https://lens.org/105-194-746-760-272,Patent Application,yes,0,18,15,15,0,B01J19/0046;;B01J2219/00378;;B01J2219/00585;;B01J2219/00659;;B01J2219/00675;;B01J2219/00689;;B01J2219/00695;;B01J2219/007;;B01J2219/00722;;B82Y30/00;;C12N15/1027;;C12N15/1031;;C40B60/04;;G16B20/00;;Y02A90/10;;G16B20/50;;G16B20/20;;C12N15/1031;;B01J2219/00722;;B01J2219/00378;;B01J2219/00689;;C40B60/04;;B01J2219/00675;;C12N15/1027;;B01J2219/00695;;B82Y30/00;;B01J2219/007;;B01J2219/00585;;B01J19/0046;;B01J2219/00659;;G16B20/00;;Y02A90/10;;G16B20/20;;G16B20/50,G01N33/53;;C12M1/00;;C12N15/09;;C12N15/10;;C12Q1/68;;G01N37/00;;G16B20/20;;G16B20/50,,0,0,,,,PENDING
299,SG,A1,SG 121902 A1,041-829-113-372-735,2006-05-26,2006,SG 200406111 A,2001-01-10,US 17555100 P;;US 21394700 P,2000-01-11,Integrated systems for diversity generation and screening,,MAXYGEN INC,BASS STEVEN H;;DAVIS S CHRISTOPHER;;PATTEN PHILLIP A;;TOBIN MATTHEW;;MINSHULL JEREMY;;WELCH MARK;;GUSTAFSSON CLAES;;CARR BRIAN;;JENNE STEPHANE;;RAILLARD SUN AI;;CRAMERI ANDREAS;;STEMMER WILLEM P C;;EMIG ROBIN;;LONGCHAMP PASCAL;;GOLDMAN STANLEY;;GIVER LORRAINE J;;AFFHOLTER JOSEPH A,,https://lens.org/041-829-113-372-735,Patent Application,no,0,0,15,15,0,B01J19/0046;;B01J2219/00378;;B01J2219/00585;;B01J2219/00659;;B01J2219/00675;;B01J2219/00689;;B01J2219/00695;;B01J2219/007;;B01J2219/00722;;B82Y30/00;;C12N15/1027;;C12N15/1031;;C40B60/04;;G16B20/00;;Y02A90/10;;G16B20/50;;G16B20/20;;C12N15/1031;;B01J2219/00722;;B01J2219/00378;;B01J2219/00689;;C40B60/04;;B01J2219/00675;;C12N15/1027;;B01J2219/00695;;B82Y30/00;;B01J2219/007;;B01J2219/00585;;B01J19/0046;;B01J2219/00659;;G16B20/00;;Y02A90/10;;G16B20/20;;G16B20/50,G01N33/53;;C12M1/00;;C12N15/09;;C12N15/10;;C12Q1/68;;G01N37/00;;G16B20/20;;G16B20/50,,0,0,,,,PENDING
