58,WO,A2,WO 2022/020779 A2,042-767-151-160-325,2022-01-27,2022,US 2021/0043073 W,2021-07-23,US 202063055927 P;;US 202063055938 P,2020-07-24,FIELD ASSEMBLED MODULAR ELECTRICAL DISTRIBUTION DEVICE,"The present invention discloses a field assembled electrical distribution device assembled from various prepackaged modular kits. The prepackaged modular kits include all of the components required for their assembly. The prepackaged modular kits, when assembled by a certified assembler using a certified method and verification means provided by the modular kit manufacturer and one or more well know third-party certifiers, meets the requirements local, national and international electrical codes and is eligible for the third-party's certification mark.",SCHNEIDER ELECTRIC USA INC,DOZIER STEVEN WAYNE;;TRAVIS JR;;MORENO-MANZO ADRIAN;;RAMSEY JAMES RAYMOND;;LIFRAN XAVIER,,https://lens.org/042-767-151-160-325,Patent Application,yes,0,0,14,38,0,H02B1/04;;H01H71/08;;H02B1/056;;H01R25/142;;H02B3/00;;H01R11/07;;H01R2101/00;;H01H2071/0278;;H01H71/08;;H01R25/142;;H02B1/04;;H02B3/00;;H01H2071/0278;;H02B1/056;;H02B1/20;;G05B19/188;;G05B2219/31396,G06Q1/08,,0,0,,,,PENDING
59,DE,A1,DE 1475819 A1,162-922-456-291-156,1969-10-30,1969,DE 1475819 A,1965-03-22,US 35397964 A,1964-03-23,Verfahren zum Verlegen einer Rohrleitung auf dem Boden eines Gewaessers,,SHELL INT RESEARCH,DEAN COX HAROLD;;STARR HAMMETT DILLARD;;RONALD DOZIER JAMES;;LAWTON SHATTO JUN HOWARD,,https://lens.org/162-922-456-291-156,Patent Application,no,0,1,6,7,0,F16L1/18;;F16L1/19;;F16L1/203;;B63H25/00;;B63B35/03;;B63H19/00;;F16L1/203;;F16L1/19;;F16L1/18;;B63H25/00;;B63H19/00;;B63B35/03,F16L1/18;;F16L1/19;;F16L1/20,,0,0,,,,EXPIRED
60,US,P1,US 2011/0209256 P1,130-809-697-610-589,2011-08-25,2011,US 71120410 V,2010-02-23,US 71120410 V,2010-02-23,KIWI PLANT NAMED 'AU GOLDEN TIGER',A new and distinct cultivar of the species Actinidia chinesis Planch is described. This cultivar named ‘AU Golden Tiger’ was developed from seeds collected from an open pollinated ‘AU Golden Dragon’ fruit. The seedling has been reproduced by rooted cuttings and grafting and tested in replicated cultivar trials. It maintains all of its unique characteristics after each propagation. Its bloom period overlaps the bloom period of ‘AU Golden Sunshine’ and is the pollinizer for ‘AU Golden Sunshine’.,DOZIER JR WILLIAM ALFRED;;WILKINS BRYAN SHELTON;;PITTS JIM;;HANSEN CURTIS JAY;;SPIERS JAMES D,DOZIER JR WILLIAM ALFRED;;WILKINS BRYAN SHELTON;;PITTS JIM;;HANSEN CURTIS JAY;;SPIERS JAMES D,AUBURN UNIVERSITY (2010-06-24),https://lens.org/130-809-697-610-589,Patent Application,yes,0,1,2,2,0,A01H5/08;;A01H6/00;;A01H5/08;;A01H6/00,A01H6/00;;A01H5/08,PLT 156,0,0,,,,PENDING
61,US,A,US 3503296 A,192-103-964-396-842,1970-03-31,1970,US 3503296D A,1967-07-18,US 65418967 A,1967-07-18,VISUAL KEYBOARD TEACHING DEVICE,,ELECTRO LEARNER CORP,SCHMOYER ARTHUR R;;DOZIER JAMES J JR;;BRADFORD RICHARD H;;BOSWELL JOHN E E JR,SCHMOYER CHARLES F. (1989-04-17);;SCHOMOYER MARION F (1986-06-18),https://lens.org/192-103-964-396-842,Granted Patent,no,2,12,3,3,0,G01R13/40;;G06F3/023;;G09B13/00;;G09B15/08;;G09G3/001;;G09G3/14;;G09G3/14;;G09B15/08;;G09B13/00;;G06F3/023;;G01R13/40;;G09G3/001,G01R13/40;;G06F3/023;;G09B13/00;;G09B15/08;;G09G3/00,84/478,0,0,,,,EXPIRED
62,CA,A,CA 831713 A,129-056-707-245-644,1970-01-13,1970,CA 831713D A,,CA 831713T A,,VISUAL KEYBOARD TEACHING DEVICE,,ELECTRO LEARNER CORP,SCHMOYER ARTHUR R;;DOZIER JAMES J JR;;BRADFORD RICHARD H;;BOSWELL JOHN E E JR,,https://lens.org/129-056-707-245-644,Granted Patent,no,0,1,1,1,0,,,,0,0,,,,EXPIRED
63,US,A1,US 2023/0170673 A1,006-651-649-920-651,2023-06-01,2023,US 202117920275 A,2021-07-23,US 202117920275 A;;US 202063055927 P;;US 202063055938 P;;US 2021/0043073 W,2020-07-24,FIELD ASSEMBLED MODULAR ELECTRICAL DISTRIBUTION DEVICE,"The present invention discloses a field assembled electrical distribution device assembled from various prepackaged modular kits. The prepackaged modular kits include all of the components required for their assembly. The prepackaged modular kits, when assembled by a certified assembler using a certified method and verification means provided by the modular kit manufacturer and one or more well know third-party certifiers, meets the requirements local, national and international electrical codes and is eligible for the third-party's certification mark.",SCHNEIDER ELECTRIC USA INC,DOZIER STEVEN WAYNE;;TRAVIS JR CHARLES WESLEY;;MORENO-MANZO ADRIAN;;RAMSEY JAMES RAYMOND;;LIFRAN XAVIER,SCHNEIDER ELECTRIC USA INC (2021-09-20),https://lens.org/006-651-649-920-651,Patent Application,yes,0,0,14,38,0,H02B1/04;;H01H71/08;;H02B1/056;;H01R25/142;;H02B3/00;;H01R11/07;;H01R2101/00;;H01H2071/0278;;H01H71/08;;H01R25/142;;H02B1/04;;H02B3/00;;H01H2071/0278;;H02B1/056;;H02B1/20;;G05B19/188;;G05B2219/31396,H02B3/00;;H01R25/14;;H02B1/04,,0,0,,,,PENDING
64,BR,A2,BR 112023001247 A2,051-898-574-001-488,2023-02-14,2023,BR 112023001247 A,2021-07-23,US 2021/0043073 W;;US 202063055927 P;;US 202063055938 P,2020-07-24,DISPOSITIVO DE DISTRIBUIÇÃO ELÉTRICA MODULAR MONTADO EM CAMPO,"DISPOSITIVO DE DISTRIBUIÇÃO ELÉTRICA MODULAR MONTADO EM CAMPO. A presente invenção revela um dispositivo de distribuição elétrica montado em campo montado a partir de vários kits modulares pré-embalados. Os kits modulares pré-embalados incluem todos os componentes necessários para sua montagem. Os kits modulares pré-embalados, quando montados por um montador certificado usando o método certificado e meios de verificação fornecidos pelo fabricante do kit modular e um ou mais certificadores de terceiros bem conhecidos, satisfazem os requisitos dos códigos elétricos locais, nacionais e internacionais e são elegíveis para o marca de certificação de terceiros.",SCHNEIDER ELECTRIC USA INC,STEVEN WAYNE DOZIER;;CHARLES WESLEY TRAVIS JR;;ADRIAN MORENO-MANZO;;JAMES RAYMOND RAMSEY;;XAVIER LIFRAN,,https://lens.org/051-898-574-001-488,Patent Application,no,0,0,14,38,0,H02B1/04;;H01H71/08;;H02B1/056;;H01R25/142;;H02B3/00;;H01R11/07;;H01R2101/00;;H01H2071/0278;;H01H71/08;;H01R25/142;;H02B1/04;;H02B3/00;;H01H2071/0278;;H02B1/056;;H02B1/20;;G05B19/188;;G05B2219/31396,H02G5/00;;H01H71/02;;H02B1/42;;H02B3/00,,0,0,,,,PENDING
65,US,P2,US PP022140 P2,166-570-035-533-574,2011-09-13,2011,US 71120410 V,2010-02-23,US 71120410 V,2010-02-23,Kiwi plant named Au Golden Tiger,A new and distinct cultivar of the species Actinidia chinesis Planch is described. This cultivar named ‘AU Golden Tiger’ was developed from seeds collected from an open pollinated ‘AU Golden Dragon’ fruit. The seedling has been reproduced by rooted cuttings and grafting and tested in replicated cultivar trials. It maintains all of its unique characteristics after each propagation. Its bloom period overlaps the bloom period of ‘AU Golden Sunshine’ and is the pollinizer for ‘AU Golden Sunshine’.,UNIV AUBURN,DOZIER JR WILLIAM ALFRED;;WILKINS BRYAN SHELTON;;PITTS JIM;;HANSEN CURTIS JAY;;SPIERS JAMES D,,https://lens.org/166-570-035-533-574,Plant Patent,yes,0,1,2,2,0,A01H5/08;;A01H6/00;;A01H5/08;;A01H6/00,A01H6/00;;A01H5/08,PLT 156,2,0,,,"Wall et al., ""Vegetative and Floral Chilling Requirement of Four New Kiwi Cultivars of Actinidia chinensis and A. deliciosa,"" (Hort Science 43(3):644-647, Jun. 2008.;;Wall et al., ""Determining a Maturity Index and the Effect of Chilling Requirements, and Cytokinin Applications on Three New Kiwi Cultivars,"" Thesis-Degree of Master of Science, Auburn University, Aug. 2006, 87 pages.",PENDING
66,DE,A1,DE 1772332 A1,154-343-502-241-55X,1971-03-04,1971,DE 1772332 A,1968-04-30,US 65418967 A,1967-07-18,Visuelle Tastatur-Lehrvorrichtung,,SCHMOYER ARTHUR R,R SCHMOYER ARTHUR;;J DOZIER JUN JAMES;;H BRADFORD RICHARD;;E E BOSWELL JUN JOHN,,https://lens.org/154-343-502-241-55X,Patent Application,no,0,0,3,3,0,G01R13/40;;G06F3/023;;G09B13/00;;G09B15/08;;G09G3/001;;G09G3/14;;G09G3/14;;G09B15/08;;G09B13/00;;G06F3/023;;G01R13/40;;G09G3/001,G01R13/40;;G06F3/023;;G09B13/00;;G09B15/08;;G09G3/00,,0,0,,,,DISCONTINUED
67,EP,A2,EP 4136723 A2,025-568-766-277-978,2023-02-22,2023,EP 21845518 A,2021-07-23,US 202063055927 P;;US 202063055938 P;;US 2021/0043073 W,2020-07-24,FIELD ASSEMBLED MODULAR ELECTRICAL DISTRIBUTION DEVICE,,SCHNEIDER ELECTRIC USA INC,DOZIER STEVEN WAYNE;;TRAVIS JR CHARLES WESLEY;;MORENO-MANZO ADRIAN;;RAMSEY JAMES RAYMOND;;LIFRAN XAVIER,,https://lens.org/025-568-766-277-978,Patent Application,yes,0,0,14,38,0,H02B1/04;;H01H71/08;;H02B1/056;;H01R25/142;;H02B3/00;;H01R11/07;;H01R2101/00;;H01H2071/0278;;H01H71/08;;H01R25/142;;H02B1/04;;H02B3/00;;H01H2071/0278;;H02B1/056;;H02B1/20;;G05B19/188;;G05B2219/31396,H02G5/00;;H01H71/02;;H02B1/42;;H02B3/00,,0,0,,,,PENDING
68,US,A,US 3221816 A,194-573-217-514-39X,1965-12-07,1965,US 15765461 A,1961-12-07,US 15765461 A,1961-12-07,Underwater oil gathering installation,,SHELL OIL CO,SHATTO JR HOWARD L;;WATKINS BRUCE J;;RONALD DOZIER JAMES;;FAULK BILL L;;GOEPFERT BENJAMIN L,,https://lens.org/194-573-217-514-39X,Granted Patent,no,9,19,1,4,0,B63B21/50;;B65D88/78;;E21B43/017;;E21B43/36;;E21B43/36;;E21B43/017;;B63B21/50;;B65D88/78,B63B21/50;;B65D88/78;;E21B43/017;;E21B43/36,,0,0,,,,EXPIRED
69,US,A1,US 2003/0041117 A1,004-136-115-046-171,2003-02-27,2003,US 9741802 A,2002-03-15,US 9741802 A;;US 20474598 A;;US 41298195 A,1995-03-28,Method and apparatus for publishing hypermedia documents over wide area networks,"
   The present invention addresses the critical needs of publishers seeking to create and publish hypermedia content in electronic form across the wide area networks (WAN's) such as the World Wide Web. Toward this end, a client-server development platform is provided for handling the important functions of document authoring, content-based indexing and retrieval of documents, management and control of proprietary assets, and a support for developing form-driven interactive services, all in a manner that is uniquely and seamlessly WAN-integrated. 
",AMERICA ONLINE INC,DOZIER LINDA T;;WILLIAMS GEORGE W;;LONG DAVE;;MCKEE DOUGLAS M;;DAVIDSON JAMES G;;BRADY KAREN,OATH INC (2009-12-04);;AOL LLC (2006-04-03),https://lens.org/004-136-115-046-171,Patent Application,yes,16,15,16,16,0,G06F16/10;;G06F16/10;;G06F16/958;;G06F16/958,G06F17/21;;G06F12/00;;G06F13/00;;G06F17/30,709/217;;709/203,0,0,,,,EXPIRED
70,US,A,US 3252439 A,170-482-409-727-66X,1966-05-24,1966,US 43382364 A,1964-12-08,US 43382364 A;;US 15765461 A,1961-12-07,Underwater oil gathering installation,,SHELL OIL CO,SHATTO JR HOWARD L;;WATKINS BRUCE J;;DOZIER JAMES R;;FAULK BILL L;;GOEPFERT BENJAMIN L,,https://lens.org/170-482-409-727-66X,Granted Patent,no,6,17,1,4,0,B63B21/50;;E21B43/017;;B63B21/50;;E21B43/017,B63B21/50,,0,0,,,,EXPIRED
71,US,A,US 5870552 A,091-260-261-954-155,1999-02-09,1999,US 41298195 A,1995-03-28,US 41298195 A,1995-03-28,Method and apparatus for publishing hypermedia documents over wide area networks,"The present invention addresses the critical needs of publishers seeking to create and publish hypermedia content in electronic form across wide area networks (""WAN's"") such as the World Wide Web. Toward this end, a client-server development platform is provided for handling the important functions of document authoring, content-based indexing and retrieval of documents, management and control of proprietary assets, and support for developing form-driven interactive services, all in a manner that is uniquely and seamlessly WAN-integrated.",AMERICA ONLINE INC,DOZIER LINDA T;;WILLIAMS V GEORGE W;;LONG DAVE;;MCKEE DOUGLAS M;;DAVIDSON JAMES G;;BRADY KAREN,AOL LLC (2006-04-03);;NAVISOFT INC (1995-05-25);;AOL INC (2009-12-04),https://lens.org/091-260-261-954-155,Granted Patent,yes,14,510,16,16,0,G06F16/10;;G06F16/10;;G06F16/958;;G06F16/958,G06F17/21;;G06F12/00;;G06F13/00;;G06F17/30,395/200.49;;395/200.33;;707/501,16,2,004-255-456-001-096;;120-336-686-771-491,10.1145/181894.181895;;10.1145/179606.179671,"Veljkov et al.; Pocket Guides to the Internet: vol. 2: Transferring Files with File Transfer Protocol; ISBN 0 88736 944 8; Meckler Corp., Westport CT USA; pp. 11 17, 1994.;;Vatton, I.; Amaya W3C s Browser/Editor ; retrieved from internet as http://www.w3.org/Amaya/, Jul. 10, 1998.;;Vatton, I.; Amaya 1.3 ; retrived fro internet at http://www.w3.org/Amaya/User/New.html, Jul. 10, 1998.;;Claris, MacProjectII Users Guide, Claris Corporation, Mountain Viwe, CA, 1986, Chapters 1 4, pp. 1 138, Dec. 1986.;;Publishing on the Web , B. Rousseau, 1995 Cern School of Computing, Proceedings (Cern 95 05), 1995 Cern School of Computing, Proceedings, Arles, France, 20 Aug. 2 Sep. 1995, 1995 Geneva, Switzerland, Cern, Switzerland, pp. 279 293, XP000578592.;;Hughes, Kevin, Entering the World Wide Web: A Guide to Cyberspace, May 1994.;;Berners Lee, Tim, et al., The World Wide Web, Communications of the ACM, Aug. 1994.;;Baker, Steven, Hypertext Browsing on the Internet, UNIX Review, Sep. 1994.;;Gunn, Angela, Power in Pictures: Easier Than It Looks, Computer Shopper, Nov. 1994.;;McArthur, Douglas C., World Wide Web and HTML, Dr. Dobb s Journal of Software Tools, Dec. 1994.;;Lewis, Peter H., Business Technology: Prodigy Leads Its Peers Onto the world Wide Web, The New York Times, Jan. 18, 1995, Sec. D, p. 7, Col. 1, Business/Financial Desk.;;Flynn, Laurie, The Executive Computer: Browsers Make Navigating the World Wide Web a Snap, The New York Times, Jan. 29, 1995, Sec. 3, p. 6, Col. 1, Business/Financial Desk.;;Boutell, Thomas, World Wide Web Frequently Asked Questions, World Wide Web FAQ, Jan. 23, 1995, resides on the World Wide Web on Sunsite.;;Cover Story: Electronic Publishing, PC Magazine, Feb. 7, 1995, pp. 110 196.;;Cortese, Amy, et al., Cyberspace, Business Week, Feb. 27, 1995, pp. 78 86.;;Marriott, Michel, et al., Super Cyber Surfers, Newsweek, Mar. 20, 1995, pp. 43 44.",EXPIRED
72,US,A1,US 2007/0168355 A1,157-776-658-501-71X,2007-07-19,2007,US 56228706 A,2006-11-21,US 56228706 A;;US 9741802 A;;US 20474598 A;;US 41298195 A,1995-03-28,Method and Apparatus for Publishing Hypermedia Documents Over Wide Area Networks,"The present invention addresses the critical needs of publishers seeking to create and publish hypermedia content in electronic form across the wide area networks (“WAN's”) such as the World Wide Web. Toward this end, a client-server development platform is provided for handling the important functions of document authoring, content-based indexing and retrieval of documents, management and control of proprietary assets, and a support for developing form-driven interactive services, all in a manner that is uniquely and seamlessly WAN-integrated.",AMERICA ONLINE INC,DOZIER LINDA T;;WILLIAMS GEORGE W V;;LONG DAVE;;MCKEE DOUGLAS M;;DAVIDSON JAMES G;;BRADY KAREN,AOL LLC (2006-04-03);;NAVISOFT INC (1995-05-15);;AOL INC (2009-12-04),https://lens.org/157-776-658-501-71X,Patent Application,yes,31,7,16,16,0,G06F16/10;;G06F16/10;;G06F16/958;;G06F16/958,G06F17/21;;G06F17/30;;G06F12/00;;G06F13/00,707/10,0,0,,,,DISCONTINUED
73,WO,A1,WO 1996/030846 A1,159-360-129-481-884,1996-10-03,1996,US 9601686 W,1996-03-21,US 41298195 A,1995-03-28,AN INTEGRATED DEVELOPMENT PLATFORM FOR DISTRIBUTED PUBLISHING AND MANAGEMENT OF HYPERMEDIA OVER WIDE AREA NETWORKS,"The present invention addresses the critical needs of publishers seeking to create and publish hypermedia content in electronic form across wide area networks ('WAN's') such as the World Wide Web. Toward this end, a client-server development platform is provided for handling the important functions of document authoring, content-based indexing and retrieval of documents, management and control of proprietary assets, and support for developing form-driven interactive services, all in a manner that is uniquely and seamlessly WAN-integrated.",NAVISOFT INC,DOZIER LINDA T;;WILLIAMS GEORGE W V;;LONG DAVE;;MCKEE DOUGLAS M;;DAVIDSON JAMES G;;BRADY KAREN,,https://lens.org/159-360-129-481-884,Patent Application,yes,0,5,16,16,0,G06F16/10;;G06F16/10;;G06F16/958;;G06F16/958,G06F17/21;;G06F12/00;;G06F13/00;;G06F17/30,,1,0,,,"ROUSSEAU B: ""Publishing on the Web"", 1995 CERN SCHOOL OF COMPUTING. PROCEEDINGS (CERN 95-05), 1995 CERN SCHOOL OF COMPUTING. PROCEEDINGS, ARLES, FRANCE, 20 AUG.-2 SEPT. 1995, 1995, GENEVA, SWITZERLAND, CERN, SWITZERLAND, pages 279 - 293, XP000578592",PENDING
74,AU,B2,AU 705581 B2,117-429-236-067-709,1999-05-27,1999,AU 1996/053538 A,1996-03-01,US 41298195 A;;US 9601686 W,1995-03-28,An integrated development platform for distributed publishing and management of hypermedia over wide area networks,,NAVISOFT INC,DOZIER LINDA T;;WILLIAMS GEORGE W V;;LONG DAVE;;MCKEE DOUGLAS M;;DAVIDSON JAMES G;;BRADY KAREN,"AMERICA ONLINE, INC. (2001-08-02)",https://lens.org/117-429-236-067-709,Granted Patent,no,2,0,16,16,0,G06F16/10;;G06F16/10;;G06F16/958;;G06F16/958,G06F17/21;;G06F12/00;;G06F13/00;;G06F17/30,,0,0,,,,EXPIRED
75,CA,A1,CA 2216826 A1,135-389-368-777-04X,1996-10-03,1996,CA 2216826 A,1996-03-21,US 41298195 A;;US 9601686 W,1995-03-28,AN INTEGRATED DEVELOPMENT PLATFORM FOR DISTRIBUTED PUBLISHING AND MANAGEMENT OF HYPERMEDIA OVER WIDE AREA NETWORKS,"The present invention addresses the critical needs of publishers seeking to create and publish hypermedia content in electronic form across wide area networks (""WAN's"") such as the World Wide Web. Toward this end, a clientserver development platform is provided for handling the important functions of document authoring, content-based indexing and retrieval of documents, management and control of proprietary assets, and support for developing formdriven interactive services, all in a manner that is uniquely and seamlessly WAN-integrated.",NAVISOFT INC,DOZIER LINDA T;;WILLIAMS GEORGE W V;;DAVIDSON JAMES G;;MCKEE DOUGLAS M;;LONG DAVE;;BRADY KAREN,,https://lens.org/135-389-368-777-04X,Patent Application,no,0,2,16,16,0,G06F16/10;;G06F16/10;;G06F16/958;;G06F16/958,G06F17/21;;G06F12/00;;G06F13/00;;G06F17/30,,0,0,,,,EXPIRED
76,US,B2,US 7139812 B2,168-731-072-558-436,2006-11-21,2006,US 9741802 A,2002-03-15,US 9741802 A;;US 20474598 A;;US 41298195 A,1995-03-28,Method and apparatus for publishing hypermedia documents over wide area networks,"The present invention addresses the critical needs of publishers seeking to create and publish hypermedia content in electronic form across the wide area networks (“WAN's”) such as the World Wide Web. Toward this end, a client-server development platform is provided for handling the important functions of document authoring, content-based indexing and retrieval of documents, management and control of proprietary assets, and a support for developing form-driven interactive services, all in a manner that is uniquely and seamlessly WAN-integrated.",AMERICA ONLINE INC,DOZIER LINDA T;;WILLIAMS V GEORGE W;;LONG DAVE;;MCKEE DOUGLAS M;;DAVIDSON JAMES G;;BRADY KAREN,OATH INC (2009-12-04);;AOL LLC (2006-04-03),https://lens.org/168-731-072-558-436,Granted Patent,yes,41,8,16,16,0,G06F16/10;;G06F16/10;;G06F16/958;;G06F16/958,G06F15/16;;G06F17/21;;G06F12/00;;G06F13/00;;G06F17/30,709/218;;709/219;;715/501.1,27,4,096-161-496-511-752;;109-261-141-855-802;;004-255-456-001-096;;120-336-686-771-491,10.1049/ic:19951257;;10.17487/rfc2291;;10.1145/181894.181895;;10.1145/179606.179671,"Jing Xiang He et al., ""A tool for hypertext-based systems analysis and dynamic evaluation"", IEEE Conference on System Sciences, vol. 3, pp. 5-14, Jan. 1994.;;Theng, Y.L. et al., ""Designer tools for hypertext authoring"", IEEE Colloquium on Authoring and Application of Hypermedia-Based Use-Interfaces, pp. 4/1-4/4, Nov. 1995.;;Slein, J. et al., ""Requirements for a distributed authoring and versioning protocol for the world wide web"", RFC2291, pp. 1-21, Feb. 1998.;;Cesare Maioli et al., Anchors and Paths in a Hypertext Publishing System, Feb. 1993, Technical Report UBLCS-93-3, Laboratory for Computer Science University of Bologna, 13 pages, [retrieved from http://citeseer.csail.mit.edu/ on Mar. 10, 2006].;;Cesare Maioli et al., Versioning issues in a Collaborative Distributed Hypertext System, Apr. 1993, Technical Report UBLCS-93-6, Laboratory for Computer Science University of Bologna, 16 pages, [retrieved from http://citeseer.csail.mit.edu/ on Mar. 10, 2006].;;Cesare Maioli et al., Wide-Area Distribution Issue in Hypertext Systems, Oct. 1993, Technical Report UBLCS-93-24, Laboratory for Computer Science, University of Bologna, 15 pages, [retrieved from http://citeseer.csail.mit.edu/ on Mar. 17, 2006].;;Nick Willaims et al., Experiences in Writing a WYSIWYG Editor for HTML, Proceedings of WWW '94, Switzerland, 1994, 12 pages, [retrieved from http://citeseer.csail.mit.edu/ on Mar. 17, 2006].;;Claris, ""MacProjectII Users' Guide,"" Claris Corporation, Mountain View, CA, 1986, Chapters 1-4, pp. 1-138.;;Hughes, Kevin, ""Entering the World-Wide Web: A Guide to Cyberspace,"" May 1994.;;Berners-Lee, Tim, et al., ""The World-Wide Web,"" Communications of the ACM, Aug. 1994.;;Baker, Steven, ""Hypertext Browsing on the Internet,"" UNIX Review, Sep. 1994.;;Gunn, Angela, ""Power in Pictures: Easier That It Looks,"" Computer Shopper, Nov. 1994.;;McArthur, Douglas C., ""World Wide Web and HTML,"" Dr. Dobb's Journal of Software Tools, Dec. 1994.;;Lewis, Peter H., ""Business Technology: Prodigy Leads Its Peers Onto the World Wide Web,"" The New York Times, Jan. 18, 1995, Sec. D, p. 7, col. L1, ""Business/Financial Desk"".;;Flynn, Laurie, ""The Executive Computer: Browsers Make Navigating the World Wide Web a Snap,"" The New York Times, Jan. 29, 1995, Sec. 3, p. 6, col. 1, ""Business/Financial Desk"".;;Boutell, Thomas, ""World Wide Web Frequently Asked Questions,"" World Wide Web FAQ, Jan. 23, 1995, resides on the World Wide Web on Sunsite.;;""Cover Story: Electronic Publishing,"" PC Magazine, Feb. 7, 1995, pp. 110-196.;;Cortese, Amy, et al., ""Cyberspace,"" Business Week, Feb. 27, 1995, pp. 78-86.;;Marriott, Michel, et al., ""Super Cyber Surfers,"" Newsweek, Mar. 20, 1995, pp. 43-44.;;Veljkov et al.; Pocket Guides to the Internet: vol. 2: Transferring Files with File Transfer Protocol; ISBN 0-88736-944-8; Meckler Corp., Westport CT USA; pp. 11-17, 1994.;;""San Francisco Reservations,"" Internet Magazine, No. 2, Japan, Dec. 18, 1994, pp. 126-127.;;""Publishing on the Web"", B. Rousseau, 1995 Cern School of Computing, Proceedings (Cern 95-05), 1995 Cern School of Computing, Proceedings, Arles, France, Aug. 20-Sep. 2, 1995, 1995 Geneva, Switzerland, Cern, Switzerland, pp. 279-293, XP000578592.;;Vatton, I., ""Amaya-W3C's Browser/Editor"", retrieved from Internet at http://www.w3.org/Amaya/, Jul. 10, 1998.;;Vatton, I., ""Amaya 1.3"", retrieved from Internet at http://www.w3.org/Amaya/User/New.html, Jul. 10, 1998.;;Office Action issued Feb. 7, 2006 f or Application No. 2004-170836.;;Information Processing Society, 49<SUP>th</SUP>, International Conference, Sep. 30, 1994, pp. 1-13 and 1-14.;;HTML Quick Reference, INTERNET magazine No. 3, Impress Co., Feb. 18, 1995, No. 3, pp. 9-11.",EXPIRED
