77,US,B1,US 6393469 B1,034-929-366-936-193,2002-05-21,2002,US 20474598 A,1998-12-02,US 20474598 A;;US 41298195 A,1995-03-28,Method and apparatus for publishing hypermedia documents over wide area networks,"
    The present invention addresses the critical needs of publishers seeking to create and publish hypermedia content in electronic form across the wide area networks (WAN's) such as the World Wide Web. Toward the end, a client-server development platform is provided for handling the important functions of document authoring, content-based indexing and retrieval of documents, management and control of proprietary assets, and a support for developing form-driven interactive services, all in a manner that is uniquely and seemlessly WAN-integrated. 
",AMERICA ONLINE INC,DOZIER LINDA T;;WILLIAMS V GEORGE W;;LONG DAVE;;MCKEE DOUGLAS M;;DAVIDSON JAMES G;;BRADY KAREN,OATH INC (2009-12-04);;AOL LLC (2006-04-03),https://lens.org/034-929-366-936-193,Granted Patent,yes,15,45,16,16,0,G06F16/10;;G06F16/10;;G06F16/958;;G06F16/958,G06F17/21;;G06F12/00;;G06F13/00;;G06F17/30,709/219;;709/218;;707/501.1,17,2,004-255-456-001-096;;120-336-686-771-491,10.1145/181894.181895;;10.1145/179606.179671,"Vatton, I, ""Amaya-W3C's Browser/Editor"", www.w3.org/Amaya/, Jul. 1998.*;;Vatton, I., ""Amaya 1.3"", www.w3c.org/Amaya/User/New, Jul. 1998.*;;""Publishing on the Web"", B. Rousseau, 1995 Cern School of Computing, Proceedings (Cern 95-05), 1995 Cern School of Computing, Proceedings, Arles, France, Aug. 20-Sep. 2, 1995, 1995 Geneva, Switzerland, Cern, Switzerland, pp. 279-293, XP000578592.;;Claris, ""MacProjectII Users' Guide,"" Claris Corporation, Mountain View, CA, 1986, Chapters 1-4, pp. 1-138.;;Hughes, Kevin, ""Entering the World-Wide Web: A Guide to Cyberspace,"" May, 1994.;;Berners-Lee, Tim, et al., ""The World-Wide Web,"" Communications of the ACM, Aug., 1994.;;Baker, Steven, ""Hypertext Browsing on the Internet,"" UNIX Review, Sep., 1994.;;Gunn, Angela, ""Power in Pictures: Easier Than It Looks,"" Computer Shopper, Nov., 1994.;;McArthur, Douglas C., ""World Wide Web and HTML,"" Dr. Dobb's Journal of Software Tools, Dec., 1994.;;Lewis, Peter H., ""Business Technology: Prodigy Leads Its Peers Onto the World Wide Web,"" The New York Times, Jan. 18, 1995, Sec. D, p. 7, Col. L1, ""Business/Financial Desk"".;;Flynn, Laurie, ""The Executive Computer: Browsers Make Navigating the World Wide Web a Snap,"" The New York Times, Jan. 29, 1995, Sec. 3, p. 6, Col. 1, ""Business/Financial Desk"".;;Boutell, Thomas, ""World Wide Web Frequently Asked Questions,"" World Wide Web FAQ, Jan. 23, 1995, resides on the World Wide Web on Sunsite.;;""Cover Story: Electronic Publishing,"" PC Magazine, Feb. 7, 1995, pp. 110-196.;;Cortese, Amy, et al., ""Cyberspace,"" Business Week, Feb. 27, 1995, pp. 78-86.;;Marriott, Michel, et al., ""Super Cyber Surfers,"" Newsweek, Mar. 20, 1995, pp. 43-44.;;Veljkov et al.; Pocket Guides to the Internet:vol. 2: Transferring Files with File Transfer Protocol; ISBN 0-88736-944-8; Meckler Corp., Westport CT USA; pp. 11-17, 1994.;;""San Francisco Reservations,"" Internet Magazine, No. 2, Japan, Dec. 18, 1994, pp. 126-127.",EXPIRED
78,EP,A1,EP 0818013 A1,140-319-822-254-298,1998-01-14,1998,EP 96910306 A,1996-03-21,US 9601686 W;;US 41298195 A,1995-03-28,AN INTEGRATED DEVELOPMENT PLATFORM FOR DISTRIBUTED PUBLISHING AND MANAGEMENT OF HYPERMEDIA OVER WIDE AREA NETWORKS,,NAVISOFT INC,DOZIER LINDA T;;WILLIAMS GEORGE W V;;LONG DAVE;;MCKEE DOUGLAS M;;DAVIDSON JAMES G;;BRADY KAREN,"AMERICA ONLINE, INC. (2001-05-16)",https://lens.org/140-319-822-254-298,Patent Application,yes,0,0,16,16,0,G06F16/10;;G06F16/10;;G06F16/958;;G06F16/958,G06F17/21;;G06F12/00;;G06F13/00;;G06F17/30,,1,0,,,See references of WO 9630846A1,DISCONTINUED
79,AU,A,AU 1996/053538 A,106-544-919-532-248,1996-10-16,1996,AU 1996/053538 A,1996-03-01,US 41298195 A;;US 9601686 W,1995-03-28,An integrated development platform for distributed publishin g and management of hypermedia over wide area networks,,AMERICA ONLINE INC,DOZIER LINDA T;;WILLIAMS GEORGE W V;;LONG DAVE;;MCKEE DOUGLAS M;;DAVIDSON JAMES G;;BRADY KAREN,"AMERICA ONLINE, INC. (2001-08-02)",https://lens.org/106-544-919-532-248,Patent Application,no,0,0,16,16,0,G06F16/10;;G06F16/10;;G06F16/958;;G06F16/958,G06F17/21;;G06F12/00;;G06F13/00;;G06F17/30,,0,0,,,,EXPIRED
80,CA,C,CA 2216826 C,004-641-333-536-539,2009-01-27,2009,CA 2216826 A,1996-03-21,US 41298195 A;;US 9601686 W,1995-03-28,AN INTEGRATED DEVELOPMENT PLATFORM FOR DISTRIBUTED PUBLISHING AND MANAGEMENT OF HYPERMEDIA OVER WIDE AREA NETWORKS,"The present invention addresses the critical needs of publishers seeking to create and publish hypermedia content in electronic form across wide area networks (""WAN's"") such as the World Wide Web. Toward this end, a client-server development platform is provided for handling the important functions of document authoring, content-based indexing and retrieval of documents, management and control of proprietary assets, and support for developing form-driven interactive services, all in a manner that is uniquely and seamlessly WAN-integrated.",NAVISOFT INC,DAVIDSON JAMES G;;LONG DAVE;;DOZIER LINDA T;;MCKEE DOUGLAS M;;BRADY KAREN;;WILLIAMS V GEORGE W,,https://lens.org/004-641-333-536-539,Granted Patent,no,0,0,16,16,0,G06F16/10;;G06F16/10;;G06F16/958;;G06F16/958,G06F17/21;;H04L12/16;;G06F12/00;;G06F13/00;;G06F17/00;;G06F17/30,,0,0,,,,EXPIRED
81,DE,B2,DE 1475819 B2,148-667-641-022-537,1974-05-30,1974,DE 1475819 A,1965-03-22,US 35397964 A,1964-03-23,DE 1475819 B2,,"SHELL INTERNATIONALE RESEARCH MAATSCHAPPIJ B.V., DEN HAAG (NIEDERLANDE)","COX, HAROLD DEAN, METAIRIE, LA.;;HAMMETT, DILLARD STARR, HACIENDA HEIGHTS;;DOZIER, JAMES RONALD, WHITTIER;;SHATTO JUN., HOWARD LAWTON, GLENVILLE, CONN.",,https://lens.org/148-667-641-022-537,Patent Application,no,0,0,6,7,0,F16L1/18;;F16L1/19;;F16L1/203;;B63H25/00;;B63B35/03;;B63H19/00;;F16L1/203;;F16L1/19;;F16L1/18;;B63H25/00;;B63H19/00;;B63B35/03,F16L1/18;;F16L1/19;;F16L1/20,,0,0,,,,EXPIRED
82,DE,C3,DE 1475819 C3,187-846-948-728-938,1975-01-16,1975,DE 1475819 A,1965-03-22,US 35397964 A,1964-03-23,DE 1475819 C3,,"SHELL INTERNATIONALE RESEARCH MAATSCHAPPIJ B.V., DEN HAAG (NIEDERLANDE)","COX, HAROLD DEAN, METAIRIE, LA.;;HAMMETT, DILLARD STARR, HACIENDA HEIGHTS;;DOZIER, JAMES RONALD, WHITTIER;;SHATTO JUN., HOWARD LAWTON, GLENVILLE, CONN.",,https://lens.org/187-846-948-728-938,Granted Patent,no,0,0,6,7,0,F16L1/18;;F16L1/19;;F16L1/203;;B63H25/00;;B63B35/03;;B63H19/00;;F16L1/203;;F16L1/19;;F16L1/18;;B63H25/00;;B63H19/00;;B63B35/03,F16L1/18;;F16L1/19;;F16L1/20,,0,0,,,,EXPIRED
83,US,A,US 5493677 A,142-072-602-003-922,1996-02-20,1996,US 25537994 A,1994-06-08,US 25537994 A,1994-06-08,"Generation, archiving, and retrieval of digital images with evoked suggestion-set captions and natural language interface","Digitized images are associated with English language captions and other data, collectively known as the metadata associated with the images. A natural language processing database removes ambiguities from the metadata, and the images and the metadata are stored in databases. A user formulates a search query, and natural language processing is used to determine matches between the query and the stored metadata. Images corresponding to the matches are then viewed, and desired images are selected for licensing. The license terms for selected images are displayed, and a subset of the selected images are ordered as desired by the user.",SYSTEMS RESEARCH & APPLIC CORP,BALOGH ARISTOTLE;;BLEJER HATTE;;CHEN EUGENE;;FLANK SHARON;;IANNACONE CARMEN;;MALONEY JOHN;;MARTIN PATRICK;;ROTHEY JAMES;;SCHMID GARY;;DOZIER LINDA T;;LORTON MICHAEL,EASTMAN KODAK COMPANY (ONE HALF INTEREST) (1997-07-30);;APPLE INC (2013-02-11);;SYSTEMS RESEARCH & APPLICATIONS CORPORATION (1994-08-10);;EASTMAN KODAK COMPANY (1997-07-22);;PICTURE NETWORK INTERNATIONAL LTD (1997-05-19),https://lens.org/142-072-602-003-922,Granted Patent,yes,11,918,3,3,0,G06Q30/04;;G06T11/00;;H04N1/00864;;H04N1/00872;;H04N1/32144;;H04N1/32208;;H04N1/32251;;H04N1/32309;;H04N2201/3233;;H04N2201/327;;H04N2201/3273;;G06T1/0021;;G06F16/54;;G06F16/78;;G06F16/5838;;G06F16/70;;G06F16/58;;G06Q30/04;;H04N2201/327;;H04N1/00872;;H04N2201/3273;;H04N1/00864;;H04N2201/3233;;H04N1/32309;;H04N1/32208;;H04N1/32251;;G06T11/00;;H04N1/32144;;Y10S707/966;;Y10S707/915;;Y10S707/99945;;G06T1/0021;;G06F16/54;;G06F16/78;;G06F16/58;;G06F16/70;;G06F16/5838;;G06F16/587,G06F17/30;;G06Q30/04;;G06T1/00;;G06T11/00;;H04N1/00;;H04N1/32;;H04N1/44,395/600;;364/419.01;;364/419.02;;364/419.07;;364/419.08;;364/974;;364/963.5;;364/282.1;;364/225.5;;X364DIG 1;;X364DIG 2,0,0,,,,EXPIRED
84,EP,A1,EP 4238673 A1,167-159-328-113-182,2023-09-06,2023,EP 23156411 A,2023-02-13,US 202217653535 A,2022-03-04,ALIGNING OF MELTING BEAM SOURCE IN ADDITIVE MANUFACTURING SYSTEM,"Embodiments of the disclosure relate to the aligning of a melting beam source in an additive manufacturing (AM) system (100). Methods of the disclosure may include forming a first test article (104) and a second test article (302) of different shapes on a build plate (118). The method further includes measuring a vertical scale, vertical alignment, horizontal scale, and an alignment of the melting beam source using the first and second test articles (104, 302). The method includes determining whether one of the vertical scale, the vertical alignment, the horizontal scale, or the horizontal alignment of the melting beam source is not within a corresponding tolerance of a target specification. If at least one of the vertical scale, the vertical alignment, the horizontal scale, or the horizontal alignment is within the corresponding tolerance, the method includes adjusting the melting beam source of the AM system (100) to align the melting beam source to yield the target specification.
",GEN ELECTRIC,POURCHO JOHN BRYAN;;ROHRSSEN ROBERT JOSEPH;;MILLER MAXWELL EVAN;;MURRAY III JAMES JOSEPH;;HORTON MICHAEL RYAN;;DOZIER EVAN JOHN;;GRIFFIS CLAY THOMAS;;DULKIEWICZ CHAD JOSEPH,GENERAL ELECTRIC TECHNOLOGY GMBH (2023-12-13),https://lens.org/167-159-328-113-182,Patent Application,yes,2,0,4,4,0,B22F10/31;;B22F10/28;;B22F2999/00;;B33Y50/02;;B33Y10/00;;B33Y30/00;;B22F12/90;;B29C64/393;;B29C64/153;;B22F10/85;;B29C64/268;;Y02P10/25;;B33Y10/00;;B33Y30/00;;B33Y50/02;;B23K26/342;;B22F12/40;;B22F10/85;;B22F10/28;;B23K26/03;;B23K26/04;;G05B15/02,B22F10/85;;B22F10/28;;B22F10/31;;B22F12/90;;B29C64/153;;B29C64/393;;B33Y10/00;;B33Y30/00;;B33Y50/02,,0,0,,,,PENDING
85,US,A1,US 2023/0278134 A1,175-977-045-262-692,2023-09-07,2023,US 202217653535 A,2022-03-04,US 202217653535 A,2022-03-04,ALIGNING OF MELTING BEAM SOURCE IN ADDITIVE MANUFACTURING SYSTEM,"Embodiments of the disclosure relate to the aligning of a melting beam source in an additive manufacturing (AM) system. Methods of the disclosure may include forming a first test article and a second test article of different shapes on a build plate. The method further includes measuring a vertical scale, vertical alignment, horizontal scale, and an alignment of the melting beam source using the first and second test articles. The method includes determining whether one of the vertical scale, the vertical alignment, the horizontal scale, or the horizontal alignment of the melting beam source is not within a corresponding tolerance of a target specification. If at least one of the vertical scale, the vertical alignment, the horizontal scale, or the horizontal alignment is within the corresponding tolerance, the method includes adjusting the melting beam source of the AM system to align the melting beam source to yield the target specification.",GEN ELECTRIC,POURCHO JOHN BRYAN;;ROHRSSEN ROBERT JOSEPH;;MILLER MAXWELL EVAN;;MURRAY III JAMES JOSEPH;;HORTON MICHAEL RYAN;;DOZIER EVAN JOHN;;GRIFFIS CLAY THOMAS;;DULKIEWICZ CHAD JOSEPH,GE INFRASTRUCTURE TECHNOLOGY LLC (2023-11-10);;GENERAL ELECTRIC COMPANY (2022-03-04),https://lens.org/175-977-045-262-692,Patent Application,yes,0,0,4,4,0,B22F10/31;;B22F10/28;;B22F2999/00;;B33Y50/02;;B33Y10/00;;B33Y30/00;;B22F12/90;;B29C64/393;;B29C64/153;;B22F10/85;;B29C64/268;;Y02P10/25;;B33Y10/00;;B33Y30/00;;B33Y50/02;;B23K26/342;;B22F12/40;;B22F10/85;;B22F10/28;;B23K26/03;;B23K26/04;;G05B15/02,B23K26/04;;B22F10/28;;B22F10/85;;B22F12/40;;B23K26/03;;B23K26/342;;B33Y10/00;;B33Y30/00;;B33Y50/02;;G05B15/02,,0,0,,,,PENDING
86,CN,A,CN 116689788 A,019-046-003-226-915,2023-09-05,2023,CN 202310090763 A,2023-02-09,US 202217653535 A,2022-03-04,Alignment of fused beam sources in additive manufacturing systems,"Embodiments of the present disclosure relate to aligning a fused beam source in an additive manufacturing (AM) system (100). Methods of the present disclosure may include forming a first test article (104) and a second test article (302) of different shapes on a build plate (118). The method further includes measuring a vertical proportion, a vertical alignment, a horizontal proportion, and an alignment of the fused beam source using the first and second test articles (104, 302). The method includes determining whether one of a vertical proportion, a vertical alignment, a horizontal proportion, or a horizontal alignment of the fused beam source is not within a corresponding tolerance of the target specification. If at least one of the vertical proportion, the vertical alignment, the horizontal proportion, or the horizontal alignment is within a corresponding tolerance, the method includes adjusting a fused beam source of the AM system (100) to align the fused beam source to produce a target specification.",GEN ELECTRIC,PUCCIO JOHN BRIAN;;ROCHSON ROBERT J;;MILLER MICHAEL E;;MURRAY III JAMES JOSEPH;;HORTON MARGARET RUTH;;DOZIER EVAN JOHN;;GRIFFITH CHARLES T;;DURKIEWICZ CHRISTOPHER JOHN,,https://lens.org/019-046-003-226-915,Patent Application,no,0,0,4,4,0,B22F10/31;;B22F10/28;;B22F2999/00;;B33Y50/02;;B33Y10/00;;B33Y30/00;;B22F12/90;;B29C64/393;;B29C64/153;;B22F10/85;;B29C64/268;;Y02P10/25;;B33Y10/00;;B33Y30/00;;B33Y50/02;;B23K26/342;;B22F12/40;;B22F10/85;;B22F10/28;;B23K26/03;;B23K26/04;;G05B15/02,B22F12/44;;B22F12/90;;B33Y30/00;;B33Y50/02,,0,0,,,,PENDING
87,JP,A,JP 2023130303 A,151-396-543-009-108,2023-09-20,2023,JP 2023011636 A,2023-01-30,US 202217653535 A,2022-03-04,ADJUSTMENT OF ALIGNMENT OF MOLTEN BEAM SOURCE IN LAMINATION MOLDING SYSTEM,"To provide a method and a program for adjusting the alignments of molten beam sources in a lamination molding system.SOLUTION: This method has a step of forming a first test article 104 and a second test article 302 having different shapes on a build plate 118. The method further has a step of measuring the vertical scale, vertical alignment, horizontal scale and horizontal alignment of molten beam sources 110, 112, 114, 116 using the first test article and the second test article. The method has a step of determining whether one of the vertical scale, the vertical alignment, the horizontal scale and the horizontal alignment of the molten beam sources lies within an allowable range corresponding to target specifications or not. The method has a step of adjusting the molten beam sources of an AM system so as to obtain the target specifications by executing alignment adjustment for the molten beam sources when at least one of the vertical scale, the vertical alignment, the horizontal scale and the horizontal alignment does not lie within the corresponding allowable range.SELECTED DRAWING: Figure 1",GENERAL ELECTRIC CO GE,JOHN BRYAN POURCHO;;ROBERT JOSEPH ROHRSSEN;;MAXWELL EVAN MILLER;;JAMES JOSEPH MURRAY III;;MICHAEL RYAN HORTON;;EVAN JOHN DOZIER;;CLAY THOMAS GRIFFIS;;CHAD JOSEPH DULKIEWICZ,,https://lens.org/151-396-543-009-108,Patent Application,no,0,0,4,4,0,B22F10/31;;B22F10/28;;B22F2999/00;;B33Y50/02;;B33Y10/00;;B33Y30/00;;B22F12/90;;B29C64/393;;B29C64/153;;B22F10/85;;B29C64/268;;Y02P10/25;;B33Y10/00;;B33Y30/00;;B33Y50/02;;B23K26/342;;B22F12/40;;B22F10/85;;B22F10/28;;B23K26/03;;B23K26/04;;G05B15/02,B22F10/366;;B22F10/25;;B22F10/28;;B22F10/85;;B29C64/153;;B29C64/393;;B33Y10/00;;B33Y50/02,,0,0,,,,PENDING
88,US,A,US 5893101 A,030-804-422-059-902,1999-04-06,1999,US 82892497 A,1997-03-28,US 82892497 A;;US 47840195 A;;US 25537994 A,1994-06-08,Protection of an electronically stored image in a first color space by the alteration of digital component in a second color space,"Digitized images are associated with English language captions and other data, collectively known as the metadata associated with the images. A natural language processing database removes ambiguities from the metadata, and the images and the metadata are stored in databases. A user formulates a search query, and natural language processing is used to determine matches between the query and the stored metadata. Images corresponding to the matches are then viewed, and desired images are selected for licensing. The license terms for selected images are displayed, and a subset of the selected images are ordered as desired by the user.",SYSTEMS RESEARCH & APPLIC CORP,BALOGH ARISTOTLE;;BLEJER HATTE;;BRIGGS ROBERT;;CHEN EUGENE;;FLANK SHARON;;IANNACONE CARMEN;;MALONEY JOHN;;MARTIN PATRICK;;ROTHEY JAMES;;SCHMID GARY;;EVANS DAVID;;DOZIER LINDA T;;LORTON MICHAEL,,https://lens.org/030-804-422-059-902,Granted Patent,yes,12,267,3,3,0,G06Q30/04;;G06T11/00;;H04N1/00864;;H04N1/00872;;H04N1/32144;;H04N1/32208;;H04N1/32251;;H04N1/32309;;H04N2201/3233;;H04N2201/327;;H04N2201/3273;;G06T1/0021;;G06F16/54;;G06F16/78;;G06F16/5838;;G06F16/70;;G06F16/58;;G06Q30/04;;H04N2201/327;;H04N1/00872;;H04N2201/3273;;H04N1/00864;;H04N2201/3233;;H04N1/32309;;H04N1/32208;;H04N1/32251;;G06T11/00;;H04N1/32144;;Y10S707/966;;Y10S707/915;;Y10S707/99945;;G06T1/0021;;G06F16/54;;G06F16/78;;G06F16/58;;G06F16/70;;G06F16/5838;;G06F16/587,G06F17/30;;G06Q30/04;;G06T1/00;;G06T11/00;;H04N1/00;;H04N1/32;;H04N1/44,707/100;;707/104;;380/54;;395/101;;399/1;;399/366;;364/225.5;;364/282.1;;364/963.5;;364/974,1,0,,,"Steve Walton, Image Authentication for a slippery New Age , Dr. Dobb s Journal, pp. 18 24, 84 87, Apr. 1995.",EXPIRED
89,US,P1,US 2011/0209255 P1,172-308-783-458-681,2011-08-25,2011,US 71119410 V,2010-02-23,US 71119410 V,2010-02-23,KIWI PLANT NAMED 'AU GOLDEN SUNSHINE',"A new and distinct cultivar of the species Actinidia chinesis Planch is described. ‘AU Golden Sunshine’ has a low chilling requirement, fruit is early maturing, excellent flavor with a non acid sweet taste and a high percent soluble solids and dry matter content. ‘AU Golden Sunshine’ matures about 20 days after ‘AU Golden Dragon’ and 30 days before ‘Hort 16A’ (patented), the industry standard for golden flesh kiwi cultivars. ‘AU Golden Sunshine’ fruit quality indices are similar to fruit quality indices of ‘AU Golden Dragon’ and ‘Hort 16A’ (patented). There have been no differences in plant performance and fruit quality of ‘AU Golden Sunshine’ plants grown in China and Alabama.",DOZIER JR WILLIAM ALFRED;;WILKINS BRYAN SHELTON;;PITTS JIM;;HANSEN CURTIS JAY;;WOODS FLOYD M;;SPIERS JAMES D;;CHEN QINGHONG;;QIN ZHONGQI;;JIANG YINGCHUN;;GU XIA;;XU AICHUN,DOZIER JR WILLIAM ALFRED;;WILKINS BRYAN SHELTON;;PITTS JIM;;HANSEN CURTIS JAY;;WOODS FLOYD M;;SPIERS JAMES D;;CHEN QINGHONG;;QIN ZHONGQI;;JIANG YINGCHUN;;GU XIA;;XU AICHUN,AUBURN UNIVERSITY (2010-06-24);;INSTITUTE OF FRUIT AND TEA (2010-06-24),https://lens.org/172-308-783-458-681,Patent Application,yes,0,0,2,2,0,A01H5/08;;A01H6/00;;A01H5/08;;A01H6/00,A01H6/00;;A01H5/08,PLT 156,0,0,,,,PENDING
90,US,P1,US 2011/0231967 P1,196-914-746-365-794,2011-09-22,2011,US 71121910 V,2010-02-23,US 71121910 V,2010-02-23,KIWI PLANT NAMED 'AU GOLDEN DRAGON',"A new and distinct cultivar of the species Actinidia chinesis Planch is described. ‘AU Golden Dragon’ has a low chilling requirement, fruit is very early maturing, excellent flavor with a non acid sweet taste, and high soluble solids and dry matter content. ‘AU Golden Dragon’ matures about 50 days ahead of ‘Hort 16A’ (patented), the industry standard for golden flesh kiwi, therefore, the two cultivars will not compete in the market place. ‘AU Golden Dragon’ fruit quality indices are similar to fruit quality indices of ‘Hort 16A’ (patented). There have been no differences in plant performance and fruit quality of ‘AU Golden Dragon’ plants grown in China and Central Alabama.",DOZIER JR WILLIAM ALFRED;;WILKINS BRYAN SHELTON;;PITTS JIM;;HANSEN CURTIS JAY;;WOODS FLOYD M;;SPIERS JAMES D;;CHEN QINGHONG;;QIN ZHONGQI;;JIANG YINGCHUN;;GU XIA;;XU AICHUN,DOZIER JR WILLIAM ALFRED;;WILKINS BRYAN SHELTON;;PITTS JIM;;HANSEN CURTIS JAY;;WOODS FLOYD M;;SPIERS JAMES D;;CHEN QINGHONG;;QIN ZHONGQI;;JIANG YINGCHUN;;GU XIA;;XU AICHUN,AUBURN UNIVERSITY (2010-08-20);;INSTITUTE OF FRUIT AND TEA (2010-08-20),https://lens.org/196-914-746-365-794,Patent Application,yes,0,0,2,2,0,A01H5/08;;A01H6/00;;A01H5/08;;A01H6/00,A01H6/00;;A01H5/08,PLT 156,0,0,,,,PENDING
91,US,P3,US PP022159 P3,063-976-788-111-697,2011-09-27,2011,US 71119410 V,2010-02-23,US 71119410 V,2010-02-23,Kiwi plant named AU Golden Sunshine,"A new and distinct cultivar of the species Actinidia chinesis Planch is described. ‘AU Golden Sunshine’ has a low chilling requirement, fruit is early maturing, excellent flavor with a non acid sweet taste and a high percent solube solids and dry matter content. ‘AU Golden Sunshine’ matures about 20 days after ‘AU Golden Dragon’ and 30 days before ‘Hort 16A’ (patented), the industry standard for golden flesh kiwi cultivars. ‘Au Golden Sunshine’ fruit quality indices are similar to fruit quality indices of ‘AU Golden Dragon’ and ‘Hort 16A’ (patented). There have been no differences in plant performance and fruit quality of ‘AU Golden Sunshine’ plants grown in China and Alabama.",UNIV AUBURN,DOZIER JR WILLIAM ALFRED;;WILKINS BRYAN SHELTON;;PITTS JIM;;HANSEN CURTIS JAY;;WOODS FLOYD M;;SPIERS JAMES D;;CHEN QINGHONG;;QIN ZHONGQI;;JIANG YINGCHUN;;GU XIA;;XU AICHUN,,https://lens.org/063-976-788-111-697,Plant Patent,yes,0,1,2,2,0,A01H5/08;;A01H6/00;;A01H5/08;;A01H6/00,A01H6/00;;A01H5/08,PLT 156,2,0,,,"Wall et al. ""Vegetative and Floral Chilling Requirement of Four New Kiwi Cultivars of Actinidia chinensis and A. deliciosa,"" (HortScience 43(3):644-647, Jun. 2008.;;Wall et al. ""Determining a Maturity Index and the Effect of Chilling Requirements, and Cytokinin Application on Three New Kiwi Cultivars,"" Thesis-Degree of Master of Science, Auburn University, Aug. 2006, 87 pages.",PENDING
92,US,P2,US PP022191 P2,193-968-879-768-735,2011-10-11,2011,US 71121910 V,2010-02-23,US 71121910 V,2010-02-23,Kiwi plant named AU Golden Dragon,"A new and distinct cultivar of the species Actinidia chinesis Planch is described. ‘AU Golden Dragon’ has a low chilling requirement, fruit is very early maturing, excellent flavor with a non acid sweet taste, and high soluble solids and dry matter content. ‘AU Golden Dragon’ matures about 50 days ahead of ‘Hort 16A’ (patented), the industry standard for golden flesh kiwi, therefore, the two cultivars will not compete in the market place. ‘AU Golden Dragon’ fruit quality indices are similar to fruit quality indices of ‘Hort 16A’ (patented). There have been no differences in plant performance and fruit quality of ‘AU Golden Dragon’ plants grown in China and Central Alabama.",UNIV AUBURN,DOZIER JR WILLIAM ALFRED;;WILKINS BRYAN SHELTON;;PITTS JIM;;HANSEN CURTIS JAY;;WOODS FLOYD M;;SPIERS JAMES D;;CHEN QINGHONG;;QIN ZHONGQI;;JIANG YINGCHUN;;GU XIA;;XU AICHUN,,https://lens.org/193-968-879-768-735,Plant Patent,yes,0,2,2,2,0,A01H5/08;;A01H6/00;;A01H5/08;;A01H6/00,A01H6/00;;A01H5/08,PLT 156,2,0,,,"Wall et al. ""Vegetative and Floral Chilling Requirement of Four New Kiwi Cultivars of Actinidia chinensis and A. deliciosa,"" (HortScience 43(3):644-647, Jun. 2008.;;Wall et al. ""Determining a Maturity Index and the Effect of Chilling Requirements, and Cytokinin Application on Three New Kiwi Cultivars,"" Thesis-Degree of Master of Science, Auburn University, Aug. 2006, 87 pages.",PENDING
93,US,A,US 5434784 A,053-284-955-013-104,1995-07-18,1995,US 29655394 A,1994-08-26,US 29655394 A,1994-08-26,Vehicle steering wheel position sensing apparatus,"This invention relates to an apparatus for sensing a vehicle steering wheel position. A permanent magnet target wheel having a global axial magnetic field normal to a first surface is attached to a steering shaft which is rotated by the steering wheel. Multiple regions equally spaced along a common radius on the first surface are magnetically altered and sensed by magnetically responsive sensors positioned adjacent the first radius. A single region positioned within a finite radius along a second radius on the first surface is magnetically altered and sensed by a magnetically responsive sensor positioned adjacent the second radius. The magnetic sensors are responsive to passage of the multiple regions and single region as the target wheel is rotated. Detection of each of the multiple regions corresponds to rotation of the target wheel by an incremental number of degrees. Detection of the single region corresponds to a target wheel position within a predetermined angular range, referred to as the center position. A turn counter is utilized to determine which of the center positions corresponds to the steering wheel neutral position.",GEN MOTORS CORP;;HUGHES AIRCRAFT CO,BRADLEY JOHN R;;PERRY THOMAS A;;TEETS RICHARD E;;MEYER MARTIN S;;SELL JEFFREY A;;VAN STEENKISTE THOMAS H;;BOHAC JR FRANK J;;ROACH JERRY S;;REISSMUELLER MANFRED W;;SHELTON EVERETT K;;DOZIER JAMES R;;YAMASAKI HIRO,HUGHES AIRCRAFT COMPANY (1994-08-04);;GENERAL MOTORS CORPORATION (1994-08-04),https://lens.org/053-284-955-013-104,Granted Patent,yes,6,19,2,2,0,B62D15/02;;B62D15/02,B62D15/02,364/424.05;;364/559,0,0,,,,EXPIRED
