"#",Jurisdiction,Kind,Display Key,Lens ID,Publication Date,Publication Year,Application Number,Application Date,Priority Numbers,Earliest Priority Date,Title,Abstract,Applicants,Inventors,Owners,URL,Document Type,Has Full Text,Cites Patent Count,Cited by Patent Count,Simple Family Size,Extended Family Size,Sequence Count,CPC Classifications,IPCR Classifications,US Classifications,NPL Citation Count,NPL Resolved Citation Count,NPL Resolved Lens ID(s),NPL Resolved External ID(s),NPL Citations,Legal Status
1,US,A,US 3330338 A,083-281-825-375-718,1967-07-11,1967,US 33481263 A,1963-12-31,US 33481263 A,1963-12-31,Anchor and method of installing,,SHELL OIL CO,DOZIER JAMES R,,https://lens.org/083-281-825-375-718,Granted Patent,no,9,12,1,1,0,B63B21/50;;B63B21/50;;B63B21/26;;B63B21/26;;E21B7/12;;E21B7/12;;E21B41/04;;E21B41/04,B63B21/26;;B63B21/50;;E21B7/12;;E21B41/04,,0,0,,,,EXPIRED
2,CA,A,CA 43804 A,041-341-107-132-20X,1893-08-02,1893,CA 43804D A,,CA 43804T A,,BARREL AND METHOD OF MAKING SAME,,DOZIER JAMES C,DOZIER JAMES C,,https://lens.org/041-341-107-132-20X,Granted Patent,no,0,0,1,1,0,,,,0,0,,,,EXPIRED
3,US,B1,US 6260896 B1,097-307-184-296-876,2001-07-17,2001,US 56988400 A,2000-05-12,US 56988400 A,2000-05-12,Barbecue device,A barbecue device for spreading and manipulating charcoal within a grill. The barbecue device includes a raking portion and a handle portion. The raking portion comprises a pair of pronged portions. Each of the pronged portions is integrally coupled together. The handle portion includes a rod and a handle member. The rod is elongate having a first and second end. The second end of the rod is integrally coupled to the raking portion. The handle member has a first end and a second end. The first end of the handle member is fixedly coupled to the first end of the rod.,DOZIER JAMES E.,DOZIER JAMES E,,https://lens.org/097-307-184-296-876,Granted Patent,yes,11,8,1,1,0,A47J37/0786;;A47J37/0786,A47J37/07,294/9;;294/1.1,0,0,,,,EXPIRED
4,US,A,US 1348161 A,148-596-807-207-457,1920-08-03,1920,US 32215219 A,1919-09-06,US 32215219 A,1919-09-06,Feeding mechanism for stapling-machines,,DOZIER JAMES C,DOZIER JAMES C,,https://lens.org/148-596-807-207-457,Granted Patent,no,0,1,1,1,0,B27F7/006;;B27F7/006,B27F7/00,,0,0,,,,EXPIRED
5,CA,A,CA 894604 A,064-061-447-107-80X,1972-03-07,1972,CA 894604D A,,CA 894604T A,,UNDERWATER PRODUCTION FACILITY INCLUDING BASE UNIT AND PRODUCTION FLUID HANDLING UNIT,,SHELL INT RESEARCH,DOZIER JAMES R,,https://lens.org/064-061-447-107-80X,Granted Patent,no,0,0,1,1,0,,E21B43/00;;E21B43/01;;E21B43/017;;E21B43/36,,0,0,,,,EXPIRED
6,US,A,US 3536135 A,119-546-787-655-385,1970-10-27,1970,US 3536135D A,1968-06-27,US 74068868 A,1968-06-27,UNDERWATER PRODUCTION FACILITY INCLUDING BASE UNIT AND PRODUCTION FLUID HANDLING UNIT,,SHELL OIL CO,DOZIER JAMES R,,https://lens.org/119-546-787-655-385,Granted Patent,no,0,13,7,7,0,E21B43/36;;E21B43/0175;;E21B43/36;;E21B43/0175,E21B43/017;;E21B43/36,166   5,0,0,,,,EXPIRED
7,US,A,US 3211121 A,071-366-245-621-000,1965-10-12,1965,US 31976363 A,1963-10-29,US 31976363 A,1963-10-29,Ship positioning system,,SHELL OIL CO,RONALD DOZIER JAMES,,https://lens.org/071-366-245-621-000,Granted Patent,no,4,10,9,9,0,G05D1/0208;;G05D1/0208,G05D1/02,,0,0,,,,EXPIRED
8,DE,A1,DE 1431318 A1,064-582-765-158-534,1969-03-20,1969,DE 1431318 A,1964-10-27,US 31976363 A,1963-10-29,"Verfahren und Einrichtung,um ein Wasserfahrzeug in einer gewuenschten Position zu halten",,SHELL INT RESEARCH,RONALD DOZIER JAMES,,https://lens.org/064-582-765-158-534,Patent Application,no,0,0,9,9,0,G05D1/0208;;G05D1/0208,G05D1/02,,0,0,,,,EXPIRED
9,GB,A,GB 1268388 A,156-546-415-285-557,1972-03-29,1972,GB 3207869 A,1969-06-25,US 74068868 A,1968-06-27,HANDLING PRODUCTION FLUID FROM UNDERWATER WELLS,"1,268,388. Offshore structures. SHELL INTERNATIONALE RESEARCH MAATSCHAPPIJ N.V. 25 June, 1969 [27 June, 1968],No. 32078/69. Heading EIH. An underwater facility for handling fluids received from subaqueous wells through flowlines 36 includes a base unit 11 with co-axial circular walls 17, 19 and a fluid-handling unit 14 with buoyancy tanks 55, 56 so that when necessary it can be raised to the surface while the base unit remains in situ, an anchor line 15 being wound onto a winch 88 to lower the unit 14. A cone 84 aligns the unit 14 with the centre of the unit 11. Disconnectible pipe-couplings 40, 45, 48 and valves 38, 49 can be manipulated by a remotely-controlled device 22, which can travel along a circular track 21 between the walls.",SHELL INT RESEARCH,DOZIER JAMES RONALD,,https://lens.org/156-546-415-285-557,Granted Patent,no,0,0,7,7,0,E21B43/36;;E21B43/0175;;E21B43/36;;E21B43/0175,E21B43/017;;E21B43/36,E1H HB            HB;;E1H H14           H14;;E1H H603          HB;;E1H H606          HB,0,0,,,,EXPIRED
10,US,A,US 1042206 A,186-478-744-017-306,1912-10-22,1912,US 1912/0677920 A,1912-02-16,US 1912/0677920 A,1912-02-16,BELT-FASTENER.,,DANIEL A LAWSON;;DOZIER JAMES H,DOZIER JAMES H,,https://lens.org/186-478-744-017-306,Granted Patent,no,0,0,1,1,0,F16G3/02;;F16G3/02;;Y10T24/1632;;Y10T24/1632,,,0,0,,,,EXPIRED
11,US,A,US 821225 A,066-329-906-837-631,1906-05-22,1906,US 1905/0273569 A,1905-08-10,US 1905/0273569 A,1905-08-10,BILLIARD-TABLE LEVELING AND HOLDING DEVICE.,,DOZIER JAMES C,DOZIER JAMES C,,https://lens.org/066-329-906-837-631,Granted Patent,no,0,6,1,1,0,A47B91/024;;A47B91/024,,,0,0,,,,EXPIRED
12,CA,A,CA 746652 A,083-870-762-097-33X,1966-11-22,1966,CA 746652D A,,CA 746652T A,,SHIP POSITIONING SYSTEM,,SHELL INT RESEARCH,DOZIER JAMES R,,https://lens.org/083-870-762-097-33X,Granted Patent,no,0,0,1,1,0,,,,0,0,,,,EXPIRED
13,DE,A1,DE 1932230 A1,185-786-154-331-045,1970-01-02,1970,DE 1932230 A,1969-06-25,US 74068868 A,1968-06-27,Unterwasserfoerderanlage zum Anschliessen an mindestens eine Unterwassertiefbohrung,,SHELL INT RESEARCH,RONALD DOZIER JAMES,,https://lens.org/185-786-154-331-045,Patent Application,no,0,0,7,7,0,E21B43/36;;E21B43/0175;;E21B43/36;;E21B43/0175,E21B43/017;;E21B43/36,,0,0,,,,EXPIRED
14,US,A,US 3056066 A,106-951-294-869-710,1962-09-25,1962,US 86115059 A,1959-12-21,US 86115059 A,1959-12-21,Ignition system for internal combustion engines,,DOZIER JR JAMES J,DOZIER JR JAMES J,,https://lens.org/106-951-294-869-710,Granted Patent,no,3,12,1,1,0,F02P3/0884;;F02P3/0884,F02P3/08,,0,0,,,,EXPIRED
15,US,A,US 4980688 A,025-048-697-343-468,1990-12-25,1990,US 84359859 A,1959-09-30,US 84359859 A,1959-09-30,Regenerator,"A radar countermeasure comprising an inflatable balloon, a corner reflector ounted inside said balloon, and means mounted on top of said balloon for destroying said balloon upon the incidence of a search radar beam, said means comprising a radar receiving antenna, a diode connected to said antenna, a standard length pulse generator connected to said diode responsive to radar signals having a period of over 0.2 microseconds, means connected to said generator for providing an output when a plurality of pulses are remitted from said pulse generator in a predetermined period of time, and an explosive charge connected to the output of said last named means for providing a warning signal upon the incidence of a search radar sweep.",US NAVY,DOZIER JR JAMES J,,https://lens.org/025-048-697-343-468,Granted Patent,yes,3,20,1,1,0,B63B22/003;;B63B2201/12;;B63G13/02;;F41J2/00;;H01Q15/20;;F41J2/00;;H01Q15/20;;B63G13/02;;B63B22/003;;B63B2201/12,B63B22/00;;B63G13/02;;F41J2/00;;H01Q15/20,342/9;;342/15,0,0,,,,EXPIRED
16,DE,C3,DE 1932230 C3,115-491-573-812-209,1978-03-30,1978,DE 1932230 A,1969-06-25,US 74068868 A,1968-06-27,DE 1932230 C3,,"SHELL INTERNATIONALE RESEARCH MAATSCHAPPIJ B.V., DEN HAAG (NIEDERLANDE)","DOZIER, JAMES RONALD, TULSA, OKLA. (V.ST.A.)",,https://lens.org/115-491-573-812-209,Granted Patent,no,0,0,7,7,0,E21B43/36;;E21B43/0175;;E21B43/36;;E21B43/0175,E21B43/017;;E21B43/36,,0,0,,,,EXPIRED
17,US,A,US 1234884 A,106-110-525-319-518,1917-07-31,1917,US 12612916 A,1916-10-17,US 12612916 A,1916-10-17,MACHINE FOR SLITTING VENEER.,,DOZIER JAMES C;;WALKER JOSEPH L,DOZIER JAMES C;;WALKER JOSEPH L,,https://lens.org/106-110-525-319-518,Granted Patent,no,0,4,1,1,0,B26D1/025;;B26D1/025;;D06H7/04;;D06H7/04;;Y10T83/6582;;Y10T83/6582;;Y10T83/6603;;Y10T83/6603;;Y10T83/6636;;Y10T83/6636,,,0,0,,,,EXPIRED
18,DE,C3,DE 1431318 C3,036-544-841-013-829,1974-05-22,1974,DE 1431318 A,1964-10-27,US 31976363 A,1963-10-29,DE 1431318 C3,,"SHELL INTERNATIONALE RESEARCH MAATSCHAPPIJ B.V., DEN HAAG (NIEDERLANDE)","DOZIER, JAMES RONALD, WHITTIER, CALIF. (V.ST.A.)",,https://lens.org/036-544-841-013-829,Granted Patent,no,0,0,9,9,0,G05D1/0208;;G05D1/0208,G05D1/02,,0,0,,,,EXPIRED
19,US,A,US 674498 A,033-287-227-164-543,1901-05-21,1901,US 1900/0026414 A,1900-08-09,US 1900/0026414 A,1900-08-09,LUMBER-KILN.,,DOZIER JAMES C;;WALKER JOSEPH L,DOZIER JAMES C;;WALKER JOSEPH L,,https://lens.org/033-287-227-164-543,Granted Patent,no,0,1,1,1,0,C21D9/00;;C21D9/00,,,0,0,,,,EXPIRED
20,DE,B,DE 1226056 B,141-446-024-143-639,1966-10-06,1966,DE S0096107 A,1965-03-22,US 1226056X A,1964-03-23,Einrichtung zum Anschliessen einer Rohrleitung von einer oberhalb der Wasseroberflaeche befindlichen Arbeitsstation aus an eine Unterwasseranlage,,SHELL INT RESEARCH,DOZIER JAMES RONALD;;JOHNSON GLENN DONNELL,,https://lens.org/141-446-024-143-639,Patent Application,no,0,2,1,1,0,E21B43/0135,E21B43/013,,0,0,,,,DISCONTINUED
21,US,A,US 1356271 A,160-917-739-851-724,1920-10-19,1920,US 36483920 A,1920-03-10,US 36483920 A,1920-03-10,Veneer-slitting machine,,DOZIER JAMES C;;WALKER JOSEPH L,DOZIER JAMES C;;WALKER JOSEPH L,,https://lens.org/160-917-739-851-724,Granted Patent,no,0,7,1,1,0,B27L5/08;;Y10T83/6636;;Y10T83/6582;;Y10T83/6603;;Y10T83/6636;;Y10T83/6582;;Y10T83/6603;;B27L5/08,B27L5/08,,0,0,,,,EXPIRED
22,US,A,US 3298092 A,005-857-295-382-565,1967-01-17,1967,US 35384064 A,1964-03-23,US 35384064 A,1964-03-23,Connection of underwater flowlines,,SHELL OIL CO,RONALD DOZIER JAMES;;JOHNSON GLENN D,,https://lens.org/005-857-295-382-565,Granted Patent,no,11,32,4,5,0,E21B15/02;;E21B41/04;;E21B43/0135;;F16L1/15;;F16L37/002;;Y10T29/53978;;Y10T29/49828;;Y10T29/53978;;Y10T29/49828;;F16L1/15;;E21B43/0135;;E21B41/04;;E21B15/02;;F16L37/002,E21B15/02;;E21B41/04;;E21B43/013;;F16L1/15;;F16L37/00,,0,0,,,,EXPIRED
23,DE,B2,DE 1431318 B2,129-491-779-686-496,1973-10-18,1973,DE 1431318 A,1964-10-27,US 31976363 A,1963-10-29,DE 1431318 B2,,"SHELL INTERNATIONALE RESEARCH MAATSCHAPPIJ N.V., DEN HAAG (NIEDERLANDE)","DOZIER, JAMES RONALD, WHITTIER, CALIF. (V.ST.A.)",,https://lens.org/129-491-779-686-496,Patent Application,no,0,0,9,9,0,G05D1/0208;;G05D1/0208,G05D1/02,,0,0,,,,EXPIRED
24,US,A,US 3442540 A,054-238-598-508-879,1969-05-06,1969,US 3442540D A,1966-09-12,US 35384064 A;;US 59430166 A,1964-03-23,CONNECTION OF UNDERWATER FLOWLINES,,SHELL OIL CO,DOZIER JAMES RONALD;;JOHNSON GLENN D,,https://lens.org/054-238-598-508-879,Granted Patent,no,6,1,1,5,0,E21B41/04;;E21B41/04;;E21B15/02;;E21B15/02;;E21B43/0135;;E21B43/0135;;F16L37/002;;F16L37/002;;Y10T403/1616;;Y10T403/1616;;Y10T403/54;;Y10T403/54,E21B15/02;;E21B41/04;;E21B43/013;;F16L37/00,287/76,0,0,,,,EXPIRED
25,CA,A,CA 731330 A,085-361-706-192-778,1966-03-29,1966,CA 731330D A,,CA 731330T A,,SHIP POSITIONING,,SHELL OIL CO,DOZIER JAMES R;;SHATTO HOWARD L JR,,https://lens.org/085-361-706-192-778,Granted Patent,no,0,0,1,1,0,,,,0,0,,,,EXPIRED
26,US,A,US 3280311 A,007-177-938-849-637,1966-10-18,1966,US 21287262 A,1962-07-27,US 21287262 A,1962-07-27,Ship positioning,,SHELL OIL CO,SHATTO JR HOWARD L;;RONALD DOZIER JAMES,,https://lens.org/007-177-938-849-637,Granted Patent,no,2,15,1,1,0,G05D1/0208;;B63H25/42;;G05D1/0208;;B63H25/42,F16L1/20;;G05D1/02,,0,0,,,,EXPIRED
27,US,B2,US 11604930 B2,116-204-168-304-050,2023-03-14,2023,US 201916586175 A,2019-09-27,US 201916586175 A,2019-09-27,Generation of translated electronic document from an input image by consolidating each of identical untranslated text strings into a single element for translation,"A method of generating an editable translated electronic document from an input image of an original document with a first layout includes: segmenting the input image to generate a first region including first untranslated text; extracting, from the first region, the first untranslated text and a first layout information; generating an editable output data including the first untranslated text and the first layout information; translating the first untranslated text into a translated text; editing the output data to include the translated text; and generating, using the first layout information, the translated electronic document including the translated text and a second layout that is identical to the first layout.",KONICA MINOLTA BUSINESS SOLUTIONS USA INC,DOZIER III MABRY FRAZIER;;GRAMS JASON JAMES,KONICA MINOLTA BUSINESS SOLUTIONS U.S.A. INC (2019-09-24),https://lens.org/116-204-168-304-050,Granted Patent,yes,9,0,2,2,0,G06F40/40;;G06F40/103;;G06F40/106;;G06V30/414;;G06V30/153;;G06V30/10;;G06F40/42;;G06F40/166;;G06V30/153;;G06F40/40;;G06V30/10;;G06V30/414;;G06V10/40,G06F40/40;;G06F3/0485;;G06F40/166;;G06F40/42;;G06F40/47;;G06V10/40;;G06V30/10;;G06V30/148,,0,0,,,,ACTIVE
28,JP,A,JP 2005004744 A,007-094-852-392-230,2005-01-06,2005,JP 2004162842 A,2004-06-01,US 46159903 A,2003-06-12,STORAGE MEDIUM WITH ENTERTAINMENT VALUE STORED THEREON,"<P>PROBLEM TO BE SOLVED: To provide an enhanced method for purchasing and acquiring a right to take part in an event. <P>SOLUTION: A system for storing the box-office value is provided with an electronic storage medium which includes a memory and stores the box-office value corresponding to a box-office event, and a computing device which is linked to the electronic storage medium and stores the box-office value on the electronic storage medium. Alternatively, the other system comprises a server computer which includes a memory and is configured to store the box-office value corresponding to the box-office event, and a computing device which is configured to electronically access an electronic vendor, acquire the box-office value from the electronic vendor, store the box-office value in the memory related to the server computer and provide an identifier related to the box-office value. <P>COPYRIGHT: (C)2005,JPO&NCIPI",HEWLETT PACKARD DEVELOPMENT CO,DOZIER MATTHEW JAMES;;JONATHAN FIROOZU;;PACHECO RAQUEL,,https://lens.org/007-094-852-392-230,Patent Application,no,0,0,5,5,0,G07F7/0866;;G07F7/0866;;G06Q30/0601;;G06Q30/0601;;G07F7/0873;;G07F7/0873;;G07F17/0014;;G07F17/0014,G06K17/00;;G06Q30/06;;G07F7/00;;G07F7/08,,0,0,,,,PENDING
29,DE,A1,DE 102004007650 A1,012-319-495-196-068,2005-01-13,2005,DE 102004007650 A,2004-02-17,US 46159903 A,2003-06-12,"Speichermedium, auf dem ein Unterhaltungswert gespeichert ist","Ein System und ein Verfahren zum Speichern eines Unterhaltungswerts sind offenbart. Bei einem Ausführungsbeispiel weist das System ein elektronisches Speichermedium auf, das einen Speicher aufweist. Das elektronische Speichermedium ist konfiguriert, um einen Unterhaltungswert zu speichern, der einem Unterhaltungsereignis entspricht. Das System weist außerdem eine Rechenvorrichtung auf, die konfiguriert ist, um eine Verbindung zu dem elektronischen Speichermedium herzustellen und den Unterhaltungswert auf dem elektronischen Speichermedium zu speichern.",HEWLETT PACKARD DEVELOPMENT CO,DOZIER MATTHEW JAMES;;FIROOZ JONATHAN;;PACHECO RAQUEL,,https://lens.org/012-319-495-196-068,Patent Application,no,0,0,5,5,0,G07F7/0866;;G07F7/0866;;G06Q30/0601;;G06Q30/0601;;G07F7/0873;;G07F7/0873;;G07F17/0014;;G07F17/0014,G06K17/00;;G06Q30/06;;G07F7/00;;G07F7/08,,0,0,,,,DISCONTINUED
30,US,A1,US 2021/0097143 A1,122-523-591-181-014,2021-04-01,2021,US 201916586175 A,2019-09-27,US 201916586175 A,2019-09-27,GENERATION OF TRANSLATED ELECTRONIC DOCUMENT FROM AN INPUT IMAGE,"A method of generating an editable translated electronic document from an input image of an original document with a first layout includes: segmenting the input image to generate a first region including first untranslated text; extracting, from the first region, the first untranslated text and a first layout information; generating an editable output data including the first untranslated text and the first layout information; translating the first untranslated text into a translated text; editing the output data to include the translated text; and generating, using the first layout information, the translated electronic document including the translated text and a second layout that is identical to the first layout.",KONICA MINOLTA BUSINESS SOLUTIONS USA INC,DOZIER III MABRY FRAZIER;;GRAMS JASON JAMES,KONICA MINOLTA BUSINESS SOLUTIONS U.S.A. INC (2019-09-24),https://lens.org/122-523-591-181-014,Patent Application,yes,1,7,2,2,0,G06F40/40;;G06F40/103;;G06F40/106;;G06V30/414;;G06V30/153;;G06V30/10;;G06F40/42;;G06F40/166;;G06V30/153;;G06F40/40;;G06V30/10;;G06V30/414;;G06V10/40,G06V30/10,,0,0,,,,ACTIVE
31,US,A1,US 2004/0254845 A1,067-234-529-742-606,2004-12-16,2004,US 46159903 A,2003-06-12,US 46159903 A,2003-06-12,Storage medium having entertainment value stored thereon,"
   A system and method for storing entertainment value, is disclosed. In one embodiment, the system comprises an electronic storage medium having a memory. The electronic storage medium is configured to store entertainment value corresponding to an entertainment event. The system also comprises a computing device configured to couple to the electronic storage medium and store the entertainment value on the electronic storage medium. 
",DOZIER MATTHEW JAMES;;FIROOZ JONATHAN;;PACHECO RAQUEL,DOZIER MATTHEW JAMES;;FIROOZ JONATHAN;;PACHECO RAQUEL,HEWLETT-PACKARD DEVELOPMENT COMPANY L.P (2003-06-10),https://lens.org/067-234-529-742-606,Patent Application,yes,4,4,5,5,0,G07F7/0866;;G07F7/0866;;G06Q30/0601;;G06Q30/0601;;G07F7/0873;;G07F7/0873;;G07F17/0014;;G07F17/0014,G06K17/00;;G06Q30/06;;G07F7/00;;G07F7/08,705/26,0,0,,,,DISCONTINUED
32,GB,A,GB 2402774 A,162-541-072-973-554,2004-12-15,2004,GB 0412755 A,2004-06-08,US 46159903 A,2003-06-12,Cashless system for payment at entertainment events using electronic storage medium,"A system (100) for storing entertainment value, is disclosed. In one embodiment, the system comprises an electronic storage medium (120) having a memory. The electronic storage medium (120) is configured to store entertainment value corresponding to an entertainment event. The system (100) also comprises a computing device (102) configured to couple to the electronic storage medium (120) and store the entertainment value on the electronic storage medium (120). The storage medium may be a compact flash memory media or a credit card-like medium. The entertainment value may relate to the purchase of a ticket for an event. The storage medium is inserted into a reader (148) to gain access to the event, the entertainment value being deducted from the storage medium. Optionally a ticket may be printed (146).",HEWLETT PACKARD DEVELOPMENT CO,DOZIER MATTHEW JAMES;;FIROOZ JONATHAN;;PACHECO RAQUEL,,https://lens.org/162-541-072-973-554,Patent Application,no,5,0,5,5,0,G07F7/0866;;G07F7/0866;;G06Q30/0601;;G06Q30/0601;;G07F7/0873;;G07F7/0873;;G07F17/0014;;G07F17/0014,G06K17/00;;G06Q30/06;;G07F7/00;;G07F7/08,G4A AUXB          UXB;;G4V VAKC          VAKC,0,0,,,,DISCONTINUED
33,US,A,US 3148653 A,031-936-029-508-530,1964-09-15,1964,US 19564562 A,1962-05-17,US 19564562 A,1962-05-17,Ship positioning,,SHELL OIL CO,SHATTO JR HOWARD L;;RONALD DOZIER JAMES,,https://lens.org/031-936-029-508-530,Granted Patent,no,4,15,1,1,0,E21B41/0014;;G05D1/0208;;E21B41/0014;;G05D1/0208,E21B41/00;;G05D1/02,,0,0,,,,EXPIRED
34,US,A,US 3681541 A,042-288-924-912-405,1972-08-01,1972,US 3681541D A,1969-12-04,US 88219269 A,1969-12-04,SELECTIVE PROGRAMMING CONTROL SYSTEM FOR TUNING AND RECORDING,"A TV receiver is automatically tuned to a receiving channel during an interval of time, the channel and time interval being preselected through the keyboard of a programmer. During the preselected interval of time and for a short duration thereafter, operating voltage is supplied by the programmer to the receiver. Channel selection is achieved by motor advancement of a tuner control during the selected interval, the motor being deenergized when the tuner control reaches the preselected channel position.",TOP AID CORP,DOZIER WILLIE L;;CARTER JAMES M JR,,https://lens.org/042-288-924-912-405,Granted Patent,no,10,6,1,1,0,G04C23/00;;G05B19/08;;H03J5/146;;H03J5/146;;G04C23/00;;G05B19/08,G04C23/00;;G05B19/08;;H03J5/14,179/100.11;;1791001  S;;318/467;;318/486;;325/396;;325/470;;325/471,0,0,,,,EXPIRED
35,US,A,US 3187704 A,050-993-377-744-775,1965-06-08,1965,US 9560161 A,1961-03-14,US 9560161 A,1961-03-14,Ship control system,,SHELL OIL CO,SHATTO JR HOWARD L;;RONALD DOZIER JAMES,,https://lens.org/050-993-377-744-775,Granted Patent,no,10,35,3,3,0,G05D1/0208;;B63H25/04;;B63H25/42;;G05D1/0208;;B63H25/04;;B63H25/42,F16L1/20;;G05D1/02,,0,0,,,,EXPIRED
36,US,A1,US 2006/0100007 A1,163-939-082-078-322,2006-05-11,2006,US 98203504 A,2004-11-05,US 98203504 A,2004-11-05,Number selecting game with skill feature,"A number selecting game including a skill feature in which a player selects a sub-set of numbers from a pool of numbers for comparing the selected sub-set with a second sub-set of numbers selected from the pool of numbers to determine a prize, in which at least a portion of the second sub-set are chosen with skill by which the player selects the portion of the second sub-set of numbers. An apparatus for playing a number selecting game is disclosed.",DOZIER DOUG;;GWIN JAMES H JR;;MCCURDY MARTIN,DOZIER DOUG;;GWIN JAMES H JR;;MCCURDY MARTIN,SPIN & WIN INC (2005-01-06),https://lens.org/163-939-082-078-322,Patent Application,yes,19,0,1,1,0,A63F9/24;;A63F3/0421;;G07F17/3262;;G07F17/329;;A63F9/24;;A63F3/0421;;G07F17/3262;;G07F17/329,A63F9/24,463/17,0,0,,,,DISCONTINUED
37,US,A,US 5673851 A,067-234-789-159-388,1997-10-07,1997,US 57050995 A,1995-12-11,US 57050995 A,1995-12-11,Variable-air-volume diffuser with induction air assembly and method,"A variable-air-volume (VAV) conditioning system having at least one diffuser (27a-27d), a flow control element (53) movably mounted for control of the volume of supply air (SA) discharged from the diffuser (27a-27d). The VAV system also includes an air induction nozzle (50,58) mounted to induce room air (RA) flow over a room air temperature sensor (28a, 28a') which controls movement of the flow control element (53). The induction air nozzle (50,58), however, is fluid coupled to a ventilation air assembly for the discharge of ventilation air (VA) into the rooms (22a-22d). Preferably, the induction air assembly is provided by a ventilation conduit assembly (44, 46a-46d) and a ventilation air treatment and supply assembly (41) fluid coupled to a ventilation air source. The ventilation air is discharged through the air induction nozzles (58). A method for ensuring the flow of ventilation air (VA) into a room (22a-22d) including the step of discharging ventilation air through an air flow induction nozzle (50,58) so that ventilation air flow is controlled independently of and decoupled from the variable flow rate of supply air from the central air conditioning supply air source (23).",ACUTHERM L P,DOZIER JACK;;HUNKA ROBERT S;;KLINE JAMES R,ACUTHERM L.P (1995-12-01),https://lens.org/067-234-789-159-388,Granted Patent,yes,11,28,1,2,0,F24F3/044;;F24F2011/0002;;Y10S236/19;;F24F11/30;;F24F2110/10;;F24F11/76;;F24F2120/00;;F24F3/044;;F24F2011/0002;;Y10S236/19;;F24F11/30;;F24F2110/10;;F24F2120/00;;F24F11/76,F24F3/044,236/49.5;;X236DIG  19,0,0,,,,EXPIRED
