38,US,P2,US PP029587 P2,156-473-214-248-552,2018-08-14,2018,US 201615330677 V,2016-10-26,US 201615330677 V,2016-10-26,Kiwi plant named ‘AU Gulf Coast Gold’,"‘AU Gulf Coast Gold’ is a new golden-fleshed cultivar of Actinidia chinensis Planch with a low chilling requirement. ‘AU Gulf Coast Gold’ fruit is large, cylindrical and uniform in shape with yellow flesh that has a thick sweet flavor and delicious taste. ‘AU Gulf Coast Gold’ fruit has a high percent soluble solids and dry matter content. Vegetative bud burst begins in late March to early April and flowering begins on average April 18-20 in central Alabama. Fruit typically reaches maturity September 21-25 in central Alabama with an internal color hue of less than 103°.",UNIV AUBURN,DOZIER JR W ALFRED;;PITTS JAMES A;;SPIERS JAMES D,,https://lens.org/156-473-214-248-552,Plant Patent,yes,6,0,1,1,0,A01H5/08;;A01H6/00;;A01H5/08;;A01H6/00,A01H6/00;;A01H5/08,PLT 156,7,5,080-425-712-882-124;;032-766-554-673-128;;075-432-430-240-793;;032-037-351-761-347;;134-151-519-154-178,10.17660/actahortic.2003.610.2;;10.1111/j.1750-3841.2011.02084.x;;21535857;;10.21273/hortsci.40.6.1923;;10.17660/actahortic.2003.610.35;;10.1016/j.postharvbio.2010.08.010,"Huang, H., S. Wang, Z. Zhang, and J. Gong. 2003. Exploration of Actinidia genetic resources and development of ciwifruit industry in China. Acta Hort 610:29-43.;;Jaeger, S.R., R. Harker, C.M. Triggs, A. Gunson, R.L. Campbell, R. Jackman and C. Requejo-Jackman. 2011. Determining consumer purchase intentions: The importance of dry matter, size and price of kiwifruit. J. Food Sci. 76 (3):177-184.;;Jiang, Z, S. Wang, R. Huang, Z. Zhang, and H. Huang. 2005. ‘Wuzhi No3’ kiwifruit. HortScience 40(6):1923-1924.;;Patterson, K., J. Burdon and N. Lallu. 2003 ‘Hort 16A’ kiwifruit: Progress and issues with commercialization. Acta Hort. 610:267-273.;;Wall et al., “Determining a Maturity Index and the Effect of Chilling Requirements, and Cytokinin Applications on Three few Kiwi Cultivars,” Thesis—Degree of Master of Science, Auburn University, Aug. 2006, 87 pages.;;Wall et al., “Vegetative and Floral Chilling Requirement of Four New Kiwi Cultivars of Actinidia chinensis and A. deliciosa,” (Hort Science 43(3):644-647, Jun. 2008.;;Wang, M.Y., E. MacRae, M. Wohlers and K. Marsh. 2011. Changes in volatile production and sensory quality of kiwifruit during fruit maturation in Actinidia deliciosa ‘Hayward’ and A. chinensis ‘Hort 16A’. Postharvest Biol. and Technol. 59:16-24.",PENDING
39,US,A,US 5860592 A,199-431-250-643-087,1999-01-19,1999,US 88872797 A,1997-07-07,US 88872797 A;;US 57050995 A,1995-12-11,Variable-air-volume diffuser with independent ventilation air assembly and method,"A variable-air-volume (VAV) conditioning system having at least one diffuser (27a-27d) for discharging supply air (SA) into a room (22a-22d) a flow control element (53) movably mounted in the diffuser for control of the volume of supply air (SA) discharged from the diffuser (27a-27d) in response to thermal loading in the room (22a-22d). The VAV system also includes a ventilation air source (41), independent of the supply air source (23), which is fluid coupled to a ventilation air opening defining structure (59), such as a nozzle, located in the diffuser housing (15) at a position downstream of the flow control element (53). A method for ensuring the flow of ventilation air (VA) into a room (22a-22d) including the step of discharging ventilation air (VA) through a ventilation air opening device (59) positioned in the diffuser housing (15) downstream of the diffuser flow control element (53) so that ventilation air flow is controlled independently of, and decoupled from, the variable flow rate of supply air (SA) which is controlled by the flow control element (53).",ACUTHERM L P,DOZIER JACK;;HUNKA ROBERT S;;KLINE JAMES R,ACUTHERM L.P (1997-06-12),https://lens.org/199-431-250-643-087,Granted Patent,yes,11,39,1,2,0,F24F3/044;;F24F2011/0002;;Y10S236/19;;F24F11/30;;F24F2110/10;;F24F11/76;;F24F3/044;;F24F2011/0002;;Y10S236/19;;F24F2110/10;;F24F11/30;;F24F11/76,F24F3/044,236/49.3;;236/49.5;;X236DIG  19,0,0,,,,EXPIRED
40,WO,A1,WO 2009/108928 A1,163-156-952-170-966,2009-09-03,2009,US 2009/0035706 W,2009-03-02,US 3946208 A,2008-02-28,TELESCOPING CASE,"An expandable storage case is disclosed for storing various writing utensils. The storage case includes a base, an inner carousel, a top carousel, and a lid. The base, the inner carousel, and the top carousel are connected in a telescoping manner such that the storage case may be expanded from a collapsed position to an expanded, in-use position. The storage case includes a locking mechanism to selectively secure the storage case in the expanded position.",CRAYOLA LLC,ALLEN JAMES WILLIAM;;HENRY ROBERT;;DOZIER PAM;;SKRIPS CARA,,https://lens.org/163-156-952-170-966,Patent Application,yes,1,0,3,3,0,A45C7/0031;;A45C11/34;;B43K23/001;;B43M99/008;;B65D25/06;;B65D43/161;;B65D83/02;;B65D85/28;;A45C11/34;;B65D85/28;;B43K23/001;;A45C7/0031;;B65D83/02;;B43M99/008;;B65D25/06;;B65D43/161,B65D83/00;;B65D85/28,,1,0,,,"""'New Crayola Telescoping Towers Offer The Tallest' Collection of Crayola Colors Ever!'."", 2006, Retrieved from the Internet <URL:http://www.crayola.com/mediacenter/download/news/press> [retrieved on 20090410]",PENDING
41,US,B2,US 7980387 B2,067-924-773-987-97X,2011-07-19,2011,US 3946208 A,2008-02-28,US 3946208 A,2008-02-28,Telescoping case,"An expandable storage case is disclosed for storing various writing utensils. The storage case includes a base, an inner carousel, a top carousel, and a lid. The base, the inner carousel, and the top carousel are connected in a telescoping manner such that the storage case may be expanded from a collapsed position to an expanded, in-use position. The storage case includes a locking mechanism to selectively secure the storage case in the expanded position.",CRAYOLA LLC,ALLEN JAMES WILLIAM;;HENRY ROBERT;;DOZIER PAM;;SKRIPS CARA,CRAYOLA LLC (2007-08-15),https://lens.org/067-924-773-987-97X,Granted Patent,yes,13,7,3,3,0,A45C7/0031;;A45C11/34;;B43K23/001;;B43M99/008;;B65D25/06;;B65D43/161;;B65D83/02;;B65D85/28;;A45C11/34;;B65D85/28;;B43K23/001;;A45C7/0031;;B65D83/02;;B43M99/008;;B65D25/06;;B65D43/161,A47F7/00;;A45C11/34;;B65D8/14,206/214;;220/8;;211/69.1;;211/70,0,0,,,,ACTIVE
42,US,S,US D0583870 S,128-012-287-401-792,2008-12-30,2008,US 30431508 F,2008-02-28,US 30431508 F,2008-02-28,Telescoping writing implement storage case,,CRAYOLA LLC,ALLEN JAMES WILLIAM;;HENRY ROBERT;;DOZIER PAM;;SKRIPS CARA,CRAYOLA LLC (2007-08-15),https://lens.org/128-012-287-401-792,Design Right,no,0,2,1,1,0,,,1906;;D19/85;;D3/206,0,0,,,,EXPIRED
43,US,A1,US 2009/0218240 A1,089-084-076-402-242,2009-09-03,2009,US 3946208 A,2008-02-28,US 3946208 A,2008-02-28,TELESCOPING CASE,"An expandable storage case is disclosed for storing various writing utensils. The storage case includes a base, an inner carousel, a top carousel, and a lid. The base, the inner carousel, and the top carousel are connected in a telescoping manner such that the storage case may be expanded from a collapsed position to an expanded, in-use position. The storage case includes a locking mechanism to selectively secure the storage case in the expanded position.",CRAYOLA LLC,ALLEN JAMES WILLIAM;;HENRY ROBERT;;DOZIER PAM;;SKRIPS CARA,CRAYOLA LLC (2007-08-15),https://lens.org/089-084-076-402-242,Patent Application,yes,13,14,3,3,0,A45C7/0031;;A45C11/34;;B43K23/001;;B43M99/008;;B65D25/06;;B65D43/161;;B65D83/02;;B65D85/28;;A45C11/34;;B65D85/28;;B43K23/001;;A45C7/0031;;B65D83/02;;B43M99/008;;B65D25/06;;B65D43/161,A45C11/34;;B65D6/00;;B65D25/00,206/214;;220/8;;220/694,0,0,,,,ACTIVE
44,JP,A,JP 2023013966 A,169-674-813-629-827,2023-01-26,2023,JP 2022095119 A,2022-06-13,US 202117376291 A,2021-07-15,ADDITIVE MANUFACTURING SYSTEM WITH PARTIALLY FLEXIBLE BUILD PLATFORM,"To provide an additive manufacturing system including a partially flexible build platform.SOLUTION: An additive manufacturing (AM) system 100 includes a build chamber 108, a base 110 adjustably coupled to the build chamber, and a build material applicator 120 for depositing a build material 122 above a build platform 104. The build platform includes a fixed region 140 fixedly and rigidly coupled to the base, and a flex region 142 configured to flex relative to the base in response to force applied to the build platform by an object. The partial flexibility allows deformation caused by thermal distortion of the build platform during use in order to reduce final object stress. The AM system can produce larger additively manufactured objects out of a crack-prone material.SELECTED DRAWING: Figure 1",GENERAL ELECTRIC CO GE,JAMES J MURRAY;;ARCHIE LEE SWANNE JR;;EVAN JOHN DOZIER,,https://lens.org/169-674-813-629-827,Patent Application,no,0,0,6,6,0,G06F30/17;;G06F30/20;;G06F2113/10;;G06F2119/14;;B22F10/28;;B33Y10/00;;B33Y30/00;;B22F12/30;;Y02P10/25;;B22F12/30;;B22F10/28;;B22F12/82;;B33Y10/00;;B33Y30/00;;B33Y40/00;;B33Y30/00;;B22F12/30;;B22F10/28,B22F12/30;;B22F10/20;;B22F10/38;;B33Y10/00;;B33Y30/00,,0,0,,,,PENDING
45,US,A1,US 2023/0013204 A1,183-902-826-049-839,2023-01-19,2023,US 202117376291 A,2021-07-15,US 202117376291 A,2021-07-15,ADDITIVE MANUFACTURING SYSTEM WITH PARTIALLY FLEXIBLE BUILD PLATFORM,"An additive manufacturing (AM) system includes a build chamber, a base adjustably coupled to the build chamber, and a build material applicator for depositing a build material above a build platform for creating the object. The build platform includes a fixed region fixedly and rigidly coupled to the base and a flex region configured to flex relative to the base in response to a force applied to the build platform by an object. The partial flexibility allows deformation caused by thermal distortion of the build platform during use to reduce final object stress. The AM system can produce larger additively manufactured objects out of crack-prone material. In addition, the partial flexibility may prevent damage to the build platform and/or base without an overly complicated arrangement.",GEN ELECTRIC,MURRAY JAMES J;;SWANNER JR ARCHIE LEE;;DOZIER EVAN JOHN,GE INFRASTRUCTURE TECHNOLOGY LLC (2023-11-10);;GENERAL ELECTRIC COMPANY (2021-07-15),https://lens.org/183-902-826-049-839,Patent Application,yes,17,0,6,6,0,G06F30/17;;G06F30/20;;G06F2113/10;;G06F2119/14;;B22F10/28;;B33Y10/00;;B33Y30/00;;B22F12/30;;Y02P10/25;;B22F12/30;;B22F10/28;;B22F12/82;;B33Y10/00;;B33Y30/00;;B33Y40/00;;B33Y30/00;;B22F12/30;;B22F10/28,B22F12/30;;B33Y30/00,,1,0,,,"Espacenet machine translation of Abe et al., JP 2013163829 A, originally published 2013 (Year: 2013)",PENDING
46,KR,A,KR 20230012416 A,044-141-100-502-258,2023-01-26,2023,KR 20220083548 A,2022-07-07,US 202117376291 A,2021-07-15,ADDITIVE MANUFACTURING SYSTEM WITH PARTIALLY FLEXIBLE BUILD PLATFORM,"An additive manufacturing (AM) system (100) includes a manufacturing chamber (108), a base (110) controllably coupled to the manufacturing chamber (108), and a manufacturing material applicator (120) for depositing a manufacturing material (122) on a manufacturing platform (104) to create an object (102). The manufacturing platform (104) includes a fixing area (140) substantially coupled to the base (110) in a fixed manner, and a bending area (142) formed to be bent with respect to the base (110) in response to a force exerted to the manufacturing platform (104) by the object (102). Partial flexibility allows for deformation caused by thermal distortion of the manufacturing platform (104) during use to reduce final object stress. The AM system (100) can produce a larger additively manufactured object with a crack-prone material. Moreover, the partial flexibility can prevent damage to the manufacturing platform (104) and/or the base (110) without having an excessively complex arrangement.",GEN ELECTRIC,JAMES J MURRAY;;ARCHIE LEE SWANNER JR;;EVAN JOHN DOZIER,,https://lens.org/044-141-100-502-258,Patent Application,no,0,0,6,6,0,G06F30/17;;G06F30/20;;G06F2113/10;;G06F2119/14;;B22F10/28;;B33Y10/00;;B33Y30/00;;B22F12/30;;Y02P10/25;;B22F12/30;;B22F10/28;;B22F12/82;;B33Y10/00;;B33Y30/00;;B33Y40/00;;B33Y30/00;;B22F12/30;;B22F10/28,B22F12/30;;B22F10/28;;B22F12/82;;B33Y10/00;;B33Y30/00;;B33Y40/00,,0,0,,,,PENDING
47,EP,A1,EP 4119268 A1,066-091-809-175-034,2023-01-18,2023,EP 22181171 A,2022-06-27,US 202117376291 A,2021-07-15,ADDITIVE MANUFACTURING SYSTEM WITH PARTIALLY FLEXIBLE BUILD PLATFORM,"An additive manufacturing (AM) system (100) includes a build chamber (108), a base (110) adjustably coupled to the build chamber (108), and a build material applicator (120) for depositing a build material (122) above a build platform (104) for creating the object (102). The build platform (104) includes a fixed region (140) fixedly and rigidly coupled to the base (110) and a flex region (142) configured to flex relative to the base (110) in response to a force applied to the build platform (104) by an object (102). The partial flexibility allows deformation caused by thermal distortion of the build platform (104) during use to reduce final object stress. The AM system (100) can produce larger additively manufactured objects out of crack-prone material. In addition, the partial flexibility may prevent damage to the build platform (104) and/or base (110) without an overly complicated arrangement.
",GEN ELECTRIC,MURRAY JAMES J;;SWANNER JR ARCHIE LEE;;DOZIER EVAN JOHN,GENERAL ELECTRIC TECHNOLOGY GMBH (2023-12-13),https://lens.org/066-091-809-175-034,Patent Application,yes,5,0,6,6,0,G06F30/17;;G06F30/20;;G06F2113/10;;G06F2119/14;;B22F10/28;;B33Y10/00;;B33Y30/00;;B22F12/30;;Y02P10/25;;B22F12/30;;B22F10/28;;B22F12/82;;B33Y10/00;;B33Y30/00;;B33Y40/00;;B33Y30/00;;B22F12/30;;B22F10/28,B22F10/28;;B22F12/30;;B33Y10/00;;B33Y30/00,,0,0,,,,PENDING
48,CN,A,CN 115618505 A,162-456-851-412-602,2023-01-17,2023,CN 202210673716 A,2022-06-13,US 202117376291 A,2021-07-15,Additive manufacturing system with partially flexible build platform,"An additive manufacturing (AM) system (100) includes a build chamber (108), a base (110) adjustably coupled to the build chamber (108), and a build material applicator (120) for depositing build material (122) over a build platform (104) to form an article (102). The build platform (104) includes a fixed region (140) coupled to the base (110) in a fixed and rigid manner and a bending region (142) configured to bend relative to the base (110) in response to a force applied by the object (102) to the build platform (104). The partial flexibility enables deformation caused by thermal distortion of the build platform (104) during use to reduce final article stress. The AM system (100) is capable of producing larger additive manufactured articles using frangible materials. Furthermore, the partial flexibility may prevent damage to the build platform (104) and/or the base (110) without the need for an excessively complex arrangement.",GEN ELECTRIC,MURRAY JAMES J;;SWANNER ALAN L JR;;DOZIER EVAN JOHN,,https://lens.org/162-456-851-412-602,Patent Application,no,0,0,6,6,0,G06F30/17;;G06F30/20;;G06F2113/10;;G06F2119/14;;B22F10/28;;B33Y10/00;;B33Y30/00;;B22F12/30;;Y02P10/25;;B22F12/30;;B22F10/28;;B22F12/82;;B33Y10/00;;B33Y30/00;;B33Y40/00;;B33Y30/00;;B22F12/30;;B22F10/28,G06F30/17;;G06F30/20;;G06F113/10;;G06F119/14,,0,0,,,,PENDING
49,US,A,US 3154854 A,158-572-907-075-048,1964-11-03,1964,US 14331961 A,1961-10-06,US 14331961 A,1961-10-06,Ship control apparatus,,SHELL OIL CO,SHATTO JR HOWARD L;;RONALD DOZIER JAMES;;GOEPFERT BENJAMIN L,,https://lens.org/158-572-907-075-048,Granted Patent,no,3,4,2,2,0,G01C9/00;;G05D1/0208;;G05D1/0208;;G01C9/00,G01C9/00;;G01C21/00;;G05D1/02,,0,0,,,,EXPIRED
50,WO,A1,WO 2022/020789 A1,064-298-401-818-126,2022-01-27,2022,US 2021/0043086 W,2021-07-23,US 202063055927 P,2020-07-24,BUS BRIDGE FOR MODULAR SWITCHBOARD,"Apparatus and method for a modular switchboard provide an adjustable length bus bridge for electrically connecting two adjacent switchboards, where the length of the bus bridge can be adjusted on site if needed. The bus bridge comprises a first set of busbars, each being electrically insulated from one another, and a second set of busbars, each being electrically insulated from one another. The first and second sets of busbars are arranged such that the busbars in the first set of busbars and the busbars in the second set of busbars are slidable relative to one another to adjust a length of the bus bridge. A longitudinal slot is formed in each busbar in either the first or the second set of busbars, or both, to accommodate a through bolt in the bus bridge when the first and second set of busbars slide relative to one another.",SCHNEIDER ELECTRIC USA INC,DOZIER STEVEN WAYNE;;TRAVIS JR;;LIFRAN XAVIER;;RAMSEY JAMES RAYMOND,,https://lens.org/064-298-401-818-126,Patent Application,yes,7,0,18,38,0,H02B1/20;;H02B1/32;;H02B1/056;;H02B3/00;;H02G5/007;;H02G5/06;;H02B1/012;;H02B1/04;;H02B1/20;;H02B1/306;;H02B1/32;;H02B1/36,H02G5/00,,0,0,,,,PENDING
51,US,B2,US 8120902 B2,088-907-883-112-792,2012-02-21,2012,US 47219809 A,2009-05-26,US 47219809 A;;US 5587708 P,2008-05-23,Durable mass data storage device cartridge,This disclosure includes an elastic shock mount for a mass data storage device cartridge comprising a shock mount body forming a void configured to receive a mass data storage device; and a set of elastic shock mount protrusions extending outward from the shock mount body. The elastic shock mount protrusions are configured to transfer shock forces experienced by the cartridge housing to durable portions of the mass data storage device.,DOZIER MATTHEW JAMES;;BROWN BRENT R;;ALLSUP DAVID SCOTT;;JANIK PETER R;;SEAGATE TECHNOLOGY LLC,DOZIER MATTHEW JAMES;;BROWN BRENT R;;ALLSUP DAVID SCOTT;;JANIK PETER R,SEAGATE TECHNOLOGY LLC (2009-07-28),https://lens.org/088-907-883-112-792,Granted Patent,yes,19,7,4,4,0,G11B33/121;;G11B33/121,A47B81/00;;G06F1/16;;A47F7/00,361/679.36;;361/679.34;;361/679.33;;312/223.1;;312/223.2;;211/26,4,0,,,"iVDR Hard Disk Drive-Outline of Hardware Specification-(Standard type)', iVDR Hard Disk Drive Consortium, Version 2.00, Aug. 2008, (26 pgs).;;iVDR Hard Disk Drive-Outline of Hardware Specification-(Mini type)', iVDR Hard Disk Drive Consortium, Version 2.00, Aug. 2008, (26 pgs).;;""[I-O Data] iVDR-H40, iVDR-H80"", http://www.iodata.jp/prod/storage/hdd/2005/ivdr-h/print.htm, translation attached, retrieved Mar. 24, 2009, (24 pgs.);;""I-O Data"" http://iodata.jp/product/hdd/portable/usb2-ivdr/index.htm, translation attached, retrieved Mar. 24, 2009, (2 pgs).",ACTIVE
52,US,B2,US 8213173 B2,046-827-689-130-686,2012-07-03,2012,US 47218709 A,2009-05-26,US 47218709 A;;US 5587708 P,2008-05-23,Mass data storage device cartridge flexible interconnect,"This disclosure includes a portable data storage device comprising a mass data storage device, a cartridge housing enclosing a mass data storage device, and a flexible interconnect. The flexible interconnect includes an external electrical connector mechanically coupled to the cartridge, an internal electrical connector mechanically and electrically coupled to a data port of the mass data storage device, and a set of flexible electrical conductors electrically coupling the external electrical connector to the internal electrical connector. The flexible electrical conductors are routed within the cartridge such that no portion of the set of flexible electrical conductors lies in a volume defined by the space between the external electrical connector and the internal electrical connector.",ALLSUP DAVID SCOTT;;DOZIER MATTHEW JAMES;;BROWN BRENT R;;JANIK PETER R;;SEAGATE TECHNOLOGY LLC,ALLSUP DAVID SCOTT;;DOZIER MATTHEW JAMES;;BROWN BRENT R;;JANIK PETER R,SEAGATE TECHNOLOGY LLC (2009-07-28),https://lens.org/046-827-689-130-686,Granted Patent,yes,20,0,4,4,0,G11B33/121;;G11B33/121,A47B81/00;;G06F1/16;;H01R12/00,361/679.36;;361/679.33;;361/679.34;;439/67;;312/223.2,4,0,,,"iVDR Hard Disk Drive-Outline of Hardware Specification-(Standard type), iVDR Hard Disk Drive Consortium, Version 2.00, Aug. 2008, (26 pgs).;;iVDR Hard Disk Drive-Outline of Hardware Specification-(Mini type), iVDR Hard Disk Drive Consortium, Version 2.00, Aug. 2008, (26 pgs).;;""[I-O Data] iVDR-H40, iVDR-H80"", http://www.iodata.jp/prod/storage/hdd/2005/ivdr-h/print.htm, translation attached, retrieved Mar. 24, 2009, (4 pgs).;;""I-O Data"" http://iodata.jp/product/hdd/portable/usb2-ivdr/index.htm, translation attached, retrieved Mar. 24, 2009, (2 pgs).",ACTIVE
53,US,A1,US 2023/0127383 A1,063-187-935-652-919,2023-04-27,2023,US 202118010142 A,2021-07-23,US 202118010142 A;;US 202063055927 P;;US 2021/0043086 W,2020-07-24,BUS BRIDGE FOR MODULAR SWITCHBOARD,"Apparatus and method for a modular switchboard provide an adjustable length bus bridge for electrically connecting two adjacent switchboards, where the length of the bus bridge can be adjusted on site if needed. The bus bridge comprises a first set of busbars, each being electrically insulated from one another, and a second set of busbars, each being electrically insulated from one another. The first and second sets of busbars are arranged such that the busbars in the first set of busbars and the busbars in the second set of busbars are slidable relative to one another to adjust a length of the bus bridge. A longitudinal slot is formed in each busbar in either the first or the second set of busbars, or both, to accommodate a through bolt in the bus bridge when the first and second set of busbars slide relative to one another.",SCHNEIDER ELECTRIC USA INC,DOZIER STEVEN WAYNE;;TRAVIS JR CHARLES WESLEY;;LIFRAN XAVIER;;RAMSEY JAMES RAYMOND,SCHNEIDER ELECTRIC USA INC (2021-09-20),https://lens.org/063-187-935-652-919,Patent Application,yes,0,0,18,38,0,H02B1/20;;H02B1/32;;H02B1/056;;H02B3/00;;H02G5/007;;H02G5/06;;H02B1/012;;H02B1/04;;H02B1/20;;H02B1/306;;H02B1/32;;H02B1/36,H02B1/056;;H02G5/00;;H02B3/00;;H02G5/06,,0,0,,,,PENDING
54,EP,A1,EP 4154368 A1,037-420-780-278-488,2023-03-29,2023,EP 21847233 A,2021-07-23,US 202063055927 P;;US 2021/0043086 W,2020-07-24,BUS BRIDGE FOR MODULAR SWITCHBOARD,,SCHNEIDER ELECTRIC USA INC,DOZIER STEVEN WAYNE;;TRAVIS JR CHARLES WESLEY;;LIFRAN XAVIER;;RAMSEY JAMES RAYMOND,,https://lens.org/037-420-780-278-488,Patent Application,yes,0,0,18,38,0,H02B1/20;;H02B1/32;;H02B1/056;;H02B3/00;;H02G5/007;;H02G5/06;;H02B1/012;;H02B1/04;;H02B1/20;;H02B1/306;;H02B1/32;;H02B1/36,H02G5/00,,0,0,,,,PENDING
55,US,A1,US 2009/0296340 A1,086-254-646-603-776,2009-12-03,2009,US 47219809 A,2009-05-26,US 47219809 A;;US 5587708 P,2008-05-23,DURABLE MASS DATA STORAGE DEVICE CARTRIDGE,This disclosure includes an elastic shock mount for a mass data storage device cartridge comprising a shock mount body forming a void configured to receive a mass data storage device; and a set of elastic shock mount protrusions extending outward from the shock mount body. The elastic shock mount protrusions are configured to transfer shock forces experienced by the cartridge housing to durable portions of the mass data storage device.,SEAGATE TECHNOLOGY LLC,DOZIER MATTHEW JAMES;;BROWN BRENT R;;ALLSUP DAVID SCOTT;;JANIK PETER R,SEAGATE TECHNOLOGY LLC (2009-07-28),https://lens.org/086-254-646-603-776,Patent Application,yes,19,4,4,4,0,G11B33/121;;G11B33/121,G06F1/16,361/679.36,0,0,,,,ACTIVE
56,US,A1,US 2009/0293075 A1,152-217-441-618-092,2009-11-26,2009,US 47218709 A,2009-05-26,US 47218709 A;;US 5587708 P,2008-05-23,MASS DATA STORAGE DEVICE CARTRIDGE FLEXIBLE INTERCONNECT,"This disclosure includes a portable data storage device comprising a mass data storage device, a cartridge housing enclosing a mass data storage device, and a flexible interconnect. The flexible interconnect includes an external electrical connector mechanically coupled to the cartridge, an internal electrical connector mechanically and electrically coupled to a data port of the mass data storage device, and a set of flexible electrical conductors electrically coupling the external electrical connector to the internal electrical connector. The flexible electrical conductors are routed within the cartridge such that no portion of the set of flexible electrical conductors lies in a volume defined by the space between the external electrical connector and the internal electrical connector.",SEAGATE TECHNOLOGY LLC,ALLSUP DAVID SCOTT;;DOZIER MATTHEW JAMES;;BROWN BRENT R;;JANIK PETER R,SEAGATE TECHNOLOGY LLC (2009-07-28),https://lens.org/152-217-441-618-092,Patent Application,yes,20,1,4,4,0,G11B33/121;;G11B33/121,G11B33/02,720/600,0,0,,,,ACTIVE
57,WO,A3,WO 2022/020779 A3,060-762-941-206-690,2022-03-03,2022,US 2021/0043073 W,2021-07-23,US 202063055927 P;;US 202063055938 P,2020-07-24,FIELD ASSEMBLED MODULAR ELECTRICAL DISTRIBUTION DEVICE,"The present invention discloses a field assembled electrical distribution device assembled from various prepackaged modular kits. The prepackaged modular kits include all of the components required for their assembly. The prepackaged modular kits, when assembled by a certified assembler using a certified method and verification means provided by the modular kit manufacturer and one or more well know third-party certifiers, meets the requirements local, national and international electrical codes and is eligible for the third-party's certification mark.",SCHNEIDER ELECTRIC USA INC,DOZIER STEVEN WAYNE;;TRAVIS JR;;MORENO-MANZO ADRIAN;;RAMSEY JAMES RAYMOND;;LIFRAN XAVIER,,https://lens.org/060-762-941-206-690,Search Report,yes,4,0,14,38,0,H02B1/04;;H01H71/08;;H02B1/056;;H01R25/142;;H02B3/00;;H01R11/07;;H01R2101/00;;H01H2071/0278;;H01H71/08;;H01R25/142;;H02B1/04;;H02B3/00;;H01H2071/0278;;H02B1/056;;H02B1/20;;G05B19/188;;G05B2219/31396,H02G5/00;;H01H71/02;;H02B1/42;;H02B3/00,,0,0,,,,PENDING
