"#",Jurisdiction,Kind,Display Key,Lens ID,Publication Date,Publication Year,Application Number,Application Date,Priority Numbers,Earliest Priority Date,Title,Abstract,Applicants,Inventors,Owners,URL,Document Type,Has Full Text,Cites Patent Count,Cited by Patent Count,Simple Family Size,Extended Family Size,Sequence Count,CPC Classifications,IPCR Classifications,US Classifications,NPL Citation Count,NPL Resolved Citation Count,NPL Resolved Lens ID(s),NPL Resolved External ID(s),NPL Citations,Legal Status
1,WO,A1,WO 2021/202187 A1,066-794-380-287-316,2021-10-07,2021,US 2021/0023842 W,2021-03-24,US 202063002391 P,2020-03-31,LARGE VOLUME SAMPLE INJECTION FOR LIQUID CHROMATOGRAPHY,Described are methods and fluidic networks for injecting a sample into a liquid chromatography system. The method may be applied for separations in which increased sensitivity is desired and a large sample volume in a strong solvent is to be injected. The method may include merging a flow of a solvent having a sample dissolved therein with a flow of a diluent. The merging occurs in a fluidic path to an injection valve. The full amount of sample previously contained in a smaller volume of solvent is maintained in a larger volume of a diluted sample that includes the strong solvent and the diluent. The entire volume of the diluted sample is loaded into a sample loop coupled to the injection valve and subsequently injected into the system flow of the chromatography system.,WATERS TECHNOLOGIES CORP,CORMIER SYVLAIN GILLES;;HILL JASON F,,https://lens.org/066-794-380-287-316,Patent Application,yes,4,0,2,2,0,G01N30/20;;G01N30/20;;G01N30/24;;G01N30/26;;G01N35/1097;;G01N2030/027;;G01N2030/201;;G01N2030/201;;G01N2030/202;;G01N2030/207;;G01N2030/207,G01N30/24;;G01N30/20;;G01N30/26,,0,0,,,,PENDING
2,US,A1,US 2021/0302396 A1,029-065-815-476-422,2021-09-30,2021,US 202117210924 A,2021-03-24,US 202117210924 A;;US 202063002391 P,2020-03-31,LARGE VOLUME SAMPLE INJECTION FOR LIQUID CHROMATOGRAPHY,Described are methods and fluidic networks for injecting a sample into a liquid chromatography system. The method may be applied for separations in which increased sensitivity is desired and a large sample volume in a strong solvent is to be injected. The method may include merging a flow of a solvent having a sample dissolved therein with a flow of a diluent. The merging occurs in a fluidic path to an injection valve. The full amount of sample previously contained in a smaller volume of solvent is maintained in a larger volume of a diluted sample that includes the strong solvent and the diluent. The entire volume of the diluted sample is loaded into a sample loop coupled to the injection valve and subsequently injected into the system flow of the chromatography system.,WATERS TECHNOLOGIES CORP,CORMIER SYLVAIN GILLES;;HILL JASON F,WATERS TECHNOLOGIES CORPORATION (2021-03-09),https://lens.org/029-065-815-476-422,Patent Application,yes,0,1,2,2,0,G01N30/20;;G01N30/20;;G01N30/24;;G01N30/26;;G01N35/1097;;G01N2030/027;;G01N2030/201;;G01N2030/201;;G01N2030/202;;G01N2030/207;;G01N2030/207,G01N30/20;;G01N30/02;;G01N35/10,,0,0,,,,DISCONTINUED
3,CN,A,CN 114746748 A,129-748-677-885-946,2022-07-12,2022,CN 202080081769 A,2020-11-11,US 201962939891 P;;US 2020/0059982 W,2019-11-25,Sampling of liquid chromatography using split solvent stream,Described herein are selectable flow limiting devices and fluidic networks for chromatographic sample dilution during sample introduction. A selectable flow restriction device is used in conjunction with the diverter to define an adjustable diverter (42) for dividing the high pressure solvent stream into two separate solvent streams having the same solvent composition. The first solvent stream is passed to a sample manager (24) where the sample is injected as a discrete fluid plug at the injection valve into the stream containing at least one solvent. A second solvent stream is combined with the first solvent carrying the sample fluid plug at a combiner (40) downstream of the sample introduction location. The second solvent stream dilutes the sample plug during mixing of the two solvent streams.,WATERS TECHNOLOGIES CORP,HILL JASON F;;CORMIER SYLVAIN G;;GILA MANISH,,https://lens.org/129-748-677-885-946,Patent Application,no,0,0,4,4,0,G01N30/34;;G01N30/20;;G01N30/06;;G01N30/32;;G01N2030/202;;G01N30/10;;G01N30/20;;G01N30/34;;G01N2030/027;;G01N2030/201;;G01N2030/202,G01N30/06;;G01N30/20;;G01N30/32;;G01N30/34,,0,0,,,,PENDING
4,AT,T1,AT E366617 T1,182-492-693-237-418,2007-08-15,2007,AT 03799802 T,2003-05-19,US 0315790 W,2003-05-19,VERFAHREN ZUR VORFILTERUNG EINER PROTEINLÖSUNG,,MILLIPORE CORP,SIWAK MARTY;;AN HONG;;CORMIER JASON;;KINZLMAIER DANA,,https://lens.org/182-492-693-237-418,Granted Patent,no,0,0,8,8,0,B01D15/00;;B01D29/41;;B01D61/00;;B01D61/145;;B01D61/147;;B01D69/141;;B01J20/24;;B01J20/26;;B01J20/28023;;B01J20/28028;;B01J20/28052;;B01J2220/4825;;C07K1/34;;C07K1/36;;G01N1/34;;G01N1/4077;;B01D61/146;;B01D61/146;;B01D69/141,B01D15/00;;B01D29/41;;B01D61/00;;B01D61/14;;B01D61/16;;B01D69/14;;C07K1/34;;C07K1/36;;G01N1/28;;G01N1/34,,0,0,,,,EXPIRED
5,US,A1,US 2021/0156826 A1,099-979-309-939-316,2021-05-27,2021,US 202017095280 A,2020-11-11,US 202017095280 A;;US 201962939891 P,2019-11-25,SAMPLE INJECTION FOR LIQUID CHROMATOGRAPHY USING SPLIT SOLVENT FLOW,Described herein are a selectable flow restriction device and a fluidic network for chromatographic sample dilution during injection. A selectable flow restriction device is used in combination with a splitter to define an adjustable splitter for separating a high-pressure solvent flow into two separate solvent flows having the same solvent composition. The first solvent flow passes to a sample manager where a sample is injected as a discrete fluidic plug at an injection valve into a flow comprising at least one solvent. The second solvent flow is merged downstream from the location of injection with the first solvent carrying the sample fluidic plug. The second solvent flow dilutes the sample plug during the mixture of the two solvent flows.,WATERS TECHNOLOGIES CORP,HILL JASON F;;CORMIER SYLVAIN GILLES;;GILAR MARTIN,WATERS TECHNOLOGIES CORPORATION (2020-10-30),https://lens.org/099-979-309-939-316,Patent Application,yes,3,0,4,4,0,G01N30/34;;G01N30/20;;G01N30/06;;G01N30/32;;G01N2030/202;;G01N30/10;;G01N30/20;;G01N30/34;;G01N2030/027;;G01N2030/201;;G01N2030/202,G01N30/20;;G01N30/10;;G01N30/34,,0,0,,,,PENDING
6,EP,A1,EP 4065971 A1,018-428-753-248-918,2022-10-05,2022,EP 20820001 A,2020-11-11,US 201962939891 P;;US 2020/0059982 W,2019-11-25,SAMPLE INJECTION FOR LIQUID CHROMATOGRAPHY USING SPLIT SOLVENT FLOW,,WATERS TECHNOLOGIES CORP,HILL JASON F;;CORMIER SYLVAIN GILLES;;GILAR MARTIN,,https://lens.org/018-428-753-248-918,Patent Application,yes,0,0,4,4,0,G01N30/34;;G01N30/20;;G01N30/06;;G01N30/32;;G01N2030/202;;G01N30/10;;G01N30/20;;G01N30/34;;G01N2030/027;;G01N2030/201;;G01N2030/202,G01N30/06;;G01N30/20;;G01N30/32;;G01N30/34,,0,0,,,,PENDING
7,WO,A1,WO 2021/108133 A1,199-841-552-049-229,2021-06-03,2021,US 2020/0059982 W,2020-11-11,US 201962939891 P,2019-11-25,SAMPLE INJECTION FOR LIQUID CHROMATOGRAPHY USING SPLIT SOLVENT FLOW,Described herein are a selectable flow restriction device and a fluidic network for chromatographic sample dilution during injection. A selectable flow restriction device is used in combination with a splitter to define an adjustable splitter (42) for separating a high-pressure solvent flow into two separate solvent flows having the same solvent composition. The first solvent flow passes to a sample manager (24) where a sample is injected as a discrete fluidic plug at an injection valve into a flow comprising at least one solvent. The second solvent flow is merged at a combiner (40) downstream from the location of injection with the first solvent carrying the sample fluidic plug. The second solvent flow dilutes the sample plug during the mixture of the two solvent flows.,WATERS TECHNOLOGIES CORP,HILL JASON F;;CORMIER SYLVAIN GILLES;;GILAR MARTIN,,https://lens.org/199-841-552-049-229,Patent Application,yes,4,0,4,4,0,G01N30/34;;G01N30/20;;G01N30/06;;G01N30/32;;G01N2030/202;;G01N30/10;;G01N30/20;;G01N30/34;;G01N2030/027;;G01N2030/201;;G01N2030/202,G01N30/06;;G01N30/20;;G01N30/32;;G01N30/34,,0,0,,,,PENDING
8,DE,D1,DE 60314916 D1,044-853-298-454-655,2007-08-23,2007,DE 60314916 T,2003-05-19,US 0315790 W,2003-05-19,VERFAHREN ZUR VORFILTERUNG EINER PROTEINLÖSUNG,,MILLIPORE CORP,SIWAK MARTY;;AN HONG;;CORMIER JASON R;;KINZLMAIER DANA,,https://lens.org/044-853-298-454-655,Granted Patent,no,0,0,8,8,0,B01D15/00;;B01D29/41;;B01D61/00;;B01D61/145;;B01D61/147;;B01D69/141;;B01J20/24;;B01J20/26;;B01J20/28023;;B01J20/28028;;B01J20/28052;;B01J2220/4825;;C07K1/34;;C07K1/36;;G01N1/34;;G01N1/4077;;B01D61/146;;B01D61/146;;B01D69/141,B01D61/14;;B01D15/00;;B01D29/41;;B01D61/00;;B01D61/16;;B01D69/14;;C07K1/34;;C07K1/36;;G01N1/28;;G01N1/34,,0,0,,,,EXPIRED
9,CA,A1,CA 2544253 A1,027-558-561-743-158,2005-05-26,2005,CA 2544253 A,2004-11-09,US 51953603 P;;US 2004/0037693 W,2003-11-12,NOVEL SEQUENCES ENCODING HEPATITIS C VIRUS GLYCOPROTEINS,"The present invention concerns a modified nucleic acid molecule comprising a nucleotide sequence coding for a full length hepatitis C virus (HCV) glycoprotein selected from the group consisting of E1 glycoprotein and E1/E2 glycoprotein heterodimer, this molecule having at least one nucleotide alteration, wherein, due to this alteration, at least one RNA splice site selected from the group consisting of RNA splice acceptor and RNA splice don or sites is eliminated from the coding sequence. The invention is also directed to methods for expressing on the surface of a cell and a pseudovirion an HCV glycoprotein, wherein the majority of the glycoprotein is full length. The invention further provides a cell and a pseudovirion expressing such glycoprotein. The invention still further provides a method for determining whether an agent inhibits HCV fusion with and entry into a target cell. The invention also provides an agent that inhibits HCV fusion with and entry int o a target cell. The invention further provides methods for treating a subject afflicted with an HCV-associated disorder, for preventing an HCV infection i n a subject, and for inhibiting in a subject the onset of an HCV-associated disorder.",EINSTEIN COLL MED;;PROGENICS PHARM INC,GARDNER JASON;;CORMIER EMMANUEL G;;DUMONCEAUX JULIE;;DRAGIC TATJANA,,https://lens.org/027-558-561-743-158,Patent Application,no,0,0,10,10,20,A61K2039/5258;;A61K2039/5258;;A61P31/00;;A61P31/14;;A61P37/00;;C07H21/02;;C07H21/02;;C07H21/04;;C07H21/04;;C07K14/005;;C07K14/005;;C12N7/00;;C12N7/00;;C12N15/86;;C12N15/86;;C12N2740/13023;;C12N2740/13023;;C12N2740/13043;;C12N2740/13043;;C12N2740/13045;;C12N2740/13045;;C12N2770/24222;;C12N2770/24222;;C12N2770/24234;;C12N2770/24234;;C12N2810/609;;C12N2810/609;;C12Q1/707;;C12Q1/707,C07H21/04;;A61K39/00;;C07H21/02;;C07K14/18;;C12N/;;C12N7/00;;C12N7/01;;C12Q1/68;;C12Q1/70,,0,0,,,,DISCONTINUED
10,WO,A2,WO 2005/047481 A2,180-899-089-267-727,2005-05-26,2005,US 2004/0037693 W,2004-11-09,US 51953603 P,2003-11-12,NOVEL SEQUENCES ENCODING HAPATITIS C VIRUS GLYCOPROTEINS,"The present invention concerns a modified nucleic acid molecule comprising a nucleotide sequence coding for a full length hepatitis C virus (HCV) glycoprotein selected from the group consisting of E1 glycoprotein and E1/E2 glycoprotein heterodimer, this molecule having at least one nucleotide alteration, wherein, due to this alteration, at least one RNA splice site selected from the group consisting of RNA splice acceptor and RNA splice donor sites is eliminated from the coding sequence. The invention is also directed to methods for expressing on the surface of a cell and a pseudovirion an HCV glycoprotein, wherein the majority of the glycoprotein is full length. The invention further provides a cell and a pseudovirion expressing such glycoprotein. The invention still further provides a method for determining whether an agent inhibits HCV fusion with and entry into a target cell. The invention also provides an agent that inhibits HCV fusion with and entry into a target cell. The invention further provides methods for treating a subject afflicted with an HCV-associated disorder, for preventing an HCV infection in a subject, and for inhibiting in a subject the onset of an HCV-associated disorder.",PROGENICS PHARM INC;;EINSTEIN COLL MED,CORMIER EMMANUEL G;;GARDNER JASON;;DRAGIC TATJANA;;DUMONCEAUX JULIE,,https://lens.org/180-899-089-267-727,Patent Application,yes,0,0,10,10,0,A61K2039/5258;;A61K2039/5258;;A61P31/00;;A61P31/14;;A61P37/00;;C07H21/02;;C07H21/02;;C07H21/04;;C07H21/04;;C07K14/005;;C07K14/005;;C12N7/00;;C12N7/00;;C12N15/86;;C12N15/86;;C12N2740/13023;;C12N2740/13023;;C12N2740/13043;;C12N2740/13043;;C12N2740/13045;;C12N2740/13045;;C12N2770/24222;;C12N2770/24222;;C12N2770/24234;;C12N2770/24234;;C12N2810/609;;C12N2810/609;;C12Q1/707;;C12Q1/707,A61K39/00;;C07H21/02;;C07H21/04;;C07K14/18;;C12N/;;C12N7/00;;C12N7/01;;C12Q1/68;;C12Q1/70,,1,0,,,See references of EP 1687325A4,PENDING
11,WO,A1,WO 2004/103530 A1,145-752-387-065-87X,2004-12-02,2004,US 0315790 W,2003-05-19,US 0315790 W,2003-05-19,PROCESS FOR PREFILTRATION OF A PROTEIN SOLUTION,"A process is provided for selectively removing plugging constituents from a biomolecule containing solution in a normal flow (NFF) filtration process before viral filtration. Preferably, it relates to a process for selectively removing plugging constituents from a biomolecule solution in a normal flow (NFF) filtration process and virus particles from the solution in a two-step filtration process. In a first step, a biomolecule solution is filtered through a filtration device containing one or more plugging constituent removing media in the form of one or more layers of adsorptive depth filters, filled microporous membranes or a small bed of media in a normal flow filtration mode of operation, to produce a plugging constituent -free stream. The plugging constituent-free stream can then be filtered through one or more ultrafiltration membranes to retain virus particles at a retention level of at least 3 LRV and to allow passage therethrough of a plugging constituent- free and virus-free biomolecule containing solution.",MILLIPORE CORP,SIWAK MARTY;;AN HONG;;CORMIER JASON R;;KINZLMAIER DANA,,https://lens.org/145-752-387-065-87X,Patent Application,yes,4,10,8,8,0,B01D15/00;;B01D29/41;;B01D61/00;;B01D61/145;;B01D61/147;;B01D69/141;;B01J20/24;;B01J20/26;;B01J20/28023;;B01J20/28028;;B01J20/28052;;B01J2220/4825;;C07K1/34;;C07K1/36;;G01N1/34;;G01N1/4077;;B01D61/146;;B01D61/146;;B01D69/141,B01D15/00;;B01D29/41;;B01D61/00;;B01D61/14;;B01D61/16;;B01D69/14;;C07K1/34;;C07K1/36;;G01N1/28;;G01N1/34,,1,0,,,"FILTRATION AND SEPARATION., vol. 34, 1997, GBELSEVIER ADVANCED TECHNOLOGY, OXFORD., pages 73 - 78, XP004136740",PATENTED
12,EP,A2,EP 1687325 A2,020-309-100-071-414,2006-08-09,2006,EP 04818701 A,2004-11-09,US 2004/0037693 W;;US 51953603 P,2003-11-12,NOVEL SEQUENCES ENCODING HEPATITIS C VIRUS GLYCOPROTEINS,,PROGENICS PHARM INC;;EINSTEIN COLL MED,CORMIER EMMANUEL G;;GARDNER JASON;;DRAGIC TATJANA;;DUMONCEAUX JULIE,,https://lens.org/020-309-100-071-414,Patent Application,yes,0,0,10,10,20,A61K2039/5258;;A61K2039/5258;;A61P31/00;;A61P31/14;;A61P37/00;;C07H21/02;;C07H21/02;;C07H21/04;;C07H21/04;;C07K14/005;;C07K14/005;;C12N7/00;;C12N7/00;;C12N15/86;;C12N15/86;;C12N2740/13023;;C12N2740/13023;;C12N2740/13043;;C12N2740/13043;;C12N2740/13045;;C12N2740/13045;;C12N2770/24222;;C12N2770/24222;;C12N2770/24234;;C12N2770/24234;;C12N2810/609;;C12N2810/609;;C12Q1/707;;C12Q1/707,C07K14/18;;A61K39/00;;A61K39/12;;C07H21/02;;C07H21/04;;C12N/;;C12N7/00;;C12N7/01;;C12N7/04;;C12Q1/68;;C12Q1/70,,0,0,,,,DISCONTINUED
13,US,B2,US 7118675 B2,133-152-967-339-596,2006-10-10,2006,US 35791403 A,2003-02-04,US 35791403 A;;US 35438602 P,2002-02-04,Process for removing protein aggregates and virus from a protein solution,"A process is provided for selectively removing protein aggregates from a protein solution in a normal flow (NFF) filtration process. Preferably, it relates to a process for selectively removing protein aggregates from a protein solution in a normal flow (NFF) filtration process and virus particles from a protein solution in a two-step filtration process. In a first step, a protein solution is filtered through one or more layers of adsorptive depth filters, charged or surface modified microporous membranes or a small bed of chromatography media in a normal flow filtration mode of operation, to produce a protein aggregate free stream. The aggregate free protein stream can then be filtered through one or more ultrafiltration membranes to retain virus particles at a retention level of at least 3 LRV and to allow passage therethrough of an aggregate free and virus free protein solution.",MILLIPORE CORP,SIWAK MARTIN;;AN HONG;;CORMIER JASON R;;KINZLMAIER DANA,EMD MILLIPORE CORPORATION (2003-01-21),https://lens.org/133-152-967-339-596,Granted Patent,yes,17,39,8,9,0,B01D61/145;;B01D61/16;;B01D2311/04;;C07K1/34;;C07K1/36;;Y10T436/255;;B01D61/146;;Y10T436/255;;C07K1/36;;B01D61/145;;B01D2311/04;;B01D61/16;;C07K1/34;;B01D61/146,B01D61/00;;B01D11/00;;B01D61/14;;B01D61/16;;C07K1/34;;C07K1/36;;C08G16/02;;C12N7/02,210/645;;210/638;;210/767;;435/239;;435/235.1;;530/390.1;;530/390.5,0,0,,,,EXPIRED
14,WO,A3,WO 2005/047481 A3,097-129-029-117-488,2005-09-09,2005,US 2004/0037693 W,2004-11-09,US 51953603 P,2003-11-12,NOVEL SEQUENCES ENCODING HAPATITIS C VIRUS GLYCOPROTEINS,"The present invention concerns a modified nucleic acid molecule comprising a nucleotide sequence coding for a full length hepatitis C virus (HCV) glycoprotein selected from the group consisting of E1 glycoprotein and E1/E2 glycoprotein heterodimer, this molecule having at least one nucleotide alteration, wherein, due to this alteration, at least one RNA splice site selected from the group consisting of RNA splice acceptor and RNA splice donor sites is eliminated from the coding sequence. The invention is also directed to methods for expressing on the surface of a cell and a pseudovirion an HCV glycoprotein, wherein the majority of the glycoprotein is full length. The invention further provides a cell and a pseudovirion expressing such glycoprotein. The invention still further provides a method for determining whether an agent inhibits HCV fusion with and entry into a target cell. The invention also provides an agent that inhibits HCV fusion with and entry into a target cell. The invention further provides methods for treating a subject afflicted with an HCV-associated disorder, for preventing an HCV infection in a subject, and for inhibiting in a subject the onset of an HCV-associated disorder.",PROGENICS PHARM INC;;EINSTEIN COLL MED,CORMIER EMMANUEL G;;GARDNER JASON;;DRAGIC TATJANA;;DUMONCEAUX JULIE,,https://lens.org/097-129-029-117-488,Search Report,yes,0,0,10,10,0,A61K2039/5258;;A61K2039/5258;;A61P31/00;;A61P31/14;;A61P37/00;;C07H21/02;;C07H21/02;;C07H21/04;;C07H21/04;;C07K14/005;;C07K14/005;;C12N7/00;;C12N7/00;;C12N15/86;;C12N15/86;;C12N2740/13023;;C12N2740/13023;;C12N2740/13043;;C12N2740/13043;;C12N2740/13045;;C12N2740/13045;;C12N2770/24222;;C12N2770/24222;;C12N2770/24234;;C12N2770/24234;;C12N2810/609;;C12N2810/609;;C12Q1/707;;C12Q1/707,A61K39/00;;C07H21/02;;C07H21/04;;C07K14/18;;C12N/;;C12N7/00;;C12N7/01;;C12Q1/68;;C12Q1/70,,3,2,047-294-743-493-646;;030-304-889-391-211,pmc296095;;14645599;;10.1128/jvi.77.24.13418-13424.2003;;9499075;;10.1128/jvi.72.3.2183-2191.1998;;pmc109514,"DUMONCEAUX J. ET AL: ""Expression of Unmodified Hepatitis C Virus Envelope Glycoprotein-Coding Sequences Leads to Cryptic Intron Excision and Cell Surface Expression of E1/E2 Heterodimers Comprising Full-Length and Partially Deleted E1"", J VIROL, vol. 77, no. 24, December 2003 (2003-12-01), pages 13418 - 13424, XP002989065;;COCQUEREL L. ET AL: ""A Retention Signal Necessary and Sufficient for Endoplasmic Reticulum Localization Maps to the Transmembrane Domain of Hepatitis C Virus Glycoprotein E2"", J VIROL, vol. 72, no. 5, March 1998 (1998-03-01), pages 2183 - 2191, XP002116794;;See also references of EP 1687325A4",PENDING
15,WO,A2,WO 2003/066669 A2,182-211-183-083-38X,2003-08-14,2003,US 0303269 W,2003-02-04,US 35438602 P,2002-02-04,PROCESS FOR REMOVING PROTEIN AGGREGATES AND VIRUS FROM A PROTEIN SOLUTION,"A process is provided for selectively removing protein aggregates from a protein solution in a normal flow (NFF) filtration process. Preferably, it relates to a process for selectively removing protein aggregates from a protein solution in a normal flow (NFF) filtration process and virus particles from a protein solution in a two-step filtration process. In a first step, a protein solution is filtered through one or more layers of adsorptive depth filters, charged or surface modified microporous membranes or a small bed of chromatography media in a normal flow filtration mode of operation, to produce a protein aggregate free stream. The aggregate free protein stream can then be filtered through one or more ultrafiltration membranes to retain virus particles at a retention level of at least 3 LRV and to allow passage therethrough of an aggregate free and virus free protein solution.",MILLIPORE CORP,SIWAK MARTY;;AN HONG;;CORMIER JASON R;;KINZLMAIER DANA,,https://lens.org/182-211-183-083-38X,Patent Application,yes,0,0,8,9,0,B01D61/145;;B01D61/16;;B01D2311/04;;C07K1/34;;C07K1/36;;Y10T436/255;;B01D61/146;;Y10T436/255;;C07K1/36;;B01D61/145;;B01D2311/04;;B01D61/16;;C07K1/34;;B01D61/146,B01D61/14;;B01D61/16;;C07K1/34;;C07K1/36,,0,0,,,,PENDING
16,EP,A4,EP 1687325 A4,046-828-836-817-053,2008-11-12,2008,EP 04818701 A,2004-11-09,US 2004/0037693 W;;US 51953603 P,2003-11-12,NOVEL SEQUENCES ENCODING HEPATITIS C VIRUS GLYCOPROTEINS,,PROGENICS PHARM INC;;EINSTEIN COLL MED,CORMIER EMMANUEL G;;GARDNER JASON;;DRAGIC TATJANA;;DUMONCEAUX JULIE,,https://lens.org/046-828-836-817-053,Search Report,no,0,0,10,10,0,A61K2039/5258;;C07H21/02;;C07H21/04;;C07K14/005;;C12N7/00;;C12N15/86;;C12N2740/13023;;C12N2740/13043;;C12N2740/13045;;C12N2770/24222;;C12N2770/24234;;C12N2810/609;;C12Q1/707;;A61P31/00;;A61P31/14;;A61P37/00;;C07H21/02;;C07K14/005;;C12Q1/707;;C07H21/04;;C12N2740/13043;;C12N2740/13045;;C12N2740/13023;;C12N7/00;;C12N2770/24222;;C12N15/86;;A61K2039/5258;;C12N2770/24234;;C12N2810/609,C07K14/18;;A61K39/00;;A61K39/12;;C07H21/02;;C07H21/04;;C12N/;;C12N7/00;;C12N7/01;;C12N7/04;;C12Q1/68;;C12Q1/70,,3,3,006-270-165-965-512;;074-746-090-953-441;;101-741-569-509-101,10.1016/s0014-5793(03)00635-5;;12832074;;10.1128/jvi.76.18.9335-9344.2002;;12186916;;pmc136469;;10.1128/jvi.71.1.697-704.1997;;pmc191102;;8985401,"DRUMMER H E ET AL: ""Cell surface expression of functional hepatitis C virus E1 and E2 glycoproteins"", FEBS LETTERS, vol. 546, no. 2-3, 10 July 2003 (2003-07-10), pages 385 - 390, XP004433679, ISSN: 0014-5793;;TRIYATNI M ET AL: ""INTERACTION OF HEPATITIS C VIRUS-LIKE PARTICLES AND CELLS: A MODEL SYSTEM FOR STUDYING VIRAL BINDING AND ENTRY"", JOURNAL OF VIROLOGY, vol. 76, no. 18, 1 September 2002 (2002-09-01), pages 9335 - 9344, XP002355721, ISSN: 0022-538X;;DELEERSNYDER V ET AL: ""FORMATION OF NATIVE HEPATITIS C VIRUS GLYCOPROTEIN COMPLEXES"", JOURNAL OF VIROLOGY, vol. 71, no. 1, 1 January 1997 (1997-01-01), pages 697 - 704, XP002030792, ISSN: 0022-538X",DISCONTINUED
17,ES,T3,ES 2290553 T3,059-351-079-115-324,2008-02-16,2008,ES 03799802 T,2003-05-19,US 0315790 W,2003-05-19,PROCEDIMIENTO PARA PREFILTRAR UNA SOLUCION DE PROTEINAS.,"Un procedimiento para eliminar de manera selectiva los constituyentes de obturación y las partículas víricas de una solución acuosa de proteínas o péptidos que comprende: filtrar en primer lugar una solución de proteínas o péptidos que contiene dichos constituyentes de obturación y los virus mediante un dispositivo que contiene uno o más medios de eliminación de los constituyentes de obturación en un modo de operación de filtración con flujo normal, recuperar la solución de proteínas o péptidos libre de constituyentes de obturación, y en segundo lugar, filtrar directamente dicha solución de proteínas o péptidos a través de una o más membranas de ultrafiltración que tengan un corte de pesos moleculares comprendido entre aproximadamente 200 kD y aproximadamente 1000 kD para retener las partículas víricas en dicha una o más membranas de ultrafiltración a un nivel de al menos 3 LRV, y para recuperar una solución acuosa de proteínas o péptidos libre de virus, caracterizada porque el primer dispositivo de filtro está en forma de una almohadilla fibrosa y el medio de eliminación del constituyente de obturación comprende tierra de diatomeas.",MILLIPORE CORP,SIWAK MARTY;;AN HONG;;CORMIER JASON R;;KINZLMAIER DANA,,https://lens.org/059-351-079-115-324,Granted Patent,no,0,0,8,8,0,B01D15/00;;B01D29/41;;B01D61/00;;B01D61/145;;B01D61/147;;B01D69/141;;B01J20/24;;B01J20/26;;B01J20/28023;;B01J20/28028;;B01J20/28052;;B01J2220/4825;;C07K1/34;;C07K1/36;;G01N1/34;;G01N1/4077;;B01D61/146;;B01D61/146;;B01D69/141,B01D61/14;;B01D15/00;;B01D29/41;;B01D61/00;;B01D61/16;;B01D69/14;;C07K1/34;;C07K1/36;;G01N1/28;;G01N1/34,,0,0,,,,EXPIRED
