"#",Jurisdiction,Kind,Display Key,Lens ID,Publication Date,Publication Year,Application Number,Application Date,Priority Numbers,Earliest Priority Date,Title,Abstract,Applicants,Inventors,Owners,URL,Document Type,Has Full Text,Cites Patent Count,Cited by Patent Count,Simple Family Size,Extended Family Size,Sequence Count,CPC Classifications,IPCR Classifications,US Classifications,NPL Citation Count,NPL Resolved Citation Count,NPL Resolved Lens ID(s),NPL Resolved External ID(s),NPL Citations,Legal Status
1,GB,B,GB 2386027 B,146-421-714-234-926,2005-07-13,2005,GB 0204865 A,2002-03-01,GB 0204865 A,2002-03-01,Mobile telephone,,DAVIDSON LAURENCE KEITH;;SILVER GAVIN ANTONY,DAVIDSON LAURENCE KEITH;;SILVER GAVIN ANTONY,,https://lens.org/146-421-714-234-926,Granted Patent,no,6,0,3,3,0,H04M1/0202;;H02S40/38;;H02J7/35;;Y02E10/50;;Y02E70/30;;H04M1/724,H01L31/058;;H02J7/35;;H02S40/38;;H04M1/02;;H04M1/724,H4J JK            JK;;H4J J36Q          JK,0,0,,,,EXPIRED
2,GB,A,GB 2386027 A,057-576-098-969-960,2003-09-03,2003,GB 0204865 A,2002-03-01,GB 0204865 A,2002-03-01,Mobile telephone with solar panel,A mobile telephone having a rechargeable battery is provided additionally with a solar panel comprising at least one solar cell 30 mounted on the telephone and connected to charge the battery. The solar panel of the invention is mounted on the same side of the telephone as the earpiece 14.,DAVIDSON LAURENCE KEITH;;SILVER GAVIN ANTONY,DAVIDSON LAURENCE KEITH;;SILVER GAVIN ANTONY,,https://lens.org/057-576-098-969-960,Patent Application,no,6,44,3,3,0,H04M1/0202;;H02S40/38;;H02J7/35;;Y02E10/50;;Y02E70/30;;H04M1/724,H01L31/058;;H02J7/35;;H02S40/38;;H04M1/02;;H04M1/724,H4J JK            JK;;H4J J36Q          JK,0,0,,,,EXPIRED
3,CA,A,CA 483035 A,021-171-958-597-975,1952-05-06,1952,CA 483035D A,,CA 483035T A,,ACCOUNTING MACHINES,,NCR CO,DAVIDSON JOHN T;;LEHMAN LAURENCE N;;WILLIAMS PAUL H,,https://lens.org/021-171-958-597-975,Granted Patent,no,0,0,1,1,0,,,,0,0,,,,EXPIRED
4,US,B1,US 6225635 B1,042-501-114-083-887,2001-05-01,2001,US 13118398 A,1998-08-07,US 13118398 A,1998-08-07,System and method for optically locating microchannel positions,"A system and method is disclosed for optically locating a microchannel position. A laser source generates a primary laser beam which is directed at a microchannel plate. The microchannel plates include microchannels at various locations. A back-reflectance beam detector receives a back-reflected beam from the plate. The back-reflected beam is generated when the primary beam reflects off of the plate. A photodiode circuit generates a trigger signal when the back-reflected beam exceeds a predetermined threshold, indicating a presence of the microchannel. The method of the present invention includes the steps of generating a primary beam, directing the primary beam to a plate containing a microchannel, receiving from the plate a back-reflected beam generated in response to the primary beam, and generating a trigger signal when the back-reflected beam exceeds a predetermined threshold which corresponds to a presence of the microchannel.",UNIV CALIFORNIA,BREWER LAURENCE R;;KIMBROUGH JOSEPH;;BALCH JOSEPH;;DAVIDSON J COURTNEY,CALIFORNIA UNIVERSITY OF REGENTS OF THE THE (1998-08-13);;LAWRENCE LIVERMORE NATIONAL SECURITY LLC (2008-06-23),https://lens.org/042-501-114-083-887,Granted Patent,yes,13,15,3,3,0,G01N27/44721;;G01N27/44721,G01N27/447,250/458.1;;250/374,0,0,,,,EXPIRED
5,WO,A1,WO 2000/008451 A1,163-569-942-755-384,2000-02-17,2000,US 9917641 W,1999-08-03,US 13118398 A,1998-08-07,SYSTEM AND METHOD FOR OPTICALLY LOCATING MICROCHANNEL POSITIONS,"A system and method is disclosed for optically locating a microchannel position. A laser source generates a primary laser beam which is directed at a microchannel plate. The microchannel plates include microchannels at various locations. A back-reflectance beam detector receives a back-reflected beam from the plate. The back-reflected beam is generated when the primary beam reflects off of the plate. A photodiode circuit generates a trigger signal when the back reflected beam exceeds a predetermined threshold, indicating a presence of the microchannel. The method of the present invention includes the steps of generating a primary beam, directing the primary beam to a plate containing a microchannel, receiving from the plate a back-reflected beam generated in response to the primary beam, and generating a trigger signal when the back-reflected beam exceeds a predetermined threshold which corresponds to a presence of the microchannel.",UNIV CALIFORNIA,BREWER LAURENCE R;;KIMBROUGH JOSEPH;;BALCH JOSEPH;;DAVIDSON J COURTNEY,,https://lens.org/163-569-942-755-384,Patent Application,yes,6,1,3,3,0,G01N27/44721;;G01N27/44721,G01N27/447,,0,0,,,,PENDING
6,AU,A,AU 1999/052546 A,042-320-645-392-854,2000-02-28,2000,AU 1999/052546 A,1999-08-03,US 13118398 A;;US 9917641 W,1998-08-07,System and method for optically locating microchannel positions,,UNIV CALIFORNIA,BREWER LAURENCE R;;KIMBROUGH JOSEPH;;BALCH JOSEPH;;DAVIDSON J COURTNEY,,https://lens.org/042-320-645-392-854,Patent Application,no,0,0,3,3,0,G01N27/44721;;G01N27/44721,G01N27/447,,0,0,,,,DISCONTINUED
7,AU,A,AU 2000/043297 A,121-502-471-049-466,2000-11-14,2000,AU 2000/043297 A,2000-04-03,US 29044599 A;;US 0008863 W,1999-04-13,System and method for chromatography and electrophoresis using circular optical scanning,,UNIV CALIFORNIA,BALCH JOSEPH W;;BREWER LAURENCE R;;DAVIDSON JAMES C;;KIMBROUGH JOSEPH R,,https://lens.org/121-502-471-049-466,Patent Application,no,0,0,3,3,0,G01N27/44721;;G01N27/44791;;G01N30/6082;;G01N30/6095;;G01N30/74;;G01N2030/386;;G01N30/74;;G01N27/44791;;G01N27/44721;;G01N30/6095;;G01N30/6082;;G01N2030/386,G01N27/447;;G01N30/38;;G01N30/60;;G01N30/74,,0,0,,,,DISCONTINUED
8,AU,A,AU 1978/036972 A,145-112-396-165-017,1979-12-13,1979,AU 1978/036972 A,1978-06-09,US 81297777 A,1977-07-05,OSTOMY APPLIANCE,,SQUIBB & SONS INC,HILL JOHN ANTHONY;;LAVIA ANTHONY LAURENCE;;LOY ROBERT WILLIAM;;DAVIDSON WILLIAM JOSEPH,,https://lens.org/145-112-396-165-017,Patent Application,no,0,0,6,6,0,A61L28/0011;;A61F5/4407;;A61L24/043;;A61L2400/14,A61F5/445;;A61F5/44;;A61L24/04;;A61L28/00,,0,0,,,,DISCONTINUED
9,US,B1,US 6296749 B1,019-718-581-898-915,2001-10-02,2001,US 29044599 A,1999-04-13,US 29044599 A,1999-04-13,System and method for chromatography and electrophoresis using circular optical scanning,"A system and method is disclosed for chromatography and electrophoresis using circular optical scanning. One or more rectangular microchannel plates or radial microchannel plates has a set of analysis channels for insertion of molecular samples. One or more scanning devices repeatedly pass over the analysis channels in one direction at a predetermined rotational velocity and with a predetermined rotational radius. The rotational radius may be dynamically varied so as to monitor the molecular sample at various positions along a analysis channel. Sample loading robots may also be used to input molecular samples into the analysis channels. Radial microchannel plates are built from a substrate whose analysis channels are disposed at a non-parallel angle with respect to each other. A first step in the method accesses either a rectangular or radial microchannel plate, having a set of analysis channels, and second step passes a scanning device repeatedly in one direction over the analysis channels. As a third step, the scanning device is passed over the analysis channels at dynamically varying distances from a centerpoint of the scanning device. As a fourth step, molecular samples are loaded into the analysis channels with a robot.",UNIV CALIFORNIA,BALCH JOSEPH W;;BREWER LAURENCE R;;DAVIDSON JAMES C;;KIMBROUGH JOSEPH R,REGENTS OF THE UNIVERSITY OF CALIFORNIA THE (1999-04-13);;LAWRENCE LIVERMORE NATIONAL SECURITY LLC (2008-06-23),https://lens.org/019-718-581-898-915,Granted Patent,yes,3,18,3,3,0,G01N27/44721;;G01N27/44791;;G01N30/6082;;G01N30/6095;;G01N30/74;;G01N2030/386;;G01N30/74;;G01N27/44791;;G01N27/44721;;G01N30/6095;;G01N30/6082;;G01N2030/386,G01N27/447;;G01N30/38;;G01N30/60;;G01N30/74,204/452;;204/450;;204/600;;204/603;;436/172;;250/458.1;;250/459.1;;250/461.1;;356/344,0,0,,,,EXPIRED
10,WO,A1,WO 2000/062043 A1,109-867-361-123-079,2000-10-19,2000,US 0008863 W,2000-04-03,US 29044599 A,1999-04-13,SYSTEM AND METHOD FOR CHROMATOGRAPHY AND ELECTROPHORESIS USING CIRCULAR OPTICAL SCANNING,"A system and method is disclosed for chromatography and electrophoresis using circular optical scanning. One or more rectangular microchannel plates or radial microchannel plates has a set of analysis channels for insertion of molecular samples. One or more scanning devices repeatedly pass over the analysis channels in one direction at a predetermined rotational velocity and with a predetermined rotational radius. The rotational radius may be dynamically varied so as to monitor the molecular sample at various positions along an analysis channel. Sample loading robots may also be used to input molecular samples into the analysis channels. Radial microchannel plates are built from a substrate whose analysis channels are disposed at a non-parallel angle with respect to each other. A first step in the method accesses either a rectangular or radial microchannel plate, having a set of analysis channels, and second step passes a scanning device repeatedly in one direction over the analysis channels. As a third step, the scanning device is passed over the analysis channels at dynamically varying distances from a centerpoint of the scanning device. As a fourth step, molecular samples are loaded into the analysis channels with a robot.",UNIV CALIFORNIA,BALCH JOSEPH W;;BREWER LAURENCE R;;DAVIDSON JAMES C;;KIMBROUGH JOSEPH R,,https://lens.org/109-867-361-123-079,Patent Application,yes,3,3,3,3,0,G01N27/44721;;G01N27/44791;;G01N30/6082;;G01N30/6095;;G01N30/74;;G01N2030/386;;G01N30/74;;G01N27/44791;;G01N27/44721;;G01N30/6095;;G01N30/6082;;G01N2030/386,G01N27/447;;G01N30/38;;G01N30/60;;G01N30/74,,0,0,,,,PENDING
11,NZ,A,NZ 747732 A,041-424-361-446-355,2021-06-25,2021,NZ 74773217 A,2017-04-28,AU 2017/050390 W;;US 201662328988 P;;US 201762480059 P,2016-04-28,Patient interface,"CPAP mask movement during patient sleep leads to problems with seal integrity around the patients nose. This problems is addressed by providing a patient interface for a CPAP mask, the interface having a positioning and stabilising structure comprises a rigidiser arm assembly that is flexibly connected to the plenum chamber by at least one flexible decoupling structure such that forces imposed on the positioning and stabilising structure by movement of the patient’s head are decoupled from the plenum chamber and the seal forming structure.",RESMED PTY LTD,SCHEINER RUPERT;;AARON SAMUEL DAVIDSON;;VON MOGER LOCHLAN;;HITCHCOCK WILLIAM LAURENCE;;GOLDSPINK LACHLAN;;EDWARDS CRAIG;;BENTLEY ALEXANDER JOEL,,https://lens.org/041-424-361-446-355,Patent Application,no,0,0,16,38,0,A61M16/0816;;A61M16/024;;A61M16/105;;A61M16/0875;;A61M16/0622;;A61M16/0666;;A61M16/109;;A61M16/0683;;A61M16/06;;A61M16/0066;;A61M16/16;;A61M2205/3368;;A61M2016/0027;;A61M2205/50;;A61M16/06;;A61M16/0666;;A61M16/0683;;A61M16/0816;;A61M16/0875;;A61M16/16;;A61M2016/0015;;A61M2016/0036;;A61M2202/0208;;A61M2202/0225;;A61M2205/3365;;A61M2205/3368;;A61M2205/50;;A61M2210/0618;;A61M16/0825;;A61M16/0069;;A61M16/107;;A61M16/109;;A61M16/125;;A61M16/022;;A61M16/0622;;A61M16/0666;;A61M16/0683;;A61M16/0816;;A61M16/16;;A61M2016/0036;;A61M16/109;;A61M16/06;;A61M2205/3368;;A61M2205/50;;A61M16/0069;;A61M2016/0015;;A61M2202/0225;;A61M2210/0618;;A61M16/125;;A61M16/0825;;A61M16/022;;A61M2202/0208;;A61M2205/3365;;A61M16/0875;;A61M16/107;;A61M16/0622;;A61M16/024;;A61M16/0066;;A61M16/105;;A61M2016/0027,A61M16/06,,0,0,,,,PENDING
12,CA,A,CA 482515 A,110-862-937-819-232,1952-04-15,1952,CA 482515D A,,CA 482515T A,,ACCOUNTING MACHINES,,NCR CO,SADGEBURY HERMAN F;;DAVIDSON JOHN T;;CRAWFORD JAMES H;;GANGER JESSE R;;WILLIAMS PAUL H;;LEHMAN LAURENCE N,,https://lens.org/110-862-937-819-232,Granted Patent,no,0,0,1,1,0,,,,0,0,,,,EXPIRED
13,WO,A4,WO 2020/236683 A4,089-073-195-885-378,2021-01-28,2021,US 2020/0033341 W,2020-05-17,US 201962849508 P;;US 201962867050 P,2019-05-17,"SYSTEMS, DEVICES, APPS, AND METHODS FOR CAPSULE ENDOSCOPY PROCEDURES","Systems, devices, methods for capsule endoscopy procedures are disclosed. A system for a capsule endoscopy procedure includes a capsule device configured to capture in-vivo images over time of at least a portion of a gastrointestinal tract (GIT) of a person, a wearable device configured to be secured to the person where the wearable device is configured to receive at least some of the in-vivo images from the capsule device and to communicate at least some of the received images to a communication device at a same location as the wearable device, and a storage medium storing machine-executable instructions configured to execute on a computing system remote from the location of the wearable device. The instructions, when executed, cause the computing system to receive communicated images from the communication device, perform processing of the communicated images received from the communication device, and communicate with at least one healthcare provider device.",GIVEN IMAGING LTD;;DI NAPOLI GIOVANNI,DI NAPOLI GIOVANNI;;AMBOR IDDO;;KESELBRENER LAURENCE;;HORESH MORAN;;PELEG DORI;;KEYNAN RONI;;DAVIDSON TAL;;ADLER AVISHAI;;SPILLINGER AVISHAG,,https://lens.org/089-073-195-885-378,Patent Application,yes,0,0,7,16,0,G16H40/63;;G16H40/67;;G16H20/10;;G16H80/00;;G16H20/60;;G16H50/20;;A61B1/00016;;A61B1/00009;;A61B1/041;;A61B1/31;;A61B1/273;;A61B1/041;;A61B1/00016;;A61B1/00055;;G16H40/63;;G16H40/67;;G16H50/20;;G16H20/10;;G16H20/60;;G16H80/00;;A61B1/000096;;A61B1/041;;A61B1/00016;;A61B1/00055;;G16H40/67;;G16H40/63;;G16H20/10;;G16H80/00;;A61B1/000096;;A61B1/31;;A61B1/0002;;A61B5/0022;;A61B5/4255;;A61B1/273;;G16H20/60;;G16H50/20;;A61B1/000096;;A61B1/00016;;A61B1/0002;;A61B1/041;;A61B5/0022;;A61B5/4255,A61B1/04;;A61B1/00;;A61B5/00;;A61B5/07,,0,0,,,,PENDING
14,US,A1,US 2022/0211257 A1,065-964-349-057-953,2022-07-07,2022,US 202017611363 A,2020-05-17,US 202017611363 A;;US 201962867050 P;;US 201962849508 P;;US 2020/0033341 W,2019-05-17,"SYSTEMS, DEVICES, APPS, AND METHODS FOR CAPSULE ENDOSCOPY PROCEDURES","Systems, devices, methods for capsule endoscopy procedures are disclosed. A system for a capsule endoscopy procedure includes a capsule device configured to capture in-vivo images over time of at least a portion of a gastrointestinal tract (GIT) of a person, a wearable device configured to be secured to the person where the wearable device is configured to receive at least some of the in-vivo images from the capsule device and to communicate at least some of the received images to a communication device at a same location as the wearable device, and a storage medium storing machine-executable instructions configured to execute on a computing system remote from the location of the wearable device. The instructions, when executed, cause the computing system to receive communicated images from the communication device, perform processing of the communicated images received from the communication device, and communicate with at least one healthcare provider device.",GIVEN IMAGING LTD,DI NAPOLI GIOVANNI;;AMBOR IDDO;;KESELBRENER LAURENCE;;HORESH MORAN;;PELEG DORI;;KEYNAN RONI;;DAVIDSON TAL;;ADLER AVISHAI;;SPILLINGER AVISHAG,GIVEN IMAGING LTD (2021-10-26),https://lens.org/065-964-349-057-953,Patent Application,yes,0,0,7,16,0,G16H40/63;;G16H40/67;;G16H20/10;;G16H80/00;;G16H20/60;;G16H50/20;;A61B1/00016;;A61B1/00009;;A61B1/041;;A61B1/31;;A61B1/273;;A61B1/041;;A61B1/00016;;A61B1/00055;;G16H40/63;;G16H40/67;;G16H50/20;;G16H20/10;;G16H20/60;;G16H80/00;;A61B1/000096;;A61B1/041;;A61B1/00016;;A61B1/00055;;G16H40/67;;G16H40/63;;G16H20/10;;G16H80/00;;A61B1/000096;;A61B1/31;;A61B1/0002;;A61B5/0022;;A61B5/4255;;A61B1/273;;G16H20/60;;G16H50/20;;A61B1/000096;;A61B1/00016;;A61B1/0002;;A61B1/041;;A61B5/0022;;A61B5/4255,A61B1/04;;A61B1/00;;A61B5/00,,0,0,,,,PENDING
15,KR,A,KR 20220010511 A,139-716-746-435-428,2022-01-25,2022,KR 20217040722 A,2020-05-17,US 201962849508 P;;US 201962867050 P;;US 2020/0033341 W,2019-05-17,"캡슐 내시경 시술들을 위한 시스템들, 디바이스들, 앱들, 및 방법들","캡슐 내시경 시술을 위한 시스템들, 디바이스들, 방법들이 개시된다. 캡슐 내시경 시술을 위한 시스템은, 사람의 위장관(GIT)의 적어도 일부분의 생체 내 이미지들을 시간의 경과에 따라 캡처하도록 구성된 캡슐 디바이스, 사람에게 고정되도록 구성된 웨어러블 디바이스 - 웨어러블 디바이스는 캡슐 디바이스로부터 생체 내 이미지들 중 적어도 일부를 수신하고 수신된 이미지들 중 적어도 일부를 웨어러블 디바이스와 동일한 위치에 있는 통신 디바이스로 통신하도록 구성됨 -; 및 웨어러블 디바이스의 위치로부터 떨어져 있는 컴퓨팅 시스템 상에서 실행되도록 구성된 기계 실행가능 명령어들을 저장하는 저장 매체를 포함한다. 명령어들은, 실행될 때, 컴퓨팅 시스템이, 통신 디바이스로부터 통신된 이미지들을 수신하게 하고, 통신 디바이스로부터 수신된 통신된 이미지들의 프로세싱을 수행하게 하고, 적어도 하나의 건강 관리 제공자 디바이스와 통신하게 한다.",GIVEN IMAGING LTD,AMBOR IDDO;;KESELBRENER LAURENCE;;HORESH MORAN;;PELEG DORI;;KEYNAN RONI;;DAVIDSON TAL;;ADLER AVISHAI;;SPILLINGER AVISHAG;;DI NAPOLI GIOVANNI,,https://lens.org/139-716-746-435-428,Patent Application,no,0,0,7,16,0,G16H40/63;;G16H40/67;;G16H20/10;;G16H80/00;;G16H20/60;;G16H50/20;;A61B1/00016;;A61B1/00009;;A61B1/041;;A61B1/31;;A61B1/273;;A61B1/041;;A61B1/00016;;A61B1/00055;;G16H40/63;;G16H40/67;;G16H50/20;;G16H20/10;;G16H20/60;;G16H80/00;;A61B1/000096;;A61B1/041;;A61B1/00016;;A61B1/00055;;G16H40/67;;G16H40/63;;G16H20/10;;G16H80/00;;A61B1/000096;;A61B1/31;;A61B1/0002;;A61B5/0022;;A61B5/4255;;A61B1/273;;G16H20/60;;G16H50/20;;A61B1/000096;;A61B1/00016;;A61B1/0002;;A61B1/041;;A61B5/0022;;A61B5/4255,A61B1/04;;A61B1/00;;G16H20/10;;G16H40/63;;G16H40/67;;G16H80/00,,0,0,,,,PENDING
16,EP,A1,EP 3968838 A1,145-742-230-160-642,2022-03-23,2022,EP 20731290 A,2020-05-17,US 201962849508 P;;US 201962867050 P;;US 2020/0033341 W,2019-05-17,"SYSTEMS, DEVICES, APPS, AND METHODS FOR CAPSULE ENDOSCOPY PROCEDURES",,GIVEN IMAGING LTD,AMBOR IDDO;;KESELBRENER LAURENCE;;HORESH MORAN;;PELEG DORI;;KEYNAN RONI;;DAVIDSON TAL;;ADLER AVISHAI;;SPILLINGER AVISHAG;;DI NAPOLI GIOVANNI,,https://lens.org/145-742-230-160-642,Patent Application,yes,0,0,7,16,0,G16H40/63;;G16H40/67;;G16H20/10;;G16H80/00;;G16H20/60;;G16H50/20;;A61B1/00016;;A61B1/00009;;A61B1/041;;A61B1/31;;A61B1/273;;A61B1/041;;A61B1/00016;;A61B1/00055;;G16H40/63;;G16H40/67;;G16H50/20;;G16H20/10;;G16H20/60;;G16H80/00;;A61B1/000096;;A61B1/041;;A61B1/00016;;A61B1/00055;;G16H40/67;;G16H40/63;;G16H20/10;;G16H80/00;;A61B1/000096;;A61B1/31;;A61B1/0002;;A61B5/0022;;A61B5/4255;;A61B1/273;;G16H20/60;;G16H50/20;;A61B1/000096;;A61B1/00016;;A61B1/0002;;A61B1/041;;A61B5/0022;;A61B5/4255,A61B1/04;;A61B1/00;;A61B5/00;;A61B5/07,,0,0,,,,PENDING
17,WO,A1,WO 2020/236683 A1,134-783-548-756-800,2020-11-26,2020,US 2020/0033341 W,2020-05-17,US 201962849508 P;;US 201962867050 P,2019-05-17,"SYSTEMS, DEVICES, APPS, AND METHODS FOR CAPSULE ENDOSCOPY PROCEDURES","Systems, devices, methods for capsule endoscopy procedures are disclosed. A system for a capsule endoscopy procedure includes a capsule device configured to capture in-vivo images over time of at least a portion of a gastrointestinal tract (GIT) of a person, a wearable device configured to be secured to the person where the wearable device is configured to receive at least some of the in-vivo images from the capsule device and to communicate at least some of the received images to a communication device at a same location as the wearable device, and a storage medium storing machine-executable instructions configured to execute on a computing system remote from the location of the wearable device. The instructions, when executed, cause the computing system to receive communicated images from the communication device, perform processing of the communicated images received from the communication device, and communicate with at least one healthcare provider device.",GIVEN IMAGING LTD;;DI NAPOLI GIOVANNI,DI NAPOLI GIOVANNI;;AMBOR IDDO;;KESELBRENER LAURENCE;;HORESH MORAN;;PELEG DORI;;KEYNAN RONI;;DAVIDSON TAL;;ADLER AVISHAI;;SPILLINGER AVISHAG,,https://lens.org/134-783-548-756-800,Patent Application,yes,14,0,7,16,0,G16H40/63;;G16H40/67;;G16H20/10;;G16H80/00;;G16H20/60;;G16H50/20;;A61B1/00016;;A61B1/00009;;A61B1/041;;A61B1/31;;A61B1/273;;A61B1/041;;A61B1/00016;;A61B1/00055;;G16H40/63;;G16H40/67;;G16H50/20;;G16H20/10;;G16H20/60;;G16H80/00;;A61B1/000096;;A61B1/041;;A61B1/00016;;A61B1/00055;;G16H40/67;;G16H40/63;;G16H20/10;;G16H80/00;;A61B1/000096;;A61B1/31;;A61B1/0002;;A61B5/0022;;A61B5/4255;;A61B1/273;;G16H20/60;;G16H50/20;;A61B1/000096;;A61B1/00016;;A61B1/0002;;A61B1/041;;A61B5/0022;;A61B5/4255,A61B1/04;;A61B1/00;;A61B5/00;;A61B5/07,,1,1,051-843-312-028-316,10.1109/memb.2009.935466;;20176525,"KARARGYRIS A ET AL: ""Wireless Capsule Endoscopy and Endoscopic Imaging: A Survey on Various Methodologies Presented"", IEEE ENGINEERING IN MEDICINE AND BIOLOGY MAGAZINE, IEEE SERVICE CENTER, PISACATAWAY, NJ, US, vol. 28, no. 1, 1 January 2010 (2010-01-01), pages 72 - 83, XP011303079, ISSN: 0739-5175",PENDING
18,EP,B1,EP 3448485 B1,073-718-486-867-000,2021-06-30,2021,EP 17788434 A,2017-04-28,US 201662328988 P;;US 201762480059 P;;AU 2017/050390 W,2016-04-28,PATIENT INTERFACE,,RESMED PTY LTD,BENTLEY ALEXANDER JOEL;;DAVIDSON AARON SAMUEL;;EDWARDS CRAIGDAVID;;GOLDSPINK LACHLAN RICHARD;;HITCHCOCK WILLIAM LAURENCE;;SCHEINER RUPERT CHRISTIAN;;VON MOGER LOCHLAN,RESMED PTY LTD (2019-07-10),https://lens.org/073-718-486-867-000,Granted Patent,yes,8,0,16,38,0,A61M16/0816;;A61M16/024;;A61M16/105;;A61M16/0875;;A61M16/0622;;A61M16/0666;;A61M16/109;;A61M16/0683;;A61M16/06;;A61M16/0066;;A61M16/16;;A61M2205/3368;;A61M2016/0027;;A61M2205/50;;A61M16/06;;A61M16/0666;;A61M16/0683;;A61M16/0816;;A61M16/0875;;A61M16/16;;A61M2016/0015;;A61M2016/0036;;A61M2202/0208;;A61M2202/0225;;A61M2205/3365;;A61M2205/3368;;A61M2205/50;;A61M2210/0618;;A61M16/0825;;A61M16/0069;;A61M16/107;;A61M16/109;;A61M16/125;;A61M16/022;;A61M16/0622;;A61M16/0666;;A61M16/0683;;A61M16/0816;;A61M16/16;;A61M2016/0036;;A61M16/109;;A61M16/06;;A61M2205/3368;;A61M2205/50;;A61M16/0069;;A61M2016/0015;;A61M2202/0225;;A61M2210/0618;;A61M16/125;;A61M16/0825;;A61M16/022;;A61M2202/0208;;A61M2205/3365;;A61M16/0875;;A61M16/107;;A61M16/0622;;A61M16/024;;A61M16/0066;;A61M16/105;;A61M2016/0027,A61M16/06;;A61M16/00;;A61M16/08;;A61M16/10;;A61M16/16,,0,0,,,,ACTIVE
19,EP,A4,EP 3448485 A4,122-761-629-068-847,2019-08-07,2019,EP 17788434 A,2017-04-28,US 201662328988 P;;US 201762480059 P;;AU 2017/050390 W,2016-04-28,PATIENT INTERFACE,,RESMED PTY LTD,BENTLEY ALEXANDER JOEL;;DAVIDSON AARON SAMUEL;;EDWARDS CRAIGDAVID;;GOLDSPINK LACHLAN RICHARD;;HITCHCOCK WILLIAM LAURENCE;;SCHEINER RUPERT CHRISTIAN;;VON MOGER LOCHLAN,RESMED PTY LTD (2019-07-10),https://lens.org/122-761-629-068-847,Search Report,no,3,0,16,38,0,A61M16/0816;;A61M16/024;;A61M16/105;;A61M16/0875;;A61M16/0622;;A61M16/0666;;A61M16/109;;A61M16/0683;;A61M16/06;;A61M16/0066;;A61M16/16;;A61M2205/3368;;A61M2016/0027;;A61M2205/50;;A61M16/06;;A61M16/0666;;A61M16/0683;;A61M16/0816;;A61M16/0875;;A61M16/16;;A61M2016/0015;;A61M2016/0036;;A61M2202/0208;;A61M2202/0225;;A61M2205/3365;;A61M2205/3368;;A61M2205/50;;A61M2210/0618;;A61M16/0825;;A61M16/0069;;A61M16/107;;A61M16/109;;A61M16/125;;A61M16/022;;A61M16/0622;;A61M16/0666;;A61M16/0683;;A61M16/0816;;A61M16/16;;A61M2016/0036;;A61M16/109;;A61M16/06;;A61M2205/3368;;A61M2205/50;;A61M16/0069;;A61M2016/0015;;A61M2202/0225;;A61M2210/0618;;A61M16/125;;A61M16/0825;;A61M16/022;;A61M2202/0208;;A61M2205/3365;;A61M16/0875;;A61M16/107;;A61M16/0622;;A61M16/024;;A61M16/0066;;A61M16/105;;A61M2016/0027,A61M16/06;;A61M16/00;;A61M16/08;;A61M16/10;;A61M16/16,,0,0,,,,ACTIVE
20,EP,A1,EP 3448485 A1,171-593-079-861-599,2019-03-06,2019,EP 17788434 A,2017-04-28,US 201662328988 P;;US 201762480059 P;;AU 2017/050390 W,2016-04-28,PATIENT INTERFACE,,RESMED LTD,BENTLEY ALEXANDER JOEL;;DAVIDSON AARON SAMUEL;;EDWARDS CRAIGDAVID;;GOLDSPINK LACHLAN RICHARD;;HITCHCOCK WILLIAM LAURENCE;;SCHEINER RUPERT CHRISTIAN;;VON MOGER LOCHLAN,RESMED PTY LTD (2019-07-10),https://lens.org/171-593-079-861-599,Patent Application,yes,0,1,16,38,0,A61M16/0816;;A61M16/024;;A61M16/105;;A61M16/0875;;A61M16/0622;;A61M16/0666;;A61M16/109;;A61M16/0683;;A61M16/06;;A61M16/0066;;A61M16/16;;A61M2205/3368;;A61M2016/0027;;A61M2205/50;;A61M16/06;;A61M16/0666;;A61M16/0683;;A61M16/0816;;A61M16/0875;;A61M16/16;;A61M2016/0015;;A61M2016/0036;;A61M2202/0208;;A61M2202/0225;;A61M2205/3365;;A61M2205/3368;;A61M2205/50;;A61M2210/0618;;A61M16/0825;;A61M16/0069;;A61M16/107;;A61M16/109;;A61M16/125;;A61M16/022;;A61M16/0622;;A61M16/0666;;A61M16/0683;;A61M16/0816;;A61M16/16;;A61M2016/0036;;A61M16/109;;A61M16/06;;A61M2205/3368;;A61M2205/50;;A61M16/0069;;A61M2016/0015;;A61M2202/0225;;A61M2210/0618;;A61M16/125;;A61M16/0825;;A61M16/022;;A61M2202/0208;;A61M2205/3365;;A61M16/0875;;A61M16/107;;A61M16/0622;;A61M16/024;;A61M16/0066;;A61M16/105;;A61M2016/0027,A61M16/06,,0,0,,,,ACTIVE
