"#",Jurisdiction,Kind,Display Key,Lens ID,Publication Date,Publication Year,Application Number,Application Date,Priority Numbers,Earliest Priority Date,Title,Abstract,Applicants,Inventors,Owners,URL,Document Type,Has Full Text,Cites Patent Count,Cited by Patent Count,Simple Family Size,Extended Family Size,Sequence Count,CPC Classifications,IPCR Classifications,US Classifications,NPL Citation Count,NPL Resolved Citation Count,NPL Resolved Lens ID(s),NPL Resolved External ID(s),NPL Citations,Legal Status
1,CN,A,CN 109998618 A,055-999-326-433-992,2019-07-12,2019,CN 201811442654 A,2018-11-29,US 201715825518 A,2017-11-29,SYSTEMS FOR DELIVERING INTRAVASCULAR IMPLANTS,Systems are provided for delivering and mechanically detaching embolic coils. The systems disclosed herein comprise a mechanical detachment mechanism to intravascularly release an emboliccoil.,SPARTAN MICRO INC,STOPPENHAGEN ERIC;;DIAS MARK,,https://lens.org/055-999-326-433-992,Patent Application,no,3,0,3,17,0,A61B17/1215;;A61B17/12113;;A61B2017/12054;;A61B17/12113;;A61B17/12145;;A61B2017/00309;;A61B2017/00336;;A61B2017/00367;;A61B2017/00867;;A61B2017/12054;;A61B2090/037;;A61B2090/0811;;A61B2090/3966,A61B17/12,,0,0,,,,PENDING
2,EP,A1,EP 3492024 A1,177-729-941-475-792,2019-06-05,2019,EP 18205742 A,2018-11-12,US 201715825518 A,2017-11-29,SYSTEMS FOR DELIVERING INTRAVASCULAR IMPLANTS,"Systems and methods are provided for delivering and mechanically detaching embolic coils. The systems disclosed herein comprise a mechanical detachment mechanism to intravascularly release an embolic coil. The methods disclosed herein comprise a various triggering mechanisms to detach embolic coils.
",SPARTAN MICRO INC,STOPPENHAGEN ERIC;;DIAS MARK,,https://lens.org/177-729-941-475-792,Patent Application,yes,6,0,3,17,0,A61B17/1215;;A61B17/12113;;A61B2017/12054;;A61B17/12113;;A61B17/12145;;A61B2017/00309;;A61B2017/00336;;A61B2017/00367;;A61B2017/00867;;A61B2017/12054;;A61B2090/037;;A61B2090/0811;;A61B2090/3966,A61B17/12,,0,0,,,,DISCONTINUED
3,US,A1,US 2019/0015107 A1,048-750-289-969-220,2019-01-17,2019,US 201715649176 A,2017-07-13,US 201715649176 A,2017-07-13,Vaso-Occlusive Device and Method,"Vaso-occlusive coils, and methods of their use, are disclosed having configurations suitable for treating certain problems associated with the vasculature, such as aneurysms, for example. The vaso-occlusive coils described or contemplated herein are configured to improve adherence to aneurysms resulting in diversion of blood flow around the aneurysm while promoting healing of the vasculature.",SPARTAN MICRO INC,DIAS MARK;;STOPPENHAGEN ERIC,,https://lens.org/048-750-289-969-220,Patent Application,yes,0,2,1,1,0,A61B17/12145;;A61B2017/12054;;A61B17/12113;;A61B17/12031;;A61B17/1214;;A61B2017/1205;;A61B17/12113;;A61B17/12031;;A61B2017/12054;;A61B17/12145,A61B17/12,,0,0,,,,DISCONTINUED
4,EP,A2,EP 2948128 A2,075-779-383-879-14X,2015-12-02,2015,EP 14700180 A,2014-01-09,EP 13152808 A;;EP 2014050269 W;;EP 14700180 A,2013-01-28,SKIN CARE COMPOSITION,,UNILEVER NV;;UNILEVER PLC,DAMODARAN ANITA;;DIAS PAUL MARK,"UNILEVER GLOBAL IP LIMITED, WIRRAL, GB (2021-08-24)",https://lens.org/075-779-383-879-14X,Patent Application,yes,0,0,17,17,0,A61K8/498;;A61K8/498;;A61K8/4953;;A61K8/67;;A61K8/67;;A61K8/9789;;A61K8/9789;;A61K2800/20;;A61Q19/08;;A61Q19/08,A61Q19/08;;A61K8/49;;A61K8/67;;A61K8/97,,1,0,,,See references of WO 2014114496A2,ACTIVE
5,US,A1,US 2018/0078263 A1,157-505-035-538-618,2018-03-22,2018,US 201715825518 A,2017-11-29,US 201715825518 A;;US 201715410639 A;;US 201662343528 P;;US 201662343542 P,2016-05-31,SYSTEMS AND METHODS FOR DELIVERING INTRAVASCULAR IMPLANTS,Systems and methods are provided for delivering and mechanically detaching embolic coils. The systems disclosed herein comprise a mechanical detachment mechanism to intravascularly release an embolic coil. The methods disclosed herein comprise a various triggering mechanisms to detach embolic coils.,SPARTAN MICRO INC,STOPPENHAGEN ERIC P;;DIAS MARK,SPARTAN MICRO INC (2017-11-28),https://lens.org/157-505-035-538-618,Patent Application,yes,0,8,4,17,0,A61B17/12113;;A61B17/12113;;A61B17/1214;;A61B17/12145;;A61B90/39;;A61B2017/00477;;A61B2017/00867;;A61B2017/00867;;A61B2017/12054;;A61B2017/12054;;A61B2090/0811;;A61B2090/3966,A61B17/12;;A61B90/00,,0,0,,,,ACTIVE
6,EP,A1,EP 3500186 A1,176-133-220-390-402,2019-06-26,2019,EP 17842021 A,2017-08-15,US 201662375595 P;;US 201715480223 A;;US 2017/0047024 W,2016-08-16,INTRAVASCULAR FLOW DIVERSION DEVICES,,SPARTAN MICRO INC,STOPPENHAGEN ERIC P;;DIAS MARK,,https://lens.org/176-133-220-390-402,Patent Application,yes,0,0,5,5,0,A61B17/12113;;A61B17/12113;;A61B17/12172;;A61B17/12172;;A61B2017/00592;;A61B2017/00592;;A61B2017/00606;;A61B2017/00606;;A61B2017/00641;;A61B2017/00641;;A61B2017/1205;;A61B2017/1205;;A61F2/011;;A61F2002/016,A61B17/12,,1,0,,,See references of WO 2018035167A1,DISCONTINUED
7,WO,A3,WO 2014/114496 A3,014-907-586-322-692,2014-12-24,2014,EP 2014050269 W,2014-01-09,EP 13152808 A,2013-01-28,SKIN CARE COMPOSITION,The invention relates to a topical composition that provides enhanced skin health by way of providing anti-aging benefits that are evident from visibly reduced wrinkles and under-eye dark circles. This is achieved through use of a synergistic combination of folic acid and gallated catechin in a specific weight ratio range.,UNILEVER NV;;UNILEVER PLC;;CONOPCO INC DBA UNILEVER,DAMODARAN ANITA;;DIAS PAUL MARK,,https://lens.org/014-907-586-322-692,Search Report,yes,4,0,17,17,0,A61K8/498;;A61K8/498;;A61K8/4953;;A61K8/67;;A61K8/67;;A61K8/9789;;A61K8/9789;;A61K2800/20;;A61Q19/08;;A61Q19/08,A61K8/67;;A61K8/49;;A61Q19/08,,2,2,002-019-691-764-248;;034-108-078-669-846,10.1161/01.res.86.11.1129;;10850963;;10.3945/jn.110.136465;;21525260,"E. S. G. STROES ET AL: ""Folic Acid Reverts Dysfunction of Endothelial Nitric Oxide Synthase"", CIRCULATION RESEARCH, vol. 86, no. 11, 9 June 2000 (2000-06-09), pages 1129 - 1134, XP055068977, ISSN: 0009-7330, DOI: 10.1161/01.RES.86.11.1129;;U. HEINRICH ET AL: ""Green Tea Polyphenols Provide Photoprotection, Increase Microcirculation, and Modulate Skin Properties of Women"", THE JOURNAL OF NUTRITION, vol. 141, no. 6, 27 April 2011 (2011-04-27), pages 1202 - 1208, XP055068990, ISSN: 0022-3166, DOI: 10.3945/jn.110.136465",PENDING
8,US,A1,US 2020/0060760 A1,022-577-940-409-143,2020-02-27,2020,US 201916529257 A,2019-08-01,US 201916529257 A;;US 201862713099 P;;US 201862713097 P,2018-08-01,CATHETER SYSTEM WITH A HIGH RADIO FREQUENCY ELECTROMAGNETIC FIELD,"A catheter system that includes a catheter with a lumen and extends from a proximal end to a distal end of the catheter, the distal end of the catheter comprising an opening. The catheter system further includes an RF generator configured to produce an high radio frequencies. An electrode is disposed within a wall of the catheter at the distal end of the catheter. The electrode is configured to produce a high radio frequency electromagnetic field that is contained within the lumen of the catheter. A plurality of wires connects the RF generator to the electrode. The plurality of wires extend along the length of the catheter.",SPARTAN MICRO INC,STOPPENHAGEN ERIC P;;DIAS MARK,SPARTAN MICRO INC (2019-08-26),https://lens.org/022-577-940-409-143,Patent Application,yes,0,0,1,1,0,A61B17/1214;;A61B18/1492;;A61B17/1214;;A61B2017/12068;;A61B2017/12068;;A61B2017/1209;;A61B2018/00577;;A61B2018/1407,A61B18/14;;A61B17/12,,0,0,,,,DISCONTINUED
9,MX,B,MX 352209 B,078-490-019-367-238,2017-11-14,2017,MX 2015009549 A,2014-01-09,EP 13152808 A;;EP 2014050269 W,2013-01-28,SKIN CARE COMPOSITION.,The invention relates to a topical composition that provides enhanced skin health by way of providing anti-aging benefits that are evident from visibly reduced wrinkles and under-eye dark circles. This is achieved through use of a synergistic combination of folic acid and gallated catechin in a specific weight ratio range.,UNILEVER NV,ANITA DAMODARAN;;PAUL MARK DIAS,,https://lens.org/078-490-019-367-238,Granted Patent,no,0,0,17,17,0,A61K8/498;;A61K8/498;;A61K8/4953;;A61K8/67;;A61K8/67;;A61K8/9789;;A61K8/9789;;A61K2800/20;;A61Q19/08;;A61Q19/08,A61K8/49;;A61K8/67;;A61K8/97;;A61Q19/08,,0,0,,,,ACTIVE
10,US,B2,US 9968360 B2,138-504-980-730-344,2018-05-15,2018,US 201715825518 A,2017-11-29,US 201715825518 A;;US 201715410639 A;;US 201662343528 P;;US 201662343542 P,2016-05-31,Systems and methods for delivering intravascular implants,Systems and methods are provided for delivering and mechanically detaching embolic coils. The systems disclosed herein comprise a mechanical detachment mechanism to intravascularly release an embolic coil. The methods disclosed herein comprise a various triggering mechanisms to detach embolic coils.,SPARTAN MICRO INC,STOPPENHAGEN ERIC P;;DIAS MARK,SPARTAN MICRO INC (2017-11-28),https://lens.org/138-504-980-730-344,Granted Patent,yes,44,19,4,17,0,A61B17/12113;;A61B17/12113;;A61B17/1214;;A61B17/12145;;A61B90/39;;A61B2017/00477;;A61B2017/00867;;A61B2017/00867;;A61B2017/12054;;A61B2017/12054;;A61B2090/0811;;A61B2090/3966,A61B17/12;;A61B17/00;;A61B90/00,,1,0,,,"PCT/US2017/040425, International Search Report and Written Opinion, dated Sep. 15, 2017, 12 pages.",ACTIVE
11,CN,A,CN 1832731 A,039-189-881-485-770,2006-09-13,2006,CN 200480022396 A,2004-07-30,GB 0317868 A,2003-07-30,Biliquid foams stable dispersions thereof and a corresponding process of manufacturing,,DISPERSE LTD,MARK DIAS MONICA GUFFOGG PHILI,,https://lens.org/039-189-881-485-770,Patent Application,no,0,8,19,19,0,A61K9/1075;;A61P17/00;;A61K9/1075,A61K9/70;;A61K9/06;;A61K9/10;;A61K9/107;;A61K9/12,,0,0,,,,ACTIVE
12,US,B2,US 10856878 B2,119-424-182-234-267,2020-12-08,2020,US 201815979226 A,2018-05-14,US 201815979226 A;;US 201715825518 A;;US 201715410639 A;;US 201662343528 P;;US 201662343542 P,2016-05-31,Systems and methods for delivering intravascular implants,Systems and methods are provided for delivering and mechanically detaching embolic coils. The systems disclosed herein comprise a mechanical detachment mechanism to intravascularly release an embolic coil. The methods disclosed herein comprise a various triggering mechanisms to detach embolic coils.,SPARTAN MICRO INC,STOPPENHAGEN ERIC P;;DIAS MARK,SPARTAN MICRO INC (2017-11-28),https://lens.org/119-424-182-234-267,Granted Patent,yes,52,1,4,17,0,A61B17/12113;;A61B17/12113;;A61B17/1214;;A61B17/12145;;A61B90/39;;A61B2017/00477;;A61B2017/00867;;A61B2017/00867;;A61B2017/12054;;A61B2017/12054;;A61B2090/0811;;A61B2090/3966,A61B17/12;;A61B17/00;;A61B90/00,,6,0,,,"U.S. Appl. No. 15/410,639, Final Office Action, dated Aug. 6, 2019, 10 pages.;;U.S. Appl. No. 15/410,639, Notice of Allowance, dated Oct. 17, 2019, 8 pages.;;PCT/US2017/040425, International Search Report and Written Opinion, dated Sep. 15, 2017, 12 pages.;;U.S. Appl. No. 15/825,518, Non-Final Office Action, dated Feb. 8, 2018, 15 pages.;;U.S. Appl. No. 15/825,518, Notice of Allowance, dated Apr. 2, 2018, 7 pages.;;U.S. Appl. No. 15/410,639, Non-Final Office Action, dated Feb. 21, 2019, 14 pages.",ACTIVE
13,CN,A,CN 105431131 A,165-981-468-867-916,2016-03-23,2016,CN 201480006348 A,2014-01-09,EP 2014050269 W;;EP 13152808 A,2013-01-28,Skin care composition,The invention relates to a topical composition that provides enhanced skin health by way of providing anti-aging benefits that are evident from visibly reduced wrinkles and under-eye dark circles. This is achieved through use of a synergistic combination of folic acid and gallated catechin in a specific weight ratio range.,UNILEVER NV,DAMODARAN ANITA;;DIAS PAUL MARK,,https://lens.org/165-981-468-867-916,Patent Application,no,2,2,17,17,0,A61K8/498;;A61K8/498;;A61K8/4953;;A61K8/67;;A61K8/67;;A61K8/9789;;A61K8/9789;;A61K2800/20;;A61Q19/08;;A61Q19/08,A61K8/67;;A61K8/49;;A61Q19/08,,1,0,,,"S.E. DAL BELO等: ""Skin Penetration of Epigallocatechin-3-Gallate and Quercetin from Green Tea and Ginkgo biloba Extracts Vehiculated in Cosmetic Formulations"", 《SKIN PHARMACOL PHYSIOL》",DISCONTINUED
14,ES,T3,ES 2609403 T3,190-314-719-868-583,2017-04-20,2017,ES 14700180 T,2014-01-09,EP 13152808 A;;EP 2014050269 W,2013-01-28,Composición para el cuidado de la piel,"Composición tópica que comprende: (i) del 0,1 al 5% de ácido fólico; (ii) del 0,1 al 5% de una catequina galatada; y (iii) una base cosméticamente aceptable seleccionada del grupo que consiste en crema, loción, gel y emulsión, en la que la razón en peso de catequina galatada:ácido fólico está en el intervalo de 1:1 a 10:1.",UNILEVER NV,DAMODARAN ANITA;;DIAS PAUL MARK,,https://lens.org/190-314-719-868-583,Granted Patent,no,0,0,17,17,0,A61K8/498;;A61K8/498;;A61K8/4953;;A61K8/67;;A61K8/67;;A61K8/9789;;A61K8/9789;;A61K2800/20;;A61Q19/08;;A61Q19/08,A61Q19/08;;A61K8/49;;A61K8/67;;A61K8/97,,0,0,,,,ACTIVE
15,CN,A,CN 109715086 A,192-903-575-338-441,2019-05-03,2019,CN 201780056589 A,2017-08-15,US 201662375595 P;;US 201715480223 A;;US 2017/0047024 W,2016-08-16,INTRAVASCULAR FLOW DIVERSION DEVICES,"Described herein are devices and methods for closing abnormal communications between one or more vessels or a vessel and an organ. The devices and methods described herein are configured to divert a flow of a body fluid such as, for example, blood or bile away from the abnormal conduit thereby promoting thrombosis and occlusion in the case of blood vessel to blood vessel communication or an aneurysm and/or decrease in size of and epithelization of the communication such as in the case of a fistula.",SPARTAN MICRO INC,STOPPENHAGEN ERIC P;;DIAS MARK,,https://lens.org/192-903-575-338-441,Patent Application,no,4,0,5,5,0,A61B17/12113;;A61B17/12172;;A61B2017/00592;;A61B2017/00606;;A61B2017/00641;;A61B2017/1205;;A61B17/12113;;A61B2017/1205;;A61B2017/00592;;A61B2017/00606;;A61B17/12172;;A61B2017/00641;;A61F2/011;;A61F2002/016,A61B17/12,,0,0,,,,DISCONTINUED
16,WO,A1,WO 2018/035167 A1,104-797-985-062-777,2018-02-22,2018,US 2017/0047024 W,2017-08-15,US 201662375595 P;;US 201715480223 A,2016-08-16,INTRAVASCULAR FLOW DIVERSION DEVICES,"Described herein are devices and methods for closing abnormal communications between one or more vessels or a vessel and an organ. The devices and methods described herein are configured to divert a flow of a body fluid such as, for example, blood or bile away from the abnormal conduit thereby promoting thrombosis and occlusion in the case of blood vessel to blood vessel communication or an aneurysm and/or decrease in size of and epithelization of the communication such as in the case of a fistula.",SPARTAN MICRO INC,STOPPENHAGEN ERIC P;;DIAS MARK,,https://lens.org/104-797-985-062-777,Patent Application,yes,10,1,5,5,0,A61B17/12113;;A61B17/12113;;A61B17/12172;;A61B17/12172;;A61B2017/00592;;A61B2017/00592;;A61B2017/00606;;A61B2017/00606;;A61B2017/00641;;A61B2017/00641;;A61B2017/1205;;A61B2017/1205;;A61F2/011;;A61F2002/016,A61B17/12,,0,0,,,,PENDING
17,WO,A1,WO 2010/070132 A1,126-271-276-998-304,2010-06-24,2010,EP 2009067594 W,2009-12-18,EP 08022166 A,2008-12-19,THIOIC ACIDS AS BUILDING BLOCK FOR POLYTHIOESTERS,"The present invention relates to thioic acids according to formula (II) suitable as building block for polythioesters; Wherein X is O, N or S and whereby R1 is chosen from (-CH 2 -) 2 , -CH 2 -O-CH 2 - or (-CH 2 -) 3 , R2 is preferably chosen from a biodegradable oligomer or polymer chosen from poly (lactide) (PLLA), polyglycolide (PGA), co-oligomers or copolymers of PLA and PGA (PLGA), poly(anhydrides), poly(trimethylenecarbonates), poly(orthoesters), poly(dioxanones), poly(ε-caprolactones) (PCL) or polyesteramides and n>1.",DSM IP ASSETS BV;;BOERAKKER MARK JOHANNES;;DIAS AYLVIN,BOERAKKER MARK JOHANNES;;DIAS AYLVIN,,https://lens.org/126-271-276-998-304,Patent Application,yes,4,0,7,7,0,C07C327/06;;C07C327/22;;C08G75/26;;C07C327/06;;C07C327/22;;C08G75/26,A61K9/50;;C07C327/06;;C07C327/22;;C08G75/26,,17,14,036-106-917-630-963;;034-964-921-863-24X;;158-518-879-670-319;;155-134-147-685-759;;046-197-124-585-575;;015-612-029-840-989;;169-462-979-524-107;;052-655-873-010-755;;097-432-544-032-421;;026-053-539-309-670;;004-838-501-954-22X;;167-054-464-804-18X;;051-109-654-362-633;;161-604-303-185-74X,10.1016/s0040-4039(00)01600-2;;13887960;;10.1016/0003-9861(61)90154-0;;10.1016/j.tet.2004.12.050;;10.5059/yukigoseikyokaishi.17.419;;17436599;;10.1021/ja01147a063;;10.1295/polymj.26.49;;10.1295/polymj.25.507;;10.1002/macp.1982.021830424;;10.1002/pi.4980110407;;10.1002/pi.4980130109;;10.1016/0032-3861(82)90017-9;;10.1002/macp.1982.021830425;;10.1016/0032-3861(83)90110-6,"ANNA K. MAPP ET AL: ""Preparation of thioesters for the ligation of peptides with non-native substrates"", TETRAHEDRON LETTERS, vol. 41, no. 49, 2000, pages 9451 - 9454, XP002527615;;DRUMMOND G I ET AL: ""The enzymic hydrolysis of glutathione thioesters"", ARCHIVES OF BIOCHEMISTRY AND BIOPHYSICS, ACADEMIC PRESS, US, vol. 95, no. 2, 1 November 1961 (1961-11-01), pages 323 - 328, XP024812993, ISSN: 0003-9861, [retrieved on 19611101];;WEIWER ET AL: ""Product selectivity in the electroreduction of thioesters"", TETRAHEDRON, vol. 61, no. 7, 2005, pages 1709 - 1714, XP002527616;;DATABASE CAPLUS [online] CHEMICAL ABSTRACTS SERVICE, COLUMBUS, OHIO, US; 1 March 1959 (1959-03-01), OKUMURA, SHIGEO ET AL: ""Reductive desulfurization of thiol acid esters by Raney nickel. I. Higher aliphatic thiol acid esters"", XP002527617, retrieved from STN Database accession no. 1959:99660;;DATABASE CAPLUS [online] CHEMICAL ABSTRACTS SERVICE, COLUMBUS, OHIO, US; 21 February 2007 (2007-02-21), MOLNAR, JOSEPH ET AL: ""Effects of nontoxic heat shock protein 90 inhibitor peptide derivatives on reversal of MDR of tumor cells"", XP002527618, retrieved from STN Database accession no. 2007:478681;;CREMLYN R.J.: ""Thiosuccinimides"", JOURNAL OF THE CHEMICAL SOCIETY, 1961, pages 5547 - 5549, XP009116853;;MARVEL; KOTCH, J. AMER. CHEM. SOC., vol. 73, 1951, pages 1100 - 1102;;KOBAYASHI ET AL., POLYMER JOURNAL, vol. 26, 1994, pages 49 - 59;;POLYMER JOURNAL, vol. 25, 1993, pages 507 - 520;;KOBAYASHI ET AL.: ""reaction mechanism of the addition reaction of thiobenzoic acid to styrene or ethynylbenzene using UV light or radical initiators (AIBN)"", POLYMER JOURNAL, vol. 25, 1993, pages 507 - 520;;POLYMER JOURNAL, vol. 26, 1994, pages 49 - 59;;D. DURAND; C.-M. BRUNEAU, MAKROMOL. CHEM., vol. 183, 1982, pages 1007 - 1020;;D. DURAND; C.-M. BRUNEAU, THE BRITISH POLYMER JOURNAL, vol. 11, 1979, pages 194 - 198;;D. DURAND; C.-M. BRUNEAU, THE BRITISH POLYMER JOURNAL, vol. 13, 1981, pages 33 - 40;;D. DURAND; C.-M. BRUNEAU, POLYMER, vol. 23, 1982, pages 69 - 72;;D. DURAND; C.-M. BRUNEAU, MAKROMOL. CHEM., vol. 183, 1982, pages 1021 - 1035;;D. DURAND; C.-M. BRUNEAU, POLYMER, vol. 24, 1983, pages 587 - 591",PENDING
18,MX,A,MX 2015009549 A,158-840-373-670-376,2015-11-25,2015,MX 2015009549 A,2014-01-09,EP 13152808 A;;EP 2014050269 W,2013-01-28,SKIN CARE COMPOSITION.,The invention relates to a topical composition that provides enhanced skin health by way of providing anti-aging benefits that are evident from visibly reduced wrinkles and under-eye dark circles. This is achieved through use of a synergistic combination of folic acid and gallated catechin in a specific weight ratio range.,UNILEVER NV,DAMODARAN ANITA;;DIAS PAUL MARK,,https://lens.org/158-840-373-670-376,Patent Application,no,0,0,17,17,0,A61K8/498;;A61K8/498;;A61K8/4953;;A61K8/67;;A61K8/67;;A61K8/9789;;A61K8/9789;;A61K2800/20;;A61Q19/08;;A61Q19/08,A61K8/67;;A61K8/49;;A61Q19/08,,0,0,,,,ACTIVE
19,EA,B9,EA 028472 B9,120-421-871-904-184,2018-01-31,2018,EA 201500778 A,2014-01-09,EP 13152808 A;;EP 2014050269 W,2013-01-28,SKIN CARE COMPOSITION,"The invention relates to a cosmetic composition that provides enhanced skin health by way of providing anti-aging benefits that are evident from visibly reduced wrinkles and under-eye dark circles. This is achieved through use of a synergistic combination of folic acid and gallated catechin in a specific weight ratio range. The cosmetic composition by the invention comprises (i) 0.1 to 5% folic acid; (ii) 0.1 to 5% a gallated catechin; and (iii) a cosmetically acceptable base selected from the group consisting of cream, lotion, gel and emulsion, wherein the weight ratio of gallated catechin:folic acid is in the range of 2.5:1 to 10:1.",UNILEVER NV,DAMODARAN ANITA;;DIAS PAUL MARK,,https://lens.org/120-421-871-904-184,Amended Patent,no,0,0,17,17,0,A61K8/498;;A61K8/498;;A61K8/4953;;A61K8/67;;A61K8/67;;A61K8/9789;;A61K8/9789;;A61K2800/20;;A61Q19/08;;A61Q19/08,A61K8/67;;A61K8/49;;A61Q19/08,,0,0,,,,ACTIVE
20,US,A1,US 2018/0256170 A1,090-302-767-918-799,2018-09-13,2018,US 201815979226 A,2018-05-14,US 201815979226 A;;US 201715825518 A;;US 201715410639 A;;US 201662343528 P;;US 201662343542 P,2016-05-31,SYSTEMS AND METHODS FOR DELIVERING INTRAVASCULAR IMPLANTS,Systems and methods are provided for delivering and mechanically detaching embolic coils. The systems disclosed herein comprise a mechanical detachment mechanism to intravascularly release an embolic coil. The methods disclosed herein comprise a various triggering mechanisms to detach embolic coils.,SPARTAN MICRO INC,STOPPENHAGEN ERIC P;;DIAS MARK,SPARTAN MICRO INC (2017-11-28),https://lens.org/090-302-767-918-799,Patent Application,yes,5,3,4,17,0,A61B17/12113;;A61B17/12113;;A61B17/1214;;A61B17/12145;;A61B90/39;;A61B2017/00477;;A61B2017/00867;;A61B2017/00867;;A61B2017/12054;;A61B2017/12054;;A61B2090/0811;;A61B2090/3966,A61B17/12;;A61B17/00;;A61B90/00,,0,0,,,,ACTIVE
21,EP,B1,EP 2948128 B1,145-321-597-885-476,2016-10-05,2016,EP 14700180 A,2014-01-09,EP 13152808 A;;EP 2014050269 W;;EP 14700180 A,2013-01-28,SKIN CARE COMPOSITION,,UNILEVER NV;;UNILEVER PLC,DAMODARAN ANITA;;DIAS PAUL MARK,"UNILEVER GLOBAL IP LIMITED, WIRRAL, GB (2021-08-24)",https://lens.org/145-321-597-885-476,Granted Patent,yes,0,0,17,17,0,A61K8/498;;A61K8/498;;A61K8/4953;;A61K8/67;;A61K8/67;;A61K8/9789;;A61K8/9789;;A61K2800/20;;A61Q19/08;;A61Q19/08,A61Q19/08;;A61K8/49;;A61K8/67;;A61K8/97,,2,1,081-209-898-799-846,19786823;;10.1159/000241299,"ANOYMOUS: ""Formulating anti-ageing products with folic acid"", PERSONAL CARE, INGREDIENTS, FORMULATION, MANUFACTURE, vol. 3, no. 1, 1 July 2009 (2009-07-01), XP055259648;;DAL BELO SE ET AL: ""Skin penetration of epigallocatechin-3-gallate and quercetin from green tea and Ginkgo biloba extracts vehiculated in cosmetic formulations. - PubMed - NCBI"", SKIN PHARMACOL PHYSIOL, vol. 22, 25 September 2009 (2009-09-25), pages 299 - 304, XP055259654",ACTIVE
22,WO,A2,WO 2014/114496 A2,193-426-860-115-746,2014-07-31,2014,EP 2014050269 W,2014-01-09,EP 13152808 A,2013-01-28,SKIN CARE COMPOSITION,The invention relates to a topical composition that provides enhanced skin health by way of providing anti-aging benefits that are evident from visibly reduced wrinkles and under-eye dark circles. This is achieved through use of a synergistic combination of folic acid and gallated catechin in a specific weight ratio range.,UNILEVER NV;;UNILEVER PLC;;CONOPCO INC DBA UNILEVER,DAMODARAN ANITA;;DIAS PAUL MARK,,https://lens.org/193-426-860-115-746,Patent Application,yes,2,2,17,17,0,A61K8/498;;A61K8/498;;A61K8/4953;;A61K8/67;;A61K8/67;;A61K8/9789;;A61K8/9789;;A61K2800/20;;A61Q19/08;;A61Q19/08,,,1,0,,,"""The CTFA Cosmetic Ingredient Handbook"", 1992",PENDING
23,CA,C,CA 2896348 C,078-717-083-729-735,2020-12-08,2020,CA 2896348 A,2014-01-09,EP 13152808 A;;EP 2014050269 W,2013-01-28,SKIN CARE COMPOSITIONS COMPRISING FOLIC ACID AND GALLATED CATECHIN,The invention relates to a topical composition that provides enhanced skin health by way of providing anti-aging benefits that are evident from visibly reduced wrinkles and under-eye dark circles. This is achieved through use of a synergistic combination of folic acid and gallated catechin in a specific weight ratio range.,UNILEVER PLC,DAMODARAN ANITA;;DIAS PAUL MARK,,https://lens.org/078-717-083-729-735,Granted Patent,no,0,0,17,17,0,A61K8/498;;A61K8/67;;A61Q19/08;;A61K8/9789;;A61K8/4953;;A61K2800/20;;A61K8/498;;A61Q19/08;;A61K8/67;;A61K8/9789,A61K8/67;;A61K8/49;;A61Q19/08,,0,0,,,,ACTIVE
24,CA,A1,CA 2896348 A1,180-566-236-026-46X,2014-07-31,2014,CA 2896348 A,2014-01-09,EP 13152808 A;;EP 2014050269 W,2013-01-28,SKIN CARE COMPOSITION,The invention relates to a topical composition that provides enhanced skin health by way of providing anti-aging benefits that are evident from visibly reduced wrinkles and under-eye dark circles. This is achieved through use of a synergistic combination of folic acid and gallated catechin in a specific weight ratio range.,UNILEVER PLC,DAMODARAN ANITA;;DIAS PAUL MARK,,https://lens.org/180-566-236-026-46X,Patent Application,no,0,0,17,17,0,A61K8/498;;A61K8/498;;A61K8/4953;;A61K8/67;;A61K8/67;;A61K8/9789;;A61K8/9789;;A61K2800/20;;A61Q19/08;;A61Q19/08,A61K8/67;;A61K8/49;;A61Q19/08,,0,0,,,,ACTIVE
