84,WO,A1,WO 2005/011643 A1,081-931-650-811-627,2005-02-10,2005,GB 2004003318 W,2004-07-30,GB 0317868 A,2003-07-30,"BILIQUID FOAMS, STABLE DISPERSIONS THEREOF AND A CORRESPONDING PROCESS OF MANUFACTURING","A biliquid foam comprising from 10% to 98% by weight of a non-polar liquid other than a fuel and from 2 to 88% by weight of a continuous phase polar liquid comprising a C1-C4 alcohol, a liquid polyethylene glycol, ethylene glycol or propylene glycol, or mixtures thereof, in an amount of at least 65% by weight, relative to the weight of the continuous phase, wherein the biliquid foam is stabilized with an amount of from 0.05% to 2% by weight based on the total formulation of a surfactant which is selected from castor oil/poly(alkylene glycol) adducts containing from 20 to 50 alkoxy groups, a C8-C24 fatty acid or hydrogenated castor oil/poly(alkylene glycol) adducts containing from 20 to 60 alkoxy groups, or mixtures thereof. A stable dispersion having a content of at least 65% by weight with regard to C1-C4 alcohol, liquid polyethylene glycol, ethylene glycol or propylene glycol which dispersion comprises from 1-80% by weight of a biliquid foam and from 99-20% by weight of an aqueous gel.",DISPERSE LTD;;DIAS MONICA;;GUFFOGG PHILIP;;WHEELER DEREK;;WHITBREAD-JORDAN MARK,DIAS MONICA;;GUFFOGG PHILIP;;WHEELER DEREK;;WHITBREAD-JORDAN MARK,,https://lens.org/081-931-650-811-627,Patent Application,yes,5,14,19,19,0,A61K9/1075;;A61P17/00;;A61K9/1075,A61K9/107,,0,0,,,,PENDING
85,US,A1,US 2018/0324132 A1,126-007-140-957-252,2018-11-08,2018,US 201715588311 A,2017-05-05,US 201715588311 A,2017-05-05,SYSTEM AND METHOD FOR AUTOMATING ACTIONS IN DISTRIBUTED COMPUTING,"Systems, methods, and media for actions in distributed computing by receiving trigger event specification that defines a trigger event that will cause a notification to be transmitted. A determination is made whether the trigger event has occurred. Responsive to the determination that the trigger event has occurred, a notification is generated. Excess data is removed from the notification. The notification, with the excess data removed, is sent.",SERVICENOW INC,BARNARD BRYAN MATHER;;BRENNAN MARK;;DIAS REBECCA;;RODRIGUEZ NATALLIA,SERVICENOW INC (2019-09-04),https://lens.org/126-007-140-957-252,Patent Application,yes,4,9,4,4,0,H04L51/08;;H04L51/10;;H04L67/02;;H04L51/224;;H04L51/08;;H04L51/10;;H04L67/02;;G06F11/3672;;H04L67/1095;;G06F9/542;;H04L67/55;;H04L51/224,H04L12/58;;H04L29/08,,0,0,,,,ACTIVE
86,CA,C,CA 2533740 C,117-538-591-662-118,2014-01-28,2014,CA 2533740 A,2004-07-30,GB 0317868 A;;GB 2004003318 W,2003-07-30,"BILIQUID FOAMS, STABLE DISPERSIONS THEREOF AND A CORRESPONDING PROCESS OF MANUFACTURING","A biliquid foam comprising from 10% to 98% by weight of a non-polar liquid other than a fuel and from 2 to 88% by weight of a continuous phase polar liquid comprising a C1-C4 alcohol, a liquid polyethylene glycol, ethylene glycol or propylene glycol, or mixtures thereof, in an amount of at least 65% by weight, relative to the weight of the continuous phase, wherein the biliquid foam is stabilized with an amount of from 0.05% to 2% by weight based on the total formulation of a surfactant which is selected from castor oil/poly(alkylene glycol) adducts containing from 20 to 50 alkoxy groups, a C8-C24 fatty acid or hydrogenated castor oil/poly(alkylene glycol) adducts containing from 20 to 60 alkoxy groups, or mixtures thereof. A stable dispersion having a content of at least 65% by weight with regard to C1-C4 alcohol, liquid polyethylene glycol, ethylene glycol or propylene glycol which dispersion comprises from 1-80% by weight of a biliquid foam and from 99-20% by weight of an aqueous gel.",DRUG DELIVERY SOLUTIONS LTD,DIAS MONICA;;GUFFOGG PHILIP;;WHEELER DEREK;;WHITBREAD-JORDAN MARK,,https://lens.org/117-538-591-662-118,Granted Patent,no,0,0,19,19,0,A61K9/1075;;A61P17/00;;A61K9/1075,A61K9/70;;A61K9/06;;A61K9/10;;A61K9/107;;A61K9/12,,0,0,,,,ACTIVE
87,DK,T3,DK 1656121 T3,003-814-772-095-962,2013-03-04,2013,DK 04743636 T,2004-07-30,GB 0317868 A;;GB 2004003318 W,2003-07-30,"Bivæsket skum, stabile dispersioner deraf og en tilsvarende fremstillingsproces",,DRUG DELIVERY SOLUTIONS LTD,DIAS MONICA;;GUFFOGG PHILIP;;WHEELER DEREK;;WHITBREAD-JORDAN MARK,,https://lens.org/003-814-772-095-962,Granted Patent,no,0,0,19,19,0,A61K9/1075;;A61P17/00;;A61K9/1075,A61K9/70;;A61K9/06;;A61K9/10;;A61K9/107;;A61K9/12,,0,0,,,,ACTIVE
88,AU,B2,AU 2004/261050 B2,136-938-139-741-583,2010-07-29,2010,AU 2004/261050 A,2004-07-30,GB 0317868 A;;GB 2004003318 W,2003-07-30,"Biliquid foams, stable dispersions thereof and a corresponding process of manufacturing",,DRUG DELIVERY SOLUTIONS LTD,GUFFOGG PHILIP;;WHITBREAD-JORDAN MARK;;DIAS MONICA;;WHEELER DEREK,,https://lens.org/136-938-139-741-583,Granted Patent,no,4,0,19,19,0,A61K9/1075;;A61P17/00;;A61K9/1075,A61K9/107,,0,0,,,,INACTIVE
89,US,A1,US 2006/0239947 A1,064-611-875-362-077,2006-10-26,2006,US 56621004 A,2004-07-30,GB 0317868 A;;GB 2004003318 W,2003-07-30,Biliquid foams stable dispersions thereof and a corresponding process of manufacturing,"A biliquid foam comprising from 10% to 98% by weight of a non-polar liquid other than a fuel and from 2 to 88% by weight of a continuous phase polar liquid comprising a C 1 -C 4 alcohol, a liquid polyethylene glycol, ethylene glycol or propylene glycol, or mixtures thereof, in an amount of at least 65% by weight, relative to the weight of the continuous phase, wherein the biliquid foam is stabilized with an amount of from 0.05% to 2% by weight based on the total formulation of a surfactant which is selected from castor oil/poly(alkylene glycol) adducts containing from 20 to 50 alkoxy groups, a C 8 -C 24 fatty acid or hydrogenated castor oil/poly(alkylene glycol) adducts containing from 20 to 60 alkoxy groups, or mixtures thereof. A stable dispersion having a content of at least 65% by weight with regard to C 1 -C 4 alcohol, liquid polyethylene glycol, ethylene glycol or propylene glycol which dispersion comprises from 1-80% by weight of a biliquid foam and from 99-20% by weight of an aqueous gel.",DIAS MONICA;;GUFFOGG PHILIP;;WHEELER DEREK;;WHITEBREAD-JORDAN MARK,DIAS MONICA;;GUFFOGG PHILIP;;WHEELER DEREK;;WHITEBREAD-JORDAN MARK,DRUG DELIVERY SOLUTIONS LIMITED (2006-02-07),https://lens.org/064-611-875-362-077,Patent Application,yes,6,15,19,19,0,A61K9/1075;;A61P17/00;;A61K9/1075,A61K8/00;;A61K9/107,424/70.1,0,0,,,,ACTIVE
90,RU,C2,RU 2362545 C2,160-223-152-051-131,2009-07-27,2009,RU 2006106271 A,2004-07-30,GB 0317868 A,2003-07-30,"TWO-FLUID FOAMS, STABLE DISPERSION ON THEIR BASIS AND WAY OF ITS RECEPTION","FIELD: medicine; pharmaceutics. ^ SUBSTANCE: invention concerns a two-fluid foam for local application on a skin, including from 10 to 98% wt. of a non-polar fluid distinct from fuel, and from 2 to 88% wt of a continuous phase of the polar fluid including C1-C4 alcohol, liquid polyethylene alcohol, ethylene alcohol or propylene glycol, or their admixtures, in quantity of at least 65% wt concerning mass of a continuous phase where the two-fluid foam is stabilised by surface-active substance in quantity from 0.05% to 2% wt in reliance on all composition which is chosen from adducts castor oil/poly (alkylene glycol), containing from 20 to 50 alkoxy groups, C8-C24 fatty acid or adducts the hydrogenated castor oil/poly (alkylene glycol), containing from 20 to 60 alkoxy groups, or from their admixtures. The stable dispersion having content of C1-C4 of alcohol, liquid polyethyleneglycol, ethyleneglycol or glycol propylene, at least 65% wt, and including from 1 to 80% wt of a two-fluid foam and from 99 to 20% wt of water gel. ^ EFFECT: received compositions include high content of alcohol for medical and cosmetic use. ^ 19 cl, 28 ex",DRAG DELIVERI SOLJUSHNZ LTD,DIAS MONIKA;;GAFFOGG FILIP;;UILER DEREK;;UITBRED-DZHORDAN MARK,,https://lens.org/160-223-152-051-131,Granted Patent,no,0,0,19,19,0,A61K9/1075;;A61P17/00;;A61K9/1075,A61K8/11;;A61K9/10;;A61K9/107;;A61K9/12;;A61L2/18;;A61L101/32;;A61P17/00;;A61Q19/00,,0,0,,,,ACTIVE
91,US,B2,US 8603503 B2,130-606-452-056-954,2013-12-10,2013,US 56621004 A,2004-07-30,GB 0317868 A;;GB 2004003318 W,2003-07-30,Biliquid foams stable dispersions thereof and a corresponding process of manufacturing,"A biliquid foam includes from 10% to 98% by weight of a non-polar liquid other than a fuel and from 2 to 88% by weight of a continuous phase polar liquid comprising a C 1 -C 4 alcohol, a liquid polyethylene glycol, ethylene glycol or propylene glycol, or mixtures thereof, in an amount of at least 65% by weight, relative to the weight of the continuous phase, wherein the biliquid foam is stabilized with an amount of from 0.05% to 2% by weight based on the total formulation of a surfactant which is selected from castor oil/poly(alkylene glycol) adducts containing from 20 to 50 alkoxy groups, a C 8 -C 24 fatty acid or hydrogenated castor oil/poly(alkylene glycol) adducts containing from 20 to 60 alkoxy groups, or mixtures thereof.",DIAS MONICA;;GUFFOGG PHILIP;;WHEELER DEREK;;WHITBREAD-JORDAN MARK;;DRUG DELIVERY SOLUTIONS LTD,DIAS MONICA;;GUFFOGG PHILIP;;WHEELER DEREK;;WHITBREAD-JORDAN MARK,DRUG DELIVERY SOLUTIONS LIMITED (2006-02-07),https://lens.org/130-606-452-056-954,Granted Patent,yes,11,3,19,19,0,A61K9/1075;;A61P17/00;;A61K9/1075,A61K9/00;;A61K8/02;;A61K9/107,424/401;;424/400;;514/945;;514/975,3,1,136-005-143-578-614,10.1023/a:1020878020237,"Flick, Emulsifying Agents-An Industrial Guide, William Andrew Publishing/Noyes, 1990, p. 61 and 92.;;Knothe, Inform, 2001, 12, pp. 1103-1107.;;Merriam-Webster Dictionary, obtained online at: http://www.merriam-webster.com/dictionary.fuel, obatined online on Oct. 3, 2009.",ACTIVE
92,CA,A1,CA 2533740 A1,168-036-830-904-760,2005-02-10,2005,CA 2533740 A,2004-07-30,GB 0317868 A;;GB 2004003318 W,2003-07-30,"BILIQUID FOAMS, STABLE DISPERSIONS THEREOF AND A CORRESPONDING PROCESS OF MANUFACTURING","A biliquid foam comprising from 10% to 98% by weight of a non-polar liquid other than a fuel and from 2 to 88% by weight of a continuous phase polar liquid comprising a C1-C4 alcohol, a liquid polyethylene glycol, ethylene glycol or propylene glycol, or mixtures thereof, in an amount of at least 65 % by weight, relative to the weight of the continuous phase, wherein the biliquid foam is stabilized with an amount of from 0.05% to 2% by weight bas ed on the total formulation of a surfactant which is selected from castor oil/poly(alkylene glycol) adducts containing from 20 to 50 alkoxy groups, a C8- C24 fatty acid or hydrogenated castor oil/poly(alkylene glycol) adducts containing from 20 to 60 alkoxy groups, or mixtures thereof. A stable dispersion having a content of at least 65% by weight with regard to C1-C4 alcohol, liquid polyethylene glycol, ethylene glycol or propylene glycol whi ch dispersion comprises from 1-80% by weight of a biliquid foam and from 99-20% by weight of an aqueous gel.",DRUG DELIVERY SOLUTIONS LTD,WHEELER DEREK;;GUFFOGG PHILIP;;DIAS MONICA;;WHITBREAD-JORDAN MARK,,https://lens.org/168-036-830-904-760,Patent Application,no,0,0,19,19,0,A61K9/1075;;A61P17/00;;A61K9/1075,A61K9/70;;A61K9/06;;A61K9/10;;A61K9/107;;A61K9/12,,0,0,,,,ACTIVE
93,EP,B1,EP 1656121 B1,012-622-279-373-308,2013-01-16,2013,EP 04743636 A,2004-07-30,GB 2004003318 W;;GB 0317868 A,2003-07-30,"BILIQUID FOAMS, STABLE DISPERSIONS THEREOF AND A CORRESPONDING PROCESS OF MANUFACTURING",,DRUG DELIVERY SOLUTIONS LTD,DIAS MONICA;;GUFFOGG PHILIP;;WHEELER DEREK;;WHITBREAD-JORDAN MARK,,https://lens.org/012-622-279-373-308,Granted Patent,yes,5,0,19,19,0,A61K9/1075;;A61P17/00;;A61K9/1075,A61K9/70;;A61K9/06;;A61K9/10;;A61K9/107;;A61K9/12,,0,0,,,,ACTIVE
94,AU,A1,AU 2004/261050 A1,157-951-722-862-225,2005-02-10,2005,AU 2004/261050 A,2004-07-30,GB 0317868 A;;GB 2004003318 W,2003-07-30,"Biliquid foams, stable dispersions thereof and a corresponding process of manufacturing",,DRUG DELIVERY SOLUTIONS LTD,GUFFOGG PHILIP;;WHITBREAD-JORDAN MARK;;DIAS MONICA;;WHEELER DEREK,,https://lens.org/157-951-722-862-225,Patent Application,no,0,0,19,19,0,A61K9/1075;;A61P17/00;;A61K9/1075,A61K9/70;;A61K9/06;;A61K9/10;;A61K9/107;;A61K9/12,,0,0,,,,INACTIVE
95,ES,T3,ES 2399426 T3,091-167-846-344-620,2013-04-01,2013,ES 04743636 T,2004-07-30,GB 0317868 A;;GB 2004003318 W,2003-07-30,"Espumas bilíquidas, dispersiones estables de las mismas y un proceso de fabricación correspondiente","Una espuma bilíquida que comprende del 10% al 98% en peso de un líquido no polar distinto de un combustible ydel 2 al 88% en peso de un líquido polar como fase continua que comprende un alcohol C1-C4, un polietilenglicol,etilenglicol o propilenglicol líquido, o mezclas de los mismos, en una cantidad de al menos el 65% en peso, respectoal peso de la fase continua, en el que la espuma bilíquida está estabiliza con una cantidad del 0,05% al 2% en pesobasado en la formulación total de un tensioactivo que se selecciona entre aductos de aceite de ricino/poli(alquilenglicol) que contienen de 20 a 50 grupos alcoxi, un ácido graso C8-C24 o aductos de aceite de ricinohidrogenado/poli (alquilenglicol) que contienen de 20 a 60 grupos alcoxi, o mezclas de los mismos.",DRUG DELIVERY SOLUTIONS LTD,DIAS MONICA;;GUFFOGG PHILIP;;WHEELER DEREK;;WHITBREAD-JORDAN MARK,,https://lens.org/091-167-846-344-620,Granted Patent,no,0,0,19,19,0,A61K9/1075;;A61P17/00;;A61K9/1075,A61K9/70;;A61K9/06;;A61K9/10;;A61K9/107;;A61K9/12,,0,0,,,,ACTIVE
96,US,A1,US 2011/0301288 A1,140-142-447-443-917,2011-12-08,2011,US 200913133217 A,2009-12-18,EP 08022166 A;;EP 2009067594 W,2008-12-19,THIOIC ACIDS AS BUILDING BLOCK FOR POLYTHIOESTERS,"The present invention relates to thioic acids according to formula (II) suitable as building block for polythioesters; Wherein X is O, N or S and whereby R1 is chosen from (—CH 2 —) 2 , —CH 2 —O—CH 2 — or (—CH 2 —) 3 , R2 is preferably chosen from a biodegradable oligomer or polymer chosen from poly(lactide) (PLLA), polyglycolide (PGA), co-oligomers or copolymers of PLA and PGA (PLGA), poly(anhydrides), poly(trimethylenecarbonates), poly(orthoesters), poly(dioxanones), poly(ε-caprolactones) (PCL) or polyesteramides and n>1.",BOERAKKER MARK JOHANNES;;DIAS AYLVIN JORGE ANGELO;;VERSTEEGEN RONNY MATHIEU;;DSM IP ASSETS BV,BOERAKKER MARK JOHANNES;;DIAS AYLVIN JORGE ANGELO;;VERSTEEGEN RONNY MATHIEU,DSM IP ASSETS B.V (2011-06-20),https://lens.org/140-142-447-443-917,Patent Application,yes,1,3,7,7,0,C07C327/06;;C07C327/22;;C08G75/26;;C07C327/06;;C07C327/22;;C08G75/26,C09D181/00;;B82Y30/00;;C07C327/06;;C08G75/26,524/600;;560/147;;562/26;;525/418;;528/373;;524/609;;524/599;;977/773;;977/788,0,0,,,,DISCONTINUED
97,ZA,B,ZA 200600760 B,099-155-712-561-999,2007-05-30,2007,ZA 200600760 A,2004-07-30,GB 0317868 A,2003-07-30,"Biliquid foams, stable dispersions thereof and a corresponding process of manufacturing",,DRUG DELIVERY SOLUTIONS LTD,MONICA DIAS;;PHILIP GUFFOGG;;ALFRED WHEELER DEREK;;MARK WHITBREAD-JORDAN,,https://lens.org/099-155-712-561-999,Granted Patent,no,0,0,19,19,0,A61K9/1075;;A61P17/00;;A61K9/1075,A61K/;;A61K9/107,,0,0,,,,ACTIVE
98,WO,A1,WO 2013/016698 A1,049-803-938-403-802,2013-01-31,2013,US 2012/0048709 W,2012-07-27,US 201161512845 P,2011-07-28,DISCECTOMY DEVICES AND RELATED METHODS,"Tissue removal devices are disclosed herein. In some embodiments, a tissue removal device may comprise a handheld housing, a motor, and a tissue removal mechanism coupled to the handheld housing. The tissue removal mechanism may comprise a tubular member, a rotatable elongated member disposed within a lumen of the tubular member, a first impeller distal to the rotatable elongated member, and a second impeller adjacent the first impeller.",SPINE VIEW INC,FABRO MYRA;;NGUYEN HIEP;;DIAS MARK A;;MIREL AL;;MAY ROBERT,,https://lens.org/049-803-938-403-802,Patent Application,yes,8,8,6,6,0,A61B17/32002;;A61B2017/00734;;A61B2017/320024;;A61B2017/00309;;A61B17/1671;;A61B17/1671;;A61B17/32002;;A61B2017/00309;;A61B2017/00734;;A61B2017/320024;;A61B17/1671;;A61B17/32002;;A61B2017/00309;;A61B2017/00734;;A61B2017/320024;;A61B17/3207,A61B17/32,,1,0,,,See also references of EP 2736426A4,PENDING
99,US,B2,US 11372389 B2,087-913-044-876-868,2022-06-28,2022,US 202017061642 A,2020-10-02,US 202017061642 A;;US 201962913930 P,2019-10-11,Methods for monitoring status of a light fixture and related monitoring modules and computer program products,Methods for remotely monitoring a status of a light fixture including monitoring sensor data associated with the light fixture; analyzing the monitored sensor data to determine if the light fixture is operating outside expected parameters associated with the light fixture; and altering the status of the light fixture for a finite period of time if it is determined that the light fixture is operating outside expected parameters are provide. Related monitoring modules and computer program products are also provided.,SENSUS SPECTRUM LLC,ROBERTS RYAN MARK;;SILVA PEDRO PAULO DIAS E;;NOBLES CHARLES MILTON,SENSUS SPECTRUM LLC (2020-09-23),https://lens.org/087-913-044-876-868,Granted Patent,yes,12,0,6,6,0,H05B47/105;;H05B47/11;;H05B47/115;;H05B47/22;;G05B19/0428;;G05B2219/23154,G05B19/042,,1,0,,,"International Search Report and Written Opinion, PCT/US2020/053908, dated Dec. 18, 2020, 10 pages.",ACTIVE
100,CA,A1,CA 2620289 A1,095-515-794-046-683,2007-03-15,2007,CA 2620289 A,2006-09-07,EP 05108206 A;;EP 2006008730 W,2005-09-07,POLYMERS COMPRISING THIOESTER BONDS,"This invention is in the field of polymer chemistry. More in particular it provides a method to produce polymers such as block copolymers or cross-link ed networks that are suitable for medical applications. The invention also provides degradable materials that may degrade completely when used in the human or animal body, minimizing residual components that may be toxic or otherwise undesirable.",DSM IP ASSETS BV,DIAS AYLVIN JORGE ANGELO ATHAN;;BOERAKKER MARK JOHANNES;;NIJENHUIS ATZE JAN,,https://lens.org/095-515-794-046-683,Patent Application,no,0,0,11,11,0,C08G63/6882;;C08G63/6888;;C08G63/912;;C08G63/6882;;C08G63/912;;C08G63/6888,C08G75/26;;C08F299/00;;C08G75/00,,0,0,,,,DISCONTINUED
101,US,A1,US 2020/0213262 A1,198-845-257-723-542,2020-07-02,2020,US 202016736565 A,2020-01-07,US 202016736565 A;;US 201715588311 A,2017-05-05,SYSTEM AND METHOD FOR AUTOMATING ACTIONS IN DISTRIBUTED COMPUTING,"Systems, methods, and media for actions in distributed computing by receiving trigger event specification that defines a trigger event that will cause a notification to be transmitted. A determination is made whether the trigger event has occurred. Responsive to the determination that the trigger event has occurred, a notification is generated. Excess data is removed from the notification. The notification, with the excess data removed, is sent.",SERVICENOW INC,BARNARD BRYAN MATHER;;BRENNAN MARK;;DIAS REBECCA ANITA;;RODRIGUEZ NATALLIA RABTSEVICH,,https://lens.org/198-845-257-723-542,Patent Application,yes,0,0,4,4,0,H04L51/08;;H04L51/10;;H04L67/02;;H04L51/224;;H04L51/08;;H04L51/10;;H04L67/02;;G06F11/3672;;H04L67/1095;;G06F9/542;;H04L67/55;;H04L51/224,H04L12/58;;H04L29/08,,0,0,,,,ACTIVE
102,JP,A,JP 2012149261 A,064-251-195-140-749,2012-08-09,2012,JP 2012045620 A,2012-03-01,EP 05108206 A,2005-09-07,POLYMER CONTAINING THIOESTER BOND AND MEDICAL DEVICE,"PROBLEM TO BE SOLVED: To provide a method for producing a polymer such as block copolymer or cross-linked network suitable for medical applications.SOLUTION: There is disclosed a block copolymer containing at least one degradable block, in which individual blocks are mutually connected through a thioester bond (-COS-) represented by formula (wherein, W, Wand Ware each selected from the group consisting of C, H, O, N, S, P, alkyl, aryl, ester and ether).",DSM IP ASSETS BV,DIAS AYLVIN JORGE ANGELO ATHANASIUS;;BOERAKKER MARK JOHANNES;;NIJENHUIS ATZE JAN,,https://lens.org/064-251-195-140-749,Patent Application,no,1,0,11,11,0,C08G63/6882;;C08G63/6888;;C08G63/912;;C08G63/6882;;C08G63/912;;C08G63/6888,C08G75/26;;A61L31/00;;C08G81/00,,2,0,,,"JPN5008013325; ＭＡＲＶＥＬ Ｃ Ｓ: ＪＯＵＲＮＡＬ ＯＦ ＴＨＥ ＡＭＥＲＩＣＡＮ ＣＨＥＭＩＣＡＬ ＳＯＣＩＥＴＹ Ｖ７３ Ｎ３, 195103, Ｐ１１００-１１０２, ＡＭＥＲＩＣＡＮ ＣＨＥＭＩＣＡＬ ＳＯＣＩＥＴＹ;;JPN5008013326; ＫＯＢＡＹＡＳＨＩ Ｅ: ＰＯＬＹＭＥＲ ＪＯＵＲＮＡＬ Ｖ２６ Ｎ１, 19940115, Ｐ４９-５９, ＳＯＣＩＥＴＹ ＯＦ ＰＯＬＹＭＥＲ ＳＣＩＥＮＣＥ",PENDING
103,CN,A,CN 115004385 A,120-799-887-951-879,2022-09-02,2022,CN 202180008183 A,2021-01-26,EP 20153986 A;;CN 2021073743 W,2020-01-28,Color plate-like assembly with structured cover plate and color filter layer,"The invention relates to a plate-like assembly (1) comprising a transparent cover plate (2) and a planar back element (3) attached to the cover plate (2), the cover plate (2) having a front side (4) facing the outside environment and a back side (5) facing the back element (3), wherein at least one surface (4, 5) selected from the front side and the rear side has at least one structured region (8, 8 '), and wherein at least one color filter layer (9, 9') for reflecting light in a predetermined wavelength range is arranged on the at least one surface (4, 5) selected from the front side and the rear side, wherein the at least one structured region (8, 8 ') has the following features (i) to (iii): (i) perpendicular to the plane of the cover plate (2), the height profile comprises peaks and valleys, the average height difference between the peaks and valleys being at least 2 [mu] m, (ii) at least 50% of the structured region consists of segments inclined with respect to the plane of the cover plate (2), at least 20% of the segments have an inclination angle in the range of 0 DEG or more to a maximum of 15 DEG and at least 30% of the segments have an inclination angle in the range of 15 DEG or more to a maximum of 45 DEG, where (iii) each segment is planar and has a segment area of at least 1 [mu] m2, the at least one color filter layer (9, 9 ') comprises at least one color filter layer (9, 9'), the segments each have an average roughness of less than 15% of the layer thickness of the at least one color filter layer (9, 9 '), and wherein the at least one color filter layer (9, 9') comprises at least one high refractive layer, the refractive index of the at least one refractive layer is greater than 2.5 in the wavelength range of 400 nm to at least 700 nm, and the extinction coefficient is at least 0.2 in the case of less than 450 nm and is less than 0.2 (in particular less than 0.1) in the case of greater than 700 nm.",CHINA BUILDING MATERIALS GLASS NEW MATERIAL RES INSTITUTE GROUP CO LTD,PALM JU RG;;RINGER SIMON;;KOEGEL JAN;;KALLIO RICCARDO;;DIAS MARK,,https://lens.org/120-799-887-951-879,Patent Application,no,0,1,8,8,0,H01L31/02366;;H01L31/0549;;H01L31/048;;H01L31/02;;H02S20/26;;Y02B10/10;;H01L31/0549;;H01L31/02366;;H01L31/0488;;H02S20/26;;Y02E10/50;;H01L31/0543;;H01L31/02162;;H01L31/02167;;H01L31/048,H01L31/054;;H01L31/02;;H01L31/0236;;H01L31/048;;H02S20/26,,0,0,,,,PENDING
104,WO,A1,WO 2021/071750 A1,131-211-372-407-056,2021-04-15,2021,US 2020/0053908 W,2020-10-02,US 201962913930 P,2019-10-11,METHOD FOR MONITORING STATUS OF A LIGHT FIXTURE AND RELATED MONITORING MODULE AND COMPUTER PROGRAM PRODUCT,Methods for remotely monitoring a status of a light fixture including monitoring sensor data associated with the light fixture; analyzing the monitored sensor data to determine if the light fixture is operating outside expected parameters associated with the light fixture; and altering the status of the light fixture for a finite period of time if it is determined that the light fixture is operating outside expected parameters are provide. Related monitoring modules and computer program products are also provided.,SENSUS SPECTRUM LLC,ROBERTS RYAN MARK;;SILVA PEDRO PAULO DIAS E;;NOBLES CHARLES MILTON,,https://lens.org/131-211-372-407-056,Patent Application,yes,5,0,6,6,0,H05B47/105;;H05B47/11;;H05B47/115;;H05B47/22;;G05B19/0428;;G05B2219/23154,H05B47/21,,0,0,,,,PENDING
105,AU,A1,AU 2006/289328 A1,158-545-198-292-643,2007-03-15,2007,AU 2006/289328 A,2006-09-07,EP 05108206 A;;EP 2006008730 W,2005-09-07,Polymers comprising thioester bonds,,DSM IP ASSETS BV,BOERAKKER MARK JOHANNES;;DIAS AYLVIN JORGE ANGELO ATHAN;;NIJENHUIS ATZE JAN,,https://lens.org/158-545-198-292-643,Patent Application,no,0,0,11,11,0,C08G63/6882;;C08G63/6888;;C08G63/912;;C08G63/6882;;C08G63/912;;C08G63/6888,C08G75/26;;C08F299/00;;C08G75/00,,0,0,,,,DISCONTINUED
106,US,A1,US 2021/0109494 A1,082-101-314-357-529,2021-04-15,2021,US 202017061642 A,2020-10-02,US 202017061642 A;;US 201962913930 P,2019-10-11,Methods for Monitoring Status of a Light Fixture and Related Monitoring Modules and Computer Program Products,Methods for remotely monitoring a status of a light fixture including monitoring sensor data associated with the light fixture; analyzing the monitored sensor data to determine if the light fixture is operating outside expected parameters associated with the light fixture; and altering the status of the light fixture for a finite period of time if it is determined that the light fixture is operating outside expected parameters are provide. Related monitoring modules and computer program products are also provided.,SENSUS SPECTRUM LLC,ROBERTS RYAN MARK;;SILVA PEDRO PAULO DIAS E;;NOBLES CHARLES MILTON,SENSUS SPECTRUM LLC (2020-09-23),https://lens.org/082-101-314-357-529,Patent Application,yes,0,0,6,6,0,H05B47/105;;H05B47/11;;H05B47/115;;H05B47/22;;G05B19/0428;;G05B2219/23154,G05B19/042,,0,0,,,,ACTIVE
