173,US,A1,US 2001/0048797 A1,067-387-505-950-854,2001-12-06,2001,US 80495201 A,2001-03-13,US 80495201 A;;US 18932700 P,2000-03-14,Fully indentifiable optical fiber assemblies,"
   The present invention relates to a radiation-curable composition comprising, in the uncured state, at least one monomer or oligomer having a radiation-curable functional group which can form free radicals in the presence of actinic radiation, a photoinitiator for said monomer or oligomer present in an amount sufficient to effect radiation cure of said monomer or oligomers and a contrasting agent which causes an observable change in the cured composition upon exposure to energy from a high energy tunable light source. 

   The invention further relates to an optical fiber ribbon assembly comprising said radiation curable composition and including energy-induced indicia, and to a process for importing indicia to an optical fiber ribbon assembly. 
",VAN DIJK SASKIA I.;;DIAS AYLVIN J.;;DE HAAS JACOB L.;;TILLEY MARK G.;;REICHERT TIMOTHY P.,VAN DIJK SASKIA I;;DIAS AYLVIN J;;DE HAAS JACOB L;;TILLEY MARK G;;REICHERT TIMOTHY P,DSM N.V (2001-07-11),https://lens.org/067-387-505-950-854,Patent Application,yes,0,48,3,3,0,B41M5/267;;C09D4/00;;G02B6/4482;;C09D4/00;;G02B6/4482;;B41M5/267,B41M5/26;;C09D4/00;;G02B6/44,385/114;;385/128,0,0,,,,DISCONTINUED
174,AU,A1,AU 2003/292269 A1,020-140-520-359-800,2004-06-30,2004,AU 2003/292269 A,2003-11-14,EP 0315016 W;;US 31533502 A,2002-12-10,APPARATUS AND METHODS FOR CO-LOCATION AND OFFLOADING OF WEB SITE TRAFFIC BASED ON TRAFFIC PATTERN RECOGNITION,,IBM,DIAS DANIEL MANUEL;;LIU ZHEN;;SQUILLANTE MARK STEVEN;;XIA HONGHUI;;YU SHUNG-ZHENG;;ZHANG LI;;KING RICHARD PERVIN,,https://lens.org/020-140-520-359-800,Patent Application,no,0,0,13,13,0,H04L41/142;;H04L47/122;;H04L43/16;;H04L67/1008;;H04L67/1029;;H04L67/101;;H04L67/1021;;H04L67/1012;;H04L67/1023;;H04L69/329;;H04L67/10015;;H04L67/1001;;H04L67/535;;H04L47/122;;H04L41/142;;H04L43/16;;H04L67/1008;;H04L67/101;;H04L69/329;;H04L67/1021;;H04L67/1029;;H04L67/1023;;H04L67/1012;;H04L9/40;;H04L67/535;;H04L67/1001;;H04L67/10015,H04L12/24;;H04L12/56;;H04L29/06;;H04L29/08,,0,0,,,,DISCONTINUED
175,CA,A1,CA 2145635 A1,164-201-455-001-252,1994-04-14,1994,CA 2145635 A,1993-09-17,US 95453992 A,1992-09-29,LONG CHAIN BRANCHED POLYMERS AND A PROCESS TO MAKE LONG CHAIN BRANCHED POLYMERS,A novel polymer and process for producing polymers incorporating linear long chain side branches are provided. The long chain linear branches occur at a frequency of less than 5.0 branches per 1000 carbon atom of the main polymer chains with at least some branches having a molecular weight greater than the critical molecular weight for entanglement of the polymer. The linear long chain branched polymers are produced by alpha-olefin macromolecule incorporation during bridged metallocene catalyst polymerization in solution and slurry processes. The polymers are characterized by superior processability characteristics of the polymer melts and superior mechanical characteristics of the solid polymers. The polymers are useful for fabrication into a wide variety of articles by conventional fabrication techniques.,EXXON CHEMICAL PATENTS INC,CANICH JO ANN MARIE;;BRANT PATRICK;;LICCIARDI GARY FREDERICK;;DIAS ANTHONY JAY;;BAMBERGER ROBERT LEE;;HENRICHS PAUL MARK,,https://lens.org/164-201-455-001-252,Patent Application,no,0,0,7,7,0,C08F290/042;;C08F290/042;;C08F2/38;;C08F4/65908;;C08F4/65927;;C08F10/02;;C08F10/02;;C08F110/02;;C08F110/02;;C08F210/08;;C08F210/16;;C08F210/16;;C08F2500/09;;C08F2500/12;;C08L2314/06;;Y10S526/943,C08F4/642;;C08F4/6592;;C08F8/00;;C08F10/00;;C08F10/02;;C08F110/02;;C08F210/16;;C08F290/00;;C08F290/04,,0,0,,,,DISCONTINUED
176,US,A1,US 2004/0111508 A1,112-279-103-067-796,2004-06-10,2004,US 31533502 A,2002-12-10,US 31533502 A,2002-12-10,Apparatus and methods for co-location and offloading of web site traffic based on traffic pattern recognition,"
   Apparatus and methods for identifying traffic patterns to web sites based on templates that characterize the arrival of traffic to the web sites are provided. Based on these templates, determinations are made as to which web sites should be co-located so as to optimize resource allocation. Specifically, web sites whose templates are complimentary, i.e. a first web site having a peak in arrival traffic at time t1 and a second web site that has a trough in arrival traffic at time t1, are designated as being candidates for co-location. In addition, the present invention uses the templates identified for the traffic patterns of web sites to determine thresholds for offloading traffic to other servers. These thresholds include a first threshold at which offloading should be performed, a second threshold that takes into consideration the lead time needed to begin offloading, and a third threshold that takes into consideration a lag time needed to stop all offloading of traffic to the other servers. 
",IBM,DIAS DANIEL MANUEL;;KING RICHARD PERVIN;;LIU ZHEN;;SQUILLANTE MARK STEVEN;;XIA HONGHUI;;YU SHUN-ZHENG;;ZHANG LI,INTERNATIONAL BUSINESS MACHINES (2003-01-28),https://lens.org/112-279-103-067-796,Patent Application,yes,15,53,13,13,0,H04L41/142;;H04L47/122;;H04L43/16;;H04L67/1008;;H04L67/1029;;H04L67/101;;H04L67/1021;;H04L67/1012;;H04L67/1023;;H04L69/329;;H04L67/10015;;H04L67/1001;;H04L67/535;;H04L47/122;;H04L41/142;;H04L43/16;;H04L67/1008;;H04L67/101;;H04L69/329;;H04L67/1021;;H04L67/1029;;H04L67/1023;;H04L67/1012;;H04L9/40;;H04L67/535;;H04L67/1001;;H04L67/10015,H04L12/24;;H04L12/56;;H04L29/06;;H04L29/08,709/224;;709/226,0,0,,,,EXPIRED
177,US,A1,US 2008/0091826 A1,190-903-138-665-994,2008-04-17,2008,US 95264107 A,2007-12-07,US 95264107 A;;US 31533502 A,2002-12-10,APPARATUS AND METHODS FOR CO-LOCATION AND OFFLOADING OF WEB SITE TRAFFIC BASED ON TRAFFIC PATTERN RECOGNITION,"Apparatus and methods for identifying traffic patterns to web sites based on templates that characterize the arrival of traffic to the web sites are provided. Based on these templates, determinations are made as to which web sites should be co-located so as to optimize resource allocation. Specifically, web sites whose templates are complimentary, i.e. a first web site having a peak in arrival traffic at time t 1 and a second web site that has a trough in arrival traffic at time t 1 , are designated as being candidates for co-location. In addition, the present invention uses the templates identified for the traffic patterns of web sites to determine thresholds for offloading traffic to other servers. These thresholds include a first threshold at which offloading should be performed, a second threshold that takes into consideration the lead time needed to begin offloading, and a third threshold that takes into consideration a lag time needed to stop all offloading of traffic to the other servers.",DIAS DANIEL M;;KING RICHARD P;;LIU ZHEN;;SQUILLANTE MARK S;;XIA HONGHUI;;YU SHUN-ZHENG;;ZHANG LI,DIAS DANIEL M;;KING RICHARD P;;LIU ZHEN;;SQUILLANTE MARK S;;XIA HONGHUI;;YU SHUN-ZHENG;;ZHANG LI,,https://lens.org/190-903-138-665-994,Patent Application,yes,30,7,13,13,0,H04L41/142;;H04L47/122;;H04L43/16;;H04L67/1008;;H04L67/1029;;H04L67/101;;H04L67/1021;;H04L67/1012;;H04L67/1023;;H04L69/329;;H04L67/10015;;H04L67/1001;;H04L67/535;;H04L47/122;;H04L41/142;;H04L43/16;;H04L67/1008;;H04L67/101;;H04L69/329;;H04L67/1021;;H04L67/1029;;H04L67/1023;;H04L67/1012;;H04L9/40;;H04L67/535;;H04L67/1001;;H04L67/10015,H04L12/24;;G06F15/173;;H04L12/56;;H04L29/06;;H04L29/08,709/226,0,0,,,,EXPIRED
178,US,B2,US 7386611 B2,149-176-181-813-257,2008-06-10,2008,US 31533502 A,2002-12-10,US 31533502 A,2002-12-10,Apparatus and methods for co-location and offloading of web site traffic based on traffic pattern recognition,"Apparatus and methods for identifying traffic patterns to web sites based on templates that characterize the arrival of traffic to the web sites are provided. Based on these templates, determinations are made as to which web sites should be co-located so as to optimize resource allocation. Specifically, web sites whose templates are complimentary, i.e. a first web site having a peak in arrival traffic at time t 1 and a second web site that has a trough in arrival traffic at time t 1 , are designated as being candidates for co-location. In addition, the present invention uses the templates identified for the traffic patterns of web sites to determine thresholds for offloading traffic to other servers. These thresholds include a first threshold at which offloading should be performed, a second threshold that takes into consideration the lead time needed to begin offloading, and a third threshold that takes into consideration a lag time needed to stop all offloading of traffic to the other servers.",IBM,DIAS DANIEL MANUEL;;KING RICHARD PERVIN;;LIU ZHEN;;SQUILLANTE MARK STEVEN;;XIA HONGHUI;;YU SHUN-ZHENG;;ZHANG LI,INTERNATIONAL BUSINESS MACHINES (2003-01-28),https://lens.org/149-176-181-813-257,Granted Patent,yes,15,51,13,13,0,H04L41/142;;H04L47/122;;H04L43/16;;H04L67/1008;;H04L67/1029;;H04L67/101;;H04L67/1021;;H04L67/1012;;H04L67/1023;;H04L69/329;;H04L67/10015;;H04L67/1001;;H04L67/535;;H04L47/122;;H04L41/142;;H04L43/16;;H04L67/1008;;H04L67/101;;H04L69/329;;H04L67/1021;;H04L67/1029;;H04L67/1023;;H04L67/1012;;H04L9/40;;H04L67/535;;H04L67/1001;;H04L67/10015,G06F15/173;;H04L12/24;;H04L12/56;;H04L29/06;;H04L29/08,709/224,2,0,,,"YOR920020222US1, Halim et al., Apparatus and Methods for Classification of Web Sites, Dec. 10, 2002.;;""Cluster Analysis"", StaSoft, Oct. 17, 2000, retrieved Apr. 3, 2006 from http://web.archive.org/web/20001017022353/http://www.statsoft.com/textbook/stcluan.html.",ACTIVE
179,US,A1,US 2005/0216490 A1,037-655-970-264-075,2005-09-29,2005,US 91669504 A,2004-08-11,US 91669504 A;;US 55693904 P,2004-03-26,Automatic database diagnostic usage models,One or more usage models are provided for a database. Each usage model includes a set of rules that are used to analyze database performance. A usage model in one or more usage models is determined. Database information is determined based on the usage model. The database information is then analyzed based on rules associated with the usage model. One or more performance problems are determined based on the analysis.,ORACLE INT CORP,DIAS KARL;;WOOD GRAHAM S;;GUPTA SHIVANI;;KUMAR SUSHIL;;RAMACHER MARK;;SHAFT URI;;TAN LENG LENG;;VENKATARAMANI VENKATESHWARAN,ORACLE INTERNATIONAL CORPORATION (2004-07-22),https://lens.org/037-655-970-264-075,Patent Application,yes,42,12,2,2,0,G06F16/21;;G06F16/21,G06F7/00;;G06F17/30,707/100,0,0,,,,ACTIVE
180,AU,A,AU 1993/049289 A,000-658-061-240-050,1994-04-26,1994,AU 1993/049289 A,1993-09-17,US 9308833 W;;US 95453992 A,1992-09-29,Long chain branched polymers and a process to make long chain branched polymers,,EXXON CHEMICAL PATENTS INC,BRANT PATRICK;;CANICH JO ANN MARIE;;DIAS ANTHONY JAY;;BAMBERGER ROBERT LEE;;LICCIARDI GARY FREDERICK;;HENRICHS PAUL MARK,,https://lens.org/000-658-061-240-050,Patent Application,no,0,0,7,7,0,C08F10/02;;C08F110/02;;C08F210/16;;C08F290/042;;C08F290/042;;C08F10/02;;C08F110/02;;C08F210/16;;C08F210/08;;C08F2/38;;C08F4/65908;;C08F4/65927;;C08F2500/12;;C08F2500/09;;C08L2314/06;;Y10S526/943,C08F4/642;;C08F4/6592;;C08F8/00;;C08F10/00;;C08F10/02;;C08F110/02;;C08F210/16;;C08F290/00;;C08F290/04,,0,0,,,,PENDING
181,TW,A,TW 200422860 A,013-616-180-890-300,2004-11-01,2004,TW 92132890 A,2003-11-24,US 31533502 A,2002-12-10,Apparatus and methods for co-location and offloading of web site traffic based on traffic pattern recognition,"Apparatus and methods for identifying traffic patterns to web sites based on templates that characterize the arrival of traffic to the web sites are provided. Based on these templates, determinations are made as to which web sties should be co-located so as to optimize resource allocation. Specifically, web sites whose templates are complimentary, i.e. a first web site having a peak in arrival traffic at time t1 and a second web site that has trough in arrival traffic at time t1, are designated as being candidates for co-location. In addition, the present invention uses the templates identified for the traffic patterns of web sites to determine thresholds for offloading traffic to other servers. These thresholds include a first threshold at which offloading should be performed, a second threshold that takes into consideration the lead time needed to begin offloading, and a third threshold that takes into consideration a lag time needed to stop a 11 offloading of traffic to the other servers.",IBM,DIAS DANIEL MANUEL;;KING RICHARD PERVIN;;LIU ZHEN;;SQUILLANTE MARK STEVEN;;XIA HONGHUI;;YU SHUN-ZHENG;;ZHANG LI,,https://lens.org/013-616-180-890-300,Patent of Addition,no,0,3,13,13,0,H04L41/142;;H04L47/122;;H04L43/16;;H04L67/1008;;H04L67/1029;;H04L67/101;;H04L67/1021;;H04L67/1012;;H04L67/1023;;H04L69/329;;H04L67/10015;;H04L67/1001;;H04L67/535;;H04L47/122;;H04L41/142;;H04L43/16;;H04L67/1008;;H04L67/101;;H04L69/329;;H04L67/1021;;H04L67/1029;;H04L67/1023;;H04L67/1012;;H04L9/40;;H04L67/535;;H04L67/1001;;H04L67/10015,H04L12/24;;H04L12/56;;H04L29/06;;H04L29/08,,0,0,,,,EXPIRED
182,CA,A1,CA 2508047 A1,079-022-572-226-341,2004-06-24,2004,CA 2508047 A,2003-11-14,EP 0315016 W;;US 31533502 A,2002-12-10,APPARATUS AND METHODS FOR CO-LOCATION AND OFFLOADING OF WEB SITE TRAFFIC BASED ON TRAFFIC PATTERN RECOGNITION,"Apparatus and methods for identifying traffic patterns to web sites based on templates that characterize the arrival of traffic to the web sites are provided. Based on these templates, determinations are made as to which web sites should be co-located so as to optimize resource allocation. Specifically, web sites whose templates are complimentary, i.e. a first web site having a peak in arrival traffic at time t1 and a second web site that has a trough in arrival traffic at time tl, are designated as being candidates for co-location. In addition, the present invention uses the templates identified for the traffic patterns of web sites to determine thresholds for offloading traffic to other servers. These thresholds include a first threshold at which offloading should be performed, a second threshold that takes into consideration the lead time needed to begin offloading, and a third threshold that takes into consideration a lag time needed to stop all offloading of traffic to the other servers.",IBM,KING RICHARD PERVIN;;YU SHUNG-ZHENG;;XIA HONGHUI;;LIU ZHEN;;DIAS DANIEL MANUEL;;ZHANG LI;;SQUILLANTE MARK STEVEN,,https://lens.org/079-022-572-226-341,Patent Application,no,0,0,13,13,0,H04L41/142;;H04L47/122;;H04L43/16;;H04L67/1008;;H04L67/1029;;H04L67/101;;H04L67/1021;;H04L67/1012;;H04L67/1023;;H04L69/329;;H04L67/10015;;H04L67/1001;;H04L67/535;;H04L47/122;;H04L41/142;;H04L43/16;;H04L67/1008;;H04L67/101;;H04L69/329;;H04L67/1021;;H04L67/1029;;H04L67/1023;;H04L67/1012;;H04L9/40;;H04L67/535;;H04L67/1001;;H04L67/10015,H04L12/24;;H04L12/56;;H04L29/06;;H04L29/08,,0,0,,,,DISCONTINUED
183,WO,A1,WO 2004/054197 A1,161-027-502-606-853,2004-06-24,2004,EP 0315016 W,2003-11-14,US 31533502 A,2002-12-10,APPARATUS AND METHODS FOR CO-LOCATION AND OFFLOADING OF WEB SITE TRAFFIC BASED ON TRAFFIC PATTERN RECOGNITION,"Apparatus and methods for identifying traffic patterns to web sites based on templates that characterize the arrival of traffic to the web sites are provided. Based on these templates, determinations are made as to which web sites should be co-located so as to optimize resource allocation. Specifically, web sites whose templates are complimentary, i.e. a first web site having a peak in arrival traffic at time t1 and a second web site that has a trough in arrival traffic at time tl, are designated as being candidates for co-location. In addition, the present invention uses the templates identified for the traffic patterns of web sites to determine thresholds for offloading traffic to other servers. These thresholds include a first threshold at which offloading should be performed, a second threshold that takes into consideration the lead time needed to begin offloading, and a third threshold that takes into consideration a lag time needed to stop all offloading of traffic to the other servers.",IBM;;IBM FRANCE,DIAS DANIEL MANUEL;;LIU ZHEN;;SQUILLANTE MARK STEVEN;;XIA HONGHUI;;YU SHUNG-ZHENG;;ZHANG LI;;KING RICHARD PERVIN,,https://lens.org/161-027-502-606-853,Patent Application,yes,4,1,13,13,0,H04L41/142;;H04L47/122;;H04L43/16;;H04L67/1008;;H04L67/1029;;H04L67/101;;H04L67/1021;;H04L67/1012;;H04L67/1023;;H04L69/329;;H04L67/10015;;H04L67/1001;;H04L67/535;;H04L47/122;;H04L41/142;;H04L43/16;;H04L67/1008;;H04L67/101;;H04L69/329;;H04L67/1021;;H04L67/1029;;H04L67/1023;;H04L67/1012;;H04L9/40;;H04L67/535;;H04L67/1001;;H04L67/10015,H04L12/24;;H04L12/56;;H04L29/06;;H04L29/08,,1,1,068-889-970-202-452,10.1016/s1389-1286(99)00011-0,"BAKER S M ET AL: ""Distributed cooperative Web servers"", COMPUTER NETWORKS, ELSEVIER SCIENCE PUBLISHERS B.V., AMSTERDAM, NL, vol. 31, no. 11-16, 17 May 1999 (1999-05-17), pages 1215 - 1229, XP004304550, ISSN: 1389-1286",PENDING
184,RU,A,RU 95110681 A,077-455-345-580-827,1997-01-10,1997,RU 95110681 A,1995-04-28,US 95453992 A,1992-09-29,LONG-CHAIN BRANCHED POLYMERS AND PROCESS FOR PREPARING LONG-CHAIN BRANCHED POLYMERS,FIELD: chemistry of polymers. SUBSTANCE: claimed invention describes new polymer and process for preparing polymers containing long chain linear side branchings. Long chain linear branchings are located at frequency of less than 5 branchings per 1000 carbon atoms of main chains. Some branchings have molecular weight which is greater than critical value of the molecular weight for intertwining polymer chains. Polymer containing long chain linear branchings are prepared by introducing alpha-olefin macromolecule in the polymerization process in solution or suspension in the presence of metallocene catalyst. Polymers have superb processibility in melt and superb mechanical properties of solid polymers. Polymers are suitable to be processed into various products by standard methods. EFFECT: more efficient preparation process.,EXXON CHEMICAL PATENTS INC,PATRIK BREHNT;;DZHO EHNN MARI KANICH;;EHNTONI DZHEJ DIAS;;ROBERT LI BAMBERGER;;GEHRI FREDERIK LICHCHARDI;;POL MARK KHENRICHS,,https://lens.org/077-455-345-580-827,Patent Application,no,0,0,7,7,0,C08F290/042;;C08F290/042;;C08F2/38;;C08F4/65908;;C08F4/65927;;C08F10/02;;C08F10/02;;C08F110/02;;C08F110/02;;C08F210/08;;C08F210/16;;C08F210/16;;C08F2500/09;;C08F2500/12;;C08L2314/06;;Y10S526/943,C08F4/642;;C08F4/6592;;C08F8/00;;C08F10/00;;C08F10/02;;C08F110/02;;C08F210/16;;C08F290/00;;C08F290/04,,0,0,,,,PENDING
185,EP,A1,EP 0662980 A1,003-129-831-548-840,1995-07-19,1995,EP 93921669 A,1993-09-17,US 9308833 W;;US 95453992 A,1992-09-29,LONG CHAIN BRANCHED POLYMERS AND A PROCESS TO MAKE LONG CHAIN BRANCHED POLYMERS.,,EXXON CHEMICAL PATENTS INC,BRANT PATRICK;;CANICH JO ANN MARIE;;DIAS ANTHONY JAY;;BAMBERGER ROBERT LEE;;LICCIARDI GARY FREDERICK;;HENRICHS PAUL MARK,,https://lens.org/003-129-831-548-840,Patent Application,yes,0,0,7,7,0,C08F290/042;;C08F290/042;;C08F2/38;;C08F4/65908;;C08F4/65927;;C08F10/02;;C08F10/02;;C08F110/02;;C08F110/02;;C08F210/08;;C08F210/16;;C08F210/16;;C08F2500/09;;C08F2500/12;;C08L2314/06;;Y10S526/943,C08F4/642;;C08F4/6592;;C08F8/00;;C08F10/00;;C08F10/02;;C08F110/02;;C08F210/16;;C08F290/00;;C08F290/04,,1,0,,,See references of WO 9407930A1,DISCONTINUED
186,WO,A1,WO 1994/007930 A1,041-739-281-336-961,1994-04-14,1994,US 9308833 W,1993-09-17,US 95453992 A,1992-09-29,LONG CHAIN BRANCHED POLYMERS AND A PROCESS TO MAKE LONG CHAIN BRANCHED POLYMERS,A novel polymer and process for producing polymers incorporating linear long chain side branches are provided. The long chain linear branches occur at a frequency of less than 5.0 branches per 1000 carbon atom of the main polymer chains with at least some branches having a molecular weight greater than the critical molecular weight for entanglement of the polymer. The linear long chain branched polymers are produced by alpha-olefin macromolecule incorporation during bridged metallocene catalyst polymerization in solution and slurry processes. The polymers are characterized by superior processability characteristics of the polymer melts and superior mechanical characteristics of the solid polymers. The polymers are useful for fabrication into a wide variety of articles by conventional fabrication techniques.,EXXON CHEMICAL PATENTS INC,BRANT PATRICK;;CANICH JO ANN MARIE;;DIAS ANTHONY JAY;;BAMBERGER ROBERT LEE;;LICCIARDI GARY FREDERICK;;HENRICHS PAUL MARK,,https://lens.org/041-739-281-336-961,Patent Application,yes,5,90,7,7,0,C08F290/042;;C08F290/042;;C08F2/38;;C08F4/65908;;C08F4/65927;;C08F10/02;;C08F10/02;;C08F110/02;;C08F110/02;;C08F210/08;;C08F210/16;;C08F210/16;;C08F2500/09;;C08F2500/12;;C08L2314/06;;Y10S526/943,C08F4/642;;C08F4/6592;;C08F8/00;;C08F10/00;;C08F10/02;;C08F110/02;;C08F210/16;;C08F290/00;;C08F290/04,,0,0,,,,PENDING
187,EP,A1,EP 1597889 A1,131-856-078-299-507,2005-11-23,2005,EP 03767833 A,2003-11-14,EP 0315016 W;;US 31533502 A,2002-12-10,APPARATUS AND METHODS FOR CO-LOCATION AND OFFLOADING OF WEB SITE TRAFFIC BASED ON TRAFFIC PATTERN RECOGNITION,,IBM,DIAS DANIEL MANUEL;;LIU ZHEN;;SQUILLANTE MARK STEVEN;;XIA HONGHUI;;YU SHUNG-ZHENG;;ZHANG LI;;KING RICHARD PERVIN,,https://lens.org/131-856-078-299-507,Patent Application,yes,0,0,13,13,0,H04L41/142;;H04L47/122;;H04L43/16;;H04L67/1008;;H04L67/1029;;H04L67/101;;H04L67/1021;;H04L67/1012;;H04L67/1023;;H04L69/329;;H04L67/10015;;H04L67/1001;;H04L67/535;;H04L47/122;;H04L41/142;;H04L43/16;;H04L67/1008;;H04L67/101;;H04L69/329;;H04L67/1021;;H04L67/1029;;H04L67/1023;;H04L67/1012;;H04L9/40;;H04L67/535;;H04L67/1001;;H04L67/10015,H04L12/24;;H04L12/56;;H04L29/06;;H04L29/08,,0,0,,,,DISCONTINUED
188,US,B2,US 8352607 B2,089-542-641-902-617,2013-01-08,2013,US 95264107 A,2007-12-07,US 95264107 A;;US 31533502 A,2002-12-10,Co-location and offloading of web site traffic based on traffic pattern recognition,"Identifying traffic patterns to web sites based on templates that characterize the arrival of traffic to the web sites is provided. Based on these templates, determinations are made as to which web sites should be co-located so as to optimize resource allocation. Web sites whose templates are complimentary, i.e. a first web site having a peak in arrival traffic at time t 1 and a second web site that has a trough in arrival traffic at time t 1 , are designated as being candidates for co-location. In addition, the templates identified for the traffic patterns of web sites are used to determine thresholds for offloading traffic to other servers. These thresholds include a first threshold at which offloading should be performed, a second threshold that takes into consideration the lead time needed to begin offloading, and a third threshold that takes into consideration a lag time needed to stop offloading of traffic.",IBM;;DIAS DANIEL MANUEL;;KING RICHARD PERVIN;;LIU ZHEN;;SQUILLANTE MARK STEVEN;;XIA HONGHUI;;YU SHUN-ZHENG;;ZHANG LI,DIAS DANIEL MANUEL;;KING RICHARD PERVIN;;LIU ZHEN;;SQUILLANTE MARK STEVEN;;XIA HONGHUI;;YU SHUN-ZHENG;;ZHANG LI,,https://lens.org/089-542-641-902-617,Granted Patent,yes,31,4,13,13,0,H04L41/142;;H04L47/122;;H04L43/16;;H04L67/1008;;H04L67/1029;;H04L67/101;;H04L67/1021;;H04L67/1012;;H04L67/1023;;H04L69/329;;H04L67/10015;;H04L67/1001;;H04L67/535;;H04L47/122;;H04L41/142;;H04L43/16;;H04L67/1008;;H04L67/101;;H04L69/329;;H04L67/1021;;H04L67/1029;;H04L67/1023;;H04L67/1012;;H04L9/40;;H04L67/535;;H04L67/1001;;H04L67/10015,G01R31/08;;G06F15/173;;G06F7/00;;H04L12/24;;H04L12/56;;H04L29/06;;H04L29/08,709/226;;709/224;;709/225;;370/241;;707/803,15,1,068-889-970-202-452,10.1016/s1389-1286(99)00011-0,"""Cluster Analysis"", StaSoft, Oct. 17, 2000, retrieved Apr. 3, 2006 from http: //web.archive.org/web/20001017022353/hftp://www.statsoft.com/textbook/stcluan.html.;;Baker et al., ""Distributed Cooperative Web Servers,"" Computer Networks, 31(11-16):1215-1229, May 1999.;;Liu et al., ""Profile-Based Traffic Characterization of Commercial Web Sites,"" Proceedings of the 18th International Teletraffic Congress, 5a:231-240, 2003.;;Marchette, ""A Statistical Method for Profiling Network Traffic,"" Proceedings of the Workshop on Intrusion Detection and Network Monitoring, Berkeley, California, pp. 119-128, Apr. 9-12, 1999.;;Office Action regarding U.S. Appl. No. 101315,335, dated Mar. 3, 2006, 11 pages.;;Response to Office Action regarding U.S. Appl. No. 10/315,335, dated Jun. 5, 2006, 15 pages.;;Final Office Action regarding U.S. Appl. No. 10/315,335, dated Jul. 19, 2006, 12 pages.;;Office Action regarding U.S. Appl. No. 10/315,335, dated Feb. 8, 2007, 5 pages.;;Response to Office Action regarding U.S. Appl. No. 10/315,335, dated May 7, 2007, 15 pages.;;Notice of Allowance regarding U.S. Appl. No. 10/315,335, dated Aug. 22, 2007, 6 pages.;;Office Action regarding U.S. Appl. No. 10/315,705, dated Apr. 10, 2006, 10 pages.;;Final Office Action regarding U.S. Appl. No. 10/315,705, dated Sep. 15, 2006, 10 pages.;;Appeal Brief regarding U.S. Appl. No. 10/315,705, dated Jan. 8, 2007, 34 pages.;;Decision on Appeal regarding U.S. Appl. No. 10/315,705, dated Feb. 2, 2010, 17 pages.;;Notice of Allowance regarding U.S. Appl. No. 10/315,705, dated Apr. 30, 2010, 14 pages.",INACTIVE
