"#",Jurisdiction,Kind,Display Key,Lens ID,Publication Date,Publication Year,Application Number,Application Date,Priority Numbers,Earliest Priority Date,Title,Abstract,Applicants,Inventors,Owners,URL,Document Type,Has Full Text,Cites Patent Count,Cited by Patent Count,Simple Family Size,Extended Family Size,Sequence Count,CPC Classifications,IPCR Classifications,US Classifications,NPL Citation Count,NPL Resolved Citation Count,NPL Resolved Lens ID(s),NPL Resolved External ID(s),NPL Citations,Legal Status
1,US,A,US 5810712 A,180-711-660-245-416,1998-09-22,1998,US 70232996 A,1996-09-27,US 70232996 A,1996-09-27,Surgical endoscope support and pivot,"A surgical endoscope support device for supporting a surgical endoscope at an end of a support arm over, and proximate to, a surgical site of a patient, the endoscope support device comprising a support and pivot body including a socket housing and a pivot ball, the socket housing having a centrally positioned inner bore in open communication between upper and lower surfaces, the inner bore having a spherical surface, and the pivot ball, positionable within the inner bore of the socket housing, in pivotable contact with the spherical surface of the inner bore, the pivot ball including a cylindrical bore through the center of the pivot ball, the cylindrical bore having a substantially uniform inner diameter along a long axis of the cylindrical bore, and an endoscope adapter having a substantially cylindrical outer wall and a substantially cylindrical central bore, the outer wall having an outer dimension substantially equivalent to the inner diameter of the cylindrical bore of the pivot ball for a sufficiently snug fit when the endoscope adapter is positioned within the cylindrical bore, the central bore of the adapter being adaptable for slidable telescoping engagement of the surgical endoscope through the central bore.",OHIO MED INSTR CO INC,DUNN MARY ELIZABETH,SCHAERER MEDICAL USA INC (1997-09-05),https://lens.org/180-711-660-245-416,Granted Patent,yes,11,169,1,1,0,A61B90/50;;A61B90/50,A61B19/00,600/114;;604/174,1,0,,,"Brochure, OMI Surgical Products, a Division of Ohio Medical Instrument Company, Inc., Mayfield /ACCISS , 1996.",EXPIRED
2,US,A,US 690642 A,000-332-449-425-414,1902-01-07,1902,US 1900/0079030 A,1900-09-14,US 1900/0079030 A,1900-09-14,SAFETY ATTACHMENT FOR HARNESS.,,DUNN MARY AGNES,DUNN MARY AGNES,,https://lens.org/000-332-449-425-414,Granted Patent,no,0,0,1,1,0,B68B1/06;;B68B1/06,,,0,0,,,,EXPIRED
3,GB,A,GB 2492949 A,004-479-998-108-069,2013-01-23,2013,GB 201111812 A,2011-07-11,GB 201111812 A,2011-07-11,A communication system and method for remotely ordering edible and drinkable products,"An order communication system 1 and method of remotely ordering one or more edible and/or drinkable products comprises an ordering device 6 to remotely send a message 2 containing a reference code that directly relates to a product. The communication system 1 also comprises an order receiving device 14 that receives the message 2 from the ordering device 6 either directly or via a web-server. The order receiving device 14 extracts and compares the reference code with data in a look up table or database such that the related product is identified and is displayed to allow the order to be prepared. The message may be a text message or email and a response message may be sent by the order receiving device notifying the customer that the order is ready for collection. The ordering device may be a remote handheld mobile device or an electronic console, including an interactive menu.",DUNN PAUL DAMIEN;;DUNN ELIZABETH MARY,DUNN PAUL DAMIEN;;DUNN ELIZABETH MARY,,https://lens.org/004-479-998-108-069,Patent Application,no,6,1,2,2,0,G06Q30/0603;;G06Q10/00;;G06Q30/06,G06Q30/06,,0,0,,,,DISCONTINUED
4,GB,A,GB 190617176 A,181-797-394-994-305,1907-07-25,1907,GB 190617176D A,1906-07-30,GB 190617176T A,1906-07-30,A New or Improved Liquid for Controlling the Evolution of Gas from Calcium Carbide.,,DUNN HORATIO;;BERRIMAN MARY JANE,DUNN HORATIO;;BERRIMAN MARY JANE,,https://lens.org/181-797-394-994-305,Patent Application,no,0,1,1,1,0,,,,0,0,,,,DISCONTINUED
5,US,A,US 1197190 A,188-354-730-219-087,1916-09-05,1916,US 4681415 A,1915-08-23,US 4681415 A,1915-08-23,BAGGAGE-CARRIER.,,DUNN MARY E;;PERRY IDA B,DUNN MARY E;;PERRY IDA B,,https://lens.org/188-354-730-219-087,Granted Patent,no,0,17,1,1,0,A45C5/146;;A45C5/146,A45C5/14,,0,0,,,,EXPIRED
6,DE,T2,DE 69224470 T2,156-288-908-010-958,1998-06-10,1998,DE 69224470 T,1992-11-06,US 82538792 A,1992-01-24,Verfahren und Gerät zur Erzeugung von Servomarken,,FUJITSU LTD,DUNN MARY E;;NORTON DAVID E,,https://lens.org/156-288-908-010-958,Granted Patent,no,0,0,8,8,0,G11B27/3027;;G11B27/3027;;G11B20/1217;;G11B20/1217;;G11B20/1426;;G11B20/1426;;G11B2220/20;;G11B2220/20,G11B20/12;;G11B20/14;;G11B27/30,,0,0,,,,EXPIRED
7,DE,D1,DE 69224470 D1,096-474-844-694-514,1998-03-26,1998,DE 69224470 T,1992-11-06,US 82538792 A,1992-01-24,Verfahren und Gerät zur Erzeugung von Servomarken,,FUJITSU LTD,DUNN MARY E;;NORTON DAVID E,,https://lens.org/096-474-844-694-514,Granted Patent,no,0,0,8,8,0,G11B27/3027;;G11B27/3027;;G11B20/1217;;G11B20/1217;;G11B20/1426;;G11B20/1426;;G11B2220/20;;G11B2220/20,G11B20/12;;G11B20/14;;G11B27/30,,0,0,,,,EXPIRED
8,EP,B1,EP 0553409 B1,173-970-510-111-845,1998-02-18,1998,EP 92119035 A,1992-11-06,US 82538792 A,1992-01-24,Method and apparatus for generating a servo mark,,FUJITSU LTD,DUNN MARY E;;NORTON DAVID E JR,,https://lens.org/173-970-510-111-845,Granted Patent,yes,3,0,8,8,0,G11B27/3027;;G11B27/3027;;G11B20/1217;;G11B20/1217;;G11B20/1426;;G11B20/1426;;G11B2220/20;;G11B2220/20,G11B20/12;;G11B20/14;;G11B27/30,,2,0,,,"PATENT ABSTRACTS OF JAPAN vol. 10, no. 160 (P-465)(2216) 7 June 1986;;PATENT ABSTRACTS OF JAPAN vol. 10, no. 344 (P-518)(2400) 20 November 1986",EXPIRED
9,US,A,US 5293276 A,077-242-546-509-497,1994-03-08,1994,US 82538792 A,1992-01-24,US 82538792 A,1992-01-24,Method for generating a reference signal from unique servo mark pattern detection,"A plurality of data sequences having patterns distinguishable from informational data are recorded as a servo mark portion of servo information on a disk. Upon decoding a predetermined number of these data sequences, a determination is made as to whether an accurately located servo mark has been detected. The detected servo mark provides a reference from which the beginning of recorded servo burst data can be located, thereby enabling all of the servo burst data to be read. The presence of defects does not inhibit the detection of the servo mark.",FUJITSU LTD,DUNN MARY E;;NORTON JR DAVID E,TOSHIBA STORAGE DEVICE CORPORATION (2009-10-14);;FUJITSU LIMITED (1992-01-21),https://lens.org/077-242-546-509-497,Granted Patent,yes,14,23,8,8,0,G11B27/3027;;G11B27/3027;;G11B20/1217;;G11B20/1217;;G11B20/1426;;G11B20/1426;;G11B2220/20;;G11B2220/20,G11B20/12;;G11B20/14;;G11B27/30,360/51;;360/49;;360/50;;360/48,2,0,,,"Patent Abstracts of Japan, vol. 10, No. 160, Jun. 7, 1986, JP A 61 013 476, Nippon Denshin Denwa.;;Patent Abstracts of Japan, vol. 10, No. 344, Nov. 20, 1986, JP A 61 144 776, Ricoh Co. Ltd.",EXPIRED
10,EP,A2,EP 0553409 A2,132-084-932-452-857,1993-08-04,1993,EP 92119035 A,1992-11-06,US 82538792 A,1992-01-24,Method and apparatus for generating a servo mark.,"A plurality of data sequences (F1 to F5) having patterns distinguishable from informational data are recorded as a servo mark portion of servo information on a disk. Upon decoding a predetermined number of these data sequences, a determination is made as to whether an accurately located servo mark has been detected. The detected servo mark provides a reference from which the beginning of recorded servo burst data can be located, thereby enabling all of the servo burst data to be read. The presence of defects does not inhibit the detection of the servo mark.",FUJITSU LTD,DUNN MARY E;;NORTON DAVID E JR,,https://lens.org/132-084-932-452-857,Patent Application,yes,0,3,8,8,0,G11B27/3027;;G11B27/3027;;G11B20/1217;;G11B20/1217;;G11B20/1426;;G11B20/1426;;G11B2220/20;;G11B2220/20,G11B20/12;;G11B20/14;;G11B27/30,,0,0,,,,EXPIRED
11,EP,A3,EP 0553409 A3,125-718-913-112-468,1993-10-20,1993,EP 92119035 A,1992-11-06,US 82538792 A,1992-01-24,METHOD AND APPARATUS FOR GENERATING A SERVO MARK,"A plurality of data sequences (F1 to F5) having patterns distinguishable from informational data are recorded as a servo mark portion of servo information on a disk. Upon decoding a predetermined number of these data sequences, a determination is made as to whether an accurately located servo mark has been detected. The detected servo mark provides a reference from which the beginning of recorded servo burst data can be located, thereby enabling all of the servo burst data to be read. The presence of defects does not inhibit the detection of the servo mark.",FUJITSU LTD,"DUNN, MARY E.;;NORTON, DAVID E., JR.",,https://lens.org/125-718-913-112-468,Search Report,yes,3,0,8,8,0,G11B27/3027;;G11B27/3027;;G11B20/1217;;G11B20/1217;;G11B20/1426;;G11B20/1426;;G11B2220/20;;G11B2220/20,G11B20/12;;G11B20/14;;G11B27/30,,2,0,,,"PATENT ABSTRACTS OF JAPAN vol. 10, no. 160 (P-465)(2216) 7 June 1986 & JP-A-61 013 476 ( NIPPON DENSHIN DENWA KOSHA );;PATENT ABSTRACTS OF JAPAN vol. 10, no. 344 (P-518)(2400) 20 November 1986 & JP-A-61 144 776 ( RICOH CO. LTD )",EXPIRED
12,WO,B1,WO 2004/095228 B1,125-554-600-163-186,2005-08-04,2005,US 2004/0007898 W,2004-03-16,US 45809603 P;;US 62803403 A,2003-03-27,SYSTEM AND METHOD FOR FACILATING A BUBSIDIARY CARD ACCOUNT WITH CONTROLLED SPENDING CAPABILITY,"The present invention provides a system and method for facilitating a subsidiary account with parental control of one or more spending limits. An exemplary system facilitates provision of funds to a subsidiary and control of the spending of subsidiary by a parent through establishment or modification of one or more spending limits. Exemplary spending limits may be configured for modifying a spending capacity so as to affect, for example, amount per transaction, per day, during a predetermined time period, at a particular merchant, at a particular chain of merchants, at a type of industry, in accordance with a predetermined rate of increase or decrease over time, number of transactions during any time period and/or any combination thereof A parent may establish or modify one or more spending limits through suitable communication means such as telephone, pager, computer, digital communications device, television, personal digital assistant, facsimile machine, or other suitable device.",AMERICAN EXPRESS TRAVEL RELATE,DUNN MELANIE;;HOBBS CHRIS;;MENICHILLI JULIE;;RANCES MARY,,https://lens.org/125-554-600-163-186,Patent Application,no,0,0,5,5,0,G06Q20/04;;G06Q20/10;;G06Q20/20;;G06Q20/227;;G06Q20/28;;G06Q20/381;;G06Q20/385;;G06Q20/405;;G06Q40/00;;G06Q40/02;;G06Q20/2295;;G06Q20/30;;G06Q40/03;;G06Q20/385;;G06Q20/381;;G06Q40/00;;G06Q20/04;;G06Q20/227;;G06Q20/20;;G06Q20/28;;G06Q20/10;;G06Q40/02;;G06Q20/405;;G06Q20/2295;;G06Q40/03,G06Q20/00;;G06Q40/00,,0,0,,,,PENDING
13,WO,A3,WO 2004/095228 A3,161-484-943-715-59X,2005-06-02,2005,US 2004/0007898 W,2004-03-16,US 45809603 P;;US 62803403 A,2003-03-27,SYSTEM AND METHOD FOR FACILATING A BUBSIDIARY CARD ACCOUNT WITH CONTROLLED SPENDING CAPABILITY,"The present invention provides a system and method for facilitating a subsidiary account with parental control of one or more spending limits. An exemplary system facilitates provision of funds to a subsidiary and control of the spending of subsidiary by a parent through establishment or modification of one or more spending limits. Exemplary spending limits may be configured for modifying a spending capacity so as to affect, for example, amount per transaction, per day, during a predetermined time period, at a particular merchant, at a particular chain of merchants, at a type of industry, in accordance with a predetermined rate of increase or decrease over time, number of transactions during any time period and/or any combination thereof A parent may establish or modify one or more spending limits through suitable communication means such as telephone, pager, computer, digital communications device, television, personal digital assistant, facsimile machine, or other suitable device.",AMERICAN EXPRESS TRAVEL RELATE,DUNN MELANIE;;HOBBS CHRIS;;MENICHILLI JULIE;;RANCES MARY,,https://lens.org/161-484-943-715-59X,Search Report,yes,1,0,5,5,0,G06Q20/04;;G06Q20/10;;G06Q20/20;;G06Q20/227;;G06Q20/28;;G06Q20/381;;G06Q20/385;;G06Q20/405;;G06Q40/00;;G06Q40/02;;G06Q20/2295;;G06Q20/30;;G06Q40/03;;G06Q20/385;;G06Q20/381;;G06Q40/00;;G06Q20/04;;G06Q20/227;;G06Q20/20;;G06Q20/28;;G06Q20/10;;G06Q40/02;;G06Q20/405;;G06Q20/2295;;G06Q40/03,G06Q20/00;;G06Q40/00,,0,0,,,,PENDING
14,WO,A2,WO 2004/095228 A2,071-298-841-021-819,2004-11-04,2004,US 2004/0007898 W,2004-03-16,US 45809603 P;;US 62803403 A,2003-03-27,SYSTEM AND METHOD FOR FACILATING A BUBSIDIARY CARD ACCOUNT WITH CONTROLLED SPENDING CAPABILITY,"The present invention provides a system and method for facilitating a subsidiary account with parental control of one or more spending limits. An exemplary system facilitates provision of funds to a subsidiary and control of the spending of subsidiary by a parent through establishment or modification of one or more spending limits. Exemplary spending limits may be configured for modifying a spending capacity so as to affect, for example, amount per transaction, per day, during a predetermined time period, at a particular merchant, at a particular chain of merchants, at a type of industry, in accordance with a predetermined rate of increase or decrease over time, number of transactions during any time period and/or any combination thereof A parent may establish or modify one or more spending limits through suitable communication means such as telephone, pager, computer, digital communications device, television, personal digital assistant, facsimile machine, or other suitable device.",AMERICAN EXPRESS TRAVEL RELATE,DUNN MELANIE;;HOBBS CHRIS;;MENICHILLI JULIE;;RANCES MARY,,https://lens.org/071-298-841-021-819,Patent Application,yes,0,6,5,5,0,G06Q20/04;;G06Q20/10;;G06Q20/20;;G06Q20/227;;G06Q20/28;;G06Q20/381;;G06Q20/385;;G06Q20/405;;G06Q40/00;;G06Q40/02;;G06Q20/2295;;G06Q20/30;;G06Q40/03;;G06Q20/385;;G06Q20/381;;G06Q40/00;;G06Q20/04;;G06Q20/227;;G06Q20/20;;G06Q20/28;;G06Q20/10;;G06Q40/02;;G06Q20/405;;G06Q20/2295;;G06Q40/03,G06Q20/00;;G06Q40/00,,0,0,,,,PENDING
15,US,A1,US 2004/0039694 A1,102-421-149-100-928,2004-02-26,2004,US 62803403 A,2003-07-24,US 62803403 A;;US 15533202 A;;US 29410701 P;;US 45809603 P,2001-05-29,System and method for facilitating a subsidiary card account with controlled spending capability,"
   The present invention provides a system and method for facilitating a subsidiary account with parental control of one or more spending limits. An exemplary system facilitates provision of funds to a subsidiary and control of the spending of subsidiary by a parent through establishment or modification of one or more spending limits. Exemplary spending limits may be configured for modifying a spending capacity so as to affect, for example, amount per transaction, per day, during a predetermined time period, at a particular merchant, at a particular chain of merchants, at a type of industry, in accordance with a predetermined rate of increase or decrease over time, number of transactions during any time period and/or any combination thereof. A parent may establish or modify one or more spending limits through suitable communication means such as telephone, pager, computer, digital communications device, television, personal digital assistant, facsimile machine, or other suitable device. 
",AMERICAN EXPRESS TRAVEL RELATE,DUNN MELANIE;;HOBBS CHRIS;;MENICHILLI JULIE;;RANCES MARY,DELIVERM CONSULTING B.V. LLC (2011-12-13);;GULA CONSULTING LIMITED LIABILITY COMPANY (2015-08-26);;AMERICAN EXPRESS TRAVEL RELATED SERVICES COMPANY INC (2003-07-17);;LIBERTY PEAK VENTURES LLC (2018-03-02);;INTELLECTUAL VENTURES ASSETS 66 LLC (2018-02-01),https://lens.org/102-421-149-100-928,Patent Application,yes,74,214,5,5,0,G06Q20/04;;G06Q20/10;;G06Q20/20;;G06Q20/227;;G06Q20/28;;G06Q20/381;;G06Q20/385;;G06Q20/405;;G06Q40/00;;G06Q40/02;;G06Q20/2295;;G06Q20/30;;G06Q40/03;;G06Q20/385;;G06Q20/381;;G06Q40/00;;G06Q20/04;;G06Q20/227;;G06Q20/20;;G06Q20/28;;G06Q20/10;;G06Q40/02;;G06Q20/405;;G06Q20/2295;;G06Q40/03,G06Q20/00;;G06Q40/00,705/39,0,0,,,,EXPIRED
16,US,B2,US 7249092 B2,172-295-124-057-542,2007-07-24,2007,US 62803403 A,2003-07-24,US 62803403 A;;US 15533202 A;;US 29410701 P;;US 45809603 P,2001-05-29,System and method for facilitating a subsidiary card account with controlled spending capability,"The present invention provides a system and method for facilitating a subsidiary account with parental control of one or more spending limits. An exemplary system facilitates the provisioning of funds to a subsidiary account and the control of the spending of the subsidiary account by a parent through establishment or modification of one or more spending limits through various communication devices. Exemplary spending limits may be configured for modifying a spending capacity so as to affect an amount per transaction, per day, during a predetermined time period, at a particular merchant, at a particular chain of merchants, at a type of industry, in accordance with a predetermined rate of increase or decrease over time, number of transactions during any time period and/or any combination thereof.",AMERICAN EXPRESS TRAVEL RELATE,DUNN MELANIE;;HOBBS CHRIS;;MENICHILLI JULIE;;RANCES MARY,DELIVERM CONSULTING B.V. LLC (2011-12-13);;GULA CONSULTING LIMITED LIABILITY COMPANY (2015-08-26);;AMERICAN EXPRESS TRAVEL RELATED SERVICES COMPANY INC (2003-07-17);;LIBERTY PEAK VENTURES LLC (2018-03-02);;INTELLECTUAL VENTURES ASSETS 66 LLC (2018-02-01),https://lens.org/172-295-124-057-542,Granted Patent,yes,75,190,5,5,0,G06Q20/04;;G06Q20/10;;G06Q20/20;;G06Q20/227;;G06Q20/28;;G06Q20/381;;G06Q20/385;;G06Q20/405;;G06Q40/00;;G06Q40/02;;G06Q20/2295;;G06Q20/30;;G06Q40/03;;G06Q20/385;;G06Q20/381;;G06Q40/00;;G06Q20/04;;G06Q20/227;;G06Q20/20;;G06Q20/28;;G06Q20/10;;G06Q40/02;;G06Q20/405;;G06Q20/2295;;G06Q40/03,G06Q20/00;;G06Q40/00,705/38;;705/35;;235/379;;235/380,3,0,,,"U.S. Appl. No. 60/083,004.;;U.S. Appl. No. 60/242,493.;;""Florida Attorney Patents Smart Card Business Process"". Card News. Potomac: Apr. 5, 2000. vol. 15, Issue 7, p. 1.",EXPIRED
17,PE,A1,PE 20010140 A1,190-836-675-602-705,2001-04-21,2001,PE 0006612000 A,2000-06-28,US 34240999 A;;US 34091299 A,1999-06-28,METODO PARA ABRIR UN DISPOSITIVO DE EMPAQUE Y EXTRAER UN ARTICULO ABSORBENTE INTERLABIAL COLOCADO EN EL INTERIOR DEL MISMO,"SE REFIERE A UN PAQUETE INDIVIDUAL RESELLABLE EN COMBINACION CON UN DISPOSITIVO INTERLABIAL, QUE COMPRENDE: A) UN PAQUETE QUE TIENE UN EJE LONGITUDINAL, UNA PORCION SUPERIOR, UNA PORCION INFERIOR OPUESTA A LA ANTERIOR, UNA PRIMERA SUPERFICIE QUE ES INTERNA Y UNA SEGUNDA SUPERFICIE EXTERNA, Y ESTA DOBLADO POR EL EJE LONGITUDINAL PARA CONFORMAR DOS MEDIOS, DONDE UNA MITAD DE LA SUPERFICIE INTERNA DEL PAQUETE DOBLADO ESTA DE CARA HACIA LA OTRA MITAD DE LA SUPERFICIE INTERNA DEL PAQUETE DOBLADO; ESTANDO ASIMISMO DICHO PAQUETE SELLADO EN POR LO MENOS TRES LADOS, SIENDO AL MENOS UNO DE LOS LADOS SELLADOS RESELLABLE; Y, B) UN DISPOSITIVO INTERLABIAL ABSORBENTE POSICIONADO ENTRE LAS MITADES DEL PAQUETE, QUE TIENE; i) UN EJE LONGITUDINAL; ii) UNA PORCION ABSORBENTE CON UNA PRIMERA Y SEGUNDA SUPERFICIES; iii) UNA PORCION IMPERMEABLE A LOS CONTAMINANTES ANEXA A LA SEGUNDA SUPERFICIE DE (ii); Y, iv) UNA PORCION PARA ASIR ANEXA A (iii), LA MISMA QUE ES ASIDA POR EL USUARIO PARA RETIRAR EL DISPOSITIVO DE (A) FACILITANDO ASI QUE DICHO DISPOSITIVO INTERLABIAL ABSORBENTE SEA REMOVIDO HIGIENICAMENTE DEL PAQUETE, EVITANDO QUE SE CONTAMINE LA PRIMERA SUPERFICIE DE LA PORCION ABSORBENTE DEL MISMO",PROCTER & GAMBLE,THOMAS WARD OSBORN III;;DIANE DUNN FARRIS;;ALICIA MARY HALL,,https://lens.org/190-836-675-602-705,Patent Application,no,0,0,4,6,0,A61F13/55165;;A61F13/47209,A61F13/15;;A61F13/20,,0,0,,,,DISCONTINUED
18,WO,A1,WO 2001/000128 A1,194-377-174-639-636,2001-01-04,2001,US 0017736 W,2000-06-27,US 34240999 A;;US 34091299 A,1999-06-28,INDIVIDUAL PACKAGES FOR ABSORBENT INTERLABIAL ABSORBENT ARTICLE,"The invention provides an individual package in combination with an absorbent interlabial device. The package has a longitudinal axis, a top portion, a bottom portion positioned oppositely to the top portion, a first surface and a second surface. The package may be folded about the longitudinal axis to form two halves or it may be formed from one or more sheets fitted together to form the package. The package may be re-sealable. An absorbent interlabial device is positioned within the package. The absorbent interlabial device is readily retrievable from the package such that a user neither touches nor contaminates the absorbent portion of the absorbent interlabial device with any part of her hand prior to the use and in using the absorbent interlabial device.",PROCTER & GAMBLE,FARRIS DIANE DUNN;;HALL ALICIA MARY;;OBSORN THOMAS WARD III,,https://lens.org/194-377-174-639-636,Patent Application,yes,3,2,4,6,0,A61F13/55165;;A61F13/47209,A61F13/15,,0,0,,,,PENDING
19,TW,B,TW 450802 B,008-728-351-574-544,2001-08-21,2001,TW 89112730 A,2000-09-25,US 34240999 A;;US 34091299 A,1999-06-28,Method for opening an individual package and retrieving an absorbent interlabial device therein,"The invention provides an individual package in combination with an absorbent interlabial device. The package has a longitudinal axis, a top portion, a bottom portion positioned oppositely to the top portion, a first surface and a second surface. The package may be folded about the longitudinal axis to form two halves or it may be formed from one more sheets fitted together to form the package. The package may be re-sealable. An absorbent interlabial device is positioned within the package. The absorbent interlabial device is readily retrievable from the package such that a user neither touches nor contaminates the absorbent portion of the absorbent interlabial device with any part of her hand prior to the use and in using the absorbent interlabial device.",PROCTER & GAMBLE,FARRIS DIANE DUNN;;HALL ALICIA MARY;;OBSORN THOMAS WARD III,,https://lens.org/008-728-351-574-544,Granted Patent,no,0,10,4,6,0,A61F13/47209;;A61F13/55165,A61F13/15,,0,0,,,,EXPIRED
20,US,A,US 6131736 A,021-136-868-303-386,2000-10-17,2000,US 34091299 A,1999-06-28,US 34091299 A,1999-06-28,Packaging device for an interlabial absorbent article,"The invention provides an individual package in combination with an absorbent interlabial device. The package has a longitudinal axis, a top portion, a bottom portion positioned oppositely to the top portion, a first surface and a second surface. The package may be folded about the longitudinal axis to form two halves or it may be formed from one more sheets fitted together to form the package. The package may be re-sealable. An absorbent interlabial device is positioned within the package. The absorbent interlabial device is readily retrievable from the package such that a user neither touches nor contaminates the absorbent portion of the absorbent interlabial device with any part of her hand prior to the use and in using the absorbent interlabial device.",PROCTER & GAMBLE,FARRIS DIANE DUNN;;HALL ALICIA MARY;;OSBORN III THOMAS WARD,PROCTER & GAMBLE COMPANY THE (1999-07-27),https://lens.org/021-136-868-303-386,Granted Patent,yes,8,83,1,6,0,A61F13/47209;;A61F13/47209;;A61F13/15211;;A61F13/15211;;A61F13/55165;;A61F13/55165,A61F13/15,206/440;;604/385.1,0,0,,,,EXPIRED
21,US,B1,US 6203512 B1,161-886-751-781-367,2001-03-20,2001,US 34240999 A,1999-06-28,US 34240999 A,1999-06-28,Method for opening a packaging device and retrieving an interlabial absorbent article placed therein,"The invention provides an individual package in combination with an absorbent interlabial device. The package has a longitudinal axis, a top portion, a bottom portion positioned oppositely to the top portion, a first surface and a second surface. The package may be folded about the longitudinal axis to form two halves or it may be formed from one more sheets fitted together to form the package. The package may be re-sealable. An absorbent interlabial device is positioned within the package. The absorbent interlabial device is readily retrievable from the package such that a user neither touches nor contaminates the absorbent portion of the absorbent interlabial device with any part of her hand prior to the use and in using the absorbent interlabial device.",PROCTER & GAMBLE,FARRIS DIANE DUNN;;HALL ALICIA MARY;;OSBORN III THOMAS WARD,PROCTER & GAMBLE COMPANY THE (1999-07-27),https://lens.org/161-886-751-781-367,Granted Patent,yes,3,82,1,6,0,A61F13/55165;;A61F13/55165;;A61F13/47209;;A61F13/47209,A61F13/15,602/79;;602/57;;602/58,0,0,,,,EXPIRED
