67,US,A1,US 2023/0032771 A1,079-065-103-217-039,2023-02-02,2023,US 202217814462 A,2022-07-22,US 202217814462 A;;US 202163226723 P,2021-07-28,SYSTEM AND METHOD FOR INTERACTIVE THREE-DIMENSIONAL PREVIEW,"Three-dimensional data can be synchronized between a first electronic device and a second electronic device. A content creation application may be running on the first electronic device and may utilize a data file describing a three-dimensional content item. A two-dimensional representation of the content item may be displayed on the first electronic device. A user may request to preview the two-dimensional representation of the content item in three-dimensions. The first electronic device may initiate a data transfer with the second electronic device. The three-dimensional data of the data file may be transferred, via a communication link, from the content creation of the first electronic device to a three-dimensional graphic rendering application at the second electronic device. The three-dimensional graphic rendering application may generate a preview of the content item in three-dimensions based on the received three-dimensional data.",APPLE INC,ZION PETER G;;CASELLA TYLER L;;SHAIK OMAR;;LOGGINS BENJAMIN B;;PEYTON ERIC S;;DEMPSEY CHRISTOPHER H,APPLE INC (2022-06-29),https://lens.org/079-065-103-217-039,Patent Application,yes,2,3,4,4,0,G02B27/017;;G06T15/005;;G02B27/0172;;G02B2027/014;;G06T2200/24;;G06T2210/32;;G06T2200/08;;G02B27/017;;G06T19/003,G06T19/00;;G02B27/01;;G06T15/00,,0,0,,,,PENDING
68,CA,A1,CA 2373458 A1,048-146-698-718-560,2000-11-16,2000,CA 2373458 A,2000-05-10,US 30961499 A;;US 0012678 W,1999-05-11,LAMINATED GLASS FLOOR TILE AND FLOORING MADE THEREFROM AND METHOD FOR MAKING SAME,"A laminated glass floor tile (10) is disclosed, comprising a glass plate (12) having a top side (13), a backing substrate (14) and a decorative layer (16) disposed between the glass plate (12) and the backing substrate (14). A decorative pattern (18) is on the top surface of the backing substrate. A glass flooring made using laminated glass floor tiles is also disclosed, as well as a method for making a laminated glass floor tile (10) comprising the steps of placing a decorative layer (16) between a backing substrate (14) and a glass plate (12) and laminating the glass plate (12), the backing substrate (14) and the decorative layer (16).",CONGOLEUM CORP,DEMPSEY ROBERT;;PARKER ANTHONY A;;ROHRBACHER PETER J;;WOOTTEN SCOTT M;;SHOST JOHN A;;SABO RICHARD A,,https://lens.org/048-146-698-718-560,Patent Application,no,0,2,4,4,0,B32B3/14;;B32B17/10247;;B32B17/10853;;B32B27/06;;B32B37/1027;;B32B37/12;;B32B2037/109;;B32B2310/0831;;B32B2315/08;;B32B2451/00;;B44C5/0407;;B44C5/0415;;B44C5/043;;B44C5/0438;;B44C5/0446;;E04F15/08;;Y10T428/24876;;Y10T428/162;;Y10T428/166;;Y10T428/24802;;B32B17/065;;Y10T428/24876;;Y10T428/162;;Y10T428/166;;Y10T428/24802;;B32B7/12;;B32B2419/04;;B32B3/14;;B32B37/12;;B32B2315/08;;B32B17/10853;;B32B27/06;;B32B17/06;;B32B2310/0831;;B32B2037/109;;B44C5/0446;;B44C5/0438;;B44C5/0407;;B32B2451/00;;E04F15/08;;B32B17/10247;;B44C5/0415;;B44C5/043;;B32B37/1027,B32B3/14;;B32B17/06;;B32B17/10;;B32B27/06;;B32B37/10;;B44C5/04;;E04F15/08,,0,0,,,,DISCONTINUED
69,US,B1,US 6418540 B1,009-383-056-424-004,2002-07-09,2002,US 38460299 A,1999-08-27,US 38460299 A,1999-08-27,State transfer with throw-away thread,"
    A computer system comprises an active processor and one or more spare processors. A dummy thread is created on the active processor while the active processor is running a current thread, causing the current thread to become dormant. The operating system of the active processor saves a set of internal state information for the current thread into a first memory coupled to the active processor. Each write to the first memory is duplicated in an equivalent spare memory coupled to each of the one or more spare processors. The dummy thread then activates the spare processor and de-activates the active processor. 
",LUCENT TECHNOLOGIES INC,DEMPSEY PETER ALLEN;;GOUDZWAARD DANIEL JOHN;;IACCARINO SALVATORE JOHN;;KAY STEPHEN L;;STRUBLE ANDREW BENNETT;;KOHLI DAVINDERJIT SINGH,WSOU INVESTMENTS LLC (2017-07-22);;LUCENT TECHNOLOGIES INC (1999-07-23),https://lens.org/009-383-056-424-004,Granted Patent,yes,13,12,1,1,0,G06F11/2028;;G06F11/2028;;G06F11/1658;;G06F11/1658;;G06F11/2023;;G06F11/2023;;G06F11/2038;;G06F11/2038;;G06F11/2041;;G06F11/2041;;G06F11/2048;;G06F11/2048;;G06F11/2097;;G06F11/2097,G06F11/20;;H04L1/22,714/13;;712/228,0,0,,,,EXPIRED
70,WO,A1,WO 2009/052360 A1,198-381-211-320-331,2009-04-23,2009,US 2008/0080285 W,2008-10-17,US 99962607 P,2007-10-19,EYELASH EXTENSION SYSTEM,"An eyelash extension system (200) having a backbone (204) and a plurality of eyelash extensions (202) attached to the backbone. An adhesive is applied to an application surface of the backbone, and the adhesive is selected from the group of adhesives comprising latex adhesives, solvent-borne adhesives, pressure-sensitive adhesives (PSAs), and hot melt adhesives.",PROCTER & GAMBLE;;RABE THOMAS ELLIOT;;WYATT PETER JONATHAN;;DEMPSEY NANCY TAYLOR;;MORYS MEGAN MAI;;MOIR ROBERT SCADDING;;GOLDREIN HOWELL TIMOTHY;;REEVES KATE,RABE THOMAS ELLIOT;;WYATT PETER JONATHAN;;DEMPSEY NANCY TAYLOR;;MORYS MEGAN MAI;;MOIR ROBERT SCADDING;;GOLDREIN HOWELL TIMOTHY;;REEVES KATE,,https://lens.org/198-381-211-320-331,Patent Application,yes,3,10,7,7,0,A41G5/02;;A41G5/02,A41G5/02,,0,0,,,,PENDING
71,US,A1,US 2009/0217938 A1,018-263-656-786-543,2009-09-03,2009,US 24540908 A,2008-10-03,US 24540908 A;;US 99962607 P,2007-10-19,Eyelash Extension System,"An eyelash extension system having a backbone and a plurality of eyelash extensions attached to the backbone. An adhesive is applied to an application surface of the backbone, and the adhesive is selected from the group of adhesives comprising latex adhesives, solvent-borne adhesives, pressure-sensitive adhesives (PSAs), and hot melt adhesives.",RABE THOMAS ELLIOT;;WYATT PETER JONATHAN;;DEMPSEY NANCY TAYLOR;;MORYS MEGAN MAI;;MOIR ROBERT SCADDING;;GOLDREIN HOWELL TIMOTHY;;REEVES KATE,RABE THOMAS ELLIOT;;WYATT PETER JONATHAN;;DEMPSEY NANCY TAYLOR;;MORYS MEGAN MAI;;MOIR ROBERT SCADDING;;GOLDREIN HOWELL TIMOTHY;;REEVES KATE,THE PROCTER & GAMBLE COMPANY (2009-05-14);;NOXELL CORPORATION (2016-09-23);;GALLERIA CO (2016-09-26),https://lens.org/018-263-656-786-543,Patent Application,yes,48,41,7,7,0,A41G5/02;;A41G5/02,A41G5/02,132/216;;132/53,0,0,,,,INACTIVE
72,EP,B1,EP 2203079 B1,021-101-855-590-152,2016-05-11,2016,EP 08840220 A,2008-10-17,US 2008/0080285 W;;US 99962607 P,2007-10-19,EYELASH EXTENSION SYSTEM,,PROCTER & GAMBLE,RABE THOMAS ELLIOT;;WYATT PETER JONATHAN;;DEMPSEY NANCY TAYLOR;;MORYS MEGAN MAI;;MOIR ROBERT SCADDING;;GOLDREIN HOWELL TIMOTHY;;REEVES KATE,,https://lens.org/021-101-855-590-152,Granted Patent,yes,3,0,7,7,0,A41G5/02;;A41G5/02,A41G5/02,,0,0,,,,ACTIVE
73,EP,B1,EP 2207441 B1,100-415-107-912-190,2016-09-07,2016,EP 08838985 A,2008-10-17,US 2008/0080284 W;;US 99962507 P,2007-10-19,METHODS AND APPARATUSES FOR APPLYING EYELASH EXTENSIONS,,PROCTER & GAMBLE,RABE THOMAS ELLIOT;;WYATT PETER JONATHAN;;MARSH KERI ANN;;EHRMAN MATTHEW CLAIR;;DEMPSEY NANCY TAYLOR;;MORYS MEGAN MAI;;MOIR ROBERT SCADDING;;BEENTJE PETER PAUL;;REEVES KATE,,https://lens.org/100-415-107-912-190,Granted Patent,yes,3,0,12,12,0,A41G5/02;;A41G5/02;;Y10T24/44017,A41G5/02,,0,0,,,,ACTIVE
74,US,B2,US 8616223 B2,173-428-876-489-551,2013-12-31,2013,US 201113208624 A,2011-08-12,US 201113208624 A;;US 24538408 A;;US 99962507 P,2007-10-19,Methods and apparatuses for applying eyelash extensions,"An applicator for use with an eyelash extension system that has a backbone and a backbone surface configured to be joined with a closure surface. A plurality of eyelash extensions are attached to the backbone. The applicator includes a frame having a first end and a second end spaced laterally from the first end, a rail attached to the frame and extending laterally between the first and second ends, and a cam. The cam has a cam surface configured to contact the backbone of the eyelash extension system to urge the backbone to come into contact with the closure as the cam is moved laterally along the rail.",RABE THOMAS ELLIOT;;WYATT PETER JONATHAN;;MARSH KERI ANN;;EHRMAN MATTHEW CLAIR;;DEMPSEY NANCY TAYLOR;;MORYS MEGAN MAI;;MOIR ROBERT SCADDING;;BEENTJE PETER PAUL;;REEVES KATE;;PROCTER & GAMBLE,RABE THOMAS ELLIOT;;WYATT PETER JONATHAN;;MARSH KERI ANN;;EHRMAN MATTHEW CLAIR;;DEMPSEY NANCY TAYLOR;;MORYS MEGAN MAI;;MOIR ROBERT SCADDING;;BEENTJE PETER PAUL;;REEVES KATE,THE PROCTER & GAMBLE COMPANY (2009-05-12);;NOXELL CORPORATION (2016-09-23);;GALLERIA CO (2016-09-26),https://lens.org/173-428-876-489-551,Granted Patent,yes,45,26,12,12,0,A41G5/02;;A41G5/02;;Y10T24/44017,A45D40/30;;A41G3/00;;A41G5/00;;A45D7/02;;A45D8/18;;A45D40/26,132/216;;132/212;;132/218;;132/201;;132/320,1,0,,,"PCT International Search Report, date mailed: Apr. 2, 2009, 4 pages.",ACTIVE
75,US,B2,US 8061367 B2,127-659-410-562-278,2011-11-22,2011,US 24540908 A,2008-10-03,US 24540908 A;;US 99962607 P,2007-10-19,Eyelash extension system,"An eyelash extension system having a backbone and a plurality of eyelash extensions attached to the backbone. An adhesive is applied to an application surface of the backbone, and the adhesive is selected from the group of adhesives comprising latex adhesives, solvent-borne adhesives, pressure-sensitive adhesives (PSAs), and hot melt adhesives.",RABE THOMAS ELLIOT;;WYATT PETER JONATHAN;;DEMPSEY NANCY TAYLOR;;MORYS MEGAN MAI;;MOIR ROBERT SCADDING;;GOLDREIN HOWELL TIMOTHY;;REEVES KATE;;PROCTER & GAMBLE,RABE THOMAS ELLIOT;;WYATT PETER JONATHAN;;DEMPSEY NANCY TAYLOR;;MORYS MEGAN MAI;;MOIR ROBERT SCADDING;;GOLDREIN HOWELL TIMOTHY;;REEVES KATE,THE PROCTER & GAMBLE COMPANY (2009-05-14);;NOXELL CORPORATION (2016-09-23);;GALLERIA CO (2016-09-26),https://lens.org/127-659-410-562-278,Granted Patent,yes,63,42,7,7,0,A41G5/02;;A41G5/02,A45D40/30;;A41G3/00,132/216;;132/53,1,0,,,"PCT International Search Report, date mailed: Apr. 2, 2009, 4 pages.",INACTIVE
76,WO,A2,WO 2009/052359 A2,155-711-119-362-415,2009-04-23,2009,US 2008/0080284 W,2008-10-17,US 99962507 P,2007-10-19,METHODS AND APPARATUSES FOR APPLYING EYELASH EXTENSIONS,"An applicator for use with an eyelash extension system that has a backbone and a backbone surface. A plurality of eyelash extensions are attached to the backbone. The applicator has a closure having a closure surface facing the backbone surface, and a pair of clips, each clip including a first arm, a second arm, and a pivot attached to the first arm and the second arm. A first holder is attached to each of the first arms to releasably attach the backbone to the first arms. Further there is a second holder attached to each of the second arms to releasably attach the closure to the second arms. The first and second arms are moveable between a first state wherein the first and second arms are spaced relative to each other and a second state wherein the first and second arms abut each other.",PROCTER & GAMBLE;;RABE THOMAS ELLIOT;;WYATT PETER JONATHAN;;MARSH KERI ANN;;EHRMAN MATTHEW CLAIR;;DEMPSEY NANCY TAYLOR;;MORYS MEGAN MAI;;MOIR ROBERT SCADDING;;BEENTJE PETER PAUL;;REEVES KATE,RABE THOMAS ELLIOT;;WYATT PETER JONATHAN;;MARSH KERI ANN;;EHRMAN MATTHEW CLAIR;;DEMPSEY NANCY TAYLOR;;MORYS MEGAN MAI;;MOIR ROBERT SCADDING;;BEENTJE PETER PAUL;;REEVES KATE,,https://lens.org/155-711-119-362-415,Patent Application,yes,1,8,12,12,0,A41G5/02;;A41G5/02;;Y10T24/44017,,,0,0,,,,PENDING
77,WO,A3,WO 2009/052359 A3,038-013-591-490-197,2009-06-04,2009,US 2008/0080284 W,2008-10-17,US 99962507 P,2007-10-19,METHODS AND APPARATUSES FOR APPLYING EYELASH EXTENSIONS,"An applicator (200) for use with an eyelash extension system (100) that has a backbone (104) and a backbone surface (108). A plurality of eyelash extensions (102) are attached to the backbone. The applicator has a closure (106) having a closure surface (110) facing the backbone surface, and a pair of clips (250, 252), each clip including a first arm (254), a second arm (256), and a pivot (258) attached to the first arm and the second arm. A first holder (270) is attached to each of the first arms to releasably attach the backbone to the first arms. Further there is a second holder (272) attached to each of the second arms to releasably attach the closure to the second arms. The first and second arms are moveable between a first state wherein the first and second arms are spaced relative to each other and a second state wherein the first and second arms abut each other.",PROCTER & GAMBLE;;RABE THOMAS ELLIOT;;WYATT PETER JONATHAN;;MARSH KERI ANN;;EHRMAN MATTHEW CLAIR;;DEMPSEY NANCY TAYLOR;;MORYS MEGAN MAI;;MOIR ROBERT SCADDING;;BEENTJE PETER PAUL;;REEVES KATE,RABE THOMAS ELLIOT;;WYATT PETER JONATHAN;;MARSH KERI ANN;;EHRMAN MATTHEW CLAIR;;DEMPSEY NANCY TAYLOR;;MORYS MEGAN MAI;;MOIR ROBERT SCADDING;;BEENTJE PETER PAUL;;REEVES KATE,,https://lens.org/038-013-591-490-197,Search Report,yes,3,0,12,12,0,A41G5/02;;A41G5/02;;Y10T24/44017,A41G5/02,,0,0,,,,PENDING
78,US,A1,US 2015/0020840 A1,047-753-280-171-164,2015-01-22,2015,US 201414507276 A,2014-10-06,US 201414507276 A;;US 201113208624 A;;US 24538408 A;;US 99962507 P,2007-10-19,Methods and Apparatuses for Applying Eyelash Extensions,"An applicator for use with an eyelash extension system that has a backbone and a backbone surface configured to be joined with a closure surface. A plurality of eyelash extensions are attached to the backbone. The applicator includes a frame having a first end and a second end spaced laterally from the first end, a rail attached to the frame and extending laterally between the first and second ends, and a cam. The cam has a cam surface configured to contact the backbone of the eyelash extension system to urge the backbone to come into contact with the closure as the cam is moved laterally along the rail.",PROCTER & GAMBLE,RABE THOMAS ELLIOT;;WYATT PETER JONATHAN;;ARINSMIER KERI MARSH;;EHRMAN MATTHEW CLAIR;;DEMPSEY NANCY TAYLOR;;MORYS MEGAN MAI;;MOIR ROBERT SCADDING;;BEENTJE PETER PAUL;;REEVES KATE,NOXELL CORPORATION (2016-09-23);;GALLERIA CO (2016-09-26),https://lens.org/047-753-280-171-164,Patent Application,yes,11,25,12,12,0,A41G5/02;;A41G5/02;;Y10T24/44017,A41G5/02,132/216,0,0,,,,DISCONTINUED
79,EP,A1,EP 2203079 A1,173-657-278-219-526,2010-07-07,2010,EP 08840220 A,2008-10-17,US 2008/0080285 W;;US 99962607 P,2007-10-19,EYELASH EXTENSION SYSTEM,,PROCTER & GAMBLE,RABE THOMAS ELLIOT;;WYATT PETER JONATHAN;;DEMPSEY NANCY TAYLOR;;MORYS MEGAN MAI;;MOIR ROBERT SCADDING;;GOLDREIN HOWELL TIMOTHY;;REEVES KATE,,https://lens.org/173-657-278-219-526,Patent Application,yes,0,0,7,7,0,A41G5/02;;A41G5/02,A41G5/02,,0,0,,,,ACTIVE
80,US,A1,US 2011/0290271 A1,138-446-643-723-669,2011-12-01,2011,US 201113208624 A,2011-08-12,US 201113208624 A;;US 24538408 A;;US 99962507 P,2007-10-19,Methods and Apparatuses For Applying Eyelash Extensions,"An applicator for use with an eyelash extension system that has a backbone and a backbone surface configured to be joined with a closure surface. A plurality of eyelash extensions are attached to the backbone. The applicator includes a frame having a first end and a second end spaced laterally from the first end, a rail attached to the frame and extending laterally between the first and second ends, and a cam. The cam has a cam surface configured to contact the backbone of the eyelash extension system to urge the backbone to come into contact with the closure as the cam is moved laterally along the rail.",RABE THOMAS ELLIOT;;WYATT PETER JONATHAN;;MARSH KERI ANN;;EHRMAN MATTHEW CLAIR;;DEMPSEY NANCY TAYLOR;;MORYS MEGAN MAI;;MOIR ROBERT SCADDING;;BEENTJE PETER PAUL;;REEVES KATE,RABE THOMAS ELLIOT;;WYATT PETER JONATHAN;;MARSH KERI ANN;;EHRMAN MATTHEW CLAIR;;DEMPSEY NANCY TAYLOR;;MORYS MEGAN MAI;;MOIR ROBERT SCADDING;;BEENTJE PETER PAUL;;REEVES KATE,THE PROCTER & GAMBLE COMPANY (2009-05-12);;NOXELL CORPORATION (2016-09-23);;GALLERIA CO (2016-09-26),https://lens.org/138-446-643-723-669,Patent Application,yes,0,33,12,12,0,A41G5/02;;A41G5/02;;Y10T24/44017,A45D44/00,132/216,0,0,,,,ACTIVE
81,US,B2,US 8015980 B2,144-134-122-623-309,2011-09-13,2011,US 24538408 A,2008-10-03,US 24538408 A;;US 99962507 P,2007-10-19,Methods and apparatuses for applying eyelash extensions,"An applicator for use with an eyelash extension system that has a backbone and a backbone surface. A plurality of eyelash extensions are attached to the backbone. The applicator has a closure having a closure surface facing the backbone surface, and a pair of clips, each clip including a first arm, a second arm, and a pivot attached to the first arm and the second arm. A first holder is attached to each of the first arms to releasably attach the backbone to the first arms. Further there is a second holder attached to each of the second arms to releasably attach the closure to the second arms. The first and second arms are moveable between a first state wherein the first and second arms are spaced relative to each other and a second state wherein the first and second arms abut each other.",PROCTER & GAMBLE,RABE THOMAS ELLIOT;;WYATT PETER JONATHAN;;MARSH KERI ANN;;EHRMAN MATTHEW CLAIR;;DEMPSEY NANCY TAYLOR;;MORYS MEGAN MAI;;MOIR ROBERT SCADDING;;BEENTJE PETER PAUL;;REEVES KATE,THE PROCTER & GAMBLE COMPANY (2009-05-12);;NOXELL CORPORATION (2016-09-23);;GALLERIA CO (2016-09-26),https://lens.org/144-134-122-623-309,Granted Patent,yes,65,36,12,12,0,A41G5/02;;A41G5/02;;Y10T24/44017,A41G3/00;;A41F1/00;;A44B1/04;;A44B1/18;;A44B11/25;;A44B17/00;;A45D40/26;;B42F1/00,132/201;;132/320;;24/457,1,0,,,"PCT International Search Report, date mailed: Apr. 2, 2009, 4 pages.",INACTIVE
82,US,A1,US 2009/0217939 A1,031-523-958-595-450,2009-09-03,2009,US 24538408 A,2008-10-03,US 24538408 A;;US 99962507 P,2007-10-19,Methods and Apparatuses For Applying Eyelash Extensions,"An applicator for use with an eyelash extension system that has a backbone and a backbone surface. A plurality of eyelash extensions are attached to the backbone. The applicator has a closure having a closure surface facing the backbone surface, and a pair of clips, each clip including a first arm, a second arm, and a pivot attached to the first arm and the second arm. A first holder is attached to each of the first arms to releasably attach the backbone to the first arms. Further there is a second holder attached to each of the second arms to releasably attach the closure to the second arms. The first and second arms are moveable between a first state wherein the first and second arms are spaced relative to each other and a second state wherein the first and second arms abut each other.",RABE THOMAS ELLIOT;;WYATT PETER JONATHAN;;MARSH KERI ANN;;EHRMAN MATTHEW CLAIR;;DEMPSEY NANCY TAYLOR;;MORYS MEGAN MAI;;MOIR ROBERT SCADDING;;BEENTJE PETER PAUL;;REEVES KATE,RABE THOMAS ELLIOT;;WYATT PETER JONATHAN;;MARSH KERI ANN;;EHRMAN MATTHEW CLAIR;;DEMPSEY NANCY TAYLOR;;MORYS MEGAN MAI;;MOIR ROBERT SCADDING;;BEENTJE PETER PAUL;;REEVES KATE,THE PROCTER & GAMBLE COMPANY (2009-05-12);;NOXELL CORPORATION (2016-09-23);;GALLERIA CO (2016-09-26),https://lens.org/031-523-958-595-450,Patent Application,yes,20,60,12,12,0,A41G5/02;;A41G5/02;;Y10T24/44017,A45D40/30,132/218,0,0,,,,INACTIVE
83,EP,A2,EP 2207441 A2,172-189-571-363-294,2010-07-21,2010,EP 08838985 A,2008-10-17,US 2008/0080284 W;;US 99962507 P,2007-10-19,METHODS AND APPARATUSES FOR APPLYING EYELASH EXTENSIONS,,PROCTER & GAMBLE,RABE THOMAS ELLIOT;;WYATT PETER JONATHAN;;MARSH KERI ANN;;EHRMAN MATTHEW CLAIR;;DEMPSEY NANCY TAYLOR;;MORYS MEGAN MAI;;MOIR ROBERT SCADDING;;BEENTJE PETER PAUL;;REEVES KATE,,https://lens.org/172-189-571-363-294,Patent Application,yes,0,0,12,12,0,A41G5/02;;A41G5/02;;Y10T24/44017,A41G5/02,,1,0,,,See references of WO 2009052359A2,ACTIVE
84,US,A1,US 2014/0083447 A1,156-132-933-611-359,2014-03-27,2014,US 201314094430 A,2013-12-02,US 201314094430 A;;US 201113208624 A;;US 24538408 A;;US 99962507 P,2007-10-19,Methods and Apparatuses for Applying Eyelash Extensions,"An applicator for use with an eyelash extension system that has a backbone and a backbone surface configured to be joined with a closure surface. A plurality of eyelash extensions are attached to the backbone. The applicator includes a frame having a first end and a second end spaced laterally from the first end, a rail attached to the frame and extending laterally between the first and second ends, and a cam. The cam has a cam surface configured to contact the backbone of the eyelash extension system to urge the backbone to come into contact with the closure as the cam is moved laterally along the rail.",PROCTER & GAMBLE,RABE THOMAS ELLIOT;;WYATT PETER JONATHAN;;ARINSMIER KERI MARSH;;EHRMAN MATTHEW CLAIR;;DEMPSEY NANCY TAYLOR;;MORYS MEGAN MAI;;MOIR ROBERT SCADDING;;BEENTJE PETER PAUL;;REEVES KATE NMN,,https://lens.org/156-132-933-611-359,Patent Application,yes,0,21,12,12,0,A41G5/02;;A41G5/02;;Y10T24/44017,A41G5/02,132/216,0,0,,,,DISCONTINUED
85,US,A,US 5016162 A,070-862-472-106-275,1991-05-14,1991,US 17545888 A,1988-03-30,US 17545888 A,1988-03-30,Contention revolution in a digital computer system,A method of assigning priorities and resolving bus contention in a distributed computer system is disclosed. Each system node is assigned an identifier. Priorities are reassigned at each change in bus access such that the node that most recently had access to the bus is assigned the lowest priority with the node having the next identifier in sequence being assigned the highest priority and all other nodes assigned priority in accordance with their identifier's position in the sequence. The identifiers are logically treated as organized in a circular fashion such that the lowest node identifier is considered to come next in the sequence after the highest node identifier.,DATA GENERAL CORP,EPSTEIN DAVID I;;HUMMEL MARK D;;HATALSKY JEFFREY F;;NEWMARK RONA J;;ALICANDRO ROSEMARIE;;BIXBY PETER C;;BURN DONALD D;;ENBERG ERIC H;;MARINO PAUL K;;WOODBURY PAUL W;;POGUE MICHAEL A;;DEMPSEY MORGAN J;;SHAH SHREYAUNSH R;;WAIBLE III LEO C,,https://lens.org/070-862-472-106-275,Granted Patent,yes,5,67,1,1,0,G06F13/374;;G06F13/374,G06F13/374,364/200;;340/825.5,0,0,,,,EXPIRED
86,CA,C,CA 1306310 C,176-034-275-304-31X,1992-08-11,1992,CA 551788 A,1987-11-13,CA 551788 A,1987-11-13,DISTRIBUTED COMPUTER SYSTEM,"A distributed computer system comprising a plurality of digital computers is disclosed. Unique bus means are provided within each digital computer and for interconnecting them into a distributed network. The CPU's of the digital computers are off-loaded by auxiliary seats of intelligence distributed in each computer, including a novel and flexible video display controller. An operating system is disclosed which cooperates with the computers in a manner which enhances distributed computing.",DATA GENERAL CORP,EPSTEIN DAVID I;;HUMMEL MARK D;;HATALSKY JEFFREY F;;NEWMARK RONA J;;ALICANDRO ROSEMARIE;;BIXBY PETER C;;BURN DONALD D;;ENBERG ERIC H;;MARINO PAUL K;;WOODBURY PAUL W;;POGUE MICHAEL A;;DEMPSEY MORGAN J;;SHAH SHREYAUNSH R;;WAIBLE LEO C III,,https://lens.org/176-034-275-304-31X,Granted Patent,no,0,2,1,1,0,,G06F13/16,D23540233    M,0,0,,,,EXPIRED
