25,US,B1,US 6169726 B1,143-339-488-548-30X,2001-01-02,2001,US 21393098 A,1998-12-17,US 21393098 A,1998-12-17,Method and apparatus for error free switching in a redundant duplex communication carrier system,"A method and apparatus for switching from an active to a standby controller in a redundant duplex carrier system without requiring retransmission of messages in progress during the switch. A main processor in the standby controller is periodically switched and made the active controller to ensure reliability of the system. The main processor in the active controller stops sending messages for a period of time before switching control to the standby controller. The main processor in the standby controller delays initiating any new communications until any current messages have been completed from the active controller. The main processor of the standby controller then retrieves any unprocessed messages that may have been sent to the active controller just before or during the switch from the active controller to the standby controller. The delay of new messages and retrieval of any unprocessed messages ensures that no data will be lost during the switch, thus removing the need for retransmission.",LUCENT TECHNOLOGIES INC,DEMPSEY PETER A;;STERN CLIFFORD B;;WOODS GORDON D,WSOU INVESTMENTS LLC (2017-07-22);;LUCENT TECHNOLOGIES INC (1998-12-15),https://lens.org/143-339-488-548-30X,Granted Patent,yes,9,32,1,1,0,H04Q3/54558;;H04Q2213/13104;;H04Q2213/13106;;H04Q2213/13166;;H04Q2213/13167;;H04Q2213/13396;;H04Q3/54558;;H04Q2213/13166;;H04Q2213/13106;;H04Q2213/13396;;H04Q2213/13167;;H04Q2213/13104,H04Q3/545,370/219;;370/282;;714/11,0,0,,,,EXPIRED
26,US,A1,US 2019/0183118 A1,027-230-400-656-273,2019-06-20,2019,US 201716309541 A,2017-06-26,US 201716309541 A;;US 201662357510 P;;US 2017/0039234 W,2016-07-01,SPRAY DRIFT REDUCTION,"Spray drift reductants for agrochemical formulations for use in spray drift reduction in agrochemical formulations which contain actives and/or micronutrients. The reductants are selected from alkoxylated polyol or polyamine which is optionally acyl terminated, and the formulation may optionally comprise non-ionic alkoxylate. There is also provided a method of making the formulation, and the use of the formulation in reducing spray drift on application of the agrochemical formulation to vegetation.",CRODA INC,DEMPSEY LOGAN PETER;;LINDNER GREGORY JAMES;;SUN JINXIA SUSAN,CRODA INC (2018-11-29),https://lens.org/027-230-400-656-273,Patent Application,yes,1,0,12,12,0,A01N25/06;;A01N25/30;;A01N25/06;;A01N25/30;;A01N25/06;;A01N25/30;;A01N25/04;;A01N25/10;;C08J3/03;;C08J2300/14,A01N25/30;;A01N25/04;;A01N25/10;;C08J3/03,,0,0,,,,PENDING
27,BR,B1,BR 112018077203 B1,139-096-915-222-294,2022-09-27,2022,BR 112018077203 A,2017-06-26,US 2017/0039234 W;;US 201662357510 P,2016-07-01,REDUÇÃO DE DESVIO DE ASPERSOR,"Trata-se de redutores de desvio de aspersor para formulações agroquímicas para uso em redução de desvio de aspersor em formulações agroquímicas que contêm agentes ativos e/ou micronutrientes. Os redutores são selecionados a partir de poliamina ou poliol alcoxilado que é, opcionalmente, terminado em acila, e a formulação pode compreender opcionalmente alcoxilato não iônico. Também é fornecido um método para produzir a formulação, e o uso da formulação na redução de desvio de aspersor na aplicação da formulação agroquímica à vegetação.",CRODA INC,LOGAN PETER DEMPSEY;;GREGORY JAMES LINDNER;;JINXIA SUSAN SUN,,https://lens.org/139-096-915-222-294,Granted Patent,no,0,0,12,12,0,A01N25/06;;A01N25/30;;A01N25/06;;A01N25/30;;A01N25/06;;A01N25/30;;A01N25/04;;A01N25/10;;C08J3/03;;C08J2300/14,A01N25/06;;A01N25/30,,0,0,,,,ACTIVE
28,CA,A1,CA 2260686 A1,178-466-119-708-138,1999-09-03,1999,CA 2260686 A,1999-02-04,US 3398598 A,1998-03-03,BANDWIDTH CONTROL IN A PACKET-BASED DATA SYSTEM,"A data system, such as a computer network or a telecommunications system, has a base station and a number of nodes called network interface units (NIUs). Each NIU is assigned to one of a number of groups of NIUs. The base station transmits special data to the NIUs indicating which groups of NIUs are currently authorized to transmit upstream messages to the base station, where only the authorized NIUs are allowed to transmit upstream messages. When message collisions in the upstream direction becomes a problem, the base station can reduce the number of NIU groups that are authorized at any given time to transmit upstream messages, in order to attempt to reduce the rate of message collisions. In one possible embodiment, each NIU is assigned horizontal and vertical group words that identify to which group it is assigned. The special data contain additional horizontal and vertical code words that are monitored by the NIUs. If the bits in the downstream code words appropriately match the corresponding bits in the NIU's assigned group words, then the NIU recognizes that it is authorized to transmit upstream messages to the base station. Otherwise, it is not. The horizontal and vertical code words correspond to two-dimensional patterns that indicate which subset of NIU groups are authorized at any given time. By cycling through a series of 2D patterns, the base station ensures that each NIU is authorized at least some of the time. Depending on the number of bits in the code words, a back-off scheme can be designed with different back-off levels, each of which authorizes a different number of groups to transmit. The base station can progressively decrease the rate of upstream transmission by selecting back-off levels with fewer and fewer NIU groups authorized to transmit.",LUCENT TECHNOLOGIES INC,LEE KYOO J;;WARMINK STUART;;DEMPSEY PETER ALLEN ANDREW,,https://lens.org/178-466-119-708-138,Patent Application,no,0,0,5,5,0,H04L47/788;;H04L47/828;;H04L47/70;;H04L47/828;;H04L47/788;;H04L47/70,H04L12/54;;H04L12/911,,0,0,,,,DISCONTINUED
29,US,A,US 5566314 A,168-766-278-929-925,1996-10-15,1996,US 11455393 A,1993-08-30,US 11455393 A,1993-08-30,Flash memory device employing unused cell arrays to update files,Disclosed is a circuit and method for utilizing FLASH devices as nonvolatile storage elements. Information is modified by adding a new block of data at another location in the memory rather than writing over the outdated information. An address pointer locates the latest information for each data file.,LUCENT TECHNOLOGIES INC,DEMARCO ROBERT W;;DEMPSEY PETER A A;;SARKAR CHANDAN,AT&T IPM CORP (1995-05-23);;AGERE SYSTEMS INC (2001-01-30);;AT&T CORP (1994-04-20);;LUCENT TECHNOLOGIES INC (1996-03-29);;AMERICAN TELEPHONE AND TELEGRAPH COMPANY (1993-08-27),https://lens.org/168-766-278-929-925,Granted Patent,yes,3,99,1,1,0,G06F11/1435;;G06F12/0246;;G06F12/0246;;G06F11/1435,G06F11/14;;G06F12/02,395/430;;395/412;;395/421.11,1,0,,,"N. Kannan, Technique Extends EEPROM Life, EDN, (Nov. 7, 1991), p. 275.",EXPIRED
30,AU,B2,AU 2017/288924 B2,124-122-107-587-860,2021-05-13,2021,AU 2017/288924 A,2017-06-26,US 201662357510 P;;US 2017/0039234 W,2016-07-01,Spray drift reduction,"Spray drift reductants for agrochemical formulations for use in spray drift reduction in agrochemical formulations which contain actives and/or micronutrients. The reductants are selected from alkoxylated polyol or polyamine which is optionally acyl terminated, and the formulation may optionally comprise non-ionic alkoxylate. There is also provided a method of making the formulation, and the use of the formulation in reducing spray drift on application of the agrochemical formulation to vegetation.",CRODA INC,DEMPSEY LOGAN PETER;;LINDNER GREGORY JAMES;;SUN JINXIA SUSAN,,https://lens.org/124-122-107-587-860,Granted Patent,no,3,0,12,12,0,A01N25/06;;A01N25/30;;A01N25/06;;A01N25/30;;A01N25/06;;A01N25/30;;A01N25/04;;A01N25/10;;C08J3/03;;C08J2300/14,A01N25/06;;A01N25/30,,0,0,,,,ACTIVE
31,EP,A1,EP 3478061 A1,020-950-095-938-426,2019-05-08,2019,EP 17737425 A,2017-06-26,US 201662357510 P;;US 2017/0039234 W,2016-07-01,SPRAY DRIFT REDUCTION,,CRODA INC,DEMPSEY LOGAN PETER;;LINDNER GREGORY JAMES;;SUN JINXIA SUSAN,"CRODA, INC. (2021-03-24)",https://lens.org/020-950-095-938-426,Patent Application,yes,0,0,12,12,0,A01N25/06;;A01N25/30;;A01N25/06;;A01N25/30;;A01N25/06;;A01N25/30;;A01N25/04;;A01N25/10;;C08J3/03;;C08J2300/14,A01N25/06;;A01N25/30,,0,0,,,,PENDING
32,AU,A1,AU 2017/288924 A1,125-392-162-391-381,2018-12-20,2018,AU 2017/288924 A,2017-06-26,US 201662357510 P;;US 2017/0039234 W,2016-07-01,Spray drift reduction,"Spray drift reductants for agrochemical formulations for use in spray drift reduction in agrochemical formulations which contain actives and/or micronutrients. The reductants are selected from alkoxylated polyol or polyamine which is optionally acyl terminated, and the formulation may optionally comprise non-ionic alkoxylate. There is also provided a method of making the formulation, and the use of the formulation in reducing spray drift on application of the agrochemical formulation to vegetation.",CRODA INC,DEMPSEY LOGAN PETER;;LINDNER GREGORY JAMES;;SUN JINXIA SUSAN,,https://lens.org/125-392-162-391-381,Patent Application,no,0,0,12,12,0,A01N25/06;;A01N25/30;;A01N25/06;;A01N25/30;;A01N25/06;;A01N25/30;;A01N25/04;;A01N25/10;;C08J3/03;;C08J2300/14,A01N25/06;;A01N25/30,,0,0,,,,ACTIVE
33,WO,A1,WO 2018/005340 A1,104-814-600-722-626,2018-01-04,2018,US 2017/0039234 W,2017-06-26,US 201662357510 P,2016-07-01,SPRAY DRIFT REDUCTION,"Spray drift reductants for agrochemical formulations for use in spray drift reduction in agrochemical formulations which contain actives and/or micronutrients. The reductants are selected from alkoxylated polyol or polyamine which is optionally acyl terminated, and the formulation may optionally comprise non-ionic alkoxylate. There is also provided a method of making the formulation, and the use of the formulation in reducing spray drift on application of the agrochemical formulation to vegetation.",CRODA INC,DEMPSEY LOGAN PETER;;LINDNER GREGORY JAMES;;SUN JINXIA SUSAN,,https://lens.org/104-814-600-722-626,Patent Application,yes,8,4,12,12,0,A01N25/06;;A01N25/30;;A01N25/06;;A01N25/30;;A01N25/06;;A01N25/30;;A01N25/04;;A01N25/10;;C08J3/03;;C08J2300/14,A01N25/06;;A01N25/30,,0,0,,,,PENDING
34,CN,A,CN 109310080 A,019-309-161-862-927,2019-02-05,2019,CN 201780038643 A,2017-06-26,US 201662357510 P;;US 2017/0039234 W,2016-07-01,SPRAY DRIFT REDUCTION,"Spray drift reductants for agrochemical formulations for use in spray drift reduction in agrochemical formulations which contain actives and/or micronutrients. The reductants are selected from alkoxylated polyol or polyamine which is optionally acyl terminated, and the formulation may optionally comprise non-ionic alkoxylate. There is also provided a method of making the formulation, and the use of the formulation in reducing spray drift on application of the agrochemical formulation to vegetation.",CRODA INC,DEMPSEY LOGAN PETER;;LINDNER GREGORY JAMES;;SUN JINXIA SUSAN,,https://lens.org/019-309-161-862-927,Patent Application,no,6,0,12,12,0,A01N25/06;;A01N25/30;;A01N25/06;;A01N25/30;;A01N25/06;;A01N25/30;;A01N25/04;;A01N25/10;;C08J3/03;;C08J2300/14,A01N25/06;;A01N25/30,,1,0,,,"夏纪鼎等: ""《表面活性剂和洗涤剂化学与工艺学》"", 31 May 1997, 北京：中国轻工业出版社",PENDING
35,AU,A1,AU 2014/230940 A1,042-602-531-097-481,2015-09-10,2015,AU 2014/230940 A,2014-03-11,EP 13175101 A;;US 201361783871 P;;EP 2014054628 W,2013-03-14,Cellulose ether as a drift control agent and rainfastness agent,"The present invention is directed to an agricultural composition comprising at least one agricultural chemical and at least one cellulose ether, wherein the cellulose ether is a nonionic methylethylhydroxyethyl cellulose (MEHEC) polymer. The present invention is also directed to a method for reducing spray drift during the spraying of an aqueous solution. The method comprises: providing a nonionic MEHEC polymer; combining the MEHEC polymer with at least one agricultural chemical to obtain the aqueous solution; and spraying the aqueous solution. Further, the present invention is also directed to a method for increasing resistance to rain wash off of an aqueous solution sprayed onto a surface. The method comprises: providing a nonionic MEHEC polymer; combining the MEHEC polymer with at least one agricultural chemical to obtain the aqueous solution; and spraying the aqueous solution onto the surface.",AKZO NOBEL CHEMICALS INT BV,SUN JINXIA SUSAN;;HE QIWEI;;ZHU SHAWN;;DEMPSEY LOGAN;;WALTERS MICHAEL;;WESTBYE PETER,,https://lens.org/042-602-531-097-481,Patent Application,no,0,0,12,12,0,A01N25/24;;A01N25/24;;A01N25/02;;A01N39/04;;A01N39/04;;A01N57/20,A01N25/24;;A01N39/04,,0,0,,,,INACTIVE
36,WO,A1,WO 2014/139975 A1,144-473-537-828-425,2014-09-18,2014,EP 2014054628 W,2014-03-11,US 201361783871 P;;EP 13175101 A,2013-03-14,CELLULOSE ETHER AS A DRIFT CONTROL AGENT AND RAINFASTNESS AGENT,"The present invention is directed to an agricultural composition comprising at least one agricultural chemical and at least one cellulose ether, wherein the cellulose ether is a nonionic methylethylhydroxyethyl cellulose (MEHEC) polymer. The present invention is also directed to a method for reducing spray drift during the spraying of an aqueous solution. The method comprises: providing a nonionic MEHEC polymer; combining the MEHEC polymer with at least one agricultural chemical to obtain the aqueous solution; and spraying the aqueous solution. Further, the present invention is also directed to a method for increasing resistance to rain wash off of an aqueous solution sprayed onto a surface. The method comprises: providing a nonionic MEHEC polymer; combining the MEHEC polymer with at least one agricultural chemical to obtain the aqueous solution; and spraying the aqueous solution onto the surface.",AKZO NOBEL CHEMICALS INT BV,SUN JINXIA SUSAN;;HE QIWEI;;ZHU SHAWN;;DEMPSEY LOGAN;;WALTERS MICHAEL;;WESTBYE PETER,,https://lens.org/144-473-537-828-425,Patent Application,yes,4,7,12,12,0,A01N25/24;;A01N25/24;;A01N25/02;;A01N39/04;;A01N39/04;;A01N57/20,A01N25/24;;A01N39/04,,0,0,,,,PENDING
37,US,B2,US 9717239 B2,199-108-187-146-319,2017-08-01,2017,US 201414773423 A,2014-03-11,US 201414773423 A;;EP 13175101 A;;US 201361783871 P;;EP 2014054628 W,2013-03-14,Cellulose ether as a drift control agent and rainfastness agent,"Disclosed is an agricultural composition comprising at least one agricultural chemical and at least one cellulose ether, wherein the cellulose ether is a nonionic methylethylhydroxyethyl cellulose (MEHEC) polymer as well as a method for reducing spray drift during the spraying of an aqueous solution. The method comprises combining the MEHEC polymer with at least one agricultural chemical to obtain the aqueous solution and spraying the aqueous solution. Also disclosed is a method for increasing resistance to rain wash off of an aqueous solution sprayed onto a surface.",AKZO NOBEL CHEMICALS INT BV,SUN JINXIA SUSAN;;HE QIWEI;;ZHU SHAWN;;DEMPSEY LOGAN;;WALTERS MICHAEL;;WESTBYE PETER,AKZO NOBEL CHEMICALS INTERNATIONAL B.V (2015-10-12),https://lens.org/199-108-187-146-319,Granted Patent,yes,20,0,12,12,0,A01N25/24;;A01N25/24;;A01N25/02;;A01N39/04;;A01N39/04;;A01N57/20,A01N25/02;;A01N25/24;;A01N39/04;;A01N57/20,,7,4,153-966-477-095-267;;001-807-968-718-975;;031-262-732-472-121;;020-934-708-413-121,10.1122/1.1332389;;10.1016/s0377-0257(01)00135-5;;10.1520/stp155820120079;;10.1063/1.2190469,"International Search Report and Written Opinion of International Application No. PCT/EP2014/054628, mailed Apr. 15, 2014.;;Search Report of EP Application No. 13175101.8, dated Sep. 19, 2013.;;Anna et al., “Elasto-capillary thinning and breakup of model elastic liquids,” Department of Chemical Engineering, Carnegie Institute of Technology, The Society of Rheology, Inc. (2001), pp. 115-138.;;Christanti et al., “Surface tension driven jet break up of strain-hardening polymer solutions,” Department of Chemical Engineering, Center for Complex Fluids Engineering, Carnegie Mellon University, Journal of Non-Newtonian Fluid Mechanics 100, (2001), pp. 9-26.;;Mei Li et al., “Enlist Duo Herbicide: A Novel 2,4-D Plus Glyphosate Premix Formulation with Low Potential for Off-target Movement,” (2011), ASTM International, pp. 3-15.;;Rodd et al., “Capillary Break-Up Rheometry of Low-Viscosity Elastic Fluids,” Appled Rheology vol. 15 Issue 1 (2005), pp. 12-27.;;Tirtaatmadja et al., “Drop formation and breakup of low viscosity elastic fluids: Effects of molecular weight and concentration,” Physics of Fluids 18, 043101 (2006), American Institute of Physics.",INACTIVE
38,AR,A1,AR 095490 A1,039-217-677-504-001,2015-10-21,2015,AR P140101094 A,2014-03-14,US 201361783871 P,2013-03-14,"COMPOSICIÓN AGRÍCOLA QUE COMPRENDE ÉTER DE CELULOSA COMO UN AGENTE DE CONTROL DE DISPERSIÓN Y AGENTE RESISTENTE A LA LLUVIA, MÉTODO PARA REDUCIR LA DISPERSIÓN DE LA PULVERIZACIÓN Y MÉTODO PARA AUMENTAR LA RESISTENCIA AL LAVADO POR LLUVIA DE UNA SOLUCIÓN ACUOSA","Reivindicación 1: Una composición agrícola caracterizada porque comprende al menos un producto químico agrícola y al menos un éter de celulosa, en donde el éter de celulosa es un polímero MEHEC no iónico que tiene un grado de sustitución mayor que aproximadamente 0,3 para el metilo, y un grado de sustitución mayor que aproximadamente 0,2 para el etilo, y en donde la composición está sustancialmente libre de mineral de aluminosilicato. Reivindicación 5: La composición agrícola de cualquiera de las reivindicaciones precedentes, caracterizada porque el producto químico agrícola es un pesticida. Reivindicación 8: La composición agrícola de la reivindicación 7, caracterizada porque el herbicida se selecciona a partir del grupo que consiste en glifosato, 2,4-D, y dicamba. Reivindicación 9: Un método para reducir la dispersión de la pulverización durante la pulverización de una solución acuosa, según el concepto inventivo de la reivindicación 1, caracterizado porque dicho método comprende: proporcionar un polímero MEHEC no iónico; combinar el polímero MEHEC con al menos un producto químico agrícola para obtener la solución acuosa; y pulverizar la solución acuosa, en donde el polímero MEHEC tiene un grado de sustitución mayor que aproximadamente 0,3 para el metilo y un grado de sustitución mayor que aproximadamente 0,2 para el etilo.",AKZO NOBEL CHEMICALS INT BV,QIWEI HE;;PETER WESTBYE;;MICHAEL WALTERS;;SHAWN ZHU;;JINXIA SUSAN SUN;;LOGAN DEMPSEY,,https://lens.org/039-217-677-504-001,Patent Application,no,0,0,1,1,0,,A01N25/24;;A01N39/04;;A01N57/20,,0,0,,,,PENDING
39,ES,T3,ES 2633269 T3,027-779-764-296-65X,2017-09-20,2017,ES 14708890 T,2014-03-11,US 201361783871 P;;EP 13175101 A;;EP 2014054628 W,2013-03-14,Eter de celulosa como agente de control de dispersión y agente de resistencia a la lluvia,"Una composición agrícola que comprende al menos un producto químico agrícola y al menos un éter de celulosa, en el que el éter de celulosa es un polímero MEHEC no iónico que tiene un grado de sustitución superior a 0,3 para el metilo y un grado de sustitución mayor que 0,2 para el etilo y en el que la composición contiene menos del 10% en peso de mineral de aluminosilicato.",AKZO NOBEL CHEMICALS INT BV,SUN JINXIA SUSAN;;HE QIWEI;;ZHU SHAWN;;DEMPSEY LOGAN;;WALTERS MICHAEL;;WESTBYE PETER,,https://lens.org/027-779-764-296-65X,Granted Patent,no,0,0,12,12,0,A01N25/24;;A01N25/24;;A01N25/02;;A01N39/04;;A01N39/04;;A01N57/20,A01N25/24;;A01N39/04,,0,0,,,,ACTIVE
40,BR,A2,BR 112015021940 A2,075-027-722-025-199,2017-07-18,2017,BR 112015021940 A,2014-03-11,EP 2014054628 W;;US 201361783871 P;;EP 13175101 A,2013-03-14,composição agrícola que compreende pelo menos uma substância química agrícola e pelo menos um éter de celulose; método de redução do desvio de pulverização durante a pulverização de uma solução aquosa; e método de aumento da resistência à lavagem pela chuva de uma solução aquosa pulverizada sobre uma superfície,"resumo composição agrícola que compreende pelo menos uma substância química agrícola e pelo menos um éter de celulose; método de redução do desvio de pulverização durante a pulverização de uma solução aquosa; e método de aumento da resistência à lavagem pela chuva de uma solução aquosa pulverizada sobre uma superfície a presente invenção refere-se a uma composição agrícola que compreende pelo menos uma substância química agrícola e pelo menos um éter de celulose, em que o éter de celulose é um polímero de metiletil-hidroxietil celulose (mehec) não iônico. a presente invenção também se refere a um método de redução do desvio de pulverização durante a pulverização de uma solução aquosa. o método compreende: fornecimento de um polímero de mehec não iônico; combinação do polímero de mehec com pelo menos uma substância química agrícola para obter a solução aquosa; e pulverização da solução aquosa. além disso, a presente invenção também se refere a um método de aumento da resistência à lavagem pela chuva de uma solução aquosa pulverizada sobre uma superfície. o método compreende: fornecimento de um polímero de mehec não iônico; combinação do polímero de mehec com pelo menos uma substância agrícola para obter a solução aquosa; e pulverização da solução aquosa sobre a superfície. 1/1",AKZO NOBEL CHEMICALS INT BV,JINXIA SUSAN SUN;;LOGAN DEMPSEY;;MICHAEL WALTERS;;PETER WESTBYE;;QIWEI HE;;SHAWN ZHU,,https://lens.org/075-027-722-025-199,Patent Application,no,0,0,12,12,0,A01N25/24;;A01N25/24;;A01N25/02;;A01N39/04;;A01N39/04;;A01N57/20,A01N25/24;;A01N39/04,,0,0,,,,DISCONTINUED
41,EP,A1,EP 2967029 A1,108-236-652-099-171,2016-01-20,2016,EP 14708890 A,2014-03-11,US 201361783871 P;;EP 13175101 A;;EP 2014054628 W;;EP 14708890 A,2013-03-14,CELLULOSE ETHER AS A DRIFT CONTROL AGENT AND RAINFASTNESS AGENT,,AKZO NOBEL CHEMICALS INT BV,SUN JINXIA SUSAN;;HE QIWEI;;ZHU SHAWN;;DEMPSEY LOGAN;;WALTERS MICHAEL;;WESTBYE PETER,,https://lens.org/108-236-652-099-171,Patent Application,yes,0,0,12,12,0,A01N25/24;;A01N25/24;;A01N25/02;;A01N39/04;;A01N39/04;;A01N57/20,A01N25/24;;A01N39/04,,1,0,,,See references of WO 2014139975A1,ACTIVE
42,CN,A,CN 105050396 A,174-137-396-374-129,2015-11-11,2015,CN 201480014470 A,2014-03-11,EP 2014054628 W;;EP 13175101 A;;US 201361783871 P,2013-03-14,Cellulose ether as a drift control agent and rainfastness agent,"The present invention is directed to an agricultural composition comprising at least one agricultural chemical and at least one cellulose ether, wherein the cellulose ether is a nonionic methylethylhydroxyethyl cellulose (MEHEC) polymer. The present invention is also directed to a method for reducing spray drift during the spraying of an aqueous solution. The method comprises: providing a nonionic MEHEC polymer; combining the MEHEC polymer with at least one agricultural chemical to obtain the aqueous solution; and spraying the aqueous solution. Further, the present invention is also directed to a method for increasing resistance to rain wash off of an aqueous solution sprayed onto a surface. The method comprises: providing a nonionic MEHEC polymer; combining the MEHEC polymer with at least one agricultural chemical to obtain the aqueous solution; and spraying the aqueous solution onto the surface.",AKZO NOBEL CHEMICALS INT BV,SUN JINXIA SUSAN;;Q HE;;S ZHU;;DEMPSEY LOGAN;;WALTERS MICHAEL;;WESTBYE PETER,,https://lens.org/174-137-396-374-129,Patent Application,no,4,4,12,12,0,A01N25/24;;A01N25/24;;A01N25/02;;A01N39/04;;A01N39/04;;A01N57/20,A01N25/24;;A01N39/04,,0,0,,,,INACTIVE
43,AU,B2,AU 2014/230940 B2,153-880-012-703-456,2016-12-08,2016,AU 2014/230940 A,2014-03-11,EP 13175101 A;;US 201361783871 P;;EP 2014054628 W,2013-03-14,Cellulose ether as a drift control agent and rainfastness agent,"The present invention is directed to an agricultural composition comprising at least one agricultural chemical and at least one cellulose ether, wherein the cellulose ether is a nonionic methylethylhydroxyethyl cellulose (MEHEC) polymer. The present invention is also directed to a method for reducing spray drift during the spraying of an aqueous solution. The method comprises: providing a nonionic MEHEC polymer; combining the MEHEC polymer with at least one agricultural chemical to obtain the aqueous solution; and spraying the aqueous solution. Further, the present invention is also directed to a method for increasing resistance to rain wash off of an aqueous solution sprayed onto a surface. The method comprises: providing a nonionic MEHEC polymer; combining the MEHEC polymer with at least one agricultural chemical to obtain the aqueous solution; and spraying the aqueous solution onto the surface.",AKZO NOBEL CHEMICALS INT BV,SUN JINXIA SUSAN;;HE QIWEI;;ZHU SHAWN;;DEMPSEY LOGAN;;WALTERS MICHAEL;;WESTBYE PETER,,https://lens.org/153-880-012-703-456,Granted Patent,no,1,0,12,12,0,A01N39/04;;A01N25/24;;A01N39/04;;A01N25/24;;A01N25/02;;A01N57/20,A01N25/24;;A01N39/04,,0,0,,,,INACTIVE
