"#",Jurisdiction,Kind,Display Key,Lens ID,Publication Date,Publication Year,Application Number,Application Date,Priority Numbers,Earliest Priority Date,Title,Abstract,Applicants,Inventors,Owners,URL,Document Type,Has Full Text,Cites Patent Count,Cited by Patent Count,Simple Family Size,Extended Family Size,Sequence Count,CPC Classifications,IPCR Classifications,US Classifications,NPL Citation Count,NPL Resolved Citation Count,NPL Resolved Lens ID(s),NPL Resolved External ID(s),NPL Citations,Legal Status
1,CA,A,CA 176984 A,048-202-644-315-786,1917-05-15,1917,CA 176984D A,1916-03-31,CA 176984T A,1916-03-31,OIL ENGINE,,DEMPSEY PETER,DEMPSEY PETER,,https://lens.org/048-202-644-315-786,Granted Patent,no,0,0,1,1,0,,,,0,0,,,,EXPIRED
2,FR,A,FR 481563 A,115-423-687-169-499,1916-12-19,1916,FR 481563D A,1916-04-21,FR 481563T A,1916-04-21,Moteurs à huile à grande vitesse,,PETER DEMPSEY,DEMPSEY PETER,,https://lens.org/115-423-687-169-499,Granted Patent,no,0,0,1,1,0,F02M31/18;;F02M31/18;;Y02T10/12,F02M31/18,"V, 8",0,0,,,,EXPIRED
3,GB,A,GB 101254 A,184-851-481-286-917,1916-08-31,1916,GB 529716 A,1916-04-11,GB 529716 A,1916-04-11,Improvements in High Speed Oil Engines.,"101,254. Dempsey, P. April 11, 1916. Regulating. - In a four-stroke-cycle engine which induces during the early portion of the suction stroke a rich non- combustible mixture to which air is subsequently admitted through ports uncovered by the piston, regulating is effected by throttling the air supply through the piston-controlled ports. The passage leading to each port contains a non-return valve and a hand-controlled throttle valve carrying an actuating-arm p. The rich mixture supplied to the cylinders is prepared in a carburettor d and heated subsequently in a chamber f through which passes the exhaust pipe a<1>. A cock c<2> controls the normal fuel supply or the admission of a light fuel at starting.",DEMPSEY PETER,DEMPSEY PETER,,https://lens.org/184-851-481-286-917,Granted Patent,no,0,0,1,1,0,F02M69/00;;F02M2700/4397,F02M69/00,,0,0,,,,EXPIRED
4,US,A,US 1224151 A,011-262-742-087-328,1917-05-01,1917,US 9850516 A,1916-05-19,US 9850516 A,1916-05-19,OIL-ENGINE.,,DEMPSEY PETER P,DEMPSEY PETER P,,https://lens.org/011-262-742-087-328,Granted Patent,no,0,1,1,1,0,F02B9/00;;F02B9/00,,,0,0,,,,EXPIRED
5,US,A,US 1198013 A,128-803-734-636-122,1916-09-12,1916,US 2827715 A,1915-05-15,US 2827715 A,1915-05-15,HIGH-SPEED OIL-ENGINE.,,DEMPSEY OIL ENGINE COMPANY INC,DEMPSEY PETER P,,https://lens.org/128-803-734-636-122,Granted Patent,no,0,3,1,1,0,F02M1/00;;F02M1/00,,,0,0,,,,EXPIRED
6,US,A,US 1247648 A,100-807-053-235-464,1917-11-27,1917,US 6346315 A,1915-11-26,US 6346315 A,1915-11-26,HIGH-SPEED OIL-ENGINE.,,DEMPSEY OIL ENGINE CORP,DEMPSEY PETER P,,https://lens.org/100-807-053-235-464,Granted Patent,no,0,0,1,1,0,F02M1/00;;F02M1/00,,,0,0,,,,EXPIRED
7,US,A,US 1256116 A,066-892-372-412-390,1918-02-12,1918,US 9409516 A,1916-04-28,US 9409516 A,1916-04-28,INTERNAL-COMBUSTION ENGINE.,,NEW DEMPSEY OIL ENGINE CORP,DEMPSEY PETER P,,https://lens.org/066-892-372-412-390,Granted Patent,no,0,3,1,1,0,F02M63/00;;F02M63/00,,,0,0,,,,EXPIRED
8,US,A1,US 2020/0407074 A1,105-477-913-230-616,2020-12-31,2020,US 202016903827 A,2020-06-17,DE 102019209236 A,2019-06-26,Power Supply Unit And On-Board Power Supply Network Of An Aircraft Or Spacecraft,"A power supply unit includes a housing having at least one input terminal and at least one output terminal, an AC-DC converter which is arranged in the housing and which is connected to the input terminal, a DC-DC converter which is arranged in the housing and which is connected to the output terminal; and a capacitor which forms a structural part of the housing. Furthermore, an on-board power supply network of an aircraft or spacecraft is also described.",AIRBUS OPERATIONS GMBH,LINDE PETER;;DEMPSEY SEAN,AIRBUS OPERATIONS GMBH (2020-06-29),https://lens.org/105-477-913-230-616,Patent Application,yes,0,0,3,3,0,B64D41/00;;B64D2221/00;;H02J2310/44;;Y02T50/40;;H02J4/00;;B64D41/00;;H02J2310/44;;B64D2221/00;;H02J5/00,B64D41/00;;H02J5/00,,0,0,,,,ACTIVE
9,DE,A1,DE 102019209236 A1,187-993-917-419-50X,2020-12-31,2020,DE 102019209236 A,2019-06-26,DE 102019209236 A,2019-06-26,Netzteil und elektrisches Bordnetz eines Luft- oder Raumfahrzeugs,"Die vorliegende Erfindung schafft ein Netzteil (100) mit einem Gehäuse (110) mit mindestens einem Eingangsanschluss (111) und mindestens einem Ausgangsanschluss (112), einem in dem Gehäuse (110) angeordneten Wechselspannung-Gleichspannung-Wandler (101), welcher mit dem Eingangsanschluss (111) verbunden ist einem in dem Gehäuse (110) angeordneten Gleichspannung-Gleichspannung-Wandler (102), welcher mit dem Ausgangsanschluss (112) verbunden ist, und einem Kondensator (103), welcher einen strukturellen Teil des Gehäuses (110) bildet. Ferner schafft die vorliegende Erfindung ein elektrisches Bordnetz eines Luft- oder Raumfahrzeugs.",AIRBUS OPERATIONS GMBH,LINDE PETER;;DEMPSEY SEAN,,https://lens.org/187-993-917-419-50X,Patent Application,no,5,0,3,3,0,B64D41/00;;B64D2221/00;;H02J2310/44;;Y02T50/40;;H02J4/00;;B64D41/00;;H02J2310/44;;B64D2221/00;;H02J5/00,H05K5/00;;H01G9/004;;H01G11/32;;H02M3/00;;H05K5/02;;H05K7/00,,0,0,,,,PENDING
10,US,B2,US 11220349 B2,158-891-068-333-488,2022-01-11,2022,US 202016903827 A,2020-06-17,DE 102019209236 A,2019-06-26,Power supply unit and on-board power supply network of an aircraft or spacecraft,"A power supply unit includes a housing having at least one input terminal and at least one output terminal, an AC-DC converter which is arranged in the housing and which is connected to the input terminal, a DC-DC converter which is arranged in the housing and which is connected to the output terminal; and a capacitor which forms a structural part of the housing. Furthermore, an on-board power supply network of an aircraft or spacecraft is also described.",AIRBUS OPERATIONS GMBH,LINDE PETER;;DEMPSEY SEAN,AIRBUS OPERATIONS GMBH (2020-06-29),https://lens.org/158-891-068-333-488,Granted Patent,yes,11,0,3,3,0,B64D41/00;;B64D2221/00;;H02J2310/44;;Y02T50/40;;H02J4/00;;B64D41/00;;H02J2310/44;;B64D2221/00;;H02J5/00,B64D41/00;;H02J5/00,,2,1,101-405-249-066-054,10.1021/am400947j;;23668320,"Qian, Hui, et al. “Multifunctional structural supercapacitor composites based on carbon aerogel modified high performance carbon fiber fabric.” ACS applied materials & interfaces 5.13 (2013): 6113-6122. (Year: 2013).;;German Search Report for Application No. DE 10 2019 209 236.5 dated Mar. 30, 2020, 2 pages.",ACTIVE
11,WO,A2,WO 2003/038693 A2,000-755-331-817-871,2003-05-08,2003,GB 0204913 W,2002-10-30,GB 0126160 A,2001-10-31,A DATA PROCESSING SYSTEM FOR MANAGING A PAYROLL OPERATION ACROSS A PLURALITY OF JURISDICTIONS,"With reference to the Figure, the present invention relates to a data processing system for managing a payroll operation across a plurality of jurisdictions each having a different deductions regime. The system comprises first input means (15 to 22) which enables input of payroll data, including employee information; first storage means (14) which stores the payroll data input via the input means; second storage means (11, 23 to 30) which stores for each of the jurisdictions deductions data regarding deductions payable in all of the plurality of jurisdictions; payroll calculation means (31) which uses the payroll data stored in the first storage means (14) and the deductions data stored in the second storage means (11, 23 to 30) to calculate for each employee a periodical payment value and a deductions value associated with the periodical payment value; output means (32, 33, 34, 35) for outputting for each employee the calculated periodical payment value and the calculated associated deductions tax value; third storage means (36) for storing a record of the periodical payment values and the associated deductions values calculated by the calculation means (31); and reporting means (12) which accesses deductions data stored in the third storage, means (36), which categorises all of the calculated deductions according to a categorisation regime applicable across all of the jurisdictions and which produces reports consolidating information across all of the plurality of jurisdictions with reference to the categorised deductions data.",MULTIJURISDICTIONAL PAYROLL LT;;MCERLAIN ANDREW ROBERT;;DEMPSEY PETER,MCERLAIN ANDREW ROBERT;;DEMPSEY PETER,,https://lens.org/000-755-331-817-871,Patent Application,yes,0,0,3,3,0,G06Q10/10;;G06Q40/02,G06Q10/00;;G06Q40/00,,0,0,,,,PENDING
12,WO,A8,WO 2003/038693 A8,175-259-679-725-963,2003-09-25,2003,GB 0204913 W,2002-10-30,GB 0126160 A,2001-10-31,A DATA PROCESSING SYSTEM FOR MANAGING A PAYROLL OPERATION ACROSS A PLURALITY OF JURISDICTIONS,,MULTIJURISDICTIONAL PAYROLL LT;;MCERLAIN ANDREW ROBERT;;DEMPSEY PETER,MCERLAIN ANDREW ROBERT;;DEMPSEY PETER,,https://lens.org/175-259-679-725-963,Patent Application,no,0,0,3,3,0,G06Q10/10;;G06Q40/02,G06Q10/00;;G06Q40/00,,0,0,,,,PENDING
13,CA,A,CA 80809 A,073-208-448-452-20X,1903-05-12,1903,CA 80809D A,1903-04-22,CA 80809T A,1903-04-22,SNAP HOOK,,MCTAVISH PETER;;DEMPSEY SIBLEY VONDON,MCTAVISH PETER;;DEMPSEY SIBLEY VONDON,,https://lens.org/073-208-448-452-20X,Granted Patent,no,0,0,1,1,0,,,,0,0,,,,EXPIRED
14,US,B1,US 6499136 B1,162-661-910-975-687,2002-12-24,2002,US 43795999 A,1999-11-10,US 43795999 A,1999-11-10,Single-shot entry code for software state transition,"
    A computer system runs an applications program generated by an object-oriented software development program. A state transition is made to a state of the applications program from an outside state. All state transitions to the state from outside states are connected to an input of a transition merge point of the state. A merge transition of the merge point is selected in response to the state transition and the merge transition transitions back to the state, wherein the merge transition contains merge transition code which executes during the merge transition. 
",LUCENT TECHNOLOGIES INC,DEMPSEY PETER ALLEN;;IACCARINO SALVATORE JOHN,WSOU INVESTMENTS LLC (2017-07-22);;LUCENT TECHNOLOGIES INC (1999-11-08),https://lens.org/162-661-910-975-687,Granted Patent,yes,17,36,1,1,0,G06F8/10;;G06F8/10,G06F9/44;;G06F9/45,717/127;;717/100;;717/126,8,5,076-001-233-575-30X;;025-889-667-660-83X;;043-693-671-889-686;;071-893-529-458-908;;018-523-156-739-79X,10.1145/503271.503236;;10.1145/318774.318788;;10.1145/639624.802062;;10.1145/225014.225028;;10.1145/287000.287001,"Lavazza et al, ""Combining UML and formal notations for modeling real time system"", ACM ESEC/FSE, pp 196-206, 2001.*;;Ling ""Designing data entry programs using state diagram as a common model"", IEEE, pp 296-308.*;;Chung et al, ""Use of state diagram to engineer communication software"", ACM Proc. of 3rd Int Conf. SW Eng. pp 215-221, 1978.*;;Jagar et al, Using UML fro software process modeling ACM pp 91-108, 2000.*;;Courtiat et al, Petri nets are good for protocols, ACM pp 66-74, 1984.*;;Dwyer et al, A compact petri net representation for concurrent programs, ACM ICSE, pp 147-157, 1995.*;;Cook et al, ""Discovering models of software processes from event based data"", ACM Trans. on software eng. and meth. vol. 7, No. 3, pp 215-249, Jul. 1998.*;;Rumbaugh et al, ""object oriented modeling and design"" Prentice Hall, 1991.",EXPIRED
15,US,A1,US 2003/0201353 A1,013-685-221-418-731,2003-10-30,2003,US 33664403 A,2003-01-03,US 33664403 A;;US 34567502 P,2002-01-03,Dual-path office product disintegrator,"
   This invention is a dual-path disintegrator having a first path which carries bulk office products to a disintegrator, such as a rotary knife mill, for high security destruction, and a second path which carries sheets of paper through a shredder, either cross cut or strip cut, and then through a disintegrator, such as a rotary knife mill, for final high security destruction. 
",LEFRANCOIS DAVID;;DEMPSEY PETER;;ROSEN LEONARD,LEFRANCOIS DAVID;;DEMPSEY PETER;;ROSEN LEONARD,SECURITY ENGINEERED MACHINERY CO. INC (2003-09-12),https://lens.org/013-685-221-418-731,Patent Application,yes,13,7,1,1,0,B02C18/0007;;B02C18/2225;;B02C2018/0046;;B02C18/2225;;B02C18/0007;;B02C2018/0046,B02C18/00;;B02C18/22,241/236,0,0,,,,DISCONTINUED
16,US,A,US 2065798 A,042-200-438-801-292,1936-12-29,1936,US 74307434 A,1934-09-07,US 74307434 A,1934-09-07,Shaking mechanism,,UNION IRON WORKS,CLAY DEMPSEY HENRY;;PETER STIMMEL EDGAR,,https://lens.org/042-200-438-801-292,Granted Patent,no,0,6,1,1,0,B07B1/42;;Y10T74/18344;;Y10T74/18344;;B07B1/42,B07B1/42,,0,0,,,,EXPIRED
17,US,A,US 5335228 A,011-084-260-512-046,1994-08-02,1994,US 95421892 A,1992-09-30,US 95421892 A,1992-09-30,Synchronization related to data streams,"A remote terminal for a subscriber loop carrier network operates by flow from one to another of units in the terminal of time division multiplexer data streams of binary valued digital bits. Each stream has the format of periodic frames of time slots of which each frame consists of (a) a service time slot containing only service bits, and (b) a plurality of customer slots which contain mostly bits coded with data from customers of the network, but which also include a less number of service bits. Each unit includes encoding means responsive to local synchronizing and clock pulses derived from data incoming to the unit to encode on each frame of the outgoing data stream synchronizing information consisting of (c) a synchronizing pattern comprising a coded sequence of service bits localized in the frame's service slot and (d) a spoiler pattern formed of service bits distributed over customer slots in the frame. The spoiler pattern is interrelated with the synchronizing pattern so that no fortuitous bit sequence occurring in the stream and including any bit beating customer data can falsely duplicate the synchronizing pattern. Each unit also includes decoding means responsive to the presence of synchronizing patterns in an incoming data stream to produce signals for synchronizing the operation of that unit with the pre-established timing of the incoming stream. Such units may be circuit cards having mounted thereon encoding and decoding means in the form of semiconductive integrated circuits and including binary counters used to implement the encoding and decoding functions.",AT & T BELL LAB,BOTTIGLIERI MICHAEL P;;DEMPSEY PETER A A,AMERICAN TELEPHONE AND TELEGRAPH COMPANY (1992-09-28),https://lens.org/011-084-260-512-046,Granted Patent,yes,10,20,1,1,0,H04J3/0605;;H04J3/0605,H04J3/06,370/100.1;;370/110.1,2,0,,,"Telecommunication Networks: Protocols, Modeling and Analysis by Mischa Schwartz, Addison Wesley Publishing Co. 1987, pp. 135 136.;;Transmission Systems for Communications by Members of the Technical Staff, Bell Telephone Laboratories, 1982, pp. 659 666.",EXPIRED
18,CL,A1,CL 2018003793 A1,186-547-842-216-719,2019-02-15,2019,CL 2018003793 A,2018-12-21,US 201662357510 P,2016-07-01,Reducción de deriva de pulverización.,"REDUCTORES DE DERIVA DE PULVERIZACIÓN PARA FORMULACIONES AGROQUÍMICAS PARA USO EN REDUCCIÓN DE DERIVA DE PULVERIZACIÓN EN FORMULACIONES AGROQUÍMICAS QUE CONTIENE ACTIVOS Y/O MICRONUTRIENTES. LOS REDUCTORES SON SELECCIONADOS DE POLIOL O POLIAMINA ALCOXILADO EL CUAL ES OPCIONALMENTE TERMINADO EN ACILO, Y LA FORMULACIÓN PUEDE OPCIONALMENTE COMPRENDER ALCOXILATO NO-IÓNICO. TAMBIÉN SE PROPORCIONA UN MÉTODO PARA HACER LA FORMULACIÓN, Y EL USO DE LA FORMULACIÓN PARA REDUCIR LA DERIVA DE PULVERIZACIÓN EN LA APLICACIÓN DE LA FORMULACIÓN AGROQUÍMICA A LA VEGETACIÓN.",CRODA INC,DEMPSEY LOGAN PETER;;LINDNER GREGORY;;SUN JINXIA SUSAN,,https://lens.org/186-547-842-216-719,Patent Application,no,0,0,12,12,0,A01N25/06;;A01N25/30;;A01N25/06;;A01N25/30;;A01N25/06;;A01N25/30;;A01N25/04;;A01N25/10;;C08J3/03;;C08J2300/14,A01N25/06;;A01N25/30,,0,0,,,,PENDING
19,US,B1,US 6195565 B1,164-684-074-823-374,2001-02-27,2001,US 3398598 A,1998-03-03,US 3398598 A,1998-03-03,Bandwidth control in a packet-based data system,"A data system, such as a computer network or a telecommunications system, has a base station and a number of nodes called network interface units (NIUs). Each NIU is assigned to one of a number of groups of NIUs. The base station transmits special data to the NIUs indicating which groups of NIUs are currently authorized to transmit upstream messages to the base station, where only the authorized NIUs are allowed to transmit upstream messages. When message collisions in the upstream direction becomes a problem, the base station can reduce the number of NIU groups that are authorized at any given time to transmit upstream messages, in order to attempt to reduce the rate of message collisions. In one possible embodiment, each NIU is assigned horizontal and vertical group words that identify to which group it is assigned. The special data contain additional horizontal and vertical code words that are monitored by the NIUs. If the bits in the downstream code words appropriately match the corresponding bits in the NIU's assigned group words, then the NIU recognizes that it is authorized to transmit upstream messages to the base station. Otherwise, it is not. The horizontal and vertical code words correspond to two-dimensional patterns that indicate which subset of NIU groups are authorized at any given time. By cycling through a series of 2D patterns, the base station ensures that each NIU is authorized at least some of the time. Depending on the number of bits in the code words, a back-off scheme can be designed with different back-off levels, each of which authorizes a different number of groups to transmit. The base station can progressively decrease the rate of upstream transmission by selecting back-off levels with fewer and fewer NIU groups authorized to transmit.",LUCENT TECHNOLOGIES INC,DEMPSEY PETER A;;LEE KYOO J;;WARMINK STUART,WSOU INVESTMENTS LLC (2017-07-22);;LUCENT TECHNOLOGIES INC (1998-02-19),https://lens.org/164-684-074-823-374,Granted Patent,yes,13,12,5,5,0,H04L47/788;;H04L47/828;;H04L47/70;;H04L47/828;;H04L47/788;;H04L47/70,H04L12/54;;H04L12/911,455/561;;455/38.1;;455/177.1;;455/266;;370/342,0,0,,,,EXPIRED
20,CN,A,CN 1238626 A,077-077-899-341-427,1999-12-15,1999,CN 99102598 A,1999-03-03,US 3398598 A,1998-03-03,Bandwidth control in packet-based data system,,LUCENT TECHNOLOGIES INC,DEMPSEY PETER A;;LEE KYOO J;;WARMINK STUART,,https://lens.org/077-077-899-341-427,Patent Application,no,0,0,5,5,0,H04L47/788;;H04L47/828;;H04L47/70;;H04L47/828;;H04L47/788;;H04L47/70,H04L12/54;;H04L12/911,,0,0,,,,DISCONTINUED
21,ES,B1,ES 2168893 B1,122-472-375-981-538,2003-11-01,2003,ES 9900437 A,1999-03-03,US 3398598 A,1998-03-03,CONTROL DE ANCHURA DE BANDA EN UN SISTEMA DE DATOS BASADO EN PAQUETES.,"Control de anchura de banda en un sistema de datos basado en paquetes por un método y un dispositivo que comprende una estación de base y una pluralidad de unidades de interfaz de red NIUs, que comprende las etapas de: (a) transmitir datos especiales desde la estación base hasta las NIUs; cuyas NIUs se organizan en dos o más grupos y los datos especiales identifican qué grupos de NIUs están autorizadas a transmitir mensajes en dirección a la estación base; y (b) transmitir mensajes dirigidos a la estación base exclusivamente desde NIUs autorizadas.",LUCENT TECHNOLOGIES INC,DEMPSEY PETER A;;LEE KYOO J;;WARMINK STUART,,https://lens.org/122-472-375-981-538,Granted Patent,no,0,0,5,5,0,H04L47/788;;H04L47/828;;H04L47/70;;H04L47/828;;H04L47/788;;H04L47/70,H04L12/54;;H04L12/911,,0,0,,,,EXPIRED
22,ES,A1,ES 2168893 A1,027-777-044-976-471,2002-06-16,2002,ES 9900437 A,1999-03-03,US 3398598 A,1998-03-03,Bandwidth control in a packet-based data system,"A data system, such as a computer network or a telecommunications system, has a base station and a number of nodes called network interface units (NIUs). Each NIU is assigned to one of a number of groups of NIUs. The base station transmits special data to the NIUs indicating which groups of NIUs are currently authorized to transmit upstream messages to the base station, where only the authorized NIUs are allowed to transmit upstream messages. When message collisions in the upstream direction becomes a problem, the base station can reduce the number of NIU groups that are authorized at any given time to transmit upstream messages, in order to attempt to reduce the rate of message collisions. In one possible embodiment, each NIU is assigned horizontal and vertical group words that identify to which group it is assigned. The special data contain additional horizontal and vertical code words that are monitored by the NIUs. If the bits in the downstream code words appropriately match the corresponding bits in the NIU's assigned group words, then the NIU recognizes that it is authorized to transmit upstream messages to the base station. Otherwise, it is not. The horizontal and vertical code words correspond to two-dimensional patterns that indicate which subset of NIU groups are authorized at any given time. By cycling through a series of 2D patterns, the base station ensures that each NIU is authorized at least some of the time. Depending on the number of bits in the code words, a back-off scheme can be designed with different back-off levels, each of which authorizes a different number of groups to transmit. The base station can progressively decrease the rate of upstream transmission by selecting back-off levels with fewer and fewer NIU groups authorized to transmit.",LUCENT TECHNOLOGIES INC,DEMPSEY PETER A;;LEE KYOO J;;WARMINK STUART,,https://lens.org/027-777-044-976-471,Patent Application,no,8,0,5,5,0,H04L47/788;;H04L47/828;;H04L47/70;;H04L47/828;;H04L47/788;;H04L47/70,H04L12/54;;H04L12/911,,1,0,,,"BASE DE DATOS WPIL en QUESTEL, semana 199912, Londres: Derwent Publications Ltd., AN 1999-143362, Class W01, W02, & WO 9905827 A1 (NTT)",EXPIRED
23,BR,A2,BR 112018077203 A2,162-661-485-076-727,2019-04-09,2019,BR 112018077203 A,2017-06-26,US 2017/0039234 W;;US 201662357510 P,2016-07-01,redução de desvio de aspersor,"trata-se de redutores de desvio de aspersor para formulações agroquímicas para uso em redução de desvio de aspersor em formulações agroquímicas que contêm agentes ativos e/ou micronutrientes. os redutores são selecionados a partir de poliamina ou poliol alcoxilado que é, opcionalmente, terminado em acila, e a formulação pode compreender opcionalmente alcoxilato não iônico. também é fornecido um método para produzir a formulação, e o uso da formulação na redução de desvio de aspersor na aplicação da formulação agroquímica à vegetação.",CRODA INC,GREGORY JAMES LINDNER;;JINXIA SUSAN SUN;;LOGAN PETER DEMPSEY,,https://lens.org/162-661-485-076-727,Patent Application,no,0,0,12,12,0,A01N25/06;;A01N25/30;;A01N25/06;;A01N25/30;;A01N25/06;;A01N25/30;;A01N25/04;;A01N25/10;;C08J3/03;;C08J2300/14,A01N25/06;;A01N25/30,,0,0,,,,ACTIVE
24,RU,C2,RU 2749613 C2,113-967-166-698-224,2021-06-16,2021,RU 2019102607 A,2017-06-26,US 201662357510 P;;US 2017/0039234 W,2016-07-01,REDUCTION OF DRIFT DURING SPRAYING,"FIELD: agriculture.SUBSTANCE: agrochemical spray preparation includes at least one agent reducing the drift during spraying in an amount of 0.001 to 4 wt.%, which is an alkoxylated polyol or polyamine, which does not necessarily contain a terminal acyl group and at least one agrochemically active compound and/or nutrient. Alternatively, the agrochemical preparation may contain neoinogenic alkoxylate. The drug is able to reduce the drift during spraying by at least 10%. A preparation concentrate suitable for obtaining an agrochemical preparation for spraying, including the above-mentioned agent reducing the drift during spraying, is proposed. A method is proposed for reducing the drift during spraying by using the above-mentioned agrochemical preparation and/or a diluted concentrate of the preparation. A method for treating vegetation is also proposed, and the treatment is selected from pest control and the provision of nutrients, involving the application of the above-mentioned preparation and/or a diluted concentrate of the preparation to the specified vegetation or directly to the environment in which the specified vegetation is located.EFFECT: invention makes it possible to provide improved control of drift during the treatment of vegetation.5 cl, 4 tbl",CRODA INC,DEMPSEY LOGAN PETER;;LINDNER GREGORY JAMES;;SUN JINXIA SUSAN,,https://lens.org/113-967-166-698-224,Granted Patent,no,4,0,12,12,0,A01N25/06;;A01N25/30;;A01N25/06;;A01N25/30;;A01N25/06;;A01N25/30;;A01N25/04;;A01N25/10;;C08J3/03;;C08J2300/14,A01N25/06;;A01N25/30,,0,0,,,,ACTIVE
