"#",Jurisdiction,Kind,Display Key,Lens ID,Publication Date,Publication Year,Application Number,Application Date,Priority Numbers,Earliest Priority Date,Title,Abstract,Applicants,Inventors,Owners,URL,Document Type,Has Full Text,Cites Patent Count,Cited by Patent Count,Simple Family Size,Extended Family Size,Sequence Count,CPC Classifications,IPCR Classifications,US Classifications,NPL Citation Count,NPL Resolved Citation Count,NPL Resolved Lens ID(s),NPL Resolved External ID(s),NPL Citations,Legal Status
1,US,A1,US 2020/0364242 A1,060-713-087-004-676,2020-11-19,2020,US 202016888641 A,2020-05-29,US 202016888641 A;;US 201514972514 A;;US 201562187516 P;;US 201562133094 P;;US 201562133071 P;;US 201562132987 P;;US 201562132625 P;;US 201462096086 P;;US 201462096071 P;;US 201462096049 P,2014-12-23,METHODS AND APPARATUS FOR PROVIDING ADAPTIVE PRIVATE NETWORK DATABASE SCHEMA MIGRATION AND MANAGEMENT PROCESSES,"System and techniques are described which apply a method for automatic database schema migration. An initial database is installed, according to rules that define tables of data, in an adaptive private network (APN) having a centralized management system including a network control node (NCN) coupled through the APN to a plurality of client nodes, wherein the NCN provides timing and control to the client nodes. An update to the initial database is received, wherein the initial database includes a first table of data stored in a first set of columns and the updated database includes a modified first table having a second set of columns that has a different number of columns as compared to the first table is automatically detected. One or more columns from the second set of columns that are different than the first set of columns are updated for data content.",TALARI NETWORKS INCORPORATED,MARTIN TODD;;PARSONS CHRISTOPHER WAYNE;;HUANG WEI;;SCHULTZ ADAM PHILLIP;;DICKEY ROBERT W,TALARI NETWORKS INCORPORATED (2015-12-16),https://lens.org/060-713-087-004-676,Patent Application,yes,3,3,12,38,0,H04L43/067;;H04L43/10;;H04L43/0817;;H04L45/76;;H04L63/0823;;H04L43/067;;H04L43/10;;H04L43/0817;;H04L41/12;;G06F21/33;;H04L45/00;;G06F16/214;;G06F16/278;;H04L41/0873;;H04L12/2854;;H04L41/0806;;H04L41/0896;;H04L41/22,G06F16/27;;G06F16/21,,0,0,,,,ACTIVE
2,US,B2,US 11502918 B2,018-642-933-320-339,2022-11-15,2022,US 202016888641 A,2020-05-29,US 202016888641 A;;US 201514972514 A;;US 201562187516 P;;US 201562133094 P;;US 201562133071 P;;US 201562132987 P;;US 201562132625 P;;US 201462096086 P;;US 201462096071 P;;US 201462096049 P,2014-12-23,Methods and apparatus for providing adaptive private network database schema migration and management processes,"System and techniques are described which apply a method for automatic database schema migration. An initial database is installed, according to rules that define tables of data, in an adaptive private network (APN) having a centralized management system including a network control node (NCN) coupled through the APN to a plurality of client nodes, wherein the NCN provides timing and control to the client nodes. An update to the initial database is received, wherein the initial database includes a first table of data stored in a first set of columns and the updated database includes a modified first table having a second set of columns that has a different number of columns as compared to the first table is automatically detected. One or more columns from the second set of columns that are different than the first set of columns are updated for data content.",TALARI NETWORKS INCORPORATED,MARTIN TODD;;PARSONS CHRISTOPHER WAYNE;;HUANG WEI;;SCHULTZ ADAM PHILLIP;;DICKEY III ROBERT W,TALARI NETWORKS INCORPORATED (2015-12-16),https://lens.org/018-642-933-320-339,Granted Patent,yes,30,0,12,38,0,H04L43/067;;H04L43/10;;H04L43/0817;;H04L45/76;;H04L63/0823;;H04L43/067;;H04L43/10;;H04L43/0817;;H04L41/12;;G06F21/33;;H04L45/00;;G06F16/214;;G06F16/278;;H04L41/0873;;H04L12/2854;;H04L41/0806;;H04L41/0896;;H04L41/22,G06F16/27;;G06F16/21;;G06F21/33;;H04L9/40;;H04L12/28;;H04L41/0806;;H04L41/0873;;H04L41/0896;;H04L41/12;;H04L41/22;;H04L43/067;;H04L43/0817;;H04L43/10;;H04L45/00,,23,1,190-401-268-730-328,10.17487/rfc3264,"Notice of Allowance and Fee(s) Due for U.S. Appl. No. 17/002,762 (dated Mar. 9, 2021).;;Commonly-Assigned, co-pending U.S. Appl. No. 17/002,762 for “Methods, Systems, and Computer Readable Media for Managing Multiple Software Defined Wide Area Network (SD-WAN) Software Versions,” (Unpublished, filed Aug. 25, 2020).;;“Partial software upgrade using local change management,” Citrix, pp. 1-4 (Oct. 15, 2019).;;Notice of Allowance and Fee(S) Due for U.S. Appl. No. 14/972,514 (dated Mar. 5, 2020).;;Applicant-Initiated Interview Summary for U.S. Appl. No. 14/972,514 (dated Jan. 27, 2020).;;“Talari Networks Announces Availability of its Mercury T5000 WAN Appliance and New Supporting APNWare Software Upgrade,” Talari Networks, Inc., pp. 1-5 (Nov. 13, 2012).;;Non-Final Office Action for U.S. Appl. No. 14/972,514 (dated Sep. 13, 2019).;;Advisory Action Before the Filing of an Appeal Brief and Applicant-Initiated Interview Summary for U.S. Appl. No. 14/972,514 (dated Feb. 28, 2019).;;Final Office Action for U.S. Appl. No. 14/972,514 (dated Dec. 14, 2018).;;Non-Final Office Action for U.S. Appl. No. 14/972,514 (dated Jun. 26, 2018).;;Francis et al., “Schema Mappings for Data Graphs,” https://project.inria.ft/bda2017/files/2017/11/talk6-2.pdf, 45 pages (2017).;;Lagura, “My Network Lab,” Basic Configuration of a Talari Networks T510 SD-WAN Appliance, http://wannabelab.blogspot.com/2016/11/basic-configuration-of-talari-networks.html, 11 pages (Nov. 18, 2016).;;Hickford, “Using Migration Scripts in Database Deployments,” https://www.red-gate.com/simple-talk/sql/database-administration/using-migration-scripts-in-database-deployments/, 20 pages (Jun. 17, 2014).;;“SQL Compare 10 Part of the SQL Developer Bundle,” redgate, https://web.archive.org/web/20130306083715/https:/www.red-gate.com/products/sql-development/sql-compare/, 2 pages (Mar. 6, 2013).;;“Adaptive Private Networking Appliance Operation Guide: APNware Release 2.5,” Talari Networks, 71 pages (2013).;;Mills et al., “Network Time Protocol Version 4: Protocol and Algorithms Specification,” RFC 5905, https://www.ietf.org/rfc/rfc5905.txt, 110 pages (Jun. 2010).;;Morales, “Oracle® Database VLDB and Partitioning Guide,” 11g Release 1 (11.1), Oracle, Chapters 1, 3, 84 pages (Jul. 2007).;;DanielKabs, “How to Calibrate System Clock Using NTP,” https://support.ntp.org/bin/view/Support/HowtoCalibrateSystemClockUsingNTP, 4 pages (Mar. 6, 2006).;;Case et al., “A Simple Network Management Protocol (SNMP),” RFC 1157, https://tools.ietf.org/html/rfc1157, 36 pages (May 1990).;;Krasner et al., “A Description of the Model-View-Controller User Interface Paradigm in the Smalltalk—80 System,” ParcPlace Systems, Inc., 34 pages (1988).;;Notice of Allowance and Fee(s) Due for U.S. Appl. No. 17/002,762 (dated Jul. 21, 2021).;;Notification of Transmittal of the International Search Report and the Written Opinion of the International Searching Authority, or the Declaration for International Application No. PCT/US2021/020112 (dated May 20, 2021).;;Rosenberg et al., “An Offer/Answer Model with the Session Description Protocol (SDP),” RFC 3264, pp. 1-26 (Jun. 2002).",ACTIVE
3,US,B2,US 10698923 B2,162-971-933-757-598,2020-06-30,2020,US 201514972514 A,2015-12-17,US 201514972514 A;;US 201462096049 P;;US 201462096071 P;;US 201462096086 P;;US 201562132625 P;;US 201562132987 P;;US 201562133071 P;;US 201562133094 P;;US 201562187516 P;;US 201514972270 A;;US 201514972353 A;;US 201414146786 A;;US 201213592460 A;;US 201213353693 A;;US 48276609 A;;US 201414291776 A;;US 201313850411 A;;US 201113208825 A;;US 201213719433 A;;US 201314019723 A;;US 201414481335 A,2009-06-11,Methods and apparatus for providing adaptive private network database schema migration and management processes,"System and techniques are described which apply a method for automatic database schema migration. An initial database is installed, according to rules that define tables of data, in an adaptive private network (APN) having a centralized management system including a network control node (NCN) coupled through the APN to a plurality of client nodes, wherein the NCN provides timing and control to the client nodes. An update to the initial database is received, wherein the initial database includes a first table of data stored in a first set of columns and the updated database includes a modified first table having a second set of columns that has a different number of columns as compared to the first table is automatically detected. One or more columns from the second set of columns that are different than the first set of columns are updated for data content.",TALARI NETWORKS INCORPORATED;;TALARI NETWORKS INC,MARTIN TODD;;HUANG WEI;;PARSONS CHRISTOPHER W;;SCHULTZ ADAM PHILLIP;;DICKEY III ROBERT W,TALARI NETWORKS INCORPORATED (2015-12-16),https://lens.org/162-971-933-757-598,Granted Patent,yes,16,6,2,38,0,G06F16/278;;G06F16/278;;G06F16/214;;G06F16/214,G06F16/27;;G06F16/21,,10,0,,,"Adaptive Private Networking Applicance Operation Guide: APNware Release Feb. 5, 2013, Talari Networks Inc., 71 pages.;;Lagura, My Network Lab Nov. 18, 2016, blogspot.com, http://wannabelab.blogspot.com/2016/11/basic-configuration-of-talari-networks.html.;;Case et al., A Simple Network Management Protocol (SNMP) May 1990, ietf, RFC 1157, https://tools.ietf.org/html/rfc1157.;;Morales, VLDB and Partitioning Guide Jul. 2007, Oracle Sys, TOC, chapters 1, 3.;;Kabs, 10.1. How to calibrate the system clock using NTP Mar. 6, 2006, ntp.org, https://support.ntp.org/bin/view/Support/HowToCalibrateSystemClockUsingNTP.;;Mills et al., RFC 5905 Network Time Protocol Version 4: Protocol and Algorithms Specification Jun. 2010, IETF, https://www.ietf.org/rfc/rfc5905.txt.;;Hickford, Using Migration Scripts in Database Deployments Jun. 17, 2014, redgate.com, https://www.red-gate.com/simple-talk/sql/database-administration/using-migration-scripts-in-database-deployments/.;;SQL Compare 10 Part of the SQL Developer Bundle date unknown [captured on Mar. 6, 2013 by archive.org], redgate, https://web.archive.org/web/20130306083715/https://www.red-gate.com/products/sql-development/sql-compare/.;;Krasner, Glenn E. and Pope, Stephen T., “A Description of the Model-View-Controller User Interface Paradigm in the Smalltalk-80 System”, ParcPlace Systems, 1988.;;“Talari Networks Announces Availability of its Mercury T5000 WAN Appliance and New Supporting APNWare Software Upgrade,” Talari Networks, Inc., pp. 1-5 (Nov. 13, 2012).",ACTIVE
4,US,A1,US 2016/0179850 A1,083-094-026-059-942,2016-06-23,2016,US 201514972514 A,2015-12-17,US 201514972514 A;;US 201462096049 P;;US 201462096071 P;;US 201462096086 P;;US 201562132625 P;;US 201562132987 P;;US 201562133071 P;;US 201562133094 P;;US 201562187516 P;;US 201514972270 A;;US 201514972353 A;;US 201414146786 A;;US 201213592460 A;;US 201213353693 A;;US 48276609 A;;US 201414291776 A;;US 201313850411 A;;US 201113208825 A;;US 201213719433 A;;US 201314019723 A;;US 201414481335 A,2009-06-11,Methods and Apparatus for Providing Adaptive Private Network Database Schema Migration and Management Processes,"System and techniques are described which apply a method for automatic database schema migration. An initial database is installed, according to rules that define tables of data, in an adaptive private network (APN) having a centralized management system including a network control node (NCN) coupled through the APN to a plurality of client nodes, wherein the NCN provides timing and control to the client nodes. An update to the initial database is received, wherein the initial database includes a first table of data stored in a first set of columns and the updated database includes a modified first table having a second set of columns that has a different number of columns as compared to the first table is automatically detected. One or more columns from the second set of columns that are different than the first set of columns are updated for data content.",TALARI NETWORKS INC,MARTIN TODD;;HUANG WEI;;PARSONS CHRISTOPHER W;;SCHULTZ ADAM PHILLIP;;DICKEY III ROBERT W,TALARI NETWORKS INCORPORATED (2015-12-16),https://lens.org/083-094-026-059-942,Patent Application,yes,0,74,2,38,0,G06F16/278;;G06F16/278;;G06F16/214;;G06F16/214,G06F17/30,,0,0,,,,ACTIVE
5,US,B1,US 6223086 B1,172-573-371-242-849,2001-04-24,2001,US 50476800 A,2000-02-09,US 50476800 A;;US 12983298 A;;US 64104596 A,1996-04-17,Endothelium preserving microwave treatment for atherosclerosis,"Method and apparatus are provided to treat atherosclerosis wherein the artery is partially closed by dilating the artery while preserving the vital and sensitive endothelial layer thereof. Microwave energy having a frequency from 3 GHz to 300 GHz is propagated into the arterial wall to produce a desired temperature profile therein at tissue depths sufficient for thermally necrosing connective tissue and softening fatty and waxy plaque while limiting heating of surrounding tissues including the endothelial layer and/or other healthy tissue, organs, and blood. The heating period for raising the temperature a potentially desired amount, about 20.degree. C. within the atherosclerotic lesion may be less than about one second. In one embodiment of the invention, a radically beveled waveguide antenna is used to deliver microwave energy at frequencies from 25 GHz or 30 GHz to about 300 GHz and is focused towards a particular radial sector of the artery. Because the atherosclerotic lesions are often asymmetrically disposed directable or focussed heating preserves healthy sectors of the artery and applies energy to the asymmetrically positioned lesion faster than a non-directed beam. A computer simulation predicts isothermic temperature profiles for the given conditions and may be used in selecting power, pulse duration, beam width, and frequency of operation to maximize energy deposition and control heat rise within the atherosclerotic lesion without harming healthy tissues or the sensitive endothelium cells.",NASA,CARL JAMES R;;ARNDT G DICKEY;;FINK PATRICK W;;BEER N REGINALD;;HENRY PHILLIP D;;PACIFICO ANTONIO;;RAFFOUL GEORGE W,,https://lens.org/172-573-371-242-849,Granted Patent,yes,8,93,4,15,0,A61B18/1206;;A61B18/1492;;A61B18/18;;A61B18/1815;;A61B2018/00351;;A61B2018/00577;;A61B2018/00732;;A61B2018/00791;;A61B2018/1861;;A61N1/06;;A61B18/18;;A61B18/1206;;A61B2018/00732;;A61N1/06;;A61B2018/00351;;A61B2018/00577;;A61B2018/00791;;A61B2018/1861;;A61B18/1492;;A61B18/1815,A61B18/14;;A61B18/18;;A61N1/06,607/101;;607/102;;607/122;;607/154;;606/33;;606/41,0,0,,,,EXPIRED
6,US,B1,US 6226553 B1,126-107-931-680-905,2001-05-01,2001,US 50115000 A,2000-02-09,US 50115000 A;;US 12983298 A;;US 64104596 A,1996-04-17,Endothelium preserving microwave treatment for atherosclerois,"Method and apparatus are provided to treat atherosclerosis wherein the artery is partially closed by dilating the artery while preserving the vital and sensitive endothelial layer thereof. Microwave energy having a frequency from 3 GHz to 300 GHz is propagated into the arterial wall to produce a desired temperature profile therein at tissue depths sufficient for thermally necrosing connective tissue and softening fatty and waxy plaque while limiting heating of surrounding tissues including the endothelial layer and/or other healthy tissue, organs, and blood. The heating period for raising the temperature a potentially desired amount about 20.degree. C., within the atherosclerotic lesion may be less than about one second. In one embodiment of the invention, a radically beveled waveguide antenna is used to deliver microwave energy at frequencies from 25 GHz or 30 GHz to about 300 GHz and is focused towards a particular radial sector of the artery. Because the atherosclerotic lesions are often asymmetrically disposed, directable or focussed heating preserves healthy sectors of the artery and applies energy to the asymmetrically positioned lesion faster than a non-directed beam. A computer simulation predicts isothermic temperature profiles for the given conditions and may be used in selecting power, pulse duration, beam width, and frequency of operation to maximize energy deposition and control heat rise within the atherosclerotic lesion without harming healthy tissues or the sensitive endothelium cells.",NASA,CARL JAMES R;;ARNDT G DICKEY;;FINK PATRICK W;;BEER N REGINALD;;HENRY PHILLIP D;;PACIFICO ANTONIO;;RAFFOUL GEORGE W,,https://lens.org/126-107-931-680-905,Granted Patent,yes,9,60,4,15,0,A61B18/1206;;A61B18/1492;;A61B18/18;;A61B18/1815;;A61B2018/00351;;A61B2018/00577;;A61B2018/00732;;A61B2018/00791;;A61B2018/1861;;A61N1/06;;A61B18/18;;A61B18/1206;;A61B2018/00732;;A61N1/06;;A61B2018/00351;;A61B2018/00577;;A61B2018/00791;;A61B2018/1861;;A61B18/1492;;A61B18/1815,A61B18/14;;A61B18/18;;A61N1/06,607/101;;607/102;;607/122;;607/154;;606/33,0,0,,,,EXPIRED
7,US,A,US 6047216 A,073-234-840-883-281,2000-04-04,2000,US 12983298 A,1998-08-05,US 12983298 A;;US 64104596 A,1996-04-17,Endothelium preserving microwave treatment for atherosclerosis,"Method and apparatus are provided to treat atherosclerosis wherein the artery is partially closed by dilating the artery while preserving the vital and sensitive endothelial layer thereof Microwave energy having a frequency from 3 GHz to 300 GHz is propagated into the arterial wall to produce a desired temperature profile therein at tissue depths sufficient for thermally necrosing connective tissue and softening fatty and waxy plaque while limiting heating of surrounding tissues including the endothelial laser and/or other healthy tissue, organs, and blood. The heating period for raising the temperature a potentially desired amount, about 20.degree. C., within the atherosclerotic lesion may be less than about one second. In one embodiment of the invention, a radically beveled waveguide antenna is used to deliver microwave energy at frequencies from 25 GHz or 30 GHz to about 300 GHz and is focused towards a particular radial sector of the artery. Because the atherosclerotic lesions are often asymmetrically disposed, directable or focussed heating preserves healthy sectors of the artery and applies energy to the asymmetrically positioned lesion faster than a non-directed beam. A computer simulation predicts isothermic temperature profiles for the given conditions and man be used in selecting power, pulse duration, beam width, and frequency of operation to maximize energy deposition and control heat rise within the atherosclerotic lesion without harming healthy tissues or the sensitive endothelium cells.",NASA,CARL JAMES R;;ARNDT G DICKEY;;FINK PATRICK W;;BEER N REGINALD;;HENRY PHILLIP D;;PACIFICO ANTONIO;;RAFFOUL GEORGE W,NATIONAL AERONAUTICS AND SPACE ADMINISTRATION U.S. GOVERNMENT AS REPRESENTED BY THE ADMINISTRATOR OF (1997-02-11),https://lens.org/073-234-840-883-281,Granted Patent,yes,19,136,4,15,0,A61B18/1206;;A61B18/1492;;A61B18/18;;A61B18/1815;;A61B2018/00351;;A61B2018/00577;;A61B2018/00732;;A61B2018/00791;;A61B2018/1861;;A61N1/06;;A61B18/18;;A61B18/1206;;A61B2018/00732;;A61N1/06;;A61B2018/00351;;A61B2018/00577;;A61B2018/00791;;A61B2018/1861;;A61B18/1492;;A61B18/1815,A61B18/14;;A61B18/18;;A61N1/06,607/101;;607/122;;607/156;;606/33;;606/42;;128/898,3,3,015-992-860-263-150;;045-746-574-308-949;;064-890-237-413-938,10.1109/tbme.1987.326039;;3557494;;3360458;;10.1109/10.1377;;2651001,"I.E.E.E. Tranasctions on Biomedical Engineering, vol. BME 34, No. 2, Feb. 1987, D.M. Sullivan, D.T. Borup, and O.M.P. Gandhi, Use of Finite Difference Time Domain Method in Calculating EM Absorption in Human Tissues, pp. 148 157.;;I.E.E.E. Transactions on Biomedical Engineering, vol. 35, No. 4, Apr. 1988, D. Andreuccetti, M. Bini, A. Ignesti, R. Olmi, N. Rubino, and R. Vanni, Use of Polyacrylamide as a Tissue Equivalent Material in the Microwave Range, pp. 275 277.;;Critical Reviews in Biomedical Engineering, K.R. Foster and H.P. Schwan, vol. 17, Issue 1, 1989, Dielectric Properties of Tissues and Biological Materials: A Critical Review, pp. 25 104.",EXPIRED
