"#",Jurisdiction,Kind,Display Key,Lens ID,Publication Date,Publication Year,Application Number,Application Date,Priority Numbers,Earliest Priority Date,Title,Abstract,Applicants,Inventors,Owners,URL,Document Type,Has Full Text,Cites Patent Count,Cited by Patent Count,Simple Family Size,Extended Family Size,Sequence Count,CPC Classifications,IPCR Classifications,US Classifications,NPL Citation Count,NPL Resolved Citation Count,NPL Resolved Lens ID(s),NPL Resolved External ID(s),NPL Citations,Legal Status
1,FR,A,FR 485584 A,114-592-116-262-084,1918-01-23,1918,FR 485584D A,1917-05-22,FR 485584T A,1917-05-22,Appareils pour bras artificiels pour permettre de saisir et de boutonner,,QUENTIN DURWARD CORLEY,CORLEY QUENTIN DURWARD,,https://lens.org/114-592-116-262-084,Granted Patent,no,0,0,1,1,0,A61F2/588,A61F2/58,"XIX, 2",0,0,,,,EXPIRED
2,FR,A1,FR 2559281 A1,043-261-941-447-45X,1985-08-09,1985,FR 8401866 A,1984-02-07,FR 8401866 A,1984-02-07,Film roll support assembly for camera apparatus,"The invention relates to an assembly comprising a sleeve 12 having end shafts 20, 21, in order for the sleeve to be able to turn in a camera apparatus. A ratchet 28 is elastically mounted in a slot of the sleeve so that it projects beyond the outer surface and can engage in a slot 16 of a core 11 of a film roll. In this way, the core 11 is automatically centred on the optical axis 19 of the camera apparatus. Application to photographic apparatuses. <IMAGE>",VISUAL GRAPHICS CORP,VAUGHAN QUENTIN DURWARD,,https://lens.org/043-261-941-447-45X,Patent Application,no,3,0,1,1,0,G03B27/587,G03B27/58,,0,0,,,,DISCONTINUED
3,GB,A,GB 120302 A,040-362-160-421-103,1918-11-07,1918,GB 1925317 A,1917-12-31,GB 1925317 A,1917-12-31,Improvements in Artificial Hand-grips.,"120,302. Corley, Q. D. Dec. 31, 1917. Limbs, artificial. - Comprises a gripping-device attachable to an artificial arm and so jointed as to simulate the action of the wrist. A shank 1 is revolubly mounted in an artificial cuff 3 and receives the plates 4, 5 attached to the U-shaped body 6 of the rigid jaw 12, a bolt 8 being passed through to form a pivot. A clamping-nut 11 on the shank engages the top plate 4 to hold the rigid jaw in an adjusted position. The movable jaw 15 is hinged on a shaft 16 carried by a U-shaped rigidjaw member 6, a pair of springs 18 keeping the jaws normally open. Depending from a shaft 16<1> carried by the movable jaw 15 are spaced ratchet bars 19 connected by springs 22 to a lip on a yoke 25 pivoted on the shaft 16<1> and having a slotted bearing thereon. The ratchet bars 19 pass through openings 20 in the fixed jaw and engage a dog 21. To grip a plough handle or the like, the jaws are placed astride the handle, and the hinged jaw closed over it by the other hand. The fixed dog 21 engages the ratchet bars and holds the jaws closed. Additional pressure may be given by a screw 24 which bears on the rear end of the yoke 25. A quick release is provided by a cord 33 moved from the shoulder which causes a lever 32 to move a disengaging-plate 27, Fig. 3, to push the ratchet bars away from the dog 21 against the influence of a spring 30. Hooks project laterally from the outer end of the rigid jaw for use in lifting and pulling, one of them having a hook-point adapted for buttoning wearing-apparel, lifting strings, &c.",CORLEY QUENTIN DURWARD,CORLEY QUENTIN DURWARD,,https://lens.org/040-362-160-421-103,Granted Patent,no,0,0,1,1,0,A61F2/588,A61F2/58,,0,0,,,,EXPIRED
4,GB,A,GB 113923 A,142-117-835-716-823,1918-03-14,1918,GB 1471817 A,1917-10-11,GB 1471817 A,1917-10-11,Artificial Hand.,"113,923. Corley, Q. D. Oct. 11, 1917. Limbs, artificial.-The fingers are adjustable into several positions by forming grooves 5 in their bases, into which a transverse loclcing-bar 6 is pressed by a spring 10. The bar can be retracted bv a cord 12. The thumb is pivoted on a stud 15 which carries a pulley segment 22 receiving the operating cord 23, and it is locked in the closed position by means of the ratchet 18 and pawl 19. For releasing the thumb, the cord 23 passes round a pulley 24 mounted on a dog 28. Tension of the cord causes the lip 33 of the dog to rotate the ratchet-wheel 29 and thereby the hexagonal cams 30 which depresses a sliding anglebar 31 having a shoe 32 bearing on the pawl 19. The pulley 22 is now free to be retracted by the spring 27 on relaxing the cord, the dog 28 riding back over the rack 29. In a modification, the fingers can be operated by a mechanism similar to that of the thumb.",CORLEY QUENTIN DURWARD,CORLEY QUENTIN DURWARD,,https://lens.org/142-117-835-716-823,Granted Patent,no,0,3,1,1,0,A61F2/583,A61F2/58,,0,0,,,,EXPIRED
5,CA,A,CA 186014 A,153-100-153-730-781,1918-08-13,1918,CA 186014D A,1917-11-13,CA 186014T A,1917-11-13,HAND,,CORLEY QUENTIN DURWARD,CORLEY QUENTIN DURWARD,,https://lens.org/153-100-153-730-781,Granted Patent,no,0,0,1,1,0,,,,0,0,,,,EXPIRED
6,CA,A,CA 181221 A,114-216-936-114-854,1917-12-25,1917,CA 181221D A,1917-04-10,CA 181221T A,1917-04-10,ARM,,CORLEY QUENTIN DURWARD,CORLEY QUENTIN DURWARD,,https://lens.org/114-216-936-114-854,Granted Patent,no,0,0,1,1,0,,,,0,0,,,,EXPIRED
7,CA,A,CA 181220 A,067-296-664-851-980,1917-12-25,1917,CA 181220D A,1917-03-19,CA 181220T A,1917-03-19,ARM,,CORLEY QUENTIN DURWARD,CORLEY QUENTIN DURWARD,,https://lens.org/067-296-664-851-980,Granted Patent,no,0,0,1,1,0,,,,0,0,,,,EXPIRED
8,FR,A,FR 487279 A,075-754-696-928-458,1918-06-19,1918,FR 487279D A,1917-10-22,FR 487279T A,1917-10-22,Main artificielle,,QUENTIN DURWARD CORLEY,CORLEY QUENTIN DURWARD,,https://lens.org/075-754-696-928-458,Granted Patent,no,0,0,1,1,0,A61F2/583,A61F2/58,"XIX, 2",0,0,,,,EXPIRED
9,FR,A,FR 485583 A,102-775-701-593-26X,1918-01-23,1918,FR 485583D A,1917-05-22,FR 485583T A,1917-05-22,Coudes articulés pour bras artificiels,,QUENTIN DURWARD CORLEY,CORLEY QUENTIN-DURWARD,,https://lens.org/102-775-701-593-26X,Granted Patent,no,0,1,1,1,0,A61F2/582,A61F2/58,"XIX, 2",0,0,,,,EXPIRED
10,AT,B,AT 86581 B,085-714-139-624-44X,1921-12-10,1921,AT 86581D A,1916-12-19,AT 86581T A,1916-12-19,Künstlicher Unterarm.,,CORLEY QUENTIN DURWARD,CORLEY QUENTIN DURWARD,,https://lens.org/085-714-139-624-44X,Granted Patent,no,0,0,1,1,0,,,30D,0,0,,,,EXPIRED
11,CA,A,CA 181223 A,097-765-958-181-035,1917-12-25,1917,CA 181223D A,1917-09-11,CA 181223T A,1917-09-11,HAND,,CORLEY QUENTIN DURWARD,CORLEY QUENTIN DURWARD,,https://lens.org/097-765-958-181-035,Granted Patent,no,0,0,1,1,0,,,,0,0,,,,EXPIRED
12,FR,B1,FR 2522418 B1,081-211-690-010-183,1986-01-31,1986,FR 8300571 A,1983-01-14,US 35363782 A,1982-03-01,APPAREIL DE TRAITEMENT COMPLET DE FILMS PHOTOGRAPHIQUES,,VISUAL GRAPHICS CORP,VAUGHAN QUENTIN DURWARD,,https://lens.org/081-211-690-010-183,Granted Patent,no,0,0,12,12,0,G03B27/323;;G03B27/323;;G03B17/50;;G03B17/50,G03B17/50;;G03B27/32,,0,0,,,,EXPIRED
13,FR,A,FR 481459 A,182-561-623-285-533,1916-12-08,1916,FR 481459D A,1916-04-10,FR 481459T A,1916-04-10,Bras artificiels,,QUENTIN DURWARD CORLEY,CORLEY QUENTIN DURWARD,,https://lens.org/182-561-623-285-533,Granted Patent,no,0,0,1,1,0,A61F2/58,A61F2/58,"XIX, 2",0,0,,,,EXPIRED
14,FR,A,FR 488714 A,021-492-380-772-868,1918-11-08,1918,FR 488714D A,1918-01-30,FR 488714T A,1918-01-30,Perfectionnements aux pinces de préhension pour bras artificiels,,QUENTIN DURWARD CORLEY,CORLEY QUENTIN DURWARD,,https://lens.org/021-492-380-772-868,Granted Patent,no,0,0,1,1,0,A61F2/588,A61F2/58,"XIX, 2",0,0,,,,EXPIRED
15,CA,A,CA 181222 A,124-498-727-578-928,1917-12-25,1917,CA 181222D A,1917-04-10,CA 181222T A,1917-04-10,ARM,,CORLEY QUENTIN DURWARD,CORLEY QUENTIN DURWARD,,https://lens.org/124-498-727-578-928,Granted Patent,no,0,0,1,1,0,,,,0,0,,,,EXPIRED
16,FR,A1,FR 2522418 A1,013-566-908-840-873,1983-09-02,1983,FR 8300571 A,1983-01-14,US 35363782 A,1982-03-01,APPAREIL DE TRAITEMENT COMPLET DE FILMS PHOTOGRAPHIQUES,"<P>L'INVENTION CONCERNE UN APPAREIL DE CONSERVATION, DE TRANSPORT, D'EXPOSITION ET DE DEVELOPPEMENT D'UN FILM PHOTOSENSIBLE.</P><P>ELLE SE RAPPORTE A UN APPAREIL QUI COMPORTE UN CHARIOT 26 PORTANT UN POSTE 20 DE TRANSPORT QUI CONTIENT UN ROULEAU DE FILM A EXPOSER. LA SECTION 20 DE TRANSPORT EST DEPLACEE SUR LE SOCLE 21 ET VIENT METTRE EN POSITION UN TRONCON DE FILM DANS LE PLAN IMAGE DE L'APPAREIL 17 DE PRISE DE VUES. LA SECTION 20 DE TRANSPORT ENTRAINE ENSUITE LE FILM EXPOSE VERS UN POSTE 71 DE TRAITEMENT. LA SECTION 20 DE TRANSPORT REVIENT ENSUITE EN POSITION INITIALE.</P><P>APPLICATION A LA FORMATION D'IMAGES DE GRAND FORMAT.</P>",VISUAL GRAPHICS CORP,VAUGHAN QUENTIN DURWARD,,https://lens.org/013-566-908-840-873,Patent Application,no,5,0,12,12,0,G03B27/323;;G03B27/323;;G03B17/50;;G03B17/50,G03B17/50;;G03B27/32,,0,0,,,,EXPIRED
17,GB,A,GB 101384 A,102-722-372-316-480,1916-09-14,1916,GB 497616 A,1916-04-05,GB 497616 A,1916-04-05,Artificial Arms.,"101,384. Corley, Q. D. April 5, 1916. Limbs, artificial.-An arm is provided with various means for grasping and manipulating objects and is designed so that the objects can be manipulated and the arm fitted on the person by people who have lost both hands. A forearm socket 1 is articulated to a divided sleeve 2 laced on the upper arm, and the laces are passed finally round friction hooks acting as locking-devices to prevent the lace from running back, thus enabling the wearer to draw the laces tight by holding the ends in his teeth. The lower end of the socket 1 carries a double clutch operated by the screw 15, which has an elongated head adapted to he rotated by the teeth or by friction against a table. The two clutch elements 13, 17 form part of a guided hollow rectangular frame 12. The element 17 co-operates with a slotted plate 16 and a socket 18 to hold the handles of knives, forks, &c., which are picked up by sliding the pointed end 19 of the socket underneath them. The element 13 co-operates with a fixed clutch element 10 to grasp a grooved stud 26 on the end of a combined hook and spring grasping-device, shown in Fig. 3. The upper member 21 is formed with long and short hooks 22, 23 respectively, which have hooked points 24 arranged as shown. The lower member 27 is spaced from the plate 21 and is provided with a depression 28 at an angle with its main axis. This member only extends laterally under the longer hook 22 and normally abuts against the under surface of the hook, except at the extreme end 29, which is curved downwardly and reduced to a fine edge to facilitate insertion under an object, such as a sheet of paper or a coin. By rotating a ratchet-wheel 30 carrying three cams 30<1>, the member 27 is alternately sprung downwards into the position shown in dotted lines in Fig. 1 and released again. Suitable objects may thus be grasped between the hook 22 and the member 27. Round objects, such as pencils, are additionally supported in the depression 28, as shown in dotted lines in Fig. 3. To operate the ratchet-wheel, the wearer first bends the forearm and pushes the pawl lever 31 in an anti-clockwise direction with his teeth. Then, on straightening the arm, the lever is moved in a clockwise direction through the medium of the cord 34 to operate the ratchet-wheel. The main hooks 22, 23 are used for lifting purposes, while the hooked points 24 are stated to be useful for buttoning clothes, opening purses, and tying and untying strings.",CORLEY QUENTIN DURWARD,CORLEY QUENTIN DURWARD,,https://lens.org/102-722-372-316-480,Granted Patent,no,0,1,1,1,0,A61F2/588,A61F2/58,,0,0,,,,EXPIRED
18,GB,A,GB 110710 A,196-101-839-157-283,1917-11-01,1917,GB 707517 A,1917-05-17,GB 707517 A,1917-05-17,Gripping and Buttoning Devices for Artificial Arms.,"110,710. Corley, Q. D. May 17, 1917. Button-hooks and the like.-An artificial arm is provided with a buttoning attachment comprising a curved loop 24 carried by a sleeve 21 which is mounted upon a rod 17 and has quadrant notches 22 for engaging pins 23 to lock it against rotation in four angular positions. The rod is secured by a flynut 19 to the fixed jaw 2 of a gripping- device and can be slung sideways out of the way.",CORLEY QUENTIN DURWARD,CORLEY QUENTIN DURWARD,,https://lens.org/196-101-839-157-283,Granted Patent,no,0,0,1,1,0,A61F2/588,A61F2/58,,0,0,,,,EXPIRED
19,CA,A,CA 197020 A,173-034-100-324-213,1920-02-10,1920,CA 197020D A,,CA 197020T A,,ELBOW STRUCTURE,,CORLEY QUENTIN DURWARD,CORLEY QUENTIN DURWARD,,https://lens.org/173-034-100-324-213,Granted Patent,no,0,0,1,1,0,,,,0,0,,,,EXPIRED
20,FR,A2,FR 2544088 A2,186-288-539-561-479,1984-10-12,1984,FR 8316038 A,1983-10-07,US 48391583 A,1983-04-11,"APPAREIL DE STOCKAGE, DE TRANSPORT ET D'EXPOSITION D'UN FILM PHOTOGRAPHIQUE","<P>L'INVENTION CONCERNE UN APPAREIL DE STOCKAGE, DE TRANSPORT ET D'EXPOSITION D'UN FILM PHOTOGRAPHIQUE.</P><P>SELON L'INVENTION, LE FILM EST MAINTENU CONTRE UN PLATEAU TRANSPARENT PAR UNE FEUILLE SOUPLE DE MATIERE PLASTIQUE QUI, DU COTE DU FILM, A DES SAILLIES 38 DE FORME ALLONGEE QUI DELIMITENT ENTRE ELLES DES ESPACES POUR LA CIRCULATION D'AIR. UNE DEPRESSION EST APPLIQUEE A UNE EXTREMITE DE LA FEUILLE 37 ET SE PROPAGE PROGRESSIVEMENT SI BIEN QU'ELLE CHASSE TOUT L'AIR ET QUE LE FILM EST BIEN APPLIQUE CONTRE LE PLATEAU TRANSPARENT.</P><P>APPLICATION AUX APPAREILS DE TIRAGE PHOTOGRAPHIQUE.</P>",VISUAL GRAPHICS CORP,VAUGHAN QUENTIN DURWARD,,https://lens.org/186-288-539-561-479,Patent Application,no,5,0,12,12,0,G03B17/50;;G03B27/323;;G03B27/60;;G03B17/50;;G03B27/323;;G03B27/60,G03B17/50;;G03B27/32;;G03B17/02;;G03B27/60,,0,0,,,,DISCONTINUED
21,US,A1,US 2010/0070034 A1,055-513-765-501-624,2010-03-18,2010,US 21298008 A,2008-09-18,US 21298008 A,2008-09-18,CERVICAL INTRA-LAMINA FUSION IMPLANT DEVICE AND METHOD,"A cervical intra-laminar fusion implant to be placed in cervical lamina includes a first lateral surface including a first arched edge, a second lateral surface positioned opposite to the first lateral surface, the second lateral surface including a plurality of posterior windows and a second arched edge, a top wall attached to the first lateral surface and the second lateral surface, the top wall having a plurality of teeth, a bottom wall positioned opposite to the top wall and attached to the first lateral surface and the second lateral surface, the bottom wall having a plurality of bottom teeth, a plurality of internal voids configured through the top wall and the bottom wall, and a connection mechanism connected to the top wall. The connection mechanism is positioned superior over the cervical lamina.",CUSTOM SPINE INC,DURWARD QUENTIN;;MARKWORTH AARON D,CUSTOM SPINE INC (2008-09-09),https://lens.org/055-513-765-501-624,Patent Application,yes,4,5,1,1,0,A61F2/4465;;A61F2/4465;;A61B17/7055;;A61B17/7055;;A61B17/7071;;A61B17/7071;;A61F2002/30133;;A61F2002/30133;;A61F2002/30433;;A61F2002/30433;;A61F2002/30507;;A61F2002/30507;;A61F2002/30578;;A61F2002/30578;;A61F2002/30593;;A61F2002/30593;;A61F2002/30777;;A61F2002/30777;;A61F2002/30785;;A61F2002/30785;;A61F2002/30891;;A61F2002/30891;;A61F2002/30892;;A61F2002/30892;;A61F2002/449;;A61F2002/449;;A61F2220/0025;;A61F2220/0025;;A61F2220/0041;;A61F2220/0041;;A61F2230/0015;;A61F2230/0015,A61F2/44;;A61B17/04,623/17.16;;623/17.11;;606/330,0,0,,,,DISCONTINUED
22,WO,A3,WO 2009/075905 A3,028-306-178-549-315,2010-01-21,2010,US 2008/0061868 W,2008-04-29,US 95318507 A,2007-12-10,SPINAL FLEXION AND EXTENSION MOTION DAMPER,"An orthopedic damper system and method to control the degree of flexion and/or extension motion of the mobile vertebral segment while providing additional stability to the spine. The damper system includes an anchor having a spring hitch, a spring coupled to the spring hitch, and a cap coupled to the spring. The anchor is adapted to connect to a spinous process. The spring includes an inner hollow area adapted to accommodate the spring hitch. The cap includes an opening connected to an inner cavity that is adapted to accommodate the spring and the spring hitch.",CUSTOM SPINE INC,DURWARD QUENTIN JOHN;;ABDELGANY MAHMOUD F,,https://lens.org/028-306-178-549-315,Search Report,yes,4,0,8,8,0,A61B17/7055;;A61B17/7055;;A61B17/7032;;A61B17/7032;;A61B17/7049;;A61B17/7049;;A61B17/7062;;A61B17/7062;;A61B17/7067;;A61B17/7067,A61B17/70,,1,0,,,See also references of EP 2231045A4,PENDING
23,EP,A2,EP 2231045 A2,006-978-174-877-817,2010-09-29,2010,EP 08754954 A,2008-04-29,US 2008/0061868 W;;US 95318507 A,2007-12-10,SPINAL FLEXION AND EXTENSION MOTION DAMPER,,CUSTOM SPINE INC,DURWARD QUENTIN JOHN;;ABDELGANY MAHMOUD F,,https://lens.org/006-978-174-877-817,Patent Application,yes,0,0,8,8,0,A61B17/7055;;A61B17/7055;;A61B17/7032;;A61B17/7032;;A61B17/7049;;A61B17/7049;;A61B17/7062;;A61B17/7062;;A61B17/7067;;A61B17/7067,A61B17/70,,0,0,,,,DISCONTINUED
24,US,B2,US 8202300 B2,048-718-791-269-019,2012-06-19,2012,US 95318507 A,2007-12-10,US 95318507 A,2007-12-10,Spinal flexion and extension motion damper,"An orthopedic damper system and method to control the degree of flexion and/or extension motion of the mobile vertebral segment while providing additional stability to the spine. The damper system includes an anchor having a spring hitch, a spring coupled to the spring hitch, and a cap coupled to the spring. The anchor is adapted to connect to a spinous process. The spring includes an inner hollow area adapted to accommodate the spring hitch. The cap includes an opening connected to an inner cavity that is adapted to accommodate the spring and the spring hitch.",DURWARD QUENTIN JOHN;;ABDELGANY MAHMOUD F;;CUSTOM SPINE INC,DURWARD QUENTIN JOHN;;ABDELGANY MAHMOUD F,EXWORKS ASSET HOLDINGS LLC (2015-07-17);;CUSTOM SPINE ACQUISITION INC (2016-01-14);;CUSTOM SPINE INC (2007-12-02),https://lens.org/048-718-791-269-019,Granted Patent,yes,7,1,8,8,0,A61B17/7055;;A61B17/7055;;A61B17/7032;;A61B17/7032;;A61B17/7049;;A61B17/7049;;A61B17/7062;;A61B17/7062;;A61B17/7067;;A61B17/7067,A61B17/70,606/248;;606/246;;606/250,0,0,,,,ACTIVE
25,EP,A4,EP 2231045 A4,033-190-916-852-500,2013-04-03,2013,EP 08754954 A,2008-04-29,US 2008/0061868 W;;US 95318507 A,2007-12-10,SPINAL FLEXION AND EXTENSION MOTION DAMPER,,CUSTOM SPINE INC,DURWARD QUENTIN JOHN;;ABDELGANY MAHMOUD F,,https://lens.org/033-190-916-852-500,Search Report,no,1,0,8,8,0,A61B17/7055;;A61B17/7055;;A61B17/7032;;A61B17/7032;;A61B17/7049;;A61B17/7049;;A61B17/7062;;A61B17/7062;;A61B17/7067;;A61B17/7067,A61B17/70,,0,0,,,,DISCONTINUED
26,US,A1,US 2009/0149885 A1,031-675-798-616-525,2009-06-11,2009,US 95318507 A,2007-12-10,US 95318507 A,2007-12-10,SPINAL FLEXION AND EXTENSION MOTION DAMPER,"An orthopedic damper system and method to control the degree of flexion and/or extension motion of the mobile vertebral segment while providing additional stability to the spine. The damper system includes an anchor having a spring hitch, a spring coupled to the spring hitch, and a cap coupled to the spring. The anchor is adapted to connect to a spinous process. The spring includes an inner hollow area adapted to accommodate the spring hitch. The cap includes an opening connected to an inner cavity that is adapted to accommodate the spring and the spring hitch.",CUSTOM SPINE INC,DURWARD QUENTIN JOHN;;ABDELGANY MAHMOUD F,EXWORKS ASSET HOLDINGS LLC (2015-07-17);;CUSTOM SPINE ACQUISITION INC (2016-01-14);;CUSTOM SPINE INC (2007-12-02),https://lens.org/031-675-798-616-525,Patent Application,yes,7,80,8,8,0,A61B17/7055;;A61B17/7055;;A61B17/7032;;A61B17/7032;;A61B17/7049;;A61B17/7049;;A61B17/7062;;A61B17/7062;;A61B17/7067;;A61B17/7067,A61B17/70;;A61B17/04;;A61B17/08;;A61B17/56;;A61B17/58,606/246;;606/103;;606/151;;606/301;;606/279;;606/302;;606/308,0,0,,,,ACTIVE
27,WO,A2,WO 2009/075905 A2,192-177-042-823-176,2009-06-18,2009,US 2008/0061868 W,2008-04-29,US 95318507 A,2007-12-10,SPINAL FLEXION AND EXTENSION MOTION DAMPER,"An orthopedic damper system and method to control the degree of flexion and/or extension motion of the mobile vertebral segment while providing additional stability to the spine. The damper system includes an anchor having a spring hitch, a spring coupled to the spring hitch, and a cap coupled to the spring. The anchor is adapted to connect to a spinous process. The spring includes an inner hollow area adapted to accommodate the spring hitch. The cap includes an opening connected to an inner cavity that is adapted to accommodate the spring and the spring hitch.",CUSTOM SPINE INC,DURWARD QUENTIN JOHN;;ABDELGANY MAHMOUD F,,https://lens.org/192-177-042-823-176,Patent Application,yes,0,1,8,8,0,A61B17/7055;;A61B17/7055;;A61B17/7032;;A61B17/7032;;A61B17/7049;;A61B17/7049;;A61B17/7062;;A61B17/7062;;A61B17/7067;;A61B17/7067,A61B17/58;;A61B17/04;;A61B17/08;;A61B17/56;;A61B17/70,,1,0,,,See references of EP 2231045A4,PENDING
28,EP,B1,EP 0116555 B1,048-031-513-483-145,1987-09-30,1987,EP 83901174 A,1983-03-28,US 41025982 A,1982-08-23,ADAPTIVE SIGNAL RECEIVING METHOD AND APPARATUS,,"WESTERN ELECTRIC COMPANY, INCORPORATED","BATTISTA, RALPH, NICHOLAS;;GROVES, QUENTIN, DURWARD;;TOW, JIMMY",,https://lens.org/048-031-513-483-145,Granted Patent,yes,2,0,6,6,0,H04Q1/457;;H04Q1/457,H04L27/26;;H04Q1/457,,0,0,,,,EXPIRED
29,EP,A1,EP 0116555 A1,118-863-562-799-540,1984-08-29,1984,EP 83901174 A,1983-03-28,US 41025982 A,1982-08-23,ADAPTIVE SIGNAL RECEIVING METHOD AND APPARATUS.,"Un récepteur de tonalité destiné à être utilisé dans un système téléphonique retrécit de manière adaptative sa gamme de sensibilité à l'amplitude, définissant des signaux de tonalité valables en fonction de l'appel par rapport à l'amplitude d'un premier signal de tonalité reçu lors d'un appel. Cette caractéristique d'adaptation aux gammes de signaux permet d'améliorer le rejet de l'écho du signal ainsi que l'élimination des bruits parasites. Un mode préférentiel de réalisation consiste en un processeur de signaux numérique programmé qui augmente le niveau des signaux de faible amplitude par rapport à l'amplitude du premier signal. Un mode alternatif de réalisation atténue de manière adaptative le niveau des signaux à l'arrivée avant la validation de ces signaux. Une autre amélioration des deux modes de réalisation permet un retrécissement supplémentaire de la gamme d'amplitude par rapport à tout signal successif d'un appel possédant une amplitude plus grande que celle de tout signal précédent dans le même appel.",WESTERN ELECTRIC CO,BATTISTA RALPH NICHOLAS;;GROVES QUENTIN DURWARD;;TOW JIMMY,,https://lens.org/118-863-562-799-540,Patent Application,yes,0,0,6,6,0,H04Q1/457;;H04Q1/457,H04L27/26;;H04Q1/457,,0,0,,,,EXPIRED
30,WO,A1,WO 1984/000867 A1,039-955-129-146-180,1984-03-01,1984,US 8300434 W,1983-03-28,US 41025982 A,1982-08-23,ADAPTIVE SIGNAL RECEIVING METHOD AND APPARATUS,A tone receiver suitable for use in a telephone system and which adaptively narrows its amplitude sensitivity range defining valid tone signals on a per call basis in accordance with the amplitude of a first tone signal received on a call. The signal range adaptability improves signal echo rejection and spurius noise talkoff. A preferred embodiment is implemented by a programmed digital signal processor which increases the lower amplitude signal threshold in accordance with the amplitude of the first signal. An alternative embodiment adaptively attenuates the level of incoming signals before signal validation. A further improvement of both embodiments allows further amplitude range narrowing in response to any subsequent signal on a call which has an amplitude greater than that of any preceding signal in the call.,WESTERN ELECTRIC CO,BATTISTA RALPH NICHOLAS;;GROVES QUENTIN DURWARD;;TOW JIMMY,,https://lens.org/039-955-129-146-180,Patent Application,yes,4,2,6,6,0,H04Q1/457;;H04Q1/457,H04Q1/457;;H04L27/26,H4K KBV           KBV,3,2,047-750-170-513-860;;033-991-315-005-250,10.1002/j.1538-7305.1981.tb00285.x;;10.1109/tcom.1977.1093872,"The Bell System Technical Journal, Volume 60, September 1981, No. 7, Part 2 Murrea Hill, BODDIE et al.: ""Digital Signal Processor: Receiver for Touch-Tone Service"" pages 1573-1583, see page 1576, line 16 to page 1581, line 2;;IEEE Transactions on Communications, Vol. COM-25, No. 6, June 1977 New York (US) BAUGH: ""Design and Performance of a Digital Multifrequency Receiver"", pages 608 to 615, see page 611, right-hand column, line 1 to page 612, left-hand column, line 23;;IBM Technical Disclosure Bulletin, Volume 18, No. 7, December 1975, New York (US) GRICE: ""Digital Automatic gain Control for Multifrequency Receiver"", pages 2203-2204, see page 2203, line 1 to page 2204, line 5",PATENTED
31,US,A1,US 2011/0087287 A1,025-934-169-319-188,2011-04-14,2011,US 57692909 A,2009-10-09,US 57692909 A,2009-10-09,Rod-to-Rod Connector,"A rod-to-rod connector assembly comprising a longitudinal member, which may be straight or S-shaped or have some other configuration; and a connecting member connected to a first end of the longitudinal member, wherein the connecting member comprises a pair of threaded opposed ends defining a channel therebetween. The assembly may further comprise a threaded blocking mechanism that engages the pair of threaded opposed ends of the connecting member. Preferably, the longitudinal member connects to only one of the opposed ends of the connecting member. The longitudinal member may comprise a first elongated portion comprising a first longitudinal axis; a second elongated portion comprising a second longitudinal axis; and a curved portion connecting the first elongated portion to the second elongated portion, wherein the first longitudinal axis and the second longitudinal axis are parallel to one another.",CUSTOM SPINE INC,REEDER JR RALPH F;;DURWARD QUENTIN;;FAIZAN AHMAD;;ABDELGANY MAHMOUD F,CUSTOM SPINE INC (2009-10-08),https://lens.org/025-934-169-319-188,Patent Application,yes,20,71,1,1,0,A61B17/7011;;A61B17/7035;;A61B17/705;;A61B17/705;;A61B17/7035;;A61B17/7011,A61B17/70,606/250;;606/264,0,0,,,,DISCONTINUED
