93,DE,T2,DE 60316467 T2,152-900-927-198-370,2008-06-12,2008,DE 60316467 T,2003-12-04,GB 0228533 A;;EP 0313800 W,2002-12-06,KRISTALLFORMEN VON 2-(5-CHLORTHIEN-2-YL)-N-((3S)-1((1S)-1-METHYL-2-MORPHOLIN-4-YL-2-OXOETHYL)-2-OXOPYRROLIDIN-3-YL)ETHENSULFONAMID,,GLAXO GROUP LTD,DELL ORCO PHILIP C;;KELLY HENRY ANDERSON;;SHAH GITA PUNJABHAI;;WATSON NIGEL STEPHEN;;YOUNG ROBERT JOHN,,https://lens.org/152-900-927-198-370,Granted Patent,no,0,0,36,37,0,C07D409/12;;A61P11/00;;A61P25/16;;A61P25/28;;A61P29/00;;A61P35/04;;A61P43/00;;A61P7/02;;A61P9/00;;A61P9/04;;A61P9/10;;C07D413/14;;C07D409/14;;C07D409/12;;C07D409/12,C07D409/12,,0,0,,,,EXPIRED
94,PL,A1,PL 377184 A1,155-469-694-680-687,2006-01-23,2006,PL 37718403 A,2003-12-04,GB 0228533 A,2002-12-06,CRYSTALLINE FORM,,GLAXO GROUP LTD,DELL ORCO PHILIP C;;KELLY HENRY ANDERSON;;SHAH GITA PUNJABHAI;;WATSON NIGEL STEPHEN;;YOUNG ROBERT JOHN,,https://lens.org/155-469-694-680-687,Patent Application,no,0,0,36,37,0,C07D409/12;;A61P11/00;;A61P25/16;;A61P25/28;;A61P29/00;;A61P35/04;;A61P43/00;;A61P7/02;;A61P9/00;;A61P9/04;;A61P9/10;;C07D413/14;;C07D409/14;;C07D409/12;;C07D409/12,C07D409/14;;C07D409/12,,0,0,,,,DISCONTINUED
95,EP,A1,EP 2155256 A1,191-995-567-755-426,2010-02-24,2010,EP 08737154 A,2008-05-02,GB 2008001526 W;;GB 0708585 A,2007-05-03,NOVEL ANTIBODY AND USE IN DIAGNOSIS AND THERAPY OF ARTHROPATHIES,,QUEEN MARY & WESTFIELD COLLEGE,NISSIM AHUVA;;CHERNAJOVSKY YUTI;;FAURHOLM BJARNE;;PERRETT DAVID;;WINYARD PAUL;;HUGHES CHRISTOPHER;;MATHER STEPHEN;;DELL ACCIO FRANCESCO,,https://lens.org/191-995-567-755-426,Patent Application,yes,0,0,9,9,0,A61K47/6843;;A61K47/6811;;A61K47/6817;;A61K47/6813;;A61P19/02;;A61K47/6843;;A61K51/1096;;C07K16/18;;C07K2317/55;;C07K2317/565;;C07K2317/569;;C07K2317/622;;C07K2317/76;;A61K47/6811;;A61K47/6803;;A61K47/6817;;A61K47/6813;;A61K47/6851;;A61K47/6849,A61P19/02;;A61K47/68;;A61K51/10;;C07K16/18,,0,0,,,,ACTIVE
96,US,A1,US 2011/0129415 A1,196-350-318-524-567,2011-06-02,2011,US 59867108 A,2008-05-02,GB 0708585 A;;GB 2008001526 W,2007-05-03,NOVEL ANTIBODY AND USE IN DIAGNOSIS AND THERAPY OF ARTHROPATHIES,"The present invention provides a composition comprising an antibody or fragment thereof against oxidised Collagen II (CII) in which the antibody or fragment thereof is conjugated to a pharmaceutically active moiety. The invention also provides a composition comprising an antibody or fragment thereof against oxidised Collagen II (Gil) and a detectable label. The invention further provides the use of such compositions in medicine, in particular for the treatment of an arthropathy, and in methods of diagnosis.",NISSIM AHUVA;;CHERNAJOVSKY YUTI;;FAURHOLM BJARNE;;PERRETT DAVID;;WINYARD PAUL;;HUGHES CHRISTOPHER;;MATHER STEPHEN;;DELL ACCIO FRANCESCO,NISSIM AHUVA;;CHERNAJOVSKY YUTI;;FAURHOLM BJARNE;;PERRETT DAVID;;WINYARD PAUL;;HUGHES CHRISTOPHER;;MATHER STEPHEN;;DELL ACCIO FRANCESCO,QUEEN MARY & WESTFIELD COLLEGE (2009-12-11),https://lens.org/196-350-318-524-567,Patent Application,yes,1,3,9,9,223,A61K47/6843;;A61K47/6811;;A61K47/6817;;A61K47/6813;;A61P19/02;;A61K47/6843;;A61K51/1096;;C07K16/18;;C07K2317/55;;C07K2317/565;;C07K2317/569;;C07K2317/622;;C07K2317/76;;A61K47/6811;;A61K47/6803;;A61K47/6817;;A61K47/6813;;A61K47/6851;;A61K47/6849,A61K51/10;;A61K38/19;;A61K38/21;;A61K39/395;;A61K49/00;;A61P19/02;;C07K14/52;;C07K14/555;;C07K14/565;;C07K16/00,424/1.49;;530/387.3;;530/351;;424/133.1;;424/85.1;;424/85.6;;424/9.1;;424/85.4,3,3,014-113-432-888-031;;008-841-048-374-253;;004-891-036-744-106,12218124;;10.4049/jimmunol.169.6.3076;;11451948;;10.1074/jbc.m102367200;;10592229;;pmc102431;;10.1093/nar/28.1.214,"De Pascalis, R., et al. J. Immunol. 2002;169:3076-3084.;;Lamminmaki, U., et al. J. Biol. Chem. 2001;276(39):36687-36694.;;Johnson, G. and Wu, T.T. Nuc.Acid Res. 2000;28(1):214-218",INACTIVE
97,WO,A1,WO 2008/135734 A1,187-686-751-300-313,2008-11-13,2008,GB 2008001526 W,2008-05-02,GB 0708585 A,2007-05-03,NOVEL ANTIBODY AND USE IN DIAGNOSIS AND THERAPY OF ARTHROPATHIES,"The present invention provides a composition comprising an antibody or fragment thereof against oxidised Collagen II (CII) in which the antibody or fragment thereof is conjugated to a pharmaceutically active moiety. The invention also provides a composition comprising an antibody or fragment thereof against oxidised Collagen II (Gil) and a detectable label. The invention further provides the use of such compositions in medicine, in particular for the treatment of an arthropathy, and in methods of diagnosis.",QUEEN MARY & WESTFIELD COLLEGE;;NISSIM AHUVA;;CHERNAJOVSKI YUTI;;FAURHOLM BJARNE;;DAVID PERRETT;;WINYARD PAUL;;HUGHES CHRISTOPHER;;MATHER STEPHEN;;DELL ACCIO FRANCESCO,NISSIM AHUVA;;CHERNAJOVSKI YUTI;;FAURHOLM BJARNE;;DAVID PERRETT;;WINYARD PAUL;;HUGHES CHRISTOPHER;;MATHER STEPHEN;;DELL ACCIO FRANCESCO,,https://lens.org/187-686-751-300-313,Patent Application,yes,0,19,9,9,223,A61K47/6843;;A61K47/6811;;A61K47/6817;;A61K47/6813;;A61P19/02;;A61K47/6843;;A61K51/1096;;C07K16/18;;C07K2317/55;;C07K2317/565;;C07K2317/569;;C07K2317/622;;C07K2317/76;;A61K47/6811;;A61K47/6803;;A61K47/6817;;A61K47/6813;;A61K47/6851;;A61K47/6849,A61K47/48;;A61P19/02,,6,6,109-241-006-378-777;;013-778-176-722-031;;130-597-731-889-324;;083-946-652-602-356;;017-845-044-741-073;;075-897-965-312-431,16329077;;10.1002/art.21479;;12355481;;10.1002/art.10472;;10.1186/ar2115;;17261171;;pmc1860067;;15494535;;10.4049/jimmunol.173.9.5818;;10395698;;10.4049/jimmunol.168.5.2554;;11859151,"NISSIM A. ET AL.: ""Generation of Neoantigenic Epitopes after Postraslational Modification of Type II Collagen by Factors Present Within the Inflamed Joint"", ARTHRITIS AND RHEUMATISM, vol. 52, no. 12, 2005, pages 3829 - 3838, XP007905787;;BURKHARDT H. ET AL.: ""EPITOPE-SPECIFIC RECOGNITION OF TYPE II COLLAGEN BY RHEUMATOID ARTHRITIS ANTIBODIES IS SHARED WITH RECOGNITION BY ANTIBODIES THAT ARE ARTHROGENIC IN COLLAGEN-INDUCED ARTHRITIS IN THE MOUSE"", ARTHRITIS AND RHEUMATISM, vol. 46, no. 9, 2002, pages 2339 - 2348, XP007905790;;TRACHSEL E. ET AL.: ""Antibody-mediated delivery of IL-10 inhibits the progression of established collagen-induced arthritis"", ARTHRITIS RESEARCH & THERAPY, vol. 9, 29 January 2007 (2007-01-29), pages R9, XP021026953;;FERRARI-LACRAZ SYLVIE ET AL: ""Targeting IL-15 receptor-bearing cells with an antagonist mutant IL-15/Fc protein prevents disease development and progression in murine collagen-induced arthritis"", JOURNAL OF IMMUNOLOGY, AMERICAN ASSOCIATION OF IMMUNOLOGISTS, US, vol. 173, no. 9, 1 November 2004 (2004-11-01), pages 5818 - 5826, XP002345721, ISSN: 0022-1767;;QUATTROCCHI E. ET AL.: ""Paradoxical Effects of Adenovirus-Mediated Blockade of TNF Activity in Murine Collagen"", THE JOURNAL OF IMMUNOLOGY, vol. 163, 1999, pages 1000 - 1009, XP007905791;;ZUO LI ET AL.: ""A Single-Chain Class II MHC-IgG3 Fusion Protein Inhibits Autoimmune Arthritis by Induction of Antigen-specific Hyporesponsiveness"", THE JOURNAL OF IMMUNOLOGY, vol. 168, 2002, pages 2554 - 2559, XP007905792",PENDING
98,US,A1,US 2004/0187099 A1,172-147-285-982-910,2004-09-23,2004,US 73925903 A,2003-12-18,US 73925903 A;;US 39249603 A,2003-03-20,System and method for processing price plans on a device based rating engine,"
   There is disclosed a simplified rating language for crafting price plans for ratable events which may be interpreted by either a source level interpreter resident upon a device also comprising a device based rating engine or via a virtual machine designed for said rating language. 
",CONVERGYS INFORMATION MAN GROU,IRWIN SCOTT A;;BIRCH ROBERT D;;LUPO JOSEPH P;;VU BICHVAN THI;;SHEN DELL;;WEAGRAFF STEPHEN D,CONVERGYS INFORMATION MANAGEMENT GROUP INC (2003-12-18);;CONVERGYS CMG UTAH (2007-11-14),https://lens.org/172-147-285-982-910,Patent Application,yes,12,10,1,1,0,G06Q30/04;;H04M15/28;;H04M15/30;;H04M15/51;;H04M15/80;;H04M15/83;;H04M17/00;;H04M17/10;;H04M2215/0152;;H04M2215/22;;H04M2215/54;;H04M2215/82;;H04M2215/92;;G06Q30/04;;H04M2215/0152;;H04M15/51;;H04M2215/92;;H04M15/30;;H04M2215/22;;H04M2215/82;;H04M17/10;;H04M15/83;;H04M17/00;;H04M15/28;;H04M2215/54;;H04M15/80,G06Q30/04;;H04M15/28;;H04M17/00,717/136;;717/114;;717/108,0,0,,,,DISCONTINUED
99,US,A1,US 2014/0171799 A1,023-025-971-843-779,2014-06-19,2014,US 201213718762 A,2012-12-18,US 201213718762 A;;US 201261736973 P,2012-12-13,SYSTEMS AND METHODS FOR PROVIDING ULTRASOUND PROBE LOCATION AND IMAGE INFORMATION,Systems and methods for providing ultrasound probe location and image information are provided. One system includes an ultrasound device coupled with an ultrasound probe and configured to acquire ultrasound images of a subject. The system further includes at least one of a plurality of digital cameras or a plurality of digital scanners configured to acquire scene information including images of the ultrasound probe with the subject during an image scan. The system also includes a processor having an ultrasound registration unit (URU) with the URU configured to identify and reference a probe location of the ultrasound probe to a surface of the object from the scene information and correlate the probe location to one or more of the acquired ultrasound images. The URU is additionally configured to generate a representation of the surface showing the identified and referenced probe location corresponding to the correlated ultrasound images.,GEN ELECTRIC,HERSHEY JOHN ERIK;;HARTMAN MICHAEL JAMES;;BONANNI PIERINO GIANNI;;BUSH STEPHEN FRANCIS;;DELL ANNO MICHAEL JOSEPH;;SORO STANISLAVA,GENERAL ELECTRIC COMPANY (2012-12-11),https://lens.org/023-025-971-843-779,Patent Application,yes,1,22,1,1,0,A61B8/4254;;A61B8/4254;;A61B5/061;;A61B5/061;;A61B8/4444;;A61B8/4477;;A61B8/4477;;A61B8/565;;A61B8/565,A61B8/00;;A61B5/00;;A61B8/08;;A61B8/13,600/440,0,0,,,,DISCONTINUED
100,DE,A1,DE 2617548 A1,145-570-283-862-607,1976-11-04,1976,DE 2617548 A,1976-04-22,US 57092475 A,1975-04-22,LASER-ISOTOPENTRENNUNG,,US ENERGY,ROBINSON CHARLES PAUL;;ROCKWOOD STEPHEN DELL;;JENSEN REED JERRY;;LYMAN JOHN LESLIE;;ALDRIDGE III JACK PAXTON;;MEMBERS STAFF,,https://lens.org/145-570-283-862-607,Patent Application,no,0,1,9,10,0,B01D59/34;;B01D59/34,B01D59/34;;H01S3/00,,0,0,,,,DISCONTINUED
101,US,B2,US 8621629 B2,147-859-952-200-783,2013-12-31,2013,US 87330910 A,2010-08-31,US 87330910 A,2010-08-31,"System, method, and computer software code for detecting a computer network intrusion in an infrastructure element of a high value target","An intrusion detection system for detecting and defeating unauthorized intrusion within a computer network of an infrastructure element of a high value target, the system including a pre-processor configured to receive data from a computer network of an infrastructure element of a high value target and to output filtered data, a grammar applicator configured to apply grammars produced using a grammar based compression and learning algorithm to the filtered data, a decision making device configured to provide a recommendation based on an input from the grammar applicator as to whether the data in the computer network constitutes an unauthorized intrusion, and an emulator in communication with the decision making device configured to expand a sampling of the filtered data using a polymorphic transformation to allow the decision making device to further analyze the sampled data to determine an unauthorized intrusion. A method and a computer software code are also disclosed.",EVANS SCOTT CHARLES;;POTDAR YOGESH KESRINATH;;DELL ANNO MICHAEL JOSEPH;;MARKHAM THOMAS STEPHEN;;KLINGBEIL ADAM EDGAR;;BORING ROBERT;;BARNETT BRUCE GORDON;;GEN ELECTRIC,EVANS SCOTT CHARLES;;POTDAR YOGESH KESRINATH;;DELL ANNO MICHAEL JOSEPH;;MARKHAM THOMAS STEPHEN;;KLINGBEIL ADAM EDGAR;;BORING ROBERT;;BARNETT BRUCE GORDON,GE DIGITAL HOLDINGS LLC (2023-11-10);;GENERAL ELECTRIC COMPANY (2010-09-03),https://lens.org/147-859-952-200-783,Granted Patent,yes,13,2,2,2,0,H04L63/1416;;H04L63/1416,H04L29/06,726/23,1,0,,,"Zhou, Jian et al, ""Analy. of Command Frequency and Command Sequence Grammar in IDS,"" 2008IEEE Conf. on Soft Computing in Indus. Apps. (SMCia/08), Jun. 25-27, pp. 113-118.",ACTIVE
102,US,A1,US 2012/0054866 A1,143-305-585-601-162,2012-03-01,2012,US 87330910 A,2010-08-31,US 87330910 A,2010-08-31,"SYSTEM, METHOD, AND COMPUTER SOFTWARE CODE FOR DETECTING A COMPUTER NETWORK INTRUSION IN AN INFRASTRUCTURE ELEMENT OF A HIGH VALUE TARGET","An intrusion detection system for detecting and defeating unauthorized intrusion within a computer network of an infrastructure element of a high value target, the system including a pre-processor configured to receive data from a computer network of an infrastructure element of a high value target and to output filtered data, a grammar applicator configured to apply grammars produced using a grammar based compression and learning algorithm to the filtered data, a decision making device configured to provide a recommendation based on an input from the grammar applicator as to whether the data in the computer network constitutes an unauthorized intrusion, and an emulator in communication with the decision making device configured to expand a sampling of the filtered data using a polymorphic transformation to allow the decision making device to further analyze the sampled data to determine an unauthorized intrusion. A method and a computer software code are also disclosed.",EVANS SCOTT CHARLES;;POTDAR YOGESH KESRINATH;;DELL ANNO MICHAEL JOSEPH;;MARKHAM THOMAS STEPHEN;;KLINGBEIL ADAM EDGAR;;BORING ROBERT;;BARNETT BRUCE GORDON,EVANS SCOTT CHARLES;;POTDAR YOGESH KESRINATH;;DELL ANNO MICHAEL JOSEPH;;MARKHAM THOMAS STEPHEN;;KLINGBEIL ADAM EDGAR;;BORING ROBERT;;BARNETT BRUCE GORDON,GE DIGITAL HOLDINGS LLC (2023-11-10);;GENERAL ELECTRIC COMPANY (2010-09-03),https://lens.org/143-305-585-601-162,Patent Application,yes,4,24,2,2,0,H04L63/1416;;H04L63/1416,G06F11/00;;G06F15/18,726/23;;709/224;;706/13,0,0,,,,ACTIVE
103,US,S,US D0843427 S,160-362-605-958-802,2019-03-19,2019,US 201729615241 F,2017-08-28,US 201729615241 F,2017-08-28,Positioning robot base,,MEDAL THOMAS ALEXANDER;;CONROY SEAN ADRIAN;;ABELLERA STEPHEN;;SAXENA SAGAR;;GMEINER FLORIAN WILLIAM;;BAILEY BRENT ANDREW;;SAXENA ABHIJIT;;DELL TREVOR JAMES,MEDAL THOMAS ALEXANDER;;CONROY SEAN ADRIAN;;ABELLERA STEPHEN;;SAXENA SAGAR;;GMEINER FLORIAN WILLIAM;;BAILEY BRENT ANDREW;;SAXENA ABHIJIT;;DELL TREVOR JAMES,SYNAPTIVE MEDICAL (BARBADOS) INC (2017-11-22);;SYNAPTIVE MEDICAL INC (2020-09-02),https://lens.org/160-362-605-958-802,Design Right,no,12,28,1,1,0,,,1599;;D15/199,0,0,,,,ACTIVE
104,CN,A,CN 105323119 A,126-709-809-495-894,2016-02-10,2016,CN 201510688138 A,2013-12-11,US 201213711433 A;;CN 201310674509 A,2012-12-11,Systems and methods for communicating ultrasound data,Systems and methods for communicating ultrasound data are provided. One method includes monitoring over time estimates of bandwidth of a channel communicatively coupling an imaging location with another location remote from the imaging location and communicating the estimates to a system at the imaging location. The method also includes identifying at least one of a region-of-interest (ROI) mask or one or more transmission parameters for the channel and adjusting at least one of the ROI mask or the one or more transmission parameters based on the monitored estimates of the bandwidth for communicating the medical images.,GEN ELECTRIC,HOCTOR RALPH THOMAS;;BONANNI PIERINO GIANNI;;BUSH STEPHEN FRANCIS;;DELL ANNO MICHAEL JOSEPH;;SORO STANISLAVA;;HARTMAN MICHAEL JAMES;;HERSHEY JOHN ERIK,,https://lens.org/126-709-809-495-894,Patent Application,no,9,1,6,6,0,H04L43/0876;;H04L43/0876;;H04L43/0876;;H04L43/0894;;H04L47/25;;H04L47/25;;H04L47/25;;H04L47/38;;H04L47/38;;H04L47/38,H04L12/26;;H04L12/811;;H04L12/825,,0,0,,,,ACTIVE
105,US,A1,US 2014/0164596 A1,064-143-667-669-192,2014-06-12,2014,US 201213711433 A,2012-12-11,US 201213711433 A,2012-12-11,SYSTEMS AND METHODS FOR COMMUNICATING ULTRASOUND DATA,Systems and methods for communicating ultrasound data are provided. One method includes monitoring over time estimates of bandwidth of a channel communicatively coupling an imaging location with another location remote from the imaging location and communicating the estimates to a system at the imaging location. The method also includes identifying at least one of a region-of-interest (ROI) mask or one or more transmission parameters for the channel and adjusting at least one of the ROI mask or the one or more transmission parameters based on the monitored estimates of the bandwidth for communicating the medical images.,GEN ELECTRIC,HOCTOR RALPH THOMAS;;BONANNI PIERINO GIANNI;;BUSH STEPHEN FRANCIS;;DELL ANNO MICHAEL JOSEPH;;SORO STANISLAVA;;HARTMAN MICHAEL JAMES;;HERSHEY JOHN ERIK,GENERAL ELECTRIC COMPANY (2012-12-07),https://lens.org/064-143-667-669-192,Patent Application,yes,10,4,6,6,0,H04L43/0876;;H04L43/0876;;H04L43/0876;;H04L43/0894;;H04L47/25;;H04L47/25;;H04L47/25;;H04L47/38;;H04L47/38;;H04L47/38,H04L12/26,709/224,0,0,,,,ACTIVE
106,US,B2,US 9100307 B2,004-231-247-959-912,2015-08-04,2015,US 201213711433 A,2012-12-11,US 201213711433 A,2012-12-11,Systems and methods for communicating ultrasound data by adjusting compression rate and/or frame rate of region of interest mask,Systems and methods for communicating ultrasound data are provided. One method includes monitoring over time estimates of bandwidth of a channel communicatively coupling an imaging location with another location remote from the imaging location and communicating the estimates to a system at the imaging location. The method also includes identifying at least one of a region-of-interest (ROI) mask or one or more transmission parameters for the channel and adjusting at least one of the ROI mask or the one or more transmission parameters based on the monitored estimates of the bandwidth for communicating the medical images.,GEN ELECTRIC,HOCTOR RALPH THOMAS;;BONANNI PIERINO GIANNI;;BUSH STEPHEN FRANCIS;;DELL ANNO MICHAEL JOSEPH;;SORO STANISLAVA;;HARTMAN MICHAEL JAMES;;HERSHEY JOHN ERIK,GENERAL ELECTRIC COMPANY (2012-12-07),https://lens.org/004-231-247-959-912,Granted Patent,yes,26,2,6,6,0,H04L43/0876;;H04L43/0876;;H04L43/0876;;H04L43/0894;;H04L47/25;;H04L47/25;;H04L47/25;;H04L47/38;;H04L47/38;;H04L47/38,G06F15/16;;H04L12/26;;H04L12/811;;H04L12/825,,2,0,,,"De Cunha, D et al., ""The MIDSTEP system for ultrasound guided remote telesurgery"", Engineering in Medicine and Biology Society, 1998. Proceedings of the 20th Annual International Conference of the IEEE, Issue Date: Oct. 29-Nov. 1, 1998, on page(s): 1266, Print ISBN: 0-7803-5164-9.;;Unofficial translation of Chinese Office Action and Search Report from corresponding CN Application No. 201310674509.X dated Mar. 19, 2015.",ACTIVE
107,US,A1,US 2005/0182088 A1,089-953-163-639-274,2005-08-18,2005,US 50051604 A,2004-06-29,US 50051604 A;;US 35015202 P;;US 0221296 W,2002-01-17,Modulators of acetylcholine receptors,"The present invention relates to compounds that modulate neurotransmission by promoting the release of neurotransmitters such as acetylcholine, dopamine and norepinephrine. More particularly, the present invention relates to thio-bridged aryl compounds that are capable of modulating acetylcholine receptors and pharmaceutical compositions comprising such compounds. The compounds disclosed are useful for the treatment of dysfunctions of the central and autonomic nervous systems.",ASTLES PETER C.;;BAKER STEPHEN;;CUBE ROWENA V.;;MARTINEZ-PEREZ JOSE;;MATEO HERRANZ ANA I.;;VERNIER JEAN M.;;DELL COLIN P.;;GUTIERREZ SONIA;;PRIETO LOURDES;;KEENAN MARTINE;;SANDERSON ADAM;;SMITH COLIN,ASTLES PETER C;;BAKER STEPHEN;;CUBE ROWENA V;;MARTINEZ-PEREZ JOSE;;MATEO HERRANZ ANA I;;VERNIER JEAN M;;DELL COLIN P;;GUTIERREZ SONIA;;PRIETO LOURDES;;KEENAN MARTINE;;SANDERSON ADAM;;SMITH COLIN,ELI LILLY AND COMPANY (2003-04-11);;MERCK SHARP & DOHME CORP (2005-08-16),https://lens.org/089-953-163-639-274,Patent Application,yes,3,0,5,5,0,A61K31/46;;A61K31/46;;A61K31/55;;A61K31/55;;C07D451/04;;C07D451/04;;C07D451/14;;C07D451/14,A61K31/46;;A61K31/55;;C07D451/04;;C07D451/14,514/301;;514/304;;546/135;;546/114,0,0,,,,EXPIRED
108,EP,A1,EP 1472248 A1,178-905-096-042-004,2004-11-03,2004,EP 02756388 A,2002-07-29,US 0221296 W;;US 35015202 P,2002-01-17,MODULATORS OF ACETYLCHOLINE RECEPTORS,,LILLY CO ELI,ASTLES PETER CHARLES;;BAKER STEPHEN RICHARD;;KEENAN MARTINE;;VERNIER JEAN MICHEL;;SANDERSON ADAM JAN;;CUBE ROWENA VILLANUEVA;;MARTINEZ-PEREZ JOSE ANTONIO;;MATEO HERRANZ ANA ISABEL;;DELL COLIN PETER;;GUTIERREZ SONIA;;PRIETO LOURDES;;SMITH COLIN WILLIAM,"MERCK & CO., INC. (2005-12-21)",https://lens.org/178-905-096-042-004,Patent Application,yes,0,0,5,5,0,A61K31/46;;A61K31/46;;A61K31/55;;A61K31/55;;C07D451/04;;C07D451/04;;C07D451/14;;C07D451/14,A61K31/46;;A61K31/55;;C07D451/04;;C07D451/14,,1,0,,,See references of WO 03062235A1,DISCONTINUED
109,US,B2,US 7148236 B2,069-203-774-534-692,2006-12-12,2006,US 50051604 A,2004-06-29,US 50051604 A;;US 35015202 P;;US 0221296 W,2002-01-17,Modulators of acetylcholine receptors,"The present invention relates to compounds that modulate neurotransmission by promoting the release of neurotransmitters such as acetylcholine, dopamine and norepinephrine. More particularly, the present invention relates to thio-bridged aryl compounds that are capable of modulating acetylcholine receptors and pharmaceutical compositions comprising such compounds. The compounds disclosed are useful for the treatment of dysfunctions of the central and autonomic nervous systems.",MERCK & CO INC,ASTLES PETER CHARLES;;BAKER STEPHEN RICHARD;;CUBE ROWENA VILLANUEVA;;MARTINEZ-PEREZ JOSE ANTONIO;;MATEO HERRANZ ANA ISABEL;;VERNIER JEAN MICHEL;;DELL COLIN PETER;;GUTIERREZ SONIA;;PRIETO LOURDES;;KEENAN MARTINE;;SANDERSON ADAM JAN;;SMITH COLIN WILLIAM,ELI LILLY AND COMPANY (2003-04-11);;MERCK SHARP & DOHME CORP (2005-08-16),https://lens.org/069-203-774-534-692,Granted Patent,yes,11,12,5,5,0,A61K31/46;;A61K31/46;;A61K31/55;;A61K31/55;;C07D451/04;;C07D451/04;;C07D451/14;;C07D451/14,A01N43/42;;A61K31/44;;A61K31/46;;A61K31/55;;C07D451/02;;C07D451/04;;C07D451/06;;C07D451/14,514/304;;546/127;;546/126,5,5,023-740-960-835-389;;076-437-851-417-023;;056-863-739-118-062;;193-773-280-252-935;;072-310-869-667-334,10.1021/jm9506884;;8632405;;10.1016/s0196-9781(97)00023-5;;9285929;;10.1021/jo01270a124;;10.1016/0960-894x(96)00416-7;;10.1002/(sici)1521-4184(20005)333:5<107::aid-ardp107>3.3.co;2-p;;10.1002/(sici)1521-4184(20005)333:5<107::aid-ardp107>3.0.co;2-y;;10863793,"Abreo et al., ""Novel 3-pyridyl ethers with subnanomolar affinity for central neuronal nicotinic acetylcholine receptors"", Journal of Medicine Chemistry, vol. 39, pp. 817-825.;;Hu et al., ""Regional vascular and cardiac responses to systemic neuropeptide-Y in normal and diabetic rats"", Peptieds, vol. 18, pp. 809-815.;;Kraiss, G. et al., Stereospecific Methods of Forming Ethers by Nucleophilic Reactions of 3alpha-Substituted Tropanes, The Journal of Organic Chemistry, Jun. 1968, 2601-2603, vol. 33, No. 6.;;Elliott, R.L.et al., 2-(Aryloxymethyl) Azacyclic Analogues as Novel Nicotinic Acetylcholine Receptor (nAChR) Ligands, Bioorganic & Medicinal Chemistry Letters, 1996, 2283-2288, vol. 6, No. 19.;;Radl S. et al., Synthesis and Analgesic Activity of Some Side-Chain Modified Anpirtoline Derivatives, Arch. Pharm. Pharm. Med. Chem., 2000, 107-112, vol. 333.",EXPIRED
110,WO,A1,WO 2003/062235 A1,121-750-900-755-792,2003-07-31,2003,US 0221296 W,2002-07-29,US 35015202 P,2002-01-17,MODULATORS OF ACETYLCHOLINE RECEPTORS,"The present invention relates to compounds that modulate neurotransmission by promoting the release of neurotransmitters such as acetylcholine, dopamine and norepinephrine. More particularly, the present invention relates to thio-bridged aryl compounds that are capable of modulating acetylcholine receptors and pharmaceutical compositions comprising such compounds. The compounds disclosed are useful for the treatment of dysfunctions of the central and autonomic nervous systems.",LILLY CO ELI;;ASTLES PETER CHARLES;;BAKER STEPHEN RICHARD;;KEENAN MARTINE;;VERNIER JEAN MICHEL;;SANDERSON ADAM JAN;;CUBE ROWENA VILLANUEVA;;MARTINEZ-PEREZ JOSE ANTONIO;;MATEO HERRANZ ANA ISABEL;;DELL COLIN PETER;;GUTIERREZ SONIA;;PRIETO LOURDES;;SMITH COLIN WILLIAM,ASTLES PETER CHARLES;;BAKER STEPHEN RICHARD;;KEENAN MARTINE;;VERNIER JEAN MICHEL;;SANDERSON ADAM JAN;;CUBE ROWENA VILLANUEVA;;MARTINEZ-PEREZ JOSE ANTONIO;;MATEO HERRANZ ANA ISABEL;;DELL COLIN PETER;;GUTIERREZ SONIA;;PRIETO LOURDES;;SMITH COLIN WILLIAM,,https://lens.org/121-750-900-755-792,Patent Application,yes,5,0,5,5,0,A61K31/46;;A61K31/46;;A61K31/55;;A61K31/55;;C07D451/04;;C07D451/04;;C07D451/14;;C07D451/14,A61K31/46;;A61K31/55;;C07D451/04;;C07D451/14,,3,3,193-773-280-252-935;;072-310-869-667-334;;056-863-739-118-062,10.1016/0960-894x(96)00416-7;;10.1002/(sici)1521-4184(20005)333:5<107::aid-ardp107>3.3.co;2-p;;10.1002/(sici)1521-4184(20005)333:5<107::aid-ardp107>3.0.co;2-y;;10863793;;10.1021/jo01270a124,"ELLIOT R L ET AL: ""2-(ARYLOXYMETHYL) AZACYCLIC ANALOGUES AS NOVEL NICOTINIC ACETYLCHOLINE RECEPTOR (NACHR) LIGANDS"", BIOORGANIC & MEDICINAL CHEMISTRY LETTERS, OXFORD, GB, vol. 6, no. 19, 1996, pages 2283 - 2288, XP000618280, ISSN: 0960-894X;;RADL, STANISLAV ET AL: ""Synthesis and analgesic activity of some side-chain modified anpirtoline derivatives"", ARCHIV DER PHARMAZIE (WEINHEIM, GERMANY) (2000), 333(5), 107-112, XP002219143;;KRAISS, G. ET AL: ""Stereospecific methods of forming ethers by nucleophilic reactions of 3.alpha.-substituted tropanes"", J. ORG. CHEM. (1968), 33(6), 2601-3, XP002219144",PENDING
