"#",Jurisdiction,Kind,Display Key,Lens ID,Publication Date,Publication Year,Application Number,Application Date,Priority Numbers,Earliest Priority Date,Title,Abstract,Applicants,Inventors,Owners,URL,Document Type,Has Full Text,Cites Patent Count,Cited by Patent Count,Simple Family Size,Extended Family Size,Sequence Count,CPC Classifications,IPCR Classifications,US Classifications,NPL Citation Count,NPL Resolved Citation Count,NPL Resolved Lens ID(s),NPL Resolved External ID(s),NPL Citations,Legal Status
1,CN,U,CN 213709872 U,107-018-531-758-810,2021-07-16,2021,CN 202021824301 U,2020-08-27,CN 202021824301 U,2020-08-27,Assembled door of container house,"The utility model discloses an assembly door of a container house. The assembly door comprises two folding doors, a movable top plate, a movable bottom plate and a door frame, the inner ends of the two folding doors are hinged to a left side frame and a right side frame of the door frame respectively, the outer ends of the two folding doors are oppositely arranged and can be close to each other to form a closed door, the inner end of the movable top plate is hinged to a top frame of the door frame, and the outer ends of the movable bottom plate are hinged to a bottom frame of the door frame respectively. Due to the fact that the two folding doors, the movable top plate and the movable bottom plate are all hinged to the door frame, the two folding doors, the movable top plate and the movable bottom plate can be unfolded outwards according to needs to form a new space, and the space can be expanded.",GREEN EARTH XIAMEN ENVIRONMENTAL TECH CO LTD,PORTER STEPHEN DELL,,https://lens.org/107-018-531-758-810,Limited Patent,no,0,0,1,1,0,,E04B1/343;;E04B1/344;;E06B3/36;;E06B3/48,,0,0,,,,ACTIVE
2,DE,A1,DE 2944044 A1,012-097-312-799-835,1980-05-14,1980,DE 2944044 A,1979-10-31,US 95763178 A,1978-11-03,OPTISCH GEPUMPTER DIODENLASER,,US ENERGY,ROCKWOOD STEPHEN DELL,,https://lens.org/012-097-312-799-835,Patent Application,no,0,0,4,4,0,H01S3/0401;;H01S5/1228;;H01S3/0401;;H01S5/1228,H01S5/00;;H01S3/094;;H01S5/12,,0,0,,,,DISCONTINUED
3,US,S,US D0766203 S,097-905-485-707-800,2016-09-13,2016,US 201529514967 F,2015-01-19,US 201529514967 F,2015-01-19,Voice mask,,TALK TECH INC,WEBB STEPHEN DELL,TALK TECHNOLOGIES (2015-04-17),https://lens.org/097-905-485-707-800,Design Right,no,0,2,1,1,0,,,1401;;D14/154,0,0,,,,ACTIVE
4,CN,U,CN 211721505 U,150-851-902-131-697,2020-10-23,2020,CN 201922294437 U,2019-12-19,CN 201922294437 U,2019-12-19,Spraying bird feeder,"The utility model relates to a spraying bird feeder which comprises a body and a cover plate assembled in the body. The positions of the cover plate and the body are lower than the top end of the body; a containing space used for containing water is formed between the cover plate and the body, and a sprayer is arranged in the containing space. And the cover plate is provided with a water injectionnozzle corresponding to the mounting position of the sprayer. According to the utility model, the cover plate is used for providing a standing position for birds, the birds can stand on the cover plate to drink water on the cover plate, and the water quantity on the cover plate cannot threaten the life safety of the birds, so that the safety of the birds during water drinking is improved.",JU GUXIAN,PORTER STEPHEN DELL,,https://lens.org/150-851-902-131-697,Limited Patent,no,0,0,1,1,0,,A01K39/02,,0,0,,,,ACTIVE
5,CN,U,CN 212342258 U,008-917-574-895-209,2021-01-12,2021,CN 202020411226 U,2020-03-26,CN 202020411226 U,2020-03-26,Wind bell,"The utility model discloses a wind bell. The device comprises a hanging piece, a connecting piece hung below the hanging piece, an impacting piece hung below the connecting piece, a plurality of windbell pipes, a plurality of first hanging ropes connected between the hanging piece and the connecting piece, and a plurality of second hanging ropes connected between the connecting piece and the impacting piece, wherein the third hanging ropes are connected between the connecting piece and the wind bell pipe and correspond to the wind bell pipe one by one, the battery box is arranged on the connecting piece, the LED lamp strings are arranged on the second hanging ropes or the third hanging ropes and electrically connected with the battery box, and the partition layers wrap the periphery of the impact piece. According to the utility model, the interlayer is sleeved on the periphery of the impact piece, and the tone of the impact piece impacted by the wind bell tube can be changed through the number change of the interlayer, so that the requirements of different users are met; and the LED lamp strings are arranged, so that the LED lamp has a light-emitting effect, and the decorative property is improved.",JU GUXIAN,PORTER STEPHEN DELL,,https://lens.org/008-917-574-895-209,Limited Patent,no,0,0,1,1,0,,G10K1/068;;F21V33/00;;F21Y115/10;;G10K1/08;;G10K1/10,,0,0,,,,INACTIVE
6,CN,U,CN 203228580 U,131-271-036-907-806,2013-10-09,2013,CN 201320187289 U,2013-04-15,CN 201320187289 U,2013-04-15,Flame assisting structure of flame handicraft,"The utility model discloses a flame assisting structure of a flame handicraft. The flame assisting structure comprises a base, a fire source container placed in a furnace chamber of the base, and a diffuser which covers the upper end of the furnace chamber, wherein the fire source container is used for containing fuel, an air guide sleeve which is adapted to the furnace chamber is also arranged in the furnace chamber of the base, the fire source container is placed in the guide sleeve, at least two spiral convex ribs are arranged on the outer wall of the guide sleeve along the axial direction, and a spiral airway which extends from the bottom of the base to the upper end of the base is formed between the spiral convex ribs and the inner wall of the furnace chamber. When a combustible material placed in the fire source container is lit and burnt, air is absorbed into the furnace chamber from the bottom of the base, spirally flows out from the upper end of the furnace chamber along the spiral airway formed between the convex ribs of the guide sleeve and the furnace chamber, and contacts with open fire of a fire source, and spiral airflow can drive flame of the open fire to rotate and move upwards so as to realize the flame handicraft which can be used for enlarging and heightening the flame and improving the attractiveness of the flame.",JU GUXIAN,STEPHEN DELL PORTER,,https://lens.org/131-271-036-907-806,Limited Patent,no,0,1,1,1,0,,B44C5/06,,0,0,,,,EXPIRED
7,CN,U,CN 213708290 U,064-678-355-754-022,2021-07-16,2021,CN 202021829445 U,2020-08-27,CN 202021829445 U,2020-08-27,Container house with beer making equipment,"The utility model discloses a container house with beer making equipment. The container house comprises a container, a mounting frame, a filter tank, a fermentation tank, an ethylene glycol tank, a cooling container, a refrigerating machine and a heat exchange system, the mounting frame is fixedly mounted in the container, the filter tank, the fermentation tank, the ethylene glycol and the heat exchange system are all mounted on a working table of the mounting frame and arranged in the container, the cooling container is mounted below the working table of the mounting frame and located under the fermentation tank, and the refrigerating machine is mounted in the container. Due to the fact that the filter tank, the fermentation tank, the ethylene glycol tank, the cooling container, the refrigerating machine, the heat exchange system and the like are installed in the container in a centralized mode, the size is small, beer making equipment can be conveniently transported to any place through the trailer, the trailer passes through electric power, and the beer making equipment has the advantage of being convenient to move. In addition, the cooling container is arranged under the fermentation tank, so that the prepared beer can be quickly stored in the cooling container, and the beer fermentation device is very convenient to use.",GREEN EARTH XIAMEN ENVIRONMENTAL TECH CO LTD,PORTER STEPHEN DELL,,https://lens.org/064-678-355-754-022,Limited Patent,no,0,0,1,1,0,,C12C13/00;;E04B1/343;;E04H1/12,,0,0,,,,ACTIVE
8,CN,U,CN 213708286 U,009-573-557-364-895,2021-07-16,2021,CN 202021834991 U,2020-08-27,CN 202021834991 U,2020-08-27,Small beer making equipment,"The utility model discloses small beer making equipment which comprises a workbench, a filter tank, a fermentation tank, an ethylene glycol tank, a cooling container, a refrigerating machine and a heat exchange system, the filter tank, the fermentation tank, the ethylene glycol tank and the heat exchange system are all mounted on a working table top of the working table, the cooling container is mounted below the working table top of the working table and located under the fermentation tank, and the refrigerating machine is mounted on one side of the working table. Due to the fact that the filter tank, the fermentation tank, the ethylene glycol tank, the heat exchange system and the like are installed in a concentrated mode, all the devices are concentrated, the size is small, and movement is very convenient. In addition, the cooling container is arranged under the fermentation tank, so that the prepared beer can be quickly stored in the cooling container, and the beer fermentation device is very convenient to use.",GREEN EARTH XIAMEN ENVIRONMENTAL TECH CO LTD,PORTER STEPHEN DELL,,https://lens.org/009-573-557-364-895,Limited Patent,no,0,0,1,1,0,,C12C7/17;;C12C7/01;;C12C7/26;;C12C11/00;;C12C13/00,,0,0,,,,ACTIVE
9,DE,A1,DE 2526054 A1,092-150-087-262-493,1976-01-02,1976,DE 2526054 A,1975-06-11,US 47856074 A,1974-06-12,VERFAHREN ZUM TRENNEN VON BORISOTOPEN,,US ENERGY,ROCKWOOD STEPHEN DELL,,https://lens.org/092-150-087-262-493,Patent Application,no,0,0,7,7,0,B01D59/34;;B01D59/34,B01D59/34;;C01B35/06,,0,0,,,,PENDING
10,CN,U,CN 215216332 U,125-494-694-029-356,2021-12-17,2021,CN 202120789615 U,2021-04-16,CN 202120789615 U,2021-04-16,Furnace capable of being quickly assembled and disassembled,"The utility model discloses a stove capable of being quickly assembled and disassembled. The stove comprises a table plate, stand columns, side plates and limiting pieces, a through hole is formed in the middle of the table board, and connecting parts corresponding to the stand columns are arranged on the lower surface of the table board; the upper end face of the stand column is connected with the connecting part through a rotary buckle, and a mounting groove is formed in the side face of the stand column and extends downwards in the axis direction of the stand column to penetrate through the lower end face of the stand column. Two ends of the side plate are respectively mounted on the mounting grooves of the two upright posts, and the end parts of the side plate are upwards embedded into the mounting grooves from the lower ends of the upright posts; the limiting pieces are movably connected to the lower ends of the side faces of the stand columns and used for limiting the side plates and preventing the side plates from disengaging from the mounting grooves. According to the utility model, all the parts of the stove are assembled in a movable connection manner and are independent from one another, so that the stove occupies a small space after being disassembled, is convenient to transport and saves the storage cost; the table plate is connected with the stand column through the rotary buckle, the stand column is connected with the side plate through the inserting groove, the side plate is positioned through the limiting piece, screws are not needed for fixing, dismounting and mounting are convenient, and efficiency is high.",JU GUXIAN,PORTER STEPHEN DELL,,https://lens.org/125-494-694-029-356,Limited Patent,no,0,0,1,1,0,,F24C1/00;;F24C15/00,,0,0,,,,ACTIVE
11,CN,U,CN 212907050 U,034-711-216-564-812,2021-04-06,2021,CN 202020727087 U,2020-05-06,CN 202020727087 U,2020-05-06,Wind bell structure,"The utility model discloses a wind bell structure which comprises a hooking piece, a connecting assembly hung below the hooking piece, a wind bell disc assembly hung below the connecting assembly, a plurality of adjustable hanging assemblies connected to the connecting assembly and a plurality of wind bell pipes hung on the hanging assemblies and surrounding the wind bell disc assembly. The hanging ropes are used for hanging; the wind bell disc assembly comprises a wind bell disc and a plurality of rod pieces, the rod pieces are arranged in the radial direction of the wind bell disc and inserted into the periphery of the wind bell disc at equal-angle intervals, and the wind bell pipes are matched among the rod pieces respectively to achieve separation. The rod pieces are arranged on the periphery of the wind bell disc to separate the wind bell tubes, the rhythm is changed through collision of the wind bell tubes and the wind bell disc or the rod pieces, mutual collision of the wind bell tubes is avoided, and the protection effect is achieved. During use, the melody can be changed by changing the material of the rod piece, so that diversified market demands are met; the position of the wind bell pipe can be adjusted through the suspension assembly to change the rhythm.",JU GUXIAN,PORTER STEPHEN DELL,,https://lens.org/034-711-216-564-812,Limited Patent,no,0,0,1,1,0,,G10K1/068,,0,0,,,,ACTIVE
12,CN,U,CN 212230060 U,033-655-208-532-642,2020-12-25,2020,CN 202020410013 U,2020-03-26,CN 202020410013 U,2020-03-26,Novel wind bell,"The utility model discloses a novel wind bell which comprises a plurality of hanging ropes, hanging pieces connected to the upper ends of the hanging ropes, connecting pieces movably matched with themiddles of the hanging ropes, a wind bell disc connected to the lower ends of the hanging ropes and a plurality of wind bell pipes. Wherein strip-shaped holes in one-to-one correspondence with the hanging ropes are formed in the connecting piece, a plurality of positioning grooves are formed in the strip-shaped holes in the axial direction, and the strip-shaped holes are distributed at equal intervals in the circumferential direction of the connecting piece with the center of the connecting piece as the circle center. The middle part of the hanging rope is arranged in the strip-shaped hole ina penetrating manner and is matched in one positioning groove; and the wind bell pipes are in one-to-one correspondence with the hanging ropes and are arranged around the wind bell disc. According tothe utility model, the strip-shaped hole with the positioning groove is formed in the connecting piece, so that the relative position of the hanging rope can be adjusted, that is, the distance betweenthe wind bell pipe and the wind bell disc can be adjusted, and different wind forces in different environments can be adapted or the volume of sound can be adjusted according to the requirements of users.",JU GUXIAN,PORTER STEPHEN DELL,,https://lens.org/033-655-208-532-642,Limited Patent,no,0,0,1,1,0,,G10K1/068;;F21V33/00;;F21Y115/10;;G10K1/08;;G10K1/10,,0,0,,,,INACTIVE
13,CN,U,CN 215437937 U,045-168-919-767-453,2022-01-07,2022,CN 202120788851 U,2021-04-16,CN 202120788851 U,2021-04-16,Container floor structure,"The utility model discloses a container floor structure which comprises a floor body and at least one of a first splicing part and a second splicing part. The first and second splicing parts are arranged on the left and right sides of the floor body; the first splicing part comprises a first arc plate/transverse plate/vertical plate; the right end of the first arc plate is connected to the upper edge of the left end of the floor body, a flange is formed on the upper edge of the left end of the floor body, and a first inserting groove is defined by the flange and the right end of the first arc plate. The right end of the first transverse plate is connected to the left end lower edge of the floor body; the first vertical plate is connected between the first arc plate and the first transverse plate; the second splicing part comprises a second arc plate/transverse plate/vertical plate; the left end of the second transverse plate is connected to the upper edge of the right end of the floor body; the left end of the second arc plate is connected to the right end of the second transverse plate, and the outer ring of the second arc plate is matched with the inner ring of the first arc plate; the upper end of the second vertical plate is connected below the right end of the second transverse plate and forms a second slot with the left end of the outer ring of the second arc plate. The splicing type LED lamp can be spliced at will, is convenient to operate and can be detached.",DADI RECYCLING XIAMEN ENVIRONMENTAL PROTECTION TECH CO LTD,PORTER STEPHEN DELL,,https://lens.org/045-168-919-767-453,Limited Patent,no,0,0,1,1,0,,B65D90/02,,0,0,,,,ACTIVE
14,CN,U,CN 210685486 U,198-271-261-652-791,2020-06-05,2020,CN 201921247492 U,2019-08-02,CN 201921247492 U,2019-08-02,Solar container house,"The utility model discloses a solar container house. The device comprises a box body, the box body is provided with a bottom face, a top face, a front face, a back face, a left side face and a right side face. Middle formed interior space, a shower space, a storage space and a living space are sequentially arranged in the inner space of the box body at intervals in the length direction. An inlet for entering the storage space and the living space is formed in the front face of the box body, an inlet for entering the shower space is formed in the side face of one side of the box body, a bottomplate is arranged on the bottom face of the box body, a back plate is arranged on the back face of the box body, a top plate is arranged on the top face, and a retractable solar panel is installed below the top plate.",DADI REGENERATION XIAMEN ENVIRONMENTAL PROTECTION TECH CO LTD,STEPHEN DELL PORTER,,https://lens.org/198-271-261-652-791,Limited Patent,no,0,1,1,1,0,Y02B10/10;;Y02E10/50,E04H1/02;;E04D13/18;;E04F10/00;;H02S20/30,,0,0,,,,ACTIVE
15,CN,U,CN 213710520 U,021-625-568-413-978,2021-07-16,2021,CN 202021826090 U,2020-08-27,CN 202021826090 U,2020-08-27,Container house,"The utility model discloses a container house which comprises two end door frames, a top plate, a bottom plate, two side plates and an assembly door or an end plate. The lower ends of the two end door frames are vertically installed at the two ends of the bottom plate respectively, the top plate is vertically fixed to the top faces of the two end door frames, and the two end door frames are provided with the assembly doors or the end plates respectively. Due to the fact that the assembly door comprises the two folding doors, the movable top plate and the movable bottom plate, the two folding doors, the movable top plate and the movable bottom plate are all hinged to the door frame, the two folding doors, the movable top plate and the movable bottom plate in the assembly door can be unfolded outwards according to needs to form a new space, and the assembly door has the advantage of being capable of expanding the space.",GREEN EARTH XIAMEN ENVIRONMENTAL TECH CO LTD,PORTER STEPHEN DELL,,https://lens.org/021-625-568-413-978,Limited Patent,no,0,0,1,1,0,,E04H1/12;;E06B3/48,,0,0,,,,ACTIVE
16,FR,A1,FR 2274339 A1,173-590-505-958-086,1976-01-09,1976,FR 7518451 A,1975-06-12,US 47856074 A,1974-06-12,PROCEDE POUR SEPARER LES ISOTOPES DU BORE,,US ENERGY,ROCKWOOD STEPHEN DELL,,https://lens.org/173-590-505-958-086,Patent Application,no,0,1,7,7,0,B01D59/34;;B01D59/34,B01D59/34;;C01B35/06,,0,0,,,,EXPIRED
17,CN,U,CN 203228581 U,062-168-520-887-53X,2013-10-09,2013,CN 201320187290 U,2013-04-15,CN 201320187290 U,2013-04-15,Thermal insulation device for flame artware,"The utility model discloses a thermal insulation device for a flame artware. The flame artware comprises a base, a fire source container placed in a furnace chamber of the base, and a light transmittable cover covered at the upper end of the furnace chamber; fuel is contained in the fire source container; the light transmittable cover consists of an inner cover and an outer cover; and an air gap is formed between the inner cover and the outer cover. According to the thermal insulation device for the flame artware, a double-layer light transmittable cove is arranged, and a gap is formed between the inner cover and the outer cover of the light transmittable, which can insulate part of the heat on the inner cover to realize a great thermal insulation function; and another gap is formed between the lower end of the outer cover and the base, so that the gap between the inner cover and the outer cover can form the air gap for ventilating, and as a result, the radiating function of the inner cover is improved, the thermal insulation function of the light transmittable cover is further improved, and the safety of the flame artware in use is ensured.",JU GUXIAN,STEPHEN DELL PORTER,,https://lens.org/062-168-520-887-53X,Limited Patent,no,0,1,1,1,0,,B44C5/06,,0,0,,,,EXPIRED
18,CN,A,CN 104913341 A,130-060-443-325-719,2015-09-16,2015,CN 201510360303 A,2015-06-26,CN 201510360303 A,2015-06-26,Biomass fuel furnace,"A biomass fuel furnace relates to combustion equipment and comprises a furnace body, a furnace pipe and a furnace table, wherein the side wall of the furnace pipe comprises an inner layer and an outer layer, plural air exhaust holes are disposed in the outer layer, plural air ducts extended and disposed from bottom to top are disposed between the inner layer and the outer layer, and the air exhaust holes are upper ports of the air ducts; and the outer surface of the outer layer is winded by a heating pipe. The biomass fuel furnace provided by the invention has the beneficial effect that when wind enters the furnace body, one part of the wind directly enters the furnace pipe to realize sustained combustion of fuels; and the other part of wind enters the air ducts and then flees from the air exhaust holes into the middle upper part of the furnace pipe. When the wind in the air ducts flees into the furnace pipe, flame gets close to the center shaft of the furnace pipe and is avoided from running around. After multiple air flows gather inside the furnace pipe, wind speed above the furnace pipe increases, air mobility in the fuel furnace is ensured, and the fuels can be completely burnt; and heat of the side wall of the furnace pipe is used to heat a water flow in the heating pipe so as to add functions of the fuel furnace and increase utilization rate of the heat.",FUJIAN ANXI HONG YUAN CRAFT CO LTD,LIN MUSHUI;;STEPHEN PORTER DELL,,https://lens.org/130-060-443-325-719,Patent Application,no,5,1,2,2,0,,F24B1/19;;F24B1/183;;F24B1/191,,0,0,,,,ACTIVE
19,DE,T2,DE 69323479 T2,160-012-440-502-670,1999-06-24,1999,DE 69323479 T,1993-06-29,US 90871792 A;;US 8093793 A;;US 9306184 W,1992-06-30,VERFAHREN ZUR VERBRENNUNG VON SCHWEFELHALTIGEN KOHLENSTOFFMATERIALIEN,"In a process for burning a combustible, sulfur-containing carbonaceous material such as coal, municipal waste, or tires, recrystallized metamorphic CaCO3 is introduced into the combustion zone along with the fuel. The amount of SO2 and NO2 generated is substantially reduced as compared to conventional processes and, even with no post-scrubbing equipment, the emission levels compare favorably to the emission levels of state-of-the-art power plants using the same coal with extensive emission controls. The present process also acts to convert sulfur resident in coal into elemental sulfur and loose sulfur compounds and to reduce the particulate output.",NOVACON ENERGY SYSTEMS INC,BAER STEPHEN;;DELL AQUILA JOSEPH,,https://lens.org/160-012-440-502-670,Granted Patent,no,0,0,14,16,0,F01N3/08;;F01N2570/04;;F23J7/00;;Y02E20/12;;C10L10/02;;F01N3/08;;F23J7/00;;F01N2570/04;;Y02E20/12;;C10L10/02,C10L10/00;;F01N3/08;;F23G5/00;;F23J7/00,,0,0,,,,EXPIRED
20,CN,U,CN 204704855 U,018-472-910-770-485,2015-10-14,2015,CN 201520446105 U,2015-06-26,CN 201520446105 U,2015-06-26,Biomass fuel stove,"The utility model provides a biomass fuel stove, relates to combustion apparatus, and including furnace body, stove courage and stove top, the lateral wall of stove courage includes inlayer and skin, and the skin is equipped with a plurality of air exits, is equipped with the wind channel that the plural number strip was set up by lower supreme extension between this inlayer and the skin, and above -mentioned air exit is the last port in wind channel promptly, and the winding of outer surface has the heating pipe. The beneficial effect of the utility model: after wind got into the furnace body, some made the fuel sustained combustion in directly getting into the stove courage, another part gets into the wind channel, scurries into the well upper portion in the stove courage from the air exit again. When wind in the wind channel is scurried into in the stove courage, make flame draw close towards the center pin of stove courage, prevent that flame from going hither and thither. The distinguished and admirable back of converging in the stove courage of multichannel results in the wind speed of stove courage top to increase, guarantees fuel -fired furnace's air current mobility, makes fuel fully burn, the heat that the utilizes stove courage lateral wall rivers in to the heating pipe heat to this add this fuel -fired furnace the function, improve thermal utilization ratio.",FUJIAN ANXI HONG YUAN CRAFT CO LTD,LIN MUSHUI;;STEPHEN PORTER DELL,,https://lens.org/018-472-910-770-485,Limited Patent,no,0,1,1,1,0,,F24B1/19;;F24B1/183;;F24B1/191,,0,0,,,,ACTIVE
