21,DE,D1,DE 69323479 D1,009-840-443-954-161,1999-03-25,1999,DE 69323479 T,1993-06-29,US 90871792 A;;US 8093793 A;;US 9306184 W,1992-06-30,VERFAHREN ZUR VERBRENNUNG VON SCHWEFELHALTIGEN KOHLENSTOFFMATERIALIEN,"In a process for burning a combustible, sulfur-containing carbonaceous material such as coal, municipal waste, or tires, recrystallized metamorphic CaCO3 is introduced into the combustion zone along with the fuel. The amount of SO2 and NO2 generated is substantially reduced as compared to conventional processes and, even with no post-scrubbing equipment, the emission levels compare favorably to the emission levels of state-of-the-art power plants using the same coal with extensive emission controls. The present process also acts to convert sulfur resident in coal into elemental sulfur and loose sulfur compounds and to reduce the particulate output.",NOVACON ENERGY SYSTEMS INC,BAER STEPHEN;;DELL AQUILA JOSEPH,,https://lens.org/009-840-443-954-161,Granted Patent,no,0,0,14,16,0,F01N3/08;;F01N2570/04;;F23J7/00;;Y02E20/12;;C10L10/02;;F01N3/08;;F23J7/00;;F01N2570/04;;Y02E20/12;;C10L10/02,C10L10/00;;F01N3/08;;F23G5/00;;F23J7/00,,0,0,,,,EXPIRED
22,CA,C,CA 2116688 C,042-754-919-447-073,2000-01-11,2000,CA 2116688 A,1993-06-29,US 8093793 A;;US 90871792 A;;US 9306184 W,1992-06-30,"PROCESS FOR COMBUSTION OF SULFUR-CONTAINING, CARBONACEOUS MATERIALS","In a process for burning a combustible, sulfur-containing carbonaceous material (16), such as coal (40), municipal waste, or tires, recrystallized CaCO3 is introduced into the combustion zone (10, 42) along with the fuel. The amount of SO2 and NO2 generated is substantially reduced as compared to conventional processes and, even with no post-scrubbing equipment, the emission levels compare favorably to the emission levels state-of-the-art power plants using the same coal with extensive emission controls. The present process also acts to convert sulfur resident in coal into elemental sulfur and loose sulfur compounds and to reduce the particulate output.",,BAER STEPHEN H;;DELL AQUILA JOSEPH,,https://lens.org/042-754-919-447-073,Granted Patent,no,0,0,14,16,0,F01N3/08;;F01N2570/04;;F23J7/00;;Y02E20/12;;C10L10/02;;F01N3/08;;F23J7/00;;F01N2570/04;;Y02E20/12;;C10L10/02,C10L10/00;;F01N3/08;;F23G5/00;;F23J7/00,,0,0,,,,EXPIRED
23,AT,T1,AT E176681 T1,158-091-479-722-992,1999-02-15,1999,AT 93916846 T,1993-06-29,US 90871792 A;;US 8093793 A,1992-06-30,VERFAHREN ZUR VERBRENNUNG VON SCHWEFELHALTIGEN KOHLENSTOFFMATERIALIEN,"In a process for burning a combustible, sulfur-containing carbonaceous material such as coal, municipal waste, or tires, recrystallized metamorphic CaCO3 is introduced into the combustion zone along with the fuel. The amount of SO2 and NO2 generated is substantially reduced as compared to conventional processes and, even with no post-scrubbing equipment, the emission levels compare favorably to the emission levels of state-of-the-art power plants using the same coal with extensive emission controls. The present process also acts to convert sulfur resident in coal into elemental sulfur and loose sulfur compounds and to reduce the particulate output.",NOVACON ENERGY SYSTEMS INC,BAER STEPHEN H;;DELL AQUILA JOSEPH,,https://lens.org/158-091-479-722-992,Granted Patent,no,0,0,14,16,0,F01N3/08;;F01N2570/04;;F23J7/00;;Y02E20/12;;C10L10/02;;F01N3/08;;F23J7/00;;F01N2570/04;;Y02E20/12;;C10L10/02,C10L10/00;;F01N3/08;;F23G5/00;;F23J7/00,,0,0,,,,EXPIRED
24,AU,A,AU 1993/046563 A,195-673-018-714-334,1994-01-24,1994,AU 1993/046563 A,1993-06-29,US 90871792 A;;US 8093793 A;;US 9306184 W,1992-06-30,"Process for combustion of sulfur-containing, carbonaceous materials","In a process for burning a combustible, sulfur-containing carbonaceous material such as coal, municipal waste, or tires, recrystallized metamorphic CaCO3 is introduced into the combustion zone along with the fuel. The amount of SO2 and NO2 generated is substantially reduced as compared to conventional processes and, even with no post-scrubbing equipment, the emission levels compare favorably to the emission levels of state-of-the-art power plants using the same coal with extensive emission controls. The present process also acts to convert sulfur resident in coal into elemental sulfur and loose sulfur compounds and to reduce the particulate output.",NOVACON ENERGY SYSTEMS INC,BAER STEPHEN H;;AQUILA JOSEPH DELL,,https://lens.org/195-673-018-714-334,Patent Application,no,0,0,14,16,0,F01N3/08;;F01N2570/04;;F23J7/00;;Y02E20/12;;C10L10/02;;F01N3/08;;F23J7/00;;F01N2570/04;;Y02E20/12;;C10L10/02,C10L10/00;;F01N3/08;;F23G5/00;;F23J7/00,,0,0,,,,EXPIRED
25,CA,A1,CA 2116688 A1,114-331-330-805-654,1994-01-06,1994,CA 2116688 A,1993-06-29,US 8093793 A;;US 90871792 A;;US 9306184 W,1992-06-30,"Process for Combustion of Sulfur-Containing, Carbonaceous Materials","In a process for burning a combustible, sulfur-containing carbonaceous material such as coal, municipal waste, or tires, recrystallized metamorphic CaCO3 is introduced into the combustion zone along with the fuel. The amount of SO2 and NO2 generated is substantially reduced as compared to conventional processes and, even with no post-scrubbing equipment, the emission levels compare favorably to the emission levels of state-of-the-art power plants using the same coal with extensive emission controls. The present process also acts to convert sulfur resident in coal into elemental sulfur and loose sulfur compounds and to reduce the particulate output.",NOVACON ENERGY SYSTEMS INC,BAER STEPHEN H;;DELL AQUILA JOSEPH,,https://lens.org/114-331-330-805-654,Patent Application,no,0,0,14,16,0,F01N3/08;;F01N2570/04;;F23J7/00;;Y02E20/12;;C10L10/02;;F01N3/08;;F23J7/00;;F01N2570/04;;Y02E20/12;;C10L10/02,C10L10/00;;F01N3/08;;F23G5/00;;F23J7/00,,0,0,,,,EXPIRED
26,EP,A1,EP 0602238 A1,157-469-123-156-921,1994-06-22,1994,EP 93916846 A,1993-06-29,US 8093793 A;;US 9306184 W;;US 90871792 A,1992-06-30,"PROCESS FOR COMBUSTION OF SULFUR-CONTAINING, CARBONACEOUS MATERIALS.","In a process for burning a combustible, sulfur-containing carbonaceous material such as coal, municipal waste, or tires, recrystallized metamorphic CaCO3 is introduced into the combustion zone along with the fuel. The amount of SO2 and NO2 generated is substantially reduced as compared to conventional processes and, even with no post-scrubbing equipment, the emission levels compare favorably to the emission levels of state-of-the-art power plants using the same coal with extensive emission controls. The present process also acts to convert sulfur resident in coal into elemental sulfur and loose sulfur compounds and to reduce the particulate output.",NOVACON ENERGY SYSTEMS INC;;DELL AQUILA JOSEPH LEGALLY REP,BAER STEPHEN H;;DELL AQUILA JOSEPH,"NOVACON ENERGY SYSTEMS, INC. (1999-01-13)",https://lens.org/157-469-123-156-921,Patent Application,yes,0,0,14,16,0,F01N3/08;;F01N2570/04;;F23J7/00;;Y02E20/12;;C10L10/02;;F01N3/08;;F23J7/00;;F01N2570/04;;Y02E20/12;;C10L10/02,C10L10/00;;F01N3/08;;F23G5/00;;F23J7/00,,0,0,,,,EXPIRED
27,EP,A4,EP 0602238 A4,180-653-075-100-969,1994-11-17,1994,EP 93916846 A,1993-06-29,US 8093793 A;;US 9306184 W;;US 90871792 A,1992-06-30,"PROCESS FOR COMBUSTION OF SULFUR-CONTAINING, CARBONACEOUS MATERIALS.","In a process for burning a combustible, sulfur-containing carbonaceous material such as coal, municipal waste, or tires, recrystallized metamorphic CaCO3 is introduced into the combustion zone along with the fuel. The amount of SO2 and NO2 generated is substantially reduced as compared to conventional processes and, even with no post-scrubbing equipment, the emission levels compare favorably to the emission levels of state-of-the-art power plants using the same coal with extensive emission controls. The present process also acts to convert sulfur resident in coal into elemental sulfur and loose sulfur compounds and to reduce the particulate output.",NOVACON ENERGY SYSTEMS INC;;DELL AQUILA JOSEPH LEGALLY REP,BAER STEPHEN H;;DELL AQUILA JOSEPH,"NOVACON ENERGY SYSTEMS, INC. (1999-01-13)",https://lens.org/180-653-075-100-969,Search Report,no,2,0,14,16,0,F01N3/08;;F01N2570/04;;F23J7/00;;Y02E20/12;;C10L10/02;;F01N3/08;;F23J7/00;;F01N2570/04;;Y02E20/12;;C10L10/02,C10L10/00;;F01N3/08;;F23G5/00;;F23J7/00,,3,0,,,"PATENT ABSTRACTS OF JAPAN vol. 12, no. 346 (M - 742) 16 September 1988 (1988-09-16);;PATENT ABSTRACTS OF JAPAN vol. 9, no. 309 (C - 318) 5 December 1985 (1985-12-05);;DATABASE WPI Week 8232, Derwent World Patents Index; AN 82-66044E",EXPIRED
28,FI,A0,FI 934679 A0,093-679-904-284-905,1993-10-22,1993,FI 934679 A,1993-10-22,US 8093793 A,1993-06-22,FOERFARANDE FOER FOERBRAENNING AV KOLHALTIGA MATERIAL INNEHAOLLANDE SVAVEL,,NOVACON ENERGY SYSTEMS INC,BAER STEPHEN H;;DELL AQUILA JOSEPH,,https://lens.org/093-679-904-284-905,Patent Application,no,0,0,2,16,0,,B01D53/34,,0,0,,,,PENDING
29,AU,B2,AU 663616 B2,190-302-051-039-065,1995-10-12,1995,AU 1993/046563 A,1993-06-29,US 90871792 A;;US 8093793 A;;US 9306184 W,1992-06-30,"Combustion of sulfur-bearing, carbonaceous materials","In a process for burning a combustible, sulfur-containing carbonaceous material such as coal, municipal waste, or tires, recrystallized metamorphic CaCO3 is introduced into the combustion zone along with the fuel. The amount of SO2 and NO2 generated is substantially reduced as compared to conventional processes and, even with no post-scrubbing equipment, the emission levels compare favorably to the emission levels of state-of-the-art power plants using the same coal with extensive emission controls. The present process also acts to convert sulfur resident in coal into elemental sulfur and loose sulfur compounds and to reduce the particulate output.",NOVACON ENERGY SYSTEMS INC;;LARRY DELL AQUILA,BAER STEPHEN H;;AQUILA JOSEPH DELL,,https://lens.org/190-302-051-039-065,Granted Patent,no,3,1,14,16,0,F01N3/08;;F01N2570/04;;F23J7/00;;Y02E20/12;;C10L10/02;;F01N3/08;;F23J7/00;;F01N2570/04;;Y02E20/12;;C10L10/02,C10L10/00;;F01N3/08;;F23G5/00;;F23J7/00,,0,0,,,,EXPIRED
30,EP,B1,EP 0602238 B1,004-019-053-483-778,1999-02-10,1999,EP 93916846 A,1993-06-29,US 8093793 A;;US 9306184 W;;US 90871792 A,1992-06-30,"PROCESS FOR COMBUSTION OF SULFUR-CONTAINING, CARBONACEOUS MATERIALS","In a process for burning a combustible, sulfur-containing carbonaceous material such as coal, municipal waste, or tires, recrystallized metamorphic CaCO3 is introduced into the combustion zone along with the fuel. The amount of SO2 and NO2 generated is substantially reduced as compared to conventional processes and, even with no post-scrubbing equipment, the emission levels compare favorably to the emission levels of state-of-the-art power plants using the same coal with extensive emission controls. The present process also acts to convert sulfur resident in coal into elemental sulfur and loose sulfur compounds and to reduce the particulate output.",NOVACON ENERGY SYSTEMS INC,BAER STEPHEN H;;DELL AQUILA JOSEPH,"NOVACON ENERGY SYSTEMS, INC. (1999-01-13)",https://lens.org/004-019-053-483-778,Granted Patent,yes,0,0,14,16,0,F01N3/08;;F01N2570/04;;F23J7/00;;Y02E20/12;;C10L10/02;;F01N3/08;;F23J7/00;;F01N2570/04;;Y02E20/12;;C10L10/02,C10L10/00;;F01N3/08;;F23G5/00;;F23J7/00,,1,0,,,"Hawley's Condensed Chemical Dictionary, 11th Edition, Van Nostrand Reinhold (1987) page 200",EXPIRED
31,US,A,US 5447703 A,019-820-057-204-850,1995-09-05,1995,US 8093793 A,1993-06-22,US 8093793 A;;US 90871792 A,1992-06-30,Process for combustion of sulfur-containing carbonaceous materials,"In a process for burning a combustible, sulfur-containing carbonaceous material such as coal, municipal waste, or tires, recrystallized metamorphic CaCO.sub.3 is introduced into the combustion zone along with the fuel. The amount of SO.sub.2 and NO.sub.2 generated is substantially reduced as compared to conventional processes and, even with no post-scrubbing equipment, the emission levels compare favorably to the emission levels of state-of-the-art power plants using the same coal with extensive emission controls. The present process also acts to convert sulfur resident in coal into elemental sulfur and loose sulfur compounds and to reduce the particulate output.",NOVACON ENERGY SYSTEMS INC,BAER STEPHEN H;;DELL AQUILA JOSEPH,NOVACON ENERGY SYSTEMS INC (1993-06-18),https://lens.org/019-820-057-204-850,Granted Patent,yes,9,42,14,16,0,F01N3/08;;F01N2570/04;;F23J7/00;;Y02E20/12;;C10L10/02;;F01N3/08;;F23J7/00;;F01N2570/04;;Y02E20/12;;C10L10/02,C10L10/00;;F01N3/08;;F23G5/00;;F23J7/00,423/235;;423/239.1;;423/244.07;;423/244.08;;110/342,6,2,110-068-513-845-340;;110-068-513-845-340,10.1038/188784b0;;10.1038/188784b0,"PATENT ABSTRACTS OF JAPAN, Vol. 12, No. 346 (M 742) 16 Sep. 1988; & JP-A-63 105 308 (EBARA) (10-05-1988);;PATENT ABSTRACTS OF JAPAN, Vol. 9, No. 309 (C 318) 5 Dec. 1985, & JP-A-60 147 300 (JIYUSABUROU FURUKAWA) (03-08-1985);;DATABASE WPI, Week 8232, Derwent Publications Ltd., London, GB; AN: 82-66044E; & DD-A1-154 307 (KLUGE ET AL.) (10-03-1982);;Colliers s Encyclopedia, vol. 15, 1962, p. 379.;;McGraw Hill Encyclopedia of Science and Technology, vol. 7, 1960, pp. 514 516.;;McGraw Hill Encyclopedia of Science and Technology, vol. 8, 1960, pp. 100 101.",EXPIRED
32,ES,T3,ES 2127289 T3,172-067-953-378-170,1999-04-16,1999,ES 93916846 T,1993-06-29,US 90871792 A;;US 8093793 A,1992-06-30,PROCEDIMIENTO PARA QUEMAR MATERIALES CARBONACEOS QUE CONTIENEN AZUFRE.,"In a process for burning a combustible, sulfur-containing carbonaceous material such as coal, municipal waste, or tires, recrystallized metamorphic CaCO3 is introduced into the combustion zone along with the fuel. The amount of SO2 and NO2 generated is substantially reduced as compared to conventional processes and, even with no post-scrubbing equipment, the emission levels compare favorably to the emission levels of state-of-the-art power plants using the same coal with extensive emission controls. The present process also acts to convert sulfur resident in coal into elemental sulfur and loose sulfur compounds and to reduce the particulate output.",NOVACON ENERGY SYSTEMS INC,BAER STEPHEN H;;DELL AQUILA JOSEPH,,https://lens.org/172-067-953-378-170,Granted Patent,no,0,0,14,16,0,F01N3/08;;F01N2570/04;;F23J7/00;;Y02E20/12;;C10L10/02;;F01N3/08;;F23J7/00;;F01N2570/04;;Y02E20/12;;C10L10/02,C10L10/00;;F01N3/08;;F23G5/00;;F23J7/00,,0,0,,,,EXPIRED
33,FI,A,FI 934679 A,182-879-364-289-643,1994-12-23,1994,FI 934679 A,1993-10-22,US 8093793 A,1993-06-22,Menetelmä rikkiä sisältävien hiilipitoisten materiaalien polttamiseksi,,NOVACON ENERGY SYSTEMS INC,BAER STEPHEN H;;DELL AQUILA JOSEPH,,https://lens.org/182-879-364-289-643,Patent Application,no,0,0,2,16,0,,B01D53/34,,0,0,,,,PENDING
34,US,A1,US 2014/0169163 A1,019-736-497-364-071,2014-06-19,2014,US 201213718678 A,2012-12-18,US 201213718678 A;;US 201261736980 P,2012-12-13,SYSTEMS AND METHODS FOR COMMUNICATION CHANNEL CAPACITY CHANGE DETECTION,Systems and methods for communication channel capacity detection are provided. One method includes monitoring a bandwidth over time of a channel communicatively coupling a plurality of medical devices at a first location with a second location remote from the first location and determining when a channel bandwidth of the channel exceeds a defined threshold value using the monitored bandwidth. The method also includes transmitting control signals from the second location to the plurality of devices at the first location to adjust a transmission rate of medical data from the plurality of medical devices to the second location and limiting a rate of transmission of the control signals to the plurality of medical devices based on a probability that the transmission of the control signals causes the channel bandwidth to exceed the defined threshold value.,GEN ELECTRIC,BUSH STEPHEN FRANCIS;;DELL ANNO MICHAEL JOSEPH,GENERAL ELECTRIC COMPANY (2012-12-13),https://lens.org/019-736-497-364-071,Patent Application,yes,12,6,1,1,0,H04L47/127;;H04L47/263;;G16H40/67;;H04L47/12;;H04L47/12;;H04L47/263;;H04L47/127;;G16H40/67,G16H40/67,370/230,0,0,,,,DISCONTINUED
35,WO,A1,WO 1994/000538 A1,113-313-523-851-547,1994-01-06,1994,US 9306184 W,1993-06-29,US 8093793 A;;US 90871792 A,1992-06-30,"PROCESS FOR COMBUSTION OF SULFUR-CONTAINING, CARBONACEOUS MATERIALS","In a process for burning a combustible, sulfur-containing carbonaceous material (16), such as coal (40), municipal waste, or tires, recrystallized CaCO3 is introduced into the combustion zone (10, 42) along with the fuel. The amount of SO2 and NO2 generated is substantially reduced as compared to conventional processes and, even with no post-scrubbing equipment, the emission levels compare favorably to the emission levels state-of-the-art power plants using the same coal with extensive emission controls. The present process also acts to convert sulfur resident in coal into elemental sulfur and loose sulfur compounds and to reduce the particulate output.",NOVACON ENERGY SYSTEMS INC;;DELL AQUILA LARRY & EM,BAER STEPHEN H;;DELL AQUILA JOSEPH DI,,https://lens.org/113-313-523-851-547,Patent Application,yes,1,0,14,16,0,F01N3/08;;F01N2570/04;;F23J7/00;;Y02E20/12;;C10L10/02;;F01N3/08;;F23J7/00;;F01N2570/04;;Y02E20/12;;C10L10/02,C10L10/00;;F01N3/08;;F23G5/00;;F23J7/00,,0,0,,,,PATENTED
36,WO,A1,WO 2019/060334 A1,193-078-094-632-040,2019-03-28,2019,US 2018/0051621 W,2018-09-19,US 201762560291 P,2017-09-19,MONITORING CABLES AND METHODS FOR MONITORING RAIL TRACKS,"A monitoring cable includes an outer jacket having a generally rectangular cross-sectional profile. The monitoring cable further includes a strain monitoring unit disposed within the outer jacket, the strain monitoring unit including a plurality of optical fibers embedded in a potting layer. The monitoring cable further comprises a protective unit disposed within the outer jacket and spaced from the strain monitoring unit, the protective unit including an optical fiber disposed within a metal outer jacket. A method for monitoring a rail track includes attaching a monitoring cable to the rail track. The method further includes monitoring strain of the rail track by measuring movement of the optical fibers of the strain monitoring unit.",AFL TELECOMMUNICATIONS LLC,STRATTON CRAIG;;LINTON STEPHEN;;DELL DUSTIN;;DUTOIT DANA,,https://lens.org/193-078-094-632-040,Patent Application,yes,3,0,2,2,0,B61L23/044;;B61L23/047;;B61L23/048;;G01B11/16;;B61L23/042;;G01B11/16;;G01L1/242,B61L23/04,,0,0,,,,PENDING
37,US,A1,US 2020/0278195 A1,108-259-465-532-98X,2020-09-03,2020,US 201816647726 A,2018-09-19,US 201816647726 A;;US 201762560291 P;;US 2018/0051621 W,2017-09-19,MONITORING CABLES AND METHODS FOR MONITORING RAIL TRACKS,"A monitoring cable includes an outer jacket having a generally rectangular cross-sectional profile. The monitoring cable further includes a strain monitoring unit disposed within the outer jacket, the strain monitoring unit including a plurality of optical fibers embedded in a potting layer. The monitoring cable further comprises a protective unit disposed within the outer jacket and spaced from the strain monitoring unit, the protective unit including an optical fiber disposed within a metal outer jacket. A method for monitoring a rail track includes attaching a monitoring cable to the rail track. The method further includes monitoring strain of the rail track by measuring movement of the optical fibers of the strain monitoring unit.",AFL TELECOMMUNICATIONS LLC,STRATTON CRAIG;;LINTON STEPHEN;;DELL DUSTIN;;DUTOIT DANA,AFL TELECOMMUNICATIONS LLC (2018-09-26),https://lens.org/108-259-465-532-98X,Patent Application,yes,0,0,2,2,0,B61L23/047;;B61L23/042;;B61L23/044;;B61L23/048;;G01B11/16;;G01B11/16;;G01L1/242,G01B11/16;;B61L23/04;;G01L1/24,,0,0,,,,DISCONTINUED
38,EP,B1,EP 0738381 B1,074-074-217-699-18X,1999-09-08,1999,EP 94928445 A,1994-09-23,GB 9402079 W;;GB 9319708 A;;GB 9324203 A;;GB 9416429 A,1993-09-24,A BLAST AND SPLINTER PROOF SCREENING DEVICE AND ITS METHOD OF USE,,PARKES JOHN HUMPHRIES,PARKES JOHN HUMPHRIES DELL;;SALTER STEPHEN HUGH BROADWOOD,,https://lens.org/074-074-217-699-18X,Granted Patent,yes,14,0,7,23,0,A62B29/00;;A62B29/00;;A62C19/00;;A62C19/00;;F41H9/00;;F41H9/00;;F42B12/50;;F42B12/50;;F42D5/045;;F42D5/045,A62B29/00;;A62C19/00;;F41H9/00;;F42B12/50;;F42D5/045,,1,0,,,"DATABASE WPI Week 7825, Derwent Publications Ltd., London, GB; AN 78E9703A & ZA,A,7 605 622 (T. WILSON)",EXPIRED
39,US,A1,US 2009/0164372 A1,153-954-762-346-231,2009-06-25,2009,US 436207 A,2007-12-20,US 436207 A,2007-12-20,Methods of processing data captured during a deposit transaction conducted at an image-based self-service check depositing terminal,"A method is provided of operating a self-service check depositing terminal. The method comprises the steps of receiving a user identification (ID) card from a depositor at the self-service check depositing terminal, reading ID data from the user ID card, sending the ID data to a consolidation server of a first financial institution to allow the first financial institution to process the ID data, and receiving from the first financial institution a first message containing a first Uniform Resource Locator (URL) which (i) is associated with a consolidation server of a second financial institution which is different from the first financial institution and (ii) is based upon the ID data which has been processed at the first financial institution.",NCR CORP,DELL CHRISTOPHER M;;GAWNE STEPHEN C;;ANCELL MICHAEL,NCR CORPORATION (2007-12-13),https://lens.org/153-954-762-346-231,Patent Application,yes,16,17,1,1,0,G07F19/20;;G07F19/20;;G06Q20/042;;G06Q20/042;;G06Q20/1085;;G06Q20/1085;;G06Q40/02;;G06Q40/02;;G07F19/202;;G07F19/202,G06Q40/00,705/43;;705/45,0,0,,,,DISCONTINUED
40,US,B1,US 10900374 B1,028-671-140-743-687,2021-01-26,2021,US 201916539778 A,2019-08-13,US 201916539778 A,2019-08-13,Transmission shift control method for reduced torque transients,"A power extraction system is provided and includes a low-pressure spool of a gas turbine engine, the low-pressure spool being rotatable at an input rotational speed between a first minimum speed and a first maximum speed, downstream components rotatable at an output rotational speed between a second minimum speed and a second maximum speed and a transmission assembly by which rotations of the low-pressure spool at the input rotational speed are transmittable at the output rotational speed to the downstream components. The transmission assembly includes clutches and a controller configured to control openings and closings of the clutches according to an upshifting algorithm whereby a torque applied by the downstream components is used to reduce the output rotational speed to an output speed of a gear into which the transmission assembly is shifting.",HAMILTON SUNDSTRAND CORP;;HAMILTON SUNSTRAND CORP,FINKE AARON M;;BORTOLI STEPHEN MICHAEL;;DELL JONATHAN C,HAMILTON SUNDSTRAND CORPORATION (2019-08-07),https://lens.org/028-671-140-743-687,Granted Patent,yes,8,0,4,4,0,F16H61/0403;;F16H2061/0422;;B60Y2400/431;;F02C7/36;;H02P2101/25;;F01D15/10;;F02C7/32;;F05D2220/3217;;F05D2220/74;;F16D21/00;;F16H3/02;;F16H2200/00;;H02P9/06,F01D15/10;;F02C7/32;;F16D21/00;;F16H3/02;;H02P9/06;;H02P101/25,,1,0,,,"European Search Report Application No. 19215827.7; dated Jul. 3, 2020; pp. 7.",ACTIVE
41,US,B2,US 11118514 B2,030-603-185-709-244,2021-09-14,2021,US 201916536960 A,2019-08-09,US 201916536960 A,2019-08-09,Turbomachine dual spool transmission systems,A turbomachine dual spool transmission system can include a transmission assembly configured to connect to a combination output of a dual spool differential at a transmission input to be driven by the combination output to turn a transmission output. The transmission assembly can be configured to provide a first output gear ratio in a first state and a second output gear ratio in a second state. The system can include the dual spool differential. The dual spool differential can include a gear assembly configured to combine a low pressure spool input and a high pressure spool input into a combination output to provide an output speed range smaller than a low pressure speed range alone.,HAMILTON SUNDSTRAND CORP,FINKE AARON M;;BORTOLI STEPHEN MICHAEL;;DELL JONATHAN C,HAMILTON SUNDSTRAND CORPORATION (2019-08-09),https://lens.org/030-603-185-709-244,Granted Patent,yes,25,0,4,6,0,F02C7/36;;F02C3/113;;F05D2260/40311;;F05D2220/50;;F16H3/54;;F16H37/0826;;F02C7/32;;F02C7/36;;F05D2260/40311;;F16H3/64;;F16H3/72;;F16H2200/20;;F16H2200/2007;;F16H2200/2033;;F16H2200/2097,F16H3/64;;F02C7/36;;F16H3/72,,3,1,050-637-473-551-980,10.3837/tiis.2014.10.008,"Extended European Search Report dated Jul. 15, 2020, issued during the prosecution of European Patent Application No. EP 19213496.3.;;Jong-Jin Won et al., “Deterministic Multi-Dimensional Task Scheduling Algorithms for Wearable Sensor Devices”, KSII Transactions on Internet and Information Systems, vol. 9, No. 10, Oct. 31, 2014, pp. 3423-3438.;;Extended European Search Report dated Jun. 29, 2020, issued during the prosecution of European Patent Application No. EP 19215795.6.",ACTIVE
42,EP,B1,EP 3779242 B1,112-539-869-669-369,2024-01-24,2024,EP 19215827 A,2019-12-12,US 201916539778 A,2019-08-13,TRANSMISSION SHIFT CONTROL METHOD FOR REDUCED TORQUE TRANSIENTS,,HAMILTON SUNDSTRAND CORP,FINKE AARON M;;BORTOLI STEPHEN MICHAEL;;DELL JONATHAN C,,https://lens.org/112-539-869-669-369,Granted Patent,yes,1,0,4,4,0,F16H61/0403;;F16H2061/0422;;B60Y2400/431;;F02C7/36;;H02P2101/25;;F01D15/10;;F02C7/32;;F05D2220/3217;;F05D2220/74;;F16D21/00;;F16H3/02;;F16H2200/00;;H02P9/06,F16H61/04;;F02C7/36,,0,0,,,,ACTIVE
