"#",Jurisdiction,Kind,Display Key,Lens ID,Publication Date,Publication Year,Application Number,Application Date,Priority Numbers,Earliest Priority Date,Title,Abstract,Applicants,Inventors,Owners,URL,Document Type,Has Full Text,Cites Patent Count,Cited by Patent Count,Simple Family Size,Extended Family Size,Sequence Count,CPC Classifications,IPCR Classifications,US Classifications,NPL Citation Count,NPL Resolved Citation Count,NPL Resolved Lens ID(s),NPL Resolved External ID(s),NPL Citations,Legal Status
1,US,B2,US 10352922 B2,162-966-681-058-136,2019-07-16,2019,US 201715678578 A,2017-08-16,US 201715678578 A,2017-08-16,System and method of measuring hematocrit,"A system for measuring hematocrit in a whole blood sample is provided. An absorbent substrate is adapted to receive a whole blood sample. At least one light source is positioned to illuminate the sample on the substrate at first and second wavelengths. The first and second wavelengths are different from each other. A spectral sensor is positioned to measure a first intensity and a second intensity of light diffusely reflected from the sample at the first and second wavelengths, respectively. The diffusely reflected first and second intensities of light are compared to reference values to generate first and second reflectance values. A controller, coupled to the spectral sensor, is configured to determine a first differential reflectance between the first and second reflectances. The hematocrit level of the sample is determined based on a first stored relationship between hematocrit and a differential reflectance corresponding to the first and second wavelengths.",THERMO FINNIGAN LLC,REEBER STEVEN L;;GLAZIER JOHN,THERMO FINNIGAN LLC (2018-04-09),https://lens.org/162-966-681-058-136,Granted Patent,yes,4,0,2,2,0,G01N33/80;;G01N2021/3148;;G01N33/49;;G01N21/4738;;G01N21/314;;G01N21/8483;;G01N33/49;;G01N15/0606;;G01N21/4738;;G01N2021/4769;;G01N2201/062;;G01N2201/06113;;G01N21/8483;;G01N33/523;;G01N2021/4754;;G01N21/314;;G01N33/80;;G01N2021/3148;;G01N15/075;;G01N2015/012,G01N33/49;;G01N15/00;;G01N15/06;;G01N21/31;;G01N21/47;;G01N21/84;;G01N33/52,,2,2,053-151-937-700-34X;;046-537-760-472-078,10.1021/acs.analchem.6b01321;;10.1021/acs.analchem.6b01321.s001;;27206105;;10.4172/2155-9872.1000162,"SARA CAPIAU, LEAH S. WILK, MAURICE C. G. AALDERS, CHRISTOPHE P. STOVE: ""A Novel, Nondestructive, Dried Blood Spot-Based Hematocrit Prediction Method Using Noncontact Diffuse Reflectance Spectroscopy"", ANALYTICAL CHEMISTRY, AMERICAN CHEMICAL SOCIETY, US, vol. 88, no. 12, 21 June 2016 (2016-06-21), US, pages 6538 - 6546, XP055337859, ISSN: 0003-2700, DOI: 10.1021/acs.analchem.6b01321;;Miller IV et al., “An On-card Approach for Assessment of Hematocrit on Dried Blood Spots which Allows for Correction of Sample Volume,” J. Anal. Bioanal. Techniques, 8 pgs, 2013.",ACTIVE
2,US,A1,US 2019/0056378 A1,145-788-884-435-573,2019-02-21,2019,US 201715678578 A,2017-08-16,US 201715678578 A,2017-08-16,SYSTEM AND METHOD OF MEASURING HEMATOCRIT,"A system for measuring hematocrit in a whole blood sample is provided. An absorbent substrate is adapted to receive a whole blood sample. At least one light source is positioned to illuminate the sample on the substrate at first and second wavelengths. The first and second wavelengths are different from each other. A spectral sensor is positioned to measure a first intensity and a second intensity of light diffusely reflected from the sample at the first and second wavelengths, respectively. The diffusely reflected first and second intensities of light are compared to reference values to generate first and second reflectance values. A controller, coupled to the spectral sensor, is configured to determine a first differential reflectance between the first and second reflectances. The hematocrit level of the sample is determined based on a first stored relationship between hematocrit and a differential reflectance corresponding to the first and second wavelengths.",THERMO FINNIGAN LLC,REEBER STEVEN L;;GLAZIER JOHN,THERMO FINNIGAN LLC (2018-04-09),https://lens.org/145-788-884-435-573,Patent Application,yes,0,0,2,2,0,G01N33/80;;G01N2021/3148;;G01N33/49;;G01N21/4738;;G01N21/314;;G01N21/8483;;G01N33/49;;G01N15/0606;;G01N21/4738;;G01N2021/4769;;G01N2201/062;;G01N2201/06113;;G01N21/8483;;G01N33/523;;G01N2021/4754;;G01N21/314;;G01N33/80;;G01N2021/3148;;G01N15/075;;G01N2015/012,G01N33/49;;G01N15/06;;G01N21/47,,0,0,,,,ACTIVE
3,US,B1,US 10402868 B1,142-434-350-908-746,2019-09-03,2019,US 201313909828 A,2013-06-04,US 201313909828 A,2013-06-04,Computer-based systems and methods for creating and distributing food and/or drink promotions for targeted consumers based on bids from suppliers and data about the targeted consumers,Computer-based systems and methods for creating and distributing food and/or drink promotions to consumers based on bids from suppliers of food and/or drink products and based on data about the targeted consumers.,ENTERRA SOLUTIONS LLC,GLAZIER JASON;;SERMARINI STEVEN;;DEANGELIS STEPHEN F,ENTERRA SOLUTIONS LLC (2013-06-18),https://lens.org/142-434-350-908-746,Granted Patent,yes,18,5,1,1,0,G06Q30/0275;;G06Q30/0275,G06Q30/02,,6,1,051-331-431-424-013,10.7312/star16075-025,"ProQuest Dialog Search Results (Year: 2019).;;Newman, “Savoring Success by Expanding the Brand,” The New York Times, Sep. 17, 2012 (3 pages).;;Duhigg, “How Companies Learn Your Secrets,” The New York Times, Feb. 16, 2012 (15 pages).;;Watson, “McCormick on mission to become Amazon of recipes with ‘breakthrough’ flavor print application,” Food navigator-usa.com, Apr. 23, 2012 (2 pages).;;Fu, “Ad Auctions with Data,” Yahoo! Research (12 pages).;;Hansen, “The Economics of Search Engines—Search, Ad Auctions & Game Theory,” Master Thesis, Copenhagen Business School, Applied Economics and Finance, 2009, www.issuu.com/jacobhansen/docs/theeconomicsofsearchengines (87 pages).",ACTIVE
4,US,A1,US 2014/0289012 A1,162-853-398-998-287,2014-09-25,2014,US 201313847273 A,2013-03-19,US 201313847273 A,2013-03-19,"AGGREGATED SENSORY PROFILE GENERATION, ANALYTICS, AND INSIGHTS","Computer-based systems and methods for determining an aggregate sensory profile for a plurality of individuals. The system may comprise a plurality of remote computer systems, each comprising: a local database for storing user data about the plurality of individuals; and a local sensory profile determination engine for generating sensory profile data for each of the plurality of individuals based on user data stored in the local database. The system may also comprise a central computer system that receives the sensory profile data from the plurality of remote computer systems. The central computer system comprises: a central database for storing the sensory profile data received from the remote computer systems; and a sensory profile aggregation engine for generating aggregate sensory profiles for each of the plurality of individuals based on the sensory profile data received from the remote computer systems and stored in the central database.",ENTERRA SOLUTIONS LLC,DEANGELIS STEPHEN F;;GLAZIER JASON;;SERMARINI STEVEN,ENTERRA SOLUTIONS LLC (2013-06-18),https://lens.org/162-853-398-998-287,Patent Application,yes,0,5,1,1,0,G06Q10/063;;G06Q10/063,G06Q10/06,705/7.32;;705/14.66,0,0,,,,DISCONTINUED
5,US,A1,US 2019/0266461 A1,189-261-647-645-337,2019-08-29,2019,US 201916407940 A,2019-05-09,US 201916407940 A;;US 201715585931 A,2017-05-03,FINGERPRINT-BASED EXPERIENCE GENERATION,"Experience fingerprints can be generated that are unique but correspond to a recognizable fingerprint template, where each fingerprint can correspond to a word of a visual language. Image data can be captured that includes a representation of an experience fingerprint, and the fingerprint can be analyzed by a remote system or service to determine an experience to be provided. The experience can be a general experience to be provided for any request relating to a specific fingerprint received over a period of time, or the experience can be selected, modified, or generated based upon contextual information for the request, such as information for a user or device submitting the request. The experience can include audio, video, text, or graphical content, as may be presented using one or more devices.",AMAZON TECH INC,APT DANIEL;;FIGUEROA CRUCES ROBERTO FULTON;;GLAZIER RICHARD;;SUSI STEVEN,,https://lens.org/189-261-647-645-337,Patent Application,yes,6,0,3,3,0,G06V20/95;;G06V10/225;;G06K19/06037;;G06K7/1417;;G06K19/06112;;G06V10/225,G06K19/06;;G06K7/14,,0,0,,,,ACTIVE
6,US,B2,US 10733491 B2,056-993-704-188-154,2020-08-04,2020,US 201916407940 A,2019-05-09,US 201916407940 A;;US 201715585931 A,2017-05-03,Fingerprint-based experience generation,"Experience fingerprints can be generated that are unique but correspond to a recognizable fingerprint template, where each fingerprint can correspond to a word of a visual language. Image data can be captured that includes a representation of an experience fingerprint, and the fingerprint can be analyzed by a remote system or service to determine an experience to be provided. The experience can be a general experience to be provided for any request relating to a specific fingerprint received over a period of time, or the experience can be selected, modified, or generated based upon contextual information for the request, such as information for a user or device submitting the request. The experience can include audio, video, text, or graphical content, as may be presented using one or more devices.",AMAZON TECH INC,APT DANIEL;;FIGUEROA CRUCES ROBERTO FULTON;;GLAZIER RICHARD;;SUSI STEVEN,,https://lens.org/056-993-704-188-154,Granted Patent,yes,59,0,3,3,0,G06V20/95;;G06V10/225;;G06K19/06037;;G06K7/1417;;G06K19/06112;;G06V10/225,G06K19/06;;G06K7/14,,12,0,,,"Non-Final Office Action issued in co-related U.S. Appl. No. 15/585,931 dated Apr. 19, 2018.;;Final Office Action issued in co-related U.S. Appl. No. 15/585,931 dated Oct. 16, 2018.;;Notice of Allowance issued in co-related U.S. Appl. No. 15/585,931 dated Mar. 13, 2019.;;Non-Final Office Action issued in co-related U.S. Appl. No. 15/831,205 dated Sep. 6, 2018.;;Final Office Action issued in co-related U.S. Appl. No. 15/831,205 dated Jan. 30, 2019.;;Notice of Allowance issued in co-related U.S. Appl. No. 15/831,205 dated Apr. 2, 2019.;;International Search Report and Written Opinion issued in International Application No. PCT/US2018/062874 dated Feb. 26, 2019.;;Non-Final Office Action issued in co-related U.S. Appl. No. 15/882,741 dated Aug. 13, 2018.;;Notice of Allowance issued in co-related U.S. Appl. No. 15/882,741 dated Jan. 11, 2019.;;Notice of Allowance issued in co-related U.S. Appl. No. 15/882,741 dated Feb. 21, 2019.;;Kiss Radio, “You Control the Music”, Oct. 2017. pp. 1-3.;;Non-Final Office Action issued in co-related U.S. Appl. No. 15/882,678 dated Dec. 2, 2019.",ACTIVE
7,US,B1,US 10354176 B1,148-017-950-875-643,2019-07-16,2019,US 201715585931 A,2017-05-03,US 201715585931 A,2017-05-03,Fingerprint-based experience generation,"Experience fingerprints can be generated that are unique but correspond to a recognizable fingerprint template, where each fingerprint can correspond to a word of a visual language. Image data can be captured that includes a representation of an experience fingerprint, and the fingerprint can be analyzed by a remote system or service to determine an experience to be provided. The experience can be a general experience to be provided for any request relating to a specific fingerprint received over a period of time, or the experience can be selected, modified, or generated based upon contextual information for the request, such as information for a user or device submitting the request. The experience can include audio, video, text, or graphical content, as may be presented using one or more devices.",AMAZON TECH INC,APT DANIEL;;FIGUEROA CRUCES ROBERTO FULTON;;GLAZIER RICHARD;;SUSI STEVEN,AMAZON TECHNOLOGIES INC (2017-05-01),https://lens.org/148-017-950-875-643,Granted Patent,yes,7,3,3,3,0,G06V20/95;;G06V10/225;;G06K19/06037;;G06K7/1417;;G06K19/06112;;G06V10/225,G06K7/14;;G06K19/06,,1,0,,,"Final Office Action issued in co-related U.S. Appl. No. 15/831,205 dated Jan. 30, 2019.",ACTIVE
8,US,A1,US 2023/0106403 A1,062-207-420-216-068,2023-04-06,2023,US 202217958280 A,2022-09-30,US 202217958280 A;;US 202163262022 P,2021-10-01,LONG CYCLE LIFE LITHIUM METAL AND ANODE-FREE CELLS,"Methods and systems for providing controlling in a repeatable manner a plurality of anode-free or lithium metal cells in a power-supply system. The cells are connected in series in one or more high energy density hybrid modules connected in parallel. Each high energy density hybrid module includes a corresponding hybrid module controller (HMC) and has a corresponding bi-directional DC-DC-converter, and each cell of the plurality of cells is independently measurable by the HMC. The corresponding bi-directional DC-DC-converter is used to charge and discharge of the plurality of cells in a repeatable manner to be within a selected state of charge (SOC) range that corresponds to a defined cycle life and energy density requirement.",OUR NEXT ENERGY INC,GLAZIER STEPHEN;;BECK LARRY;;KAYE STEVEN;;IJAZ MUJEEB;;XIE HEZHEN;;HUANG YADONG,OUR NEXT ENERGY INC (2022-09-28),https://lens.org/062-207-420-216-068,Patent Application,yes,0,0,2,2,0,B60L50/64;;B60L58/14;;B60L58/15;;B60L58/16;;B60L58/21;;B60L58/13;;Y02E60/10;;H01M4/525;;H01M4/58;;H01M10/44;;H01M2220/20,H01M10/44;;H01M4/525;;H01M4/58,,0,0,,,,PENDING
9,WO,A1,WO 2023/056071 A1,136-207-472-325-867,2023-04-06,2023,US 2022/0045469 W,2022-09-30,US 202163262022 P,2021-10-01,LONG CYCLE LIFE LITHIUM METAL AND ANODE-FREE CELLS,"Methods and systems for providing controlling in a repeatable manner a plurality of anode-free or lithium metal cells in a power-supply system. The cells are connected in series in one or more high energy density hybrid modules connected in parallel. Each high energy density hybrid module includes a corresponding hybrid module controller (HMC) and has a corresponding bi-directional DC-DC-converter, and each cell of the plurality of cells is independently measurable by the HMC. The corresponding bi-directional DC-DC-converter is used to charge and discharge of the plurality of cells in a repeatable manner to be within a selected state of charge (SOC) range that corresponds to a defined cycle life and energy density requirement.",OUR NEXT ENERGY INC,GLAZIER STEPHEN;;BECK LARRY;;KAYE STEVEN;;IJAZ MUJEEB;;XIE HEZHEN;;HUANG YADONG,,https://lens.org/136-207-472-325-867,Patent Application,yes,3,0,2,2,0,B60L50/64;;B60L58/14;;B60L58/15;;B60L58/16;;B60L58/21;;B60L58/13;;Y02E60/10;;H01M4/525;;H01M4/58;;H01M10/44;;H01M2220/20,B60L58/13;;B60L50/64;;B60L58/14;;B60L58/15;;B60L58/16;;B60L58/21,,0,0,,,,PENDING
10,US,A1,US 2012/0283770 A1,065-116-712-247-304,2012-11-08,2012,US 201013392619 A,2010-08-20,US 201013392619 A;;US 23829709 P;;US 2010/0002290 W,2009-08-31,COMPRESSIBLE ARTERIOTOMY LOCATOR FOR VASCULAR CLOSURE DEVICES AND METHODS,"A tissue puncture locator device includes a temporary anchor configured for placement through a vascular puncture into a vessel. The temporary anchor includes a column member that defines a lumen. The temporary anchor is movable between an uncompressed position and a compressed position, wherein in the compressed position a portion of the column member protrudes radially outward. The column member may include a reduced thickness portion, wherein the column member protrudes radially outward at the reduced thickness portion. The column member, when expanded radially outward within the vessel, is sized to limit retraction of the temporary anchor through the vascular puncture.",KRAMER SCOTT A;;GLAZIER VALERIE J;;PIPENHAGEN CATHERINE A;;EDQUIST BRIAN J;;WILLARD STEVEN N;;ST JUDE MEDICAL PUERTO RICO,KRAMER SCOTT A;;GLAZIER VALERIE J;;PIPENHAGEN CATHERINE A;;EDQUIST BRIAN J;;WILLARD STEVEN N,ST. JUDE MEDICAL PUERTO RICO LLC (2012-02-29),https://lens.org/065-116-712-247-304,Patent Application,yes,1,17,3,3,0,A61B17/0057;;A61B17/0057;;A61B2017/00601;;A61B2017/00601;;A61B2017/00623;;A61B2017/00623;;A61B2017/0065;;A61B2017/0065;;A61B2017/00654;;A61B2017/00654;;A61B2017/00672;;A61B2017/00672,A61B17/03,606/213,0,0,,,,INACTIVE
11,WO,A1,WO 2011/025528 A1,064-644-737-519-612,2011-03-03,2011,US 2010/0002290 W,2010-08-20,US 23829709 P,2009-08-31,COMPRESSIBLE ARTERIOTOMY LOCATOR FOR VASCULAR CLOSURE DEVICES AND METHODS,"A tissue puncture locator device includes a temporary anchor configured for placement through a vascular puncture into a vessel. The temporary anchor includes a column member that defines a lumen. The temporary anchor is movable between an uncompressed position and a compressed position, wherein in the compressed position a portion of the column member protrudes radially outward. The column member may include a reduced thickness portion, wherein the column member protrudes radially outward at the reduced thickness portion. The column member, when expanded radially outward within the vessel, is sized to limit retraction of the temporary anchor through the vascular puncture.",ST JUDE MEDICAL PUERTO RICO;;KRAMER SCOTT A;;GLAZIER VALERIE J;;PIPENHAGEN CATHERINE A;;EDQUIST BRIAN J;;WILLARD STEVEN N,KRAMER SCOTT A;;GLAZIER VALERIE J;;PIPENHAGEN CATHERINE A;;EDQUIST BRIAN J;;WILLARD STEVEN N,,https://lens.org/064-644-737-519-612,Patent Application,yes,8,6,3,3,0,A61B17/0057;;A61B17/0057;;A61B2017/00601;;A61B2017/00601;;A61B2017/00623;;A61B2017/00623;;A61B2017/0065;;A61B2017/0065;;A61B2017/00654;;A61B2017/00654;;A61B2017/00672;;A61B2017/00672,A61B17/00,,0,0,,,,PENDING
12,US,B2,US 9603588 B2,164-145-543-234-060,2017-03-28,2017,US 201013392619 A,2010-08-20,US 201013392619 A;;US 23829709 P;;US 2010/0002290 W,2009-08-31,Compressible arteriotomy locator for vascular closure devices and methods,"A tissue puncture locator device includes a temporary anchor configured for placement through a vascular puncture into a vessel. The temporary anchor includes a column member that defines a lumen. The temporary anchor is movable between an uncompressed position and a compressed position, wherein in the compressed poition a portion of the column member protrudes radially outward. The column member may include a reduced thickness portion, wherein the column member protrudes radially outward at the reduced thickness portion. The column member, when expanded radially outward within the vessel, is sized to limit retraction of the temporary anchor through the vascular puncture.",KRAMER SCOTT A;;GLAZIER VALERIE J;;PIPENHAGEN CATHERINE A;;EDQUIST BRIAN J;;WILLARD STEVEN N;;ST JUDE MEDICAL PUERTO RICO,KRAMER SCOTT A;;GLAZIER VALERIE J;;PIPENHAGEN CATHERINE A;;EDQUIST BRIAN J;;WILLARD STEVEN N,ST. JUDE MEDICAL PUERTO RICO LLC (2012-02-29),https://lens.org/164-145-543-234-060,Granted Patent,yes,9,0,3,3,0,A61B17/0057;;A61B17/0057;;A61B2017/00601;;A61B2017/00601;;A61B2017/00623;;A61B2017/00623;;A61B2017/0065;;A61B2017/0065;;A61B2017/00654;;A61B2017/00654;;A61B2017/00672;;A61B2017/00672,A61B17/00,,1,0,,,"PCT International Search Report for International Application No. PCT/US2010/002290, mailed Dec. 6, 2010.",INACTIVE
