54,CN,A,CN 113015985 A,146-570-513-270-161,2021-06-22,2021,CN 202080005069 A,2020-08-17,US 201962923774 P;;US 202016736284 A;;US 2020/0046611 W,2019-10-21,ARTIFICIAL INTELLIGENCE BASED ROOM ASSIGNMENT OPTIMIZATION SYSTEM,"Embodiments provide optimized room assignments for a hotel in response to receiving a plurality of hard constraints and soft constraints and receiving reservation preferences and room features. The optimization includes determining a guest satisfaction assignment cost based on the reservation preferences and room features, determining an operational efficiency assignment cost, generating a weighted cost matrix based on the guest satisfaction assignment cost and the operational efficiency assignment cost, and generating preliminary room assignments based on the weighted cost matrix. When the preliminary room assignments are feasible, the preliminary room assignments are the optimized room assignments comprising a feasible selection of elements of the matrix. When the preliminary room assignments are infeasible, embodiments relax one or more constraints and repeat the performing optimization until the preliminary room assignments are feasible.",ORACLE INT CORP,BOROUJENI SETAREH BORJIAN;;VAKHUTINSKY ANDREW;;YAGNAVAJHALA SARASWATI;;PEREZ JORGE LUIS RIVERO;;AGARWAL DHRUV;;CHATTERJEE AKASH,,https://lens.org/146-570-513-270-161,Patent Application,no,0,1,5,5,0,G06Q10/04;;G06Q50/12;;G06Q10/0631;;G06Q10/06314;;G06Q50/12;;G06Q10/02;;G06Q10/04;;G06Q10/02;;G06Q10/06314;;G06Q50/12;;G06Q10/04,G06Q10/04;;G06Q50/12,,0,0,,,,PENDING
55,CL,A1,CL 2019003295 A1,186-821-268-602-840,2020-08-14,2020,CL 2019003295 A,2019-11-15,CL 2019003295 A,2019-11-15,"En este documento se describe un aparato y un método correspondiente para realizar zonificación de almacén y además monitorear el almacén zonificado. el aparato incluye circuitos que dividen un espacio de trabajo en un sinnúmero de zonas basado en un área del espacio de trabajo, y un número de vehículos de transporte y un número de estanterías de artículos que deben ser desplegados en el espacio de trabajo. una ubicación de cada zona dentro del espacio de trabajo es determinada en base a una ubicación de un primer tipo de estación que está dispuesta fuera del espacio de trabajo. el aparato determina para cada zona, un área de la zona y recibe una señal que indica la ocurrencia de un evento en una de las zonas. además, el aparato determina un grado de criticidad del evento ocurrido el cual indica si la operación del espacio de trabajo en la zona puede continuar, e inicia una operación en un momento que está basado en el grado de criticidad determinado.",,GREY ORANGE PTE LTD,BOSE SAGAR;;BOPPANA NAVEEN;;KEJRIWAL GAURAV;;AGARWAL RUPESH;;GUPTA AKASH;;KOHLI SAMAY;;HOELTGEN WOLFGANG KURT,,https://lens.org/186-821-268-602-840,Patent Application,no,0,0,1,1,0,,G05B13/02;;G06Q10/06;;G06Q10/08,,0,0,,,,PENDING
56,US,A1,US 2021/0117873 A1,108-914-679-632-714,2021-04-22,2021,US 202016736284 A,2020-01-07,US 202016736284 A;;US 201962923774 P,2019-10-21,Artificial Intelligence Based Room Assignment Optimization System,"Embodiments provide optimized room assignments for a hotel in response to receiving a plurality of hard constraints and soft constraints and receiving reservation preferences and room features. The optimization includes determining a guest satisfaction assignment cost based on the reservation preferences and room features, determining an operational efficiency assignment cost, generating a weighted cost matrix based on the guest satisfaction assignment cost and the operational efficiency assignment cost, and generating preliminary room assignments based on the weighted cost matrix. When the preliminary room assignments are feasible, the preliminary room assignments are the optimized room assignments comprising a feasible selection of elements of the matrix. When the preliminary room assignments are infeasible, embodiments relax one or more constraints and repeat the performing optimization until the preliminary room assignments are feasible.",ORACLE INT CORP,VAKHUTINSKY ANDREW;;BOROUJENI SETAREH BORJIAN;;YAGNAVAJHALA SARASWATI;;PEREZ JORGE LUIS RIVERO;;AGARWAL DHRUV;;CHATTERJEE AKASH,ORACLE INTERNATIONAL CORPORATION (2019-12-30),https://lens.org/108-914-679-632-714,Patent Application,yes,0,2,5,5,0,G06Q10/04;;G06Q50/12;;G06Q10/0631;;G06Q10/06314;;G06Q50/12;;G06Q10/02;;G06Q10/04;;G06Q10/02;;G06Q10/06314;;G06Q50/12;;G06Q10/04,G06Q10/02;;G06Q10/04;;G06Q10/06;;G06Q50/12,,2,2,051-676-079-313-894;;133-704-620-989-322,10.1177/0010880405275597;;10.1016/j.ijhm.2016.03.003,"Rajiv Banker, ""Association of Nonfinancial Performance Measures with the Financial Performance of a Lodging Chain"", November, 2005, Cornell University, Volume 46, Number 4, pages 394-412. (Year: 2005);;Xun Xu, “The antecedents of customer satisfaction and dissatisfaction toward various types of hotels: A text mining approach”, May 2016, International Journal of Hospitality Management, Volume 55, Pages 57-69. (Year: 2016) (Year: 2016)",ACTIVE
57,AU,A4,AU 2021/103601 A4,133-856-910-393-255,2021-08-19,2021,AU 2021/103601 A,2021-06-24,AU 2021/103601 A,2021-06-24,SYSTEM AND METHOD FOR MONITORING POST COVID PATIENT USING MACHINE LEARNING AND BLOCK CHAIN,"SYSTEM AND METHOD FOR MONITORING POST COVID PATIENT USING MACHINE LEARNING AND BLOCK CHAIN The present invention relates to a system and method for monitoring post covid recovered patient using machine learning model and block chain technique. The objective of present invention is to solve the anomalies presented in the prior art techniques and technologies related to healthcare monitor of patient who has recovered for the covid-19 disease. The disclosure presents a block chain integrated remote post covid patient monitoring which is machine learning and Biomedical sensor based smart wearable devices for collecting various physiological and health related parameters of the patient. Its aim is to help remotely living post covid patient to gain access to healthcare units seamlessly and avail services without time and geographical restrictions. The invention is integrated with block chain technology in order to make sensitive healthcare transactions immutable leading to data integrity and non repudiation. Further, the system is equipped enough with machine learning models to infer the data available and detect any abnormal pattern related to health issues. It has provision to capture post covid patient vital signs and send to doctors. The mobile application or user interface pulls data from the machine learning model based central server and showed to doctor from time to time. Thus, doctor can view post covid patient health details and support near real-time monitoring and treatment to save lives of post covid patient besides their valuable time and effort. In this way, the monitoring of post covid recovered patient becomes easy patient and family can be avoided from harm of lives. Train central server using database and test cases according to machine learning model (201) Collect physiological and health data by smart wearable devices having biomedical sensors stored in local memory (202) Periodically sending gathered data to central server using communication network (203) Detecting abnormality in gathered data using machine learning model (204) Periodically reviewing data by the expert doctors using user interface or mobile application (205) Notifying the patient regarding any abnormality in health on the basis of assed data in real time (206) Patient or user access data using mobile application and act as prescribed by expert (207) Figure 2 - Flow-diagram of the post covid patient monitoring method",AGARWAL ANSHU;;ASTHANA STUTI;;BHANAWAT HEMANT;;CHATURVEDI PRASHANT;;PATEL RAJANKUMAR G;;SANKAR B P BIJAY;;SAXENA AKASH,AGARWAL ANSHU;;CHATURVEDI PRASHANT;;PATEL RAJANKUMAR G;;SANKAR B P BIJAY;;BHANAWAT HEMANT;;SAXENA AKASH;;ASTHANA STUTI,,https://lens.org/133-856-910-393-255,Limited Patent,no,0,0,1,1,0,G16H80/00;;A61B5/742;;G06N20/00;;G16H10/60;;G16H50/30;;H04L9/32;;A61B5/0022;;A61B5/01;;A61B5/02405;;A61B5/1118;;A61B5/165;;A61B5/4809;;A61B5/6801;;A61B5/681;;A61B5/6823;;A61B5/6831;;A61B5/7267;;H04L9/50,G16H80/00;;A61B5/00;;A61B5/01;;A61B5/024;;A61B5/11;;A61B5/16;;G06N20/00;;G16H10/60;;G16H50/30;;H04L9/32,,0,0,,,,INACTIVE
58,US,B2,US 11847820 B2,078-697-602-698-294,2023-12-19,2023,US 202217724534 A,2022-04-20,IN 202211000172 A,2022-01-03,Method and system for classifying faces of boundary representation (B-Rep) models using artificial intelligence,The invention relates to method and system for classifying faces of a Boundary Representation (B-Rep) model using Artificial Intelligence (AI). The method includes extracting topological information corresponding to each of a plurality of data points of a B-Rep model of a product; determining a set of parameters based on the topological information corresponding to each of the plurality of data points; transforming the set of parameters corresponding to each of the plurality of data points of the B-Rep model into a tabular format to obtain a parametric data table; and assigning each of the plurality of faces of the B-Rep model a category from a plurality of categories based on the parametric data table using an AI model.,HCL TECHNOLOGIES LTD,CHANDANKAR GIRISH RAMESH;;ELUMALAI HARI KRISHNAN;;GUPTA PANKAJ;;CHAKRAVARTY RAJESH;;AGARWAL AKASH;;PANDYA RAUNAQ;;REDDY YAGANTI SASIDHAR,HCL TECHNOLOGIES LIMITED (2022-04-19),https://lens.org/078-697-602-698-294,Granted Patent,yes,13,0,2,2,0,G06V10/426;;G06V10/764;;G06V10/7784;;G06V10/46,G06V10/764;;G06V10/46;;G06V10/778,,2,0,,,"Indiacadworks, Applications of Artificial Intelligence in CAD Technology, Mar. 31, 2015.;;Nefi Alarcon, AI Helps Predict and Sketch Computer-Aided Design Models, Tags: Computer Aided Design (CAD), featured, News, Jul. 23, 2020.",ACTIVE
59,US,A1,US 2023/0215138 A1,039-465-816-396-702,2023-07-06,2023,US 202217724534 A,2022-04-20,IN 202211000172 A,2022-01-03,METHOD AND SYSTEM FOR CLASSIFYING FACES OF BOUNDARY REPRESENTATION (B-REP) MODELS USING ARTIFICIAL INTELLIGENCE,The invention relates to method and system for classifying faces of a Boundary Representation (B-Rep) model using Artificial Intelligence (AI). The method includes extracting topological information corresponding to each of a plurality of data points of a B-Rep model of a product; determining a set of parameters based on the topological information corresponding to each of the plurality of data points; transforming the set of parameters corresponding to each of the plurality of data points of the B-Rep model into a tabular format to obtain a parametric data table; and assigning each of the plurality of faces of the B-Rep model a category from a plurality of categories based on the parametric data table using an AI model,HCL TECHNOLOGIES LTD,CHANDANKAR GIRISH RAMESH;;ELUMALAI HARI KRISHNAN;;GUPTA PANKAJ;;CHAKRAVARTY RAJESH;;AGARWAL AKASH;;PANDYA RAUNAQ;;REDDY YAGANTI SASIDHAR,HCL TECHNOLOGIES LIMITED (2022-04-19),https://lens.org/039-465-816-396-702,Patent Application,yes,9,1,2,2,0,G06V10/426;;G06V10/764;;G06V10/7784;;G06V10/46,G06V10/764;;G06V10/46,,0,0,,,,ACTIVE
60,US,A1,US 2019/0166608 A1,169-583-721-956-587,2019-05-30,2019,US 201715822642 A,2017-11-27,US 201715822642 A,2017-11-27,INTELLIGENT RESOURCE ASSIGNMENT TO INCREASE THROUGHPUT IN MULTIPLE INPUT MULTIPLE OUTPUT (MIMO) AND CARRIER AGGREGATION (CA) CAPABLE DEVICES,"Certain aspects of the present disclosure relate to methods and apparatus relating to intelligent resource assignment to increase throughput in LTE multiple input multiple output (MIMO) and carrier aggregation (CA) capable devices. In certain aspects, a MIMO and CA capable wireless communication device communicates with a base station (BS) on multiple component carriers (CCs) through multiple radio frequency (RF) chains. In such aspects, the device tentatively switches one or more first RF chains, not assigned to a first CC of the multiple CCs, to the first CC for evaluating a rank of the first CC. The device then determines that the first CC has a higher rank indication (RI) with the one or more RF chains. The device subsequently evaluates one or more performance factors, in conjunction with the higher rank, based on which the device then additionally assigns one or more second RF chains to the first CC.",QUALCOMM INC,KUMAR AKASH;;ZHAO PENGKAI;;PAZHEDATH ILLATH NARAYANAN;;BANSAL HARGOVIND PRASAD;;TIRUCHERAI MURALIDHARAN VIJAYVARADHARAJ;;KHAN AHMED;;AGARWAL MRIDUL;;UKIL ARITRA,QUALCOMM INCORPORATED (2017-12-21),https://lens.org/169-583-721-956-587,Patent Application,yes,0,5,3,3,0,H04B7/02;;H04B7/0602;;H04B7/063;;H04L5/001;;H04L5/0023;;H04L5/006;;H04L27/2646;;H04L27/2647;;H04L5/0042;;H04W36/362;;H04L5/001;;H04L5/006;;H04B7/063;;H04L27/2647;;H04B7/02;;H04L5/0023;;H04L27/2646;;H04B7/0602;;H04W72/23;;H04W28/082;;H04B17/382;;H04W76/36;;H04B7/0404;;H04B7/0413;;H04J1/16;;H04J11/0066;;H04L5/0042;;H04L5/0098;;H04W24/02;;H04W24/08;;H04W36/36;;H04W72/02;;H04W72/1263,H04W72/12;;H04B7/0413;;H04W24/08;;H04W72/14,,0,0,,,,ACTIVE
61,WO,A1,WO 2019/104352 A1,053-270-283-278-080,2019-05-31,2019,US 2018/0062670 W,2018-11-27,US 201715822642 A,2017-11-27,INTELLIGENT RESOURCE ASSIGNMENT TO INCREASE THROUGHPUT IN MULTIPLE INPUT MULTIPLE OUTPUT (MIMO) AND CARRIER AGGREGATION (CA) CAPABLE DEVICES,"Methods and apparatus for intelligent resource assignment to increase throughput in LTE multiple input multiple output (MIMO) and carrier aggregation (CA) capable devices. A wireless communication device may tentatively switch one or more first radio frequency (RF) chains, not assigned to a first component carrier (CC) of the multiple CCs, to the first CC for evaluating a rank of the first CC. The device may evaluate one or more performance factors, in conjunction with the rank, to additionally assigns one or more second RF chains to the first CC.",QUALCOMM INC,KUMAR AKASH;;ZHAO PENGKAI;;PAZHEDATH ILLATH NARAYANAN;;BANSAL HARGOVIND PRASAD;;TIRUCHERAI MURALIDHARAN VIJAYVARADHARAJ;;KHAN AHMED;;AGARWAL MRIDUL;;UKIL ARITRA,,https://lens.org/053-270-283-278-080,Patent Application,yes,3,0,3,3,0,H04B7/02;;H04B7/0602;;H04B7/063;;H04L5/001;;H04L5/0023;;H04L5/006;;H04L27/2646;;H04L27/2647;;H04L5/0042;;H04W36/362;;H04L5/001;;H04L5/006;;H04B7/063;;H04L27/2647;;H04B7/02;;H04L5/0023;;H04L27/2646;;H04B7/0602;;H04W72/23;;H04W28/082;;H04B17/382;;H04W76/36;;H04B7/0404;;H04B7/0413;;H04J1/16;;H04J11/0066;;H04L5/0042;;H04L5/0098;;H04W24/02;;H04W24/08;;H04W36/36;;H04W72/02;;H04W72/1263,H04L5/00;;H04B7/02;;H04L27/26,,0,0,,,,PENDING
62,US,B2,US 10356755 B2,034-312-874-279-708,2019-07-16,2019,US 201715822642 A,2017-11-27,US 201715822642 A,2017-11-27,Intelligent resource assignment to increase throughput in multiple input multiple output (MIMO) and carrier aggregation (CA) capable devices,"Certain aspects of the present disclosure relate to methods and apparatus relating to intelligent resource assignment to increase throughput in LTE multiple input multiple output (MIMO) and carrier aggregation (CA) capable devices. In certain aspects, a MIMO and CA capable wireless communication device communicates with a base station (BS) on multiple component carriers (CCs) through multiple radio frequency (RF) chains. In such aspects, the device tentatively switches one or more first RF chains, not assigned to a first CC of the multiple CCs, to the first CC for evaluating a rank of the first CC. The device then determines that the first CC has a higher rank indication (RI) with the one or more RF chains. The device subsequently evaluates one or more performance factors, in conjunction with the higher rank, based on which the device then additionally assigns one or more second RF chains to the first CC.",QUALCOMM INC,KUMAR AKASH;;ZHAO PENGKAI;;PAZHEDATH ILLATH NARAYANAN;;BANSAL HARGOVIND PRASAD;;TIRUCHERAI MURALIDHARAN VIJAYVARADHARAJ;;KHAN AHMED;;AGARWAL MRIDUL;;UKIL ARITRA,QUALCOMM INCORPORATED (2017-12-21),https://lens.org/034-312-874-279-708,Granted Patent,yes,10,0,3,3,0,H04B7/02;;H04B7/0602;;H04B7/063;;H04L5/001;;H04L5/0023;;H04L5/006;;H04L27/2646;;H04L27/2647;;H04L5/0042;;H04W36/362;;H04L5/001;;H04L5/006;;H04B7/063;;H04L27/2647;;H04B7/02;;H04L5/0023;;H04L27/2646;;H04B7/0602;;H04W72/23;;H04W28/082;;H04B17/382;;H04W76/36;;H04B7/0404;;H04B7/0413;;H04J1/16;;H04J11/0066;;H04L5/0042;;H04L5/0098;;H04W24/02;;H04W24/08;;H04W36/36;;H04W72/02;;H04W72/1263,H04B7/0404;;H04B7/0413;;H04B17/382;;H04J1/16;;H04J11/00;;H04L5/00;;H04W24/02;;H04W24/08;;H04W28/08;;H04W36/36;;H04W72/02;;H04W72/12;;H04W72/14;;H04W76/36,,1,0,,,"International Search Report and Written Opinion—PCT/US2018/062670—ISA/EPO—dated Feb. 15, 2019.",ACTIVE
63,US,B1,US 11256837 B1,127-575-042-725-898,2022-02-22,2022,US 202016946666 A,2020-06-30,US 202016946666 A,2020-06-30,"Methods, systems, and computer program product for implementing an electronic design with high-capacity design closure","Disclosed are methods, systems, and articles of manufacture for implementing an electronic design with high-capacity design closure. A reduced netlist may be generated for an analysis view of an electronic design based at least in part upon logic of interest in the analysis view. A closure may be performed based at least in part upon a union netlist, wherein the union netlist is generated from the reduced netlist. The electronic design may then be implemented based at least in part upon a result of the closure task.",CADENCE DESIGN SYSTEMS INC,SIRCAR SOURAV KUMAR;;HEYBERGER MARC;;GARG MANISH;;KHANDELWAL AKASH;;PAN CHUNLONG;;AGARWAL RUCHIR;;SARAN ANURAG;;BHARAT LALIT;;SADHANKAR NAMRATA M;;BHATIA MANISH;;DESHPANDE RENUKA,CADENCE DESIGN SYSTEMS INC (2020-06-26),https://lens.org/127-575-042-725-898,Granted Patent,yes,6,1,1,1,0,G06F30/327;;G06F2119/12;;G06F2119/06;;G06F30/327;;G06F2119/06;;G06F2119/12,G06F30/33;;G06F30/327;;G06F119/06;;G06F119/12,,10,2,172-293-114-079-095;;144-170-575-416-159,10.1007/978-90-481-9591-6_8;;10.1109/isqed.2002.996796,"Kahng et al., “Timing Closure”, Chapter 8, (2011), VLSI Physical Design: From Graph Partitioning to Timing Closure, Springer.;;Altera Corp., “Timing Closure Methodology for Advanced FPGA Designs”, (Dec. 19, 2014).;;Gandhi, P. et al., “Hierarchical Timing Analysis: Pros, Cons, and a New Approach”, (Jun. 4, 2014), Cadence White Paper, date retrieved from Google.;;Coudert, O., “Timing and Design Closure in Physical Design Flows”, (Feb. 2002), Proceedings of the International Symposium on Quality Electronic Design, 2002.;;Silvant, M., “How do you qualify netlist reduction and circuit extraction?”, (Jan. 4, 2010), EETimes.;;Shah, O., “Extraction Techniques for High-performance, High-capacity Simulation”, (Sep. 2009), Synopsys White Paper.;;Robertson, C., “Extraction Challenges Grow in Advanced Nanometer IC Design”, (Jul. 21, 2015), Siemens Blog.;;Cadence Design Systems Inc., “Quantus Extraction Solution”, (Jul. 6, 2017), Cadence, Datasheet, date retrieved from Google.;;Papadopoulos, P. et al., “Spiral inductor modeling for RFIC using RLCK model order reduction”, (May 15, 1998), date retrieved from Google.;;Yin, C. et al., “Spice Circuit Reduction for Speeding Up Simulation and Verification”, (Jun. 13, 2019), Master's Thesis, Department of Electrical and Information Technology Lund University.",ACTIVE
64,EP,A1,EP 4235096 A1,164-289-945-622-050,2023-08-30,2023,EP 22212092 A,2022-12-08,US 202163265644 P,2021-12-17,LASER LEVEL WITH IMPROVED VISABILITY,"A construction laser level includes a housing and a gimbal assembly disposed in the housing. The gimbal assembly includes a first laser generator operable to generate a first output beam. The first output beam projects outside of the housing onto a target surface. The gimbal assembly includes a second laser generator operable to generate a second output beam. The second output beam projects outside of the housing onto the target surface. The first output beam projects as a first line on the target surface. The second output beam projects as a second line on the target surface. The first line is generally perpendicular to the second line. A wavelength of the first output beam is in the range of 540 to 575 nanometers.
",STANLEY BLACK & DECKER INC,WHITE DANIEL J;;RAMIREZ JOSE G;;SCHERBARTH DOUGLAS E;;SEMAN ANDREW E;;KONG ANDY;;JIANG JIA YONG;;SCHMITTDIEL MIKE;;AGARWAL AKASH;;RING JB;;AGADI ESHAAN,,https://lens.org/164-289-945-622-050,Patent Application,yes,4,0,2,2,0,G01C15/004;;G01C15/004,G01C15/00,,1,0,,,"ANONYMOUS: ""Diode-pumped solid-state laser -Wikipedia"", 29 August 2021 (2021-08-29), pages 1 - 4, XP093065200, Retrieved from the Internet <URL:https://en.wikipedia.org/w/index.php?title=Diode-pumped_solid-state_laser&oldid=1041244842> [retrieved on 20230719]",PENDING
65,US,A1,US 2023/0194261 A1,136-562-397-536-328,2023-06-22,2023,US 202218076464 A,2022-12-07,US 202218076464 A;;US 202163265644 P,2021-12-17,LASER LEVEL WITH IMPROVED VISABILITY,A construction laser level includes a housing and a gimbal assembly disposed in the housing. The gimbal assembly includes a first laser generator operable to generate a first output beam. The first output beam projects outside of the housing onto a target surface. The gimbal assembly includes a second laser generator operable to generate a second output beam. The second output beam projects outside of the housing onto the target surface. The first output beam projects as a first line on the target surface. The second output beam projects as a second line on the target surface. The first line is generally perpendicular to the second line. A wavelength of the first output beam is in the range of 540 to 575 nanometers.,STANLEY BLACK & DECKER INC,WHITE DANIEL J;;RAMIREZ JOSE G;;SCHERBARTH DOUGLAS E;;SEMAN JR ANDREW E;;KONG LINGGUO;;JIANG JIAYONG;;SCHMITTDIEL MICHAEL C;;AGARWAL AKASH;;RING JB;;AGADI ESHAAN,STANLEY BLACK & DECKER INC (2023-01-26),https://lens.org/136-562-397-536-328,Patent Application,yes,0,0,2,2,0,G01C15/004;;G01C15/004,G01C15/00,,0,0,,,,PENDING
66,WO,A2,WO 2024/026009 A2,102-806-827-969-831,2024-02-01,2024,US 2023/0028824 W,2023-07-27,US 202263393229 P;;US 202263393704 P;;US 202363510457 P,2022-07-28,LASER LEVEL COOLING,"A construction laser level including a housing, a laser mount disposed in the housing and at least one laser generator on the laser mount. The laser mount includes a plurality of heat dissipating fins.",STANLEY BLACK & DECKER INC,SERGYEYENKO OLEKSIY P;;JIANG JIA YONG;;PHILLIPS STEVEN J;;SCHMITTDIEL MICHAEL C;;JHAWAR DEVANSH K;;AGARWAL AKASH;;RING JB;;BHANDARE SUKRUTKUMAR BABASAHEB;;RAMIREZ JOSE GUADALUPE;;WHITE DANIEL J;;MORGAN ALEXANDER J;;DESAI PRATHAMESH S;;GALITSKIY SERGEY;;LAI YEN-TING;;TUNG PO HSIEN,,https://lens.org/102-806-827-969-831,Patent Application,yes,0,0,2,3,0,G01C15/004;;G01B11/27,G01B9/02,,0,0,,,,PENDING
67,US,A1,US 2024/0039238 A1,044-582-811-215-881,2024-02-01,2024,US 202318227762 A,2023-07-28,US 202318227762 A;;US 2023/0028824 W;;US 202363510457 P;;US 202263393704 P;;US 202263393229 P,2022-07-28,LASER LEVEL COOLING,"A construction laser level including a housing, a laser mount disposed in the housing and at least one laser generator on the laser mount. The laser mount includes a plurality of heat dissipating fins.",STANLEY BLACK & DECKER INC,SERGYEYENKO OLEKSIY P;;JIANG JIA YONG;;PHILLIPS STEVEN J;;SCHMITTDIEL MICHAEL C;;JHAWAR DEVANSH K;;AGARWAL AKASH;;RING JB;;BHANDARE SUKRUTKUMAR BABASAHEB;;RAMIREZ JOSE GUADALUPE;;MORGAN ALEXANDER J;;WHITE DANIEL J;;DESAI PRATHAMESH S;;GALITSKIY SERGEY;;LAI YEN-TING;;TUNG PO HSIEN,STANLEY BLACK & DECKER INC (2023-08-16),https://lens.org/044-582-811-215-881,Patent Application,yes,0,0,1,3,0,G01C15/004;;F25B21/02;;F25B2321/023;;H01S5/02469;;F25B21/02;;F25B2321/023;;H01S5/02415;;G01C15/004,F25B21/02;;H01S5/024;;G01C15/00,,0,0,,,,PENDING
68,WO,A3,WO 2024/026009 A3,008-999-006-493-561,2024-02-29,2024,US 2023/0028824 W,2023-07-27,US 202263393229 P;;US 202263393704 P;;US 202363510457 P,2022-07-28,LASER LEVEL COOLING,"A construction laser level including a housing, a laser mount disposed in the housing and at least one laser generator on the laser mount. The laser mount includes a plurality of heat dissipating fins. The plurality of heat dissipating fins may cooperate with a thermoelectric cooler, a fan, and external heat dissipating fins in conjunction with internal heat dissipating fins.",STANLEY BLACK & DECKER INC,SERGYEYENKO OLEKSIY P;;JIANG JIA YONG;;PHILLIPS STEVEN J;;SCHMITTDIEL MICHAEL C;;JHAWAR DEVANSH K;;AGARWAL AKASH;;RING JB;;BHANDARE SUKRUTKUMAR BABASAHEB;;RAMIREZ JOSE GUADALUPE;;MORGAN ALEXANDER J;;WHITE DANIEL J;;DESAI PRATHAMESH S;;GALITSKIY SERGEY;;LAI YEN-TING;;TUNG PO HSIEN,,https://lens.org/008-999-006-493-561,Search Report,yes,0,0,2,3,0,G01C15/004;;G01B11/27,A47G1/20;;G01C15/10;;H01S5/024,,0,0,,,,PENDING
