"#",Jurisdiction,Kind,Display Key,Lens ID,Publication Date,Publication Year,Application Number,Application Date,Priority Numbers,Earliest Priority Date,Title,Abstract,Applicants,Inventors,Owners,URL,Document Type,Has Full Text,Cites Patent Count,Cited by Patent Count,Simple Family Size,Extended Family Size,Sequence Count,CPC Classifications,IPCR Classifications,US Classifications,NPL Citation Count,NPL Resolved Citation Count,NPL Resolved Lens ID(s),NPL Resolved External ID(s),NPL Citations,Legal Status
1,EP,A1,EP 4176232 A1,071-446-602-299-153,2023-05-10,2023,EP 21832327 A,2021-06-14,US 202063047604 P;;US 202017022473 A;;US 2021/0037257 W,2020-07-02,GROUPING OF ADDRESSES BASED ON SEMANTIC CONNECTIONS AND VIEWPOINTS FOR ROUTE OPTIMIZATION,,ONE HUNDRED FEET INC,GUPTA NITIN;;AGARWAL AKASH,,https://lens.org/071-446-602-299-153,Patent Application,yes,0,0,9,9,0,G06Q10/06312;;G06Q10/0832;;G06Q10/08355;;G06Q10/047;;G08G1/202;;G08G1/144;;G08G1/143;;G08G1/147;;G08G1/096816;;G08G1/146;;G08G1/096844;;G01C21/3407;;G01C21/362;;G01C21/3697;;G06Q10/08;;G01C21/3407;;G06F3/0482;;G06F3/0484;;G06Q10/047;;G01C21/362;;G06Q10/06312;;G01C21/3661;;G06Q10/0832;;G06Q10/08355;;G06Q10/08,G01C21/34;;G06Q10/04;;G06Q10/08,,0,0,,,,PENDING
2,WO,A1,WO 2022/005731 A1,140-426-520-007-017,2022-01-06,2022,US 2021/0037257 W,2021-06-14,US 202063047604 P;;US 202017022473 A,2020-07-02,GROUPING OF ADDRESSES BASED ON SEMANTIC CONNECTIONS AND VIEWPOINTS FOR ROUTE OPTIMIZATION,"In some embodiments, a computer-based, pickup and delivery system is configured to perform a pickup/delivery route optimization and dispatch optimized route information to client applications. The optimization may include optimizing the routes for servicing multiple delivery and/or pickup stops. The optimization may also include optimizing the route navigation along the routes from one location to another. The optimized navigation may include generating a destination mapping throughout, for example, an apartment complex or a business park, and determining conveniently located parking to be used to park delivery vehicles, conveniently located staircases, conveniently located elevators, access codes to the secured gates and lockboxes, and the like.",ONE HUNDRED FEET INC,GUPTA NITIN;;AGARWAL AKASH,,https://lens.org/140-426-520-007-017,Patent Application,yes,5,0,9,9,0,G06Q10/06312;;G06Q10/0832;;G06Q10/08355;;G06Q10/047;;G08G1/202;;G08G1/144;;G08G1/143;;G08G1/147;;G08G1/096816;;G08G1/146;;G08G1/096844;;G01C21/3407;;G01C21/362;;G01C21/3697;;G06Q10/08;;G01C21/3407;;G06F3/0482;;G06F3/0484;;G06Q10/047;;G01C21/362;;G06Q10/06312;;G01C21/3661;;G06Q10/0832;;G06Q10/08355;;G06Q10/08,G01C21/34;;G06Q10/04;;G06Q10/08,,0,0,,,,PENDING
3,US,A1,US 2023/0235505 A1,125-490-611-560-056,2023-07-27,2023,US 202318130062 A,2023-04-03,US 202318130062 A;;US 202017126169 A;;US 202062988980 P,2020-03-13,"YARNS, FABRICS, AND GARMENTS INCLUDING LIGNIN AS A PRIMARY DYE AGENT AND METHODS OF DYEING TEXTILES WITH LIGNIN","A yarn, fabric, or garment that includes a plurality of fibers or a fiber-based material. The yarn, fabric, or garment includes lignin as a primary dye agent. Lignin may be present in the plurality of fibers or the fiber-based material in a range of 0.3 percent to 10 percent by weight.",THE H D LEE COMPANY INC,AGARWAL DHRUV;;PARDESHI AKASH,THE H.D. LEE COMPANY INC (2023-04-03),https://lens.org/125-490-611-560-056,Patent Application,yes,0,0,1,7,0,D06P1/50;;D06P1/34;;D02G3/449;;D06P1/50,D06P1/50;;D02G3/44,,0,0,,,,PENDING
4,CN,A,CN 115605640 A,139-340-181-353-368,2023-01-13,2023,CN 202080098297 A,2020-12-18,US 202062988980 P;;US 202017126169 A;;US 2020/0065833 W,2020-03-13,Method for dyeing textiles with lignin,"The dye bath comprises an aqueous solution comprising lignin in the range of 10% to 30% by weight of the aqueous solution. In addition, a method of dyeing fibers, yarns, textiles or garments with an aqueous solution comprising 10% to 30% by weight lignin is disclosed. Further, a method of dyeing a fabric is disclosed, comprising preparing a first dye bath comprising an aqueous solution having lignin in a range of from 10% to 30% by weight of the aqueous solution, and passing the fabric through the first dye bath such that the fabric absorbs lignin to dye the fabric.",HU DERI & CO,AGARWAL DIVYA;;PADHI AKASH,,https://lens.org/139-340-181-353-368,Patent Application,no,5,0,6,7,0,D06P1/46;;D06P3/605;;D06P5/22;;D06P1/34;;D06P5/225;;D06P1/46;;D06P3/605;;D06P5/22,D01G11/00;;D02G3/02;;D02G3/40,,1,0,,,"""从碱木素试制硫化栗棕染料"", 造纸技术通讯, vol. 1, no. 03, pages 72 - 73",ACTIVE
5,CA,A1,CA 3184855 A1,092-655-574-121-691,2022-01-06,2022,CA 3184855 A,2021-06-14,US 202063047604 P;;US 202017022473 A;;US 2021/0037257 W,2020-07-02,GROUPING OF ADDRESSES BASED ON SEMANTIC CONNECTIONS AND VIEWPOINTS FOR ROUTE OPTIMIZATION,"In some embodiments, a computer-based, pickup and delivery system is configured to perform a pickup/delivery route optimization and dispatch optimized route information to client applications. The optimization may include optimizing the routes for servicing multiple delivery and/or pickup stops. The optimization may also include optimizing the route navigation along the routes from one location to another. The optimized navigation may include generating a destination mapping throughout, for example, an apartment complex or a business park, and determining conveniently located parking to be used to park delivery vehicles, conveniently located staircases, conveniently located elevators, access codes to the secured gates and lockboxes, and the like.",ONEHUNDREDFEET INC,GUPTA NITIN;;AGARWAL AKASH,,https://lens.org/092-655-574-121-691,Patent Application,no,0,0,9,9,0,G06Q10/06312;;G06Q10/0832;;G06Q10/08355;;G06Q10/047;;G08G1/202;;G08G1/144;;G08G1/143;;G08G1/147;;G08G1/096816;;G08G1/146;;G08G1/096844;;G01C21/3407;;G01C21/362;;G01C21/3697;;G06Q10/08;;G01C21/3407;;G06F3/0482;;G06F3/0484;;G06Q10/047;;G01C21/362;;G06Q10/06312;;G01C21/3661;;G06Q10/0832;;G06Q10/08355;;G06Q10/08,G01C21/34;;G06Q10/04;;G06Q10/08,,0,0,,,,PENDING
6,US,B2,US 11618998 B2,049-470-470-780-545,2023-04-04,2023,US 202017126169 A,2020-12-18,US 202017126169 A;;US 202062988980 P,2020-03-13,Method of dyeing textiles with lignin,"Dye baths including an aqueous solution including lignin in a range of 10% to 30% by weight of the aqueous solution are described. In addition, methods of dyeing fibers, yarns, textiles, or garments with an aqueous solution including 10% to 30% lignin by weight is disclosed. Further, methods of dyeing a fabric including preparing a first dye bath including an aqueous solution having lignin in a range of 10% to 30% by weight of the aqueous solution and passing a fabric through the first dye bath such that the fabric pics up lignin to dye the fabric is disclosed.",THE H D LEE COMPANY INC,AGARWAL DHRUV;;PARDESHI AKASH,THE H.D. LEE COMPANY INC (2021-01-11),https://lens.org/049-470-470-780-545,Granted Patent,yes,12,0,6,7,0,D06P1/46;;D06P3/605;;D06P5/22;;D06P1/34;;D06P5/225;;D06P1/46;;D06P3/605;;D06P5/22,D06P1/46;;D06P3/60;;D06P5/22,,4,1,009-974-375-841-918,10.1016/j.indcrop.2017.09.059,"Meryemoglu. Natural dyes from lignocellulosic biomass hydrolysis. Indian Journal of Fibre and Textile Research. vol. 43, Mar. 2018, pp. 92-97.;;Sunthornvarabhas. Antimicrobial kinetic activities of lignin from sugarcane bagasse for textile product. Industrial Crops and Products, 109 (2017) 857-861.;;Notification of Transmittal of the International Search Report and the Written Opinion of the International Searching Authority, of the Declaration, PCT App. No. PCT/US20/65833, dated Mar. 15, 2021, 13 pgs.;;Bangladesh Office Action for App. No. 396-2020, dated Feb. 27, 2022, 1 pg.",ACTIVE
7,CN,A,CN 115695641 A,165-140-879-225-970,2023-02-03,2023,CN 202110871494 A,2021-07-30,CN 202110871494 A,2021-07-30,"Information management and control method, terminal and readable storage medium","The invention discloses an information management and control method, a terminal and a readable storage medium. The information management and control method is applied to a terminal of a travel scene and comprises the steps that at least one travel management and control mode is provided, and the travel management and control mode is used for controlling the information pushing permission of the terminal in the travel scene; in response to the selection operation and/or the current scene information, entering a corresponding travel management and control mode; and executing information pushing according to the entered travel management and control mode. An adaptive travel management and control mode is provided for the user, and information pushing can be controlled according to requirements.",SHENZHEN ONEPLUS TECH CO LTD,AGARWAL SUMIT;;KUMAR AKASH,,https://lens.org/165-140-879-225-970,Patent Application,no,4,0,1,1,0,,H04M1/72448;;H04L67/55;;H04M1/72463,,0,0,,,,PENDING
8,US,A1,US 2022/0004942 A1,012-875-156-030-298,2022-01-06,2022,US 202017022473 A,2020-09-16,US 202017022473 A;;US 202063047604 P,2020-07-02,GROUPING OF ADDRESSES BASED ON SEMANTIC CONNECTIONS AND VIEWPOINTS FOR ROUTE OPTIMIZATION,"In some embodiments, a computer-based, pickup and delivery system is configured to perform a pickup/delivery route optimization and dispatch optimized route information to client applications. The optimization may include optimizing the routes for servicing multiple delivery and/or pickup stops. The optimization may also include optimizing the route navigation along the routes from one location to another. The optimized navigation may include generating a destination mapping throughout, for example, an apartment complex or a business park, and determining conveniently located parking to be used to park delivery vehicles, conveniently located staircases, conveniently located elevators, access codes to the secured gates and lockboxes, and the like.",ONE HUNDRED FEET INC,GUPTA NITIN;;AGARWAL AKASH,ONE HUNDRED FEET INC (2020-09-16),https://lens.org/012-875-156-030-298,Patent Application,yes,5,3,9,9,0,G06Q10/06312;;G06Q10/0832;;G06Q10/08355;;G06Q10/047;;G08G1/202;;G08G1/144;;G08G1/143;;G08G1/147;;G08G1/096816;;G08G1/146;;G08G1/096844;;G01C21/3407;;G01C21/362;;G01C21/3697;;G06Q10/08;;G01C21/3407;;G06F3/0482;;G06F3/0484;;G06Q10/047;;G01C21/362;;G06Q10/06312;;G01C21/3661;;G06Q10/0832;;G06Q10/08355;;G06Q10/08,G06Q10/04;;G06Q10/08,,0,0,,,,DISCONTINUED
9,MX,A,MX 2022011353 A,162-541-046-022-376,2023-02-16,2023,MX 2022011353 A,2020-12-18,US 202062988980 P;;US 202017126169 A;;US 2020/0065833 W,2020-03-13,METHOD OF DYEING TEXTILES LIGNIN.,"Dye baths including an aqueous solution including lignin in a range of 10% to 30% by weight of the aqueous solution. In addition, methods of dyeing fibers, yarns, textiles, or garments with an aqueous solution including 10% to 30% lignin by weight is disclosed. Further, methods of dyeing a fabric including preparing a first dye bath including an aqueous solution having lignin in a range of 10% to 30% by weight of the aqueous solution and passing a fabric through the first dye bath such that the fabric pics up lignin to dye the fabric is disclosed.",THE H D LEE COMPANY INC,AGARWAL DHRUV;;PARDESHI AKASH,,https://lens.org/162-541-046-022-376,Patent Application,no,0,0,6,7,0,D06P1/46;;D06P3/605;;D06P5/22;;D06P1/34;;D06P5/225;;D06P1/46;;D06P3/605;;D06P5/22,D01G11/00;;D02G3/02;;D02G3/40,,0,0,,,,PENDING
10,WO,A1,WO 2021/183201 A1,141-102-670-190-123,2021-09-16,2021,US 2020/0065833 W,2020-12-18,US 202017126169 A;;US 202062988980 P,2020-03-13,METHOD OF DYEING TEXTILES LIGNIN,"Dye baths including an aqueous solution including lignin in a range of 10% to 30% by weight of the aqueous solution. In addition, methods of dyeing fibers, yarns, textiles, or garments with an aqueous solution including 10% to 30% lignin by weight is disclosed. Further, methods of dyeing a fabric including preparing a first dye bath including an aqueous solution having lignin in a range of 10% to 30% by weight of the aqueous solution and passing a fabric through the first dye bath such that the fabric pics up lignin to dye the fabric is disclosed.",THE H D LEE COMPANY INC,AGARWAL DHRUV;;PARDESHI AKASH,,https://lens.org/141-102-670-190-123,Patent Application,yes,4,0,6,7,0,D06P1/46;;D06P3/605;;D06P5/22;;D06P1/34;;D06P5/225;;D06P1/46;;D06P3/605;;D06P5/22,D01G11/00;;D02G3/02;;D02G3/40,,0,0,,,,PENDING
11,US,A1,US 2021/0285153 A1,034-980-173-966-859,2021-09-16,2021,US 202017126169 A,2020-12-18,US 202017126169 A;;US 202062988980 P,2020-03-13,Method of Dyeing Textiles with Lignin,"Dye baths including an aqueous solution including lignin in a range of 10% to 30% by weight of the aqueous solution. In addition, methods of dyeing fibers, yarns, textiles, or garments with an aqueous solution including 10% to 30% lignin by weight is disclosed. Further, methods of dyeing a fabric including preparing a first dye bath including an aqueous solution having lignin in a range of 10% to 30% by weight of the aqueous solution and passing a fabric through the first dye bath such that the fabric pics up lignin to dye the fabric is disclosed.",THE H D LEE COMPANY INC,AGARWAL DHRUV;;PARDESHI AKASH,THE H.D. LEE COMPANY INC (2021-01-11),https://lens.org/034-980-173-966-859,Patent Application,yes,8,0,6,7,0,D06P1/46;;D06P3/605;;D06P5/22;;D06P1/34;;D06P5/225;;D06P1/46;;D06P3/605;;D06P5/22,D06P1/46;;D06P5/22,,2,1,009-974-375-841-918,10.1016/j.indcrop.2017.09.059,"Meryemoglu. Natural dyes from lignocellulosic biomass hydrolysis. Indian Journal of Fibre and Textile Research. Vol. 43, March 2018, pp 92-97;;Sunthornvarabhas. Antimicrobial kinetic activities of lignin from sugarcane bagasse for textile product. Industrial Crops and Products, 109 (2017) 857-861",ACTIVE
12,DE,A1,DE 102020112315 A1,064-454-428-749-687,2020-11-12,2020,DE 102020112315 A,2020-05-06,US 201916406883 A,2019-05-08,VERFÜGBARKEITSVORHERSAGESYSTEME UND -VERFAHREN FÜR PARKPLÄTZE,"Diese Offenbarung stellt Systeme und Verfahren zum Vorhersagen der Verfügbarkeit von Parkplätzen bereit. In einer beispielhaften Ausführungsform gibt ein Fahrer eines ersten Fahrzeugs, das auf einem Parkplatz geparkt ist, eine geschätzte Belegungszeit des Parkplatzes in eine Vorrichtung wie etwa ein Smartphone ein. Diese Informationen werden durch das Gerät an einen Server übertragen. Ein Fahrer eines zweiten Fahrzeugs kann eine Anfrage nach einem freien Parkplatz an den Server übertragen. Der Server verwendet Informationen wie etwa die geschätzte Belegungszeit, um eine erwartete Wartezeit für das zweite Fahrzeug, um den durch das erste Fahrzeug belegten Parkplatz zu erlangen, zu bestimmen. Die erwartete Wartezeit wird von dem Server an den Fahrer des zweiten Fahrzeugs übertragen, der dann zu dem Parkplatz fahren kann, wenn dieser frei wird. Der Server kann dem Fahrer eine Wegbeschreibung bereitstellen, um den frei gewordenen Parkplatz zu erreichen.",FORD GLOBAL TECH LLC,AGARWAL AKASH;;GANDIGA SANDEEP RAJ,,https://lens.org/064-454-428-749-687,Patent Application,no,0,0,4,4,0,G06Q10/04;;G08G1/142;;G08G1/0968;;G08G1/144;;G06Q50/40;;G08G1/141;;G06Q50/40,G08G1/14,,0,0,,,,PENDING
13,US,B1,US 10832574 B1,184-046-631-274-128,2020-11-10,2020,US 201916406883 A,2019-05-08,US 201916406883 A,2019-05-08,Parking spot availability prediction systems and methods,"Systems and methods for predicting the availability of parking spots. A driver of a first vehicle that is parked in a parking spot inputs into a device, such as a smartphone, an estimated time of occupancy of the parking spot. This information is transmitted by the device to a server. A driver of a second vehicle may transmit to the server a request for a vacant parking spot. The server uses information, such as the estimated time of occupancy, to determine an expected wait time for the second vehicle to obtain the parking spot occupied by the first vehicle. The expected wait time is transmitted by the server to the driver of the second vehicle which can then drive to the parking spot when vacated. The server may provide driving directions to the driver to reach the vacated parking spot.",FORD GLOBAL TECH LLC,AGARWAL AKASH;;GANDIGA SANDEEP RAJ,FORD GLOBAL TECHNOLOGIES LLC (2019-04-12),https://lens.org/184-046-631-274-128,Granted Patent,yes,2,3,4,4,0,G06Q10/04;;G08G1/142;;G08G1/0968;;G08G1/144;;G06Q50/40;;G08G1/141;;G06Q50/40,B60Q1/48;;G06Q50/30;;G08G1/14,,2,1,003-747-568-919-162,10.1109/iota.2016.7562735,"Khanna, et al., “IoT based smart parking system,” 2016 International Conference on Internet of Things and Applications (IOTA), Pune, 2016, pp. 266-270. doi: 10.1109/IOTA.2016.7562735.;;Searching for Parking Costs Americans $73 Billion a Year (Jul. 12, 2017). Retrieved from http://inrix.com/press-releases/parking-pain-us/ (7 pages).",ACTIVE
14,US,A1,US 2020/0357281 A1,044-780-708-064-189,2020-11-12,2020,US 201916406883 A,2019-05-08,US 201916406883 A,2019-05-08,PARKING SPOT AVAILABILITY PREDICTION SYSTEMS AND METHODS,"This disclosure is generally directed to systems and methods for predicting the availability of parking spots. In one exemplary embodiment, a driver of a first vehicle that is parked in a parking spot inputs into a device such as a smartphone, an estimated time of occupancy of the parking spot. This information is transmitted by the device to a server. A driver of a second vehicle may transmit to the server a request for a vacant parking spot. The server uses information such as the estimated time of occupancy to determine an expected wait time for the second vehicle to obtain the parking spot occupied by the first vehicle. The expected wait time is transmitted by the server to the driver of the second vehicle who can then drive to the parking spot when vacated. The server may provide driving directions to the driver to reach the vacated parking spot.",FORD GLOBAL TECH LLC,AGARWAL AKASH;;GANDIGA SANDEEP RAJ,FORD GLOBAL TECHNOLOGIES LLC (2019-04-12),https://lens.org/044-780-708-064-189,Patent Application,yes,1,3,4,4,0,G06Q10/04;;G08G1/142;;G08G1/0968;;G08G1/144;;G06Q50/40;;G08G1/141;;G06Q50/40,G06Q50/30;;G08G1/14,,0,0,,,,ACTIVE
15,CN,A,CN 111915050 A,011-057-171-845-89X,2020-11-10,2020,CN 202010379897 A,2020-05-07,US 201916406883 A,2019-05-08,Parking spot availability prediction system and method,"The invention provides a parking spot availability prediction system and method. Systems and methods for predicting the availability of parking spots. A driver of a first vehicle that is parked in a parking spot inputs into a device, such as a smartphone, an estimated time of occupancy of the parking spot. This information is transmitted by the device to a server. A driver of a second vehicle maytransmit to the server a request for a vacant parking spot. The server uses information, such as the estimated time of occupancy, to determine an expected wait time for the second vehicle to obtain the parking spot occupied by the first vehicle. The expected wait time is transmitted by the server to the driver of the second vehicle which can then drive to the parking spot when vacated. The servermay provide driving directions to the driver to reach the vacated parking spot.",FORD GLOBAL TECH CO LTD,AGARWAL AKASH;;GANDIGA SANDEEP RAJ,,https://lens.org/011-057-171-845-89X,Patent Application,no,0,1,4,4,0,G06Q10/04;;G08G1/142;;G08G1/0968;;G08G1/144;;G06Q50/40;;G08G1/141;;G06Q50/40,G06Q10/04;;G08G1/0968;;G08G1/14,,0,0,,,,PENDING
16,WO,A1,WO 2022/107000 A1,172-371-797-950-708,2022-05-27,2022,IB 2021060622 W,2021-11-16,IN 202011050940 A,2020-11-23,AUTOMATED TRACKING OF INVENTORY ITEMS FOR ORDER FULFILMENT AND REPLENISHMENT,"An automated item tracking system is provided. The system includes plurality of imaging devices positioned within a storage facility and a control server. The control server receives, from at least one imaging device, time-series images and identifies an item being handled by an operator. The control server tags the item with operator based on successful identification of the item and tracks movement of the item and operator based on subsequent time-series images captured by the at least one imaging device or one or more other imaging devices. The control server determines final position information of the item based on tracked movement of at least one of the item and the operator and compares the final position information with desired position information of the item. The control server detects successful handling or failure in handling of the item based on result of comparison between the final and desired position information.",GREY ORANGE INC,GUPTA AKASH;;TIWARY SUMIT;;AGARWAL ANKIT,,https://lens.org/172-371-797-950-708,Patent Application,yes,2,0,1,1,0,G06Q10/087,G06Q10/08,,0,0,,,,PENDING
17,EP,A1,EP 4176329 A1,109-844-723-777-861,2023-05-10,2023,EP 21834621 A,2021-06-21,US 202063047604 P;;US 202017022418 A;;US 2021/0038196 W,2020-07-02,SELECTIVE DISPLAY OF COMPLEX STRUCTURES IN A COMPUTER-IMPLEMENTED GRAPHICAL MAP DISPLAY,,ONEHUNDREDFEET INC,VALDEZ EDWARD;;GUPTA NITIN;;AGARWAL AKASH,,https://lens.org/109-844-723-777-861,Patent Application,yes,0,0,9,9,0,G06Q10/06312;;G06Q10/0832;;G06Q10/08355;;G06Q10/047;;G08G1/202;;G08G1/144;;G08G1/143;;G08G1/147;;G08G1/096816;;G08G1/146;;G08G1/096844;;G01C21/3407;;G01C21/362;;G01C21/3697;;G06Q10/08;;G01C21/3407;;G06F3/0482;;G06F3/0484;;G06Q10/047;;G01C21/362;;G06Q10/06312;;G01C21/3661;;G06Q10/0832;;G06Q10/08355;;G06Q10/08,G05D1/00,,0,0,,,,PENDING
18,US,A1,US 2021/0118071 A1,121-728-388-884-518,2021-04-22,2021,US 201916719040 A,2019-12-18,IN 201941042843 A,2019-10-22,Artificial Intelligence Based Recommendations,"Embodiments provide recommendations to a guest of a hotel or other type of service industry. Embodiments receive input data including demographics data and preference data for a plurality of guests of the hotel, and receive a plurality of guest interest categories. Embodiments assign one or more keywords to each of the guest interest categories and extract a plurality of attributes from the input data concerning the guest. Embodiments perform semantic analysis to map the attributes to the guest interest categories and determine a plurality of guest similarity calculations comprising a similarity value each of the plurality of guests with every other plurality of guests. Embodiments then generate a plurality of guest interest categories predictions for each of the guests based on the determined guest similarity calculations.",ORACLE INT CORP,AGARWAL DHRUV;;CHATTERJEE AKASH;;BANERJEE ANIRBAN,ORACLE INTERNATIONAL CORPORATION (2019-12-16),https://lens.org/121-728-388-884-518,Patent Application,yes,13,2,1,1,0,G06Q50/12;;G06Q30/0631;;G06Q30/0204;;G06N20/00;;G06F40/30;;G06Q50/12;;G06Q30/0204;;G06Q30/0631;;G06N5/04,G06Q50/12;;G06N5/04;;G06Q30/02;;G06Q30/06,,0,0,,,,DISCONTINUED
19,CA,A1,CA 3184860 A1,112-439-991-504-703,2022-01-06,2022,CA 3184860 A,2021-06-21,US 202063047604 P;;US 202017022418 A;;US 2021/0038196 W,2020-07-02,SELECTIVE DISPLAY OF COMPLEX STRUCTURES IN A COMPUTER-IMPLEMENTED GRAPHICAL MAP DISPLAY,"In some embodiments, a computer-based, pickup and delivery system is configured to perform a pickup/delivery route optimization and dispatch optimized route information to client applications. The optimization may include optimizing the routes for servicing multiple delivery and/or pickup stops. The optimization may also include optimizing the route navigation along the routes from one location to another. The optimized navigation may include generating a destination mapping throughout, for example, an apartment complex or a business park, and determining conveniently located parking to be used to park delivery vehicles, conveniently located staircases, conveniently located elevators, access codes to the secured gates and lockboxes, and the like.",ONEHUNDREDFEET INC,VALDEZ EDWARD;;GUPTA NITIN;;AGARWAL AKASH,,https://lens.org/112-439-991-504-703,Patent Application,no,0,0,9,9,0,G06Q10/06312;;G06Q10/0832;;G06Q10/08355;;G06Q10/047;;G08G1/202;;G08G1/144;;G08G1/143;;G08G1/147;;G08G1/096816;;G08G1/146;;G08G1/096844;;G01C21/3407;;G01C21/362;;G01C21/3697;;G06Q10/08;;G01C21/3407;;G06F3/0482;;G06F3/0484;;G06Q10/047;;G01C21/362;;G06Q10/06312;;G01C21/3661;;G06Q10/0832;;G06Q10/08355;;G06Q10/08,G05D1/00,,0,0,,,,PENDING
20,US,A1,US 2022/0003559 A1,162-270-578-834-728,2022-01-06,2022,US 202017022418 A,2020-09-16,US 202017022418 A;;US 202063047604 P,2020-07-02,SELECTIVE DISPLAY OF COMPLEX STRUCTURES IN A COMPUTER-IMPLEMENTED GRAPHICAL MAP DISPLAY,"In some embodiments, a computer-based, pickup and delivery system is configured to perform a pickup/delivery route optimization and dispatch optimized route information to client applications. The optimization may include optimizing the routes for servicing multiple delivery and/or pickup stops. The optimization may also include optimizing the route navigation along the routes from one location to another. The optimized navigation may include generating a destination mapping throughout, for example, an apartment complex or a business park, and determining conveniently located parking to be used to park delivery vehicles, conveniently located staircases, conveniently located elevators, access codes to the secured gates and lockboxes, and the like.",ONE HUNDRED FEET INC,VALDEZ EDWARD;;GUPTA NITIN;;AGARWAL AKASH,ONE HUNDRED FEET INC (2020-09-17),https://lens.org/162-270-578-834-728,Patent Application,yes,0,1,9,9,0,G06Q10/06312;;G06Q10/0832;;G06Q10/08355;;G06Q10/047;;G08G1/202;;G08G1/144;;G08G1/143;;G08G1/147;;G08G1/096816;;G08G1/146;;G08G1/096844;;G01C21/3407;;G01C21/362;;G01C21/3697;;G06Q10/08;;G01C21/3407;;G06F3/0482;;G06F3/0484;;G06Q10/047;;G01C21/362;;G06Q10/06312;;G01C21/3661;;G06Q10/0832;;G06Q10/08355;;G06Q10/08,G01C21/34;;G01C21/36;;G06F3/0482;;G06F3/0484;;G06Q10/04;;G06Q10/06;;G06Q50/28,,0,0,,,,ACTIVE
