37,CN,A,CN 116932071 A,109-946-176-687-169,2023-10-24,2023,CN 202310307489 A,2023-03-27,US 202217717497 A,2022-04-11,Vehicle feature coordinator,"The invention provides a vehicle feature coordinator. A system receives a request to engage one or more vehicle microservices representing vehicle features. The system accesses a manifest associated with the vehicle feature, the manifest including the one or more microservices and a configuration to be associated with an instance of the one or more microservices initiated on behalf of the vehicle feature. The system requests initiation of each of the micro-services and the associated configuration from a vehicle process responsible for micro-service initiation to construct a pipeline for the vehicle feature, and converts a result generated by at least one micro-service of the pipeline into a format predefined to be suitable for use by the vehicle feature.",FORD GLOBAL TECH LLC,CAKARI MEHMET;;AGARWAL AKASH;;PARENTI ROBERT;;HASSANI ALI;;SHAIKH FAIZAN,,https://lens.org/109-946-176-687-169,Patent Application,no,0,0,3,3,0,G06F8/31;;H04L67/12;;H04L67/306;;H04L67/535;;G07C5/0816;;G06F9/442;;G07C5/004,G06F9/445;;H04L67/12;;H04L67/51,,0,0,,,,PENDING
38,US,A1,US 2023/0326266 A1,050-732-222-380-334,2023-10-12,2023,US 202217717497 A,2022-04-11,US 202217717497 A,2022-04-11,VEHICLE FEATURE ORCHESTRATOR,"A system receives a request to engage one or more vehicle micro-services on behalf of a vehicle feature. The system accesses a manifest associated with the vehicle feature, the manifest including the one or more micro-services and configurations to be associated with instances of the one or more micro-services launched on behalf of the vehicle feature. The system requests launch of each of the micro-services and the associated configurations from a vehicle process responsible for micro-service launch, to build a pipeline for the vehicle feature and translates results generated by at least one micro-service of the pipeline into a format predefined as suitable for use by the vehicle feature.",FORD GLOBAL TECH LLC,KARKARE MEDHA;;AGARWAL AKASH;;PARENTI ROBERT;;HASSANI ALI;;SHAIK FAIZAN,FORD GLOBAL TECHNOLOGIES LLC (2021-12-10),https://lens.org/050-732-222-380-334,Patent Application,yes,0,0,3,3,0,G06F8/31;;H04L67/12;;H04L67/306;;H04L67/535;;G07C5/0816;;G06F9/442;;G07C5/004,G07C5/08;;G06F9/4401;;G07C5/00,,0,0,,,,PENDING
39,US,B2,US 11665094 B2,042-498-059-384-825,2023-05-30,2023,US 202017107718 A,2020-11-30,US 202017107718 A,2020-11-30,"Collecting, processing, and distributing telemetry data","Some embodiments of the invention provide a method of reporting telemetry data in a telecommunication network. The telemetry data is collected from a set of one or more telemetry-producing (TP) network elements and is distributed to a set of one or more telemetry-consuming (TC) network elements registered to receive the telemetry data. The method receives a telemetry packet produced by a TP network element and performs a filtering operation to determine whether the telemetry packet should be reported to at least a subset of one or more TC network elements. When the filtering operations result in a determination that the telemetry packet should be reported, the method forwards the telemetry packet to the subset of TC network elements.",VMWARE INC,DESHMUKH SIDDHANT;;BASLER BENJAMIN C;;AGARWAL ROHAN;;HARIHARAN SRIKANTH;;GANGIL AKASH,VMWARE INC (2020-11-24),https://lens.org/042-498-059-384-825,Granted Patent,yes,41,0,3,3,0,H04L45/745;;H04L43/06;;H04L43/12;;H04L67/1004;;H04L67/1097;;H04L45/745;;H04L67/1097;;H04L43/062,H04L45/745;;H04L43/062;;H04L67/1097,,3,2,072-507-002-108-379;;155-258-713-926-022,10.1109/mdso.2006.57;;10.1109/coconet.2015.7411225,"Buyya, Rajkumar, et al., “A Case of Peering of Content Delivery Networks,” IEEE Distributed Systems Online, Oct. 2006, 5 pages, vol. 7, No. 10, IEEE Computer Society.;;Dasilva, Luiz A., et al., “Customized Services over Virtual Wireless Networks: The Path towards Networks without Borders,” Proceedings of Future Network & Mobile Summit 2013, Jul. 3-5, 2013, 10 pages, IIMC, Lisbon, Portugal.;;Majhi, Santosh Kumar, et al., “A Security Context Migration Framework for Virtual Machine Migration,” 2015 International Conference on Computing and Network Communications (CoCoNet '15), Dec. 16-19, 2015, 5 pages, Trivandrum, IN.",ACTIVE
40,US,A1,US 2023/0283556 A1,103-643-802-594-749,2023-09-07,2023,US 202318196384 A,2023-05-11,US 202318196384 A;;US 202017107718 A,2020-11-30,"COLLECTING, PROCESSING, AND DISTRIBUTING TELEMETRY DATA","Some embodiments of the invention provide a method of reporting telemetry data in a telecommunication network. The telemetry data is collected from a set of one or more telemetry-producing (TP) network elements and is distributed to a set of one or more telemetry-consuming (TC) network elements registered to receive the telemetry data. The method receives a telemetry packet produced by a TP network element and performs a filtering operation to determine whether the telemetry packet should be reported to at least a subset of one or more TC network elements. When the filtering operations result in a determination that the telemetry packet should be reported, the method forwards the telemetry packet to the subset of TC network elements.",VMWARE INC,DESHMUKH SIDDHANT;;BASLER BENJAMIN C;;AGARWAL ROHAN;;HARIHARAN SRIKANTH;;GANGIL AKASH,,https://lens.org/103-643-802-594-749,Patent Application,yes,16,0,3,3,0,H04L45/745;;H04L43/06;;H04L43/12;;H04L67/1004;;H04L67/1097;;H04L45/745;;H04L67/1097;;H04L43/062,H04L45/745;;H04L43/062;;H04L67/1097,,0,0,,,,PENDING
41,US,A1,US 2022/0174012 A1,149-137-761-602-868,2022-06-02,2022,US 202017107718 A,2020-11-30,US 202017107718 A,2020-11-30,"COLLECTING, PROCESSING, AND DISTRIBUTING TELEMETRY DATA","Some embodiments of the invention provide a method of reporting telemetry data in a telecommunication network. The telemetry data is collected from a set of one or more telemetry-producing (TP) network elements and is distributed to a set of one or more telemetry-consuming (TC) network elements registered to receive the telemetry data. The method receives a telemetry packet produced by a TP network element and performs a filtering operation to determine whether the telemetry packet should be reported to at least a subset of one or more TC network elements. When the filtering operations result in a determination that the telemetry packet should be reported, the method forwards the telemetry packet to the subset of TC network elements.",VMWARE INC,DESHMUKH SIDDHANT;;BASLER BENJAMIN C;;AGARWAL ROHAN;;HARIHARAN SRIKANTH;;GANGIL AKASH,VMWARE INC (2020-11-24),https://lens.org/149-137-761-602-868,Patent Application,yes,3,4,3,3,0,H04L45/745;;H04L43/06;;H04L43/12;;H04L67/1004;;H04L67/1097;;H04L45/745;;H04L67/1097;;H04L43/062,H04L12/741;;H04L12/26;;H04L29/08,,0,0,,,,ACTIVE
42,DE,A1,DE 102023107121 A1,049-148-381-996-445,2023-10-12,2023,DE 102023107121 A,2023-03-21,US 202217717478 A,2022-04-11,FAHRZEUGDIENSTVERWALTER,"Ein Fahrzeugsystem empfängt eine Anforderung für einen ersten Fahrzeugmikrodienst, der für ein erstes Merkmal auszuführen ist und der auszuführen ist, wobei er eine in der Anforderung beinhaltete Konfiguration aufweist. Das System bestimmt, ob der erste Mikrodienst mit der Konfiguration bereits für ein zweites Merkmal ausgeführt wird. Das System bestimmt, ob Fahrzeugressourcen eine Instanz des ersten Mikrodienstes mit der Konfiguration unterstützen werden, wenn der erste Mikrodienst mit der Konfiguration nicht bereits ausgeführt wird, und startet als Reaktion auf das Bestimmen, dass Fahrzeugressourcen die Instanz unterstützen werden, den angeforderten ersten Mikrodienst mit der Konfiguration. Das System registriert zusätzlich die Instanz zusammen mit der Konfiguration und beliebigen Merkmalen, für die die Instanz funktioniert.",FORD GLOBAL TECH LLC,HASSANI ALI;;EL SHAIR ZAID;;SHAIK FAIZAN;;KARKARE MEDHA;;PARENTI ROBERT;;AGARWAL AKASH,,https://lens.org/049-148-381-996-445,Patent Application,no,0,0,3,3,0,B60R16/0234;;G06F2209/503;;G06F9/4831;;G06F9/5027;;B60R16/0234;;G06F9/4881;;G06F9/5038,G06F9/50,,0,0,,,,PENDING
43,CN,A,CN 116932158 A,080-044-043-894-240,2023-10-24,2023,CN 202310307538 A,2023-03-27,US 202217717478 A,2022-04-11,Vehicle service manager,"The present disclosure provides a ""Vehicle Service Manager"". A vehicle system receives a request for a first vehicle microservice that is executed on behalf of a first feature and that is executed with a configuration included in the request. The system determines whether the first micro-service with the configuration has been executed on behalf of a second feature. When the first micro-service having the configuration has not been executed, the system determines whether a vehicle resource will support an instance of the first micro-service having the configuration, and in response to determining that the vehicle resource will support the instance, initiates the requested first micro-service having the configuration. In addition, the system registers the instance along with the configuration and any feature on which the instance functions.",FORD GLOBAL TECH LLC,HASSANI ALI;;EL SHAER ZAKARIA;;SHAIKH FAIZAN;;CAKARI MEHMET;;PARENTI ROBERT;;AGARWAL AKASH,,https://lens.org/080-044-043-894-240,Patent Application,no,0,0,3,3,0,B60R16/0234;;G06F2209/503;;G06F9/4831;;G06F9/5027;;B60R16/0234;;G06F9/4881;;G06F9/5038,G06F9/48,,0,0,,,,PENDING
44,US,A1,US 2023/0325247 A1,104-140-182-548-54X,2023-10-12,2023,US 202217717478 A,2022-04-11,US 202217717478 A,2022-04-11,VEHICLE SERVICE MANAGER,"A vehicle system receives a request for a first vehicle micro-service to be executed on behalf of a first feature and to be executed having a configuration included in the request. The system determines whether the first micro-service with the configuration is already executing on behalf of a second feature. The system determines if vehicle resources will support an instance of the first micro-service with the configuration when the first micro-service with the configuration is not already executing and, responsive to determining that vehicle resources will support the instance, launches the requested first micro-service with the configuration. The system additionally registers the instance along with the configuration and any features on behalf of which the instance is functioning.",FORD GLOBAL TECH LLC,HASSANI ALI;;EL SHAIR ZAID;;SHAIK FAIZAN;;KARKARE MEDHA;;PARENTI ROBERT;;AGARWAL AKASH,FORD GLOBAL TECHNOLOGIES LLC (2021-12-10),https://lens.org/104-140-182-548-54X,Patent Application,yes,0,0,3,3,0,B60R16/0234;;G06F2209/503;;G06F9/4831;;G06F9/5027;;B60R16/0234;;G06F9/4881;;G06F9/5038,G06F9/50;;B60R16/023;;G06F9/48,,0,0,,,,PENDING
45,US,A1,US 2020/0301432 A1,188-659-429-999-907,2020-09-24,2020,US 201716614210 A,2017-05-16,IB 2017000583 W,2017-05-16,APPARATUS AND METHOD FOR WAREHOUSE ZONING,"Described herein is an apparatus and a corresponding method for performing warehouse zoning and further monitoring the zoned warehouse. The apparatus includes circuitry that partitions a workspace into a plurality of zones based on an area of the workspace, and a number of transportation vehicles and a number of item racks that are to be deployed in the workspace. A location of each zone within the workspace is determined based on a location of a first type of station that is disposed outside the workspace. The apparatus determines for each zone, an area of the zone and receives a signal indicating occurrence of an event in one of the zones. Further, the apparatus determines a degree of criticality of the occurred event which indicates whether workspace operation in the zone can be continued, and initiates an operation at a timing that is based on the determined degree of criticality.",GREY ORANGE PTE LTD,BOSE SAGAR;;BOPPANA NAVEEN;;KEJRIWAL GAURAV;;AGARWAL RUPESH;;GUPTA AKASH;;KOHLI SAMAY;;HOELTGEN WOLFGANG,GREY ORANGE PTE. LTD (2020-09-22),https://lens.org/188-659-429-999-907,Patent Application,yes,0,5,7,7,0,G06Q10/08;;G05D1/0027;;G05D1/0214;;G06Q10/087,G05D1/02;;G05D1/00;;G06Q10/08,,0,0,,,,ACTIVE
46,WO,A1,WO 2018/211295 A1,100-261-090-002-334,2018-11-22,2018,IB 2017000583 W,2017-05-16,IB 2017000583 W,2017-05-16,APPARATUS AND METHOD FOE WAREHOUSE ZONING,"Described herein is an apparatus and a corresponding method for performing warehouse zoning and further monitoring the zoned warehouse. The apparatus includes circuitry that partitions a workspace into a plurality of zones based on an area of the workspace, and a number of transportation vehicles and a number of item racks that are to be deployed in the workspace. A location of each zone within the workspace is determined based on a location of a first type of station that is disposed outside the workspace. The apparatus determines for each zone, an area of the zone and receives a signal indicating occurrence of an event in one of the zones. Further, the apparatus determines a degree of criticality of the occurred event which indicates whether workspace operation in the zone can be continued, and initiates an operation at a timing that is based on the determined degree of criticality.",GREY ORANGE PTE LTD,BOSE SAGAR;;BOPPANA NAVEEN;;KEJRIWAL GAURAV;;AGARWAL RUPESH;;GUPTA AKASH;;KOHLI SAMAY;;HOELTGEN WOLFGANG KURT,,https://lens.org/100-261-090-002-334,Patent Application,yes,5,1,7,7,0,G06Q10/08;;G05D1/0027;;G05D1/0214;;G06Q10/087,G06Q10/08;;G05B13/02;;G06Q10/06,,1,0,,,See also references of EP 3625739A4,PENDING
47,US,B2,US 11514374 B2,178-435-060-108-370,2022-11-29,2022,US 202016736284 A,2020-01-07,US 202016736284 A;;US 201962923774 P,2019-10-21,"Method, system, and non-transitory computer readable medium for an artificial intelligence based room assignment optimization system","Embodiments provide optimized room assignments for a hotel in response to receiving a plurality of hard constraints and soft constraints and receiving reservation preferences and room features. The optimization includes determining a guest satisfaction assignment cost based on the reservation preferences and room features, determining an operational efficiency assignment cost, generating a weighted cost matrix based on the guest satisfaction assignment cost and the operational efficiency assignment cost, and generating preliminary room assignments based on the weighted cost matrix. When the preliminary room assignments are feasible, the preliminary room assignments are the optimized room assignments comprising a feasible selection of elements of the matrix. When the preliminary room assignments are infeasible, embodiments relax one or more constraints and repeat the performing optimization until the preliminary room assignments are feasible.",ORACLE INT CORP,VAKHUTINSKY ANDREW;;BOROUJENI SETAREH BORJIAN;;YAGNAVAJHALA SARASWATI;;PEREZ JORGE LUIS RIVERO;;AGARWAL DHRUV;;CHATTERJEE AKASH,ORACLE INTERNATIONAL CORPORATION (2019-12-30),https://lens.org/178-435-060-108-370,Granted Patent,yes,28,0,5,5,0,G06Q10/04;;G06Q50/12;;G06Q10/0631;;G06Q10/06314;;G06Q50/12;;G06Q10/02;;G06Q10/04;;G06Q10/02;;G06Q10/06314;;G06Q50/12;;G06Q10/04,G06Q10/02;;G06Q10/04;;G06Q10/06;;G06Q50/12,,12,7,115-331-353-741-629;;133-704-620-989-322;;051-676-079-313-894;;133-704-620-989-322;;069-859-866-881-095;;027-637-887-931-488;;182-951-291-619-878,10.1287/opre.13.3.388;;10.1016/j.ijhm.2016.03.003;;10.1177/0010880405275597;;10.1016/j.ijhm.2016.03.003;;10.1057/rpm.2011.37;;10.18637/jss.v033.i01;;pmc2929880;;20808728;;10.4304/jsw.5.7.745-752,"Peter L. Iv{hacek over (a)}nescu, Some Network Flow Problems Solved with Pseudo-Boolean Programming, May-Jun. 1965, INFORMS, vol. 13, No. 3, pp. 388-399. (Year: 1965).;;Viviana Perdomo, Operating Theatre Scheduling Using Lagrangian Relaxation, Feb. 26, 2007, IEEE, 10.1109/ICSSSM.2006.320685 (Year: 2007).;;Daniel Elizalde, How to Use a Scorecard to Prioritize Features, Mar. 13, 2019, IoT Strategy for Product Teams (Year: 2019).;;Xun Xu, “The antecedents of customer satisfaction and dissatisfaction toward various types of hotels: A text mining approach”, May 2016, International Journal of Hospitality Management, vol. 55, pp. 57-69. (Year: 2016).;;Rajiv Banker, “Association of Nonfinancial Performance Measures with the Financial Performance of a Lodging Chain”, Nov. 2005, Cornell University, vol. 46, No. 4, pp. 394-412. (Year: 2005).;;Xun Xu, “The antecedents of customer satisfaction and dissatisfaction toward various types of hotels: A text mining approach”, May 2016, International Journal of Hospitality Management, vol. 55, pp. 57-69. (Year: 2016) (Year: 2016).;;Li, Y., Wang, B. and Caudillo-Fuentes, L.A. (2013) Modeling a hotel room assignment problem. Journal of Revenue and Pricing Management 12: 120-127.;;Friedman et al., “Regularization Paths for Generalized Linear Models via Coordinate Descent”, Journal of Statistical Software, Jan. 2010, vol. 33, issue 1.;;International Search Report and Written Opinion issued in the corresponding International Application No. PCT/US2020/046618, dated Nov. 18, 2020.;;International Search Report and Written Opinion issued in the corresponding International Application No. PCT/US2020/046611, dated Nov. 18, 2020.;;Gong, “A Collaborative Filtering Recommendation Algorithm Based on User Clustering and Item Clustering,” Journal of Software, 2010, vol. 5.7, pp. 1-2 (Abstract only).;;Ramzan et al., “An Intelligent Data Analysis for Recommendation Systems Using Machine Learning,” Scientific Programming, 2019, pp. 1-2, (abstract only), Hindawi Limited.",ACTIVE
48,EP,A1,EP 3625739 A1,005-109-469-125-507,2020-03-25,2020,EP 17910414 A,2017-05-16,IB 2017000583 W,2017-05-16,APPARATUS AND METHOD FOE WAREHOUSE ZONING,,GREY ORANGE PTE LTD,BOSE SAGAR;;BOPPANA NAVEEN;;KEJRIWAL GAURAV;;AGARWAL RUPESH;;GUPTA AKASH;;KOHLI SAMAY;;HOELTGEN WOLFGANG KURT,,https://lens.org/005-109-469-125-507,Patent Application,yes,0,0,7,7,0,G06Q10/08;;G05D1/0027;;G05D1/0214;;G06Q10/087,G06Q10/08;;G05B13/02;;G06Q10/06,,0,0,,,,PENDING
49,BR,A8,BR 112019024221 A8,015-602-674-637-888,2023-04-18,2023,BR 112019024221 A,2017-05-16,IB 2017000583 W,2017-05-16,"APARELHO, E, MÉTODO PARA OPERAR UM ESPAÇO DE TRABALHO DE UMA INSTALAÇÃO POR UM CONJUNTO DE CIRCUITOS","É aqui descrito um aparelho e um método correspondente para executar o zoneamento do armazém e monitorar adicionalmente o armazém zonado. O aparelho inclui conjunto de circuitos que particionam um espaço de trabalho em uma pluralidade de zonas com base em uma área do espaço de trabalho, e vários veículos de transporte e várias cremalheiras de itens que devem ser implantados no espaço de trabalho. Um local de cada zona dentro do espaço de trabalho é determinado com base no local de um primeiro tipo de estação que é disposto fora do espaço de trabalho. O aparelho determina, para cada zona, uma área da zona e recebe um sinal indicando a ocorrência de um evento em uma das zonas. Além disso, o aparelho determina um grau de criticidade do evento ocorrido que indica se a operação do espaço de trabalho na zona pode ser continuada ou não, e inicia uma operação em um momento que é baseado no grau determinado de criticidade.",GREY ORANGE PTE LTD,SAGAR BOSE;;NAVEEN BOPPANA;;GAURAV KEJRIWAL;;RUPESH AGARWAL;;AKASH GUPTA;;SAMAY KOHLI;;WOLFGANG KURT HOELTGEN,,https://lens.org/015-602-674-637-888,Patent Application,no,0,0,7,7,0,G06Q10/08;;G05D1/0027;;G05D1/0214;;G06Q10/087,G05D1/02;;G06Q10/087,,0,0,,,,DISCONTINUED
50,US,B2,US 11269338 B2,028-012-558-065-685,2022-03-08,2022,US 201716614210 A,2017-05-16,IB 2017000583 W,2017-05-16,Apparatus and method for warehouse zoning,"Described herein is an apparatus and a corresponding method for performing warehouse zoning and further monitoring the zoned warehouse. The apparatus includes circuitry that partitions a workspace into a plurality of zones based on an area of the workspace, and a number of transportation vehicles and a number of item racks that are to be deployed in the workspace. A location of each zone within the workspace is determined based on a location of a first type of station that is disposed outside the workspace. The apparatus determines for each zone, an area of the zone and receives a signal indicating occurrence of an event in one of the zones. Further, the apparatus determines a degree of criticality of the occurred event which indicates whether workspace operation in the zone can be continued, and initiates an operation at a timing that is based on the determined degree of criticality.",GREY ORANGE PTE LTD,BOSE SAGAR;;BOPPANA NAVEEN;;KEJRIWAL GAURAV;;AGARWAL RUPESH;;GUPTA AKASH;;KOHLI SAMAY;;HOELTGEN WOLFGANG KURT,GREY ORANGE PTE. LTD (2020-09-22),https://lens.org/028-012-558-065-685,Granted Patent,yes,11,0,7,7,0,G06Q10/08;;G05D1/0027;;G05D1/0214;;G06Q10/087,G05D1/02;;G05D1/00;;G06Q10/08,,3,0,,,"Extended European Search Report dated Nov. 3, 2020 in European Patent Application No. 179104141.6, 7 pages.;;International Search Report and Written Opinion dated Aug. 18, 2017 in PCT/IB2017/000583 filed May 16, 2017.;;First Substantive Report dated Aug. 16, 2021 in corresponding Chilean Patent Application No. 2019-3295 (with English translation)(12 pages).",ACTIVE
51,BR,A2,BR 112019024221 A2,053-769-875-144-257,2020-08-18,2020,BR 112019024221 A,2017-05-16,IB 2017000583 W,2017-05-16,"aparelho, e, método para operar um espaço de trabalho de uma instalação por um conjunto de circuitos","é aqui descrito um aparelho e um método correspondente para executar o zoneamento do armazém e monitorar adicionalmente o armazém zonado. o aparelho inclui conjunto de circuitos que particionam um espaço de trabalho em uma pluralidade de zonas com base em uma área do espaço de trabalho, e vários veículos de transporte e várias cremalheiras de itens que devem ser implantados no espaço de trabalho. um local de cada zona dentro do espaço de trabalho é determinado com base no local de um primeiro tipo de estação que é disposto fora do espaço de trabalho. o aparelho determina, para cada zona, uma área da zona e recebe um sinal indicando a ocorrência de um evento em uma das zonas. além disso, o aparelho determina um grau de criticidade do evento ocorrido que indica se a operação do espaço de trabalho na zona pode ser continuada ou não, e inicia uma operação em um momento que é baseado no grau determinado de criticidade.",GREY ORANGE PTE LTD,AKASH GUPTA;;GAURAV KEJRIWAL;;NAVEEN BOPPANA;;RUPESH AGARWAL;;SAGAR BOSE;;SAMAY KOHLI;;WOLFGANG KURT HOELTGEN,,https://lens.org/053-769-875-144-257,Patent Application,no,0,0,7,7,0,G06Q10/08;;G05D1/0027;;G05D1/0214;;G06Q10/087,G05B13/02;;G06Q10/06;;G06Q10/08,,0,0,,,,DISCONTINUED
52,EP,A4,EP 3625739 A4,060-048-932-617-553,2020-12-02,2020,EP 17910414 A,2017-05-16,IB 2017000583 W,2017-05-16,APPARATUS AND METHOD FOE WAREHOUSE ZONING,,GREY ORANGE PTE LTD,AGARWAL RUPESH;;GUPTA AKASH;;KOHLI SAMAY;;HOELTGEN WOLFGANG KURT;;BOSE SAGAR;;BOPPANA NAVEEN;;KEJRIWAL GAURAV,,https://lens.org/060-048-932-617-553,Search Report,no,1,0,7,7,0,G06Q10/08;;G05D1/0027;;G05D1/0214;;G06Q10/087,G06Q10/08,,0,0,,,,PENDING
53,WO,A1,WO 2021/080668 A1,087-319-905-067-164,2021-04-29,2021,US 2020/0046611 W,2020-08-17,US 201962923774 P;;US 202016736284 A,2019-10-21,ARTIFICIAL INTELLIGENCE BASED ROOM ASSIGNMENT OPTIMIZATION SYSTEM,"Embodiments provide optimized room assignments for a hotel in response to receiving a plurality of hard constraints and soft constraints and receiving reservation preferences and room features. The optimization includes determining a guest satisfaction assignment cost based on the reservation preferences and room features, determining an operational efficiency assignment cost, generating a weighted cost matrix based on the guest satisfaction assignment cost and the operational efficiency assignment cost, and generating preliminary room assignments based on the weighted cost matrix. When the preliminary room assignments are feasible, the preliminary room assignments are the optimized room assignments comprising a feasible selection of elements of the matrix. When the preliminary room assignments are infeasible, embodiments relax one or more constraints and repeat the performing optimization until the preliminary room assignments are feasible.",ORACLE INT CORP,BOROUJENI SETAREH BORJIAN;;VAKHUTINSKY ANDREW;;YAGNAVAJHALA SARASWATI;;PEREZ JORGE LUIS RIVERO;;AGARWAL DHRUV;;CHATTERJEE AKASH,,https://lens.org/087-319-905-067-164,Patent Application,yes,2,0,5,5,0,G06Q10/04;;G06Q50/12;;G06Q10/0631;;G06Q10/06314;;G06Q50/12;;G06Q10/02;;G06Q10/04;;G06Q10/02;;G06Q10/06314;;G06Q50/12;;G06Q10/04,G06Q10/06;;G06Q50/12,,0,0,,,,PENDING
