55,US,B2,US 8538876 B2,117-746-655-886-425,2013-09-17,2013,US 201213445592 A,2012-04-12,US 201213445592 A;;US 56187609 A;;US 37251009 A;;US 3047408 P,2008-02-21,System and method for providing borrowing schemes,A system and method providing a borrowing scheme. The method comprises the steps of: establishing an interest-free revolving amount or account using the computer processor; establishing a periodic payment for maintaining the interest-free revolving amount or account using the computer processor; and automatically revising the interest-free revolving amount or account or the periodic payment using the computer processor based upon at least one user performance metric over a predetermined period of time; wherein the interest-free revolving amount or account or the periodic payment for maintaining the interest-free revolving amount is determined by the user via the network.,VICENTE MARIA TERESITA;;DRAGOTTA FRANK CAWLEY;;FIELD MANNING R;;KOPPENHAVER JOY LYNN;;MOED JAMES SAMUEL;;JACOBY RYAN ALAN;;GROULX IAN MICHAEL;;DAME KEVIN THOMAS;;EMERSON HEATHER MARGARET;;MCGARRY JENNIFER C;;JPMORGAN CHASE BANK NA,VICENTE MARIA TERESITA;;DRAGOTTA FRANK CAWLEY;;FIELD MANNING R;;KOPPENHAVER JOY LYNN;;MOED JAMES SAMUEL;;JACOBY RYAN ALAN;;GROULX IAN MICHAEL;;DAME KEVIN THOMAS;;EMERSON HEATHER MARGARET;;MCGARRY JENNIFER C,JPMORGAN CHASE BANK N.A (2009-01-26),https://lens.org/117-746-655-886-425,Granted Patent,yes,120,5,8,8,0,G06Q20/10;;G06Q20/102;;G06Q20/22;;G06Q20/405;;G06Q40/02;;G06Q40/00;;G06Q30/0207;;G06Q40/03;;G06Q40/02;;G06Q20/22;;G06Q20/405;;G06Q20/102;;G06Q20/10;;G06Q40/03;;G06Q40/00;;G06Q20/24;;G06Q30/0207,G06Q40/00,705/40;;705/39,14,2,110-500-903-923-252;;110-500-903-923-252,10.1093/ei/cbi023;;10.1093/ei/cbi023,"Anonymous ""GE launches new card for Coles Myer(GE Capital is reviving its Australian credit card business )"" Feb. 8, 2002 Cards International , p. 7.;;Kim et al. ""Bank competition and consumer search over credit card interest rates."" Apr. 2005 Economic Inquiry , 43 , 2 , 344(10).;;Britt, Competing in Auto Lending, America's Community Banker, vol. 5, No. 11, Nov. 1, 1996, pp. 33-37.;;McMonagle, Daniel, McMonagle, Chapter VII-Cash Balance Plans in a Traditional Defined Benefit World, as found on google.scholar (dev.soa.org, Jan. 2002), www.soa.org/.../monographs/retirement-systems/cash-balance-symposium/2002/january/m-rs02-3-07.pdf-May 7, 2009.;;Brown et al., Purchasing Card Magic Eli Lilly Finds Accounts Payable Flying High With Plastic, Corporate Cashflow, vol. 15, No. 12, Nov. 1994, 2 pages.;;Spurgin, Sopininmon! or What's Happening in the Retail Credit Card Environment, Credit World Journal, vol. 85, No. 4, Mar. 1, 1997, pp. 20-23.;;Office Action issued Feb. 17, 2011 in corresponding U.S. Appl. No. 12/372,510.;;Office Action issued Jan. 5, 2011 in corresponding U.S. Appl. No. 12/372,554.;;Office Action issued Jan. 14, 2011 in corresponding U.S. Appl. No. 12/372,617.;;Office Action issued Feb. 1, 2011 in corresponding U.S. Appl. No. 12/372,710.;;Office Action issued Mar. 22, 2011 in corresponding U.S. Appl. No. 12/372,716.;;Office Action issued Aug. 4, 2011 in corresponding U.S. Appl. No. 12/561,876.;;Anonymous, ""GE Launches New Card for Coles Myer (GE is Reviving its Austrian Credit Card Business)"" Feb. 8, 2002, Cards International, pp. 7.;;Kim et al, ""Bank Competition and Consumer Search Over Credit Card Interest Rates"" Economic Inquiry, 43, 2 344(10).",ACTIVE
56,US,B2,US 8706625 B2,094-506-853-411-37X,2014-04-22,2014,US 201313759212 A,2013-02-05,US 201313759212 A;;US 201213445592 A;;US 56187609 A;;US 37251009 A;;US 3047408 P,2008-02-21,System and method for providing borrowing schemes,A system and method providing a borrowing scheme. The method comprises the steps of: establishing an interest-free revolving amount or account using the computer processor; establishing a periodic payment for maintaining the interest-free revolving amount or account using the computer processor; and automatically revising the interest-free revolving amount or account or the periodic payment using the computer processor based upon at least one user performance metric over a predetermined period of time; wherein the interest-free revolving amount or account or the periodic payment for maintaining the interest-free revolving amount is determined by the user via the network.,JPMORGAN CHASE BANK NA;;JPMORGAN CHASE BANK NA,VICENTE MARIA TERESITA;;DRAGOTTA FRANK CAWLEY;;FIELD MANNING R;;KOPPENHAVER JOY LYNN;;MOED JAMES SAMUEL;;JACOBY RYAN ALAN;;GROULX IAN MICHAEL;;DAME KEVIN THOMAS;;EMERSON HEATHER MARGARET;;MCGARRY JENNIFER C,JPMORGAN CHASE BANK N.A (2009-01-26),https://lens.org/094-506-853-411-37X,Granted Patent,yes,120,55,8,8,0,G06Q20/10;;G06Q20/102;;G06Q20/22;;G06Q20/405;;G06Q40/02;;G06Q40/00;;G06Q30/0207;;G06Q40/03;;G06Q40/02;;G06Q20/22;;G06Q20/405;;G06Q20/102;;G06Q20/10;;G06Q40/03;;G06Q40/00;;G06Q20/24;;G06Q30/0207,G06Q30/02;;G06Q40/00;;G06Q40/02,705/40;;705/39,11,1,110-500-903-923-252,10.1093/ei/cbi023,"Anonymous ""GE launches new card for Coles Myer(GE Capital is reviving its Australian credit card business )"" Feb. 8, 2002 Cards International , p. 7.;;Kim et al. ""Bank competition and consumer search over credit card interest rates. "" Apr. 2005 Economic Inquiry , 43 , 2 , 344(10).;;Britt, Competing in Auto Lending, America's Community Banker, vol. 5, No. 11, Nov. 1, 1996, pp. 33-37.;;McMonagle, Daniel, McMonagle, Chapter VII-Cash Balance Plans in a Traditional Defined Benefit World, as found on google.scholar (dev.soa.org, Jan. 2002), www.soa.org/.../monographs/retirement-systems/cash-balance-symposium/2002/january/m-rs02-3-07.pdf-May 7, 2009.;;Brown et al., Purchasing Card Magic Eli Lilly Finds Accounts Payable Flying High With Plastic, Corporate Cashflow, vol. 15, No. 12, Nov. 1994, 2 pages.;;Spurgin, Sopininmon! or What's Happening in the Retail Credit Card Environment, Credit World Journal, vol. 85, No. 4, Mar. 1, 1997, pp. 20-23.;;Office Action issued Jan. 5, 2011 in corresponding U.S. Appl. No. 12/372,554.;;Office Action issued Jan. 14, 2011 in corresponding U.S. Appl. No. 12/372,617.;;Office Action issued Feb. 1, 2011 in corresponding U.S. Appl. No. 12/372,710.;;Office Action issued Mar. 22, 2011 in corresponding U.S. Appl. No. 12/372,716.;;Anonymous, ""GE Launches New Card for Coles Myer (GE is Reviving its Austrian Credit Card Business)"" Feb. 8, 2002, Cards International, pp. 7.",ACTIVE
57,US,A1,US 2012/0209761 A1,021-836-138-674-836,2012-08-16,2012,US 201213445592 A,2012-04-12,US 201213445592 A;;US 56187609 A;;US 37251009 A;;US 3047408 P,2008-02-21,System and Method for Providing Borrowing Schemes,A system and method providing a borrowing scheme. The method comprises the steps of: establishing an interest-free revolving amount or account using the computer processor; establishing a periodic payment for maintaining the interest-free revolving amount or account using the computer processor; and automatically revising the interest-free revolving amount or account or the periodic payment using the computer processor based upon at least one user performance metric over a predetermined period of time; wherein the interest-free revolving amount or account or the periodic payment for maintaining the interest-free revolving amount is determined by the user via the network,VICENTE MARIA TERESITA;;DRAGOTTA FRANK CAWLEY;;FIELD MANNING R;;KOPPENHAVER JOY LYNN;;MOED JAMES SAMUEL;;JACOBY RYAN ALAN;;GROULX IAN MICHAEL;;DAME KEVIN THOMAS;;EMERSON HEATHER MARGARET;;MCGARRY JENNIFER C;;JPMORGAN CHASE BANK NA,VICENTE MARIA TERESITA;;DRAGOTTA FRANK CAWLEY;;FIELD MANNING R;;KOPPENHAVER JOY LYNN;;MOED JAMES SAMUEL;;JACOBY RYAN ALAN;;GROULX IAN MICHAEL;;DAME KEVIN THOMAS;;EMERSON HEATHER MARGARET;;MCGARRY JENNIFER C,JPMORGAN CHASE BANK N.A (2009-01-26),https://lens.org/021-836-138-674-836,Patent Application,yes,0,4,8,8,0,G06Q20/10;;G06Q20/102;;G06Q20/22;;G06Q20/405;;G06Q40/02;;G06Q40/00;;G06Q30/0207;;G06Q40/03;;G06Q40/02;;G06Q20/22;;G06Q20/405;;G06Q20/102;;G06Q20/10;;G06Q40/03;;G06Q40/00;;G06Q20/24;;G06Q30/0207,G06Q40/02,705/38,2,1,110-500-903-923-252,10.1093/ei/cbi023,"ANONYMOUS ""GE launches new card for Coles Myer(GE Capital is reviving its Australian credit card business )"" February 08, 2002 Cards International , p 7;;KIM ET AL. ""Bank competition and consumer search over credit card interest rates. "" April , 2005 Economic Inquiry , 43 , 2 , 344(10)",ACTIVE
58,US,B1,US 8078528 B1,116-831-115-865-578,2011-12-13,2011,US 37251009 A,2009-02-17,US 37251009 A;;US 3047408 P,2008-02-21,System and method for providing borrowing schemes,"The method according to exemplary embodiments comprises establishing an interest-free revolving amount or account, establishing a periodic payment for maintaining the interest-free revolving amount or account, and automatically revising the interest-free revolving amount or account or the periodic payment based upon at least one user performance metric over a predetermined period of time; wherein the interest-free revolving amount or account or the periodic payment for maintaining the interest-free revolving amount is determined by the user via a network.",VICENTE MARIA TERESITA;;DRAGOTTA FRANK CAWLEY;;FIELD MANNING R;;KOPPENHAVER JOY LYNN;;MOED JAMES SAMUEL;;JACOBY RYAN ALAN;;GROULX IAN MICHAEL;;DAME KEVIN THOMAS;;EMERSON HEATHER MARGARET;;MCGARRY JENNIFER C;;JPMORGAN CHASE BANK NA,VICENTE MARIA TERESITA;;DRAGOTTA FRANK CAWLEY;;FIELD MANNING R;;KOPPENHAVER JOY LYNN;;MOED JAMES SAMUEL;;JACOBY RYAN ALAN;;GROULX IAN MICHAEL;;DAME KEVIN THOMAS;;EMERSON HEATHER MARGARET;;MCGARRY JENNIFER C,JPMORGAN CHASE BANK N.A (2009-01-26),https://lens.org/116-831-115-865-578,Granted Patent,yes,117,115,8,8,0,G06Q20/10;;G06Q20/102;;G06Q20/22;;G06Q20/405;;G06Q40/02;;G06Q40/00;;G06Q30/0207;;G06Q40/03;;G06Q40/02;;G06Q20/22;;G06Q20/405;;G06Q20/102;;G06Q20/10;;G06Q40/03;;G06Q40/00;;G06Q20/24;;G06Q30/0207,G06Q40/00,705/38;;705/35,10,1,110-500-903-923-252,10.1093/ei/cbi023,"Anonymous ""GE launches new card for Coles Myer(GE Capital is reviving its Australian credit card business )"" Feb. 8, 2002 Cards International , p. 7.;;Kim et al. ""Bank competition and consumer search over credit card interest rates."" Apr. 2005 Economic Inquiry , 43 , 2 , 344(10).;;Britt, Competing in Auto Lending, America's Community Banker, vol. 5, No. 11, Nov. 1, 1996, pp. 33-37.;;McMonagle, Daniel, McMonagle, Chapter VII-Cash Balance Plans in a Traditional Defined Benefit World, as found on google.scholar (dev.soa.org, Jan. 2002), www.soa.org/.../monographs/retirement-systems/cash-balance-symposium/2002/january/m-rs02-3-07.pdf - May 7, 2009.;;Brown et al., Purchasing Card Magic Eli Lilly Finds Accounts Payable Flying High With Plastic, Corporate Cashflow, vol. 15, No. 12, Nov. 1994, 2 pages.;;Spurgin, Sopininmon! or What's Happening in the Retail Credit Card Environment, Credit World Journal, vol. 85, No. 4, Mar. 1, 1997, pp. 20-23.;;Office Action issued Jan. 5, 2011 in corresponding U.S. Appl. No. 12/372,554.;;Office Action issued Jan. 14, 2011 in corresponding U.S. Appl. No. 12/372,617.;;Office Action issued Feb. 1, 2011 in corresponding U.S. Appl. No. 12/372,710.;;Office Action issued Mar. 22, 2011 in corresponding U.S. Appl. No. 12/372,716.",ACTIVE
59,US,A1,US 2013/0151404 A1,038-152-828-578-411,2013-06-13,2013,US 201313759212 A,2013-02-05,US 201313759212 A;;US 201213445592 A;;US 56187609 A;;US 37251009 A;;US 3047408 P,2008-02-21,System and Method For Providing Borrowing Schemes,A system and method providing a borrowing scheme. The method comprises the steps of: establishing an interest-free revolving amount or account using the computer processor; establishing a periodic payment for maintaining the interest-free revolving amount or account using the computer processor; and automatically revising the interest-free revolving amount or account or the periodic payment using the computer processor based upon at least one user performance metric over a predetermined period of time; wherein the interest-free revolving amount or account or the periodic payment for maintaining the interest-free revolving amount is determined by the user via the network,JPMORGAN CHASE BANK NA;;JPMORGAN CHASE BANK NA,VICENTE MARIA TERESITA;;DRAGOTTA FRANK CAWLEY;;FIELD MANNING R;;KOPPENHAVER JOY LYNN;;MOED JAMES SAMUEL;;JACOBY RYAN ALAN;;GROULX IAN MICHAEL;;DAME KEVIN THOMAS;;EMERSON HEATHER MARGARET;;MCGARRY JENNIFER C,JPMORGAN CHASE BANK N.A (2009-01-26),https://lens.org/038-152-828-578-411,Patent Application,yes,0,0,8,8,0,G06Q20/10;;G06Q20/102;;G06Q20/22;;G06Q20/405;;G06Q40/02;;G06Q40/00;;G06Q30/0207;;G06Q40/03;;G06Q40/02;;G06Q20/22;;G06Q20/405;;G06Q20/102;;G06Q20/10;;G06Q40/03;;G06Q40/00;;G06Q20/24;;G06Q30/0207,G06Q20/24,705/40,0,0,,,,ACTIVE
60,US,B1,US 8190522 B1,184-190-277-447-909,2012-05-29,2012,US 56187609 A,2009-09-17,US 56187609 A;;US 37251009 A;;US 3047408 P,2008-02-21,System and method for providing borrowing schemes,A system and method providing a borrowing scheme. The method comprises the steps of: establishing an interest-free revolving amount or account using the computer processor; establishing a periodic payment for maintaining the interest-free revolving amount or account using the computer processor; and automatically revising the interest-free revolving amount or account or the periodic payment using the computer processor based upon at least one user performance metric over a predetermined period of time; wherein the interest-free revolving amount or account or the periodic payment for maintaining the interest-free revolving amount is determined by the user via the network.,VICENTE MARIA TERESITA;;DRAGOTTA FRANK CAWLEY;;FIELD MANNING R;;KOPPENHAVER JOY LYNN;;MOED JAMES SAMUEL;;JACOBY RYAN ALAN;;GROULX IAN MICHAEL;;DAME KEVIN THOMAS;;EMERSON HEATHER MARGARET;;MCGARRY JENNIFER C;;JPMORGAN CHASE BANK NA,VICENTE MARIA TERESITA;;DRAGOTTA FRANK CAWLEY;;FIELD MANNING R;;KOPPENHAVER JOY LYNN;;MOED JAMES SAMUEL;;JACOBY RYAN ALAN;;GROULX IAN MICHAEL;;DAME KEVIN THOMAS;;EMERSON HEATHER MARGARET;;MCGARRY JENNIFER C,JPMORGAN CHASE BANK N.A (2009-01-26),https://lens.org/184-190-277-447-909,Granted Patent,yes,120,9,8,8,0,G06Q20/10;;G06Q20/102;;G06Q20/22;;G06Q20/405;;G06Q40/02;;G06Q40/00;;G06Q30/0207;;G06Q40/03;;G06Q40/02;;G06Q20/22;;G06Q20/405;;G06Q20/102;;G06Q20/10;;G06Q40/03;;G06Q40/00;;G06Q20/24;;G06Q30/0207,G06Q40/00,705/40;;705/39,13,2,110-500-903-923-252;;110-500-903-923-252,10.1093/ei/cbi023;;10.1093/ei/cbi023,"Anonymous ""GE launches new card for Coles Myer(GE Capital is reviving its Australian credit card business )"" Feb. 8, 2002 Cards International , p. 7.;;Kim et al. ""Bank competition and consumer search over credit card interest rates. "" Apr. 2005 Economic Inquiry, 43, 2, 344(10).;;Britt, Competing in Auto Lending, America's Community Banker, vol. 5, No. 11, Nov. 1, 1996, pp. 33-37.;;McMonagle, Daniel, McMonagle, Chapter VII-Cash Balance Plans in a Traditional Defined Benefit World, as found on google.scholar (dev.soa.org, Jan. 2002), www.soa.org/.../monographs/retirement-systems/cash-balance-symposium/2002/january/m-rs02-3-07.pdf-2009-05-07.;;Brown et al., Purchasing Card Magic Eli Lilly Finds Accounts Payable Flying High With Plastic, Corporate Cashflow, vol. 15, No. 12, Nov. 1994, 2 pages.;;Spurgin, Sopininmon! or What's Happening in the Retail Credit Card Environment, Credit World Journal, vol. 85, No. 4, Mar. 1, 1997, pp. 20-23.;;Office Action issued Feb. 17, 2011 in corresponding U.S. Appl. No. 12/372,510.;;Office Action issued Jan. 5, 2011 in corresponding U.S. Appl. No. 12/372,554.;;Office Action issued Jan. 14, 2011 in corresponding U.S. Appl. No. 12/372,617.;;Office Action issued Feb. 1, 2011 in corresponding U.S. Appl. No. 12/372,710.;;Office Action issued Mar. 22, 2011 in corresponding U.S. Appl. No. 12/372,716.;;Anonymous, ""GE Launches New Card for Coles Myer (GE is Reviving its Austrian Credit Card Business)"" Feb. 8, 2002, Cards International p. 7.;;Kim et al., ""Bank Competition and Consumer Search Over Credit Card Interest Rates,"" Economic Inquiry, 43, 2 344(10).",ACTIVE
