"#",Jurisdiction,Kind,Display Key,Lens ID,Publication Date,Publication Year,Application Number,Application Date,Priority Numbers,Earliest Priority Date,Title,Abstract,Applicants,Inventors,Owners,URL,Document Type,Has Full Text,Cites Patent Count,Cited by Patent Count,Simple Family Size,Extended Family Size,Sequence Count,CPC Classifications,IPCR Classifications,US Classifications,NPL Citation Count,NPL Resolved Citation Count,NPL Resolved Lens ID(s),NPL Resolved External ID(s),NPL Citations,Legal Status
1,US,S,US D0402436 S,154-964-494-553-036,1998-12-15,1998,US 8347898 F,1998-02-10,US 8347898 F,1998-02-10,Hexagonal waffle,,KELLOG CO,CAWLEY C ROBERT;;CAWLEY MARTHA,KELLOGG COMPANY (1998-02-05),https://lens.org/154-964-494-553-036,Design Right,yes,8,27,1,1,0,,,D 1129;;0101,0,0,,,,EXPIRED
2,US,A,US 1032989 A,127-833-667-092-831,1912-07-16,1912,US 1910/0594328 A,1910-11-26,US 1910/0594328 A,1910-11-26,VENDING-MACHINE.,,TURNER HARRIS VENDING MACHINE COMPANY,CAWLEY CLYDE C,,https://lens.org/127-833-667-092-831,Granted Patent,no,0,8,1,1,0,G07F11/52;;G07F11/52,,,0,0,,,,EXPIRED
3,US,S,US D0267337 S,004-939-920-587-180,1982-12-21,1982,US 19726380 F,1980-10-15,US 19726380 F,1980-10-15,Stove,,CAWLEY JR C ROBERT,CAWLEY JR C ROBERT,,https://lens.org/004-939-920-587-180,Design Right,yes,1,0,1,1,0,,,D23/97;;D2303,0,0,,,,EXPIRED
4,US,A,US 3796521 A,003-182-273-159-623,1974-03-12,1974,US 3796521D A,1971-09-03,US 17767771 A,1971-09-03,COMPRESSOR WITH MOTOR AIR GAP ADJUSTMENT,"A refrigerant compressor incorporating an electric motor for rotating a drive shaft journalled within a compressor block of the compressor, the electric motor including a stator secured to the compressor block and a rotor secured to the drive shaft and inductively coupled to the stator. The stator is adjustably connected to the compressor block so as to permit relative adjustment of the stator and rotor to effect desired adjustment of the air gap between the stator and the rotor.",LENNOX IND INC,ELLIS C;;CAWLEY R,,https://lens.org/003-182-273-159-623,Granted Patent,no,11,1,1,1,0,F04B35/04;;F04B35/04;;H02K7/14;;H02K7/14;;H02K15/16;;H02K15/16,F04B35/04;;H02K7/14;;H02K15/16,417-415,0,0,,,,EXPIRED
5,BE,A,BE 597666 A,024-647-928-609-621,1961-03-15,1961,BE 597666 A,1960-11-30,US 597666X A,1959-12-03,Dispositif coupleur entre outil et câble.,,ATOMIC ENERGY COMMISSION,CAWLEY W E;;FRANTZ C E,,https://lens.org/024-647-928-609-621,Granted Patent,no,0,0,1,1,0,Y02E30/30,,,0,0,,,,EXPIRED
6,BE,A,BE 597504 A,197-854-509-052-887,1961-03-15,1961,BE 597504 A,1960-11-25,US 597504X A,1959-12-03,Dispositif à fendre les tubes.,,US ATOMIC ENERGY COMMISSIONS,FRANTZ C E;;CAWLEY W E,,https://lens.org/197-854-509-052-887,Granted Patent,no,0,0,2,2,0,B60S1/18,B60S1/18,,0,0,,,,EXPIRED
7,TW,A,TW 201508439 A,167-895-517-813-722,2015-03-01,2015,TW 103102262 A,2014-01-22,US 201313862135 A,2013-04-12,High performance current source power supply,"A system can include a device under test (DUT) having a DUT voltage, a cable connected to the DUT, the cable having a cable inductance, and a power supply configured as a current source to provide a wide bandwidth voltage source to the DUT, wherein the DUT voltage is independent of the cable inductance.",KEITHLEY INSTRUMENTS,CAWLEY KEVIN;;GOEKE WAYNE C;;SOBOLEWSKI GREGORY,,https://lens.org/167-895-517-813-722,Patent of Addition,no,0,0,8,8,0,G01R31/31721;;H04M1/24;;G01R31/31721;;H04M1/24;;G05F1/575,G05F1/46,,0,0,,,,PENDING
8,US,A,US 3827954 A,048-584-285-790-329,1974-08-06,1974,US 28135372 A,1972-08-17,US 28135372 A;;US 81602069 A,1969-04-14,ELECTRODEPOSITION OF METALLIC BORIDE COATINGS,,US INTERIOR,MC CAWLEY F;;WYCHE C;;SCHLAIN D,,https://lens.org/048-584-285-790-329,Granted Patent,no,0,8,1,2,0,C25D3/66;;C25D3/66,C25D3/66,204-039,0,0,,,,EXPIRED
9,US,A,US 3849962 A,098-545-462-026-893,1974-11-26,1974,US 41044073 A,1973-10-29,US 41044073 A;;US 11945771 A,1971-03-01,FUNCTIONAL AND DECORATIVE TRIM,"Structure serving as decorative trim and also to join panels together and to provide a support for the ""hanging"" of an item attached to an L-shaped support bracket. A base portion bears against the top edge of one or more panels, and a flange portion overlies the base portion. The upper and side surfaces of the flange portion serve as the exposed decorative trim. The flange portion has an outwardly and then downwardly extending outer part on each side thereof which terminates above a support surface to hold one leg of the L-shaped support bracket and to maintain the other leg of that bracket resting on the support surface.",KNOLL INTERNATIONAL,ALBINSON D;;HOPKINS R;;STEPHENS W;;CAWLEY C,WESTINGHOUSE ELECTRIC CORPORATION A CORP. OF PA (1990-11-27),https://lens.org/098-545-462-026-893,Granted Patent,no,4,10,1,4,0,A47B95/043;;A47B96/061;;A47B96/061;;A47B95/043,A47B95/04;;A47B96/06,052-717,0,0,,,,EXPIRED
10,US,A,US 3807102 A,170-486-597-439-128,1974-04-30,1974,US 33742573 A,1973-03-02,US 33742573 A;;US 11945771 A,1971-03-01,PANEL STRUCTURE HAVING FUNCTIONAL AND DECORATIVE TRIM AND SUPPORT BRACKET MEANS,"Structure serving as decorative trim and also to join panels together and to provide a support for the ""hanging"" of an item attached to an L-shaped support bracket. A base portion bears against the top edge of one or more panels, and a flange portion overlies the base portion. The upper and side surfaces of the flange portion serve as the exposed decorative trim. The flange portion has an outwardly and then downwardly extending outer part on each side thereof which terminates above a support surface to hold one leg of the L-shaped support bracket and to maintain the other leg of that bracket resting on the support surface.",KNOLL INTERNATIONAL,ALBINSON D;;STEPHENS W;;CAWLEY C;;HOPKINS R,WESTINGHOUSE ELECTRIC CORPORATION A CORP. OF PA (1990-11-27),https://lens.org/170-486-597-439-128,Granted Patent,no,3,23,1,4,0,A47B95/043;;A47B95/043;;A47B96/061;;A47B96/061,A47B95/04;;A47B96/06,052-036,0,0,,,,EXPIRED
11,US,A,US 3849950 A,015-842-377-582-246,1974-11-26,1974,US 33728473 A,1973-03-02,US 33728473 A;;US 11945771 A,1971-03-01,FUNCTIONAL AND DECORATIVE TRIM AND SUPPORT BRACKET STRUCTURES,"Structure serving as decorative trim and also to join panels together and to provide a support for the ""hanging"" of an item attached to an L-shaped support bracket. A base portion bears against the top edge of one or more panels, and a flange portion overlies the base portion. The upper and side surfaces of the flange portion serve as the exposed decorative trim. The flange portion has an outwardly and then downwardly extending outer part on each side thereof which terminates above a support surface to hold one leg of the L-shaped support bracket and to maintain the other leg of that bracket resting on the support surface.",KNOLL INTERNATIONAL,ALBINSON D;;HOPKINS R;;STEPHENS W;;CAWLEY C,WESTINGHOUSE ELECTRIC CORPORATION A CORP. OF PA (1990-11-27),https://lens.org/015-842-377-582-246,Granted Patent,no,5,5,1,4,0,A47B95/04;;A47B95/04;;A47B95/043;;A47B95/043;;A47B96/061;;A47B96/061,A47B95/04;;A47B96/06,052-027,0,0,,,,EXPIRED
12,US,A,US 5203671 A,160-050-634-802-804,1993-04-20,1993,US 72720091 A,1991-07-09,US 72720091 A,1991-07-09,Apparatus for palletizing bundles of paper,An apparatus for stacking irregular height bundles of paper onto a shipping pallet. Height detectors measure bundles traveling on a conveyor. The height data is utilized by a computer system to control an accumulator to accumulate and stack bundles to a predetermined height and then move the bundles to a storage compartment. The computer instructs a robot to move the stored bundles and place them in a compartmentalized guide box on a pallet in a substantially level predetermined layer height.,C & D ROBOTICS,CAWLEY W D;;BEAVERS JOE C;;HAYES DAVID,C&D ROBOTICS A CORP. OF TEXAS (1991-07-01),https://lens.org/160-050-634-802-804,Granted Patent,yes,20,97,1,1,0,B65B11/008;;B65G61/00;;Y10S414/12;;Y10S414/116;;B65B11/008;;B65G61/00;;Y10S414/116;;Y10S414/12,B65G61/00,414/791.6;;414/792.9;;414/799;;414/902;;414/907;;53/540;;364/478,0,0,,,,EXPIRED
13,US,A,US 3853294 A,070-846-825-392-132,1974-12-10,1974,US 33742673 A,1973-03-02,US 33742673 A;;US 11945771 A,1971-03-01,SUPPORT BRACKET,P,KNOLL INTERNATIONAL,ALBINSON D;;HOPKINS R;;STEPHENS W;;CAWLEY C,WESTINGHOUSE ELECTRIC CORPORATION A CORP. OF PA (1990-11-27),https://lens.org/070-846-825-392-132,Granted Patent,no,7,2,1,4,0,A47B95/043;;A47B96/061;;A47B96/061;;A47B95/043,A47B95/04;;A47B96/06,248-235,0,0,,,,EXPIRED
14,US,B2,US 7414414 B2,172-583-440-961-177,2008-08-19,2008,US 48935606 A,2006-07-19,US 48935606 A,2006-07-19,Spatially distributed guarded impedance,A guarded sense impedance for use in a measurement instrument includes a sense impedance adapted to have a spatially distributed electrical potential and at least one guard structure adapted to have the spatially distributed electrical potential. The guard structure is arranged to provide a spatially distributed guard potential for the sense impedance.,KEITHLEY INSTRUMENTS,NIEMANN JAMES A;;GIBBONS JOHN;;CAWLEY KEVIN;;GOEKE WAYNE C,KEITHLEY INSTRUMENTS INC (2006-08-04),https://lens.org/172-583-440-961-177,Granted Patent,yes,5,0,4,4,0,G01R1/18;;G01R1/203;;G01R1/18;;G01R1/203,G01R27/26;;G01F23/00,324/688;;324/627;;324/705;;X 73304 C,0,0,,,,ACTIVE
15,US,A1,US 2008/0018348 A1,010-892-459-613-070,2008-01-24,2008,US 48935606 A,2006-07-19,US 48935606 A,2006-07-19,Spatially distributed guarded impedance,A guarded sense impedance for use in a measurement instrument includes a sense impedance adapted to have a spatially distributed electrical potential and at least one guard structure adapted to have the spatially distributed electrical potential. The guard structure is arranged to provide a spatially distributed guard potential for the sense impedance.,NIEMANN JAMES A;;GIBBONS JOHN;;CAWLEY KEVIN;;GOEKE WAYNE C,NIEMANN JAMES A;;GIBBONS JOHN;;CAWLEY KEVIN;;GOEKE WAYNE C,KEITHLEY INSTRUMENTS INC (2006-08-04),https://lens.org/010-892-459-613-070,Patent Application,yes,5,0,4,4,0,G01R1/18;;G01R1/203;;G01R1/18;;G01R1/203,G01R27/26,324/688,0,0,,,,ACTIVE
16,JP,A,JP 2008026300 A,156-219-788-558-951,2008-02-07,2008,JP 2007000581 A,2007-01-05,US 48935606 A,2006-07-19,SPATIALLY DISTRIBUTED PROTECTED IMPEDANCE,"<P>PROBLEM TO BE SOLVED: To protect a node in an area surrounding an important measuring node by driving it to a potential same to that of the node itself. <P>SOLUTION: This protected sensing impedance 20 used in a measuring instrument 10 includes a sensing impedance 14 constituted to have a spatially distributed electric potential, an at least one protection constitutive body 16 or 18 constituted to have the spatially distributed electric potential. The protection constitutive body 16 or 18 imparts the spatially distributed electric potential to the sensing impedance 14. <P>COPYRIGHT: (C)2008,JPO&INPIT",KEITHLEY INSTRUMENTS,NIEMANN JAMES A;;GIBBONS JOHN;;CAWLEY KEVIN;;GOEKE WAYNE C,,https://lens.org/156-219-788-558-951,Patent Application,no,2,0,4,4,0,G01R1/18;;G01R1/203;;G01R1/18;;G01R1/203,G01R19/00,,0,0,,,,INACTIVE
17,CA,A1,CA 2322101 A1,023-734-960-089-143,2001-04-04,2001,CA 2322101 A,2000-10-03,US 15757599 P,1999-10-04,ALARM SYSTEM FOR DETECTING HAZARDS DUE TO POWER TRANSMISSIONLINES,"An alarm system for detecting and warning of the risk of shock and electrocution is provided. The alarm system is adapted for use with mobile construction equipment, e.g., cranes, trucks, etc., that can be used around overhead power transmission lines. The present alarm system has a sensor that detects the presence of outside power at the equipment where current is flowing therethrough to ground. The sensor preferably includes a conductor and an inductive sensor such as a current transformer which limits the output signal on its low side that is sent to an alarm unit. In this manner, the system herein continues to properly function despite the presence of large voltages at the equipment such as when the equipment contacts a high voltage power transmission line. The sensor can include a cable that provides a path of least resistance for current flowing through the equipment which can be detected by the sensor. Preferably, the cable is attached across a moving joint of the equipment where potential differences readily can oe found. Alternatively, the conductor can be a portion of the equipment itself through which current flows with the sensor detecting the flow through the equipment portion.",US GOV HEALTH & HUMAN SERV,SACKS H KENNETH;;YENCHEK MICHAEL R;;HOMCE GERALD T;;CAWLEY JAMES C,,https://lens.org/023-734-960-089-143,Patent Application,no,0,0,2,2,0,B60P1/00;;B60P1/00;;B66C15/065;;B66C15/065,B60P1/00;;B66C15/06;;G01R19/145;;G08B21/00,,0,0,,,,DISCONTINUED
18,US,B1,US 6600426 B1,129-000-143-959-20X,2003-07-29,2003,US 66943500 A,2000-09-25,US 66943500 A;;US 15757599 P,1999-10-04,Alarm system for detecting hazards due to power transmission lines,"
    An alarm system for detecting and warning of the risk of shock and electrocution is provided. The alarm system is adapted for use with mobile construction equipment, e.g., cranes, trucks, etc., that can be used around overhead power transmission lines. The present alarm system has a sensor that detects the presence of outside power at the equipment where current is flowing therethrough to ground. The sensor preferably includes a conductor and an inductive sensor such as a current transformer which limits the output signal on its low side that is sent to an alarm unit. In this manner, the system herein continues to properly function despite the presence of large voltages at the equipment such as when the equipment contacts a high voltage power transmission line. The sensor can include a cable that provides a path of least resistance for current flowing through the equipment which can be detected by the sensor. Preferably, the cable is attached across a moving joint of the equipment where potential differences readily can be found. Alternatively, the conductor can be a portion of the equipment itself through which current flows with the sensor detecting the flow through the equipment portion. 
",US HEALTH,SACKS H KENNETH;;YENCHEK MICHAEL R;;HOMCE GERALD T;;CAWLEY JAMES C,GOVERNMENT OF THE UNITED STATES OF AMERICA AS REPRESENTED BY THE SECRETARY OF THE DEPARTMENT OF HEALTH AND HUMAN SERVICES CENTERS FOR DISEASE CONTROL AND PREVENTION THE (2001-01-03),https://lens.org/129-000-143-959-20X,Granted Patent,yes,10,26,2,2,0,B60P1/00;;B60P1/00;;B66C15/065;;B66C15/065,B60P1/00;;B66C15/06;;G01R19/145;;G08B21/00,340664;;340684;;340685,0,0,,,,EXPIRED
19,US,B2,US 9907589 B2,087-126-064-274-220,2018-03-06,2018,US 201514828934 A,2015-08-18,US 201514828934 A,2015-08-18,Surgical plate device incorporating a screw locking mechanism,"A surgical plate device that incorporates a screw locking mechanism in each screw hole by which the surgical plate device is affixed to a bony segment. The screw locking mechanism includes a tab structure emanating from an interior portion (or either surface) of the surgical plate that is biased into a portion of the corresponding screw hole. When a screw is inserted into the screw hole, the head of the screw temporarily biases the tab structure out of the screw hole, until the head of the screw passes below the plane of the tab structure, at which point the tab structure rebounds into the previously occupied portion of the screw hole, thereby covering a portion of the head of the screw and preventing it from “backing out.”",ROSS THOMAS;;MUMME CHARLES W;;STEINMANN JOHN C;;STEINMANN JOHN P;;CAWLEY TRACE R;;RENOVIS SURGICAL TECH INC,ROSS THOMAS;;MUMME CHARLES W;;STEINMANN JOHN C;;STEINMANN JOHN P;;CAWLEY TRACE R,RENOVIS SURGICAL TECHNOLOGIES INC (2015-08-10),https://lens.org/087-126-064-274-220,Granted Patent,yes,7,5,2,2,0,A61B17/8042;;A61B17/8042;;A61B17/7059;;A61B17/7059,A61B17/56;;A61B17/70;;A61B17/80,,0,0,,,,ACTIVE
20,US,A1,US 2017/0049491 A1,146-665-888-310-344,2017-02-23,2017,US 201514828934 A,2015-08-18,US 201514828934 A,2015-08-18,SURGICAL PLATE DEVICE INCORPORATING A SCREW LOCKING MECHANISM,"A surgical plate device that incorporates a screw locking mechanism in each screw hole by which the surgical plate device is affixed to a bony segment. The screw locking mechanism includes a tab structure emanating from an interior portion (or either surface) of the surgical plate that is biased into a portion of the corresponding screw hole. When a screw is inserted into the screw hole, the head of the screw temporarily biases the tab structure out of the screw hole, until the head of the screw passes below the plane of the tab structure, at which point the tab structure rebounds into the previously occupied portion of the screw hole, thereby covering a portion of the head of the screw and preventing it from “backing out.”",ROSS THOMAS;;MUMME CHARLES W;;STEINMANN JOHN C;;STEINMANN JOHN P;;CAWLEY TRACE R;;RENOVIS SURGICAL TECH INC,ROSS THOMAS;;MUMME CHARLES W;;STEINMANN JOHN C;;STEINMANN JOHN P;;CAWLEY TRACE R,RENOVIS SURGICAL TECHNOLOGIES INC (2015-08-10),https://lens.org/146-665-888-310-344,Patent Application,yes,0,9,2,2,0,A61B17/8042;;A61B17/8042;;A61B17/7059;;A61B17/7059,A61B17/80;;A61B17/70,,0,0,,,,ACTIVE
21,US,A,US 4438473 A,154-906-816-689-863,1984-03-20,1984,US 28524781 A,1981-07-21,US 28524781 A,1981-07-21,Power supply for an intrinsically safe circuit,"An intrinsically safe power supply employing a binary current interrupter connected between the power source and the electrical load. Normally the load is situated in a potentially dangerous environment, like a coal mine, and the intrinsically safe power supply at a safe remote location, e.g., on the earth's surface. The interrupter has a pass and switching transistor, current sensor, gating circuitry, a flip-flop switch, and means to delay the turning on of the transistor--but not its turning off. If an overcurrent or overvoltage condition is sensed between the input and output of the intrinsically safe power supply, load current will cease to flow. In normal operation, only the current interrupter pass transistor will open. A reset signal from an oscillator internal of the interrupter may be used to reset the flip-flop after actuation or upon its initial setting, thereby causing the flow of power into the load.",US INTERIOR,CAWLEY JAMES C;;DIMARTINO MICHAEL D;;FISHER THOMAS J;;KING ROGER L;;UHLER MARCUS H,UNITED STATES OF AMERICA AS REPRESENTED BY THE SECRETARY OF THE INTERIOR (1981-07-14),https://lens.org/154-906-816-689-863,Granted Patent,yes,4,63,1,1,0,G05F1/569;;G05F1/569;;H02H9/008;;H02H9/008,G05F1/569;;H02H9/00,361/18;;361/74;;361/93;;361/101,0,0,,,,EXPIRED
22,US,A1,US 2020/0179123 A1,014-960-296-781-367,2020-06-11,2020,US 202016788353 A,2020-02-12,US 202016788353 A;;US 201414339508 A;;US 201213530048 A;;US 201361916469 P;;US 201361885778 P;;US 201361857824 P;;US 201261595249 P;;US 201261587336 P,2012-01-17,SURGICAL IMPLANT DEVICES INCORPORATING POROUS SURFACES AND ASSOCIATED METHOD OF MANUFACTURE,"A surgical implant device, including: an implant body; a porous layer disposed adjacent to the implant body, wherein the porous layer includes a lattice of intersecting struts; and a plurality of needle structures protruding from the porous layer opposite the implant body, wherein at least some of the plurality of needle structures traverse the porous layer and are anchored to the implant body. The plurality of needle structures that traverse the porous layer and are anchored to the implant body are coupled to one or more intersecting struts of the lattice. Optionally, some of the plurality of needle structures are spaced apart from the implant body and are anchored only to the porous layer. Preferably, one or more of the implant body, the porous layer, and the plurality of needle structures are formed by an additive manufacturing technique.",KYOCERA MEDICAL TECH INC,STEINMANN JOHN C;;RUCKER SCOTT;;RASMUSSEN TIM;;STEINMANN JOHN P;;CAWLEY TRACE;;ROSS THOMAS;;RIOS ERNESTO;;OLCESE ANDREW,KYOCERA MEDICAL TECHNOLOGIES INC (2021-05-18),https://lens.org/014-960-296-781-367,Patent Application,yes,0,2,4,26,0,A61F2/30771;;A61F2/34;;A61F2002/30784;;A61F2002/30841;;A61F2002/3093;;A61F2002/30985;;A61F2310/00023;;A61F2/30907;;A61F2/3094;;A61F2002/3092;;A61F2/30771;;A61F2/34;;A61F2310/00023;;A61F2002/30784;;A61F2002/30841;;A61F2002/3093;;A61F2002/30985,A61F2/30;;A61F2/34,,0,0,,,,ACTIVE
23,CN,A,CN 105578994 A,147-701-913-414-287,2016-05-11,2016,CN 201480052652 A,2014-07-24,US 2014/0047940 W;;US 201361857824 P;;US 201361885778 P;;US 201361916469 P,2013-07-24,Surgical implant devices incorporating porous surfaces,"A surgical implant device, comprising: a body portion; and one or more surfaces comprising a plurality of protruding structures; wherein the body portion and the one or more surfaces comprising the plurality of protruding structures are integrally formed. The one or more surfaces comprising the plurality of protruding structures are formed by an additive manufacturing process. The plurality of protruding structures comprise a plurality of needles. Optionally, the surgical implant device comprises one of an anterior lumbar interbody fusion cage, a posterior lumbar interbody fusion cage, a transforaminal lumbar interbody fusion cage, an oblique lumbar interbody fusion cage, a cervical cage, and a bone screw.",RENOVIS SURGICAL TECH INC,STEINMANN JOHN C;;RUCKER SCOTT;;RASMUSSEN TIM;;STEINMANN JOHN P;;CAWLEY TRACE;;ROSS THOMAS;;RIOS ERNESTO;;OLCESE ANDREW,,https://lens.org/147-701-913-414-287,Patent Application,no,5,4,5,26,0,A61F2/30907;;A61F2/34;;A61F2/4465;;A61B17/86;;A61F2002/30011;;A61F2002/30517;;A61F2002/30774;;A61F2002/30777;;A61F2002/30784;;A61F2002/30785;;A61F2002/30787;;A61F2002/30909;;A61F2002/30911;;A61F2002/3093;;A61F2310/00023;;A61F2310/00796;;A61F2/447;;B22F2005/005;;A61F2002/30507;;A61F2002/30593;;Y02P10/25;;B22F10/66;;B22F10/28;;B22F10/28;;B22F10/66;;A61F2/447;;B22F2005/005,A61F2/44,,0,0,,,,ACTIVE
24,US,A1,US 2015/0134063 A1,146-901-823-478-623,2015-05-14,2015,US 201414504509 A,2014-10-02,US 201414504509 A;;US 201213530048 A;;US 201361885778 P;;US 201361916469 P,2012-06-21,SURGICAL IMPLANT DEVICES INCORPORATING POROUS SURFACES AND A LOCKING PLATE,"A surgical implant device, comprising: a body portion defining a plurality of ports; a plurality of bone screws disposed partially through the plurality of ports defined by the body portion; a locking plate disposed over a head portion of at least one of the plurality of bone screws and engaging a plurality of recesses manufactured into a side of the body portion; and a screw operable for compressing the locking plate against the side of the body portion. Optionally, the surgical implant device further comprising: one or more surfaces comprising a plurality of protruding structures; wherein the body portion and the one or more surfaces comprising the plurality of protruding structures are integrally formed. The one or more surfaces comprising the plurality of protruding structures are formed by an additive manufacturing process. Optionally, the surgical implant device comprises one of an anterior lumbar interbody fusion cage and a cervical cage.",RENOVIS SURGICAL TECHNOLOGIES INC,STEINMANN JOHN C;;RUCKER SCOTT;;RASMUSSEN TIM;;STEINMANN JOHN P;;CAWLEY TRACE;;ROSS THOMAS;;RIOS ERNESTO;;OLCESE ANDREW,RENOVIS SURGICAL TECHNOLOGIES INC (2014-12-18),https://lens.org/146-901-823-478-623,Patent Application,yes,18,67,3,26,0,A61F2/447;;A61F2/447;;A61F2/30771;;A61F2/30907;;A61F2/30907;;A61F2/3094;;A61F2/4465;;A61F2/4465;;A61F2002/30011;;A61F2002/30011;;A61F2002/30507;;A61F2002/30507;;A61F2002/30517;;A61F2002/30517;;A61F2002/30593;;A61F2002/30593;;A61F2002/30772;;A61F2002/30774;;A61F2002/30774;;A61F2002/30777;;A61F2002/30777;;A61F2002/30779;;A61F2002/30779;;A61F2002/30784;;A61F2002/30784;;A61F2002/30785;;A61F2002/30785;;A61F2002/30787;;A61F2002/30787;;A61F2002/30841;;A61F2002/30909;;A61F2002/30909;;A61F2002/30911;;A61F2002/30911;;A61F2002/3093;;A61F2002/3093;;A61F2310/00023;;A61F2310/00023;;A61F2310/00796;;A61F2310/00796;;B33Y80/00,A61F2/44;;A61F2/30;;B33Y80/00,623/17.16,0,0,,,,ACTIVE
25,US,A1,US 2022/0218487 A1,148-087-238-504-877,2022-07-14,2022,US 202217709640 A,2022-03-31,US 202217709640 A;;US 202016788353 A;;US 201414339508 A;;US 201213530048 A;;US 201361857824 P;;US 201361885778 P;;US 201361916469 P;;US 201261587336 P;;US 201261595249 P,2012-01-17,SURGICAL IMPLANT DEVICES INCORPORATING POROUS SURFACES AND ASSOCIATED METHOD OF MANUFACTURE,"A surgical implant device, including: an implant body; a porous layer disposed adjacent to the implant body, wherein the porous layer includes a lattice of intersecting struts; and a plurality of needle structures protruding from the porous layer opposite the implant body, wherein at least some of the plurality of needle structures traverse the porous layer and are anchored to the implant body. The plurality of needle structures that traverse the porous layer and are anchored to the implant body are coupled to one or more intersecting struts of the lattice. Optionally, some of the plurality of needle structures are spaced apart from the implant body and are anchored only to the porous layer. Preferably, one or more of the implant body, the porous layer, and the plurality of needle structures are formed by an additive manufacturing technique.",KYOCERA MEDICAL TECH INC,STEINMANN JOHN C;;RUCKER SCOTT;;RASMUSSEN TIM;;STEINMANN JOHN P;;CAWLEY TRACE;;ROSS THOMAS;;RIOS ERNESTO;;OLCESE ANDREW,KYOCERA MEDICAL TECHNOLOGIES INC (2021-05-18),https://lens.org/148-087-238-504-877,Patent Application,yes,1,0,4,26,0,A61F2/30771;;A61F2/34;;A61F2002/30784;;A61F2002/30841;;A61F2002/3093;;A61F2002/30985;;A61F2310/00023;;A61F2/30907;;A61F2/3094;;A61F2002/3092;;A61F2/30771;;A61F2/34;;A61F2310/00023;;A61F2002/30784;;A61F2002/30841;;A61F2002/3093;;A61F2002/30985,A61F2/30;;A61F2/34,,0,0,,,,ACTIVE
