"#",Jurisdiction,Kind,Display Key,Lens ID,Publication Date,Publication Year,Application Number,Application Date,Priority Numbers,Earliest Priority Date,Title,Abstract,Applicants,Inventors,Owners,URL,Document Type,Has Full Text,Cites Patent Count,Cited by Patent Count,Simple Family Size,Extended Family Size,Sequence Count,CPC Classifications,IPCR Classifications,US Classifications,NPL Citation Count,NPL Resolved Citation Count,NPL Resolved Lens ID(s),NPL Resolved External ID(s),NPL Citations,Legal Status
1,WO,A1,WO 2008/100581 A1,140-891-305-597-230,2008-08-21,2008,US 2008/0001984 W,2008-02-13,US 88967707 P;;US 88968807 P;;US 88969507 P;;US 88969907 P,2007-02-13,ENERGY FINANCIAL RECONCILIATION SYSTEM AND METHOD,"An energy financial reconciliation method, comprising displaying at least two electricity options for selection by a user, each electricity option identifying attributes associated with the electricity used to process hydrogen fuel and determining an amount of funds to be transferred to an electricity provider based on the amount of purchased hydrogen fuel and the selected electricity option.",BAILEY GREG,BAILEY GREG,,https://lens.org/140-891-305-597-230,Patent Application,yes,3,0,2,2,0,G06Q50/06;;G06Q50/06;;G06Q30/0283;;G06Q30/0283;;G06Q30/0601;;G06Q30/0601,B60L11/18,,0,0,,,,PENDING
2,EP,A1,EP 3971382 A1,117-631-795-380-186,2022-03-23,2022,EP 21198170 A,2021-09-22,GB 202014970 A,2020-09-22,ACOUSTIC DOOR,"An acoustic door (2) comprises a first metallic panel (6) forming a first side of the door, a second metallic panel (8) forming a second side of the door, and a thermal break element (14) of glass fibre joining the first panel to the second panel and extending around a periphery of the door, such that there is no direct contact between the first (6) and second (8) metallic panels.
",IAC ACOUSTIC COMPANY UK LTD,SMITH GREG;;BAILEY PAUL,,https://lens.org/117-631-795-380-186,Patent Application,yes,3,0,2,2,0,E06B3/5892;;E06B3/827;;E06B5/20;;E06B5/162;;E06B5/164;;E06B5/167;;E06B3/263;;E06B2003/26394;;E06B3/2735,E06B5/16;;E06B3/263;;E06B3/273;;E06B3/58;;E06B3/82;;E06B5/20,,0,0,,,,DISCONTINUED
3,US,A1,US 2008/0195508 A1,125-175-246-159-79X,2008-08-14,2008,US 3064008 A,2008-02-13,US 3064008 A;;US 88967707 P;;US 88968807 P;;US 88969907 P;;US 88969507 P,2007-02-13,ENERGY FINANCIAL RECONCILIATION SYSTEM AND METHOD,"An energy financial reconciliation method, comprising displaying at least two electricity options for selection by a user, each electricity option identifying attributes associated with the electricity used to process hydrogen fuel and determining an amount of funds to be transferred to an electricity provider based on the amount of purchased hydrogen fuel and the selected electricity option.",BAILEY GREG;;LOCHHEAD JASON,BAILEY GREG;;LOCHHEAD JASON,,https://lens.org/125-175-246-159-79X,Patent Application,yes,5,5,2,2,0,G06Q50/06;;G06Q50/06;;G06Q30/0283;;G06Q30/0283;;G06Q30/0601;;G06Q30/0601,G06Q30/00;;G06Q10/00,705/27;;705/400,0,0,,,,DISCONTINUED
4,WO,A1,WO 2014/128132 A1,199-459-569-431-937,2014-08-28,2014,EP 2014053163 W,2014-02-18,EP 13155991 A,2013-02-20,MONITORING SYSTEM AND METHOD,"A monitoring system for monitoring the operation of a relief system is provided. The relief system is connected to one or more sources configured to deliver fluid into the relief system and the sources each comprise one or more source sensors for measuring one or more parameters associated with a respective source. The monitoring system is configured to access data storage arranged to store a first set of one or more sources that have previously been identified as delivering fluid into the relief system. The monitoring system comprises a data receiver arranged to receive substantially real-time measurement data from the source sensors and a processor. The processor is configured to a) determine a second set of sources currently delivering fluid into the relief system based on the received source sensor measurement data, b) access the data storage whereby to determine whether said second set of sources matches the first set of sources, and c) generate a relief system operation assessment based on the determination. A computer-implemented method for monitoring the operation of a relief system is also provided.",BP EXPLORATION OPERATING;;BAILEY RICHARD S;;HICKEY GREG,BAILEY RICHARD S;;HICKEY GREG,,https://lens.org/199-459-569-431-937,Patent Application,yes,5,11,1,1,0,F23N5/022;;F23N5/187;;F23N5/242;;F23G7/085;;F23N2223/08,F23N5/02;;F23G7/08;;F23N5/18;;F23N5/24,,0,0,,,,PENDING
5,US,B1,US 11447108 B1,092-951-202-300-169,2022-09-20,2022,US 201815932947 A,2018-05-25,US 201815932947 A;;US 201762707394 P,2017-10-30,Braking control system and method to sysnchronize the operation of the braking of a towed vehicle,A braking control system and method to synchronize the operation of the braking system of a towed vehicle with the braking system of a towing vehicle to match the deceleration and acceleration of the towed vehicle with the deceleration and acceleration of the towing vehicle wherein the braking control system includes a braking device comprising an electrically driven linear actuator coupled between an electric motor and the brake pedal of the towed vehicle and a control device coupled to the electric motor and including logic to control operation of the electrically driven linear actuator to selectively extend and retract the electrically driven linear actuator to selectively depress and release the brake pedal of the towed vehicle as the towing vehicle decelerates and accelerates.,BAILEY DAVID;;CREED RUSSELL;;BAJ GREG;;CREED MONARCH INC,BAILEY DAVID;;CREED RUSSELL;;BAJ GREG,CREED-MONARCH INC (2018-05-05),https://lens.org/092-951-202-300-169,Granted Patent,yes,114,3,1,1,0,B60T8/1708;;B60T8/171;;B60T17/223;;B60T7/20;;B60T13/745;;B60T8/1701;;B60T8/172;;B60T8/3205;;B60T8/321;;B60Y2200/147;;B60T13/72;;B60T13/74;;B60R16/033;;B60T13/46,B60T8/17;;B60R16/033;;B60T8/172;;B60T8/32;;B60T13/46;;B60T13/72;;B60T13/74,,1,0,,,"Arthur W. Fisher III, A prototype of The Creed-Monarch Patriot Model 2012 Auxiliary Braking System including a housing formed by two shells was completed at least as early as Mar. 2011 (Attachment 1). Each shell includes a groove forming a cable channel to receive a cable therein extending between a cavity and a cable connector location to couple a force measuring device to a controller (Composite Attachment 2). A production model of the Patriot Model II Auxiliary Braking System including the cavity and cable channel formed in the two shells (Attachment 3) was first sold to Blue Ox on or about Apr. 25, 2012. (Attachment 4).",ACTIVE
6,US,B2,US 11319504 B2,188-360-055-193-08X,2022-05-03,2022,US 202117146396 A,2021-01-11,US 202117146396 A;;US 202063039862 P,2020-06-16,Lubricant with nanoparticulate additive,An engine oil additive includes carbon nanotubes and boron nitride particulates dispersed within a fluid. The additive is configured to be mixed with a quantity of oil such that the quantity of oil has a concentration from 0.05 to 0.5 grams of carbon nanotubes and of boron nitride particulates per quart of oil to improve the lubricity of the oil. The additive improves the horsepower and torque of the engine while reducing fuel consumption. The carbon nanotubes have an —OH functionalized exterior surface. The carbon nanotubes have a diameter from 1 nanometer to 50 nanometers and have a length from 1 micron to 1000 microns. The boron nitride particulates are hex-boron nitride structures having an average size from 30 nanometers to 500 nanometers.,NOVUM NANO LLC;;SOUTH DAKOTA BOARD OF REGENTS,BAILEY CRAIG;;CHRISTENSEN GREG;;HONG HAIPING,SOUTH DAKOTA BOARD OF REGENTS (2020-10-28);;NOVUM NANO LLC (2020-06-16),https://lens.org/188-360-055-193-08X,Granted Patent,yes,8,0,4,4,0,C10M2201/061;;C10M2201/041;;C10N2040/25;;C10N2070/02;;C10N2030/54;;C10N2030/06;;C10M141/12;;C10M171/06;;B82Y30/00;;C10M169/04;;C10M125/02;;C10M125/26;;C10M2203/003;;C10M2201/041;;B82Y40/00;;C10M2201/14;;C10N2040/25;;C10N2020/06;;C10N2070/02;;B82Y30/00;;C10M2201/082,C10M125/00;;B82Y30/00;;B82Y40/00;;C10M125/02;;C10M125/26;;C10M169/04;;C10N20/06;;C10N40/25;;C10N70/00,,1,0,,,"International Search Report and Written Opinion for PCT/US2021/033125, dated Sep. 9, 2021, 10 pages.",ACTIVE
7,US,A1,US 2022/0251468 A1,064-752-003-480-008,2022-08-11,2022,US 202217713053 A,2022-04-04,US 202217713053 A;;US 202117146396 A;;US 202063039862 P,2020-06-16,LUBRICANT WITH NANOPARTICULATE ADDITIVE,An engine oil additive includes carbon nanotubes and boron nitride particulates dispersed within a fluid. The additive is configured to be mixed with a quantity of oil such that the quantity of oil has a concentration from 0.05 to 0.5 grams of carbon nanotubes and of boron nitride particulates per quart of oil to improve the lubricity of the oil. The additive improves the horsepower and torque of the engine while reducing fuel consumption. The carbon nanotubes have an —OH functionalized exterior surface. The carbon nanotubes have a diameter from 1 nanometer to 50 nanometers and have a length from 1 micron to 1000 microns. The boron nitride particulates are hex-boron nitride structures having an average size from 30 nanometers to 500 nanometers.,NOVUM NANO LLC;;SOUTH DAKOTA BOARD OF REGENTS,BAILEY CRAIG;;CHRISTENSEN GREG;;HONG HAIPING,SOUTH DAKOTA BOARD OF REGENTS (2020-10-28);;NOVUM NANO LLC (2022-03-16),https://lens.org/064-752-003-480-008,Patent Application,yes,3,0,4,4,0,C10M2201/061;;C10M2201/041;;C10N2040/25;;C10N2070/02;;C10N2030/54;;C10N2030/06;;C10M141/12;;C10M171/06;;B82Y30/00;;C10M169/04;;C10M125/02;;C10M125/26;;C10M2203/003;;C10M2201/041;;B82Y40/00;;C10M2201/14;;C10N2040/25;;C10N2020/06;;C10N2070/02;;B82Y30/00;;C10M2201/082,C10M169/04;;C10M125/02;;C10M125/26,,0,0,,,,PENDING
8,US,A1,US 2021/0388285 A1,024-470-877-500-528,2021-12-16,2021,US 202117146396 A,2021-01-11,US 202117146396 A;;US 202063039862 P,2020-06-16,LUBRICANT WITH NANOPARTICULATE ADDITIVE,An engine oil additive includes carbon nanotubes and boron nitride particulates dispersed within a fluid. The additive is configured to be mixed with a quantity of oil such that the quantity of oil has a concentration from 0.05 to 0.5 grams of carbon nanotubes and of boron nitride particulates per quart of oil to improve the lubricity of the oil. The additive improves the horsepower and torque of the engine while reducing fuel consumption. The carbon nanotubes have an —OH functionalized exterior surface. The carbon nanotubes have a diameter from 1 nanometer to 50 nanometers and have a length from 1 micron to 1000 microns. The boron nitride particulates are hex-boron nitride structures having an average size from 30 nanometers to 500 nanometers.,NOVUM NANO LLC;;SOUTH DAKOTA BOARD OF REGENTS,BAILEY CRAIG;;CHRISTENSEN GREG;;HONG HAIPING,SOUTH DAKOTA BOARD OF REGENTS (2020-10-28);;NOVUM NANO LLC (2020-06-16),https://lens.org/024-470-877-500-528,Patent Application,yes,0,0,4,4,0,C10M2201/061;;C10M2201/041;;C10N2040/25;;C10N2070/02;;C10N2030/54;;C10N2030/06;;C10M141/12;;C10M171/06;;B82Y30/00;;C10M169/04;;C10M125/02;;C10M125/26;;C10M2203/003;;C10M2201/041;;B82Y40/00;;C10M2201/14;;C10N2040/25;;C10N2020/06;;C10N2070/02;;B82Y30/00;;C10M2201/082,C10M169/04;;C10M125/02;;C10M125/26,,0,0,,,,ACTIVE
9,WO,A1,WO 2021/257231 A1,129-384-507-093-124,2021-12-23,2021,US 2021/0033125 W,2021-05-19,US 202063039862 P;;US 202117146396 A,2020-06-16,LUBRICANT WITH NANOPARTICULATE ADDITIVE,An engine oil additive includes carbon nanotubes and boron nitride particulates dispersed within a fluid. The additive is configured to be mixed with a quantity of oil such that the quantity of oil has a concentration from 0.05 to 0.5 grams of carbon nanotubes and of boron nitride particulates per quart of oil to improve the lubricity of the oil. The additive improves the horsepower and torque of the engine while reducing fuel consumption. The carbon nanotubes have an -OH functionalized exterior surface. The carbon nanotubes have a diameter from 1 nanometer to 50 nanometers and have a length from 1 micron to 1000 microns. The boron nitride particulates are hex-boron nitride structures having an average size from 30 nanometers to 500 nanometers.,NOVUM NANO LLC;;SOUTH DAKOTA BOARD OF REGENTS,BAILEY CRAIG;;CHRISTENSEN GREG;;HONG HAIPING,,https://lens.org/129-384-507-093-124,Patent Application,yes,5,0,4,4,0,C10M2201/061;;C10M2201/041;;C10N2040/25;;C10N2070/02;;C10N2030/54;;C10N2030/06;;C10M141/12;;C10M171/06;;B82Y30/00;;C10M169/04;;C10M125/02;;C10M125/26;;C10M2203/003;;C10M2201/041;;B82Y40/00;;C10M2201/14;;C10N2040/25;;C10N2020/06;;C10N2070/02;;B82Y30/00;;C10M2201/082,C10M125/02;;C10M125/20;;C10M125/26;;C10N20/06;;C10N40/25,,0,0,,,,PENDING
10,US,A1,US 2008/0216864 A1,192-551-891-023-12X,2008-09-11,2008,US 69769507 A,2007-04-06,US 69769507 A;;US 23732705 A;;US 44056106 A,2005-09-27,METHOD AND SYSTEM FOR DISTRIBUTING GAS FOR A BEVEL EDGE ETCHER,A plasma etch processing chamber configured to clean a bevel edge of a substrate is provided. The chamber includes a bottom edge electrode and a top edge electrode defined over the bottom edge electrode. The top edge electrode and the bottom edge electrode are configured to generate a cleaning plasma to clean the bevel edge of the substrate. The chamber includes a gas feed defined through a top surface of the processing chamber. The gas feed introduces a processing gas for striking the cleaning plasma at a location in the processing chamber that is between an axis of the substrate and the top edge electrode. A pump out port is defined through the top surface of the chamber and the pump out port located along a center axis of the substrate. A method for cleaning a bevel edge of a substrate is also provided.,SEXTON GREG;;BAILEY ANDREW;;SCHOEPP ALAN,SEXTON GREG;;BAILEY ANDREW;;SCHOEPP ALAN,LAM RESEARCH CORPORATION (2007-03-30),https://lens.org/192-551-891-023-12X,Patent Application,yes,10,31,10,10,0,B08B7/0035;;B08B7/0035;;H01L21/02087;;H01L21/02087;;H01L21/3065;;H01J37/32009;;H01J37/32009;;H01J37/3244;;H01J37/3244;;H01J37/32706;;H01J37/32706;;Y10S134/902;;Y10S134/902,B08B6/00;;C25F3/30,134/1.2;;134/200,0,0,,,,ACTIVE
11,US,A,US 5343605 A,014-948-055-361-941,1994-09-06,1994,US 2295493 A,1993-02-25,US 2295493 A;;US 76598691 A,1991-09-26,"Wire marking, cutting and stripping apparatus and method","A system for marking elongated wire and for cutting the wire and stripping insulation therefrom comprising first structure operable to mark the wire; second structure operable to cut the marked wire and to strip insulation from the wire; the wire extending between and movable between the first and second structures, the first and second structure comprising separate stand-alone devices; and control structure, including an external computer, operatively connected with the first and second structures for controlling operation of the first and second structures in time sequence relation to wire movement therebetween, and/or to control wire marking, wire cutting, and insulation stripping length.",EUBANKS ENG CO,NAZERIAN GREG;;BAILEY RONALD;;HOFFA JACK L,EUBANKS ENGINEERING COMPANY (1993-02-23),https://lens.org/014-948-055-361-941,Granted Patent,yes,81,25,4,38,0,H02G1/1256;;H02G1/1256;;Y10T29/49117;;Y10T29/49117;;Y10T29/5193;;Y10T29/5193;;Y10T29/53209;;Y10T29/53209,H02G1/12,29 33M;;29/747;;29/825;;81/9.51,4,0,,,"Standard Logic Catalogue, EWS 6K Electronic Wire Stripper , Feb. 1974.;;Artos Catalog Sheet, Single Blade, Fully Automatic Wire Processing , 1989.;;Komax 33 Catalogue Sheet, 1988.;;French Patent Application No. 2,525,402 dated Apr. 16, 1982.",EXPIRED
12,WO,A1,WO 2008/124350 A1,159-455-368-867-41X,2008-10-16,2008,US 2008/0058790 W,2008-03-28,US 69769507 A,2007-04-06,METHOD AND SYSTEM FOR DISTRIBUTING GAS FOR A BEVEL EDGE ETCHER,A plasma etch processing chamber configured to clean a bevel edge of a substrate is provided. The chamber includes a bottom edge electrode and a top edge electrode defined over the bottom edge electrode. The top edge electrode and the bottom edge electrode are configured to generate a cleaning plasma to clean the bevel edge of the substrate. The chamber includes a gas feed defined through a top surface of the processing chamber. The gas feed introduces a processing gas for striking the cleaning plasma at a location in the processing chamber that is between an axis of the substrate and the top edge electrode. A pump out port is defined through the top surface of the chamber and the pump out port located along a center axis of the substrate. A method for cleaning a bevel edge of a substrate is also provided.,LAM RES CORP;;SEXTON GREG;;BAILEY ANDREW III;;SCHOEP ALAN,SEXTON GREG;;BAILEY ANDREW III;;SCHOEP ALAN,,https://lens.org/159-455-368-867-41X,Patent Application,yes,4,0,10,10,0,B08B7/0035;;B08B7/0035;;H01L21/02087;;H01L21/02087;;H01L21/3065;;H01J37/32009;;H01J37/32009;;H01J37/3244;;H01J37/3244;;H01J37/32706;;H01J37/32706;;Y10S134/902;;Y10S134/902,H01L21/306,,0,0,,,,PENDING
13,US,A,US 5539967 A,164-610-749-450-528,1996-07-30,1996,US 38475195 A,1995-02-07,US 38475195 A;;US 22581394 A;;US 2295493 A;;US 76598691 A;;US 65955791 A;;US 61105790 A,1990-11-09,Multiple blade set strip apparatus for cable and wire,"The method of processing wire to cut the wire into sections and to strip sheathing from the wire to expose wire ends at opposite ends of the sections, and by operation of wire feed means and cutter means, the steps that include operating the feed means and cutter means to displace the wire endwise along an axis to a first position; sever the wire thereby to form wire forward and rearward sections, the forward section having a rearward end portion; and, the rearward section having a forward end portion, and; stripping sheathing from the forward section rearward portion and from the rearward section forward portion thereby to expose wire ends at the portions; the cutter means including three blade pairs, each pair including two blades located at opposite sides of the axis, both blades of one pair being displaced toward the wire to sever the wire, and both blades of the remaining two pairs being displaced toward the wire sections to strip sheathing from the rearward and forward portions during controlled endwise displacement of the sections. A sheathing slug or slugs may alternatively be relatively displaced along the wire section or sections to protectively overhang an end or ends of wire metal core, the slug or slugs not then be completely stripped from the section or sections.",EUBANKS ENG CO,NAZERIAN GREG;;BAILEY RONALD;;HOFFA JACK L,,https://lens.org/164-610-749-450-528,Granted Patent,yes,98,13,4,38,0,H02G1/1256;;H02G1/1256;;Y10T29/49117;;Y10T29/49117;;Y10T29/5193;;Y10T29/5193;;Y10T29/53209;;Y10T29/53209,H02G1/12,29 33M;;29/825;;81/9.51,4,0,,,"Standard Logic Catalogue, EWS 6K Electronic Wire Stripper , Feb. 1974.;;Artos Catalog Sheet, Single Blade, Fully Automatic Wire Processing , 1989.;;Komax 33 Catalogue Sheet, 1988.;;French Patent Application No. 2,525,402 dated Apr. 16, 1982.",EXPIRED
14,US,A,US 5412856 A,057-674-473-350-246,1995-05-09,1995,US 22581394 A,1994-04-11,US 22581394 A;;US 2295493 A;;US 76598691 A,1991-09-26,"Wire marking, cutting and stripping apparatus and method","A system for marking elongated wire and for cutting the wire and stripping insulation therefrom comprising first structure operable to mark the wire; second structure operable to cut the marked wire and to strip insulation from the wire; the wire extending between and movable between the first and second structures, the first and second structure comprising separate stand-alone devices; and control structure, including external computer means, operatively connected with the first and second structures for controlling operation of the first and second structures in time sequence relation to wire movement therebetween, and/or to control wire marking, wire cutting, and insulating stripping length.",EUBANKS ENG CO,NAZERIAN GREG;;BAILEY RONALD;;HOFFA JACK L,,https://lens.org/057-674-473-350-246,Granted Patent,yes,89,21,4,38,0,H02G1/1256;;H02G1/1256;;Y10T29/49117;;Y10T29/49117;;Y10T29/5193;;Y10T29/5193;;Y10T29/53209;;Y10T29/53209,H02G1/12,29 33M;;29/747;;29/825;;81/9.51,3,0,,,"Standard Logic Catalogue, EWS 6K Electronic Wire Stripper , Feb. 1974.;;Artos Catalog Sheet, Single Blade, Fully Automatic Wire Processing , 1989.;;Komax 33 Catalogue Sheet, 1988.",EXPIRED
15,KR,A,KR 20100014707 A,169-038-444-861-50X,2010-02-10,2010,KR 20097020476 A,2008-03-28,US 69769507 A,2007-04-06,METHOD AND SYSTEM FOR DISTRIBUTING GAS FOR A BEVEL EDGE ETCHER,A plasma etch processing chamber configured to clean a bevel edge of a substrate is provided. The chamber includes a bottom edge electrode and a top edge electrode defined over the bottom edge electrode. The top edge electrode and the bottom edge electrode are configured to generate a cleaning plasma to clean the bevel edge of the substrate. The chamber includes a gas feed defined through a top surface of the processing chamber. The gas feed introduces a processing gas for striking the cleaning plasma at a location in the processing chamber that is between an axis of the substrate and the top edge electrode. A pump out port is defined through the top surface of the chamber and the pump out port located along a center axis of the substrate. A method for cleaning a bevel edge of a substrate is also provided.,LAM RES CORP,SEXTON GREG;;BAILEY ANDREW III;;SCHOEP ALAN,,https://lens.org/169-038-444-861-50X,Patent Application,no,0,0,10,10,0,B08B7/0035;;B08B7/0035;;H01L21/02087;;H01L21/02087;;H01L21/3065;;H01J37/32009;;H01J37/32009;;H01J37/3244;;H01J37/3244;;H01J37/32706;;H01J37/32706;;Y10S134/902;;Y10S134/902,H01L21/3065,,0,0,,,,ACTIVE
16,CN,A,CN 101675503 A,026-567-823-239-559,2010-03-17,2010,CN 200880011086 A,2008-03-28,US 2008/0058790 W;;US 69769507 A,2007-04-06,Method and system for distributing gas for a bevel edge etcher,A plasma etch processing chamber configured to clean a bevel edge of a substrate is provided. The chamber includes a bottom edge electrode and a top edge electrode defined over the bottom edge electrode. The top edge electrode and the bottom edge electrode are configured to generate a cleaning plasma to clean the bevel edge of the substrate. The chamber includes a gas feed defined through a top surface of the processing chamber. The gas feed introduces a processing gas for striking the cleaning plasma at a location in the processing chamber that is between an axis of the substrate and the topedge electrode. A pump out port is defined through the top surface of the chamber and the pump out port located along a center axis of the substrate. A method for cleaning a bevel edge of a substrateis also provided.,LAM RES CORP,GREG SEXTON;;ANDREW BAILEY III;;ALAN SCHOEP,,https://lens.org/026-567-823-239-559,Patent Application,no,0,1,10,10,0,B08B7/0035;;B08B7/0035;;H01L21/02087;;H01L21/02087;;H01L21/3065;;H01J37/32009;;H01J37/32009;;H01J37/3244;;H01J37/3244;;H01J37/32706;;H01J37/32706;;Y10S134/902;;Y10S134/902,H01L21/306,,0,0,,,,DISCONTINUED
17,US,A1,US 2001/0000354 A1,092-861-182-497-312,2001-04-19,2001,US 73382700 A,2000-12-11,US 73382700 A;;US 51057600 A;;US 2295493 A;;US 76598691 A,1991-09-26,"Wire marking, cutting and stripping apparatus and method","
   A system for marking elongated wire and for cutting the wire and stripping insulation therefrom comprising first structure operable to mark the wire; second structure operable to cut the marked wire and to strip insulation from the wire; the wire extending between and movable between the first and second structures, the first and second structure comprising separate stand-alone devices; and control structure, including external computer means, operatively connected with the first and second structures for controlling operation of the first and second structures in time sequence relation to wire movement therebetween, and/or to control wire marking, wire cutting, and insulation stripping length. 
",NAZERIAN GREG;;BAILEY RONALD;;HOFFA JACK L.,NAZERIAN GREG;;BAILEY RONALD;;HOFFA JACK L,,https://lens.org/092-861-182-497-312,Patent Application,yes,0,8,4,38,0,H02G1/1256;;H02G1/1256;;Y10T29/49117;;Y10T29/49117;;Y10T29/5193;;Y10T29/5193;;Y10T29/53209;;Y10T29/53209,H02G1/12,700/114;;X029;;700/125;;700/167,0,0,,,,DISCONTINUED
18,US,B2,US 8475624 B2,059-324-508-423-330,2013-07-02,2013,US 69769507 A,2007-04-06,US 69769507 A;;US 23732705 A;;US 44056106 A,2005-09-27,Method and system for distributing gas for a bevel edge etcher,A plasma etch processing chamber configured to clean a bevel edge of a substrate is provided. The chamber includes a bottom edge electrode and a top edge electrode defined over the bottom edge electrode. The top edge electrode and the bottom edge electrode are configured to generate a cleaning plasma to clean the bevel edge of the substrate. The chamber includes a gas feed defined through a top surface of the processing chamber. The gas feed introduces a processing gas for striking the cleaning plasma at a location in the processing chamber that is between an axis of the substrate and the top edge electrode. A pump out port is defined through the top surface of the chamber and the pump out port located along a center axis of the substrate. A method for cleaning a bevel edge of a substrate is also provided.,SEXTON GREG;;BAILEY III ANDREW;;SCHOEN ALAN;;LAM RES CORP,SEXTON GREG;;BAILEY III ANDREW;;SCHOEN ALAN,LAM RESEARCH CORPORATION (2007-03-30),https://lens.org/059-324-508-423-330,Granted Patent,yes,10,3,10,10,0,B08B7/0035;;B08B7/0035;;H01L21/02087;;H01L21/02087;;H01L21/3065;;H01J37/32009;;H01J37/32009;;H01J37/3244;;H01J37/3244;;H01J37/32706;;H01J37/32706;;Y10S134/902;;Y10S134/902,C23F1/00;;B44C1/22;;C03C15/00;;C03C25/68;;H01L21/306,156/345.3;;156/345.43;;216/67,0,0,,,,ACTIVE
