"#",Jurisdiction,Kind,Display Key,Lens ID,Publication Date,Publication Year,Application Number,Application Date,Priority Numbers,Earliest Priority Date,Title,Abstract,Applicants,Inventors,Owners,URL,Document Type,Has Full Text,Cites Patent Count,Cited by Patent Count,Simple Family Size,Extended Family Size,Sequence Count,CPC Classifications,IPCR Classifications,US Classifications,NPL Citation Count,NPL Resolved Citation Count,NPL Resolved Lens ID(s),NPL Resolved External ID(s),NPL Citations,Legal Status
1,US,A,US 4084802 A,086-527-792-030-268,1978-04-18,1978,US 81363077 A,1977-07-07,US 81363077 A,1977-07-07,Picture frame vise,"A motor driven picture framing vise mounts a pair of finger tip control buttons on the vise table convenient to the operator for locking and releasing the vise. A post and support arrangement provides adjustable vertical positioning of the vise table and swinging of the table around horizontal and vertical axes suited to particular picture framing operations. Interchangeable wedges allow various frame angles, e.g., rectangular, hexagonal and octagonal, to be joined and railing adjustments enable a wide latitude in thickness of the framing being joined.",CANNON HAROLD LEE,CANNON HAROLD LEE,,https://lens.org/086-527-792-030-268,Granted Patent,yes,5,5,1,1,0,B25B5/142;;B25B5/142,B25B5/14,269/41,0,0,,,,EXPIRED
2,DE,C,DE 912528 C,180-022-042-555-691,1954-05-31,1954,DE B0019429 A,1952-03-11,DE B0019429 A,1952-03-11,Fluglageanzeigevorrichtung in einem Hubschrauber,,BELL AIRCRAFT CORP,CANNON JOSEPH ALAN;;FLETCHER HAROLD KING,,https://lens.org/180-022-042-555-691,Granted Patent,no,0,0,1,1,0,G05D1/0858,G05D1/08,,0,0,,,,EXPIRED
3,US,A,US 2702169 A,000-374-043-898-823,1955-02-15,1955,US 16679850 A,1950-06-08,US 16679850 A,1950-06-08,Helicopter rotor attitude indicating system,,BELL AIRCRAFT CORP,CANNON JOSEPH A;;FLETCHER HAROLD K,,https://lens.org/000-374-043-898-823,Granted Patent,no,5,3,1,1,0,G05D1/0858;;G05D1/0858,G05D1/08,,0,0,,,,EXPIRED
4,CA,A,CA 526474 A,077-416-970-014-116,1956-06-19,1956,CA 526474D A,,CA 526474T A,,HELICOPTER FLIGHT CONTROL AND INSTRUMENT,,BELL AIRCRAFT CORP,CANNON JOSEPH A;;FLETCHER HAROLD K,,https://lens.org/077-416-970-014-116,Granted Patent,no,0,0,1,1,0,,,,0,0,,,,EXPIRED
5,US,A,US 3492486 A,102-960-628-297-636,1970-01-27,1970,US 3492486D A,1966-05-02,US 54690166 A,1966-05-02,FILM COMPARATOR,,HAROLD W BISCHOFF;;JAMES H CANNON,BISCHOFF HAROLD W;;CANNON JAMES H,,https://lens.org/102-960-628-297-636,Granted Patent,no,4,19,1,1,0,G02B7/36;;A61B6/08;;A61B6/00;;G02B7/36,G01J1/36,250/204,0,0,,,,EXPIRED
6,US,A,US 2194174 A,129-765-483-147-704,1940-03-19,1940,US 22833238 A,1938-09-03,GB 2423037 A,1937-09-04,Electrical remote control system,,RCA CORP,HUGHES WASSELL HAROLD JOSEPH;;HERBERT CANNON FRANK,,https://lens.org/129-765-483-147-704,Granted Patent,no,0,1,3,3,0,H03J5/20;;H03J5/20,H03J5/20,,0,0,,,,EXPIRED
7,CA,A,CA 404067 A,049-922-513-953-106,1942-04-14,1942,CA 404067D A,,CA 404067T A,,ELECTRIC REMOTE CONTROL SYSTEM,,MARCONI CO CANADA,CANNON FRANK HERBERT;;WASSELL HAROLD JOSEPH HUGHES,,https://lens.org/049-922-513-953-106,Granted Patent,no,0,0,1,1,0,,,,0,0,,,,EXPIRED
8,US,A,US 2620477 A,155-167-388-284-885,1952-12-09,1952,US 14423650 A,1950-02-15,US 14423650 A,1950-02-15,Rainwear,,ACKERMAN JR HAROLD B;;CANNON CULBERTSON BEATRICE,ACKERMAN JR HAROLD B;;CANNON CULBERTSON BEATRICE,,https://lens.org/155-167-388-284-885,Granted Patent,no,8,7,1,1,0,A41D3/08;;A41D3/08,A41D3/08,,0,0,,,,EXPIRED
9,CA,C,CA 2843706 C,006-193-753-938-610,2015-02-17,2015,CA 2843706 A,2014-02-24,US 201313835694 A,2013-03-15,APPARATUS AND METHOD USING ELECTROMAGNETIC RADIATION FOR STUNNING ANIMALS TO BE SLAUGHTERED,A method of stunning an animal for slaughter is provided. The method includes directing a first portion of electromagnetic radiation in a first side of the animal's head and directing a second portion of the electromagnetic radiation in a second side of the animal's head such that the first portion and second portion of the electromagnetic radiation achieve constructive interfere at a focal point within the animal's head.,HORMEL FOOD CORP,SUMMERFIELD JOHN W;;CANNON JERRY E;;KIMREY HAROLD D,,https://lens.org/006-193-753-938-610,Granted Patent,no,0,0,7,7,0,A22B3/06;;A22B3/06,H05C1/02;;A22B3/06,,0,0,,,,INACTIVE
10,MX,A,MX 2014003222 A,033-266-701-228-32X,2014-11-20,2014,MX 2014003222 A,2014-03-14,US 201313835694 A,2013-03-15,APPARATUS AND METHOD USING ELECTROMAGNETIC RADIATION FOR STUNNING ANIMALS TO BE SLAUGHTERED.,A method of stunning an animal for slaughter is provided. The method includes directing a first portion of electromagnetic radiation in a first side of the animals head and directing a second portion of the electromagnetic radiation in a second side of the animals head such that the first portion and second portion of the electromagnetic radiation achieve constructive interfere at a focal point within the animal's head.,HORMEL FOOD CORP,SUMMERFIELD JOHN W;;CANNON JERRY E;;KIMREY HAROLD D,,https://lens.org/033-266-701-228-32X,Patent Application,no,0,0,7,7,0,A22B3/06;;A22B3/06,H05C1/00;;A22B3/06,,0,0,,,,DISCONTINUED
11,BR,A2,BR 102014005792 A2,032-906-649-852-761,2014-10-21,2014,BR 102014005792 A,2014-03-13,US 201313835694 A,2013-03-15,APARELHO E MÉTODO USANDO RADIAÇÃO ELETROMAGNÉTICA PARA ATORDOAR ANIMAIS A SEREM ABATIDOS,"RESUMO Patente de Invenção: ""APARELHO E MÉTODO USANDO RADIAÇÃO ELETROMAGNÉTICA PARA ATORDOAR ANIMAIS A SEREM ABATIDOS"". A presenten invenção refere-se a um método de atordoar um animal para abate que é proporcionado. O método compreende direcionar uma primeira porção de radiação eletromagnética para um primeiro lado da cabeça do animal e direcionar uma segunda porção da radiação eletromagnética para um segundo lado da cabeça do animal de tal modo que a primeira porção e a segunda porção da radiação eletromagnética realizem a interferência construtiva em um ponto focal dentro da cabeça do animal. 20711232v2",HORMEL FOOD CORP,SUMMERFIELD JOHN W;;CANNON JERRY E;;KIMREY HAROLD D,,https://lens.org/032-906-649-852-761,Patent Application,no,0,0,7,7,0,A22B3/06;;A22B3/06,A22B3/06;;H05C1/00,,0,0,,,,DISCONTINUED
12,CN,A,CN 104041563 A,089-342-006-532-85X,2014-09-17,2014,CN 201410092985 A,2014-03-13,US 201313835694 A,2013-03-15,APPARATUS AND METHOD USING ELECTROMAGNETIC RADIATION FOR STUNNING ANIMALS TO BE SLAUGHTERED,A method of stunning an animal for slaughter is provided. The method includes directing a first portion of electromagnetic radiation in a first side of the animal's head and directing a second portion of the electromagnetic radiation in a second side of the animal's head such that the first portion and second portion of the electromagnetic radiation achieve constructive interfere at a focal point within the animal's head.,HORMEL FOOD CORP,SUMMERFIELD JOHN W;;CANNON JERRY E;;KIMREY HAROLD D,,https://lens.org/089-342-006-532-85X,Patent Application,no,1,0,7,7,0,A22B3/06;;A22B3/06,A22B3/06,,0,0,,,,INACTIVE
13,CA,A1,CA 2843706 A1,130-773-214-762-317,2014-06-11,2014,CA 2843706 A,2014-02-24,US 201313835694 A,2013-03-15,APPARATUS AND METHOD USING ELECTROMAGNETIC RADIATION FOR STUNNING ANIMALS TO BE SLAUGHTERED,A method of stunning an animal for slaughter is provided. The method includes directing a first portion of electromagnetic radiation in a first side of the animal's head and directing a second portion of the electromagnetic radiation in a second side of the animal's head such that the first portion and second portion of the electromagnetic radiation achieve constructive interfere at a focal point within the animal's head.,HORMEL FOOD CORP,SUMMERFIELD JOHN W;;CANNON JERRY E;;KIMREY HAROLD D,,https://lens.org/130-773-214-762-317,Patent Application,no,0,0,7,7,0,A22B3/06;;A22B3/06,H05C1/02;;A22B3/06,,0,0,,,,INACTIVE
14,US,B1,US 8568207 B1,140-605-381-369-491,2013-10-29,2013,US 201313835694 A,2013-03-15,US 201313835694 A,2013-03-15,Apparatus and method using electromagnetic radiation for stunning animals to be slaughtered,A method of stunning an animal for slaughter is provided. The method includes directing a first portion of electromagnetic radiation in a first side of the animals head and directing a second portion of the electromagnetic radiation in a second side of the animals head such that the first portion and second portion of the electromagnetic radiation achieve constructive interfere at a focal point within the animal's head.,HORMEL FOOD CORP,SUMMERFIELD JOHN W;;CANNON JERRY E;;KIMREY HAROLD D,HORMEL FOODS CORPORATION (2013-03-15),https://lens.org/140-605-381-369-491,Granted Patent,yes,14,4,7,7,0,A22B3/06;;A22B3/06,A22B3/06,452/58,7,6,103-681-510-314-482;;014-755-970-935-59X;;050-202-969-730-656;;000-192-193-522-269;;010-382-242-678-236;;118-867-481-778-009,10.1029/rs017i05sp0169s;;10.1080/16070658.1977.11689039;;200753;;5594;;10.1080/16070658.1977.11689055;;210282;;10.1111/j.1748-1716.1976.tb10315.x;;998280;;10.1111/j.1749-6632.1975.tb36025.x;;1054251,"Guy, Arthur W. et al. ""Effects of high-intensity microwave pulse exposure of rat brain"" Bioelectromagnetics Research Laboratory, Department of Rehabilitation Medicine University of Washington School of Medicine, Seattle, Washington. 1982. American Geophysical Union. Paper No. ISO050. p. 169S-178S.;;Merritt, J.H. et al. ""Microwave Fixation of Brain Tissue as a Neurochemical Technique-A Review."" Journal of Microwave Power. 1977 by IMPI, Edmonton, Canada. vol. 12, No. 2. p. 133-139.;;Modak, Arvind T. et al. ""Use of 300-MSEC Microwave Irradiation for Enzyme Inactivation: A Study of Effects of Sodium Pentobarbital on Acetylcholine Concentration in Mouse Brain Regions"" The Journal of Pharmacology and Experimental Therapeutics. 1976 by The Williams & Wilkins Co. vol. 197, No. 2. p. 245-252.;;Moroji T. et al. ""Rapid Microwave Fixation of Rat Brain"" Journal of Microwave Power. 1977 by IMPI, Edmonton, Canada. vol. 12, No. 4. p. 273-286.;;Nordberg A. et al. ""Biosynthesis of Acetylcholine in Different Brain Regions in vivo Following Alternative Methods of Sacrifice by Microwave Irradiation"" Acta Physiologica Scandinavica. 1976. vol. 98, Issue 3. p. 307-317.;;Phillips, Richard D. et al. ""Field Measurements, Absorbed Dose, and Biologic Dosimetry of Microwaves."" Biology Department Battelle, Pacific Northwest Laboratories, Richland, Washington. Annals New York Academy of Sciences: Exposure Arrangements. Date unknown. p. 499-509.;;Stavinoha, W. B. et al. ""Microwave Irradiation for Brain Enzyme Inactivation: Import of Power Distribution."" Federation of American Societies for Experimental Biology, Abstracts of Papers. 63rd Annual Meeting Dallas, Texas Apr. 1-10, 1979. 2 pages.",INACTIVE
15,US,A1,US 2013/0191895 A1,131-900-024-982-752,2013-07-25,2013,US 201213356461 A,2012-01-23,US 201213356461 A,2012-01-23,Recovery of Information from Commercial Web Portals,"Novel tools and techniques for automated recovery of information from commercial web portals, including commercial web portals requiring credentials for access. In some instances images are captured and pushed to external processes for improving system performance. In some instances access to automated software agent remote control modules is balanced across a system comprising a plurality of processors hosting the automated software agent remote control modules. Some instances provide provisioning of credentials, in particular indicating credentials available for an unlimited or a select limited number of users and monitoring credential use of those credentials usable by a select number of users. Some instances provide cache management optimizes retrieval of data by external processes and ensures reliability of such data to reduce unnecessary web portal inquiries.",MAGEE JOHN L;;CANNON DAVID;;OMTVEDT DARIN;;LARIVEE ROBERT;;HARPER CORY;;PISKIEL HAROLD;;RECONDO TECHNOLOGY INC,MAGEE JOHN L;;CANNON DAVID;;OMTVEDT DARIN;;LARIVEE ROBERT;;HARPER CORY;;PISKIEL HAROLD,RECONDO TECHNOLOGY INC (2012-02-15);;WAYSTAR INC (2020-12-17),https://lens.org/131-900-024-982-752,Patent Application,yes,3,6,4,4,0,G06F21/33;;G06F21/6218;;G06F16/951;;G06Q40/08;;G06F16/951;;G06F21/6218;;G06F21/33;;H04L47/125;;G06Q40/08,G06F21/00,726/6,3,2,144-956-964-875-046;;151-257-142-018-433,10.1145/1147403.1147413;;10.1109/2.485845,"Daniel Moser, Design and implementation of a runtime deadlock detection mechanism for SCOOP, 2005, Department of Computer Science, ETH Zurich, pages 1-32;;Agarwal et al., Run-Time Detection of Potential Deadlocks for Programs with Locks, Semaphores, and Condition Variables, 2006, PADTAD-IV, July, 2006, Portland, Maine, USA, ACM 1-59593-263-1/06/0007, pages 51-59;;Sandhu et al., Role-Based Access Control Models, 1996, IEEE Computer, Volume 29, Number 2, pages 38-47",ACTIVE
16,GB,A,GB 1170749 A,001-640-548-111-657,1969-11-12,1969,GB 5233265 A,1965-12-09,GB 5233165 A,1965-12-09,A Process and Apparatus for Making a Yarn and the Yarn so made,"1,170,749. Looped multifilament yarns. IMPERIAL CHEMICAL INDUSTRIES Ltd. 8 Dec., 1966 [9 Dec., 1965 (2)], Nos. 52331/65 and 52332/65. Heading DID, D1F, DIN and D1W. The method of producing a continuous filament yarn described in Specification 1,046,197 -in which freshly extruded filaments are forwarded by a fluid jet to a hollow, rotating body and a yarn comprising an assembly of serially connected loops is withdrawn therefrom-is modified by withdrawing the yarn through a stationary tube to reduce the number of loops in the peripheral region and cause the peripheral loops to extend substantially parallel to the yarn. The yarn may be withdrawn from the hollow body through the base thereof as in Specification 1,046,197, with the tube extending into the base, or from the top of the body with the serially-connected loops being everted.",ICI LTD,SELWOOD ALAN;;STANISTREET HAROLD PETER;;CANNON CYRIL GEORGE;;WILLIAMS ROY ALAN;;DAVIES BARRIE LINTON,,https://lens.org/001-640-548-111-657,Granted Patent,no,0,1,1,1,0,D01D7/02,D01D7/00,D1D D2H3          D2H;;D1F FX            -;;D1F F43A          F40/;;D1F F43C          F40/;;D1F F43D          F40/;;D1N N2B7          -;;D1W W1            -;;D1W W5            -;;D1W W7A           -,0,0,,,,EXPIRED
17,EP,A1,EP 0807114 A1,092-509-214-284-002,1997-11-19,1997,EP 96904563 A,1996-02-02,US 9601506 W;;US 38281895 A,1995-02-03,BRIDGED INDOLES AS MATRIX METALLOPROTEASE INHIBITORS,,SYNTEX INC,CASTELHANO ARLINDO L;;LIAK TENG J;;HORNE STEPHEN;;YUAN ZHENGYU;;KRANTZ ALEXANDER;;CHEN JIAN JEFFREY;;VAN WART HAROLD;;CANNON PAUL D,SYNTEX (U.S.A.) LLC (2001-08-29);;ROCHE PALO ALTO LLC (2003-08-27),https://lens.org/092-509-214-284-002,Patent Application,yes,0,0,26,60,0,C07D487/04;;C07D487/08;;C07F9/6561;;A61P1/02;;A61P17/02;;A61P19/02;;A61P19/10;;A61P29/00;;A61P3/14;;A61P35/00;;A61P43/00;;C07D487/04;;C07D487/08;;C07F9/6561,A61K31/40;;A61K31/437;;A61K31/66;;A61P1/02;;A61P3/14;;A61P19/10;;A61P29/00;;A61P35/00;;A61P43/00;;C07D487/04;;C07D487/08;;C07D498/08;;C07F9/30;;C07F9/645;;C07F9/6561,,0,0,,,,DISCONTINUED
18,FI,B,FI 113965 B,147-526-987-541-267,2004-07-15,2004,FI 973198 A,1997-08-01,US 38281895 A;;US 9601506 W,1995-02-03,"8-okso-4-oksa-1,7-diatsatrisyklo-oktadekatetraen-9-yylikarbamoyylijohdannaiset matriisimetalloproteaasi-inhibiittoreina",,SYNTEX INC,CASTELHANO ARLINDO L;;LIAK TENG J;;HORNE STEPHEN;;YUAN ZHENGYO;;KRANTZ ALEXANDER;;CHEN JIAN JEFFREY;;VAN WART HAROLD;;CANNON PAUL D,,https://lens.org/147-526-987-541-267,Patent Application,no,0,0,26,60,0,C07D487/04;;C07D487/08;;C07F9/6561;;A61P1/02;;A61P17/02;;A61P19/02;;A61P19/10;;A61P29/00;;A61P3/14;;A61P35/00;;A61P43/00;;C07D487/04;;C07D487/08;;C07F9/6561,A61K31/40;;A61K31/437;;A61K31/66;;A61P1/02;;A61P3/14;;A61P19/10;;A61P29/00;;A61P35/00;;A61P43/00;;C07D487/04;;C07D487/08;;C07D498/08;;C07F9/30;;C07F9/645;;C07F9/6561,,0,0,,,,DISCONTINUED
19,ZA,B,ZA 96850 B,193-948-155-255-821,1997-11-03,1997,ZA 96850 A,1996-02-02,US 38281895 A,1995-02-03,Matrix metalloprotease inhibitors.,,SYNTEX INC,HORNE STEPHEN;;KRANTZ ALEXANDER;;WART HAROLD VAN;;CASTELHANO ARLINDO L;;LIAK TENG J;;YUAN ZHENGYO;;CHEN JIAN JEFFREY;;CANNON PAUL D,,https://lens.org/193-948-155-255-821,Granted Patent,no,0,0,26,60,0,C07D487/04;;C07D487/08;;C07F9/6561;;A61P1/02;;A61P17/02;;A61P19/02;;A61P19/10;;A61P29/00;;A61P3/14;;A61P35/00;;A61P43/00;;C07D487/04;;C07D487/08;;C07F9/6561,A61K31/40;;A61K31/437;;A61K31/66;;A61P1/02;;A61P3/14;;A61P19/10;;A61P29/00;;A61P35/00;;A61P43/00;;C07D487/04;;C07D487/08;;C07D498/08;;C07F9/30;;C07F9/645;;C07F9/6561,,0,0,,,,EXPIRED
20,HU,A2,HU P9702073 A2,179-996-167-105-395,1998-03-30,1998,HU P9702073 A,1996-02-02,US 38281895 A,1995-02-03,"LACTAM BOND CONTAINING BRIDGED ACYLAMINOINDOLE DERIVATIVES, PROCESS FOR THEIR PREPARATION AND PHARMACEUTICAL COMPOSITIONS THEREOF","A találmány tárgyát (I) általánős képletű vegyületek, gyógyászatilagelfőgadhat sóik, az előállításűkra szőlgáló eljárás és a hatóanyagkéntezeket tartalmazó gyógyszerkészítmények képezik. A képletben m értéket 2-6, n értéke 0-4, A jelentése -CH2-, -O- vagy -N(R11)- általánős képletű csőpőrt, ebbenR11 jelentése hidrőgénatőm vagy alkilcsőpőrt, vagy A jelentése -CH(R12)- átalánős képletű csőpőrt, ebben R12 jelentésekarbőxil-, vagy alkőxi-karbőnil-csőpőrt, vagy adőtt esetbenhelyettesített karbamőilcsőpőrt, R1 jelentése a) -CH2-R4 általánős képletű csőpőrt, ebben R4 jelentése merkaptő-,acetil-tiő-, karbőxil-, aminő-karbőnil-, N-hidrőxi-főrmil-aminő-,alkőxi-karbőnil-, aril-őxi-karbőnil-, aralkőxi-karbőnil-, benzil-őxi-aminő-karbőnil- vagy általánős képletű csőpőrt, ebben R6 jelentése adőtt esetbenhelyettesített arilcsőpőrt, b) -CH(R7)-R8 általánős képletű csőpőrt, ebbben R7 hidrőgénatőm alkil-,hidrőxil-, aminő-, helyettesített aminő-, alkőxi-karbőnil-, aminő-karbőnil-, aralkil- vagy karbőxilcsőpőrt, vagy R7 jelentésehelyettesített -CH2NH2 csőpőrt, és R8 jelentése karbőxil-, hidrőxi-aminő-karbőnil-, alkőxi-karbőnil- vagy aralkőxi-karbőnil-csőpőrt, vagy c) -NH-CH(R9)-R10 általánős képletű csőpőrt, ebben R9 jelentésehidrőgénatőm, alkil- vagy aralkilcsőpőrt, és R10 jelentése karbőxil-,alkőxi-karbőnil- vagy aralkőxi-karbőnil-, főszfőnil-, dialkil-főszfőnil- vagy metőxi-főszfőnil-csőpőrt, R2 jelentése alkil-, alkenil-, triflűőr-metil-alkil-, ciklőalkil-,ciklőalkil-alkil-, hidrőxi-alkil-, alkőxi-alkil-, aralkőxi-alkil-,aril-, aril-őxi-alkil- vagy aralkilcsőpőrt, és R3 jelentése hidrőgénatőm, hidrőxilcsőpőrt, halőgénatőm, alkil-, alkőxi-vagy aralkőxicsőpőrt. A vegyületek az interstcíiális kőllagenázőkat gátőllják, és gyó-gyászati készítmények hatóanyagként ízületi bántalmak és ősztepőróziskezelésére használhatók. ŕ",SYNTEX INC,CANNON PAUL D;;CASTELHANO ARLINDO L;;CHEN JIAN JEFFREY;;HORNE STEPHEN;;KRANTZ ALEXANDER;;LIAK TENG J;;YUAN ZHENGYU;;VAN WART HAROLD,,https://lens.org/179-996-167-105-395,Patent Application,no,0,0,26,60,0,C07D487/04;;C07D487/08;;C07F9/6561;;A61P1/02;;A61P17/02;;A61P19/02;;A61P19/10;;A61P29/00;;A61P3/14;;A61P35/00;;A61P43/00;;C07D487/04;;C07D487/08;;C07F9/6561,A61K31/40;;A61K31/437;;A61K31/66;;A61P1/02;;A61P3/14;;A61P19/10;;A61P29/00;;A61P35/00;;A61P43/00;;C07D487/04;;C07D487/08;;C07D498/08;;C07F9/30;;C07F9/645;;C07F9/6561,,0,0,,,,PENDING
21,FI,A0,FI 973198 A0,144-735-013-230-50X,1997-08-01,1997,FI 973198 A,1997-08-01,US 38281895 A;;US 9601506 W,1995-02-03,Silloitetut indolit matriisimetalloproteaasi-inhibiittoreina,,SYNTEX INC,CASTELHANO ARLINDO L;;LIAK TENG J;;HORNE STEPHEN;;YUAN ZHENGYO;;KRANTZ ALEXANDER;;CHEN JIAN JEFFREY;;VAN WART HAROLD;;CANNON PAUL D,,https://lens.org/144-735-013-230-50X,Patent Application,no,0,0,26,60,0,C07D487/04;;C07D487/08;;C07F9/6561;;A61P1/02;;A61P17/02;;A61P19/02;;A61P19/10;;A61P29/00;;A61P3/14;;A61P35/00;;A61P43/00;;C07D487/04;;C07D487/08;;C07F9/6561,A61K31/40;;A61K31/437;;A61K31/66;;A61P1/02;;A61P3/14;;A61P19/10;;A61P29/00;;A61P35/00;;A61P43/00;;C07D487/04;;C07D487/08;;C07D498/08;;C07F9/30;;C07F9/645;;C07F9/6561,,0,0,,,,DISCONTINUED
22,AU,A,AU 1996/048636 A,065-371-180-389-683,1996-08-21,1996,AU 1996/048636 A,1996-02-02,US 38281895 A;;US 9601506 W,1995-02-03,Bridged indoles as matrix metalloprotease inhibitors,,SYNTEX INC,CASTELHANO ARLINDO L;;LIAK TENG J;;HORNE STEPHEN;;YUAN ZHENGYU;;KRANTZ ALEXANDER;;CHEN JIAN JEFFREY;;WART HAROLD VAN;;CANNON PAUL D,,https://lens.org/065-371-180-389-683,Patent Application,no,0,0,26,60,0,C07D487/04;;C07D487/08;;C07F9/6561;;A61P1/02;;A61P17/02;;A61P19/02;;A61P19/10;;A61P29/00;;A61P3/14;;A61P35/00;;A61P43/00;;C07D487/04;;C07D487/08;;C07F9/6561,A61K31/40;;A61K31/437;;A61K31/66;;A61P1/02;;A61P3/14;;A61P19/10;;A61P29/00;;A61P35/00;;A61P43/00;;C07D487/04;;C07D487/08;;C07D498/08;;C07F9/30;;C07F9/645;;C07F9/6561,,0,0,,,,EXPIRED
23,CA,A1,CA 2212236 A1,082-229-718-918-997,1996-08-08,1996,CA 2212236 A,1996-02-02,US 38281895 A,1995-02-03,BRIDGED INDOLES AS MATRIX METALLOPROTEASE INHIBITORS,"Compounds of formula (I) as single stereoisomers or mixtures thereof and their pharmaceutically acceptable salts inhibit matrix metalloproteases, such as interstitial collagenases, and are useful in the treatment of mammals having disease states alleviated by the inhibition of such matrix metalloproteases, for example arthritic diseases or bone resorption diseases, such as osteoporosis.",SYNTEX INC,YUAN ZHENGYU;;CASTELHANO ARLINDO L;;CHEN JIAN JEFFREY;;LIAK J TENG;;VAN WART HAROLD;;HORNE STEPHEN;;CANNON PAUL D;;KRANTZ ALEXANDER,,https://lens.org/082-229-718-918-997,Patent Application,no,0,0,26,60,0,C07D487/04;;C07D487/08;;C07F9/6561;;A61P1/02;;A61P17/02;;A61P19/02;;A61P19/10;;A61P29/00;;A61P3/14;;A61P35/00;;A61P43/00;;C07D487/04;;C07D487/08;;C07F9/6561,A61K31/40;;A61K31/437;;A61K31/66;;A61P1/02;;A61P3/14;;A61P19/10;;A61P29/00;;A61P35/00;;A61P43/00;;C07D487/04;;C07D487/08;;C07D498/08;;C07F9/30;;C07F9/645;;C07F9/6561,,0,0,,,,DISCONTINUED
24,BR,A,BR 9606998 A,007-201-880-014-879,1997-10-28,1997,BR 9606998 A,1996-02-02,US 38281895 A;;US 9601506 W,1995-02-03,Indóis ligados por ponte como inibidores de metaloprotease de matriz,,SYNTEX INC,CASTELHANO ARLINDO L;;LIAK TENG J;;HORNE STEPHEN;;YUAN ZHENGYO;;KRANTZ ALEXANDER;;CHEN JIAN JEFFREY;;WART HAROLD VAN;;CANNON PAUL D,,https://lens.org/007-201-880-014-879,Patent Application,no,0,0,26,60,0,C07D487/04;;C07D487/08;;C07F9/6561;;A61P1/02;;A61P17/02;;A61P19/02;;A61P19/10;;A61P29/00;;A61P3/14;;A61P35/00;;A61P43/00;;C07D487/04;;C07D487/08;;C07F9/6561,A61K31/40;;A61K31/437;;A61K31/66;;A61P1/02;;A61P3/14;;A61P19/10;;A61P29/00;;A61P35/00;;A61P43/00;;C07D487/04;;C07D487/08;;C07D498/08;;C07F9/30;;C07F9/645;;C07F9/6561,,0,0,,,,DISCONTINUED
25,NO,B1,NO 311257 B1,120-578-718-323-258,2001-11-05,2001,NO 973551 A,1997-08-01,US 38281895 A;;US 9601506 W,1995-02-03,"Indoler med brostruktur som matriksmetallproteaseinhibitorer, samt farmasöytiske preparater som omfatter dem","Forbindelser med formel (I) i form av enkle stereolsomerer eller blandinger derav og deres farmasøytisk akseptable salter, inhiberer matriksmetallproteaser, slik som interstitielle kollagenaser og er anvendelige ved behandling av pattedyr med sykdomstilstander som lindres ved inhibering av slike matriksmetallproteasér, f.eks. artritiske sykdommer eller benresorp-sjonssykdommer, slik som osteoporose.",SYNTEX INC,CASTELHANO ARLINDO L;;LIAK TENG J;;HORNE STEPHEN;;YUAN ZHENGYO;;KRANTZ ALEXANDER;;CHEN JIAN JEFFREY;;WART HAROLD VAN;;CANNON PAUL D,,https://lens.org/120-578-718-323-258,Granted Patent,no,0,0,26,60,0,C07D487/04;;C07D487/08;;C07F9/6561;;A61P1/02;;A61P17/02;;A61P19/02;;A61P19/10;;A61P29/00;;A61P3/14;;A61P35/00;;A61P43/00;;C07D487/04;;C07D487/08;;C07F9/6561,A61K31/40;;A61K31/437;;A61K31/66;;A61P1/02;;A61P3/14;;A61P19/10;;A61P29/00;;A61P35/00;;A61P43/00;;C07D487/04;;C07D487/08;;C07D498/08;;C07F9/30;;C07F9/645;;C07F9/6561,,0,0,,,,EXPIRED
26,PL,A1,PL 321659 A1,128-353-167-644-613,1997-12-22,1997,PL 32165996 A,1996-02-02,US 9601506 W;;US 38281895 A,1995-02-03,BIDGED INDOLES AS INHIBITORS OF MATRIX METALOPROTEASES,,SYNTEX INC,CASTELHANO ARLINDO L;;LIAK TENG J;;HORNE STEPHEN;;YUAN ZHENGYU;;KRANTZ ALEXANDER;;CHEN JIAN JEFFREY;;VAN WART HAROLD;;CANNON PAUL D,,https://lens.org/128-353-167-644-613,Patent Application,no,0,0,26,60,0,C07D487/04;;C07D487/08;;C07F9/6561;;A61P1/02;;A61P17/02;;A61P19/02;;A61P19/10;;A61P29/00;;A61P3/14;;A61P35/00;;A61P43/00;;C07D487/04;;C07D487/08;;C07F9/6561,A61K31/40;;A61K31/437;;A61K31/66;;A61P1/02;;A61P3/14;;A61P19/10;;A61P29/00;;A61P35/00;;A61P43/00;;C07D487/04;;C07D487/08;;C07D498/08;;C07F9/30;;C07F9/645;;C07F9/6561,,0,0,,,,PENDING
27,AU,B2,AU 705763 B2,132-187-373-951-749,1999-06-03,1999,AU 1996/048636 A,1996-02-02,US 38281895 A;;US 9601506 W,1995-02-03,Bridged indoles as matrix metalloprotease inhibitors,,SYNTEX INC,CASTELHANO ARLINDO L;;LIAK TENG J;;HORNE STEPHEN;;YUAN ZHENGYU;;KRANTZ ALEXANDER;;CHEN JIAN JEFFREY;;WART HAROLD VAN;;CANNON PAUL D,,https://lens.org/132-187-373-951-749,Granted Patent,no,1,0,26,60,0,C07D487/04;;C07D487/08;;C07F9/6561;;A61P1/02;;A61P17/02;;A61P19/02;;A61P19/10;;A61P29/00;;A61P3/14;;A61P35/00;;A61P43/00;;C07D487/04;;C07D487/08;;C07F9/6561,A61K31/40;;A61K31/437;;A61K31/66;;A61P1/02;;A61P3/14;;A61P19/10;;A61P29/00;;A61P35/00;;A61P43/00;;C07D487/04;;C07D487/08;;C07D498/08;;C07F9/30;;C07F9/645;;C07F9/6561,,0,0,,,,EXPIRED
