28,CZ,A3,CZ 243197 A3,151-699-595-720-872,1998-01-14,1998,CZ 243197 A,1996-02-02,US 38281895 A,1995-02-03,BRIDGED INDOLES AS INHIBITORS OF MATRIX METALLOPROTEASE,,SYNTEX INC,CASTELHANO ARLINDO L;;LIAK TENG J;;HORNE STEPHEN;;YUAN ZHENGYO;;KRANTZ ALEXANDER;;CHEN JIAN JEFFREY;;VAN WART HAROLD;;CANNON PAUL D,,https://lens.org/151-699-595-720-872,Patent Application,no,0,0,26,60,0,C07D487/04;;C07D487/08;;C07F9/6561;;A61P1/02;;A61P17/02;;A61P19/02;;A61P19/10;;A61P29/00;;A61P3/14;;A61P35/00;;A61P43/00;;C07D487/04;;C07D487/08;;C07F9/6561,A61K31/40;;A61K31/437;;A61K31/66;;A61P1/02;;A61P3/14;;A61P19/10;;A61P29/00;;A61P35/00;;A61P43/00;;C07D487/04;;C07D487/08;;C07D498/08;;C07F9/30;;C07F9/645;;C07F9/6561,,0,0,,,,EXPIRED
29,FI,A,FI 973198 A,030-609-377-287-725,1997-08-01,1997,FI 973198 A,1997-08-01,US 38281895 A;;US 9601506 W,1995-02-03,Silloitetut indolit matriisimetalloproteaasi-inhibiittoreina,,SYNTEX INC,CASTELHANO ARLINDO L;;LIAK TENG J;;HORNE STEPHEN;;YUAN ZHENGYO;;KRANTZ ALEXANDER;;CHEN JIAN JEFFREY;;VAN WART HAROLD;;CANNON PAUL D,,https://lens.org/030-609-377-287-725,Patent Application,no,0,0,26,60,0,C07D487/04;;C07D487/08;;C07F9/6561;;A61P1/02;;A61P17/02;;A61P19/02;;A61P19/10;;A61P29/00;;A61P3/14;;A61P35/00;;A61P43/00;;C07D487/04;;C07D487/08;;C07F9/6561,A61K31/40;;A61K31/437;;A61K31/66;;A61P1/02;;A61P3/14;;A61P19/10;;A61P29/00;;A61P35/00;;A61P43/00;;C07D487/04;;C07D487/08;;C07D498/08;;C07F9/30;;C07F9/645;;C07F9/6561,,0,0,,,,DISCONTINUED
30,CZ,B6,CZ 293868 B6,189-074-620-541-892,2004-08-18,2004,CZ 243197 A,1996-02-02,US 38281895 A,1995-02-03,Bridged indoles as matrix metalloprotease inhibitors,"In the present invention, there are disclosed compounds of the general formula I as single stereoisomers or mixtures thereof and their pharmaceutically acceptable salts. These compounds inhibit matrix metalloproteases, such as interstitial collagenases, and are useful in the treatment of mammals having disease states alleviated by the inhibition of such matrix metalloproteases, for example arthritic diseases or bone resorption diseases, such as osteoporosis.",SYNTEX INC,LIAK TENG J;;YUAN ZHENGYO;;KRANTZ ALEXANDER;;CHEN JIAN JEFFREY;;VAN WART HAROLD;;CANNON PAUL D;;CASTELHANO ARLINDO L;;HORNE STEPHEN,,https://lens.org/189-074-620-541-892,Granted Patent,no,0,0,26,60,0,C07D487/04;;C07D487/08;;C07F9/6561;;A61P1/02;;A61P17/02;;A61P19/02;;A61P19/10;;A61P29/00;;A61P3/14;;A61P35/00;;A61P43/00;;C07D487/04;;C07D487/08;;C07F9/6561,A61K31/40;;A61K31/437;;A61K31/66;;A61P1/02;;A61P3/14;;A61P19/10;;A61P29/00;;A61P35/00;;A61P43/00;;C07D487/04;;C07D487/08;;C07D498/08;;C07F9/30;;C07F9/645;;C07F9/6561,,0,0,,,,EXPIRED
31,NO,D0,NO 973551 D0,052-284-019-508-829,1997-08-01,1997,NO 973551 A,1997-08-01,US 38281895 A;;US 9601506 W,1995-02-03,Indoler med brostruktur som matriksmetallproteaseinhibitorer,,SYNTEX INC,CASTELHANO ARLINDO L;;LIAK TENG J;;HORNE STEPHEN;;YUAN ZHENGYO;;KRANTZ ALEXANDER;;CHEN JIAN JEFFREY;;WART HAROLD VAN;;CANNON PAUL D,,https://lens.org/052-284-019-508-829,Patent Application,no,0,0,26,60,0,C07D487/04;;C07D487/08;;C07F9/6561;;A61P1/02;;A61P17/02;;A61P19/02;;A61P19/10;;A61P29/00;;A61P3/14;;A61P35/00;;A61P43/00;;C07D487/04;;C07D487/08;;C07F9/6561,A61K31/40;;A61K31/437;;A61K31/66;;A61P1/02;;A61P3/14;;A61P19/10;;A61P29/00;;A61P35/00;;A61P43/00;;C07D487/04;;C07D487/08;;C07D498/08;;C07F9/30;;C07F9/645;;C07F9/6561,,0,0,,,,EXPIRED
32,NO,L,NO 973551 L,091-700-857-086-455,1997-10-03,1997,NO 973551 A,1997-08-01,US 38281895 A;;US 9601506 W,1995-02-03,Indoler med brostruktur som matriksmetallproteaseinhibitorer,,SYNTEX INC,CASTELHANO ARLINDO L;;LIAK TENG J;;HORNE STEPHEN;;YUAN ZHENGYO;;KRANTZ ALEXANDER;;CHEN JIAN JEFFREY;;WART HAROLD VAN;;CANNON PAUL D,,https://lens.org/091-700-857-086-455,Abstract,no,0,0,26,60,0,C07D487/04;;C07D487/08;;C07F9/6561;;A61P1/02;;A61P17/02;;A61P19/02;;A61P19/10;;A61P29/00;;A61P3/14;;A61P35/00;;A61P43/00;;C07D487/04;;C07D487/08;;C07F9/6561,A61K31/40;;A61K31/437;;A61K31/66;;A61P1/02;;A61P3/14;;A61P19/10;;A61P29/00;;A61P35/00;;A61P43/00;;C07D487/04;;C07D487/08;;C07D498/08;;C07F9/30;;C07F9/645;;C07F9/6561,,0,0,,,,EXPIRED
33,WO,A1,WO 1996/023791 A1,178-832-018-415-958,1996-08-08,1996,US 9601506 W,1996-02-02,US 38281895 A,1995-02-03,BRIDGED INDOLES AS MATRIX METALLOPROTEASE INHIBITORS,"Compounds of formula (I) as single stereoisomers or mixtures thereof and their pharmaceutically acceptable salts inhibit matrix metalloproteases, such as interstitial collagenases, and are useful in the treatment of mammals having disease states alleviated by the inhibition of such matrix metalloproteases, for example arthritic diseases or bone resorption diseases, such as osteoporosis.",SYNTEX INC,CASTELHANO ARLINDO L;;LIAK TENG J;;HORNE STEPHEN;;YUAN ZHENGYU;;KRANTZ ALEXANDER;;CHEN JIAN JEFFREY;;VAN WART HAROLD;;CANNON PAUL D,,https://lens.org/178-832-018-415-958,Patent Application,yes,4,17,26,60,0,C07D487/04;;C07D487/08;;C07F9/6561;;A61P1/02;;A61P17/02;;A61P19/02;;A61P19/10;;A61P29/00;;A61P3/14;;A61P35/00;;A61P43/00;;C07D487/04;;C07D487/08;;C07F9/6561,A61K31/40;;A61K31/437;;A61K31/66;;A61P1/02;;A61P3/14;;A61P19/10;;A61P29/00;;A61P35/00;;A61P43/00;;C07D487/04;;C07D487/08;;C07D498/08;;C07F9/30;;C07F9/645;;C07F9/6561,,1,0,,,"CHEMICAL ABSTRACTS, vol. 123, no. 13, 25 September 1995, Columbus, Ohio, US; abstract no. 160068q, A. L. CASTELHANO ET AL.: ""Novel indolactam-based inhibitors of matrix metalloproteinases"" page 24; XP002006091",PATENTED
