23,US,B1,US 6473794 B1,070-299-686-111-344,2002-10-29,2002,US 32113599 A,1999-05-27,US 32113599 A,1999-05-27,System for establishing plan to test components of web based framework by displaying pictorial representation and conveying indicia coded components of existing network framework,"
    A system, method, and article of manufacture are provided for planning the testing of components of an existing network framework. First, a pictorial representation of an existing network framework is displayed along with a plurality of components of the existing network framework. Thereafter, the components of the existing network framework are indicia coded in order to convey a plan by which the components of the existing network framework are to be tested. The components may be indicia coded in order to convey an order of the testing or which components of the existing network framework are to be tested. 
",ACCENTURE LLP,GUHEEN MICHAEL F;;MITCHELL JAMES D;;BARRESE JAMES J,ACCENTURE GLOBAL SERVICES LIMITED (2010-09-01);;ACCENTURE LLP (2001-01-02);;ACCENTURE GLOBAL SERVICES GMBH (2010-08-31),https://lens.org/070-299-686-111-344,Granted Patent,yes,22,1470,1,1,0,H04L41/22;;H04L43/50;;H04L67/34;;H04L67/75;;H04L41/22;;H04L43/50;;H04L67/34;;H04L9/40;;H04L67/75,H04L12/24;;H04L12/26;;H04L29/06;;H04L29/08,709/223;;709/224,35,0,,,"Paul Blake; Building Relationships with Your Web Customers; Information Today, vol. 15, No. 9, pp. 12-13; Oct. 1998.;;Portions of U.S. Ser. No. 09/321,492, ""A System, Method and Article of Manufacture for Providing Commerce-Related Web Application Services"", Attorney Docket No. M&G 8567.78US01, filed May 27, 1999, 9 pages.;;Portions of U.S. Ser. No. 09/320,819, ""A System, Method and Article of Manufacture for Providing Commerce-Related Web Application Services"", Attorney Docket No. M&G 8567.79US01, filed May 27, 1999, 8 pages.;;Portions of U.S. Ser. No. 09/321,280, ""A System, Method and Article of Manufacture for Providing Web Application Services to Manage Customer Relations"", Attorney Docket No. M&G 8567.80US01, filed May 27, 1999, 8 pages.;;Portions of U.S. Ser. No. 09/321,951, ""A System, Method and Article of Manufacture for Providing Content Management-Related Web Application Services"", Attorney Docket No. M&G 8567.81US01, filed May 27, 1999, 8 pages.;;Portions of U.S. Ser. No. 09/321,053, ""A System, Method and Article of Manufacture for Providing Education-Related Web Application Services"", Attorney Docket No. M&G 8567.82US01, filed May 27, 1999, 8 pages.;;Portions of U.S. Ser. No. 09/321,493, ""A System, Method and Article of Manufacture for Providing Customer Service-Related Web Application Services"", Attorney Docket No. M&G 8567.83US01, filed May 27, 1999, 8 pages.;;Portions of U.S. Ser. No. 09/321,359, ""A System, Method and Article of Manufacture for Providing Security Services in a Web Architecture Framework"", Attorney Docket No. M&G 8567.84US01, filed May 27, 1999, 8 pages.;;Portions of U.S. Ser. No. 09/321,949, ""A System, Method and Article of Manufacture for Providing Network Services in a Web Architecture Framework"", Attorney Docket No. M&G 8567.85US01, filed May 27, 1999, 9 pages.;;Portions of U.S. Ser. No. 09/321,953, ""A System, Method and Article of Manufacture for Providing Internet Services in a Web Architecture Framework"", Attorney Docket No. M&G 8567.86US01, filed May 27, 1999, 10 pages.;;Portions of U.S. Ser. No. 09/321,361, ""A System, Method and Article of Manufacture for Providing Client Services in a Web Architecture Framework"", Attorney Docket No. M&G 8567.87US01, filed May 27, 1999, 7 pages.;;Portions of U.S. Ser. No. 09/322,105, ""A System, Method and Article of Manufacture for Providing Data Services in a Web Architecture Framework"", Attorney Docket No. M&G 8567.88US01, filed May 27, 1999, 8 pages.;;Portions of U.S. Ser. No. 09/321,304, ""A System, Method and Article of Manufacture for Providing Integration Capabilities in a Web Architecture Framework"", Attorney Docket No. M&G 8567.89US01, filed May 27, 1999, 8 pages.;;Portions of U.S. Ser. No. 09/320,820, ""A System, Method and Article of Manufacture for Providing Multiple Capabilities in a Web Architecture Framework"", Attorney Docket No. M&G 8567.90US01, filed May 27, 1999, 8 pages.;;Portions of U.S. Ser. No. 09/321,052, ""A System, Method and Article of Manufacture for Providing Directory Services in a Web Architecture Framework"", Attorney Docket No. M&G 8567.91US01, filed May 27, 1999, 8 pages.;;Portions of U.S. Ser. No. 09/320,817, ""A System, Method and Article of Manufacture for Providing Management and Operations in a Web Architecture Framework"", Attorney Docket No. M&G 8567.92US01, filed May 27, 1999, 8 pages.;;Portions of U.S. Ser. No. 09/321,358, ""A System, Method and Article of Manufacture for Providing Developer Services in a Web Architecture Framework"", Attorney Docket No. M&G 8567.93US01, filed May 27, 1999, 8 pages.;;Portions of U.S. Ser. No. 09/321,495, ""Methods, Concepts and Technology for a Virtual Shopping System Capable of Assessing Needs of a Customer and Recommending a Product or Service Based on Such Assessed Needs"", Attorney Docket No. M&G 8567.94US01, filed May 27, 1999, 7 pages.;;Portions of U.S. Ser. No. 09/321,303, ""Methods, Concepts and Technology for a Virtual Shopping System Capable of Allowing a User to Customize Products/Services that are Available for Purchase"", Attorney Docket No. M&G 8567.95US01, filed May 27, 1999, 7 pages.;;Portions of U.S. Ser. No. 09/321,305, ""Methods, Concepts and Technology for a Virtual Shopping System Capable of Advertising Based on Products/Services that are Available for Purchase"", Attorney Docket No. M&G 8567.96US01, filed May 27, 1999, 7 pages.;;Portions of U.S. Ser. No. 09/321,514, ""Methods, Concepts and Technology for a Virtual Shopping System Capable of Selectively Determining Prices and Availability on Products/Services Based on a Profile of a Current User"", Attorney Docket No. M&G 8567.97US01, filed May 27, 1999, 7 pages.;;Portions of U.S. Ser. No. 09/321,134, ""Methods, Concepts and Technology for Curriculum Generation Based on a User Profile in an Internet Based Environment"", Attorney Docket No. M&G 8567.98US01, filed May 27, 1999, 7 pages.;;Portions of U.S. Ser. No. 09/321,954, ""Methods, Concepts and Technology for Proactive Service Delivery Based on a User Profile in an Internet Based Environment"", Attorney Docket No. M&G 8567.100US01, filed May 27, 1999, 7 pages.;;Portions of U.S. Ser. No. 09/321,273, ""Methods, Concepts and Technology for Dynamic Customer Profile Management"", Attorney Docket No. M&G 8567.101US01, filed May 27, 1999, 7 pages.;;Portions of U.S. Ser. No. 09/320,818, ""Methods, Concepts and Technology for Dynamic Comparison of Product Features and Customer Profile"", Attorney Docket No. M&G 8567.102US01, filed May 27, 1999, 7 pages.;;Portions of U.S. Ser. No. 09/321,952, ""A System, Method, and Article of Manufacture for Identification of Redundancies and Omissions Among Components of a Web Based Architecture"", Attorney Docket No. M&G 8567.103US01, filed May 27, 1999, 8 pages.;;Portions of U.S. Ser. No. 09/321,136, ""A System, Method, and Article of Manufacture for Effectively Conveying Which Components of a System are Required for Implementation of Technology"", Attorney Docket No. M&G 8567.104US01, filed May 27, 1999, 8 pages.;;Portions of U.S. Ser. No. 09/321,274, ""A System, Method, and Article of Manufacture for Prioritizing Components of a Network Framework Required for Implementation of Technology"", Attorney Docket No. M&G 8567.105US01, filed May 27, 1999, 9 pages.;;Portions of U.S. Ser. No. 09/321,360, ""A System, Method, and Article of Manufacture for Phase Delivery of Components of a System Required for Implementation of Technology"", Attorney Docket No. M&G 8567.106US01, filed May 27, 1999, 8 pages.;;Portions of U.S. Ser. No. 09/321,279, ""A System, Method, and Article of Manufacture for Comparatively Analyzing Vendors of Components Required for a Web-Based Architecture"", Attorney Docket No. M&G 8567.107US01, filed May 27, 1999, 8 pages.;;Portions of U.S. Ser. No. 09/322,073, ""A System, Method, and Article of Manufacture for a Web-Based Architecture Sales Tool"", Attorney Docket No. M&G 8567.108US01, filed May 27, 1999, 8 pages.;;Portions of U.S. Ser. No. 09/320,921, ""A System, Method, and Article of Manufacture for Building, Managing, and Supporting Various Components of a System"", Attorney Docket No. M&G 8567.109US01, filed May 27, 1999, 8 pages.;;Portions of U.S. Ser. No. 09/321,494, ""A System, Method, and Article of Manufacture for Identifying Where Various Products are Focused in a Web Architecture Framework"", Attorney Docket No. M&G 8567.110US01, filed May 27, 1999, 8 pages.;;Portions of U.S. Ser. No. 09/320,816, ""A System, Method, and Article of Manufacture for Business Alliance Identification in a Web Architecture Framework"", Attorney Docket No. M&G 8567.111US01, filed May 27, 1999, 8 pages.;;Portions of U.S. Ser. No. 09/321,950, ""Methods, Concepts and Technology for a Virtual Shopping System Capable of Storing Previous Shopping Experiences for Later Reuse"", Attorney Docket No. M&G 8567.113US01, filed May 27, 1999, 7 pages.",EXPIRED
24,AU,A,AU 2000/051623 A,139-223-639-671-630,2000-12-18,2000,AU 2000/051623 A,2000-05-24,US 32081699 A;;US 0014375 W,1999-05-27,"A system, method, and article of manufacture for business alliance identification in a web architecture framework",,ANDERSEN CONSULTING LLP,GUHEEN MICHAEL F;;MITCHELL JAMES D;;BARRESE JAMES J,,https://lens.org/139-223-639-671-630,Patent Application,no,0,0,6,6,0,G06Q50/01;;G06Q99/00;;G06Q99/00;;G06Q50/01,G06F17/00;;G06Q99/00,,0,0,,,,DISCONTINUED
25,AU,A,AU 2000/050457 A,172-543-849-480-364,2000-12-18,2000,AU 2000/050457 A,2000-05-24,US 32136099 A;;US 0014458 W,1999-05-27,"A system, method, and article of manufacture for phase delivery of components ofa system required for implementation of technology",,ANDERSEN CONSULTING LLP,GUHEEN MICHAEL F;;MITCHELL JAMES D;;BARRESE JAMES J,,https://lens.org/172-543-849-480-364,Patent Application,no,0,0,4,4,0,G06Q10/063;;G06Q10/0631;;G06Q10/06313;;G06Q10/087;;G06T11/206;;G06T11/206;;G06Q10/0631;;G06Q10/06313;;G06Q10/087;;G06Q10/063,G06T11/20,,0,0,,,,DISCONTINUED
26,AU,A,AU 2000/050458 A,031-541-491-463-508,2000-12-18,2000,AU 2000/050458 A,2000-05-24,US 32081899 A;;US 0014459 W,1999-05-27,"Methods, concepts and technology for dynamic comparison of product features and customer profile",,ANDERSEN CONSULTING LLP,GUHEEN MICHAEL F;;MITCHELL JAMES D;;BARRESE JAMES J,,https://lens.org/031-541-491-463-508,Patent Application,no,0,0,4,4,0,G06Q30/02,G06Q30/00,,0,0,,,,DISCONTINUED
27,WO,A9,WO 2000/073956 A9,098-773-787-431-103,2002-02-21,2002,US 0014406 W,2000-05-24,US 32127499 A,1999-05-27,"A SYSTEM, METHOD, AND ARTICLE OF MANUFACTURE FOR PRIORITIZING COMPONENTS OF A NETWORK FRAMEWORK REQUIRED FOR IMPLEMENTATION OF TECHNOLOGY","A system, method, and article of manufacture are provided for prioritizing components of an existing network framework. First, a priority is determined among a plurality of components required for implementation of a predetermined technology using an existing network framework. The existing network framework and the plurality of components are then pictorially represented. Next, a first component of the existing network framework is indicia coded in order to indicate that the first component must be implemented first. Thereafter, a second component and any remaining components of the existing network framework are indicia encoded in order to indicate that the second components and any remaining components must be implemented after the first component.",ANDERSEN CONSULTING LLP,GUHEEN MICHAEL F;;MITCHELL JAMES D;;BARRESE JAMES J,,https://lens.org/098-773-787-431-103,Patent Application,no,0,0,6,6,0,G06Q10/06;;G06Q10/06,G06Q10/06,,0,0,,,,PENDING
28,WO,A9,WO 2000/073955 A9,055-829-073-363-137,2003-11-27,2003,US 0014357 W,2000-05-24,US 32149599 A,1999-05-27,"METHODS, CONCEPTS AND TECHNOLOGY FOR A VIRTUAL SHOPPING SYSTEM CAPABLE OF ASSESSING NEEDS OF A CUSTOMER AND RECOMMENDING A PRODUCT OR SERVICE BASED ON SUCH ASSESSED NEEDS","La présente invention concerne un système permettant de réaliser des transactions commerciales virtuelles après identification des besoins de l'utilisateur. Tout d'abord, le système évalue les besoins d'un utilisateur. Il génère ensuite, sur la base des besoins de l'utilisateur, une solution, qui est affichée. Un paiement est alors accepté en échange de la solution. Il convient de noter que dans le cadre du présent descriptif de l'invention, ladite solution est, mais pas exclusivement, un produit ou un service.",ACCENTURE LLP,GUHEEN MICHAEL F;;MITCHELL JAMES D;;BARRESE JAMES J,,https://lens.org/055-829-073-363-137,Patent Application,no,0,0,5,5,0,G06Q30/02,G06Q30/00,,0,0,,,,PENDING
29,WO,A8,WO 2000/073929 A8,073-770-391-207-817,2001-08-02,2001,US 0014457 W,2000-05-24,US 32113699 A,1999-05-27,"A SYSTEM, METHOD, AND ARTICLE OF MANUFACTURE FOR EFFECTIVELY CONVEYING WHICH COMPONENTS OF A SYSTEM ARE REQUIRED FOR IMPLEMENTATION OF TECHNOLOGY","Cette invention se rapporte à un système, un procédé et un article manufacturé permettant l'acheminement efficace des composants d'un système nécessaires à sa mise en pratique. A cet effet, on affiche d'abord une représentation graphique du système, qui contient les divers composants du système, puis on code à l'aide d'indices ces composants, afin d'indiquer lesquels sont nécessaires pour la mise en pratique du système.",ACCENTURE LLP,GUHEEN MICHAEL F;;MITCHELL JAMES D;;BARRESE JAMES J,,https://lens.org/073-770-391-207-817,Patent Application,no,0,0,4,4,0,G06Q30/02;;H04L41/0213;;H04L41/145;;H04L41/50;;H04L43/00;;H04L43/0811;;H04L43/0817;;H04L43/0847;;H04L43/16;;H04L67/02;;H04L69/329;;H04L67/75,G06Q30/00;;H04L12/24;;H04L12/26;;H04L29/06;;H04L29/08,,0,0,,,,PENDING
30,US,B2,US 7149698 B2,143-612-713-072-219,2006-12-12,2006,US 66203703 A,2003-09-12,US 66203703 A;;US 32081699 A,1999-05-27,Business alliance identification in a web architecture Framework,"A method is provided for identifying alliances among a plurality of business entities in components of a network framework. First, alliances are identified among a plurality of business entities in terms of components of a current network framework. Next, a pictorial representation is displayed of the current network framework and the components. The alliances are then conveyed by indicia coding the components of the current network framework in which the alliances exist.",ACCENTURE LLP,GUHEEN MICHAEL F;;MITCHELL JAMES D;;BARRESE JAMES J,ACCENTURE GLOBAL SERVICES LIMITED (2010-09-01);;ACCENTURE GLOBAL SERVICES GMBH (2010-08-31),https://lens.org/143-612-713-072-219,Granted Patent,yes,18,439,6,6,0,G06Q50/01;;G06Q99/00;;G06Q99/00;;G06Q50/01,G06F17/00;;G06Q99/00,705/1,2,0,,,"Stein, Tom; ""Manufacturing: Key Word: Integration""; Information Week, p. 223+; dialog copy pp. 1-7.;;Stein, Tom, ""Manufacturers and their suppliers, distributors , and retailers use the Internet to share real-time information about amount of product needed and sold"", Information Week, Sep. 22, 1997, pp. 223-229, United States.",EXPIRED
31,WO,A2,WO 2000/073929 A2,020-922-554-464-584,2000-12-07,2000,US 0014457 W,2000-05-24,US 32113699 A,1999-05-27,"A SYSTEM, METHOD, AND ARTICLE OF MANUFACTURE FOR EFFECTIVELY CONVEYING WHICH COMPONENTS OF A SYSTEM ARE REQUIRED FOR IMPLEMENTATION OF TECHNOLOGY","Cette invention se rapporte à un système, un procédé et un article manufacturé permettant l'acheminement efficace des composants d'un système nécessaires à sa mise en pratique. A cet effet, on affiche d'abord une représentation graphique du système, qui contient les divers composants du système, puis on code à l'aide d'indices ces composants, afin d'indiquer lesquels sont nécessaires pour la mise en pratique du système.",ANDERSEN CONSULTING LLP,GUHEEN MICHAEL F;;MITCHELL JAMES D;;BARRESE JAMES J,,https://lens.org/020-922-554-464-584,Patent Application,yes,0,8,4,4,0,G06Q30/02;;H04L41/0213;;H04L41/145;;H04L41/50;;H04L43/00;;H04L43/0811;;H04L43/0817;;H04L43/0847;;H04L43/16;;H04L67/02;;H04L69/329;;H04L67/75,G06Q30/00;;H04L12/24;;H04L12/26;;H04L29/06;;H04L29/08,,0,0,,,,PENDING
32,WO,A3,WO 2000/073957 A3,042-449-099-363-892,2001-08-16,2001,US 0014420 W,2000-05-25,US 32149299 A,1999-05-27,"A SYSTEM, METHOD, AND ARTICLE OF MANUFACTURE FOR PROVIDING COMMERCE-RELATED WEB APPLICATION SERVICES","A system, method, and article of manufacture are provided that afford a combination of commerce-related web application services. Various features are included such as allowing purchase of products and services via a displayed catalog. As an option, such catalog may be personalized. In various embodiments, a virtual shopping cart environment may be provided. Further, data, i.e. specifications, details, etc., relating to the products and services may be displayed along with a comparison between different products and services. Data relating to needs of a user may also be received for the purpose of outputting a recommendation of the products and services based on the inputted needs. Optionally, features of the products and services may be listed in order to allow the user to configure a specifically tailored product or service. Yet another aspect of the present invention includes outputting an estimate relating to a price and/or availability of the products and services. Further, an order for the products and services may be received after which a tax and a shipping fee are calculated. A status of the delivery of the ordered products and services may also be provided.",ACCENTURE LLP,GUHEEN MICHAEL F;;MITCHELL JAMES D;;BARRESE JAMES J,,https://lens.org/042-449-099-363-892,Search Report,yes,7,0,3,3,0,G06Q30/06,G06Q30/00,,0,0,,,,PENDING
