16,US,B1,US 7315826 B1,007-394-255-430-483,2008-01-01,2008,US 32127999 A,1999-05-27,US 32127999 A,1999-05-27,Comparatively analyzing vendors of components required for a web-based architecture,"A system, method and article of manufacture are provided for performing a comparative analysis of vendors of network-related products or services. The present invention includes first determining a current network framework. Thereafter, a graphical depiction of the current network framework is displayed along with a plurality of components thereof. Next, a comparative analysis of at least two vendors of network-related products or services is presented. This is accomplished with indicia coding that highlights various aspects of the vendors.",ACCENTURE LLP,GUHEEN MICHAEL F;;MITCHELL JAMES D;;BARRESE JAMES J,ACCENTURE GLOBAL SERVICES LIMITED (2010-09-01);;ACCENTURE LLP (2001-01-02);;ACCENTURE GLOBAL SERVICES GMBH (2010-08-31),https://lens.org/007-394-255-430-483,Granted Patent,yes,29,888,1,1,0,G06Q10/06;;G06Q10/06375;;G06Q10/0639;;G06Q30/0201;;G06F16/958;;G06Q10/06375;;G06Q10/06;;G06Q10/0639;;G06Q30/0201;;G06F16/958,G06F17/30,705/7;;709/223;;703/27,49,0,,,"CRN, 1998 [retrieved on Apr. 17, 2002], http://www.crn.com/testcenter], pp. 1-2.;;""Computer Reseller News Test Center Launches Interactive Database; Available through ChannelWEB Online Community, Business Wire"", Jun. 5, 1998 [retrieved Apr. 17, 2002], 2 pages, retrived from: Proquest Direct.;;""How the survey was conducted"", Computer Reseller News, Jun. 15, 1998 [retrieved on Apr. 17, 2002], 2 pages, retrieved from: Proquest Direct.;;""The Channel Champions survey explained"", Computer Reseller News, Jun. 16, 1997 [retrieved Apr. 17, 2002], 2 pages, retrived from: Proquest Direct.;;BizRate.com, 1996 [retrieved on Apr. 13, 2002], http://www.bizrate.com, screenshots, 5 pages.;;Gartner, [retrieved on Apr. 17, 2002], http://www.gartner.com, screenshots, 10 pages.;;""GartnerGroup Forecasts Megatrends for the IT Industry During Inagural GartnerGroup Predicts Conference"", Business Wire, Apr. 7, 1998 [retrieved on Apr. 15, 2002], 3 pages, Retrieved from: Proquest Direct.;;Spiers et al., ""Making your Financial Software Pay"", Fortune, Dec. 26, 1994 [retrieved on Apr. 17, 2002], vol. 130, Issue 13, 6 pages, Retrieved from: Proquest Direct.;;""O.K. for $2K"", CNET.com, Jun. 5, 1997 [retrieved on Nov. 20, 2002], 2 pages, retrieved from: Google.com and archive.org.;;""ISDN: the speed you need"", CNET.com, Dec. 22, 1996 [retrieved on Nov. 20, 2002], 8 pages, retrieved from: Google.com and archive.org.;;""Five Top Web Servers"", CNET.com, Dec. 22, 1996 [retrieved on Nov. 20, 2002], 5 pages, retrieved from: Google.com and archive.org.;;""The Hard Drives have it"", CNET.com, Jan. 19, 1997 [retrieved on Nov. 20, 2002], 3 pages, retrieved from: Google.com and archive.org.;;Mace, Scott, et al., ""The one that got away"", InfoWorld, Jul. 24, 1995 [retrieved on Nov. 20, 2002], vol. 17, No. 30, 14 pages, retrieved from: dialog.;;Portions of U.S. Appl. No. 09/321,492, ""A System, Method and Article of Manufacture for Providing Commerce-Related Web Application Services"", filed May 27, 1999, 9 pages.;;Portions of U.S. Appl. No. 09/320,819, ""A System, Method and Article of Manufacture for Providing Commerce-Related Web Application Services"", filed May 27, 1999, 8 pages.;;Portions of U.S. Appl. No. 09/321,280, ""A System, Method and Article of Manufacture for Providing Web Application Services to Manage Customer Relations"", filed May 27, 1999, 8 pages.;;Portions of U.S. Appl. No. 09/321,951, ""A System, Method and Article of Manufacture for Providing Content Management-Related Web Application Services"", filed May 27, 1999, 8 pages.;;Portions of U.S. Appl. No. 09/321,053, ""A System, Method and Article of Manufacture for Providing Education-Related Web Application Services"", filed May 27, 1999, 8 pages.;;Portions of U.S. Appl. No. 09/321,493, ""A System, Method and Article of Manufacture for Providing Customer Service-Related Web Application Services"", filed May 27, 1999, 8 pages.;;Portions of U.S. Appl. No. 09/321,359, ""A System, Method and Article of Manufacture for Providing Security Services in a Web Architecture Framework"", filed May 27, 1999, 8 pages.;;Portions of U.S. Appl. No. 09/321,949, ""A System, Method and Article of Manufacture for Providing Network Services in a Web Architecture Framework"", filed May 27, 1999, 9 pages.;;Portions of U.S. Appl. No. 09/321,953, ""A System, Method and Article of Manufacture for Providing Internet Services in a Web Architecture Framework"", filed May 27, 1999, 10 pages.;;Portions of U.S. Appl. No. 09/321,361, ""A System, Method and Article of Manufacture for Providing Client Services in a Web Architecture Framework"", filed May 27, 1999, 7 pages.;;Portions of U.S. Appl. No. 09/322,105, ""A System, Method and Article of Manufacture for Providing Data Services in a Web Architecture Framework"", filed May 27, 1999, 8 pages.;;Portions of U.S. Appl. No. 09/321,304, ""A System, Method and Article of Manufacture for Providing Integration Capabilities in a Web Architecture Framework"", filed May 27, 1999, 8 pages.;;Portions of U.S. Appl. No. 09/320,820, ""A System, Method and Article of Manufacture for Providing Multiple Capabilities in a Web Architecture Framework"", filed May 27, 1999, 8 pages.;;Portions of U.S. Appl. No. 09/321,052, ""A System, Method and Article of Manufacture for Providing Directory Services in a Web Architecture Framework"", filed May 27, 1999, 8 pages.;;Portions of U.S. Appl. No. 09/320,817, ""A System, Method and Article of Manufacture for Providing Management and Operations in a Web Architecture Framework"", filed May 27, 1999, 8 pages.;;Portions of U.S. Appl. No. 09/321,358, ""A System, Method and Article of Manufacture for Providing Developer Services in a Web Architecture Framework"", filed May 27, 1999, 8 pages.;;Portions of U.S. Appl. No. 09/321,495, ""Methods, Concepts and Technology for a Virtual Shopping System Capable of Assessing Needs of a Customer and Recommending a Product or Service Based on Such Assessed Needs"", filed May 27, 1999, 7 pages.;;Portions of U.S. Appl. No. 09/321,303, ""Methods, Concepts and Technology for a Virtual Shopping System Capable of Allowing a User to Customize Products/Services that are Available for Purchase"", filed May 27, 1999, 7 pages.;;Portions of U.S. Appl. No. 09/321,305, ""Methods, Concepts and Technology for a Virtual Shopping System Capable of Advertising Based on Products/Services that are Available for Purchase"", filed May 27, 1999, 7 pages.;;Portions of U.S. Appl. No. 09/321,514, ""Methods, Concepts and Technology for a Virtual Shopping System Capable of Selectively Determining Prices and Availability on Products/Services Based on a Profile of a Current User"", filed May 27, 1999, 7 pages.;;Portions of U.S. Appl. No. 09/321,134, ""Methods, Concepts and Technology for Curriculum Generation Based on a User Profile in an Internet Based Environment"", filed May 27, 1999, 7 pages.;;Portions of U.S. Appl. No. 09/321,954, ""Methods, Concepts and Technology for Proactive Service Delivery Based on a User Profile in an Internet Based Environment"", filed May 27, 1999, 7 pages.;;Portions of U.S. Appl. No. 09/321,273, ""Methods, Concepts and Technology for Dynamic Customer Profile Management"", filed May 27, 1999, 7 pages.;;Portions of U.S. Appl. No. 09/320,818, ""Methods, Concepts and Technology for Dynamic Comparison of Product Features and Customer Profile"", filed May 27, 1999, 7 pages.;;Portions of U.S. Appl. No. 09/321,952, ""A System, Method, and Article of Manufacture for Identification of Redundancies and Omissions Among Components of a Web Based Architecture"", filed May 27, 1999, 8 pages.;;Portions of U.S. Appl. No. 09/321,136, ""A System, Method, and Article of Manufacture for Effectively Conveying Which Components of a System are Required for Implementation of Technology"", filed May 27, 1999, 8 pages.;;Portions of U.S. Appl. No. 09/321,274, ""A System, Method, and Article of Manufacture for Prioritizing Components of a Network Framework Required for Implementation of Technology"", filed May 27, 1999 9 pages.;;Portions of U.S. Appl. No. 09/321,360, ""A System, Method, and Article of Manufacture for Phase Delivery of Components of a System Required for Implementation of Technology"", filed May 27, 1999, 8 pages.;;Portions of U.S. Appl. No. 09/322,073, ""A System, Method, and Article of Manufacture for a Web-Based Architecture Sales Tool"", filed May 27, 1999, 8 pages.;;Portions of U.S. Appl. No. 09/320,921, ""A System, Method, and Article of Manufacture for Building, Managing, and Supporting Various Components of a System"", filed May 27, 1999, 8 pages.;;Portions of U.S. Appl. No. 09/321,494, ""A System, Method, and Article of Manufacture for Identifying Where Various Products are Focused in a Web Architecture Framework"", filed May 27, 1999, 8 pages.;;Portions of U.S. Appl. No. 09/320,816, ""A System, Method, and Article of Manufacture for Business Alliance Identification in a Web Architecture Framework"", filed May 27, 1999, 8 pages.;;Portions of U.S. Appl. No. 09/321,135, ""A System, Method, and Article of Manufacture for Establishing a Plan to Test Components of a Web Based Framework"", filed May 27, 1999, 8 pages.;;Portions of U.S. Appl. No. 09/321,950, ""Methods, Concepts and Technology for a Virtual Shopping System Capable of Storing Previous Shopping Experiences for Later Reuse"", filed May 27, 1999, 7 pages.;;Jennifer Lee; Stop & Shop signs deal for on-line orders; Boston Globe, Aug. 6, 1996, p. D1.;;Baan Debuts First Web Applications and Unveils Internet Roadmap;BAANWORLD, newswire, May 14, 1997.",EXPIRED
17,US,B1,US 8121874 B1,131-495-620-165-613,2012-02-21,2012,US 32136099 A,1999-05-27,US 32136099 A,1999-05-27,Phase delivery of components of a system required for implementation technology,"A system, method, and article of manufacture are provided for displaying phases of delivery of components of a system by first displaying a pictorial representation of an existing system including a plurality of components. Next, a first set of components are presented that are to be delivered in a first phase. This is accomplished by indicia coding the first set of components in a specific manner. Further, a second set of components are presented that are to be delivered in a second phase. This is carried out by indicia coding the second set of components in a manner unique with respect to the indicia coding of the first set of components.",GUHEEN MICHAEL F;;MITCHELL JAMES D;;BARRESE JAMES J;;ACCENTURE GLOBAL SERVICES LTD,GUHEEN MICHAEL F;;MITCHELL JAMES D;;BARRESE JAMES J,ACCENTURE GLOBAL SERVICES LIMITED (2010-09-01);;ACCENTURE LLP (2001-01-02);;ACCENTURE GLOBAL SERVICES GMBH (2010-08-31),https://lens.org/131-495-620-165-613,Granted Patent,yes,25,208,4,4,0,G06Q10/063;;G06Q10/0631;;G06Q10/06313;;G06Q10/087;;G06T11/206;;G06T11/206;;G06Q10/0631;;G06Q10/06313;;G06Q10/087;;G06Q10/063,G06T11/20;;G06Q99/00,705/7.11;;705/7.12;;705/7.23;;705/28,39,3,091-160-316-239-872;;023-192-652-686-866;;136-882-372-830-718,10.1109/38.689658;;10.1109/iemt.1991.279784;;10.1109/67.60743,"""Borland: Borland announces summer promotions"", Presswire, Jun. 11, 1996.;;Guheen et al., portions of U.S. Appl. No. 09/321,492, ""A System, Method and Article of Manufacture for Providing Commerce-Related Web Application Services"", filed May 27, 1999, 9 pages.;;Guheen et al., portions of U.S. Appl. No. 09/320,819, ""A System, Method and Article of Manufacture for Providing Commerce-Related Web Application Services"", filed May 27, 1999, 8 pages.;;Guheen et al., portions of U.S. Appl. No. 09/321,280, ""A System, Method and Article of Manufacture for Providing Web Application Services to Manage Customer Relations"", filed May 27, 1999, 8 pages.;;Guheen et al., portions of U.S. Appl. No. 09/321,951, ""A System, Method and Article of Manufacture for Providing Content Management-Related Web Application Services"", filed May 27, 1999, 8 pages.;;Guheen et al., portions of U.S. Appl. No. 09/321,053, ""A System, Method and Article of Manufacture for Providing Education-Related Web Application Services"", filed May 27, 1999, 8 pages.;;Guheen et al., portions of U.S. Appl. No. 09/321,493, ""A System, Method and Article of Manufacture for Providing Customer Service-Related Web Application Services"", filed May 27, 1999, 8 pages.;;Guheen et al., portions of U.S. Appl. No. 09/321,359, ""A System, Method and Article of Manufacture for Providing Security Services in a Web Architecture Framework"", filed May 27, 1999, 8 pages.;;Guheen et al., portions of U.S. Appl. No. 09/321,949, ""A System, Method and Article of Manufacture for Providing Network Services in a Web Architecture Framework"", filed May 27, 1999, 9 pages.;;Guheen et al., portions of U.S. Appl. No. 09/321,953, ""A System, Method and Article of Manufacture for Providing Internet Services in a Web Architecture Framework"", filed May 27, 1999, 10 pages.;;Guheen et al., portions of U.S. Appl. No. 09/321,361, ""A System, Method and Article of Manufacture for Providing Client Services in a Web Architecture Framework"", filed May 27, 1999, 7 pages.;;Guheen et al., portions of U.S. Appl. No. 09/322,105, ""A System, Method and Article of Manufacture for Providing Data Services in a Web Architecture Framework"", filed May 27, 1999, 8 pages.;;Guheen et al., portions of U.S. Appl. No. 09/321,304, ""A System, Method and Article of Manufacture for Providing Integration Capabilities in a Web Architecture Framework"", filed May 27, 1999, 8 pages.;;Guheen et al., portions of U.S. Appl. No. 09/320,820, ""A System, Method and Article of Manufacture for Providing Multiple Capabilities in a Web Architecture Framework"", filed May 27, 1999, 8 pages.;;Guheen et al., portions of U.S. Appl. No. 09/321,052, ""A System, Method and Article of Manufacture for Providing Directory Services in a Web Architecture Framework"", filed May 27, 1999, 8 pages.;;Guheen et al., portions of U.S. Appl. No. 09/320,817, ""A System, Method and Article of Manufacture for Providing Management and Operations in a Web Architecture Framework"", filed May 27, 1999, 8 pages.;;Guheen et al., portions of U.S. Appl. No. 09/321,358, ""A System, Method and Article of Manufacture for Providing Developer Services in a Web Architecture Framework"", filed May 27, 1999, 8 pages.;;Guheen et al., portions of U.S. Appl. No. 09/321,495, ""Methods, Concepts and Technology for a Virtual Shopping System Capable of Assessing Needs of a Customer and Recommending a Product or Service Based on Such Assessed Needs"", filed May 27, 1999, 7 pages.;;Guheen et al., portions of U.S. Appl. No. 09/321,303, ""Methods, Concepts and Technology for a Virtual Shopping System Capable of Allowing a User to Customize Products/Services that are Available for Purchase "", filed May 27, 1999, 7 pages.;;Guheen et al., portions of U.S. Appl. No. 09/321,305, ""Methods, Concepts and Technology for a Virtual Shopping System Capable of Advertising Based on Products/Services that are Available for Purchase"", filed May 27, 1999, 7 pages.;;Guheen et al., portions of U.S. Appl. No. 09/321,514, ""Methods, Concepts and Technology for a Virtual Shopping System Capable of Selectively Determining Prices and Availability on Products/Services Based on a Profile of a Current User"", filed May 27, 1999, 7 pages.;;Guheen et al., portions of U.S. Appl. No. 09/321,134, ""Methods, Concepts and Technology for Curriculum Generation Based on a User Profile in an Internet Based Environment"", filed May 27, 1999, 7 pages.;;Guheen et al., portions of U.S. Appl. No. 09/321,954, ""Methods, Concepts and Technology for Proactive Service Delivery Based on a User Profile in an Internet Based Environment"", filed May 27, 1999, 7 pages.;;Guheen et al., portions of U.S. Appl. No. 09/321,273, ""Methods, Concepts and Technology for Dynamic Customer Profile Management"", filed May 27, 1999, 7 pages.;;Guheen et al., portions of U.S. Appl. No. 09/320,818, ""Methods, Concepts and Technology for Dynamic Comparison of Pruduct Features and Customer Profile"", filed May 27, 1999, 7 pages.;;Guheen et al., portions of U.S. Appl. No. 09/321,952, ""A System, Method, and Article of Manufacture for Identification of Redundancies and Omissions Among Components of a Web Based Architecture"", filed May 27, 1999, 8 pages.;;Guheen et al., portions of U.S. Appl. No. 09/321,136, ""A System, Method, and Article of Manufacture for Effectively Conveying Which Components of a System are Required for Implementation of Technology"", filed May 27, 1999, 8 pages.;;Guheen et al., portions of U.S. Appl. No. 09/321,274, ""A System, Method, and Article of Manufacture for Prioritizing Components of a Network Framework Required for Implementation of Technology"", filed May 27, 1999, 9 pages.;;Guheen et al., portions of U.S. Appl. No. 09/321,279, ""A System, Method, and Article of Manufacture for Comparatively Analyzing Vendors of Components Required for a Web-Based Architecture"", filed May 27, 1999, 8 pages.;;Guheen et al., portions of U.S. Appl. No. 09/322,073, ""A System, Method, and Article of Manufacture for a Web-Based Architecture Sales Tool"", filed May 27, 1999, 8 pages.;;Guheen et al., portions of U.S. Appl. No. 09/320,921, ""A System, Method, and Article of Manufacture for Building, Managing, and Supporting Various Components of a System"", filed May 27, 1999, 8 pages.;;Guheen et al., portions of U.S. Appl. No. 09/321,494, ""A System, Method, and Article of Manufacture for Identifying Where Various Products are Focused in a Web Architecture Framework"", filed May 27, 1999, 8 pages.;;Guheen et al., portions of U.S. Appl. No. 09/320,816, ""A System, Method, and Article of Manufacture for Business Alliance Identification in a Web Architecture Framework"", filed May 27, 1999, 8 pages.;;Guheen et al., portions of U.S. Appl. No. 09/321,135, ""A System, Method, and Article of Manufacture for Establishing a Plan to Test Components of a Web Based Framework"", filed May 27, 1999, 8 pages.;;Guheen et al., portions of U.S. Appl. No. 09/321,950, ""Methods, Concepts and Technology for a Virtual Shopping System Capable of Storing Previous Shopping Experiences for Later Reuse"", filed May 27, 1999, 7 pages.;;Chuah, M. et al., ""Information Rich Glyphs for Software Management Data"", Information Visualization, pp. 24-29 (Jul./Aug. 1998).;;DiCesare, F. et al., ""An Interactive Multimedia Learning Module for Manufacturing Scheduling"", IEEE, pp. 770-776 (Nov. 18, 1996).;;Hawley, J. et al., ""Paperless Assembly Using Touchscreen Based Graphics"", IEEE/CHMT '91 IEMT Symposium, pp. 231-234 (Sep. 16, 1991).;;Imhof, K. et al., ""Show It With Colors. Connectivity, Status, and Value Information in Energy Management Systems"", IEEE Computer Applications in Power, pp. 11-16 (Oct. 1990).",EXPIRED
18,US,B1,US 6721713 B1,158-865-650-465-778,2004-04-13,2004,US 32081699 A,1999-05-27,US 32081699 A,1999-05-27,Business alliance identification in a web architecture framework,"
    A system, method and article of manufacture are provided for identifying alliances among a plurality of business entities in components of a network framework. First, alliances are identified among a plurality of business entities in terms of components of a current network framework. Next, a pictorial representation is displayed of the current network framework and the components. The alliances are then conveyed by indicia coding the components of the current network framework in which the alliances exist. 
",ACCENTURE LLP,GUHEEN MICHAEL F;;MITCHELL JAMES D;;BARRESE JAMES J,ACCENTURE GLOBAL SERVICES LIMITED (2010-09-01);;ACCENTURE LLP (2001-01-02);;ACCENTURE GLOBAL SERVICES GMBH (2010-08-31),https://lens.org/158-865-650-465-778,Granted Patent,yes,19,920,6,6,0,G06Q50/01;;G06Q99/00;;G06Q99/00;;G06Q50/01,G06F17/00;;G06Q99/00,705/1;;707/503;;709/223,1,0,,,"Stein, Tom; Manufacturing: Key Word: Integration; Information week, p223+; dialog copy pp. 1-7.",EXPIRED
19,WO,A2,WO 2000/073928 A2,011-290-642-716-455,2000-12-07,2000,US 0014375 W,2000-05-24,US 32081699 A,1999-05-27,"A SYSTEM, METHOD, AND ARTICLE OF MANUFACTURE FOR BUSINESS ALLIANCE IDENTIFICATION IN A WEB ARCHITECTURE FRAMEWORK","A system, method and article of manufacture are provided for identifying alliances among a plurality of business entities in components of a network framework. First, alliances are identified among a plurality of business entities in terms of components of a current network framework. Next, a pictorial representation is displayed of the current network framework and the components. The alliances are then conveyed by indicia coding the components of the current network framework in which the alliances exist.",ANDERSEN CONSULTING LLP,GUHEEN MICHAEL F;;MITCHELL JAMES D;;BARRESE JAMES J,,https://lens.org/011-290-642-716-455,Patent Application,yes,0,3,6,6,0,G06Q50/01;;G06Q99/00;;G06Q99/00;;G06Q50/01,G06F17/00;;G06Q99/00,,0,0,,,,PENDING
20,US,B1,US 6615166 B1,041-824-716-795-152,2003-09-02,2003,US 32127499 A,1999-05-27,US 32127499 A,1999-05-27,Prioritizing components of a network framework required for implementation of technology,"
    A system and method are provided for prioritizing components of an existing network framework. First, a plurality of components required for implementation of a predetermined technology using an existing network framework are provided. Next, a priority listing of the components is complied such that the relative position of the components on the priority listing corresponds to a temporal priority among the components. The existing network framework and the components are pictorially represented. Next, a first component of the existing network framework is indicia coded in order to indicate that the first component must be installed first based on the component's position on the priority listing. Thereafter, a second component and any remaining components of the existing network framework is indicia encoded in order to indicate that the second component and any remaining components must be installed after the first component based on the second component's position on the priority listing. 
",ACCENTURE LLP,GUHEEN MICHAEL F;;MITCHELL JAMES D;;BARRESE JAMES J,ACCENTURE GLOBAL SERVICES LIMITED (2010-09-01);;ACCENTURE LLP (2001-01-02);;ACCENTURE GLOBAL SERVICES GMBH (2010-08-31),https://lens.org/041-824-716-795-152,Granted Patent,yes,28,823,6,6,0,G06Q10/06;;G06Q10/06,G06Q10/06,703/27;;703/26;;709/231;;709/316;;709/223;;709/220;;717/140,4,3,091-160-316-239-872;;023-192-652-686-866;;136-882-372-830-718,10.1109/38.689658;;10.1109/iemt.1991.279784;;10.1109/67.60743,"Chuah, M. et al., ""Information Rich Glyphs for Software Management Data"", Information Visualization, pp. 24-29 (Jul./Aug. 1998).;;DiCesare, F. et al., ""An Interactive Multimedia Learning Module for Manufacturing Scheduling"", IEEE, pp. 770-776 (Nov. 18, 1996).;;Hawley, J. et al., ""Paperless Assembly Using Touchscreen Based Graphics"", IEEE/CHMT '91 IEMT Symposium, pp. 231-234 (Sep. 16, 1991).;;Imhof, K. et al., ""Show It With Colors. Connectivity, Status, and Value Information in Energy Management Systems"", IEEE Computer Applications in Power, pp. 11-16 (Oct. 1990).",EXPIRED
21,AU,A,AU 2000/048599 A,157-593-610-676-391,2000-12-18,2000,AU 2000/048599 A,2000-05-24,US 32127499 A;;US 0014406 W,1999-05-27,"A system, method, and article of manufacture for prioritizing components of a network framework required for implementation of technology",,ANDERSEN CONSULTING LLP,GUHEEN MICHAEL F;;MITCHELL JAMES D;;BARRESE JAMES J,,https://lens.org/157-593-610-676-391,Patent Application,no,0,0,6,6,0,G06Q10/06;;G06Q10/06,G06Q10/06,,0,0,,,,DISCONTINUED
22,WO,A3,WO 2000/073928 A3,174-957-177-276-08X,2001-05-25,2001,US 0014375 W,2000-05-24,US 32081699 A,1999-05-27,BUSINESS ALLIANCE IDENTIFICATION,"A system, method and article of manufacture are provided for identifying alliances among a plurality of business entities in components of a network framework. First, alliances are identified among a plurality of business entities in terms of components of a current network framework. Next, a pictorial representation is displayed of the current network framework and the components. The alliances are then conveyed by indicia coding the components of the current network framework in which the alliances exist.",ACCENTURE LLP,GUHEEN MICHAEL F;;MITCHELL JAMES D;;BARRESE JAMES J,,https://lens.org/174-957-177-276-08X,Search Report,yes,1,0,6,6,0,G06Q50/01;;G06Q99/00;;G06Q99/00;;G06Q50/01,G06F17/00;;G06Q99/00,,0,0,,,,PENDING
