"#",Jurisdiction,Kind,Display Key,Lens ID,Publication Date,Publication Year,Application Number,Application Date,Priority Numbers,Earliest Priority Date,Title,Abstract,Applicants,Inventors,Owners,URL,Document Type,Has Full Text,Cites Patent Count,Cited by Patent Count,Simple Family Size,Extended Family Size,Sequence Count,CPC Classifications,IPCR Classifications,US Classifications,NPL Citation Count,NPL Resolved Citation Count,NPL Resolved Lens ID(s),NPL Resolved External ID(s),NPL Citations,Legal Status
1,US,B2,US 7890376 B2,033-223-726-361-370,2011-02-15,2011,US 98223904 A,2004-11-05,US 98223904 A,2004-11-05,System and method for location based content correlation,A method and a system to correlate location and content. For example hyperlinked content can be received from a user including current geographical position data. The current geographical position data can be extracted from the hyperlinked content. Location or geographically-based content can be selected based on the current geographical position data. The geographical based content can be returned to the user.,EBAY INC,BARRESE JAMES J;;PRITCHETT DAN L,EBAY INC (2004-09-30);;PAYPAL INC (2015-07-17),https://lens.org/033-223-726-361-370,Granted Patent,yes,28,26,6,6,0,G06Q10/063;;G06Q30/0639;;G06Q40/04;;G06Q30/0261;;H04W4/02;;H04W4/029;;G06Q10/063;;G06Q30/0639;;G06Q40/04;;G06Q30/0261,G06Q30/00;;H04W4/02;;H04W4/029,705/26;;705/1;;705/7;;705/8;;705/14;;705/27;;705/37;;455/41.1;;455/456.1;;455/456.3;;455/412.1;;455/414.1,5,0,,,"U.S. Appl. No. 11/870,542, Non-Final Office Action mailed Jun. 19, 2009, 19 Pgs.;;U.S. Appl. No. 11/870,542, Response filed Sep. 21, 2009 to Non Final Office Action mailed Jun. 19, 2009, 13 pgs.;;U.S. Appl. No. 11/870,542, Notice of Allowance mailed Jan. 13, 2010, 14 Pgs.;;International Application Serial No. PCT/US2008/011552, International Search Report mailed Mar. 27, 2009, 4 pgs.;;International Application Serial No. PCT/US2008/011552, Written Opinion mailed Mar. 27, 2009, 7 pgs.",ACTIVE
2,US,A1,US 2006/0099964 A1,151-374-292-790-771,2006-05-11,2006,US 98223904 A,2004-11-05,US 98223904 A,2004-11-05,System and method for location based content correlation,A method and a system to correlate location and content. For example hyperlinked content can be received from a user including current geographical position data. The current geographical position data can be extracted from the hyperlinked content. Location or geographically-based content can be selected based on the current geographical position data. The geographical based content can be returned to the user.,EBAY INC,BARRESE JAMES J;;PRITCHETT DAN L,EBAY INC (2004-09-30);;PAYPAL INC (2015-07-17),https://lens.org/151-374-292-790-771,Patent Application,yes,25,115,6,6,0,G06Q10/063;;G06Q30/0639;;G06Q40/04;;G06Q30/0261;;H04W4/02;;H04W4/029;;G06Q10/063;;G06Q30/0639;;G06Q40/04;;G06Q30/0261,H04W4/02;;H04W4/029,455/456.3;;455/456.1,0,0,,,,ACTIVE
3,US,B1,US 6536037 B1,052-104-634-745-593,2003-03-18,2003,US 32195299 A,1999-05-27,US 32195299 A,1999-05-27,Identification of redundancies and omissions among components of a web based architecture,"
    A system, method and article of manufacture are provided for conveying redundancies and omissions among components of a network framework such as a web architecture framework. First, an area of an existing network framework is determined in which redundancies and omissions exist. Next, a pictorial representation of the existing network framework is presented along with a plurality of its components. The foregoing redundancies and the omissions are then highlighted by indicia coding the components of the existing network that reside in the area. As such, a diagnostic analysis of redundant efforts and gaps in a current implementation of the existing network framework is effectively conveyed. 
",ACCENTURE LLP,GUHEEN MICHAEL F;;MITCHELL JAMES D;;BARRESE JAMES J,ACCENTURE GLOBAL SERVICES LIMITED (2010-09-01);;ACCENTURE LLP (2001-01-02);;ACCENTURE GLOBAL SERVICES GMBH (2010-08-31),https://lens.org/052-104-634-745-593,Granted Patent,yes,40,987,1,1,0,G06F8/71;;G06F8/71,G06F9/44;;G06F9/45,717/151;;717/151;;709/231;;703/2,37,1,101-188-038-437-435,10.1145/504502.504522,"Chen et al, ""Visualization and evolution of a subject domain: case study"", IEEE, pp 449-452, 1999.*;;Ower, ""A data model and architecture for hypermedia database visualization"", ACM Web3D, pp 121-126, 2002.*;;Knoblock et al, mixed initiative multi source information assistance:, ACM WWW10, pp 697-707, 2001.*;;Portions of U.S. Ser. No. 09/321,492, ""A System, Method and Article of Manufacture for Providing Commerce-Related Web Application Services"", Attorney Docket No. M&G 8567.78US01, filed May 27, 1999, 9 pages.;;Portions of U.S. Ser. No. 09/320,819, ""A System, Method and Article of Manufacture for Providing Commerce-Related Web Application Services"", Attorney Docket No. M&G 8567.79US01, filed May 27, 1999, 8 pages.;;Portions of U.S. Ser. No. 09/321,280, ""A System, Method and Article of Manufacture for Providing Web Application Services to Manage Customer Relations"", Attorney Docket No. M&G 8567.80US01, filed May 27, 1999, 8 pages.;;Portions of U.S. Ser. No. 09/321,951, ""A System, Method and Article of Manufacture for Providing Content Management-Related Web Application Services"", Attorney Docket No. M&G 8567.81US01, filed May 27, 1999, 8 pages.;;Portions of U.S. Ser. No. 09/321,053, ""A System, Method and Article of Manufacture for Providing Education-Related Web Application Services"", Attorney Docket No. M&G 8567.82US01, filed May 27, 1999, 8 pages.;;Portions of U.S. Ser. No. 09/321,493, ""A System, Method and Article of Manufacture for Providing Customer Service-Related Web Application Services"", Attorney Docket No. M&G 8567.83US01, filed May 27, 1999, 8 pages.;;Portions of U.S. Ser. No. 09/321,359, ""A System, Method and Article of Manufacture for Providing Security Services in a Web Architecture Framework"", Attorney Docket No. M&G 8567.84US01, filed May 27, 1999, 8 pages.;;Portions of U.S. Ser. No. 09/321,949, ""A System, Method and Article of Manufacture for Providing Network Services in a Web Architecture Framework"", Attorney Docket No. M&G 8567.85US01, filed May 27, 1999, 9 pages.;;Portions of U.S. Ser. No. 09/321,953, ""A System, Method and Article of Manufacture for Providing Internet Services in a Web Architecture Framework"", Attorney Docket No. M&G 8567.86US01, filed May 27, 1999, 10 pages.;;Portions of U.S. Ser. No. 09/321,361, ""A System, Method and Article of Manufacture for Providing Client Services in a Web Architecture Framework"", Attorney Docket No. M&G 8567.87US01, filed May 27, 1999, 7 pages.;;Portions of U.S. Ser. No. 09/322,105, ""A System, Method and Article of Manufacture for Providing Data Services in a Web Architecture Framework"", Attorney Docket No. M&G 8567.88US01, filed May 27, 1999, 8 pages.;;Portions of U.S. Ser. No. 09/321,304, ""A System, Method and Article of Manufacture for Providing Integration Capabilities in a Web Architecture Framework"", Attorney Docket No. M&G 8567.89US01, filed May 27, 1999, 8 pages.;;Portions of U.S. Ser. No. 09/320,820, ""A System, Method and Article of Manufacture for Providing Multiple Capabilities in a Web Architecture Framework"", Attorney Docket No. M&G 8567.90US01, filed May 27, 1999, 8 pages.;;Portions of U.S. Ser. No. 09/321,052, ""A System, Method and Article of Manufacture for Providing Directory Services in a Web Architecture Framework"", Attorney Docket No. M&G 8567.91US01, filed May 27, 1999, 8 pages.;;Portions of U.S. Ser. No. 09/320,817, ""A System, Method and Article of Manufacture for Providing Management and Operations in a Web Architecture Framework"", Attorney Docket No. M&G 8567.92US01, filed May 27, 1999, 8 pages.;;Portions of U.S. Ser. No. 09/321,358, ""A System, Method and Article of Manufacture for Providing Developer Services in a Web Architecture Framework"", Attorney Docket No. M&G 8567.93US01, filed May 27, 1999, 8 pages.;;Portions of U.S. Ser. No. 09/321,495, ""Methods, Concepts and Technology for a Virtual Shopping System Capable of Assessing Needs of a Customer and Recommending a Product or Service Based on Such Assessed Needs"", Attorney Docket No. M&G 85567.94US01, filed May 27, 1999, 7 pages.;;Portions of U.S. Ser. No. 09/321,303, ""Methods, Concepts and Technology for a Virtual Shopping System Capable of Allowing a User to Customize Products/Services that are Available for Purchase"", Attorney Docket No. M&G 8567.95US01, filed May 27, 1999, 7 pages.;;Portions of U.S. Ser. No. 09/321,305, ""Methods, Concepts and Technology for a Virtual Shopping System Capable of Advertising Based on Products/Services that are Available for Purchase"", Attorney Docket No. M&G 8567.96US01, filed May 27, 1999, 7 pages.;;Portions of U.S. Ser. No. 09/321,514, ""Methods, Concepts and Technology for a Virtual Shopping System Capable of Selectively Determining Prices and Availability on Products/Services Based on a Profile of a Current User"", Attorney Docket No. M&G 8567.97US01, filed May 27, 1999, 7 pages.;;Portions of U.S. Ser. No. 09/321,134, ""Methods, Concepts and Technology for Curriculum Generation Based on a User Profile in an Internet Based Environment"", Attorney Docket No. M&G 8567.98US01, filed May 27, 1999, 7 pages.;;Portions of U.S. Ser. No. 09/321,954, ""Methods, Concepts and Technology for Proactive Service Delivery Based on a User Profile in an Internet Based Environment"", Attorney Docket No. M&G 8567.100US01, filed May 27, 1999, 7 pages.;;Portions of U.S. Ser. No. 09/321,273, ""Methods, Concepts and Technology for Dynamic Customer Profile Management"", Attorney Docket No. M&G 8567.101US01, filed May 27, 1999, 7 pages.;;Portions of U.S. Ser. No. 09/320,818, ""Methods, Concepts and Technology for Dynamic Comparison of Product Features and Customer Profile"", Attorney Docket No. M&G 8567.102US01, filed May 27, 1999, 7 pages.;;Portions of U.S. Ser. No. 09/321,136, ""A System, Method, and Article of Manufacture for Effectively Conveying Which Components of a System are Required for Implementation of Technology"", Attorney Docket No. M&G 8567.104US01, filed May 27, 1999, 8 pages.;;Portions of U.S. Ser. No. 09/321,274, ""A System, Method, and Article of Manufacture for Prioritizing Components of a Network Framework Required for Implementation of Technology"", Attorney Docket No. M&G 8567.105US01, filed May 27, 1999, 9 pages.;;Portions of U.S. Ser. No. 09/321,360, ""A System, Method, and Article of Manufacture for Phase Delivery of Components of a System Required for Implementation of Technology"", Attorney Docket No. M&G 8567.106US01, filed May 27, 1999, 8 pages.;;Portions of U.S. Ser. No. 09/321,279, ""A System, Method, and Article of Manufacture for Comparatively Analyzing Vendors of Components Required for a Web-Based Architecture"", Attorney Docket No. M&G 8567.107US01, filed May 27, 1999, 8 pages.;;Portions of U.S. Ser. No. 09/322,073, ""A System, Method, and Article of Manufacture for a Web-Based Architecture Sales Tool"", Attorney Docket No. M&G 8567.108US01, filed May 27, 1999, 8 pages.;;Portions of U.S. Ser. No. 09/320,921, ""A System, Method, and Article of Manufacture for Building, Managing, and Supporting Various Components of a System"", Attorney Docket No. M&G 8567.109US01, filed May 27, 1999, 8 pages.;;Portions of U.S. Ser. No. 09/321,494, ""A System, Method, and Article of Manufacture for Identifying Where Various Products are Focused in a Web Architecture Framework"", Attorney Docket No. M&G 8567.110US01, filed May 27, 1999, 8 pages.;;Portions of U.S. Ser. No. 09/320,816, ""A System, Method, and Article of Manufacture for Business Alliance Identification in a Web Architecture Framework"", Attorney Docket No. M&G 8567.111US01, filed May 27, 1999, 8 pages.;;Portions of U.S. Ser. No. 09/321,135, ""A System, Method, and Article of Manufacture for Establishing a Plan to Test Components of a Web Based Framework"", Attorney Docket No. M&G 8567.112US01, filed May 27, 1999, 8 pages.;;Portions of U.S. Ser. No. 09/321,950, ""Methods, Concepts and Technology for a Virtual Shopping System Capable of Storing Previous Shopping Experiences for Later Reuse"", Attorney Docket No. M&G 8567.113US01, filed May 27, 1999, 7 pages.",EXPIRED
4,WO,A2,WO 2000/073955 A2,170-780-577-816-763,2000-12-07,2000,US 0014357 W,2000-05-24,US 32149599 A,1999-05-27,"METHODS, CONCEPTS AND TECHNOLOGY FOR A VIRTUAL SHOPPING SYSTEM CAPABLE OF ASSESSING NEEDS OF A CUSTOMER AND RECOMMENDING A PRODUCT OR SERVICE BASED ON SUCH ASSESSED NEEDS","La présente invention concerne un système permettant de réaliser des transactions commerciales virtuelles après identification des besoins de l'utilisateur. Tout d'abord, le système évalue les besoins d'un utilisateur. Il génère ensuite, sur la base des besoins de l'utilisateur, une solution, qui est affichée. Un paiement est alors accepté en échange de la solution. Il convient de noter que dans le cadre du présent descriptif de l'invention, ladite solution est, mais pas exclusivement, un produit ou un service.",ANDERSEN CONSULTING LLP,GUHEEN MICHAEL F;;MITCHELL JAMES D;;BARRESE JAMES J,,https://lens.org/170-780-577-816-763,Patent Application,yes,0,32,5,5,0,G06Q30/02,G06Q30/00,,0,0,,,,PENDING
5,WO,A8,WO 2000/073958 A8,196-322-342-848-66X,2008-01-17,2008,US 0014459 W,2000-05-24,US 32081899 A,1999-05-27,"METHODS, CONCEPTS AND TECHNOLOGY FOR DYNAMIC COMPARISON OF PRODUCT FEATURES AND CUSTOMER PROFILE",,ACCENTURE LLP,GUHEEN MICHAEL F;;MITCHELL JAMES D;;BARRESE JAMES J,,https://lens.org/196-322-342-848-66X,Patent Application,no,0,0,4,4,0,G06Q30/02,G06Q30/00,,0,0,,,,PENDING
6,WO,A2,WO 2000/073957 A2,101-316-707-890-979,2000-12-07,2000,US 0014420 W,2000-05-25,US 32149299 A,1999-05-27,"A SYSTEM, METHOD, AND ARTICLE OF MANUFACTURE FOR PROVIDING COMMERCE-RELATED WEB APPLICATION SERVICES","A system, method, and article of manufacture are provided that afford a combination of commerce-related web application services. Various features are included such as allowing purchase of products and services via a displayed catalog. As an option, such catalog may be personalized. In various embodiments, a virtual shopping cart environment may be provided. Further, data, i.e. specifications, details, etc., relating to the products and services may be displayed along with a comparison between different products and services. Data relating to needs of a user may also be received for the purpose of outputting a recommendation of the products and services based on the inputted needs. Optionally, features of the products and services may be listed in order to allow the user to configure a specifically tailored product or service. Yet another aspect of the present invention includes outputting an estimate relating to a price and/or availability of the products and services. Further, an order for the products and services may be received after which a tax and a shipping fee are calculated. A status of the delivery of the ordered products and services may also be provided.",ANDERSEN CONSULTING LLP,GUHEEN MICHAEL F;;MITCHELL JAMES D;;BARRESE JAMES J,,https://lens.org/101-316-707-890-979,Patent Application,yes,0,14,3,3,0,G06Q30/06,G06Q30/00,,0,0,,,,PENDING
7,US,A1,US 2004/0107125 A1,092-586-035-938-567,2004-06-03,2004,US 66203703 A,2003-09-12,US 66203703 A;;US 32081699 A,1999-05-27,Business alliance identification in a web architecture,"
   A system, method and article of manufacture are provided for identifying alliances among a plurality of business entities in components of a network framework. First, alliances are identified among a plurality of business entities in terms of components of a current network framework. Next, a pictorial representation is displayed of the current network framework and the components. The alliances are then conveyed by indicia coding the components of the current network framework in which the alliances exist. 
",ACCENTURE LLP,GUHEEN MICHAEL F;;MITCHELL JAMES D;;BARRESE JAMES J,ACCENTURE GLOBAL SERVICES LIMITED (2010-09-01);;ACCENTURE GLOBAL SERVICES GMBH (2010-08-31),https://lens.org/092-586-035-938-567,Patent Application,yes,16,992,6,6,0,G06Q50/01;;G06Q99/00;;G06Q99/00;;G06Q50/01,G06F17/00;;G06Q99/00,705/7,0,0,,,,EXPIRED
8,WO,A2,WO 2000/073958 A2,049-905-312-432-203,2000-12-07,2000,US 0014459 W,2000-05-24,US 32081899 A,1999-05-27,"METHODS, CONCEPTS AND TECHNOLOGY FOR DYNAMIC COMPARISON OF PRODUCT FEATURES AND CUSTOMER PROFILE","The present invention is provided for comparison shopping by utilizing a customer's profile to prioritize the features of a group of similar, competing products. First, a customer's profile is developed. This profile may be developed from many sources including customer input, customer buying habits, customer income level, customer searching habits, customer profession, customer education level, customer's purpose of the pending sale, customer's shopping habits, etc. Next, the customer selects multiple, similar items, i.e. products or services to compare. Finally, a comparison table is presented which prioritizes the features in accordance with the customer's profile.",ANDERSEN CONSULTING LLP,GUHEEN MICHAEL F;;MITCHELL JAMES D;;BARRESE JAMES J,,https://lens.org/049-905-312-432-203,Patent Application,yes,0,28,4,4,0,G06Q30/02,G06Q30/00,,0,0,,,,PENDING
9,AU,A,AU 2000/050443 A,049-578-309-212-757,2000-12-18,2000,AU 2000/050443 A,2000-05-24,US 32149599 A;;US 0014357 W,1999-05-27,"Methods, concepts and technology for a virtual shopping system capable of assessing needs of a customer and recommending a product or service based on such assessed needs",,ANDERSEN CONSULTING LLP,GUHEEN MICHAEL F;;MITCHELL JAMES D;;BARRESE JAMES J,,https://lens.org/049-578-309-212-757,Patent Application,no,0,0,5,5,0,G06Q30/02,G06Q30/00,,0,0,,,,DISCONTINUED
10,WO,A2,WO 2000/073956 A2,196-402-822-710-053,2000-12-07,2000,US 0014406 W,2000-05-24,US 32127499 A,1999-05-27,"A SYSTEM, METHOD, AND ARTICLE OF MANUFACTURE FOR PRIORITIZING COMPONENTS OF A NETWORK FRAMEWORK REQUIRED FOR IMPLEMENTATION OF TECHNOLOGY","A system, method, and article of manufacture are provided for prioritizing components of an existing network framework. First, a priority is determined among a plurality of components required for implementation of a predetermined technology using an existing network framework. The existing network framework and the plurality of components are then pictorially represented. Next, a first component of the existing network framework is indicia coded in order to indicate that the first component must be implemented first. Thereafter, a second component and any remaining components of the existing network framework are indicia encoded in order to indicate that the second components and any remaining components must be implemented after the first component.",ANDERSEN CONSULTING LLP,GUHEEN MICHAEL F;;MITCHELL JAMES D;;BARRESE JAMES J,,https://lens.org/196-402-822-710-053,Patent Application,yes,0,6,6,6,0,G06Q10/06;;G06Q10/06,G06Q10/06,,0,0,,,,PENDING
11,AU,A,AU 2000/050451 A,028-028-400-834-831,2000-12-18,2000,AU 2000/050451 A,2000-05-25,US 32149299 A;;US 0014420 W,1999-05-27,"A system, method, and article of manufacture for providing commerce-related web application services",,ANDERSEN CONSULTING LLP,GUHEEN MICHAEL F;;MITCHELL JAMES D;;BARRESE JAMES J,,https://lens.org/028-028-400-834-831,Patent Application,no,0,0,3,3,0,G06Q30/06,G06Q30/00,,0,0,,,,DISCONTINUED
12,WO,A3,WO 2000/073956 A3,043-604-807-786-479,2002-09-12,2002,US 0014406 W,2000-05-24,US 32127499 A,1999-05-27,"SYSTEM, METHOD AND COMPUTER PROGRAM FOR REPRESENTING PRIORITY INFORMATION CONCERNING COMPONENTS OF A SYSTEM","A system, method, and article of manufacture are provided for prioritizing components of an existing network framework. First, a priority is determined among a plurality of components required for implementation of a predetermined technology using an existing network framework. The existing network framework and the plurality of components are then pictorially represented. Next, a first component of the existing network framework is indicia coded in order to indicate that the first component must be implemented first. Thereafter, a second component and any remaining components of the existing network framework are indicia encoded in order to indicate that the second components and any remaining components must be implemented after the first component.",ANDERSEN CONSULTING LLP,GUHEEN MICHAEL F;;MITCHELL JAMES D;;BARRESE JAMES J,,https://lens.org/043-604-807-786-479,Search Report,yes,0,0,6,6,0,G06Q10/06;;G06Q10/06,G06Q10/06,,4,4,136-882-372-830-718;;023-192-652-686-866;;091-160-316-239-872;;091-555-081-016-258,10.1109/67.60743;;10.1109/iemt.1991.279784;;10.1109/38.689658;;10.1109/etfa.1996.574001,"IMHOF K ET AL: ""Show It With Colors-connectivity, status, and value information in energy management systems"", IEEE COMPUTER APPLICATIONS IN POWER, OCT. 1990, USA, vol. 3, no. 4, pages 11 - 16, XP002186466, ISSN: 0895-0156;;HAWLEY J ET AL: ""Paperless assembly using touchscreen based graphics"", ELEVENTH IEEE/CHMT INTERNATIONAL ELECTRONICS MANUFACTURING TECHNOLOGY SYMPOSIUM (CAT. NO.91CH3043-7), SAN FRANCISCO, CA, USA, 16-18 SEPT. 1991, 1991, New York, NY, USA, IEEE, USA, pages 231 - 234, XP002186467, ISBN: 0-7803-0155-2;;CHUAH M C ET AL: ""Information rich glyphs for software management data"", IEEE COMPUTER GRAPHICS AND APPLICATIONS, JULY-AUG. 1998, IEEE, USA, vol. 18, no. 4, pages 24 - 29, XP002186468, ISSN: 0272-1716;;BICESARE F ET AL: ""An interactive multimedia learning module for manufacturing scheduling"", PROCEEDINGS. 1996 IEEE CONFERENCE ON EMERGING TECHNOLOGIES AND FACTORY AUTOMATION. EFTA '96 (CAT. NO.96TH8238), PROCEEDINGS 1996 IEEE CONFERENCE ON EMERGING TECHNOLOGIES AND FACTORY AUTOMATION. ETFA '96, KAUAI, HI, USA, 18-21 NOV. 1996, 1996, New York, NY, USA, IEEE, USA, pages 770 - 776 vol.2, XP002186469, ISBN: 0-7803-3685-2",PENDING
13,WO,A8,WO 2000/073930 A8,070-803-724-268-079,2001-11-08,2001,US 0014458 W,2000-05-24,US 32136099 A,1999-05-27,"A SYSTEM, METHOD, AND ARTICLE OF MANUFACTURE FOR PHASE DELIVERY OF COMPONENTS OF A SYSTEM REQUIRED FOR IMPLEMENTATION OF TECHNOLOGY","L'invention concerne un système, un procédé et un article manufacturé destinés à afficher des phases de fourniture de composants d'un système, en affichant d'abord une représentation picturale d'un système existant comprenant plusieurs composants. Ensuite, une première série de composants à fournir dans une première phase est présentée. Cette opération s'effectue par codage indiciel de la première série de composants, de façon spécifique. Par la suite, une deuxième série de composants à fournir dans une deuxième phase est présentée. Cette opération s'effectue par codage indiciel de la deuxième série de composants, de façon unique par rapport au codage indiciel de la première série de composants.",ACCENTURE LLP,GUHEEN MICHAEL F;;MITCHELL JAMES D;;BARRESE JAMES J,,https://lens.org/070-803-724-268-079,Patent Application,no,0,0,4,4,0,G06Q10/063;;G06Q10/0631;;G06Q10/06313;;G06Q10/087;;G06T11/206;;G06T11/206;;G06Q10/0631;;G06Q10/06313;;G06Q10/087;;G06Q10/063,G06T11/20,,0,0,,,,PENDING
14,WO,A8,WO 2000/073955 A8,183-532-432-091-414,2001-08-02,2001,US 0014357 W,2000-05-24,US 32149599 A,1999-05-27,"METHODS, CONCEPTS AND TECHNOLOGY FOR A VIRTUAL SHOPPING SYSTEM CAPABLE OF ASSESSING NEEDS OF A CUSTOMER AND RECOMMENDING A PRODUCT OR SERVICE BASED ON SUCH ASSESSED NEEDS","La présente invention concerne un système permettant de réaliser des transactions commerciales virtuelles après identification des besoins de l'utilisateur. Tout d'abord, le système évalue les besoins d'un utilisateur. Il génère ensuite, sur la base des besoins de l'utilisateur, une solution, qui est affichée. Un paiement est alors accepté en échange de la solution. Il convient de noter que dans le cadre du présent descriptif de l'invention, ladite solution est, mais pas exclusivement, un produit ou un service.",ACCENTURE LLP,GUHEEN MICHAEL F;;MITCHELL JAMES D;;BARRESE JAMES J,,https://lens.org/183-532-432-091-414,Patent Application,no,0,0,5,5,0,G06Q30/02,G06Q30/00,,0,0,,,,PENDING
15,WO,A2,WO 2000/073930 A2,074-321-814-901-214,2000-12-07,2000,US 0014458 W,2000-05-24,US 32136099 A,1999-05-27,"A SYSTEM, METHOD, AND ARTICLE OF MANUFACTURE FOR PHASE DELIVERY OF COMPONENTS OF A SYSTEM REQUIRED FOR IMPLEMENTATION OF TECHNOLOGY","L'invention concerne un système, un procédé et un article manufacturé destinés à afficher des phases de fourniture de composants d'un système, en affichant d'abord une représentation picturale d'un système existant comprenant plusieurs composants. Ensuite, une première série de composants à fournir dans une première phase est présentée. Cette opération s'effectue par codage indiciel de la première série de composants, de façon spécifique. Par la suite, une deuxième série de composants à fournir dans une deuxième phase est présentée. Cette opération s'effectue par codage indiciel de la deuxième série de composants, de façon unique par rapport au codage indiciel de la première série de composants.",ANDERSEN CONSULTING LLP,GUHEEN MICHAEL F;;MITCHELL JAMES D;;BARRESE JAMES J,,https://lens.org/074-321-814-901-214,Patent Application,yes,0,10,4,4,0,G06Q10/063;;G06Q10/0631;;G06Q10/06313;;G06Q10/087;;G06T11/206;;G06T11/206;;G06Q10/0631;;G06Q10/06313;;G06Q10/087;;G06Q10/063,G06T11/20,,0,0,,,,PENDING
