38,US,B1,US 6957186 B1,181-251-611-622-117,2005-10-18,2005,US 32092199 A,1999-05-27,US 32092199 A,1999-05-27,"System method and article of manufacture for building, managing, and supporting various components of a system","A system, method and article of manufacture are provided for identifying various components of a system for building, management, and support purposes. A pictorial representation of an existing system is first displayed along with a plurality of components thereof. Next, information is presented relating to building, managing, and supporting the components of the existing system by indicia coding the components on the pictorial representation. The building, management, and support information relates more specifically to deliverable features of the components of the existing system that are available in a business offering.",ACCENTURE LLP,GUHEEN MICHAEL F;;MITCHELL JAMES D;;BARRESE JAMES J,ACCENTURE GLOBAL SERVICES LIMITED (2010-09-01);;ACCENTURE LLP (2001-01-02);;ACCENTURE GLOBAL SERVICES GMBH (2010-08-31),https://lens.org/181-251-611-622-117,Granted Patent,yes,21,887,1,1,0,G06Q99/00;;G06Q99/00;;G06Q90/20;;G06Q90/20,G06Q99/00,705/1,35,0,,,"Smith et al; Performance engineering of object-oriented systems; Nov 1997; Capacity Management Review v25n11, pp 1-18; Dialog copy pp. 1-12.;;Portions of U.S. Appl. No. 09/321,492, ""A System, Method and Article of Manufacture for Providing Commerce-Related Web Application Services"", filed May 27, 1999, 9 pages.;;Portions of U.S. Appl. No. 09/320,819, ""A System, Method and Article of Manufacture for Providing Commerce-Related Web Application Services"", filed May 27, 1999, 8 pages.;;Portions of U.S. Appl. No. 09/321,280, ""A System, Method and Article of Manufacture for Providing Web Application Services to Manage Customer Relations"", filed May 27, 1999, 8 pages.;;Portions of U.S. Appl. No. 09/321,951, ""A System, Method and Article of Manufacture for Providing Content Management-Related Web Application Services"", filed May 27, 1999, 8 pages.;;Portions of U.S. Appl. No. 09/321,053, ""A System, Method and Article of Manufacture for Providing Education-Related Web Application Services"", filed May 27, 1999, 8 pages.;;Portions of U.S. Appl. No. 09/321,493, ""A System, Method and Article of Manufacture for Providing Customer Service-Related Web Application Services"", filed May 27, 1999, 8 pages.;;Portions of U.S. Appl. No. 09/321,359, ""A System, Method and Article of Manufacture for Providing Security Services in a Web Architecture Framework"", filed May 27, 1999, 8 pages.;;Portions of U.S. Appl. No. 09/321,949, ""A System, Method and Article of Manufacture for Providing Network Services in a Web Architecture Framework"", filed May 27, 1999, 9 pages.;;Portions of U.S. Appl. No. 09/321,953, ""A System, Method and Article of Manufacture for Providing Internet Services in a Web Architecture Framework"", filed May 27, 1999, 10 pages.;;Portions of U.S. Appl. No. 09/321,361, ""A System, Method and Article of Manufacture for Providing Client Services in a Web Architecture Framework"", filed May 27, 1999, 7 pages.;;Portions of U.S. Appl. No. 09/322,105, ""A System, Method and Article of Manufacture for Providing Data Services in a Web Architecture Framework"", filed May 27, 1999, 8 pages.;;Portions of U.S. Appl. No. 09/321,304, ""A System, Method and Article of Manufacture for Providing Integration Capabilities in a Web Architecture Framework"", filed May 27, 1999, 8 pages.;;Portions of U.S. Appl. No. 09/320,820, ""A System, Method and Article of Manufacture for Providing Multiple Capabilities in a Web Architecture Framework"", filed May 27, 1999, 8 pages.;;Portions of U.S. Appl. No. 09/321,052, ""A System, Method and Article of Manufacture for Providing Directory Services in a Web Architecture Framework"", filed May 27, 1999, 8 pages.;;Portions of U.S. Appl. No. 09/320,817, ""A System, Method and Article of Manufacture for Providing Management and Operations in a Web Architecture Framework"", filed May 27, 1999, 8 pages.;;Portions of U.S. Appl. No. 09/321,358, ""A System, Method and Article of Manufacture for Providing Developer Services in a Web Architecture Framework"", filed May 27, 1999, 8 pages.;;Portions of U.S. Appl. No. 09/321,495, ""Methods, Concepts and Technology for a Virtual Shopping System Capable of Assessing Needs of a Customer and Recommending a Product or Service Based on Such Assessed Needs"", filed May 27, 1999, 7 pages.;;Portions of U.S. Appl. No. 09/321,303, ""Methods, Concepts and Technology for a Virtual Shopping System Capable of Allowing a User to Customize Products/Services that are Available for Purchase"", filed May 27, 1999, 7 pages.;;Portions of U.S. Appl. No. 09/321,305, ""Methods, Concepts and Technology for a Virtual Shopping System Capable of Advertising Based on Products/Services that are Available for Purchase"", filed May 27, 1999, 7 pages.;;Portions of U.S. Appl. No. 09/321,514, ""Methods, Concepts and Technology for a Virtual Shopping System Capable of Selectively Determining Prices and Availablity on Products/Services Based on a Profile of a Current User"", filed May 27, 1999, 7 pages.;;Portions of U.S. Appl. No. 09/321,134, ""Methods, Concepts and Technology for Curriculum Generation Based on a User Profile in an internet Based Environment"", filed May 27, 1999, 7 pages.;;Portions of U.S. Appl. No. 09/321,954, ""Methods, Concepts and Technology for Proactive Service Delivery Based on a User Profile in an Internet Based Environment"", filed May 27, 1999, 7 pages.;;Portions of U.S. Appl. No. 09/321,273, ""Methods, Concepts and Technology for Dynamic Customer Profile Management"", filed May 27, 1999, 7 pages.;;Portions of U.S. Appl. No. 09/320,818, ""Methods, Concepts and Technology for Dynamic Comparison of Product Features and Customer Profile"", filed May 27, 1999, 7 pages.;;Portions of U.S. Appl. No. 09/321,952, ""A System, Method, and Article of Manufacture for Identification of Redundancies and Omissions Among Components of a Web Based Architecture"", filed May 27, 1999, 8 pages.;;Portions of U.S. Appl. No. 09/321,136, ""A System, Method, and Article of Manufacture for Effectively Conveying Which Components of a System are Required for Implementation of Technology"", filed May 27, 1999, 8 pages.;;Portions of U.S. Appl. No. 09/321,274, ""A System, Method, and Article of Manufacture for Prioritizing Components of a Network Framework Required for Implementation of Technology"", filed May 27, 1999, 9 pages.;;Portions of U.S. Appl. No. 09/321,360, ""A System, Method, and Article of Manufacture for Phase Delivery of Components of a System Required for Implementation of Technology"", filed May 27, 1999, 8 pages.;;Portions of U.S. Appl. No. 09/321,279, ""A System, Method, and Article of Manufacture for Comparatively Analyzing Vendors of Components Required for a Web-Based Architecture"", filed May 27, 1999, 8 pages.;;Portions of U.S. Appl. No. 09/322,073, ""A System, Method, and Article of Manufacture for a Web-Based Architecture Sales Tool"", filed May 27, 1999, 8 pages.;;Portions of U.S. Appl. No. 09/321,494, ""A System, Method, and Article of Manufacture for Identifying Where Various Products are Focused in a Web Architecture Framework"", filed May 27, 1999, 8 pages.;;Portions of U.S. Appl. No. 09/320,816, ""A System, Method, and Article of Manufacture for Business Alliance Identification in a Web Architecture Framework"", filed May 27, 1999, 8 pages.;;Portions of U.S. Appl. No. 09/321,135, ""A System, Method, and Article of Manufacture for Establishing a Plan to Test Components of a Web Based Framework"", filed May 27, 1999, 8 pages.;;Portions of U.S. Appl. No. 09/321,950, ""Methods, Concepts and Technology for a Virtual Shopping System Capable of Storing Previous Shopping Experiences for Later Reuse"", filed May 27, 1999, 7 pages.",EXPIRED
39,AU,A,AU 2000/050456 A,069-452-681-067-48X,2000-12-18,2000,AU 2000/050456 A,2000-05-24,US 32113699 A;;US 0014457 W,1999-05-27,"A system, method, and article of manufacture for effectively conveying which components of a system are required for implementation of technology",,ANDERSEN CONSULTING LLP,GUHEEN MICHAEL F;;MITCHELL JAMES D;;BARRESE JAMES J,,https://lens.org/069-452-681-067-48X,Patent Application,no,0,0,4,4,0,G06Q30/02;;H04L41/0213;;H04L41/145;;H04L41/50;;H04L43/00;;H04L43/0811;;H04L43/0817;;H04L43/0847;;H04L43/16;;H04L67/02;;H04L69/329;;H04L67/75,G06Q30/00;;H04L12/24;;H04L12/26;;H04L29/06;;H04L29/08,,0,0,,,,DISCONTINUED
40,EP,A2,EP 1190353 A2,127-403-152-496-941,2002-03-27,2002,EP 00932768 A,2000-05-24,US 0014357 W;;US 32149599 A,1999-05-27,"METHODS, CONCEPTS AND TECHNOLOGY FOR A VIRTUAL SHOPPING SYSTEM CAPABLE OF ASSESSING NEEDS OF A CUSTOMER AND RECOMMENDING A PRODUCT OR SERVICE BASED ON SUCH ASSESSED NEEDS",,ACCENTURE LLP,GUHEEN MICHAEL F;;MITCHELL JAMES D;;BARRESE JAMES J,,https://lens.org/127-403-152-496-941,Patent Application,yes,0,0,5,5,0,G06Q30/02,G06Q30/00,,0,0,,,,DISCONTINUED
41,US,A1,US 2023/0086796 A1,006-713-606-523-753,2023-03-23,2023,US 202117448222 A,2021-09-21,US 202117448222 A,2021-09-21,SYSTEM AND METHOD FOR ANALYZING DECURLER SETTINGS USING AUGMENTED REALITY,"A method of analyzing decurling settings for a print request including a plurality of sheets, the method including receiving a real image of a first portion of the plurality of sheets, receiving a first input, displaying one or more decurler settings, and displaying a first augmented image of a stack of the plurality of sheets.",XEROX CORP,LUBIN DARA NANETTE;;BARRESE ELIZABETH LEE;;DUFORT RON EDWARD;;OCHS MATTHEW JAMES,XEROX CORPORATION (2021-09-20),https://lens.org/006-713-606-523-753,Patent Application,yes,3,0,2,2,0,H04N1/00647;;H04N1/00411;;H04N1/00257;;G06F3/1208;;G06F3/1282;;G06F3/1256;;G06F3/1208;;G06F3/1256;;H04N1/00647;;H04N1/00257;;H04N1/00411;;G06T19/006,G06F3/12;;G06T19/00;;H04N1/00,,0,0,,,,ACTIVE
42,US,B1,US 11604612 B1,151-283-036-826-719,2023-03-14,2023,US 202117448222 A,2021-09-21,US 202117448222 A,2021-09-21,System and method for analyzing decurler settings using augmented reality,"A method of analyzing decurling settings for a print request including a plurality of sheets, the method including receiving a real image of a first portion of the plurality of sheets, receiving a first input, displaying one or more decurler settings, and displaying a first augmented image of a stack of the plurality of sheets.",XEROX CORP,LUBIN DARA NANETTE;;BARRESE ELIZABETH LEE;;DUFORT RON EDWARD;;OCHS MATTHEW JAMES,XEROX CORPORATION (2021-09-20),https://lens.org/151-283-036-826-719,Granted Patent,yes,7,0,2,2,0,H04N1/00647;;H04N1/00411;;H04N1/00257;;G06F3/1208;;G06F3/1282;;G06F3/1256;;G06F3/1208;;G06F3/1256;;H04N1/00647;;H04N1/00257;;H04N1/00411;;G06T19/006,G06F3/12;;G06T19/00;;H04N1/00,,0,0,,,,ACTIVE
43,JP,A,JP 2023103969 A,064-600-303-500-573,2023-07-27,2023,JP 2022207931 A,2022-12-26,US 202217648005 A,2022-01-14,SYSTEM AND METHOD FOR RETRIEVING AND DISPLAYING PRINT ATTRIBUTES USING AUGMENTED REALITY,"To provide a system and method for retrieving print attributes and displaying the print attributes over a printed sheet of a print job using augmented reality (AR).SOLUTION: A method of automatically displaying a predetermined set of print attributes of a print job includes: receiving an image of a first printed sheet, the first printed sheet including one or more at least partial machine-readable codes, the one or more at least partial machine-readable codes encoded with data related to the predetermined set of print attributes; decoding the data from the one or more at least partial machine-readable codes; determining if the data includes all of the print attributes in the predetermined set of print attributes; and, if the data includes all of the print attributes in the predetermined set of print attributes, displaying the data using augmented reality (AR) over the first printed sheet.SELECTED DRAWING: Figure 3",XEROX CORP,DARA NANOTTE LUBIN;;ELIZABETH LEE BARRESE;;RON EDWARD DUFORT;;MATTHEW JAMES OCHS,,https://lens.org/064-600-303-500-573,Patent Application,no,0,0,3,3,0,H04N1/32133;;H04N2201/3212;;H04N2201/3216;;H04N2201/3221;;H04N2201/3222;;H04N2201/3223;;H04N2201/3252;;H04N2201/326;;H04N2201/3269;;H04N2201/3271;;H04N2201/3276;;G06F3/1204;;G06F3/1257;;G06F3/1253;;G06F3/1285;;G06K7/1417;;G06K7/1443;;G06T11/00;;H04N1/32138,G06F3/12;;G06F3/0481;;G06T19/00;;H04N1/387,,0,0,,,,PENDING
44,US,A1,US 2023/0230291 A1,191-617-789-103-775,2023-07-20,2023,US 202217648005 A,2022-01-14,US 202217648005 A,2022-01-14,SYSTEM AND METHOD FOR RETRIEVING AND DISPLAYING PRINT ATTRIBUTES USING AUGMENTED REALITY,"A method of automatically displaying a predetermined set of print attributes of a print job, the method including receiving an image of a first printed sheet, the first printed sheet including one or more at least partial machine-readable codes, the one or more at least partial machine-readable codes encoded with data related to the predetermined set of print attributes, decoding the data from the one or more at least partial machine-readable codes, determining if the data includes all of the print attributes in the predetermined set of print attributes, and if the data includes all of the print attributes in the predetermined set of print attributes, displaying the data using augmented reality (AR) over the first printed sheet.",XEROX CORP,LUBIN DARA NANETTE;;BARRESE ELIZABETH LEE;;DUFORT RON EDWARD;;OCHS MATTHEW JAMES,XEROX CORPORATION (2022-01-11),https://lens.org/191-617-789-103-775,Patent Application,yes,7,0,3,3,0,H04N1/32133;;H04N2201/3212;;H04N2201/3216;;H04N2201/3221;;H04N2201/3222;;H04N2201/3223;;H04N2201/3252;;H04N2201/326;;H04N2201/3269;;H04N2201/3271;;H04N2201/3276;;G06F3/1204;;G06F3/1257;;G06F3/1253;;G06F3/1285;;G06K7/1417;;G06K7/1443;;G06T11/00;;H04N1/32138,G06T11/00;;G06K7/14;;H04N1/32,,2,2,053-260-578-492-851;;055-944-528-377-732,10.1145/3214286;;10.1016/j.measurement.2012.11.037,"Song C, Li Z, Xu W, Zhou C, Jin Z, Ren K. My smartphone recognizes genuine QR codes! practical unclonable qr code via 3D printing. Proceedings of the ACM on Interactive, Mobile, Wearable and Ubiquitous Technologies. 2018 Jul 5;2(2):1-20. (Year: 2018);;Lundström J, Verikas A, Tullander E, Larsson B. Assessing, exploring, and monitoring quality of offset colour prints. Measurement. 2013 May 1;46(4):1427-41.",PENDING
45,EP,A1,EP 4213476 A1,134-975-807-397-758,2023-07-19,2023,EP 22217108 A,2022-12-29,US 202217648005 A,2022-01-14,SYSTEM AND METHOD FOR RETRIEVING AND DISPLAYING PRINT ATTRIBUTES USING AUGMENTED REALITY,"A method of automatically displaying a predetermined set of print attributes of a print job, the method including receiving an image of a first printed sheet, the first printed sheet including one or more at least partial machine-readable codes, the one or more at least partial machine-readable codes encoded with data related to the predetermined set of print attributes, decoding the data from the one or more at least partial machine-readable codes, determining if the data includes all of the print attributes in the predetermined set of print attributes, and if the data includes all of the print attributes in the predetermined set of print attributes, displaying the data using augmented reality (AR) over the first printed sheet.
",XEROX CORP,LUBIN DARA NANETTE;;BARRESE ELIZABETH LEE;;DUFORT RON EDWARD;;OCHS MATTHEW JAMES,,https://lens.org/134-975-807-397-758,Patent Application,yes,5,0,3,3,0,H04N1/32133;;H04N2201/3212;;H04N2201/3216;;H04N2201/3221;;H04N2201/3222;;H04N2201/3223;;H04N2201/3252;;H04N2201/326;;H04N2201/3269;;H04N2201/3271;;H04N2201/3276;;G06F3/1204;;G06F3/1257;;G06F3/1253;;G06F3/1285;;G06K7/1417;;G06K7/1443;;G06T11/00;;H04N1/32138,H04N1/32;;G06F3/12,,0,0,,,,PENDING
46,WO,A2,WO 2005/010650 A2,185-377-220-080-866,2005-02-03,2005,US 2004/0014997 W,2004-05-12,US 48482703 P,2003-07-03,METHOD AND SYSTEM FOR MANAGING DATA TRANSACTION REQUESTS,A method and system is provided to process data transactions in a data store including a plurality of databases. The system may comprise a computer interface module to receive a data transaction request from at least one requesting computer and a data store interface module to interface the system to the plurality of databases. The system also includes a data access layer defining an abstraction layer to identify at least one database of the plurality of databases. The data transaction request may be an object orientated request and the plurality of databases may be horizontally distributed wherein the data access layer defines an object orientated abstraction layer between the computer interface module and the plurality of databases. In one embodiment a data dependent routing module is provided that generates a query to a database that is identified based on content of the data in the data transaction request.,EBAY INC;;GROSSFELD ELENA;;WIDJOJO SURJATINI;;LOCKERT THORSTEN;;SEITZ GREG;;BARRESE JAMES;;WIGGINTON RANDY;;KASTEN CHRIS,GROSSFELD ELENA;;WIDJOJO SURJATINI;;LOCKERT THORSTEN;;SEITZ GREG;;BARRESE JAMES;;WIGGINTON RANDY;;KASTEN CHRIS,,https://lens.org/185-377-220-080-866,Patent Application,yes,0,20,11,11,0,G06F9/505;;G06F16/2365;;G06F16/2365;;G06F9/505;;Y10S707/966;;Y10S707/968;;Y10S707/969,G06F/,,0,0,,,,PENDING
47,WO,A3,WO 2005/010650 A3,177-152-788-178-324,2005-03-31,2005,US 2004/0014997 W,2004-05-12,US 48482703 P,2003-07-03,METHOD AND SYSTEM FOR MANAGING DATA TRANSACTION REQUESTS,A method and system is provided to process data transactions in a data store including a plurality of databases. The system may comprise a computer interface module to receive a data transaction request from at least one requesting computer and a data store interface module to interface the system to the plurality of databases. The system also includes a data access layer defining an abstraction layer to identify at least one database of the plurality of databases. The data transaction request may be an object orientated request and the plurality of databases may be horizontally distributed wherein the data access layer defines an object orientated abstraction layer between the computer interface module and the plurality of databases. In one embodiment a data dependent routing module is provided that generates a query to a database that is identified based on content of the data in the data transaction request.,EBAY INC;;GROSSFELD ELENA;;WIDJOJO SURJATINI;;LOCKERT THORSTEN;;SEITZ GREG;;BARRESE JAMES;;WIGGINTON RANDY;;KASTEN CHRIS,GROSSFELD ELENA;;WIDJOJO SURJATINI;;LOCKERT THORSTEN;;SEITZ GREG;;BARRESE JAMES;;WIGGINTON RANDY;;KASTEN CHRIS,,https://lens.org/177-152-788-178-324,Search Report,yes,1,0,11,11,0,G06F9/505;;G06F16/2365;;G06F16/2365;;G06F9/505;;Y10S707/966;;Y10S707/968;;Y10S707/969,G06F/,,0,0,,,,PENDING
48,US,A1,US 2016/0132864 A1,197-371-302-189-281,2016-05-12,2016,US 201514934813 A,2015-11-06,US 201514934813 A;;US 201462076667 P,2014-11-07,PAYMENT PROCESSING APPARATUS,"A payment processing apparatus and a system or a method are provided that have a location-agnostic payment code, where the user does not have to check in to the merchant's location. Further, the reliance on the network connection is reduced by caching or storing payment codes at the user's mobile device. The payment codes may have expiration and may be used once. The payment codes may be revoked or canceled if the user's mobile device is compromised or stolen. In an embodiment, the payment codes may be generated and provided to the user's mobile device when the payment application at the user's mobile device is refreshed. For example, the payment application is refreshed based on user's payment history or payment habits. In another embodiment, the payment codes may be generated and provided to the user's mobile device when the user is within a predetermined distance from a merchant.",PAYPAL INC,BARRESE JAMES;;MAHESHWARI MANISH;;SEHGAL ROHAN;;PAKA AMIT;;NAIR SUNIL;;SOMANI SUKET;;RANGASWAMY BARATH;;SHAH VIDHI HIMANSHU;;LI WEIJIE,PAYPAL INC (2015-11-02),https://lens.org/197-371-302-189-281,Patent Application,yes,0,72,6,6,0,G06Q20/204;;G06Q20/3227;;G06Q20/3274;;G06Q20/3224;;G06Q20/385;;G06Q20/326;;G06Q20/3274;;G06Q20/3224;;G06Q20/385;;G06Q20/204;;G06Q20/3227,G06Q20/32;;G06K9/72;;G06Q20/38,,0,0,,,,ACTIVE
49,US,A1,US 2020/0042976 A1,001-589-090-416-406,2020-02-06,2020,US 201916505024 A,2019-07-08,US 201916505024 A;;US 201514934813 A;;US 201462076667 P,2014-11-07,PAYMENT PROCESSING APPARATUS,"A payment processing apparatus and a system or a method are provided that have a location-agnostic payment code, where the user does not have to check in to the merchant's location. Further, the reliance on the network connection is reduced by caching or storing payment codes at the user's mobile device. The payment codes may have expiration and may be used once. The payment codes may be revoked or canceled if the user's mobile device is compromised or stolen. In an embodiment, the payment codes may be generated and provided to the user's mobile device when the payment application at the user's mobile device is refreshed. For example, the payment application is refreshed based on user's payment history or payment habits. In another embodiment, the payment codes may be generated and provided to the user's mobile device when the user is within a predetermined distance from a merchant.",PAYPAL INC,BARRESE JAMES;;MAHESHWARI MANISH;;SEHGAL ROHAN;;PAKA AMIT;;NAIR SUNIL;;SOMANI SUKET;;RANGASWAMY BARATH;;SHAH VIDHI HIMANSHU;;LI WEIJIE,PAYPAL INC (2015-11-02),https://lens.org/001-589-090-416-406,Patent Application,yes,0,5,6,6,0,G06Q20/204;;G06Q20/3227;;G06Q20/3274;;G06Q20/3224;;G06Q20/385;;G06Q20/326;;G06Q20/3274;;G06Q20/3224;;G06Q20/385;;G06Q20/204;;G06Q20/3227,G06Q20/32;;G06Q20/20;;G06Q20/38,,0,0,,,,ACTIVE
50,US,A1,US 2022/0207512 A1,086-172-351-490-074,2022-06-30,2022,US 202217671523 A,2022-02-14,US 202217671523 A;;US 201916505024 A;;US 201514934813 A;;US 201462076667 P,2014-11-07,PAYMENT PROCESSING APPARATUS,"A payment processing apparatus and a system or a method are provided that have a location-agnostic payment code, where the user does not have to check in to the merchant's location. Further, the reliance on the network connection is reduced by caching or storing payment codes at the user's mobile device. The payment codes may have expiration and may be used once. The payment codes may be revoked or canceled if the user's mobile device is compromised or stolen. In an embodiment, the payment codes may be generated and provided to the user's mobile device when the payment application at the user's mobile device is refreshed. For example, the payment application is refreshed based on user's payment history or payment habits. In another embodiment, the payment codes may be generated and provided to the user's mobile device when the user is within a predetermined distance from a merchant.",PAYPAL INC,BARRESE JAMES;;MAHESHWARI MANISH;;SEHGAL ROHAN;;PAKA AMIT;;NAIR SUNIL;;SOMANI SUKET;;RANGASWAMY BARATH;;SHAH VIDHI HIMANSHU;;LI WEIJIE,PAYPAL INC (2015-11-02),https://lens.org/086-172-351-490-074,Patent Application,yes,3,0,6,6,0,G06Q20/204;;G06Q20/3227;;G06Q20/3274;;G06Q20/3224;;G06Q20/385;;G06Q20/326;;G06Q20/3274;;G06Q20/3224;;G06Q20/385;;G06Q20/204;;G06Q20/3227,G06Q20/32;;G06Q20/20;;G06Q20/38,,0,0,,,,PENDING
51,US,B2,US 11250413 B2,012-192-128-484-919,2022-02-15,2022,US 201916505024 A,2019-07-08,US 201916505024 A;;US 201514934813 A;;US 201462076667 P,2014-11-07,Payment processing apparatus,"A payment processing apparatus and a system or a method are provided that have a location-agnostic payment code, where the user does not have to check in to the merchant's location. Further, the reliance on the network connection is reduced by caching or storing payment codes at the user's mobile device. The payment codes may have expiration and may be used once. The payment codes may be revoked or canceled if the user's mobile device is compromised or stolen. In an embodiment, the payment codes may be generated and provided to the user's mobile device when the payment application at the user's mobile device is refreshed. For example, the payment application is refreshed based on user's payment history or payment habits. In another embodiment, the payment codes may be generated and provided to the user's mobile device when the user is within a predetermined distance from a merchant.",PAYPAL INC,BARRESE JAMES;;MAHESHWARI MANISH;;SEHGAL ROHAN;;PAKA AMIT;;NAIR SUNIL;;SOMANI SUKET;;RANGASWAMY BARATH;;SHAH VIDHI HIMANSHU;;LI WEIJIE,PAYPAL INC (2015-11-02),https://lens.org/012-192-128-484-919,Granted Patent,yes,5,0,6,6,0,G06Q20/204;;G06Q20/3227;;G06Q20/3274;;G06Q20/3224;;G06Q20/385;;G06Q20/326;;G06Q20/3274;;G06Q20/3224;;G06Q20/385;;G06Q20/204;;G06Q20/3227,G06Q20/40;;G06Q20/20;;G06Q20/32;;G06Q20/38,,0,0,,,,ACTIVE
