136,CA,A1,CA 2467874 A1,110-890-881-201-318,2003-06-05,2003,CA 2467874 A,2002-11-25,EP 0213218 W;;US 33465301 P,2001-11-30,N-UREIDO-PIPERIDINES AS ANTAGONISTS VIII FOR CCR-3 RECEPTOR,"The invention relates to compounds of Formula (I), wherein R1 R5, A, L, and X are as defined in the specification. The compounds are useful as CCR-3 receptor antagonists, and therefore, may be used for treatment of CCR-3 mediated diseases.",HOFFMANN LA ROCHE,SJOGREN ERIC BRIAN;;KERTESZ DENIS JOHN;;SMITH DAVID BERNARD;;WANG BEIHAN;;DU BOIS DAISY JOE,,https://lens.org/110-890-881-201-318,Patent Application,no,0,0,14,60,0,A61K31/445;;A61P11/06;;A61P43/00;;C07D211/26;;C07D401/04;;C07D211/18;;C07D401/12;;C07D405/04;;C07D409/04;;C07D409/12,A61K31/445;;A61K31/4525;;A61K31/4535;;A61K31/454;;A61K31/4545;;A61K31/4709;;A61K31/4725;;A61K31/506;;A61P11/06;;A61P43/00;;C07D211/18;;C07D401/04;;C07D401/12;;C07D405/04;;C07D409/04;;C07D409/12;;C07D471/04,,0,0,,,,DISCONTINUED
137,EP,A1,EP 1453514 A1,098-168-377-097-004,2004-09-08,2004,EP 02787795 A,2002-11-25,EP 0213217 W;;US 33465501 P,2001-11-30,PIPERAZINE DERIVATIVES FOR USE AS CCR-3 RECEPTOR ANTAGONISTS IN THE TREATMENT OF ASTHMA,,HOFFMANN LA ROCHE,DU BOIS DAISY JOE;;KERTESZ DENIS JOHN;;SJOGREN ERIC BRIAN;;SMITH DAVID BERNARD;;WANG BEIHAN,,https://lens.org/098-168-377-097-004,Patent Application,yes,0,0,21,60,0,C07D295/084;;C07D295/135;;C07D307/22;;C07D333/24;;A61P1/04;;A61P11/06;;A61P27/16;;A61P37/08;;A61P43/00;;C07D295/145;;C07D405/04;;A61K31/496;;C07D295/084;;C07D295/135;;C07D307/22;;C07D333/24,C07D295/12;;A61K31/495;;A61K31/496;;A61P1/04;;A61P11/06;;A61P27/16;;A61P37/08;;A61P43/00;;C07D241/04;;C07D295/084;;C07D295/135;;C07D307/22;;C07D333/24,,0,0,,,,EXPIRED
138,DK,T3,DK 1585630 T3,125-086-931-851-712,2008-08-18,2008,DK 03812776 T,2003-10-27,US 42602302 P;;US 0333867 W,2002-11-13,Fremgangsmåde til ekstraktion af kontaktlinser,,JOHNSON & JOHNSON VISION CARE,WOOD JOE M;;BERNARD ANTHONY J;;EVANS DOUGLAS L;;SPAULDING TERRY L;;VANDERLAAN DOUGLAS G,,https://lens.org/125-086-931-851-712,Granted Patent,no,0,0,15,15,0,B29C71/0009;;B29C2071/0027;;B29D11/00067;;B29L2011/0041;;B29D11/00923;;B29D11/00317;;B29D11/00;;B29C71/0009;;B29C2071/0027;;B29L2011/0041;;B29D11/00067,B29D11/00;;B29C71/00,,0,0,,,,EXPIRED
139,HK,A1,HK 1081913 A1,135-939-737-336-551,2006-05-26,2006,HK 06102270 A,2006-02-21,US 42602302 P;;US 0333867 W,2002-11-13,METHODS FOR THE EXTRACTION OF CONTACT LENSES,,JOHNSON & JOHNSON VISION CARE,WOOD JOE M;;BERNARD ANTHONY J;;EVANS DOUGLAS L;;SPAULDING TERRY L;;VANDERLAAN DOUGLAS G,,https://lens.org/135-939-737-336-551,Patent Application,no,0,0,15,15,0,B29C71/0009;;B29C2071/0027;;B29D11/00067;;B29L2011/0041;;B29D11/00923;;B29D11/00317;;B29D11/00;;B29C71/0009;;B29C2071/0027;;B29L2011/0041;;B29D11/00067,B29D/;;B29C71/00;;B29D11/00,,0,0,,,,DISCONTINUED
140,CA,A1,CA 2505581 A1,176-220-714-638-629,2004-06-24,2004,CA 2505581 A,2003-10-27,US 42602302 P;;US 0333867 W,2002-11-13,METHODS FOR THE EXTRACTION OF CONTACT LENSES,"Disclosed are methods for extracting excess materials from contact lenses, during which the contact lenses swell above their functional size. The metho ds include the steps of treating contact lenses with a liquid, preferably a solution that causes the contact lenses to swell to a size larger than their functional size, and treating the contact lenses with a liquid, preferably a solution that causes them to shrink back to their functional size.",JOHNSON & JOHNSON VISION CARE,VANDERLAAN DOUGLAS G;;WOOD JOE M;;SPAULDING TERRY L;;EVANS DOUGLAS L;;BERNARD ANTHONY J,,https://lens.org/176-220-714-638-629,Patent Application,no,0,0,15,15,0,B29C71/0009;;B29C2071/0027;;B29D11/00067;;B29L2011/0041;;B29D11/00923;;B29D11/00317;;B29D11/00;;B29C71/0009;;B29C2071/0027;;B29L2011/0041;;B29D11/00067,B29C71/00;;B29D11/00,,0,0,,,,DISCONTINUED
141,DE,D1,DE 60221275 D1,000-887-605-785-665,2007-08-30,2007,DE 60221275 T,2002-11-25,US 33465501 P;;EP 0213217 W,2001-11-30,PIPERAZIN-DERIVATE ZUR VERWENDUNG ALS CCR-3 REZEPTOR ANTAGONISTEN ZUR BEHANDLUNG VON ASTHMA,,HOFFMANN LA ROCHE,DU BOIS DAISY JOE;;KERTESZ DENIS JOHN;;SJOGREN ERIC BRIAN;;SMITH DAVID BERNARD;;WANG BEIHAN,,https://lens.org/000-887-605-785-665,Granted Patent,no,0,0,21,60,0,C07D295/084;;C07D295/135;;C07D307/22;;C07D333/24;;A61P1/04;;A61P11/06;;A61P27/16;;A61P37/08;;A61P43/00;;C07D295/145;;C07D405/04;;A61K31/496;;C07D295/084;;C07D295/135;;C07D307/22;;C07D333/24,A61K31/496;;C07D295/12;;A61K31/495;;A61P1/04;;A61P11/06;;A61P27/16;;A61P37/08;;A61P43/00;;C07D241/04;;C07D295/02;;C07D295/084;;C07D295/135;;C07D307/22;;C07D333/22;;C07D333/24,,0,0,,,,EXPIRED
142,PL,A1,PL 370746 A1,013-397-917-823-405,2005-05-30,2005,PL 37074602 A,2002-11-25,US 33465501 P,2001-11-30,PIPERAZINE DERIVATIVES FOR USE AS CCR-3 RECEPTOR ANTAGONISTS IN THE TREATMENT OF ASTHMA,,HOFFMANN LA ROCHE,DU BOIS DAISY JOE;;KERTESZ DENIS JOHN;;SJOGREN ERICK BRIAN;;SMITH DAVID BERNARD;;WANG BEIHAN,,https://lens.org/013-397-917-823-405,Patent Application,no,0,0,21,60,0,C07D295/084;;C07D295/135;;C07D307/22;;C07D333/24;;A61P1/04;;A61P11/06;;A61P27/16;;A61P37/08;;A61P43/00;;C07D295/145;;C07D405/04;;A61K31/496;;C07D295/084;;C07D295/135;;C07D307/22;;C07D333/24,C07D295/12;;A61K31/495;;A61K31/496;;A61P1/04;;A61P11/06;;A61P27/16;;A61P37/08;;A61P43/00;;C07D241/04;;C07D295/084;;C07D295/135;;C07D307/22;;C07D333/24,,0,0,,,,DISCONTINUED
143,DE,D1,DE 60321601 D1,156-186-390-478-240,2008-07-24,2008,DE 60321601 T,2003-10-27,US 42602302 P;;US 0333867 W,2002-11-13,VERFAHREN ZUR EXTRAKTION VON KONTAKTLINSEN,,JOHNSON & JOHNSON VISION CARE,WOOD JOE M;;BERNARD ANTHONY J;;EVANS DOUGLAS L;;SPAULDING TERRY L;;VANDERLAAN DOUGLAS G,,https://lens.org/156-186-390-478-240,Granted Patent,no,0,0,15,15,0,B29C71/0009;;B29C2071/0027;;B29D11/00067;;B29L2011/0041;;B29D11/00923;;B29D11/00317;;B29D11/00;;B29C71/0009;;B29C2071/0027;;B29L2011/0041;;B29D11/00067,B29D11/00;;B29C71/00,,0,0,,,,EXPIRED
144,EP,B1,EP 1585630 B1,019-536-759-360-067,2008-06-11,2008,EP 03812776 A,2003-10-27,US 0333867 W;;US 42602302 P,2002-11-13,METHODS FOR THE EXTRACTION OF CONTACT LENSES,,JOHNSON & JOHNSON VISION CARE,WOOD JOE M;;BERNARD ANTHONY J;;EVANS DOUGLAS L;;SPAULDING TERRY L;;VANDERLAAN DOUGLAS G,,https://lens.org/019-536-759-360-067,Granted Patent,yes,3,0,15,15,0,B29C71/0009;;B29C2071/0027;;B29D11/00067;;B29L2011/0041;;B29D11/00923;;B29D11/00317;;B29D11/00;;B29C71/0009;;B29C2071/0027;;B29L2011/0041;;B29D11/00067,B29D11/00;;B29C71/00,,0,0,,,,EXPIRED
145,BR,A,BR 0316287 A,078-148-017-166-885,2005-10-11,2005,BR 0316287 A,2003-10-27,US 42602302 P;;US 0333867 W,2002-11-13,Métodos para a retirada de lentes de contato,"""MéTODOS PARA A RETIRADA DE LENTES DE CONTATO"". A presente invenção refere-se a métodos para extração de excesso de materiais de lentes de contato, durante os quais as lentes de contato dilatam-se acima de seu tamanho funcional. Os métodos incluem as etapas de tratar lentes de contato com um líquido, preferivelmente uma solução que faz com que a lente de contato dilate-se para um tamanho maior do que seu tamanho funcional, e tratar as lentes de contato com um líquido, preferivelmente uma solução que faz com que elas encolham-se novamente para seu tamanho natural.",JOHNSON & JOHNSON VISION CARE,BERNARD ANTHONY J;;EVANS DOUGLAS L;;SPAULDING TERRY L;;VANDERLAAN DOUGLAS G;;WOOD JOE M,JOHNSON AND JOHNSON (US) (2006-05-16),https://lens.org/078-148-017-166-885,Patent Application,no,0,0,15,15,0,B29C71/0009;;B29C2071/0027;;B29D11/00067;;B29L2011/0041;;B29D11/00923;;B29D11/00317;;B29D11/00;;B29C71/0009;;B29C2071/0027;;B29L2011/0041;;B29D11/00067,B29C71/00;;B29D11/00,,0,0,,,,DISCONTINUED
146,US,A1,US 2004/0091613 A1,188-079-606-152-600,2004-05-13,2004,US 69208803 A,2003-10-23,US 69208803 A;;US 42602302 P,2002-11-13,Methods for the extraction of contact lenses,"
   Disclosed are methods for extracting excess materials from contact lenses, during which the contact lenses swell above their functional size. The methods include the steps of treating contact lenses with a liquid, preferably a solution that causes the contact lenses to swell to a size larger than their functional size, and treating the contact lenses with a liquid, preferably a solution that causes them to shrink back to their functional size. 
",WOOD JOE M.;;BERNARD ANTHONY JOSEPH;;EVANS DOUGLAS L.;;SPAULDING TERRY L.;;VANDERLAAN DOUGLAS G.,WOOD JOE M;;BERNARD ANTHONY JOSEPH;;EVANS DOUGLAS L;;SPAULDING TERRY L;;VANDERLAAN DOUGLAS G,,https://lens.org/188-079-606-152-600,Patent Application,yes,45,32,15,15,0,B29C71/0009;;B29C2071/0027;;B29D11/00067;;B29L2011/0041;;B29D11/00923;;B29D11/00317;;B29D11/00;;B29C71/0009;;B29C2071/0027;;B29L2011/0041;;B29D11/00067,B29C71/00;;B29D11/00,427/162,0,0,,,,DISCONTINUED
147,US,S,US D0502313 S,115-527-010-103-662,2005-03-01,2005,US 18626103 F,2003-07-11,US 18626103 F,2003-07-11,Holster for a communication device,,MOTOROLA INC,LODATO FRANCO;;SHARP JOE A;;MILLER THOMAS W;;FEDDERKE HELGE;;WHITTAKER JOHN JAMES BERNARD;;PUCHE CARLES,MOTOROLA MOBILITY LLC (2010-07-31);;MOTOROLA INC (2004-05-19),https://lens.org/115-527-010-103-662,Design Right,yes,6,4,2,2,0,,,D 3218,0,0,,,,EXPIRED
148,US,A1,US 2004/0077646 A1,052-803-085-879-953,2004-04-22,2004,US 45311203 A,2003-06-02,US 45311203 A;;US 30896302 A;;US 33675001 P,2001-12-04,Indole nitriles,"
    Compounds of the formula (I) 

    wherein m, n, R ¹ , R ² , R ³ , R ⁴ , R ⁵ and R ⁶ are as described herein, together with methods for making the compounds and using the compounds for treatment of diseases or conditions mediated by Cathepsin K. 
",BAMBERG JOE TIMOTHY;;GABRIEL TOBIAS;;KRAUSS NANCY ELISABETH;;MIRZADEGAN TARANEH;;PALMER WYLIE SOLANG;;SMITH DAVID BERNARD,BAMBERG JOE TIMOTHY;;GABRIEL TOBIAS;;KRAUSS NANCY ELISABETH;;MIRZADEGAN TARANEH;;PALMER WYLIE SOLANG;;SMITH DAVID BERNARD,ROCHE PALO ALTO LLC (2003-06-02),https://lens.org/052-803-085-879-953,Patent Application,yes,0,11,2,31,0,C07D209/08;;C07D209/08;;C07D209/42;;C07D209/42;;C07D213/81;;C07D213/81;;C07D215/40;;C07D215/40;;C07D215/48;;C07D215/48;;C07D215/54;;C07D215/54;;C07D215/60;;C07D215/60;;C07D217/02;;C07D217/02;;C07D231/38;;C07D231/38;;C07D231/56;;C07D231/56;;C07D241/44;;C07D241/44;;C07D277/62;;C07D277/62;;C07D401/12;;C07D401/12;;C07D405/12;;C07D405/12;;C07D409/12;;C07D409/12;;C07D471/04;;C07D471/04;;C07D513/04;;C07D513/04,C07D209/08;;C07D209/42;;C07D213/81;;C07D215/40;;C07D215/48;;C07D215/54;;C07D215/60;;C07D217/02;;C07D231/38;;C07D231/56;;C07D241/44;;C07D277/62;;C07D401/12;;C07D405/12;;C07D409/12;;C07D471/04;;C07D513/04,514/237.5;;514/255.01;;514/317;;514/367;;X5143;;514/406;;514/301;;X5144;;514/419;;544/162;;544/386;;546/114;;546/113;;548/153;;548/163;;548/338.5;;548/360.1;;548/495,0,0,,,,EXPIRED
149,US,B2,US 6759428 B2,011-835-316-166-23X,2004-07-06,2004,US 45311203 A,2003-06-02,US 45311203 A;;US 30896302 A;;US 33675001 P,2001-12-04,Indole nitriles,"
    Compounds of the formula (I) 

    wherein m, n, R ^{ 1 } , R ^{ 2 } , R ^{ 3 } , R ^{ 4 } , R ^{ 5 } and R ^{ 6 } are as described herein, together with methods for making the compounds and using the compounds for treatment of diseases or conditions mediated by Cathepsin K. 
",ROCHE PALO ALTO LLC,BAMBERG JOE TIMOTHY;;GABRIEL TOBIAS;;KRAUSS NANCY ELISABETH;;MIRZADEGAN TARANEH;;PALMER WYLIE SOLANG;;SMITH DAVID BERNARD,ROCHE PALO ALTO LLC (2003-06-02),https://lens.org/011-835-316-166-23X,Granted Patent,yes,8,5,2,31,0,C07D209/08;;C07D209/08;;C07D209/42;;C07D209/42;;C07D213/81;;C07D213/81;;C07D215/40;;C07D215/40;;C07D215/48;;C07D215/48;;C07D215/54;;C07D215/54;;C07D215/60;;C07D215/60;;C07D217/02;;C07D217/02;;C07D231/38;;C07D231/38;;C07D231/56;;C07D231/56;;C07D241/44;;C07D241/44;;C07D277/62;;C07D277/62;;C07D401/12;;C07D401/12;;C07D405/12;;C07D405/12;;C07D409/12;;C07D409/12;;C07D471/04;;C07D471/04;;C07D513/04;;C07D513/04,C07D209/08;;C07D209/42;;C07D213/81;;C07D215/40;;C07D215/48;;C07D215/54;;C07D215/60;;C07D217/02;;C07D231/38;;C07D231/56;;C07D241/44;;C07D277/62;;C07D401/12;;C07D405/12;;C07D409/12;;C07D471/04;;C07D513/04,514419;;548492;;548491;;5483611;;5483114;;548180;;548150;;546 87;;546112;;546201;;5462781;;544143;;544373;;5142352;;514253;;514323;;514339;;514367;;514397;;514403,15,15,001-785-103-276-181;;053-291-781-704-794;;018-620-992-789-674;;035-553-919-502-023;;074-397-839-430-093;;104-370-718-518-394;;165-065-910-996-398;;022-700-389-760-353;;022-060-119-090-641;;036-493-638-161-124;;051-300-927-032-345;;125-939-568-986-656;;120-533-436-961-041;;039-185-904-676-492;;078-048-433-799-317,10.1358/dnp.1999.12.2.661337;;10.1146/annurev.physiol.59.1.63;;9074757;;8288568;;10.1016/s0021-9258(17)42227-7;;10.1002/jbmr.5650070411;;1319105;;10.1002/jcp.1041500202;;1734028;;9779840;;9691094;;10.1172/jci181;;pmc508918;;9393764;;11848867;;10.1021/cr950025u;;9405598;;10.1073/pnas.94.26.14249;;pmc24926;;9461297;;10.1111/j.1432-1033.1997.00745.x;;10.1016/s0040-4039(00)96384-6;;10.1021/ja01019a052;;10.1248/cpb.38.350;;2337953;;10.1039/p19940001411,"Brömme, ""The new discoveries made regarding cysteine proteases may offer therapeutic targets for bone disease, cancer and neurodegeneration,"" Drug News Perspect, 1999, pp. 73-82, vol. 12(2).;;Chapman et al., ""Emerging roles for cysteine proteases in human biology,"" Annu. Rev. Phys., 1997, pp. 63-88, vol. 59.;;Tezuka et al., ""Molecular Cloning of a Possible Cysteine Proteinase Predominantly Expressed in Osteoclasts,"" J. Biol. Chem., 1994, pp. 1106-1109, vol. 269:2.;;Lerner, et al, ""Human Cystatin C, a Cysteine Proteinase Inhibitor, Inhibits Bone Resorption In Vitro Stimulated by Parathyroid Hormone and Parathyroid Hormone-Related Peptide of Malignancy,"" J. Bone Min Res., 1992, pp. 433-440, vol. 7:4.;;Everts, et al., ""Degradation of Collagen in the Bone-Resorbing Compartment Underlying the Osteoclast Involves Both Cysteine-Proteinases and Matrix Metalloproteinases,"" J. Cell. Physiol., 1992, pp. 221-231, vol. 150, Wiley-Liss.;;Hummel, et al., ""Cysteine Proteinase Cathepsin K mRNA Is Expressed in Synovium of Patients with Rheumatoid Arthritis and Is Detected at Sites of Synovial Bone Destruction,"" J. Rheumatol., 1998, pp. 1887-1894, vol. 25:10.;;Sukhova, et al., ""Expression of the Elastolytic Cathepsins S and K in Human Atheroma and Regulation of their Production in Smooth Muscle Cells,"" J. Clin. Invest., 1998, pp. 576-583, vol. 102:3.;;Littlewood-Evans et al, ""The Osteoclast-associated Protease Cathepsin K Is Expressed in Human Breast Carcinoma,"" Cancer Res., 1997, pp. 5386-5390, vol. 57.;;Otto et al., ""Cysteine Proteases and Their Inhibitors,"" Chem. Rev., 1997, pp. 133-171, vol. 97.;;Thompson et al., ""Design of potent and selective human cathepsin K inhibitors that span the active site,"" Proc. Natl. Acad. Sci. USA, 1997, pp. 14249-14254, vol. 94.;;Maubach et al, ""The inhibition of cathepsin S by its propeptide,"" Eur. J. Biochem., 1997, pp. 745-750, vol. 250:2.;;Rink, ""Solid-phase synthesis of protected peptide fragments using a trialkoxy-diphenyl-methylester resin,"" Tetrahedron Lett., 1987, pp. 3787-3790, vol. 28:33, Pergamon Journals.;;Atkins & Burgess, ""The Reactions of an N-Sulfonylamine Inner Salt,"" J. Am. Chem. Soc., 1968, pp. 4744-4745, vol. 90:17.;;Kobayashi et al., ""Chiral Synthon Obtained with Pig Liver Esterase: Introduction of Chiral Centers into Cyclohexene Skeleton,"" Chem. Pharm. Bull., 1990, pp. 350-354 vol. 38:2.;;Davies, et al., ""Asymmetric Synthesis of (-)-(1R,2S)-Cispentacin and Related cis- and trans-2-Amino Cyclopentane- and Cyclohexane- 1-carboxylic Acids,"" J. Chem. Soc. Perkin Trans., 1994, pp. 1411-1415, vol. 1.",EXPIRED
150,AR,A1,AR 037458 A1,154-692-078-070-880,2004-11-10,2004,AR P020104581 A,2002-11-28,US 33465301 P,2001-11-30,"UN COMPUESTO DERIVADO DE PIPERIDINA, SU EMPLEO, METODOS PARA PREPARARLO Y UNA COMPOSICION QUE LO CONTIENE","Un compuesto derivado de piperidina de fórmula (1) en la cual: R1 es alquileno C1-2; R2 es fenilo opcionalmente substituido; R3 es hidrógeno, alquilo C1-6, acilo, arilo o aril-alquilo C1-6; el anillo A es cicloalquilo C3-7, heterociclilo, o fenilo opcionalmente substituido; L es -C(=O)-, -C(=S)-, -SO2-, -C(=O)N(Ra)-, -C(=S)N(Ra)-, -SO2N(Ra)-, -C(=O)O-, -C(=S)O-, -S(=O)2O-, donde Ra es hidrógeno, alquilo C1-6, acilo, arilo, aril-alquilo C1-6, alcoxicarbonilo C1-6 o benciloxicarbonilo; X está ausente, es -(CR'R'')O-, (CR'R'')S-, -(CR'R'')NRb- o alquileno C1-6 donde R' y R'' son independientemente hidrógeno o alquilo C1-6 y Rb es hidrógeno o alquilo C1-6; R4 es arilo o heteroarilo; y R5 es hidrógeno o alquilo C1-6; siempre que cuando R1 es -CH2-, R2 es fenilo, R3 es hidrógeno, R5 es hidrógeno, A es fenilo, L es -C(=O)NH- y X está ausente, entonces R4 no es 2,5-difluorfenilo, o profármacos, isómeros individuales, mezclas racémicas y no racémicas de isómeros, y sales farmacéuticamente aceptables de los mismos; donde: la frase ""fenilo opcionalmente substituido"" se refiere a un grupo fenilo que está opcionalmente substituido por uno o más sustituyentes seleccionados entre el grupo que comprende alquilo C1-6, haloalquilo C1-6 hidroxialquilo C1-6, heteroalquilo, acilo, acilamino, amino, alquil C1-6amino, dialquil C1-6amino, alquil C1-6tio, alquil C1-6sulfinilo, alquil C1-6sulfonilo, -SO2NR'R'' (donde R' y R'' son independientemente hidrógeno o alquilo C1-6), alcoxi C1-6, haloalcoxi C1-6, alcoxi C1-6carbonilo, carbamoilo, hidroxi, halo nitro, ciano, mercapto, metilendioxi o etilendioxi; el término ""acilo"" significa un radical -C(O)R, en el cual R es hidrógeno, alquilo C1-6, cicloalquilo C3-7, cicloalquil C3-7-alquilo C1-6, fenilo o fenilalquilo C1-6; el término ""arilo"" se refiere a un radical de hidrocarburo aromático monocíclico o bicíclico, que tiene entre 6 y 10 átomos en el anillo, que está opcionalmente substituido por uno o más sustituyentes seleccionados entre el grupo que comprende alquilo C1-6, haloalquilo C1-6, hidroxialquilo C1-6, heteroalquilo, acilo, acilamino, amino, alquil C1-6amino, dialquil C1-6amino, alquil C1-6tio, alquil C1-6sulfinilo, alquil C1-6sulfonilo, -SO2NR'R'' (donde R' y R'' son independientemente hidrógeno o alquilo C1-6), alcoxi C1-6, haloalcoxi C1-6, alcoxi C1-6carbonilo, carbamoilo, hidroxi, halo, nitro, ciano, mercapto, metilendioxi o etilendioxi; el término ""heteroarilo"" se refiere a un radical monocíclico o bicíclico que tiene entre 5 y 12 átomos en el anillo, que tiene al menos un anillo aromático que contiene uno, dos o tres heteroátomos en el anillo seleccionados entre N, O ó S, el resto de los átomos del anillo son C, entendiendo que el punto de unión del radical heteroarilo será en un anillo aromático, y el anillo heteroarilo está opcionalmente substituido en forma independiente por uno o más sustituyentes seleccionados entre alquilo C1-6, haloalquilo C1-6, hidroxialquilo C1-6, heteroalquilo, acilo, acilamino, amino, alquil C1-6amino, dialquil C1-6amino, alquil C1-6tio, alquil C1-6sulfinilo, alquil C1-6sulfonilo, -SO2NR'R'' (donde R' y R'' son independientemente hidrógeno o alquilo C1-6), alcoxi C1-6, haloalcoxi C1-6, alcoxi C1-6carbonilo, carbamoilo, hidroxi, halo, nitro, ciano, mercapto, metilendioxi, etilendioxi, o fenilo opcionalmente substituido; el término ""heteroalquilo"" se refiere a un radical alquilo C1-6 en el cual uno, dos o tres átomos de hidrógeno se reemplazaron por un substituyente independientemente seleccionado entre el grupo que comprende -ORa, -NRbRc, y -S(O)nRd (donde n es un entero que oscila entre 0 y 2), entendiendo que el punto de unión del radical heteroalquilo es a través de un átomo de carbono, donde Ra es hidrógeno, acilo, alquilo C1-6, cicloalquilo C3-7 o cicloalquil C3-7-alquilo C1-6; Rb y Rc son independientemente uno del otro hidrógeno, acilo, alquilo C1-6, cicloalquilo C3-7 o cicloalquil C3-7-alquilo C1-6; cuando n es 0, Rd es hidrógeno, alquilo C1-6, cicloalquilo C3-7 o cicloalquil C3-7-alquilo C1-6 y cuando n es 1 o 2, Rd es alquilo C1-6, cicloalquilo C3-7, cicloalquil C3-7-alquilo C1-6, amino, acilamino, monoalquil C1-6amino o dialquil C1-6amino; el término ""heterociclilo"" se refiere a un radical cíclico no aromático saturado o insaturado que tiene entre 3 y 8 átomos en el anillo, donde uno o dos átomos del anillo son heteroátomos seleccionados entre NRx (donde cada Rx es independientemente hidrógeno, alquilo C1-6, acilo, alquil C1-6sulfonilo, aminosulfonilo, (alquil C1-6amino)sulfonilo, (dialquil C1-6amino)sulfonilo, carbamoilo, (alquil C1-6amino)carbonilo, (dialquil C1-6amino)carbonilo, (carbonil)alquilo C1-6, (alquil C1-6amino)carbonilalquilo C1-6, o dialquil C1-6aminocarbonilalquilo C1-6, O, o S(O)n (donde n es un entero que oscila entre 0 y 2) el resto de los átomos del anillo son C, y el anillo heterociclilo puede estar opcionalmente substituido en forma independiente por uno, dos o tres sustituyentes seleccionados entre alquilo C1-6, haloalquilo C1-6, heteroalquilo, halo, nitro, cianoalquilo C1-6, hidroxi, alcoxi C1-6amino, monoalquil C1-6amino, dialquil C1-6amino, arilalquilo C1-6, (X)n-C(O)R (donde X es O ó NR', n es 0 ó 1, R es hidrógeno, alquilo C1-6, haloalquilo C1-6, hidroxi, alcoxi C1-6, amino, monoalquil C1-6amino, dialquil C1-6amino o fenilo opcionalmente substituido, y R' es hidrógeno o alquilo C1-6, -alquilenoC1-6-C(O)R (donde R es hidrógeno, alquilo C1-6, haloalquilo C1-6, hidroxi, alcoxi C1-6, amino, monoalquil C1-6amino, dialquil C1-6amino o fenilo opcionalmente substituido), o S(O)nRd (donde n es un entero que oscila entre 0 y 2 , y Rd es hidrógeno (siempre y cuando n sea 0), alquilo C1-6, haloalquilo C1-6, cicloalquilo C3-7, cicloalquil C3-7-alquilo C1-6, amino, monoalquil C1-6amino, dialquil C1-6amino, o hidroxialquilo C1-6. Su empleo, métodos para su preparación y una composición que lo contiene. El compuesto de fórmula (1) es útil como antagonista del receptor CCR-3 y, por lo tanto, puede utilizarse en el tratamiento de enfermedades mediadas por CCR-3, como el asma.",HOFFMANN LA ROCHE,DU BOIS DAISY JOE;;KERTESZ DENIS JOHN;;SJOGREN ERIC BRIAN;;SMITH DAVID BERNARD;;WANG BEI MICHELLE,,https://lens.org/154-692-078-070-880,Patent Application,no,0,0,14,60,0,A61K31/445;;A61P11/06;;A61P43/00;;C07D211/26;;C07D401/04;;C07D211/18;;C07D401/12;;C07D405/04;;C07D409/04;;C07D409/12,A61K31/445;;A61K31/4525;;A61K31/4535;;A61K31/454;;A61K31/4545;;A61K31/4709;;A61K31/4725;;A61K31/506;;A61P11/06;;A61P43/00;;C07D211/18;;C07D401/04;;C07D401/12;;C07D405/04;;C07D409/04;;C07D409/12;;C07D471/04,,0,0,,,,DISCONTINUED
151,US,A1,US 2004/0010644 A1,000-411-277-606-563,2004-01-15,2004,US 19517202 A,2002-07-11,US 19517202 A,2002-07-11,System and method for providing improved bus utilization via target directed completion,"
   An electronic system is disclosed, including multiple initiators and one or more targets coupled to a bus, and a request mask control unit (RMCU). The initiators are configured to initiate requests (e.g., read requests and write requests) via the bus, and the targets are configured to receive requests from the initiators via the bus. The targets are also configured to produce multiple MaskEnable signals, wherein each of the MaskEnable signals is generated following an initial request received via the bus, and dependent on a corresponding masking situation within the target. Exemplary masking situations include delayed read, no read buffer available, and no write buffer available. The RMCU receives the MaskEnable signals and produces multiple RequestMask signals dependent upon the MaskEnable signals. One or more of the initiators are permitted to repeat requests via the bus dependent upon one or more of the RequestMask signals. From another point of view, the one or more initiators are prevented from repeating requests via the bus dependent upon the one or more RequestMask signals. In preventing repeated requests that do not transfer data, the above mechanism provides additional bus bandwidth for carrying out successful data transfers. Methods for initiating requests via a bus, receiving requests via a bus, and communicating via a bus, are also described. 
",IBM,DRERUP BERNARD CHARLES;;GANASAN JAYA PRAKASH SUBRAMANI;;HOFMANN RICHARD GERARD;;IACHETTA RICHARD NICHOLAS;;WOLFORD BARRY JOE,INTERNATIONAL BUSINESS MACHINES CORPORATION (2002-07-08),https://lens.org/000-411-277-606-563,Patent Application,yes,17,5,2,2,0,G06F13/364;;G06F13/364,G06F13/00;;G06F13/14;;G06F13/364,710/107,0,0,,,,EXPIRED
152,AU,B2,AU 576697 B2,059-914-490-235-373,1988-09-01,1988,AU 1987/074280 A,1987-06-16,US 87661386 A,1986-06-20,COMBINED CIRCUIT SWITCH AND PACKET SWITCHING SYSTEM,,AMERICAN TELEPHONE & TELEGRAPH,FERENC JAMES JOSEPH;;GEBHARDT ROBERT WILLIAM;;GRIMES GARY JOE;;MORGAN EDWARD BERNARD JR;;SELLERS GABE ALFRED III,,https://lens.org/059-914-490-235-373,Granted Patent,no,3,2,8,8,0,H04J3/16;;H04J3/1682;;H04J3/1682,H04Q11/04;;H04J3/16;;H04L12/64,,0,0,,,,EXPIRED
