187,US,B2,US 6834378 B2,054-061-912-909-152,2004-12-21,2004,US 26416202 A,2002-10-03,US 26416202 A,2002-10-03,System on a chip bus with automatic pipeline stage insertion for timing closure,"
    A method of designing a system on a chip (SoC) to operate with varying latencies and frequencies. A layout of the chip is designed with specific placement of devices, including a bus controller, initiator, and target devices. The time for a signal to propagate from a source device to a destination device is determined relative to a default propagation time. A pipeline stage is then inserted into a bus path between said source device and destination device for each additional time the signal takes to propagate. Each device (i.e., initiators, targets, and bus controller) is designed with logic to control a protocol that functions with a variety of response latencies. With the additional logic, the devices do not need to be changed when pipeline stages are inserted in the various paths. Registers are utilized as the pipeline stages that are inserted within the paths. 
",IBM,AUGSBURG VICTOR ROBERTS;;DIEFFENDERFER JAMES NORRIS;;DRERUP BERNARD CHARLES;;HOFMANN RICHARD GERARD;;SARTORIUS THOMAS ANDREW;;WOLFORD BARRY JOE,GLOBALFOUNDRIES U.S. INC (2020-10-22);;INTERNATIONAL BUSINESS MACHINES CORPORATION (2002-10-01);;GLOBALFOUNDRIES U.S. 2 LLC (2015-06-29);;GLOBALFOUNDRIES INC (2015-09-10),https://lens.org/054-061-912-909-152,Granted Patent,yes,5,15,4,4,0,G06F30/30;;G06F30/30,G06F17/50,716/6;;716/10;;716/1,2,0,,,"R. Hofmann et al., ""Next Generation CoreConnect(TM) Processor Local Bus Architecture,"" 15<th >Annucal IEEE Int'l ASIC/SOC Conference, Sep. 2002, pp. 221-225.*;;K.K. Ryu et al., ""A Comparison of Five Different Multiprocessor SoC Bus Architectures,"" Proceesings Euromicro Symposium on Digital Systems, Design, Sep. 2001, pp. 202-209.",EXPIRED
188,US,B2,US 6807608 B2,006-038-653-356-963,2004-10-19,2004,US 7756002 A,2002-02-15,US 7756002 A,2002-02-15,Multiprocessor environment supporting variable-sized coherency transactions,"
    A method and system for performing variable-sized memory coherency transactions. A bus interface unit coupled between a slave and a master may be configured to receive a request (master request) comprising a plurality of coherency granules from the master. Each snooping unit in the system may be configured to snoop a different number of coherency granules in the master request at a time. Once the bus interface unit has received a collection of sets of indications from each snooping logic unit indicating that the associated collection of coherency granules in the master request have been snooped by each snooping unit and that the data at the addresses for the collection of coherency granules snooped has not been updated, the bus interface unit may allow the data at the addresses of those coherency granules not updated to be transferred between the requesting master and the slave. 
",IBM,AUGSBURG VICTOR ROBERTS;;DIEFFENDERFER JAMES NORRIS;;DRERUP BERNARD CHARLES;;HOFMANN RICHARD GERARD;;SARTORIUS THOMAS ANDREW;;WOLFORD BARRY JOE,INTERNATIONAL BUSINESS MACHINES CORPORATION (2002-02-13),https://lens.org/006-038-653-356-963,Granted Patent,yes,16,2,2,2,0,G06F12/0831;;G06F12/0831;;Y02D10/00;;Y02D10/00,G06F12/08,711/146;;711/141;;710/20,2,2,027-262-290-770-142;;042-479-534-200-631,10.1109/icpads.1998.741017;;10.1109/hpc.1997.592113,"Won-Kee Hong et al., ""Design and performance evaluation of an adaptive cache coherence protocol,"" IEEE Xplore, 1998, pp. 33-40.;;Won-Kee Hong et al., ""An effective full-map directory scheme for the sectored caches,"" IEEE Xplore, 1997, pp. 7-11.",EXPIRED
189,WO,A2,WO 2006/014233 A2,116-899-938-677-149,2006-02-09,2006,US 2005/0022008 W,2005-06-21,US 88461604 A,2004-07-02,APPARATUS AND METHODS FOR POSITIONING PROSTHESES FOR DEPLOYMENT FROM A CATHETER,"Apparatus for delivering stents to body lumens include a flexible catheter shaft, an expandable member, a tubular prosthesis selectively movable in an axial direction over the expandable member, and a stop member disposed on the catheter shaft near the distal end of the catheter shaft for stopping the prosthesis at a deployment position on the expandable member. A variety of different stop members are provided according to various embodiments, such as stop members disposed outside the expandable member, stop members disposed inside the expandable member, movable stop members, and the like. Methods of delivering stents are also provided.",XTENT INC;;ACOSTA PABLO;;ANDREAS BERNARD;;KAO STEPHEN;;KARRATT JOE;;LANDREVILLE STEVE;;LANG ERIC;;SANDERSON DAVID;;WELK CRAIG;;SNOW DAVID,ACOSTA PABLO;;ANDREAS BERNARD;;KAO STEPHEN;;KARRATT JOE;;LANDREVILLE STEVE;;LANG ERIC;;SANDERSON DAVID;;WELK CRAIG;;SNOW DAVID,,https://lens.org/116-899-938-677-149,Patent Application,yes,0,254,13,13,0,A61F2/91;;A61F2/91;;A61F2/915;;A61F2/915;;A61F2/958;;A61F2/958;;A61F2002/826;;A61F2002/826;;A61F2002/91508;;A61F2002/91508;;A61F2002/91516;;A61F2002/91516;;A61F2002/91525;;A61F2002/91525;;A61F2002/91533;;A61F2002/91533;;A61F2002/9155;;A61F2002/9155;;A61F2002/91558;;A61F2002/91558;;A61F2002/9583;;A61F2002/9583;;A61F2230/0013;;A61F2230/0013,A61F2/82,,1,0,,,See references of EP 1763326A4,PENDING
190,US,B2,US 7035958 B2,145-474-400-151-370,2006-04-25,2006,US 26417002 A,2002-10-03,US 26417002 A,2002-10-03,Re-ordering a first request within a FIFO request queue to a different queue position when the first request receives a retry response from the target,"A method of operating a request FIFO of a system on a chip (SoC) in which a requests in a first position that has been granted and which subsequently receives a retry from the intended target is automatically re-ordered with respect to the other requests below it in the request FIFO. Each issued requests is tagged to either enable or disable a re-order feature. When a request that is tagged as re-order enabled is granted, the FIFO logic monitors the response provided for the request. If the response is a retry, the request is removed from the first position of the request FIFO and the next sequential request is moved into the first position. The removed requests may be re-ordered within the request FIFO or sent back to the initiator. In the former implementation, controller logic reorders the first request within the request FIFO. In the latter implementation, the controller logic of the bus controller messages the initiator when a request has been retried and subsequently removed from the first position of the request FIFO. The initiator then determines whether or not to re-issue the request.",IBM,AUGSBURG VICTOR ROBERTS;;DIEFFENDERFER JAMES NORRIS;;DRERUP BERNARD CHARLES;;HOFMANN RICHARD GERARD;;SARTORIUS THOMAS ANDREW;;WOLFORD BARRY JOE,INTERNATIONAL BUSINESS MACHINES CORPORATION (2002-10-01);;INTEL CORPORATION (2013-04-08),https://lens.org/145-474-400-151-370,Granted Patent,yes,13,13,2,2,0,G06F13/362;;G06F13/4022;;G06F2213/0038;;G06F13/362;;G06F13/4022;;G06F2213/0038,G06F13/36;;G06F13/362;;G06F13/40,710/310;;710/309;;710/112;;710/39,2,0,,,"Patent Abstracts of Japan, Shibayama Hiroaki: ""Portable Terminal And Display Method Therefor"" Publication No. 2000356977, Feb. 26, 2000, Application No. 11170407, Jun. 17, 1999.;;Patent Abstracts of Japan, Tenkai Mayumi: ""Image Decoding Device And Method Therefor"" Publication No. 10032817, Mar. 2, 1998, Application No. 08183809, Dec. 7, 1996.",EXPIRED
191,EP,A4,EP 1763326 A4,142-720-371-522-532,2012-10-03,2012,EP 05762885 A,2005-06-21,US 2005/0022008 W;;US 88461604 A,2004-07-02,APPARATUS AND METHODS FOR POSITIONING PROSTHESES FOR DEPLOYMENT FROM A CATHETER,,J W MEDICAL SYSTEMS LTD,ACOSTA PABLO;;ANDREAS BERNARD;;KAO STEPHEN;;KARRATT JOE;;LANDREVILLE STEVE;;LANG ERIC;;SANDERSON DAVID;;WELK CRAIG;;SNOW DAVID,J.W. MEDICAL SYSTEMS LTD. (2012-04-04),https://lens.org/142-720-371-522-532,Search Report,no,4,0,13,13,0,A61F2/91;;A61F2/915;;A61F2/958;;A61F2002/826;;A61F2002/91508;;A61F2002/91516;;A61F2002/91525;;A61F2002/91533;;A61F2002/9155;;A61F2002/91558;;A61F2002/9583;;A61F2230/0013;;A61F2/91;;A61F2002/91516;;A61F2002/91533;;A61F2002/9583;;A61F2002/826;;A61F2002/9155;;A61F2/915;;A61F2/958;;A61F2002/91508;;A61F2002/91525;;A61F2002/91558;;A61F2230/0013,A61F2/82,,0,0,,,,ACTIVE
192,US,A1,US 2003/0159005 A1,117-818-695-771-446,2003-08-21,2003,US 7756002 A,2002-02-15,US 7756002 A,2002-02-15,Multiprocessor environment supporting variable-sized coherency transactions,"
   A method and system for performing variable-sized memory coherency transactions. A bus interface unit coupled between a slave and a master may be configured to receive a request (master request) comprising a plurality of coherency granules from the master. Each snooping unit in the system may be configured to snoop a different number of coherency granules in the master request at a time. Once the bus interface unit has received a collection of sets of indications from each snooping logic unit indicating that the associated collection of coherency granules in the master request have been snooped by each snooping unit and that the data at the addresses for the collection of coherency granules snooped has not been updated, the bus interface unit may allow the data at the addresses of those coherency granules not updated to be transferred between the requesting master and the slave. 
",IBM,AUGSBURG VICTOR ROBERTS;;DIEFFENDERFER JAMES NORRIS;;DRERUP BERNARD CHARLES;;HOFMANN RICHARD GERARD;;SARTORIUS THOMAS ANDREW;;WOLFORD BARRY JOE,INTERNATIONAL BUSINESS MACHINES CORPORATION (2002-02-13),https://lens.org/117-818-695-771-446,Patent Application,yes,9,21,2,2,0,G06F12/0831;;G06F12/0831;;Y02D10/00;;Y02D10/00,G06F12/08,711/146;;711/172;;711/144,0,0,,,,EXPIRED
193,US,B2,US 8083788 B2,025-144-707-054-388,2011-12-27,2011,US 56379306 A,2006-11-28,US 56379306 A;;US 88461604 A;;US 87485904 A;;US 63771303 A;;US 41271403 A;;US 30681302 A;;US 36438902 P;;US 33696701 P,2001-12-03,Apparatus and methods for positioning prostheses for deployment from a catheter,"Apparatus for delivering stents to body lumens include a flexible catheter shaft, an expandable member, a tubular prosthesis selectively movable in an axial direction over the expandable member, and a stop member disposed on the catheter shaft near the distal end of the catheter shaft for stopping the prosthesis at a deployment position on the expandable member. A variety of different stop members are provided according to various embodiments, such as stop members disposed outside the expandable member, stop members disposed inside the expandable member, movable stop members, and the like. Methods of delivering stents are also provided.",ACOSTA PABLO;;ANDREAS BERNARD;;KAO STEPHEN;;KARRATT JOE;;LANDREVILLE STEVE;;LANG ERIC;;SANDERSON DAVID;;WELK CRAIG;;SNOW DAVID W;;XTENT INC,ACOSTA PABLO;;ANDREAS BERNARD;;KAO STEPHEN;;KARRATT JOE;;LANDREVILLE STEVE;;LANG ERIC;;SANDERSON DAVID;;WELK CRAIG;;SNOW DAVID W,J.W. MEDICAL SYSTEMS LTD (2011-12-27);;XTENT INC (2004-09-09),https://lens.org/025-144-707-054-388,Granted Patent,yes,104,37,13,13,0,A61F2/91;;A61F2/91;;A61F2/915;;A61F2/915;;A61F2/958;;A61F2/958;;A61F2002/826;;A61F2002/826;;A61F2002/91508;;A61F2002/91508;;A61F2002/91516;;A61F2002/91516;;A61F2002/91525;;A61F2002/91525;;A61F2002/91533;;A61F2002/91533;;A61F2002/9155;;A61F2002/9155;;A61F2002/91558;;A61F2002/91558;;A61F2002/9583;;A61F2002/9583;;A61F2230/0013;;A61F2230/0013,A61F2/82,623/1.11,9,2,102-116-107-378-680;;076-075-136-052-701,14499187;;10.1016/s0168-3659(03)00305-5;;9821591;;10.2144/98255rr03,"Office Action of Japanese Patent Application No. 2007-519284, mailed Oct. 26, 2010, 6 pages total [English Translation Included].;;Colombo, ""The Invatec Bifurcation Stent Solution"" Bifurcation Stents: Novel Solutions, TCT 2003, Washington: Sep. 15-19, 2003, 24 pages total.;;Cooley et al., ""Applications of Ink-Jet Printing Technology to BioMEMs and Microfluidic Systems,"" Proceedings, SPIE Conference on Microfluidics and BioMEMs, (Oct. 2001).;;""Drug Delivery Stent With Holes Located on Neutral Axis"" Research Disclosure, Kenneth Mason Publications, Hampshire, CB, No. 429, Jan. 2000, p. 13, XP00976354.;;Evans Analytical Group, ""Functional Sites on Non-polymeric Materials: Gas Plasma Treatment and Surface Analysis,"" http://www.eaglabs.com.;;Joung et al., ""Estrogen Release from Metallic Stent Surface for the Prevention of Restenosis,"" Journal of Controlled Release 92 (2003) pp. 83-91.;;Lefevre et al. ""Approach to Coronary Bifurcation Stenting in 2003,"" Euro PCR, (May 2003) 28 pages total.;;""Stent"". Definitions from Dictionary.com. Unabridged 9v1.01). Retrieved Sep. 22, 2006, from Dictionary.com website: .;;Stimpson et al., Parallel Production of Oligonucleotide Arrays Using Membranes and Reagent Jet Printing, BioTechniques 25:886-890 (Nov. 1998).",ACTIVE
194,EP,A4,EP 3167373 A4,086-660-854-474-829,2018-02-28,2018,EP 15819073 A,2015-07-10,US 201462023053 P;;US 2015/0039887 W,2014-07-10,INTERFACE FOR ORCHESTRATION AND ANALYSIS OF A COMPUTER ENVIRONMENT,,SIOS TECH CORPORATION,RAZIN SERGEY A;;MOUKABAA JOE;;TREULICH HAROLD JASON;;GOLDIE TRAVIS;;TO YOKUKI;;THOMAN SCOTT;;CLEMENTS PAUL R;;CROKER JAMES BERNARD,,https://lens.org/086-660-854-474-829,Search Report,no,5,0,7,7,0,G06F11/3495;;G06F11/323;;G06F11/3433;;G06F11/3442;;G06F11/3006;;G06F11/3409;;G06F11/3495;;G06F11/323;;G06F11/3433;;G06F11/3442;;G06F11/3006;;G06F11/30;;G06F9/5011;;G06F11/3024;;G06F11/3409,G06F11/30;;G06F11/32;;G06F11/34,,1,0,,,See also references of WO 2016007824A1,DISCONTINUED
195,EP,A1,EP 3167373 A1,112-770-212-649-752,2017-05-17,2017,EP 15819073 A,2015-07-10,US 201462023053 P;;US 2015/0039887 W,2014-07-10,INTERFACE FOR ORCHESTRATION AND ANALYSIS OF A COMPUTER ENVIRONMENT,,SIOS TECH CORP,RAZIN SERGEY A;;MOUKABAA JOE;;TREULICH HAROLD JASON;;GOLDIE TRAVIS;;TO YOKUKI;;THOMAN SCOTT;;CLEMENTS PAUL R;;CROKER JAMES BERNARD,,https://lens.org/112-770-212-649-752,Patent Application,yes,0,0,7,7,0,G06F11/3495;;G06F11/323;;G06F11/3433;;G06F11/3442;;G06F11/3006;;G06F11/3409;;G06F11/3495;;G06F11/323;;G06F11/3433;;G06F11/3442;;G06F11/3006;;G06F11/30;;G06F9/5011;;G06F11/3024;;G06F11/3409,G06F11/30,,0,0,,,,DISCONTINUED
196,GB,A,GB 2384929 A,042-151-795-689-712,2003-08-06,2003,GB 0224391 A,2002-10-21,US 33030601 P,2001-10-19,Integrated optical engine control system,"An integrated control system comprising an integrated circuit (750) that controls at least one component or subsystem of an engine and a first light source (702,704) that generates a first light signal when triggered through the integrated circuit. The first light signal propagates from the first light source through a waveguide that may also serve as a substrate, wherein the signal that actuates the component of the engine can be the first light signal or a signal generated after the first light signal is produced. The component or subsystem of the engine may be an ignition system or a fuel injection system.",VISTEON GLOBAL TECH INC,SHI ZHONG-YOU JOE;;MEYER BERNARD A;;SINGH HARVINDER;;BAKER JAY DEAVIS;;KNEISEL LAWRENCE LEROY;;MCMILLAN RICHARD KEITH;;STEINERT DAVID JAMES,,https://lens.org/042-151-795-689-712,Patent Application,no,9,0,26,49,0,F02B75/22;;F02B77/085;;F02B77/089;;F02D41/28;;F02D2400/18;;F05C2225/08;;G01F23/2925;;G01L11/02;;G01L23/16;;G02B6/12004;;G02B6/12007;;G02B6/122;;G02B6/4298;;G02B6/43;;G02B2006/12104;;G02B2006/12109;;G08C23/02;;G08C2201/31;;G08C2201/41,F02D45/00;;F02B75/22;;F02B77/08;;F02D35/00;;F02D41/24;;F02F11/00;;F02M51/00;;G01F23/292;;G01L11/02;;G01L23/16;;G02B6/12;;G02B6/122;;G02B6/42;;G02B6/43;;G08C23/02;;H04B10/2581;;H04Q9/00,H4B BK12          BK12,0,0,,,,EXPIRED
197,US,A1,US 2004/0255085 A1,039-438-609-039-338,2004-12-16,2004,US 45899803 A,2003-06-11,US 45899803 A,2003-06-11,Ensuring orderly forward progress in granting snoop castout requests,"
   A method and system for ensuring orderly forward progress in granting snoop castout requests. Masters may include a tag (request tag) in their transfer requests to a bus macro. The request tag indicates the order of the request issued by the master. If the bus macro determines that the transfer request is snoopable, then the bus macro broadcasts a snoop request that includes the request tag. If a snoop controller determines that the address in the snoop request is a hit to a modified coherency granule in an associated cache, then the master associated with that snoop controller transmits a castout request to the bus macro that includes the request tag associated with the snoop request. The bus macro uses the request tag to determine whether the castout request is a response to the oldest in a series of pipelined snoop requests to be serviced. 
",IBM,DIEFFENDERFER JAMES NORRIS;;DRERUP BERNARD CHARLES;;GANASAN JAYA PRAKASH;;HOFMANN RICHARD GERARD;;SARTORIUS THOMAS ANDREW;;SPEIER THOMAS PHILIP;;WOLFORD BARRY JOE,INTERNATIONAL BUSINESS MACHINES CORPORATION (2003-06-06),https://lens.org/039-438-609-039-338,Patent Application,yes,25,10,2,2,0,G06F12/0831;;G06F12/0831,G06F12/08,711/146;;711/144,0,0,,,,EXPIRED
198,US,A,US 4681175 A,073-081-993-947-43X,1987-07-21,1987,US 65804484 A,1984-10-05,US 65804484 A,1984-10-05,Auto-coupling tool for drill-pipes,"An automatic broken-drill-pipe-intercoupling tool having, a body portion with, at one end, a female threaded adapted to cooperate with the threaded male end of the retrievable portion of a broken drill pipe and at the other end a tapered, multi-interwined-spiral bit portion, integral with the body portion, the body portion having flats thereon to permit tightening of the tool on the retrievable portion of the broken drill pipe.",BOCKING BRUCE;;CERVANTES JR JOE A;;GREEN DOUGLAS H;;SOTA BRUCE W;;MARSHALL DAVID H;;RODRIGUEZ BERNARD;;GORDEN GLEN VAN,BOCKING BRUCE;;CERVANTES JR JOE A;;GREEN DOUGLAS H;;LA SOTA BRUCE W;;MARSHALL DAVID H;;RODRIGUEZ BERNARD;;VAN GORDEN GLEN,,https://lens.org/073-081-993-947-43X,Granted Patent,yes,11,4,1,1,0,E21B7/20;;E21B17/021;;E21B17/04;;E21B31/20;;E21B7/20;;E21B31/20;;E21B17/04;;E21B17/021,E21B7/20;;E21B17/02;;E21B17/04;;E21B31/20,175/393;;166/98;;285/40;;294/86.22,0,0,,,,EXPIRED
199,US,B2,US 7127562 B2,093-595-373-820-511,2006-10-24,2006,US 45899803 A,2003-06-11,US 45899803 A,2003-06-11,Ensuring orderly forward progress in granting snoop castout requests,"A method and system for ensuring orderly forward progress in granting snoop castout requests. Masters may include a tag (“request tag”) in their transfer requests to a bus macro. The request tag indicates the order of the request issued by the master. If the bus macro determines that the transfer request is snoopable, then the bus macro broadcasts a snoop request that includes the request tag. If a snoop controller determines that the address in the snoop request is a hit to a modified coherency granule in an associated cache, then the master associated with that snoop controller transmits a castout request to the bus macro that includes the request tag associated with the snoop request. The bus macro uses the request tag to determine whether the castout request is a response to the oldest in a series of pipelined snoop requests to be serviced.",IBM,DIEFFENDERFER JAMES NORRIS;;DRERUP BERNARD CHARLES;;GANASAN JAYA PRAKASH;;HOFMANN RICHARD GERARD;;SARTORIUS THOMAS ANDREW;;SPEIER THOMAS PHILIP;;WOLFORD BARRY JOE,INTERNATIONAL BUSINESS MACHINES CORPORATION (2003-06-06),https://lens.org/093-595-373-820-511,Granted Patent,yes,25,12,2,2,0,G06F12/0831;;G06F12/0831,G06F12/00;;G06F12/08,711/146;;711/144;;711/145;;711/148;;711/150;;711/151;;711/168;;711/169,0,0,,,,INACTIVE
200,GB,B,GB 2384929 B,149-898-908-333-110,2004-06-16,2004,GB 0224391 A,2002-10-21,US 33030601 P,2001-10-19,Optically controlled IPCS circuitry,,VISTEON GLOBAL TECH INC,SHI ZHONG-YOU JOE;;MEYER BERNARD A;;SINGH HARVINDER;;BAKER JAY DEAVIS;;KNEISEL LAWRENCE LEROY;;MCMILLAN RICHARD KEITH;;STEINERT DAVID JAMES,,https://lens.org/149-898-908-333-110,Granted Patent,no,9,0,26,49,0,F02B75/22;;F02B77/085;;F02B77/089;;F02D41/28;;F02D2400/18;;F05C2225/08;;G01F23/2925;;G01L11/02;;G01L23/16;;G02B6/12004;;G02B6/12007;;G02B6/122;;G02B6/4298;;G02B6/43;;G02B2006/12104;;G02B2006/12109;;G08C23/02;;G08C2201/31;;G08C2201/41,F02D45/00;;F02B75/22;;F02B77/08;;F02D35/00;;F02D41/24;;F02F11/00;;F02M51/00;;G01F23/292;;G01L11/02;;G01L23/16;;G02B6/12;;G02B6/122;;G02B6/42;;G02B6/43;;G08C23/02;;H04B10/2581;;H04Q9/00,H4B BK12          BK12,0,0,,,,EXPIRED
201,US,B2,US 9910707 B2,186-361-344-529-100,2018-03-06,2018,US 201514796161 A,2015-07-10,US 201514796161 A;;US 201462023053 P,2014-07-10,Interface for orchestration and analysis of a computer environment,"A host server is configured to receive information related to metrics and configurations associated with computer resources of a computer infrastructure, derive and resolve the information into capacity, performance, reliability, and efficiency, as related to attributes associated with the computer resources, including compute attributes such as application, virtual machine (VM) attributes, storage attributes, and network attributes. The host server provides the metrics and attributes in a matrix configuration as a graphical user interface (GUI) on an output device, such as a display. The GUI is configured to provide a user with a single point of view into the computer infrastructure by converging application, compute, storage, and network attributes into capacity, performance, reliability, and efficiency concepts. With such a configuration, the GUI allows the end user to readily review the environments for potential issues in a time efficient manner, as well as solutions provided by the GUI.",SIOS TECH CORPORATION,RAZIN SERGEY A;;MOUKABAA JOE;;TREULICH HAROLD JASON;;GOLDIE TRAVIS;;TO YOKUKI;;THOMAN SCOTT;;CLEMENTS JR PAUL R;;CROCKER JAMES BERNARD,SIOS TECHNOLOGY CORPORATION (2017-02-22),https://lens.org/186-361-344-529-100,Granted Patent,yes,11,2,7,7,0,G06F11/3495;;G06F11/323;;G06F11/3433;;G06F11/3442;;G06F11/3006;;G06F11/3409;;G06F11/3495;;G06F11/323;;G06F11/3433;;G06F11/3442;;G06F11/3006;;G06F11/30;;G06F9/5011;;G06F11/3024;;G06F11/3409,G06F9/54;;G06F9/50;;G06F11/30;;G06F11/32;;G06F11/34,,1,0,,,"International Search Report dated Oct. 23, 2015 from the corresponding International Application No. PCT/US15/039887.",ACTIVE
202,US,A1,US 2010/0267666 A1,135-963-362-281-450,2010-10-21,2010,US 37897709 A,2009-02-20,US 37897709 A;;US 3103508 P;;US 20572909 P,2008-02-25,Pyrrolopyrazine kinase inhibitors,"The present invention relates to the use of novel pyrrolopyrazine derivatives of Formula I, wherein the variables Q 1 , R, and X are defined as described herein, which inhibit JAK and SYK and are useful for the treatment of auto-immune and inflammatory diseases.",BAMBERG JOE TIMOTHY;;DUBOIS DAISY JOE;;ELWORTHY TODD RICHARD;;HENDRICKS ROBERT THAN;;HERMANN JOHANNES CORNELIUS;;JAHANGIR ALAM;;KONDRU RAMA K;;LEMOINE REMY;;LOU YAN;;OWENS TIMOTHY D;;SMITH DAVID BERNARD;;SOTH MICHAEL;;YANG HANBIAO,BAMBERG JOE TIMOTHY;;DUBOIS DAISY JOE;;ELWORTHY TODD RICHARD;;HENDRICKS ROBERT THAN;;HERMANN JOHANNES CORNELIUS;;JAHANGIR ALAM;;KONDRU RAMA K;;LEMOINE REMY;;LOU YAN;;OWENS TIMOTHY D;;SMITH DAVID BERNARD;;SOTH MICHAEL;;YANG HANBIAO,ROCHE PALO ALTO LLC (2009-03-23),https://lens.org/135-963-362-281-450,Patent Application,yes,3,4,12,93,0,C07D487/04;;C07D519/00;;A61P1/00;;A61P1/04;;A61P11/06;;A61P15/18;;A61P17/04;;A61P17/06;;A61P19/02;;A61P25/00;;A61P25/28;;A61P29/00;;A61P35/00;;A61P35/02;;A61P37/00;;A61P37/02;;A61P37/06;;A61P43/00;;A61P5/14;;A61P3/10;;C07D487/04;;C07D519/00,A61K31/4985;;A61K31/397;;A61K31/5377;;A61K31/541;;A61K31/695;;A61P1/04;;A61P3/10;;A61P11/06;;A61P17/06;;A61P25/28;;A61P29/00;;A61P35/00;;A61P35/02;;A61P37/00;;A61P37/06;;C07D487/04,514/63;;544/350;;514/249;;544/117;;514/234.2;;544/58.6;;544/58.2;;514/228.5;;544/230;;514/210.21;;544/295,0,0,,,,INACTIVE
203,US,B2,US 8008298 B2,140-469-665-289-043,2011-08-30,2011,US 37897709 A,2009-02-20,US 37897709 A;;US 3103508 P;;US 20572909 P,2008-02-25,Pyrrolopyrazine kinase inhibitors,"The present invention relates to the use of novel pyrrolopyrazine derivatives of Formula I, wherein the variables Q 1 , R, and X are defined as described herein, which inhibit JAK and SYK and are useful for the treatment of auto-immune and inflammatory diseases.",ROCHE PALO ALTO,BAMBERG JOE TIMOTHY;;DUBOIS DAISY JOE;;ELWORTHY TODD RICHARD;;HENDRICKS ROBERT THAN;;HERMANN JOHANNES CORNELIUS;;JAHANGIR ALAM;;KONDRU RAMA K;;LEMOINE REMY;;LOU YAN;;OWENS TIMOTHY D;;SMITH DAVID BERNARD;;SOTH MICHAEL;;YANG HANBIAO,ROCHE PALO ALTO LLC (2009-03-23),https://lens.org/140-469-665-289-043,Granted Patent,yes,9,3,12,93,0,C07D487/04;;C07D519/00;;A61P1/00;;A61P1/04;;A61P11/06;;A61P15/18;;A61P17/04;;A61P17/06;;A61P19/02;;A61P25/00;;A61P25/28;;A61P29/00;;A61P35/00;;A61P35/02;;A61P37/00;;A61P37/02;;A61P37/06;;A61P43/00;;A61P5/14;;A61P3/10;;C07D487/04;;C07D519/00,A61K31/495,514/249;;544/61;;544/143;;544/333;;544/350;;544/373;;546/200;;546/276.7;;548/143;;548/235;;548/240;;548/335.1;;548/373.1;;548/460;;548/518;;548/560;;548/950;;548/361.1;;549/14;;549/59;;549/356;;549/429;;549/510,0,0,,,,INACTIVE
