70,TW,A,TW 200745925 A,029-269-183-297-200,2007-12-16,2007,TW 95138708 A,2006-10-20,US 26061405 A,2005-10-27,Maximizing window display area using window flowing,"A method, system and a computer program product that enables a second window opened on a display screen to ""flow"" into and fill/occupy all available space within the displayable area of the display screen without overlapping a first window occupying less than the maximum width and/or length of the display area. A window flowing utility enables multiple windows to concurrently coexist and fill the maximum displayable area of the display screen. The window flowing utility determines which areas of the display screen are not currently being utilized by the first window, and allows the second window to occupy all of the available space remaining on the display device surrounding the first window.",IBM,AWADA FAISAL M;;BROWN JOE NATHAN;;BURKES PHILIP BERNARD,,https://lens.org/029-269-183-297-200,Patent of Addition,no,0,4,18,18,0,G06F3/0481;;G06F3/04855;;G06F2203/04803;;G06F40/103;;G06F3/0481;;G06F3/0485;;G06F3/0481;;G06F2203/04803;;G06F3/04855;;G06F40/103,G06F3/048,,0,0,,,,INACTIVE
71,CA,A1,CA 2931887 A1,046-911-964-455-031,2016-12-05,2016,CA 2931887 A,2016-06-01,US 201561171877 P,2015-06-05,CARGO CARRIER,"The disclosed invention includes a device that receives and supports one or more storage containers mounted to a water craft. The device includes a frame, secured to the water craft, that includes a center frame and one or more outer frames with a width and length equal to the width and length of one or more complimentary storage containers, which provide equal distribution of weight to the frame to balance and contribute to the buoyancy of the water craft. In some embodiments, the frame may be transformed into a table.",WINGMAN OUTFITTER INC,BOUSMAN AUSTIN GARDENER;;LIPKE BERNARD JOE;;ARNEY CURTIS DREW,,https://lens.org/046-911-964-455-031,Patent Application,no,0,0,1,1,0,,B23B25/00,,0,0,,,,PENDING
72,US,B2,US 7486971 B2,151-697-304-079-554,2009-02-03,2009,US 253904 A,2004-12-02,US 253904 A,2004-12-02,Method and apparatus for managing ring tones in a mobile device,"An improved method, apparatus, and computer instructions for a mobile device for managing ring tones. A radio frequency transmission is detected from another mobile device. In response to detecting the radio frequency transmission from the other mobile device, a ring tone used by the other mobile device is identified to form an identified ring tone. The current ring tone is selectively changed for the mobile device to an alternate ring tone, depending on the identified ring tone.",IBM,AWADA FAISAL M;;BROWN JOE NATHAN;;BURKES PHILIP BERNARD,INTERNATIONAL BUSINESS MACHINES CORPORATION (2004-11-29),https://lens.org/151-697-304-079-554,Granted Patent,yes,11,17,13,13,0,H04M19/041;;H04M2250/02;;H04M1/72457;;H04M19/041;;H04M2250/02;;H04M1/72457,H04B1/38;;H04B7/00;;H04L12/58;;H04M1/72457;;H04W84/10;;H04W88/02;;H04W92/18,455/567;;455/412.1;;455/41.1,5,0,,,"IBM Research Disclosure 416131, ""Non-Intrusive System to Warn the Disabled of Dangerous Situations"", Dec. 1998, pp. 1705.;;http://www.red-m.com/news/news-alert6.asp, New Red-Alert Pro from Red-M is First Standalone WLAN IDS to Detect Bluetooth and 802.11 a/b/g, Oct. 20, 2004, pp. 1-2.;;IBM Technical Disclosure Bulletin, ""Providing Services in Node Network Modal"", Dec. 1995, pp. 263-266.;;IBM Technical Disclosure Bulletin, ""Improved Compare and Swap Instruction using Change Bits for Computer Systems with Broadcast"", Mar. 1992, pp. 117-119.;;U.S. Appl. No. 09/735,341, Bonalumi et al., Radio Receiver that Changes Function According to the Output of an Internal Voice-Only Detector, filed Dec. 12, 2000.",ACTIVE
73,US,B1,US 9563699 B1,032-898-492-933-83X,2017-02-07,2017,US 201514692310 A,2015-04-21,US 201514692310 A;;US 201213401728 A;;US 201113193514 A;;US 201161547028 P;;US 36873510 P,2010-07-29,System and method for matching a query against a broadcast stream,"A method for matching a query against a broadcast stream includes receiving one or more broadcast streams, from which it generates and stores an audio fingerprint of a selected portion of each received broadcast stream. A query is received from which the method generates an audio fingerprint. From that point, the method continues by identifying audio content from the query, using the query audio fingerprint and a database of indexed audio content. The method concludes by identifying the source of the query using the query audio fingerprint and the stored audio fingerprints. Embodiments of the method further include predictively caching audio fingerprint sequences and corresponding audio item identifiers from a server after storing audio fingerprints extracted from the broadcast stream; and using the predictively cached audio fingerprint sequences to identify an audio item within the audio signal based on at least some additional audio fingerprints of the audio signal.",SOUNDHOUND INC;;SOUNDHOUND INC,MOHAJER KEYVAN;;MONT-REYNAUD BERNARD;;AUNG JOE KYAW SOE,SOUNDHOUND AI IP HOLDING LLC (2023-05-10);;SOUNDHOUND AI IP LLC (2023-05-10);;SOUNDHOUND INC (2013-05-13),https://lens.org/032-898-492-933-83X,Granted Patent,yes,100,3,3,16,0,H04H60/372;;H04H60/58;;G06F16/686;;G06F16/639;;G06F16/683;;G10L19/018;;G06F16/686;;G06F16/639;;G06F16/683;;H04H60/372;;H04H60/58;;G06F16/687;;H04H20/14;;H04H60/13;;H04H60/27;;H04H60/35;;H04H60/43;;H04H60/44,G06F17/30;;G10L19/018;;H04H20/14;;H04H60/13;;H04H60/27;;H04H60/35;;H04H60/43;;H04H60/44,,48,11,138-764-066-066-921;;138-764-066-066-921;;136-787-470-295-08X;;032-351-563-667-809;;040-464-369-709-332;;063-623-440-439-989;;134-711-618-409-714;;092-756-051-343-060;;179-166-503-537-371;;063-728-577-625-046;;060-090-745-787-329,10.1145/217279.215273;;10.1145/217279.215273;;10.1109/tasl.2007.913035;;10.1145/354384.354520;;10.1145/226931.226934;;10.1045/may97-witten;;10.1109/icme.2002.1035785;;10.1145/1145287.1145312;;10.1145/872773.872780;;10.1109/mmdbms.1996.541853;;10.1109/93.556537,"U.S. Appl. No. 60/218,824, filed Jul. 18, 2005, Kenyon, Stephen, et al.;;U.S. Appl. No. 60/155,064, filed Sep. 21, 1999, Kenyon, Stephen, et al.;;U.S. Appl. No. 60/222,023, filed Jul. 31, 2000, Wang, et al.;;U.S. Appl. No. 60/134,782, filed May 19, 1999, Rhoads, G.;;U.S. Appl. No. 60/166,965, filed Nov. 23, 1999, Finley, Michael, et al.;;U.S. Appl. No. 60/158,087, filed Oct. 7, 1999, Swierczek, Remi.;;U.S. Appl. No. 60/186,565, filed Mar. 2, 2000, Swierczek, Remi.;;PCT/2009/066458, International Search Report, mailed Jun. 23, 2010, 16 pages.;;InData Corporation, DepoView Video Review Software Product Description, ""InData's Newest Video Deposition Viewer"", Dec. 2007, 2 pgs.;;InData Corporation, DepoView DVD, Video Review Software Product Brochure, Jun. 2008, 4 Pgs.;;InData Corporation, DepoView Video Review Software Product Discription, http://indatacorp.com/depoview.html, accessed Nov. 8, 2011, 2 Pgs.;;Sony Ericsson's W850i Walkman Phone Now Available in the Middle East. Al-Bawaba News, 2006 Al-Bawaba. Dec. 11, 2006. Factiva, Inc. , 2 pages.;;Blackburn, Steven G. ""Content Based Retrieval and Navigation of Music"". University of Southampton, Department of Electronics and Computer Science, Faculty of Engineering and Applied Science. Mar. 10, 1999. 41 Pages.;;Blackburn, Steven, et al. ""A Tool for Content Based Navigation of Music"". University of Southampton, Department of Electronics and Computer Science, Multimedia Research Group. Copyright 1998 ACM 1-58113-036-8/98/0008. pp. 361-368.;;Blackburn, Steven George. ""Content Based Retrieval and Navigation of Music Using Melodic Pitch Contours"". University of Southampton, Department of Electronics and Computer Science, Faculty of Engineering and Applied Science. Sep. 26, 2000. 136 Pages.;;Blackburn, Steven G. ""Search by Humming"". University of Southampton, Department of Electronics and Computer Science, Faculty of Engineering. May 8, 1997. 69 Pages.;;Hum That Tune, Then Find it on the Web. NPR: Weekend Edition-Saturday, WKSA. Copyright 2006 National Public Radio. Dec. 23, 2006, Factiva, Inc. 2 pages.;;Casey, Michael A., et al., ""Content-Based Music Information Retrieval: Current Directions and Future Challenges"", Apr. 2008, vol. 96, No. 4. Copyright 2008 IEEE, Retrieved from IEEE Xplore [retrieved on Dec. 29, 2008 at 18:02]. 29 Pages.;;Wagstaff, Jeremy. ""Loose Wire: New Service Identifies Songs You Hum"". WSJA Weekend Journal. Copyright 2006, Dow Jones & Company, Inc. Dec. 25, 2006. Factiva, Inc. 2 pages.;;Saltzman, Marc. ""The Best Things in life are Free-For Your iPhone"". Home Electronics and Technology, for Canwest News Service. Copyright 2008 Edmonton Journal. Nov. 12, 2008. Factiva, Inc. 2 pages.;;First Products with Gracenote Technology to Ship in 2008. Warren's Consumer Electronics Daily. Copyright 2007 Warren Publishing, Inc. Sep. 18, 2007. Factiva, Inc. 2 pages.;;Gracenote Readies New Services, But Video Initiative Stalls. Warren's Consumer Electronics Daily. Copyright 2005 Warren Publishing, Inc. vol. 5; Issue 122. Jun. 24, 2005. Factiva, Inc. 2 pages.;;Furui, Sadaoki. ""Digital Speech Processing, Synthesis, and Recognition"". Second Edition, Revised and Expanded. Nov. 17, 2000. ISBN 978-0824704520. 17 pages.;;Ghias, Asif, at al. ""Query by Humming"". Musical Information Retrieval in an Audio Database. Cornell University 1995. 6 Pages.;;Ghias, Asif, et al. ""Query by Humming-Musical Information Retrieval in an Audio Database"". ACM Multimedia 95-Electronic Proceedings. San Francisco, Ca. Nov. 5-9, 1995. 13 Pages.;;Han, Byeong-jun, et al. ""M-Musics: Mobile Content-Based Music Retrieval System"". Copyright 2007, Augsburg, Bavaria, Germany. ACM 978-1-59593-01-8/07/0009. Sep. 23-28, 2007. pp. 469-470. 2 Pages.;;Jang, Jyh-Shing Roger, et al. ""A General Framework of Progressive Filtering and its Application to Query to Singing/Humming"". IEEE Transactions on Audio, Speech, and Language Processing, vol. 16. No. 2, Feb. 2008 pp. 350-358. 9 Pages.;;Kosugi, Naoko, et al. ""A Practical Query-By-Humming System for a Large Music Database"". NTT Laboratories, Japan, ACM Multimedia Los Angeles, Ca, USA, Copyright ACM 2000 1-58113-198-4/00/10, pp. 333-342. 10 Pages.;;McNab, Rodger J., et al. ""Towards the Digital Music Library: Tune Retrieval from Acoustic Input"". University of Waikato, Department of Computer Science, School of Education. DL 1996, Bethesda MD USA. Copyright 1996 ACM 0-89791-830-4/96/03. p. 11-18. 8 Pages.;;McNab, Rodger J., et al. ""The New Zealand Digital Library MELody inDEX"". University of Waikato, Department of Computer Science. D-Lib Magazine, May 1997 [retrieved on Jun. 12, 2011 at 11:25:49 AM]. ISSN 1082-9873. Retrieved from the Internet: , 13 pages.;;Pardo, Bryan, et al. ""The VocalSearch Music Search Engine"". EECS, Northwestern University. JCDL 2008, Pittsburgh, Pennsylvania, USA. Jun. 16-20, 2008, ACM 978-1-59593-998-2/08/06, p. 430. 1 Page.;;Mobile Music: Comcast Cellular First in U.S. To Trial Breakthrough Interactive Music Service Called *CD. Copyright PR Newswire, New York. ProQuest LLC. Feb. 11, 1999. Retrieved from the Internet: <http://proquest.umi.com.libproxy.mit.edu/pqdwb?did+38884944&sid=3&Fmt-3&clientid=5482&RQT=309&VName=PQD>. 3 pages.;;Song, Jungmin, et al. ""Query by Humming: Matching Humming Query to Polyphonic Audio"", LG Electronics, Seoul, Korea. Copyright 2002 IEEE. 0/7809-7304-9/02. pp. 329-332. 4 Pages.;;Taylor, Chuck. ""Company Lets Listeners Dial for CDs"". Billboard, vol. 1, No. 26, General Interest Module. Jun. 26, 1999. pp. 86-87. 2 pages.;;Can't Get That Song Out of Your Head. Copyright 2007 The Jakarta Post. May 20, 2007. Factiva, Inc. 2 Pages.;;Typke, Rainer, et al. ""A Survey of Music Information Retrieval Systems"". Universiteit Utrecht, The Netherlands. Copyright 2005 Queen Mary, University of London. 8 Pages.;;Wang, Avery. ""The Shazam Music Recognition Service"". Communications of the ACM, vol. 49, No. 8. Aug. 2006, ACM 0001-0782/06/0800, pp. 44-48. 5 pages.;;Melodis Rolls Out midorni mobile. Wireless News. Copyright 2008 M2 Communications, Ltd. Mar. 6, 2008. 1 Page.;;Zhu, Yunyue, et al. ""Warping Indexes with Envelope Transforms for Query by Humming"". New York University, New York, SIGMOD Copyright 2003, San Diego, CA. Jun. 9-12, 2003. ACM 1-58113-634-X/03/06. pp. 181-192. 12 Pages.;;PCT/US2009/066458, International Preliminary Report on Patentability dated Jun. 7, 2011, 7 pages.;;Chou, Ta-Chun, et al., ""Music Databases: Indexing Techniques and Implementation"", Proceedings of International Workshop on Multimedia Database Management Systems, IEEE, dated Aug. 14-16, 1996, pp. 46-53, 8 pages.;;McPherson, John R. and Bainbridge, David, ""Usage of the MELDEX Digital Music Library"", 1999, in Proceedings of the International Symposium on Music Information Retrieval, (Bloomington, IN, USA, 2001), pp. 19-20, 2 pages.;;Wold, Erling, et al., ""Classification, Search, and Retrieval of Audio"", Muslce Fish, Berkeley, CA, USA, CRC Handbook of Multimedia Computing 1999, pp. 1-19, 18 pages.;;Wold et al., ""Content-Based Classification, Search and Retrieval of Audio"", IEEE Multimedia 1070-986X/96, vol. 3, No. 3: Fall 1996, pp. 27-36 (17 pages).;;Horn, Patricia, ""What was that song? With a wireless phone, find out what you heard on the radio."", The Inquirer, Philadelphia, Pennsylvania, USA, dated Feb. 11, 1999, 3 pages.;;U.S. Appl. No. 13/401,728-Response to Office Action dated Jul. 17, 2014, filed Oct. 16, 2014, 16 pages.;;U.S. Appl. No. 13/401,728-Notice of Allowance dated Mar. 4, 2015, 8 pages.;;U.S. Appl. No. 13/401,728-Office Action dated Jul. 17, 2014, 11 pages.",ACTIVE
74,US,A,US 5482565 A,082-100-631-227-854,1996-01-09,1996,US 31670094 A,1994-09-30,US 31670094 A;;US 82777392 A,1992-01-29,Method for washing balls,"An apparatus and method for washing balls in a fluid is disclosed which includes a container for storing soiled balls and a wash unit having an elongated cylindrical housing suitable for containing the fluid and having a lower end adapted for receiving balls and an upper end adapted for discharging balls. The container serially dispenses balls via a transfer chute to the lower end of the housing. The transfer chute includes apparatus for separating regular and irregular balls. Inside the housing, balls are conveyed from the lower end to the upper end by a screw conveyor system which agitates and scrubs the balls. The screw conveyer system includes an first screw conveyor located near the lower end, and a second screw conveyor located near the upper end. The first and second screw conveyors are spaced to form a conveyor free wash cell. Balls are discharged at the housing's upper end to a ramp having a plurality of overlapping flights, where the balls are rinsed.",DISCOVERY ZONE INC,GUTTERMAN BERNARD;;ACKER DUANE;;WALTER RICHARD J;;SOLLING JOE L,CEC ENTERTAINMENT INC (1999-06-23),https://lens.org/082-100-631-227-854,Granted Patent,yes,25,2,2,2,0,A63B47/04;;A63B2047/028;;A63B2047/043;;A63B2047/046;;A63B2208/12;;A63B2225/30;;B08B3/042;;A63B47/04;;B08B3/042;;A63B2047/028;;A63B2225/30;;A63B2047/043;;A63B2047/046;;A63B2208/12,A63B47/02;;A63B47/04;;B08B3/04,134/25.4;;134/25.5;;134/32;;134/34,0,0,,,,EXPIRED
75,US,A,US 5353822 A,096-427-323-942-736,1994-10-11,1994,US 82777392 A,1992-01-29,US 82777392 A,1992-01-29,Apparatus and method for washing balls,"An apparatus and method for washing balls in a fluid is disclosed which includes a container for storing soiled balls and a wash unit having an elongated cylindrical housing suitable for containing the fluid and having a lower end adapted for receiving balls and an upper end adapted for discharging balls. The container serially dispenses balls via a transfer chute to the lower end of the housing. The transfer chute includes means for separating regular and irregular balls. Inside the housing, balls are conveyed from the lower end to the upper end by a screw conveyor system which agitates and scrubs the balls. The screw conveyer system includes an first screw conveyor located near the lower end, and a second screw conveyor located near the upper end. The first and second screw conveyors are spaced to form a conveyor free wash cell. Balls are discharged at the housing's upper end to a ramp having a plurality of overlapping flights, where the balls are rinsed.",RESTAURANT TECHNOLOGY,GUTTERMAN BERNARD;;ACKER DUANE;;WALTER RICHARD J;;SOLLING JOE L,DISCOVERY ZONE INC (1994-08-29);;RESTAURANT TECHNOLOLGY INC (1992-01-27);;RESTAURANT TECHNOLOGY INC (1992-01-27);;CEC ENTERTAINMENT INC (1999-06-23),https://lens.org/096-427-323-942-736,Granted Patent,yes,25,17,2,2,0,A63B47/04;;A63B2047/028;;A63B2047/043;;A63B2047/046;;A63B2208/12;;A63B2225/30;;B08B3/042;;A63B47/04;;B08B3/042;;A63B2047/028;;A63B2225/30;;A63B2047/043;;A63B2047/046;;A63B2208/12,A63B47/02;;A63B47/04;;B08B3/04,134/65;;134/132;;134/133;;134/134;;134/69,0,0,,,,EXPIRED
76,US,A1,US 2004/0226012 A1,004-932-555-568-181,2004-11-11,2004,US 43452503 A,2003-05-08,US 43452503 A,2003-05-08,System and method of managing items on a clipboard,"
   A system and method of enabling a user to manage items such as text, graphics image, audio clips, video clips etc. on a clipboard are provided. The system and method include displaying a window having at least one option for managing the items on the clipboard and allowing the user to assert the option to manage the items. In another embodiment, a system and method are provided to indicate a selected item at a location in a document displayed in a graphical user interface with a scrollbar. The method includes selecting the item, determining whether the item is a file, and displaying, if the item is a file, an icon representing the file in the scrollbar at a location corresponding to the location of the highlighted item. 
",IBM,AWADA FAISAL M;;BROWN JOE NATHAN;;BURKES PHILIP BERNARD;;RODRIGUEZ HERMAN,INTERNATIONAL BUSINESS MACHINES CORPORATION (2003-05-01),https://lens.org/004-932-555-568-181,Patent Application,yes,11,55,2,2,0,G06F3/04855;;G06F3/04855;;G06F3/04842;;G06F3/04842;;G06F9/543;;G06F9/543;;H04N21/434;;H04N21/434,G06F9/46;;G06F15/16;;G06F15/167,7181;;709/213;;715/500.1;;X71553;;709/201;;709/229,0,0,,,,EXPIRED
77,US,A1,US 2005/0060274 A1,146-064-764-283-053,2005-03-17,2005,US 66007203 A,2003-09-11,US 66007203 A,2003-09-11,World wide web document distribution system with a plurality of alternate user-interface formats selectively available for each bookmarked web document,"A user at a receiving Web station is provided with several alternate Web page display interface formats, from which the user may select the appropriate format for each Web document that he bookmarks. Thus, each time that a bookmarked Web document will be displayed subsequently, it will have this optimum presentation interface format. The implementation comprises bookmarking a received Web document, predetermining at least one display interface format alternate to said standard display interface format for bookmarked Web documents, providing a document folder associated with each alternate display interface format, enabling a user to put a bookmarked Web document into a document folder associated with an alternate display interface format and displaying bookmarked documents in said document folder in said alternate display interface format.",IBM,AWADA FAISAL M;;BROWN JOE NATHAN;;BURKES PHILIP BERNARD;;ESPINOZA VICTOR,INTERNATIONAL BUSINESS MACHINES CORPORATION (2003-08-26),https://lens.org/146-064-764-283-053,Patent Application,yes,13,2,2,2,0,G06F16/9562;;G06F16/9562,G06F17/30;;G06F40/00,707/1,0,0,,,,EXPIRED
78,US,A1,US 2004/0236974 A1,195-752-329-241-170,2004-11-25,2004,US 44369103 A,2003-05-22,US 44369103 A,2003-05-22,Advanced computer hibernation functions,"
   Advanced computer hibernation functions are useful in saving a user's work environment when a user logs off a computer. The current art requires powering off the computer when entering into hibernation, and only allows a user to store a single non-reusable hibernation file for use in restoring operation when the computer is subsequently powered on. The present invention allows hibernation files to be created and stored without requiring a user to power off the computer to enter hibernation mode. Once the hibernation files are created and stored, a user achieves faster shut down of the computer when the user enters into hibernation mode by selecting from one of the existing hibernation files for advanced hibernation mode. Multiple users are allowed to save multiple work environments or files while maintaining privacy regarding each user's work environments by requiring log on identification passwords for each user. 
",IBM,BROWN JOE NATHAN;;BURKES PHILIP BERNARD;;ESPINOZA VICTOR;;MICHEL LARRY A,INTERNATIONAL BUSINESS MACHINES CORPORATION (2003-05-19),https://lens.org/195-752-329-241-170,Patent Application,yes,5,38,2,2,0,G06F9/44505;;G06F9/44505;;G06F9/4418;;G06F9/4418;;Y02D10/00;;Y02D10/00,G06F1/32;;G06F9/445,71332,0,0,,,,EXPIRED
79,TW,B,TW I352287 B,031-516-583-164-631,2011-11-11,2011,TW 94114172 A,2005-05-03,US 84553404 A,2004-05-13,"Method, system, and computer program product for m",,IBM,AWADA FAISAL M;;BROWN JOE NATHAN;;BURKES PHILIP BERNARD;;ESPINOZA VICTOR,,https://lens.org/031-516-583-164-631,Granted Patent,no,0,0,6,6,0,G06F9/5077;;G06F11/0712;;G06F11/0784;;G06F11/0784;;G06F9/5077;;G06F11/0712,G06F9/50,,0,0,,,,INACTIVE
80,TW,A,TW 200612244 A,096-071-383-493-085,2006-04-16,2006,TW 94114172 A,2005-05-03,US 84553404 A,2004-05-13,Free resource error/event log for autonomic data processing system,"System, method, and computer program product for monitoring resources capable of being assigned to different partitions of a data processing system from a free resources pool of the data processing system. A free resources event log is associated with the free resources pool for maintaining a log of events for each resource that is in the free resources pool. When a resource is assigned to a partition from the free resources pool, a log of events for the assigned resource is transferred from the free resources event log to an event log associated with the partition.",IBM,AWADA FAISAL M;;BROWN JOE NATHAN;;BURKES PHILIP BERNARD;;ESPINOZA VICTOR,,https://lens.org/096-071-383-493-085,Patent of Addition,no,0,1,6,6,0,G06F9/5077;;G06F11/0712;;G06F11/0784;;G06F11/0784;;G06F9/5077;;G06F11/0712,G06F9/50;;G06F12/00,,0,0,,,,INACTIVE
81,DE,B,DE 1229998 B,162-936-622-507-088,1966-12-08,1966,DE ST018322 A,1961-09-13,US 1229998X A,1960-09-22,Verfahren zur Alkylierung von Isoparaffinen mit Olefinen in fluessiger Phase in Gegenwart eines Aluminiumchlorid-Dialkylaether-Komplexes,,STANDARD OIL CO,KELLY JOE TAYLOR;;SCHOEN WILLIAM;;ROEBUCK ALAN KITTSON;;EVERING BERNARD LEWIS,,https://lens.org/162-936-622-507-088,Patent Application,no,1,0,1,1,0,C07C2/60;;C07C2521/08,C07C2/60,,0,0,,,,DISCONTINUED
82,US,B2,US 7496853 B2,113-914-518-608-706,2009-02-24,2009,US 43452503 A,2003-05-08,US 43452503 A,2003-05-08,Method of managing items on a clipboard,"A method of enabling a user to manage items such as text, graphics image, audio clips, video clips etc. on a clipboard are provided. The method includes displaying a window having at least one option for managing the items on the clipboard and allowing the user to assert the option to manage the items. In another embodiment, a method is provided to indicate a selected item at a location in a document displayed in a graphical user interface with a scrollbar. The method includes selecting the item, determining whether the item is a file, and displaying, if the item is a file, an icon representing the file in the scrollbar at a location corresponding to the location of the highlighted item.",IBM,AWADA FAISAL M;;BROWN JOE NATHAN;;BURKES PHILIP BERNARD;;RODRIGUEZ HERMAN,INTERNATIONAL BUSINESS MACHINES CORPORATION (2003-05-01),https://lens.org/113-914-518-608-706,Granted Patent,yes,11,15,2,2,0,G06F3/04855;;G06F3/04855;;G06F3/04842;;G06F3/04842;;G06F9/543;;G06F9/543;;H04N21/434;;H04N21/434,G06F17/00;;G06F3/00;;G06F9/00;;G06F9/46;;G06F15/16;;G06F15/167;;G11B27/00;;H04N5/44;;H04N7/173,715/767;;715/764;;715/769;;715/770;;715/716,1,0,,,"""Clipboard Express"" http://web.archive.org/web/20020823011407/www.cheqsoft.com/clipboard.html, pp. 1-3.",INACTIVE
83,US,A1,US 2002/0169343 A1,042-065-253-210-825,2002-11-14,2002,US 85078001 A,2001-05-08,US 85078001 A,2001-05-08,PROCESS FOR OBTAINING ALPHA-CAMPHOLENIC ALDEHYDE,"
   A process for obtaining alpha-campholenic aldehyde, which is useful as an aroma chemical and as a synthetic intermediate for other aroma chemicals, particularly those with a sandalwood odor, and also for some pharmaceuticals, is provided. In particular, the invention includes a continuous process for obtaining optically active or racemic -campholenic aldehyde by a catalytic rearrangement of optically active or racemic -pinene oxide that can be commercially practicable. 

   In one embodiment, the method comprises continuously feeding -pinene oxide to a mixture including catalyst(s) and solvent(s), where the solvent(s) have a boiling point higher than the boiling point of -campholenic aldehyde, under conditions sufficient to provide for the complete, or at least partial, conversion of -pinene oxide into -campholenic aldehyde. The process further includes continuously removing -campholenic aldehyde from the reaction zone by suitable techniques such as distillation. 
",KANE BERNARD J.;;SANDERS GARY P.;;SNOW JOE W.;;ERMAN MARK B.,KANE BERNARD J;;SANDERS GARY P;;SNOW JOE W;;ERMAN MARK B,MILLENNIUM SPECIALTY CHEMICALS (2001-09-05);;RENESSENZ LLC (2010-04-30),https://lens.org/042-065-253-210-825,Patent Application,yes,0,0,9,9,0,C07C45/58;;C07C45/58,C07B61/00;;B01D3/00;;C07C45/58;;C07C47/225,568/443,0,0,,,,EXPIRED
