"#",Jurisdiction,Kind,Display Key,Lens ID,Publication Date,Publication Year,Application Number,Application Date,Priority Numbers,Earliest Priority Date,Title,Abstract,Applicants,Inventors,Owners,URL,Document Type,Has Full Text,Cites Patent Count,Cited by Patent Count,Simple Family Size,Extended Family Size,Sequence Count,CPC Classifications,IPCR Classifications,US Classifications,NPL Citation Count,NPL Resolved Citation Count,NPL Resolved Lens ID(s),NPL Resolved External ID(s),NPL Citations,Legal Status
1,FR,A,FR 1013180 A,068-638-293-527-48X,1952-07-23,1952,FR 1013180D A,1950-02-23,FR 1013180T A,1950-02-23,Nouvelles casseroles hémicirculaires utilisant un seul foyer pour chauffer deux récipients,,,GAUDOIN JOE L-BERNARD-ETIENN,,https://lens.org/068-638-293-527-48X,Granted Patent,no,0,0,1,1,0,A47J27/122,A47J27/122,,0,0,,,,EXPIRED
2,GB,A,GB 2213523 A,114-950-967-121-13X,1989-08-16,1989,GB 8828860 A,1988-12-09,GB 8728814 A,1987-12-09,Strap connector,"A camera strap arrangement has a shoulder strap (12) of fixed length engaged between a pair of fittings (14). Further short straps (21) are looped around these fittings (14) in a manner to permit adjustment of the overall length of the combined strap (12, 21). The short straps (21) terminate in connectors (10) which have open hooks (33) for engaging with a camera fitting (47, 46) either directly or via a ring (48). A keep member (34) is pivotably mounted to the connectors (10) to retain the hooks (33) in place or to permit their release. Soft flexible pads (43) can overlap, the hooks (33) to protect the camera. <IMAGE>",C Z SCIENT INSTR LTD,CONNOR JOE E;;SAMS BERNARD,,https://lens.org/114-950-967-121-13X,Patent Application,no,5,0,3,3,0,A45C13/30;;F16B45/02;;F16B45/027;;F16B45/022,A45C13/30;;F16B45/02,E2A AHD           AHD;;E2A A200          AHD;;E2A A426          AHD;;U1S S2220,0,0,,,,DISCONTINUED
3,CN,A,CN 101044747 A,155-108-096-076-005,2007-09-26,2007,CN 200580035494 A,2005-11-09,EP 2005055850 W;;US 253904 A,2004-12-02,Method and apparatus for managing ring tones in a mobile device,"An improved method, apparatus, and computer instructions for a mobile device for managing ring tones. A radio frequency transmission is detected from another mobile device. In response to detecting the radio frequency transmission from the other mobile device, a ring tone used by the other mobile device is identified to form an identified ring tone. The current ring tone is selectively changed for the mobile device to an alternate ring tone, depending on the identified ring tone.",IBM,BERNARD AWADA FAISAL BROWN JOE,,https://lens.org/155-108-096-076-005,Patent Application,no,0,6,13,13,0,H04M19/041;;H04M2250/02;;H04M1/72457;;H04M19/041;;H04M2250/02;;H04M1/72457,H04M19/04;;H04M1/72457;;H04W84/10;;H04W88/02;;H04W92/18,,0,0,,,,ACTIVE
4,WO,A1,WO 2008/157838 A1,079-533-657-212-47X,2008-12-24,2008,US 2008/0067933 W,2008-06-23,US 92932807 P,2007-06-21,"CONNECTING SYSTEM, APPARATUS, AND PROCESS, AND MULTI-PART CONNECTED STRUCTURE","In one embodiment of the disclosed invention, a connecting device is provided. The connecting device comprises a connector that includes at least two openings. A shield is provided adjacent to a surface of the connector and is positioned to block a projectile directed at the surface of the connector from entering a portion of the connector between the two openings. The shield may be made of a ballistic-resistant material to thereby impart ballistic resistance to the connecting device.",TACTRONICS GROUP L L C;;GRASTY JOE C;;MADRID BERNARD,GRASTY JOE C;;MADRID BERNARD,,https://lens.org/079-533-657-212-47X,Patent Application,yes,4,2,1,1,0,F16B5/0635;;F41H5/013,F16B1/00,,0,0,,,,PENDING
5,EP,A2,EP 0405869 A2,018-145-013-990-64X,1991-01-02,1991,EP 90306891 A,1990-06-22,US 37126489 A,1989-06-26,Roll-up door construction.,"A roll-up door for enclosing a doorway in a building. The door comprises a horizontal rotatable drum mounted above the doorway and a flexible door panel (8) is wound on the drum. A pair of first pulleys (17) are secured to opposite ends of the drum and one end of a flat belt (18) is secured to each first pulley, while the opposite end of each belt is dead-ended on a fixed object. A counterbalancing weight (23) is attached to the belt intermediate its ends and exerts a counterbalanc­ing force to wind the door panel (8) on the drum. A pair of second pulleys (27) are secured to opposite ends of the drum and located adjacent the first pulleys. One end of a second flat belt (28) is secured to each second pulley (27), while the opposite end of each second belt is connected to the lower end of the door panel (8). A drive member, such as a hydraulic motor (9), is operably connected to the drum and operation of the motor in one direction will unwind the door panel from the drum and move the door to a closed position, while operation of the motor in the opposite direction will wind the door panel on the drum to move the door panel to an open position. A resilient member or spring (37) is connected to the second belt (28) intermediate its ends and exerts a biasing force to stretch the door panel.  ",KELLEY CO INC,WEISHAR WILLIAM BERNARD;;DELGADO JOE MANUEL,,https://lens.org/018-145-013-990-64X,Patent Application,yes,0,5,5,5,0,E06B9/62;;E06B9/68;;E06B9/80;;E05Y2900/00;;E05F15/47;;E05Y2900/106;;E06B9/68;;E06B9/62;;E06B9/80;;E05Y2900/00;;E05F15/47;;E05Y2900/106,E05F15/00;;E06B9/62;;E06B9/68;;E06B9/80,,0,0,,,,DISCONTINUED
6,EP,A3,EP 0405869 A3,069-226-844-030-900,1991-12-04,1991,EP 90306891 A,1990-06-22,US 37126489 A,1989-06-26,ROLL-UP DOOR CONSTRUCTION,"A roll-up door for enclosing a doorway in a building. The door comprises a horizontal rotatable drum mounted above the doorway and a flexible door panel (8) is wound on the drum. A pair of first pulleys (17) are secured to opposite ends of the drum and one end of a flat belt (18) is secured to each first pulley, while the opposite end of each belt is dead-ended on a fixed object. A counterbalancing weight (23) is attached to the belt intermediate its ends and exerts a counterbalanc­ing force to wind the door panel (8) on the drum. A pair of second pulleys (27) are secured to opposite ends of the drum and located adjacent the first pulleys. One end of a second flat belt (28) is secured to each second pulley (27), while the opposite end of each second belt is connected to the lower end of the door panel (8). A drive member, such as a hydraulic motor (9), is operably connected to the drum and operation of the motor in one direction will unwind the door panel from the drum and move the door to a closed position, while operation of the motor in the opposite direction will wind the door panel on the drum to move the door panel to an open position. A resilient member or spring (37) is connected to the second belt (28) intermediate its ends and exerts a biasing force to stretch the door panel.  ",KELLEY COMPANY INC.,"WEISHAR, WILLIAM BERNARD;;DELGADO, JOE MANUEL",,https://lens.org/069-226-844-030-900,Search Report,yes,3,0,5,5,0,E06B9/62;;E06B9/68;;E06B9/80;;E05Y2900/00;;E05F15/47;;E05Y2900/106;;E06B9/68;;E06B9/62;;E06B9/80;;E05Y2900/00;;E05F15/47;;E05Y2900/106,E05F15/00;;E06B9/62;;E06B9/68;;E06B9/80,,0,0,,,,DISCONTINUED
7,WO,A1,WO 2009/126172 A1,118-220-614-276-823,2009-10-15,2009,US 2008/0073487 W,2008-08-18,US 4426008 P,2008-04-11,RESISTANCE TO POLYPHENON E DUE TO INCREASED BCL-2 EXPRESSION,"The present invention discloses BCL2 gene and protein expression are significantly higher in cancer cells resistant to the growth inhibitory effects of Polyphenon E (Poly E), and decreasing BCL2 expression or activity would restore sensitivity to Poly E. These results indicate that BCL2 could be a marker of resistance to Poly E and could be used to identify patients who may not benefit clinically from treatment or prevention with Poly E. Furthermore, treatment regimens that combine Poly E and BCL2 inhibitors may be effective against cancers with high BCL2 expression.",UNIV COLUMBIA;;JOE ANDREW K;;WEINSTEIN I BERNARD,JOE ANDREW K;;WEINSTEIN I BERNARD,,https://lens.org/118-220-614-276-823,Patent Application,yes,7,3,1,1,0,G01N33/5011;;G01N2333/4748;;G01N2800/52,A61K31/21;;A61K31/44,,2,2,065-963-968-016-961;;129-344-754-413-862,15609335;;10.1002/ijc.20785;;10.1096/fj.02-0665fje;;12586742,"NIHAL ET AL.: ""Anti-proliferative and proapoptotic effects of (-)epigallocatechin-3-gallate on human melanoma: Possible implications for the chemoprevention of melanoma."", INT. J. CANCER, vol. 114, 17 December 2004 (2004-12-17), pages 513 - 521, XP002592436, DOI: doi:10.1002/IJC.20785;;HOFMANN ET AL.: ""Green tea polyphenol epigallocatechin-3 gallate induces apoptosis of proliferating vascular smooth muscle cells via activation of p53."", THE FASEB JOURNAL EXPRESS ARTICLE 10.1096/FJ. 02-0665-FJE., 5 February 2003 (2003-02-05)",PENDING
8,US,A1,US 2004/0199606 A1,056-258-438-314-486,2004-10-07,2004,US 40665603 A,2003-04-03,US 40665603 A,2003-04-03,"Apparatus, system and method of delivering alternate web pages based on browsers' content filter settings","
   A method, system and apparatus for delivering an alternate Web page to a browser are provided. The method, system and apparatus include the implementation of indicating Web pages that are not authorized to be displayed by the browser using content filter settings, comparing the content filter settings to content labels incorporated in a requested Web page and delivering an alternate Web page, if there is a match. The filter settings are generated by the browser and sent to a server in a request message. The browser also incorporates a semaphore in the request message. The semaphore is used to indicate whether the comparison should be undertaken. Thus, if the semaphore is absent in the request message, the requested Web page is delivered to the browser as customary. Further, in the case where there is a match and there is not an alternate Web page specified, either the requested Web page may be delivered to the browser or a message may be delivered to the browser indicating that the requested web page is off-limit. 
",IBM,BROWN JOE NATHAN;;BURKES PHILIP BERNARD,INTERNATIONAL BUSINESS MACHINES CORPORATION (2003-03-28),https://lens.org/056-258-438-314-486,Patent Application,yes,12,20,2,2,0,G06F16/9535;;G06F16/9535,G06F17/30,709/219;;709/229,0,0,,,,EXPIRED
9,US,B2,US 7539933 B2,097-512-557-170-962,2009-05-26,2009,US 99838601 A,2001-11-15,US 99838601 A,2001-11-15,Apparatus and method of highlighting links in a web page,"An apparatus and method of highlighting links that are not clearly identifiable in a Web document are provided. When the document is displayed, if the links are not clearly recognizable as such, the user may depress a button. Upon depressing the button, all the links embedded in the document will be highlighted. Here, highlighted is used to mean any manner that may be used to make the links clearly recognizable as such.",IBM,BROWN JOE NATHAN;;BURKES PHILIP BERNARD,INTERNATIONAL BUSINESS MACHINES CORPORATION (2001-11-14),https://lens.org/097-512-557-170-962,Granted Patent,yes,28,21,2,2,0,G06F16/9558;;G06F16/9558,G06F17/00;;G06F3/048;;G06F17/30,715/207;;715/205;;715/234;;715/856,5,3,030-176-358-448-422;;187-815-628-055-04X;;090-275-124-964-862,10.1145/74224.74229;;10.1145/234828.234833;;10.1145/948496.948516,"""Next Button for Jumping/Tabbing between Internet Hypertext Transfer Protocol Hyperlinks"", IBM Technical Disclosure Bulletin, Jan. 1998, 435-436.;;Warren Ernst ""Using Netscape"" from QUE, Mar. 1995, pp. 322-324.;;R. Glushko, ""Design Issues for Multi-Document Hypertexts"", ACM ,Nov. 1989, pp. 51-60.;;J. Allan, ""Automatic Hypertext Link Typing"", ACM, 1996, pp. 42-52.;;M. Noirhomme-Fraiture et al., ""Visual Representation of Hypermedia Links According to Their Types"", Proc. Working Conf. on Advanced Visual Interface, Italy, May 1998, pp. 146-155.",ACTIVE
10,DE,A1,DE 1621358 A1,013-836-841-613-082,1971-04-29,1971,DE 1621358 A,1967-07-26,US 59284866 A,1966-11-08,Verfahren zur Aufbringung duenner Filme aus dielektrischem Material auf ein Substrat,,TEXAS INSTRUMENTS INC,GONZALES CARBAJAL BERNARD;;TED PIERCE JOE,,https://lens.org/013-836-841-613-082,Patent Application,no,0,2,2,3,0,C23C16/503;;H01L23/291;;H01L23/3157;;H01L2924/0002,C23C16/503;;H01L23/29;;H01L23/31,,0,0,,,,DISCONTINUED
11,US,B2,US 7966400 B2,030-141-455-915-23X,2011-06-21,2011,US 40665603 A,2003-04-03,US 40665603 A,2003-04-03,"Apparatus, system and method of delivering alternate web pages based on browsers' content filter settings","A method, system and apparatus for delivering an alternate Web page to a browser are provided. The method, system and apparatus include the implementation of indicating Web pages that are not authorized to be displayed by the browser using content filter settings, comparing the content filter settings to content labels incorporated in a requested Web page and delivering an alternate Web page, if there is a match. The filter settings are generated by the browser and sent to a server in a request message. The browser also incorporates a semaphore in the request message. The semaphore is used to indicate whether the comparison should be undertaken. Thus, if the semaphore is absent in the request message, the requested Web page is delivered to the browser as customary. Further, in the case where there is a match and there is not an alternate Web page specified, either the requested Web page may be delivered to the browser or a message may be delivered to the browser indicating that the requested web page is off-limit.",IBM,BROWN JOE NATHAN;;BURKES PHILIP BERNARD,INTERNATIONAL BUSINESS MACHINES CORPORATION (2003-03-28),https://lens.org/030-141-455-915-23X,Granted Patent,yes,12,6,2,2,0,G06F16/9535;;G06F16/9535,G06F7/04;;G06F15/173;;G06F17/30,709/225;;726/2;;726/3;;709/223,0,0,,,,INACTIVE
12,US,A,US 4730151 A,073-361-081-875-839,1988-03-08,1988,US 81907186 A,1986-01-15,US 81907186 A,1986-01-15,Continuous field control of series wound motors,"A method for operating an electronic control system for an operator controlled, electrically driven vehicle. The vehicle being powered by a direct current electric traction motor. The electronic control system includes a power source, a variable mark-space ratio power regulator responsive to a motor current command signal developed in response to the position of an accelerator, a direction selection means for providing signals indicative of the direction of motion of the vehicle, and a braking signal responsive to brake position. The electronic control system implements operation of the motor automatically in a propulsion mode, a regenerative mode, and a plug mode. The propulsion mode is either a series connected mode or a separately excited mode. The regenerative mode simulates the retarding effects of an internal combustion engine driven vehicle, while recover the kinetic energy of the vehicle by the generation of current to recharge the power source. The regenerative mode includes a regenertive coast mode and a regenerative brake mode. The plug mode provides a greater retarding force than the regenerative mode. The plug mode includes a plug coast mode and a plug brake mode.",GEN ELECTRIC,FLOREY BERNARD I;;LAMBERT JOE C,GENERAL ELECTRIC CORPORATION A CORP. OF NEW YORK (1986-01-10),https://lens.org/073-361-081-875-839,Granted Patent,yes,8,42,1,1,0,B60L7/006;;B60L7/22;;B60L2260/30;;B60L7/12;;B60L50/52;;Y02T10/70;;B60L7/006;;B60L2260/30;;B60L7/22;;B60L7/12;;B60L50/52;;Y02T10/64;;Y02T10/70,B60L7/22;;B60L11/18,318/376;;318/139;;318/363;;318/370;;318/373,0,0,,,,EXPIRED
13,US,A1,US 2005/0286452 A1,188-016-592-966-997,2005-12-29,2005,US 13079005 A,2005-05-17,IE S20040347 A,2004-05-18,Method and system for bi-directional exchange of data based on user-defined policies for the selection of a preferred datalink,A communications channel selection device aimed at solving the problems associated with selecting a preferred channel for two-way communication between an aircraft and the ground over TCP/IP packet-based networks. The device provides a means whereby policies for the selection of a preferred datalink are associated with the communications from aircraft-based applications so that communications are effected over the preferred channel according to a pre-defined set of policies. The device overcomes the challenges presented by the dynamic assignment of IP addresses to onboard systems by providing a method for: the discovery of dynamically assigned IP addresses (thereby enabling ground-initiated communications with an IP addressable entity) where such addresses relate to the preferred datalinks for active policies; queuing connect requests pending establishment of a connection to a ground-based system over a selected datalink; forwarding data over the selected datalink; mapping between the TCP/IP connection established and the connection over which the communicating application is communicating; defining policies such that they are understood by air-based and ground-based systems; a ground-based registry with which each onboard connecting application registers its currently preferred IP points of attachment for defined policies; a method for suitable authorised systems to retrieve the current IP address for a particular aircraft; and managing datalink connectivity.,HARDGRAVE STEVE;;MCGOLDRICK JOE;;HENSEY BERNARD,HARDGRAVE STEVE;;MCGOLDRICK JOE;;HENSEY BERNARD,FLIGHTMAN RESEARCH LIMITED (2005-08-11),https://lens.org/188-016-592-966-997,Patent Application,yes,10,139,2,2,0,H04W8/26;;H04W36/06;;H04W40/02;;H04W80/00;;H04W84/005;;H04W88/16;;H04L67/306;;H04L67/14;;H04L67/12;;H04L69/18;;H04B7/18506;;H04W76/10;;H04L67/63;;H04L67/306;;H04W80/00;;H04W84/005;;H04W8/26;;H04W88/16;;H04W36/06;;H04W40/02;;H04L67/12;;H04L69/18;;H04L67/14;;H04B7/18506;;H04W76/10;;H04L67/63,H04B7/00;;H04L12/28;;H04L12/56;;H04L12/66;;H04L29/06;;H04L29/08,370/310,0,0,,,,DISCONTINUED
14,US,A1,US 2004/0205500 A1,195-789-708-924-042,2004-10-14,2004,US 99838601 A,2001-11-15,US 99838601 A,2001-11-15,Apparatus and method of highlighting links in a web page,"
   An apparatus and method of highlighting links that are not clearly identifiable in a Web document are provided. When the document is displayed, if the links are not clearly recognizable as such, the user may depress a button. Upon depressing the button, all the links embedded in the document will be highlighted. Here, highlighted is used to mean any manner that may be used to make the links clearly recognizable as such. 
",IBM,BROWN JOE NATHAN;;BURKES PHILIP BERNARD,INTERNATIONAL BUSINESS MACHINES CORPORATION (2001-11-14),https://lens.org/195-789-708-924-042,Patent Application,yes,19,16,2,2,0,G06F16/9558;;G06F16/9558,G06F17/30,715/501.1;;715/512,0,0,,,,EXPIRED
15,WO,A1,WO 2012/102821 A1,089-697-131-219-638,2012-08-02,2012,US 2011/0068154 W,2011-12-30,US 201113012572 A,2011-01-24,LOW TEMPERATURE HYPERTHERMIA SYSTEM FOR THERAPEUTIC TREATMENT OF INVASIVE AGENTS,"The Low Temperature Hyperthermia System illuminates nano-particles, which are implanted in a living organism at the locus of the cancer or into the cancer cells, with a precisely determined energy field. This energy field ensures that the optimal cancer cell and cancer stem cell destruction temperature of 42C is not exceeded in the tissue, which minimizes the release of Heat Shock Proteins and cancer stem cells. The Low Temperature Hyperthermia System uses specially designed nano-particles that exhibit a specific temperature rise in a given illumination energy field and then have no further temperature rise even if the applied illumination energy field increases beyond the optimal level. Alternatively, the nano-particles exhibit a tightly controlled temperature rise based on a pre-determined illumination energy field strength. This innovative approach can also use radiation and/or chemotherapy in conjunction with the nano-particle illumination to kill the majority of the cancer cells.",ACTIUM BIOSYSTEMS LLC,MCKENNA DANIEL BERNARD;;TONDU ROBERT JOE,,https://lens.org/089-697-131-219-638,Patent Application,no,2,1,3,3,0,B82Y5/00;;A61N1/406;;B82Y5/00;;A61N1/406;;A61N2/002;;A61N2/004;;A61N5/0625;;A61N7/02,A61K9/14;;B82Y5/00,,0,0,,,,PENDING
16,IE,A2,IE S20040347 A2,124-722-724-837-393,2005-11-30,2005,IE S20040347 A,2004-05-18,IE S20040347 A,2004-05-18,A method for bi-directional exchange of data based on user-defined policies for the selection of a preferred datalink,A communications channel selection device aimed at solving the problems associated with selecting a preferred channel for two-way communication between an aircraft and the ground over TCP/IP packet-based networks. The device provides a means whereby policies for the selection of a preferred datalink are associated with the communications from aircraft-based applications so that communications are effected over the channel according to a pre-defined set of policies. The device overcomes the challenges presented by the dynamic assignment of IP addresses to onboard systems by providing a method for: the discovery of dynamically assigned IP addresses (thereby enabling ground-initiated communications with an IP addressable entity) where such addresses relate to the preferred datalinks for active policies; queuing connect requests pending establishment of a connection to a ground-based system over a selected datablink; forwarding data over the selected datalink; mapping between the TCP/IP connection established and the connection over which the communication application is communicating; defining policies such that they are understood by air-based and ground-based systems; a ground-based systems; a ground-based registry with which each onboard connecting application registers its currently preferred IP points of attachment for defined policies; a method for suitable authorised systems to retrieve the current IP address for a particular aircraft; and managing datalink connectivity.,FLIGHTMAN RES LTD,HARDGRAVE STEVE;;MCGOLDRICK JOE;;HENSEY BERNARD,,https://lens.org/124-722-724-837-393,Patent Application,no,0,0,2,2,0,H04W8/26;;H04W36/06;;H04W40/02;;H04W80/00;;H04W84/005;;H04W88/16;;H04L67/306;;H04L67/14;;H04L67/12;;H04L69/18;;H04B7/18506;;H04W76/10;;H04L67/63;;H04L67/306;;H04W80/00;;H04W84/005;;H04W8/26;;H04W88/16;;H04W36/06;;H04W40/02;;H04L67/12;;H04L69/18;;H04L67/14;;H04B7/18506;;H04W76/10;;H04L67/63,H04B7/00;;H04L12/28;;H04L12/56;;H04L12/66;;H04L29/06;;H04L29/08,,0,0,,,,DISCONTINUED
17,CN,A,CN 1735502 A,025-647-519-426-054,2006-02-15,2006,CN 200380108325 A,2003-10-27,US 42602302 P,2002-11-13,Methods for the extraction of contact lenses,,JOHNSON & JOHNSON VISION CARE,WOOD JOE M BERNARD ANTHONY J E,,https://lens.org/025-647-519-426-054,Patent Application,no,0,1,15,15,0,B29C71/0009;;B29C2071/0027;;B29D11/00067;;B29L2011/0041;;B29D11/00923;;B29D11/00317;;B29D11/00;;B29C71/0009;;B29C2071/0027;;B29L2011/0041;;B29D11/00067,B29D11/00;;B29C71/00,,0,0,,,,DISCONTINUED
18,DE,D1,DE 59209439 D1,027-745-965-524-844,1998-09-03,1998,DE 59209439 T,1992-12-28,EP 92122041 A,1992-12-28,"Verfahren zum Betrieb eines Empfängers, der mit Informationen gespeist wird, die über ein elektrisches Energieversorgungsnetz übertragen werden, und Anordnung zur Durchführung des Verfahrens","The receiver (3) is connected to a first phase of the electrical power supply network (2) from which it is fed exclusively with the transmitted information items. At least one event is monitored in the phases of the electrical power supply network (2), the occurrence of which event in one of the phases exacerbates or renders impossible correct reception of the transmitted information items in the receiver (3) when the latter is fed exclusively from the relevant phase with the transmitted information items. The arrangement (1) is driven via in each case one voltage divider (9, 10, 11) per phase and contains a controller (8), a switching arrangement (15; 16; 17) and in each case one event monitoring arrangement (12, 13, 14) per phase. The arrangement contains in each case one event detector (25, 26, 27) and in each case one event counter (28, 29, 30) per monitored event. The method and the arrangement (1) produce statements on the quality of the transmission and of the transmission path, which statements can be used, inter alia, for statistical purposes, for saving temporarily stored measurement data in a non-volatile memory and for switching over the transmission path. <IMAGE>",LANDIS & GYR TECH INNOVAT,IMFELD JOE;;PILLOUD BERNARD;;KING MARTIN CRANSTON,,https://lens.org/027-745-965-524-844,Granted Patent,no,0,0,4,4,0,H04B3/54;;H04B2203/5466;;H04B2203/5495;;H02J13/00009;;Y02E60/00;;Y04S40/121,H02J13/00;;H04B3/54,,0,0,,,,EXPIRED
