773,TR,T2,TR 200002050 T2,156-764-218-448-578,2000-12-21,2000,TR 200002050 T,1998-12-23,EP 9808551 W;;EP 98300292 A,1998-01-16,Selüloza bağlanabilen polisakkarit konjugesi.,"Bir polisakkarit konjugesi, moleküler agirligi en azindan 5000 olan birlestirilmis bir yapiya sahip bir polisakkarit konjugesi, selüloza baglanabilir. Tercih edilen polisakkaritler, demirhindi çekirdegi ksilogklukani, keçi boynuzu çekirdegi zamki ve enzimle modifiye edilmis guardir. Birlestirilen yapi, uygun olarak bir protein, örnegin bir enzim, antikor veya antikor parçasi, veya muhtemelen kendisiyle birlestirilmis koku gibi yararli bir maddeye sahip bir taneciktir. Polisakkarit konjugesi, pamuk ve diger kumaslar, kagit vs.' de bulunan selüloza baglandigindan, konjugenin selüloza baglanmasi, birlestirilmis yapiyi, selüloz içeren yüzeyin yakinina getirir. Bulus, bu sekilde birlestirilen yapilarin, bu tür yüzeylere hedeflenmesini mümkün kilar. Bulus, ayrica polisakkarit konjugesini içeren bir ürün ve polisakkarit konjugesinin kullanilmasiyla bir yapinin selüloza hedeflenerek baglanmasi için bir yöntem saglar.",UNILEVER NV,BERRY MARK JOHN;;DAVIS PAUL JAMES;;GIDLEY MICHAEL JOHN,,https://lens.org/156-764-218-448-578,Patent Application,no,0,0,18,18,0,C11D3/386;;C11D3/386;;C08B37/0057;;C08B37/0057;;C08B37/0087;;C08B37/0087;;C08B37/0093;;C08B37/0093;;C08B37/0096;;C08B37/0096;;C08L5/14;;C08L5/14;;C11D3/222;;C11D3/222;;C11D3/3845;;C11D3/3845;;C11D3/502;;C11D3/502,C08B37/00;;C08L5/14;;C11D3/22;;C11D3/384;;C11D3/386;;C11D3/50,,0,0,,,,PENDING
774,EP,B1,EP 1047726 B1,170-008-773-911-107,2002-08-28,2002,EP 99901057 A,1999-01-15,EP 99901057 A;;EP 98300291 A;;GB 9900145 W,1998-01-16,POLYSACCHARIDE CONJUGATES CAPABLE OF BINDING TO CELLULOSE,,QUEST INT,BERRY MARK JOHN;;GIDLEY MICHAEL JOHN;;DAVIS PAUL JAMES,,https://lens.org/170-008-773-911-107,Granted Patent,yes,3,0,9,9,0,C08B37/0096;;C08B37/0024;;C08B37/0057;;C08B37/0087;;C08B37/009;;C08B37/0093;;C08L5/14;;C11D3/222;;C11D3/505,C08B37/00;;C08B37/14;;C08L5/14;;C11D3/22;;C11D3/50;;C11D7/00,,2,0,,,"DATABASE WPI Week 8634 Derwent Publications Ltd., London, GB; AN 86-223138 XP002069370 & JP 61 155307 A (LION CORP), 15 July 1986;;DATABASE WPI Week 8631 Derwent Publications Ltd., London, GB; AN 86-201034 XP002069371 & JP 61 133299 A (LILAC KENKYUSHO KK) , 20 June 1986",EXPIRED
775,CN,C,CN 1128718 C,188-453-750-247-687,2003-11-26,2003,CN 99814195 A,1999-10-22,US 18977798 A,1998-11-10,Low electromagnetic emissions and improved signal quality video drive architecture for laser printers,,LEXMARK INT INC,BERRY JOHN B;;HARDIN KEITH B;;RICHEY JOHN P,,https://lens.org/188-453-750-247-687,Granted Patent,no,0,0,11,11,0,G06K15/1204;;G06K15/1204;;G06K2215/0077;;G06K2215/0077,B41J29/00;;B41J2/44;;G03G21/00;;G06K15/12,,0,0,,,,EXPIRED
776,EP,A1,EP 0068788 A1,086-609-307-254-751,1983-01-05,1983,EP 82303236 A,1982-06-22,AU PE938081 A,1981-06-22,Hydraulic valve control device.,"A motor-operable fluid valve for a pump, said valve comprising a valve body defining an open central portion, at least one high pressure inlet port in fluid communication with the open central portion, a plurality of lower pressure inlet and/or outlet ports in fluid communication with the open central portion via an array of flow passages, and a valve rotor having a plurality of openings and movably disposed within the open central portion between the line of flow from the high pressure to the lower pressure ports; said valve rotor further comprising a centrally mounted shaft operable to selectively connect inlet and outlet ports; said valve further comprising a rotational means on the shaft of the valve rotor, a drive gear (1, 2, 3) cooperative with the rotational means and comprising a top face and a bottom face, the top face being sloped so as to form a cam such that when the drive gear is rotated the rotational means may be raised and lowered by the camming action.",CLARK RUBBER LTD,MEYERS GRAHAM JOHN;;HUDSON BARRY LAURENCE;;BERRY DESMOND JOHN,,https://lens.org/086-609-307-254-751,Patent Application,yes,2,1,6,6,0,F16K31/54;;Y10T137/86501;;Y10T137/86397;;Y10T137/86445;;Y10T137/2698;;Y10T137/2693;;Y10T137/86501;;Y10T137/86397;;Y10T137/86445;;Y10T137/2698;;Y10T137/2693;;F16K31/54,F16K31/53;;F16K31/54,,0,0,,,,EXPIRED
777,CN,A,CN 1329544 A,018-336-817-135-392,2002-01-02,2002,CN 99814195 A,1999-10-22,US 18977798 A,1998-11-10,Low electromagnetic emissions and improved signal quality video drive architecture for laser printers,,LEXMARK INT INC,BERRY JOHN B;;HARDIN KEITH B;;RICHEY JOHN P,,https://lens.org/018-336-817-135-392,Patent Application,no,0,1,11,11,0,G06K15/1204;;G06K15/1204;;G06K2215/0077;;G06K2215/0077,B41J29/00;;B41J2/44;;G03G21/00;;G06K15/12,,0,0,,,,EXPIRED
778,CA,A1,CA 2316894 A1,090-303-422-043-936,1999-07-22,1999,CA 2316894 A,1998-12-23,EP 98300292 A;;EP 9808551 W,1998-01-16,POLYSACCHARIDE CONJUGATE CAPABLE OF BINDING CELLULOSE,"A polysaccharide conjugate comprises a polysaccharide with an attached entity having a molecular weight of at least 5000, the polysaccharide conjugate being capable of binding to cellulose. Preferred polysaccharides include tamarind seed xyloglucan, locust bean gum and enzyme modified guar. The attached entity is suitably a protein such as an enzyme, antibody or antibody fragment, or a particle possibly having a benefit agent such as a fragrance associated therewith. Because the polysaccharide conjugate binds to cellulose, which is present in cotton and other fabrics, paper, etc., binding of the conjugate to cellulose brings the attached entity into close proximity to a surface of or containing cellulose. The invention thus enables targeting of attached entities to such surfaces. The invention also provides a product incorporating the polysaccharide conjugate of the invention. The product is conveniently a laundry product such as a fabric washing product, e.g., a detergent product, or a fabric conditioning product. In this case the attached entity may be an enzyme, a particle bearing fragrance, etc. The invention also provides a method of targeting binding of an entity to cellulose by use of the polysaccharide conjugate of the invention.",UNILEVER PLC,DAVIS PAUL JAMES;;GIDLEY MICHAEL JOHN;;BERRY MARK JOHN,,https://lens.org/090-303-422-043-936,Patent Application,no,0,0,18,18,0,C11D3/386;;C11D3/386;;C08B37/0057;;C08B37/0057;;C08B37/0087;;C08B37/0087;;C08B37/0093;;C08B37/0093;;C08B37/0096;;C08B37/0096;;C08L5/14;;C08L5/14;;C11D3/222;;C11D3/222;;C11D3/3845;;C11D3/3845;;C11D3/502;;C11D3/502,C08B37/00;;C08L5/14;;C11D3/22;;C11D3/384;;C11D3/386;;C11D3/50,,0,0,,,,EXPIRED
779,US,A,US 3228053 A,094-768-456-743-08X,1966-01-11,1966,US 35365364 A,1964-03-18,US 35365364 A,1964-03-18,Cylindrical brush assembly,,HORTON JOHN P;;BERRY GEORGE E;;STIRLING JOHN E,HORTON JOHN P;;BERRY GEORGE E;;STIRLING JOHN E,,https://lens.org/094-768-456-743-08X,Granted Patent,no,5,19,1,1,0,A46B13/005;;A46B13/005,A46B13/00,,0,0,,,,EXPIRED
780,US,B1,US 6225462 B1,139-118-894-281-205,2001-05-01,2001,US 22904399 A,1999-01-12,EP 98300292 A,1998-01-16,Conjugated polysaccharide fabric detergent and conditioning products,"A polysaccharide conjugate comprises a polysaccharide with an attached entity having a molecular weight of at least 5000, the polysaccharide conjugate being capable of binding to cellulose. Preferred polysaccharides include tamarind seed xyloglucan, locust bean gum and enzyme modified guar. The attached entity is suitably a protein such as an enzyme, antibody or antibody fragment, or a particle possibly having a benefit agent such as a fragrance associated therewith. Because the polysaccharide conjugate binds to cellulose, which is present in cotton and other fabrics, paper, etc., binding of the conjugate to cellulose brings the attached entity into close proximity to a surface of or containing cellulose. The invention thus enables targeting of attached entities to such surfaces. The invention also provides a product incorporating the polysaccharide conjugate of the invention. The product is conveniently a laundry product such as a fabric washing product, e.g. a detergent product, or a fabric conditioning product. In this case the attached entity may be an enzyme, a particle bearing fragrance, etc. The invention also provides a method of targeting binding of an entity to cellulose by use of the polysaccharide conjugate of the invention.",LEVER BROTHERS COMPANY A DIVIS,BERRY MARK JOHN;;DAVIS PAUL JAMES;;GIDLEY MICHAEL JOHN,LEVER BROTHERS COMPANY DIVISION OF CONOPCO INC (1998-12-21),https://lens.org/139-118-894-281-205,Granted Patent,yes,12,30,18,18,0,C11D3/386;;C11D3/386;;C08B37/0057;;C08B37/0057;;C08B37/0087;;C08B37/0087;;C08B37/0093;;C08B37/0093;;C08B37/0096;;C08B37/0096;;C08L5/14;;C08L5/14;;C11D3/222;;C11D3/222;;C11D3/3845;;C11D3/3845;;C11D3/502;;C11D3/502,C08B37/00;;C08L5/14;;C11D3/22;;C11D3/384;;C11D3/386;;C11D3/50,536/123.1;;536/123.12;;536/55.1;;536/56;;536/112;;536/124;;435/12;;435/18;;435/27;;435/28;;252/8.6;;252/174.12;;252/174.17;;X252DIG  12;;530/300;;530/345;;530/350,2,0,,,"Derwent Abstract of JP 61155307-published Jul. 15, 1986.;;Derwent Abstract of JP 61133299-published Jun. 20, 1986.",EXPIRED
781,EP,A1,EP 1128964 A1,198-883-119-049-374,2001-09-05,2001,EP 99956640 A,1999-10-22,US 9924807 W;;US 18977798 A,1998-11-10,LOW ELECTROMAGNETIC EMISSIONS AND IMPROVED SIGNAL QUALITY VIDEO DRIVE ARCHITECTURE FOR LASER PRINTERS,,LEXMARK INT INC,BERRY JOHN BRUCE;;HARDIN KEITH BRYAN;;RICHEY JOHN PARKER,,https://lens.org/198-883-119-049-374,Patent Application,yes,0,0,11,11,0,G06K15/1204;;G06K15/1204;;G06K2215/0077;;G06K2215/0077,B41J29/00;;B41J2/44;;G03G21/00;;G06K15/12,,0,0,,,,EXPIRED
782,CA,A,CA 786291 A,074-057-254-345-490,1968-05-28,1968,CA 786291D A,,CA 786291T A,,FIBROUS WEBS FLEXIBLE SHEET MATERIALS,,DUNLOP RUBBER CO,BENNETT JOHN V;;BERRY PETER W;;SMITH JOHN L,,https://lens.org/074-057-254-345-490,Granted Patent,no,0,0,1,1,0,,,,0,0,,,,EXPIRED
783,US,A,US 6147699 A,132-982-564-244-193,2000-11-14,2000,US 18977798 A,1998-11-10,US 18977798 A,1998-11-10,Low electromagnetic emissions and improved signal quality video drive architecture for laser printers,"An electrophotographic image forming apparatus transfers image information relating to an image to be formed on a medium, while maintaining desired low levels of electromagnetic emissions. The apparatus includes an image processor that generates low-frequency image information signals containing the image information. A low-frequency interface is connected to the image processor for transferring the low-frequency image information signals. A control circuit, connected to the low-frequency interface, receives the low-frequency image information signals generated by the image processor. The control circuit operates on the low-frequency image information signals to form a high-frequency image information signal therefrom, where the high-frequency image information signal contains the image information. The apparatus also includes a high-frequency interface connected to the printhead control circuit for transferring the high-frequency image information signal. An image formation device, connected to the high-frequency interface, forms an image on the medium. The image formation device forms the image based on the image information contained within the high-frequency image information signal.",LEXMARK INT INC,BERRY JOHN BRUCE;;HARDIN KEITH BRYAN;;RICHEY JOHN PARKER,LEXMARK INTERNATIONAL INC (1998-11-10),https://lens.org/132-982-564-244-193,Granted Patent,yes,5,10,11,11,0,G06K15/1204;;G06K15/1204;;G06K2215/0077;;G06K2215/0077,B41J29/00;;B41J2/44;;G03G21/00;;G06K15/12,347/255;;395/114;;395/888;;358/261.1;;382/245,0,0,,,,EXPIRED
784,CA,A1,CA 3001437 A1,008-696-621-523-269,2017-05-18,2017,CA 3001437 A,2016-11-07,EP 15193578 A;;EP 2016076807 W,2015-11-09,ANTI-PERSPIRANT COMPOSITION,"An anti-perspirant composition comprising: (a) chitosan or a salt thereof, with a weight average molecular weight of greater than 80 kDa; and (b) an aluminium, zinc, magnesium or copper salt or mixture thereof. wherein the composition comprises less than 3 wt% of aluminium salt.",UNILEVER PLC,BERRY MARK JOHN;;CHANDLER IAN CHRISTOPHER;;HUNTER KARL JOHN,,https://lens.org/008-696-621-523-269,Patent Application,no,0,0,5,5,0,A61Q15/00;;A61K8/19;;A61K8/20;;A61K8/23;;A61K8/26;;A61K8/27;;A61K8/736,A61K8/73;;A61K8/19;;A61K8/26;;A61K8/27;;A61Q15/00,,0,0,,,,DISCONTINUED
785,AR,A1,AR 106621 A1,093-110-717-717-422,2018-01-31,2018,AR P160103401 A,2016-11-08,EP 15193578 A,2015-11-09,"COMPOSICIÓN ANTITRANSPIRANTE, MÉTODO COSMÉTICO, USO","Una composición antitranspirante que comprende: (a) quitosano o una sal de este, con un peso molecular promedio superior a 80 kDa; y (b) una sal de aluminio, zinc, magnesio o cobre o mezclas de ellos donde la composición comprende menos del 3% en peso de sal de aluminio.",UNILEVER NV,KARL JOHN HUNTER;;IAN CHRISTOPHER CHANDLER;;MARK JOHN BERRY,,https://lens.org/093-110-717-717-422,Patent Application,no,0,0,5,5,0,A61Q15/00;;A61K8/19;;A61K8/20;;A61K8/23;;A61K8/26;;A61K8/27;;A61K8/736,A61K8/19;;A61K8/26;;A61K8/27;;A61K8/73;;A61Q15/00,,0,0,,,,PENDING
786,WO,A1,WO 1999/036469 A1,145-879-045-469-450,1999-07-22,1999,EP 9808551 W,1998-12-23,EP 98300292 A,1998-01-16,POLYSACCHARIDE CONJUGATE CAPABLE OF BINDING CELLULOSE,"A polysaccharide conjugate comprises a polysaccharide with an attached entity having a molecular weight of at least 5000, the polysaccharide conjugate being capable of binding to cellulose. Preferred polysaccharides include tamarind seed xyloglucan, locust bean gum and enzyme modified guar. The attached entity is suitably a protein such as an enzyme, antibody or antibody fragment, or a particle possibly having a benefit agent such as a fragrance associated therewith. Because the polysaccharide conjugate binds to cellulose, which is present in cotton and other fabrics, paper, etc., binding of the conjugate to cellulose brings the attached entity into close proximity to a surface of or containing cellulose. The invention thus enables targeting of attached entities to such surfaces. The invention also provides a product incorporating the polysaccharide conjugate of the invention. The product is conveniently a laundry product such as a fabric washing product, e.g., a detergent product, or a fabric conditioning product. In this case the attached entity may be an enzyme, a particle bearing fragrance, etc. The invention also provides a method of targeting binding of an entity to cellulose by use of the polysaccharide conjugate of the invention.",UNILEVER NV;;UNILEVER PLC,BERRY MARK JOHN;;DAVIS PAUL JAMES;;GIDLEY MICHAEL JOHN,,https://lens.org/145-879-045-469-450,Patent Application,yes,3,27,18,18,0,C11D3/386;;C11D3/386;;C08B37/0057;;C08B37/0057;;C08B37/0087;;C08B37/0087;;C08B37/0093;;C08B37/0093;;C08B37/0096;;C08B37/0096;;C08L5/14;;C08L5/14;;C11D3/222;;C11D3/222;;C11D3/3845;;C11D3/3845;;C11D3/502;;C11D3/502,C08B37/00;;C08L5/14;;C11D3/22;;C11D3/384;;C11D3/386;;C11D3/50,,2,0,,,"DATABASE WPI Week 8634, Derwent World Patents Index; AN 86-223138, XP002069397;;DATABASE WPI Week 8631, Derwent World Patents Index; AN 86-201034, XP002069398",PATENTED
787,CA,C,CA 2316894 C,163-201-538-950-465,2009-12-01,2009,CA 2316894 A,1998-12-23,EP 98300292 A;;EP 9808551 W,1998-01-16,POLYSACCHARIDE CONJUGATE CAPABLE OF BINDING CELLULOSE,"A polysaccharide conjugate comprises a polysaccharide with an attached entit y having a molecular weight of at least 5000, the polysaccharide conjugate being capable of binding to cellulose. Preferred polysaccharides include tamarind seed xyloglucan, locust bean gum and enzyme modified guar. The attached entity is suitably a protein such as an enzyme, antibody or antibody fragment, or a particle possibly having a benefit agent such as a fragrance associated therewith. Because the polysaccharide conjugate binds to cellulose, which is present in cotton and other fabrics, paper, etc., binding of the conjugat e to cellulose brings the attached entity into close proximity to a surface of or containing cellulose. The invention thus enables targeting of attached entities to such surfaces. The invention also provides a product incorporating the polysaccharide conjugate of the invention. The product is conveniently a laundry product such as a fabric washing product, e.g., a detergent product, or a fabric conditioning product. In thi s case the attached entity may be an enzyme, a particle bearing fragrance, etc. The invention also provides a method of targeting binding of an entity to cellulose by use of the polysaccharide conjugate of the invention.",UNILEVER PLC,GIDLEY MICHAEL JOHN;;DAVIS PAUL JAMES;;BERRY MARK JOHN,,https://lens.org/163-201-538-950-465,Granted Patent,no,0,0,18,18,0,C11D3/386;;C11D3/386;;C08B37/0057;;C08B37/0057;;C08B37/0087;;C08B37/0087;;C08B37/0093;;C08B37/0093;;C08B37/0096;;C08B37/0096;;C08L5/14;;C08L5/14;;C11D3/222;;C11D3/222;;C11D3/3845;;C11D3/3845;;C11D3/502;;C11D3/502,C12N9/96;;C07K16/00;;C07K17/10;;C08B37/00;;C08L5/14;;C11D3/22;;C11D3/384;;C11D3/386;;C11D3/50;;C11D7/42;;C11D7/44,,0,0,,,,EXPIRED
788,DE,D1,DE 3266670 D1,186-219-115-394-823,1985-11-07,1985,DE 3266670 T,1982-06-22,AU PE938081 A,1981-06-22,HYDRAULIC VALVE CONTROL DEVICE,"A motor-operable fluid valve for a pump includes a valve body defining an open central portion, at least one high pressure inlet port in fluid communication with the open central portion, a plurality of lower pressure inlet and/or outlet ports in fluid communication with the open central portion via an array of flow passages, and a valve rotor having a plurality of openings and movably disposed within the open central portion between the line of flow from the high pressure to the lower pressure ports. The valve rotor further includes a centrally mounted shaft operable to selectively connect inlet and outlet ports; said valve further comprising a rotational means on the shaft of the valve rotor and a drive gear cooperative with the rotational means and comprising a top face and a bottom face, the top face being sloped so as to form a cam such that when the drive gear is rotated the rotational means may be raised and lowered by the camming action.",CLARK RUBBER LTD,MEYERS GRAHAM JOHN;;HUDSON BARRY LAURENCE;;BERRY DESMOND JOHN,,https://lens.org/186-219-115-394-823,Granted Patent,no,0,0,6,6,0,F16K31/54;;Y10T137/86501;;Y10T137/86397;;Y10T137/86445;;Y10T137/2698;;Y10T137/2693;;Y10T137/86501;;Y10T137/86397;;Y10T137/86445;;Y10T137/2698;;Y10T137/2693;;F16K31/54,F16K31/53;;F16K31/54,,0,0,,,,EXPIRED
789,AT,T1,AT E15933 T1,008-942-240-194-79X,1985-10-15,1985,AT 82303236 T,1982-06-22,AU PE938081 A;;EP 82303236 A,1981-06-22,REGELVORRICHTUNG FUER HYDRAULISCHES VENTIL.,"A motor-operable fluid valve for a pump includes a valve body defining an open central portion, at least one high pressure inlet port in fluid communication with the open central portion, a plurality of lower pressure inlet and/or outlet ports in fluid communication with the open central portion via an array of flow passages, and a valve rotor having a plurality of openings and movably disposed within the open central portion between the line of flow from the high pressure to the lower pressure ports. The valve rotor further includes a centrally mounted shaft operable to selectively connect inlet and outlet ports; said valve further comprising a rotational means on the shaft of the valve rotor and a drive gear cooperative with the rotational means and comprising a top face and a bottom face, the top face being sloped so as to form a cam such that when the drive gear is rotated the rotational means may be raised and lowered by the camming action.",CLARK RUBBER LTD,MEYERS GRAHAM JOHN;;HUDSON BARRY LAURENCE;;BERRY DESMOND JOHN,,https://lens.org/008-942-240-194-79X,Granted Patent,no,0,0,6,6,0,F16K31/54;;Y10T137/86501;;Y10T137/86397;;Y10T137/86445;;Y10T137/2698;;Y10T137/2693;;Y10T137/86501;;Y10T137/86397;;Y10T137/86445;;Y10T137/2698;;Y10T137/2693;;F16K31/54,F16K31/53;;F16K31/54,,0,0,,,,DISCONTINUED
790,ZA,B,ZA 99191 B,098-220-398-881-469,2000-07-12,2000,ZA 99191 A,1999-01-12,EP 98300292 A,1998-01-16,Binding of polysaccharides.,,UNILEVER PLC,BERRY MARK JOHN;;DAVIS PAUL JAMES;;GIDLEY MICHAEL JOHN,,https://lens.org/098-220-398-881-469,Granted Patent,no,0,0,18,18,0,C11D3/386;;C11D3/386;;C08B37/0057;;C08B37/0057;;C08B37/0087;;C08B37/0087;;C08B37/0093;;C08B37/0093;;C08B37/0096;;C08B37/0096;;C08L5/14;;C08L5/14;;C11D3/222;;C11D3/222;;C11D3/3845;;C11D3/3845;;C11D3/502;;C11D3/502,C08B37/00;;C08L5/14;;C11D3/22;;C11D3/384;;C11D3/386;;C11D3/50,,0,0,,,,EXPIRED
791,US,A1,US 2002/0131841 A1,029-808-971-389-085,2002-09-19,2002,US 80852401 A,2001-03-14,US 80852401 A,2001-03-14,Self-tapping fastner and method for attaching weatherseals,"
   A self-tapping fastener or fastening peg secures a weatherseal to a mounting surface of an automotive vehicle. A pointed, conical nose pierces the weatherseal to form an opening. In the preferred embodiment, the fastening peg is rotated at a first velocity as it is axially advanced toward the weatherseal to create an opening. The fastening peg is further axially advanced and rotated at a second velocity to advance a first flange through the pierced opening, thereby securing the fastening peg to the weatherseal. The weatherseal is then secured to a vehicle mounting surface by advancing a locking assembly through a pre-formed opening in the mounting surface. 
",STANDARD PRODUCTS CO,BERRY DAVID HAROLD;;SEED JOHN;;REKRET TADEUSZ,COOPER-STANDARD AUTOMOTIVE INC (2001-02-26),https://lens.org/029-808-971-389-085,Patent Application,yes,3,3,9,9,0,F16B5/065;;F16B5/123;;F16B25/106;;B60J10/30;;F16B21/00;;F16B5/123;;F16B5/065;;F16B25/106;;B60J10/30,F16B13/14;;B60J10/00;;F16B5/06;;F16B5/12;;F16B19/00;;F16B25/00;;F16B25/10,411/386,0,0,,,,DISCONTINUED
792,US,A,US 4399458 A,042-161-802-249-678,1983-08-16,1983,US 26483181 A,1981-05-18,GB 8017014 A,1980-05-22,Signal processing system,"A signal processing system comprises an analogue shift register of the charge coupled type (24) fed from a sampling device (22) and controlled by a clock arrangement (26) having three independent clocks (26A, 26B and 26C). Clock (26A) determines the sampling rate of sampling device (22) and the rate at which such samples are clocked into register (24). Clock 26C determines the rate at which stored samples are clocked out of the register (24). Clocks 26A and 26C operate in the MHz range. Clock 26B operates in the KHz range and dictates the sample storage interval and clocks the stored samples through a number of storage sites in register (24) during the storage interval to reduce the adverse effects of geometrical and other inhomogeneities of the individual register sites on the individual stored samples.",BARR & STROUD LTD,BERRY PETER J;;MONTGOMERY JOHN Y C,BARR & STROUD LIMITED A BRITISH COMPANY (1981-05-11),https://lens.org/042-161-802-249-678,Granted Patent,yes,1,5,14,16,0,G11C27/04;;G11C27/04,G11C27/04,358/113;;307/311;;357/24;;358/160;;250/330;;377/62,0,0,,,,EXPIRED
793,NZ,A,NZ 547590 A,070-407-294-495-348,2008-11-28,2008,NZ 54759004 A,2004-10-29,GB 0325509 A;;GB 2004004590 W,2003-10-31,Solar tiles which form an overlapping relationship with conventional tiles,"A set of tiles comprising a conventional roof tile, at least one thermal solar tile, and at least one photovoltaic tile is disclosed. The at least one solar thermal tile 1 has a chassis 6 on which is mounted a transparent portion 2 for permitting the entry of sunlight into a heating space. At least one protrusion 16, 18 on at least one edge of the chassis is configured to form an overlapping relationship 8 with an adjacent tile. The at least one solar thermal tile and the at least one photovoltaic tile have a length substantially equal to the length of the conventional roof tile 50 to 59 and a width substantially equal to multiple widths of the conventional roof tile. The at least one photovoltaic tile has a chassis that is substantially similar in external appearance to that of the at least at least one solar thermal tile with a photovoltaic material being mounted in substantially the same position as the transparent portion on the solar thermal tile chassis.",SOLAR CENTURY HOLDINGS LTD,DAVIES DANIEL GOWER;;BERRY MARTYN JOHN CHARLES,,https://lens.org/070-407-294-495-348,Patent Application,no,0,0,10,10,0,Y02B10/20;;H02S20/25;;F24S2020/17;;F24S20/69;;Y02E10/50;;Y02B10/10;;Y02E10/40;;H02S20/25;;Y02B10/20;;Y02E10/44;;F24S20/69;;F24S2020/17;;Y02B10/10,F24J2/04;;H01L31/048,,0,0,,,,DISCONTINUED
794,BR,A2,BR 112015025073 A2,084-071-925-377-658,2017-07-18,2017,BR 112015025073 A,2014-04-03,IB 2014060393 W;;US 201361807974 P,2013-04-03,sistema de ventilação; e método para controlar um sistema de ventilação para fornecer suporte respiratório a um indivíduo,,KONINKLIJKE PHILIPS NV,NATHAN JOHN BERRY ANN;;WILLIAM ANTHONY TRUSCHEL,,https://lens.org/084-071-925-377-658,Patent Application,no,0,0,12,12,0,A61M16/0051;;A61M2205/13;;A61M16/0063;;A61M16/024;;A61M16/00;;A61M16/0051;;A61M2205/13;;A61M16/0063;;A61M16/024;;A61M16/0003;;A61M16/0069;;A61M2205/3334;;A61M2205/502,A61M16/00,,0,0,,,,ACTIVE
795,EP,A1,EP 2885038 A1,093-075-073-923-376,2015-06-24,2015,EP 13783384 A,2013-08-13,US 201261684991 P;;IB 2013056608 W,2012-08-20,PATIENT INTERFACE ASSEMBLY DISCONNECT DETECTION,,KONINKL PHILIPS NV,BERRY ANN NATHAN JOHN;;TRUSCHEL WILLIAM A,KONINKLIJKE PHILIPS N.V. (2020-03-18),https://lens.org/093-075-073-923-376,Patent Application,yes,0,0,7,7,0,A61M16/0051;;A61M2016/0027;;A61M2016/003;;A61M2205/13;;A61M16/0063;;A61M16/026;;A61M2016/003;;A61M2205/13;;A61M2016/0027;;A61M16/0051;;A61M16/0063;;A61M16/026;;A61M16/0003;;A61M16/0066;;A61M16/06;;A61M2205/3334;;A61M2205/502,A61M16/00,,0,0,,,,ACTIVE
