582,US,A1,US 2002/0038953 A1,149-303-405-796-652,2002-04-04,2002,US 82534301 A,2001-04-04,AU 2000/062430 A,2000-10-02,Fluid couplings,"
    A fluid coupling 10  comprising a length of flexible tubing 11  having a free end 12,  a connector 13  having at least one end with at least one radially projecting rib, the end being adapted to be a force fit within the free end of the tubing so that the rib causes a radially outward expansion of the tubing, and a locking ring 30  having an inextensive band 31  coupled to resilient gripping means, the locking ring 30  being adapted to be a sliding fit on the tubing but an interference fit on the expanded portion of the tubing to cause the gripping means to engage and grip against the tubing to prevent axial separation of the tubing from the connector 13. 
",MCNAB ROBERT KENNETH;;BERRY DESMOND JOHN,MCNAB ROBERT KENNETH;;BERRY DESMOND JOHN,EDGETEC SYSTEMS PTY LTD (2001-03-29),https://lens.org/149-303-405-796-652,Patent Application,yes,0,5,1,4,0,F16L37/091;;F16L37/091,F16L37/091,285/255,0,0,,,,DISCONTINUED
583,EP,B1,EP 3184904 B1,137-182-870-818-446,2021-01-27,2021,EP 16203418 A,2016-12-12,US 201514978068 A,2015-12-22,STAGED FUEL AND AIR INJECTION IN COMBUSTION SYSTEMS OF GAS TURBINES,,GEN ELECTRIC,HUGHES MICHAEL JOHN;;BERRY JONATHAN DWIGHT,"GENERAL ELECTRIC TECHNOLOGY GMBH, CH (2023-11-23)",https://lens.org/137-182-870-818-446,Granted Patent,yes,4,0,8,8,0,F01D25/12;;F02C7/18;;F02C7/222;;F23R3/28;;F23R3/283;;F01D5/187;;F23R2900/03044;;F01D9/023;;F01D25/14;;F02C7/12;;F05D2260/201;;F23R3/346;;F01D9/041;;F01D9/06;;F01D25/12;;F05D2220/32;;F05D2240/35;;F23R3/346;;F23R3/10;;F02C3/04;;F23R2900/03044;;F02C7/12,F23R3/34;;F01D5/18,,0,0,,,,ACTIVE
584,CN,A,CN 107525096 A,139-703-795-616-61X,2017-12-29,2017,CN 201710484120 A,2017-06-22,US 201615189708 A,2016-06-22,MULTI-TUBE LATE LEAN INJECTOR,"The invention relates to a multi-tube late lean injector. The micromixer injector includes a fuel plenum to receive a supply of fuel. A plurality of premixing tubes extend through the fuel plenum. Each tube has a plurality of fuel holes formed therein to receive the supply of fuel for mixing with air in the tube. The micromixer has a tapering profile such that an overall inlet area of the plurality of premixing tubes on an upstream face of the micromixer is larger than an overall outlet area of the plurality of premixing tubes on a downstream face such that the plurality of premixing tubes are relatively spaced-apart at the upstream face and more densely packed at the downstream face. Additionally, an air inlet of each tube has a first geometrical shape and the outlet of each tube has a second geometrical shape that is different from the first geometrical shape.",GEN ELECTRIC,JONATHAN DWIGHT BERRY;;MICHAEL JOHN HUGHES,,https://lens.org/139-703-795-616-61X,Patent Application,no,8,0,7,7,0,F23R3/286;;F23R3/286;;F23R3/34;;F02C7/222;;F02C7/228;;F23R3/06;;F23R3/06;;F23R3/346;;F23R3/346;;F23R2900/03341;;F23R2900/03341,F23R3/34,,0,0,,,,ACTIVE
585,WO,A1,WO 1997/027862 A1,159-652-332-635-468,1997-08-07,1997,AU 1948/097000 W,1997-01-30,AU PN784796 A,1996-02-02,SUPPLEMENTATION OF GLUCOCORTICOIDS,A formulation for and a method of treatment of dermatological conditions comprising the application of a formulation consisting of a glucocorticosteroid and a pharmaceutically acceptable zinc compound. The zinc compound may be zinc monoglycerolate.,BELLARA MEDICAL PRODUCTS;;STORY MICHAEL JOHN;;WILLIAMS DESMOND BERRY,STORY MICHAEL JOHN;;WILLIAMS DESMOND BERRY,,https://lens.org/159-652-332-635-468,Patent Application,yes,5,9,2,3,0,A61K31/57;;A61K33/30,A61K31/57;;A61K33/30,,8,3,060-315-406-880-224;;055-433-058-521-01X;;016-167-342-761-025,2721800;;3598209;;10.1111/1523-1747.ep12470553;;10.1254/fpj.98.5_369;;1813368,"DERWENT WPAT ONLINE ABSTRACT, No. 88-026753, Class B04; & RO,A,92 445 (INTR. ANTIBIOTICE), 30 September 1987.;;DERWENT WPAT ONLINE ABSTRACT, No. 91-213826, Class A96; & SU,A,1 510 131 (MOSC. MEDICINE INST. et al.).;;PATENT ABSTRACTS OF JAPAN, C-387, page 83; & JP,A,61 151 121 (TAISHO PHARM. CO. LTD.), 9 July 1986.;;DERWENT ABSTRACT, Accession No. 86-067649/10, Class P31; & SU,A,117 400 (CHITA MEDICINE INST.), 23 August 1985.;;DERMATOL. MON. SCHR., 175, (1989), MUELLER, VON R. et al., ""Reaktion und Wirksamkeit von Prednisolon in Zinkoxidhaltigen Dermatika"", pages 82-86.;;JOURNAL OF INVESTIGATIVE DERMATOLOGY, Volume 89, No. 2, (1987), MULLIN C.H. et al., ""Specific Induction of Metallothionein in Hairless Mouse Skin by Zinc and Dexamethasone"", pages 164-166.;;THE JOURNAL OF OSAKA UNIVERSITY DENTAL SOCIETY, Vol. 20, No. 2, (1975), NAKAMURA MASAYUKI, ""Effects of Corticosteroids and Zinx on Wound Healing of Rat Skin"", pages 105-119.;;FOLIA PHARMACOL. JAPON., Vol. 98, (1991), YOSHIDA A. et al., ""Basal Studies on the Mode of Circular Excision Wounds Made on the Dorsal Skin of Rats Treated With Hydrocorticone"", pages 369-377.",PENDING
586,CN,A,CN 1867264 A,172-070-098-233-487,2006-11-22,2006,CN 200480029610 A,2004-07-29,EP 03254986 A,2003-08-12,Ice confection and its manufacturing process,"Provided an ice confection containing; (i) at least 2% by wt. fat; (ii) at least 10% by wt. of a sugar or sugars; and (iii) protein, which is present at a level of less than 2 % by weight; wherein some or all of the fat and protein are present as oil bodies.",UNILEVER PLC,JILL BERRY MARK JOHN COX ANDRE,,https://lens.org/172-070-098-233-487,Patent Application,no,0,5,5,5,0,A23G9/327;;A23G9/38;;A23G9/46;;A23G9/52;;A23G2200/08;;A23G9/38;;A23G9/46;;A23G9/52;;A23G2200/08;;A23G9/327,A23G9/34;;A23G9/32;;A23G9/38;;A23G9/46;;A23G9/52,,0,0,,,,DISCONTINUED
587,AU,A1,AU 2003/204774 A1,168-706-261-794-193,2004-02-26,2004,AU 2003/204774 A,2003-06-18,AU 2003/204774 A;;AU 2002/950705 A,2002-08-09,Spa fittings,,EDGETEC SYSTEMS PTY LTD,MCNAB ROBERT KENNETH;;BERRY DESMOND JOHN,,https://lens.org/168-706-261-794-193,Patent Application,no,0,0,6,6,0,A61H33/6073;;A61H33/6073,A47K3/00;;A47K3/022;;A47K3/10;;A61H33/00,,0,0,,,,EXPIRED
588,US,A,US 4037920 A,181-749-479-575-680,1977-07-26,1977,US 60019975 A,1975-07-29,GB 4642474 A,1974-10-26,RADIATION SCANNING SYSTEM WITH TWO RELATIVELY MOVABLE REFLECTORS,"Apparatus for use in a radiation scanning system comprising a radiation detector and an optical system arranged to scan radiation from a field of view across the radiation detector. The optical system includes two sets of planar reflective surfaces, one set being movable relative to the other, and a rotary assembly carrying one of the sets and rotatable about an axis of rotation. The detector is arranged relative to the optical system such that the radiation enters the detector after sequential reflection from reflective surfaces of the two sets, and the surfaces which effect the sequential reflection being separated by a predetermined amount and being located with respect to the axis of rotation such that the angle of incidence of radiation at the detector is independent of the position of the radiation in the field of view.",BARR & STROUD LTD,RUNCIMAN HERBERT MORRISON;;BERRY PETER JOHN,,https://lens.org/181-749-479-575-680,Granted Patent,yes,6,17,4,5,0,G02B5/09;;H04N3/09;;G02B5/09;;H04N3/09,G02B5/09;;H04N3/09,350/7,0,0,,,,EXPIRED
589,GB,A,GB 1001041 A,013-284-633-196-779,1965-08-11,1965,GB 4137762 A,1962-11-01,GB 4137762 A,1962-11-01,Improvements in or relating to electric circuits,"1,001,041. Transistor amplitude-discriminating circuits; pilot-controlled A.V.C. GENERAL ELECTRIC CO. Ltd. Oct. 23, 1963 [Nov. 1, 1962], No. 41377/62. Headings H3T and H4R. A circuit for producing a predetermined response when the voltage level of an input signal (e.g. a pilot signal in a communication system) falls outside defined limits, comprises two bi-stable trigger circuits one of which changes state when the input signal voltage increases positively to exceed a first voltage level but which does not return to its initial state until the input signal has fallen below a level less positive than the first voltage level and the other of which changes state when the input signal voltage increases negatively to exceed a second voltage level but which does not return to its initial state until the input signal has fallen below a level less negative than the second voltage level. Thus both trigger circuits remain in their initial states so long as the input signal voltage remains within the limits defined by the first and second voltage levels; however, once a circuit has changed state its state is not restored until the input signal voltage has returned to within limits narrower than those defined by the first and second voltage levels. The circuit may form part of terminal receiving equipment in which a pilot signal transmitted with the intelligence signal is used to effect gain control, the circuit serving to indicate when excessive changes on the pilot-signal amplitude, such as would be due to a fault, have taken place. The two bi-stable circuits 43, 44 comprise Schmitt-trigger circuits constituted by transistors 2, 6 and 13, 16 respectively and so biased that for input-signals levels within the defined limits, transistors 6 and 13 are conducting. The circuit 44 includes an inverting output transistor 24, so that for normal levels of input signal, the output transistors 6 and 24 of the circuits 43, 44 are both conducting. The outputs from the two trigger circuits are applied via diode gates 11, 28 to emitter-follower transistor 29; thus for normal input-signal levels both transistors 31 and 36 are conducting and relay 39 is energized. Reversal of the state of either of the bi-stable circuits results in a considerably more negative voltage being established at the base of emitter follower 29, this switching transistors 31 and 36 and so releasing relay 39 to cause an alarm to be operated and/or some other control to be effected. Transistor 22 forms part of the load for transistor 13 and serves to delay the onset of bottoming in that transistor.",GEN ELECTRIC CO LTD,BERRY ALLAN DAVID;;BURCOMBE JOHN EDWARD,,https://lens.org/013-284-633-196-779,Granted Patent,no,0,0,1,1,0,H04B3/10,H04B3/10,H3P PPTE          PPTE;;H3T TE            TE;;H3T T1CX          -;;H3T T1M2P         -;;H3T T2A1N         -;;H3T T2A2          -;;H3T T2B2          -;;H3T T2B3          -;;H3T T2J           -;;H3T T2M           -;;H3T T2T3J         -;;H3T T3C1          -;;H3T T3E           -;;H3T T3N           -;;H3T T3X           -;;H3T T4C           -;;H3T T4D           -;;H3T T4E1N         -;;H3T T4E2N         -;;H3T T4G           -;;H3T T4M           -;;H3T T5E           -;;H4R R18A1         -,0,0,,,,EXPIRED
590,GB,A,GB 2280078 A,016-919-729-249-826,1995-01-18,1995,GB 8119046 A,1981-06-23,GB 8024228 A,1980-07-24,Thermal imaging and rangefinding apparatus,"Integrated thermal imaging and laser rangefinding apparatus comprises a laser rangefinder (LRF) transmitter (12) collimated with the principal line of sight (PQ) of the imager which is formed by a first scan mechanism (2) and a second scan mechanism (1). Radiation from the field of view first encounters the second scan mechanism (1) the scan rate of which is slower than that of the first scan mechanism (2) and the scan cycle of which includes a part where the pointing direction of the imager is not along the principal line of sight (PQ) and the change in the pointing direction is less than a predetermined amount during a predetermined time interval. The apparatus further includes a trigger means (13) providing a trigger signal to the LRF transmitter (12) during the aforesaid scan cycle part and received laser radiation is received during the aforesaid time interval along the line of sight (PQ) of the imager and is directed by the second scan mechanism (1) to a LRF receiver (9), Fig. 2 (not shown), without being incident on the first scan mechanism (2). The imager includes a radiation detector (5) which may be the same as or different from the detector (9) forming the LRF receiver. <IMAGE>",BARR & STROUD LTD,BERRY PETER JOHN;;RUNCIMAN HERBERT MORRISON,,https://lens.org/016-919-729-249-826,Patent Application,no,0,0,8,8,0,G01S7/4817;;G01S17/10;;G01S17/89;;H04N3/09;;G01S17/89;;H04N3/09,G01S17/10;;G01S17/14;;G01S17/89;;H04N3/09,G2J JB7WX         JB7WX;;H4D DLAA          LAA;;H4D DLFX          LFX;;H4D D735          LAA;;H4D D735          LFX;;H4D D745          LAA;;H4D D745          LFX;;H4D D750          LAA;;H4D D750          LFX;;H4D D781          LAA;;H4D D781          LFX;;H4D D783          LAA;;H4D D783          LFX;;H4F FD18R         JB;;H4F FD27A1        JB;;H4F FD27R1        JB;;H4F FD27R2        JB;;H4F FD27R9        JB;;H4F FD27T1        JB;;H4F FD83X         JB;;H4F FJB           JB;;U1S S2145,0,0,,,,EXPIRED
591,US,B2,US 9989260 B2,024-045-747-335-694,2018-06-05,2018,US 201514978051 A,2015-12-22,US 201514978051 A,2015-12-22,Staged fuel and air injection in combustion systems of gas turbines,A gas turbine that includes: a combustor coupled to a turbine that define a working fluid flowpath; a compressor discharge cavity; a staged injection system that includes the forward injector and a staged injector; a stator blade positioned extending across the working fluid flowpath between an inboard sidewall and an outboard sidewall. A one-way continuous coolant flowpath that includes: an intake section that comprises an upstream port connected to the compressor discharge cavity and a downstream port formed through one of the inboard and outboard sidewalls; an outtake section that comprises a downstream port connected to the staged injector and an upstream port formed through the other one of the inboard and outboard sidewalls; and a cooling circuit extending through an interior of the airfoil of the stator blade and connecting to the downstream port of the intake section and the upstream port of the outtake section.,GEN ELECTRIC,HUGHES MICHAEL JOHN;;BERRY JONATHAN DWIGHT,GE INFRASTRUCTURE TECHNOLOGY LLC (2023-11-10);;GENERAL ELECTRIC COMPANY (2015-12-17),https://lens.org/024-045-747-335-694,Granted Patent,yes,49,0,8,8,0,F02C7/04;;F02C7/18;;F02C7/222;;F23R3/28;;F23R3/283;;F05D2240/35;;F01D9/023;;F02C3/14;;F02C7/224;;F23R3/20;;F23R3/34;;F05D2260/201;;F05D2260/232;;F05D2260/601;;F02C7/222;;F01D9/023;;F02C3/14;;F02C7/224;;F23R3/20;;F23R3/34;;F02C3/04;;F02C7/222;;F23R3/16;;F23R3/346;;F23R2900/03044;;F23R2900/03043;;F23R2900/03045;;F23R2900/03341,F23R3/34;;F01D5/18;;F01D9/02;;F02C3/04;;F02C3/14;;F02C7/22;;F02C7/224;;F23D11/40;;F23D11/44;;F23D14/70;;F23R3/16;;F23R3/20,,2,0,,,"US 8,019,523, 09/2011, Davis, Jr. et al. (withdrawn);;Extended European Search Report and Opinion issued in connection with corresponding EP Application No. 16203707.1 dated May 16, 2017.",ACTIVE
592,AT,T1,AT E216644 T1,038-310-119-137-147,2002-05-15,2002,AT 98932387 T,1998-07-07,GB 9714424 A;;GB 9801993 W,1997-07-10,VORRICHTUNG UND VERFAHREN ZUM SCHNEIDEN VON METALBÄNDER,"The invention is an apparatus for cutting metal sheet having two rotatable drums, wherein the metal sheet passes between the drums for cutting. Each of the drums has a cutting blade moved into and out of cutting position by an axial actuator rod. The cutting blade includes two sets of rollers bearing against one of a pair of profiled side surfaces of the axial actuator rod.",KVAERNER TECHNOLOGY & RES LTD,SCHOFIELD SIMON;;BERRY JOHN;;COOPER BRIAN,,https://lens.org/038-310-119-137-147,Granted Patent,no,0,0,13,13,0,B23D25/02;;B23D25/12;;B26D1/425;;Y10T83/4708;;Y10T83/4682;;Y10T83/4693;;Y10T83/4833;;Y10T83/9471;;Y10T83/8748;;Y10T83/4685;;Y10T83/4653;;Y10T83/4708;;Y10T83/4682;;Y10T83/4693;;Y10T83/4833;;Y10T83/9471;;Y10T83/8748;;Y10T83/4685;;Y10T83/4653;;B26D1/425;;B23D25/02;;B23D25/12,B23D25/02;;B23D25/12;;B26D1/42,,0,0,,,,PENDING
593,AU,B2,AU 775803 B2,045-149-002-559-739,2004-08-19,2004,AU 2000/062430 A,2000-10-02,AU 2000/062430 A;;AU PQ326299 A,1999-10-04,Fluid couplings,,BERRY DESMOND JOHN;;MCNAB ROBERT KENNETH,MCNAB ROBERT KENNETH;;BERRY DESMOND JOHN,,https://lens.org/045-149-002-559-739,Granted Patent,no,3,0,2,4,0,,F16L21/00;;F16L21/08;;F16L33/00,,0,0,,,,EXPIRED
594,EP,B1,EP 3184895 B1,055-569-138-891-873,2023-03-01,2023,EP 16204876 A,2016-12-16,US 201514978019 A,2015-12-22,STAGED FUEL AND AIR INJECTION IN COMBUSTION SYSTEMS OF GAS TURBINE,,GEN ELECTRIC,HUGHES MICHAEL JOHN;;BERRY JONATHAN DWIGHT,"GENERAL ELECTRIC TECHNOLOGY GMBH (2023-12-13);;GENERAL ELECTRIC TECHNOLOGY GMBH, CH (2023-11-23)",https://lens.org/055-569-138-891-873,Granted Patent,yes,4,0,7,7,0,F01D25/12;;F02C7/18;;F02C7/222;;F23R3/28;;F23R3/283;;F23R3/04;;F23R3/286;;F23R3/46;;F23R3/50;;F23R2900/03043;;F23R3/002;;F23R3/346;;F23R2900/03044;;F23R3/04;;F23R3/286;;F23R3/46;;F23R3/50;;F23R2900/03043;;F02C7/18;;F02C3/04;;F02C7/12;;F02C7/222;;F23R3/002;;F23R3/346;;F23R2900/03044,F23R3/00;;F23R3/04;;F23R3/28;;F23R3/34;;F23R3/46;;F23R3/50,,0,0,,,,ACTIVE
595,EP,B1,EP 3184896 B1,074-590-534-669-073,2019-02-20,2019,EP 16203200 A,2016-12-09,US 201514978006 A,2015-12-22,STAGED FUEL AND AIR INJECTION IN COMBUSTION SYSTEMS OF GAS TURBINES,,GEN ELECTRIC,HUGHES MICHAEL JOHN;;BERRY JONATHAN DWIGHT,"GENERAL ELECTRIC TECHNOLOGY GMBH, CH (2023-11-23)",https://lens.org/074-590-534-669-073,Granted Patent,yes,2,0,8,8,0,F02C7/04;;F02C7/22;;F23R3/06;;F23R3/346;;F23R2900/03044;;F23R3/06;;F02C3/04;;F02C7/222;;F23R3/002;;F23R3/346;;F23R2900/03044,F23R3/06;;F23R3/34,,0,0,,,,ACTIVE
596,GB,A,GB 960683 A,104-896-904-040-386,1964-06-17,1964,GB 4057759 A,1959-11-30,GB 4057759 A,1959-11-30,Improvements in or relating to waveguides,"960,683. Electromagnetic waveguides. MARCONI CO. Ltd. June 14, 1960 [Nov. 30, 1959], No. 40577/59. Heading H1W. A waveguide coupling arrangement comprises two hollow circular sectioned waveguides 1 and 2 joined end to end and constructed to propagate therethrough radio energy in the H on mode, the waveguide walls providing conductive paths parallel to the axes of the guides and each sharing a different impedance over the major part of its length, at least one of the guides, 1, having internal grooves la whose dimensions are varied in such manner that the minimum diameter of the guide over the grooved portion remains constant, thereby to provide a gradual transition of surface impedance from the value over the major part of the lengths of the guide to another value approaching that of the surface impedance of the other guides at the end thereof. The guides 1 and 2 are held together by a sleeve 4, the guide 2 in Fig. 1 being a helical guide 2a in a sheath 2b of synthetic material. In the construction shown in Figs. 1 and 3 the grooving la is in the form of internal ring triangular grooves, in a solid walled grade, which are of a depth and/or width which is increased from groove to groove towards the end of the guide or of a depth and/or width which is increased from group of grooves to group of grooves towards the end of the guide. Alternatively the grooving can be in the form of a screw thread of increasing depth and/or width towards the end of the guide. In the construction shown in Fig. 2 the guide 2 consists of a metal helix 2c whose turns are in contact contained in a sheath 2b of synthetic material, the metal helix being formed of metal wire or strip the cross-sectional dimensions of which are reduced, either gradually or in steps, over a length at one end of the guide. In the construction shown in Fig. 3 the flexible guide 2 is built up of metal rings 2d spaced by rings 2e of dielectric material. The desired gradual variation of surface impedance, which may be effected in a solid walled guide or a flexible guide, or in both, can be in accordance with a linear, binormal or exponential law.",MARCONI CO LTD,SCHELISCH ERNST FRIEDRICH;;BERRY JOHN ALFRED,,https://lens.org/104-896-904-040-386,Granted Patent,no,0,0,3,4,0,H01P5/082;;H01P5/082,H01P5/08,H1W WFA           WFA,0,0,,,,EXPIRED
597,JP,A,JP 2022104807 A,099-573-080-761-539,2022-07-11,2022,JP 2021204277 A,2021-12-16,US 202017136131 A,2020-12-29,MAGNETIC TURBOMACHINE SEALING ARRANGEMENT,To provide a sealing arrangement for a turbomachine.SOLUTION: A sealing arrangement (201) and a turbomachine are provided. The sealing arrangement (201) for the turbomachine includes a transition duct (44) having an upstream end (46) and a downstream end (48). The transition duct (44) includes an aft frame (100) that circumferentially surrounds the downstream end (48) of the transition duct (44). A stage-one nozzle (700) is separated from the aft frame (100) and defines a gap (202) therebetween. A sealing assembly (400) extends across the gap (202). The sealing assembly (400) includes a first seal link (602) magnetically coupled to the aft frame (100). The sealing assembly (400) further includes a second seal link (604) magnetically coupled to the first seal link (602) and the stage-one nozzle (700).SELECTED DRAWING: Figure 4,GENERAL ELECTRIC CO GE,BERRY JONATHAN DWIGHT;;HUGHES MICHAEL JOHN,,https://lens.org/099-573-080-761-539,Patent Application,no,0,0,3,3,0,F01D9/023;;F01D11/005;;F05D2240/55;;F05D2260/32;;F16J15/061;;F16J15/0887;;F02C3/04;;F02C7/18;;F02C7/28;;F05D2220/32;;F05D2240/35;;F05D2240/55,F02C7/28;;F01D11/00;;F16J15/12,,0,0,,,,PENDING
598,DE,A1,DE 2838362 A1,125-078-326-008-276,1979-03-22,1979,DE 2838362 A,1978-09-02,GB 3808777 A,1977-09-13,STRAHLUNGSABTASTVORRICHTUNG,,BARR & STROUD LTD,BERRY PETER JOHN;;RUNCIMAN HERBERT MORRISON,,https://lens.org/125-078-326-008-276,Patent Application,no,1,2,6,6,0,H04N3/09;;H04N3/09,H04N3/09,,0,0,,,,EXPIRED
599,EP,A1,EP 3184748 A1,131-707-967-449-30X,2017-06-28,2017,EP 16203707 A,2016-12-13,US 201514978051 A,2015-12-22,STAGED FUEL AND AIR INJECTION IN COMBUSTION SYSTEMS OF GAS TURBINES,"A gas turbine that includes: a combustor 13 coupled to a turbine 12 that define a working fluid flowpath 37; a compressor discharge cavity 44; a staged injection system that includes the forward injector and a staged injector 51; a stator blade 17 positioned extending across the working fluid flowpath between an inboard sidewall and an outboard sidewall. A one-way continuous coolant flowpath that includes: an intake section that comprises an upstream port connected to the compressor discharge cavity and a downstream port formed through one of the inboard and outboard sidewalls; an outtake section that comprises a downstream port connected to the staged injector and an upstream port formed through the other one of the inboard and outboard sidewalls; and a cooling circuit extending through an interior of the airfoil of the stator blade and connecting to the downstream port of the intake section and the upstream port of the outtake section.
",GEN ELECTRIC,HUGHES MICHAEL JOHN;;BERRY JONATHAN DWIGHT,"GENERAL ELECTRIC TECHNOLOGY GMBH, CH (2023-11-23)",https://lens.org/131-707-967-449-30X,Patent Application,yes,5,4,8,8,0,F02C7/04;;F02C7/18;;F02C7/222;;F23R3/28;;F23R3/283;;F05D2240/35;;F01D9/023;;F02C3/14;;F02C7/224;;F23R3/20;;F23R3/34;;F05D2260/201;;F05D2260/232;;F05D2260/601;;F02C7/222;;F01D9/023;;F02C3/14;;F02C7/224;;F23R3/20;;F23R3/34;;F02C3/04;;F02C7/222;;F23R3/16;;F23R3/346;;F23R2900/03044;;F23R2900/03043;;F23R2900/03045;;F23R2900/03341,F01D9/02;;F01D5/18;;F02C7/22,,0,0,,,,ACTIVE
600,US,A,US 3294151 A,126-177-691-370-265,1966-12-27,1966,US 40155764 A,1964-10-05,US 40155764 A,1964-10-05,Automatic electric awning,,HARTLEY ANDREW G;;BERRY JOHN D,HARTLEY ANDREW G;;BERRY JOHN D,SOLAR DRAPE LTD. A NY CORP (1983-07-28),https://lens.org/126-177-691-370-265,Granted Patent,no,7,11,1,1,0,E06B9/70;;E06B9/70;;E05F15/684;;E05F15/684;;E05F15/71;;E05F15/71;;E05F15/79;;E05F15/79;;E05Y2900/146;;E05Y2900/146;;E06B9/42;;E06B9/42;;E06B2009/583;;E06B2009/583;;E06B2009/6809;;E06B2009/6809;;E06B2009/6818;;E06B2009/6818,G05D25/02,,0,0,,,,EXPIRED
601,US,A1,US 2017/0175634 A1,148-599-277-159-796,2017-06-22,2017,US 201514977993 A,2015-12-22,US 201514977993 A,2015-12-22,STAGED FUEL AND AIR INJECTION IN COMBUSTION SYSTEMS OF GAS TURBINES,"A gas turbine that includes a working fluid flowpath extending aftward from a forward injector in a combustor. The combustor may include an inner radial wall, an outer radial wall, and, therebetween, a flow annulus. A staged injector may intersect the flow annulus so to attain an injection point within the working fluid flowpath by which aftward and forward annulus sections are defined. Air directing structure may include an aftward intake section that corresponds to the aftward annulus section and a forward intake section that corresponds to the forward annulus section. The air directing structure may be configured to: direct air entering through the aftward intake section through the aftward annulus section in a forward direction to the staged injector; and direct air entering through the forward intake section through the forward annulus section in an aftward direction to the staged injector.",GEN ELECTRIC,HUGHES MICHAEL JOHN;;BERRY JONATHAN DWIGHT,GE INFRASTRUCTURE TECHNOLOGY LLC (2023-11-10);;GENERAL ELECTRIC COMPANY (2015-12-17),https://lens.org/148-599-277-159-796,Patent Application,yes,15,20,8,8,0,F01D25/12;;F02C7/18;;F02C7/222;;F23R3/28;;F23R3/283;;F23R3/346;;F23R3/06;;F23R2900/03044;;F02C7/222;;F02C3/04;;F23R3/002;;F23R3/06;;F23R2900/03044;;F23R3/346,F02C7/22;;F02C3/04;;F23R3/00;;F23R3/06,,0,0,,,,ACTIVE
