366,EP,A2,EP 1736111 A2,162-162-846-481-212,2006-12-27,2006,EP 06252866 A,2006-06-02,GB 0513021 A,2005-06-25,Dermatological treatment apparatus,"A dermatological treatment platform is disclosed that incorporates an actively Q-switched laser and intense pulsed light source. The platform comprises: a power supply having an electrical energy source, a capacitive energy store for receiving energy from the energy source, a power outlet, and an electronically controlled switch that can selectively connect the energy store to the power outlet connection for delivery to a light source. The power supply further includes timing circuitry that can operate the electronically controlled switch and an optical switch within a device connected to the power supply. The capacitative energy source is charged in use to a potential suitable for operation of both the laser and the intense pulsed light source, typically less than 500V. Thus, a practitioner can offer both laser and intense pulsed light treatment without incurring the expense of two power supplies.
",LYNTON LASERS LTD,BERRY ANDREW JOHN;;CHARLTON ANDREW,,https://lens.org/162-162-846-481-212,Patent Application,yes,0,0,6,6,0,A61B18/203;;A61B2017/00734;;A61B2018/00452;;A61B18/20;;A61B18/22;;A61N5/06;;A61N5/0616;;A61B18/203;;A61B2018/00452;;A61B2017/00734,A61B17/00;;A61B18/20;;A61N5/06,,0,0,,,,DISCONTINUED
367,WO,A3,WO 2001/049278 A3,186-895-286-064-478,2002-04-11,2002,GB 0100082 W,2001-01-08,GB 0000131 A,2000-01-06,COMPOUNDS AND COMPOSITIONS FOR USE IN INHIBITING ENDOPARASITIC FATTY ACID BIOSYNTHESIS,"Use of at least one compound, or pharmaceutically acceptable salt or prodrug thereof, as an inhibitor of at least one β-ketoacyl acyl carrier protein synthase operable in the fatty acid biosynthesis of endoparasites, which compound is of the general formula (I) where R1 is selected from the group consisting of hydrogen, alkyl, (cyano)alkylene, alkenyl, alkynyl, (alkoxy)alkylene, (alkoxy)alkenylene, (alkoxy)alkynylene, cycloalkyl, (cycloalkyl)alkylene, (cycloalkyl)alkenylene, (cycloalkyl)alkynylene, (heterocycle)alkylene, (heterocycle)alkenylene, (heterocycle)alkynylene, aryl, (aryl)alkylene, (aryl)alkenylene, (aryl)alkynylene, (arylcarbonylarylene)alkylene, (arylcarbonylarylene)alkenylene and (arylcarbonylarylene)alkynylene; R2 is alkyl or cycloalkyl; R3 is alkyl or cycloalkyl; and R4 is hydrogen or alkyl; including racemic mixtures and enantiomers of said compound when the latter is chiral, but excluding the racemic mixture of a chiral compound of formula (I) in which R1 is CH2=CH-C(CH3)=CH-, R2 is methyl, R3 is methyl and R4 is hydrogen.",UNIV CARDIFF;;BERRY COLIN;;HARWOOD JOHN L,BERRY COLIN;;HARWOOD JOHN L,,https://lens.org/186-895-286-064-478,Search Report,yes,0,0,8,8,0,A61K31/381;;A61K31/381;;A61P33/00;;A61P33/02;;A61P33/06;;A61P43/00;;Y02A50/30;;Y02A50/30,C07D333/32;;A61K31/381;;A61K45/00;;A61P33/00;;A61P33/02;;A61P33/06;;A61P43/00;;C07D409/06,,4,4,050-353-212-732-818;;055-690-229-660-039;;007-396-421-947-920;;124-751-520-688-747,pmc22835;;10.1073/pnas.95.21.12352;;9770490;;7958265;;10.1042/bst022202s;;10727420;;10.1042/0264-6021:3470205;;pmc1220949;;10.1042/bj3470205;;10.1074/jbc.m000569200;;10747933,"DATABASE BIOSIS [online] BIOSCIENCES INFORMATION SERVICE, PHILADELPHIA, PA, US; 13 October 1998 (1998-10-13), WALLER ROSS F ET AL: ""Nuclear-encoded proteins target to the plastid in Toxoplasma gondii and Plasmodium falciparum."", XP002184935, Database accession no. PREV199800495881;;DATABASE CA [online] CHEMICAL ABSTRACTS SERVICE, COLUMBUS, OHIO, US; JONES, A. LESLEY ET AL: ""The effect of thiolactomycin analogs on fatty acid synthesis in peas (Pisum sativum cv. Onward)"", XP002184936, retrieved from STN Database accession no. 121:175291;;DATABASE CA [online] CHEMICAL ABSTRACTS SERVICE, COLUMBUS, OHIO, US; JONES, A. LESLEY ET AL: ""Novel inhibitors of the condensing enzymes of the type II fatty acid synthase of pea (Pisum sativum)"", XP002184937, retrieved from STN Database accession no. 133:70579;;DATABASE CA [online] CHEMICAL ABSTRACTS SERVICE, COLUMBUS, OHIO, US; KREMER, LAURENT ET AL: ""Thiolactomycin and related analogues as novel anti-mycobacterial agents targeting KasA and KasB condensing enzymes in Mycobacterium tuberculosis"", XP002184938, retrieved from STN Database accession no. 133:174529",PENDING
368,WO,A2,WO 2001/049278 A2,187-180-501-998-263,2001-07-12,2001,GB 0100082 W,2001-01-08,GB 0000131 A,2000-01-06,COMPOUNDS AND COMPOSITIONS FOR USE IN INHIBITING ENDOPARASITIC FATTY ACID BIOSYNTHESIS,"Use of at least one compound, or pharmaceutically acceptable salt or prodrug thereof, as an inhibitor of at least one β-ketoacyl acyl carrier protein synthase operable in the fatty acid biosynthesis of endoparasites, which compound is of the general formula (I) where R1 is selected from the group consisting of hydrogen, alkyl, (cyano)alkylene, alkenyl, alkynyl, (alkoxy)alkylene, (alkoxy)alkenylene, (alkoxy)alkynylene, cycloalkyl, (cycloalkyl)alkylene, (cycloalkyl)alkenylene, (cycloalkyl)alkynylene, (heterocycle)alkylene, (heterocycle)alkenylene, (heterocycle)alkynylene, aryl, (aryl)alkylene, (aryl)alkenylene, (aryl)alkynylene, (arylcarbonylarylene)alkylene, (arylcarbonylarylene)alkenylene and (arylcarbonylarylene)alkynylene; R2 is alkyl or cycloalkyl; R3 is alkyl or cycloalkyl; and R4 is hydrogen or alkyl; including racemic mixtures and enantiomers of said compound when the latter is chiral, but excluding the racemic mixture of a chiral compound of formula (I) in which R1 is CH2=CH-C(CH3)=CH-, R2 is methyl, R3 is methyl and R4 is hydrogen.",UNIV CARDIFF;;BERRY COLIN;;HARWOOD JOHN L,BERRY COLIN;;HARWOOD JOHN L,,https://lens.org/187-180-501-998-263,Patent Application,yes,0,11,8,8,0,A61K31/381;;A61K31/381;;A61P33/00;;A61P33/02;;A61P33/06;;A61P43/00;;Y02A50/30;;Y02A50/30,C07D333/32;;A61K31/381;;A61K45/00;;A61P33/00;;A61P33/02;;A61P33/06;;A61P43/00;;C07D409/06,,0,0,,,,PENDING
369,EP,A1,EP 0269254 A1,034-378-654-993-186,1988-06-01,1988,EP 87309420 A,1987-10-26,GB 8625679 A,1986-10-27,Improvements in synthetic vascular grafts.,"IMPROVEMENTS IN SYNTHETIC VASCULAR GRAFTS An aorto-coronary bypass graft (13) comprises a plate portion (14) and at least one tube portion (15,16) extending from the plate portion (14), the opening in the tube portion communicating with a corresponding opening in the plate portion.  ",ETHICON INC;;UNIV LIVERPOOL,BERRY JOHN PHILLIP;;ANNIS DAVID,,https://lens.org/034-378-654-993-186,Patent Application,yes,4,23,7,7,0,A61B2017/1135;;A61F2/06;;A61F2/064;;Y10S623/901;;A61F2/064;;A61B2017/1135;;A61F2/06;;Y10S623/901,A61B17/11;;A61F2/06,,0,0,,,,DISCONTINUED
370,AU,A,AU 1999/012482 A,033-177-453-149-58X,1999-06-15,1999,AU 1999/012482 A,1998-11-23,EP 97309409 A;;GB 9803483 W,1997-11-21,Improvements in or relating to displacement assays,,INVERNESS MEDICAL SWITZERLAND GMBH,BERRY MARK JOHN;;HOWELL STEPHEN,INVERNESS MEDICAL SWITZERLAND GMBH (2002-07-11),https://lens.org/033-177-453-149-58X,Patent Application,no,0,0,12,12,0,G01N33/54373,G01N33/543,,0,0,,,,EXPIRED
371,EP,A3,EP 1128535 A3,146-933-277-250-950,2002-04-03,2002,EP 01200455 A,2001-02-08,GB 0003058 A;;GB 0022367 A,2000-02-11,Power converter controll loop,"An apparatus for and method of control of a switch (102) in an electrical power converter (100) using pulse width modulation to regulate output voltage (112) and current. The method allows precise output voltage regulation to be achieved whilst accurately controlling the proportion of load-current supplied by multiple modules connected in parallel. A ramped waveform (408), consisting of a component representing the instantaneous current and a component representing the input voltage applied since the switch (102) switched on in the current PWM cycle, is compared with an error signal (406) to determine the width of each PWM pulse.",OXFORD MAGNET TECH,MACKAY STEPHEN JOHN;;BERRY STEPHEN,"SIEMENS PLC, CAMBERLEY, GB (2011-10-14)",https://lens.org/146-933-277-250-950,Search Report,yes,5,0,9,14,0,H02M3/156;;H02M3/156,H02M3/156,,0,0,,,,EXPIRED
372,GB,A,GB 189908446 A,156-523-721-235-521,1900-04-21,1900,GB 189908446D A,1899-04-22,GB 189908446T A,1899-04-22,Improvements in Lubricating Apparatus.,"8446. Berry, C. H., and Snowdon, J. April 22. Lubricating moving parts of engines &c., and especially for lubricating simultaneously two or more parts, such as the crank - pin and crosshead of an engine. Figs. 1, 2, and 5 show means for supplying different lubricants to these two parts. One lubricant is delivered to the chamber L, and passes through the pipes H, D to the passages F leading to the passage M in the crank-pin. The other lubricant is supplied at K, and passes through the pipes J, E to the passage G in the part C, which projects from the crank - pin. From the passage G it flows to the chamber formed by the surrounding ring N, and thence through the pipe O to the crosshead. The pipes H, J are necessarily concentric, and coaxial with the crank shaft. The pipes D, E may be placed side by side, or one within the other. If only one lubricant is employed, the duplicate arrangement of pipes is dispensed with.",BERRY CHARLES HERBERT;;SNOWDON JOHN,BERRY CHARLES HERBERT;;SNOWDON JOHN,,https://lens.org/156-523-721-235-521,Patent Application,no,0,0,1,1,0,,,,0,0,,,,DISCONTINUED
373,US,A,US 4883453 A,055-290-782-010-477,1989-11-28,1989,US 9031287 A,1987-08-28,GB 8625679 A,1986-10-27,Method of manufacturing synthetic vascular grafts,"An aorto-coronary bypass graft comprising a plate portion and at least one tube portion extending from the plate portion, the opening in the tube portion communicating with a corresponding opening in the plate portion.",ETHICOH INC;;UNIV LIVERPOOL,BERRY JOHN P;;ANNIS DAVID,ETHICON INC. AND THE UNIVERSITY OF LIVERPOOL (1987-07-22),https://lens.org/055-290-782-010-477,Granted Patent,yes,9,71,7,7,0,A61B2017/1135;;A61F2/06;;A61F2/064;;Y10S623/901;;A61F2/064;;A61B2017/1135;;A61F2/06;;Y10S623/901,A61B17/11;;A61F2/06,600/36;;623/66;;285/189;;285/260;;156/294;;156/303.1;;156/423,0,0,,,,EXPIRED
374,BR,A,BR 8704495 A,064-218-564-445-210,1988-04-19,1988,BR 8704495 A,1987-09-01,GB 8621150 A,1986-09-02,ENXERTO VASCULAR SINTETICO E PROCESSO PARA FIAR ELETROSTATICAMENTE UM ENXERTO VASCULAR,,ETHICON INC;;UNIV LIVERPOOL,BERRY JOHN PHILLIP;;ANNIS DAVID,,https://lens.org/064-218-564-445-210,Patent Application,no,0,0,9,9,0,A61F2/06;;D01D5/0092,A61F2/06;;D01D5/08,,0,0,,,,DISCONTINUED
375,US,A,US 3503110 A,106-581-260-850-565,1970-03-31,1970,US 3503110D A,1967-02-24,GB 3917265 A,1965-09-14,SECURING TUBES INTO TUBE PLATES,,YORKSHIRE IMPERIAL METALS LTD,BERRY DAVID JOHN;;HARDWICK ROY,,https://lens.org/106-581-260-850-565,Granted Patent,no,7,22,16,16,0,B21D39/066;;B21D39/066;;B21D26/08;;B21D26/08;;F22G3/009;;F22G3/009;;F28F9/16;;F28F9/16;;F28F2275/068;;F28F2275/068;;Y10T29/49375;;Y10T29/49375;;Y10T29/49393;;Y10T29/49393;;Y10T29/49806;;Y10T29/49806,B23K20/08;;B21D26/08;;B21D39/06;;F22G3/00;;F28F9/16,29/157.4,0,0,,,,EXPIRED
376,BR,A,BR 8701329 A,111-814-911-942-371,1988-01-05,1988,BR 8701329 A,1987-03-24,GB 8607235 A,1986-03-24,APARELHO PARA PRODUZIR ESTRUTURAS FIBROSAS,,JOHNSON & JOHNSON,ANNIS DAVID;;BERRY JOHN PHILLIP,,https://lens.org/111-814-911-942-371,Patent Application,no,0,0,8,8,0,D01D5/0069;;D01D5/0076;;D04H1/728;;D04H3/16;;D01D5/0076;;D01D5/0069;;D04H3/16;;D04H1/728,D04H1/728;;D04H3/16,,0,0,,,,DISCONTINUED
377,GB,A,GB 189724406 A,112-326-566-434-811,1898-10-21,1898,GB 189724406D A,1897-10-21,GB 189724406T A,1897-10-21,"Improvements in Locks for Doors, Boxes and the like.","24,406. Holbrook, R., and Berry, J. W. Oct. 21. Locks, key.-The mechanism and the keyhole in the case are capable of lateral adjustment, so that the lock may be used to replace another without cutting a fresh keyhole in the door, box, &c. to which the lock is applied. A D-shaped hole, shown in dotted lines in Fig. 1, is cut in the front plate of the lock and covered by a keyhole plate B, which can be adjusted by a screw b. A tumbler C, Fig. 3, having projections c to enable it to be operated by a key, is adjustably secured to the bolt D by a screw c<2> and slot d in the bolt, which is thus operated through the tumbler. A stump c<1> on the tumbler projects through a slot d' in the bolt, and engages a lever E which is pivoted on the keyhole plate and holds the bolt in the retracted or shot positions. The rear end of the bolt is guided by a pin d<4> on the case. To attach the lock the case is placed in position, and the keyhole is made to register by moving the keyhole plate. The position of the bolt relatively to the tumbler is then adjusted by the screw c<2>. Fig. 6 shows the arrangement for a night latch. The position of the spring bolt is adjusted relatively to the tumbler I by a screw L' bearing against a projection i on the tumbler, the key operating the bolt, in one direction only, through the tumbler. The screw L' is turned by a screwdriver inserted through a hole in the case, and allows the projection of the bolt to be adjusted so that it can latch easily.",HOLBROOK ROBERT;;BERRY JOHN WILLIAM,HOLBROOK ROBERT;;BERRY JOHN WILLIAM,,https://lens.org/112-326-566-434-811,Patent Application,no,0,0,1,1,0,,,,0,0,,,,DISCONTINUED
378,US,A,US 4842505 A,123-137-447-054-177,1989-06-27,1989,US 2851987 A,1987-03-20,GB 8607235 A,1986-03-24,Apparatus for producing fibrous structures electrostatically,"Apparatus for producing a fibrous structure including electrostatically charged mandrels arranged around a delivery assembly for fiberizable material. The delivery assembly includes capillary needles to which fiberizable material is supplied from a reservoir, the needles being arranged on manifolds moved continuously around a loop path on a rail.",ETHICON INC;;UNIV LIVERPOOL,ANNIS DAVID;;BERRY JOHN P,ETHICON INC (1987-03-02);;UNIVERSITY OF LIVERPOOL THE (1987-03-02),https://lens.org/123-137-447-054-177,Granted Patent,yes,14,123,8,8,0,D01D5/0069;;D01D5/0076;;D04H1/728;;D04H3/16;;D01D5/0076;;D01D5/0069;;D04H3/16;;D04H1/728,D04H1/728;;D04H3/16,4251748 E;;264/26;;264/164,1,0,,,"University of Liverpool/Ethicon Inc., Panel Meeting 4th 5th Nov., 1985.",EXPIRED
379,US,S,US D0408925 S,142-984-433-787-333,1999-04-27,1999,US 9109598 F,1998-07-22,US 9109598 F,1998-07-22,Handle for massage device,,BERRY HARVEY;;LYNCH JOHN R,BERRY HARVEY;;LYNCH JOHN R,BB WORLD HEALTH NOW (1998-07-20),https://lens.org/142-984-433-787-333,Design Right,yes,5,14,1,1,0,,,D24/214;;2803,0,0,,,,EXPIRED
380,GB,A,GB 191420352 A,054-288-256-464-349,1915-06-17,1915,GB 191420352D A,1914-09-30,GB 191420352T A,1914-09-30,Improvements relating to the Registering Mechanism of Gas and like Meters.,"20,352. Berry, J., Glover, W. T., and Meters, Ltd. Sept. 30. Gas-meters.-In registering-mechanism for gas and like meters of the type in which means are employed to compensate for differences in pressure, the compensating-means is controlled by a weight adapted to move angularly to balance the gas pressure. As shown in Fig. 1, a supplementary movement is given to the differential gear train of the registering mechanism by pawls h, i carried by a bar g connected to a plunger c which is reciprocated by a crank d and connecting-rod e through a spring f. The extent of movement of the plunger c is controlled by a curved striking-plate b carried by a lever p connected by a link to a sliding member o. The sliding member o is connected through a lever n to a diaphragm a and by a chain q to a quadrant r secured to an arm s provided with a weight t. An increase in the pressure of the gas acts through the diaphragm a and connected parts to move the striking- plate b and to move the weight t angularly to increase its leverage. In a modification, the weight t is carried by the striking-plate b. Specification 7727/11 is referred to. The Provisional Specification also states that a piston under the influence of the gas pressure may cause a wheel to mesh with any one of a series of wheels or with parts of a wheel with numbers of teeth removed at different points.",BERRY JOHN;;GLOVER WILLIAM THOMAS,BERRY JOHN;;GLOVER WILLIAM THOMAS,,https://lens.org/054-288-256-464-349,Patent Application,no,0,0,1,1,0,G01F15/04,G01F15/04,,0,0,,,,DISCONTINUED
381,DE,A1,DE 2731305 A1,184-754-742-453-310,1978-01-26,1978,DE 2731305 A,1977-07-11,GB 2993976 A,1976-07-19,"PRAEPARATE, INSBESONDERE ZUR KONSERVIERUNG LANDWIRTSCHAFTLICHER PRODUKTE",,BP CHEM INT LTD,BERRY DAVID;;HUITSON JOHN JACKSON,,https://lens.org/184-754-742-453-310,Patent Application,no,0,1,7,7,0,A23L3/34;;A23K30/10,A23K3/02;;A23L3/34,,0,0,,,,DISCONTINUED
382,GB,A,GB 189703325 A,021-113-521-836-421,1898-01-08,1898,GB 189703325D A,1897-02-08,GB 189703325T A,1897-02-08,An Improvement in Lubricating Apparatus.,"3325. Berry, C. H., and Snowdon, J. Feb. 8. Lubricators.-In the case of a lubricator in which lubricant of a more or less solid character is forced to the parts to be lubricated by a piston, the lubrication is suspended during the refilling of the cylinder. To avoid this, two cylinders A, A' are employed. The worm D, driven by ratchet mechanism, is mounted on a lever C and can be moved into engagement with either of the nuts B, B<1> to cause the descent of the corresponding piston. The lever C is connected with the plug F of a three-way cock so that whichever piston is descending the corresponding cylinder must communicate with the delivery pipe.",BERRY CHARLES HIBBERT;;SNOWDON JOHN,BERRY CHARLES HIBBERT;;SNOWDON JOHN,,https://lens.org/021-113-521-836-421,Patent Application,no,0,0,1,1,0,,,,0,0,,,,DISCONTINUED
383,BR,A,BR 8705699 A,074-558-099-530-404,1988-05-31,1988,BR 8705699 A,1987-10-23,GB 8625679 A,1986-10-27,ENXERTO DE DISPOSITIVO DE DESVIO SECUNDARIO AORTO-CORONARIANO E PROCESSO PARA MANUFATURA-LO,,JOHNSON & JOHNSON,BERRY JOHN PHILLIP;;ANNIS DAVID,,https://lens.org/074-558-099-530-404,Patent Application,no,0,0,7,7,0,A61B2017/1135;;A61F2/06;;A61F2/064;;Y10S623/901;;A61F2/064;;A61B2017/1135;;A61F2/06;;Y10S623/901,A61B17/11;;A61F2/06,,0,0,,,,DISCONTINUED
384,GB,A,GB 189415146 A,097-643-888-834-209,1895-07-20,1895,GB 189415146D A,1894-08-08,GB 189415146T A,1894-08-08,Improvements in Apparatus for Lubricating Moving Parts of Machinery.,,BERRY CHARLES HIBBERT;;SNOWDON JOHN,BERRY CHARLES HIBBERT;;SNOWDON JOHN,,https://lens.org/097-643-888-834-209,Patent Application,no,0,0,1,1,0,,,,0,0,,,,DISCONTINUED
385,GB,B,GB 2418363 B,175-182-268-273-373,2006-09-27,2006,GB 0513021 A,2005-06-25,GB 0513021 A,2005-06-25,Dermatological treatment apparatus,,LYNTON LASERS LTD,BERRY ANDREW JOHN;;CHARLTON ANDREW,,https://lens.org/175-182-268-273-373,Granted Patent,no,4,0,6,6,0,A61B18/203;;A61B2017/00734;;A61B2018/00452;;A61B18/20;;A61B18/22;;A61N5/06;;A61N5/0616;;A61B18/203;;A61B2018/00452;;A61B2017/00734,A61B18/22;;A61B17/00;;A61B18/20;;A61N5/06,A5R REHR          A5R8;;A5R RHFR          A5R8,0,0,,,,ACTIVE
386,AU,A,AU 1987/077755 A,004-509-117-369-707,1988-03-10,1988,AU 1987/077755 A,1987-09-01,GB 8621150 A,1986-09-02,SYNTHETIC VASCULAR GRAFT & METHOD OF MAKING SAME,,ETHICON INC;;UNIVERSITY OF LIVERPOOL THE,BERRY JOHN PHILLIP;;ANNIS DAVID,,https://lens.org/004-509-117-369-707,Patent Application,no,0,0,9,9,0,A61F2/06;;D01D5/0092,A61F2/06;;D01D5/08,,0,0,,,,DISCONTINUED
387,EP,B1,EP 1128535 B1,031-023-001-136-118,2004-01-07,2004,EP 01200455 A,2001-02-08,GB 0003058 A;;GB 0022367 A,2000-02-11,Power converter controll loop,"An apparatus for and method of control of a switch (102) in an electrical power converter (100) using pulse width modulation to regulate output voltage (112) and current. The method allows precise output voltage regulation to be achieved whilst accurately controlling the proportion of load-current supplied by multiple modules connected in parallel. A ramped waveform (408), consisting of a component representing the instantaneous current and a component representing the input voltage applied since the switch (102) switched on in the current PWM cycle, is compared with an error signal (406) to determine the width of each PWM pulse. <IMAGE>",OXFORD MAGNET TECH,MACKAY STEPHEN JOHN;;BERRY STEPHEN,"SIEMENS PLC, CAMBERLEY, GB (2011-10-14)",https://lens.org/031-023-001-136-118,Granted Patent,yes,5,2,9,14,0,H02M3/156;;H02M3/156,H02M3/156,,0,0,,,,EXPIRED
388,EP,A2,EP 1128535 A2,023-061-933-433-718,2001-08-29,2001,EP 01200455 A,2001-02-08,GB 0003058 A;;GB 0022367 A,2000-02-11,Power converter controll loop,"An apparatus for and method of control of a switch (102) in an electrical power converter (100) using pulse width modulation to regulate output voltage (112) and current. The method allows precise output voltage regulation to be achieved whilst accurately controlling the proportion of load-current supplied by multiple modules connected in parallel. A ramped waveform (408), consisting of a component representing the instantaneous current and a component representing the input voltage applied since the switch (102) switched on in the current PWM cycle, is compared with an error signal (406) to determine the width of each PWM pulse.",OXFORD MAGNET TECH,MACKAY STEPHEN JOHN;;BERRY STEPHEN,"SIEMENS PLC, CAMBERLEY, GB (2011-10-14)",https://lens.org/023-061-933-433-718,Patent Application,yes,0,5,9,14,0,H02M3/156;;H02M3/156,H02M3/156,,0,0,,,,EXPIRED
389,US,S,US D0680133 S,021-069-295-102-319,2013-04-16,2013,US 201129407147 F,2011-11-23,US 201129407147 F,2011-11-23,Pump assembly,,HOEHN RICHARD;;BERRY JACOB JOHN;;TUTHILL CORP,HOEHN RICHARD;;BERRY JACOB JOHN,TUTHILL CORPORATION (2011-12-08);;THE GORMAN-RUPP COMPANY (2022-05-31),https://lens.org/021-069-295-102-319,Design Right,no,0,3,1,1,0,,,1502;;D15/7,0,0,,,,ACTIVE
390,GB,A,GB 1149387 A,153-357-195-041-267,1969-04-23,1969,GB 3917265 A,1965-09-14,GB 3917265 A,1965-09-14,Improvements in securing tubes into tube plates,"1,149,387. Pipe joints. YORKSHIRE IMPERIAL METALS Ltd. 14 Sept., 1966 [14 Sept., 1965], No. 39172/65. Heading F2G. [Also in Division B3] Method of welding a metal tube 1 in an aperture in a plate 2, wherein the distance between the outer wall of the tube and the wall of the aperture increases towards the adjacent free end of the tube, comprises using an explosive charge 5 to force an inert insert 6 against the tube-bore. At least part of the length of the aperture may be tapered, or the outer diameter of the tube-end. The explosive 5 may have a detonation velocity greater than 120% of the velocity of sound in the metal of the tube or tube-plate, whichever has the higher sonic velocity. The aperture-portion 4 may follow an exponential curve or a double taper, and the short end of the tube may project beyond the plate 2 and be severed over the radiused or angled edges at the end of the aperture. To achieve a good metallurgical bond between the tube and plate, surface oxides and grease are removed before assembly. The density of the wax and sawdust plug 6 may be varied along its length, and a number of tube-ends may be secured simultaneously. Tubes of aluminiumbrass may be secured to a brass or coppernickel plate, or a copper-nickel tube may be secured to a copper-nickel or brass plate.",YORKSHIRE IMP METALS LTD,BERRY DAVID JOHN;;HARDWICK ROY,,https://lens.org/153-357-195-041-267,Granted Patent,no,0,2,16,16,0,B21D39/066;;B21D39/066;;B21D26/08;;B21D26/08;;F22G3/009;;F22G3/009;;F28F9/16;;F28F9/16;;F28F2275/068;;F28F2275/068;;Y10T29/49375;;Y10T29/49375;;Y10T29/49393;;Y10T29/49393;;Y10T29/49806;;Y10T29/49806,B23K20/08;;B21D26/08;;B21D39/06;;F22G3/00;;F28F9/16,B3J J15           -;;B3Q Q1R3          Q1R;;B3Q Q1X           Q1R;;B3Q Q2A8          Q1R;;B3Q Q2F2          Q1R;;B3Q Q3            -;;B3R R17A          -;;B3R R6            -;;B3W W70A          -;;F2G G9H           G9K;;F2G G9K           G9K,0,0,,,,EXPIRED
391,US,A1,US 2016/0271045 A1,056-387-184-303-779,2016-09-22,2016,US 201415030386 A,2014-09-30,EP 13189911 A;;EP 2014070911 W,2013-10-23,ANTI-PERSPIRANT COMPOSITION,"The invention relates to use of chitosan or a salt thereof in an anti-perspirant composition as an anti-perspirant ingredient. Current anti-perspirants are based on aluminium, but inorganic salts have the effect of leaving white patches on clothes. Additionally there is a perceived health risk associated with aluminium The current approach is to reduce the amount of aluminium in antiperspirants or to use additional metal salts such as those of zirconium. However, this approach tends to lower the efficacy of the formulation and hence prove more expensive. Zirconium-based antiperspirants tend to leave yellow patches on clothes. Use of chitosan or a salt thereof in an anti-perspirant composition as an anti-perspirant ingredient is provided, wherein the chitosan or salt thereof has a degree of acetylation of 0-15, preferably 0-12, most preferably 0-10%, wherein the chitosan or salt thereof is either in an anhydrous form or dissolved in water at a pH of no more than 6.0, preferably no more than 5.5, most preferably no more than 5.0.",CONOPCO INC DBA UNILEVER,BERRY MARK JOHN;;CASEY JOHN;;HUNTER KARL JOHN,CONOPCO INC. D/B/A UNILEVER (2014-10-01),https://lens.org/056-387-184-303-779,Patent Application,yes,2,1,10,10,0,A61Q15/00;;A61K8/736;;A61Q15/00;;A61K8/736;;A61K8/26,A61K8/73;;A61K8/26;;A61Q15/00,,0,0,,,,DISCONTINUED
