"#",Jurisdiction,Kind,Display Key,Lens ID,Publication Date,Publication Year,Application Number,Application Date,Priority Numbers,Earliest Priority Date,Title,Abstract,Applicants,Inventors,Owners,URL,Document Type,Has Full Text,Cites Patent Count,Cited by Patent Count,Simple Family Size,Extended Family Size,Sequence Count,CPC Classifications,IPCR Classifications,US Classifications,NPL Citation Count,NPL Resolved Citation Count,NPL Resolved Lens ID(s),NPL Resolved External ID(s),NPL Citations,Legal Status
1,GB,A,GB 190317757 A,045-691-900-515-666,1904-06-23,1904,GB 190317757D A,1903-08-17,GB 190317757T A,1903-08-17,Improvements in Clips and Clip Releasers for Cable Haulage,"17,757. Berry, J., and Berry, F. Aug. 17. Rope grips.-Consists of a clip or grip for cable haulage in collieries &c., and of means for automatically releasing the same. Figs. 1 and 4 show the clip, and Fig. 5 the releaser. Pivoted in a body piece a are jaws e, e<1> the lower ends of which embrace the cable. A top jaw h slides in slots in the piece a. The jaws e, e<1> are weighted so that when free of the cable they open, but when the clip is placed on the rope the jaw h separates the top parts of the jaws e, e<1> enough to allow the thin part of the wedge-shaped cam-lever c, d to enter between them. On then depressing this lever, the edge of the cam engages the inclined top of the jaw h, and its sides the jaws e, e', and all three jaws are thus closed on the cable. The releaser comprises a trough k with a supporting-roller l for the cable, and a pivoted cross-arm n on to which the cam lever c, d passes to be lifted. An incline o on the clip raises the arm n to allow of the passage of the clip, after which the arm drops again to its operative position.",BERRY JOHN;;BERRY FASCUTT,BERRY JOHN;;BERRY FASCUTT,,https://lens.org/045-691-900-515-666,Patent Application,no,0,0,1,1,0,,,,0,0,,,,DISCONTINUED
2,US,A,US 2713933 A,048-575-571-713-602,1955-07-26,1955,US 37914153 A,1953-09-09,GB 2713933X A,1952-09-11,Loading machines,,JOHN BERRY,JOHN BERRY,,https://lens.org/048-575-571-713-602,Granted Patent,no,6,1,1,1,0,B65G65/00;;B65G65/00;;B65G2814/0335;;B65G2814/0335,B65G65/00,,0,0,,,,EXPIRED
3,ZA,B,ZA 755604 B,174-202-210-603-447,1976-11-24,1976,ZA 755604 A,1975-09-03,US 50348774 A,1974-09-04,APPARATUS FOR MEASURING MOISTURE IN MOVING BULK MATERIAL USING A LITHIUM-7 RADIATION SOURCE,,TEXAS NUCLEAR CORP,ASHE JOHN BERRY;;JOHN BERRY ASHE,,https://lens.org/174-202-210-603-447,Granted Patent,no,0,0,4,4,0,G01N23/204;;G01N23/204,G01N23/204,,0,0,,,,EXPIRED
4,CA,A,CA 53446 A,048-000-799-055-75X,1896-09-11,1896,CA 53446D A,1896-08-20,CA 53446T A,1896-08-20,FOOT-PROPELLED SLEIGH OR SLED,,BERRY JOHN,BERRY JOHN,,https://lens.org/048-000-799-055-75X,Granted Patent,no,0,0,1,1,0,,,,0,0,,,,EXPIRED
5,GB,A,GB 2366196 A,136-141-521-746-467,2002-03-06,2002,GB 0120008 A,2001-08-16,GB 0020056 A,2000-08-16,A collapsible airer,"An airer for attaching to a radiator, is collapsible between a flat, storage position and an extended, operative position. The airer 2 comprises two brackets 4 and at least one support member 6 extending between the brackets, the brackets having one or more male or female members 8 for engagement with the ends of the support member. Preferably, each bracket is in the shape of a hook which has the support members detachably mounted or hinged to it.",BERRY JOHN,BERRY JOHN,,https://lens.org/136-141-521-746-467,Patent Application,no,4,0,3,3,0,D06F57/127,D06F57/12,A4L LAL           LAL;;A4L L124          LAL,1,0,,,"Argos catalog 1999 autumn/wint edition p 224, items 1 and 4",DISCONTINUED
6,GB,A,GB 731546 A,179-979-162-847-563,1955-06-08,1955,GB 2283052 A,1952-09-11,GB 2283052 A,1952-09-11,Improvements in loading machines,"731,546. Jigging conveyers. DISTINGTON ENGINEERING CO., Ltd. Sept. 7, 1953 [Sept. 11, 1952], No. 22830/52. Class 78 (1). A machine for loading coal or other loose material comprises in combination a shaker conveyer 1, Figs. 1 and 2, which includes a shovel 4 and drive mechanism 2 therefor and for steerable propelling means 3, the conveyer being arranged wholly in front of the drive mechanism and being adapted to discharge material through a curved trough 5 at a height less than that of the drive mechanism. The shovel and trough are mounted on a vertical pivot pin 6, Fig. 7, carried by a frarne 7 which is slidable longitudinally of the machine on ball bearings 8 carried by a skid. plate 9. A pin 12, Fig. 9, fixed to the shovel 4, is rotatably mounted in a carriage 13 which travels in guides 14. These guides are secured to a shoe 15, Fig. 8, which is slidable in lateral guides 16 mounted on the skid. The shoe 15 is connected by a link 18, Fig. 3, and a bell-crank lever 19 to the piston rod of a double-acting hydraulic cylinder 17. The frame 7 is pivotally connected to one end of a rod 11, the other end of which is pivotally connected to a lever 32. This lever is connected by a rocker arm 31, coupling rod 30, bell-crank lever 29 and connecting rod 28 to a crank-shaft 27, Fig. 5. The crank-shaft is driven through spur gearing by a shaft 24 which is driven by an electric motor 23. The shaft 24 drives a hydraulic pump 25 which supplies fluid to the cylinder 17 and to two variable speed motors 26 which drive the endless tracks 3. The upper end of the lever 32 is connected by a link 35 to a shaft 36, the ends of which engage balance weights 33 slidably mounted on guides 34.",DISTINGTON ENGINEERING CO,BERRY JOHN,,https://lens.org/179-979-162-847-563,Granted Patent,no,0,0,2,2,0,B65G65/14,B65G65/14,,0,0,,,,EXPIRED
7,US,A,US 1235544 A,076-090-021-392-250,1917-08-07,1917,US 5733315 A,1915-10-22,US 5733315 A,1915-10-22,APPARATUS FOR CONTROLLING INTERNAL-COMBUSTION ENGINES.,,BERRY JOHN,BERRY JOHN,,https://lens.org/076-090-021-392-250,Granted Patent,no,0,0,1,1,0,F02D17/00;;F02D17/00,,,0,0,,,,EXPIRED
8,DE,B,DE 1035054 B,108-905-922-078-748,1958-07-24,1958,DE D0015914 A,1953-09-10,GB 1035054X A,1952-09-11,"Lademaschine fuer loses Foerdergut, insbesondere fuer Bergwerksbetriebe",,DISTINGTON ENGINEERING CO,BERRY JOHN,,https://lens.org/108-905-922-078-748,Patent Application,no,4,1,1,1,0,B65G65/00;;B65G2814/0335,B65G65/00,,0,0,,,,DISCONTINUED
9,GB,A,GB 191407627 A,050-386-660-884-306,1915-09-16,1915,GB 191407627D A,1914-09-26,GB 191407627T A,1914-09-26,"Improvements in Chimney Tops, Cowls or Ventilators.","7627. Berry, J. Sept. 26. C h i m n e y and ventilating - shaft t o p s. - Chimney tops and ventilators with free or uncovered uptakes, a n d oppositely - placed openings c through their rectangular upper parts, have the walls above and below the openings shaped as shown in Fig. 3, and the intermediate vertical portions made narrow with tapering ribs k as shown in section in Fig. 2, the openings being of an aggregate area not less than the area of the uptake.",BERRY JOHN,BERRY JOHN,,https://lens.org/050-386-660-884-306,Patent Application,no,0,0,1,1,0,F23L17/02,F23L17/02,,0,0,,,,DISCONTINUED
10,CA,A,CA 535216 A,142-063-733-580-872,1957-01-01,1957,CA 535216D A,,CA 535216T A,,SELF LOADING SHAKER CONVEYOR,,DISTINGTON ENGINEERING CO,BERRY JOHN,,https://lens.org/142-063-733-580-872,Granted Patent,no,0,0,1,1,0,,,,0,0,,,,EXPIRED
11,CA,A,CA 136775 A,025-934-223-815-140,1911-11-14,1911,CA 136775D A,1911-01-17,CA 136775T A,1911-01-17,WATER PURIFYING PROCESS,,BERRY JOHN,BERRY JOHN,,https://lens.org/025-934-223-815-140,Granted Patent,no,0,0,1,1,0,,,,0,0,,,,EXPIRED
12,GB,A,GB 190223612 A,055-727-830-309-123,1903-04-16,1903,GB 190223612D A,1902-10-29,GB 190223612T A,1902-10-29,"Improvements in Apparatus for Transferring Corves or Boxes to or from Mine Cages, Hoists, and the like.","23,612. Berry, J. Oct. 29. Lifts.-Relates to apparatus for loading or unloading corves into or from cages or hoists at the tops or bottoms of shafts of coal mines or the like. The corves run down inclined rails by gravity towards stoppers or drop fences C, Fig. 1, which are caused to slide on fixed guiderods by means of two levers F, one on each side of the cage and operated together. One lever is connected by means of a link and bell-crank lever to the rod H of a slide valve, which admits steam or compressed air to a cylinder, thus forcing out a piston-rod I carrying a crosshead 0 and a pivoted fork P which engages an axle of a corve. The crosshead and fork are shown separately in Fig. 6. Jaws on the upper part of the crosshead are provided with an elongated hole to receive a shank on a second pair of jaws, which embrace the fork and through which the pivot passes. The crosshead is guided by slide bars, which are provided with spring or rubber buffers at the ends. The apparatus may be adapted for use where the length of the cage is at right-angles to the length of the corves, as shown in Fig. 7. Two foot-levers M, arranged one on each side of the cage, actuate the curved levers shown in Fig. 9, which press on tongues formed on the retaining-catches, and so unlock the corves from the cages. Two adjacent corves on separate pairs of rails are pushed simultaneously into the cage by extending the crossbead laterally and providing it with two forks.",BERRY JOHN,BERRY JOHN,,https://lens.org/055-727-830-309-123,Patent Application,no,0,0,1,1,0,,,,0,0,,,,DISCONTINUED
13,US,A,US 2224841 A,160-848-974-217-145,1940-12-10,1940,US 20512238 A,1938-04-29,US 20512238 A;;US 2224841X A,1937-08-25,Fixing or securing clips or devices for sealing cartons or containers,,JOHN BERRY,JOHN BERRY,,https://lens.org/160-848-974-217-145,Granted Patent,no,0,6,1,1,0,B65B51/046;;Y10T29/49908;;Y10T29/49833;;Y10T29/49908;;Y10T29/49833;;B65B51/046,B65B51/04,,0,0,,,,EXPIRED
14,CA,A,CA 265557 A,067-232-112-661-166,1926-11-02,1926,CA 265557D A,,CA 265557T A,,TELEPHONE SELECTOR,,SIEMENS BROTHERS & CO LTD,BERRY JOHN,,https://lens.org/067-232-112-661-166,Granted Patent,no,0,0,1,1,0,,,,0,0,,,,EXPIRED
15,US,A,US 774150 A,003-663-096-038-261,1904-11-08,1904,US 1903/0186461 A,1903-12-24,US 1903/0186461 A,1903-12-24,AXLE-NUT.,,BERRY JOHN,BERRY JOHN,,https://lens.org/003-663-096-038-261,Granted Patent,no,0,2,1,1,0,B60B37/10;;Y10S411/924;;B60B37/10;;Y10S411/924,,,0,0,,,,EXPIRED
16,GB,A,GB 191202246 A,098-201-242-695-076,1912-11-07,1912,GB 191202246D A,1912-01-29,GB 191202246T A,1912-01-29,Improvements in and applicable to Covers for Pneumatic Tyres.,"2246. Berry, J. Jan. 29. Tread bands, projections, and surfaces. - Blocks of wood, metal, rubber, or other suitable material are held detachably in metal holders, which are secured in one or more rows, directly or by means of metal base-plates, to the cover of a pneumatic tyre or to a band thereon. In the form shown in Fig. 2, the holder 1 is in the form of a box, the bottom of which is riveted to the tyre or band, and the block 3 is secured therein by a pin 2 opposite an inclined side. In the form shown in Fig. 4, the holder comprises halves attached to the band or tyre, which may be separated to receive the block, the block being secured therein by inclined sides, grooves, projections, and, in some cases, by bolts, which may pass through the two parts of the block. In the form shown in Fig. 7, the holders are of ring form with inclined walls, and are secured to base-plates 15 by projections 18 engaging in recesses in a flange 16 on the plate and lugs 20, passing through slots in an opposite flange 17, screwed to the plates. The holders and blocks may be square, hexagonal, circular, or of other form. In the form shown in Fig. 9, they are shaped to give a continuous tread surface. The holders may be linked together.",BERRY JOHN,BERRY JOHN,,https://lens.org/098-201-242-695-076,Patent Application,no,0,0,1,1,0,B60C27/16,B60C27/16,,0,0,,,,DISCONTINUED
17,GB,A,GB 190426727 A,079-732-841-631-246,1905-12-07,1905,GB 190426727D A,1904-12-08,GB 190426727T A,1904-12-08,"Improvements in or relating to the Lubrication of the Axles of Colliery Wagons, Tubs or Corves and the like.","26,727. Berry, J. Dec. 8. Air-escape valves; piston valves; tubular valves. -In connection with the automatic lubrication of the axle bearings of colliery wagons, tubs, or corves, &c., a lubricator is combined with a tipper, the lubricant being delivered by the motion of the tipper. One or more drums d are provided with air valves g and delivery spouts f. In the position shown in Fig. 1, the air valves are closed, but when the tipper is inverted, the valves open and allow the lubricant to pass from the spouts f to the axles of the corve &c. Preferably, the air valve comprises a piston h, Fig. 7, working in a bush i provided with ports j opening into the interior of the drum. The piston is carried by a screwed rod k provided with nuts l by which the amount of opening of the valve can be regulated according to requirement. Each spout may be provided with a self-closing device for delivering a measured quantity of the lubricant at each operation. The spout n, Fig. 10, slides within a part n, and is provided with ports o, p opening into a chamber s on the part r and into the drum respectively. As the tipper is turned, the spout slides to cover and uncover the ports ; the lubricant collected in the chamber s during the previous operation of the tipper is then delivered through the spout, and afterwards the chamber is again filled ready for the next operation of the tipper. According to the Provisional Specification, a tap, controlled by a gravity lever, may be applied to each spout.",BERRY JOHN,BERRY JOHN,,https://lens.org/079-732-841-631-246,Patent Application,no,0,0,1,1,0,,,,0,0,,,,DISCONTINUED
18,GB,A,GB 189708743 A,199-855-875-507-682,1898-02-19,1898,GB 189708743D A,1897-04-06,GB 189708743T A,1897-04-06,"Improvements in and relating to Machines for Making Bricks, Tiles, and the like.","8743. Berry, J. April 6. Moulding bricks, tiles, &c.- Fig. shows in plan view a pugmill a and sliding mould plate c<1> for producing rough bricks, and Fig. 13 a vertical section of one of the presses for finishing the bricks. Cylindrical stems of the knives or curved blades b pass through holes in the square portion b<2> of the pug-mill shaft, and are secured by nuts b<3>. The mould plate c' has two apertures or moulds, and is moved backwards and forwards by cams to bring the empty mould opposite to the mouthpiece of the pugmill and the filled moulds opposite to the ejecting-plungers g, g<1>. These plungers are covered with flannel lubricated from an oil reservoir g*, and are reciprocated by cranks g<2>, a rocking shaft g<2>@,and cams on the sides of a spur-wheel, acting on rollers g<5>, g<7>. The ejected bricks fall on endless bands k, k<1>, and are transferred by push-plates k<3> to bottom plates m of the presses. The sides n<4> of the mould are hinged to a plate n' of the frame n<2>, and are opened outwards and closed by the up-and-down motion of a frame n<3>, which acts on inclined surfaces of the sides of the mould. The pressing-plunger n* and frames n<3> are reciprocated by cams on a shaft p<1>. The bottom plates m are raised and lowered by cams, and the carrier or push-plates are reciprocated by cams and rocking levers. The rough brick is slightly smaller than the finished brick, and the formation of the frog or indent by the pressing-plunger forces the clay outwards to the sides of the press box or mould. The pug-mill, cam, and working shafts are driven from a main shaft by toothed gearing, and a hand-wheel is provided for moving the parts to any required position for repairs &c.",BERRY JOHN,BERRY JOHN,,https://lens.org/199-855-875-507-682,Patent Application,no,0,0,1,1,0,,,,0,0,,,,DISCONTINUED
19,US,A,US 723636 A,119-182-661-269-679,1903-03-24,1903,US 1902/0096432 A,1902-03-03,US 1902/0096432 A,1902-03-03,AIR-SHIP.,,BERRY JOHN,BERRY JOHN,,https://lens.org/119-182-661-269-679,Granted Patent,no,0,0,1,1,0,B64B1/00;;B64B1/00,,,0,0,,,,EXPIRED
20,CA,A,CA 96163 A,141-831-805-832-745,1905-11-21,1905,CA 96163D A,1905-10-10,CA 96163T A,1905-10-10,AXLE NUT,,BERRY JOHN,BERRY JOHN,,https://lens.org/141-831-805-832-745,Granted Patent,no,0,0,1,1,0,,,,0,0,,,,EXPIRED
21,CA,A,CA 244991 A,155-680-260-417-72X,1924-12-02,1924,CA 244991D A,,CA 244991T A,,IMPULSE TRANSMITTER FOR AUTOMATIC AND SEMI-AUTOMATIC TELEPHONE SYSTEMS,,SIEMENS BROTHERS & CO LTD,BERRY JOHN,,https://lens.org/155-680-260-417-72X,Granted Patent,no,0,0,1,1,0,,,,0,0,,,,EXPIRED
22,GB,A,GB 830356 A,020-674-071-001-761,1960-03-16,1960,GB 2867456 A,1956-09-19,GB 2867456 A,1956-09-19,Improvements in and relating to hatch covers of ships,"830,356. Hatch covers. SHORT BROS. Ltd. Sept. 19, 1956, No. 28674/56. Class 113. A ship's hatch cover is adapted to be lifted and to be displaced in a direction parallel to a pair of walls of the hatch coaming. The hatch cover 1 has at least three mountings 11a attached to it by bolts 12. Each mounting has a nut 13 welded to it through which screws the jack 14. At the bottom of each jack there is a roller 17, grooved to run on rail 22 of deck 2, mounted in a fork member 18 which has a collar 19 rotatable relative to the head 20 of the jack. The hatch cover has a series of stiffeners 27 on the top, and a solid bar 6 welded to the bottom which enters the packing material 4, when in the closed position. Wing nuts on screws 9 fit slots in the hatch cover for fastening down. To remove the cover the fastenings 9 are released, the jacks oerated to lift the cover which is then pushed along the rails. Different types of jacks may be used, for example, one having a lateral projecting stub which is inserted in the recess of a mounting fixed to the cover or a ratchet type jack. Various arrangements of jacks may be employed, provided they support the cover in a substantially stable equilibrium, for example two jacks either side of the cover, two on one side and one in the other or one on each side and one in the middle of a third side.",SHORT BROTHERS LTD,BERRY JOHN,,https://lens.org/020-674-071-001-761,Granted Patent,no,0,1,1,1,0,B63B19/18,B63B19/18,B7A AGQ           GQ,0,0,,,,EXPIRED
23,US,A1,US 2012/0074335 A1,083-327-990-366-568,2012-03-29,2012,US 201113249035 A,2011-09-29,US 201113249035 A;;US 30217905 A;;US 2004/0018772 W;;US 64047703 A;;US 47823103 P,2003-06-12,METHODS AND APPARATUS FOR STERILIZATION OF AIR AND OBJECTS,"A portable air sterilization apparatus includes a portable chamber forming an interior volume, a portable source for producing a single beam of collimated light energy, and a rotating beam redirector. The portable chamber includes a first end for introducing air into the chamber, a second end for permitting air to exit from the chamber, a transparent orifice through which a single beam of collimated light energy can be introduced into the interior volume of the chamber; and at least one reflective wall. The rotating beam redirector is adapted to rotate through a complete revolution about a rotational axis and to redirect the single beam of collimated light energy within the chamber during said revolution.",BERRY LAMBERT DARRYL;;BERRY JOHN ROBERT;;SAFE HAVEN INC,BERRY LAMBERT DARRYL;;BERRY JOHN ROBERT,,https://lens.org/083-327-990-366-568,Patent Application,yes,2,4,8,9,0,A61L2/08;;A61L9/18;;A61L9/18;;A61L2/08,A61L9/18;;A61L2/08,250/455.11,0,0,,,,ACTIVE
24,GB,A,GB 190409251 A,108-740-886-233-436,1904-05-26,1904,GB 190409251D A,1904-04-22,GB 190409251T A,1904-04-22,Improvements in Engine Cross-heads.,"9251. Berry, D. C., and Berry, J. L. April 22. Crossheads.-The crosshead pin 13 has an adjustable sleeve 14 which cau be turned when worn. The crosshead shown in Fig. 1 is made in halves which are joined by cross-bolts 8 and keys 9. One part is bored to receive the end of the piston-rod. In the solid crosshead shown in Fig. 7, the cheekplates are grooved to admit the reduced portion 15 of the sleeve.",BERRY DAVID CHARLES;;BERRY JOHN LAWRENCE,BERRY DAVID CHARLES;;BERRY JOHN LAWRENCE,,https://lens.org/108-740-886-233-436,Patent Application,no,0,0,1,1,0,,,,0,0,,,,DISCONTINUED
25,CA,A,CA 24417 A,018-377-218-037-353,1886-07-03,1886,CA 24417D A,,CA 24417T A,,CHECK VALVE,,BERRY JOHN H,BERRY JOHN H,,https://lens.org/018-377-218-037-353,Granted Patent,no,0,0,1,1,0,,,,0,0,,,,EXPIRED
26,AU,B3,AU 658117 B3,085-028-013-500-089,1995-03-30,1995,AU 1995/010241 A,1995-01-17,AU 1995/010241 A,1995-01-17,Spa skimmer,,WICOR IND AUSTRALIA PTY LTD,BERRY DESMOND JOHN,,https://lens.org/085-028-013-500-089,Limited Patent,no,3,0,1,1,0,,E04H4/16,,0,0,,,,EXPIRED
27,US,A,US 2249267 A,082-671-712-100-256,1941-07-15,1941,US 34091740 A,1940-06-17,US 34091740 A,1940-06-17,Permanent wave comb and spreader,,BERRY JOHN R,BERRY JOHN R,,https://lens.org/082-671-712-100-256,Granted Patent,no,0,13,1,1,0,A45D2/42;;A45D2/42,A45D2/42,,0,0,,,,EXPIRED
28,AU,A,AU 1990/050122 A,064-313-659-683-954,1990-09-06,1990,AU 1990/050122 A,1990-02-26,AU 1990/050122 A;;AU PJ300489 A,1989-03-01,JOINTING DEVICE,,DEGA RESEARCH PTY LTD,BERRY DESMOND JOHN,,https://lens.org/064-313-659-683-954,Patent Application,no,0,0,2,2,0,E03C1/021;;F16L25/14,E03C1/02;;F16L25/14,,0,0,,,,EXPIRED
29,US,A,US 1205844 A,083-579-091-320-612,1916-11-21,1916,US 5377715 A,1915-10-02,US 5377715 A,1915-10-02,COLD-BOTTLE DISPENSER.,,BERRY JOHN WALTER,BERRY JOHN WALTER,,https://lens.org/083-579-091-320-612,Granted Patent,no,0,18,1,1,0,F25D31/007;;F25D31/007;;G07F13/10;;G07F13/10,,,0,0,,,,EXPIRED
30,US,A,US 3964867 A,092-559-559-009-124,1976-06-22,1976,US 55300875 A,1975-02-25,US 55300875 A,1975-02-25,Reaction container,"A mold formed reaction container includes a lower portion having four sides forming an open top parallelepiped structure and an upper portion in the shape of a threaded hollow cylinder over which a cap may be screwed. The lower portion is inserted in a square opening of an automatic chemical analyzer so that two of the sides thereof are in a radiant energy path. The opening of the analyzer has two slot indentions removed from two opposite sides thereof and the lower portion of the container has two corresponding key extensions therefrom to insure the proper two sides of the container are placed in the energy path. Further, one of the sides of the container not having a key extension has a label on a portion thereof and that portion intersects and blocks a second radiant energy path through the opening in such a manner that the insertion of the container can be detected.",HYCEL INC,BERRY JOHN FRANKLIN,,https://lens.org/092-559-559-009-124,Granted Patent,yes,3,48,2,2,0,G01N21/03;;G01N21/03;;G01N21/253;;G01N21/253,B01J19/12;;G01N21/03;;G01N21/25;;G01N21/75;;G01N33/48,23253R,0,0,,,,EXPIRED
31,US,A,US 1705354 A,114-699-216-681-577,1929-03-12,1929,US 28618328 A,1928-06-18,US 28618328 A,1928-06-18,Mold,,BERRY JOHN F,BERRY JOHN F,,https://lens.org/114-699-216-681-577,Granted Patent,no,0,2,1,1,0,B28B7/0079;;B28B7/0079;;B28B7/0073;;B28B7/0073;;B28B7/183;;B28B7/183,B28B7/00;;B28B7/18,,0,0,,,,EXPIRED
32,US,A,US 2972587 A,140-823-034-202-430,1961-02-21,1961,US 73511758 A,1958-05-14,US 73511758 A,1958-05-14,"Aqueous filler-sealer wood finishing composition of urea-formaldehyde, sugar, boric acid, alum and solvent",,MIDLAND CHEMICAL CORP,BERRY JOHN M,,https://lens.org/140-823-034-202-430,Granted Patent,no,0,7,1,1,0,B27K3/15;;B27K5/02;;C08L61/24;;C09D161/24;;C08L97/02;;Y10T428/24364;;Y10T428/24372;;Y10T428/24364;;Y10T428/24372;;B27K3/15;;B27K5/02;;C09D161/24;;C08L61/24;;C08L97/02,B27K3/15;;C09D161/24,,0,0,,,,EXPIRED
33,AU,B2,AU 622351 B2,137-123-576-954-113,1992-04-02,1992,AU 1990/062058 A,1990-09-03,AU PJ626889 A,1989-09-12,SPA JET ASSEMBLY,,DEGA RESEARCH PTY LTD,BERRY DESMOND JOHN,,https://lens.org/137-123-576-954-113,Granted Patent,no,3,2,2,2,0,A61H33/027;;A61H33/6063,A61H33/02,,0,0,,,,EXPIRED
34,FR,A,FR 399543 A,140-580-352-470-330,1909-06-30,1909,FR 399543D A,1909-02-16,GB 399543X A,1908-07-25,Dispositif antidérapant pour véhicules automobiles,,JOHN CARTER BERRY,BERRY JOHN CARTER,,https://lens.org/140-580-352-470-330,Granted Patent,no,0,0,1,1,0,B60B15/00;;B60B39/00,B60B39/00,"X, 1",0,0,,,,EXPIRED
35,CA,A,CA 74403 A,174-334-373-414-450,1902-01-14,1902,CA 74403D A,1901-09-12,CA 74403T A,1901-09-12,WEIGHING AND PACKING MACHINE,,BERRY JOHN WILLIAM;;TACOMA AUTOMATIC SCALES COMPANY,BERRY JOHN WILLIAM,,https://lens.org/174-334-373-414-450,Granted Patent,no,0,0,1,1,0,,,,0,0,,,,EXPIRED
36,US,A,US 2855097 A,188-151-436-157-428,1958-10-07,1958,US 66320757 A,1957-06-03,US 66320757 A,1957-06-03,Hosiery package,,BERRY JOHN C;;BERRY WILLIAM J,BERRY JOHN C;;BERRY WILLIAM J,,https://lens.org/188-151-436-157-428,Granted Patent,no,3,0,1,1,0,B65D85/18;;B65D85/18,B65D85/18,,0,0,,,,EXPIRED
37,US,A,US 2985297 A,077-884-638-129-365,1961-05-23,1961,US 58889456 A,1956-06-01,US 58889456 A,1956-06-01,Foot covering package,,BERRY JOHN C;;BERRY WILLIAM J,BERRY JOHN C;;BERRY WILLIAM J,,https://lens.org/077-884-638-129-365,Granted Patent,no,5,5,1,1,0,B65D85/18;;B65D85/18,B65D85/18,,0,0,,,,EXPIRED
38,US,A1,US 2006/0165563 A1,058-244-242-404-055,2006-07-27,2006,US 30217905 A,2005-12-12,US 30217905 A;;US 2004/0018772 W;;US 64047703 A;;US 47823103 P,2003-06-12,Methods and apparatus for sterilization of air and objects,"An air purification system that uses laser beams ( 40 ) to purify air. A laser beam (42) is set to sweep across the interior of a box ( 20 ) that is open at two ends to the flow of air. The laser beam ( 42 ) is of sufficient strength to destroy or neutralize any dust particles, pollen, pathogens, allergens, aor gasses that are present in the flow of air through the box ( 20 ). An air baffle box ( 80 ) is utilized at each end of the box with the air flow to prevent the laser beam from escaping from the box.",SAFE HAVEN INC,BERRY LAMBERT D;;BERRY JOHN R,,https://lens.org/058-244-242-404-055,Patent Application,yes,39,7,8,9,0,A61L2/08;;A61L9/18;;A61L9/18;;A61L2/08,A61L2/08;;A61L9/18,422/121,0,0,,,,DISCONTINUED
