"#",Jurisdiction,Kind,Display Key,Lens ID,Publication Date,Publication Year,Application Number,Application Date,Priority Numbers,Earliest Priority Date,Title,Abstract,Applicants,Inventors,Owners,URL,Document Type,Has Full Text,Cites Patent Count,Cited by Patent Count,Simple Family Size,Extended Family Size,Sequence Count,CPC Classifications,IPCR Classifications,US Classifications,NPL Citation Count,NPL Resolved Citation Count,NPL Resolved Lens ID(s),NPL Resolved External ID(s),NPL Citations,Legal Status
1,US,B2,US 9460367 B2,156-905-055-027-547,2016-10-04,2016,US 201414561512 A,2014-12-05,US 201414561512 A;;US 201462085151 P,2014-11-26,Method and system for automating an image rejection process,"Systems and methods for automating an image rejection process. Features including texture, spatial structure, and image quality characteristics can be extracted from one or more images to train a classifier. Features can be calculated with respect to a test image for submission of the features to the classifier, given an operating point corresponding to a desired false positive rate. One or more inputs can be generated from the classifier as a confidence value corresponding to a likelihood of, for example: a license plate being absent in the image, the license plate being unreadable, or the license plate being obstructed. The confidence value can be compared against a threshold to determine if the image(s) should be removed from a human review pipeline, thereby reducing images requiring human review.",XEROX CORP,KOZITSKY VLADIMIR;;SHREVE MATTHEW;;BURRY AARON M,CONDUENT BUSINESS SERVICES LLC (2017-01-12);;XEROX CORPORATION (2014-12-02),https://lens.org/156-905-055-027-547,Granted Patent,yes,20,6,2,2,0,G08G1/0175;;G06N20/20;;G06V20/52;;G06V20/62;;G06V20/625;;G06N20/00;;G08G1/0175;;G06N20/20;;G06V20/52;;G06V20/62;;G06V20/625;;G06F18/2413,G06K9/00;;G06K9/46;;G06K9/62;;G06N20/20,,2,1,058-124-091-198-963,10.1109/tpami.2006.244;;17108377,"Ahonen, T. et al., ""Face Recognition with Local Binary Patterns,"" IEEE Transactions on Pattern Analysis and Machine Intelligence Oct. 30, 2006, 28(12):2037-2041.;;California Vehicle Code Section 4450-4467, http://www.leginfo.ca.gov/cgi-bin/displaycode?section=veh&group=04001-05000&file=4450-4467, printed Dec. 3, 2014, 14 pages.",ACTIVE
2,US,A1,US 2016/0148076 A1,094-414-407-310-992,2016-05-26,2016,US 201414561512 A,2014-12-05,US 201414561512 A;;US 201462085151 P,2014-11-26,METHOD AND SYSTEM FOR AUTOMATING AN IMAGE REJECTION PROCESS,"Systems and methods for automating an image rejection process. Features including texture, spatial structure, and image quality characteristics can be extracted from one or more images to train a classifier. Features can be calculated with respect to a test image for submission of the features to the classifier, given an operating point corresponding to a desired false positive rate. One or more inputs can be generated from the classifier as a confidence value corresponding to a likelihood of, for example: a license plate being absent in the image, the license plate being unreadable, or the license plate being obstructed. The confidence value can be compared against a threshold to determine if the image(s) should be removed from a human review pipeline, thereby reducing images requiring human review.",XEROX CORP,KOZITSKY VLADIMIR;;SHREVE MATTHEW;;BURRY AARON M,CONDUENT BUSINESS SERVICES LLC (2017-01-12);;XEROX CORPORATION (2014-12-02),https://lens.org/094-414-407-310-992,Patent Application,yes,0,8,2,2,0,G08G1/0175;;G06N20/20;;G06V20/52;;G06V20/62;;G06V20/625;;G06N20/00;;G08G1/0175;;G06N20/20;;G06V20/52;;G06V20/62;;G06V20/625;;G06F18/2413,G06K9/62;;G06N20/20,,0,0,,,,ACTIVE
3,WO,A1,WO 2021/242339 A1,074-795-164-619-149,2021-12-02,2021,US 2021/0019322 W,2021-02-24,US 202016887346 A,2020-05-29,SYSTEM AND METHOD FOR ARC DETECTION USING A BIAS RF GENERATOR SIGNAL,"An arc detector for a RF power supply system, where the RF power supply incudes a first RF power supply and a second RF power supply. A signal applied to a non-linear load varies in accordance with an output from one of the first RF power supply or the second RF power supply. The signal has a frequency. During an arc or arc condition in the non-linear load, the frequency of the signal changes, and if the frequency is outside of a selected range, an arc or arc condition is indicated. The frequency can be determined by digitizing the signal into a series of pulses and measuring a time or period between pulses.",MKS INSTR INC,FISK LARRY J;;GITLIN BENJAMIN;;OLDZIEJ MARIUSZ;;BURRY AARON;;HARRINGTON MATTHEW;;RADOMSKI AARON,,https://lens.org/074-795-164-619-149,Patent Application,yes,5,0,9,9,0,H01J37/321;;H01J37/32091;;G01R31/14;;G01R31/1281;;H01J37/32935;;H01J37/32091;;H01J37/321;;G01R23/16;;G01R31/14;;G01R31/1281;;H01J2237/24564;;H01J2237/334;;G01R23/16;;G01R29/02;;H01J2237/334;;H01J37/321;;H01J2237/24564;;H01J37/32091,H01J37/32,,0,0,,,,PENDING
4,WO,A1,WO 2006/010130 A1,155-715-281-292-492,2006-01-26,2006,US 2005/0024609 W,2005-07-11,US 58655204 P,2004-07-09,TUBULAR POLYMER STENT COVERINGS,"The present invention concerns thin, flexible tubings useful as stent coverings; covered stents; methods for applying such coverings to stents; and methods for reinforcing biological lumens, such as the intracranial vasculature, by introducing the covered stent into the biological lumen and positioning the covered stent at a target site, such as the site of a vascular defect.",UNIV FLORIDA;;MERICLE ROBERT A;;SANTRA SWADESHMUKUL;;BATICH CHRISTOPHER D;;BURRY MATTHEW V;;WATKINS COURTNEY S,MERICLE ROBERT A;;SANTRA SWADESHMUKUL;;BATICH CHRISTOPHER D;;BURRY MATTHEW V;;WATKINS COURTNEY S,,https://lens.org/155-715-281-292-492,Patent Application,yes,11,11,2,2,0,A61F2/07;;A61F2/07;;A61F2/06;;A61F2/06;;A61F2/90;;A61F2/90;;A61F2002/072;;A61F2002/072;;A61F2002/075;;A61F2002/075;;A61F2210/0061;;A61F2210/0061;;A61F2250/0067;;A61F2250/0067,A61F2/06,,0,0,,,,PENDING
5,EP,A1,EP 1673031 A1,190-285-740-214-795,2006-06-28,2006,EP 03754429 A,2003-09-02,US 0327446 W,2003-09-02,"POLYMERIC RECONSTRAINABLE, REPOSITIONABLE, DETACHABLE, PERCUTANEOUS ENDOVASCULAR STENTGRAFT",,UNIV FLORIDA,MERICLE ROBERT A;;SANTRA SWADESHMUKUL;;BURRY MATTHEW V;;BATICH CHRISTOPHER D;;WATKINS COURTNEY S,,https://lens.org/190-285-740-214-795,Patent Application,yes,0,0,6,6,0,A61F2/06;;A61L31/06;;A61F2/06;;A61L31/06,A61F2/06;;A61L31/06,,0,0,,,,DISCONTINUED
6,US,A1,US 2005/0049691 A1,156-323-383-162-748,2005-03-03,2005,US 65255703 A,2003-09-02,US 65255703 A;;US 0327446 W,2003-09-02,"Polymeric reconstrainable, repositionable, detachable, percutaneous endovascular stentgraft","A coaxial double lumen tube adapted for forming an endovascular graft which comprises an outer tube positioned over an inner tube, both tubes being made of a material acceptable for use in endovascular grafts and having an internal and external diameter and a wall thickness, the outer tube having an internal diameter and the inner tube having an external diameter such that a space is created between the outer tube and inner tube, said space being at least partially filled with an uncured adhesive which, upon curing after endovascular implantation, cures to adhere said inner and outer tubes together to form a self-supportive tube.",MERICLE ROBERT A.;;SANTRA SWADESHMUKUL;;BURRY MATTHEW V.;;BATICH CHRISTOPHER D.;;WATKINS COURTNEY S.,MERICLE ROBERT A;;SANTRA SWADESHMUKUL;;BURRY MATTHEW V;;BATICH CHRISTOPHER D;;WATKINS COURTNEY S,FLORIDA UNIVERSITY OF (2003-11-25);;UNIVERSITY OF FLORIDA RESEARCH FOUNDATION INC (2004-10-26),https://lens.org/156-323-383-162-748,Patent Application,yes,34,66,6,6,0,A61F2/06;;A61L31/06;;A61F2/06;;A61L31/06,A61F2/06;;A61L31/06,623/1.23,0,0,,,,DISCONTINUED
7,WO,A1,WO 2005/025456 A1,007-358-126-791-460,2005-03-24,2005,US 0327446 W,2003-09-02,US 0327446 W,2003-09-02,"POLYMERIC RECONSTRAINABLE, REPOSITIONABLE, DETACHABLE, PERCUTANEOUS ENDOVASCULAR STENTGRAFT","A coaxial double lumen tube adapted for forming an endovascular graft which comprises an outer tube positioned over an inner tube, both tubes being made of a material acceptable for use in endovascular grafts and having an internal and external diameter and a wall thickness, the outer tube having an internal diameter and the inner tube having an external diameter such that a space is created between the outer tube and inner tube, said space being at least partially filled with an uncured adhesive which, upon curing after endovascular implantation, cures to adhere said inner and outer tubes together to form a self-supportive tube.",UNIV FLORIDA;;MERICLE ROBERT A;;SANTRA SWADESHMUKUL;;BURRY MATTHEW V;;BATICH CHRISTOPHER D;;WATKINS COURTNEY S,MERICLE ROBERT A;;SANTRA SWADESHMUKUL;;BURRY MATTHEW V;;BATICH CHRISTOPHER D;;WATKINS COURTNEY S,,https://lens.org/007-358-126-791-460,Patent Application,yes,2,1,6,6,0,A61F2/06;;A61L31/06;;A61F2/06;;A61L31/06,A61F2/06;;A61L31/06,,0,0,,,,PENDING
8,AU,A1,AU 2003/272255 A1,084-778-374-475-081,2005-04-06,2005,AU 2003/272255 A,2003-09-02,US 0327446 W,2003-09-02,"POLYMERIC RECONSTRAINABLE, REPOSITIONABLE, DETACHABLE, PERCUTANEOUS ENDOVASCULAR STENTGRAFT",,UNIV FLORIDA,MERICLE ROBERT A;;SANTRA SWADESHMUKUL;;BURRY MATTHEW V;;BATICH CHRISTOPHER D;;WATKINS COURTNEY S,,https://lens.org/084-778-374-475-081,Patent Application,no,0,0,6,6,0,A61F2/06;;A61L31/06;;A61F2/06;;A61L31/06,A61F2/06;;A61L31/06,,0,0,,,,DISCONTINUED
9,CA,A1,CA 2539110 A1,069-982-727-999-935,2005-03-24,2005,CA 2539110 A,2003-09-02,US 0327446 W,2003-09-02,"POLYMERIC RECONSTRAINABLE, REPOSITIONABLE, DETACHABLE, PERCUTANEOUS ENDOVASCULAR STENTGRAFT","A coaxial double lumen tube adapted for forming an endovascular graft which comprises an outer tube positioned over an inner tube, both tubes being made of a material acceptable for use in endovascular grafts and having an intern al and external diameter and a wall thickness, the outer tube having an interna l diameter and the inner tube having an external diameter such that a space is created between the outer tube and inner tube, said space being at least partially filled with an uncured adhesive which, upon curing after endovascular implantation, cures to adhere said inner and outer tubes togeth er to form a self-supportive tube.",UNIV FLORIDA,WATKINS COURTNEY S;;MERICLE ROBERT A;;SANTRA SWADESHMUKUL;;BURRY MATTHEW V;;BATICH CHRISTOPHER D,,https://lens.org/069-982-727-999-935,Patent Application,no,0,0,6,6,0,A61F2/06;;A61L31/06;;A61F2/06;;A61L31/06,A61F2/06;;A61L31/06,,0,0,,,,DISCONTINUED
10,US,A1,US 2005/0131458 A1,179-744-091-569-976,2005-06-16,2005,US 91351104 A,2004-08-09,US 91351104 A;;US 49297403 P,2003-08-07,Biodegradable embolic agents,"A flowable, biodegradable endovascular embolic composition effective for embolizing a vascular defect consisting essentially of: (a) a biocompatible, biodegradable polymer or polymeric material forming composition; (b) a biocompatible embolic solvent for the polymer or polymer forming composition capable of diffusion into mammalian tissue; (c) biocompatible magnetic particles responsive to a magnetic field; wherein: the polymer or polymeric forming material and solvent are present in the composition in amounts and relative proportions such that (1) the composition is deliverable to a vascular defect site and (2) upon delivery to the site, solidifies into an embolic mass; and the magnetic particles are present in the composition in an amount sufficient to enable the composition being deliverable to the vascular site by a magnetic field. Also disclosed are methods and articles of manufacture embodying the above-described composition.",BATICH CHRISTOPHER D.;;EADENS MATTHEW J.;;MERICLE ROBERT A.;;BURRY MATTHEW V.;;WATKINS COURTNEY S.;;SANTRA SWADESHMUKUL;;LEAMY PATRICK,BATICH CHRISTOPHER D;;EADENS MATTHEW J;;MERICLE ROBERT A;;BURRY MATTHEW V;;WATKINS COURTNEY S;;SANTRA SWADESHMUKUL;;LEAMY PATRICK,,https://lens.org/179-744-091-569-976,Patent Application,yes,16,16,3,3,0,A61B17/12022;;A61B17/12113;;A61B17/12186;;A61B2017/00876;;A61K9/0009;;A61K9/0019;;A61K9/5015;;A61K9/5115;;A61K9/5153;;A61K49/0404;;A61K49/0423;;A61K49/0485;;A61L24/001;;A61L24/02;;A61L31/022;;A61L31/18;;B82Y5/00;;A61L2400/06;;A61L2430/36;;A61L24/02;;A61B17/12113;;A61L31/18;;B82Y5/00;;A61K9/0009;;A61K49/0404;;A61B17/12186;;A61K9/5015;;A61B2017/00876;;A61L24/001;;A61K9/5115;;A61K49/0485;;A61K49/0423;;A61K9/5153;;A61L31/022;;A61B17/12022;;A61K9/0019;;A61L2400/06;;A61L2430/36,A61B/;;A61B17/08;;A61B17/12;;A61K9/00;;A61K9/50;;A61K9/51;;A61K49/04;;A61L24/00;;A61L24/02;;A61L31/02;;A61L31/18,606/214,0,0,,,,DISCONTINUED
11,US,A1,US 2008/0132999 A1,093-381-830-856-12X,2008-06-05,2008,US 54770305 A,2005-07-11,US 54770305 A;;US 58655204 P;;US 2005/0024609 W,2004-07-09,Tubular Polymer Stent Coverings,"The present invention concerns thin, flexible tubings useful as stent coverings; covered stents; methods for applying such coverings to stents; and methods for reinforcing biological lumens, such as the intracranial vasculature, by introducing the covered stent into the biological lumen and positioning the covered stent at a target site, such as the site of a vascular defect.",MERICLE ROBERT A;;SANTRA SWADESHMUKUL;;BATICH CHRISTOPHE D;;BURRY MATTHEW V;;WATKINS COURTNEY S,MERICLE ROBERT A;;SANTRA SWADESHMUKUL;;BATICH CHRISTOPHE D;;BURRY MATTHEW V;;WATKINS COURTNEY S,UNIVERSITY OF FLORIDA RESEARCH FOUNDATION INC (2006-10-18),https://lens.org/093-381-830-856-12X,Patent Application,yes,22,74,2,2,0,A61F2/07;;A61F2/07;;A61F2/06;;A61F2/06;;A61F2/90;;A61F2/90;;A61F2002/072;;A61F2002/072;;A61F2002/075;;A61F2002/075;;A61F2210/0061;;A61F2210/0061;;A61F2250/0067;;A61F2250/0067,A61F2/06,623/1.34;;623/1.46;;623/1.42,0,0,,,,DISCONTINUED
12,WO,A3,WO 2005/013810 A3,121-011-503-676-872,2006-05-18,2006,US 2004/0025869 W,2004-08-09,US 49297403 P,2003-08-07,BIODEGRADABLE EMBOLIC AGENTS,"A flowable, biodegradable endovascular embolic composition effective for embolizing a vascular defect consisting essentially of: (a) a biocompatible, biodegradable polymer or polymeric material forming composition; (b) a biocompatible embolic solvent for the polymer or polymer forming composition capable of diffusion into mammalian tissue; (c) biocompatible magnetic particles responsive to a magnetic field; wherein: the polymer or polymeric forming material and solvent are present in the composition in amounts and relative proportions such that (1) the composition is deliverable to a vascular defect site and (2) upon delivery to the site, solidifies into an embolic mass; and the magnetic particles are present in the composition in an amount sufficient to enable the composition being deliverable to the vascular site by a magnetic field. Also disclosed are methods and articles of manufacture embodying the above-described composition.",UNIV FLORIDA;;BATICH CHRISTOPHER D;;EADENS MATTHEW J;;MERICLE ROBERT A;;BURRY MATTHEW V;;WATKINS COURTNEY S;;SWADESHMUKUL SANTRA;;LEAMY PATRICK,BATICH CHRISTOPHER D;;EADENS MATTHEW J;;MERICLE ROBERT A;;BURRY MATTHEW V;;WATKINS COURTNEY S;;SWADESHMUKUL SANTRA;;LEAMY PATRICK,,https://lens.org/121-011-503-676-872,Search Report,yes,2,0,3,3,0,A61B17/12022;;A61B17/12113;;A61B17/12186;;A61B2017/00876;;A61K9/0009;;A61K9/0019;;A61K9/5015;;A61K9/5115;;A61K9/5153;;A61K49/0404;;A61K49/0423;;A61K49/0485;;A61L24/001;;A61L24/02;;A61L31/022;;A61L31/18;;B82Y5/00;;A61L2400/06;;A61L2430/36;;A61L24/02;;A61B17/12113;;A61L31/18;;B82Y5/00;;A61K9/0009;;A61K49/0404;;A61B17/12186;;A61K9/5015;;A61B2017/00876;;A61L24/001;;A61K9/5115;;A61K49/0485;;A61K49/0423;;A61K9/5153;;A61L31/022;;A61B17/12022;;A61K9/0019;;A61L2400/06;;A61L2430/36,A61B/;;A61B17/08;;A61B17/12;;A61K9/00;;A61K9/50;;A61K9/51;;A61K49/04;;A61L24/00;;A61L24/02;;A61L31/02;;A61L31/18,,0,0,,,,PENDING
13,WO,A2,WO 2005/013810 A2,161-038-701-783-098,2005-02-17,2005,US 2004/0025869 W,2004-08-09,US 49297403 P,2003-08-07,BIODEGRADABLE EMBOLIC AGENTS,"A flowable, biodegradable endovascular embolic composition effective for embolizing a vascular defect consisting essentially of: (a) a biocompatible, biodegradable polymer or polymeric material forming composition; (b) a biocompatible embolic solvent for the polymer or polymer forming composition capable of diffusion into mammalian tissue; (c) biocompatible magnetic particles responsive to a magnetic field; wherein: the polymer or polymeric forming material and solvent are present in the composition in amounts and relative proportions such that (1) the composition is deliverable to a vascular defect site and (2) upon delivery to the site, solidifies into an embolic mass; and the magnetic particles are present in the composition in an amount sufficient to enable the composition being deliverable to the vascular site by a magnetic field. Also disclosed are methods and articles of manufacture embodying the above-described composition.",UNIV FLORIDA;;BATICH CHRISTOPHER D;;EADENS MATTHEW J;;MERICLE ROBERT A;;BURRY MATTHEW V;;WATKINS COURTNEY S;;SWADESHMUKUL SANTRA;;LEAMY PATRICK,BATICH CHRISTOPHER D;;EADENS MATTHEW J;;MERICLE ROBERT A;;BURRY MATTHEW V;;WATKINS COURTNEY S;;SWADESHMUKUL SANTRA;;LEAMY PATRICK,,https://lens.org/161-038-701-783-098,Patent Application,yes,0,20,3,3,0,A61B17/12022;;A61B17/12113;;A61B17/12186;;A61B2017/00876;;A61K9/0009;;A61K9/0019;;A61K9/5015;;A61K9/5115;;A61K9/5153;;A61K49/0404;;A61K49/0423;;A61K49/0485;;A61L24/001;;A61L24/02;;A61L31/022;;A61L31/18;;B82Y5/00;;A61L2400/06;;A61L2430/36;;A61L24/02;;A61B17/12113;;A61L31/18;;B82Y5/00;;A61K9/0009;;A61K49/0404;;A61B17/12186;;A61K9/5015;;A61B2017/00876;;A61L24/001;;A61K9/5115;;A61K49/0485;;A61K49/0423;;A61K9/5153;;A61L31/022;;A61B17/12022;;A61K9/0019;;A61L2400/06;;A61L2430/36,A61B/;;A61B17/08;;A61B17/12;;A61K9/00;;A61K9/50;;A61K9/51;;A61K49/04;;A61L24/00;;A61L24/02;;A61L31/02;;A61L31/18,,0,0,,,,PENDING
14,GB,A,GB 2431394 A,064-835-059-279-382,2007-04-25,2007,GB 0620794 A,2006-10-19,US 72817305 P;;US 55007006 A,2005-10-19,Tape measure in the form of a hollow annulus,"A recoiling tape measure comprises a housing 2 in the form of a hollow annulus. The tape measure 1 may consist of a relatively large tape blade 22. To accommodate a large blade the tape measure housing is formed as a hollow annular ring having an open central core 6 where the blade is wound about the core of the annular housing. Because the housing has a central opening it can be easily carried in one hand. The tape measure further comprises a first mechanism 42 for locking the tape in an extended position and a second mechanism 28 for rewinding the tape back into the housing. The rewind mechanism may comprise a belt dive, opposed springs with a cam lock, a linear spring compressed by a gear drive, a motor driven gear drive, a flat spring and gear drive or a magnetic drive.",IRWIN IND TOOL CO,LEVINE STEVEN R;;WEIR JAMES ALAN;;WHITNEY HAMILTON SEAN MICHAEL;;SHUTE MATTHEW R;;BURRY JAMES M,,https://lens.org/064-835-059-279-382,Patent Application,no,4,1,6,6,0,G01B3/1041;;G01B3/1005;;G01B3/1005;;G01B3/1003;;G01B3/1003;;G01B3/1043;;G01B3/1043;;G01B3/1046;;G01B3/1046;;G01B2003/1028;;G01B2003/1028,G01B3/10;;B65H75/48,B8M MB7           MB7;;B8M M109          MB7;;B8M M16D          MB7;;B8M M16E          MB7,0,0,,,,DISCONTINUED
15,AU,A1,AU 2006/230689 A1,151-873-501-275-693,2007-05-03,2007,AU 2006/230689 A,2006-10-19,US 72817305 P;;US 55007006 A,2005-10-19,Tape Measure,,IRWIN IND TOOL CO,WEIR JAMES ALAN;;BURRY JAMES M;;SHUTE MATTHEW R;;LEVINE STEVEN R;;WHITNEY HAMILTON SEAN MICHAEL,,https://lens.org/151-873-501-275-693,Patent Application,no,0,0,6,6,0,G01B3/1005;;G01B2003/1028;;G01B3/1043;;G01B3/1046;;G01B3/1003;;G01B3/1041;;G01B3/1005;;G01B2003/1028;;G01B3/1003;;G01B3/1043;;G01B3/1046,G01B3/10;;B65H54/74;;G01B3/02;;G01B5/02,,0,0,,,,DISCONTINUED
16,US,A1,US 2007/0101599 A1,154-292-303-669-628,2007-05-10,2007,US 55007006 A,2006-10-17,US 55007006 A;;US 72817305 P,2005-10-19,TAPE MEASURE,"The tape measure may consist of a relatively large tape blade. To accommodate a large blade the tape measure housing is formed as a hollow annulus having an open central core where the blade is wound about the core of the annular housing. Because the housing has a central opening it can be easily carried in one hand. The device also includes a locking mechanism for locking the tape in an extended position and a rewind mechanism for rewinding the tape back into the housing. The rewind mechanism may comprise a belt drive, opposed springs with a cam lock, a linear spring compressed by a gear drive, a motor driven gear drive, a flat spring and gear drive or a magnetic drive.",LEVINE STEVEN R;;WEIR JAMES A;;WHITNEY HAMILTON S M;;SHUTE MATTHEW R;;BURRY JAMES M,LEVINE STEVEN R;;WEIR JAMES A;;WHITNEY HAMILTON S M;;SHUTE MATTHEW R;;BURRY JAMES M,BLACK & DECKER INC (2018-12-03);;IRWIN INDUSTRIAL TOOL COMPANY (2007-01-19),https://lens.org/154-292-303-669-628,Patent Application,yes,40,8,6,6,0,G01B3/1041;;G01B3/1005;;G01B3/1005;;G01B3/1003;;G01B3/1003;;G01B3/1043;;G01B3/1043;;G01B3/1046;;G01B3/1046;;G01B2003/1028;;G01B2003/1028,G01B3/10,33/755,0,0,,,,INACTIVE
17,FR,A1,FR 2892187 A1,123-446-216-049-644,2007-04-20,2007,FR 0654370 A,2006-10-19,US 72817305 P;;US 55007006 A,2005-10-19,METRE A RUBAN DE GRANDE TAILLE,"Le mètre à ruban (1) peut se composer d'un ruban (22) de taille relativement grande. Afin d'accepter un ruban (22) de grande taille, le boîtier de mètre à ruban (2) est sous la forme d'un anneau creux ayant un noyau central ouvert où le ruban (22) est enroulé autour du noyau du boîtier annulaire (2). Du fait que le boîtier (2) a une ouverture centrale (6), il peut facilement être transporté d'une main. Le dispositif comprend également un mécanisme de blocage (14) destiné à bloquer le mètre à ruban (1) dans une position sortie et un mécanisme de rembobinage (16) destiné à rembobiner le ruban (22) dans le boîtier (2). Le mécanisme de rembobinage peut comprendre un entraînement à courroie, des ressorts opposés avec un verrou à came, un ressort linéaire comprimé par un entraînement à pignon, un entraînement à pignon entraîné par moteur, un ressort plat et un entraînement à pignon ou un entraînement magnétique.",IRWIN IND TOOL CO,LEVINE STEVEN R;;WEIR JAMES ALAN;;WHITNEY HAMILTON SEAN MICHAEL;;SHUTE MATTHEW R;;BURRY JAMES M,,https://lens.org/123-446-216-049-644,Patent Application,no,0,0,6,6,0,G01B3/1041;;G01B3/1005;;G01B3/1005;;G01B3/1003;;G01B3/1003;;G01B3/1043;;G01B3/1043;;G01B3/1046;;G01B3/1046;;G01B2003/1028;;G01B2003/1028,G01B3/08,,0,0,,,,PENDING
18,US,B2,US 7559154 B2,112-163-789-807-028,2009-07-14,2009,US 55007006 A,2006-10-17,US 55007006 A;;US 72817305 P,2005-10-19,Tape measure,"The tape measure may consist of a relatively large tape blade. To accommodate a large blade the tape measure housing is formed as a hollow annulus having an open central core where the blade is wound about the core of the annular housing. Because the housing has a central opening it can be easily carried in one hand. The device also includes a locking mechanism for locking the tape in an extended position and a rewind mechanism for rewinding the tape back into the housing. The rewind mechanism may comprise a belt drive, opposed springs with a cam lock, a linear spring compressed by a gear drive, a motor driven gear drive, a flat spring and gear drive or a magnetic drive.",IRWIN IND TOOL CO,LEVINE STEVEN R;;WEIR JAMES ALAN;;WHITNEY HAMILTON SEAN MICHAEL;;SHUTE MATTHEW R;;BURRY JAMES M,BLACK & DECKER INC (2018-12-03);;IRWIN INDUSTRIAL TOOL COMPANY (2007-01-19),https://lens.org/112-163-789-807-028,Granted Patent,yes,40,16,6,6,0,G01B3/1041;;G01B3/1005;;G01B3/1005;;G01B3/1003;;G01B3/1003;;G01B3/1043;;G01B3/1043;;G01B3/1046;;G01B3/1046;;G01B2003/1028;;G01B2003/1028,G01B3/10,33/769;;33/755;;33/761,1,0,,,"European Search Report from corresponding European patent application No. GB0620794.8 dated Jan. 8, 2007.",INACTIVE
19,WO,A3,WO 2003/090604 A3,057-252-925-114-149,2004-01-15,2004,US 0312835 W,2003-04-24,US 37481502 P,2002-04-24,METHOD OF ENDOVASCULAR BRAIN MAPPING,"Disclosed are the following strategies for endovascularly mapping the brain with a chemical agent capable of staining the preselected region of the brain to a color visibly contrasting with non-stained portions of the brain and of passing through the blood-brain barrier to the preselected region of the brain: 1) Passive transport: (a) pro-drug, (b) Modification of mapping agent to mimic molecules that readily cross the BBB (e.g., amino acid, glucose, etc.); 2) Active transport; 3) Receptor-mediated transport (e.g., antibody mediated); 4) Blood brain barrier (BBB) manipulation; 5) Emulsification of agent (such as &bgr;-carotene, organic dye, etc.) to stain capillary endothelium; 6) Embolization of brain capillaries; 7) Grafted-nanoparticle systems for brain delivery of mapping agent.",UNIV FLORIDA;;MERICLE ROBERT A;;BATICH CHRISTOPHER D;;WATKINS COURTNEY S;;BURRY MATTHEW V;;RICHTER ERICH O;;SWANDESHMUKUL SANTRA,MERICLE ROBERT A;;BATICH CHRISTOPHER D;;WATKINS COURTNEY S;;BURRY MATTHEW V;;RICHTER ERICH O;;SWANDESHMUKUL SANTRA,,https://lens.org/057-252-925-114-149,Search Report,yes,4,0,5,5,0,A61K49/0002;;A61K49/0021;;A61K49/0043;;A61K49/0052;;A61K49/0056;;A61K49/0067;;A61K49/0093;;A61K49/0438;;A61K49/0002;;A61K49/0021;;A61K49/0438;;A61K49/0052;;A61K49/0043;;A61K49/0056;;A61K49/0067;;A61K49/0093,A61B/;;A61B5/05;;A61B6/00;;A61K49/00,,0,0,,,,PENDING
