"#",Jurisdiction,Kind,Display Key,Lens ID,Publication Date,Publication Year,Application Number,Application Date,Priority Numbers,Earliest Priority Date,Title,Abstract,Applicants,Inventors,Owners,URL,Document Type,Has Full Text,Cites Patent Count,Cited by Patent Count,Simple Family Size,Extended Family Size,Sequence Count,CPC Classifications,IPCR Classifications,US Classifications,NPL Citation Count,NPL Resolved Citation Count,NPL Resolved Lens ID(s),NPL Resolved External ID(s),NPL Citations,Legal Status
1,US,B1,US 5383454 B1,039-296-219-091-658,1996-12-31,1996,US 90909792 A,1992-07-02,US 90909792 A;;US 60075390 A,1990-10-19,System for indicating the position of a surgical probe within a head on an image of the head,"The system for determining a position of a probe relative to an object such as a head of a body patient. The head includes a surface such as a forehead having a contour. The head is placed in a cradle equipped with an arc. The cross-sectional images of the head are determined relative to the arc. A hand-held unit optically scans the forehead and the arc. During scanning to generate the cross-sectional images, the optical scanner is used to determine the position of the forehead relative to the cradle. During surgery, the optical scanner also determines the position of the forehead relative to a base ring. An array for receiving radiation emitted from the probe and from the base ring generates signals indicating the position of the tip of the probe relative to the base ring. A stereotactic imaging system selects and display the image of the head closest to the measured position of the tip of the probe.",UNIV ST LOUIS,BUCHOLZ RICHARD D,,https://lens.org/039-296-219-091-658,Granted Patent,no,0,5,31,90,0,A61B5/0064;;A61B5/0073;;A61B5/055;;A61B5/06;;A61B5/1077;;A61B6/12;;A61B6/501;;A61B6/5247;;A61B8/00;;A61B8/5238;;A61B2017/00738;;B82Y15/00;;A61B8/0808;;A61B2090/3983;;A61B90/10;;A61B90/36;;A61B2034/2055;;A61B2034/2068;;A61B2034/2072;;A61B2090/3788;;A61B2090/363;;A61B2090/3945;;A61B34/20;;A61B2090/364;;A61B90/14;;A61B2034/105;;A61B2090/378;;A61B90/39;;A61B2090/3954;;A61B90/10;;A61B5/0073;;A61B6/12;;A61B6/501;;A61B8/00;;A61B8/5238;;A61B5/0064;;B82Y15/00;;A61B5/06;;A61B5/1077;;A61B6/5247;;A61B2017/00738;;A61B8/0808;;A61B2034/2068;;A61B2090/3945;;A61B2090/363;;A61B2034/2055;;A61B2090/3788;;A61B2090/3983;;A61B2090/3954;;A61B90/10;;A61B90/36;;A61B2034/2072;;A61B34/20;;A61B2090/378;;A61B2090/364;;A61B2034/105;;A61B90/39;;A61B90/14,A61B5/00;;A61B5/055;;A61B5/06;;A61B5/107;;A61B6/00;;A61B6/12;;A61B8/00;;A61B17/88;;A61B19/00,12/865.31,0,0,,,,EXPIRED
2,US,B2,US 6678545 B2,114-281-570-273-543,2004-01-13,2004,US 19733702 A,2002-07-16,US 19733702 A;;US 15179898 A;;US 54351695 A;;US 85898092 A;;US 60075390 A,1990-10-19,System for determining the position in a scan image corresponding to the position of an imaging probe,"
    A system for use in imaging a subject and determining a position relative to a body of a patient. A base is fixed in relation to the subject. An imaging probe is configured to scan the subject and provide scan images of the subject. An array of receivers is in communication with the base and the imaging probe. A first plurality of reference points is fixed in relation to the base and in communication with the array. A second plurality of reference points is fixed in relation to the imaging probe and in communication with the array. A processor in communication with the imaging probe and the array calculates the position in the scan images corresponding to the position of the imaging probe relative to the subject. 
",UNIV ST LOUIS,BUCHOLZ RICHARD D,SAINT LOUIS UNIVERSITY (1992-05-12),https://lens.org/114-281-570-273-543,Granted Patent,yes,100,32,31,90,0,A61B5/0064;;A61B5/0073;;A61B5/055;;A61B5/06;;A61B5/1077;;A61B6/12;;A61B6/501;;A61B6/5247;;A61B8/00;;A61B8/5238;;A61B2017/00738;;B82Y15/00;;A61B8/0808;;A61B2090/3983;;A61B90/10;;A61B90/36;;A61B2034/2055;;A61B2034/2068;;A61B2034/2072;;A61B2090/3788;;A61B2090/363;;A61B2090/3945;;A61B34/20;;A61B2090/364;;A61B90/14;;A61B2034/105;;A61B2090/378;;A61B90/39;;A61B2090/3954;;A61B90/10;;A61B5/0073;;A61B6/12;;A61B6/501;;A61B8/00;;A61B8/5238;;A61B5/0064;;B82Y15/00;;A61B5/06;;A61B5/1077;;A61B6/5247;;A61B2017/00738;;A61B8/0808;;A61B2034/2068;;A61B2090/3945;;A61B2090/363;;A61B2034/2055;;A61B2090/3788;;A61B2090/3983;;A61B2090/3954;;A61B90/10;;A61B90/36;;A61B2034/2072;;A61B34/20;;A61B2090/378;;A61B2090/364;;A61B2034/105;;A61B90/39;;A61B90/14,A61B5/00;;A61B5/055;;A61B5/06;;A61B5/107;;A61B6/00;;A61B6/12;;A61B8/00;;A61B17/88;;A61B19/00,600/426;;600/427;;600/429;;606/130,99,67,152-540-075-607-894;;112-858-152-757-474;;083-441-016-481-959;;015-780-157-273-416;;018-987-015-300-80X;;038-726-520-304-887;;008-660-323-454-379;;134-213-781-078-917;;014-404-040-536-096;;008-781-274-164-674;;000-793-841-642-810;;078-122-679-012-396;;046-181-618-353-102;;005-527-234-836-357;;039-488-308-308-130;;055-835-252-831-646;;135-707-030-514-075;;061-170-040-873-143;;020-435-815-801-561;;018-619-035-365-329;;144-771-508-631-303;;021-303-513-312-457;;082-407-940-246-756;;001-295-053-045-630;;003-945-587-628-958;;044-967-534-766-438;;070-288-833-629-511;;011-417-572-174-966;;073-083-375-277-650;;047-151-254-592-223;;071-203-597-321-89X;;044-035-812-382-291;;000-490-542-979-773;;118-165-861-266-025;;006-777-221-107-145;;024-942-339-677-185;;028-173-531-593-258;;010-527-299-479-857;;048-818-956-556-605;;007-586-797-021-998;;050-894-970-309-527;;007-125-857-735-043;;072-147-847-582-068;;061-306-723-284-719;;042-721-069-995-979;;036-057-016-604-137;;020-901-478-172-439;;004-270-281-820-748;;006-827-196-410-566;;024-164-409-489-414;;023-372-015-104-518;;018-213-517-504-168;;045-127-623-209-312;;057-179-039-883-279;;070-817-926-177-287;;018-029-125-377-147;;070-817-926-177-287;;119-929-227-576-310;;004-508-635-362-48X;;002-647-445-180-017;;071-389-598-868-449;;062-706-680-618-238;;001-752-865-559-996;;077-929-839-377-185;;012-394-910-659-139;;004-315-321-788-495;;044-967-534-766-438,10.1109/iembs.1992.594708;;2659493;;10.1109/10.29455;;10.1227/00006123-198205000-00006;;7048125;;10.1097/00006123-198205000-00006;;10.1016/0165-0270(83)90048-1;;6688280;;215935;;10.1227/00006123-197805000-00006;;1983879;;10.1016/0090-3019(91)90198-i;;7000984;;10.3171/jns.1980.53.2.0256;;10.1007/bf00369080;;6986582;;10.2214/ajr.127.1.167;;180828;;335812;;10.1007/978-3-7091-8482-0_15;;6991649;;10.3171/jns.1980.52.6.0794;;354336;;10.1007/bf01774748;;374688;;10.3171/jns.1979.50.6.0715;;385549;;10.1097/00004424-197907000-00006;;10.1136/jnnp.47.6.590;;pmc1027856;;6330310;;10.1109/robot.1992.220031;;7050312;;10.3171/jns.1982.57.4.0491;;6341870;;10.1227/00006123-198303000-00005;;10.1097/00006123-198303000-00005;;10.1109/tpami.1987.4767965;;21869429;;2925925;;10.1097/00004728-198903000-00030;;10.1097/00004728-199005000-00018;;2335610;;7110573;;10.1227/00006123-198207010-00016;;10.1097/00006123-198207010-00016;;6367649;;10.1159/000101264;;3554569;;10.1016/0090-3019(87)90152-2;;10.3171/jns.1982.57.3.0390;;6284890;;3350540;;10.1109/10.1353;;7027934;;10.1159/000102252;;10.1109/iembs.1992.5761358;;10.1007/978-3-642-66959-0_187;;10.1007/bf00395371;;370681;;6985653;;10.3171/jns.1980.52.1.0021;;10.1109/robot.1987.1087758;;2672708;;10.1007/978-3-7091-9029-6_26;;10.1159/000128741;;3042426;;1871575;;10.1055/s-2007-1003974;;2541602;;10.1007/bf01772816;;10.1227/00006123-199301000-00008;;10.1097/00006123-199301000-00008;;8421557;;10.1159/000100241;;2080355;;3531430;;10.3171/jns.1986.65.4.0545;;10.3171/jns.1978.49.1.0071;;660270;;6384814;;10.1227/00006123-198409000-00018;;1446455;;10.1109/robot.1992.220225;;10.1097/00003086-199212000-00010;;10.1097/00004728-198901000-00004;;2492038;;360096;;10.1227/00006123-197809000-00005;;10.1227/00006123-198010000-00011;;6255367;;10.3171/jns.1983.59.4.0673;;6350539;;483146;;10.1097/00006123-198207010-00008;;10.1227/00006123-198207010-00008;;7050762;;10.3171/jns.1977.46.6.0740;;192856;;10.1117/12.956295;;87000;;10.1148/131.3.681;;3251168;;10.1007/bf01741417;;365094;;10.1159/000102413;;745758;;10.1007/978-3-642-66959-0_178;;10.1007/bf00395362;;10.2214/ajr.125.4.961;;1211526;;10.1007/978-3-642-52311-3_76;;6990697;;10.1007/bf01400939;;10.1007/978-3-642-52311-3_76;;10.1148/radiology.172.3.2788893;;2788893;;1016819;;2013785;;10.3171/jns.1991.74.5.0845;;7422110;;10.1227/00006123-198008000-00006;;7043765;;10.1016/0090-3019(82)90117-3;;3005528;;10.3171/jns.1986.64.3.0427;;10.1016/0090-3019(81)90158-0;;9760963;;6367646;;10.1159/000101261;;10.1007/bf01406196;;6344558;;3350540;;10.1109/10.1353,"Cinquin et al., ""Computer Assisted Medical Interventions,"" The 1st Workshop on Domestic Robotics-The 2nd Workshop on Medical & Healthcare Robotics, Sep. 5-7, 1989, pp. 63-65.;;Cinquin et al., ""IGOR: Image Guided Operating Robot, Methodololgy, Applications,"" IEEE EMBS, Paris, 1992, pp. 1-2.;;Cinquin et al., ""IGOR: Image Guided Robot. Methodology, Applications,"" IEEE EMBS (1992).;;Dever et al., ""OR Role Seen for 3-D Imaging,"" Radiology Today, Feb. 1991, 2 pages.;;Foley et al., ""Image-Guided Intraoperative Spinal Localization,"" Intraoperative Neuroprotection, Chapter 19, 1996, pp. 325-340.;;Friets et al., ""A Frameless Sterotaxic Operating Microscope for Neurosurgery,"" IEEE Transactions on Biomedical Engineering, vol. 36, No. 6, Jun. 1989, pp. 608, 613-617.;;Gildenberg et al., ""Calculation of Stereotactic Coordinates from the Computed Tomographic Scan,"" Neurosurgery, vol. 10, No. 5, May 1982, pp. 580-586.;;Glaser et al., ""The Image-Combining Computer Microscope-an Interactive Instrument for Morphometry of the Nervous System,"" Journal of Neuroscience Methods, vol. 8, 1983, pp. 17-32.;;Gleason et al., ""Stereotactic Localization (with Computerized Tomographic Scanning), Biopsy, and Radiofrequency Treatment of Deep Brain Lesions,"" Neurosurgery, vol. 2, No. 3, 1978, pp. 217-222.;;Gomez et al., ""Transcranial Doppler Ultrasound Following Closed Head Injury: Vasospasm or Vasoparalysis?,"" Surg. Neurol., vol. 35, No. 1, Jan. 1991, pp. 30-35.;;Gonzalez et al., ""Digital Image Processing,"" Second Edition, Addison-Wesley Publishing Company, 1987, pp. 52-54.;;Gouda et al., ""New Frame for Stereotaxic Surgery,"" J. Neurosurg, vol. 53, Aug. 1980, pp. 256-259.;;Greitz, et al., ""Head Fixation System for Interation of Radiodiagnostic and Therapeutic Procedures,"" Neuroradiology, vol. 19, No. 1, 1980, pp. 1-6.;;Bergstrom, et al., ""Stereotaxic Computed Tomography,"" Am. J. Roentgenol, 127:167-170, 1976, pp. 167-170.;;Birg, et al., ""A Computer Programme System for Stereotactic Neurosurgery,"" Acta Neurochirurgica Suppl., 24, 1977, 99-108.;;Bo�thius et al., ""Stereotaxic Computerized Tomography with a GE 8800 Scanner,"" J. Neurosurg, vol. 52, Jun. 1980, pp. 794-800.;;Boethius et al., ""Stereotactic Biopsies and Computer Tomography in Gliomas,"" Acta Neurochirurgica, vol. 40, Fasc. 3-4, 1978, pp. 223-232.;;Brown, ""A Computeried Tomography-Computer Graphics Approach to Stereotaxic Localization,"" J. Neurosurg, vol. 50, No. 6, 1979, pp. 715-720.;;Brown, ""A Stereotactic Head Frame for Use with CT Body Scanners,"" Inv. Radiol., vol. 14, No. 4, Jul. 1979, pp. 300-304.;;Bullard et al., ""C.T.-Guided Stereotactic Biopsies Using a Modified Frame and Gildenberg Techniques,"" Neurology, Neurosurgery, and Psychiatry, vol. 47, 1984, pp. 590-595.;;Byte Magazine, ""3-D Digitizer Captures the World,"" 1990, p.43.;;Castleman, ""Digital Image Processing,"" Prentice Hall, Inc., p. 364-369 (1979).;;Champleboux et al., ""Accurate Calibration of Cameras and Range Imaging Sensors: the NPBS Method,"" 1992, 6 pages.;;Champleboux, ""Ulilisation De Fonctions Splines Pour La Mise Au Poit d'Un Capteur Tridimension Sans Contact,"" These, Docteur de L'Univerite' Joseph Fourie Grenoble, 1991.;;Adams et al., ""Medical Imaging. Computer-Assisted Surgery,"" IEEE Computer Graphics & Applications, 1990, pp. 43-51.;;Adams et al., ""Aide Au Reperage Tridimensionnel Pour La Chirurgie De La Base Du Crane,"" Innov. Tech. Biol. Med., vol. 13, No. 4, pp. 409-424 (1992).;;Adams et al., ""Computer-Assisted Surgery,"" Medical Imaging, IEEE, pp. 43-51 (May 1990).;;Afshar et al., ""A Three-Dimensional Reconstruction of the Human Brain Stem,"" J. Neurosurg., vol. 57, No. 4, Oct. 1982, pp. 491-495.;;Apuzzo et al., ""Computed Tomographic Guidance Stereotaxis in the Management of Intracranial Mass Lesions,"" Neurosurgery, vol. 12, No. 3, 1983, pp. 277-285.;;Arun et al., ""Transactions on Pattern Analysis and Machine Intelligence,"" IEEE, vol. PAMI-9, No. 5, 1987, pp. 698-770.;;Awwad et al., ""Post-Traumatic Spinal Synovial Cyst with Spondylolysis CT Features,"" Journal of Computer Assisted Tomography, vol. 13, No. 2, Mar./Apr. 1989, pp. 334-337.;;Awwad et al., ""MR Imaging of Lumbar Juxtaarticular Cysts,"" Journal of Computer Assisted Tomography, vol. 14, No. 3, May/Jun. 1990, pp 415-417.;;Bajcsy et al, ""Computerized Anatomy Atlas of the Human Brain,"" Proceedings of the Second Annual Conference & Exhibition of the National Computer Graphics Association, Inc., 1981, pp. 435-441.;;Batnitzky, et al., ""Three-Dimensional Computer Reconstructions of Brain Lesions from Surface Contours Provided by Computed Tomography: A Prospectus,"" Neurosurgery, vol. 11, No. 1, Jul. 1982, pp. 73-84.;;Van Buren et al., ""A Multipurpose CT-Guided Stereotactic Instrument of Simple Design,"" Applied Neurophysiology, Jan.-Aug. 1983, pp. 211-216.;;Watanabe et al., ""Three Dimensional Digitizer (Neuronavigator): New Equipment for Computed Tomography-Guided Stereotaxic Surgery,"" 27 Surg. Neurol, 1987, pp. 543-547.;;Watanabe, ""Neuronavigator,"" Igaku-no-Ayumi, vol. 137, No. 6, May 10, 1986 (With Translation).;;Wolfe, ""The Infrared Handbook,"", Office of Naval Research, Department of the Navy, Washington, D.C., pp. 22-63 through 22-77 (1978).;;Yeates et al., ""Simplified and Accurate CT-Guided Needle Biopsy of Central Nervous System Lesions,"" Journal of Neurosurgery, vol. 57, No. 3, Sep. 1982, pp. 390-393.;;Yosugi et al., ""An Articulated Neurosurgical Navigation System Using MRI and CT Images,"" (Feb. 1988) pp. 147-152.;;Rosenbaum et al., ""Computerized Tomography Guided Stereotaxis: A New Approach,"" Applied Neurophysiology, vol. 43, No. 3-5, Jan. 1980, pp. 172-173.;;Sautot et al., ""Computer Assisted Spine Surgery: A First Step Toward Clinical Application in Orthopaedics,"" IEEE, 1992.;;Scarabin et al., ""Stereotaxic Exploration in 200 Supratentorial Brain Tumors,"" Neuroradiology, vol. 16, Jun. 4-10, 1978, pp. 591-593.;;Shelden et al., ""Development of a Computerized Microstereotaxic Method for Localization and Removal of Minute CNS Lesions Under Direct 3-D Vision,"" J. Neurosurg, vol. 52, Jan. 1980, pp. 21-27.;;Shiu et al., ""Finding the Mounting Position of a Sensor by Solving a Homogeneous Transform Equation of Form AX=XB,"" IEEE, vol. 3, 1987, pp. 1666-1671.;;Smith et al., ""Multimodality Image Analysis and Display Methods for Improved Tumor Localization in Stereotactic Neurosurgery,"" Annual Conference for the IEEE Engineering in Medicine and Biology Society, vol. 13, No. 1, 1991, p. 210.;;Valentino et al., ""Three-Dimensional Visualization of Human Brain Structure-Function Relationships,"" The Journal of Nuclear Medicine, 1989, Posterboard 1136, vol. 30, No. 10, p. 1747.;;Pixsys, Inc., ""SACDAC User's Guide, Version 2e,"" Mar. 1989, pp. 0-1 through 5-3.;;Pixsys, Inc., ""Design Aide"" Mar. 1989, 5 unnumbered pages.;;Pixsys, Inc., ""Offset Probe for Science Accessories' GP-8-3D digitizer"" (Dec. 1987), one page.;;Reinhardt et al., ""CT-Guided 'Real Time' Stereotaxy,"" Acta Neurochirurgica Suppl. 46, 1989, 107-108.;;Reinhardt et al., ""A Computer Assisted Device for the Intra Operate CT-Correlated Localization of Brain Tumors,"" 1988 Eur. Surg. Res. 20:52-58.;;Reinhardt et al., ""Mikrochirugicshe Entfurnung tifliegender Gefabetamibetabildungen mit Hilfe der Sonar-Stereometrie,"" Ultraschall in Med. 12, 1991, pp. 80-84.;;Reinhardt,""Surgery of Brain Neoplasms Using 32-P Tumor Marker"" Acta Neurochir, 1989, 97:89-94.;;Reinhardt, ""Sonic Stereometry in Microsurgical Procedures for Deep-Seated Brain Tumors and Vascular Malformations,"" Neurosurgery, vol. 32, No. 1, Jan. 1993, pp. 51-57.;;Reinhardt et al., ""Interactive Sonar-Operated Device for Stereotactic and Open Surgery,"" Stereotac Funct Neurosurg, 1990, 54+55:393-397.;;Roberts et al., ""A Frameless Sterotaxic Integration of Computerized Tomographic Imaging and the Operating Microscope,"" J. Neurosurg., vol. 65, Oct. 1986, pp. 545-549.;;O'Leary et al., ""Localization of Vertex Lesions Seen on CT Scan,"" 1978, pp. 71-74.;;Patil, ""Computed Tomography Plane of the Target Approach in Computed Tomographic Stereotaxis,"" Neurosurgery, vol. 15, No. 3, Sep. 1984, pp. 410-414.;;Paul et al., ""Development of a Surgical Robot for Cementless Total Hip Arthroplasty,"" Clinical Orthopaedics, No. 285, Dec. 1992, pp. 57-66.;;Pelizzari et al., ""Accurate Three-Dimensional Registration of CT, PET and/or MR Images of the Brain,"" Journal of Computer Assisted Tomography, 13(1):20-26, Jan./Feb. 1989, pp. 20-26.;;Pelizzari et al., 3D Patient/Image Registration: Application to Radiation Treatment Planning, Medical Physics, vol. 18, No. 3, May/Jun. 1991, p. 612.;;Pelizzari et al., ""Three Dimensional Correlation of PET, CT and MRI Images,"" The Journal of Nuclear Medicine, Abstract Book, 34th Annual Meeting, vol. 28, No. 4, Poster Session No. 528, 1987, p. 682.;;Pelizzari et al., ""Interactive 3D Patient-Image Registration,"" Lecture Notes in Computer Science, Springer-Verlag, Wye, UK, Information Procession in Medical Imaging, Proceedings, pp. 132-141 (Jul. 1991).;;Penn et al., ""Stereotactic Surgery with Image Processing of Computerized Tomographics Scans,"" Neurosurgery, vol. 3, No. 2, Sep./Oct. 1978, pp. 157-163.;;Perry et al., ""Computed Tomography-Guided Stereotactic Surgery: Conception and Development of a New Stereotactic Methodology,"" Neurosurgery, vol. 7, No. 4, Oct. 1980, pp. 376-381.;;Picard et al., ""The First Human Stereotaxic Apparatus,"" J. Neurosurg., vol. 59, Oct. 1983, pp. 673-676.;;Piskun et al., ""A Simplified Method of CT Assisted Localization and Biopsy of Intracranial Lesions,"" Surgical Neurology, vol. 11, Jun. 1979, pp. 413-417.;;Mackay et al., ""Computed Tomography-Directed Stereotaxy for Biopsy and Interstitial Irradiation of Brain Tumors: Technical Note,"" Neurosurgery, vol. 11, No. 1, 1982, pp. 38-42.;;Maroon et al., ""Intracranial Biopsy Assisted by Computerized Tomography,"" J. Neurosurg., vol. 46, No. 6, Jun. 1977, pp. 740-744.;;Mazier et al., ""Computer Assisted Interventionist Imaging: Application to the Vertebral Column Surgery,"" IEEE, vol. 12, No. 1, 1990, pp. 430-431.;;Mazier et al., ""Computer Assisted Vertebral Column Surgery: Application to the Spinal Pedicle Fixation,"" Innov. Tech. Biol. Med., vol. 11, No. 5, 1990, pp. 559-565.;;Mazier et al., ""Chirurgie De La Colonne Vertebrale Assiste Par Ordinateur: Application Au Vissage Pediculaire,"" Innov. Tech. Biol. Med., vol. 11, No. 5, pp. 559-566, 1990.;;Mesqui et al., ""Real-Time, Noninvasive Recording and Three-Dimensional Display of the Functional Movements of an Arbitrary Mandible Point,"" Proceedings, vol. 602, Biostereometrics '85, Dec. 3-6, 1985, Cannes, France, SPIE, vol. 602, pp. 77-84.;;Moran et al., ""Central Nervous System Lesions Biopsied or Treated by CT-guided Needle Placement,"" Radiology, vol. 131, No. 3, Jun. 1979 pp, 681-686.;;Mosages et al., ""A New Imaging Method for Intraoperative Therapy control in Skull-Base Surgery,"" 1988.;;Mundinger et al., ""Computer-Assisted Stereotactic Brain Operations by Means Including Computerized Axial Tomography,"" Applied Neurophysiology, vol. 41, No. 1-4, 1978, pp. 169-182.;;Mundinger et al., ""Treatment of Small Cerebral Gliomas with CT-Aided Stereotaxic Curietherapy,"" Neuroradiology, vol. 16, 1978, pp. 564-567.;;Norman et al., ""Localization with the EMI Scanner,"" The American Journal fo Roentgenology, Radium Therapy and Nuclear Medicine, vol. 125, No. 4, Dec. 1975, pp. 961-964.;;Lavalee et al, ""Computer Assisted Medial Interventions,"" NATO AISI vol. F60, 1990, pp. 301-312.;;Lavalee et al., ""Ponction Assistee Par Ordinateur"" (""Computer Assisted Puncture""), afcet INRIA, 1987, pp. 439-449.;;Lavalee et al., ""Matching 3-D Smooth Surfaces with Their 2-D Projections Using 3-D Distance Maps,"" SPIE, vol. 1570, Geometric Methods in Computer Vision, 1991, pp. 322-336.;;Lavalee, ""A New System for Computer Assisted Neurosurgery,"" IEEE Engineering in Medicine & Biology Society 11th Annual International Conference, 1989.;;Lavalee et al., ""Computer Assisted Driving of a Needle into the Brain,"" Computer Assisted Radiology 1989, pp. 416-420.;;Lavalee et al., ""Computer Assisted Puncture,"" pp. 439-449 (Nov. 16-20, 1987).;;Leksell et al., ""Stereotaxis and Tomography, a Technical Note,"" Acta Neurrochirurgica, vol. 52, Fasc 1-2, 1980, pp. 1-7.;;Lemke, et al., ""Computer Assisted Driving of a Needle into the Brain,"" Computer Assisted Radiology Magazine, pp. 416-420 (1989).;;Levin et al., ""Multimodality 3-D View of the Brain Created from MRI and PET Scans,"" SMRI 1989: Seventh Annual Meeting Program and Abstracts, vol. 7, Supplement 1, p. 89.;;Levin et al., ""The Brain: Integrated Three-Dimensional Display of MR and PET Images,"" Radiology, 1989, vol. 172, No. 3, pp. 783-789.;;Levinthal et al., ""Technique for Accurate Localization with the CT Scanner,"" Bulletin of the Los Angeles Neurological Societies, vol. 41, No. 1, Jan. 1976, pp. 6-8.;;Lunsford, ""Innovations in Stereotactic Technique Coupled with Computerized Tomography,"" Contemporary Neurosurgery, 1982, pp. 1-6.;;Kato et al., ""A Frameless, Armless Navigational System for Computer Assisted Neurosurgery"" 74 J. Neurosurg., 1991, pp. 845-849.;;Kaufman, ""New Head-Positioning System for Use with Computed Tomographic Scanning,"" Neurosurgery, vol. 7, No. 2, Aug. 1980, pp. 147-149.;;Kelly et al., ""A Microstereotactic Approach to Deep-Seated Arteriovenous Malformations,"" Surgical Neurology, vol. 17, No. 4, Apr. 1982, 260-262.;;Kelly et al., ""Computer-Assisted Stereotaxic Laser Resection of Intra-Axial Brain Neoplasma,"" J. Neurosurg., vol. 64, Mar. 1976, pp. 427-439.;;Kelly et al., ""A Stereotactic Approach to Deep-Seated Central Nervous System Neoplasms Using the Carbon Dioxide Laser,"" Surgical Neurology, vol.15, No. 5, May 1981, pp. 331-334.;;Kelly et al., ""Stereotactic CT Scanning for the Biopsy of Intracranial Lesions and Functional Neurosurgery,"" Applied Neurophysiology, vol. 46, Dec. 1983, pp. 193-199.;;Kelly et al., ""Precision Resection of Intra-Axial CNS Lesions by CT-Based Stereotactic Craniotomy and Computer Monitored CO2 Laser,"" Acta Neurochirurgica, vol. 68, Fasc. 1-2, 1983, pp. 1-9.;;Kosugi et al., ""An Articulated Neurosurgical Navigation System Using MRI and CT Images,"" IEEE Transaction on Biomedical Engineering, vol. 35, No. 2, Feb. 1988, pp. 147-152.",EXPIRED
3,WO,A1,WO 2013/086497 A1,145-955-534-841-067,2013-06-13,2013,US 2012/0068753 W,2012-12-10,US 201161569071 P,2011-12-09,ELECTRODE CLAMP,A clamp for clamping a brain electrode extending through a burr hole formed in a skull of a patient includes a first retainer element having a flange extending around an outer end for engaging an outer table of the skull and a jaw extending across the inner end. The clamp includes a second retainer element shaped complementarily to the first retainer element. The second retainer element has a flange extending around an outer end for engaging the outer table of the skull and a jaw extending across the inner end for cooperating with the jaw of the first retainer to clamp the electrode. The clamp has a cap for maintaining the jaws of the first and second retainer elements in cooperation to clamp the electrode adjacent an inner table of the skull. The cap includes an opening for receiving the electrode to hold the electrode against movement.,UNIV SAINT LOUIS,BUCHOLZ RICHARD D,,https://lens.org/145-955-534-841-067,Patent Application,yes,6,0,3,3,0,A61N1/0539;;A61N1/0539;;A61B2090/103;;A61B2090/103;;A61N1/0534,A61N1/05,,0,0,,,,PENDING
