33,CA,C,CA 2161430 C,159-796-018-159-216,2001-07-03,2001,CA 2161430 A,1994-04-25,US 5307693 A;;US 9404530 W,1993-04-26,SYSTEM AND METHOD FOR INDICATING THE POSITION OF A SURGICAL PROBE,"This is a system for determining a position of a probe (302) relative to as object such as a head of a body of a patient. The head includes a surface such as a forehead having a contour. Cross-sectional imag es of the head are scanned and stored as a function of the forehead contour. If the forehead contour does not appear in the scan images , then the position of the forehead contour relative to the scan images is determined with an optical scanner (380) and ring (590). During surgery, the optical scanner (380) also determines the position of the tip of the forehead relative to the ring (590). An easy (300) for receiving radiation emitted from the probe and from the ring generates signals indicating the position of the tip (301) of the probe (302) relative to the ring (590). A stereo-tactic imaging system (324) generates and displays an image of the head corresponding to the measured position of the tip (301) of the probe (302).",,BUCHOLZ RICHARD D,,https://lens.org/159-796-018-159-216,Granted Patent,no,0,0,22,90,0,A61B5/0064;;A61B5/0073;;A61B5/055;;A61B5/1077;;A61B6/12;;A61B6/501;;A61B6/5247;;A61B8/00;;A61B8/5238;;A61B8/0808;;A61B2090/3983;;A61B90/10;;A61B90/36;;A61B2090/373;;A61B2034/2055;;A61B2034/2063;;A61B2034/2068;;A61B2034/2072;;A61B2090/363;;A61B2090/3945;;A61B2090/3979;;A61B2090/3995;;A61B34/20;;A61B2090/364;;A61B90/14;;A61B2090/061;;A61B2034/105;;A61B2034/2065;;A61B2090/378;;A61B90/39;;A61B2090/3925;;A61B2090/3929;;A61B2090/3954;;A61B5/061;;A61B5/0073;;A61B5/1077;;A61B6/5247;;A61B8/00;;A61B8/5238;;A61B5/0064;;A61B6/501;;A61B5/055;;A61B6/12;;A61B8/0808;;A61B2034/2068;;A61B2090/3983;;A61B2090/363;;A61B2090/378;;A61B2034/2063;;A61B2090/3945;;A61B2034/2072;;A61B2090/3979;;A61B2090/373;;A61B90/10;;A61B2090/364;;A61B2034/2055;;A61B2034/2065;;A61B2090/061;;A61B2090/3925;;A61B90/36;;A61B2090/3995;;A61B2034/105;;A61B34/20;;A61B90/14;;A61B2090/3929;;A61B2090/3954;;A61B90/39;;A61B5/061;;A61B5/702,A61B5/00;;A61B5/055;;A61B5/06;;A61B5/107;;A61B6/00;;A61B6/12;;A61B8/00;;A61B17/88;;A61B19/00,,0,0,,,,EXPIRED
34,WO,A2,WO 2000/072180 A2,181-059-636-144-027,2000-11-30,2000,US 0013965 W,2000-05-22,US 13505799 P,1999-05-20,NETWORKING INFRASTRUCTURE FOR AN OPERATING ROOM,"A networking infrastructure for an operating room, comprising a plurality of medical devices, each device of which is connected through a single communication channel to the network, wherein each device may be controlled through a local interface, or through a remote interface available through the network. Furthermore, the networking infrastructure operates in robust manner with respect to the removal of a communication channel to the network associated with the removal of a medical device from the network, or with respect to the addition of a communication channel to the network associated with the addition of a medical device to the network.",UNIV ST LOUIS,BUCHOLZ RICHARD D,,https://lens.org/181-059-636-144-027,Patent Application,yes,0,12,4,4,0,G16H40/20;;G16H40/67;;G16H20/40;;G16H40/20;;G16H20/40;;G16H40/67,G06F19/00,,0,0,,,,PENDING
35,DE,T2,DE 69132412 T2,020-771-106-102-808,2001-03-01,2001,DE 69132412 T,1991-10-17,US 60075390 A;;US 9107755 W,1990-10-19,LOKALISIERUNGSSYSTEM FÜR EINE CHIRURGISCHE SONDE ZUR ANWENDUNG AM KOPF,"The system for determining a position of a probe relative to an object such as a head of a body patient. The head includes a surface such as a forehead having a contour. The head is placed in a cradle equipped with an arc. The cross-sectional images of the head are determined relative to the arc. A hand-held unit optically scans the forehead and the arc. During scanning to generate the cross-sectional images, the optical scanner is used to determine the position of the forehead relative to the cradle. During surgery, the optical scanner also determines the position of the forehead relative to a base ring. An array for receiving radiation emitted from the probe and from the base ring generates signals indicating the position of the tip of the probe relative to the base ring. A stereotactic imaging system selects and display the image of the head closest to the measured position of the tip of the probe.",UNIV ST LOUIS,BUCHOLZ RICHARD D,,https://lens.org/020-771-106-102-808,Granted Patent,no,0,0,31,90,0,A61B5/0064;;A61B5/0073;;A61B5/055;;A61B5/06;;A61B5/1077;;A61B6/12;;A61B6/501;;A61B6/5247;;A61B8/00;;A61B8/5238;;A61B2017/00738;;B82Y15/00;;A61B8/0808;;A61B2090/3983;;A61B90/10;;A61B90/36;;A61B2034/2055;;A61B2034/2068;;A61B2034/2072;;A61B2090/3788;;A61B2090/363;;A61B2090/3945;;A61B34/20;;A61B2090/364;;A61B90/14;;A61B2034/105;;A61B2090/378;;A61B90/39;;A61B2090/3954;;A61B90/10;;A61B5/0073;;A61B6/12;;A61B6/501;;A61B8/00;;A61B8/5238;;A61B5/0064;;B82Y15/00;;A61B5/06;;A61B5/1077;;A61B6/5247;;A61B2017/00738;;A61B8/0808;;A61B2034/2068;;A61B2090/3945;;A61B2090/363;;A61B2034/2055;;A61B2090/3788;;A61B2090/3983;;A61B2090/3954;;A61B90/10;;A61B90/36;;A61B2034/2072;;A61B34/20;;A61B2090/378;;A61B2090/364;;A61B2034/105;;A61B90/39;;A61B90/14,A61B5/00;;A61B5/055;;A61B5/06;;A61B5/107;;A61B6/00;;A61B6/12;;A61B8/00;;A61B17/88;;A61B19/00,,0,0,,,,EXPIRED
36,EP,A4,EP 2568895 A4,047-648-020-125-917,2015-03-25,2015,EP 11781036 A,2011-05-03,US 201113014473 A;;US 34933110 P;;US 33304210 P;;US 2011/0035009 W,2010-05-10,DISTRACTOR,,UNIV ST LOUIS,BUCHOLZ RICHARD D,,https://lens.org/047-648-020-125-917,Search Report,no,6,0,7,7,0,A61B17/0293;;A61B17/0293;;A61B17/3439;;A61B17/3439,A61B17/34,,1,0,,,See also references of WO 2011143011A1,DISCONTINUED
37,WO,A1,WO 2011/143011 A1,143-224-369-320-628,2011-11-17,2011,US 2011/0035009 W,2011-05-03,US 201113014473 A;;US 34933110 P;;US 33304210 P,2010-05-10,DISTRACTOR,"A surgical distractor for distracting tissue of a patient to access structure underlying the tissue of the patient. The distractor includes a tube having a distal end adapted for insertion in tissue, a proximal end opposite the distal end, an exterior surface adapted for contacting the tissue, and an interior surface opposite the exterior surface defining a hollow interior extending between the distal end and the proximal end for accessing structure underlying the tissue when the distal end is inserted in the tissue. The distractor is adjustable from a reduced configuration, in which the tube has a reduced width sized for inserting the distal end in the tissue, and an expanded configuration, in which the tube has an expanded width greater than the reduced width sized to provide the hollow interior with a size sufficient for accessing the structure underlying the tissue.",UNIV ST LOUIS;;BUCHOLZ RICHARD D,BUCHOLZ RICHARD D,,https://lens.org/143-224-369-320-628,Patent Application,yes,5,0,7,7,0,A61B17/0293;;A61B17/0293;;A61B17/3439;;A61B17/3439,A61B17/34,,1,0,,,See also references of EP 2568895A4,PENDING
38,EP,A2,EP 1830521 A2,152-205-363-499-762,2007-09-05,2007,EP 07103539 A,2007-03-05,US 77866406 P,2006-03-03,System and Method for Communicating Data for a Hospital,"A system used by a local health care facility to communicate with a remote health care facility via a data communication network. A controller at the local health care facility controls communication on the data communication network, including data communicated between the local health care facility and the remote health care facility. One or more devices located at the local health care facility transmit data to the remote health care facility via the data communication network. Additionally, the one or more devices receive control data via the data communication network and perform one or more functions in response to the received control data.
",UNIV ST LOUIS,BUCHOLZ RICHARD D,,https://lens.org/152-205-363-499-762,Patent Application,yes,0,5,4,4,0,G06Q10/10;;G06Q10/10;;G16H40/67;;G16H40/67;;H04L67/025;;H04L67/025,H04L12/28;;G06F19/00;;G06Q10/00;;G06Q50/00,,0,0,,,,DISCONTINUED
39,EP,A2,EP 0997109 A2,165-347-272-033-209,2000-05-03,2000,EP 99124254 A,1994-04-25,EP 94916567 A;;US 5307693 A,1993-04-26,Indicating the position of a surgical probe,"This is a system for determining a position of a probe (302) relative to an object such as a head of a body of a patient. The head includes a surface such as a forehead having a contour. Cross-sectional images of the head are scanned and stored as a function of the forehead contour. If the forehead contour does not appear in the scan images, then the position of the forehead contour relative to the scan images is determined with an optical scanner (380) and ring (590). During surgery, the optical scanner (380) also determines the position of the tip of the forehead relative to the ring (590). An array (300) for receiving radiation emitted from the probe and from the ring generates signals indicating the position of the tip (301) of the probe (302) relative to the ring (590). A stereo-tactic imaging system (324) generates and displays an image of the head corresponding to the measured position of the tip (301) of the probe (302).",UNIV ST LOUIS,BUCHOLZ RICHARD D,,https://lens.org/165-347-272-033-209,Patent Application,yes,0,0,22,90,0,A61B5/0064;;A61B5/0073;;A61B5/055;;A61B5/1077;;A61B6/12;;A61B6/501;;A61B6/5247;;A61B8/00;;A61B8/5238;;A61B8/0808;;A61B2090/3983;;A61B90/10;;A61B90/36;;A61B2090/373;;A61B2034/2055;;A61B2034/2063;;A61B2034/2068;;A61B2034/2072;;A61B2090/363;;A61B2090/3945;;A61B2090/3979;;A61B2090/3995;;A61B34/20;;A61B2090/364;;A61B90/14;;A61B2090/061;;A61B2034/105;;A61B2034/2065;;A61B2090/378;;A61B90/39;;A61B2090/3925;;A61B2090/3929;;A61B2090/3954;;A61B5/061;;A61B5/0073;;A61B5/1077;;A61B6/5247;;A61B8/00;;A61B8/5238;;A61B5/0064;;A61B6/501;;A61B5/055;;A61B6/12;;A61B8/0808;;A61B2034/2068;;A61B2090/3983;;A61B2090/363;;A61B2090/378;;A61B2034/2063;;A61B2090/3945;;A61B2034/2072;;A61B2090/3979;;A61B2090/373;;A61B90/10;;A61B2090/364;;A61B2034/2055;;A61B2034/2065;;A61B2090/061;;A61B2090/3925;;A61B90/36;;A61B2090/3995;;A61B2034/105;;A61B34/20;;A61B90/14;;A61B2090/3929;;A61B2090/3954;;A61B90/39;;A61B5/061;;A61B5/702,A61B5/00;;A61B5/055;;A61B5/06;;A61B5/107;;A61B6/00;;A61B6/12;;A61B8/00;;A61B17/88;;A61B19/00,,0,0,,,,EXPIRED
40,EP,A3,EP 1830521 A3,000-357-300-533-354,2008-12-24,2008,EP 07103539 A,2007-03-05,US 77866406 P,2006-03-03,System and Method for Communicating Data for a Hospital,"A system used by a local health care facility to communicate with a remote health care facility via a data communication network. A controller at the local health care facility controls communication on the data communication network, including data communicated between the local health care facility and the remote health care facility. One or more devices located at the local health care facility transmit data to the remote health care facility via the data communication network. Additionally, the one or more devices receive control data via the data communication network and perform one or more functions in response to the received control data.
",UNIV ST LOUIS,BUCHOLZ RICHARD D,,https://lens.org/000-357-300-533-354,Search Report,yes,3,0,4,4,0,G06Q10/10;;H04L67/025;;G16H40/67;;H04L67/025;;G06Q10/10;;G16H40/67,G06F19/00;;H04L12/28;;G06Q10/00;;G06Q50/00,,0,0,,,,DISCONTINUED
41,US,A1,US 2006/0241400 A1,088-300-788-433-255,2006-10-26,2006,US 42227006 A,2006-06-05,US 42227006 A;;US 6806402 A;;US 45769999 A;;US 24380499 A;;US 47756195 A;;US 5307693 A;;US 90909792 A;;US 85898092 A;;US 60075390 A;;US 9107745 W,1990-10-19,Method of determining the position of an instrument relative to a body of a patient,"A system for determining a position of a probe relative to an object such as a head of a body of a patient. The head includes a surface such as a forehead having a contour. Cross sectional images of the head are scanned and stored as a function of the forehead contour. If the forehead contour does not appear in the scan images, then the position of the forehead contour relative to the scan images is determined with an optical scanner and a ring. During surgery, the optical scanner also determines the position of the forehead relative to the ring. An array for receiving radiation emitted from the probe and from the ring generates signals indicating the position of the tip of the probe relative to the ring. A stereotactic imaging system generates and displays an image of the head corresponding to the measured position of the tip of the probe. The system may also display scan images from different scanning technologies which scan images correspond to the same position in the head.",UNIV ST LOUIS,BUCHOLZ RICHARD D,,https://lens.org/088-300-788-433-255,Patent Application,yes,99,27,22,90,0,A61B5/0064;;A61B5/0073;;A61B5/055;;A61B5/1077;;A61B6/12;;A61B6/501;;A61B6/5247;;A61B8/00;;A61B8/5238;;A61B8/0808;;A61B2090/3983;;A61B90/10;;A61B90/36;;A61B2090/373;;A61B2034/2055;;A61B2034/2063;;A61B2034/2068;;A61B2034/2072;;A61B2090/363;;A61B2090/3945;;A61B2090/3979;;A61B2090/3995;;A61B34/20;;A61B2090/364;;A61B90/14;;A61B2090/061;;A61B2034/105;;A61B2034/2065;;A61B2090/378;;A61B90/39;;A61B2090/3925;;A61B2090/3929;;A61B2090/3954;;A61B5/061;;A61B5/0073;;A61B5/1077;;A61B6/5247;;A61B8/00;;A61B8/5238;;A61B5/0064;;A61B6/501;;A61B5/055;;A61B6/12;;A61B8/0808;;A61B2034/2068;;A61B2090/3983;;A61B2090/363;;A61B2090/378;;A61B2034/2063;;A61B2090/3945;;A61B2034/2072;;A61B2090/3979;;A61B2090/373;;A61B90/10;;A61B2090/364;;A61B2034/2055;;A61B2034/2065;;A61B2090/061;;A61B2090/3925;;A61B90/36;;A61B2090/3995;;A61B2034/105;;A61B34/20;;A61B90/14;;A61B2090/3929;;A61B2090/3954;;A61B90/39;;A61B5/061;;A61B5/702,A61B5/05;;A61B5/00;;A61B5/055;;A61B5/06;;A61B5/107;;A61B6/00;;A61B6/12;;A61B8/00;;A61B17/88;;A61B19/00,600/424;;600/415;;600/414,0,0,,,,DISCONTINUED
42,US,B2,US 8721538 B2,093-761-674-999-018,2014-05-13,2014,US 201113014473 A,2011-01-26,US 201113014473 A;;US 33304210 P;;US 34933110 P,2010-05-10,Distractor,"A surgical distractor for distracting tissue of a patient to access structure underlying the tissue of the patient. The distractor includes a tube having a distal end adapted for insertion in tissue, a proximal end opposite the distal end, an exterior surface adapted for contacting the tissue, and an interior surface opposite the exterior surface defining a hollow interior extending between the distal end and the proximal end for accessing structure underlying the tissue when the distal end is inserted in the tissue. The distractor is adjustable from a reduced configuration, in which the tube has a reduced width sized for inserting the distal end in the tissue, and an expanded configuration, in which the tube has an expanded width greater than the reduced width sized to provide the hollow interior with a size sufficient for accessing the structure underlying the tissue.",BUCHOLZ RICHARD D;;UNIV ST LOUIS,BUCHOLZ RICHARD D,ST. LOUIS UNIVERSITY (2011-03-22),https://lens.org/093-761-674-999-018,Granted Patent,yes,40,17,7,7,0,A61B17/0293;;A61B17/0293;;A61B17/3439;;A61B17/3439,A61B17/02,600/208;;600/206,0,0,,,,INACTIVE
43,EP,A3,EP 0997109 A3,121-203-526-899-872,2000-06-14,2000,EP 99124254 A,1994-04-25,EP 94916567 A;;US 5307693 A,1993-04-26,Indicating the position of a surgical probe,"This is a system for determining a position of a probe (302) relative to an object such as a head of a body of a patient. The head includes a surface such as a forehead having a contour. Cross-sectional images of the head are scanned and stored as a function of the forehead contour. If the forehead contour does not appear in the scan images, then the position of the forehead contour relative to the scan images is determined with an optical scanner (380) and ring (590). During surgery, the optical scanner (380) also determines the position of the tip of the forehead relative to the ring (590). An array (300) for receiving radiation emitted from the probe and from the ring generates signals indicating the position of the tip (301) of the probe (302) relative to the ring (590). A stereo-tactic imaging system (324) generates and displays an image of the head corresponding to the measured position of the tip (301) of the probe (302).",UNIV ST LOUIS,BUCHOLZ RICHARD D,,https://lens.org/121-203-526-899-872,Search Report,yes,5,0,22,90,0,A61B5/0064;;A61B5/0073;;A61B5/055;;A61B5/1077;;A61B6/12;;A61B6/501;;A61B6/5247;;A61B8/00;;A61B8/5238;;A61B8/0808;;A61B2090/3983;;A61B90/10;;A61B90/36;;A61B2090/373;;A61B2034/2055;;A61B2034/2063;;A61B2034/2068;;A61B2034/2072;;A61B2090/363;;A61B2090/3945;;A61B2090/3979;;A61B2090/3995;;A61B34/20;;A61B2090/364;;A61B90/14;;A61B2090/061;;A61B2034/105;;A61B2034/2065;;A61B2090/378;;A61B90/39;;A61B2090/3925;;A61B2090/3929;;A61B2090/3954;;A61B5/061;;A61B5/0073;;A61B5/1077;;A61B6/5247;;A61B8/00;;A61B8/5238;;A61B5/0064;;A61B6/501;;A61B5/055;;A61B6/12;;A61B8/0808;;A61B2034/2068;;A61B2090/3983;;A61B2090/363;;A61B2090/378;;A61B2034/2063;;A61B2090/3945;;A61B2034/2072;;A61B2090/3979;;A61B2090/373;;A61B90/10;;A61B2090/364;;A61B2034/2055;;A61B2034/2065;;A61B2090/061;;A61B2090/3925;;A61B90/36;;A61B2090/3995;;A61B2034/105;;A61B34/20;;A61B90/14;;A61B2090/3929;;A61B2090/3954;;A61B90/39;;A61B5/061;;A61B5/702,A61B5/00;;A61B5/055;;A61B5/06;;A61B5/107;;A61B6/00;;A61B6/12;;A61B8/00;;A61B17/88;;A61B19/00,,0,0,,,,EXPIRED
44,US,B2,US 9457180 B2,027-607-970-905-224,2016-10-04,2016,US 201213709673 A,2012-12-10,US 201213709673 A;;US 201161569071 P,2011-12-09,Electrode clamp,A clamp for clamping a brain electrode extending through a burr hole formed in a skull of a patient. The clamp includes a first retainer element having a flange extending around an outer end for engaging an outer table of the skull and a jaw extending across the inner end. The clamp includes a second retainer element shaped complementarily to the first retainer element. The second retainer element has a flange extending around an outer end for engaging the outer table of the skull and a jaw extending across the inner end for cooperating with the jaw of the first retainer to clamp the electrode. The clamp has a cap for maintaining the jaws of the first and second retainer elements in cooperation to clamp the electrode adjacent an inner table of the skull. The cap includes an opening for receiving the electrode to hold the electrode against movement.,UNIV SAINT LOUIS;;ST LOUIS UNIV,BUCHOLZ RICHARD D,ST. LOUIS UNIVERSITY (2011-12-12),https://lens.org/027-607-970-905-224,Granted Patent,yes,10,6,3,3,0,A61N1/0539;;A61N1/0539;;A61B2090/103;;A61B2090/103;;A61N1/0534,A61N1/05,,2,0,,,"International Search Report for PCT/US2012/68753 dated Feb. 28, 2013, 4 pgs.;;Written Opinion for PCT/US2012/68753 dated Feb. 28, 2013, 5 pgs.",ACTIVE
45,AT,T1,AT E196234 T1,071-946-354-636-341,2000-09-15,2000,AT 91919611 T,1991-10-17,US 60075390 A;;US 9107755 W,1990-10-19,LOKALISIERUNGSSYSTEM FÜR EINE CHIRURGISCHE SONDE ZUR ANWENDUNG AM KOPF,"The system for determining a position of a probe relative to an object such as a head of a body patient. The head includes a surface such as a forehead having a contour. The head is placed in a cradle equipped with an arc. The cross-sectional images of the head are determined relative to the arc. A hand-held unit optically scans the forehead and the arc. During scanning to generate the cross-sectional images, the optical scanner is used to determine the position of the forehead relative to the cradle. During surgery, the optical scanner also determines the position of the forehead relative to a base ring. An array for receiving radiation emitted from the probe and from the base ring generates signals indicating the position of the tip of the probe relative to the base ring. A stereotactic imaging system selects and display the image of the head closest to the measured position of the tip of the probe.",UNIV ST LOUIS,BUCHOLZ RICHARD D,,https://lens.org/071-946-354-636-341,Granted Patent,no,0,0,31,90,0,A61B5/0064;;A61B5/0073;;A61B5/055;;A61B5/06;;A61B5/1077;;A61B6/12;;A61B6/501;;A61B6/5247;;A61B8/00;;A61B8/5238;;A61B2017/00738;;B82Y15/00;;A61B8/0808;;A61B2090/3983;;A61B90/10;;A61B90/36;;A61B2034/2055;;A61B2034/2068;;A61B2034/2072;;A61B2090/3788;;A61B2090/363;;A61B2090/3945;;A61B34/20;;A61B2090/364;;A61B90/14;;A61B2034/105;;A61B2090/378;;A61B90/39;;A61B2090/3954;;A61B90/10;;A61B5/0073;;A61B6/12;;A61B6/501;;A61B8/00;;A61B8/5238;;A61B5/0064;;B82Y15/00;;A61B5/06;;A61B5/1077;;A61B6/5247;;A61B2017/00738;;A61B8/0808;;A61B2034/2068;;A61B2090/3945;;A61B2090/363;;A61B2034/2055;;A61B2090/3788;;A61B2090/3983;;A61B2090/3954;;A61B90/10;;A61B90/36;;A61B2034/2072;;A61B34/20;;A61B2090/378;;A61B2090/364;;A61B2034/105;;A61B90/39;;A61B90/14,A61B5/00;;A61B5/055;;A61B5/06;;A61B5/107;;A61B6/00;;A61B6/12;;A61B8/00;;A61B17/88;;A61B19/00,,0,0,,,,DISCONTINUED
46,EP,B1,EP 1690511 B1,072-308-805-228-719,2010-07-14,2010,EP 06100735 A,1991-10-17,EP 02004099 A;;EP 99108026 A;;EP 91919611 A;;US 60075390 A,1990-10-19,Surgical probe locating system for head use,"The system for determining a position of a probe relative to an object such as a head of a body patient. The head includes a surface such as a forehead having a contour. The head is placed in a cradle equipped with an arc. The cross-sectional images of the head are determined relative to the arc. A hand-held unit optically scans the forehead and the arc. During scanning to generate the cross-sectional images, the optical scanner is used to determine the position of the forehead relative to the cradle. During surgery, the optical scanner also determines the position of the forehead relative to a base ring. An array for receiving radiation emitted from the probe and from the base ring generates signals indicating the position of the tip of the probe relative to the base ring. A stereotactic imaging system selects and display the image of the head closest to the measured position of the tip of the probe.",UNIV ST LOUIS,BUCHOLZ RICHARD D,,https://lens.org/072-308-805-228-719,Granted Patent,yes,6,0,31,90,0,A61B5/0064;;A61B5/0073;;A61B5/055;;A61B5/06;;A61B5/1077;;A61B6/12;;A61B6/501;;A61B6/5247;;A61B8/00;;A61B8/5238;;A61B2017/00738;;B82Y15/00;;A61B8/0808;;A61B2090/3983;;A61B90/10;;A61B90/36;;A61B2034/2055;;A61B2034/2068;;A61B2034/2072;;A61B2090/3788;;A61B2090/363;;A61B2090/3945;;A61B34/20;;A61B2090/364;;A61B90/14;;A61B2034/105;;A61B2090/378;;A61B90/39;;A61B2090/3954;;A61B90/10;;A61B5/0073;;A61B6/12;;A61B6/501;;A61B8/00;;A61B8/5238;;A61B5/0064;;B82Y15/00;;A61B5/06;;A61B5/1077;;A61B6/5247;;A61B2017/00738;;A61B8/0808;;A61B2034/2068;;A61B2090/3945;;A61B2090/363;;A61B2034/2055;;A61B2090/3788;;A61B2090/3983;;A61B2090/3954;;A61B90/10;;A61B90/36;;A61B2034/2072;;A61B34/20;;A61B2090/378;;A61B2090/364;;A61B2034/105;;A61B90/39;;A61B90/14,A61B19/00;;A61B5/00;;A61B5/055;;A61B5/06;;A61B5/103;;A61B5/107;;A61B6/00;;A61B6/08;;A61B6/12;;A61B8/00;;A61B17/88,,1,0,,,"FRIETS ET AL.: ""A frameless Stereotaxic Operating Microscope for Neurosurgery"" IEEE TRANSACTIONS ON BIOMEDICAL ENGINEERING, vol. 36, no. 6, June 1989 (1989-06), pages 608-617, XP000099027 NEW YORK",EXPIRED
47,EP,A1,EP 0931516 A1,118-442-336-841-370,1999-07-28,1999,EP 99108026 A,1991-10-17,EP 91919611 A;;US 60075390 A,1990-10-19,Surgical probe locating system for head use,"A system is described for use in imaging a subject which comprises memory (320) including a first scan image (FIG. 5C) of the subject, an imaging probe (500) configured to scan the subject and provide a second scan image (FIG. 5B) of the subject, means (502) for sending a signal representing a position of the subject, means (370) for sending a signal representing a position of the imaging probe (500), an array of receivers (300) in communication with the subject position signalling means and the imaging probe position signalling means, and a processor (314) in communication with the array. The processor (314) is configured to determine the position of the subject relative to the array (300), to determine the position of the imaging probe (500) relative to the array (300), to determine the position of the imaging probe (500) relative to the subject, and to determine the position in the first scan image (FIG. 5C) and the second scan image (FIG. 5B) corresponding to the position of the imaging probe (500) relative to the subject.",UNIV ST LOUIS,BUCHOLZ RICHARD D,,https://lens.org/118-442-336-841-370,Patent Application,yes,7,2,31,90,0,A61B5/0064;;A61B5/0073;;A61B5/055;;A61B5/06;;A61B5/1077;;A61B6/12;;A61B6/501;;A61B6/5247;;A61B8/00;;A61B8/5238;;A61B2017/00738;;B82Y15/00;;A61B8/0808;;A61B2090/3983;;A61B90/10;;A61B90/36;;A61B2034/2055;;A61B2034/2068;;A61B2034/2072;;A61B2090/3788;;A61B2090/363;;A61B2090/3945;;A61B34/20;;A61B2090/364;;A61B90/14;;A61B2034/105;;A61B2090/378;;A61B90/39;;A61B2090/3954;;A61B90/10;;A61B5/0073;;A61B6/12;;A61B6/501;;A61B8/00;;A61B8/5238;;A61B5/0064;;B82Y15/00;;A61B5/06;;A61B5/1077;;A61B6/5247;;A61B2017/00738;;A61B8/0808;;A61B2034/2068;;A61B2090/3945;;A61B2090/363;;A61B2034/2055;;A61B2090/3788;;A61B2090/3983;;A61B2090/3954;;A61B90/10;;A61B90/36;;A61B2034/2072;;A61B34/20;;A61B2090/378;;A61B2090/364;;A61B2034/105;;A61B90/39;;A61B90/14,A61B5/00;;A61B5/055;;A61B5/06;;A61B5/107;;A61B6/00;;A61B6/12;;A61B8/00;;A61B17/88;;A61B19/00,,1,1,112-858-152-757-474,2659493;;10.1109/10.29455,"FRIETS ET AL.: ""A frameless Stereotaxic Operating Microscope for Neurosurgery"", IEEE TRANSACTIONS ON BIOMEDICAL ENGINEERING, vol. 36, no. 6, June 1989 (1989-06-01), NEW YORK, pages 608 - 617, XP000099027",EXPIRED
