97,CN,A,CN 102933369 A,043-838-087-696-142,2013-02-13,2013,CN 201180010650 A,2011-02-24,US 2011/0025980 W;;US 30755510 P,2010-02-24,Injection stretch blow molding process,"The present invention relates to a solid preform made from polyethylene material, wherein the preform comprises a neck region, side walls and a base region, and has an interior having inner walls and an exterior having outer walls; characterised in that at least 65% of the polyethylene material by weight of the total polyethylene material has a Z-average molecular weight (Mz) of between 300,000 g/mol and 6,000,000 g/mol, and a Mz/Mn value of greater than 28, where Mn is the number average molecular weight, and Mz/Mn is the Mz value divided by the Mn value.",PROCTER & GAMBLE,BROYLES NORMAN SCOTT;;BOSWELL EMILY CHARLOTTE;;ZEIK DOUGLAS BRUCE;;ETESSE PATRICK JEAN-FRANCOIS;;LAYMAN JOHN MONCRIEF,,https://lens.org/043-838-087-696-142,Patent Application,no,4,5,12,12,0,B29B11/08;;B29B11/10;;B29B11/12;;B29B11/14;;B29C45/0001;;B29C49/0005;;B29C49/04;;B29C49/06;;B29K2023/0608;;B29K2105/253;;B29K2995/0063;;C08L23/06;;Y10T428/1397;;B29C2949/26;;B29C2949/28;;B29C2949/24;;B29C2949/22;;B29C2949/3024;;B29C2949/3032;;B29C2949/3041;;B29C2949/3056;;B29C2949/072;;B29C2949/0777;;B29C2949/0773;;B29C2949/0818;;B29C2949/0817;;B29C2949/0826;;B29C2949/0822;;B29C2949/0831;;B29C2949/0836;;B29C2949/0835;;B29C2949/0829;;B29C49/0685;;B29C49/071;;B29C2949/0715;;B29C2049/7861;;B29C2049/7879;;Y10T428/1397;;B29B11/14;;C08L23/06;;B29K2995/0063;;B29B11/08;;B29C49/06;;B29B11/12;;B29K2105/253;;B29C49/04;;B29B11/10;;B29C45/0001;;B29C49/0005;;B29K2023/0608;;B29C49/0685;;B29C2949/22;;B29C2949/24;;B29C2949/26;;B29C2949/28;;B29C2949/072;;B29C2949/0773;;B29C2949/0777;;B29C2949/0817;;B29C2949/0818;;B29C2949/0822;;B29C2949/0826;;B29C2949/0829;;B29C2949/0831;;B29C2949/0835;;B29C2949/0836;;B29C2949/3024;;B29C2949/3032;;B29C2949/3041;;B29C2949/3056,B29C49/06;;B29B11/08;;B29B11/10;;B29B11/12;;B29B11/14;;B29C45/00;;B29C45/77;;B29C49/00,,0,0,,,,DISCONTINUED
98,WO,A3,WO 2011/106471 A3,014-249-557-427-83X,2012-11-22,2012,US 2011/0025980 W,2011-02-24,US 30755510 P,2010-02-24,"INJECTION STRETCH BLOW MOLDING PROCESS, PREFORM AND CONTAINER","The present invention relates to a solid preform made from polyethylene material, wherein the preform comprises a neck region, side walls and a base region, and has an interior having inner walls and an exterior having outer walls; characterised in that at least 65% of the polyethylene material by weight of the total polyethylene material has a Z-average molecular weight (Mz) of between 300,000 g/mol and 6,000,000 g/mol, and a Mz/Mn value of greater than 28, where Mn is the number average molecular weight, and Mz/Mn is the Mz value divided by the Mn value.",PROCTER & GAMBLE;;BROYLES NORMAN SCOTT;;BOSWELL EMILY CHARLOTTE;;ZEIK DOUGLAS BRUCE;;ETESSE PATRICK JEAN-FRANCOIS;;LAYMAN JOHN MONCRIEF,BROYLES NORMAN SCOTT;;BOSWELL EMILY CHARLOTTE;;ZEIK DOUGLAS BRUCE;;ETESSE PATRICK JEAN-FRANCOIS;;LAYMAN JOHN MONCRIEF,,https://lens.org/014-249-557-427-83X,Search Report,no,1,0,12,12,0,B29B11/08;;B29B11/10;;B29B11/12;;B29B11/14;;B29C45/0001;;B29C49/0005;;B29C49/04;;B29C49/06;;B29K2023/0608;;B29K2105/253;;B29K2995/0063;;C08L23/06;;Y10T428/1397;;B29C2949/26;;B29C2949/28;;B29C2949/24;;B29C2949/22;;B29C2949/3024;;B29C2949/3032;;B29C2949/3041;;B29C2949/3056;;B29C2949/072;;B29C2949/0777;;B29C2949/0773;;B29C2949/0818;;B29C2949/0817;;B29C2949/0826;;B29C2949/0822;;B29C2949/0831;;B29C2949/0836;;B29C2949/0835;;B29C2949/0829;;B29C49/0685;;B29C49/071;;B29C2949/0715;;B29C2049/7861;;B29C2049/7879;;Y10T428/1397;;B29B11/14;;C08L23/06;;B29K2995/0063;;B29B11/08;;B29C49/06;;B29B11/12;;B29K2105/253;;B29C49/04;;B29B11/10;;B29C45/0001;;B29C49/0005;;B29K2023/0608;;B29C49/0685;;B29C2949/22;;B29C2949/24;;B29C2949/26;;B29C2949/28;;B29C2949/072;;B29C2949/0773;;B29C2949/0777;;B29C2949/0817;;B29C2949/0818;;B29C2949/0822;;B29C2949/0826;;B29C2949/0829;;B29C2949/0831;;B29C2949/0835;;B29C2949/0836;;B29C2949/3024;;B29C2949/3032;;B29C2949/3041;;B29C2949/3056,B29B11/08;;B29B11/10;;B29B11/12;;B29B11/14;;B29C45/00;;B29C45/77;;B29C49/00;;B29C49/06,,0,0,,,,PENDING
99,WO,A2,WO 2011/106471 A2,163-358-175-528-26X,2011-09-01,2011,US 2011/0025980 W,2011-02-24,US 30755510 P,2010-02-24,INJECTION STRETCH BLOW MOLDING PROCESS,"The present invention relates to a solid preform made from polyethylene material, wherein the preform comprises a neck region, side walls and a base region, and has an interior having inner walls and an exterior having outer walls; characterised in that at least 65% of the polyethylene material by weight of the total polyethylene material has a Z-average molecular weight (Mz) of between 300,000 g/mol and 6,000,000 g/mol, and a Mz/Mn value of greater than 28, where Mn is the number average molecular weight, and Mz/Mn is the Mz value divided by the Mn value.",PROCTER & GAMBLE;;BROYLES NORMAN SCOTT;;BOSWELL EMILY CHARLOTTE;;ZEIK DOUGLAS BRUCE;;ETESSE PATRICK JEAN-FRANCOIS;;LAYMAN JOHN MONCRIEF,BROYLES NORMAN SCOTT;;BOSWELL EMILY CHARLOTTE;;ZEIK DOUGLAS BRUCE;;ETESSE PATRICK JEAN-FRANCOIS;;LAYMAN JOHN MONCRIEF,,https://lens.org/163-358-175-528-26X,Patent Application,yes,1,0,12,12,0,B29B11/08;;B29B11/10;;B29B11/12;;B29B11/14;;B29C45/0001;;B29C49/0005;;B29C49/04;;B29C49/06;;B29K2023/0608;;B29K2105/253;;B29K2995/0063;;C08L23/06;;Y10T428/1397;;B29C2949/26;;B29C2949/28;;B29C2949/24;;B29C2949/22;;B29C2949/3024;;B29C2949/3032;;B29C2949/3041;;B29C2949/3056;;B29C2949/072;;B29C2949/0777;;B29C2949/0773;;B29C2949/0818;;B29C2949/0817;;B29C2949/0826;;B29C2949/0822;;B29C2949/0831;;B29C2949/0836;;B29C2949/0835;;B29C2949/0829;;B29C49/0685;;B29C49/071;;B29C2949/0715;;B29C2049/7861;;B29C2049/7879;;Y10T428/1397;;B29B11/14;;C08L23/06;;B29K2995/0063;;B29B11/08;;B29C49/06;;B29B11/12;;B29K2105/253;;B29C49/04;;B29B11/10;;B29C45/0001;;B29C49/0005;;B29K2023/0608;;B29C49/0685;;B29C2949/22;;B29C2949/24;;B29C2949/26;;B29C2949/28;;B29C2949/072;;B29C2949/0773;;B29C2949/0777;;B29C2949/0817;;B29C2949/0818;;B29C2949/0822;;B29C2949/0826;;B29C2949/0829;;B29C2949/0831;;B29C2949/0835;;B29C2949/0836;;B29C2949/3024;;B29C2949/3032;;B29C2949/3041;;B29C2949/3056,B29C49/06;;B65D1/02,,0,0,,,,PENDING
100,CA,A1,CA 2789469 A1,091-102-364-027-342,2011-09-01,2011,CA 2789469 A,2011-02-24,US 30755510 P;;US 2011/0025980 W,2010-02-24,INJECTION STRETCH BLOW MOLDING PROCESS,"The present invention relates to a solid preform made from polyethylene material, wherein the preform comprises a neck region, side walls and a base region, and has an interior having inner walls and an exterior having outer walls; characterised in that at least 65% of the polyethylene material by weight of the total polyethylene material has a Z-average molecular weight (Mz) of between 300,000 g/mol and 6,000,000 g/mol, and a Mz/Mn value of greater than 28, where Mn is the number average molecular weight, and Mz/Mn is the Mz value divided by the Mn value.",PROCTER & GAMBLE,BROYLES NORMAN SCOTT;;BOSWELL EMILY CHARLOTTE;;ZEIK DOUGLAS BRUCE;;ETESSE PATRICK JEAN-FRANCOIS;;LAYMAN JOHN MONCRIEF,,https://lens.org/091-102-364-027-342,Patent Application,no,0,0,12,12,0,B29B11/08;;B29B11/10;;B29B11/12;;B29B11/14;;B29C45/0001;;B29C49/0005;;B29C49/04;;B29C49/06;;B29K2023/0608;;B29K2105/253;;B29K2995/0063;;C08L23/06;;Y10T428/1397;;B29C2949/26;;B29C2949/28;;B29C2949/24;;B29C2949/22;;B29C2949/3024;;B29C2949/3032;;B29C2949/3041;;B29C2949/3056;;B29C2949/072;;B29C2949/0777;;B29C2949/0773;;B29C2949/0818;;B29C2949/0817;;B29C2949/0826;;B29C2949/0822;;B29C2949/0831;;B29C2949/0836;;B29C2949/0835;;B29C2949/0829;;B29C49/0685;;B29C49/071;;B29C2949/0715;;B29C2049/7861;;B29C2049/7879;;Y10T428/1397;;B29B11/14;;C08L23/06;;B29K2995/0063;;B29B11/08;;B29C49/06;;B29B11/12;;B29K2105/253;;B29C49/04;;B29B11/10;;B29C45/0001;;B29C49/0005;;B29K2023/0608;;B29C49/0685;;B29C2949/22;;B29C2949/24;;B29C2949/26;;B29C2949/28;;B29C2949/072;;B29C2949/0773;;B29C2949/0777;;B29C2949/0817;;B29C2949/0818;;B29C2949/0822;;B29C2949/0826;;B29C2949/0829;;B29C2949/0831;;B29C2949/0835;;B29C2949/0836;;B29C2949/3024;;B29C2949/3032;;B29C2949/3041;;B29C2949/3056,B29C49/06;;B65D1/02,,0,0,,,,DISCONTINUED
101,MX,A,MX 2012009868 A,089-648-113-549-325,2012-09-12,2012,MX 2012009868 A,2011-02-24,US 30755510 P;;US 2011/0025980 W,2010-02-24,INJECTION STRETCH BLOW MOLDING PROCESS.,"The present invention relates to a solid preform made from polyethylene material, wherein the preform comprises a neck region, side walls and a base region, and has an interior having inner walls and an exterior having outer walls; characterised in that at least 65% of the polyethylene material by weight of the total polyethylene material has a Z-average molecular weight (Mz) of between 300,000 g/mol and 6,000,000 g/mol, and a Mz/Mn value of greater than 28, where Mn is the number average molecular weight, and Mz/Mn is the Mz value divided by the Mn value.",PROCTER & GAMBLE,BOSWELL EMILY CHARLOTTE;;ETESSE PATRICK JEAN-FRANCOIS;;BROYLES NORMAN SCOTT;;LAYMAN JOHN MONCRIEF;;ZEIK DOUGLAS BRUCE,,https://lens.org/089-648-113-549-325,Patent Application,no,0,0,12,12,0,B29B11/08;;B29B11/10;;B29B11/12;;B29B11/14;;B29C45/0001;;B29C49/0005;;B29C49/04;;B29C49/06;;B29K2023/0608;;B29K2105/253;;B29K2995/0063;;C08L23/06;;Y10T428/1397;;B29C2949/26;;B29C2949/28;;B29C2949/24;;B29C2949/22;;B29C2949/3024;;B29C2949/3032;;B29C2949/3041;;B29C2949/3056;;B29C2949/072;;B29C2949/0777;;B29C2949/0773;;B29C2949/0818;;B29C2949/0817;;B29C2949/0826;;B29C2949/0822;;B29C2949/0831;;B29C2949/0836;;B29C2949/0835;;B29C2949/0829;;B29C49/0685;;B29C49/071;;B29C2949/0715;;B29C2049/7861;;B29C2049/7879;;Y10T428/1397;;B29B11/14;;C08L23/06;;B29K2995/0063;;B29B11/08;;B29C49/06;;B29B11/12;;B29K2105/253;;B29C49/04;;B29B11/10;;B29C45/0001;;B29C49/0005;;B29K2023/0608;;B29C49/0685;;B29C2949/22;;B29C2949/24;;B29C2949/26;;B29C2949/28;;B29C2949/072;;B29C2949/0773;;B29C2949/0777;;B29C2949/0817;;B29C2949/0818;;B29C2949/0822;;B29C2949/0826;;B29C2949/0829;;B29C2949/0831;;B29C2949/0835;;B29C2949/0836;;B29C2949/3024;;B29C2949/3032;;B29C2949/3041;;B29C2949/3056,B29C49/06;;B65D1/02,,0,0,,,,PENDING
102,EP,A2,EP 1182117 A2,120-395-545-336-891,2002-02-27,2002,EP 01202662 A,2001-07-11,US 22774400 P,2000-08-24,Distributed control architecture for mechatronic automotive systems,"A chassis control network architecture (20) having an electronic control module (30) mountable on a steering column subassembly (56) is disclosed. A first communications bus (36) is connected to the electronic control module (30) and an actuator control module (40) is in communication with the electronic control module (30), through the first communications bus (36). The actuator control module (40) is further connected to an electric steering motor (16), and is capable of receiving a steering input command from the electronic control module (30) and applying it to the electric steering motor (16).",DELPHI TECH INC,MILLSAP SCOTT A;;GILLMAN STEPHEN V;;BOSWELL KAREN A;;BERG FREDERICK J;;PETROWSKI JAMES M;;MENJAK RATKO,,https://lens.org/120-395-545-336-891,Patent Application,yes,0,4,3,3,0,B60T8/246;;B60T8/246;;B60G17/0195;;B60G17/0195;;B60G21/005;;B60G21/005;;B60G2204/82;;B60G2204/82;;B60G2600/00;;B60G2600/00;;B60Q1/1461;;B60Q1/1461;;B60T7/12;;B60T7/12;;B60T13/662;;B60T13/662;;B60T2260/02;;B60T2260/02;;B60T2260/08;;B60T2260/08;;B60T2260/09;;B60T2260/09;;B62D1/16;;B62D1/16;;B62D5/0403;;B62D5/0403,B60G17/0195;;B60G21/00;;B60Q1/14;;B60T7/12;;B60T8/24;;B60T13/66;;B62D1/16;;B62D5/04,,0,0,,,,DISCONTINUED
103,CA,A1,CA 2410698 A1,034-567-784-631-581,2001-12-20,2001,CA 2410698 A,2001-06-14,EP 00112681 A;;EP 00112680 A;;US 0119055 W,2000-06-15,BODY ACTIVITY DETECTION AND PROCESSING,"A method for monitoring body activity comprises the steps of: receiving actimetry data from a sensor (11) for measuring body activity, analysing (17 ) the data to provide advisory information and displaying the advisory information (4).",PROCTER & GAMBLE,DIJK DERK-JAN;;EWART KEITH;;BOSWELL EMILY CHARLOTTE;;DAUGER-STRAUSS CORINNE;;BARRON BRADFORD SCOTT;;MACGILP NEIL ARCHIBALD,,https://lens.org/034-567-784-631-581,Patent Application,no,0,0,5,18,0,A61B5/113;;A61B5/0002,A61B5/00;;A61B5/022;;A61B5/0245;;A61B5/113;;A61B5/16,,0,0,,,,DISCONTINUED
104,US,A1,US 2002/0026268 A1,152-309-676-383-628,2002-02-28,2002,US 85823601 A,2001-05-15,US 85823601 A;;US 22774400 P,2000-08-24,Distributed control architecture for mechatronic automotive systems,"
   A chassis control network architecture having an electronic control module mountable on a steering column subassembly is disclosed. A first communications bus is connected to the electronic control module and an actuator control module is in communication with the electronic control module, through the first communications bus. The actuator control module is further connected to an electric steering motor, and is capable of receiving a steering input command from the electronic control module and applying it to the electric steering motor. 
",MILLSAP SCOTT A.;;GILLMAN STEPHEN VINCENT;;BOSWELL KAREN ANN;;BERG FREDERICK J.;;PETROWSKI JAMES M.;;MENJAK RATKO,MILLSAP SCOTT A;;GILLMAN STEPHEN VINCENT;;BOSWELL KAREN ANN;;BERG FREDERICK J;;PETROWSKI JAMES M;;MENJAK RATKO,PACIFIC CENTURY MOTORS INC (2010-11-30);;STEERING SOLUTIONS IP HOLDING CORPORATION (2012-01-26);;DELPHI TECHNOLOGIES INC (2001-04-05);;GM GLOBAL TECHNOLOGY OPERATIONS INC (2010-11-30),https://lens.org/152-309-676-383-628,Patent Application,yes,0,25,3,3,0,B60T8/246;;B60T8/246;;B60G17/0195;;B60G17/0195;;B60G21/005;;B60G21/005;;B60G2204/82;;B60G2204/82;;B60G2600/00;;B60G2600/00;;B60Q1/1461;;B60Q1/1461;;B60T7/12;;B60T7/12;;B60T13/662;;B60T13/662;;B60T2260/02;;B60T2260/02;;B60T2260/08;;B60T2260/08;;B60T2260/09;;B60T2260/09;;B62D1/16;;B62D1/16;;B62D5/0403;;B62D5/0403,B60G17/0195;;B60G21/00;;B60Q1/14;;B60T7/12;;B60T8/24;;B60T13/66;;B62D1/16;;B62D5/04,701/41;;180/443,0,0,,,,EXPIRED
105,US,B2,US 9682537 B2,044-192-137-092-694,2017-06-20,2017,US 201313889061 A,2013-05-07,US 201313889061 A;;US 201261643813 P;;US 201361782219 P;;US 201261643823 P;;US 201361782757 P;;US 201261676042 P;;US 201261727961 P;;US 201361782859 P;;US 201261680045 P;;US 201361782951 P;;US 201361780039 P;;US 201361789135 P,2012-05-07,Flexible materials for flexible containers,"A flexible material for a flexible container can include a first laminate and a second laminate joined to at least a portion of the first laminate by at least one seal. The first laminate can include a first gas barrier layer disposed between first and second sealable layers, wherein the first and second sealable layers define opposed exterior layers of the first laminate. The second laminate can include a third sealable layer defining an exterior layer of the second laminate, and a second gas barrier layer. The at least one seal joins a portion of the third sealable layer to at least a portion of the second sealable layer.",PROCTER & GAMBLE,STANLEY SCOTT KENDYL;;YOU JUN;;BOSWELL EMILY CHARLOTTE;;ARENT LEE MATHEW;;MCGUIRE KENNETH STEPHEN;;RAPACH ANDREW PAUL,THE PROCTER & GAMBLE COMPANY (2013-05-14),https://lens.org/044-192-137-092-694,Granted Patent,yes,173,6,118,183,0,B32B7/12;;B32B27/08;;B32B27/306;;B32B27/32;;B32B27/327;;B32B27/34;;B32B27/36;;B65D31/16;;B65D33/004;;B65D33/02;;B65D75/008;;B65D75/525;;B65D75/54;;B32B2307/31;;B32B2307/7246;;B32B2307/7244;;B32B2307/7242;;B32B2270/00;;B32B2250/24;;B32B2255/10;;B32B2439/40;;B32B2439/70;;B65D75/5883;;B65D75/5877;;B65D75/5866;;B65D75/20;;B65D75/566;;B32B7/12;;B32B27/306;;B32B27/32;;B32B27/327;;B32B27/34;;B32B27/36;;B65D75/008;;B65D75/525;;B65D75/54;;B65D33/004;;B65D75/5883;;B32B2250/24;;B32B2255/10;;B32B2270/00;;B32B2307/31;;B32B2307/7242;;B32B2307/7244;;B32B2307/7246;;B32B2439/40;;B32B2439/70;;B65D75/20;;B65D75/566;;B65D31/16;;B65D75/5866;;B65D75/5877;;B65D33/02;;Y10T428/24942;;Y10T428/31913;;Y10T428/31746;;Y10T428/31797;;B32B27/08;;B32B2307/54;;B32B2307/548;;B32B3/12;;B32B7/02;;B32B7/12;;B32B27/08;;B32B27/20;;B32B37/10;;B65D33/00;;B65D75/52;;B32B27/306;;B32B27/327;;B32B27/34;;B32B27/36;;B65D33/008;;B65D75/008;;B65D75/5883;;B65D75/5894;;B65D81/3288;;B32B27/325;;B65D31/16;;B65D31/18;;B65D75/525;;B65D75/5866;;Y10S383/906;;B32B2307/54;;B32B2307/548;;B32B2307/31;;B32B2307/7244;;B32B2250/24;;B32B2255/10;;B32B2270/00;;B32B2439/40;;B32B27/08;;B65D75/00;;B65D75/58;;B65D31/00;;B32B27/34;;B32B27/32;;B32B27/30;;B65D85/00;;Y10T428/24942;;Y10T428/31913;;Y10T428/31746;;Y10T428/31797;;B65D27/00;;B65D37/00;;B65D33/02;;B32B7/12;;B32B27/306;;B32B27/32;;B32B27/327;;B32B27/34;;B32B27/36;;B65D75/008;;B65D75/525;;B65D75/54;;B65D33/004;;B65D75/5883;;B32B2250/24;;B32B2255/10;;B32B2270/00;;B32B2307/31;;B32B2307/7242;;B32B2307/7244;;B32B2307/7246;;B32B2439/40;;B32B2439/70;;B65D75/20;;B65D75/566;;B65D31/16;;B65D75/5866;;B65D75/5877;;B32B1/00;;B65D25/14;;B65D1/42;;B65D21/0201;;B65D35/10;;B65D31/00;;B32B27/08;;B32B27/30,B32B1/02;;B32B7/12;;B32B27/08;;B32B27/30;;B32B27/32;;B32B27/34;;B32B27/36;;B65D1/42;;B65D21/02;;B65D25/14;;B65D27/00;;B65D30/00;;B65D30/10;;B65D33/00;;B65D33/02;;B65D35/10;;B65D37/00;;B65D75/00;;B65D75/20;;B65D75/52;;B65D75/54;;B65D75/56;;B65D75/58;;B65D85/00,,21,0,,,"U.S. Appl. No. 13/888,679, filed May 7, 2013, Stanley et al.;;U.S. Appl. No. 13/888,721, filed May 7, 2013, Stanley et al.;;U.S. Appl. No. 13/888,963, filed May 7, 2013, Stanley et al.;;U.S. Appl. No. 13/888,756, filed May 7, 2013, Stanley et al.;;U.S. Appl. No. 13/889,000, filed May 7, 2013, Stanley et al.;;U.S. Appl. No. 13/889,090, filed May 7, 2013, Stanley et al.;;U.S. Appl. No. 61/680,045, filed Aug. 6, 2012, Stanley et al.;;U.S. Appl. No. 61/782,951, filed Mar. 14, 2013, Stanley et al.;;All Office Actions, U.S. Appl. No. 13/889,090.;;All Office Actions, U.S. Appl. No. 13/889,090, date of filing May 7, 2013.;;All Office Actions, U.S. Appl. No. 14/534,209, date of filing Nov. 6, 2014.;;PCT International Search Report, mailed Nov. 20, 2014, 10 pages.;;PCT International Search Report and Written Opinion for PCT/US2013/039800, dated Aug. 12, 2013.;;PCT International Search Report and Written Opinion for PCT/US2013/039801, dated Aug. 12, 2013.;;PCT International Search Report and Written Opinion for PCT/US2013/039809, dated Aug. 8, 2013.;;PCT International Search Report and Written Opinion for PCT/US2013/039811, dated Aug. 14, 2013.;;PCT International Search Report and Written Opinion for PCT/US2013/039807, dated Aug. 12, 2013.;;PCT International Search Report and Written Opinion for PCT/US2013/053204, dated Nov. 13, 2013.;;PCT International Search Report and Written Opinion for PCT/US2013/053205, dated Nov. 22, 2013.;;PCT International Search Report and Written Opinion for PCT/US2013/039804, dated Aug. 12, 2013.;;PCT International Search Report and Written Opinion for PCT/US2013/039802, dated Aug. 12, 2013.",ACTIVE
106,EP,A4,EP 1671200 A4,054-417-128-854-076,2007-10-17,2007,EP 04760391 A,2004-04-26,US 2004/0012805 W;;US 46511803 P;;US 46512203 P;;US 46512103 P,2003-04-24,AUTOMATED ELECTRONIC SOFTWARE DISTRIBUTION AND MANAGEMENT METHOD AND SYSTEM,,SECUREINFO CORP,STURONAS JOSEPH;;WASSERBERGER ALAN G;;CIRILLO ANDREW;;CAMPBELL SCOTT;;STEELE SCOTT;;BOSWELL JAMES;;ABDULHADI ASHRAF;;WOLFE ALEX;;GOLDING MICHAEL;;LESSACK IRA;;KRUEGER RAY,,https://lens.org/054-417-128-854-076,Search Report,no,5,0,12,12,0,G06F8/61;;G06F8/64;;G06F8/64;;G06F8/61,G06F9/445;;G06F/;;G06F15/16;;G06F15/173;;G06F15/177;;G06F17/00;;G06F17/30,,1,0,,,"""DESCRIPTION SCRIPTING LANGUAGE FOR UPDATING AND INSTALLING APPLICATION VIA THE INTERNET"", IBM TECHNICAL DISCLOSURE BULLETIN, IBM CORP. NEW YORK, US, vol. 40, no. 6, June 1997 (1997-06-01), pages 151 - 153, XP000728370, ISSN: 0018-8689",DISCONTINUED
107,US,B2,US 6522962 B2,150-650-249-094-529,2003-02-18,2003,US 85823601 A,2001-05-15,US 85823601 A;;US 22774400 P,2000-08-24,Distributed control architecture for mechatronic automotive systems,"
    A chassis control network architecture having an electronic control module mountable on a steering column subassembly is disclosed. A first communications bus is connected to the electronic control module and an actuator control module is in communication with the electronic control module, through the first communications bus. The actuator control module is further connected to an electric steering motor, and is capable of receiving a steering input command from the electronic control module and applying it to the electric steering motor. 
",DELPHI TECH INC,MILLSAP SCOTT A;;GILLMAN STEPHEN VINCENT;;BOSWELL KAREN ANN;;BERG FREDERICK J;;PETROWSKI JAMES M;;MENJAK RATKO,PACIFIC CENTURY MOTORS INC (2010-11-30);;STEERING SOLUTIONS IP HOLDING CORPORATION (2012-01-26);;DELPHI TECHNOLOGIES INC (2001-04-05);;GM GLOBAL TECHNOLOGY OPERATIONS INC (2010-11-30),https://lens.org/150-650-249-094-529,Granted Patent,yes,5,13,3,3,0,B60T8/246;;B60T8/246;;B60G17/0195;;B60G17/0195;;B60G21/005;;B60G21/005;;B60G2204/82;;B60G2204/82;;B60G2600/00;;B60G2600/00;;B60Q1/1461;;B60Q1/1461;;B60T7/12;;B60T7/12;;B60T13/662;;B60T13/662;;B60T2260/02;;B60T2260/02;;B60T2260/08;;B60T2260/08;;B60T2260/09;;B60T2260/09;;B62D1/16;;B62D1/16;;B62D5/0403;;B62D5/0403,B60G17/0195;;B60G21/00;;B60Q1/14;;B60T7/12;;B60T8/24;;B60T13/66;;B62D1/16;;B62D5/04,701/41;;180/443,0,0,,,,EXPIRED
108,EP,A2,EP 1671200 A2,165-747-909-323-119,2006-06-21,2006,EP 04760391 A,2004-04-26,US 2004/0012805 W;;US 46511803 P;;US 46512203 P;;US 46512103 P,2003-04-24,AUTOMATED ELECTRONIC SOFTWARE DISTRIBUTION AND MANAGEMENT METHOD AND SYSTEM,,SECUREINFO CORP,STURONAS JOSEPH;;WASSERBERGER ALAN G;;CIRILLO ANDREW;;CAMPBELL SCOTT;;STEELE SCOTT;;BOSWELL JAMES;;ABDULHADI ASHRAF;;WOLFE ALEX;;GOLDING MICHAEL;;LESSACK IRA;;KRUEGER RAY,,https://lens.org/165-747-909-323-119,Patent Application,yes,0,0,12,12,0,G06F8/61;;G06F8/64;;G06F8/64;;G06F8/61,G06F9/445;;G06F/;;G06F15/16;;G06F15/173;;G06F15/177;;G06F17/00;;G06F17/30,,0,0,,,,DISCONTINUED
109,MX,A,MX 2013005770 A,093-174-234-318-411,2013-06-18,2013,MX 2013005770 A,2011-11-10,US 41639910 P;;US 2011/0060078 W,2010-11-23,THERMOPLASTIC STARCH COMPOSITIONS.,The present invention relates to improvements in prevention of discoloration of thermoplastic starch materials and their blends with other thermoplastic materials.,PROCTER & GAMBLE,BUSAM LUDWIG;;BROYLES NORMAN SCOTT;;BOSWELL EMILY CHARLOTTE;;MAGNESS ROBERT EARL;;CARUSO PIER-LORENZO;;HARREN JOERG;;WATTEBLED LAURENT,,https://lens.org/093-174-234-318-411,Patent Application,no,0,0,14,14,0,C08K5/092;;C08K5/098;;C08K5/41;;C08K3/30;;C08K5/0016;;C08K5/005;;C08K5/36;;C08K3/014;;C08K5/092;;C08K5/098;;C08K5/41;;C08K3/014;;C08K3/30;;C08K5/005;;C08K5/36;;C08K5/0016;;C08L23/06;;C08L23/12;;C08L67/02,C08L3/00;;C08K3/30;;C08K5/00;;C08K5/36;;C08K5/405;;C08L3/02,,0,0,,,,ACTIVE
110,US,A1,US 2014/0275356 A1,129-977-183-779-181,2014-09-18,2014,US 201414293424 A,2014-06-02,US 201414293424 A;;US 201113301926 A;;US 41639910 P,2010-11-23,Thermoplastic Starch Compositions,The present invention relates to improvements in prevention of discoloration of thermoplastic starch materials and their blends with other thermoplastic materials.,PROCTER & GAMBLE,BROYLES NORMAN SCOTT;;CARUSO PIER-LORENZO;;BOSWELL EMILY CHARLOTTE;;MAGNESS ROBERT EARL;;BUSAM LUDWIG;;HARREN JORG;;WATTEBLED LAURENT,,https://lens.org/129-977-183-779-181,Patent Application,yes,1,0,14,14,0,C08K5/092;;C08K5/098;;C08K5/41;;C08K3/30;;C08K5/0016;;C08K5/005;;C08K5/36;;C08K3/014;;C08K5/092;;C08K5/098;;C08K5/41;;C08K3/014;;C08K3/30;;C08K5/005;;C08K5/36;;C08K5/0016;;C08L23/06;;C08L23/12;;C08L67/02,C08L3/02;;C08L23/06;;C08L23/12;;C08L67/02,524/52;;106/213.1;;524/47,0,0,,,,INACTIVE
111,CA,A1,CA 2818588 A1,018-609-218-379-775,2012-05-31,2012,CA 2818588 A,2011-11-10,US 41639910 P;;US 2011/0060078 W,2010-11-23,THERMOPLASTIC STARCH COMPOSITIONS,The present invention relates to improvements in prevention of discoloration of thermoplastic starch materials and their blends with other thermoplastic materials.,PROCTER & GAMBLE,BROYLES NORMAN SCOTT;;CARUSO PIER-LORENZO;;BOSWELL EMILY CHARLOTTE;;MAGNESS ROBERT EARL;;BUSAM LUDWIG;;HARREN JOERG;;WATTEBLED LAURENT,,https://lens.org/018-609-218-379-775,Patent Application,no,0,0,14,14,0,C08K5/092;;C08K5/098;;C08K5/41;;C08K3/30;;C08K5/0016;;C08K5/005;;C08K5/36;;C08K3/014;;C08K5/092;;C08K5/098;;C08K5/41;;C08K3/014;;C08K3/30;;C08K5/005;;C08K5/36;;C08K5/0016;;C08L23/06;;C08L23/12;;C08L67/02,C08L3/00;;C08K3/30;;C08K5/00;;C08K5/36;;C08K5/405;;C08L3/02,,0,0,,,,DISCONTINUED
112,US,B2,US 9006315 B2,044-627-943-171-143,2015-04-14,2015,US 201414293424 A,2014-06-02,US 201414293424 A;;US 201113301926 A;;US 41639910 P,2010-11-23,Thermoplastic starch compositions,The present invention relates to improvements in prevention of discoloration of thermoplastic starch materials and their blends with other thermoplastic materials.,PROCTER & GAMBLE;;PROCTER & GAMBLE,BROYLES NORMAN SCOTT;;CARUSO PIER-LORENZO;;BOSWELL EMILY CHARLOTTE;;MAGNESS ROBERT EARL;;BUSAM LUDWIG;;HARREN JORG;;WATTEBLED LAURENT,,https://lens.org/044-627-943-171-143,Granted Patent,yes,51,0,14,14,0,C08K5/092;;C08K5/098;;C08K5/41;;C08K3/30;;C08K5/0016;;C08K5/005;;C08K5/36;;C08K3/014;;C08K5/092;;C08K5/098;;C08K5/41;;C08K3/014;;C08K3/30;;C08K5/005;;C08K5/36;;C08K5/0016;;C08L23/06;;C08L23/12;;C08L67/02,C08L3/00;;C08K5/092;;C08K5/098;;C08K5/41;;C08L3/02;;C08L23/06;;C08L23/12;;C08L67/02;;D21H19/58,524/47;;524/52,2,1,001-336-675-585-20X,10.4028/www.scientific.net/amr.391-392.940,"Kainuma,""Determination of the Degree of Gelatinization and Retrogradation of Starch"", Methods in Carbohydrate Chemistry, vol. X, John Wiley & Sons, Inc., pp. 137-141 (1994).;;Bao, ""Study on the Effect of Distillation Reside in Corn Polyols Industry on Thermoplastic Starch"", Advanced Materials Research vols. 391-392 (2012) pp. 940-944.",INACTIVE
