"#",Jurisdiction,Kind,Display Key,Lens ID,Publication Date,Publication Year,Application Number,Application Date,Priority Numbers,Earliest Priority Date,Title,Abstract,Applicants,Inventors,Owners,URL,Document Type,Has Full Text,Cites Patent Count,Cited by Patent Count,Simple Family Size,Extended Family Size,Sequence Count,CPC Classifications,IPCR Classifications,US Classifications,NPL Citation Count,NPL Resolved Citation Count,NPL Resolved Lens ID(s),NPL Resolved External ID(s),NPL Citations,Legal Status
1,US,A1,US 2013/0171982 A1,022-855-219-864-690,2013-07-04,2013,US 201113338502 A,2011-12-28,US 201113338502 A,2011-12-28,METHOD AND APPARATUS FOR REMOTE SECURE ACCESS TO WIRELESS NETWORK,"In one embodiment, a method includes initiating at a mobile device, a secure connection with a wireless controller of a wireless network, receiving traffic from a wireless client device at the mobile device, and transmitting the traffic to the wireless controller over the secure connection. The mobile device is located remote from the wireless network. An apparatus and logic are also disclosed.",BARRITT BRIAN;;BOSWELL SCOTT;;CISCO TECH INC,BARRITT BRIAN;;BOSWELL SCOTT,CISCO TECHNOLOGY INC (2011-12-27),https://lens.org/022-855-219-864-690,Patent Application,yes,17,6,1,1,0,H04W12/02;;H04W12/02;;H04W12/03;;H04W12/03;;H04W48/20;;H04W48/20,H04W8/00;;H04W48/20,455/422.1,0,0,,,,DISCONTINUED
2,US,A1,US 2019/0376010 A1,055-490-998-951-168,2019-12-12,2019,US 201816004071 A,2018-06-08,US 201816004071 A,2018-06-08,WATER-SOLUBLE UNIT DOSE ARTICLES MADE FROM EXTRUDED FILMS AND CONTAINING HOUSEHOLD CARE COMPOSITIONS AND METHODS FOR MAKING THE SAME,The present disclosure relates to water-soluble unit dose articles made from a combination of water-soluble films and containing household care compositions that are at least partially enclosed by the water-soluble films in at least one compartment.,PROCTER & GAMBLE,SALAAM AMANEE;;BROYLES NORMAN SCOTT;;BOSWELL EMILY CHARLOTTE,THE PROCTER & GAMBLE COMPANY (2018-12-21),https://lens.org/055-490-998-951-168,Patent Application,yes,7,7,3,3,0,C11D17/042;;B65D65/46;;B65D75/30;;C08K5/053;;C11D3/3753;;C11D17/042;;C11D17/045;;C11D2111/12,C11D17/04;;C08K5/053;;C11D3/37;;C11D11/00,,0,0,,,,ACTIVE
3,US,A1,US 2015/0034294 A1,032-968-421-814-607,2015-02-05,2015,US 201313954865 A,2013-07-30,US 201313954865 A,2013-07-30,Submersible Electrical Machine and Method,"A submersible electrical machine includes a first magnetic package spaced axially from a second magnetic package, a first stator displaced axially from the first magnetic package by a first air gap, a second stator displaced axially from the second magnetic package by a second air gap. The electrical machine can be operated as a generator or as a motor. When operating as a generator, a turbine can rotate the magnetic packages relative to the stators in response to fluid flowing axially across the electrical machine.",SCHLUMBERGER TECHNOLOGY CORP,MILES JEROME;;DAHLGREN SCOTT;;BOSWELL CRAIG;;WOLSTON SCOTT;;ORBAN JACQUES;;MADSEN DANIEL,SCHLUMBERGER TECHNOLOGY CORPORATION (2015-09-10),https://lens.org/032-968-421-814-607,Patent Application,yes,4,36,6,6,0,E21B47/13;;E21B41/0085;;E21B41/0085;;H02K5/12;;H02K5/12;;H02K5/1285;;H02K5/132;;H02K7/1823;;H02K7/1823;;H02K16/00;;H02K16/00;;H02K16/04;;H02K16/04;;H02K21/24;;H02K21/24,H02K5/132;;E21B47/12,166/66.5;;310/87,0,0,,,,ACTIVE
4,US,B2,US 9863238 B2,178-839-180-447-220,2018-01-09,2018,US 201313954865 A,2013-07-30,US 201313954865 A,2013-07-30,Submersible electrical machine and method,"A submersible electrical machine includes a first magnetic package spaced axially from a second magnetic package, a first stator displaced axially from the first magnetic package by a first air gap, a second stator displaced axially from the second magnetic package by a second air gap. The electrical machine can be operated as a generator or as a motor. When operating as a generator, a turbine can rotate the magnetic packages relative to the stators in response to fluid flowing axially across the electrical machine.",SCHLUMBERGER TECHNOLOGY CORP,MILES JEROME;;DAHLGREN SCOTT;;BOSWELL CRAIG;;WOLSTON SCOTT;;ORBAN JACQUES;;MADSEN DANIEL,SCHLUMBERGER TECHNOLOGY CORPORATION (2015-09-10),https://lens.org/178-839-180-447-220,Granted Patent,yes,14,3,6,6,0,E21B47/13;;E21B41/0085;;E21B41/0085;;H02K5/12;;H02K5/12;;H02K5/1285;;H02K5/132;;H02K7/1823;;H02K7/1823;;H02K16/00;;H02K16/00;;H02K16/04;;H02K16/04;;H02K21/24;;H02K21/24,E21B47/12;;E21B41/00;;H02K5/12;;H02K5/128;;H02K5/132;;H02K7/18;;H02K16/00;;H02K16/04;;H02K21/24,,3,0,,,"International search report and written opinion for the equivalent PCT patent application No. PCT/US2014/046262 dated Nov. 14, 2014.;;International Preliminary Report on Patentability issued in corresponding International application PCT/US2014/046262 dated Feb. 11, 2016. 12 pages.;;First Office Action and Search Report issued in corresponding Chinese application 201480051857.4 dated Dec. 2, 2016. 22 pages.",ACTIVE
5,CA,A1,CA 2919967 A1,182-650-681-155-694,2015-02-05,2015,CA 2919967 A,2014-07-11,US 201313954865 A;;US 2014/0046262 W,2013-07-30,SUBMERSIBLE ELECTRICAL MACHINE AND METHOD,"A submersible electrical machine includes a first magnetic package spaced axially from a second magnetic package, a first stator displaced axially from the first magnetic package by a first air gap, a second stator displaced axially from the second magnetic package by a second air gap. The electrical machine can be operated as a generator or as a motor. When operating as a generator, a turbine can rotate the magnetic packages relative to the stators in response to fluid flowing axially across the electrical machine.",SCHLUMBERGER CA LTD,MILES JEROME;;DAHLGREN SCOTT;;BOSWELL CRAIG;;WOLSTON SCOTT;;ORBAN JACQUES;;MADSEN DANIEL,,https://lens.org/182-650-681-155-694,Patent Application,no,0,1,6,6,0,E21B47/13;;E21B41/0085;;E21B41/0085;;H02K5/12;;H02K5/12;;H02K5/1285;;H02K5/132;;H02K7/1823;;H02K7/1823;;H02K16/00;;H02K16/00;;H02K16/04;;H02K16/04;;H02K21/24;;H02K21/24,E21B12/00;;E21B41/00;;H02K5/12,,0,0,,,,DISCONTINUED
6,WO,A1,WO 2015/017110 A1,016-656-090-776-50X,2015-02-05,2015,US 2014/0046262 W,2014-07-11,US 201313954865 A,2013-07-30,SUBMERSIBLE ELECTRICAL MACHINE AND METHOD,"A submersible electrical machine includes a first magnetic package spaced axially from a second magnetic package, a first stator displaced axially from the first magnetic package by a first air gap, a second stator displaced axially from the second magnetic package by a second air gap. The electrical machine can be operated as a generator or as a motor. When operating as a generator, a turbine can rotate the magnetic packages relative to the stators in response to fluid flowing axially across the electrical machine.",SCHLUMBERGER CA LTD;;SCHLUMBERGER SERVICES PETROL;;SCHLUMBERGER HOLDINGS;;SCHLUMBERGER TECHNOLOGY BV;;PRAD RES & DEV LTD;;SCHLUMBERGER TECHNOLOGY CORP,MILES JEROME;;DAHLGREN SCOTT;;BOSWELL CRAIG;;WOLSTON SCOTT;;ORBAN JACQUES;;MADSEN DANIEL,,https://lens.org/016-656-090-776-50X,Patent Application,yes,5,3,6,6,0,E21B47/13;;E21B41/0085;;E21B41/0085;;H02K5/12;;H02K5/12;;H02K5/1285;;H02K5/132;;H02K7/1823;;H02K7/1823;;H02K16/00;;H02K16/00;;H02K16/04;;H02K16/04;;H02K21/24;;H02K21/24,E21B12/00;;E21B41/00;;H02K5/12,,0,0,,,,PENDING
7,CN,A,CN 105556053 A,197-946-285-935-303,2016-05-04,2016,CN 201480051857 A,2014-07-11,US 2014/0046262 W;;US 201313954865 A,2013-07-30,Submersible electrical machine and method,"A submersible electrical machine includes a first magnetic package spaced axially from a second magnetic package, a first stator displaced axially from the first magnetic package by a first air gap, a second stator displaced axially from the second magnetic package by a second air gap. The electrical machine can be operated as a generator or as a motor. When operating as a generator, a turbine can rotate the magnetic packages relative to the stators in response to fluid flowing axially across the electrical machine.",PRAD RES & DEV LTD,MILES JEROME;;DAHLGREN SCOTT;;BOSWELL CRAIG;;WOLSTON SCOTT;;ORBAN JACQUES;;MADSEN DANIEL,,https://lens.org/197-946-285-935-303,Patent Application,no,7,0,6,6,0,E21B47/13;;E21B41/0085;;E21B41/0085;;H02K5/12;;H02K5/12;;H02K5/1285;;H02K5/132;;H02K7/1823;;H02K7/1823;;H02K16/00;;H02K16/00;;H02K16/04;;H02K16/04;;H02K21/24;;H02K21/24,E21B12/00;;E21B41/00;;H02K5/12,,0,0,,,,DISCONTINUED
8,MX,A,MX 2014013578 A,027-677-759-381-422,2015-02-12,2015,MX 2014013578 A,2013-05-07,US 201261643813 P;;US 201261643823 P;;US 201261676042 P;;US 201261680045 P;;US 201261727961 P;;US 201361780039 P;;US 201361782757 P;;US 201361782859 P;;US 201361782951 P;;US 201361643813 P;;US 201361789135 P;;US 2013/0039809 W,2012-05-07,FLEXIBLE MATERIALS FOR FLEXIBLE CONTAINERS.,"A flexible material for a flexible container can include a first laminate and a second laminate joined to at least a portion of the first laminate by at least one seal. The first laminate can include a first gas barrier layer disposed between first and second sealable layers, wherein the first and second sealable layers define opposed exterior layers of the first laminate. The second laminate can include a third sealable layer defining an exterior layer of the second laminate, and a second gas barrier layer. The at least one seal joins a portion of the third sealable layer to at least a portion of the second sealable layer.",PROCTER & GAMBLE,STANLEY SCOTT KENDYL;;ARENT LEE MATHEW;;BOSWELL EMILY CHARLOTTE;;YOUJUN,,https://lens.org/027-677-759-381-422,Patent Application,no,0,0,5,183,0,B32B27/08;;B32B27/306;;B32B27/32;;B32B27/327;;B32B27/34;;B32B2307/548;;B32B27/08;;B32B27/306;;B32B27/32;;B32B27/327;;B32B27/34;;B32B2250/24;;B32B2270/00;;B32B2307/31;;B32B2307/54;;B32B2307/7244;;B32B2439/40;;B32B2439/70,B32B27/08;;B32B27/30;;B32B27/32;;B32B27/34,,0,0,,,,PENDING
9,MX,A,MX 2014013581 A,145-852-513-823-044,2014-12-04,2014,MX 2014013581 A,2013-05-07,US 201261643813 P;;US 201261643823 P;;US 201261676042 P;;US 201261680045 P;;US 201261727961 P;;US 201361780039 P;;US 201361782219 P;;US 201361782757 P;;US 201361782859 P;;US 201361782951 P;;US 201361789135 P;;US 2013/0039811 W,2012-05-07,FLEXIBLE MATERIALS FOR FLEXIBLE CONTAINERS.,"A flexible material for a flexible container can include a first laminate and a second laminate joined to at least a portion of the first laminate by at least one seal. The first laminate can include a first gas barrier layer disposed between first and second sealable layers, wherein the first and second sealable layers define opposed exterior layers of the first laminate. The second laminate can include a third sealable layer defining an exterior layer of the second laminate, and a second gas barrier layer. The at least one seal joins a portion of the third sealable layer to at least a portion of the second sealable layer.",PROCTER & GAMBLE,STANLEY SCOTT KENDYL;;ARENT LEE MATHEW;;BOSWELL EMILY CHARLOTTE;;YOUJUN,,https://lens.org/145-852-513-823-044,Patent Application,no,0,0,118,183,0,B32B7/12;;B32B27/08;;B32B27/306;;B32B27/32;;B32B27/327;;B32B27/34;;B32B27/36;;B65D31/16;;B65D33/004;;B65D33/02;;B65D75/008;;B65D75/525;;B65D75/54;;B32B2307/31;;B32B2307/7246;;B32B2307/7244;;B32B2307/7242;;B32B2270/00;;B32B2250/24;;B32B2255/10;;B32B2439/40;;B32B2439/70;;B65D75/5883;;B65D75/5877;;B65D75/5866;;B65D75/20;;B65D75/566;;B32B7/12;;B32B27/306;;B32B27/32;;B32B27/327;;B32B27/34;;B32B27/36;;B65D75/008;;B65D75/525;;B65D75/54;;B65D33/004;;B65D75/5883;;B32B2250/24;;B32B2255/10;;B32B2270/00;;B32B2307/31;;B32B2307/7242;;B32B2307/7244;;B32B2307/7246;;B32B2439/40;;B32B2439/70;;B65D75/20;;B65D75/566;;B65D31/16;;B65D75/5866;;B65D75/5877;;B65D33/02;;Y10T428/24942;;Y10T428/31913;;Y10T428/31746;;Y10T428/31797;;B32B27/08;;B32B2307/54;;B32B2307/548;;B32B3/12;;B32B7/02;;B32B7/12;;B32B27/08;;B32B27/20;;B32B37/10;;B65D33/00;;B65D75/52;;B32B27/306;;B32B27/327;;B32B27/34;;B32B27/36;;B65D33/008;;B65D75/008;;B65D75/5883;;B65D75/5894;;B65D81/3288;;B32B27/325;;B65D31/16;;B65D31/18;;B65D75/525;;B65D75/5866;;Y10S383/906;;B32B2307/54;;B32B2307/548;;B32B2307/31;;B32B2307/7244;;B32B2250/24;;B32B2255/10;;B32B2270/00;;B32B2439/40;;B32B27/08;;B65D75/00;;B65D75/58;;B65D31/00;;B32B27/34;;B32B27/32;;B32B27/30;;B65D85/00;;Y10T428/24942;;Y10T428/31913;;Y10T428/31746;;Y10T428/31797;;B65D27/00;;B65D37/00;;B65D33/02;;B32B7/12;;B32B27/306;;B32B27/32;;B32B27/327;;B32B27/34;;B32B27/36;;B65D75/008;;B65D75/525;;B65D75/54;;B65D33/004;;B65D75/5883;;B32B2250/24;;B32B2255/10;;B32B2270/00;;B32B2307/31;;B32B2307/7242;;B32B2307/7244;;B32B2307/7246;;B32B2439/40;;B32B2439/70;;B65D75/20;;B65D75/566;;B65D31/16;;B65D75/5866;;B65D75/5877;;B32B1/00;;B65D25/14;;B65D1/42;;B65D21/0201;;B65D35/10;;B65D31/00;;B32B27/08;;B32B27/30,B32B7/12;;B32B27/08;;B32B27/30;;B32B27/32;;B32B27/34;;B32B27/36;;B65D33/00;;B65D75/00;;B65D75/52;;B65D75/54;;B65D75/58;;B65D81/32,,0,0,,,,PENDING
10,RU,C2,RU 2587707 C2,050-431-597-931-05X,2016-06-20,2016,RU 2014144070 A,2013-05-07,US 201261643813 P;;US 201261643823 P;;US 201261676042 P;;US 201261680045 P;;US 201261727961 P;;US 201361780039 P;;US 201361782219 P;;US 201361782951 P;;US 201361782859 P;;US 201361782757 P;;US 201361789135 P;;US 2013/0039811 W,2012-05-07,ELASTIC MATERIALS FOR ELASTIC CONTAINERS,"FIELD: packaging industry.SUBSTANCE: invention relates to laminar materials for packing of fluids and concerns elastic material for elastic containers. Elastic material comprises compartment providing support structure and product compartment, wherein said elastic material comprises first laminate and second laminate connected with at least part of first laminate by at least one fastening. First laminate comprises first gas-impermeable layer arranged between first and second fixed layers, wherein first and second secured layers make opposite outer layers of first laminate. Second laminate comprises third attached layer making outer layer of second laminate, and second gas-impermeable layer. At least one attachment connects fixed part of third layer with at least part of second fixed layer for formation of at least one boundary, which provides compartment support structure, which is located between first and second laminates. Elastic material is characterised by gas permeability from 0.05 cm/m·day·atm to 18 cm/m·day·atm in area forming compartment support structure.EFFECT: invention provides creation of container for fluid products functional and technological in production.20 cl, 58 dwg, 8 ex",PROCTER & GAMBLE,STANLEY SCOTT KENDYL;;YOU JUN;;BOSWELL EMILY CHARLOTTE;;ARENT LEE MATHEW,,https://lens.org/050-431-597-931-05X,Granted Patent,no,0,0,118,183,0,B32B7/12;;B32B27/08;;B32B27/306;;B32B27/32;;B32B27/327;;B32B27/34;;B32B27/36;;B65D31/16;;B65D33/004;;B65D33/02;;B65D75/008;;B65D75/525;;B65D75/54;;B32B2307/31;;B32B2307/7246;;B32B2307/7244;;B32B2307/7242;;B32B2270/00;;B32B2250/24;;B32B2255/10;;B32B2439/40;;B32B2439/70;;B65D75/5883;;B65D75/5877;;B65D75/5866;;B65D75/20;;B65D75/566;;B32B7/12;;B32B27/306;;B32B27/32;;B32B27/327;;B32B27/34;;B32B27/36;;B65D75/008;;B65D75/525;;B65D75/54;;B65D33/004;;B65D75/5883;;B32B2250/24;;B32B2255/10;;B32B2270/00;;B32B2307/31;;B32B2307/7242;;B32B2307/7244;;B32B2307/7246;;B32B2439/40;;B32B2439/70;;B65D75/20;;B65D75/566;;B65D31/16;;B65D75/5866;;B65D75/5877;;B65D33/02;;Y10T428/24942;;Y10T428/31913;;Y10T428/31746;;Y10T428/31797;;B32B27/08;;B32B2307/54;;B32B2307/548;;B32B3/12;;B32B7/02;;B32B7/12;;B32B27/08;;B32B27/20;;B32B37/10;;B65D33/00;;B65D75/52;;B32B27/306;;B32B27/327;;B32B27/34;;B32B27/36;;B65D33/008;;B65D75/008;;B65D75/5883;;B65D75/5894;;B65D81/3288;;B32B27/325;;B65D31/16;;B65D31/18;;B65D75/525;;B65D75/5866;;Y10S383/906;;B32B2307/54;;B32B2307/548;;B32B2307/31;;B32B2307/7244;;B32B2250/24;;B32B2255/10;;B32B2270/00;;B32B2439/40;;B32B27/08;;B65D75/00;;B65D75/58;;B65D31/00;;B32B27/34;;B32B27/32;;B32B27/30;;B65D85/00;;Y10T428/24942;;Y10T428/31913;;Y10T428/31746;;Y10T428/31797;;B65D27/00;;B65D37/00;;B65D33/02;;B32B7/12;;B32B27/306;;B32B27/32;;B32B27/327;;B32B27/34;;B32B27/36;;B65D75/008;;B65D75/525;;B65D75/54;;B65D33/004;;B65D75/5883;;B32B2250/24;;B32B2255/10;;B32B2270/00;;B32B2307/31;;B32B2307/7242;;B32B2307/7244;;B32B2307/7246;;B32B2439/40;;B32B2439/70;;B65D75/20;;B65D75/566;;B65D31/16;;B65D75/5866;;B65D75/5877;;B32B1/00;;B65D25/14;;B65D1/42;;B65D21/0201;;B65D35/10;;B65D31/00;;B32B27/08;;B32B27/30,B32B27/08;;B32B27/30;;B32B27/32;;B32B27/34;;B65D30/00,,0,0,,,,INACTIVE
11,US,B2,US 11015406 B2,057-177-681-653-594,2021-05-25,2021,US 201916253447 A,2019-01-22,US 201916253447 A;;US 201514741584 A;;US 201462018743 P,2014-06-30,Sensor activated downhole cutting tool,"A sensor assembly may include a housing made of a non-magnetic material. The housing may define an interior chamber. A shaft may extend from the housing. A bearing may be positioned around the shaft. An impeller may be positioned around the shaft and the bearing, and the impeller may include a magnetized portion. A sensor may be positioned within the interior chamber and/or proximate the magnetized portion. The sensor may detect the magnetized portion of the impeller to sense a rate of rotation of the impeller. The rate of rotation of the impeller may correspond to changes in flow rate of the fluid. As the flow rate of the fluid, and the rate of rotation of the impeller change in predetermined manners, control signals may be conveyed to activate a tool.",SCHLUMBERGER TECHNOLOGY CORP,ORBAN JACQUES;;BOSWELL R CRAIG;;WOOLSTON SCOTT RICHARD;;ENGLUND JORDAN DANE,,https://lens.org/057-177-681-653-594,Granted Patent,yes,83,0,5,5,0,G01N11/00;;G01N2011/0053;;G01F1/115;;E21B21/08;;E21B21/08;;E21B7/28;;G01F1/115;;G01N11/00;;G01N2011/0053,E21B21/08;;E21B7/28;;E21B10/32;;E21B47/10;;G01F1/115;;G01N11/00,,19,0,,,"International Search Report and Written Opinion issued in International Patent Application No. PCT/US2014/027634 dated Aug. 14, 2014, 17 pages.;;International Preliminary Report on Patentability issued in International Patent Application No. PCT/US2014/027634 dated Sep. 15, 2015.;;European Search Report issued in European Patent Application No. 14768506.9 dated Mar. 22, 2016, 4 pages.;;Communication Pursuant to Article 94(3) issued in European Patent Application No. 14768506.9 dated Apr. 13, 2016, 5 pages.;;Office Action issued in U.S. Appl. No. 14/208,512 dated Feb. 5, 2016, 12 pages.;;International Search Report and Written Opinion issued in International Patent Application No. PCT/US2014/027527 dated Jul. 3, 2014, 10 pages.;;International Preliminary Report on Patentability issued in International Patent Application No. PCT/US2014/027527 dated Sep. 15, 2015.;;European Search and Exam Report issued in European Patent Application No. 14768849.3 dated Mar. 9, 2016, 6 pages.;;European Search Report issued in European Patent Application No. 14768849.3 dated Feb. 12, 2016, 4 pages.;;International Search Report issued in International Patent Application No. PCT/US2015/037320 dated Sep. 25, 2015, 3 pages.;;International Preliminary Report on Patentability issued in International Patent Application No. PCT/US2015/037320 dated Jan. 3, 2017, 13 pages.;;Office Action issued in U.S. Appl. No. 14/741,584 dated Mar. 16, 2018, 19 pages.;;Office Action issued in U.S. Appl. No. 14/741,584 dated Aug. 21, 2017, 29 pages.;;Office Action issued in U.S. Appl. No. 14/208,639 dated Jun. 8, 2016, 12 pages.;;Office Action issued in U.S. Appl. No. 15/379,690 dated Mar. 28, 2018, 13 pages.;;Office Action issued in U.S. Appl. No. 15/379,690 dated Nov. 13, 2017, 10 pages.;;Office Action issued in U.S. Appl. No. 16/244,221 dated Jun. 19, 2020, 14 pages.;;Preliminary Office Action issued in Brazilian Patent Application 112015023687-1 dated Mar. 30, 2020, 6 pages with English translation.;;Examination Report issued in Canadian Patent Application 2,904,398 dated Jun. 9, 2020, 4 pages.",ACTIVE
12,CA,A1,CA 2873004 A1,192-016-260-060-923,2013-11-14,2013,CA 2873004 A,2013-05-07,US 201261643813 P;;US 201261643823 P;;US 201261676042 P;;US 201261680045 P;;US 201261727961 P;;US 201361780039 P;;US 201361782219 P;;US 201361782951 P;;US 201361782859 P;;US 201361782757 P;;US 201361789135 P;;US 2013/0039811 W,2012-05-07,FLEXIBLE MATERIALS FOR FLEXIBLE CONTAINERS,"A flexible material for a flexible container can include a first laminate and a second laminate joined to at least a portion of the first laminate by at least one seal. The first laminate can include a first gas barrier layer disposed between first and second sealable layers, wherein the first and second sealable layers define opposed exterior layers of the first laminate. The second laminate can include a third sealable layer defining an exterior layer of the second laminate, and a second gas barrier layer. The at least one seal joins a portion of the third sealable layer to at least a portion of the second sealable layer.",PROCTER & GAMBLE,STANLEY SCOTT KENDYL;;YOU JUN;;BOSWELL EMILY CHARLOTTE;;ARENT LEE MATHEW,,https://lens.org/192-016-260-060-923,Patent Application,no,0,2,118,183,0,B32B7/12;;B32B27/08;;B32B27/306;;B32B27/32;;B32B27/327;;B32B27/34;;B32B27/36;;B65D31/16;;B65D33/004;;B65D33/02;;B65D75/008;;B65D75/525;;B65D75/54;;B32B2307/31;;B32B2307/7246;;B32B2307/7244;;B32B2307/7242;;B32B2270/00;;B32B2250/24;;B32B2255/10;;B32B2439/40;;B32B2439/70;;B65D75/5883;;B65D75/5877;;B65D75/5866;;B65D75/20;;B65D75/566;;B32B7/12;;B32B27/306;;B32B27/32;;B32B27/327;;B32B27/34;;B32B27/36;;B65D75/008;;B65D75/525;;B65D75/54;;B65D33/004;;B65D75/5883;;B32B2250/24;;B32B2255/10;;B32B2270/00;;B32B2307/31;;B32B2307/7242;;B32B2307/7244;;B32B2307/7246;;B32B2439/40;;B32B2439/70;;B65D75/20;;B65D75/566;;B65D31/16;;B65D75/5866;;B65D75/5877;;B65D33/02;;Y10T428/24942;;Y10T428/31913;;Y10T428/31746;;Y10T428/31797;;B32B27/08;;B32B2307/54;;B32B2307/548;;B32B3/12;;B32B7/02;;B32B7/12;;B32B27/08;;B32B27/20;;B32B37/10;;B65D33/00;;B65D75/52;;B32B27/306;;B32B27/327;;B32B27/34;;B32B27/36;;B65D33/008;;B65D75/008;;B65D75/5883;;B65D75/5894;;B65D81/3288;;B32B27/325;;B65D31/16;;B65D31/18;;B65D75/525;;B65D75/5866;;Y10S383/906;;B32B2307/54;;B32B2307/548;;B32B2307/31;;B32B2307/7244;;B32B2250/24;;B32B2255/10;;B32B2270/00;;B32B2439/40;;B32B27/08;;B65D75/00;;B65D75/58;;B65D31/00;;B32B27/34;;B32B27/32;;B32B27/30;;B65D85/00;;Y10T428/24942;;Y10T428/31913;;Y10T428/31746;;Y10T428/31797;;B65D27/00;;B65D37/00;;B65D33/02;;B32B7/12;;B32B27/306;;B32B27/32;;B32B27/327;;B32B27/34;;B32B27/36;;B65D75/008;;B65D75/525;;B65D75/54;;B65D33/004;;B65D75/5883;;B32B2250/24;;B32B2255/10;;B32B2270/00;;B32B2307/31;;B32B2307/7242;;B32B2307/7244;;B32B2307/7246;;B32B2439/40;;B32B2439/70;;B65D75/20;;B65D75/566;;B65D31/16;;B65D75/5866;;B65D75/5877;;B32B1/00;;B65D25/14;;B65D1/42;;B65D21/0201;;B65D35/10;;B65D31/00;;B32B27/08;;B32B27/30,B32B7/12;;B32B27/08;;B32B27/30;;B32B27/32;;B32B27/34;;B32B27/36;;B65D33/00;;B65D75/00;;B65D75/52;;B65D75/54;;B65D75/58;;B65D81/32,,0,0,,,,DISCONTINUED
13,EP,A1,EP 2846998 A1,067-281-601-042-770,2015-03-18,2015,EP 13724976 A,2013-05-07,US 201261643813 P;;US 201261643823 P;;US 201261676042 P;;US 201261680045 P;;US 201261727961 P;;US 201361780039 P;;US 201361782219 P;;US 201361782951 P;;US 201361782859 P;;US 201361782757 P;;US 201361789135 P;;US 2013/0039809 W,2012-05-07,FLEXIBLE MATERIALS FOR FLEXIBLE CONTAINERS,,PROCTER & GAMBLE,STANLEY SCOTT KENDYL;;YOU JUN;;BOSWELL EMILY CHARLOTTE;;ARENT LEE MATHEW,,https://lens.org/067-281-601-042-770,Patent Application,yes,0,0,118,183,0,B32B7/12;;B32B27/08;;B32B27/306;;B32B27/32;;B32B27/327;;B32B27/34;;B32B27/36;;B65D31/16;;B65D33/004;;B65D33/02;;B65D75/008;;B65D75/525;;B65D75/54;;B32B2307/31;;B32B2307/7246;;B32B2307/7244;;B32B2307/7242;;B32B2270/00;;B32B2250/24;;B32B2255/10;;B32B2439/40;;B32B2439/70;;B65D75/5883;;B65D75/5877;;B65D75/5866;;B65D75/20;;B65D75/566;;B32B7/12;;B32B27/306;;B32B27/32;;B32B27/327;;B32B27/34;;B32B27/36;;B65D75/008;;B65D75/525;;B65D75/54;;B65D33/004;;B65D75/5883;;B32B2250/24;;B32B2255/10;;B32B2270/00;;B32B2307/31;;B32B2307/7242;;B32B2307/7244;;B32B2307/7246;;B32B2439/40;;B32B2439/70;;B65D75/20;;B65D75/566;;B65D31/16;;B65D75/5866;;B65D75/5877;;B65D33/02;;Y10T428/24942;;Y10T428/31913;;Y10T428/31746;;Y10T428/31797;;B32B27/08;;B32B2307/54;;B32B2307/548;;B32B3/12;;B32B7/02;;B32B7/12;;B32B27/08;;B32B27/20;;B32B37/10;;B65D33/00;;B65D75/52;;B32B27/306;;B32B27/327;;B32B27/34;;B32B27/36;;B65D33/008;;B65D75/008;;B65D75/5883;;B65D75/5894;;B65D81/3288;;B32B27/325;;B65D31/16;;B65D31/18;;B65D75/525;;B65D75/5866;;Y10S383/906;;B32B2307/54;;B32B2307/548;;B32B2307/31;;B32B2307/7244;;B32B2250/24;;B32B2255/10;;B32B2270/00;;B32B2439/40;;B32B27/08;;B65D75/00;;B65D75/58;;B65D31/00;;B32B27/34;;B32B27/32;;B32B27/30;;B65D85/00;;Y10T428/24942;;Y10T428/31913;;Y10T428/31746;;Y10T428/31797;;B65D27/00;;B65D37/00;;B65D33/02;;B32B7/12;;B32B27/306;;B32B27/32;;B32B27/327;;B32B27/34;;B32B27/36;;B65D75/008;;B65D75/525;;B65D75/54;;B65D33/004;;B65D75/5883;;B32B2250/24;;B32B2255/10;;B32B2270/00;;B32B2307/31;;B32B2307/7242;;B32B2307/7244;;B32B2307/7246;;B32B2439/40;;B32B2439/70;;B65D75/20;;B65D75/566;;B65D31/16;;B65D75/5866;;B65D75/5877;;B32B1/00;;B65D25/14;;B65D1/42;;B65D21/0201;;B65D35/10;;B65D31/00;;B32B27/08;;B32B27/30,B32B27/08;;B32B27/30;;B32B27/32;;B32B27/34,,0,0,,,,ACTIVE
