284,DK,T3,DK 2132230 T3,041-408-866-000-463,2014-06-30,2014,DK 08744179 T,2008-03-21,US 89633907 P;;US 2008/0057819 W,2007-03-22,"APOPTOTISKE ANTI-IGE-ANTISTOFFER, DER BINDER DET MEMBRANBUNDNE IGE",,GENENTECH INC,WU LAWREN;;BALAZS MERCEDESZ;;BRIGHTBILL HANS;;CHAN ANDREW;;CHEN YVONNE;;CHUNTHARAPAI ANAN;;DENNIS MARK;;WONG TERENCE,,https://lens.org/041-408-866-000-463,Granted Patent,no,0,0,56,56,0,A01K67/0278;;A01K2217/072;;A01K2227/105;;A01K2267/0387;;A61K2039/505;;C07K2317/21;;C07K2317/24;;C07K2317/41;;C07K2317/73;;C07K16/4291;;A61P1/04;;A61P11/00;;A61P11/02;;A61P11/06;;A61P13/10;;A61P17/00;;A61P17/04;;A61P19/00;;A61P31/10;;A61P33/00;;A61P35/00;;A61P37/00;;A61P37/02;;A61P37/06;;A61P37/08;;A61P43/00;;C07K16/42;;A61K39/395;;A01K2267/0387;;C07K2317/41;;A01K67/0278;;A01K2217/072;;A01K2227/105;;C07K2317/21;;C07K2317/24;;A61K2039/505;;C07K2317/73;;C07K16/4291,C07K16/42;;A01K67/027;;A61P37/06,,0,0,,,,ACTIVE
285,AU,A1,AU 2008/228778 A1,139-340-592-408-861,2008-09-25,2008,AU 2008/228778 A,2008-03-21,US 89633907 P;;US 2008/0057819 W,2007-03-22,Apoptotic anti- IgE antibodies binding the membrane-bound IgE,,GENENTECH INC,CHAN ANDREW;;DENNIS MARK;;BALAZS MERCEDESZ;;WONG TERENCE;;CHEN YVONNE;;BRIGHTBILL HANS;;CHUNTHARAPAI ANAN;;WU LAWREN,,https://lens.org/139-340-592-408-861,Patent Application,no,0,0,56,56,0,A01K67/0278;;A01K2217/072;;A01K2227/105;;A01K2267/0387;;A61K2039/505;;C07K2317/21;;C07K2317/24;;C07K2317/41;;C07K2317/73;;C07K16/4291;;A61P1/04;;A61P11/00;;A61P11/02;;A61P11/06;;A61P13/10;;A61P17/00;;A61P17/04;;A61P19/00;;A61P31/10;;A61P33/00;;A61P35/00;;A61P37/00;;A61P37/02;;A61P37/06;;A61P37/08;;A61P43/00;;C07K16/42;;A61K39/395;;A01K2267/0387;;C07K2317/41;;A01K67/0278;;A01K2217/072;;A01K2227/105;;C07K2317/21;;C07K2317/24;;A61K2039/505;;C07K2317/73;;C07K16/4291,C07K16/42;;A61P37/06,,0,0,,,,INACTIVE
286,US,B2,US 8586040 B2,181-276-584-127-209,2013-11-19,2013,US 201113281209 A,2011-10-25,US 201113281209 A;;US 5306308 A;;US 89633907 P,2007-03-22,Methods of using apoptotic anti-IGE antibodies,"The present application relates to apoptotic anti-IgE antibodies, nucleic acid encoding the same, therapeutic compositions thereof, and their use in the treatment of IgE-mediated disorders.",WU LAWREN;;BALAZS MERCEDESZ;;BRIGHTBILL HANS;;CHAN ANDY;;CHEN YVONNE;;CHUNTHARAPAI ANAN;;DENNIS MARK;;WONG TERENCE;;GENENTECH INC,WU LAWREN;;BALAZS MERCEDESZ;;BRIGHTBILL HANS;;CHAN ANDY;;CHEN YVONNE;;CHUNTHARAPAI ANAN;;DENNIS MARK;;WONG TERENCE,,https://lens.org/181-276-584-127-209,Granted Patent,yes,35,4,56,56,112,A01K67/0278;;A01K2217/072;;A01K2227/105;;A01K2267/0387;;A61K2039/505;;C07K2317/21;;C07K2317/24;;C07K2317/41;;C07K2317/73;;C07K16/4291;;A61P1/04;;A61P11/00;;A61P11/02;;A61P11/06;;A61P13/10;;A61P17/00;;A61P17/04;;A61P19/00;;A61P31/10;;A61P33/00;;A61P35/00;;A61P37/00;;A61P37/02;;A61P37/06;;A61P37/08;;A61P43/00;;C07K16/42;;A61K39/395;;A01K2267/0387;;C07K2317/41;;A01K67/0278;;A01K2217/072;;A01K2227/105;;C07K2317/21;;C07K2317/24;;A61K2039/505;;C07K2317/73;;C07K16/4291,A61K39/00,424/139.1;;424/133.1;;424/144.1;;424/153.1;;424/805;;424/810,52,41,079-641-458-974-955;;012-766-659-499-706;;026-394-549-918-010;;031-155-990-917-687;;169-898-528-890-498;;016-159-131-505-996;;098-430-732-762-189;;005-288-963-505-077;;049-134-753-209-354;;047-666-521-157-692;;037-250-999-819-307;;125-421-571-646-808;;081-796-381-766-573;;014-120-339-887-224;;011-664-260-437-411;;037-018-511-164-049;;086-096-098-843-89X;;050-959-366-576-084;;102-239-156-414-748;;043-856-845-093-906;;104-370-350-200-141;;002-348-443-531-16X;;067-287-661-835-147;;087-297-425-142-95X;;011-174-345-245-142;;014-190-984-734-267;;098-563-753-507-901;;008-757-580-600-622;;045-556-293-127-132;;031-816-544-752-97X;;149-540-380-570-946;;002-305-399-176-585;;138-157-823-727-156;;029-062-984-888-15X;;015-239-659-590-870;;014-330-136-504-946;;008-783-229-055-363;;134-958-999-769-59X;;027-477-313-726-928;;023-154-204-899-879;;051-508-475-126-991,9188850;;10.1016/s0161-5890(96)00110-1;;pmc2196392;;8976175;;10.1084/jem.184.6.2197;;pmc1555307;;6807838;;10.1016/s0091-6749(97)70202-1;;9257795;;16722326;;10.1016/s0065-2776(06)93002-8;;17383539;;12218370;;10.1159/000063860;;20083663;;10.4049/jimmunol.0902437;;10.1016/0022-2836(87)90412-8;;3681981;;pmc507895;;9062345;;10.1172/jci119252;;10.1016/j.ejphar.2005.12.045;;16464445;;10.1038/nbt0191-53;;1370037;;18390733;;10.4049/jimmunol.180.8.5499;;pmc2959155;;pmc1414812;;7927502;;2185467;;pmc53900;;10.1073/pnas.87.9.3363;;8254205;;pmc42997;;10.1073/pnas.91.2.604;;7507250;;10.1038/363446a0;;8502296;;1937909;;10.1159/000235333;;15969677;;10.1111/j.1398-9995.2005.00832.x;;10.1111/1523-1747.ep12286482;;9036935;;16219319;;10.1016/j.jim.2005.08.009;;1727861;;10.4049/jimmunol.177.6.3597;;16951319;;8784342;;10.1038/nsb0996-733;;7522164;;10.1002/eji.1830240934;;1701791;;10.1067/mai.2001.115625;;11398080;;10.1016/s1074-7613(00)00006-6;;10933393;;2369921;;10.1002/eji.1830200630;;12700943;;10.1007/s00262-002-0347-6;;10.1007/s00429-009-0230-8;;19937345;;10.1016/s0378-1119(98)00607-6;;9931414;;17943232;;10.1007/s12026-007-8008-7;;10.4049/jimmunol.150.3.880;;8423344;;15809359;;10.1161/01.hyp.0000161995.64192.2b;;10.1191/0961203302lu305rr;;12529049;;15699570;;10.1385/mb:29:2:153;;10.1073/pnas.79.6.1979;;pmc346105;;6804947;;10.1161/01.atv.20.6.1425;;10845854;;10.1016/s0168-1656(02)00105-0;;pmc7252021;;12204554,"Anand, S. et al., ""Multiple transcripts of the murine immunoglobulin epsilon membrane locus are generated by alternative splicing and differential usage of two polyadenylation sites"" Molecular Immunology 34(2):175-183 (1997).;;Austrian Search Report GCC/P/2008/10423, mailing date Sep. 9, 2011, pp. 1-14 (Sep. 9, 2011).;;Batista, F. et al., ""The two membrane isoforms of human IgE assemble into functionally distinct B cell antigen receptors"" Journal of Experimental Medicine 184:2197-2205 (Dec. 1996).;;Bozelka, B. et al., ""IgE isotype suppression in anti-epsilon-treated mice"" Immunology 46:527-532 (1982).;;Casale, T. et al., ""Use of an anti-IgE humanized monoclonal antibody in ragweed-induced allergic rhinitis"" J. Allergy Clin. Immunol. 100(1):110-121 (Jul. 1997).;;Chang, T.W., ""Developing Antibodies for Targeting Immunoglobulin and Membrane-Bound Immunoglobulin E"" Allergy and Asthma Proceedings: The Official Journal of Regional and State Allergy Societies 2006 27(2):S7-S14 (Mar. 2006).;;Chang, Tse Wen et al., ""Anti-IgE antibodies for the treatment of IgE-mediated allergic diseases"" Advances in Immunol. 93:63-119 (2007).;;Chen, H. Y. et al., ""Generation and Characterization of Monoclonal Antibodies Against a Segment (epsilonm67) Uniquely Present in Membrane-Bound IgE"" FASEB Journal 15(5):A1018 (Mar. 8, 2001).;;Chen, H. Y. et al., ""Monoclonal Antibodies Against the C(epsilon)mX Domain of Human Membrane-Bound IgE and Their Potential Use for Targeting IgE-Expressing B Cells"" Int. Arch Allergy Immunology 128(4):315-324 (Aug. 2002).;;Chen, Jiun-Bo et al., ""Unique Epitopes on CepsilonmX in IgE-B Cell Receptors Are Potentially Applicable for Targeting IgE-Committed B Cells"" The Journal of Immunology 184:1748-1756 (Jan. 2010).;;Chothia and Lesk, ""Canonical structures for the hypervariable regions of immunoglobulins"" J. Mol. Biol. 196:901-917 (1987).;;Corne, J. et al., ""The effect of intravenous administration of a chimeric anti-IgE antibody on serum IgE levels in atopic subjects: efficacy, safety and pharmacokinetics"" J. Clin. Invest. 99(5):879-887 (Mar. 1997).;;Crestani, E. et al., ""In Vivo Association of Cytokine Production and IgE Levels in Infants and Adults"" J Allergy Clin Immunol 113(2):S87 (Feb. 2004).;;D'Amato, Gennaro ""Role of anti-IgE monoclonal antibody (omalizumab in the treatment of bronchial asthma and allergic respiratory diseases"" European Journal of Pharmacology 533:302-307 (Feb. 7, 2006).;;Davis, F. et al., ""An epitope on membrane-bound but not secreted IgE: implications in isotype-specific regulation"" Bio/Technology 9:53-56 (Jan. 1991).;;Feichtner, S. et al., ""Targeting the Extracellular Membrane-Proximal Domain of Membrane-Bound IgE by Passive Immunization Blocks IgE Synthesis in Vivo"" Journal of Immunology 180(8):5499-5505 (Apr. 15, 2008).;;Haak-Frendscho et al., ""Administration of an anti-IgE antibody inhhibits CD23 expression and IgE production in vivo"" Immunology 82:306-313 (1994).;;Haba and Nisinoff, ""Inhibition of IgE synthesis by anti-IgE: Role in long-term inhibition of IgE synthesis by neonatally administered soluble IgE"" Proc. Natl. Acad. Sci. USA 87:3363-3367 (May 1990).;;Haba and Nisonoff, ""Effects of syngeneic anti-IgE antibodies on the development of IgE memory and on the secondary IgE response"" J. Immunol. 152:51-57 (1994).;;Haba and Nisonoff, ""Role of antibody and T cells in the long-term inhibition of IgE synthesis"" Proc. Natl. Acad. Sci. USA 91:604-608 (Jan. 1994).;;Hamers-Casterman et al., ""Naturally occurring antibodies devoid of light chains"" Nature 363:446-448 (Jun. 3, 1993).;;Heusser, Ch.H. et al., ""New concepts of IgE regulation"" Int. Arch. Allergy Appl. Immunol. 94:87-90 (1991).;;Infuhr, D. et al., ""Molecular and Cellular Targets of Anti-IgE Antibodies"" Allergy 60(8):977-985 (Aug. 2005).;;Johansson, S.G.O., ""IgE in allergic diseases"" Proc. roy. Soc. Med. 62:37-38 (975-976) (Sep. 1969).;;Johnson and Wu Methods in Molecular Biology ""The Kabat Database and a Bioinformatics Example"" Lo ed., Totowa, NJ:Human Press, vol. 248:11-25 (2003).;;Klubal, R. et al., ""The high-affinity receptor for IgE is the predominant IgE-binding structure in lesional skin of atopic dermatitis patients"" J. Invest. Dermatol. 108:336-342 (1997).;;Niwa, Rinpei et al., ""IgG subclass-independent improvement of antibody-dependent cellular cytotoxicity by fucose removal from Asn297-linked Oligosaccharides"" Immunological Mathods 306:151-160 (Aug. 10, 2005).;;Peng, C. et al., ""A new isoform of human membrane-bound IgE"" J. Immunol. 148:129-136 (Jan. 1, 1992).;;Poggianella, M. et al., ""The Extracellular Membrane-Proximal Domain of Human Membrane IgE Controls Apoptotic Signaling of the B Cell Receptor in the Mature B Cell Line A20"" Journal of Immunology 177(6):3597-3605 (Sep. 15, 2006).;;Sheriff and Constantine, ""Redefining the minimal antigen-binding fragment"" Nature Struct Biol 3(9):733-736 (Sep. 1996).;;Stampfli, M. et al., ""Inhibition of human IgE synthesis by anti-IgE antibodies requires divalent recognition"" Eur. J. of Immunol. 24:2161-2167 (1994).;;Sun, L. K. et al., ""Transfectomas expressing both secreted and membrane-bound forms of chimeric IgE with anti-viral specificity"" J. Immunol. 146(1):199-205 (Jan. 1, 1991).;;Terr, A.I., ""The Atopic Diseases"" Med. Immunol., Stites et al., 9th edition, Stamford, Connecticut:Appleton & Lange, Chapter 27, (1997).;;Tumas, D.B. et al., ""Anti-IgE Efficacy in Murine Asthma Models is Dependent on the Method of Allergen Sensitization"" The Journal of Allergy and Clinical Immunology 107(6):1025-1033 (Jun. 2001).;;Xu and Davis, ""Diversity in the CDR3 region of V H is sufficient for most antibody specificities"" Immunity 13:37-45 (Jul. 2000).;;Benhamou et al., ""Anti-immunoglobulins induce death by apoptosis in WEHI-231 B lymphoma cells"" Eur. J. Immunol 20:1405-1407 ( 1990).;;Chinn et al., ""Antibody therapy of non-Hodgkin's B-cell lymphoma"" Cancer Immunol Immunother 52:257-280 ( 2003).;;Janeway, Jr. et al. ImmunoBiology: the immune system in health and disease 6th edition, New York:Garland Science,:352, 353, 401, 402 ( 2005).;;Rituxan ® (Rituximab) Proposed Mechanism of Action, pp. 1-3 (Internet Retrieval Date Oct. 5, 2012).;;Fundamental Immunology Paul, W. ed., Third edition, New York:Raven Press,:242 ( 1993).;;Gama Sosa et al., ""Animal transgenesis: an overview"" Brain Struct Funct 214:91-109 ( 2010).;;Janeway et al. Immunobiology Third edition,Garland Press,:3:1 - 3:11 ( 1997).;;Kolb et al., ""Insertion of a foreign gene into the Beta-casein locus by Cre-mediated site-specific recombination"" Gene 227:21-31 ( 1999).;;Kumar et al., ""Understanding B-cell tolerance through the use of immunoglobulin transgenic models"" Immunol Res 40:208-223 ( 2008).;;Portolano et al., ""Lack of promiscuity in autoantigen-specific H and L chain combinations as revealed by human H and L chain 'Roulette""' J Immunol 150(3):880-887 (Feb. 1993).;;Qi et al., ""A New Transgenic Rat Model of Hepatic Steatosis and the Metabolic Syndrome"" Hypertension 45:1004-1011 ( 2005).;;Ravirajan et al., ""Transgenic models of tolerance and autoimmunity: with special reference to systemic lupus erythematosus"" Lupus 11:843-849 ( 2002).;;Ristevski, ""Making Better Transgenic Models"" Molecular Biotechnology 29:153-163 ( 2005).;;Rudikoff et al., ""Single amino acid substitution altering antigen-binding specificity"" P Natl Acad Sci USA 79:1979-1983 (Mar. 1982).;;Sigmund, Arteroscler Throm Vasc Biol 20:1425-1429 ( 2000).;;Smith et al., ""Gene Transfer in higher animals: theoretical considerations and key concepts"" J Biotechnol 99(1):1-22 ( 2002).;;Third Party Submission under 37 CFR 1.290 filed Oct. 23, 2012.",INACTIVE
287,CR,A,CR 11035 A,193-646-878-592-393,2009-12-03,2009,CR 11035 A,2009-09-18,US 89633907 P,2007-03-22,ANTICUERPOS ANTI-IGE APOPTOTICOS LIGANDO LA MEMBRANA- ATADA IGE,"La presente solicitud guarda relacion con anti-IgE apoptoticos, con el acido nucleico que los codifica, con composiciones terapeuticas de estos y con su uso en el tratamiento de trastornos mediados por IgE.",GENENTECH INC,WU LAWREN;;BALAZS MERCEDESZ;;BRIGHTBILL HANS;;CHAN ANDREW;;CHEN YVONNE;;CHUNTHARAPAI ANAN;;DENNIS MARK;;WONG TERENCE,,https://lens.org/193-646-878-592-393,Patent Application,no,0,0,56,56,0,A01K67/0278;;A01K2217/072;;A01K2227/105;;A01K2267/0387;;A61K2039/505;;C07K2317/21;;C07K2317/24;;C07K2317/41;;C07K2317/73;;C07K16/4291;;A61P1/04;;A61P11/00;;A61P11/02;;A61P11/06;;A61P13/10;;A61P17/00;;A61P17/04;;A61P19/00;;A61P31/10;;A61P33/00;;A61P35/00;;A61P37/00;;A61P37/02;;A61P37/06;;A61P37/08;;A61P43/00;;C07K16/42;;A61K39/395;;A01K2267/0387;;C07K2317/41;;A01K67/0278;;A01K2217/072;;A01K2227/105;;C07K2317/21;;C07K2317/24;;A61K2039/505;;C07K2317/73;;C07K16/4291,A61P37/06;;C07K16/42,,0,0,,,,PENDING
288,JP,A,JP 2001273607 A,197-169-204-095-717,2001-10-05,2001,JP 2001055070 A,2001-02-28,US 51916000 A,2000-03-06,"MAGNETIC HEAD, ITS MANUFACTURING METHOD, AND HARD DISK DRIVE","PROBLEM TO BE SOLVED: To provide a magnetic head wherein the leakage of a magnetic flux passed through a surface gap is extremely small, and its manufacturing method, and a hard disk drive having the magnetic head loaded. SOLUTION: A magnetic head 38 has a first magnetic pole composed of double layers. This first magnetic pole has a first magnetic pole layer formed on a reading head element, and a second magnetic pole layer formed on the first magnetic pole layer. The second magnetic pole layer is formed to be a pattern so as to have an opening formed in the vicinity of the upper end position of a substantially formed second magnetic pole tip part 76. A surface gap distance between the upper end of a second magnetic pole tip part and the first magnetic pole layer 68 is increased, and the leakage of a magnetic flux crossing a surface gap 72 is reduced. According to one embodiment, the second magnetic pole layer, is provided as a single integrated formed layer having an opening. According to another embodiment, the second magnetic pole layer is formed as two independent parts having openings.",IBM,WEN-CHEN DAVID SHIAO;;TERENCE TIN-LOCK LAMB;;LEE EDWARD HINPONG;;YANSHEN RUO;;YUAN SAMUEL WONDER,,https://lens.org/197-169-204-095-717,Patent Application,no,0,0,2,2,0,,G11B5/31;;G11B5/187;;G11B5/23;;G11B5/245,,0,0,,,,PENDING
289,US,A1,US 2014/0115729 A1,024-075-095-051-190,2014-04-24,2014,US 201314137927 A,2013-12-20,US 201314137927 A;;US 201113281126 A;;US 5306308 A;;US 89633907 P,2007-03-22,APOPTOTIC ANTI-IGE ANTIBODIES,"The present application relates to apoptotic anti-IgE antibodies, nucleic acid encoding the same, therapeutic compositions thereof, and their use in the treatment of IgE-mediated disorders.",GENENTECH INC,WU LAWREN;;BALAZS MERCEDESZ;;BRIGHTBILL HANS;;CHAN ANDREW;;CHEN YVONNE;;CHUNTHARAPAI ANAN;;DENNIS MARK;;WONG TERENCE,,https://lens.org/024-075-095-051-190,Patent Application,yes,7,1,56,56,112,A01K67/0278;;A01K2217/072;;A01K2227/105;;A01K2267/0387;;A61K2039/505;;C07K2317/21;;C07K2317/24;;C07K2317/41;;C07K2317/73;;C07K16/4291;;A61P1/04;;A61P11/00;;A61P11/02;;A61P11/06;;A61P13/10;;A61P17/00;;A61P17/04;;A61P19/00;;A61P31/10;;A61P33/00;;A61P35/00;;A61P37/00;;A61P37/02;;A61P37/06;;A61P37/08;;A61P43/00;;C07K16/42;;A61K39/395;;A01K2267/0387;;C07K2317/41;;A01K67/0278;;A01K2217/072;;A01K2227/105;;C07K2317/21;;C07K2317/24;;A61K2039/505;;C07K2317/73;;C07K16/4291,C07K16/42,800/18;;530/387.2;;530/326;;530/327;;424/131.1;;536/23.53;;435/320.1;;435/327;;435/69.6,0,0,,,,DISCONTINUED
290,NZ,A,NZ 580553 A,061-481-678-152-044,2012-05-25,2012,NZ 58055308 A,2008-03-21,US 89633907 P;;US 2008/0057819 W,2007-03-22,APOPTOTIC ANTI- IGE ANTIBODIES BINDING THE MEMBRANE-BOUND IGE,"Provided is an anti-IgE/M1' antibody that specifically binds an epitope in the M1' segment of IgE defined by residues 317 to 352 of SEQ ID NO:1 and which induces apoptosis in IgE-expressing B-cells. Further provided are deposited murine hybridomas expressing such antibodies, methods of antibody production and use of the antibodies against IgE mediated disorders, including allergies, asthma and IgE myeloma.",GENENTECH INC,WU LAWREN;;BALAZS MERCEDESZ;;BRIGHTBILL HANS;;CHAN ANDREW;;CHEN YVONNE;;CHUNTHARAPAI ANAN;;DENNIS MARK;;WONG TERENCE,"GENENTECH, INC., US (2012-03-30)",https://lens.org/061-481-678-152-044,Patent Application,no,0,0,56,56,0,A01K67/0278;;A01K2217/072;;A01K2227/105;;A01K2267/0387;;A61K2039/505;;C07K2317/21;;C07K2317/24;;C07K2317/41;;C07K2317/73;;C07K16/4291;;A61P1/04;;A61P11/00;;A61P11/02;;A61P11/06;;A61P13/10;;A61P17/00;;A61P17/04;;A61P19/00;;A61P31/10;;A61P33/00;;A61P35/00;;A61P37/00;;A61P37/02;;A61P37/06;;A61P37/08;;A61P43/00;;C07K16/42;;A61K39/395;;A01K2267/0387;;C07K2317/41;;A01K67/0278;;A01K2217/072;;A01K2227/105;;C07K2317/21;;C07K2317/24;;A61K2039/505;;C07K2317/73;;C07K16/4291,C07K16/42;;A61P37/06,,0,0,,,,DISCONTINUED
291,EP,A1,EP 2644621 A1,103-600-514-471-912,2013-10-02,2013,EP 13165235 A,2008-03-21,US 89633907 P;;EP 08744179 A,2007-03-22,Apoptotic anti-IgE antibodies,"The present application relates to apoptotic anti-IgE antibodies, nucleic acid encoding the same, therapeutic compositions thereof, and their use in the treatment of IgE-mediated disorders.
",GENENTECH INC,WU LAWREN;;BALAZS MERCEDESZ;;BRIGHTBILL HANS;;CHAN ANDREW;;CHEN YVONNE;;CHUNTHARAPAI ANAN;;DENNIS MARK;;WONG TERENCE,,https://lens.org/103-600-514-471-912,Patent Application,yes,0,0,56,56,112,A01K67/0278;;A01K2217/072;;A01K2227/105;;A01K2267/0387;;A61K2039/505;;C07K2317/21;;C07K2317/24;;C07K2317/41;;C07K2317/73;;C07K16/4291;;A61P1/04;;A61P11/00;;A61P11/02;;A61P11/06;;A61P13/10;;A61P17/00;;A61P17/04;;A61P19/00;;A61P31/10;;A61P33/00;;A61P35/00;;A61P37/00;;A61P37/02;;A61P37/06;;A61P37/08;;A61P43/00;;C07K16/42;;A61K39/395;;A01K2267/0387;;C07K2317/41;;A01K67/0278;;A01K2217/072;;A01K2227/105;;C07K2317/21;;C07K2317/24;;A61K2039/505;;C07K2317/73;;C07K16/4291,C07K16/42;;A01K67/027;;A61P37/06,,7,7,098-430-732-762-189;;169-898-528-890-498;;106-725-365-736-38X;;087-297-425-142-95X;;008-757-580-600-622;;043-856-845-093-906;;081-796-381-766-573,12218370;;10.1159/000063860;;16722326;;10.1096/fasebj.15.3.855;;10.4049/jimmunol.177.6.3597;;16951319;;10.1067/mai.2001.115625;;11398080;;15969677;;10.1111/j.1398-9995.2005.00832.x;;18390733;;10.4049/jimmunol.180.8.5499;;pmc2959155,"CHEN HUAN YUAN ET AL: ""Monoclonal antibodies against the C(epsilon)mX domain of human membrane-bound IgE and their potential use for targeting IgE-expressing B cells."", INTERNATIONAL ARCHIVES OF ALLERGY AND IMMUNOLOGY AUG 2002, vol. 128, no. 4, August 2002 (2002-08-01), pages 315 - 324, XP008083849, ISSN: 1018-2438;;CHANG TSE WEN: ""Developing antibodies for targeting immunoglobulin and membrane-bound immunoglobulin E."", ALLERGY AND ASTHMA PROCEEDINGS : THE OFFICIAL JOURNAL OF REGIONAL AND STATE ALLERGY SOCIETIES 2006 MAR-APR, vol. 27, no. 2 Suppl 1, March 2006 (2006-03-01), pages S7 - 14, XP008083904, ISSN: 1088-5412;;CHEN HUAN YUAN ET AL: ""Generation and characterization of monoclonal antibodies against a segment (epsilonm67) uniquely present in membrane-bound IgE"", FASEB JOURNAL, vol. 15, no. 5, 8 March 2001 (2001-03-08), & ANNUAL MEETING OF THE FEDERATION OF AMERICAN SOCIETIES FOR EXPERIMENTAL BIOLOGY ON EXPERIMENTAL BIOL; ORLANDO, FLORIDA, USA; MARCH 31-APRIL 04, 2001, pages A1018, XP008095920, ISSN: 0892-6638;;POGGIANELLA MONICA ET AL: ""The extracellular membrane-proximal domain of human membrane IgE controls apoptotic signaling of the B cell receptor in the mature B cell line A20."", JOURNAL OF IMMUNOLOGY (BALTIMORE, MD. : 1950) 15 SEP 2006, vol. 177, no. 6, 15 September 2006 (2006-09-15), pages 3597 - 3605, XP002494041, ISSN: 0022-1767;;TUMAS D B ET AL: ""Anti-IgE efficacy in murine asthma models is dependent on the method of allergen sensitization."", THE JOURNAL OF ALLERGY AND CLINICAL IMMUNOLOGY JUN 2001, vol. 107, no. 6, June 2001 (2001-06-01), pages 1025 - 1033, XP002494042, ISSN: 0091-6749;;INFÜHR D ET AL: ""Molecular and cellular targets of anti-IgE antibodies."", ALLERGY AUG 2005, vol. 60, no. 8, August 2005 (2005-08-01), pages 977 - 985, XP002494043, ISSN: 0105-4538;;FEICHTNER STEFAN ET AL: ""Targeting the extracellular membrane-proximal domain of membrane-bound IgE by passive immunization blocks IgE synthesis in vivo."", JOURNAL OF IMMUNOLOGY (BALTIMORE, MD. : 1950) 15 APR 2008, vol. 180, no. 8, 15 April 2008 (2008-04-15), pages 5499 - 5505, XP002494044, ISSN: 0022-1767",ACTIVE
292,ES,T3,ES 2478242 T3,107-978-972-674-880,2014-07-21,2014,ES 08744179 T,2008-03-21,US 89633907 P;;US 2008/0057819 W,2007-03-22,Anticuerpos anti IgE apoptóticos que se unen con el IgE unido a membrana,Un anticuerpo anti IgE/M1' que se une específicamente con un epítopo en el segmento M1' de IgE definido por los restos 317 a 351 de SEC ID Nº: 1 y que induce apoptosis en linfocitos B que expresan IgE.,GENENTECH INC,WU LAWREN;;BALAZS MERCEDESZ;;BRIGHTBILL HANS;;CHAN ANDREW;;CHEN YVONNE;;CHUNTHARAPAI ANAN;;DENNIS MARK;;WONG TERENCE,,https://lens.org/107-978-972-674-880,Granted Patent,no,0,0,56,56,0,A01K67/0278;;A01K2217/072;;A01K2227/105;;A01K2267/0387;;A61K2039/505;;C07K2317/21;;C07K2317/24;;C07K2317/41;;C07K2317/73;;C07K16/4291;;A61P1/04;;A61P11/00;;A61P11/02;;A61P11/06;;A61P13/10;;A61P17/00;;A61P17/04;;A61P19/00;;A61P31/10;;A61P33/00;;A61P35/00;;A61P37/00;;A61P37/02;;A61P37/06;;A61P37/08;;A61P43/00;;C07K16/42;;A61K39/395;;A01K2267/0387;;C07K2317/41;;A01K67/0278;;A01K2217/072;;A01K2227/105;;C07K2317/21;;C07K2317/24;;A61K2039/505;;C07K2317/73;;C07K16/4291,C07K16/42;;A01K67/027;;A61P37/06,,0,0,,,,ACTIVE
293,CN,A,CN 101679528 A,145-410-085-331-706,2010-03-24,2010,CN 200880016908 A,2008-03-21,US 2008/0057819 W;;US 89633907 P,2007-03-22,Apoptotic anti-ige antibodies,"The present application relates to apoptotic anti-IgE antibodies, nucleic acid encoding the same, therapeutic compositions thereof, and their use in the treatment of IgE-mediated disorders.",GENENTECH INC,LAWREN WU;;MERCEDESZ BALAZS;;HANS BRIGHTBILL;;ANDREW CHAN;;YVONNE CHEN;;ANAN CHUNTHARAPAI;;MARK DENNIS;;TERENCE WONG,,https://lens.org/145-410-085-331-706,Patent Application,no,0,1,56,56,0,A01K67/0278;;A01K2217/072;;A01K2227/105;;A01K2267/0387;;A61K2039/505;;C07K2317/21;;C07K2317/24;;C07K2317/41;;C07K2317/73;;C07K16/4291;;A61P1/04;;A61P11/00;;A61P11/02;;A61P11/06;;A61P13/10;;A61P17/00;;A61P17/04;;A61P19/00;;A61P31/10;;A61P33/00;;A61P35/00;;A61P37/00;;A61P37/02;;A61P37/06;;A61P37/08;;A61P43/00;;C07K16/42;;A61K39/395;;A01K2267/0387;;C07K2317/41;;A01K67/0278;;A01K2217/072;;A01K2227/105;;C07K2317/21;;C07K2317/24;;A61K2039/505;;C07K2317/73;;C07K16/4291,C07K16/42;;A61P37/06,,0,0,,,,INACTIVE
294,AU,B2,AU 2008/228778 B2,158-866-731-522-230,2014-05-22,2014,AU 2008/228778 A,2008-03-21,US 89633907 P;;US 2008/0057819 W,2007-03-22,Apoptotic anti- IgE antibodies binding the membrane-bound IgE,"The present application relates to apoptotic anti-IgE antibodies, nucleic acid encoding the same, therapeutic compositions thereof, and their use in the treatment of IgE-mediated disorders.",GENENTECH INC,BALAZS MERCEDESZ;;CHUNTHARAPAI ANAN;;BRIGHTBILL HANS;;WONG TERENCE;;WU LAWREN;;CHAN ANDREW;;CHEN YVONNE;;DENNIS MARK,,https://lens.org/158-866-731-522-230,Granted Patent,no,0,0,56,56,0,A01K67/0278;;A01K2217/072;;A01K2227/105;;A01K2267/0387;;A61K2039/505;;C07K2317/21;;C07K2317/24;;C07K2317/41;;C07K2317/73;;C07K16/4291;;A61P1/04;;A61P11/00;;A61P11/02;;A61P11/06;;A61P13/10;;A61P17/00;;A61P17/04;;A61P19/00;;A61P31/10;;A61P33/00;;A61P35/00;;A61P37/00;;A61P37/02;;A61P37/06;;A61P37/08;;A61P43/00;;C07K16/42;;A61K39/395;;A01K2267/0387;;C07K2317/41;;A01K67/0278;;A01K2217/072;;A01K2227/105;;C07K2317/21;;C07K2317/24;;A61K2039/505;;C07K2317/73;;C07K16/4291,C07K16/42;;A61P37/06,,3,2,169-898-528-890-498;;098-430-732-762-189,16722326;;12218370;;10.1159/000063860,"Chen, H. et al. 2001 Faseb J. 15(5):A1018, Ab 778.1;;Chang, T. 2006 Allergy Asthma Proc. 27:S7-S14;;Chen, H. et al. 2002 Int. Arch. Allergy Immunol;128:315-324",INACTIVE
