"#",Jurisdiction,Kind,Display Key,Lens ID,Publication Date,Publication Year,Application Number,Application Date,Priority Numbers,Earliest Priority Date,Title,Abstract,Applicants,Inventors,Owners,URL,Document Type,Has Full Text,Cites Patent Count,Cited by Patent Count,Simple Family Size,Extended Family Size,Sequence Count,CPC Classifications,IPCR Classifications,US Classifications,NPL Citation Count,NPL Resolved Citation Count,NPL Resolved Lens ID(s),NPL Resolved External ID(s),NPL Citations,Legal Status
1,US,A1,US 2007/0169568 A1,004-000-091-079-792,2007-07-26,2007,US 48190406 A,2006-07-07,TW 95102365 A,2006-01-20,Digital torque display device for wrench and method for detecting the torque,"A wrench includes a handle and a head connected to an end of the handle. A driving member is received in a through hole in the head and a pawl is received in a first recess defined in an inner periphery of the through hole. The teeth of the pawl are engaged with the teeth of the driving member. At least one detection member is connected to the head so as to detect changes of voltage, resistance, deformation, current, phase differences, or displacement of the wrench. A display member is connected to an outside of the head and electrically connected with the at least one detection member. The user can check the digital value of the torque applied to the object. The method for detecting torque of a wrench includes steps of re-setting, operation, detection, deformation, transmitting digital signals, and displaying.",CHEN TERENCE,CHEN TERENCE,,https://lens.org/004-000-091-079-792,Patent Application,yes,0,0,3,3,0,B25B23/1425;;B25B23/1425;;B25B13/463;;B25B13/463,B25B23/14,73/862.21,0,0,,,,DISCONTINUED
2,US,A1,US 2004/0212989 A1,047-064-231-766-096,2004-10-28,2004,US 43641203 A,2003-05-13,TW 92109545 A,2003-04-22,Illuminative universal joint,"
   An illuminative universal joint includes a first element, a second element, a third element connected between the first element and the second element, an illuminative device, a switch and a head. The first element is for engagement with a handle. The second element defines a space. The third element includes an end pivotally connected with the first element and an opposite end pivotally connected with the second element. The illuminative device is installed in the space for emitting light. The switch is mounted on the second element for turning on and off the illuminative device. The head includes a first insert fit in the space, a second insert for insertion into a tool bit and a hole defined therein for passing light. 
",CHEN TERENCE,CHEN TERENCE,,https://lens.org/047-064-231-766-096,Patent Application,yes,5,3,4,4,0,B25B23/0014;;B25B23/18;;B60Q3/30;;F16D3/38;;B25B23/18;;B25B23/0014;;B60Q3/30,B25B23/00;;B25B23/18;;B60Q3/06,362/119;;362/109,0,0,,,,EXPIRED
3,US,A1,US 2005/0011315 A1,045-336-512-350-883,2005-01-20,2005,US 64820503 A,2003-08-27,TW 92119645 A,2003-07-18,Ratchet wrench,"A ratchet wrench includes a handle and an annular head from which the handle projects. The annular head defines a first space, a second space communicated with the first space and a third space communicated with the second space. An annular gear is rotationally put in the first space. The annular gear includes a toothed external face. A direction controller is put in the second space. The direction controller includes two pawls and a spring installed between the pawls. Each of the pawls includes a toothed face. The direction switch is rotationally mounted on the handle and partially put in the third space for bringing the toothed face of selective one of the pawls into engagement with the toothed external face of the annular gear.",CHEN TERENCE,CHEN TERENCE,,https://lens.org/045-336-512-350-883,Patent Application,yes,15,17,3,3,0,B25B13/463;;B25B13/463,B25B13/46,81/63.1,0,0,,,,EXPIRED
4,US,A1,US 2004/0216565 A1,086-866-778-762-565,2004-11-04,2004,US 85436804 A,2004-05-27,US 85436804 A;;TW 91218181 U;;US 30802102 A,2002-11-11,Pawl having at least two supporting protrusions for contacting inside of recess of ratchet wrench,"
   A pawl of a ratchet tool includes two protrusions extending from a rear side thereof so as to contact the curve inside of the recess fro receiving the pawl of the wrench. A spring is biased between an end of the pawl and the inside of the recess. The curve inside of the recess applies two forces at different angles along the curve inside to the two protrusions of the pawl so as to push the pawl to match its driving teeth with the engaging teeth of the engaging wheel in the wrench. The multiple contact points between the pawl and the curve inside of the recess share the force so as to reduce damage of the pawl and the inside of the recess due to the stress concentration. 
",CHEN TERENCE,CHEN TERENCE,,https://lens.org/086-866-778-762-565,Patent Application,yes,1,5,1,4,0,B25B13/463;;B25B13/463,B25B13/46,081 063200,0,0,,,,DISCONTINUED
5,US,A1,US 2004/0226413 A1,108-917-381-770-069,2004-11-18,2004,US 43778903 A,2003-05-14,US 43778903 A,2003-05-14,Joint for connecting wrench with socket,"
   A joint apparatus is provided for firmly connecting a head of a wrench with a socket. The joint apparatus includes a joint and a retainer. The joint includes a first portion for releasable engagement with the head of the wrench and a second portion for releasable engagement with a socket. The retainer is attached to the first portion of the joint for abutting the head of the wrench, thus avoiding the joint escaping the head of the wrench. 
",CHEN TERENCE,CHEN TERENCE,,https://lens.org/108-917-381-770-069,Patent Application,yes,3,4,2,2,0,B25B13/462;;B25B13/462;;B25B15/001;;B25B15/001;;B25B23/0035;;B25B23/0035,B25B13/46;;B25B15/00;;B25B23/00,081 6,0,0,,,,EXPIRED
6,US,B2,US 6920809 B2,125-636-650-040-298,2005-07-26,2005,US 76052504 A,2004-01-21,TW 92132386 A,2003-11-19,Selective one-way wrench,"A selective one-way wrench includes an annular head, a gear, a pawl, a transmission and a switch. The annular head defines a first space, a second space communicated with the first space and an aperture communicated with the second space. The gear is rotationally put in the first space. The gear includes a toothed face. The pawl is put in the second space. The pawl includes a toothed side for engagement with the toothed face of the gear. The transmission is rotationally put in the second space. The transmission includes three protrusions selective one of which is put between the rods of the pawl so that the transmission can move the pawl. The switch is put into the second space through the aperture for connection with the transmission.",CHEN TERENCE,CHEN TERENCE,,https://lens.org/125-636-650-040-298,Granted Patent,yes,1,0,4,4,0,B25B13/463;;B25B13/463,B25B13/46,81/63.2;;192/43.2,0,0,,,,EXPIRED
7,US,S,US D0493341 S,112-807-669-309-818,2004-07-27,2004,US 17644503 F,2003-02-21,US 17644503 F,2003-02-21,Ratchet wrench,,CHEN TERENCE,CHEN TERENCE,,https://lens.org/112-807-669-309-818,Design Right,no,0,8,1,1,0,,,D 8 25,0,0,,,,EXPIRED
8,US,A1,US 2007/0044600 A1,106-998-933-667-233,2007-03-01,2007,US 21263505 A,2005-08-29,US 21263505 A,2005-08-29,Wrench set having driving members with specific sizes,"A wrench includes a handle and two function heads on two ends of the handle. Two engaging holes are respectively defined in the two function heads so as to be engaged with two driving members. Each of the two driving members includes an engaging section for being engaged with the engaging hole and a polygonal driving portion which extends from the engaging section. The sizes of the two engaging sections can be 10 mm (⅜ inch) and 13 mm (½ inch), 10 mm (⅜ inch) and 19 mm (¾ inch), or 13 mm (½ inch) and 19 mm (¾ inch).",CHEN TERENCE,CHEN TERENCE,,https://lens.org/106-998-933-667-233,Patent Application,yes,22,9,1,1,0,B25B13/461;;B25B13/461;;B25B13/56;;B25B13/56,B25B13/58;;B25B13/00;;B25B23/16;;B25G1/00,81/185;;81/124.4;;81/177.85,0,0,,,,DISCONTINUED
9,CN,A,CN 101337343 A,125-332-098-202-878,2009-01-07,2009,CN 200710165443 A,2007-10-29,US 77248207 A,2007-07-02,Reversible wrench with fixing structure of direction switch button,"The present invention discloses a wrench which is provided with a birdirectional control button positioning structure. The wrench comprises a handle, a direction control device, a positioning device, and a connecting device. The handle is extended with a driving part that forms a driving hole. A driving piece is imbedded into the driving hole which is provided with an accommodating chamber at one side for accommodating more than one group of ratchet block. A restricting part and an accommodating part are provided adjacent to the accommodating chamber. The direction control device is provided with two reversing switches which are provided at the accommodating part and are restricted by the restricting part. The reversing switches drive the ratchet block and are respectively provided with a containing part and more than one group of positioning part. The positioning device is provided on the positioning part of the reversing switch. The connecting device comprises a connector and an elastic part. Two ends of the connector are respectively clamped on the containing part. The elastic part abuts against the connector and provides elastic force for resetting when the reversing switch is dialed to position the positioning device to the reversing switch. Therefore the purposes of fast clamping and positioning are achieved.",INFAR IND CO LTD,TERENCE CHEN,,https://lens.org/125-332-098-202-878,Patent Application,no,0,4,4,4,0,B25B13/463;;B25B13/463,B25B13/46;;B25B23/00,,0,0,,,,INACTIVE
10,US,B2,US 6857339 B2,124-880-673-282-570,2005-02-22,2005,US 42811403 A,2003-05-02,TW 92205935 U,2003-04-14,Wrench structure,"A wrench structure includes a drive head formed with a receiving chamber and having an end face formed with a direction control recess. The end face of the drive head is formed with a spacing portion. Thus, the spacing portion is continuously extended through the end face of the drive head and is not broken, so that the end face of the drive head is continuously extended through the drive head and is not broken, thereby preventing the stress from being concentrated on the portion between the receiving chamber and the direction control recess of the drive head, such that the structural strength of the drive head can be enhanced.",CHEN TERENCE,CHEN TERENCE,,https://lens.org/124-880-673-282-570,Granted Patent,yes,5,23,3,3,0,B25B13/463;;B25B13/463,B25B13/46,81/63.1;;81/58;;81/60;;192/43.1,0,0,,,,EXPIRED
11,US,A1,US 2004/0211299 A1,126-932-278-146-418,2004-10-28,2004,US 43779103 A,2003-05-14,TW 92109544 A,2003-04-22,Joint for connecting wrench with socket,"
   A toolkit includes at least one socket made according to the metric system, a first joint for connecting a head of a wrench with the at least one socket made according to the metric system, a first ring made of a first color and mounted on the first joint, at least one socket made according to the British system, a second joint for connecting the head of the wrench with the at least one socket made according to the British system and a second ring made of a second color other than the first color and mounted on the second joint. 
",CHEN TERENCE,CHEN TERENCE,,https://lens.org/126-932-278-146-418,Patent Application,yes,18,6,3,3,0,B25B13/463;;B25B15/001;;B25B13/463;;B25B15/001,B25B13/46;;B25B15/00,81/121.1,0,0,,,,DISCONTINUED
12,US,A1,US 2006/0118500 A1,135-956-361-125-733,2006-06-08,2006,US 3629005 A,2005-01-13,TW 93137578 A,2004-12-03,Tool-holding apparatus,"A tool-holding apparatus is provided for holding at least one tool. The tool-holding apparatus includes a board and at least two holders formed on the board. Each of the holders includes a stand extending from the board, a first pressing element extending from the stand and a second pressing element for cooperating with the first pressing element of the other holder in order to pinch the tool.",CHEN TERENCE,CHEN TERENCE,,https://lens.org/135-956-361-125-733,Patent Application,yes,17,23,3,3,0,A47F7/0028;;A47F7/0028;;B25H3/04;;B25H3/04,A47F7/00,211/70.6,0,0,,,,DISCONTINUED
13,US,A1,US 2005/0051446 A1,178-833-667-711-559,2005-03-10,2005,US 69130403 A,2003-10-22,TW 92124963 A,2003-09-10,Tool-holding apparatus,"A tool-holding apparatus is provided for holding at least one tool. The tool-holding apparatus includes a board and at least one holder formed on the board. The holder includes a root extending from the board, a tip extending from the root for pressing the tool, a restraint formed thereon near the tip for restraining the tool and a concave portion defined therein near the root for receiving the tool.",CHEN TERENCE,CHEN TERENCE,,https://lens.org/178-833-667-711-559,Patent Application,yes,1,13,4,4,0,B25H3/04;;B25H3/04,B25H3/04,206/376;;206/349,0,0,,,,EXPIRED
14,DE,A1,DE 10333286 A1,179-157-674-956-39X,2004-02-26,2004,DE 10333286 A,2003-07-22,US 20032002 A,2002-07-23,Werkzeugbox mit einer Ratschenwerkzeug-Prüfbasis,"Eine Werkzeugbox umfaßt eine Vielzahl von Haken und eine Vielzahl von Klemmelementen, die sich von einer Fläche der Werkzeugbox erstrecken. Die Haken und die Klemmelemente befinden sich miteinander ausgerichtet angeordnet, so daß Schäfte des Werkzeugs durch die Klemmelemente geklemmt sind und das Funktionsende sich in Eingriff mit den Haken befindet. Eine Prüfvorrichtung ist mit der Fläche des Werkzeugkastens verbunden und umfaßt ein schräg stehendes Halterungselement, mit dem ein Eingriffsstück verbunden ist, damit das Funktionsende des Schraubenschlüssels damit in Eingriff tritt. Ein Begrenzungsrahmen befindet sich auf der Prüfvorrichtung und begrenzt den Bereich des Schaftes des Werkzeugs für die Verschwenkung.",CHEN TERENCE,CHEN TERENCE,,https://lens.org/179-157-674-956-39X,Patent Application,no,0,0,4,4,0,B25H3/003;;B25H3/003,B25H3/00,,0,0,,,,EXPIRED
15,US,A1,US 2008/0163730 A1,050-355-773-484-649,2008-07-10,2008,US 64977007 A,2007-01-05,US 64977007 A,2007-01-05,Adapter engaging structure,"An adapter engaging structure has an elastic pressing member on the surface of an adapter contacting with a driving head of a wrenching tool, the elastic pressing member is positioned inside the holding portion of the pressing member. With the engaging portion of the pressing member projecting slightly above the surface of the adapter, when the adapter is inserted into a driving portion of a tool, the projective engaging portion is engaged with the inner wall of the driving portion by means of an elastic engaging strength. In addition, when the pressing member is inserted into the holding portion, via the elastic pressing strength of the fixing portion of the pressing member to position the pressing member and the magnetic piece therein inside the holding portion, and without damaging the magnetic piece. Then the objectives of high stability and the engagement of the pressing member are attained.",CHEN TERENCE,CHEN TERENCE,,https://lens.org/050-355-773-484-649,Patent Application,yes,8,2,1,1,0,B25B23/0035;;B25B23/0035,B25B23/00,81/438,0,0,,,,DISCONTINUED
16,US,B2,US 6691594 B2,081-462-474-269-533,2004-02-17,2004,US 18948702 A,2002-07-08,US 18948702 A,2002-07-08,Wrench structure,"
    A wrench structure includes a wrench handle, a drive body, two directional blocks, and a direction control member. The wrench handle has a drive head formed with a receiving chamber for mounting the drive body and a guide slot for mounting each of the two directional blocks. The drive head has an end face formed with a direction control recess and a spacing portion located between the receiving chamber and the direction control recess, for enhancing the structural strength of the wrench handle. The direction control recess is formed with a limit portion for limiting and guiding each of the two directional blocks, so that each of the two directional blocks may be moved to a determined position exactly, thereby changing the direction of operation of the wrench handle and the drive body actually. 
",CHEN TERENCE,CHEN TERENCE,,https://lens.org/081-462-474-269-533,Granted Patent,yes,3,28,2,2,0,B25B13/463;;B25B13/463,B25B13/46,81/61;;81/62,0,0,,,,EXPIRED
17,US,B2,US 6976582 B2,160-864-060-742-744,2005-12-20,2005,US 69130403 A,2003-10-22,TW 92124963 A,2003-09-10,Tool-holding apparatus,"A tool-holding apparatus is provided for holding at least one tool. The tool-holding apparatus includes a board and at least one holder formed on the board. The holder includes a root extending from the board, a tip extending from the root for pressing the tool, a restraint formed thereon near the tip for restraining the tool and a concave portion defined therein near the root for receiving the tool.",CHEN TERENCE,CHEN TERENCE,,https://lens.org/160-864-060-742-744,Granted Patent,yes,6,12,4,4,0,B25H3/04;;B25H3/04,B25H3/04,206/376;;206/480;;206/482;;211/70.6,0,0,,,,EXPIRED
18,EP,A3,EP 1413399 A3,030-651-056-043-497,2004-05-06,2004,EP 03019741 A,2003-08-29,US 25459202 A,2002-09-26,Ratchet wrench,"A one-way wrench includes an annular head, an annular gear, a pawl and an elastic element. The annular head includes a circular space defined therein and a crescent space defined in the wall of the circular space. The annular gear is put in the circular space. The annular gear includes teeth extending from an external face. The pawl is put in the crescent space. The pawl includes teeth extending from a side for engagement with the teeth of the annular gear and first and second protrusions both extending from an opposite side. The elastic element is compressed between the pawl and the wall of the crescent space. The wall of the crescent space pushes the first protrusion as the annular head drives the annular gear in a direction through the pawl. The wall of the crescent space pushes the second protrusion so as to pivot the pawl from the annular gear as the annular head rotates relative to the annular gear in an opposite direction.",CHEN TERENCE,CHEN TERENCE,,https://lens.org/030-651-056-043-497,Search Report,yes,9,0,3,3,0,B25B13/463,B25B13/46,,0,0,,,,EXPIRED
19,US,A1,US 2005/0068764 A1,042-425-878-127-809,2005-03-31,2005,US 70065403 A,2003-11-03,TW 92127127 A,2003-09-30,Luminescent connective apparatus for wrench,"A luminescent connective apparatus is provided for connecting a wrench with a socket. The luminescent connective apparatus includes a joint defining a tunnel, a lighting device installed in the tunnel and a switch assembly installed on the joint so that the switch assembly is operable in order to turn the lighting device on and off.",CHEN TERENCE,CHEN TERENCE,,https://lens.org/042-425-878-127-809,Patent Application,yes,2,6,2,2,0,B25B13/461;;B25B23/18;;B25B23/18;;B25B13/461,B25B13/46;;B25B23/18,362/119,0,0,,,,DISCONTINUED
20,US,A1,US 2004/0003684 A1,108-760-419-551-070,2004-01-08,2004,US 18948702 A,2002-07-08,US 18948702 A,2002-07-08,WRENCH STRUCTURE,"
   A wrench structure includes a wrench handle, a drive body, two directional blocks, and a direction control member. The wrench handle has a drive head formed with a receiving chamber for mounting the drive body and a guide slot for mounting each of the two directional blocks. The drive head has an end face formed with a direction control recess and a spacing portion located between the receiving chamber and the direction control recess, for enhancing the structural strength of the wrench handle. The direction control recess is formed with a limit portion for limiting and guiding each of the two directional blocks, so that each of the two directional blocks may be moved to a determined position exactly, thereby changing the direction of operation of the wrench handle and the drive body actually. 
",CHEN TERENCE,CHEN TERENCE,,https://lens.org/108-760-419-551-070,Patent Application,yes,3,7,2,2,0,B25B13/463;;B25B13/463,B25B13/46,81/62,0,0,,,,EXPIRED
21,US,A1,US 2004/0261586 A1,182-899-748-918-654,2004-12-30,2004,US 61752203 A,2003-07-11,TW 92117206 A,2003-06-25,Multi-joint wrench,"
   A wrench includes a head, a first handle, a second handle and a retaining device. The first includes first and second end. The first end of the first handle is pivotally connected with the head about a first axis. The second handle is pivotally connected with the second end of the first handle about a second axis. The retaining device can retain the first handle in position relative to the head, and the second handle in position relative to the first handle. 
",CHEN TERENCE,CHEN TERENCE,,https://lens.org/182-899-748-918-654,Patent Application,yes,5,12,3,6,0,B25G1/063;;B25G1/063;;B25B13/461;;B25B13/461,B25B13/46;;B25B23/00;;B25G1/06,81/177.7,0,0,,,,EXPIRED
22,EP,A1,EP 1537952 A1,178-926-637-985-607,2005-06-08,2005,EP 04024821 A,2004-10-19,US 72423103 A,2003-12-01,Selective one-way wrench,"A selective one-way wrench includes a handle (19), an annular head (11), a gear (40), a direction controller (20) and a direction switch (30). The handle projects from the annular head. The annular head defines a first space (12) and a second space (13) communicating with the first space. The gear is rotational in the first space. The gear includes a toothed external face (41). The direction controller is put in the second space, and includes two pawls (21;25) and a spring (22) installed between the pawls. Each of the pawls includes a toothed face (24;29). The direction switch includes a first element (31) installed rotationally on the handle and a second element (36) put in the second space and operably connected with the first element for bringing the toothed face of a selective one of the pawls into engagement with the toothed external face of the annular gear.",CHEN TERENCE,CHEN TERENCE,,https://lens.org/178-926-637-985-607,Patent Application,yes,10,3,5,5,0,B25B13/463;;B25B13/463,B25B13/46;;B25B23/00,,0,0,,,,DISCONTINUED
23,US,S,US D0502094 S,061-650-161-574-02X,2005-02-22,2005,US 18823503 F,2003-08-14,US 18823503 F,2003-08-14,Hanger for wrenches,,CHEN TERENCE,CHEN TERENCE,,https://lens.org/061-650-161-574-02X,Design Right,yes,4,0,1,1,0,,,D 9415;;D3/905,0,0,,,,EXPIRED
24,US,A1,US 2004/0200321 A1,063-853-873-207-474,2004-10-14,2004,US 42811403 A,2003-05-02,TW 92205935 U,2003-04-14,WRENCH STRUCTURE,"
   A wrench structure includes a drive head formed with a receiving chamber and having an end face formed with a direction control recess. The end face of the drive head is formed with a spacing portion. Thus, the spacing portion is continuously extended through the end face of the drive head and is not broken, so that the end face of the drive head is continuously extended through the drive head and is not broken, thereby preventing the stress from being concentrated on the portion between the receiving chamber and the direction control recess of the drive head, such that the structural strength of the drive head can be enhanced. 
",CHEN TERENCE,CHEN TERENCE,,https://lens.org/063-853-873-207-474,Patent Application,yes,5,9,3,3,0,B25B13/463;;B25B13/463,B25B13/46,81/63.1,0,0,,,,EXPIRED
25,US,A1,US 2005/0284268 A1,071-923-283-718-267,2005-12-29,2005,US 91956104 A,2004-08-16,TW 93118450 A,2004-06-25,Wrench combination,"A wrench combination includes a handle with an ear defining an aperture and an annular groove around the aperture. A wrench includes an annular head, an ear extending from the annular head and an annular gear put in the annular head. A washer is put in the annular groove defined in the ear of the handle. A washer is put in the annular groove defined in the ear of the wrench. Each washer includes two contact points on a side and three contact points on an opposite side. A joint includes a first pair of ears for sandwiching the ear of the handle and a second pair of ears for sandwiching the ear of the wrench. A first bolt is driven in the first pair of ears of the joint and the ear of the handle. A second bolt is driven in the second pair of ears of the joint and the ear of the wrench.",CHEN TERENCE,CHEN TERENCE,,https://lens.org/071-923-283-718-267,Patent Application,yes,3,4,4,4,0,B25G1/063;;Y10T403/32827;;Y10T403/32827;;B25G1/063,B25B13/00;;B25B13/28;;B25B23/00;;B25B23/16;;B25G1/06,81/177.8,0,0,,,,INACTIVE
26,EP,B1,EP 1426144 B1,065-647-348-702-499,2006-12-06,2006,EP 03020160 A,2003-09-05,US 30802102 A,2002-12-03,One-way wrench,,CHEN TERENCE,CHEN TERENCE,,https://lens.org/065-647-348-702-499,Granted Patent,yes,5,0,6,6,0,B25B13/463,B25B13/46,,0,0,,,,EXPIRED
27,US,A1,US 2005/0257651 A1,072-362-635-536-838,2005-11-24,2005,US 19052305 A,2005-07-28,US 19052305 A;;US 72423103 A,2003-12-01,Selective one-way wrench,A selective one-way wrench includes a head defining a first space and a second space communicated with the first space. A gear is put pivotally in the first space. The gear includes a toothed external face. A direction controller is put in the second space. The direction controller includes two toothed faces. A spring pushes the direction controller to the gear. A direction switch includes a first element put pivotally on the head and a second element put in the second space and connected to the first element for bringing selected one of the toothed faces of the direction controller into engagement with the toothed external face of the gear.,CHEN TERENCE,CHEN TERENCE,,https://lens.org/072-362-635-536-838,Patent Application,yes,10,5,5,5,0,B25B13/463;;B25B13/463,B25B13/46;;B25B23/00,81/63.2,0,0,,,,EXPIRED
