164,US,B1,US 6197568 B1,128-161-954-527-76X,2001-03-06,2001,US 12377098 A,1998-07-28,US 12377098 A;;US 5382897 P,1997-07-29,"Method and compositions for isolation, diagnosis and treatment of polyanion-binding microorganisms","Methods and compositions for the isolation, diagnosis and treatment of microorganisms such as flaviviruses and other hemorrhagic fever viruses are based on the sulfated polyanion-dependent interaction of flaviviruses and hemorrhagic fever viruses, in particular dengue virus, with target cells. The cellular receptors targeted by these viruses have been identified as sulfated polyanionic glycoproteins, that include highly sulfated heparan sulfate glycosaminoglycans for some target cell types, and as a sulfated mucin on vascular endothelium. Compounds such as heparin, highly sulfated heparan sulfate, and synthetic polyanions such as Suramin, inhibit the interaction between the microorganisms and target cells, thereby disrupting the infective process.",UNIV MICHIGAN;;UNIV IOWA RES FOUND;;NZ HEALTH RES COUNCIL,MARKS RORY M;;CHEN YAPING;;MAGUIRE TERENCE;;LINHARDT ROBERT J,HEALTH RESEARCH COUNCIL OF NEW ZEALAND THE (1998-09-01);;IOWA RESEARCH FOUNDATION UNIVERSITY OF IOWA THE (1998-09-01);;REGENTS OF THE UNIVERSITY OF MICHIGAN THE (1998-09-01),https://lens.org/128-161-954-527-76X,Granted Patent,yes,1,45,1,1,10,C12N7/00;;C12N15/85;;C12N2770/24151;;C12N2810/60;;C12Q1/70;;G01N33/56983;;Y10S435/803;;Y10S435/948;;C12N7/00;;C12N15/85;;G01N33/56983;;C12N2770/24151;;C12N2810/60;;C12Q1/70;;Y10S435/803;;Y10S435/948;;Y02A50/30,C12N7/02;;C12N15/85;;C12Q1/70;;G01N33/569,435/239;;435/5;;435/7.1;;435/7.8;;435/29;;435/803;;435/948;;424/185;;424/193.1;;424/196.11;;424/197.11;;424/279.1;;514/23;;514/54;;514/55;;514/56;;514/57;;514/58;;514/59;;514/60;;514/61;;514/62,67,60,061-892-509-836-548;;040-420-714-634-550;;021-777-533-262-295;;062-966-040-373-034;;004-731-819-988-980;;005-322-661-796-530;;040-306-894-903-842;;124-952-635-605-172;;066-003-063-804-099;;009-527-579-755-574;;004-371-318-570-301;;068-266-634-244-193;;025-710-148-809-396;;120-814-714-111-567;;092-094-354-625-794;;058-019-674-955-693;;043-365-903-444-326;;048-512-049-867-459;;143-196-961-601-693;;030-388-307-578-301;;056-651-814-284-542;;063-180-704-627-343;;002-567-810-947-301;;017-308-094-474-029;;077-814-202-592-451;;054-080-357-642-148;;010-397-301-772-380;;110-623-555-502-338;;024-090-726-528-641;;070-454-619-037-655;;069-710-985-338-938;;107-520-827-427-125;;072-662-301-626-82X;;040-716-905-898-666;;006-979-290-234-610;;003-219-255-309-540;;020-024-093-158-044;;119-055-829-995-921;;076-727-262-749-252;;048-220-826-936-638;;147-246-286-964-703;;105-832-760-109-930;;100-231-048-990-482;;029-100-930-310-461;;107-460-021-751-24X;;069-703-945-232-199;;058-901-249-518-781;;032-802-332-370-119;;011-173-411-986-201;;065-678-110-707-195;;027-209-493-268-133;;033-115-131-004-798;;107-298-529-358-681;;015-334-426-658-446;;069-045-505-632-584;;020-129-749-440-271;;083-054-074-637-085;;070-376-559-044-288;;114-866-485-851-269;;059-649-500-596-718,10.1099/0022-1317-73-8-2155;;1645154;;208980;;pmc421926;;10.1128/iai.20.3.776-781.1978;;10.1016/0092-8674(90)90694-a;;1694723;;3026396;;10.1016/s0006-291x(86)80253-4;;10.1016/s0021-9258(18)83150-7;;2524478;;10.1146/annurev.cellbio.8.1.365;;1335744;;10.1146/annurev.cb.08.110192.002053;;10.1016/s0022-2836(84)71582-8;;10.1006/jmbi.1994.1582;;7932691;;pmc414649;;10.1128/iai.26.2.534-541.1979;;121109;;2463827;;10.1161/01.atv.9.1.21;;1704661;;10.1016/0042-6822(91)90471-m;;8112591;;10.1016/0378-1119(94)90525-8;;pmc190973;;8971005;;10.1128/jvi.70.12.8765-8772.1996;;10.1038/nm0897-866;;9256277;;pmc332338;;10.1093/nar/18.19.5889;;2216784;;10.1128/iai.32.2.469-473.1981;;7251133;;pmc351468;;10.1016/0042-6822(91)90055-g;;1984665;;pmc346710;;10.1073/pnas.79.15.4540;;6812050;;10.1073/pnas.82.10.3197;;pmc397742;;3858816;;10.1016/s0021-9258(18)45335-5;;2957376;;10.1126/science.271.5252.1116;;8599088;;7487089;;10.1006/abbi.1995.9963;;1356919;;10.1038/icb.1992.14;;4198027;;10.1093/infdis/128.1.7;;3277268;;10.1126/science.3277268;;10.1126/science.239.4839.476;;2665015;;10.1093/clinids/11.supplement_4.s830;;1462664;;2564270;;10.1007/bf01313814;;7666046;;10.1002/jmv.1890450417;;10.1128/cmr.3.4.376;;2224837;;10.1128/cmr.3.4.376-396.1990;;pmc358169;;pmc248008;;2398538;;10.1128/jvi.64.10.5156-5159.1990;;10.1002/jmv.1890420304;;8006634;;pmc190485;;10.1128/jvi.70.8.5282-5287.1996;;8764038;;10.1007/978-1-4613-2825-4_1;;7908925;;10.1093/infdis/169.3.512;;8388021;;10.1099/0022-1317-74-5-931;;10.1007/bf01310705;;2178591;;pmc48638;;10.1073/pnas.89.6.2267;;1532254;;7518164;;10.1006/viro.1994.1410;;10.1016/0166-0934(94)90083-3;;7525622;;10.1074/jbc.271.30.17804;;8663266;;8291250;;10.1006/viro.1994.1081;;8898196;;10.1016/s0092-8674(00)81363-x;;10.1016/0092-8674(91)90192-2;;1655283;;8674685;;10.1042/bst0240274;;2428214;;10.1016/s0065-3527(08)60268-7;;2561233;;10.1016/0049-3848(89)90289-2;;10.1093/oxfordjournals.aje.a118408;;10.1038/375291a0;;7753193;;8975885;;10.1128/iai.65.1.1-8.1997;;pmc174549;;10.1126/science.2821619;;2821619;;808927;;10.1099/0022-1317-77-10-2541;;8887488;;7434071;;10.1016/s0021-9258(18)47059-7;;7929389;;7877230;;10.1016/s0741-5214(95)70290-3;;10.1128/iai.13.3.688-695.1976;;pmc420665;;57925;;10.1021/bi00179a006;;8142385;;8943254;;10.1074/jbc.271.50.32040;;pmc1218218;;10.1042/bj3220499;;9065769;;21877;;10.1016/s0021-9258(19)75264-8,"Anderson, R et al. ""Correlation of E protein binding with cell susceptibility to dengue 4 virus infection"" Journal of General Virology (1992), vol. 73, pp. 2155-2159.;;Andrews, BS et al. ""Replication of Dengue and Junin viruses in cultured rabbit and human endothelial cells"" Infection and Immunity (Jun. 1978), vol. 20, No. 3, pp. 776-781.;;Aruffo, A et al. ""CD44 is the principal cell surface receptor for hyaluronate"" Cell (Jun. 29, 1990) vol. 61, pp. 1303-1313.;;Baeuerle PA and WB Huttner ""Chlorate-A Potent Inhibitor of Protein Sulfaction in Intact Cells"" Biochemical and Biophysical Research Communications (Dec. 15, 1986) vol. 141, No. 2.;;Bame, KJ and JD Esko ""Undersulfated Heparan Sulfate in a Chinese Hamster Ovary Cell Mutant Defective in Heparan Sulfate N-Sulfotransferase"" The Journal of Biological Chemistry (May 15, 1989) vol. 264, No. 14.;;Bernfield, M et al. ""Biology of the Syndecans: A family of transmembrane heparan sulfate proteoglycans"" Annual Review of Cell Biology (1992) vol. 8, pp. 365-393.;;Bork, P et al. ""The Immunoglobulin Fold: Structural Classification, Sequence Patterns and Common Core"" J. Mol. Biol. (1994) vol. 242, pp. 309-320.;;Brandt, WE et al. ""Effect of passage history on Dengue-2 Virus Replication in Subpopulations of Human Leukocytes"" Infection and Immunity (Nov. 1979) vol. 26, pp. 534-541.;;Cardin, AD and HJR Weintraub ""Molecular Modeling of Protein-Glycosaminoglycan Interactions"" Arteriosclerosis (Jan./Feb. 1989) vol. 9. No. 1, pp. 21-32.;;Cecilia, D and EA Gould ""Nucleotide Changes Responsible for Loss of Neuroinvasiveness in Japanese Encephalitis Virus Neutralization-Resistant Mutants"" Virology (1991), vol. 181, pp. 70-77.;;Chen, BPC and T Hai ""Expression vectors for affinity purification and radiolabeling of proteins using Eschdrichia coli as host"" Gene (1994) vol. 130, pp. 73-75.;;Chen, et al. ""Demonstration of Binding of Dengue Virus Envelope Protein to Target Cells"" Supplement to the American Journal of Tropical Medicine and Hygiene (1994) vol. 55, No. 2 pp. 269-270, abstract 517.;;Chen, Y et al. ""Demonstration of Binding of Dengue Virus Envelope Protein to Target Cells"" (Dec. 1996) Journal of Virology. vol. 70, No. 12, pp. 8765-8772.;;Chen, Y et al. ""Dengue virus infectivity depends on envelope protein binding to target cell heparan sulfate"" (Aug. 1997) Nature Medicine, vol. 3, No. 8, pp. 866-871.;;Chen, W and T Maguire ""Nucleotide sequence of the envelope glycoprotein gene of a dengue-2 virus isolated during an epidemic of benign dengue fever in Tonga in 1974"" Nucleic Acids Research (1990) vol. 18, No. 19, p. 5889.;;Daughaday, CC et al. ""Evidence for two mechanisms of dengue virus infection of adherent human monocytes; Trypsin-sensitive virus receptors and trypsin-resistant immune complex receptors"" Infection and Immunity (May 1981) vol. 32, No. 2, pp. 469-473.;;Davis, BD et al. ""The Nature of Viruses: Assay of Viruses"" Principles of Microbiology and Immunology (1967) pp. 664-671.;;Deubel, V., et al. ""Processing, secretion, and immunoreactivity of carboxy terminally truncated dengue-2 virus envelope proteins expressed in insect cells by recombinant baculoviruses"" Virology (1991) 180:442-447.;;Elder, J. H. et al. ""Endo-beta-N-acetylglucosaminidase F: Endoglycosidase from Flavobacterium. meningosepticum that cleaves both high-mannose and complex glycoproteins."" Proc. Natl. Acad. Sci. (USA) (1982) 79:4540-4544.;;Esko, J. D. et al. ""Animal cell mutants defective in glycosaminoglycan biosynthesis"" Proc. Nati. Acad. Sci. (USA) (1985) 82:3197-3201.;;Esko, J. D. et al. ""Inhibition of chondroitin and heparan sulfate biosynthesis in Chinese hamster ovary cell mutants defective in galactosyltransferase"" 1. J. Biol. Chem. (1985) 262:12189-95.;;Faham, S. et al. ""Heparin structure and interactions with basic fibroblast growth factor"" Science (1996) 271:1116-20.;;Fromm, J. R. et al. ""Differences in the interaction of heparin with arginine and lysine and the importance of these basic amino acids in the binding of heparin to acidic fibroblast growth factor"" Arch Biochem Biophys. (1995) 323:279-87.;;Grattage, L. P. et al. ""Effects of PMA, cytokines and dexamethasone on the expression of cell surface Fc receptors and mRNA in U937 cells"" Immunology and Cell Biology (1992) 70:97-105.;;Halstead, S. B. et al. ""Studies on the pathogenesis of dengue infection in monkeys. 1. Clinical laboratory responses to primary infection"" J. Infect. Dis. (1973) 128:7-14.;;Halstead, S. B. ""Pathogenesis of dengue: Challenges to molecular biology"" Science (1988) 239:476-486.;;Halstead, S. B. ""Antibody, macrophages, dengue virus infection, shock, and hemorrhage: a pathogenetic cascade"" Rev. Infect. Dis. (1989) 11:S830-S839.;;Halstead, S. B. ""The XXth century dengue pandemic: need for surveillance and research"" World Health Stat Q. (1992) 45:292-298.;;Hase, T. et al. ""Flavivirus entry into cultured mosquito cells and human peripheral blood monocytes"" Arch. Virol. (1989) 104:129-143.;;He, R.-T. et al. ""Antibodies that block virus attachment to Vero cells are a major component of the human neutralizing antibody response against dengue virus type 2"" J. Med. Virol. (1995) 45:451-461.;;Henchal, E. A., and J. R. Putnak ""The dengue viruses"" Clinical Microbiology Reviews (1990) 3:376-396.;;Holzmann, H. et al. ""A single amino acid substitution in envelope protein E of tick-borne encephalitis virus leads to attenuation in the mouse model"" J. Virology (1990) 64:5156-5159.;;Imbert, J. L. et al. ""Dengue virus infects mouse cultured neurons but not astrocytes"" J. Med. Virol. (1994) 42:228-33.;;Jackson, T. et al. ""Efficient Infection of Cells in Culture by Type O Foot-and-Mouth Disease Virus Requires Binding to Cell Surface Heparan Sulfate"" J. Virology (1996) 70:5282-5287.;;Jaffe, E. A. ""Culture and identification of large vessel endothelial cells."" In E. A. Jaffe ed, Biology of endothelial cells Martinus Nihoff, The Hague (1984).;;Jennings, A.D. et al. ""Analysis of a yello fever virus isolated from a fatal case of vaccine-associated human encephalitis"" J. Infect. Dis. (1994) 169:512-8.;;Jiang, W. R. et al. ""Single amino acid codon changes detected in louping ill virus antibody-resistant mutants with reduced neurovirulence"" J. Gen. Virology (1993) 74:931-935.;;Kurane, I. et al. ""Dengue-2 virus infection of human mononuclear cell lines and establishment of persistent infections"" Arch Virol. 110:91-101.;;Lidholt, K. et al. ""A single mutation affects both N-acetylglucosaminyltransferase and glucuronosyltransferase activities in a Chinese hamster ovary cell mutant defective in heparan sulfate biosynthesis"" Proc. Natl. Acad. Sci. (USA) (1992) 89:2267-2271.;;Lin, B. et al. ""Localization of a neutrlization epitope on the envelope protein of dengue virust type2"" Virology (1994) 202:885-890.;;Linhardt, R J. ""Analysis of glycogonjugates, pp. 17.13.17-17.13.32. In A. Varki (ed.), Current Protocols in Molecular Biology"" Wiley Interscience, Boston (1994).;;Linhardt, R. J. et al. ""Heparin oligosaccharides-new analogs development and application"" In Z.B. Witczak and K. A. Nieforth (ed.), Carbohydrates as Drugs. Marcel Dekker, New York (1997).;;Lucia, H. L. et al. ""Identification of dengue virus-infected cells in parrafin-embedded tissue using in situ polymerase chain reaction and DNA hybridization"" J. Virol. Methods (1994) 48:1-8.;;Maccarana, M. et al. ""Domain structure of heparan sulfates from bovine organs"" J. Biol. Chem. (196) 271:17804-17810.;;McClain, D.S. et al. ""Cell-specific kinetics and efficiency of herpes simplex virus type 1 entry are determined by two distinct phases of attachment"" Virology (1994) 198:690-702.;;Montgomery, R. I. et al. ""Herpes simplex virus-1 entry into cells mediated by a novel member of the TNF/NGF receptor family"" Cell (1996) 87:427-436.;;Ortega-Barria, E. et al. ""A novel T. cruzi heparin-binding protein promotes fibroblast adhesion and penetration of engineered bacteria and trypanosomes into mammalian cells"" Cell (1991) 67:411-21.;;Peitsch, M. C. ""ProMod and Swiss-Model: Internet-based tools for automated comparative protein modelling"" Biochem Soc. Trans. (1996) 24:274-279.;;Porterfield, J.S. ""Antibody-dependent enhancement of viral infectivity"" Adv. Virus Research (1986) 31:335-355.;;Raake, W. et al. ""Anticoagulant and antithrombotic properties of synthetic sulfated bis-lactobionic acid amides"" Thromb Res. (1989) 56:719-30.;;Reed, L. J. et al. ""A simple method of estimating fifty per cent end points"" Amer. J. Hygiene (1938) 27:493-497.;;Rey, F. A. et al. ""The envelope glycoprotein from tick-borne encephalitis virus at 2 A resolution"" Nature (1995) 375:291-8.;;Rice, C. M. ""Flaviviridae: the viruses and their replication"", pp. 931-959. In B. N. Fields and D. M. Knipe A-17y and P. M. Howley (ed.), Fields Virology 3rd edition, vol. 1 Lippincott-Raven, Philadelphia (1996).;;Rostand, K. S. et al. ""Microbial adherence and invasion through proteoglycans"" Infect. Immun. (1997) 65:1-8.;;Ruoslahti, E. et al. ""New perspectives in cell adhesion: RGD and integrins"" Science (1987) 238:491-497.;;Salzman, G. C. et al. ""Cell classification by laser light scattering: identification and separation of unstained leukocytes"" Acta. Cytol. (1975) 19: 374-377.;;Sanchez, I. J. et al. ""A single nucleotide change in the E protein of dengue virus 2 mexican strain affects neurovirulence in mice"" J. General Virology (1996) 77:2541-2545.;;Sahaphong, S. et al. ""Electron microscopic study of the vascular endothelial cell in dengue hemorrhagic fever"" Southeast. Asian. J. Trop. Med. Pub. Health (1980) 11:194-204.;;Shao, H. et al. ""cDNA cloning and characterization of a ligand for the Cek5 receptor protein-tyrosine kinase"" J. Biol. Chem. (1994) 269:26606-26609.;;Sternbergh, W. C. et al. ""Heparinoids with low anticoagulant potency attenuate postischernic endothelial cell dysfunction"" J Vasc Surg. (1995) 21:477-83.;;Tarr, G. C. et al. ""Chemically induced temperature-sensitive mutants of dengue virus type 2: comparison of temperature sensitivity in vitro with infectivity in suckling mice, hamsters, and rhesus monkeys"" Infect. Immun. (1976) 13:688-695.;;Thompson, L. D. et al. ""Energetic characterization of the basic fibroblast growth factor-heparin interaction: identification of the heparin binding domain"" Biochemistry (1994) 33:3831-3840.;;Toida, T. et al. ""Enzymatic preparation of heparin oligosaccharides containing antithrombin III binding sites"" J. Biol. Chem. (1996) 271:32040-32047.;;Toida, T. et al. ""Structural differences in heparan sulfates from different tissues and species"" Biochemical Journal (1997) 322:499-506.;;Tyler, K. L. et al. ""Pathogenesis of viral infections"", pp. 173-217. In B. N. Fields and D. M. Knipe and P. M. Howley (ed.), Fields Virology 3rd edition, vol. 1. Lippincott-Raven, Philadelphia (1996).;;Umemoto, J. et al. ""Purification and properties of an endo-alpha-N-acetyl-D-galactosaminidase from Diplococcus pneurnoniae"" J. Biol. Chem. (1977) 252:8609-8614.;;Wimmer, E. ""Introduction, pp. 1-13. In E. Winimer (ed.),""Cellular receptors for animal viruses vol. 1. Cold Spring Harbor Laboratory Press, New York (1994).",EXPIRED
165,JP,A,JP 2002310138 A,162-767-614-591-289,2002-10-23,2002,JP 2001401433 A,2001-12-28,US 82741001 A,2001-04-06,ROLLER STRUCTURE FOR OPERATION IN HIGH TEMPERATURE CONDITION,PROBLEM TO BE SOLVED: To provide a roller structure capable of maintaining a connection even in a high temperature condition. SOLUTION: This roller 10 to be used for a fusion assembly of a copying device appropriate for the operation in the high temperature condition is provided with a cylindrical tube 12 and end gudgeons 14 for sealing both ends of the cylindrical tube. Each end gudgeon is provided at each corresponding end of the cylindrical tube to prevent the movement of the cylindrical tube in the direction for separating from the end gudgeon with the creep deformation of the material when operating in the high temperature condition after connecting the cylindrical tube and the end gudgeon by welding. The end gudgeon is formed with a recessed dovetail shape 20 for installation in the corresponding end of the cylindrical tube.,NEXPRESS SOLUTIONS LLC,KASS ALLEN;;MILLER TERENCE MICHAEL;;BLEIL RAINER;;CHEN JIANN-HSING,,https://lens.org/162-767-614-591-289,Patent Application,no,0,0,6,6,0,F16C13/00;;G03G15/2053;;G03G15/2053;;F16C13/00,F16C13/00;;G03G15/20,,0,0,,,,DISCONTINUED
166,US,A1,US 2020/0144416 A1,191-089-168-568-151,2020-05-07,2020,US 201816183214 A,2018-11-07,US 201816183214 A,2018-11-07,VERTICAL FIELD-EFFECT TRANSISTOR WITH A BOTTOM CONTACT THAT EXHIBITS LOW ELECTRICAL RESISTANCE,"Techniques regarding one or more VFETs operably coupled to bottom contacts with low electrical resistance are provided. For example, one or more embodiments described herein can comprise an apparatus, which can comprise a vertical field-effect transistor device that can comprise a semiconductor fin positioned on a source/drain region, which can comprise a semiconductor substrate. The apparatus can also comprise a metal contact layer positioned on the source/drain region and at least partially surrounding a base of the semiconductor fin. Further, the metal contact layer can be in electrical communication with the source/drain region.",IBM,ZHANG CHEN;;YAMASHITA TENKO;;HOOK TERENCE B;;ANDERSON BRENT ALAN,INTERNATIONAL BUSINESS MACHINES CORPORATION (2018-11-01),https://lens.org/191-089-168-568-151,Patent Application,yes,2,1,2,2,0,H01L29/66666;;H01L29/7827;;H01L27/088;;H01L29/0847;;H01L29/41741;;H01L29/41741;;H01L29/66666;;H01L29/7827,H01L29/78;;H01L27/088;;H01L29/08;;H01L29/417;;H01L29/66,,0,0,,,,ACTIVE
167,PT,E,PT 880523 E,192-405-619-465-716,2007-01-31,2007,PT 97902295 T,1997-01-30,US 1127996 P;;US 2768896 P,1996-02-07,PYRAZOLOPYRIMIDINES AS CRF RECEPTOR ANTAGONISTS,,NEUROCRINE BIOSCIENCES INC,CHEN-CHEN;;WEBB THOMAS R;;MCCARTHY JAMES;;MORAN TERENCE J;;WILCOXEN KEITH M,,https://lens.org/192-405-619-465-716,Granted Patent,no,0,0,43,52,0,C07D487/04;;C07D471/10;;A61P1/00;;A61P1/04;;A61P1/12;;A61P1/14;;A61P11/00;;A61P11/06;;A61P11/14;;A61P13/12;;A61P19/02;;A61P25/00;;A61P25/08;;A61P25/18;;A61P25/22;;A61P25/24;;A61P25/30;;A61P25/32;;A61P29/00;;A61P3/00;;A61P3/04;;A61P37/00;;A61P37/02;;A61P37/06;;A61P37/08;;A61P43/00;;A61P5/00;;A61P9/00;;A61P9/12;;C07D487/04;;A61K31/495,C07D487/04;;A61K31/00;;A61K31/435;;A61K31/439;;A61K31/485;;A61K31/495;;A61K31/496;;A61K31/505;;A61K31/519;;A61K31/529;;A61K31/535;;A61K31/5375;;A61K31/5377;;A61K31/55;;A61P1/00;;A61P1/04;;A61P1/12;;A61P1/14;;A61P3/00;;A61P3/04;;A61P9/00;;A61P9/12;;A61P11/00;;A61P11/06;;A61P11/14;;A61P13/12;;A61P19/02;;A61P25/08;;A61P25/18;;A61P25/22;;A61P25/24;;A61P25/30;;A61P25/32;;A61P29/00;;A61P37/00;;A61P37/02;;A61P37/06;;A61P37/08;;A61P43/00;;C07D471/08;;C07D471/10;;C07D489/09;;C07D491/18;;C07D491/20;;C07D495/22,,0,0,,,,EXPIRED
168,US,A1,US 2016/0225919 A1,135-255-342-053-736,2016-08-04,2016,US 201514612639 A,2015-02-03,US 201514612639 A,2015-02-03,DEVICE STRUCTURE WITH NEGATIVE RESISTANCE CHARACTERISTICS,Device structures that exhibit negative resistance characteristics and fabrication methods for such device structures. A signal is applied to a metal layer of a metal-insulator-semiconductor capacitor to cause a breakdown of an insulator layer of the metal-insulator-semiconductor capacitor at a location. The breakdown at the location of the insulator layer causes the metal-insulator-semiconductor capacitor to exhibit negative resistance. The metal layer may be comprised of a polycrystalline metal. A grain of the polycrystalline metal may penetrate through the insulator layer and into a portion of a substrate at the location of the breakdown.,GLOBALFOUNDRIES INC,CHEN FEN;;GRAAS CAROLE D;;KANE TERENCE L;;SHINOSKY MICHAEL A,INTERNATIONAL BUSINESS MACHINES CORPORATION (2015-01-27);;GLOBALFOUNDRIES U.S. 2 LLC (2015-06-29);;GLOBALFOUNDRIES INC (2015-09-10),https://lens.org/135-255-342-053-736,Patent Application,yes,6,2,5,5,0,H01L29/94;;H01L29/945;;H10N80/01;;H01L29/945;;H01L29/495;;H01L29/518;;H10N80/01,H01L29/94;;H01L29/32,,0,0,,,,DISCONTINUED
169,CN,A,CN 105845744 A,023-545-993-891-033,2016-08-10,2016,CN 201610069313 A,2016-02-01,US 201514612639 A,2015-02-03,Device structure with negative resistance characteristics,The invention provides device structures that exhibit negative resistance characteristics and fabrication methods for such device structures. A signal is applied to a metal layer of a metal-insulator-semiconductor capacitor to cause a breakdown of an insulator layer of the metal-insulator-semiconductor capacitor at a location. The breakdown at the location of the insulator layer causes the metal-insulator-semiconductor capacitor to exhibit negative resistance. The metal layer may be comprised of a polycrystalline metal. A grain of the polycrystalline metal may penetrate through the insulator layer and into a portion of a substrate at the location of the breakdown.,GLOBALFOUNDRIES INC,SHINOSKY MICHAEL A;;CHEN FEN;;KANE TERENCE L;;GRAAS CAROLE D,,https://lens.org/023-545-993-891-033,Patent Application,no,4,0,5,5,0,H01L29/94;;H01L29/945;;H10N80/01;;H01L29/945;;H01L29/495;;H01L29/518;;H10N80/01,H01L29/94,,0,0,,,,INACTIVE
170,TW,B,TW I633661 B,181-575-617-668-66X,2018-08-21,2018,TW 105101219 A,2016-01-15,US 201514612639 A,2015-02-03,Device structure with negative resistance characteristics,,GLOBALFOUNDRIES US INC,CHEN FEN;;GRAAS CAROLE D;;KANE TERENCE L;;SHINOSKY MICHAEL A,,https://lens.org/181-575-617-668-66X,Granted Patent,no,1,0,5,5,0,H01L29/94;;H01L29/945;;H10N80/01;;H01L29/945;;H01L29/495;;H01L29/518;;H10N80/01,,,0,0,,,,INACTIVE
171,WO,A1,WO 1997/047144 A1,024-907-154-138-712,1997-12-11,1997,US 9708706 W,1997-05-21,US 65681896 A,1996-06-03,METHOD AND APPARATUS FOR REGISTRATION STATUS INDICATION IN A ROAMING SYSTEM,A method for receiving a registration status indication at a one-way roaming selective call receiver comprises the steps of scanning (1051) a predetermined set of frequencies for an identifier(s) (1052 or 1056) broadcast on the frequencies that match identifier(s) stored at the receiver. The method provides an indication of being registered in a 'home' zone (1054) if an identifier transmitted on the communication resource matches a 'home' zone identifier stored in the receiver or provides for an indication of being registered in a 'roaming' zone (1058) if an identifier transmitted on the frequencies matches a 'roaming' zone identifier stored in the receiver or provides for an indication of not being registered (1055 or 1059) when the identifier transmitted on the frequencies do(es) not match either the 'home' zone identifier or the 'roaming' zone identifier stored in the receiver.,MOTOROLA INC,SUMNER TERENCE EDWARD;;BRIANCON ALAIN C;;CHEN XUMING;;HERTZ ALLEN D,,https://lens.org/024-907-154-138-712,Patent Application,yes,4,6,3,3,0,G08B3/1066;;H04W88/026,G08B3/10;;H04W88/02,,1,0,,,"ADVISOR MESSAGE RECEIVER ADVERTISEMENT, 1990.",PENDING
